sample ID;locality;country;Collection date;eventDate;Number and gender;individualCount;Family;Genus;species;scientific name;Z;decimalLatitude;decimalLongitude;Troglomorphy;habitat;joint coordinates;unique species count;air temperature ;deepest air temperature;média temperature;;;;;;;;;;;;;;;;;;;
1;Špilja na Pozalicu;Croatia;29.9.2007.;2007-09-29;1 m, 1 f;2;Nesticidae;Kryptonesticus;eremita;;60;42.76131;16.9129;tf;deep cave;;4;;12,65;14;;;;;;;;;;;;;;;;;;;
2;Špilja na Pozalicu;Croatia;4.3.2008.;2008-03-04;1 m, 1 f;2;Nesticidae;Kryptonesticus;eremita;Kryptonesticus eremita;60;42.76131;16.9129;tf;deep cave;42.7613116.9129;4;;12,65;14;;;;;;;;;;;;;;;;;;;
3;oko kampa u Skrivenoj Luci;Croatia;4.3.2008.;2008-03-04;1 f;1;Dysderidae;Dysdera;sp.;Dysdera sp.;;42.741872;16.88264;Tx;;42.74187216.88264;1;;;;;;;;;;;;;;;;;;;;;;
4;Jama pod Velji vrh;Croatia;30.9.2007.;2007-09-30;3 juv;3;Dysderidae;Folkia;sp. 2;Folkia sp. 2;70;42.766635;16.907278;Tb;deep cave;42.76663516.907278;2;;16,1;17,425;;;;;;;;;;;;;;;;;;;
5;Medvidina špilja;Croatia;3.3.2008.;2008-03-03;2f, 4 juv;6;Nesticidae;Kryptonesticus;eremita;Kryptonesticus eremita;;42.734776;16.863532;tf;deep cave;42.73477616.863532;1;;;;;;;;;;;;;;;;;;;;;;
7;Špilja na Pozalicu;Croatia;29.9.2007.;2007-09-29;1 juv;1;Cheiracanthiidae;Gen.;sp.;Gen. sp.;60;42.76131;16.9129;;;42.7613116.9129;4;;12,65;14;;;;;;;;;;;;;;;;;;;
8;Špilja na Pozalicu;Croatia;3.3.2008.;2008-03-03;6 juv;6;Nesticidae;Kryptonesticus;eremita;Kryptonesticus eremita;60;42.76131;16.9129;tf;deep cave;42.7613116.9129;4;;12,65;14;;;;;;;;;;;;;;;;;;;
9;Ra?a špilja;Croatia;28.9.2007.;2007-09-28;1 juv;1;Dysderidae;Folkia;sp. 2;Folkia sp. 2;141;42.734493;16.910785;Tb;deep cave;42.73449316.910785;4;;16,5;14,42;;;;;;;;;;;;;;;;;;;
10;Jama pod Velji vrh;Croatia;30.9.2007.;2007-09-30;1 juv;1;Dysderidae;Folkia;sp. 2;Folkia sp. 2;;42.766635;16.907278;Tb;deep cave;42.76663516.907278;2;;16,1;17,425;;;;;;;;;;;;;;;;;;;
11;Hrastovska špilja;Croatia;2.10.2007.;2007-10-02;5 juv;5;Nesticidae;Kryptonesticus;eremita;Kryptonesticus eremita;120;42.756282;16.875635;tf;deep cave;42.75628216.875635;4;11,2;;;;;;;;;;;;;;;;;;;;;
12;Ra?a špilja;Croatia;28.9.2007.;2007-09-28;1 f;1;Dysderidae;Folkia;sp. 2;Folkia sp. 2;141;42.734493;16.910785;Tb;deep cave;42.73449316.910785;4;;16,5;14,42;;;;;;;;;;;;;;;;;;;
13;Jama pod Velji vrh;Croatia;30.9.2007.;2007-09-30;1 juv;1;Dysderidae;Folkia;sp. 2;Folkia sp. 2;;42.766635;16.907278;Tb;deep cave;42.76663516.907278;2;;16,1;17,425;;;;;;;;;;;;;;;;;;;
14;Špilja na Pozalicu;Croatia;4.3.2008.;2008-03-04;1 f;1;Leptonetidae;Barusia;sp. 1;Barusia sp. 1;60;42.76131;16.9129;tb;deep cave;42.7613116.9129;4;;12,65;14;;;;;;;;;;;;;;;;;;;
16;Polušpilja na Mr?ari;Croatia;1.10.2007.;2007-10-01;1f, 2 juv;3;Agelenidae;Tegenaria;domestica;Tegenaria domestica;;42.768583;16.788965;Tf;cave entrance;42.76858316.788965;2;19,4;;;;;;;;;;;;;;;;;;;;;
18;Špilja na Pozalicu;Croatia;29.9.2007.;2007-09-29;1 f, 1 juv;2;Nesticidae;Kryptonesticus;eremita;Kryptonesticus eremita;60;42.76131;16.9129;tf;deep cave;42.7613116.9129;4;;12,65;14;;;;;;;;;;;;;;;;;;;
19;Špilja na Pozalicu;Croatia;3.3.2008.;2008-03-03;1 juv;1;Nesticidae;Kryptonesticus;eremita;Kryptonesticus eremita;60;42.76131;16.9129;tf;deep cave;42.7613116.9129;4;;12,65;14;;;;;;;;;;;;;;;;;;;
20;Jama pod Velji vrh;Croatia;30.9.2007.;2007-09-30;1 f, 1 juv;2;Nesticidae;Kryptonesticus;eremita;Kryptonesticus eremita;;42.766635;16.907278;tf;deep cave;42.76663516.907278;2;;16,1;17,425;;;;;;;;;;;;;;;;;;;
21;Špilja na Pozalicu;Croatia;29.9.2007.;2007-09-29;2 juv;2;Nesticidae;Kryptonesticus;eremita;Kryptonesticus eremita;60;42.76131;16.9129;tf;deep cave;42.7613116.9129;4;;12,65;14;;;;;;;;;;;;;;;;;;;
22;Jama pod Velji vrh (ispred);Croatia;2.3.2008.;2008-03-02;1 juv;1;Dysderidae;Folkia;sp. 2;Folkia sp. 2;;42.766635;16.907278;Tb;shallow subterranean habitat;42.76663516.907278;2;;16,1;17,425;;;;;;;;;;;;;;;;;;;
23;Hrastovska špilja;Croatia;3.3.2008.;2008-03-03;2 juv;2;Nesticidae;Kryptonesticus;eremita;Kryptonesticus eremita;120;42.756282;16.875635;tf;deep cave;42.75628216.875635;4;11,2;;;;;;;;;;;;;;;;;;;;;
25;Ra?a špilja;Croatia;28.9.2007.;2007-09-28;1f;1;Dysderidae;Folkia;sp. 2;Folkia sp. 2;141;42.734493;16.910785;Tb;deep cave;42.73449316.910785;4;;16,5;14,42;;;;;;;;;;;;;;;;;;;
26;Špilja pod Kaštel;Croatia;4.3.2008.;2008-03-04;1 m;1;Leptonetidae;Barusia;sp. 1;Barusia sp. 1;;42.768041;16.899005;tb;deep cave;42.76804116.899005;2;;15,3;17,5;;;;;;;;;;;;;;;;;;;
29;Hrastovska špilja;Croatia;4.3.2008.;2008-03-04;6 juv;6;Nesticidae;Kryptonesticus;eremita;Kryptonesticus eremita;120;42.756282;16.875635;tf;deep cave;42.75628216.875635;4;11,2;;;;;;;;;;;;;;;;;;;;;
30;Ra?a špilja;Croatia;28.9.2007.;2007-09-28;1 juv;1;Dysderidae;Folkia;sp. 2;Folkia sp. 2;141;42.734493;16.910785;Tb;deep cave;42.73449316.910785;4;;16,5;14,42;;;;;;;;;;;;;;;;;;;
31;Hrastovska špilja;Croatia;2.10.2007.;2007-10-02;5 juv;5;Nesticidae;Kryptonesticus;eremita;Kryptonesticus eremita;120;42.756282;16.875635;tf;deep cave;42.75628216.875635;4;11,2;;;;;;;;;;;;;;;;;;;;;
32;Hrastovska špilja;Croatia;3.3.2008.;2008-03-03;1 f, 1 juv m;2;Nesticidae;Kryptonesticus;eremita;Kryptonesticus eremita;120;42.756282;16.875635;tf;deep cave;42.75628216.875635;4;11,2;;;;;;;;;;;;;;;;;;;;;
33;Jama pod Velji vrh;Croatia;30.9.2007.;2007-09-30;3 juv;3;Dysderidae;Folkia;sp. 2;Folkia sp. 2;;42.766635;16.907278;Tb;deep cave;42.76663516.907278;2;;16,1;17,425;;;;;;;;;;;;;;;;;;;
34;Ra?a špilja;Croatia;28.9.2007.;2007-09-28;1 juv;1;Dysderidae;Folkia;sp. 2;Folkia sp. 2;141;42.734493;16.910785;Tb;deep cave;42.73449316.910785;4;;16,5;14,42;;;;;;;;;;;;;;;;;;;
35;Špilja na Pozalicu;Croatia;3.3.2008.;2008-03-03;1 f;1;Pholcidae;Pholcus;phalangioides;Pholcus phalangioides;60;42.76131;16.9129;;deep cave;42.7613116.9129;4;;12,65;14;;;;;;;;;;;;;;;;;;;
36;Hrastovska špilja;Croatia;3.3.2008.;2008-03-03;1 juv;1;Dysderidae;Folkia;sp. 2;Folkia sp. 2;120;42.756282;16.875635;Tb;deep cave;42.75628216.875635;4;11,2;;;;;;;;;;;;;;;;;;;;;
37;Medvidina špilja;Croatia;3.3.2008.;2008-03-03;1 f, 1 juv m;2;Nesticidae;Kryptonesticus;eremita;Kryptonesticus eremita;;42.734776;16.863532;tf;deep cave;42.73477616.863532;1;;;;;;;;;;;;;;;;;;;;;;
39;Špilja pod Kaštel;Croatia;27.9.2007.;2007-09-27;2 juv;2;Nesticidae;Kryptonesticus;eremita;Kryptonesticus eremita;;42.768041;16.899005;tf;deep cave;42.76804116.899005;2;;15,3;17,5;;;;;;;;;;;;;;;;;;;
41;Ra?a špilja;Croatia;2.10.2007.;2007-10-02;1 juv;1;Agelenidae;Tegenaria;sp.;Tegenaria sp.;141;42.734493;16.910785;;deep cave;42.73449316.910785;4;;16,5;14,42;;;;;;;;;;;;;;;;;;;
42;Jama Cvjetana Barbi?a;Croatia;1.10.2007.;2007-10-01;2 juv;2;Nesticidae;Kryptonesticus;eremita;Kryptonesticus eremita;73;42.740282;16.879112;tf;deep cave;42.74028216.879112;1;17,2;;;;;;;;;;;;;;;;;;;;;
44;Jama pod Velji vrh;Croatia;30.9.2007.;2007-09-30;1 juv;1;Nesticidae;Kryptonesticus;eremita;Kryptonesticus eremita;70;42.766635;16.907278;tf;deep cave;42.76663516.907278;2;;16,1;17,425;;;;;;;;;;;;;;;;;;;
45;Hrastovska špilja;Croatia;2.10.2007.;2007-10-02;2 juv;2;Dysderidae;Folkia;sp. 2;Folkia sp. 2;120;42.756282;16.875635;Tb;deep cave;42.75628216.875635;4;11,2;;;;;;;;;;;;;;;;;;;;;
46;Špilja na Pozalicu;Croatia;3.3.2008.;2008-03-03;1 m;1;Nesticidae;Kryptonesticus;eremita;Kryptonesticus eremita;60;42.76131;16.9129;tf;deep cave;42.7613116.9129;4;;12,65;14;;;;;;;;;;;;;;;;;;;
47;Jama pod Velji vrh;Croatia;2.3.2008.;2008-03-02;1 juv;1;Dysderidae;Folkia;sp. 2;Folkia sp. 2;;42.766635;16.907278;Tb;deep cave;42.76663516.907278;2;;16,1;17,425;;;;;;;;;;;;;;;;;;;
48;Hrastovska špilja;Croatia;3.3.2008.;2008-03-03;1 f, 1 juv;2;Leptonetidae;Barusia;sp. 1;Barusia sp. 1;120;42.756282;16.875635;tb;deep cave;42.75628216.875635;4;11,2;;;;;;;;;;;;;;;;;;;;;
50;Hrastovska špilja;Croatia;3.3.2008.;2008-03-03;2 juv;2;Nesticidae;Kryptonesticus;eremita;Kryptonesticus eremita;120;42.756282;16.875635;tf;deep cave;42.75628216.875635;4;11,2;;;;;;;;;;;;;;;;;;;;;
51;Hrastovska špilja;Croatia;2.10.2007.;2007-10-02;1 f;1;Linyphiidae;Bathyphantes;sp. 1;Bathyphantes sp. 1;120;42.756282;16.875635;Tx;;42.75628216.875635;4;11,2;;;;;;;;;;;;;;;;;;;;;
53;Špilja pod Kaštel;Croatia;4.3.2008.;2008-03-04;1 m;1;Nesticidae;Kryptonesticus;eremita;Kryptonesticus eremita;;42.768041;16.899005;tf;deep cave;42.76804116.899005;2;;15,3;17,5;;;;;;;;;;;;;;;;;;;
54;Špilja na Pozalicu;Croatia;29.9.2007.;2007-09-29;1 juv;1;Nesticidae;Kryptonesticus;eremita;Kryptonesticus eremita;60;42.76131;16.9129;tf;deep cave;42.7613116.9129;4;;12,65;14;;;;;;;;;;;;;;;;;;;
56;Breg jama;Croatia;30.4.2008.;2008-04-30;1 juv;1;Dysderidae;Harpactea;sp.;Harpactea sp.;;42.723459;17.591234;;;42.72345917.591234;1;14,9;;;;;;;;;;;;;;;;;;;;;
57;Jama Me?ugra?en;Croatia;30.4.2008.;2008-04-30;1m, 2 juv?;3;Dysderidae;Harpactea;sp. 9;Harpactea sp. 9;;42.737934;17.55671;Tb;deep cave;42.73793417.55671;3;15,8;;;;;;;;;;;;;;;;;;;;;
58;Jama Me?ugra?en;Croatia;30.4.2008.;2008-04-30;1f, 2juv;3;Agelenidae;Histopona;bidens;Histopona bidens;;42.737934;17.55671;tb;deep cave;42.73793417.55671;3;15,8;;;;;;;;;;;;;;;;;;;;;
59;Jara? na ponti od Graca;Croatia;3.5.2008.;2008-05-03;2 juv;2;Agelenidae;Histopona;bidens;Histopona bidens;;42.785308;17.392067;tb;deep cave;42.78530817.392067;2;10,55;;;;;;;;;;;;;;;;;;;;;
60;Jama na Žutim kokom;Croatia;2.5.2008.;2008-05-02;1 juv;1;Agelenidae;Histopona;bidens;Histopona bidens;326;42.712746;17.682621;tb;deep cave;42.71274617.682621;3;;;;;;;;;;;;;;;;;;;;;;
61;Ostaševica;Croatia;28.4.2008.;2008-04-28;1f, 1juv m;2;Agelenidae;Histopona;bidens;Histopona bidens;220;42.748959;17.544404;tb;deep cave;42.74895917.544404;9;11,6;;;;;;;;;;;;;;;;;;;;;
62;Jama na Brekalcima;Croatia;29.4.2008.;2008-04-29;1m, 1f;2;Agelenidae;Histopona;bidens;Histopona bidens;;42.781895;17.407747;tb;deep cave;42.78189517.407747;1;12,86666667;;;;;;;;;;;;;;;;;;;;;
63;Jama pod Sv. Spasom;Croatia;3.5.2008.;2008-05-03;1f;1;Agelenidae;Histopona;bidens;Histopona bidens;134;42.731779;17.542409;tb;deep cave;42.73177917.542409;6;;;;;;;;;;;;;;;;;;;;;;
64;Jama pod Sv. Spasom;Croatia;3.5.2008.;2008-05-03;1f;1;Dysderidae;Folkia;inermis;Folkia inermis;;42.731779;17.542409;Tb;deep cave;42.73177917.542409;6;;;;;;;;;;;;;;;;;;;;;;
65;Movrica;Croatia;28.4.2008.;2008-04-28;1 juv m;1;Agelenidae;Histopona;bidens;Histopona bidens;210;42.752604;17.551145;tb;deep cave;42.75260417.551145;6;12,6;;;;;;;;;;;;;;;;;;;;;
66;Male ponte;Croatia;27.4.2008.;2008-04-27;1 juv m;1;Agelenidae;Histopona;bidens;Histopona bidens;250;42.761389;17.430786;tb;deep cave;42.76138917.430786;7;;14;14,6;;;;;;;;;;;;;;;;;;;
67;Movrica;Croatia;28.4.2008.;2008-04-28;1m, 1f, 3 juv;5;Agelenidae;Histopona;bidens;Histopona bidens;;42.752604;17.551145;tb;deep cave;42.75260417.551145;6;12,6;;;;;;;;;;;;;;;;;;;;;
68;Špilja u Solinama;Croatia;26.4.2008.;2008-04-26;1f, 2juv;3;Agelenidae;Histopona;bidens;Histopona bidens;17;42.768021;17.377062;tb;deep cave;42.76802117.377062;5;;;7,6;;;;;;;;;;;;;;;;;;;
70;Špilja u Solinama;Croatia;26.4.2008.;2008-04-26;1 juv;1;Dysderidae;Gen. ;sp.;Gen.  sp.;;42.768021;17.377062;Tb;deep cave;42.76802117.377062;5;;;7,6;;;;;;;;;;;;;;;;;;;
71;Špilja u Solinama;Croatia;26.4.2008.;2008-04-26;1 juv;1;Dysderidae;Folkia;sp. 5;Folkia sp. 5;;42.768021;17.377062;Tb;deep cave;42.76802117.377062;5;;;7,6;;;;;;;;;;;;;;;;;;;
72;Jama na Brekalcima;Croatia;29.4.2008.;2008-04-29;1f;1;Agelenidae;Histopona;bidens;Histopona bidens;;42.781895;17.407747;tb;deep cave;42.78189517.407747;1;12,86666667;;;;;;;;;;;;;;;;;;;;;
73;Špilja kod Nerezinog dola;Croatia;27.4.2008.;2008-04-27;1 juv;1;Agelenidae;Tegenaria;sp.;Tegenaria sp.;201;42.758378;17.436094;;deep cave;42.75837817.436094;6;;14,6;12,7875;;;;;;;;;;;;;;;;;;;
74;Male ponte;Croatia;27.4.2008.;2008-04-27;2 juv;2;Agelenidae;Histopona;bidens;Histopona bidens;250;42.761389;17.430786;tb;deep cave;42.76138917.430786;7;;14;14,6;;;;;;;;;;;;;;;;;;;
75;Jama za Sv. Ilijom;Croatia;2.5.2008.;2008-05-02;2 juv;2;Agelenidae;Histopona;bidens;Histopona bidens;;42.744428;17.515269;tb;deep cave;42.74442817.515269;3;;;13,2;;;;;;;;;;;;;;;;;;;
76;Jama na Žutim kokom;Croatia;2.5.2008.;2008-05-02;1 juv;1;Dysderidae;Folkia;inermis;Folkia inermis;;42.712746;17.682621;Tb;deep cave;42.71274617.682621;3;;;;;;;;;;;;;;;;;;;;;;
77;Gali?njak;Croatia;2.5.2008.;2008-05-02;1 juv;1;Agelenidae;Histopona;bidens;Histopona bidens;;42.720118;17.67071;tb;deep cave;42.72011817.67071;11;12;;;;;;;;;;;;;;;;;;;;;
78;Gali?njak;Croatia;2.5.2008.;2008-05-02;1 f;1;Leptonetidae;Sulcia;sp. 6;Sulcia sp. 6;;42.720118;17.67071;Tf;cave entrance;42.72011817.67071;11;12;;;;;;;;;;;;;;;;;;;;;
79;Gali?njak;Croatia;2.5.2008.;2008-05-02;2 m, 2 f, 1 juv;5;Leptonetidae;Sulcia;sp. 6;Sulcia sp. 6;;42.720118;17.67071;Tf;cave entrance;42.72011817.67071;11;12;;;;;;;;;;;;;;;;;;;;;
80;Gali?njak;Croatia;2.5.2008.;2008-05-02;1m, 1f, 1 juv;3;Leptonetidae;Sulcia;sp. 6;Sulcia sp. 6;;42.720118;17.67071;Tf;cave entrance;42.72011817.67071;11;12;;;;;;;;;;;;;;;;;;;;;
86;Gali?njak;Croatia;2.5.2008.;2008-05-02;2 m, 1 juv;3;Leptonetidae;Barusia;maheni;Barusia maheni;;42.720118;17.67071;tf;deep cave;42.72011817.67071;11;12;;;;;;;;;;;;;;;;;;;;;
87;Špilja kod Nerezinog dola;Croatia;27.4.2008.;2008-04-27;1 juv f;1;Leptonetidae;Barusia;maheni;Barusia maheni;;42.758378;17.436094;tf;deep cave;42.75837817.436094;6;;14,6;12,7875;;;;;;;;;;;;;;;;;;;
89;Movrica;Croatia;28.4.2008.;2008-04-28;1 f, 2 juv m;3;Leptonetidae;Sulcia;nocturna;Sulcia nocturna;;42.752604;17.551145;;deep cave;42.75260417.551145;6;12,6;;;;;;;;;;;;;;;;;;;;;
90;Male ponte;Croatia;27.4.2008.;2008-04-27;1 f;1;Linyphiidae;Palliduphantes;sp. 1;Palliduphantes sp. 1;;42.761389;17.430786;tf;deep cave;42.76138917.430786;7;;14;14,6;;;;;;;;;;;;;;;;;;;
96;Male ponte;Croatia;14.4.2007.;2007-04-14;1f, 1 juv;2;Leptonetidae;Sulcia;nocturna;Sulcia nocturna;;42.761389;17.430786;;deep cave;42.76138917.430786;7;;14;14,6;;;;;;;;;;;;;;;;;;;
98;Gali?njak;Croatia;10.4.2007.;2007-04-10;1 m;1;Leptonetidae;Barusia;maheni;Barusia maheni;;42.720118;17.67071;tf;deep cave;42.72011817.67071;11;12;;;;;;;;;;;;;;;;;;;;;
99;Ostaševica;Croatia;8.4.2007.;2007-04-08;1f, 1 juv;2;Leptonetidae;Sulcia;nocturna;Sulcia nocturna;220;42.748959;17.544404;;deep cave;42.74895917.544404;9;11,6;;;;;;;;;;;;;;;;;;;;;
100;Gali?njak;Croatia;14.4.2007.;2007-04-14;1 m;1;Leptonetidae;Barusia;maheni;Barusia maheni;;42.720118;17.67071;tf;deep cave;42.72011817.67071;11;12;;;;;;;;;;;;;;;;;;;;;
102;Male ponte;Croatia;9.4.2007.;2007-04-09;1 f;1;Leptonetidae;Barusia;maheni;Barusia maheni;;42.761389;17.430786;tf;deep cave;42.76138917.430786;7;;14;14,6;;;;;;;;;;;;;;;;;;;
103;Male ponte;Croatia;9.4.2007.;2007-04-09;1 m, 1 f, 1 juv;3;Leptonetidae;Sulcia;nocturna;Sulcia nocturna;;42.761389;17.430786;;deep cave;42.76138917.430786;7;;14;14,6;;;;;;;;;;;;;;;;;;;
104;Špilja kod Nerezinog dola;Croatia;7.4.2007.;2007-04-07;1 m, 3 juv;4;Leptonetidae;Barusia;maheni;Barusia maheni;;42.758378;17.436094;tf;deep cave;42.75837817.436094;6;;14,6;12,7875;;;;;;;;;;;;;;;;;;;
105;Špilja u Solinama;Croatia;11.4.2007.;2007-04-11;1 m, 1 f;2;Leptonetidae;Barusia;maheni;Barusia maheni;17;42.768021;17.377062;tf;deep cave;42.76802117.377062;5;;;7,6;;;;;;;;;;;;;;;;;;;
109;Špilja kod Nerezinog dola;Croatia;7.4.2007.;2007-04-07;1 m, 2 f;3;Leptonetidae;Barusia;maheni;Barusia maheni;;42.758378;17.436094;tf;deep cave;42.75837817.436094;6;;14,6;12,7875;;;;;;;;;;;;;;;;;;;
111;Male ponte;Croatia;9.4.2007.;2007-04-09;1 f;1;Linyphiidae;Palliduphantes;sp. 1;Palliduphantes sp. 1;;42.761389;17.430786;tf;deep cave;42.76138917.430786;7;;14;14,6;;;;;;;;;;;;;;;;;;;
112;Ostaševica;Croatia;8.4.2007.;2007-04-08;2 juv;2;Agelenidae;Histopona;bidens;Histopona bidens;220;42.748959;17.544404;tb;deep cave;42.74895917.544404;9;11,6;;;;;;;;;;;;;;;;;;;;;
113;Špilja kod Nerezinog dola;Croatia;7.4.2007.;2007-04-07;1 juv;1;Agelenidae;Histopona;bidens;Histopona bidens;;42.758378;17.436094;tb;deep cave;42.75837817.436094;6;;14,6;12,7875;;;;;;;;;;;;;;;;;;;
114;Male ponte;Croatia;9.4.2007.;2007-04-09;1 juv;1;Agelenidae;Histopona;bidens;Histopona bidens;250;42.761389;17.430786;tb;deep cave;42.76138917.430786;7;;14;14,6;;;;;;;;;;;;;;;;;;;
118;Gali?njak;Croatia;10.4.2007.;2007-04-10;1m;1;Nemesiidae;Nemesia;sp. 1;Nemesia sp. 1;;42.720118;17.67071;;;42.72011817.67071;11;12;;;;;;;;;;;;;;;;;;;;;
119;Gali?njak;Croatia;14.4.2007.;2007-04-14;2 juv;2;Agelenidae;Histopona;bidens;Histopona bidens;;42.720118;17.67071;tb;deep cave;42.72011817.67071;11;12;;;;;;;;;;;;;;;;;;;;;
120;Male ponte;Croatia;9.4.2007.;2007-04-09;2 juv;2;Agelenidae;Histopona;bidens;Histopona bidens;250;42.761389;17.430786;tb;deep cave;42.76138917.430786;7;;14;14,6;;;;;;;;;;;;;;;;;;;
122;Movrica;Croatia;8.4.2007.;2007-04-08;2 juv;2;Agelenidae;Histopona;bidens;Histopona bidens;;42.752604;17.551145;tb;deep cave;42.75260417.551145;6;12,6;;;;;;;;;;;;;;;;;;;;;
123;Špilja kod Vrha spile;Croatia;9.4.2007.;2007-04-09;1 juv;1;Agelenidae;Histopona;bidens;Histopona bidens;;42.776757;17.420591;tb;deep cave;42.77675717.420591;3;9,4;;;;;;;;;;;;;;;;;;;;;
124;Mala špilja, Blato;Croatia;12.4.2007.;2007-04-12;2 juv;2;Dysderidae;Folkia;inermis;Folkia inermis;;42.764498;17.471054;Tb;deep cave;42.76449817.471054;5;;;;;;;;;;;;;;;;;;;;;;
125;Gali?njak;Croatia;10.4.2007.;2007-04-10;1 juv;1;Dysderidae;Harpactea;sp.;Harpactea sp.;;42.720118;17.67071;;;42.72011817.67071;11;12;;;;;;;;;;;;;;;;;;;;;
126;Špilja u Solinama;Croatia;11.4.2007.;2007-04-11;1 juv;1;Dysderidae;Folkia;sp. 5;Folkia sp. 5;17;42.768021;17.377062;Tb;deep cave;42.76802117.377062;5;;;7,6;;;;;;;;;;;;;;;;;;;
127;Mala špilja, Blato;Croatia;12.4.2007.;2007-04-12;1 juv;1;Dysderidae;Folkia;inermis;Folkia inermis;;42.764498;17.471054;Tb;deep cave;42.76449817.471054;5;;;;;;;;;;;;;;;;;;;;;;
128;Male ponte;Croatia;9.4.2007.;2007-04-09;1 juv;1;Dysderidae;Folkia;sp. 5;Folkia sp. 5;;42.761389;17.430786;Tb;deep cave;42.76138917.430786;7;;14;14,6;;;;;;;;;;;;;;;;;;;
129;Špilja kod Nerezinog dola;Croatia;7.4.2007.;2007-04-07;1 juv;1;Dysderidae;Folkia;inermis;Folkia inermis;;42.758378;17.436094;Tb;deep cave;42.75837817.436094;6;;14,6;12,7875;;;;;;;;;;;;;;;;;;;
130;Mala špilja, Blato;Croatia;12.4.2007.;2007-04-12;1 juv;1;Dysderidae;Folkia;inermis;Folkia inermis;;42.764498;17.471054;Tb;deep cave;42.76449817.471054;5;;;;;;;;;;;;;;;;;;;;;;
131;Male ponte;Croatia;13.4.2007.;2007-04-13;1f;1;Dysderidae;Folkia;sp. 5;Folkia sp. 5;;42.761389;17.430786;Tb;deep cave;42.76138917.430786;7;;14;14,6;;;;;;;;;;;;;;;;;;;
133;Movrica;Croatia;8.4.2007.;2007-04-08;1 f;1;Linyphiidae;Bathyphantes;sp. 1;Bathyphantes sp. 1;;42.752604;17.551145;Tx;;42.75260417.551145;6;12,6;;;;;;;;;;;;;;;;;;;;;
134;Špilja u Solinama;Croatia;11.4.2007.;2007-04-11;1 f;1;Familia x;Gen.;sp.;Gen. sp.;17;42.768021;17.377062;;;42.76802117.377062;5;;;7,6;;;;;;;;;;;;;;;;;;;
135;Male ponte;Croatia;9.4.2007.;2007-04-09;1 f;1;Linyphiidae;Bathyphantes;sp. 1;Bathyphantes sp. 1;;42.761389;17.430786;Tx;;42.76138917.430786;7;;14;14,6;;;;;;;;;;;;;;;;;;;
136;Mala špilja, Blato;Croatia;12.4.2007.;2007-04-12;1 f;1;Linyphiidae;Bathyphantes;sp. 1;Bathyphantes sp. 1;;42.764498;17.471054;Tx;;42.76449817.471054;5;;;;;;;;;;;;;;;;;;;;;;
139;Ostaševica;Croatia;28.4.2008.;2008-04-28;1m;1;Dysderidae;Folkia;inermis;Folkia inermis;220;42.748959;17.544404;Tb;deep cave;42.74895917.544404;9;11,6;;;;;;;;;;;;;;;;;;;;;
140;Ostaševica;Croatia;28.4.2008.;2008-04-28;1m;1;Agelenidae;Histopona;bidens;Histopona bidens;220;42.748959;17.544404;tb;deep cave;42.74895917.544404;9;11,6;;;;;;;;;;;;;;;;;;;;;
141;Jama Me?ugra?en;Croatia;30.4.2008.;2008-04-30;3 juv;3;Agelenidae;Histopona;bidens;Histopona bidens;;42.737934;17.55671;tb;deep cave;42.73793417.55671;3;15,8;;;;;;;;;;;;;;;;;;;;;
142;Jama Me?ugra?en;Croatia;30.4.2008.;2008-04-30;1f;1;Dysderidae;Folkia;inermis;Folkia inermis;;42.737934;17.55671;Tb;deep cave;42.73793417.55671;3;15,8;;;;;;;;;;;;;;;;;;;;;
143;Vilina špilja-Izvor Omble;Croatia;1.11.2008.;2008-11-01;2m, 1 juv;3;Leptonetidae;Sulcia;sp. 2;Sulcia sp. 2;137;42.67716;18.136236;Tb;deep cave;42.6771618.136236;5;;;14,2;;;;;;;;;;;;;;;;;;;
144;Mo?iljska špilja;Croatia;1.11.2008.;2008-11-01;1f;1;Nesticidae;Kryptonesticus;eremita;Kryptonesticus eremita;410;42.689061;18.071906;tf;deep cave;42.68906118.071906;6;;15,4;15,825;;;;;;;;;;;;;;;;;;;
146;Debela ljut;Croatia;31.10.2008.;2008-10-31;1f, 2 juv;3;Nesticidae;Kryptonesticus;eremita;Kryptonesticus eremita;258;42.717699;18.022036;tf;deep cave;42.71769918.022036;8;;15,6;13,78333333;;;;;;;;;;;;;;;;;;;
147;Debela ljut;Croatia;31.10.2008.;2008-10-31;1 f;1;Linyphiidae;Gen.;sp. X;Gen. sp. X;;42.717699;18.022036;;;42.71769918.022036;8;;15,6;13,78333333;;;;;;;;;;;;;;;;;;;
148;Banova ljut;Croatia;31.10.2008.;2008-10-31;1 juv m;1;Nesticidae;Kryptonesticus;eremita;Kryptonesticus eremita;;42.724023;18.023649;tf;deep cave;42.72402318.023649;4;15,2;;;;;;;;;;;;;;;;;;;;;
152;Jama Zadubravica;Croatia;3.11.2008.;2008-11-03;1 juv m, 1f;2;Leptonetidae;Sulcia;sp. X;Sulcia sp. X;;42.771666;17.936425;;;42.77166617.936425;3;;11,3;12,45;;;;;;;;;;;;;;;;;;;
154;Jama na vrh Prodoli;Croatia;4.11.2008.;2008-11-04;1 m;1;Leptonetidae;Barusia;maheni;Barusia maheni;;42.720837;18.021231;tf;deep cave;42.72083718.021231;1;;21,6;;;;;;;;;;;;;;;;;;;;
156;Debela ljut;Croatia;31.10.2008.;2008-10-31;1m, 1 juv;2;Leptonetidae;Barusia;maheni;Barusia maheni;;42.717699;18.022036;tf;deep cave;42.71769918.022036;8;;15,6;13,78333333;;;;;;;;;;;;;;;;;;;
160;Pe?ina u Gaju;Croatia;1.11.2008.;2008-11-01;1 juv;1;Agelenidae;Histopona;sp.;Histopona sp.;;42.704486;18.08282;;deep cave;42.70448618.08282;2;;;;;;;;;;;;;;;;;;;;;;
161;Pe?ina u Gaju;Croatia;1.11.2008.;2008-11-01;1m, 1juv f;2;Leptonetidae;Sulcia;sp. 14;Sulcia sp. 14;;42.704486;18.08282;;;42.70448618.08282;2;;;;;;;;;;;;;;;;;;;;;;
162;Špijaturica;Croatia;5.11.2008.;2008-11-05;1m, 1f;2;Leptonetidae;Barusia;maheni;Barusia maheni;340;42.835204;17.806752;tf;deep cave;42.83520417.806752;3;;;;;;;;;;;;;;;;;;;;;;
169;Vilina špilja-Izvor Omble;Croatia;1.11.2008.;2008-11-01;1f;1;Agelenidae;Histopona;dubia;Histopona dubia;137;42.67716;18.136236;tb;deep cave;42.6771618.136236;5;;;14,2;;;;;;;;;;;;;;;;;;;
170;Vilinska špilja;Croatia;4.11.2008.;2008-11-04;1f;1;Linyphiidae;Troglohyphantes;salax;Troglohyphantes salax;;42.797852;17.922663;tb;deep cave;42.79785217.922663;2;;;;;;;;;;;;;;;;;;;;;;
171;Jama na vrh Vrguda;Croatia;2.11.2008.;2008-11-02;1 m;1;Leptonetidae;Barusia;maheni;Barusia maheni;523;42.726207;18.039158;tf;deep cave;42.72620718.039158;9;;11;13,43333333;;;;;;;;;;;;;;;;;;;
173;Jama na vrh Vrguda;Croatia;2.11.2008.;2008-11-02;1 juv m;1;Agelenidae;Histopona;dubia;Histopona dubia;523;42.726207;18.039158;tb;deep cave;42.72620718.039158;9;;11;13,43333333;;;;;;;;;;;;;;;;;;;
174;Špijaturica;Croatia;5.11.2008.;2008-11-05;5m, 2f;7;Leptonetidae;Barusia;maheni;Barusia maheni;;42.835204;17.806752;tf;deep cave;42.83520417.806752;3;;;;;;;;;;;;;;;;;;;;;;
175;Vilina špilja-Izvor Omble;Croatia;1.11.2008.;2008-11-01;1 juv ;1;Agelenidae;Histopona;sp.;Histopona sp.;137;42.67716;18.136236;;deep cave;42.6771618.136236;5;;;14,2;;;;;;;;;;;;;;;;;;;
176;Vilina špilja-Izvor Omble;Croatia;1.11.2008.;2008-11-01;2m, 1f, 3 juv;6;Leptonetidae;Sulcia;sp. 2;Sulcia sp. 2;137;42.67716;18.136236;Tb;deep cave;42.6771618.136236;5;;;14,2;;;;;;;;;;;;;;;;;;;
180;Jama Zadubravica;Croatia;3.11.2008.;2008-11-03;1f;1;Agelenidae;Histopona;conveniens;Histopona conveniens;;42.771666;17.936425;Tf;deep cave;42.77166617.936425;3;;11,3;12,45;;;;;;;;;;;;;;;;;;;
181;Aragonka;Croatia;26.3.2008.;2008-03-26;1 juv;1;Agelenidae;Histopona;sp.;Histopona sp.;306;42.713284;18.019397;;deep cave;42.71328418.019397;3;;;15,4;;;;;;;;;;;;;;;;;;;
182;Aragonka;Croatia;26.3.2008.;2008-03-26;1 f;1;Agelenidae;Histopona;dubia;Histopona dubia;306;42.713284;18.019397;tb;deep cave;42.71328418.019397;3;;;15,4;;;;;;;;;;;;;;;;;;;
183;Jama u Zabira?u;Croatia;30.3.2008.;2008-03-30;1m, 2 juv;3;Dysderidae;Dysdera;sp. 1;Dysdera sp. 1;;42.732667;18.049328;;;42.73266718.049328;3;11,9;;;;;;;;;;;;;;;;;;;;;
184;Kriva?a špilja;Croatia;31.3.2008.;2008-03-31;1f;1;Dysderidae;Stalagtia;hercegovinensis;Stalagtia hercegovinensis;;42.730217;18.067602;Tb;deep cave;42.73021718.067602;1;;8,9;9,95;;;;;;;;;;;;;;;;;;;
185;Jama u Zabira?u;Croatia;30.3.2008.;2008-03-30;1m;1;Dysderidae;Stalagtia;sp. 5;Stalagtia sp. 5;;42.732667;18.049328;Tb;deep cave;42.73266718.049328;3;11,9;;;;;;;;;;;;;;;;;;;;;
186;Jama na vrh Vrguda;Croatia;2.11.2008.;2008-11-02;1 f;1;Agelenidae;Tegenaria;annulata;Tegenaria annulata;523;42.726207;18.039158;tf;deep cave;42.72620718.039158;9;;11;13,43333333;;;;;;;;;;;;;;;;;;;
187;Jama na vrh Vrguda;Croatia;2.11.2008.;2008-11-02;1m, 2 juv;3;Dysderidae;Stalagtia;sp. 5;Stalagtia sp. 5;523;42.726207;18.039158;Tb;deep cave;42.72620718.039158;9;;11;13,43333333;;;;;;;;;;;;;;;;;;;
188;Jama na vrh Vrguda;Croatia;2.11.2008.;2008-11-02;1f;1;Linyphiidae;Troglohyphantes;affinis;Troglohyphantes affinis;523;42.726207;18.039158;tb;deep cave;42.72620718.039158;9;;11;13,43333333;;;;;;;;;;;;;;;;;;;
189;Kriva?a špilja;Croatia;31.3.2008.;2008-03-31;1f;1;Dysderidae;Stalagtia;hercegovinensis;Stalagtia hercegovinensis;;42.730217;18.067602;Tb;deep cave;42.73021718.067602;1;;8,9;9,95;;;;;;;;;;;;;;;;;;;
190;Jama u Zabira?u;Croatia;2.11.2008.;2008-11-02;2f;2;Dysderidae;Stalagtia;sp. 5;Stalagtia sp. 5;;42.732667;18.049328;Tb;deep cave;42.73266718.049328;3;11,9;;;;;;;;;;;;;;;;;;;;;
191;Jama Zadubravica;Croatia;3.11.2008.;2008-11-03;1f;1;Dysderidae;Stalagtia;hercegovinensis;Stalagtia hercegovinensis;;42.771666;17.936425;Tb;deep cave;42.77166617.936425;3;;11,3;12,45;;;;;;;;;;;;;;;;;;;
192;Vilina špilja-Izvor Omble;Croatia;1.11.2008.;2008-11-01;1f;1;Dysderidae;Stalagtia;sp. 2;Stalagtia sp. 2;137;42.67716;18.136236;Tb;deep cave;42.6771618.136236;5;;;14,2;;;;;;;;;;;;;;;;;;;
193;Aragonka;Croatia;26.3.2008.;2008-03-26;1f, 1 juv;2;Dysderidae;Stalagtia;sp. 5;Stalagtia sp. 5;306;42.713284;18.019397;Tb;deep cave;42.71328418.019397;3;;;15,4;;;;;;;;;;;;;;;;;;;
194;Špilja na vrh Toraca;Croatia;26.3.2008.;2008-03-26;1f;1;Dysderidae;Stalagtia;sp. 5;Stalagtia sp. 5;;42.705575;18.03049;Tb;deep cave;42.70557518.03049;3;;15,5;15,275;;;;;;;;;;;;;;;;;;;
195;Špijaturica;Croatia;5.11.2008.;2008-11-05;1 juv;1;Dysderidae;Stalagtia;hercegovinensis;Stalagtia hercegovinensis;;42.835204;17.806752;Tb;deep cave;42.83520417.806752;3;;;;;;;;;;;;;;;;;;;;;;
196;Jama uz stazu na Sv. Nikoli;Croatia;28.3.2008.;2008-03-28;2 juv;2;Dysderidae;Stalagtia;sp. 5;Stalagtia sp. 5;;42.700426;18.028022;Tb;deep cave;42.70042618.028022;2;;;;;;;;;;;;;;;;;;;;;;
197;Vilina špilja-Izvor Omble;Croatia;1.11.2008.;2008-11-01;1 juv;1;Dysderidae;Stalagtia;sp. 2;Stalagtia sp. 2;137;42.67716;18.136236;Tb;deep cave;42.6771618.136236;5;;;14,2;;;;;;;;;;;;;;;;;;;
198;Vilinska špilja;Croatia;4.11.2008.;2008-11-04;2 juv;2;Dysderidae;Stalagtia;hercegovinensis;Stalagtia hercegovinensis;;42.797852;17.922663;Tb;deep cave;42.79785217.922663;2;;;;;;;;;;;;;;;;;;;;;;
199;Rudina;Croatia;27.3.2008.;2008-03-27;1 juv;1;Dysderidae;Stalagtia;hercegovinensis;Stalagtia hercegovinensis;;42.721999;18.015321;Tb;deep cave;42.72199918.015321;3;9,9;;;;;;;;;;;;;;;;;;;;;
200;Jama na vrh Vrguda;Croatia;2.11.2008.;2008-11-02;1 juv;1;Dysderidae;Harpactea;sp.;Harpactea sp.;523;42.726207;18.039158;;;42.72620718.039158;9;;11;13,43333333;;;;;;;;;;;;;;;;;;;
201;Jama Zadubravica;Croatia;31.3.2008.;2008-03-31;3 juv;3;Dysderidae;Stalagtia;hercegovinensis;Stalagtia hercegovinensis;;42.771666;17.936425;Tb;deep cave;42.77166617.936425;3;;11,3;12,45;;;;;;;;;;;;;;;;;;;
202;Mo?iljska špilja;Croatia;1.11.2008.;2008-11-01;1 juv;1;Dysderidae;Stalagtia;sp. 5;Stalagtia sp. 5;410;42.689061;18.071906;Tb;deep cave;42.68906118.071906;6;;15,4;15,825;;;;;;;;;;;;;;;;;;;
203;Jama na vrh Vrguda;Croatia;2.11.2008.;2008-11-02;1m;1;Linyphiidae;Micrargus;herbigradus;Micrargus herbigradus;523;42.726207;18.039158;Tf;deep cave;42.72620718.039158;9;;11;13,43333333;;;;;;;;;;;;;;;;;;;
204;Špijaturica;Croatia;5.11.2008.;2008-11-05;2 f;2;Linyphiidae;Asthenargus;bracianus;Asthenargus bracianus;;42.835204;17.806752;tf;deep cave;42.83520417.806752;3;;;;;;;;;;;;;;;;;;;;;;
205;Debela ljut;Croatia;31.10.2008.;2008-10-31;1f, 1m;2;Linyphiidae;Asthenargus;bracianus;Asthenargus bracianus;;42.717699;18.022036;tf;deep cave;42.71769918.022036;8;;15,6;13,78333333;;;;;;;;;;;;;;;;;;;
207;Debela ljut;Croatia;31.10.2008.;2008-10-31;1 f;1;Linyphiidae;Asthenargus;bracianus;Asthenargus bracianus;;42.717699;18.022036;tf;deep cave;42.71769918.022036;8;;15,6;13,78333333;;;;;;;;;;;;;;;;;;;
208;Jama u Zabira?u;Croatia;30.3.2008.;2008-03-30;1f;1;Linyphiidae;Centromerus;raridentatus sp.n.;Centromerus raridentatus sp.n.;;42.732667;18.049328;;;42.73266718.049328;3;11,9;;;;;;;;;;;;;;;;;;;;;
209;Jama uz stazu na Sv. Nikoli;Croatia;28.3.2008.;2008-03-28;1 f;1;Linyphiidae;Gen. 2;sp. 1;Gen. 2 sp. 1;;42.700426;18.028022;;;42.70042618.028022;2;;;;;;;;;;;;;;;;;;;;;;
210;Jama na vrh Vrguda;Croatia;2.11.2008.;2008-11-02;1 m;1;Linyphiidae;Asthenargus;bracianus;Asthenargus bracianus;523;42.726207;18.039158;tf;deep cave;42.72620718.039158;9;;11;13,43333333;;;;;;;;;;;;;;;;;;;
211;Jama na vrh Vrguda;Croatia;2.11.2008.;2008-11-02;1 ?;;Linyphiidae;Gen. 1;sp. 1;Gen. 1 sp. 1;523;42.726207;18.039158;;;42.72620718.039158;9;;11;13,43333333;;;;;;;;;;;;;;;;;;;
213;Špijaturica;Croatia;5.11.2008.;2008-11-05;2f, 2m;4;Linyphiidae;Asthenargus;bracianus;Asthenargus bracianus;;42.835204;17.806752;tf;deep cave;42.83520417.806752;3;;;;;;;;;;;;;;;;;;;;;;
214;?injadra;Croatia;5.1.2009.;2009-01-05;1 f, 1 juv;2;Nesticidae;Kryptonesticus;eremita;Kryptonesticus eremita;294;43.339771;16.599423;tf;deep cave;43.33977116.599423;2;;;15,1;;;;;;;;;;;;;;;;;;;
215;?injadra;Croatia;22.10.2007.;2007-10-22;1 f, 5 juv;6;Nesticidae;Kryptonesticus;eremita;Kryptonesticus eremita;294;43.339771;16.599423;tf;deep cave;43.33977116.599423;2;;;15,1;;;;;;;;;;;;;;;;;;;
219;Špilja pod Zimzelom;Croatia;25.6.2008.;2008-06-25;1 m;1;Dysderidae;Parastalita;stygia;Parastalita stygia;765;45.281948;15.115239;Tb;deep cave;45.28194815.115239;1;8;;;;;;;;;;;;;;;;;;;;;
220;Špilja pod Zimzelom;Croatia;25.6.2008.;2008-06-25;1 m, 1f;2;Dysderidae;Parastalita;stygia;Parastalita stygia;765;45.281948;15.115239;Tb;deep cave;45.28194815.115239;1;8;;;;;;;;;;;;;;;;;;;;;
221;Špilja pod Zimzelom;Croatia;14.12.2008.;2008-12-14;1 m;1;Dysderidae;Parastalita;stygia;Parastalita stygia;765;45.281948;15.115239;Tb;deep cave;45.28194815.115239;1;8;;;;;;;;;;;;;;;;;;;;;
222;Špilja pod Zimzelom;Croatia;14.12.2008.;2008-12-14;2 f;2;Dysderidae;Parastalita;stygia;Parastalita stygia;765;45.281948;15.115239;Tb;deep cave;45.28194815.115239;1;8;;;;;;;;;;;;;;;;;;;;;
223;Krumpirište;Croatia;13.10.2007.;2007-10-13;1 m;1;Linyphiidae;Troglohyphantes;sp. 12;Troglohyphantes sp. 12;860;45.90677;15.95285;tf;shallow subterranean habitat;45.9067715.95285;1;;;;;;;;;;;;;;;;;;;;;;
224;Kranjica pe?ina;Croatia;13.10.2007.;2007-10-13;1m, 1f;2;Agelenidae;Tegenaria;bosnica;Tegenaria bosnica;820;43.959462;16.475197;;deep cave;43.95946216.475197;2;;;;;;;;;;;;;;;;;;;;;;
225;Suhodolka;Croatia;26.10.2008.;2008-10-26;1f;1;Linyphiidae;Porrhomma;egeria;Porrhomma egeria;658;45.504451;17.698877;;deep cave;45.50445117.698877;1;;8,55;8,62;;;;;;;;;;;;;;;;;;;
226;Suhodolka;Croatia;24.10.2008.;2008-10-24;1f;1;Linyphiidae;Porrhomma;egeria;Porrhomma egeria;658;45.504451;17.698877;;deep cave;45.50445117.698877;1;;8,55;8,62;;;;;;;;;;;;;;;;;;;
227;Kova?ica jama;Croatia;25.10.2008.;2008-10-25;1f, 1m, 1juv;3;Linyphiidae;Porrhomma;convexum;Porrhomma convexum;;45.519178;17.65444;;deep cave;45.51917817.65444;4;9,3;;;;;;;;;;;;;;;;;;;;;
228;Lijepa jama;Croatia;27.10.2008.;2008-10-27;2m, 1 juv;3;Linyphiidae;Porrhomma;egeria;Porrhomma egeria;725;45.501686;17.708297;;deep cave;45.50168617.708297;1;10,8;;;;;;;;;;;;;;;;;;;;;
230;Jama iznad Jezerca;Croatia;27.10.2008.;2008-10-27;2 m;2;Linyphiidae;Porrhomma;microps;Porrhomma microps;607;45.504726;17.684095;Tf;deep cave;45.50472617.684095;1;;9,6;9,85;;;;;;;;;;;;;;;;;;;
231;Jama na Bilu;Croatia;25.10.2008.;2008-10-25;1m, 2f, 1juv;4;Linyphiidae;Porrhomma;egeria;Porrhomma egeria;630;45.512599;17.693701;;deep cave;45.51259917.693701;1;8,9;;;;;;;;;;;;;;;;;;;;;
233;Suhodolka;Croatia;24.10.2008.;2008-10-24;6m, 7f, 5juv;18;Linyphiidae;Porrhomma;egeria;Porrhomma egeria;658;45.504451;17.698877;;deep cave;45.50445117.698877;1;;8,55;8,62;;;;;;;;;;;;;;;;;;;
235;Oko jame Kova?ice;Croatia;25.10.2008.;2008-10-25;1m;1;Cybaeidae;Mastigusa;macrophthalma;Mastigusa macrophthalma;;45.519178;17.65444;Tx;Shallow subterranean habitat;45.51917817.65444;4;;;;;;;;;;;;;;;;;;;;;;
236;Oko jame Kova?ice;Croatia;25.10.2008.;2008-10-25;1f;1;Amaurobidae;Amaurobius;jugorum;Amaurobius jugorum;;45.519178;17.65444;Tx;epigean habitat;45.51917817.65444;4;;;;;;;;;;;;;;;;;;;;;;
237;Oko jame Kova?ice;Croatia;25.10.2008.;2008-10-25;1f;1;Hahniidae;Cicurina;cicur;Cicurina cicur;;45.519178;17.65444;tf;epigean habitat;45.51917817.65444;4;;;;;;;;;;;;;;;;;;;;;;
239;Osinec jama;Croatia;14.10.2008.;2008-10-14;1f;1;Agelenidae;Tegenaria;ferruginea;Tegenaria ferruginea;524;46.163969;16.111277;Tf;deep cave;46.16396916.111277;2;;;;;;;;;;;;;;;;;;;;;;
240;Velika špilja, Pokojec;Croatia;19.10.2008.;2008-10-19;1 f;1;Corinnidae;Gen.;sp.;Gen. sp.;;46.170142;16.237915;;;46.17014216.237915;1;;;;;;;;;;;;;;;;;;;;;;
241;Matekova špilja 2;Croatia;16.10.2008.;2008-10-16;1 f;1;Cybaeidae;Cybaeus;sp. 1;Cybaeus sp. 1;;46.188341;16.123401;;;46.18834116.123401;1;;;;;;;;;;;;;;;;;;;;;;
242;Špilja u Bukevju;Croatia;18.10.2008.;2008-10-18;2f;2;Amaurobidae;Amaurobius;fenestralis;Amaurobius fenestralis;;46.206924;16.143971;Tx;deep cave;46.20692416.143971;2;;;;;;;;;;;;;;;;;;;;;;
243;Osinec jama;Croatia;29.5.2008.;2008-05-29;3 juv;3;Nesticidae;Nesticus;cellulanus;Nesticus cellulanus;524;46.163969;16.111277;;deep cave;46.16396916.111277;2;;;;;;;;;;;;;;;;;;;;;;
244;Špilja na Pisanoj pe?ini;Croatia;19.10.2008.;2008-10-19;3 juv;3;Nesticidae;Nesticus;cellulanus;Nesticus cellulanus;461;46.177112;16.220637;;deep cave;46.17711216.220637;1;;;;;;;;;;;;;;;;;;;;;;
245;Špilja na Pisanoj pe?ini;Croatia;14.5.2008.;2008-05-14;1 juv;1;Nesticidae;Nesticus;cellulanus;Nesticus cellulanus;461;46.177112;16.220637;;deep cave;46.17711216.220637;1;;;;;;;;;;;;;;;;;;;;;;
247;Zdenec pri Ciglaru;Croatia;14.5.2008.;2008-05-14;2 juv;2;Nesticidae;Nesticus;cellulanus;Nesticus cellulanus;251;46.283906;16.06104;tf;deep cave;46.28390616.06104;4;;;;;;;;;;;;;;;;;;;;;;
248;Osinec jama;Croatia;14.5.2008.;2008-05-14;1 juv;1;Nesticidae;Nesticus;cellulanus;Nesticus cellulanus;524;46.163969;16.111277;;deep cave;46.16396916.111277;2;;;;;;;;;;;;;;;;;;;;;;
251;Matekova špilja 1;Croatia;14.5.2008.;2008-05-14;1f, 1m;2;Linyphiidae;Diplocephalus;alpinus;Diplocephalus alpinus;;46.18834;16.123531;Tf;deep cave;46.1883416.123531;2;;;;;;;;;;;;;;;;;;;;;;
254;Hanžekova jama;Croatia;17.10.2008.;2008-10-17;1f, 2m;3;Linyphiidae;Troglohyphantes;sp. 2;Troglohyphantes sp. 2;390;46.155463;16.1171;tb;deep cave;46.15546316.1171;5;;;;;;;;;;;;;;;;;;;;;;
255;Hanžekova jama;Croatia;14.5.2008.;2008-05-14;6f, 1m;7;Linyphiidae;Porrhomma;egeria;Porrhomma egeria;390;46.155463;16.1171;Tf;deep cave;46.15546316.1171;5;;;;;;;;;;;;;;;;;;;;;;
257;Hanžekova jama;Croatia;12.5.2008.;2008-05-12;2 f;2;Linyphiidae;Troglohyphantes;sp. 2;Troglohyphantes sp. 2;390;46.155463;16.1171;tb;deep cave;46.15546316.1171;5;;;;;;;;;;;;;;;;;;;;;;
258;Duplja jama;Croatia;13.5.2008.;2008-05-13;1 juv m;1;Nesticidae;Nesticus;cellulanus;Nesticus cellulanus;539;46.281676;15.99087;;deep cave;46.28167615.99087;2;;;;;;;;;;;;;;;;;;;;;;
259;Duplja jama;Croatia;13.5.2008.;2008-05-13;1 m;1;Linyphiidae;Troglohyphantes;excavatus;Troglohyphantes excavatus;539;46.281676;15.99087;tf;deep cave;46.28167615.99087;2;;;;;;;;;;;;;;;;;;;;;;
261;Duplja jama;Croatia;13.5.2008.;2008-05-13;1 f;1;Linyphiidae;Troglohyphantes;excavatus;Troglohyphantes excavatus;539;46.281676;15.99087;tf;deep cave;46.28167615.99087;2;;;;;;;;;;;;;;;;;;;;;;
262;Rudnik Kraševski zviri;Croatia;14.5.2008.;2008-05-14;5m, 2f, 2 juv;9;Linyphiidae;Porrhomma;convexum;Porrhomma convexum;;46.203313;16.109739;Tf;deep cave;46.20331316.109739;3;;;;;;;;;;;;;;;;;;;;;;
263;Špilja u Bukevju;Croatia;14.5.2008.;2008-05-14;1 juv;1;Agelenidae;Tegenaria;sp.;Tegenaria sp.;107;46.206924;16.143971;;deep cave;46.20692416.143971;2;;;;;;;;;;;;;;;;;;;;;;
265;Rudnik Kraševski zviri;Croatia;14.5.2008.;2008-05-14;1 f;1;Linyphiidae;Gen.;sp. X;Gen. sp. X;;46.203313;16.109739;;;46.20331316.109739;3;;;;;;;;;;;;;;;;;;;;;;
266;Matekova špilja 1;Croatia;14.5.2008.;2008-05-14;1 juv;1;Dysderidae;Harpactea;sp.;Harpactea sp.;;46.18834;16.123531;;;46.1883416.123531;2;;;;;;;;;;;;;;;;;;;;;;
267;Bazgova?a;Croatia;5.1.2009.;2009-01-05;1f, 2m, 1juv;4;Linyphiidae;Palliduphantes;spelaeorum;Palliduphantes spelaeorum;;43.30647;16.622143;Tf;deep cave;43.3064716.622143;3;;5;6,675;;;;;;;;;;;;;;;;;;;
270;Grap?eva špilja;Croatia;16.10.2007.;2007-10-16;1m, 2 f, 1 juv;4;Nesticidae;Kryptonesticus;eremita;Kryptonesticus eremita;200;43.134189;16.753732;tf;deep cave;43.13418916.753732;5;;;13,93333333;;;;;;;;;;;;;;;;;;;
271;Grap?eva špilja;Croatia;16.10.2007.;2007-10-16;1 juv;1;Agelenidae;Hadites;tegenarioides;Hadites tegenarioides;200;43.134189;16.753732;TB;deep cave;43.13418916.753732;5;;;13,93333333;;;;;;;;;;;;;;;;;;;
273;Kranjica pe?ina;Croatia;13.10.2007.;2007-10-13;1 juv;1;Dysderidae;Harpactea;sp.;Harpactea sp.;820;43.959462;16.475197;;;43.95946216.475197;2;;;;;;;;;;;;;;;;;;;;;;
274;Grap?eva špilja;Croatia;16.10.2007.;2007-10-16;1 m, 1 juv;2;Nesticidae;Kryptonesticus;eremita;Kryptonesticus eremita;200;43.134189;16.753732;tf;deep cave;43.13418916.753732;5;;;13,93333333;;;;;;;;;;;;;;;;;;;
275;Zmajeva špilja;Croatia;21.7.2007.;2007-07-21;1 f;1;Agelenidae;Tegenaria;sp. 3;Tegenaria sp. 3;323;43.269174;16.598972;;deep cave;43.26917416.598972;4;;;;;;;;;;;;;;;;;;;;;;
276;Zmajeva špilja;Croatia;21.10.2007.;2007-10-21;2 juv;2;Agelenidae;Tegenaria;sp.;Tegenaria sp.;323;43.269174;16.598972;;deep cave;43.26917416.598972;4;;;;;;;;;;;;;;;;;;;;;;
277;Zmajeva špilja;Croatia;21.10.2007.;2007-10-21;1f, 3 juv;4;Amaurobidae;Amaurobius;sp. 1;Amaurobius sp. 1;;43.269174;16.598972;Tx;;43.26917416.598972;4;;;;;;;;;;;;;;;;;;;;;;
278;Vodena pe?a;Croatia;17.8.2005.;2005-08-17;1f;1;Linyphiidae;Troglohyphantes;dinaricus;Troglohyphantes dinaricus;610;43.792496;16.671447;tb;deep cave;43.79249616.671447;8;;;;;;;;;;;;;;;;;;;;;;
279;Vodena pe?a;Croatia;30.7.2007.;2007-07-30;1f;1;Linyphiidae;Troglohyphantes;dinaricus;Troglohyphantes dinaricus;610;43.792496;16.671447;tb;deep cave;43.79249616.671447;8;;;;;;;;;;;;;;;;;;;;;;
280;Vodena pe?a;Croatia;30.7.2007.;2007-07-30;1f, 1 m;2;Linyphiidae;Troglohyphantes;dinaricus;Troglohyphantes dinaricus;610;43.792496;16.671447;tb;deep cave;43.79249616.671447;8;;;;;;;;;;;;;;;;;;;;;;
281;Boži?eva špilja;Croatia;12.8.2007.;2007-08-12;2f, 1m;3;Linyphiidae;Troglohyphantes;kordunlikanus;Troglohyphantes kordunlikanus;285;45.000041;15.776525;tf;deep cave;45.00004115.776525;7;;12,9;10,84;;;;;;;;;;;;;;;;;;;
282;Boži?eva špilja;Croatia;12.8.2007.;2007-08-12;2f;2;Linyphiidae;Troglohyphantes;kordunlikanus;Troglohyphantes kordunlikanus;;45.000041;15.776525;tf;deep cave;45.00004115.776525;7;;12,9;10,84;;;;;;;;;;;;;;;;;;;
283;Boži?eva špilja;Croatia;12.8.2007.;2007-08-12;2f, 2 juv;4;Linyphiidae;Troglohyphantes;kordunlikanus;Troglohyphantes kordunlikanus;;45.000041;15.776525;tf;deep cave;45.00004115.776525;7;;12,9;10,84;;;;;;;;;;;;;;;;;;;
284;Boži?eva špilja;Croatia;12.8.2007.;2007-08-12;1f;1;Linyphiidae;Centromerus;cavernarum;Centromerus cavernarum;;45.000041;15.776525;Tf;deep cave;45.00004115.776525;7;;12,9;10,84;;;;;;;;;;;;;;;;;;;
285;Boži?eva špilja;Croatia;12.8.2007.;2007-08-12;1f;1;Linyphiidae;Troglohyphantes;kordunlikanus;Troglohyphantes kordunlikanus;;45.000041;15.776525;tf;deep cave;45.00004115.776525;7;;12,9;10,84;;;;;;;;;;;;;;;;;;;
286;Boži?eva špilja;Croatia;12.8.2007.;2007-08-12;1m;1;Linyphiidae;Centromerus;cavernarum;Centromerus cavernarum;;45.000041;15.776525;Tf;deep cave;45.00004115.776525;7;;12,9;10,84;;;;;;;;;;;;;;;;;;;
287;Boži?eva špilja;Croatia;12.8.2007.;2007-08-12;1m;1;Nesticidae;Nesticus;cellulanus;Nesticus cellulanus;35;45.000041;15.776525;tf;deep cave;45.00004115.776525;7;;12,9;10,84;;;;;;;;;;;;;;;;;;;
291;Mikašinovi?a špilja;Croatia;7.12.2008.;2008-12-07;1 f, 1 juv;2;Linyphiidae;Troglohyphantes;croaticus;Troglohyphantes croaticus;230;45.283788;15.28561;Tb;deep cave;45.28378815.28561;3;;;;;;;;;;;;;;;;;;;;;;
294;Jastrebina špilja;Croatia;5.12.2008.;2008-12-05;1f, 3 juv;4;Linyphiidae;Centromerus;cavernarum;Centromerus cavernarum;187;45.456129;15.44341;Tf;deep cave;45.45612915.44341;5;;;;;;;;;;;;;;;;;;;;;;
295;Danetska pe?ina;Croatia;20.6.2008.;2008-06-20;1 juv m;1;Dysderidae;Dysdera;ninnii;Dysdera ninnii;160;45.351625;15.327998;Tx;;45.35162515.327998;2;;;;;;;;;;;;;;;;;;;;;;
296;Kuštrovka;Croatia;19.6.2008.;2008-06-19;1 juv;1;Dysderidae;Stalita;pretneri;Stalita pretneri;450;45.346234;15.219338;Tb;deep cave;45.34623415.219338;3;;;;;;;;;;;;;;;;;;;;;;
297;Hajdu?ka pe?ina;Croatia;17.6.2008.;2008-06-17;1 f;1;Linyphiidae;Troglohyphantes;croaticus;Troglohyphantes croaticus;;45.27146;15.28981;Tb;deep cave;45.2714615.28981;3;;;;;;;;;;;;;;;;;;;;;;
298;Hajdu?ka pe?ina;Croatia;17.6.2008.;2008-06-17;1 f;1;Dysderidae;Parastalita;stygia;Parastalita stygia;;45.27146;15.28981;Tb;deep cave;45.2714615.28981;3;;;;;;;;;;;;;;;;;;;;;;
299;Jezero;Croatia;16.3.2002.;2002-03-16;2 m;2;Linyphiidae;Troglohyphantes;troglodytes;Troglohyphantes troglodytes;903;42.580381;18.356073;tf;deep cave;42.58038118.356073;8;;;7,566666667;;;;;;;;;;;;;;;;;;;
300;Škrabuljica;Croatia;1.11.2003.;2003-11-01;1m, 1 juv;2;Linyphiidae;Troglohyphantes;troglodytes;Troglohyphantes troglodytes;685;42.567045;18.385063;tf;deep cave;42.56704518.385063;5;;8,1;11,025;;;;;;;;;;;;;;;;;;;
301;Kuštrovka;Croatia;19.6.2008.;2008-06-19;6f, 1m, 1 juv;8;Linyphiidae;Troglohyphantes;croaticus;Troglohyphantes croaticus;450;45.346234;15.219338;Tb;deep cave;45.34623415.219338;3;;;;;;;;;;;;;;;;;;;;;;
302;Dragina pe?ina na Dobri;Croatia;18.6.2008.;2008-06-18;1 m;1;Nesticidae;Nesticus;cellulanus;Nesticus cellulanus;156;45.346751;15.290094;tf;deep cave;45.34675115.290094;4;;;;;;;;;;;;;;;;;;;;;;
303;Dragina pe?ina na Dobri;Croatia;18.6.2008.;2008-06-18;1 m;1;Linyphiidae;Troglohyphantes;excavatus;Troglohyphantes excavatus;156;45.346751;15.290094;tf;deep cave;45.34675115.290094;4;;;;;;;;;;;;;;;;;;;;;;
304;Jastrebina špilja;Croatia;14.6.2008.;2008-06-14;1m, 1 juv;2;Nesticidae;Nesticus;cellulanus;Nesticus cellulanus;187;45.456129;15.44341;tf;deep cave;45.45612915.44341;5;;;;;;;;;;;;;;;;;;;;;;
306;Bibi?ka špilja;Croatia;22.6.2008.;2008-06-22;1 f;1;Linyphiidae;Troglohyphantes;excavatus;Troglohyphantes excavatus;200;45.335921;15.254079;tf;deep cave;45.33592115.254079;3;;;;;;;;;;;;;;;;;;;;;;
307;Špilja u Rebi?ima;Croatia;15.6.2008.;2008-06-15;1f;1;Linyphiidae;Troglohyphantes;croaticus;Troglohyphantes croaticus;;45.32087;15.341565;Tb;deep cave;45.3208715.341565;1;;;;;;;;;;;;;;;;;;;;;;
309;Jama na Solinskom vrhu;Croatia;23.6.2008.;2008-06-23;1m, 2 juv;3;Linyphiidae;Troglohyphantes;excavatus;Troglohyphantes excavatus;;45.359492;15.313756;tf;deep cave;45.35949215.313756;1;;;;;;;;;;;;;;;;;;;;;;
310;Hajdu?ka pe?ina;Croatia;17.6.2008.;2008-06-17;1f;1;Linyphiidae;Troglohyphantes;croaticus;Troglohyphantes croaticus;;45.27146;15.28981;Tb;deep cave;45.2714615.28981;3;;;;;;;;;;;;;;;;;;;;;;
312;Jama na rubu;Croatia;16.6.2008.;2008-06-16;1m;1;Anapidae;Comaroma;simoni;Comaroma simoni;;45.324782;15.284649;tf;deep cave;45.32478215.284649;3;;;;;;;;;;;;;;;;;;;;;;
314;Jama na Solinskom vrhu;Croatia;23.6.2008.;2008-06-23;1m, 2 juv;3;Linyphiidae;Troglohyphantes;excavatus;Troglohyphantes excavatus;;45.359492;15.313756;tf;deep cave;45.35949215.313756;1;;;;;;;;;;;;;;;;;;;;;;
316;Špilja u kanjonu Dobre ispod Podjakši?a;Croatia;20.6.2008.;2008-06-20;1f, 1juv;2;Nesticidae;Nesticus;cellulanus;Nesticus cellulanus;473;45.348914;15.340795;tf;deep cave;45.34891415.340795;1;;;;;;;;;;;;;;;;;;;;;;
317;Guge?ka špilja;Croatia;17.6.2008.;2008-06-17;1f;1;Nesticidae;Kryptonesticus;eremita;Kryptonesticus eremita;265;45.270615;15.30004;tf;deep cave;45.27061515.30004;1;;;;;;;;;;;;;;;;;;;;;;
319;Jama na rubu;Croatia;16.6.2008.;2008-06-16;1f, 1 juv;2;Nesticidae;Nesticus;cellulanus;Nesticus cellulanus;214;45.324782;15.284649;tf;deep cave;45.32478215.284649;3;;;;;;;;;;;;;;;;;;;;;;
320;Jama na rubu;Croatia;16.6.2008.;2008-06-16;1f;1;Linyphiidae;Porrhomma;egeria;Porrhomma egeria;214;45.324782;15.284649;Tf;deep cave;45.32478215.284649;3;;;;;;;;;;;;;;;;;;;;;;
321;Pave?a špilja;Croatia;18.6.2008.;2008-06-18;1 m;1;Linyphiidae;Troglohyphantes;excavatus;Troglohyphantes excavatus;180;45.353264;15.317461;tf;deep cave;45.35326415.317461;2;;;;;;;;;;;;;;;;;;;;;;
322;Jama kod Kasuni?a;Croatia;20.6.2008.;2008-06-20;3f, 1juv;4;Linyphiidae;Troglohyphantes;excavatus;Troglohyphantes excavatus;223;45.353478;15.312285;tf;deep cave;45.35347815.312285;2;;;;;;;;;;;;;;;;;;;;;;
323;Jama na rubu;Croatia;16.6.2008.;2008-06-16;1m;1;Nesticidae;Nesticus;cellulanus;Nesticus cellulanus;214;45.324782;15.284649;tf;deep cave;45.32478215.284649;3;;;;;;;;;;;;;;;;;;;;;;
324;Dragina pe?ina na Dobri;Croatia;18.6.2008.;2008-06-18;2m, 2juv;4;Nesticidae;Nesticus;cellulanus;Nesticus cellulanus;156;45.346751;15.290094;tf;deep cave;45.34675115.290094;4;;;;;;;;;;;;;;;;;;;;;;
325;Kuštrovka;Croatia;27.8.2008.;2008-08-27;2m, 4 f;6;Linyphiidae;Troglohyphantes;croaticus;Troglohyphantes croaticus;450;45.346234;15.219338;Tb;deep cave;45.34623415.219338;3;;;;;;;;;;;;;;;;;;;;;;
326;Kuštrovka;Croatia;27.8.2008.;2008-08-27;2f, 3juv;5;Linyphiidae;Troglohyphantes;croaticus;Troglohyphantes croaticus;450;45.346234;15.219338;Tb;deep cave;45.34623415.219338;3;;;;;;;;;;;;;;;;;;;;;;
327;Jama u kanjonu Dobre ispod Grabrka;Croatia;26.8.2008.;2008-08-26;1f;1;Linyphiidae;Troglohyphantes;excavatus;Troglohyphantes excavatus;;45.353879;15.299838;tf;deep cave;45.35387915.299838;3;;;;;;;;;;;;;;;;;;;;;;
328;Lipa na Protulipi;Croatia;24.8.2008.;2008-08-24;2f, 2m;4;Linyphiidae;Porrhomma;egeria;Porrhomma egeria;135;45.406127;15.385848;Tf;deep cave;45.40612715.385848;2;;;;;;;;;;;;;;;;;;;;;;
329;Trijama II;Croatia;23.8.2008.;2008-08-23;1m, 2f, 1juv;4;Linyphiidae;Troglohyphantes;excavatus;Troglohyphantes excavatus;;45.364356;15.315804;tf;deep cave;45.36435615.315804;2;;;;;;;;;;;;;;;;;;;;;;
332;Kuštrovka;Croatia;27.8.2008.;2008-08-27;1f, 1juv;2;Linyphiidae;Troglohyphantes;croaticus;Troglohyphantes croaticus;450;45.346234;15.219338;Tb;deep cave;45.34623415.219338;3;;;;;;;;;;;;;;;;;;;;;;
334;Kuštrovka;Croatia;27.8.2008.;2008-08-27;4f, 2juv;6;Linyphiidae;Troglohyphantes;croaticus;Troglohyphantes croaticus;450;45.346234;15.219338;Tb;deep cave;45.34623415.219338;3;;;;;;;;;;;;;;;;;;;;;;
335;Jastrebina špilja;Croatia;14.6.2008.;2008-06-14;3f;3;Linyphiidae;Porrhomma;egeria;Porrhomma egeria;187;45.456129;15.44341;Tf;deep cave;45.45612915.44341;5;;;;;;;;;;;;;;;;;;;;;;
336;Jama kod Kasuni?a;Croatia;20.6.2008.;2008-06-20;1m;1;Linyphiidae;Troglohyphantes;excavatus;Troglohyphantes excavatus;223;45.353478;15.312285;tf;deep cave;45.35347815.312285;2;;;;;;;;;;;;;;;;;;;;;;
337;Jama kod Kasuni?a;Croatia;20.6.2008.;2008-06-20;1f, 1 juv 2;2;Linyphiidae;Porrhomma;egeria;Porrhomma egeria;223;45.353478;15.312285;Tf;deep cave;45.35347815.312285;2;;;;;;;;;;;;;;;;;;;;;;
339;Danetska pe?ina;Croatia;20.6.2008.;2008-06-20;1f, 1juv;2;Linyphiidae;Troglohyphantes;excavatus;Troglohyphantes excavatus;;45.351625;15.327998;tf;deep cave;45.35162515.327998;2;;;;;;;;;;;;;;;;;;;;;;
341;Jama kod Koli?a 2;Croatia;15.6.2008.;2008-06-15;1f, 3juv;4;Linyphiidae;Troglohyphantes;croaticus;Troglohyphantes croaticus;;45.343306;15.316733;Tb;deep cave;45.34330615.316733;2;;;;;;;;;;;;;;;;;;;;;;
342;Jama kod Koli?a 2;Croatia;15.6.2008.;2008-06-15;1juv m;1;Dysderidae;Parastalita;stygia;Parastalita stygia;;45.343306;15.316733;Tb;deep cave;45.34330615.316733;2;;;;;;;;;;;;;;;;;;;;;;
343;Jama u kanjonu Dobre ispod Grabrka;Croatia;26.8.2008.;2008-08-26;1 juv;1;Dysderidae;Parastalita;stygia;Parastalita stygia;;45.353879;15.299838;Tb;deep cave;45.35387915.299838;3;;;;;;;;;;;;;;;;;;;;;;
344;Kuštrovka;Croatia;27.8.2008.;2008-08-27;1m;1;Dysderidae;Stalita;pretneri;Stalita pretneri;450;45.346234;15.219338;Tb;deep cave;45.34623415.219338;3;;;;;;;;;;;;;;;;;;;;;;
345;Kuštrovka;Croatia;27.8.2008.;2008-08-27;1m;1;Dysderidae;Parastalita;stygia;Parastalita stygia;450;45.346234;15.219338;Tb;deep cave;45.34623415.219338;3;;;;;;;;;;;;;;;;;;;;;;
346;Kuštrovka;Croatia;27.8.2008.;2008-08-27;1f, 1juv;2;Dysderidae;Stalita;pretneri;Stalita pretneri;450;45.346234;15.219338;Tb;deep cave;45.34623415.219338;3;;;;;;;;;;;;;;;;;;;;;;
347;Kuštrovka;Croatia;27.8.2008.;2008-08-27;1f;1;Dysderidae;Parastalita;stygia;Parastalita stygia;450;45.346234;15.219338;Tb;deep cave;45.34623415.219338;3;;;;;;;;;;;;;;;;;;;;;;
349;Pave?a špilja;Croatia;18.6.2008.;2008-06-18;1f;1;Linyphiidae;Porrhomma;egeria;Porrhomma egeria;180;45.353264;15.317461;Tf;deep cave;45.35326415.317461;2;;;;;;;;;;;;;;;;;;;;;;
350;Jastrebina špilja;Croatia;14.6.2008.;2008-06-14;1m;1;Linyphiidae;Porrhomma;convexum;Porrhomma convexum;187;45.456129;15.44341;Tf;deep cave;45.45612915.44341;5;;;;;;;;;;;;;;;;;;;;;;
352;Špilja u kanjonu Bistraca kod Kromara;Croatia;25.8.2008.;2008-08-25;3f, 1juv;4;Linyphiidae;Porrhomma;convexum;Porrhomma convexum;230;45.280604;15.289475;Tf;deep cave;45.28060415.289475;2;;;;;;;;;;;;;;;;;;;;;;
353;Jastrebina špilja;Croatia;14.6.2008.;2008-06-14;1f, 1juv;2;Linyphiidae;Gen.;sp. X;Gen. sp. X;187;45.456129;15.44341;;;45.45612915.44341;5;;;;;;;;;;;;;;;;;;;;;;
354;Jastrebina špilja;Croatia;14.6.2008.;2008-06-14;1m;1;Linyphiidae;Centromerus;cavernarum;Centromerus cavernarum;187;45.456129;15.44341;Tf;deep cave;45.45612915.44341;5;;;;;;;;;;;;;;;;;;;;;;
355;Lipa na Protulipi;Croatia;24.8.2008.;2008-08-24;4f, 2m, 1juv;7;Linyphiidae;Porrhomma;egeria;Porrhomma egeria;135;45.406127;15.385848;Tf;deep cave;45.40612715.385848;2;;;;;;;;;;;;;;;;;;;;;;
357;Ledenica u ?ažinki;Croatia;15.6.2008.;2008-06-15;1m;1;Thomisidae;Xysticus;lanio;Xysticus lanio;;45.342702;15.299779;Tx;deep cave;45.34270215.299779;2;;;;;;;;;;;;;;;;;;;;;;
360;Vaganka;Croatia;27.9.2008.;2008-09-27;1 juv;1;Dysderidae;Parastalita;stygia;Parastalita stygia;658;44.33853;15.43867;Tb;deep cave;44.3385315.43867;5;;;12,05;;;;;;;;;;;;;;;;;;;
361;Špilja u Lužnama;Croatia;27.9.2008.;2008-09-27;1 m;1;Dysderidae;Parastalita;stygia;Parastalita stygia;629;44.328901;15.454175;Tb;deep cave;44.32890115.454175;2;;;;;;;;;;;;;;;;;;;;;;
362;Jama Nangilija;Croatia;29.9.2008.;2008-09-29;1 juv;1;Agelenidae;Histopona;sp.;Histopona sp.;430;44.346542;15.385818;;deep cave;44.34654215.385818;1;12,2;;;;;;;;;;;;;;;;;;;;;
364;Manita pe?;Croatia;1.10.2008.;2008-10-01;1 f;1;Dysderidae;Parastalita;stygia;Parastalita stygia;520;44.314302;15.475264;Tb;deep cave;44.31430215.475264;7;;;;;;;;;;;;;;;;;;;;;;
365;Jatara špilja;Croatia;26.9.2008.;2008-09-26;1 juv;1;Agelenidae;Histopona;sp.;Histopona sp.;600;44.334974;15.446351;;deep cave;44.33497415.446351;3;;;;;;;;;;;;;;;;;;;;;;
366;Jatara špilja;Croatia;26.9.2008.;2008-09-26;1 f;1;Agelenidae;Histopona;egonpretneri;Histopona egonpretneri;600;44.334974;15.446351;Tb;deep cave;44.33497415.446351;3;;;;;;;;;;;;;;;;;;;;;;
367;Jatara špilja;Croatia;26.9.2008.;2008-09-26;1f, 1 m;2;Linyphiidae;Centromerus;cavernarum;Centromerus cavernarum;;44.334974;15.446351;Tf;deep cave;44.33497415.446351;3;;;;;;;;;;;;;;;;;;;;;;
368;Vaganka;Croatia;27.9.2008.;2008-09-27;1 juv;1;Agelenidae;Histopona;sp.;Histopona sp.;658;44.33853;15.43867;;deep cave;44.3385315.43867;5;;;12,05;;;;;;;;;;;;;;;;;;;
370;Vaganka;Croatia;27.9.2008.;2008-09-27;1f;1;Dysderidae;Mesostalita;sp. 3;Mesostalita sp. 3;658;44.33853;15.43867;Tb;deep cave;44.3385315.43867;5;;;12,05;;;;;;;;;;;;;;;;;;;
371;Vaganka;Croatia;27.9.2008.;2008-09-27;1 juv;1;Agelenidae;Histopona;sp.;Histopona sp.;658;44.33853;15.43867;;deep cave;44.3385315.43867;5;;;12,05;;;;;;;;;;;;;;;;;;;
372;Vaganka;Croatia;27.9.2008.;2008-09-27;1 f;1;Leptonetidae;Cataleptoneta;lingulata;Cataleptoneta lingulata;658;44.33853;15.43867;tb;deep cave;44.3385315.43867;5;;;12,05;;;;;;;;;;;;;;;;;;;
375;Lažnjakuša lajava;Croatia;30.9.2008.;2008-09-30;2 juv;2;Agelenidae;Histopona;sp.;Histopona sp.;654;44.333719;15.451152;;deep cave;44.33371915.451152;1;;;;;;;;;;;;;;;;;;;;;;
383;Strmoglavica;Croatia;29.9.2008.;2008-09-29;1f;1;Leptonetidae;Cataleptoneta;lingulata;Cataleptoneta lingulata;;44.346729;15.386425;tb;deep cave;44.34672915.386425;1;;;;;;;;;;;;;;;;;;;;;;
385;Špilja pod pekon;Croatia;28.9.2008.;2008-09-28;1 juv;1;Agelenidae;Histopona;sp.;Histopona sp.;731;44.337685;15.42639;;deep cave;44.33768515.42639;1;;;;;;;;;;;;;;;;;;;;;;
386;Jama pod kukom;Croatia;28.9.2008.;2008-09-28;1 f;1;Linyphiidae;Porrhomma;convexum;Porrhomma convexum;;44.346245;15.414066;;deep cave;44.34624515.414066;1;7,8;;;;;;;;;;;;;;;;;;;;;
387;Ledenica u ?ažinki;Croatia;15.6.2008.;2008-06-15;1 m;1;Linyphiidae;Troglohyphantes;croaticus;Troglohyphantes croaticus;;45.342702;15.299779;Tb;deep cave;45.34270215.299779;2;;;;;;;;;;;;;;;;;;;;;;
388;Izvor špilja Bijeli bunar;Croatia;18.7.2004.;2004-07-18;1 f;1;Linyphiidae;Porrhomma;convexum;Porrhomma convexum;;45.609794;17.536299;;deep cave;45.60979417.536299;2;11,6;;;;;;;;;;;;;;;;;;;;;
389;Izvor špilja Bijeli bunar;Croatia;18.7.2004.;2004-07-18;1 juv;1;Nesticidae;Nesticus;cellulanus;Nesticus cellulanus;;45.609794;17.536299;;deep cave;45.60979417.536299;2;11,6;;;;;;;;;;;;;;;;;;;;;
390;Kosilova jama;Croatia;15.9.2005.;2005-09-15;1m, 2 juv;3;Linyphiidae;Troglohyphantes;wiebesi;Troglohyphantes wiebesi;;44.105772;16.347082;tb;deep cave;44.10577216.347082;1;;;;;;;;;;;;;;;;;;;;;;
391;Kotluša;Croatia;13.8.2005.;2005-08-13;1 f;1;Nesticidae;Kryptonesticus;eremita;Kryptonesticus eremita;390;43.949126;16.399081;tf;deep cave;43.94912616.399081;1;11,7;;;;;;;;;;;;;;;;;;;;;
392;Gospodska špilja;Croatia;21.8.2004.;2004-08-21;1 juv;1;Nesticidae;Kryptonesticus;eremita;Kryptonesticus eremita;440;43.982279;16.432905;tf;deep cave;43.98227916.432905;1;;9,9;10,45;;;;;;;;;;;;;;;;;;;
394;Rudeli?a pe?ina;Croatia;15.8.2005.;2005-08-15;1 juv m;1;Nesticidae;Kryptonesticus;eremita;Kryptonesticus eremita;;43.970543;16.418533;tf;deep cave;43.97054316.418533;2;;;;;;;;;;;;;;;;;;;;;;
395;Rudeli?a pe?ina;Croatia;22.8.2004.;2004-08-22;1 juv m, 3 juv;4;Nesticidae;Kryptonesticus;eremita;Kryptonesticus eremita;;43.970543;16.418533;tf;deep cave;43.97054316.418533;2;;;;;;;;;;;;;;;;;;;;;;
396;Rudeli?a pe?ina;Croatia;22.8.2004.;2004-08-22;1m, 1f, 2 juv;4;Theridiidae;Episinus;cavernicola;Episinus cavernicola;;43.970543;16.418533;Tf;deep cave;43.97054316.418533;2;;;;;;;;;;;;;;;;;;;;;;
397;Budin pupak;Croatia;22.7.2003.;2003-07-22;1 f;1;Linyphiidae;Troglohyphantes;sp. 3;Troglohyphantes sp. 3;;44.739729;15.089755;tb;deep cave;44.73972915.089755;2;;;;;;;;;;;;;;;;;;;;;;
398;Vodena pe?a;Croatia;31.1.2002.;2002-01-31;1 f;1;Nesticidae;Kryptonesticus;eremita;Kryptonesticus eremita;610;43.792496;16.671447;tf;deep cave;43.79249616.671447;8;;;;;;;;;;;;;;;;;;;;;;
402;Vodena pe?a;Croatia;31.1.2002.;2002-01-31;1 f;1;Linyphiidae;Centromerus;cavernarum;Centromerus cavernarum;610;43.792496;16.671447;Tf;deep cave;43.79249616.671447;8;;;;;;;;;;;;;;;;;;;;;;
403;Vodena pe?a;Croatia;17.8.2005.;2005-08-17;1f;1;Linyphiidae;Centromerus;cavernarum;Centromerus cavernarum;610;43.792496;16.671447;Tf;deep cave;43.79249616.671447;8;;;;;;;;;;;;;;;;;;;;;;
406;Vodena pe?a;Croatia;17.8.2005.;2005-08-17;1f, 2 juv, 2 juv m;5;Nesticidae;Kryptonesticus;eremita;Kryptonesticus eremita;610;43.792496;16.671447;tf;deep cave;43.79249616.671447;8;;;;;;;;;;;;;;;;;;;;;;
407;Vodena pe?a;Croatia;17.8.2005.;2005-08-17;1 m;1;Nesticidae;Kryptonesticus;eremita;Kryptonesticus eremita;610;43.792496;16.671447;tf;deep cave;43.79249616.671447;8;;;;;;;;;;;;;;;;;;;;;;
408;Vodena pe?a;Croatia;4.2.2006.;2006-02-04;1m, 1 f;2;Nesticidae;Kryptonesticus;eremita;Kryptonesticus eremita;610;43.792496;16.671447;tf;deep cave;43.79249616.671447;8;;;;;;;;;;;;;;;;;;;;;;
410;Vodena pe?a;Croatia;4.2.2006.;2006-02-04;2 juv;2;Dysderidae;Stalagtia;sp. 4;Stalagtia sp. 4;610;43.792496;16.671447;Tb;deep cave;43.79249616.671447;8;;;;;;;;;;;;;;;;;;;;;;
411;Vodena pe?a;Croatia;4.2.2006.;2006-02-04;1 juv;1;Dysderidae;Stalagtia;sp. 4;Stalagtia sp. 4;610;43.792496;16.671447;Tb;deep cave;43.79249616.671447;8;;;;;;;;;;;;;;;;;;;;;;
412;Kravarica;Croatia;25.1.2008.;2008-01-25;1 f;1;Dysderidae;Stalagtia;sp. 4;Stalagtia sp. 4;;43.779322;16.688191;Tb;deep cave;43.77932216.688191;3;;;;;;;;;;;;;;;;;;;;;;
413;Krsta?ka jama;Croatia;22.7.2007.;2007-07-22;1m;1;Dysderidae;Harpactea;sp. 18;Harpactea sp. 18;;43.840788;16.638797;Tf;deep cave;43.84078816.638797;2;;;;;;;;;;;;;;;;;;;;;;
414;Jama na Suhom Ruminu;Croatia;27.7.2007.;2007-07-27;1m, 3 juv;4;Nesticidae;Kryptonesticus;eremita;Kryptonesticus eremita;391;43.782202;16.645051;tf;deep cave;43.78220216.645051;1;;;;;;;;;;;;;;;;;;;;;;
415;Jama na Suhom Ruminu;Croatia;28.7.2007.;2007-07-28;4 m;4;Nesticidae;Kryptonesticus;eremita;Kryptonesticus eremita;391;43.782202;16.645051;tf;deep cave;43.78220216.645051;1;;;;;;;;;;;;;;;;;;;;;;
416;Krsta?ka jama;Croatia;22.7.2007.;2007-07-22;1 m;1;Pholcidae;Pholcus;sp.;Pholcus sp.;;43.840788;16.638797;;;43.84078816.638797;2;;;;;;;;;;;;;;;;;;;;;;
420;Žablja jama;Croatia;27.6.2009.;2009-06-27;2f, 3 juv;5;Dysderidae;Stalagtia;sp. 4;Stalagtia sp. 4;;43.791308;16.666362;Tb;deep cave;43.79130816.666362;2;;;;;;;;;;;;;;;;;;;;;;
421;Žablja jama;Croatia;27.6.2009.;2009-06-27;1 juv;1;Scytodidae;Scytodes;sp.;Scytodes sp.;;43.791308;16.666362;;;43.79130816.666362;2;;;;;;;;;;;;;;;;;;;;;;
424;Jama pastirski stan;Croatia;4.8.2009.;2009-08-04;1juv;1;Dysderidae;Stalagtia;sp. 4;Stalagtia sp. 4;;43.841966;16.648348;Tb;deep cave;43.84196616.648348;1;;;;;;;;;;;;;;;;;;;;;;
425;Pti?arka;Croatia;29.6.2009.;2009-06-29;1 f;1;Linyphiidae;Porrhomma;convexum;Porrhomma convexum;;43.855242;16.622618;;deep cave;43.85524216.622618;1;;;;;;;;;;;;;;;;;;;;;;
426;Highlander;Croatia;3.8.2009.;2009-08-03;1 juv;1;Agelenidae;Tegenaria;sp.;Tegenaria sp.;927;43.845735;16.653759;;deep cave;43.84573516.653759;2;;;;;;;;;;;;;;;;;;;;;;
427;Highlander;Croatia;3.8.2009.;2009-08-03;1 m;1;Linyphiidae;Gen.;sp. X;Gen. sp. X;;43.845735;16.653759;;;43.84573516.653759;2;;;;;;;;;;;;;;;;;;;;;;
428;Gvozdenica;Croatia;13.2.2009.;2009-02-13;1f, 1 juv;2;Nesticidae;Nesticus;cellulanus;Nesticus cellulanus;200;45.299765;15.589405;tf;deep cave;45.29976515.589405;4;8,7;;;;;;;;;;;;;;;;;;;;;
429;Gvozdenica;Croatia;13.2.2009.;2009-02-13;1 m;1;Linyphiidae;Troglohyphantes;kordunlikanus;Troglohyphantes kordunlikanus;;45.299765;15.589405;tf;deep cave;45.29976515.589405;4;8,7;;;;;;;;;;;;;;;;;;;;;
430;Kuštrovka;Croatia;14.2.2009.;2009-02-14;2f;2;Linyphiidae;Troglohyphantes;croaticus;Troglohyphantes croaticus;450;45.346234;15.219338;Tb;deep cave;45.34623415.219338;3;;;;;;;;;;;;;;;;;;;;;;
431;Kuštrovka;Croatia;14.2.2009.;2009-02-14;1f;1;Linyphiidae;Troglohyphantes;croaticus;Troglohyphantes croaticus;450;45.346234;15.219338;Tb;deep cave;45.34623415.219338;3;;;;;;;;;;;;;;;;;;;;;;
433;Gvozdenica;Croatia;13.2.2009.;2009-02-13;1 f;1;Linyphiidae;Centromerus;cavernarum;Centromerus cavernarum;;45.299765;15.589405;Tf;deep cave;45.29976515.589405;4;8,7;;;;;;;;;;;;;;;;;;;;;
434;Luška špilja;Croatia;8.9.2009.;2009-09-08;1 f;1;Linyphiidae;Troglohyphantes;croaticus;Troglohyphantes croaticus;620;45.224689;15.093741;Tb;deep cave;45.22468915.093741;2;;;;;;;;;;;;;;;;;;;;;;
435;Luška špilja;Croatia;9.9.2009.;2009-09-09;1 f;1;Linyphiidae;Troglohyphantes;croaticus;Troglohyphantes croaticus;620;45.224689;15.093741;Tb;deep cave;45.22468915.093741;2;;;;;;;;;;;;;;;;;;;;;;
436;Mandelaja;Croatia;10.9.2009.;2009-09-10;2f;2;Linyphiidae;Troglohyphantes;croaticus;Troglohyphantes croaticus;340;45.233397;15.30015;Tb;deep cave;45.23339715.30015;7;;;;;;;;;;;;;;;;;;;;;;
438;?ulin ponor-Medvedica;Croatia;5.9.2009.;2009-09-05;1m, 1f;2;Linyphiidae;Porrhomma;convexum;Porrhomma convexum;320;45.267036;15.223745;Tf;deep cave;45.26703615.223745;3;;;;;;;;;;;;;;;;;;;;;;
439;?ulin ponor-Medvedica;Croatia;5.9.2009.;2009-09-05;1f;1;Linyphiidae;Porrhomma;egeria;Porrhomma egeria;320;45.267036;15.223745;Tf;deep cave;45.26703615.223745;3;;;;;;;;;;;;;;;;;;;;;;
440;Ponor Sušik;Croatia;8.9.2009.;2009-09-08;2f;2;Linyphiidae;Porrhomma;convexum;Porrhomma convexum;470;45.145514;15.538934;Tf;deep cave;45.14551415.538934;4;9,6;;;;;;;;;;;;;;;;;;;;;
441;Ponor Sušik;Croatia;8.9.2009.;2009-09-08;2f;2;Linyphiidae;Porrhomma;egeria;Porrhomma egeria;470;45.145514;15.538934;Tf;deep cave;45.14551415.538934;4;9,6;;;;;;;;;;;;;;;;;;;;;
442;Ambarac;Croatia;7.9.2009.;2009-09-07;2m, 6f;8;Linyphiidae;Porrhomma;convexum;Porrhomma convexum;;45.231783;15.306426;Tf;deep cave;45.23178315.306426;1;;;;;;;;;;;;;;;;;;;;;;
443;Tounj?ica;Croatia;15.2.2009.;2009-02-15;1f;1;Nesticidae;Nesticus;cellulanus;Nesticus cellulanus;230;45.248722;15.322408;tf;deep cave;45.24872215.322408;5;14;;;;;;;;;;;;;;;;;;;;;
444;Tounj?ica;Croatia;15.2.2009.;2009-02-15;1f;1;Linyphiidae;Troglohyphantes;croaticus;Troglohyphantes croaticus;;45.248722;15.322408;Tb;deep cave;45.24872215.322408;5;14;;;;;;;;;;;;;;;;;;;;;
445;Tounj?ica;Croatia;15.2.2009.;2009-02-15;1 m;1;Tetragnathidae;Meta;menardi;Meta menardi;;45.248722;15.322408;tf;deep cave;45.24872215.322408;5;14;;;;;;;;;;;;;;;;;;;;;
447;Vreli? špilja;Croatia;12.9.2009.;2009-09-12;1f;1;Linyphiidae;Porrhomma;egeria;Porrhomma egeria;180;45.311898;15.351451;Tf;deep cave;45.31189815.351451;3;;;;;;;;;;;;;;;;;;;;;;
448;Vidovi?a špilja;Croatia;8.9.2009.;2009-09-08;2f;2;Linyphiidae;Troglohyphantes;croaticus;Troglohyphantes croaticus;463;45.14975;15.0993;Tb;deep cave;45.1497515.0993;2;;;;;;;;;;;;;;;;;;;;;;
449;Lištrovica jama;Croatia;9.9.2009.;2009-09-09;3f, 3m;6;Linyphiidae;Troglohyphantes;croaticus;Troglohyphantes croaticus;;45.20141;15.12398;Tb;deep cave;45.2014115.12398;2;;;;;;;;;;;;;;;;;;;;;;
451;Zvone?ka II;Croatia;17.9.2009.;2009-09-17;1f;1;Dysderidae;Parastalita;stygia;Parastalita stygia;;45.531095;15.367671;Tb;deep cave;45.53109515.367671;3;;;;;;;;;;;;;;;;;;;;;;
452;Špilja pod Ma?kovom dragom;Croatia;9.9.2009.;2009-09-09;1 juv m;1;Dysderidae;Parastalita;stygia;Parastalita stygia;;45.261001;15.023822;Tb;deep cave;45.26100115.023822;1;7,4;;;;;;;;;;;;;;;;;;;;;
453;Špilja pod Ma?kovom dragom;Croatia;17.5.2009.;2009-05-17;2m;2;Dysderidae;Parastalita;stygia;Parastalita stygia;;45.261001;15.023822;Tb;deep cave;45.26100115.023822;1;7,4;;;;;;;;;;;;;;;;;;;;;
454;Rokina Bezdana;Croatia;7.9.2009.;2009-09-07;1f;1;Dysderidae;Parastalita;stygia;Parastalita stygia;;45.069717;15.192231;Tb;deep cave;45.06971715.192231;1;;;;;;;;;;;;;;;;;;;;;;
455;Luška špilja;Croatia;8.9.2009.;2009-09-08;1f;1;Dysderidae;Parastalita;stygia;Parastalita stygia;620;45.224689;15.093741;Tb;deep cave;45.22468915.093741;2;;;;;;;;;;;;;;;;;;;;;;
456;Mandelaja;Croatia;10.9.2009.;2009-09-10;1m;1;Dysderidae;Parastalita;stygia;Parastalita stygia;;45.233397;15.30015;Tb;deep cave;45.23339715.30015;7;;;;;;;;;;;;;;;;;;;;;;
457;Vidovi?a špilja;Croatia;8.9.2009.;2009-09-08;1m;1;Dysderidae;Parastalita;stygia;Parastalita stygia;;45.14975;15.0993;Tb;deep cave;45.1497515.0993;2;;;;;;;;;;;;;;;;;;;;;;
458;Vreli? špilja;Croatia;12.9.2009.;2009-09-12;1 juv;1;Dysderidae;Stalita;pretneri;Stalita pretneri;180;45.311898;15.351451;Tb;deep cave;45.31189815.351451;3;;;;;;;;;;;;;;;;;;;;;;
459;Tamnica;Croatia;12.3.2009.;2009-03-12;1m, 1f;2;Dysderidae;Parastalita;stygia;Parastalita stygia;;45.27298;15.36197;Tb;deep cave;45.2729815.36197;3;;;;;;;;;;;;;;;;;;;;;;
460;Rokina Bezdana;Croatia;7.9.2009.;2009-09-07;1m;1;Dysderidae;Parastalita;stygia;Parastalita stygia;;45.069717;15.192231;Tb;deep cave;45.06971715.192231;1;;;;;;;;;;;;;;;;;;;;;;
461;Lištrovica jama;Croatia;9.9.2009.;2009-09-09;1m, 2f;3;Dysderidae;Parastalita;stygia;Parastalita stygia;;45.20141;15.12398;Tb;deep cave;45.2014115.12398;2;;;;;;;;;;;;;;;;;;;;;;
462;Lištrovica jama;Croatia;14.6.2009.;2009-06-14;1f, 1 m;2;Dysderidae;Parastalita;stygia;Parastalita stygia;;45.20141;15.12398;Tb;deep cave;45.2014115.12398;2;;;;;;;;;;;;;;;;;;;;;;
463;Špilja pod Ma?kovom dragom;Croatia;14.6.2009.;2009-06-14;1m, 2f;3;Dysderidae;Parastalita;stygia;Parastalita stygia;;45.261001;15.023822;Tb;deep cave;45.26100115.023822;1;7,4;;;;;;;;;;;;;;;;;;;;;
464;Špilja pod Ma?kovom dragom;Croatia;14.6.2009.;2009-06-14;1m;1;Dysderidae;Parastalita;stygia;Parastalita stygia;;45.261001;15.023822;Tb;deep cave;45.26100115.023822;1;7,4;;;;;;;;;;;;;;;;;;;;;
465;Jama u kanjonu Dobre ispod Grabrka;Croatia;6.9.2009.;2009-09-06;1f;1;Dysderidae;Parastalita;stygia;Parastalita stygia;;45.353879;15.299838;Tb;deep cave;45.35387915.299838;3;;;;;;;;;;;;;;;;;;;;;;
467;Hajdu?ka pe?ina;Croatia;10.5.2009.;2009-05-10;1 juv;1;Dysderidae;Stalita;pretneri;Stalita pretneri;;45.27146;15.28981;Tb;deep cave;45.2714615.28981;3;;;;;;;;;;;;;;;;;;;;;;
468;Trijama II;Croatia;24.5.2009.;2009-05-24;1 juv m;1;Dysderidae;Stalita;pretneri;Stalita pretneri;;45.364356;15.315804;Tb;deep cave;45.36435615.315804;2;;;;;;;;;;;;;;;;;;;;;;
469;Trijama II;Croatia;24.5.2009.;2009-05-24;2f, 2 juv;4;Linyphiidae;Troglohyphantes;excavatus;Troglohyphantes excavatus;;45.364356;15.315804;tf;deep cave;45.36435615.315804;2;;;;;;;;;;;;;;;;;;;;;;
470;Dragina pe?ina na Dobri;Croatia;3.10.2009.;2009-10-03;1m, 2f;3;Nesticidae;Nesticus;cellulanus;Nesticus cellulanus;156;45.346751;15.290094;tf;deep cave;45.34675115.290094;4;;;;;;;;;;;;;;;;;;;;;;
471;Izvor špilja kod Trošmarije;Croatia;10.5.2009.;2009-05-10;1m, 2 juv;3;Nesticidae;Nesticus;cellulanus;Nesticus cellulanus;175;45.318215;15.272614;tf;deep cave;45.31821515.272614;1;;;;;;;;;;;;;;;;;;;;;;
473;Hajdu?ka pe?ina;Croatia;10.5.2009.;2009-05-10;1f;1;Linyphiidae;Troglohyphantes;croaticus;Troglohyphantes croaticus;;45.27146;15.28981;Tb;deep cave;45.2714615.28981;3;;;;;;;;;;;;;;;;;;;;;;
474;Kuštrovka;Croatia;12.5.2009.;2009-05-12;2m, 4f, 2juv;8;Linyphiidae;Troglohyphantes;croaticus;Troglohyphantes croaticus;450;45.346234;15.219338;Tb;deep cave;45.34623415.219338;3;;;;;;;;;;;;;;;;;;;;;;
475;Kuštrovka;Croatia;12.5.2009.;2009-05-12;2f;2;Dysderidae;Stalita;pretneri;Stalita pretneri;450;45.346234;15.219338;Tb;deep cave;45.34623415.219338;3;;;;;;;;;;;;;;;;;;;;;;
477;Hajdu?ka pe?ina;Croatia;13.5.2009.;2009-05-13;1f;1;Linyphiidae;Troglohyphantes;croaticus;Troglohyphantes croaticus;;45.27146;15.28981;Tb;deep cave;45.2714615.28981;3;;;;;;;;;;;;;;;;;;;;;;
478;Jama kod Koli?a 2;Croatia;13.5.2009.;2009-05-13;1f;1;Linyphiidae;Troglohyphantes;croaticus;Troglohyphantes croaticus;;45.343306;15.316733;Tb;deep cave;45.34330615.316733;2;;;;;;;;;;;;;;;;;;;;;;
479;Jama 3;Croatia;14.5.2009.;2009-05-14;2m, 2f;4;Linyphiidae;Porrhomma;egeria;Porrhomma egeria;335;45.346666;15.242214;Tf;deep cave;45.34666615.242214;2;;;;;;;;;;;;;;;;;;;;;;
480;Jama 3;Croatia;14.5.2009.;2009-05-14;1f, 1m, 3juv;5;Linyphiidae;Troglohyphantes;croaticus;Troglohyphantes croaticus;335;45.346666;15.242214;Tb;deep cave;45.34666615.242214;2;;;;;;;;;;;;;;;;;;;;;;
481;Pe?ina pod Pe?anima;Croatia;13.5.2009.;2009-05-13;1f;1;Linyphiidae;Troglohyphantes;kordunlikanus;Troglohyphantes kordunlikanus;;45.350909;15.326449;tf;deep cave;45.35090915.326449;2;;;;;;;;;;;;;;;;;;;;;;
482;Jama kod Koli?a 2;Croatia;9.5.2009.;2009-05-09;2f, 1 juv m;3;Linyphiidae;Troglohyphantes;croaticus;Troglohyphantes croaticus;;45.343306;15.316733;Tb;deep cave;45.34330615.316733;2;;;;;;;;;;;;;;;;;;;;;;
484;Jama kod Koli?a 2;Croatia;13.5.2009.;2009-05-13;2m, 2f, 3 juv;7;Linyphiidae;Troglohyphantes;croaticus;Troglohyphantes croaticus;;45.343306;15.316733;Tb;deep cave;45.34330615.316733;2;;;;;;;;;;;;;;;;;;;;;;
485;Vodena jama;Croatia;10.5.2009.;2009-05-10;1f;1;Linyphiidae;Troglohyphantes;excavatus;Troglohyphantes excavatus;;45.33849;15.326748;tf;deep cave;45.3384915.326748;2;;;;;;;;;;;;;;;;;;;;;;
486;Vodena jama;Croatia;9.5.2009.;2009-05-09;1m;1;Linyphiidae;Troglohyphantes;excavatus;Troglohyphantes excavatus;;45.33849;15.326748;tf;deep cave;45.3384915.326748;2;;;;;;;;;;;;;;;;;;;;;;
487;Jama u kanjonu Dobre ispod Grabrka;Croatia;24.5.2009.;2009-05-24;1f;1;Linyphiidae;Troglohyphantes;excavatus;Troglohyphantes excavatus;;45.353879;15.299838;tf;deep cave;45.35387915.299838;3;;;;;;;;;;;;;;;;;;;;;;
488;Vreli? špilja;Croatia;11.5.2009.;2009-05-11;1f;1;Linyphiidae;Troglohyphantes;kordunlikanus;Troglohyphantes kordunlikanus;180;45.311898;15.351451;tf;deep cave;45.31189815.351451;3;;;;;;;;;;;;;;;;;;;;;;
489;Pe?ina pod Pe?anima;Croatia;13.5.2009.;2009-05-13;1f;1;Linyphiidae;Troglohyphantes;croaticus;Troglohyphantes croaticus;;45.350909;15.326449;Tb;deep cave;45.35090915.326449;2;;;;;;;;;;;;;;;;;;;;;;
490;Sušica ponor;Croatia;11.5.2009.;2009-05-11;1f;1;Linyphiidae;Porrhomma;convexum;Porrhomma convexum;;45.3156;15.344255;Tf;deep cave;45.315615.344255;2;;;;;;;;;;;;;;;;;;;;;;
491;Jama u kanjonu Dobre ispod Grabrka;Croatia;12.5.2009.;2009-05-12;1f;1;Linyphiidae;Troglohyphantes;excavatus;Troglohyphantes excavatus;;45.353879;15.299838;tf;deep cave;45.35387915.299838;3;;;;;;;;;;;;;;;;;;;;;;
492;Sušica ponor;Croatia;11.5.2009.;2009-05-11;1f;1;Linyphiidae;Porrhomma;convexum;Porrhomma convexum;;45.3156;15.344255;Tf;deep cave;45.315615.344255;2;;;;;;;;;;;;;;;;;;;;;;
493;Vreli? špilja;Croatia;11.5.2009.;2009-05-11;1m;1;Linyphiidae;Porrhomma;egeria;Porrhomma egeria;180;45.311898;15.351451;Tf;deep cave;45.31189815.351451;3;;;;;;;;;;;;;;;;;;;;;;
495;Trijama II;Croatia;23.8.2009.;2009-08-23;1m, 1juv m;2;Linyphiidae;Troglohyphantes;excavatus;Troglohyphantes excavatus;;45.364356;15.315804;tf;deep cave;45.36435615.315804;2;;;;;;;;;;;;;;;;;;;;;;
498;Trijama II;Croatia;12.5.2009.;2009-05-12;1m, 4 juv;5;Linyphiidae;Troglohyphantes;excavatus;Troglohyphantes excavatus;;45.364356;15.315804;tf;deep cave;45.36435615.315804;2;;;;;;;;;;;;;;;;;;;;;;
499;Jama na Bertiji 1;Croatia;14.5.2009.;2009-05-14;1m, 2 juv;3;Linyphiidae;Troglohyphantes;croaticus;Troglohyphantes croaticus;;45.347083;15.249043;Tb;deep cave;45.34708315.249043;1;;;;;;;;;;;;;;;;;;;;;;
500;Sušica ponor;Croatia;11.5.2009.;2009-05-11;1m;1;Linyphiidae;Porrhomma;convexum;Porrhomma convexum;;45.3156;15.344255;Tf;deep cave;45.315615.344255;2;;;;;;;;;;;;;;;;;;;;;;
501;Jama na Bertiji 2;Croatia;14.5.2009.;2009-05-14;2f;2;Linyphiidae;Troglohyphantes;croaticus;Troglohyphantes croaticus;;45.347147;15.248737;Tb;deep cave;45.34714715.248737;1;;;;;;;;;;;;;;;;;;;;;;
502;Jama na Bertiji 2;Croatia;14.5.2009.;2009-05-14;2f;2;Linyphiidae;Troglohyphantes;croaticus;Troglohyphantes croaticus;;45.347147;15.248737;Tb;deep cave;45.34714715.248737;1;;;;;;;;;;;;;;;;;;;;;;
503;Šutova?ka špilja;Croatia;10.5.2009.;2009-05-10;4f;4;Linyphiidae;Troglohyphantes;croaticus;Troglohyphantes croaticus;;45.313742;15.269264;Tb;deep cave;45.31374215.269264;1;;;;;;;;;;;;;;;;;;;;;;
504;Sušica ponor;Croatia;11.5.2009.;2009-05-11;4f, 1m, 1juv;6;Linyphiidae;Porrhomma;convexum;Porrhomma convexum;;45.3156;15.344255;Tf;deep cave;45.315615.344255;2;;;;;;;;;;;;;;;;;;;;;;
505;Sušica ponor;Croatia;11.5.2009.;2009-05-11;2f;2;Linyphiidae;Troglohyphantes;excavatus;Troglohyphantes excavatus;;45.3156;15.344255;tf;deep cave;45.315615.344255;2;;;;;;;;;;;;;;;;;;;;;;
506;Lipa na Protulipi;Croatia;24.5.2009.;2009-05-24;1m;1;Nesticidae;Nesticus;cellulanus;Nesticus cellulanus;135;45.406127;15.385848;tf;deep cave;45.40612715.385848;2;;;;;;;;;;;;;;;;;;;;;;
508;Vodena jama;Croatia;9.5.2009.;2009-05-09;1m;1;Hahniidae;Gen. 1;sp. 1;Gen. 1 sp. 1;;45.33849;15.326748;;;45.3384915.326748;2;;;;;;;;;;;;;;;;;;;;;;
510;Vilina špilja-Izvor Omble;Croatia;22.6.2009.;2009-06-22;1juv? Osušen;1;Dysderidae;Stalagtia;sp. 2;Stalagtia sp. 2;137;42.67716;18.136236;Tb;deep cave;42.6771618.136236;5;;;14,2;;;;;;;;;;;;;;;;;;;
513;Vilinska špilja;Croatia;23.6.2009.;2009-06-23;1juv;1;Dysderidae;Stalagtia;hercegovinensis;Stalagtia hercegovinensis;;42.797852;17.922663;Tb;deep cave;42.79785217.922663;2;;;;;;;;;;;;;;;;;;;;;;
514;Vilina špilja-Izvor Omble;Croatia;22.6.2009.;2009-06-22;4f, 4 juv;8;Leptonetidae;Sulcia;sp. 2;Sulcia sp. 2;137;42.67716;18.136236;Tb;deep cave;42.6771618.136236;5;;;14,2;;;;;;;;;;;;;;;;;;;
515;Vilina špilja-Izvor Omble;Croatia;22.6.2009.;2009-06-22;1 juv;1;Agelenidae;Histopona;sp.;Histopona sp.;137;42.67716;18.136236;;deep cave;42.6771618.136236;5;;;14,2;;;;;;;;;;;;;;;;;;;
516;Vilina špilja-Izvor Omble;Croatia;22.6.2009.;2009-06-22;1 juv;1;Dysderidae;Stalagtia;sp. 2;Stalagtia sp. 2;137;42.67716;18.136236;Tb;deep cave;42.6771618.136236;5;;;14,2;;;;;;;;;;;;;;;;;;;
517;Vilina špilja-Izvor Omble;Croatia;22.6.2009.;2009-06-22;4f, 2m, 2 juv;8;Leptonetidae;Sulcia;sp. 2;Sulcia sp. 2;137;42.67716;18.136236;Tb;deep cave;42.6771618.136236;5;;;14,2;;;;;;;;;;;;;;;;;;;
518;Vilina špilja-Izvor Omble;Croatia;22.6.2009.;2009-06-22;3 juv;3;Agelenidae;Histopona;sp.;Histopona sp.;137;42.67716;18.136236;;deep cave;42.6771618.136236;5;;;14,2;;;;;;;;;;;;;;;;;;;
519;Kukova pe?;Croatia;8.10.2009.;2009-10-08;2 juv;2;Agelenidae;Histopona;sp.;Histopona sp.;274;42.726992;17.96566;;deep cave;42.72699217.96566;5;;17;16,62;;;;;;;;;;;;;;;;;;;
520;Kukova pe?;Croatia;8.10.2009.;2009-10-08;1f, 1m;2;Linyphiidae;Agyneta;sp.;Agyneta sp.;;42.726992;17.96566;;;42.72699217.96566;5;;17;16,62;;;;;;;;;;;;;;;;;;;
521;Kukova pe?;Croatia;8.10.2009.;2009-10-08;1m, 4 juv/f;5;Dysderidae;Stalagtia;hercegovinensis;Stalagtia hercegovinensis;;42.726992;17.96566;Tb;deep cave;42.72699217.96566;5;;17;16,62;;;;;;;;;;;;;;;;;;;
522;Špilja za Groma?kom vlakom;Croatia;6.9.2006.;2006-09-06;1juv m, 2 juv;3;Dysderidae;Stalagtia;hercegovinensis;Stalagtia hercegovinensis;605;42.743509;18.027359;Tb;deep cave;42.74350918.027359;15;;;13,63043478;;;;;;;;;;;;;;;;;;;
523;Špilja za Groma?kom vlakom;Croatia;6.9.2006.;2006-09-06;1 juv;1;Agelenidae;Histopona;sp.;Histopona sp.;605;42.743509;18.027359;;deep cave;42.74350918.027359;15;;;13,63043478;;;;;;;;;;;;;;;;;;;
524;Jama pod Sinji kuk;Croatia;10.10.2009.;2009-10-10;3m, 1f, 1 juv;5;Leptonetidae;Gen. 1;sp. 1;Gen. 1 sp. 1;295;42.709828;17.988632;Tb;deep cave;42.70982817.988632;5;16,2;;;;;;;;;;;;;;;;;;;;;
525;Jama pod Sinji kuk;Croatia;10.10.2009.;2009-10-10;1f;1;Dysderidae;Stalagtia;hercegovinensis;Stalagtia hercegovinensis;;42.709828;17.988632;Tb;deep cave;42.70982817.988632;5;16,2;;;;;;;;;;;;;;;;;;;;;
526;Špilja na vrh Kr?evina;Croatia;9.10.2009.;2009-10-09;1 juv;1;Dysderidae;Stalagtia;hercegovinensis;Stalagtia hercegovinensis;;42.717692;18.006249;Tb;deep cave;42.71769218.006249;2;;16,5;17,6;;;;;;;;;;;;;;;;;;;
527;Špilja ispod Krsta;Croatia;6.10.2009.;2009-10-06;2 juv;2;Nesticidae;Kryptonesticus;eremita;Kryptonesticus eremita;;42.677813;18.063701;;deep cave;42.67781318.063701;2;;;;;;;;;;;;;;;;;;;;;;
528;Špilja ispod Krsta;Croatia;6.10.2009.;2009-10-06;1 juv;1;Dysderidae;Stalagtia;sp. 2;Stalagtia sp. 2;;42.677813;18.063701;Tb;deep cave;42.67781318.063701;2;;;;;;;;;;;;;;;;;;;;;;
529;Špilja na vrh Kr?evina;Croatia;9.10.2009.;2009-10-09;1 juv;1;Nesticidae;Kryptonesticus;eremita;Kryptonesticus eremita;;42.717692;18.006249;;deep cave;42.71769218.006249;2;;16,5;17,6;;;;;;;;;;;;;;;;;;;
530;Špilja na vrh Kr?evina;Croatia;9.10.2009.;2009-10-09;1f, 2juv;3;Dysderidae;Stalagtia;hercegovinensis;Stalagtia hercegovinensis;;42.717692;18.006249;Tb;deep cave;42.71769218.006249;2;;16,5;17,6;;;;;;;;;;;;;;;;;;;
531;Vitkova?a jama;Croatia;25.6.2009.;2009-06-25;1 juv;1;Dysderidae;Stalagtia;hercegovinensis;Stalagtia hercegovinensis;;42.752378;17.94736;Tb;deep cave;42.75237817.94736;1;;;;;;;;;;;;;;;;;;;;;;
533;Kukova pe?;Croatia;7.10.2009.;2009-10-07;1 juv;1;Agelenidae;Histopona;sp.;Histopona sp.;;42.726992;17.96566;;deep cave;42.72699217.96566;5;;17;16,62;;;;;;;;;;;;;;;;;;;
534;Kukova pe?;Croatia;7.10.2009.;2009-10-07;1f, 1juv m;2;Linyphiidae;Agyneta;sp.;Agyneta sp.;;42.726992;17.96566;;;42.72699217.96566;5;;17;16,62;;;;;;;;;;;;;;;;;;;
535;Pasja jama, Brse?ine;Croatia;7.10.2009.;2009-10-07;1?;;Orthognatha;Gen.;sp.;Gen. sp.;;42.731152;17.965877;;;42.73115217.965877;4;;;;;;;;;;;;;;;;;;;;;;
536;Pasja jama, Brse?ine;Croatia;7.10.2009.;2009-10-07;3 juv;3;Dysderidae;Stalagtia;hercegovinensis;Stalagtia hercegovinensis;;42.731152;17.965877;Tb;deep cave;42.73115217.965877;4;;;;;;;;;;;;;;;;;;;;;;
538;Pasja jama, Brse?ine;Croatia;7.10.2009.;2009-10-07;2f;2;Linyphiidae;Gen.;sp. X;Gen. sp. X;;42.731152;17.965877;;;42.73115217.965877;4;;;;;;;;;;;;;;;;;;;;;;
539;Pasja jama, Brse?ine;Croatia;7.10.2009.;2009-10-07;1 juv;1;Dysderidae;Dysdera;sp.;Dysdera sp.;;42.731152;17.965877;Tx;;42.73115217.965877;4;;;;;;;;;;;;;;;;;;;;;;
540;Zadiljke jama;Croatia;4.10.2009.;2009-10-04;1f;1;Linyphiidae;Troglohyphantes;hadzii;Troglohyphantes hadzii;;42.768482;17.96906;tf;deep cave;42.76848217.96906;1;;;;;;;;;;;;;;;;;;;;;;
542;Sumpora?a velika;Croatia;7.10.2009.;2009-10-07;2 juv;2;Nesticidae;Kryptonesticus;eremita;Kryptonesticus eremita;;42.673168;18.089354;tf;deep cave;42.67316818.089354;5;;;;;;;;;;;;;;;;;;;;;;
543;Sumpora?a velika;Croatia;7.10.2009.;2009-10-07;1 juv;1;Pholcidae;Pholcus;sp.;Pholcus sp.;;42.673168;18.089354;;;42.67316818.089354;5;;;;;;;;;;;;;;;;;;;;;;
544;Jama na Zovi do;Croatia;4.10.2009.;2009-10-04;1 juv;1;Pholcidae;Pholcus;sp.;Pholcus sp.;;42.758221;17.97901;;;42.75822117.97901;3;;;;;;;;;;;;;;;;;;;;;;
545;Jama na Zovi do;Croatia;4.10.2009.;2009-10-04;1m, 3f, 2 juv;6;Linyphiidae;Troglohyphantes;hadzii;Troglohyphantes hadzii;;42.758221;17.97901;tf;deep cave;42.75822117.97901;3;;;;;;;;;;;;;;;;;;;;;;
546;Jama na Zovi do;Croatia;4.10.2009.;2009-10-04;2f, 1m;3;Linyphiidae;Gen.;sp. X;Gen. sp. X;;42.758221;17.97901;;;42.75822117.97901;3;;;;;;;;;;;;;;;;;;;;;;
547;Pasja jama, Brse?ine;Croatia;7.10.2009.;2009-10-07;1m;1;Linyphiidae;Asthenargus;bracianus;Asthenargus bracianus;;42.731152;17.965877;tf;deep cave;42.73115217.965877;4;;;;;;;;;;;;;;;;;;;;;;
548;Zvone?ka II;Croatia;19.3.2009.;2009-03-19;1 m;1;Dysderidae;Parastalita;stygia;Parastalita stygia;;45.531095;15.367671;Tb;deep cave;45.53109515.367671;3;;;;;;;;;;;;;;;;;;;;;;
549;?ot jama;Croatia;6.6.2009.;2009-06-06;1 m;1;Dysderidae;Parastalita;stygia;Parastalita stygia;;45.536515;15.338202;Tb;deep cave;45.53651515.338202;3;;;;;;;;;;;;;;;;;;;;;;
550;Zvone?ka II;Croatia;19.3.2009.;2009-03-19;3 juv;3;Dysderidae;Parastalita;stygia;Parastalita stygia;;45.531095;15.367671;Tb;deep cave;45.53109515.367671;3;;;;;;;;;;;;;;;;;;;;;;
551;Zvone?ka II;Croatia;6.6.2009.;2009-06-06;3m, 1 juv;4;Dysderidae;Parastalita;stygia;Parastalita stygia;;45.531095;15.367671;Tb;deep cave;45.53109515.367671;3;;;;;;;;;;;;;;;;;;;;;;
552;Riobamba jama;Croatia;21.3.2009.;2009-03-21;2f, 1 juv;3;Nesticidae;Kryptonesticus;eremita;Kryptonesticus eremita;;45.64562;15.421545;Tf;deep cave;45.6456215.421545;2;;;;;;;;;;;;;;;;;;;;;;
553;Špilja pokraj Kozja?e;Croatia;17.9.2009.;2009-09-17;1 m;1;Linyphiidae;Porrhomma;microps;Porrhomma microps;145;45.638885;15.394546;Tf;deep cave;45.63888515.394546;1;;;;;;;;;;;;;;;;;;;;;;
555;Vrlovka;Croatia;17.3.2009.;2009-03-17;1m, 1 juvf, 1juv;3;Linyphiidae;Troglohyphantes;excavatus;Troglohyphantes excavatus;;45.63707;15.390544;tf;deep cave;45.6370715.390544;2;;;;;;;;;;;;;;;;;;;;;;
556;?ot jama;Croatia;6.6.2009.;2009-06-06;1 juv;1;Dysderidae;Stalita;pretneri;Stalita pretneri;;45.536515;15.338202;Tb;deep cave;45.53651515.338202;3;;;;;;;;;;;;;;;;;;;;;;
557;?ot jama;Croatia;6.6.2009.;2009-06-06;1 f;1;Linyphiidae;Troglohyphantes;excavatus;Troglohyphantes excavatus;;45.536515;15.338202;tf;deep cave;45.53651515.338202;3;;;;;;;;;;;;;;;;;;;;;;
562;K`U?ka;Croatia;23.4.2009.;2009-04-23;1 juv m;1;Dysderidae;Stalita;taenaria;Stalita taenaria;1100;45.303353;14.210369;Tb;deep cave;45.30335314.210369;3;;;;;;;;;;;;;;;;;;;;;;
563;Borušnjak 3;Croatia;25.6.2009.;2009-06-25;1 juv;1;Dysderidae;Stalita;taenaria;Stalita taenaria;;45.375119;14.180968;Tb;deep cave;45.37511914.180968;1;;;;;;;;;;;;;;;;;;;;;;
564;Jama pod Velikim Knezgradom;Croatia;28.6.2009.;2009-06-28;1 juv;1;Dysderidae;Stalita;taenaria;Stalita taenaria;;45.28092;14.249305;Tb;deep cave;45.2809214.249305;2;;;;;;;;;;;;;;;;;;;;;;
565;Jama pod Križ;Croatia;27.6.2009.;2009-06-27;2f;2;Linyphiidae;Troglohyphantes;brignolii;Troglohyphantes brignolii;;45.374314;14.113041;Tb;deep cave;45.37431414.113041;1;;;;;;;;;;;;;;;;;;;;;;
567;Borušnjak 1;Croatia;25.6.2009.;2009-06-25;1m;1;Linyphiidae;Troglohyphantes;brignolii;Troglohyphantes brignolii;;45.370735;14.186981;Tb;deep cave;45.37073514.186981;1;;;;;;;;;;;;;;;;;;;;;;
568;Pe?ina kod planinarske ku?e Pavlovac;Croatia;20.9.2008.;2008-09-20;2m;2;Linyphiidae;Troglohyphantes;brignolii;Troglohyphantes brignolii;;45.371352;14.191845;Tb;deep cave;45.37135214.191845;1;;;;;;;;;;;;;;;;;;;;;;
569;ZV-1;Croatia;24.4.2009.;2009-04-24;4f, 2m;6;Linyphiidae;Troglohyphantes;brignolii;Troglohyphantes brignolii;;45.352478;14.253225;Tb;deep cave;45.35247814.253225;2;;;;;;;;;;;;;;;;;;;;;;
570;ZV-1;Croatia;24.4.2009.;2009-04-24;1m;1;Linyphiidae;Tenuiphantes;cristatus;Tenuiphantes cristatus;;45.352478;14.253225;SubTf?;;45.35247814.253225;2;;;;;;;;;;;;;;;;;;;;;;
572;Jama u Debelom bregu;Croatia;25.4.2009.;2009-04-25;1f, 1m;2;Linyphiidae;Troglohyphantes;brignolii;Troglohyphantes brignolii;;45.358239;14.25243;Tb;deep cave;45.35823914.25243;1;;;;;;;;;;;;;;;;;;;;;;
573;Borušnjak 1;Croatia;25.6.2009.;2009-06-25;1f;1;Linyphiidae;Troglohyphantes;brignolii;Troglohyphantes brignolii;;45.370735;14.186981;Tb;deep cave;45.37073514.186981;1;;;;;;;;;;;;;;;;;;;;;;
574;Jama pod Velikim Knezgradom;Croatia;28.6.2009.;2009-06-28;3f;3;Linyphiidae;Troglohyphantes;brignolii;Troglohyphantes brignolii;;45.28092;14.249305;Tb;deep cave;45.2809214.249305;2;;;;;;;;;;;;;;;;;;;;;;
575;Špilja iznad Velikog Bresta;Croatia;20.9.2009.;2009-09-20;5f, 1juv f;6;Linyphiidae;Troglohyphantes;brignolii;Troglohyphantes brignolii;743;45.429588;14.095256;tb;deep cave;45.42958814.095256;3;;;;;;;;;;;;;;;;;;;;;;
576;Borušnjak 2;Croatia;25.6.2009.;2009-06-25;2f, 2juv;4;Linyphiidae;Troglohyphantes;brignolii;Troglohyphantes brignolii;;45.374948;14.180971;Tb;deep cave;45.37494814.180971;1;;;;;;;;;;;;;;;;;;;;;;
578;Jama u Debelom bregu;Croatia;25.4.2009.;2009-04-25;1f, 1juv m;2;Linyphiidae;Troglohyphantes;brignolii;Troglohyphantes brignolii;;45.358239;14.25243;Tb;deep cave;45.35823914.25243;1;;;;;;;;;;;;;;;;;;;;;;
579;Jama na Mahencu 1;Croatia;22.4.2009.;2009-04-22;1f, 1m, 7juv;9;Linyphiidae;Troglohyphantes;brignolii;Troglohyphantes brignolii;;45.348186;14.239877;Tb;deep cave;45.34818614.239877;1;;;;;;;;;;;;;;;;;;;;;;
580;Jame na Zaluki;Croatia;22.4.2009.;2009-04-22;1m;1;Linyphiidae;Troglohyphantes;brignolii;Troglohyphantes brignolii;;45.34416;14.235222;Tb;deep cave;45.3441614.235222;2;;;;;;;;;;;;;;;;;;;;;;
581;Jama na Mahencu 2;Croatia;22.4.2009.;2009-04-22;1f;1;Cheiracanthiidae;Gen.;sp.;Gen. sp.;890;45.348335;14.23389;SubTf?;;45.34833514.23389;4;;;;;;;;;;;;;;;;;;;;;;
582;Pe?ina kod sela Puhari;Croatia;21.4.2009.;2009-04-21;1f, 1juv m;2;Linyphiidae;Troglohyphantes;excavatus;Troglohyphantes excavatus;;45.328896;14.256583;Tf;deep cave;45.32889614.256583;2;;;;;;;;;;;;;;;;;;;;;;
583;Pe?ina kod sela Puhari;Croatia;21.4.2009.;2009-04-21;1f, 1juv f;2;Linyphiidae;Troglohyphantes;liburnicus;Troglohyphantes liburnicus;;45.328896;14.256583;Tb;deep cave;45.32889614.256583;2;;;;;;;;;;;;;;;;;;;;;;
585;Pe?ina kod planinarske ku?e Pavlovac;Croatia;20.6.2009.;2009-06-20;1f;1;Linyphiidae;Troglohyphantes;brignolii;Troglohyphantes brignolii;;45.371352;14.191845;Tb;deep cave;45.37135214.191845;1;;;;;;;;;;;;;;;;;;;;;;
586;Druška pe?;Croatia;24.4.2009.;2009-04-24;1m, 1juv m;2;Nesticidae;Kryptonesticus;eremita;Kryptonesticus eremita;;45.249486;14.231421;Tf;deep cave;45.24948614.231421;2;;;;;;;;;;;;;;;;;;;;;;
587;Borušnjak 1;Croatia;25.6.2009.;2009-06-25;1m, 2juv m;3;Linyphiidae;Troglohyphantes;brignolii;Troglohyphantes brignolii;;45.370735;14.186981;Tb;deep cave;45.37073514.186981;1;;;;;;;;;;;;;;;;;;;;;;
589;Jama na Mahencu 2;Croatia;22.4.2009.;2009-04-22;2f, 1juv;3;Linyphiidae;Troglohyphantes;brignolii;Troglohyphantes brignolii;;45.348335;14.23389;Tb;deep cave;45.34833514.23389;4;;;;;;;;;;;;;;;;;;;;;;
590;K`U?ka;Croatia;23.4.2009.;2009-04-23;1f juv;1;Linyphiidae;Troglohyphantes;brignolii;Troglohyphantes brignolii;;45.303353;14.210369;Tf;deep cave;45.30335314.210369;3;;;;;;;;;;;;;;;;;;;;;;
591;K`U?ka;Croatia;23.4.2009.;2009-04-23;1f;1;Agelenidae;Histopona;luxurians;Histopona luxurians;;45.303353;14.210369;tf;deep cave;45.30335314.210369;3;;;;;;;;;;;;;;;;;;;;;;
592;Borušnjak 2;Croatia;25.6.2009.;2009-06-25;1m, 2f;3;Linyphiidae;Troglohyphantes;brignolii;Troglohyphantes brignolii;;45.374948;14.180971;Tb;deep cave;45.37494814.180971;1;;;;;;;;;;;;;;;;;;;;;;
593;ZV-1;Croatia;24.4.2009.;2009-04-24;1m, 1f, 1juv;3;Linyphiidae;Troglohyphantes;brignolii;Troglohyphantes brignolii;;45.352478;14.253225;Tb;deep cave;45.35247814.253225;2;;;;;;;;;;;;;;;;;;;;;;
594;Druška pe?;Croatia;24.4.2009.;2009-04-24;1 juv;1;Pholcidae;Pholcus;sp.;Pholcus sp.;;45.249486;14.231421;Tf;;45.24948614.231421;2;;;;;;;;;;;;;;;;;;;;;;
595;Jama u Vetvi;Croatia;26.4.2009.;2009-04-26;1m;1;Dysderidae;Dysdera;adriatica;Dysdera adriatica;;45.332148;14.240733;Tx;;45.33214814.240733;3;;;;;;;;;;;;;;;;;;;;;;
598;Pe?ina pod Brložnikom;Croatia;13.9.2008.;2008-09-13;1f, 1juv;2;Linyphiidae;Troglohyphantes;brignolii;Troglohyphantes brignolii;;45.336603;14.227302;Tb;deep cave;45.33660314.227302;1;;;;;;;;;;;;;;;;;;;;;;
599;Proljetna jama;Croatia;28.6.2009.;2009-06-28;1f, 1juv m;2;Linyphiidae;Troglohyphantes;liburnicus;Troglohyphantes liburnicus;;45.284901;14.24706;Tb;deep cave;45.28490114.24706;1;;;;;;;;;;;;;;;;;;;;;;
600;Jama SD 2;Croatia;24.4.2009.;2009-04-24;1f;1;Linyphiidae;Troglohyphantes;brignolii;Troglohyphantes brignolii;;45.356722;14.228408;Tb;deep cave;45.35672214.228408;1;;;;;;;;;;;;;;;;;;;;;;
601;Jama na Lipovice;Croatia;25.4.2009.;2009-04-25;1f;1;Linyphiidae;Troglohyphantes;excavatus;Troglohyphantes excavatus;940;45.368907;14.245975;Tf;deep cave;45.36890714.245975;4;;;;;;;;;;;;;;;;;;;;;;
602;Jama na Lipovice;Croatia;25.4.2009.;2009-04-25;1m, 2f, 1juv;4;Linyphiidae;Troglohyphantes;brignolii;Troglohyphantes brignolii;;45.368907;14.245975;Tb;deep cave;45.36890714.245975;4;;;;;;;;;;;;;;;;;;;;;;
603;Jama na Lipovice;Croatia;25.4.2009.;2009-04-25;1m;1;Linyphiidae;Tenuiphantes;cristatus;Tenuiphantes cristatus;;45.368907;14.245975;SubTf?;;45.36890714.245975;4;;;;;;;;;;;;;;;;;;;;;;
604;Jama pod Velikim Knezgradom;Croatia;28.6.2009.;2009-06-28;1f;1;Linyphiidae;Troglohyphantes;brignolii;Troglohyphantes brignolii;;45.28092;14.249305;Tb;deep cave;45.2809214.249305;2;;;;;;;;;;;;;;;;;;;;;;
605;Jama na Zaluki (ispred);Croatia;22.4.2009.;2009-04-22;1f;1;Linyphiidae;Palliduphantes;istrianus;Palliduphantes istrianus;;45.34416;14.235222;Tf;shallow subterranean habitat;45.3441614.235222;2;;;;;;;;;;;;;;;;;;;;;;
607;Barinova jama;Croatia;11.9.2008.;2008-09-11;1m, 1juv m;2;Linyphiidae;Troglohyphantes;brignolii;Troglohyphantes brignolii;;45.354889;14.126033;Tb;deep cave;45.35488914.126033;1;;;;;;;;;;;;;;;;;;;;;;
608;Rudnik u Medveji;Croatia;24.4.2009.;2009-04-24;1f, 1juv;2;Nesticidae;Kryptonesticus;eremita;Kryptonesticus eremita;;45.271377;14.268107;Tf;deep cave;45.27137714.268107;1;;;;;;;;;;;;;;;;;;;;;;
609;Jama u Vetvi;Croatia;26.4.2009.;2009-04-26;1f;1;Linyphiidae;Troglohyphantes;liburnicus;Troglohyphantes liburnicus;;45.332148;14.240733;Tb;deep cave;45.33214814.240733;3;;;;;;;;;;;;;;;;;;;;;;
610;ZV-1;Croatia;24.4.2009.;2009-04-24;1f, 1m;2;Linyphiidae;Troglohyphantes;brignolii;Troglohyphantes brignolii;;45.352478;14.253225;Tb;deep cave;45.35247814.253225;2;;;;;;;;;;;;;;;;;;;;;;
613;Jama na Lipovice;Croatia;25.4.2009.;2009-04-25;1f;1;Linyphiidae;Troglohyphantes;brignolii;Troglohyphantes brignolii;;45.368907;14.245975;Tb;deep cave;45.36890714.245975;4;;;;;;;;;;;;;;;;;;;;;;
615;ZV-1;Croatia;24.4.2009.;2009-04-24;6f, 1m;7;Linyphiidae;Troglohyphantes;brignolii;Troglohyphantes brignolii;;45.352478;14.253225;Tb;deep cave;45.35247814.253225;2;;;;;;;;;;;;;;;;;;;;;;
616;Jama na Mahencu 2;Croatia;22.4.2009.;2009-04-22;1m, 5f;6;Linyphiidae;Troglohyphantes;brignolii;Troglohyphantes brignolii;;45.348335;14.23389;Tb;deep cave;45.34833514.23389;4;;;;;;;;;;;;;;;;;;;;;;
617;Jama u Velim Sapcima 3;Croatia;26.4.2009.;2009-04-26;1f, 2juv;3;Linyphiidae;Troglohyphantes;liburnicus;Troglohyphantes liburnicus;850;45.359003;14.242656;Tb;deep cave;45.35900314.242656;5;;;;;;;;;;;;;;;;;;;;;;
618;Jama u Velim Sapcima 3;Croatia;26.4.2009.;2009-04-26;1f, 1m;2;Linyphiidae;Troglohyphantes;excavatus;Troglohyphantes excavatus;;45.359003;14.242656;Tf;deep cave;45.35900314.242656;5;;;;;;;;;;;;;;;;;;;;;;
619;Jama u Velim Sapcima 3;Croatia;26.4.2009.;2009-04-26;1m;1;Tetragnathidae;Metellina;mengei;Metellina mengei;;45.359003;14.242656;SubTf?;;45.35900314.242656;5;;;;;;;;;;;;;;;;;;;;;;
622;Jama na Lipovice;Croatia;25.4.2009.;2009-04-25;2f;2;Tetragnathidae;Metellina;merianae;Metellina merianae;;45.368907;14.245975;tf;deep cave;45.36890714.245975;4;;;;;;;;;;;;;;;;;;;;;;
623;Jama na Mahencu 2;Croatia;22.4.2009.;2009-04-22;1m;1;Tetragnathidae;Metellina;merianae;Metellina merianae;;45.348335;14.23389;tf;deep cave;45.34833514.23389;4;;;;;;;;;;;;;;;;;;;;;;
624;Jama na Mahencu 2;Croatia;22.4.2009.;2009-04-22;1f;1;Agelenidae;Tegenaria;silvestris;Tegenaria silvestris;;45.348335;14.23389;Tf;deep cave;45.34833514.23389;4;;;;;;;;;;;;;;;;;;;;;;
625;Jama u Velim Sapcima 3;Croatia;26.4.2009.;2009-04-26;1f;1;Agelenidae;Tegenaria;sp. 1;Tegenaria sp. 1;;45.359003;14.242656;SubTf?;deep cave;45.35900314.242656;5;;;;;;;;;;;;;;;;;;;;;;
627;Jama u Vetvi;Croatia;26.4.2009.;2009-04-26;1m;1;cf. Tetragnathidae;Gen. 1;sp. 1;Gen. 1 sp. 1;;45.332148;14.240733;Tx;;45.33214814.240733;3;;;;;;;;;;;;;;;;;;;;;;
628;Ledenica u Špeharima;Croatia;3.12.2009.;2009-12-03;1m;1;Dysderidae;Parastalita;stygia;Parastalita stygia;;45.371029;15.317544;Tb;deep cave;45.37102915.317544;1;;;;;;;;;;;;;;;;;;;;;;
632;Jama kod Koli?a 2;Croatia;2.12.2009.;2009-12-02;1m;1;Linyphiidae;Troglohyphantes;croaticus;Troglohyphantes croaticus;;45.343306;15.316733;Tb;deep cave;45.34330615.316733;2;;;;;;;;;;;;;;;;;;;;;;
633;Tounj?ica;Croatia;5.12.2009.;2009-12-05;2f;2;Linyphiidae;Porrhomma;convexum;Porrhomma convexum;;45.248722;15.322408;Tf;deep cave;45.24872215.322408;5;14;;;;;;;;;;;;;;;;;;;;;
634;Špilja u kanjonu Bistraca kod Kromara;Croatia;25.8.2008.;2008-08-25;1f;1;Linyphiidae;Porrhomma;egeria;Porrhomma egeria;230;45.280604;15.289475;Tf;deep cave;45.28060415.289475;2;;;;;;;;;;;;;;;;;;;;;;
635;Urinjska špilja;Croatia;17.10.2009.;2009-10-17;1f;1;Nesticidae;Kryptonesticus;eremita;Kryptonesticus eremita;10;45.285721;14.524173;tf;deep cave;45.28572114.524173;5;;;;;;;;;;;;;;;;;;;;;;
636;Urinjska špilja;Croatia;17.10.2009.;2009-10-17;1 juv;1;Dysderidae;Stalita;taenaria;Stalita taenaria;;45.285721;14.524173;Tb;deep cave;45.28572114.524173;5;;;;;;;;;;;;;;;;;;;;;;
637;Mali štumbur;Croatia;18.10.2009.;2009-10-18;1m;1;Dysderidae;Stalita;taenaria;Stalita taenaria;48;45.297181;14.503575;Tb;deep cave;45.29718114.503575;2;;;;;;;;;;;;;;;;;;;;;;
639;Špilja kod kompresorske stanice;Croatia;17.10.2009.;2009-10-17;1m, 2juv;3;Nesticidae;Kryptonesticus;eremita;Kryptonesticus eremita;;45.315027;14.483783;tf;deep cave;45.31502714.483783;2;;;;;;;;;;;;;;;;;;;;;;
640;Špilja kod kompresorske stanice;Croatia;17.10.2009.;2009-10-17;1 juv;1;Pholcidae;Pholcus;sp.;Pholcus sp.;;45.315027;14.483783;;;45.31502714.483783;2;;;;;;;;;;;;;;;;;;;;;;
641;Urinjska špilja;Croatia;15.10.2009.;2009-10-15;1 m;1;Nesticidae;Kryptonesticus;eremita;Kryptonesticus eremita;;45.285721;14.524173;tf;deep cave;45.28572114.524173;5;;;;;;;;;;;;;;;;;;;;;;
642;Urinjska špilja;Croatia;17.10.2009.;2009-10-17;1f;1;Nesticidae;Kryptonesticus;eremita;Kryptonesticus eremita;;45.285721;14.524173;tf;deep cave;45.28572114.524173;5;;;;;;;;;;;;;;;;;;;;;;
643;Rudnik iznad uvale Martinš?ica;Croatia;29.4.2009.;2009-04-29;1m, 1f;2;Nesticidae;Kryptonesticus;eremita;Kryptonesticus eremita;;45.31777;14.487393;tf;deep cave;45.3177714.487393;1;;;;;;;;;;;;;;;;;;;;;;
647;Rudnik iznad uvale Martinš?ica;Croatia;29.4.2009.;2009-04-29;1f, 2juv m, 2juv;5;Nesticidae;Kryptonesticus;eremita;Kryptonesticus eremita;;45.31777;14.487393;tf;deep cave;45.3177714.487393;1;;;;;;;;;;;;;;;;;;;;;;
649;Bunetova jama;Croatia;28.4.2009.;2009-04-28;2f, 2juv;4;Nesticidae;Kryptonesticus;eremita;Kryptonesticus eremita;;45.300434;14.526307;tf;deep cave;45.30043414.526307;1;;;;;;;;;;;;;;;;;;;;;;
652;Mali štumbur;Croatia;18.10.2009.;2009-10-18;1f;1;Nesticidae;Kryptonesticus;eremita;Kryptonesticus eremita;;45.297181;14.503575;tf;deep cave;45.29718114.503575;2;;;;;;;;;;;;;;;;;;;;;;
653;Špilja iznad ceste;Croatia;17.10.2009.;2009-10-17;1f;1;Nesticidae;Kryptonesticus;eremita;Kryptonesticus eremita;;45.31381;14.483246;tf;deep cave;45.3138114.483246;3;;;;;;;;;;;;;;;;;;;;;;
655;Špilja iznad ceste;Croatia;17.10.2009.;2009-10-17;2f;2;Nesticidae;Kryptonesticus;eremita;Kryptonesticus eremita;;45.31381;14.483246;tf;deep cave;45.3138114.483246;3;;;;;;;;;;;;;;;;;;;;;;
660;Špilja kod kompresorske stanice;Croatia;17.10.2009.;2009-10-17;1 juv;1;Pholcidae;Pholcus;sp.;Pholcus sp.;;45.315027;14.483783;;;45.31502714.483783;2;;;;;;;;;;;;;;;;;;;;;;
661;Špilja iznad ceste;Croatia;17.10.2009.;2009-10-17;1 juv;1;Pholcidae;Pholcus;sp.;Pholcus sp.;;45.31381;14.483246;;;45.3138114.483246;3;;;;;;;;;;;;;;;;;;;;;;
663;Špilja u uvali Predpe?;Croatia;27.4.2009.;2009-04-27;1f;1;Dysderidae;Rhode;aspinifera;Rhode aspinifera;;45.291576;14.510419;Tb;deep cave;45.29157614.510419;4;;;;;;;;;;;;;;;;;;;;;;
664;Urinjska špilja;Croatia;29.4.2009.;2009-04-29;1f;1;Linyphiidae;Centromerus;sellarius;Centromerus sellarius;;45.285721;14.524173;tf;deep cave;45.28572114.524173;5;;;;;;;;;;;;;;;;;;;;;;
665;Urinjska špilja;Croatia;17.10.2009.;2009-10-17;2f, 2juv;4;Linyphiidae;Centromerus;sellarius;Centromerus sellarius;;45.285721;14.524173;tf;deep cave;45.28572114.524173;5;;;;;;;;;;;;;;;;;;;;;;
666;Špilja iznad ceste;Croatia;17.10.2009.;2009-10-17;1f;1;Theridiidae;Episinus;cavernicola;Episinus cavernicola;;45.31381;14.483246;Tf;deep cave;45.3138114.483246;3;;;;;;;;;;;;;;;;;;;;;;
669;Ton?akova jama;Croatia;18.10.2009.;2009-10-18;1f, 1 juv m, 2 juv;4;Theridiidae;Episinus;cavernicola;Episinus cavernicola;;45.304426;14.521058;Tf;deep cave;45.30442614.521058;1;;;;;;;;;;;;;;;;;;;;;;
671;Urinjska špilja;Croatia;29.4.2009.;2009-04-29;1 juv;1;Dysderidae;Rhode;aspinifera;Rhode aspinifera;;45.285721;14.524173;Tb;deep cave;45.28572114.524173;5;;;;;;;;;;;;;;;;;;;;;;
672;Urinjska špilja;Croatia;29.4.2009.;2009-04-29;1m;1;Dictynidae;Nigma;flavescens;Nigma flavescens;;45.285721;14.524173;Tx;;45.28572114.524173;5;;;;;;;;;;;;;;;;;;;;;;
674;Biserujka;Croatia;26.5.2009.;2009-05-26;1 f;1;Nesticidae;Kryptonesticus;eremita;Kryptonesticus eremita;;45.187464;14.60981;tf;deep cave;45.18746414.60981;1;;;;;;;;;;;;;;;;;;;;;;
677;Vilska luknja;Croatia;16.5.2009.;2009-05-16;1 f;1;Linyphiidae;Porrhomma;sp. 1;Porrhomma sp. 1;;46.19;15.9;;;46.1915.9;3;;;;;;;;;;;;;;;;;;;;;;
679;Hanžekova jama;Croatia;20.5.2009.;2009-05-20;1f, 2m, 2juv;5;Linyphiidae;Porrhomma;egeria;Porrhomma egeria;390;46.155463;16.1171;Tf;deep cave;46.15546316.1171;5;;;;;;;;;;;;;;;;;;;;;;
681;Volarš?ica;Croatia;19.11.2009.;2009-11-19;1 juv;1;Dysderidae;Harpactea;sp.;Harpactea sp.;;46.184293;15.893218;;;46.18429315.893218;3;;;;;;;;;;;;;;;;;;;;;;
682;Volarš?ica;Croatia;19.11.2009.;2009-11-19;1m;1;Agelenidae;Tegenaria;silvestris;Tegenaria silvestris;;46.184293;15.893218;Tf;deep cave;46.18429315.893218;3;;;;;;;;;;;;;;;;;;;;;;
686;Vilska luknja;Croatia;16.5.2009.;2009-05-16;1 m;1;Linyphiidae;Porrhomma;microps;Porrhomma microps;;46.19;15.9;Tf;deep cave;46.1915.9;3;;;;;;;;;;;;;;;;;;;;;;
687;Vilska luknja;Croatia;16.5.2009.;2009-05-16;2 f;2;Theridiidae;Pholcomma;gibbum;Pholcomma gibbum;;46.19;15.9;Tx;;46.1915.9;3;;;;;;;;;;;;;;;;;;;;;;
688;Volarš?ica;Croatia;19.11.2009.;2009-11-19;1 m;1;Theridiidae;Pholcomma;gibbum;Pholcomma gibbum;;46.184293;15.893218;Tx;;46.18429315.893218;3;;;;;;;;;;;;;;;;;;;;;;
689;Jama iznad Vrulja;Croatia;26.9.2009.;2009-09-26;1 juv;1;Agelenidae;Tegenaria;sp.;Tegenaria sp.;;43.81234;15.301095;;deep cave;43.8123415.301095;5;;;;;;;;;;;;;;;;;;;;;;
692;Vjetruša;Croatia;28.9.2009.;2009-09-28;1 juv;1;Agelenidae;Tegenaria;sp.;Tegenaria sp.;;43.77419;15.349733;;deep cave;43.7741915.349733;1;;;;;;;;;;;;;;;;;;;;;;
695;Donja Bara?eva;Croatia;17.4.2004.;2004-04-17;1f;1;Dysderidae;Parastalita;stygia;Parastalita stygia;310;44.984157;15.723225;Tb;deep cave;44.98415715.723225;8;;;;;;;;;;;;;;;;;;;;;;
696;Donja Bara?eva;Croatia;17.4.2004.;2004-04-17;1m, 1 juv f - možda Therii;2;Linyphiidae;Troglohyphantes;excavatus;Troglohyphantes excavatus;310;44.984157;15.723225;tf;deep cave;44.98415715.723225;8;;;;;;;;;;;;;;;;;;;;;;
697;Manita pe?;Croatia;12.8.1998.;1998-08-12;1m, 2 juv;3;Dysderidae;Parastalita;stygia;Parastalita stygia;520;44.314302;15.475264;Tb;deep cave;44.31430215.475264;7;;;;;;;;;;;;;;;;;;;;;;
698;Manita pe?;Croatia;12.8.1998.;1998-08-12;1f, 1 juv;2;Dysderidae;Stalita;pretneri;Stalita pretneri;520;44.314302;15.475264;Tb;deep cave;44.31430215.475264;7;;;;;;;;;;;;;;;;;;;;;;
699;Manita pe?;Croatia;13.6.1999.;1999-06-13;1m, 1 juv;2;Dysderidae;Parastalita;stygia;Parastalita stygia;520;44.314302;15.475264;Tb;deep cave;44.31430215.475264;7;;;;;;;;;;;;;;;;;;;;;;
700;Manita pe?;Croatia;13.6.1999.;1999-06-13;1 juv;1;Dysderidae;Stalita;pretneri;Stalita pretneri;520;44.314302;15.475264;Tb;deep cave;44.31430215.475264;7;;;;;;;;;;;;;;;;;;;;;;
701;Jama u Velim Sapcima 3;Croatia;26.4.2009.;2009-04-26;1m;1;Agelenidae;Histopona;torpida;Histopona torpida;;45.359003;14.242656;Tx;deep cave;45.35900314.242656;5;;;;;;;;;;;;;;;;;;;;;;
702;Tu?epska vilenja?a;Croatia;31.5.2007.;2007-05-31;1m;1;Dysderidae;Stalagtia;sp. 4;Stalagtia sp. 4;1181;43.286465;17.083638;Tb;deep cave;43.28646517.083638;8;;;;;;;;;;;;;;;;;;;;;;
703;Vranja?a špilja kod Dugopolja;Croatia;1.8.2007.;2007-08-01;1m;1;Dysderidae;Rhode;sp. 1;Rhode sp. 1;445;43.562235;16.648216;Tb;deep cave;43.56223516.648216;5;;;;;;;;;;;;;;;;;;;;;;
704;Tu?epska vilenja?a;Croatia;9.4.1990.;1990-04-09;1m;1;Dysderidae;Harpactea;mateparlovi;Harpactea mateparlovi;1181;43.286465;17.083638;Tf;deep cave;43.28646517.083638;8;;;;;;;;;;;;;;;;;;;;;;
705;Kuna špilja;Croatia;27.8.1998.;1998-08-27;1m;1;Dysderidae;Harpactea;mateparlovi;Harpactea mateparlovi;1401;43.324523;17.055953;Tf;deep cave;43.32452317.055953;2;;;;;;;;;;;;;;;;;;;;;;
706;Vilina špilja, Gruda;Croatia;27.6.2003.;2003-06-27;1f;1;Linyphiidae;Palliduphantes;sp. X;Palliduphantes sp. X;205;42.506621;18.391346;;deep cave;42.50662118.391346;7;;;;;;;;;;;;;;;;;;;;;;
707;Drenova?a;Croatia;6.5.2010.;2010-05-06;1f, 1 juv m ;2;Linyphiidae;Palliduphantes;istrianus;Palliduphantes istrianus;;43.954975;15.946464;Tf;deep cave;43.95497515.946464;2;;;;;;;;;;;;;;;;;;;;;;
708;Jama kod Zaskoka;Croatia;6.5.2010.;2010-05-06;1m, 2 f;3;Linyphiidae;Palliduphantes;istrianus;Palliduphantes istrianus;;43.914245;15.975538;Tf;deep cave;43.91424515.975538;1;;;;;;;;;;;;;;;;;;;;;;
715;Stara jametina;Croatia;7.5.2010.;2010-05-07;1m, 1 juv;2;Theridiidae;Episinus;cavernicola;Episinus cavernicola;;43.794009;16.00259;Tf;deep cave;43.79400916.00259;6;;;;;;;;;;;;;;;;;;;;;;
716;Stara jametina;Croatia;7.5.2010.;2010-05-07;1f;1;Dysderidae;Stalagtia;sp. 4;Stalagtia sp. 4;;43.794009;16.00259;Tb;deep cave;43.79400916.00259;6;;;;;;;;;;;;;;;;;;;;;;
717;Jazinka;Croatia;6.5.2010.;2010-05-06;1m;1;Dysderidae;Stalagtia;sp. 4;Stalagtia sp. 4;235;43.975892;16.029694;Tb;deep cave;43.97589216.029694;2;;;;;;;;;;;;;;;;;;;;;;
718;Topla pe?ina;Croatia;5.5.2010.;2010-05-05;1f;1;Dysderidae;Stalagtia;sp. 4;Stalagtia sp. 4;155;43.839254;16.0536;Tb;deep cave;43.83925416.0536;4;;;;;;;;;;;;;;;;;;;;;;
719;Topla pe?ina;Croatia;5.5.2010.;2010-05-05;1m;1;Dysderidae;Stalagtia;sp. 4;Stalagtia sp. 4;;43.839254;16.0536;Tb;deep cave;43.83925416.0536;4;;;;;;;;;;;;;;;;;;;;;;
720;Stara jametina;Croatia;7.5.2010.;2010-05-07;1m;1;Dysderidae;Stalagtia;sp. 4;Stalagtia sp. 4;;43.794009;16.00259;Tb;deep cave;43.79400916.00259;6;;;;;;;;;;;;;;;;;;;;;;
721;Stara jametina;Croatia;7.5.2010.;2010-05-07;1f;1;Linyphiidae;Micrargus;herbigradus;Micrargus herbigradus;;43.794009;16.00259;Tf;deep cave;43.79400916.00259;6;;;;;;;;;;;;;;;;;;;;;;
722;Stara jametina;Croatia;7.5.2010.;2010-05-07;3 juv;3;Dysderidae;Stalagtia;sp. 4;Stalagtia sp. 4;;43.794009;16.00259;Tb;deep cave;43.79400916.00259;6;;;;;;;;;;;;;;;;;;;;;;
723;Jazinka;Croatia;6.5.2010.;2010-05-06;1 juv;1;Dysderidae;Stalagtia;sp. 4;Stalagtia sp. 4;235;43.975892;16.029694;Tb;deep cave;43.97589216.029694;2;;;;;;;;;;;;;;;;;;;;;;
724;Stara jametina;Croatia;7.5.2010.;2010-05-07;1 juv;1;Dysderidae;Stalagtia;sp. 4;Stalagtia sp. 4;;43.794009;16.00259;Tb;deep cave;43.79400916.00259;6;;;;;;;;;;;;;;;;;;;;;;
725;Stara jametina;Croatia;7.5.2010.;2010-05-07;1 juv;1;Dysderidae;Stalagtia;sp. 4;Stalagtia sp. 4;;43.794009;16.00259;Tb;deep cave;43.79400916.00259;6;;;;;;;;;;;;;;;;;;;;;;
726;Jazinka;Croatia;6.5.2010.;2010-05-06;1 juv;1;Dysderidae;Stalagtia;sp. 4;Stalagtia sp. 4;235;43.975892;16.029694;Tb;deep cave;43.97589216.029694;2;;;;;;;;;;;;;;;;;;;;;;
727;Topla pe?ina;Croatia;5.5.2010.;2010-05-05;1 juv;1;Dysderidae;Stalagtia;sp. 4;Stalagtia sp. 4;;43.839254;16.0536;Tb;deep cave;43.83925416.0536;4;;;;;;;;;;;;;;;;;;;;;;
729;Sedrena špilja kod stola;Croatia;3.5.2010.;2010-05-03;1 juv;1;Agelenidae;Histopona;sp.;Histopona sp.;;44.01385;16.068978;;deep cave;44.0138516.068978;2;;;;;;;;;;;;;;;;;;;;;;
730;Ozi?ana pe?ina;Croatia;6.5.2010.;2010-05-06;2f;2;Nesticidae;Kryptonesticus;eremita;Kryptonesticus eremita;;43.90774;15.980634;tf;deep cave;43.9077415.980634;4;;;;;;;;;;;;;;;;;;;;;;
731;Miljacka 2;Croatia;6.1.2005.;2005-01-06;2 juv;2;Agelenidae;Tegenaria;sp.;Tegenaria sp.;;44.0002;16.016234;;deep cave;44.000216.016234;4;;;;;;;;;;;;;;;;;;;;;;
733;Drenova?a;Croatia;8.1.2005.;2005-01-08;1 f;1;Linyphiidae;Palliduphantes;istrianus;Palliduphantes istrianus;;43.954975;15.946464;Tf;deep cave;43.95497515.946464;2;;;;;;;;;;;;;;;;;;;;;;
734;Drenova?a;Croatia;8.1.2005.;2005-01-08;2m, 3 juv;5;Linyphiidae;Palliduphantes;istrianus;Palliduphantes istrianus;;43.954975;15.946464;Tf;deep cave;43.95497515.946464;2;;;;;;;;;;;;;;;;;;;;;;
735;Triši?a jama;Croatia;8.1.2005.;2005-01-08;3f, 4 juv;7;Linyphiidae;Palliduphantes;istrianus;Palliduphantes istrianus;;43.949231;15.947793;Tf;deep cave;43.94923115.947793;2;;;;;;;;;;;;;;;;;;;;;;
736;Triši?a jama;Croatia;8.1.2005.;2005-01-08;2f;2;Linyphiidae;Palliduphantes;istrianus;Palliduphantes istrianus;;43.949231;15.947793;Tf;deep cave;43.94923115.947793;2;;;;;;;;;;;;;;;;;;;;;;
737;Triši?a jama;Croatia;8.1.2005.;2005-01-08;1m, 1 juv;2;Linyphiidae;Micrargus;herbigradus;Micrargus herbigradus;;43.949231;15.947793;Tf;deep cave;43.94923115.947793;2;;;;;;;;;;;;;;;;;;;;;;
739;Jama u šumi uvale Bjejajka;Croatia;18.6.2010.;2010-06-18;1f;1;Linyphiidae;Gen. 4;sp.;Gen. 4 sp.;;42.765231;17.385606;;;42.76523117.385606;6;;;;;;;;;;;;;;;;;;;;;;
740;Jama u šumi uvale Bjejajka;Croatia;18.6.2010.;2010-06-18;1 f, 1 juv m;2;Linyphiidae;Palliduphantes;sp. 1;Palliduphantes sp. 1;;42.765231;17.385606;tf;deep cave;42.76523117.385606;6;;;;;;;;;;;;;;;;;;;;;;
744;Veternica;Croatia;28.12.2003.;2003-12-28;2 m,3  juv;5;Linyphiidae;Troglohyphantes;excavatus;Troglohyphantes excavatus;330;45.841058;15.873642;tf;deep cave;45.84105815.873642;6;;;;;;;;;;;;;;;;;;;;;;
745;Los Antonio;Croatia;10.8.2006.;2006-08-10;1f;1;Linyphiidae;Troglohyphantes;sp. 4;Troglohyphantes sp. 4;;44.632703;15.136461;tb;deep cave;44.63270315.136461;1;;;;;;;;;;;;;;;;;;;;;;
746;Mravinjuša jama;Croatia;21.3.2004.;2004-03-21;2 f, 2juv;4;Linyphiidae;Typhlonyphia;sp. 1;Typhlonyphia sp. 1;730;43.346139;17.099776;Tb;deep cave;43.34613917.099776;1;;;;;;;;;;;;;;;;;;;;;;
747;Dvoga?a;Croatia;4.12.2004.;2004-12-04;1 f;1;Linyphiidae;Troglohyphantes;excavatus;Troglohyphantes excavatus;450;45.850768;15.873148;tf;deep cave;45.85076815.873148;2;;;;;;;;;;;;;;;;;;;;;;
748;Francuski rudnik 1;Croatia;19.11.2004.;2004-11-19;1 f;1;Linyphiidae;Troglohyphantes;excavatus;Troglohyphantes excavatus;700;45.91305;15.940454;tf;deep cave;45.9130515.940454;3;;;;;;;;;;;;;;;;;;;;;;
749;Gornja Bara?eva;Croatia;15.5.2004.;2004-05-15;6 f;6;Linyphiidae;Troglohyphantes;excavatus;Troglohyphantes excavatus;;44.983895;15.721656;tf;deep cave;44.98389515.721656;8;;;;;;;;;;;;;;;;;;;;;;
750;Kosi?ev ponor;Croatia;26.5.2005.;2005-05-26;1 m;1;Linyphiidae;Troglohyphantes;excavatus;Troglohyphantes excavatus;305;45.835763;15.846355;tf;deep cave;45.83576315.846355;2;;;;;;;;;;;;;;;;;;;;;;
751;Zverina;Croatia;3.11.2002.;2002-11-03;2f,1m;3;Linyphiidae;Troglohyphantes;excavatus;Troglohyphantes excavatus;320;45.681296;15.445012;tf;deep cave;45.68129615.445012;2;;;;;;;;;;;;;;;;;;;;;;
752;Vranja?a špilja kod Dugopolja;Croatia;20.7.2004.;2004-07-20;1f,1juv;2;Linyphiidae;Troglohyphantes;strandi;Troglohyphantes strandi;445;43.562235;16.648216;tb;deep cave;43.56223516.648216;5;;;;;;;;;;;;;;;;;;;;;;
753;Dvocijevka;Croatia;28.7.2004.;2004-07-28;1 m,1juv;2;Linyphiidae;Troglohyphantes;croaticus;Troglohyphantes croaticus;1359;45.437456;14.617413;Tb;deep cave;45.43745614.617413;1;;;;;;;;;;;;;;;;;;;;;;
754;Jama na Puharevom;Croatia;2.11.2003.;2003-11-02;1 m;1;Linyphiidae;Troglohyphantes;liburnicus;Troglohyphantes liburnicus;;45.410155;14.30419;Tb;deep cave;45.41015514.30419;2;;;;;;;;;;;;;;;;;;;;;;
755;Luška špilja;Croatia;3.7.2004.;2004-07-03;1 f;1;Linyphiidae;Troglohyphantes;croaticus;Troglohyphantes croaticus;620;45.224689;15.093741;Tb;deep cave;45.22468915.093741;2;;;;;;;;;;;;;;;;;;;;;;
756;Jama blizu ceste MV 3;Croatia;27.-28.7.2002;2002-07-27/2002-07-28;1m;1;Linyphiidae;Troglohyphantes;brignolii;Troglohyphantes brignolii;;45.449439;14.13203;tb;deep cave;45.44943914.13203;1;;;;;;;;;;;;;;;;;;;;;;
757;Veternica;Croatia;20.12.2004.;2004-12-20;1 f;1;Linyphiidae;Troglohyphantes;excavatus;Troglohyphantes excavatus;330;45.841058;15.873642;tf;deep cave;45.84105815.873642;6;;;;;;;;;;;;;;;;;;;;;;
758;Francuski rudnik 1;Croatia;24.11.2004.;2004-11-24;1 m,1 juv;2;Linyphiidae;Troglohyphantes;excavatus;Troglohyphantes excavatus;;45.91305;15.940454;tf;deep cave;45.9130515.940454;3;;;;;;;;;;;;;;;;;;;;;;
759;Kosi?ev ponor;Croatia;26.5.2005.;2005-05-26;1 f,1 m;2;Linyphiidae;Troglohyphantes;excavatus;Troglohyphantes excavatus;305;45.835763;15.846355;tf;deep cave;45.83576315.846355;2;;;;;;;;;;;;;;;;;;;;;;
760;Veternica;Croatia;26.2.2005.;2005-02-26;1 f;1;Linyphiidae;Troglohyphantes;excavatus;Troglohyphantes excavatus;330;45.841058;15.873642;tf;deep cave;45.84105815.873642;6;;;;;;;;;;;;;;;;;;;;;;
761;Mravinjuša jama;Croatia;21.3.2004.;2004-03-21;2 f, 1 juv;3;Linyphiidae;Typhlonyphia;sp. 1;Typhlonyphia sp. 1;730;43.346139;17.099776;Tb;deep cave;43.34613917.099776;1;;;;;;;;;;;;;;;;;;;;;;
762;Rudnik Zrinski;Croatia;16.4.2004.;2004-04-16;1 f,1 m;2;Linyphiidae;Troglohyphantes;excavatus;Troglohyphantes excavatus;804;45.887195;15.927871;tf;deep cave;45.88719515.927871;9;;;;;;;;;;;;;;;;;;;;;;
763;Bošak jama;Croatia;21.3.2004.;2004-03-21;2 f;2;Linyphiidae;Typhlonyphia;sp. 1;Typhlonyphia sp. 1;739;43.347996;17.100045;Tb;deep cave;43.34799617.100045;2;;;;;;;;;;;;;;;;;;;;;;
764;Batinova jama;Croatia;3.12.2004.;2004-12-03;1 f;1;Linyphiidae;Troglohyphantes;excavatus;Troglohyphantes excavatus;450;45.845957;15.868496;tf;deep cave;45.84595715.868496;2;;;;;;;;;;;;;;;;;;;;;;
765;Batinova jama;Croatia;23.1.2004.;2004-01-23;1 m;1;Linyphiidae;Troglohyphantes;excavatus;Troglohyphantes excavatus;450;45.845957;15.868496;tf;deep cave;45.84595715.868496;2;;;;;;;;;;;;;;;;;;;;;;
766;Staje 8;Croatia;29.7.2001.;2001-07-29;1 f;1;Linyphiidae;Troglohyphantes;excavatus;Troglohyphantes excavatus;;45.447413;14.143861;Tf;deep cave;45.44741314.143861;3;;;;;;;;;;;;;;;;;;;;;;
767;Batinova jama;Croatia;3.12.2004.;2004-12-03;1 f,1 m;2;Linyphiidae;Troglohyphantes;excavatus;Troglohyphantes excavatus;450;45.845957;15.868496;tf;deep cave;45.84595715.868496;2;;;;;;;;;;;;;;;;;;;;;;
768;Veternica;Croatia;21.4.2003.;2003-04-21;1 f;1;Linyphiidae;Troglohyphantes;excavatus;Troglohyphantes excavatus;330;45.841058;15.873642;tf;deep cave;45.84105815.873642;6;;;;;;;;;;;;;;;;;;;;;;
769;Židovske jame;Croatia;23.4.2005.;2005-04-23;1 f;1;Linyphiidae;Troglohyphantes;excavatus;Troglohyphantes excavatus;233;45.997503;16.038982;tf;deep cave;45.99750316.038982;2;;;;;;;;;;;;;;;;;;;;;;
770;Tisin ponor (ispred);Croatia;22.5.2005.;2005-05-22;1 m;1;Linyphiidae;Troglohyphantes;excavatus;Troglohyphantes excavatus;649;45.918842;15.963461;Tf;shallow subterranean habitat;45.91884215.963461;2;;;;;;;;;;;;;;;;;;;;;;
771;Veternica;Croatia;4.12.2004.;2004-12-04;1 f;1;Linyphiidae;Troglohyphantes;excavatus;Troglohyphantes excavatus;330;45.841058;15.873642;tf;deep cave;45.84105815.873642;6;;;;;;;;;;;;;;;;;;;;;;
772;Veternica;Croatia;13.5.2004.;2004-05-13;1 f;1;Linyphiidae;Troglohyphantes;excavatus;Troglohyphantes excavatus;330;45.841058;15.873642;tf;deep cave;45.84105815.873642;6;;;;;;;;;;;;;;;;;;;;;;
773;Rudnik Zrinski;Croatia;14.6.2004.;2004-06-14;2 f,1 m,1 juv;4;Linyphiidae;Troglohyphantes;excavatus;Troglohyphantes excavatus;804;45.887195;15.927871;tf;deep cave;45.88719515.927871;9;;;;;;;;;;;;;;;;;;;;;;
774;Batinova jama;Croatia;23.1.2004.;2004-01-23;2 f;2;Linyphiidae;Troglohyphantes;excavatus;Troglohyphantes excavatus;450;45.845957;15.868496;tf;deep cave;45.84595715.868496;2;;;;;;;;;;;;;;;;;;;;;;
775;Francuski rudnik 1;Croatia;16.4.2005.;2005-04-16;1f;1;Linyphiidae;Troglohyphantes;excavatus;Troglohyphantes excavatus;;45.91305;15.940454;tf;deep cave;45.9130515.940454;3;;;;;;;;;;;;;;;;;;;;;;
776;Jama Bijele sige;Croatia;24.1.2004.;2004-01-24;1 f,2 m;3;Linyphiidae;Troglohyphantes;excavatus;Troglohyphantes excavatus;;45.855153;15.863263;tf;deep cave;45.85515315.863263;1;;;;;;;;;;;;;;;;;;;;;;
777;Veternica;Croatia;13.5.2004.;2004-05-13;1 f;1;Linyphiidae;Troglohyphantes;excavatus;Troglohyphantes excavatus;330;45.841058;15.873642;tf;deep cave;45.84105815.873642;6;;;;;;;;;;;;;;;;;;;;;;
778;Veternica;Croatia;2.6.2001.;2001-06-02;1 f;1;Linyphiidae;Troglohyphantes;excavatus;Troglohyphantes excavatus;330;45.841058;15.873642;tf;deep cave;45.84105815.873642;6;;;;;;;;;;;;;;;;;;;;;;
779;Los Antonio;Croatia;10.8.2006.;2006-08-10;1 f;1;Linyphiidae;Troglohyphantes;sp. 4;Troglohyphantes sp. 4;;44.632703;15.136461;tb;deep cave;44.63270315.136461;1;;;;;;;;;;;;;;;;;;;;;;
780;Mili?ka;Croatia;26.4.2003.;2003-04-26;1m;1;Linyphiidae;Troglohyphantes;wiehlei;Troglohyphantes wiehlei;553;45.716744;15.310831;tf;deep cave;45.71674415.310831;6;;;;;;;;;;;;;;;;;;;;;;
781;Batinova jama;Croatia;3.12.2004.;2004-12-03;1 f, 1 m, 1 juv m;3;Linyphiidae;Troglohyphantes;excavatus;Troglohyphantes excavatus;450;45.845957;15.868496;tf;deep cave;45.84595715.868496;2;;;;;;;;;;;;;;;;;;;;;;
782;Bedara;Croatia;18.12.2005.;2005-12-18;1 m;1;Linyphiidae;Troglohyphantes;excavatus;Troglohyphantes excavatus;620;45.751922;15.536692;tf;deep cave;45.75192215.536692;4;;;;;;;;;;;;;;;;;;;;;;
783;Spilja Lisina;Croatia;17.10.1999.;1999-10-17;1 f;1;Linyphiidae;Troglohyphantes;excavatus;Troglohyphantes excavatus;277;45.69351;15.441668;tf;deep cave;45.6935115.441668;1;;;;;;;;;;;;;;;;;;;;;;
784;Dola?a;Croatia;8.12.2002.;2002-12-08;1 f;1;Linyphiidae;Troglohyphantes;excavatus;Troglohyphantes excavatus;410;45.739571;15.482755;tf;deep cave;45.73957115.482755;5;;;;;;;;;;;;;;;;;;;;;;
785;Jama u Vrloj strani;Croatia;7.6.2003.;2003-06-07;1f;1;Linyphiidae;Troglohyphantes;wiehlei;Troglohyphantes wiehlei;;45.72603;15.27504;tf;deep cave;45.7260315.27504;1;;;;;;;;;;;;;;;;;;;;;;
786;Zidane pe?ine;Croatia;11.10.1998.;1998-10-11;1f;1;Linyphiidae;Troglohyphantes;wiehlei;Troglohyphantes wiehlei;400;45.738992;15.497143;tf;deep cave;45.73899215.497143;7;;;;;;;;;;;;;;;;;;;;;;
787;Jama Jamura;Croatia;15.9.2002.;2002-09-15;2 f,1 m;3;Linyphiidae;Troglohyphantes;excavatus;Troglohyphantes excavatus;350;45.754062;15.489269;tf;deep cave;45.75406215.489269;2;;;;;;;;;;;;;;;;;;;;;;
788;Jama na Javorniku;Croatia;7.6.2003.;2003-06-07;1 f;1;Linyphiidae;Troglohyphantes;excavatus;Troglohyphantes excavatus;729;45.732907;15.282397;tf;deep cave;45.73290715.282397;1;;;;;;;;;;;;;;;;;;;;;;
789;Zidane pe?ine;Croatia;9.6.2002.;2002-06-09;1 f;1;Linyphiidae;Troglohyphantes;excavatus;Troglohyphantes excavatus;400;45.738992;15.497143;tf;deep cave;45.73899215.497143;7;;;;;;;;;;;;;;;;;;;;;;
790;Jamina;Croatia;2.11.2002.;2002-11-02;1 f;1;Linyphiidae;Troglohyphantes;excavatus;Troglohyphantes excavatus;393;45.699157;15.424684;tf;deep cave;45.69915715.424684;3;;;;;;;;;;;;;;;;;;;;;;
791;Dola?a;Croatia;8.12.2002.;2002-12-08;1 f;1;Linyphiidae;Troglohyphantes;excavatus;Troglohyphantes excavatus;410;45.739571;15.482755;tf;deep cave;45.73957115.482755;5;;;;;;;;;;;;;;;;;;;;;;
792;Golubnja?a, Žegar;Croatia;9.1.2005.;2005-01-09;1 f;1;Linyphiidae;Troglohyphantes;roberti;Troglohyphantes roberti;243;44.131933;15.851054;tb;deep cave;44.13193315.851054;6;;;;;;;;;;;;;;;;;;;;;;
793;Golubnja?a, Žegar;Croatia;9.1.2005.;2005-01-09;1 f,5 juv;6;Linyphiidae;Troglohyphantes;roberti;Troglohyphantes roberti;243;44.131933;15.851054;tb;deep cave;44.13193315.851054;6;;;;;;;;;;;;;;;;;;;;;;
794;Špilja u zubu Buljme;Croatia;13.9.2006.;2006-09-13;1 f;1;Linyphiidae;Troglohyphantes;sp. 14;Troglohyphantes sp. 14;;44.366906;15.470541;tb;deep cave;44.36690615.470541;1;;;;;;;;;;;;;;;;;;;;;;
795;Jama Nuga;Croatia;5.6.2000.;2000-06-05;1f, 1juv m;2;Linyphiidae;Troglohyphantes;roberti;Troglohyphantes roberti;;44.326231;15.656986;tb;deep cave;44.32623115.656986;1;;;;;;;;;;;;;;;;;;;;;;
796;Špilja Vranik;Croatia;8.5.2004.;2004-05-08;2 f;2;Linyphiidae;Troglohyphantes;roberti;Troglohyphantes roberti;;44.433612;15.686039;tb;deep cave;44.43361215.686039;1;;;;;;;;;;;;;;;;;;;;;;
797;Bonagracije;Croatia;5.8.2004.;2004-08-05;1 f;1;Linyphiidae;Troglohyphantes;sp. 4;Troglohyphantes sp. 4;;44.631808;15.123855;tb;deep cave;44.63180815.123855;1;;;;;;;;;;;;;;;;;;;;;;
798;Zverina;Croatia;3.11.2002.;2002-11-03;1 f;1;Linyphiidae;Troglohyphantes;excavatus;Troglohyphantes excavatus;320;45.681296;15.445012;tf;deep cave;45.68129615.445012;2;;;;;;;;;;;;;;;;;;;;;;
799;Bezdanka;Croatia;13.4.1984.;1984-04-13;3 f;3;Linyphiidae;Troglohyphantes;roberti;Troglohyphantes roberti;565;44.227473;15.852219;tb;deep cave;44.22747315.852219;2;;;;;;;;;;;;;;;;;;;;;;
800;Jama sa strane;Croatia;13.8.2006.;2006-08-13;1 m;1;Linyphiidae;Troglohyphantes;kordunlikanus;Troglohyphantes kordunlikanus;;44.635406;15.130318;tf;deep cave;44.63540615.130318;1;;;;;;;;;;;;;;;;;;;;;;
801;Baji?eva špilja 4;Croatia;5.6.2002.;2002-06-05;1f;1;Nesticidae;Nesticus;cellulanus;Nesticus cellulanus;;45.25183;15.848764;tf;deep cave;45.2518315.848764;1;;;;;;;;;;;;;;;;;;;;;;
803;Mrgi?a ponor;Croatia;2.9.2009.;2009-09-02;1 f;1;Nesticidae;Nesticus;cellulanus;Nesticus cellulanus;;45.268189;15.469236;tf;deep cave;45.26818915.469236;10;;;;;;;;;;;;;;;;;;;;;;
805;Gradusa špilja;Croatia;27.2.2009.;2009-02-27;1 juv;1;Nesticidae;Nesticus;cellulanus;Nesticus cellulanus;;45.328293;16.436304;tf;deep cave;45.32829316.436304;1;;;;;;;;;;;;;;;;;;;;;;
806;Gradusa špilja;Croatia;6.3.2009.;2009-03-06;1 juv;1;Nesticidae;Nesticus;cellulanus;Nesticus cellulanus;;45.328293;16.436304;tf;deep cave;45.32829316.436304;1;;;;;;;;;;;;;;;;;;;;;;
808;Kukuruzovi?eva špilja;Croatia;18.6.2005.;2005-06-18;1 m, 2 juv;3;Nesticidae;Nesticus;cellulanus;Nesticus cellulanus;319;44.914821;15.702486;tf;deep cave;44.91482115.702486;3;;;;;;;;;;;;;;;;;;;;;;
809;Mandelaja;Croatia;28.1.1995.;1995-01-28;1 f;1;Nesticidae;Nesticus;cellulanus;Nesticus cellulanus;;45.233397;15.30015;tf;deep cave;45.23339715.30015;7;;;;;;;;;;;;;;;;;;;;;;
812;Gradusa špilja;Croatia;27.2.2009.;2009-02-27;1f, 2juv;3;Nesticidae;Nesticus;cellulanus;Nesticus cellulanus;;45.328293;16.436304;tf;deep cave;45.32829316.436304;1;;;;;;;;;;;;;;;;;;;;;;
815;Gvozdenica;Croatia;9.12.1997.;1997-12-09;1 f;1;Nesticidae;Nesticus;cellulanus;Nesticus cellulanus;;45.299765;15.589405;tf;deep cave;45.29976515.589405;4;8,7;;;;;;;;;;;;;;;;;;;;;
820;Water well in Uble;Croatia;15.6.2001.;2001-06-15;1 m;1;Nesticidae;Kryptonesticus;eremita;Kryptonesticus eremita;;42.743393;16.827354;tf;cave entrance;42.74339316.827354;1;;;;;;;;;;;;;;;;;;;;;;
821;?urovi?a jama;Croatia;31.10.2003.;2003-10-31;1 f;1;Nesticidae;Kryptonesticus;eremita;Kryptonesticus eremita;;42.559979;18.263559;tf;deep cave;42.55997918.263559;4;;;;;;;;;;;;;;;;;;;;;;
822;Jama pod Bilušinim vrhom;Croatia;24.4.2004.;2004-04-24;1 juv;1;Nesticidae;Kryptonesticus;eremita;Kryptonesticus eremita;;42.93959;17.11266;;deep cave;42.9395917.11266;3;;;;;;;;;;;;;;;;;;;;;;
823;Jezero;Croatia;28.5.2004.;2004-05-28;1f;1;Nesticidae;Kryptonesticus;arenstorffi;Kryptonesticus arenstorffi;903;42.580381;18.356073;tb;deep cave;42.58038118.356073;8;;;7,566666667;;;;;;;;;;;;;;;;;;;
824;Jezero;Croatia;28.5.2004.;2004-05-28;1f, 2 juv;3;Nesticidae;Kryptonesticus;arenstorffi;Kryptonesticus arenstorffi;903;42.580381;18.356073;tb;deep cave;42.58038118.356073;8;;;7,566666667;;;;;;;;;;;;;;;;;;;
825;Jama pod Bilušinim vrhom;Croatia;24.4.2004.;2004-04-24;1f, 2 juv m,1 juv;4;Nesticidae;Kryptonesticus;eremita;Kryptonesticus eremita;176;42.93959;17.11266;tf;deep cave;42.9395917.11266;3;;;;;;;;;;;;;;;;;;;;;;
831;Samograd;Croatia;26.4.2004.;2004-04-26;2 m;2;Nesticidae;Kryptonesticus;eremita;Kryptonesticus eremita;68;42.970451;16.995978;tf;deep cave;42.97045116.995978;4;;;;;;;;;;;;;;;;;;;;;;
832;Baši?a jama;Croatia;17.12.2008.;2008-12-17;1f,1 juv;2;Nesticidae;Kryptonesticus;eremita;Kryptonesticus eremita;;42.513988;18.38209;;deep cave;42.51398818.38209;1;;;;;;;;;;;;;;;;;;;;;;
833;Jama u Vrisju;Croatia;25.4.2004.;2004-04-25;5 juv;5;Nesticidae;Kryptonesticus;eremita;Kryptonesticus eremita;;42.944287;17.118511;;deep cave;42.94428717.118511;2;;;;;;;;;;;;;;;;;;;;;;
835;Jama u Dubokom dolu;Croatia;27.4.2004.;2004-04-27;1 juv;1;Nesticidae;Kryptonesticus;eremita;Kryptonesticus eremita;;42.946895;17.022321;;deep cave;42.94689517.022321;3;;;;;;;;;;;;;;;;;;;;;;
839;Pr?eva pe?;Croatia;8.12.2004.;2004-12-08;1 f;1;Nesticidae;Kryptonesticus;eremita;Kryptonesticus eremita;;43.98118;15.96072;tf;deep cave;43.9811815.96072;1;;;;;;;;;;;;;;;;;;;;;;
842;Šupljara;Croatia;24.9.2005.;2005-09-24;1 juv;1;Nesticidae;Nesticus;cellulanus;Nesticus cellulanus;;44.899906;15.612099;Tf;deep cave;44.89990615.612099;5;;;;;;;;;;;;;;;;;;;;;;
847;Velika pe?ina, kanjon Korane;Croatia;24.9.2005.;2005-09-24;1 juv;1;Nesticidae;Nesticus;cellulanus;Nesticus cellulanus;470;44.91106;15.606811;Tf;deep cave;44.9110615.606811;1;;;;;;;;;;;;;;;;;;;;;;
848;Vrtare male;Croatia;2.7.2005.;2005-07-02;1f,2 juv;3;Nesticidae;Kryptonesticus;eremita;Kryptonesticus eremita;;45.197431;14.660523;tf;deep cave;45.19743114.660523;1;;;;;;;;;;;;;;;;;;;;;;
854;Mra?na pe?ina;Croatia;24.9.2005.;2005-09-24;1 juv;1;Nesticidae;Nesticus;cellulanus;Nesticus cellulanus;;44.909793;15.606582;Tf;deep cave;44.90979315.606582;1;;;;;;;;;;;;;;;;;;;;;;
856;Vrtare male;Croatia;3.7.2005.;2005-07-03;1f,1 juv;2;Nesticidae;Kryptonesticus;eremita;Kryptonesticus eremita;;45.197431;14.660523;tf;deep cave;45.19743114.660523;1;;;;;;;;;;;;;;;;;;;;;;
862;Velika špilja kod Goranca;Croatia;15.10.2006.;2006-10-15;1 juv;1;Nesticidae;Nesticus;cellulanus;Nesticus cellulanus;;46.284655;16.032361;tf;deep cave;46.28465516.032361;5;;;;;;;;;;;;;;;;;;;;;;
863;Zdenec pri Ciglaru;Croatia;26.5.2007.;2007-05-26;1 juv;1;Nesticidae;Nesticus;cellulanus;Nesticus cellulanus;251;46.283906;16.06104;tf;deep cave;46.28390616.06104;4;;;;;;;;;;;;;;;;;;;;;;
864;Vu?ilnica špilja;Croatia;27.5.2007.;2007-05-27;1 juv;1;Nesticidae;Nesticus;cellulanus;Nesticus cellulanus;449;46.284875;15.996239;;deep cave;46.28487515.996239;1;;;;;;;;;;;;;;;;;;;;;;
867;Velika špilja kod Goranca;Croatia;15.10.2007.;2007-10-15;1 juv;1;Nesticidae;Nesticus;cellulanus;Nesticus cellulanus;;46.284655;16.032361;tf;deep cave;46.28465516.032361;5;;;;;;;;;;;;;;;;;;;;;;
868;Jama pod cestom;Croatia;2.11.2007.;2007-11-02;1 juv;1;Agelenidae;Histopona;sp.;Histopona sp.;;46.275852;16.060171;;deep cave;46.27585216.060171;2;;;;;;;;;;;;;;;;;;;;;;
871;Špilja Kukelj 1;Croatia;15.10.2006.;2006-10-15;1 f;1;Nesticidae;Nesticus;cellulanus;Nesticus cellulanus;;46.291887;16.032305;tf;deep cave;46.29188716.032305;1;;;;;;;;;;;;;;;;;;;;;;
872;Velika špilja kod Goranca;Croatia;14.5.2006.;2006-05-14;1f,3 juv;4;Nesticidae;Nesticus;cellulanus;Nesticus cellulanus;;46.284655;16.032361;tf;deep cave;46.28465516.032361;5;;;;;;;;;;;;;;;;;;;;;;
873;Cinkalica 1;Croatia;15.10.2006.;2006-10-15;1f;1;Nesticidae;Nesticus;cellulanus;Nesticus cellulanus;448;46.288913;16.039777;tf;deep cave;46.28891316.039777;2;;;;;;;;;;;;;;;;;;;;;;
874;Velika špilja kod Goranca;Croatia;14.5.2006.;2006-05-14;1f,1 juv;2;Nesticidae;Nesticus;cellulanus;Nesticus cellulanus;;46.284655;16.032361;tf;deep cave;46.28465516.032361;5;;;;;;;;;;;;;;;;;;;;;;
875;Ledenica kod Bednjice;Croatia;27.5.2007.;2007-05-27;1 m;1;Nesticidae;Nesticus;cellulanus;Nesticus cellulanus;;46.280843;15.975585;tf;deep cave;46.28084315.975585;1;;;;;;;;;;;;;;;;;;;;;;
876;Zdenec pri Ciglaru;Croatia;15.5.2006.;2006-05-15;1f;1;Nesticidae;Nesticus;cellulanus;Nesticus cellulanus;251;46.283906;16.06104;tf;deep cave;46.28390616.06104;4;;;;;;;;;;;;;;;;;;;;;;
877;Rudnik u Velikoj Sotinskoj;Croatia;28.5.2007.;2007-05-28;1 f, 2 juv;3;Nesticidae;Nesticus;cellulanus;Nesticus cellulanus;400;46.286677;16.028417;tf;deep cave;46.28667716.028417;1;;;;;;;;;;;;;;;;;;;;;;
878;Zdenec pri Ciglaru;Croatia;15.5.2006.;2006-05-15;1f, 1m, 1 juv;3;Nesticidae;Nesticus;cellulanus;Nesticus cellulanus;251;46.283906;16.06104;tf;deep cave;46.28390616.06104;4;;;;;;;;;;;;;;;;;;;;;;
879;Zdenec pri Ciglaru;Croatia;26.5.2007.;2007-05-26;1f, 1m,1 juv;3;Nesticidae;Nesticus;cellulanus;Nesticus cellulanus;251;46.283906;16.06104;tf;deep cave;46.28390616.06104;4;;;;;;;;;;;;;;;;;;;;;;
882;Dopolanš?ica;Croatia;15.5.2006.;2006-05-15;2 juv;2;Nesticidae;Nesticus;cellulanus;Nesticus cellulanus;;46.275198;16.05968;;deep cave;46.27519816.05968;2;;;;;;;;;;;;;;;;;;;;;;
883;Velika špilja kod Goranca;Croatia;14.5.2006.;2006-05-14;1 juv;1;Nesticidae;Nesticus;cellulanus;Nesticus cellulanus;;46.284655;16.032361;tf;deep cave;46.28465516.032361;5;;;;;;;;;;;;;;;;;;;;;;
884;Zdenec pri Ciglaru;Croatia;26.5.2007.;2007-05-26;6 juv;6;Nesticidae;Nesticus;cellulanus;Nesticus cellulanus;251;46.283906;16.06104;tf;deep cave;46.28390616.06104;4;;;;;;;;;;;;;;;;;;;;;;
885;Jama pod cestom;Croatia;2.11.2007.;2007-11-02;1 juv;1;Nesticidae;Nesticus;cellulanus;Nesticus cellulanus;;46.275852;16.060171;;deep cave;46.27585216.060171;2;;;;;;;;;;;;;;;;;;;;;;
887;Velika špilja kod Goranca;Croatia;14.5.2007.;2007-05-14;2 juv;2;Nesticidae;Nesticus;cellulanus;Nesticus cellulanus;;46.284655;16.032361;tf;deep cave;46.28465516.032361;5;;;;;;;;;;;;;;;;;;;;;;
888;Šupljara;Croatia;24.9.2005.;2005-09-24;1f,2 juv;3;Nesticidae;Nesticus;cellulanus;Nesticus cellulanus;;44.899906;15.612099;tf;deep cave;44.89990615.612099;5;;;;;;;;;;;;;;;;;;;;;;
889;Mra?na pe?ina;Croatia;24.9.2005.;2005-09-24;1f, 1 m;2;Nesticidae;Nesticus;cellulanus;Nesticus cellulanus;;44.909793;15.606582;tf;deep cave;44.90979315.606582;1;;;;;;;;;;;;;;;;;;;;;;
890;Špilja pod Kaštel;Croatia;14.6.2001.;2001-06-14;1 juv f,1 juv m,4 juv;6;Nesticidae;Kryptonesticus;eremita;Kryptonesticus eremita;;42.768041;16.899005;tf;deep cave;42.76804116.899005;2;;15,3;17,5;;;;;;;;;;;;;;;;;;;
892;Špilja Kukelj Sjever;Croatia;3.11.2007.;2007-11-03;1m;1;Agelenidae;Tegenaria;silvestris;Tegenaria silvestris;400;46.293861;16.036898;Tf;deep cave;46.29386116.036898;1;;;;;;;;;;;;;;;;;;;;;;
893;Mandelaja;Croatia;28.1.1995.;1995-01-28;1f;1;Agelenidae;Tegenaria;silvestris;Tegenaria silvestris;;45.233397;15.30015;Tf;deep cave;45.23339715.30015;7;;;;;;;;;;;;;;;;;;;;;;
895;Tunel u Markuševcu;Croatia;10.4.2005.;2005-04-10;1f,1 juv m;2;Nesticidae;Nesticus;cellulanus;Nesticus cellulanus;;45.890469;15.991149;tf;deep cave;45.89046915.991149;2;;;;;;;;;;;;;;;;;;;;;;
898;Tunel u Markuševcu;Croatia;10.4.2005.;2005-04-10;1 m, 1 juv;2;Nesticidae;Nesticus;cellulanus;Nesticus cellulanus;;45.890469;15.991149;tf;deep cave;45.89046915.991149;2;;;;;;;;;;;;;;;;;;;;;;
905;Francuski rudnik 3;Croatia;24.11.2004.;2004-11-24;1juv m;1;Nesticidae;Nesticus;cellulanus;Nesticus cellulanus;;45.905584;15.940186;;deep cave;45.90558415.940186;2;;;;;;;;;;;;;;;;;;;;;;
908;Velika pe? (Rog);Croatia;20.3.2005.;2005-03-20;2 juv;2;Nesticidae;Nesticus;cellulanus;Nesticus cellulanus;;45.93776;16.06234;tf;deep cave;45.9377616.06234;4;;;;;;;;;;;;;;;;;;;;;;
909;Tunel u Markuševcu;Croatia;10.4.2005.;2005-04-10;1f,1 juv;2;Nesticidae;Nesticus;cellulanus;Nesticus cellulanus;;45.890469;15.991149;tf;deep cave;45.89046915.991149;2;;;;;;;;;;;;;;;;;;;;;;
913;Kosi?ev ponor;Croatia;20.5.2005.;2005-05-20;1 m;1;Nesticidae;Nesticus;cellulanus;Nesticus cellulanus;305;45.835763;15.846355;tf;deep cave;45.83576315.846355;2;;;;;;;;;;;;;;;;;;;;;;
917;Jama Vrap?anka;Croatia;8.2.2004.;2004-02-08;1 juv;1;Nesticidae;Nesticus;cellulanus;Nesticus cellulanus;397;45.848567;15.892337;;deep cave;45.84856715.892337;3;;;;;;;;;;;;;;;;;;;;;;
918;Križevš?ak spring;Croatia;28.5.2005.;2005-05-28;1 m;1;Nesticidae;Nesticus;cellulanus;Nesticus cellulanus;;45.837713;15.858133;tf;cave entrance;45.83771315.858133;2;;;;;;;;;;;;;;;;;;;;;;
924;Špilja Mikuli?ka;Croatia;7.2.1999.;1999-02-07;1m, 1 juv;2;Tetragnathidae;Metellina;merianae;Metellina merianae;585;45.759693;15.527832;Tf;deep cave;45.75969315.527832;1;;;;;;;;;;;;;;;;;;;;;;
926;Veternica;Croatia;13.5.2004.;2004-05-13;1 juv m;1;Nesticidae;Nesticus;cellulanus;Nesticus cellulanus;330;45.841058;15.873642;tf;deep cave;45.84105815.873642;6;;;;;;;;;;;;;;;;;;;;;;
929;Francuski rudnik 1;Croatia;16.4.2005.;2005-04-16;1 f;1;Nesticidae;Nesticus;cellulanus;Nesticus cellulanus;;45.91305;15.940454;tf;deep cave;45.9130515.940454;3;;;;;;;;;;;;;;;;;;;;;;
935;Jama Vrap?anka;Croatia;8.2.2004.;2004-02-08;1f;1;Linyphiidae;Gen.;sp. X;Gen. sp. X;397;45.848567;15.892337;;;45.84856715.892337;3;;;;;;;;;;;;;;;;;;;;;;
936;Oko Tisinog ponora;Croatia;22.5.2005.;2005-05-22;1f, 1 juv;2;Nesticidae;Gen.;sp.;Gen. sp.;649;45.918842;15.963461;;Shallow subterranean habitat;45.91884215.963461;2;;;;;;;;;;;;;;;;;;;;;;
937;Grgosova špilja stara;Croatia;13.10.2004.;2004-10-13;1 m,1 juv m;2;Nesticidae;Gen.;sp.;Gen. sp.;240;45.818969;15.67855;;deep cave;45.81896915.67855;6;;;;;;;;;;;;;;;;;;;;;;
939;Jama kraj ceste u Plitvi?kom klancu (ispred);Croatia;23.9.2005.;2005-09-23;1m;1;Agelenidae;Histopona;torpida;Histopona torpida;499;44.912378;15.599213;Tx;shallow subterranean habitat;44.91237815.599213;1;;;;;;;;;;;;;;;;;;;;;;
941;Tunel u Markuševcu;Croatia;10.4.2005.;2005-04-10;1 m;1;Agelenidae;Histopona;torpida;Histopona torpida;;45.890469;15.991149;Tx;deep cave;45.89046915.991149;2;;;;;;;;;;;;;;;;;;;;;;
944;Golubinka, Desne;Croatia;23.7.1997.;1997-07-23;2 juv m;2;Agelenidae;Histopona;sp.;Histopona sp.;40;43.065371;17.527293;;deep cave;43.06537117.527293;3;;;;;;;;;;;;;;;;;;;;;;
946;Špilja u Solinama;Croatia;18.6.2001.;2001-06-18;1 f;1;Agelenidae;Histopona;bidens;Histopona bidens;17;42.768021;17.377062;tb;deep cave;42.76802117.377062;5;;;7,6;;;;;;;;;;;;;;;;;;;
953;Kosi?ev ponor;Croatia;26.5.2005.;2005-05-26;1juv;1;Nesticidae;Nesticus;cellulanus;Nesticus cellulanus;305;45.835763;15.846355;tf;deep cave;45.83576315.846355;2;;;;;;;;;;;;;;;;;;;;;;
954;Šupljara;Croatia;24.9.2006.;2006-09-24;1 juv;1;Agelenidae;Tegenaria;sp.;Tegenaria sp.;;44.899906;15.612099;;deep cave;44.89990615.612099;5;;;;;;;;;;;;;;;;;;;;;;
956;Jamina, Biokovo;Croatia;28.10.2003.;2003-10-28;1 f;1;Agelenidae;Histopona;conveniens;Histopona conveniens;617;43.386358;16.925277;Tf;deep cave;43.38635816.925277;4;;;;;;;;;;;;;;;;;;;;;;
957;Kraljevska jama na Gulišini;Croatia;26.9.2000.;2000-09-26;1 juv;1;Agelenidae;Hadites;tegenarioides;Hadites tegenarioides;;43.133120;16.744319;TB;deep cave;43.13312016.744319;3;;;;;;;;;;;;;;;;;;;;;;
958;Jama pod Humcem;Croatia;7.8.1997.;1997-08-07;1juv f, 1 juv;2;Agelenidae;Hadites;tegenarioides;Hadites tegenarioides;;43.138508;16.76188;TB;deep cave;43.13850816.76188;1;;;;;;;;;;;;;;;;;;;;;;
959;Špilja Šparova greda;Croatia;2.3.2002.;2002-03-02;1 juv m;1;Agelenidae;Textrix;sp.;Textrix sp.;;43.811864;16.51955;;deep cave;43.81186416.51955;2;;;;;;;;;;;;;;;;;;;;;;
960;Jama pod Sv. Spasom;Croatia;17.6.2001.;2001-06-17;1f, 1m,5 juv;7;Agelenidae;Histopona;bidens;Histopona bidens;;42.731779;17.542409;tb;deep cave;42.73177917.542409;6;;;;;;;;;;;;;;;;;;;;;;
961;?olnja?a;Croatia;19.1.1997.;1997-01-19;1 juv;1;Agelenidae;Histopona;sp.;Histopona sp.;;43.409175;16.88745;;deep cave;43.40917516.88745;4;;;;;;;;;;;;;;;;;;;;;;
962;Kukor;Croatia;27.7.2004.;2004-07-27;1 juv;1;Agelenidae;Histopona;sp.;Histopona sp.;425;43.355609;16.991707;;deep cave;43.35560916.991707;10;;;;;;;;;;;;;;;;;;;;;;
964;Špilja pod Kapelu;Croatia;13.4.2003.;2003-04-13;1 juv m, 1 juv;2;Agelenidae;Hadites;tegenarioides;Hadites tegenarioides;;43.184949;16.434233;TB;deep cave;43.18494916.434233;5;;;;;;;;;;;;;;;;;;;;;;
965;Vlastelinka jama;Croatia;26.3.2003.;2003-03-26;2 juv;2;Agelenidae;Histopona;sp.;Histopona sp.;410;43.269635;17.211206;;deep cave;43.26963517.211206;2;;;;;;;;;;;;;;;;;;;;;;
966;Jama na Teruncu;Croatia;26.7.2003.;2003-07-26;1f, 1 juv;2;Agelenidae;Hadites;tegenarioides;Hadites tegenarioides;244;43.13221;16.991729;TB;deep cave;43.1322116.991729;2;;;;;;;;;;;;;;;;;;;;;;
968;Modri? špilja;Croatia;20.9.2003.;2003-09-20;1 juv m;1;Agelenidae;Histopona;sp.;Histopona sp.;;44.25684;15.537248;;deep cave;44.2568415.537248;1;;;;;;;;;;;;;;;;;;;;;;
970;Drinova 2;Croatia;23.3.2003.;2003-03-23;1 juv m;1;Agelenidae;Histopona;sp.;Histopona sp.;725;43.407702;16.942899;;deep cave;43.40770216.942899;3;;;;;;;;;;;;;;;;;;;;;;
971;Kraljevska jama na Gulišini;Croatia;27.2.1999.;1999-02-27;1f, 2 juv;3;Agelenidae;Hadites;tegenarioides;Hadites tegenarioides;;43.133120;16.744319;TB;deep cave;43.13312016.744319;3;;;;;;;;;;;;;;;;;;;;;;
972;Ješkalovica;Croatia;4.1.2009.;2009-01-04;1 f,1 juv;2;Nesticidae;Kryptonesticus;eremita;Kryptonesticus eremita;155;43.299857;16.839313;tf;deep cave;43.29985716.839313;2;;;;;;;;;;;;;;;;;;;;;;
973;Pavši?a pe?a;Croatia;30.7.2007.;2007-07-30;3m, 1f, 3 juv;7;Nesticidae;Kryptonesticus;eremita;Kryptonesticus eremita;520;43.786027;16.665515;tf;deep cave;43.78602716.665515;2;;;;;;;;;;;;;;;;;;;;;;
974;Spilja od Tankega rota;Croatia;9.1.2000.;2000-01-09;4 f;4;Nesticidae;Kryptonesticus;eremita;Kryptonesticus eremita;115;43.012832;16.111537;tf;deep cave;43.01283216.111537;1;;;;;;;;;;;;;;;;;;;;;;
975;Kraljevska jama na Gulišini;Croatia;27.2.1999.;1999-02-27;3 f;3;Nesticidae;Kryptonesticus;eremita;Kryptonesticus eremita;146;43.133120;16.744319;tf;deep cave;43.13312016.744319;3;;;;;;;;;;;;;;;;;;;;;;
976;Špilja na Vršinoj glavici;Croatia;30.7.2007.;2007-07-30;1f, 1juv;2;Nesticidae;Kryptonesticus;eremita;Kryptonesticus eremita;709;43.70718;16.7843;tf;deep cave;43.7071816.7843;2;;;;;;;;;;;;;;;;;;;;;;
977;Kraljevska jama na Gulišini;Croatia;5.8.1997.;1997-08-05;2 f;2;Nesticidae;Kryptonesticus;eremita;Kryptonesticus eremita;146;43.133120;16.744319;tf;deep cave;43.13312016.744319;3;;;;;;;;;;;;;;;;;;;;;;
978;Živa voda;Croatia;9.-10.4.2004.;2004-04-09/2004-04-10;4 juv;4;Nesticidae;Kryptonesticus;eremita;Kryptonesticus eremita;;43.116808;17.050393;tf;deep cave;43.11680817.050393;1;;;;;;;;;;;;;;;;;;;;;;
979;Dan?evi?a jama;Croatia;18.9.2005.;2005-09-18;1 f;1;Nesticidae;Kryptonesticus;eremita;Kryptonesticus eremita;;43.14142;16.75466;Tf;deep cave;43.1414216.75466;2;;;;;;;;;;;;;;;;;;;;;;
981;Kraljicina špilja;Croatia;3.4.1995.;1995-04-03;1f, 1 juv;2;Nesticidae;Kryptonesticus;eremita;Kryptonesticus eremita;;43.073661;16.100773;tf;deep cave;43.07366116.100773;2;;;;;;;;;;;;;;;;;;;;;;
983;Špilja Šparova greda;Croatia;2.3.2002.;2002-03-02;1f;1;Nesticidae;Kryptonesticus;eremita;Kryptonesticus eremita;;43.811864;16.51955;tf;deep cave;43.81186416.51955;2;;;;;;;;;;;;;;;;;;;;;;
984;Brajkovica;Croatia;11.1.2000.;2000-01-11;1f, 1 juv;2;Nesticidae;Kryptonesticus;eremita;Kryptonesticus eremita;;43.042669;16.099975;tf;deep cave;43.04266916.099975;2;;;;;;;;;;;;;;;;;;;;;;
985;Živa voda;Croatia;9.8.1997.;1997-08-09;1f;1;Nesticidae;Kryptonesticus;eremita;Kryptonesticus eremita;;43.116808;17.050393;tf;deep cave;43.11680817.050393;1;;;;;;;;;;;;;;;;;;;;;;
986;Živa voda;Croatia;27.-28.9.2000.;2000-09-27/2000-09-28;4 juv;4;Nesticidae;Kryptonesticus;eremita;Kryptonesticus eremita;;43.116808;17.050393;tf;deep cave;43.11680817.050393;1;;;;;;;;;;;;;;;;;;;;;;
987;Dujina jama;Croatia;17.10.1999.;1999-10-17;3f, 1 juv m;4;Nesticidae;Kryptonesticus;eremita;Kryptonesticus eremita;77;43.489889;16.06565;tf;deep cave;43.48988916.06565;1;;;;;;;;;;;;;;;;;;;;;;
988;Živa voda;Croatia;9.-10.4.2004.;2004-04-09/2004-04-10;1juv m, 1 juv;2;Nesticidae;Kryptonesticus;eremita;Kryptonesticus eremita;;43.116808;17.050393;tf;deep cave;43.11680817.050393;1;;;;;;;;;;;;;;;;;;;;;;
990;Kraljicina špilja;Croatia;10.1.2000.;2000-01-10;5 f,1 juv m,6 juv;12;Nesticidae;Kryptonesticus;eremita;Kryptonesticus eremita;;43.073661;16.100773;tf;deep cave;43.07366116.100773;2;;;;;;;;;;;;;;;;;;;;;;
992;Franetova jama;Croatia;28.2.1999.;1999-02-28;2f;2;Nesticidae;Kryptonesticus;eremita;Kryptonesticus eremita;;43.1361;16.9384;tf;deep cave;43.136116.9384;2;;;;;;;;;;;;;;;;;;;;;;
993;Špilja iznad Grap?eve špilje;Croatia;17.9.1995.;1995-09-17;1f;1;Nesticidae;Kryptonesticus;eremita;Kryptonesticus eremita;;43.137114;16.753747;tf;deep cave;43.13711416.753747;1;;;;;;;;;;;;;;;;;;;;;;
994;Tužna jama;Croatia;9.1.2000.;2000-01-09;1f, 1 juv;2;Nesticidae;Kryptonesticus;eremita;Kryptonesticus eremita;302;43.059014;16.137969;tf;deep cave;43.05901416.137969;1;;;;;;;;;;;;;;;;;;;;;;
997;Kraljevska jama na Gulišini;Croatia;26.9.2000.;2000-09-26;1 juv;1;Nesticidae;Kryptonesticus;eremita;Kryptonesticus eremita;;43.133120;16.744319;tf;deep cave;43.13312016.744319;3;;;;;;;;;;;;;;;;;;;;;;
998;Bežmekova jama;Croatia;29.9.1996.;1996-09-29;2 juv;2;Nesticidae;Kryptonesticus;eremita;Kryptonesticus eremita;565;43.311389;16.625833;;deep cave;43.31138916.625833;1;;;;;;;;;;;;;;;;;;;;;;
999;Kraljevska jama na Gulišini;Croatia;2.4.2005.;2005-04-02;1 juv m;1;Nesticidae;Kryptonesticus;eremita;Kryptonesticus eremita;;43.133120;16.744319;tf;deep cave;43.13312016.744319;3;;;;;;;;;;;;;;;;;;;;;;
1001;Škrabuljica;Croatia;11.3.2003.;2003-03-11;1 juv;1;Dysderidae;Stalagtia;sp. 2;Stalagtia sp. 2;685;42.567045;18.385063;Tb;deep cave;42.56704518.385063;5;;8,1;11,025;;;;;;;;;;;;;;;;;;;
1002;Vratolomka;Croatia;31.7.2006.;2006-07-31;1 f;1;Agelenidae;Histopona;egonpretneri;Histopona egonpretneri;35;44.191701;15.785015;Tb;deep cave;44.19170115.785015;2;;;;;;;;;;;;;;;;;;;;;;
1003;Špilja kod mlina Miljacki (Miljacka 4);Croatia;6.1.2005.;2005-01-06;2 juv;2;Agelenidae;Tegenaria;sp.;Tegenaria sp.;175;44.003485;16.019087;;deep cave;44.00348516.019087;2;;;;;;;;;;;;;;;;;;;;;;
1004;Tradanj;Croatia;8.1.2005.;2005-01-08;1f;1;Agelenidae;Tegenaria;domestica;Tegenaria domestica;;43.793104;15.845439;Tf;deep cave;43.79310415.845439;3;;;;;;;;;;;;;;;;;;;;;;
1005;Miljacka 2;Croatia;6.1.2005.;2005-01-06;1f;1;Agelenidae;Gen.;sp.;Gen. sp.;;44.0002;16.016234;;deep cave;44.000216.016234;4;;;;;;;;;;;;;;;;;;;;;;
1008;Topla pe?ina;Croatia;7.1.2005.;2005-01-07;1 f,3 juv;4;Nesticidae;Kryptonesticus;eremita;Kryptonesticus eremita;;43.839254;16.0536;tf;deep cave;43.83925416.0536;4;;;;;;;;;;;;;;;;;;;;;;
1009;Miljacka 2;Croatia;6.1.2005.;2005-01-06;2f, 1m;3;Nesticidae;Kryptonesticus;eremita;Kryptonesticus eremita;;44.0002;16.016234;tf;deep cave;44.000216.016234;4;;;;;;;;;;;;;;;;;;;;;;
1011;Špilja kod Vilišnice;Croatia;4.5.2005.;2005-05-04;1f;1;Nesticidae;Kryptonesticus;eremita;Kryptonesticus eremita;;43.960355;15.450916;tf;deep cave;43.96035515.450916;2;;;;;;;;;;;;;;;;;;;;;;
1014;Mili?a špilja;Croatia;30.7.2006.;2006-07-30;1 f;1;Nesticidae;Kryptonesticus;eremita;Kryptonesticus eremita;;44.143333;15.803133;tf;deep cave;44.14333315.803133;1;;;;;;;;;;;;;;;;;;;;;;
1015;Tradanj;Croatia;8.1.2005.;2005-01-08;1 f;1;Theridiidae;Episinus;cavernicola;Episinus cavernicola;;43.793104;15.845439;Tf;deep cave;43.79310415.845439;3;;;;;;;;;;;;;;;;;;;;;;
1018;Špilja kod Vilišnice;Croatia;4.5.2005.;2005-05-04;1 m,2 juv;3;Nesticidae;Kryptonesticus;eremita;Kryptonesticus eremita;;43.960355;15.450916;tf;deep cave;43.96035515.450916;2;;;;;;;;;;;;;;;;;;;;;;
1021;Jezero, Iž;Croatia;30.7.1995.;1995-07-30;2 f,1 juv;3;Nesticidae;Kryptonesticus;eremita;Kryptonesticus eremita;;44.030833;15.132778;Tf;deep cave;44.03083315.132778;1;;;;;;;;;;;;;;;;;;;;;;
1022;Topla pe?ina;Croatia;7.1.2005.;2005-01-07;2 f,1 m,1 juv;4;Nesticidae;Kryptonesticus;eremita;Kryptonesticus eremita;;43.839254;16.0536;tf;deep cave;43.83925416.0536;4;;;;;;;;;;;;;;;;;;;;;;
1023;Stražbenica;Croatia;29.3.2005.;2005-03-29;1 f,1 juv m,3 juv;5;Nesticidae;Kryptonesticus;eremita;Kryptonesticus eremita;;43.697353;16.029618;tf;deep cave;43.69735316.029618;3;;;;;;;;;;;;;;;;;;;;;;
1024;Drenova?a;Croatia;12.10.2003.;2003-10-12;1 f;1;Nesticidae;Kryptonesticus;eremita;Kryptonesticus eremita;;43.954975;15.946464;tf;deep cave;43.95497515.946464;2;;;;;;;;;;;;;;;;;;;;;;
1025;Tavnica;Croatia;8.1.2005.;2005-01-08;2 f,3 juv;5;Nesticidae;Kryptonesticus;eremita;Kryptonesticus eremita;;43.972099;15.947296;tf;deep cave;43.97209915.947296;3;;;;;;;;;;;;;;;;;;;;;;
1026;Stražbenica;Croatia;31.1.2001.;2001-01-31;1 f,1 juv m;2;Nesticidae;Kryptonesticus;eremita;Kryptonesticus eremita;;43.697353;16.029618;tf;deep cave;43.69735316.029618;3;;;;;;;;;;;;;;;;;;;;;;
1027;Velika Kusa?a;Croatia;29.7.2003.;2003-07-29;1 juv;1;Nesticidae;Kryptonesticus;eremita;Kryptonesticus eremita;;44.139892;15.842169;tf;deep cave;44.13989215.842169;1;;;;;;;;;;;;;;;;;;;;;;
1030;Mili?a špilja;Croatia;30.7.2006.;2006-07-30;1 f, 3 juv;4;Nesticidae;Kryptonesticus;eremita;Kryptonesticus eremita;;44.143333;15.803133;tf;deep cave;44.14333315.803133;1;;;;;;;;;;;;;;;;;;;;;;
1031;Mala Kusa?a;Croatia;29.7.2006.;2006-07-29;1 f,1 m,1juv;3;Nesticidae;Kryptonesticus;eremita;Kryptonesticus eremita;;44.139831;15.842079;tf;deep cave;44.13983115.842079;2;;;;;;;;;;;;;;;;;;;;;;
1032;Maksimova špilja;Croatia;22.4.2006.;2006-04-22;1 juv;1;Nesticidae;Nesticus;cellulanus;Nesticus cellulanus;493;45.518313;17.68695;tf;deep cave;45.51831317.68695;3;;;;;;;;;;;;;;;;;;;;;;
1033;Trbušnjak;Croatia;29.7.2006.;2006-07-29;1f;1;Nesticidae;Nesticus;cellulanus;Nesticus cellulanus;185;45.495969;17.263219;tf;deep cave;45.49596917.263219;3;;;;;;;;;;;;;;;;;;;;;;
1034;Trbušnjak;Croatia;10.6.2007.;2007-06-10;1 m;1;Nesticidae;Nesticus;cellulanus;Nesticus cellulanus;;45.495969;17.263219;tf;deep cave;45.49596917.263219;3;;;;;;;;;;;;;;;;;;;;;;
1035;Sokolina špilja;Croatia;19.7.2004.;2004-07-19;1 m;1;Nesticidae;Nesticus;cellulanus;Nesticus cellulanus;;45.461454;17.566155;Tf;deep cave;45.46145417.566155;1;;;;;;;;;;;;;;;;;;;;;;
1047;Uviraljka;Croatia;23.4.2006.;2006-04-23;1m;1;Agelenidae;Histopona;luxurians;Histopona luxurians;810;45.522243;17.62067;tf;deep cave;45.52224317.62067;3;;;;;;;;;;;;;;;;;;;;;;
1048;Medvje?a špilja, Mali Lošinj;Croatia;20.3.2005.;2005-03-20;1f,1 juv m;2;Nesticidae;Kryptonesticus;eremita;Kryptonesticus eremita;;44.605518;14.40794;tf;deep cave;44.60551814.40794;1;;;;;;;;;;;;;;;;;;;;;;
1050;Biserujka;Croatia;19.10.2000.;2000-10-19;1f;1;Nesticidae;Kryptonesticus;eremita;Kryptonesticus eremita;;45.187464;14.60981;tf;deep cave;45.18746414.60981;1;;;;;;;;;;;;;;;;;;;;;;
1051;Jama Baredine;Croatia;31.10.1998.;1998-10-31;1f,1 juv m;2;Nesticidae;Kryptonesticus;eremita;Kryptonesticus eremita;;45.270267;13.661985;tf;deep cave;45.27026713.661985;1;;;;;;;;;;;;;;;;;;;;;;
1052;Medova buža;Croatia;29.5.2001.;2001-05-29;1 f;1;Nesticidae;Kryptonesticus;eremita;Kryptonesticus eremita;;44.813345;14.745867;;deep cave;44.81334514.745867;1;;;;;;;;;;;;;;;;;;;;;;
1055;Sedrena špilja iza mlina;Croatia;3.5.2010.;2010-05-03;1m;1;Leptonetidae;Barusia;maheni;Barusia maheni;198;44.013402;16.067798;tf;deep cave;44.01340216.067798;6;;;;;;;;;;;;;;;;;;;;;;
1056;Piskovica;Croatia;13.5.2002.;2002-05-13;1 f;1;Nesticidae;Kryptonesticus;eremita;Kryptonesticus eremita;315;45.26207;14.03692;tf;deep cave;45.2620714.03692;1;;;;;;;;;;;;;;;;;;;;;;
1058;?ampari;Croatia;20.10.2000.;2000-10-20;1 m,1 juv;2;Agelenidae;Tegenaria;silvestris;Tegenaria silvestris;312;45.123809;14.333655;Tf;deep cave;45.12380914.333655;4;;;;;;;;;;;;;;;;;;;;;;
1059;Oštirova jama;Croatia;18.9.2007.;2007-09-18;1f,1 juv;2;Agelenidae;Tegenaria;sp. 1;Tegenaria sp. 1;740;45.355854;14.123988;SubTf?;deep cave;45.35585414.123988;3;;;;;;;;;;;;;;;;;;;;;;
1060;Jama za greben;Croatia;6.11.2006.;2006-11-06;1juv;1;Agelenidae;Tegenaria;sp.;Tegenaria sp.;;45.314602;14.205191;SubTf?;deep cave;45.31460214.205191;1;;;;;;;;;;;;;;;;;;;;;;
1061;Pe?ina poli vrti?a;Croatia;6.11.2006.;2006-11-06;1f;1;Agelenidae;Tegenaria;silvestris;Tegenaria silvestris;;45.327434;14.180962;Tf;deep cave;45.32743414.180962;1;;;;;;;;;;;;;;;;;;;;;;
1063;Jama u Krogu;Croatia;15.9.2007.;2007-09-15;1f;1;Agelenidae;Tegenaria;sp. 1;Tegenaria sp. 1;;45.378389;14.16897;SubTf?;deep cave;45.37838914.16897;2;;;;;;;;;;;;;;;;;;;;;;
1064;Markova jama kod Tara;Croatia;12.5.2001.;2001-05-12;2f,1 juv m,5 juv;8;Nesticidae;Kryptonesticus;eremita;Kryptonesticus eremita;95;45.319298;13.631373;tf;deep cave;45.31929813.631373;7;;;;;;;;;;;;;;;;;;;;;;
1066;Romualdova špilja;Croatia;28.8.1997.;1997-08-28;1f,1 juv;2;Nesticidae;Kryptonesticus;eremita;Kryptonesticus eremita;120;45.127466;13.737433;tf;deep cave;45.12746613.737433;1;;;;;;;;;;;;;;;;;;;;;;
1068;Piskovica;Croatia;6.8.2003.;2003-08-06;1f;1;Nesticidae;Kryptonesticus;eremita;Kryptonesticus eremita;315;45.26207;14.03692;tf;deep cave;45.2620714.03692;1;;;;;;;;;;;;;;;;;;;;;;
1069;Kus;Croatia;2.11.2001.;2001-11-02;1 juv m;1;Nesticidae;Kryptonesticus;eremita;Kryptonesticus eremita;165;44.814755;14.426275;;deep cave;44.81475514.426275;2;;;;;;;;;;;;;;;;;;;;;;
1070;Rupe 1;Croatia;17.9.2007.;2007-09-17;1f;1;Agelenidae;Tegenaria;silvestris;Tegenaria silvestris;;45.253697;14.199858;Tf;deep cave;45.25369714.199858;1;;;;;;;;;;;;;;;;;;;;;;
1071;Jama u Krogu;Croatia;15.9.1997.;1997-09-15;1f;1;Agelenidae;Tegenaria;sp. 1;Tegenaria sp. 1;;45.378389;14.16897;SubTf?;deep cave;45.37838914.16897;2;;;;;;;;;;;;;;;;;;;;;;
1076;Jama Ikinica;Croatia;13.8.2001.;2001-08-13;1 juv;1;Nesticidae;Kryptonesticus;eremita;Kryptonesticus eremita;;44.924393;13.947791;;deep cave;44.92439313.947791;3;;;;;;;;;;;;;;;;;;;;;;
1082;Jama kod potoka Banine 3;Croatia;4.11.2006.;2006-11-04;1 f;1;Nesticidae;Kryptonesticus;eremita;Kryptonesticus eremita;509;45.313714;14.242713;Tf;deep cave;45.31371414.242713;3;;;;;;;;;;;;;;;;;;;;;;
1088;Sini?i? špilja;Croatia;7.10.2006.;2006-10-07;1f,1 juv m;2;Agelenidae;Tegenaria;silvestris;Tegenaria silvestris;;44.990698;15.177848;Tf;deep cave;44.99069815.177848;6;;;;;;;;;;;;;;;;;;;;;;
1090;Vrelo 2;Croatia;6.9.1995.;1995-09-06;1m;1;Agelenidae;Tegenaria;silvestris;Tegenaria silvestris;;45.326489;14.704217;Tf;deep cave;45.32648914.704217;8;;;;;;;;;;;;;;;;;;;;;;
1092;Vrtare male;Croatia;7.10.2006.;2006-10-07;1f,1m,1 juv;3;Nesticidae;Kryptonesticus;eremita;Kryptonesticus eremita;;45.197431;14.660523;tf;deep cave;45.19743114.660523;1;;;;;;;;;;;;;;;;;;;;;;
1094;Vrtare male;Croatia;10.7.2005.;2005-07-10;1 juv m;1;Nesticidae;Kryptonesticus;eremita;Kryptonesticus eremita;;45.197431;14.660523;tf;deep cave;45.19743114.660523;1;;;;;;;;;;;;;;;;;;;;;;
1098;Mramornica, Lika;Croatia;30.6.1999.;1999-06-30;1f;1;Theridiidae;Gen.;sp.;Gen. sp.;;44.772186;15.181912;;;44.77218615.181912;2;;;;;;;;;;;;;;;;;;;;;;
1106;Piliš?e;Croatia;6.2.1999.;1999-02-06;1f;1;Agelenidae;Inermocoelotes;inermis;Inermocoelotes inermis;;46.231366;16.511903;;deep cave;46.23136616.511903;1;;;;;;;;;;;;;;;;;;;;;;
1108;Vila;Croatia;6.11.2007.;2007-11-06;1f;1;Nesticidae;Nesticus;cellulanus;Nesticus cellulanus;613;46.265771;15.995721;tf;deep cave;46.26577115.995721;2;;;;;;;;;;;;;;;;;;;;;;
1115;Jama u Dubokom dolu;Croatia;27.4.2004.;2004-04-27;1 f,4 juv;5;Linyphiidae;Typhlonyphia;reimoseri;Typhlonyphia reimoseri;;42.946895;17.022321;tb;deep cave;42.94689517.022321;3;;;;;;;;;;;;;;;;;;;;;;
1116;Jama MB3;Croatia;23.6.2005.;2005-06-23;1f, 1 juv m;2;Linyphiidae;Troglohyphantes;sp. 14;Troglohyphantes sp. 14;;44.362422;15.490195;tb;deep cave;44.36242215.490195;1;;;;;;;;;;;;;;;;;;;;;;
1117;Špilja u zubu Buljme;Croatia;13.9.2006.;2006-09-13;1 f;1;Linyphiidae;Troglohyphantes;sp. 14;Troglohyphantes sp. 14;;44.366906;15.470541;tb;deep cave;44.36690615.470541;1;;;;;;;;;;;;;;;;;;;;;;
1118;Špilja pod Velji vrh;Croatia;25.4.2004.;2004-04-25;1 f;1;Linyphiidae;Typhlonyphia;reimoseri;Typhlonyphia reimoseri;;42.953716;17.039919;tb;deep cave;42.95371617.039919;2;;;;;;;;;;;;;;;;;;;;;;
1119;Bošak jama;Croatia;21.3.2004.;2004-03-21;1 f,5 juv;6;Linyphiidae;Typhlonyphia;sp. 1;Typhlonyphia sp. 1;739;43.347996;17.100045;Tb;deep cave;43.34799617.100045;2;;;;;;;;;;;;;;;;;;;;;;
1120;?ampari;Croatia;20.10.2000.;2000-10-20;1 m;1;Linyphiidae;Troglohyphantes;liburnicus;Troglohyphantes liburnicus;312;45.123809;14.333655;Tb;deep cave;45.12380914.333655;4;;;;;;;;;;;;;;;;;;;;;;
1121;Rastova?a;Croatia;2.8.2005.;2005-08-02;2 f,4 juv;6;Linyphiidae;Troglohyphantes;roberti;Troglohyphantes roberti;380;44.233742;15.698969;tb;deep cave;44.23374215.698969;2;;;;;;;;;;;;;;;;;;;;;;
1122;Jama pod Osojem;Croatia;28.10.2008.;2008-10-28;1f, 1m;2;Linyphiidae;Typhlonyphia;sp. 1;Typhlonyphia sp. 1;;43.251441;17.118374;Tb;deep cave;43.25144117.118374;3;;;;;;;;;;;;;;;;;;;;;;
1123;Bršljanovica;Croatia;22.3.1997.;1997-03-22;1 f;1;Linyphiidae;Troglohyphantes;brignolii;Troglohyphantes brignolii;;45.348192;14.134112;tb;deep cave;45.34819214.134112;1;;;;;;;;;;;;;;;;;;;;;;
1124;Kapaljka 1;Croatia;1.6.1997.;1997-06-01;3 f,1 m;4;Linyphiidae;Troglohyphantes;croaticus;Troglohyphantes croaticus;;45.459187;14.675404;Tb;deep cave;45.45918714.675404;2;;;;;;;;;;;;;;;;;;;;;;
1125;Jama na Horvatovoj stazi;Croatia;2.8.2003.;2003-08-02;1 f,1 m;2;Linyphiidae;Troglohyphantes;croaticus;Troglohyphantes croaticus;850;45.426902;14.67011;Tb;deep cave;45.42690214.67011;1;;;;;;;;;;;;;;;;;;;;;;
1126;Volareva jama;Croatia;25.3.1999.;1999-03-25;1f;1;Linyphiidae;Troglohyphantes;liburnicus;Troglohyphantes liburnicus;;45.414689;14.300831;Tb;deep cave;45.41468914.300831;1;;;;;;;;;;;;;;;;;;;;;;
1128;Mar?ina jama;Croatia;6.4.1997.;1997-04-06;1 f;1;Linyphiidae;Troglohyphantes;strandi;Troglohyphantes strandi;;43.597526;16.221955;tb;deep cave;43.59752616.221955;1;;;;;;;;;;;;;;;;;;;;;;
1129;Ponor Vele vode;Croatia;12.7.2004.;2004-07-12;1 f,2 juv;3;Linyphiidae;Troglohyphantes;croaticus;Troglohyphantes croaticus;680;45.418527;14.693695;Tb;deep cave;45.41852714.693695;3;;;;;;;;;;;;;;;;;;;;;;
1130;Sinkhole in Javorje;Croatia;18.7.1999.;1999-07-18;1 m;1;Linyphiidae;Troglohyphantes;excavatus;Troglohyphantes excavatus;;45.096444;14.916321;tf;shallow subterranean habitat;45.09644414.916321;1;;;;;;;;;;;;;;;;;;;;;;
1131;Brezdanja?a na Stražbenici;Croatia;15.8.1993.;1993-08-15;1f;1;Linyphiidae;Troglohyphantes;liburnicus;Troglohyphantes liburnicus;;45.26712;14.691436;Tb;deep cave;45.2671214.691436;4;;;;;;;;;;;;;;;;;;;;;;
1132;Gordanova jama;Croatia;23.4.2000.;2000-04-23;1f;1;Linyphiidae;Troglohyphantes;croaticus;Troglohyphantes croaticus;875;45.455731;14.792266;Tb;deep cave;45.45573114.792266;2;;;;;;;;;;;;;;;;;;;;;;
1133;Poputna jama;Croatia;30.7.2003.;2003-07-30;1f;1;Linyphiidae;Troglohyphantes;croaticus;Troglohyphantes croaticus;1292;45.435917;14.61605;Tb;deep cave;45.43591714.61605;1;;;;;;;;;;;;;;;;;;;;;;
1134;Brezdanja?a na Stražbenici;Croatia;15.8.1993.;1993-08-15;1 m;1;Linyphiidae;Troglohyphantes;croaticus;Troglohyphantes croaticus;;45.26712;14.691436;Tb;deep cave;45.2671214.691436;4;;;;;;;;;;;;;;;;;;;;;;
1135;Kuštrovka;Croatia;13.12.2003.;2003-12-13;2 f;2;Linyphiidae;Troglohyphantes;croaticus;Troglohyphantes croaticus;450;45.346234;15.219338;Tb;deep cave;45.34623415.219338;3;;;;;;;;;;;;;;;;;;;;;;
1136;Jama Štemajzlinka;Croatia;2.8.2003.;2003-08-02;1 f;1;Linyphiidae;Troglohyphantes;croaticus;Troglohyphantes croaticus;963;45.462153;14.613912;Tb;deep cave;45.46215314.613912;1;;;;;;;;;;;;;;;;;;;;;;
1137;Gornja Bara?eva;Croatia;17.5.2004.;2004-05-17;3 f;3;Linyphiidae;Troglohyphantes;excavatus;Troglohyphantes excavatus;;44.983895;15.721656;tf;deep cave;44.98389515.721656;8;;;;;;;;;;;;;;;;;;;;;;
1138;Špilja kod Turkovi?a;Croatia;1.7.2004.;2004-07-01;1 m;1;Linyphiidae;Troglohyphantes;croaticus;Troglohyphantes croaticus;;45.275344;15.164792;Tb;deep cave;45.27534415.164792;1;;;;;;;;;;;;;;;;;;;;;;
1139;Jama na vrtlu u Biljevini;Croatia;23.9.2005.;2005-09-23;1 f;1;Linyphiidae;Troglohyphantes;excavatus;Troglohyphantes excavatus;;44.921647;15.581161;tf;deep cave;44.92164715.581161;2;;;;;;;;;;;;;;;;;;;;;;
1140;Francuski rudnik 1;Croatia;16.4.2004.;2004-04-16;1 f;1;Linyphiidae;Troglohyphantes;excavatus;Troglohyphantes excavatus;;45.91305;15.940454;tf;deep cave;45.9130515.940454;3;;;;;;;;;;;;;;;;;;;;;;
1141;Tounj?ica;Croatia;18.6.2006.;2006-06-18;2 f;2;Linyphiidae;Troglohyphantes;croaticus;Troglohyphantes croaticus;;45.248722;15.322408;Tb;deep cave;45.24872215.322408;5;14;;;;;;;;;;;;;;;;;;;;;
1142;Golubinka više Mrši?a strane;Croatia;5.8.2006.;2006-08-05;2 f;2;Linyphiidae;Troglohyphantes;roberti;Troglohyphantes roberti;;44.12501;15.807683;tb;deep cave;44.1250115.807683;3;;;;;;;;;;;;;;;;;;;;;;
1143;Tounj?ica;Croatia;19.8.1999.;1999-08-19;3 f;3;Linyphiidae;Troglohyphantes;croaticus;Troglohyphantes croaticus;;45.248722;15.322408;Tb;deep cave;45.24872215.322408;5;14;;;;;;;;;;;;;;;;;;;;;
1144;Plantaža;Croatia;11.6.2005.;2005-06-11;1 f;1;Linyphiidae;Troglohyphantes;croaticus;Troglohyphantes croaticus;;45.227501;15.325084;Tb;deep cave;45.22750115.325084;2;;;;;;;;;;;;;;;;;;;;;;
1145;Pe?ina u Topolovcu;Croatia;22.9.2001.;2001-09-22;1 m;1;Linyphiidae;Troglohyphantes;brignolii;Troglohyphantes brignolii;;45.374121;14.193699;Tb;deep cave;45.37412114.193699;2;;;;;;;;;;;;;;;;;;;;;;
1147;?utno;Croatia;27.1.2001.;2001-01-27;1 f,1 juv;2;Linyphiidae;Troglohyphantes;croaticus;Troglohyphantes croaticus;210;45.415607;15.233039;tb;deep cave;45.41560715.233039;4;;;;;;;;;;;;;;;;;;;;;;
1149;Golubinka, Desne;Croatia;23.7.1997.;1997-07-23;1 juv;1;Nesticidae;Kryptonesticus;eremita;Kryptonesticus eremita;40;43.065371;17.527293;;deep cave;43.06537117.527293;3;;;;;;;;;;;;;;;;;;;;;;
1150;Movrica;Croatia;17.6.2001.;2001-06-17;3 f,1 juv;4;Agelenidae;Histopona;bidens;Histopona bidens;;42.752604;17.551145;tb;deep cave;42.75260417.551145;6;12,6;;;;;;;;;;;;;;;;;;;;;
1152;Špilja kod Nerezinog dola;Croatia;2.12.2001.;2001-12-02;1 juv;1;Agelenidae;Histopona;bidens;Histopona bidens;;42.758378;17.436094;tb;deep cave;42.75837817.436094;6;;14,6;12,7875;;;;;;;;;;;;;;;;;;;
1154;Grizeljeva jama;Croatia;8.8.2007.;2007-08-08;2 juv m;2;Nesticidae;Kryptonesticus;eremita;Kryptonesticus eremita;;43.867534;16.399097;;deep cave;43.86753416.399097;5;;;;;;;;;;;;;;;;;;;;;;
1155;Špilja na Gradini kod Premanture;Croatia;13.7.2005.;2005-07-13;2 juv;2;Nesticidae;Kryptonesticus;eremita;Kryptonesticus eremita;38;44.786909;13.907968;tf;deep cave;44.78690913.907968;3;;;;;;;;;;;;;;;;;;;;;;
1157;Tu?epska vilenja?a;Croatia;17.6.2002.;2002-06-17;1 juv,1juv m,1f;3;Agelenidae;Histopona;conveniens;Histopona conveniens;1181;43.286465;17.083638;Tf;deep cave;43.28646517.083638;8;;;;;;;;;;;;;;;;;;;;;;
1158;Ostaševica;Croatia;17.6.2001.;2001-06-17;1f,1 juv;2;Agelenidae;Histopona;bidens;Histopona bidens;;42.748959;17.544404;tb;deep cave;42.74895917.544404;9;11,6;;;;;;;;;;;;;;;;;;;;;
1159;Manita pe?;Croatia;12.8.1998.;1998-08-12;1 juv;1;Agelenidae;Histopona;sp.;Histopona sp.;520;44.314302;15.475264;;deep cave;44.31430215.475264;7;;;;;;;;;;;;;;;;;;;;;;
1160;Mo?iljska špilja;Croatia;21.6.2001.;2001-06-21;2f,2m,2 juv;6;Nesticidae;Kryptonesticus;eremita;Kryptonesticus eremita;;42.689061;18.071906;tf;deep cave;42.68906118.071906;6;;15,4;15,825;;;;;;;;;;;;;;;;;;;
1161;Tu?epska vilenja?a;Croatia;17.6.2002.;2002-06-17;1 m, 2juv;3;Agelenidae;Histopona;conveniens;Histopona conveniens;1181;43.286465;17.083638;Tf;deep cave;43.28646517.083638;8;;;;;;;;;;;;;;;;;;;;;;
1162;Tu?epska vilenja?a;Croatia;23.5.2004.;2004-05-23;1 juv;1;Agelenidae;Histopona;sp.;Histopona sp.;1181;43.286465;17.083638;;deep cave;43.28646517.083638;8;;;;;;;;;;;;;;;;;;;;;;
1164;Pišurka;Croatia;2.6.2000.;2000-06-02;1f,1 juv m,1 juv;3;Nesticidae;Kryptonesticus;eremita;Kryptonesticus eremita;39;42.959451;17.129228;tf;deep cave;42.95945117.129228;5;;;;;;;;;;;;;;;;;;;;;;
1165;Jama za Mahrincem;Croatia;5.1.2009.;2009-01-05;3f,2m,2 juv;7;Nesticidae;Kryptonesticus;eremita;Kryptonesticus eremita;;43.344348;16.74088;tf;deep cave;43.34434816.74088;2;;;;;;;;;;;;;;;;;;;;;;
1166;Bazgova?a;Croatia;4.8.2004.;2004-08-04;1 juv;1;Nesticidae;Kryptonesticus;eremita;Kryptonesticus eremita;;43.30647;16.622143;;deep cave;43.3064716.622143;3;;5;6,675;;;;;;;;;;;;;;;;;;;
1167;Jama za Mahrincem;Croatia;24.10.2007.;2007-10-24;1f,1m,4 juv;6;Nesticidae;Kryptonesticus;eremita;Kryptonesticus eremita;;43.344348;16.74088;tf;deep cave;43.34434816.74088;2;;;;;;;;;;;;;;;;;;;;;;
1168;Bali?a špilja;Croatia;4.8.2007.;2007-08-04;1 m;1;Nesticidae;Kryptonesticus;eremita;Kryptonesticus eremita;405;43.57296;16.57002;tf;deep cave;43.5729616.57002;11;7,2;;;;;;;;;;;;;;;;;;;;;
1169;Golubnja?a, Žegar;Croatia;2.8.2006.;2006-08-02;1f,1m;2;Nesticidae;Kryptonesticus;eremita;Kryptonesticus eremita;243;44.131933;15.851054;tf;deep cave;44.13193315.851054;6;;;;;;;;;;;;;;;;;;;;;;
1171;Golubnja?a, Žegar;Croatia;2.8.2006.;2006-08-02;1 f;1;Nesticidae;Kryptonesticus;eremita;Kryptonesticus eremita;243;44.131933;15.851054;tf;deep cave;44.13193315.851054;6;;;;;;;;;;;;;;;;;;;;;;
1172;Manita pe?;Croatia;3.9.1999.;1999-09-03;1 juv;1;Agelenidae;Histopona;sp.;Histopona sp.;520;44.314302;15.475264;;deep cave;44.31430215.475264;7;;;;;;;;;;;;;;;;;;;;;;
1173;Manita pe?;Croatia;7.6.2006.;2006-06-07;1 f;1;Agelenidae;Histopona;egonpretneri;Histopona egonpretneri;520;44.314302;15.475264;Tb;deep cave;44.31430215.475264;7;;;;;;;;;;;;;;;;;;;;;;
1175;Grap?eva špilja;Croatia;4.4.2005.;2005-04-04;1 juv;1;Agelenidae;Hadites;tegenarioides;Hadites tegenarioides;200;43.134189;16.753732;TB;deep cave;43.13418916.753732;5;;;13,93333333;;;;;;;;;;;;;;;;;;;
1176;Grap?eva špilja;Croatia;4.4.2005.;2005-04-04;1 f,2 juv;3;Nesticidae;Kryptonesticus;eremita;Kryptonesticus eremita;200;43.134189;16.753732;tf;deep cave;43.13418916.753732;5;;;13,93333333;;;;;;;;;;;;;;;;;;;
1177;Špilja na Gradini kod Premanture;Croatia;13.7.2004.;2004-07-13;2 f,3 juv;5;Nesticidae;Kryptonesticus;eremita;Kryptonesticus eremita;38;44.786909;13.907968;tf;deep cave;44.78690913.907968;3;;;;;;;;;;;;;;;;;;;;;;
1178;Špilja na Gradini kod Premanture;Croatia;20.11.2006.;2006-11-20;2f;2;Nesticidae;Kryptonesticus;eremita;Kryptonesticus eremita;38;44.786909;13.907968;tf;deep cave;44.78690913.907968;3;;;;;;;;;;;;;;;;;;;;;;
1180;Špilja u uvali Predpe?;Croatia;6.4.2008.;2008-04-06;1 f,2 juv;3;Nesticidae;Kryptonesticus;eremita;Kryptonesticus eremita;;45.291576;14.510419;tf;deep cave;45.29157614.510419;4;;;;;;;;;;;;;;;;;;;;;;
1181;Golubnja?a, kanjon Korane;Croatia;24.9.2005.;2005-09-24;1 juv;1;Nesticidae;Nesticus;cellulanus;Nesticus cellulanus;;44.761303;15.590569;Tf;deep cave;44.76130315.590569;1;;;;;;;;;;;;;;;;;;;;;;
1183;Šipun;Croatia;27.3.2003.;2003-03-27;3 juv;3;Agelenidae;Histopona;sp.;Histopona sp.;;42.583646;18.217986;;deep cave;42.58364618.217986;11;16;;;;;;;;;;;;;;;;;;;;;
1184;Šipun;Croatia;11.2.2005.;2005-02-11;1 f,2juv;3;Agelenidae;Histopona;dubia;Histopona dubia;;42.583646;18.217986;tb;deep cave;42.58364618.217986;11;16;;;;;;;;;;;;;;;;;;;;;
1189;Šipun;Croatia;11.2.2005.;2005-02-11;1 juv;1;Agelenidae;Histopona;sp.;Histopona sp.;;42.583646;18.217986;;deep cave;42.58364618.217986;11;16;;;;;;;;;;;;;;;;;;;;;
1191;Šipun;Croatia;27.3.2003.;2003-03-27;1 juv;1;Agelenidae;Histopona;sp.;Histopona sp.;;42.583646;18.217986;;deep cave;42.58364618.217986;11;16;;;;;;;;;;;;;;;;;;;;;
1196;Šipun;Croatia;12.2.2005.;2005-02-12;1 juv;1;Agelenidae;Histopona;sp.;Histopona sp.;;42.583646;18.217986;;deep cave;42.58364618.217986;11;16;;;;;;;;;;;;;;;;;;;;;
1198;Šipun;Croatia;19.8.2005.;2005-08-19;1f, 1 juv;2;Nesticidae;Kryptonesticus;eremita;Kryptonesticus eremita;;42.583646;18.217986;tf;deep cave;42.58364618.217986;11;16;;;;;;;;;;;;;;;;;;;;;
1199;Šipun;Croatia;27.3.2003.;2003-03-27;2 juv;2;Agelenidae;Histopona;sp.;Histopona sp.;;42.583646;18.217986;;deep cave;42.58364618.217986;11;16;;;;;;;;;;;;;;;;;;;;;
1200;Šipun;Croatia;19.8.2005.;2005-08-19;1 juv;1;Agelenidae;Histopona;sp.;Histopona sp.;;42.583646;18.217986;;deep cave;42.58364618.217986;11;16;;;;;;;;;;;;;;;;;;;;;
1201;Pišurka;Croatia;27.4.2004.;2004-04-27;1 juv;1;Nesticidae;Kryptonesticus;eremita;Kryptonesticus eremita;39;42.959451;17.129228;;deep cave;42.95945117.129228;5;;;;;;;;;;;;;;;;;;;;;;
1203;?urovi?a jama;Croatia;27.6.2003.;2003-06-27;1f,1m,1 juv;3;Nesticidae;Kryptonesticus;eremita;Kryptonesticus eremita;;42.559979;18.263559;tf;deep cave;42.55997918.263559;4;;;;;;;;;;;;;;;;;;;;;;
1204;?urovi?a jama;Croatia;27.5.2004.;2004-05-27;1f, 1juv;2;Nesticidae;Kryptonesticus;eremita;Kryptonesticus eremita;;42.559979;18.263559;tf;deep cave;42.55997918.263559;4;;;;;;;;;;;;;;;;;;;;;;
1205;Runjova?a;Croatia;23.8.2005.;2005-08-23;1 m;1;Nesticidae;Kryptonesticus;eremita;Kryptonesticus eremita;;42.547018;18.262348;tf;deep cave;42.54701818.262348;1;;;;;;;;;;;;;;;;;;;;;;
1207;Jama II kod Velikih Brisnica;Croatia;2.6.2006.;2006-06-02;1 juv;1;Agelenidae;Histopona;sp.;Histopona sp.;520;44.789027;14.918377;;deep cave;44.78902714.918377;3;;;;;;;;;;;;;;;;;;;;;;
1209;Jama II kod Velikih Brisnica;Croatia;2.6.2006.;2006-06-02;1 juv;1;Agelenidae;Histopona;sp.;Histopona sp.;520;44.789027;14.918377;;deep cave;44.78902714.918377;3;;;;;;;;;;;;;;;;;;;;;;
1210;Jama na Kuželjevcu;Croatia;2.6.2006.;2006-06-02;1f,1m,1 juv;3;Agelenidae;Histopona;egonpretneri;Histopona egonpretneri;400;44.828665;14.910216;Tb;deep cave;44.82866514.910216;2;;;;;;;;;;;;;;;;;;;;;;
1219;Špilja u Vukoti?a dragi;Croatia;1.6.2006.;2006-06-01;1f, 1m, 2juv;4;Agelenidae;Histopona;egonpretneri;Histopona egonpretneri;;44.808197;14.883737;Tb;deep cave;44.80819714.883737;2;;;;;;;;;;;;;;;;;;;;;;
1221;Tamnica;Croatia;11.11.1998.;1998-11-11;1m;1;Agelenidae;Tegenaria;silvestris;Tegenaria silvestris;;45.27298;15.36197;Tf;deep cave;45.2729815.36197;3;;;;;;;;;;;;;;;;;;;;;;
1225;Baji?a 3 špilja;Croatia;26.2.2009.;2009-02-26;1f;1;Nesticidae;Nesticus;cellulanus;Nesticus cellulanus;180;45.251779;15.849009;tf;deep cave;45.25177915.849009;2;;;;;;;;;;;;;;;;;;;;;;
1226;Dragina pe?ina na Dobri;Croatia;27.2.2000.;2000-02-27;1 f,1juv m,1juv;3;Nesticidae;Nesticus;cellulanus;Nesticus cellulanus;156;45.346751;15.290094;tf;deep cave;45.34675115.290094;4;;;;;;;;;;;;;;;;;;;;;;
1227;Dragina pe?ina na Dobri;Croatia;27.2.2000.;2000-02-27;1f, 2m;3;Agelenidae;Tegenaria;silvestris;Tegenaria silvestris;156;45.346751;15.290094;Tf;deep cave;45.34675115.290094;4;;;;;;;;;;;;;;;;;;;;;;
1236;Dragina pe?ina na Dobri;Croatia;17.2.1999.;1999-02-17;1m;1;Agelenidae;Tegenaria;silvestris;Tegenaria silvestris;156;45.346751;15.290094;Tf;deep cave;45.34675115.290094;4;;;;;;;;;;;;;;;;;;;;;;
1237;Dragina pe?ina na Dobri;Croatia;17.2.1999.;1999-02-17;1 f,2 juv;3;Nesticidae;Nesticus;cellulanus;Nesticus cellulanus;156;45.346751;15.290094;tf;deep cave;45.34675115.290094;4;;;;;;;;;;;;;;;;;;;;;;
1238;Gornja Bara?eva;Croatia;17.5.2003.;2003-05-17;1 juv;1;Agelenidae;Tegenaria;sp.;Tegenaria sp.;;44.983895;15.721656;;deep cave;44.98389515.721656;8;;;;;;;;;;;;;;;;;;;;;;
1240;Antina špilja;Croatia;17.7.2004.;2004-07-17;1 f,2 juv;3;Nesticidae;Nesticus;cellulanus;Nesticus cellulanus;;45.497475;17.856553;tf;deep cave;45.49747517.856553;2;;;;;;;;;;;;;;;;;;;;;;
1255;Dopolanš?ica;Croatia;9.1.2002.;2002-01-09;1m;1;Agelenidae;Tegenaria;silvestris;Tegenaria silvestris;;46.275198;16.05968;Tf;deep cave;46.27519816.05968;2;;;;;;;;;;;;;;;;;;;;;;
1257;Klari?eva jama;Croatia;20.2.2007.;2007-02-20;1 f;1;Nesticidae;Kryptonesticus;eremita;Kryptonesticus eremita;88;45.150294;13.673661;tf;deep cave;45.15029413.673661;2;;;;;;;;;;;;;;;;;;;;;;
1260;Jama Baredine;Croatia;30.11.2007.;2007-11-30;1 f;1;Nesticidae;Kryptonesticus;eremita;Kryptonesticus eremita;;45.270267;13.661985;tf;deep cave;45.27026713.661985;1;;;;;;;;;;;;;;;;;;;;;;
1262;Pliškovi?eva jama;Croatia;19.2.2007.;2007-02-19;1 f,2 m,1 juv;4;Nesticidae;Kryptonesticus;eremita;Kryptonesticus eremita;256;45.071604;13.872151;tf;deep cave;45.07160413.872151;4;;;;;;;;;;;;;;;;;;;;;;
1263;Jama Baredine;Croatia;30.11.2007.;2007-11-30;1 juv;1;Nesticidae;Kryptonesticus;eremita;Kryptonesticus eremita;;45.270267;13.661985;;deep cave;45.27026713.661985;1;;;;;;;;;;;;;;;;;;;;;;
1265;Medvje?a špilja, Mali Lošinj;Croatia;13.1.2000.;2000-01-13;1 f,1 juv;2;Nesticidae;Kryptonesticus;eremita;Kryptonesticus eremita;;44.605518;14.40794;tf;deep cave;44.60551814.40794;1;;;;;;;;;;;;;;;;;;;;;;
1268;Kukor;Croatia;8.9.2005.;2005-09-08;1 f;1;Nesticidae;Kryptonesticus;deelemanae;Kryptonesticus deelemanae;425;43.355609;16.991707;tb;deep cave;43.35560916.991707;10;;;;;;;;;;;;;;;;;;;;;;
1269;Ogra?ena špilja pod Sv. Jurom;Croatia;21.6.2003.;2003-06-21;2 juv;2;Nesticidae;Kryptonesticus;deelemanae;Kryptonesticus deelemanae;1462;43.348504;17.051475;tb;deep cave;43.34850417.051475;2;;;;;;;;;;;;;;;;;;;;;;
1271;Matijaševa pe?;Croatia;4.4.2006.;2006-04-04;1 juv;1;Nesticidae;Kryptonesticus;deelemanae;Kryptonesticus deelemanae;584;43.320551;17.122321;tb;deep cave;43.32055117.122321;6;;;;;;;;;;;;;;;;;;;;;;
1272;Kukor;Croatia;27.7.2004.;2004-07-27;1 juv;1;Nesticidae;Kryptonesticus;deelemanae;Kryptonesticus deelemanae;425;43.355609;16.991707;tb;deep cave;43.35560916.991707;10;;;;;;;;;;;;;;;;;;;;;;
1273;Špilja u Radinovcima;Croatia;25.10.2006.;2006-10-25;2f, 2m, 2 juv;6;Nesticidae;Kryptonesticus;deelemanae;Kryptonesticus deelemanae;400;43.387285;17.0103;tb;deep cave;43.38728517.0103;4;;;;;;;;;;;;;;;;;;;;;;
1274;Poskokova rupa;Croatia;25.5.2004.;2004-05-25;1 f;1;Nesticidae;Kryptonesticus;deelemanae;Kryptonesticus deelemanae;633;43.318607;17.119945;tb;deep cave;43.31860717.119945;2;;;;;;;;;;;;;;;;;;;;;;
1275;Kukor;Croatia;19.6.2002.;2002-06-19;1f, 2 juv;3;Nesticidae;Kryptonesticus;deelemanae;Kryptonesticus deelemanae;425;43.355609;16.991707;tb;deep cave;43.35560916.991707;10;;;;;;;;;;;;;;;;;;;;;;
1276;Kukor;Croatia;29.10.2006.;2006-10-29;1 f;1;Nesticidae;Kryptonesticus;deelemanae;Kryptonesticus deelemanae;425;43.355609;16.991707;tb;deep cave;43.35560916.991707;10;;;;;;;;;;;;;;;;;;;;;;
1277;Crna ledenica;Croatia;24.10.2006.;2006-10-24;1 m;1;Nesticidae;Kryptonesticus;deelemanae;Kryptonesticus deelemanae;1500;43.348162;17.055328;tb;deep cave;43.34816217.055328;2;;;;;;;;;;;;;;;;;;;;;;
1281;Ledenica kod Stare škole;Croatia;28.6.2002.;2002-06-28;2 juv;2;Nesticidae;Kryptonesticus;deelemanae;Kryptonesticus deelemanae;1469;43.342082;17.041289;tb;deep cave;43.34208217.041289;1;;;;;;;;;;;;;;;;;;;;;;
1284;Spasiteljica;Croatia;23.3.2003.;2003-03-23;1 f;1;Nesticidae;Kryptonesticus;deelemanae;Kryptonesticus deelemanae;521;43.408514;16.94211;tb;deep cave;43.40851416.94211;1;;;;;;;;;;;;;;;;;;;;;;
1285;Mala jama u stijenama;Croatia;20.6.2003.;2003-06-20;1 juv;1;Nesticidae;Kryptonesticus;deelemanae;Kryptonesticus deelemanae;1115;43.365579;17.027668;tb;deep cave;43.36557917.027668;3;;;;;;;;;;;;;;;;;;;;;;
1286;Kukor;Croatia;6.4.2006.;2006-04-06;1 juv;1;Nesticidae;Kryptonesticus;deelemanae;Kryptonesticus deelemanae;425;43.355609;16.991707;tb;deep cave;43.35560916.991707;10;;;;;;;;;;;;;;;;;;;;;;
1287;Stonjska pe? donja;Croatia;27.10.2003.;2003-10-27;1m, 1 juv;2;Nesticidae;Kryptonesticus;deelemanae;Kryptonesticus deelemanae;608;43.315167;17.130659;tb;deep cave;43.31516717.130659;6;;;;;;;;;;;;;;;;;;;;;;
1288;Kuna špilja;Croatia;15.6.2002.;2002-06-15;1 juv m;1;Nesticidae;Kryptonesticus;deelemanae;Kryptonesticus deelemanae;1401;43.324523;17.055953;tb;deep cave;43.32452317.055953;2;;;;;;;;;;;;;;;;;;;;;;
1289;Kukor;Croatia;6.4.2006.;2006-04-06;1 juv;1;Nesticidae;Kryptonesticus;deelemanae;Kryptonesticus deelemanae;425;43.355609;16.991707;tb;deep cave;43.35560916.991707;10;;;;;;;;;;;;;;;;;;;;;;
1290;Samogorska špilja;Croatia;4.4.2006.;2006-04-04;1 juv m;1;Nesticidae;Kryptonesticus;deelemanae;Kryptonesticus deelemanae;717;43.318227;17.121122;tb;deep cave;43.31822717.121122;6;;;;;;;;;;;;;;;;;;;;;;
1291;Kuna špilja;Croatia;28.4.2002.;2002-04-28;1 juv m;1;Nesticidae;Kryptonesticus;deelemanae;Kryptonesticus deelemanae;1401;43.324523;17.055953;tb;deep cave;43.32452317.055953;2;;;;;;;;;;;;;;;;;;;;;;
1292;Jama iznad Lipog do?i?a;Croatia;26.2.2001.;2001-02-26;1 juv m;1;Nesticidae;Kryptonesticus;deelemanae;Kryptonesticus deelemanae;1500;43.338669;17.055229;tb;deep cave;43.33866917.055229;1;;;;;;;;;;;;;;;;;;;;;;
1293;Pretnerova jama;Croatia;28.10.2006.;2006-10-28;1 f;1;Nesticidae;Kryptonesticus;deelemanae;Kryptonesticus deelemanae;1409;43.339276;17.038312;tb;deep cave;43.33927617.038312;2;;;;;;;;;;;;;;;;;;;;;;
1294;Crna ledenica;Croatia;25.4.2004.;2004-04-25;1f, 1 juv m;2;Nesticidae;Kryptonesticus;deelemanae;Kryptonesticus deelemanae;1500;43.348162;17.055328;tb;deep cave;43.34816217.055328;2;;;;;;;;;;;;;;;;;;;;;;
1296;Kukor;Croatia;27.7.2004.;2004-07-27;1 f;1;Nesticidae;Kryptonesticus;deelemanae;Kryptonesticus deelemanae;425;43.355609;16.991707;tb;deep cave;43.35560916.991707;10;;;;;;;;;;;;;;;;;;;;;;
1297;Špilja u Radinovcima;Croatia;25.10.2006.;2006-10-25;2f, 1m, 7 juv;1;Nesticidae;Kryptonesticus;deelemanae;Kryptonesticus deelemanae;400;43.387285;17.0103;tb;deep cave;43.38728517.0103;4;;;;;;;;;;;;;;;;;;;;;;
1298;Samogorska špilja;Croatia;4.4.2006.;2006-04-04;1 f;1;Nesticidae;Kryptonesticus;deelemanae;Kryptonesticus deelemanae;717;43.318227;17.121122;tb;deep cave;43.31822717.121122;6;;;;;;;;;;;;;;;;;;;;;;
1299;Špilja u Radinovcima;Croatia;26.10.2006.;2006-10-26;2f, 2juv;4;Nesticidae;Kryptonesticus;deelemanae;Kryptonesticus deelemanae;400;43.387285;17.0103;tb;deep cave;43.38728517.0103;4;;;;;;;;;;;;;;;;;;;;;;
1301;Jama na Puharevom;Croatia;2.11.2003.;2003-11-02;1f;1;Dysderidae;Stalita;taenaria;Stalita taenaria;;45.410155;14.30419;Tb;deep cave;45.41015514.30419;2;;;;;;;;;;;;;;;;;;;;;;
1302;Jama na Plase, Plas;Croatia;16.9.2007.;2007-09-16;1m;1;Clubionidae;Clubiona;terrestris;Clubiona terrestris;;45.296416;14.205266;Tx;;45.29641614.205266;1;;;;;;;;;;;;;;;;;;;;;;
1303;Šparožna pe?ina;Croatia;14.4.2001.;2001-04-14;1f;1;Dysderidae;Stalita;taenaria;Stalita taenaria;;45.407967;14.332456;Tb;deep cave;45.40796714.332456;4;;;;;;;;;;;;;;;;;;;;;;
1304;Šparožna pe?ina;Croatia;6.3.2003.;2003-03-06;2f;2;Dysderidae;Stalita;taenaria;Stalita taenaria;;45.407967;14.332456;Tb;deep cave;45.40796714.332456;4;;;;;;;;;;;;;;;;;;;;;;
1305;Božinkina jama;Croatia;4.1.2004.;2004-01-04;1m, 1f;2;Dysderidae;Stalita;taenaria;Stalita taenaria;350;45.40466;14.30388;Tb;deep cave;45.4046614.30388;2;;;;;;;;;;;;;;;;;;;;;;
1306;Jama u Vetvi;Croatia;4.6.2010.;2010-06-04;1m;1;Dysderidae;Dysdera;adriatica;Dysdera adriatica;;45.332148;14.240733;Tx;;45.33214814.240733;3;;;;;;;;;;;;;;;;;;;;;;
1307;Jama u Vetvi;Croatia;4.6.2010.;2010-06-04;1f;1;Linyphiidae;Troglohyphantes;liburnicus;Troglohyphantes liburnicus;;45.332148;14.240733;Tb;deep cave;45.33214814.240733;3;;;;;;;;;;;;;;;;;;;;;;
1308;Oštirova jama;Croatia;18.9.2007.;2007-09-18;2f, 2m;4;Linyphiidae;Troglohyphantes;brignolii;Troglohyphantes brignolii;;45.355854;14.123988;Tb;deep cave;45.35585414.123988;3;;;;;;;;;;;;;;;;;;;;;;
1309;Jama pod Križ;Croatia;4.6.2010.;2010-06-04;1f;1;Linyphiidae;Troglohyphantes;brignolii;Troglohyphantes brignolii;;45.374314;14.113041;Tb;deep cave;45.37431414.113041;1;;;;;;;;;;;;;;;;;;;;;;
1310;Jama pod Križ;Croatia;4.6.2010.;2010-06-04;1f, 3 juv m;4;Linyphiidae;Troglohyphantes;brignolii;Troglohyphantes brignolii;;45.374314;14.113041;Tb;deep cave;45.37431414.113041;1;;;;;;;;;;;;;;;;;;;;;;
1311;Barinova jama;Croatia;18.9.2007.;2007-09-18;3f;3;Linyphiidae;Troglohyphantes;brignolii;Troglohyphantes brignolii;;45.354889;14.126033;Tb;deep cave;45.35488914.126033;1;;;;;;;;;;;;;;;;;;;;;;
1312;Vrta?a kod doma na Poklonu;Croatia;7.11.2006.;2006-11-07;1f;1;Linyphiidae;Troglohyphantes;brignolii;Troglohyphantes brignolii;;45.311536;14.212207;Tb;shallow subterranean habitat;45.31153614.212207;3;;;;;;;;;;;;;;;;;;;;;;
1315;Jama pul Bani;Croatia;11.9.1999.;1999-09-11;1f;1;Linyphiidae;Troglohyphantes;liburnicus;Troglohyphantes liburnicus;282;45.374679;14.364057;Tb;deep cave;45.37467914.364057;2;;;;;;;;;;;;;;;;;;;;;;
1316;Jama pod zavojem;Croatia;1.6.2010.;2010-06-01;2f, 1 juv m;3;Linyphiidae;Troglohyphantes;brignolii;Troglohyphantes brignolii;;45.375853;14.191785;Tb;deep cave;45.37585314.191785;1;;;;;;;;;;;;;;;;;;;;;;
1317;Jama na Lovranskim Lazi?ima;Croatia;4.11.2006.;2006-11-04;1f, 2m, 4 juv;7;Linyphiidae;Troglohyphantes;brignolii;Troglohyphantes brignolii;;45.309912;14.240736;Tb;deep cave;45.30991214.240736;1;;;;;;;;;;;;;;;;;;;;;;
1318;Topolska pe?;Croatia;14.9.2007.;2007-09-14;1f;1;Linyphiidae;Troglohyphantes;brignolii;Troglohyphantes brignolii;;45.30489;14.212681;Tb;deep cave;45.3048914.212681;3;;;;;;;;;;;;;;;;;;;;;;
1319;Lovranski Lazi?i 1;Croatia;4.11.2006.;2006-11-04;1m;1;Linyphiidae;Troglohyphantes;excavatus;Troglohyphantes excavatus;;45.310255;14.240885;Tf;deep cave;45.31025514.240885;2;;;;;;;;;;;;;;;;;;;;;;
1320;Lovranski Lazi?i 1;Croatia;4.11.2006.;2006-11-04;5f, 4m, 3 juv;12;Linyphiidae;Troglohyphantes;brignolii;Troglohyphantes brignolii;;45.310255;14.240885;Tb;deep cave;45.31025514.240885;2;;;;;;;;;;;;;;;;;;;;;;
1321;Jama mrtvih golubova;Croatia;7.11.2006.;2006-11-07;2f, 1juv m, 1 juv;4;Linyphiidae;Palliduphantes;pallidus;Palliduphantes pallidus;;45.280855;14.188262;Tf;deep cave;45.28085514.188262;1;;;;;;;;;;;;;;;;;;;;;;
1323;Jama iznad Vranjske drage;Croatia;2.6.2010.;2010-06-02;3f, 2 juv;5;Linyphiidae;Troglohyphantes;brignolii;Troglohyphantes brignolii;306;45.310568;14.152319;Tb;deep cave;45.31056814.152319;3;;;;;;;;;;;;;;;;;;;;;;
1324;Jama iznad Vranjske drage;Croatia;2.6.2010.;2010-06-02;2m;2;Nesticidae;Kryptonesticus;eremita;Kryptonesticus eremita;;45.310568;14.152319;Tf;deep cave;45.31056814.152319;3;;;;;;;;;;;;;;;;;;;;;;
1325;Jama iznad Vranjske drage;Croatia;2.6.2010.;2010-06-02;1f;1;Linyphiidae;Palliduphantes;istrianus;Palliduphantes istrianus;;45.310568;14.152319;Tf;deep cave;45.31056814.152319;3;;;;;;;;;;;;;;;;;;;;;;
1326;Oštirova jama;Croatia;18.9.2007.;2007-09-18;1m, 1f;2;Linyphiidae;Troglohyphantes;brignolii;Troglohyphantes brignolii;;45.355854;14.123988;Tb;deep cave;45.35585414.123988;3;;;;;;;;;;;;;;;;;;;;;;
1327;Jama kod potoka Banine 3;Croatia;17.9.2007.;2007-09-17;2f;2;Linyphiidae;Troglohyphantes;liburnicus;Troglohyphantes liburnicus;;45.313714;14.242713;Tb;deep cave;45.31371414.242713;3;;;;;;;;;;;;;;;;;;;;;;
1328;Jama na Poklonu;Croatia;14.9.2007.;2007-09-14;2f;2;Linyphiidae;Troglohyphantes;excavatus;Troglohyphantes excavatus;;45.307227;14.214922;Tf;deep cave;45.30722714.214922;2;;;;;;;;;;;;;;;;;;;;;;
1329;Babina jama, Brest;Croatia;5.11.2006.;2006-11-05;1f, 1m, 1 juv;3;Linyphiidae;Troglohyphantes;brignolii;Troglohyphantes brignolii;;45.345066;14.151693;Tb;deep cave;45.34506614.151693;1;;;;;;;;;;;;;;;;;;;;;;
1334;Vrta?a kod doma na Poklonu;Croatia;14.9.2007.;2007-09-14;1m;1;Linyphiidae;Centromerus;sellarius;Centromerus sellarius;;45.311536;14.212207;tf;deep cave;45.31153614.212207;3;;;;;;;;;;;;;;;;;;;;;;
1335;Jama kod crvenog gloga;Croatia;7.11.2006.;2006-11-07;5f, 2 m, 1 juv;8;Linyphiidae;Palliduphantes;istrianus;Palliduphantes istrianus;;45.280222;14.187889;Tf;deep cave;45.28022214.187889;1;;;;;;;;;;;;;;;;;;;;;;
1336;Topolska pe?;Croatia;26.7.2006.;2006-07-26;1m, 3 juv;4;Linyphiidae;Troglohyphantes;brignolii;Troglohyphantes brignolii;;45.30489;14.212681;Tb;deep cave;45.3048914.212681;3;;;;;;;;;;;;;;;;;;;;;;
1337;Topolska pe?;Croatia;26.7.2006.;2006-07-26;1f, 1 juv;2;Linyphiidae;Troglohyphantes;brignolii;Troglohyphantes brignolii;;45.30489;14.212681;Tb;deep cave;45.3048914.212681;3;;;;;;;;;;;;;;;;;;;;;;
1338;Bršljanovica;Croatia;3.6.2010.;2010-06-03;1f;1;Linyphiidae;Troglohyphantes;brignolii;Troglohyphantes brignolii;;45.348192;14.134112;Tb;deep cave;45.34819214.134112;1;;;;;;;;;;;;;;;;;;;;;;
1339;Pe?ina kod dje?jeg oporavilišta;Croatia;8.11.2006.;2006-11-08;1f, 1 juv;2;Linyphiidae;Troglohyphantes;brignolii;Troglohyphantes brignolii;;45.311037;14.223287;Tb;deep cave;45.31103714.223287;1;;;;;;;;;;;;;;;;;;;;;;
1340;Rupe 2;Croatia;17.9.2007.;2007-09-17;1m;1;Linyphiidae;Centromerus;sellarius;Centromerus sellarius;;45.251804;14.199476;tf;deep cave;45.25180414.199476;1;;;;;;;;;;;;;;;;;;;;;;
1341;Vrta?a kod doma na Poklonu;Croatia;14.9.2007.;2007-09-14;1m, 1f;2;Anapidae;Comaroma;simoni;Comaroma simoni;;45.311536;14.212207;tf;shallow subterranean habitat;45.31153614.212207;3;;;;;;;;;;;;;;;;;;;;;;
1342;Babina jama, Brest;Croatia;5.11.2006.;2006-11-05;1f;1;Linyphiidae;Troglohyphantes;brignolii;Troglohyphantes brignolii;;45.345066;14.151693;Tb;deep cave;45.34506614.151693;1;;;;;;;;;;;;;;;;;;;;;;
1345;Jama na Poklonu;Croatia;14.9.2007.;2007-09-14;1m;1;Linyphiidae;Tenuiphantes;tenebricola;Tenuiphantes tenebricola;;45.307227;14.214922;Tx;deep cave;45.30722714.214922;2;;;;;;;;;;;;;;;;;;;;;;
1346;Jama na Balaguštini;Croatia;16.9.2007.;2007-09-16;1f;1;Linyphiidae;Troglohyphantes;brignolii;Troglohyphantes brignolii;;45.31343;14.227259;Tb;deep cave;45.3134314.227259;1;;;;;;;;;;;;;;;;;;;;;;
1348;Staje 8;Croatia;29.7.2001.;2001-07-29;1f;1;Linyphiidae;Tenuiphantes;flavipes;Tenuiphantes flavipes;;45.447413;14.143861;Tf;deep cave;45.44741314.143861;3;;;;;;;;;;;;;;;;;;;;;;
1349;Vela pe?;Croatia;4.6.2010.;2010-06-04;1f;1;Linyphiidae;Troglohyphantes;brignolii;Troglohyphantes brignolii;;45.333194;14.158683;Tb;deep cave;45.33319414.158683;1;;;;;;;;;;;;;;;;;;;;;;
1351;Lovranski Lazi?i 1;Croatia;4.11.2006.;2006-11-04;1f;1;Linyphiidae;Troglohyphantes;brignolii;Troglohyphantes brignolii;;45.310255;14.240885;Tb;deep cave;45.31025514.240885;2;;;;;;;;;;;;;;;;;;;;;;
1355;Jama na Prevoji?u;Croatia;1.6.2010.;2010-06-01;2f, 1 juv m;3;Linyphiidae;Troglohyphantes;brignolii;Troglohyphantes brignolii;;45.381621;14.189238;Tb;deep cave;45.38162114.189238;2;;;;;;;;;;;;;;;;;;;;;;
1356;Jama na Prevoji?u;Croatia;1.6.2010.;2010-06-01;3m;3;Amaurobidae;Amaurobius;obustus;Amaurobius obustus;;45.381621;14.189238;Tx;deep cave;45.38162114.189238;2;;;;;;;;;;;;;;;;;;;;;;
1358;Oštirova jama;Croatia;18.9.2007.;2007-09-18;1f;1;Gnaphosidae;Drassodes;lapidosus;Drassodes lapidosus;;45.355854;14.123988;Tx;;45.35585414.123988;3;;;;;;;;;;;;;;;;;;;;;;
1359;Jama kod crvenog gloga;Croatia;7.11.2006.;2006-11-07;1f;1;Linyphiidae;Palliduphantes;istrianus;Palliduphantes istrianus;;45.280222;14.187889;Tf;deep cave;45.28022214.187889;1;;;;;;;;;;;;;;;;;;;;;;
1367;Rudnik Karlota;Croatia;17.2.2007.;2007-02-17;1f;1;Nesticidae;Kryptonesticus;eremita;Kryptonesticus eremita;;45.07732;14.090585;;deep cave;45.0773214.090585;1;;;;;;;;;;;;;;;;;;;;;;
1369;Jama pul Bani;Croatia;11.9.1999.;1999-09-11;1m;1;Linyphiidae;Palliduphantes;istrianus;Palliduphantes istrianus;282;45.374679;14.364057;Tf;deep cave;45.37467914.364057;2;;;;;;;;;;;;;;;;;;;;;;
1370;Strguljin grad 2;Croatia;3.8.2001.;2001-08-03;1f;1;Cybaeidae;Cybaeus;sp. 1;Cybaeus sp. 1;;45.452235;14.141663;;;45.45223514.141663;2;;;;;;;;;;;;;;;;;;;;;;
1372;Staje 9;Croatia;23.5.2003.;2003-05-23;1m;1;Anapidae;Comaroma;simoni;Comaroma simoni;;45.447795;14.144849;tf;deep cave;45.44779514.144849;2;;;;;;;;;;;;;;;;;;;;;;
1373;Jama Blaži?i 1;Croatia;8.4.2001.;2001-04-08;1f, 5 juv;6;Linyphiidae;Troglohyphantes;liburnicus;Troglohyphantes liburnicus;;45.381586;14.399848;Tb;deep cave;45.38158614.399848;1;;;;;;;;;;;;;;;;;;;;;;
1374;Staje 9 (ispred);Croatia;23.5.2003.;2003-05-23;1m;1;Anapidae;Comaroma;simoni;Comaroma simoni;;45.447795;14.144849;tf;shallow subterranean habitat;45.44779514.144849;2;;;;;;;;;;;;;;;;;;;;;;
1375;oko ulaza pod kamenjem kod jame Staje 9;Croatia;23.5.2003.;2003-05-23;2f;2;Amaurobidae;Amaurobius;sp. 2;Amaurobius sp. 2;;45.447795;14.144849;Tx;Shallow subterranean habitat;45.44779514.144849;2;;;;;;;;;;;;;;;;;;;;;;
1376;Radota;Croatia;29.7.2001.;2001-07-29;2m, 1 juv;3;Linyphiidae;Centromerus;cavernarum;Centromerus cavernarum;595;45.456089;13.984855;Tf;deep cave;45.45608913.984855;6;;;;;;;;;;;;;;;;;;;;;;
1377;Staje 12;Croatia;30.7.2007.;2007-07-30;1f, 1 juv;2;Linyphiidae;Tenuiphantes;flavipes;Tenuiphantes flavipes;;45.448664;14.14793;Tf;deep cave;45.44866414.14793;1;;;;;;;;;;;;;;;;;;;;;;
1378;Strguljin grad 2;Croatia;3.8.2001.;2001-08-03;1f;1;Linyphiidae;Tenuiphantes;flavipes;Tenuiphantes flavipes;;45.452235;14.141663;Tf;deep cave;45.45223514.141663;2;;;;;;;;;;;;;;;;;;;;;;
1381;Velebita- Dva javora;Croatia;15.8.2007.;2007-08-15;1f;1;Linyphiidae;Porrhomma;egeria;Porrhomma egeria;1560;44.757596;14.98636;;deep cave;44.75759614.98636;2;;;;;;;;;;;;;;;;;;;;;;
1384;Gavranova jama;Croatia;7.8.2009.;2009-08-07;1f;1;Linyphiidae;Troglohyphantes;sp. 3;Troglohyphantes sp. 3;;44.745184;15.072389;tb;deep cave;44.74518415.072389;1;;;;;;;;;;;;;;;;;;;;;;
1385;Gavranova jama;Croatia;7.8.2009.;2009-08-07;2m;2;Linyphiidae;Troglohyphantes;sp. 3;Troglohyphantes sp. 3;;44.745184;15.072389;tb;deep cave;44.74518415.072389;1;;;;;;;;;;;;;;;;;;;;;;
1393;Medvje?a špilja, Mali Lošinj;Croatia;27.-28.3.2010.;2010-03-27/2010-03-28;1f, 1 juv;2;Nesticidae;Kryptonesticus;eremita;Kryptonesticus eremita;;44.605518;14.40794;tf;deep cave;44.60551814.40794;1;;;;;;;;;;;;;;;;;;;;;;
1396;Špilja kod Stare Sušice;Croatia;12.6.2009.;2009-06-12;1m;1;Anapidae;Comaroma;simoni;Comaroma simoni;;45.387689;14.994379;tf;deep cave;45.38768914.994379;11;7,4;;;;;;;;;;;;;;;;;;;;;
1397;Pe? u ?ulinovim raljevinama;Croatia;6.1.2009.;2009-01-06;1f;1;Linyphiidae;Troglohyphantes;strandi;Troglohyphantes strandi;428;43.605854;16.575066;tb;deep cave;43.60585416.575066;5;;;;;;;;;;;;;;;;;;;;;;
1398;Dragina pe?ina na Dobri;Croatia;27.2.2000.;2000-02-27;1f;1;Tetragnathidae;Metellina;merianae;Metellina merianae;;45.346751;15.290094;Tf;deep cave;45.34675115.290094;4;;;;;;;;;;;;;;;;;;;;;;
1400;Jama u Krogu;Croatia;15.9.2007.;2007-09-15;1m;1;Linyphiidae;Labulla;thoracica;Labulla thoracica;;45.378389;14.16897;;;45.37838914.16897;2;;;;;;;;;;;;;;;;;;;;;;
1401;Kukor;Croatia;28.7.2006.;2006-07-28;1 juv;1;Nesticidae;Kryptonesticus;deelemanae;Kryptonesticus deelemanae;425;43.355609;16.991707;tb;deep cave;43.35560916.991707;10;;;;;;;;;;;;;;;;;;;;;;
1402;Matijaševa pe?;Croatia;19.11.2005.;2005-11-19;1 juv;1;Nesticidae;Kryptonesticus;deelemanae;Kryptonesticus deelemanae;584;43.320551;17.122321;tb;deep cave;43.32055117.122321;6;;;;;;;;;;;;;;;;;;;;;;
1403;Jama iznad Sarana?a;Croatia;2.4.2006.;2006-04-02;1 juv m;1;Agelenidae;Histopona;sp.;Histopona sp.;770;43.249007;17.174663;;deep cave;43.24900717.174663;7;;;;;;;;;;;;;;;;;;;;;;
1405;Veli Sklop 4;Croatia;7.6.2006.;2006-06-07;1 juv m;1;Agelenidae;Histopona;sp.;Histopona sp.;467;44.310221;15.483825;;deep cave;44.31022115.483825;1;;;;;;;;;;;;;;;;;;;;;;
1406;Vaganka;Croatia;3.6.2006.;2006-06-03;3 juv;3;Agelenidae;Histopona;sp.;Histopona sp.;658;44.33853;15.43867;;deep cave;44.3385315.43867;5;;;12,05;;;;;;;;;;;;;;;;;;;
1408;Jama pod isto?nom stijenom Buljme;Croatia;13.9.2006.;2006-09-13;1 f;1;Agelenidae;Histopona;egonpretneri;Histopona egonpretneri;1421;44.368375;15.467868;Tb;deep cave;44.36837515.467868;3;;;;;;;;;;;;;;;;;;;;;;
1409;Šoši?a jama;Croatia;29.9.2006.;2006-09-29;1 juv;1;Agelenidae;Histopona;sp.;Histopona sp.;;44.319599;15.408031;;deep cave;44.31959915.408031;1;;;;;;;;;;;;;;;;;;;;;;
1411;Topla pe?ina;Croatia;29.7.2006.;2006-07-29;1 m,8 juv;9;Nesticidae;Kryptonesticus;eremita;Kryptonesticus eremita;;43.839254;16.0536;tf;deep cave;43.83925416.0536;4;;;;;;;;;;;;;;;;;;;;;;
1412;Marasovi?a špilja;Croatia;7.6.2006.;2006-06-07;3 juv;3;Agelenidae;Histopona;sp.;Histopona sp.;303;44.309906;15.481716;;deep cave;44.30990615.481716;2;;;;;;;;;;;;;;;;;;;;;;
1414;Markova špilja, Seline;Croatia;4.6.2006.;2006-06-04;1 f,2 juv;3;Nesticidae;Kryptonesticus;eremita;Kryptonesticus eremita;14;44.279837;15.47716;tf;deep cave;44.27983715.47716;3;;;;;;;;;;;;;;;;;;;;;;
1416;Ivina jama, Paklenica;Croatia;16.9.2006.;2006-09-16;2 juv;2;Agelenidae;Histopona;sp.;Histopona sp.;634;44.330962;15.467557;;deep cave;44.33096215.467557;1;;;;;;;;;;;;;;;;;;;;;;
1417;Kapljarka;Croatia;8.6.2006.;2006-06-08;2 juv;2;Agelenidae;Histopona;sp.;Histopona sp.;410;44.294555;15.519648;;deep cave;44.29455515.519648;2;;;;;;;;;;;;;;;;;;;;;;
1419;Kad jaganjci utihnu;Croatia;5.6.2006.;2006-06-05;1f, 32 juv;33;Theridiidae;Episinus;cavernicola;Episinus cavernicola;223;44.365085;15.314841;Tf;deep cave;44.36508515.314841;3;;;;;;;;;;;;;;;;;;;;;;
1422;Jatara špilja;Croatia;9.6.2006.;2006-06-09;3 juv;3;Agelenidae;Histopona;sp.;Histopona sp.;600;44.334974;15.446351;;deep cave;44.33497415.446351;3;;;;;;;;;;;;;;;;;;;;;;
1424;Špilja u Lužnama;Croatia;9.6.2006.;2006-06-09;1 juv m;1;Agelenidae;Histopona;sp.;Histopona sp.;629;44.328901;15.454175;;deep cave;44.32890115.454175;2;;;;;;;;;;;;;;;;;;;;;;
1425;Jatara špilja;Croatia;9.6.2006.;2006-06-09;1 juv m,3 juv;4;Agelenidae;Histopona;sp.;Histopona sp.;600;44.334974;15.446351;;deep cave;44.33497415.446351;3;;;;;;;;;;;;;;;;;;;;;;
1426;Kapljarka;Croatia;8.6.2006.;2006-06-08;1 juv;1;Agelenidae;Histopona;sp.;Histopona sp.;410;44.294555;15.519648;;deep cave;44.29455515.519648;2;;;;;;;;;;;;;;;;;;;;;;
1427;Kad jaganjci utihnu;Croatia;5.6.2006.;2006-06-05;3 juv;3;Agelenidae;Histopona;sp.;Histopona sp.;223;44.365085;15.314841;;deep cave;44.36508515.314841;3;;;;;;;;;;;;;;;;;;;;;;
1428;Markova špilja, Seline;Croatia;5.6.2006.;2006-06-05;2 juv;2;Agelenidae;Histopona;sp.;Histopona sp.;14;44.279837;15.47716;;deep cave;44.27983715.47716;3;;;;;;;;;;;;;;;;;;;;;;
1430;Jama kod Jatare 1;Croatia;12.9.2006.;2006-09-12;1 f;1;Agelenidae;Histopona;egonpretneri;Histopona egonpretneri;643;44.333263;15.448252;Tb;deep cave;44.33326315.448252;1;;;;;;;;;;;;;;;;;;;;;;
1432;Kukor;Croatia;2.1.1999.;1999-01-02;1 f;1;Agelenidae;Histopona;conveniens;Histopona conveniens;425;43.355609;16.991707;Tf;deep cave;43.35560916.991707;10;;;;;;;;;;;;;;;;;;;;;;
1433;?olnja?a;Croatia;25.10.2003.;2003-10-25;1f;1;Agelenidae;Histopona;conveniens;Histopona conveniens;;43.409175;16.88745;Tf;deep cave;43.40917516.88745;4;;;;;;;;;;;;;;;;;;;;;;
1434;Pozjata špilja;Croatia;26.10.2003.;2003-10-26;1m;1;Agelenidae;Histopona;conveniens;Histopona conveniens;1435;43.387837;16.963748;Tf;deep cave;43.38783716.963748;3;;;;;;;;;;;;;;;;;;;;;;
1435;Jujnovi?a špilja;Croatia;27.4.2002.;2002-04-27;1f;1;Agelenidae;Histopona;conveniens;Histopona conveniens;405;43.266579;17.19798;Tf;deep cave;43.26657917.19798;6;;;;;;;;;;;;;;;;;;;;;;
1436;Ze?ica;Croatia;2.4.2006.;2006-04-02;1m;1;Agelenidae;Histopona;conveniens;Histopona conveniens;1002;43.260392;17.146168;Tf;deep cave;43.26039217.146168;3;;;;;;;;;;;;;;;;;;;;;;
1437;Jama za Supinom;Croatia;18.11.2005.;2005-11-18;1 f;1;Agelenidae;Histopona;conveniens;Histopona conveniens;;43.250417;17.113278;Tf;deep cave;43.25041717.113278;7;;;;;;;;;;;;;;;;;;;;;;
1438;Jama za Supinom;Croatia;18.11.2005.;2005-11-18;2m,1 juv;3;Agelenidae;Histopona;conveniens;Histopona conveniens;;43.250417;17.113278;Tf;deep cave;43.25041717.113278;7;;;;;;;;;;;;;;;;;;;;;;
1439;Romanova jama;Croatia;30.9.1995.;1995-09-30;1f;1;Agelenidae;Histopona;conveniens;Histopona conveniens;1330;43.307939;17.067563;Tf;deep cave;43.30793917.067563;2;;;;;;;;;;;;;;;;;;;;;;
1440;Bošak jama;Croatia;4.4.2006.;2006-04-04;1 juv;1;Agelenidae;Histopona;sp.;Histopona sp.;739;43.347996;17.100045;;deep cave;43.34799617.100045;2;;;;;;;;;;;;;;;;;;;;;;
1441;Jama iznad Sarana?a;Croatia;25.3.2003.;2003-03-25;1f;1;Agelenidae;Histopona;conveniens;Histopona conveniens;770;43.249007;17.174663;Tf;deep cave;43.24900717.174663;7;;;;;;;;;;;;;;;;;;;;;;
1442;Kukor;Croatia;6.4.2006.;2006-04-06;1m;1;Agelenidae;Histopona;conveniens;Histopona conveniens;425;43.355609;16.991707;Tf;deep cave;43.35560916.991707;10;;;;;;;;;;;;;;;;;;;;;;
1443;Kukor;Croatia;23.9.1999.;1999-09-23;1f,1 juv m;2;Agelenidae;Histopona;conveniens;Histopona conveniens;425;43.355609;16.991707;Tf;deep cave;43.35560916.991707;10;;;;;;;;;;;;;;;;;;;;;;
1444;Špilja u Radinovcima;Croatia;25.10.2006.;2006-10-25;1f;1;Agelenidae;Histopona;conveniens;Histopona conveniens;400;43.387285;17.0103;Tf;deep cave;43.38728517.0103;4;;;;;;;;;;;;;;;;;;;;;;
1445;Spila 1;Croatia;26.3.2003.;2003-03-26;1f;1;Agelenidae;Histopona;conveniens;Histopona conveniens;516;43.262438;17.203945;Tf;deep cave;43.26243817.203945;3;;;;;;;;;;;;;;;;;;;;;;
1446;Baba;Croatia;27.4.2002.;2002-04-27;1m;1;Agelenidae;Histopona;conveniens;Histopona conveniens;965;43.256469;17.162283;Tf;deep cave;43.25646917.162283;4;;;;;;;;;;;;;;;;;;;;;;
1447;Špilja u Radinovcima;Croatia;25.10.2006.;2006-10-25;1m;1;Agelenidae;Histopona;conveniens;Histopona conveniens;400;43.387285;17.0103;Tf;deep cave;43.38728517.0103;4;;;;;;;;;;;;;;;;;;;;;;
1448;Jama za Supinom;Croatia;3.4.2006.;2006-04-03;1m;1;Agelenidae;Histopona;conveniens;Histopona conveniens;;43.250417;17.113278;Tf;deep cave;43.25041717.113278;7;;;;;;;;;;;;;;;;;;;;;;
1449;Jama na Brezdanu;Croatia;20.3.2004.;2004-03-20;1f;1;Agelenidae;Histopona;conveniens;Histopona conveniens;915;43.369901;16.973172;Tf;deep cave;43.36990116.973172;3;;;;;;;;;;;;;;;;;;;;;;
1450;Matijaševa pe?;Croatia;4.4.2006.;2006-04-04;1 juv;1;Agelenidae;Histopona;sp.;Histopona sp.;584;43.320551;17.122321;;deep cave;43.32055117.122321;6;;;;;;;;;;;;;;;;;;;;;;
1451;Oplemenjena špilja;Croatia;20.6.2003.;2003-06-20;1 juv;1;Agelenidae;Histopona;sp.;Histopona sp.;1100;43.369119;17.025884;;deep cave;43.36911917.025884;1;;;;;;;;;;;;;;;;;;;;;;
1452;Kukor;Croatia;19.6.2002.;2002-06-19;1 juv;1;Agelenidae;Histopona;sp.;Histopona sp.;425;43.355609;16.991707;;deep cave;43.35560916.991707;10;;;;;;;;;;;;;;;;;;;;;;
1454;Spila 2;Croatia;23.3.2004.;2004-03-23;1 juv;1;Agelenidae;Histopona;sp.;Histopona sp.;516;43.26239;17.204021;;deep cave;43.2623917.204021;6;;;;;;;;;;;;;;;;;;;;;;
1455;Jama iznad Prozor?i?a;Croatia;22.11.2005.;2005-11-22;1 juv;1;Agelenidae;Histopona;sp.;Histopona sp.;617;43.38381;16.932036;;deep cave;43.3838116.932036;5;;;;;;;;;;;;;;;;;;;;;;
1456;Jama iznad Prozor?i?a;Croatia;24.3.2004.;2004-03-24;2 juv;2;Agelenidae;Histopona;sp.;Histopona sp.;617;43.38381;16.932036;;deep cave;43.3838116.932036;5;;;;;;;;;;;;;;;;;;;;;;
1457;Podrum;Croatia;22.5.2004.;2004-05-22;1 juv;1;Agelenidae;Histopona;sp.;Histopona sp.;180;43.234263;17.091929;;deep cave;43.23426317.091929;2;;;;;;;;;;;;;;;;;;;;;;
1459;Svetica;Croatia;25.10.2003.;2003-10-25;3 juv;3;Agelenidae;Histopona;sp.;Histopona sp.;300;43.401143;16.894548;;deep cave;43.40114316.894548;5;;;;;;;;;;;;;;;;;;;;;;
1460;Jamina, Biokovo;Croatia;24.3.2004.;2004-03-24;2 juv;2;Agelenidae;Histopona;sp.;Histopona sp.;617;43.386358;16.925277;;deep cave;43.38635816.925277;4;;;;;;;;;;;;;;;;;;;;;;
1461;Stonjska pe? donja;Croatia;27.10.2003.;2003-10-27;1 juv f;1;Agelenidae;Histopona;sp.;Histopona sp.;608;43.315167;17.130659;;deep cave;43.31516717.130659;6;;;;;;;;;;;;;;;;;;;;;;
1462;Jama za Supinom;Croatia;26.5.2004.;2004-05-26;3 juv;3;Agelenidae;Histopona;sp.;Histopona sp.;;43.250417;17.113278;;deep cave;43.25041717.113278;7;;;;;;;;;;;;;;;;;;;;;;
1466;?olnja?a;Croatia;23.5.2004.;2004-05-23;1 juv;1;Agelenidae;Histopona;sp.;Histopona sp.;;43.409175;16.88745;;deep cave;43.40917516.88745;4;;;;;;;;;;;;;;;;;;;;;;
1467;Špilja na Mrždolcu;Croatia;21.11.2005.;2005-11-21;1 juv m;1;Agelenidae;Histopona;sp.;Histopona sp.;461;43.405319;17.014811;;deep cave;43.40531917.014811;3;;;;;;;;;;;;;;;;;;;;;;
1468;Jama u Bratušu;Croatia;27.10.2006.;2006-10-27;1 juv;1;Agelenidae;Histopona;sp.;Histopona sp.;25;43.328376;16.979405;;deep cave;43.32837616.979405;4;;;;;;;;;;;;;;;;;;;;;;
1469;Ješkalovica;Croatia;4.1.2009.;2009-01-04;1f;1;Nesticidae;Kryptonesticus;eremita;Kryptonesticus eremita;155;43.299857;16.839313;tf;deep cave;43.29985716.839313;2;;;;;;;;;;;;;;;;;;;;;;
1472;Rudnik Zrinski;Croatia;8.10.2008.;2008-10-08;1f,2 juv;3;Agelenidae;Histopona;torpida;Histopona torpida;804;45.887195;15.927871;Tx;deep cave;45.88719515.927871;9;;;;;;;;;;;;;;;;;;;;;;
1473;Špilja u Nevistinim stinama;Croatia;22.3.2003.;2003-03-22;1 juv;1;Agelenidae;Tegenaria;sp.;Tegenaria sp.;545;43.38269;16.942238;;deep cave;43.3826916.942238;1;;;;;;;;;;;;;;;;;;;;;;
1475;Jama na Saran?u;Croatia;25.3.2005.;2005-03-25;1f;1;Agelenidae;Tegenaria;sp. 4;Tegenaria sp. 4;725;43.247108;17.176093;;deep cave;43.24710817.176093;4;;;;;;;;;;;;;;;;;;;;;;
1476;Muci?a ledenica;Croatia;24.5.2004.;2004-05-24;1f;1;Agelenidae;Tegenaria;sp. 2;Tegenaria sp. 2;1250;43.35632;17.051544;;deep cave;43.3563217.051544;3;;;;;;;;;;;;;;;;;;;;;;
1478;Špilja u uvali Svežanj;Croatia;6.4.2008.;2008-04-06;2 juv m,1 juv;3;Nesticidae;Kryptonesticus;eremita;Kryptonesticus eremita;3;45.298144;14.49561;;deep cave;45.29814414.49561;1;;;;;;;;;;;;;;;;;;;;;;
1481;Kukor;Croatia;17.8.2000.;2000-08-17;1f,1 juv;2;Nesticidae;Kryptonesticus;deelemanae;Kryptonesticus deelemanae;425;43.355609;16.991707;tb;deep cave;43.35560916.991707;10;;;;;;;;;;;;;;;;;;;;;;
1483;Kuter?eva špilja;Croatia;25.5.2008.;2008-05-25;1m,1 juv;2;Nesticidae;Nesticus;cellulanus;Nesticus cellulanus;221;45.120864;15.635259;tf;deep cave;45.12086415.635259;3;;;;;;;;;;;;;;;;;;;;;;
1484;Stara Ledenica;Croatia;16.6.2002.;2002-06-16;1 juv;1;Agelenidae;Tegenaria;sp.;Tegenaria sp.;;43.318824;17.050297;;deep cave;43.31882417.050297;1;;;;;;;;;;;;;;;;;;;;;;
1485;Kuter?eva špilja;Croatia;8.6.2003.;2003-06-08;1f,1 juv;2;Nesticidae;Nesticus;cellulanus;Nesticus cellulanus;221;45.120864;15.635259;tf;deep cave;45.12086415.635259;3;;;;;;;;;;;;;;;;;;;;;;
1486;Mili?a špilja;Croatia;30.7.2006.;2006-07-30;1f;1;Nesticidae;Kryptonesticus;eremita;Kryptonesticus eremita;;44.143333;15.803133;tf;deep cave;44.14333315.803133;1;;;;;;;;;;;;;;;;;;;;;;
1487;Dvojama, Klana;Croatia;29.3.2007.;2007-03-29;1m;1;Agelenidae;Tegenaria;ferruginea;Tegenaria ferruginea;614;45.448806;14.424279;Tf;deep cave;45.44880614.424279;3;;;;;;;;;;;;;;;;;;;;;;
1488;Grizeljeva jama;Croatia;30.4.2005.;2005-04-30;1f;1;Agelenidae;Tegenaria;sp. 4;Tegenaria sp. 4;930;43.867534;16.399097;;deep cave;43.86753416.399097;5;;;;;;;;;;;;;;;;;;;;;;
1489;Jama u Bratušu;Croatia;27.8.2005.;2005-08-27;3 juv;3;Agelenidae;Histopona;sp.;Histopona sp.;25;43.328376;16.979405;;deep cave;43.32837616.979405;4;;;;;;;;;;;;;;;;;;;;;;
1490;Velika špilja na Bukovcima;Croatia;21.11.2005.;2005-11-21;1 juv;1;Agelenidae;Histopona;sp.;Histopona sp.;459;43.403686;17.022825;;deep cave;43.40368617.022825;1;;;;;;;;;;;;;;;;;;;;;;
1491;Nevakuša špilja;Croatia;2.12.2009.;2009-12-02;1f;1;Agelenidae;Histopona;conveniens;Histopona conveniens;;42.97412;17.686578;Tf;deep cave;42.9741217.686578;3;;;;;;;;;;;;;;;;;;;;;;
1494;Pišurka;Croatia;2.6.2000.;2000-06-02;2f;2;Agelenidae;Tegenaria;annulata;Tegenaria annulata;39;42.959451;17.129228;tf;deep cave;42.95945117.129228;5;;;;;;;;;;;;;;;;;;;;;;
1495;Kuna špilja;Croatia;27.8.1998.;1998-08-27;1m;1;Nesticidae;Kryptonesticus;deelemanae;Kryptonesticus deelemanae;1401;43.324523;17.055953;tb;deep cave;43.32452317.055953;2;;;;;;;;;;;;;;;;;;;;;;
1496;Jama na Ka?ju;Croatia;21.7.2006.;2006-07-21;1m;1;Nesticidae;Kryptonesticus;eremita;Kryptonesticus eremita;;45.553891;14.504034;Tf;deep cave;45.55389114.504034;1;;;;;;;;;;;;;;;;;;;;;;
1497;Kuter?eva špilja;Croatia;25.5.2008.;2008-05-25;1f,2 m;3;Nesticidae;Nesticus;cellulanus;Nesticus cellulanus;221;45.120864;15.635259;tf;deep cave;45.12086415.635259;3;;;;;;;;;;;;;;;;;;;;;;
1498;Jama na Suhom Ruminu;Croatia;27.7.2002.;2002-07-27;1m;1;Nesticidae;Kryptonesticus;eremita;Kryptonesticus eremita;391;43.782202;16.645051;tf;deep cave;43.78220216.645051;1;;;;;;;;;;;;;;;;;;;;;;
1500;Kraljicina špilja;Croatia;19.10.2007.;2007-10-19;4f,1m;5;Nesticidae;Kryptonesticus;eremita;Kryptonesticus eremita;44;43.073661;16.100773;tf;deep cave;43.07366116.100773;2;;;;;;;;;;;;;;;;;;;;;;
1501;Brajkovica;Croatia;24.8.2006.;2006-08-24;1f;1;Nesticidae;Kryptonesticus;eremita;Kryptonesticus eremita;;43.042669;16.099975;tf;deep cave;43.04266916.099975;2;;;;;;;;;;;;;;;;;;;;;;
1502;Kraljicina špilja;Croatia;19.10.2007.;2007-10-19;1 juv;1;Agelenidae;Histopona;sp.;Histopona sp.;44;43.073661;16.100773;;deep cave;43.07366116.100773;2;;;;;;;;;;;;;;;;;;;;;;
1503;Kraljicina špilja;Croatia;19.10.2007.;2007-10-19;1 juv;1;Nesticidae;Kryptonesticus;eremita;Kryptonesticus eremita;44;43.073661;16.100773;tf;deep cave;43.07366116.100773;2;;;;;;;;;;;;;;;;;;;;;;
1504;Jama za Mahrincem;Croatia;5.1.2005.;2005-01-05;2f,1 juv;3;Nesticidae;Kryptonesticus;eremita;Kryptonesticus eremita;54;43.344348;16.74088;tf;deep cave;43.34434816.74088;2;;;;;;;;;;;;;;;;;;;;;;
1505;Polušpilja na Mr?ari;Croatia;1.10.2007.;2007-10-01;2 juv;2;Agelenidae;Tegenaria;sp.;Tegenaria sp.;;42.768583;16.788965;;deep cave;42.76858316.788965;2;19,4;;;;;;;;;;;;;;;;;;;;;
1506;Kraljicina špilja;Croatia;3.10.2005.;2005-10-03;1f;1;Nesticidae;Kryptonesticus;eremita;Kryptonesticus eremita;44;43.073661;16.100773;tf;deep cave;43.07366116.100773;2;;;;;;;;;;;;;;;;;;;;;;
1516;Špilja Jama;Croatia;17.3.2002.;2002-03-17;1f;1;Agelenidae;Tegenaria;bosnica;Tegenaria bosnica;;43.110888;17.354016;;deep cave;43.11088817.354016;1;;;;;;;;;;;;;;;;;;;;;;
1517;Jama na Srakinju;Croatia;18.9.1996.;1996-09-18;1m;1;Agelenidae;Tegenaria;sp. X;Tegenaria sp. X;;43.2;16.7;;deep cave;43.216.7;1;;;;;;;;;;;;;;;;;;;;;;
1518;Špilja na vrh Toraca;Croatia;23.8.2005.;2005-08-23;1 juv;1;Nesticidae;Kryptonesticus;eremita;Kryptonesticus eremita;;42.705575;18.03049;tf;deep cave;42.70557518.03049;3;;15,5;15,275;;;;;;;;;;;;;;;;;;;
1521;Hrastovska špilja;Croatia;2.10.2007.;2007-10-02;2 juv;2;Nesticidae;Kryptonesticus;eremita;Kryptonesticus eremita;120;42.756282;16.875635;tf;deep cave;42.75628216.875635;4;11,2;;;;;;;;;;;;;;;;;;;;;
1522;Nevakuša špilja;Croatia;11.9.1997.;1997-09-11;1 juv;1;Agelenidae;Histopona;sp.;Histopona sp.;;42.97412;17.686578;;deep cave;42.9741217.686578;3;;;;;;;;;;;;;;;;;;;;;;
1523;Stražbenica;Croatia;3.5.2009.;2009-05-03;3f;3;Nesticidae;Kryptonesticus;eremita;Kryptonesticus eremita;213;43.697353;16.029618;tf;deep cave;43.69735316.029618;3;;;;;;;;;;;;;;;;;;;;;;
1524;Male ponte;Croatia;21.6.2001.;2001-06-21;3 juv;3;Agelenidae;Histopona;bidens;Histopona bidens;250;42.761389;17.430786;tb;deep cave;42.76138917.430786;7;;14;14,6;;;;;;;;;;;;;;;;;;;
1526;Kaverna u tunelu HE Plat;Croatia;10.8.2000.;2000-08-10;4f,2 juv;6;Nesticidae;Kryptonesticus;eremita;Kryptonesticus eremita;;42.603833;18.232834;tf;deep cave;42.60383318.232834;2;;;;;;;;;;;;;;;;;;;;;;
1528;Mo?iljska špilja;Croatia;1.11.2003.;2003-11-01;1f,1 juv;2;Agelenidae;Histopona;dubia;Histopona dubia;410;42.689061;18.071906;tb;deep cave;42.68906118.071906;6;;15,4;15,825;;;;;;;;;;;;;;;;;;;
1529;Vilina špilja-Izvor Omble;Croatia;7.10.2004.;2004-10-07;1f,8 juv;9;Agelenidae;Histopona;dubia;Histopona dubia;137;42.67716;18.136236;tb;deep cave;42.6771618.136236;5;;;14,2;;;;;;;;;;;;;;;;;;;
1530;Ostaševica;Croatia;17.6.2001.;2001-06-17;1f,1 juv;2;Agelenidae;Histopona;bidens;Histopona bidens;220;42.748959;17.544404;tb;deep cave;42.74895917.544404;9;11,6;;;;;;;;;;;;;;;;;;;;;
1531;Vilinska jama;Croatia;2.4.2007.;2007-04-02;1 juv;1;Agelenidae;Histopona;sp.;Histopona sp.;121;42.728553;17.881121;;deep cave;42.72855317.881121;10;13,6;;;;;;;;;;;;;;;;;;;;;
1532;Banova ljut;Croatia;4.4.2007.;2007-04-04;1f,1 juv;2;Nesticidae;Kryptonesticus;eremita;Kryptonesticus eremita;;42.724023;18.023649;tf;deep cave;42.72402318.023649;4;15,2;;;;;;;;;;;;;;;;;;;;;
1533;Banova ljut;Croatia;4.4.2007.;2007-04-04;2 juv;2;Agelenidae;Histopona;sp.;Histopona sp.;;42.724023;18.023649;;deep cave;42.72402318.023649;4;15,2;;;;;;;;;;;;;;;;;;;;;
1534;Špilja za Groma?kom vlakom;Croatia;29.5.2004.;2004-05-29;1 f;1;Agelenidae;Histopona;dubia;Histopona dubia;605;42.743509;18.027359;tb;deep cave;42.74350918.027359;15;;;13,63043478;;;;;;;;;;;;;;;;;;;
1535;Jama pod Velji vrh;Croatia;14.6.2001.;2001-06-14;2m,1f, 2 juv;5;Nesticidae;Kryptonesticus;eremita;Kryptonesticus eremita;;42.766635;16.907278;tf;deep cave;42.76663516.907278;2;;16,1;17,425;;;;;;;;;;;;;;;;;;;
1536;Špilja na vrh Toraca;Croatia;8.10.2004.;2004-10-08;2 juv;2;Agelenidae;Histopona;sp.;Histopona sp.;;42.705575;18.03049;;deep cave;42.70557518.03049;3;;15,5;15,275;;;;;;;;;;;;;;;;;;;
1537;Špilja za Groma?kom vlakom;Croatia;29.5.2004.;2004-05-29;2f;2;Agelenidae;Histopona;dubia;Histopona dubia;605;42.743509;18.027359;tb;deep cave;42.74350918.027359;15;;;13,63043478;;;;;;;;;;;;;;;;;;;
1539;Vilina špilja-Izvor Omble;Croatia;11.8.2000.;2000-08-11;4 juv;4;Agelenidae;Histopona;sp.;Histopona sp.;137;42.67716;18.136236;;deep cave;42.6771618.136236;5;;;14,2;;;;;;;;;;;;;;;;;;;
1540;Rudina;Croatia;9.9.2006.;2006-09-09;1f;1;Agelenidae;Histopona;dubia;Histopona dubia;;42.721999;18.015321;tb;deep cave;42.72199918.015321;3;9,9;;;;;;;;;;;;;;;;;;;;;
1541;Rudina;Croatia;9.9.2004.;2004-09-09;2 juv;2;Agelenidae;HIstopona;sp.;HIstopona sp.;;42.721999;18.015321;;deep cave;42.72199918.015321;3;9,9;;;;;;;;;;;;;;;;;;;;;
1542;Špilja na vrh Toraca;Croatia;8.10.2004.;2004-10-08;3 juv;3;Agelenidae;Histopona;sp.;Histopona sp.;;42.705575;18.03049;;deep cave;42.70557518.03049;3;;15,5;15,275;;;;;;;;;;;;;;;;;;;
1543;Banova ljut;Croatia;7.9.2006.;2006-09-07;1f;1;Agelenidae;Histopona;dubia;Histopona dubia;;42.724023;18.023649;tb;deep cave;42.72402318.023649;4;15,2;;;;;;;;;;;;;;;;;;;;;
1544;Debela ljut;Croatia;7.4.2006.;2006-04-07;2 juv;2;Nesticidae;Kryptonesticus;eremita;Kryptonesticus eremita;;42.717699;18.022036;tf;deep cave;42.71769918.022036;8;;15,6;13,78333333;;;;;;;;;;;;;;;;;;;
1545;Špilja za Groma?kom vlakom;Croatia;25.-26.3.2003.;2003-03-25/2003-03-26;2 f;2;Tetragnathidae;Metellina;merianae;Metellina merianae;605;42.743509;18.027359;Tf;deep cave;42.74350918.027359;15;;;13,63043478;;;;;;;;;;;;;;;;;;;
1546;Špilja za Groma?kom vlakom;Croatia;25.-26.3.2003.;2003-03-25/2003-03-26;1f,2 juv;3;Agelenidae;Histopona;dubia;Histopona dubia;605;42.743509;18.027359;tb;deep cave;42.74350918.027359;15;;;13,63043478;;;;;;;;;;;;;;;;;;;
1547;Špilja za Groma?kom vlakom;Croatia;8.5.2006.;2006-05-08;1f;1;Agelenidae;Histopona;dubia;Histopona dubia;605;42.743509;18.027359;tb;deep cave;42.74350918.027359;15;;;13,63043478;;;;;;;;;;;;;;;;;;;
1548;Špilja za Groma?kom vlakom;Croatia;29.3.2003.;2003-03-29;1 juv;1;Agelenidae;Histopona;sp.;Histopona sp.;605;42.743509;18.027359;;deep cave;42.74350918.027359;15;;;13,63043478;;;;;;;;;;;;;;;;;;;
1549;Špilja na vrh Toraca;Croatia;23.8.2005.;2005-08-23;1 juv;1;Agelenidae;Histopona;sp.;Histopona sp.;;42.705575;18.03049;;deep cave;42.70557518.03049;3;;15,5;15,275;;;;;;;;;;;;;;;;;;;
1550;Banova ljut;Croatia;4.4.2007.;2007-04-04;2 juv;2;Agelenidae;Histopona;sp.;Histopona sp.;;42.724023;18.023649;;deep cave;42.72402318.023649;4;15,2;;;;;;;;;;;;;;;;;;;;;
1551;Banova ljut;Croatia;4.4.2007.;2007-04-04;1f, 1 juv;2;Agelenidae;Histopona;dubia;Histopona dubia;;42.724023;18.023649;tb;deep cave;42.72402318.023649;4;15,2;;;;;;;;;;;;;;;;;;;;;
1552;Banova ljut;Croatia;7.9.2006.;2006-09-07;1 f;1;Nesticidae;Kryptonesticus;eremita;Kryptonesticus eremita;;42.724023;18.023649;tf;deep cave;42.72402318.023649;4;15,2;;;;;;;;;;;;;;;;;;;;;
1553;Špilja za Groma?kom vlakom;Croatia;29.3.2003.;2003-03-29;1 juv;1;Agelenidae;Histopona;sp.;Histopona sp.;605;42.743509;18.027359;;deep cave;42.74350918.027359;15;;;13,63043478;;;;;;;;;;;;;;;;;;;
1554;Špilja za Groma?kom vlakom;Croatia;25.-26.3.2003.;2003-03-25/2003-03-26;2 f,1juv;3;Agelenidae;Histopona;dubia;Histopona dubia;605;42.743509;18.027359;tb;deep cave;42.74350918.027359;15;;;13,63043478;;;;;;;;;;;;;;;;;;;
1555;Špilja na vrh Toraca;Croatia;23.8.2005.;2005-08-23;1f;1;Nesticidae;Kryptonesticus;eremita;Kryptonesticus eremita;;42.705575;18.03049;tf;deep cave;42.70557518.03049;3;;15,5;15,275;;;;;;;;;;;;;;;;;;;
1556;Mo?iljska špilja;Croatia;28.3.2003.;2003-03-28;1 m;1;Agelenidae;Histopona;dubia;Histopona dubia;410;42.689061;18.071906;tb;deep cave;42.68906118.071906;6;;15,4;15,825;;;;;;;;;;;;;;;;;;;
1557;Mo?iljska špilja;Croatia;;;1 juv;1;Agelenidae;Histopona;sp.;Histopona sp.;410;42.689061;18.071906;;deep cave;42.68906118.071906;6;;15,4;15,825;;;;;;;;;;;;;;;;;;;
1558;Mo?iljska špilja;Croatia;28.3.2003.;2003-03-28;5 juv;5;Agelenidae;Histopona;sp.;Histopona sp.;410;42.689061;18.071906;;deep cave;42.68906118.071906;6;;15,4;15,825;;;;;;;;;;;;;;;;;;;
1559;Mo?iljska špilja;Croatia;8.10.2004.;2004-10-08;2 juv;2;Agelenidae;Histopona;sp.;Histopona sp.;410;42.689061;18.071906;;deep cave;42.68906118.071906;6;;15,4;15,825;;;;;;;;;;;;;;;;;;;
1561;Mo?iljska špilja;Croatia;1.4.2007.;2007-04-01;1 m, 1f;2;Agelenidae;Histopona;dubia;Histopona dubia;410;42.689061;18.071906;tb;deep cave;42.68906118.071906;6;;15,4;15,825;;;;;;;;;;;;;;;;;;;
1563;Vilinska jama;Croatia;2.4.2007.;2007-04-02;1f;1;Agelenidae;Histopona;dubia;Histopona dubia;121;42.728553;17.881121;tb;deep cave;42.72855317.881121;10;13,6;;;;;;;;;;;;;;;;;;;;;
1564;Jama pod Sv. Spasom;Croatia;20.6.2001.;2001-06-20;1juv m, 3 juv;4;Agelenidae;Histopona;bidens;Histopona bidens;134;42.731779;17.542409;tb;deep cave;42.73177917.542409;6;;;;;;;;;;;;;;;;;;;;;;
1565;Jama pod Sv. Spasom;Croatia;2.12.2001.;2001-12-02;1 m;1;Tetragnathidae;Metellina;merianae;Metellina merianae;;42.731779;17.542409;Tf;deep cave;42.73177917.542409;6;;;;;;;;;;;;;;;;;;;;;;
1567;Vilina špilja-Izvor Omble;Croatia;11.8.2000.;2000-08-11;1 juv;1;Nesticidae;Kryptonesticus;eremita;Kryptonesticus eremita;;42.67716;18.136236;tf;deep cave;42.6771618.136236;5;;;14,2;;;;;;;;;;;;;;;;;;;
1569;Škarin Samograd;Croatia;8.1.2005.;2005-01-08;1m,1 juv m, 1juv;3;Tetragnathidae;Metellina;merianae;Metellina merianae;;43.781501;16.09613;Tf;deep cave;43.78150116.09613;3;;;;;;;;;;;;;;;;;;;;;;
1570;Mo?iljska špilja;Croatia;28.4.2010.;2010-04-28;1m, 1juv;2;Nesticidae;Kryptonesticus;eremita;Kryptonesticus eremita;410;42.689061;18.071906;tf;deep cave;42.68906118.071906;6;;15,4;15,825;;;;;;;;;;;;;;;;;;;
1571;Mo?iljska špilja;Croatia;28.4.2010.;2010-04-28;2 juv;2;Agelenidae;Histopona;sp.;Histopona sp.;410;42.689061;18.071906;;deep cave;42.68906118.071906;6;;15,4;15,825;;;;;;;;;;;;;;;;;;;
1572;Mo?iljska špilja;Croatia;28.4.2010.;2010-04-28;1 juv m,1juv;2;Nesticidae;Kryptonesticus;eremita;Kryptonesticus eremita;410;42.689061;18.071906;tf;deep cave;42.68906118.071906;6;;15,4;15,825;;;;;;;;;;;;;;;;;;;
1573;Mo?iljska špilja;Croatia;28.4.2010.;2010-04-28;1 juv;1;Agelenidae;Histopona;sp.;Histopona sp.;410;42.689061;18.071906;;deep cave;42.68906118.071906;6;;15,4;15,825;;;;;;;;;;;;;;;;;;;
1574;Vilina špilja-Izvor Omble;Croatia;29.4.2010.;2010-04-29;1f,1 juv m;2;Agelenidae;Histopona;dubia;Histopona dubia;137;42.67716;18.136236;tb;deep cave;42.6771618.136236;5;;;14,2;;;;;;;;;;;;;;;;;;;
1575;Špilja za Groma?kom vlakom;Croatia;27.4.2010.;2010-04-27;1f;1;Agelenidae;Histopona;dubia;Histopona dubia;605;42.743509;18.027359;tb;deep cave;42.74350918.027359;15;;;13,63043478;;;;;;;;;;;;;;;;;;;
1576;Špilja za Groma?kom vlakom;Croatia;27.4.2010.;2010-04-27;5 juv;5;Agelenidae;Histopona;sp.;Histopona sp.;605;42.743509;18.027359;;deep cave;42.74350918.027359;15;;;13,63043478;;;;;;;;;;;;;;;;;;;
1581;Banova ljut;Croatia;4.4.2007.;2007-04-04;1 juv;1;Nesticidae;Kryptonesticus;eremita;Kryptonesticus eremita;;42.724023;18.023649;tf;deep cave;42.72402318.023649;4;15,2;;;;;;;;;;;;;;;;;;;;;
1583;Jama pod Sv. Spasom;Croatia;20.6.2001.;2001-06-20;1juv;1;Agelenidae;Tegenaria;sp.;Tegenaria sp.;134;42.731779;17.542409;;deep cave;42.73177917.542409;6;;;;;;;;;;;;;;;;;;;;;;
1584;Piskovica;Croatia;13.5.2001.;2001-05-13;1f;1;Nesticidae;Kryptonesticus;eremita;Kryptonesticus eremita;315;45.26207;14.03692;tf;deep cave;45.2620714.03692;1;;;;;;;;;;;;;;;;;;;;;;
1585;Uviraljka;Croatia;21.9.2010.;2010-09-21;4f, 1m;5;Linyphiidae;Porrhomma;egeria;Porrhomma egeria;810;45.522243;17.62067;Tf;deep cave;45.52224317.62067;3;;;;;;;;;;;;;;;;;;;;;;
1586;Uviraljka;Croatia;21.9.2010.;2010-09-21;3f, 3 juv;6;Linyphiidae;Porrhomma;egeria;Porrhomma egeria;810;45.522243;17.62067;Tf;deep cave;45.52224317.62067;3;;;;;;;;;;;;;;;;;;;;;;
1587;Jan?ikin guz;Croatia;23.9.2010.;2010-09-23;1f;1;Linyphiidae;Centromerus;cavernarum;Centromerus cavernarum;;45.517713;17.668957;Tf;deep cave;45.51771317.668957;1;;;;;;;;;;;;;;;;;;;;;;
1589;Miljacka 1- 5;Croatia;8.10.2010.;2010-10-08;1 juv;1;Agelenidae;Histopona;sp.;Histopona sp.;;44.004754;16.023086;;deep cave;44.00475416.023086;2;;;;;;;;;;;;;;;;;;;;;;
1591;Kukor;Croatia;19.6.2002.;2002-06-19;1f;1;Theridiidae;Gen.;sp.;Gen. sp.;425;43.355609;16.991707;;;43.35560916.991707;10;;;;;;;;;;;;;;;;;;;;;;
1593;Markov ponor;Croatia;15.8.2009.;2009-08-15;1f;1;Linyphiidae;Troglohyphantes;sp. 3;Troglohyphantes sp. 3;;44.765318;15.176875;tb;deep cave;44.76531815.176875;1;;;;;;;;;;;;;;;;;;;;;;
1595;Mala Golubnja?a;Croatia;16.8.2009.;2009-08-16;1juv f;1;Nesticidae;Nesticus;cellulanus;Nesticus cellulanus;;44.756723;15.189413;tf;deep cave;44.75672315.189413;2;;;;;;;;;;;;;;;;;;;;;;
1596;Mala Golubnja?a;Croatia;16.8.2009.;2009-08-16;2m, 4 juv;6;Linyphiidae;Troglohyphantes;sp. 3;Troglohyphantes sp. 3;;44.756723;15.189413;tb;deep cave;44.75672315.189413;2;;;;;;;;;;;;;;;;;;;;;;
1597;Velika Golubnja?a;Croatia;16.8.2009.;2009-08-16;2m, 7f, 1 juv;1;Linyphiidae;Troglohyphantes;sp. 3;Troglohyphantes sp. 3;;44.756325;15.190472;tb;deep cave;44.75632515.190472;1;;;;;;;;;;;;;;;;;;;;;;
1598;Markarova špilja;Croatia;14.10.1995.;1995-10-14;1m;1;Tetragnathidae;Metellina;merianae;Metellina merianae;;45.033811;15.258625;Tf;deep cave;45.03381115.258625;1;;;;;;;;;;;;;;;;;;;;;;
1600;Vrelo;Croatia;20.2.1999.;1999-02-20;1f;1;Linyphiidae;Troglohyphantes;croaticus;Troglohyphantes croaticus;730;45.326489;14.704217;Tb;deep cave;45.32648914.704217;8;;;;;;;;;;;;;;;;;;;;;;
1601;Vrelo;Croatia;20.2.1999.;1999-02-20;1f;1;Linyphiidae;Gen. 6;sp. 1;Gen. 6 sp. 1;730;45.326489;14.704217;;;45.32648914.704217;8;;;;;;;;;;;;;;;;;;;;;;
1603;Vrelo;Croatia;20.2.1999.;1999-02-20;1m;1;Dysderidae;Stalita;pretneri;Stalita pretneri;730;45.326489;14.704217;Tb;deep cave;45.32648914.704217;8;;;;;;;;;;;;;;;;;;;;;;
1604;Vrelo;Croatia;3.7.1994.;1994-07-03;1f, 1 juv;2;Dysderidae;Parastalita;stygia;Parastalita stygia;730;45.326489;14.704217;Tb;deep cave;45.32648914.704217;8;;;;;;;;;;;;;;;;;;;;;;
1605;Vrelo;Croatia;30.3.1996.;1996-03-30;1f;1;Linyphiidae;Troglohyphantes;croaticus;Troglohyphantes croaticus;730;45.326489;14.704217;Tb;deep cave;45.32648914.704217;8;;;;;;;;;;;;;;;;;;;;;;
1606;Vrelo;Croatia;8.9.1994.;1994-09-08;2f;2;Dysderidae;Parastalita;stygia;Parastalita stygia;730;45.326489;14.704217;Tb;deep cave;45.32648914.704217;8;;;;;;;;;;;;;;;;;;;;;;
1607;Vrelo 2;Croatia;6.9.1995.;1995-09-06;1m;1;Dysderidae;Parastalita;stygia;Parastalita stygia;730;45.326489;14.704217;Tb;deep cave;45.32648914.704217;8;;;;;;;;;;;;;;;;;;;;;;
1608;Lokvarka;Croatia;1.- 2.9.2001.;2001-09-01/2001-09-02;1m, 3 juv;4;Dysderidae;Parastalita;stygia;Parastalita stygia;775;45.361466;14.762671;Tb;deep cave;45.36146614.762671;2;;;;;;;;;;;;;;;;;;;;;;
1609;Stupina jama;Croatia;10.9.1995.;1995-09-10;1m;1;Dysderidae;Parastalita;stygia;Parastalita stygia;920;45.242487;14.788115;Tb;deep cave;45.24248714.788115;1;;;;;;;;;;;;;;;;;;;;;;
1610;Medvje?a špilja;Croatia;20.10.1996.;1996-10-20;2m, 2f;4;Dysderidae;Parastalita;stygia;Parastalita stygia;809;45.363572;14.757905;Tb;deep cave;45.36357214.757905;3;;;;;;;;;;;;;;;;;;;;;;
1611;Medvje?a špilja;Croatia;20.10.1996.;1996-10-20;1 juv m?;1;Dysderidae;Stalita;pretneri;Stalita pretneri;809;45.363572;14.757905;Tb;deep cave;45.36357214.757905;3;;;;;;;;;;;;;;;;;;;;;;
1612;Vrtložna jama;Croatia;1.7.2006.;2006-07-01;1m;1;Dysderidae;Parastalita;stygia;Parastalita stygia;875;45.590817;14.515796;Tb;deep cave;45.59081714.515796;1;;;;;;;;;;;;;;;;;;;;;;
1613;Jama kod Vrbovskog;Croatia;30.9.1996.;1996-09-30;1f;1;Dysderidae;Parastalita;stygia;Parastalita stygia;;45.358714;15.073242;Tb;deep cave;45.35871415.073242;2;;;;;;;;;;;;;;;;;;;;;;
1614;Jama na Vrši?ku;Croatia;1.9.2006.;2006-09-01;1m;1;Dysderidae;Parastalita;stygia;Parastalita stygia;873;45.453146;14.701154;Tb;deep cave;45.45314614.701154;1;;;;;;;;;;;;;;;;;;;;;;
1615;Lokvarka;Croatia;17.3.2007.;2007-03-17;1m;1;Dysderidae;Parastalita;stygia;Parastalita stygia;775;45.361466;14.762671;Tb;deep cave;45.36146614.762671;2;;;;;;;;;;;;;;;;;;;;;;
1616;Lokvarka;Croatia;12.9.1996.;1996-09-12;3m;3;Dysderidae;Parastalita;stygia;Parastalita stygia;775;45.361466;14.762671;Tb;deep cave;45.36146614.762671;2;;;;;;;;;;;;;;;;;;;;;;
1617;Lokvarka;Croatia;14.6.1997.;1997-06-14;1juv;1;Dysderidae;Parastalita;stygia;Parastalita stygia;775;45.361466;14.762671;Tb;deep cave;45.36146614.762671;2;;;;;;;;;;;;;;;;;;;;;;
1618;Hircova jama;Croatia;2.8.2002.;2002-08-02;1m;1;Dysderidae;Parastalita;stygia;Parastalita stygia;923;45.426113;14.664785;Tb;deep cave;45.42611314.664785;3;;;;;;;;;;;;;;;;;;;;;;
1619;Vrelo Li?anke;Croatia;20.7.1998.;1998-07-20;1m;1;Dysderidae;Parastalita;stygia;Parastalita stygia;740;45.329044;14.701574;Tb;deep cave;45.32904414.701574;1;;;;;;;;;;;;;;;;;;;;;;
1620;Lokvarka;Croatia;27.9.1997.;1997-09-27;1juv;1;Dysderidae;Parastalita;stygia;Parastalita stygia;775;45.361466;14.762671;Tb;deep cave;45.36146614.762671;2;;;;;;;;;;;;;;;;;;;;;;
1621;Grizeljeva jama;Croatia;8.8.2007.;2007-08-08;1f;1;Dysderidae;Harpactea;sp. 27;Harpactea sp. 27;;43.867534;16.399097;;;43.86753416.399097;5;;;;;;;;;;;;;;;;;;;;;;
1622;Jakasova spila;Croatia;25.4.2004.;2004-04-25;3 juv;3;Dysderidae;Folkia;haasi;Folkia haasi;95;42.91615;17.12834;Tb;deep cave;42.9161517.12834;1;;;;;;;;;;;;;;;;;;;;;;
1623;Jakasova spila;Croatia;27.8.1995.;1995-08-27;2 juv;2;Dysderidae;Folkia;haasi;Folkia haasi;;42.91615;17.12834;Tb;deep cave;42.9161517.12834;1;;;;;;;;;;;;;;;;;;;;;;
1624;Špilja kod Nerezinog dola;Croatia;8.8.1996.;1996-08-08;1m, 1juv;2;Dysderidae;Folkia;inermis;Folkia inermis;;42.758378;17.436094;Tb;deep cave;42.75837817.436094;6;;14,6;12,7875;;;;;;;;;;;;;;;;;;;
1625;Samograd;Croatia;26.4.2004.;2004-04-26;1m, 1juv;2;Dysderidae;Folkia;haasi;Folkia haasi;;42.970451;16.995978;Tb;deep cave;42.97045116.995978;4;;;;;;;;;;;;;;;;;;;;;;
1626;Pišurka;Croatia;28.8.1995.;1995-08-28;1juv;1;Dysderidae;Folkia;haasi;Folkia haasi;;42.959451;17.129228;Tb;deep cave;42.95945117.129228;5;;;;;;;;;;;;;;;;;;;;;;
1627;Samograd;Croatia;1.9.1995.;1995-09-01;1juv;1;Dysderidae;Folkia;haasi;Folkia haasi;;42.970451;16.995978;Tb;deep cave;42.97045116.995978;4;;;;;;;;;;;;;;;;;;;;;;
1628;Pišurka;Croatia;12.2.1998.;1998-02-12;2 juv;2;Dysderidae;Folkia;haasi;Folkia haasi;;42.959451;17.129228;Tb;deep cave;42.95945117.129228;5;;;;;;;;;;;;;;;;;;;;;;
1630;Samograd;Croatia;4.6.2000.;2000-06-04;3f, 1juv;4;Dysderidae;Folkia;haasi;Folkia haasi;;42.970451;16.995978;Tb;deep cave;42.97045116.995978;4;;;;;;;;;;;;;;;;;;;;;;
1631;Samograd;Croatia;12.2.1998.;1998-02-12;1 juvm, 2 juv;3;Dysderidae;Folkia;haasi;Folkia haasi;;42.970451;16.995978;Tb;deep cave;42.97045116.995978;4;;;;;;;;;;;;;;;;;;;;;;
1632;Jakasova spila;Croatia;3.6.2000.;2000-06-03;1f, 1 juv;2;Dysderidae;Folkia;haasi;Folkia haasi;;42.91615;17.12834;Tb;deep cave;42.9161517.12834;1;;;;;;;;;;;;;;;;;;;;;;
1633;Samograd;Croatia;26.4.2004.;2004-04-26;2 juv;2;Dysderidae;Folkia;haasi;Folkia haasi;;42.970451;16.995978;Tb;deep cave;42.97045116.995978;4;;;;;;;;;;;;;;;;;;;;;;
1634;Pišurka;Croatia;2.6.2000.;2000-06-02;2 juv;2;Dysderidae;Folkia;haasi;Folkia haasi;;42.959451;17.129228;Tb;deep cave;42.95945117.129228;5;;;;;;;;;;;;;;;;;;;;;;
1635;Jakasova spila;Croatia;25.4.2004.;2004-04-25;2 juv;2;Dysderidae;Folkia;haasi;Folkia haasi;;42.91615;17.12834;Tb;deep cave;42.9161517.12834;1;;;;;;;;;;;;;;;;;;;;;;
1636;Vodena pe?a;Croatia;17.8.2005.;2005-08-17;1f;1;Dysderidae;Stalagtia;sp. 4;Stalagtia sp. 4;610;43.792496;16.671447;Tb;deep cave;43.79249616.671447;8;;;;;;;;;;;;;;;;;;;;;;
1637;Grizeljeva jama;Croatia;8.8.2007.;2007-08-08;1juvm, 1juv;2;Dysderidae;Harpactea;sp.;Harpactea sp.;;43.867534;16.399097;;;43.86753416.399097;5;;;;;;;;;;;;;;;;;;;;;;
1638;Vodena pe?a;Croatia;17.8.2005.;2005-08-17;1f;1;Dysderidae;Harpactea;sp. 33;Harpactea sp. 33;610;43.792496;16.671447;;;43.79249616.671447;8;;;;;;;;;;;;;;;;;;;;;;
1639;Mo?iljska špilja;Croatia;1.11.2003.;2003-11-01;1m;1;Dysderidae;Stalagtia;sp. 5;Stalagtia sp. 5;;42.689061;18.071906;Tb;deep cave;42.68906118.071906;6;;15,4;15,825;;;;;;;;;;;;;;;;;;;
1640;Šipun;Croatia;26.3.2004.;2004-03-26;1f;1;Dysderidae;Stalagtia;sp. 1;Stalagtia sp. 1;;42.583646;18.217986;Tb;deep cave;42.58364618.217986;11;16;;;;;;;;;;;;;;;;;;;;;
1641;Mo?iljska špilja;Croatia;9.2.1998.;1998-02-09;1f;1;Dysderidae;Stalagtia;sp. 5;Stalagtia sp. 5;;42.689061;18.071906;Tb;deep cave;42.68906118.071906;6;;15,4;15,825;;;;;;;;;;;;;;;;;;;
1642;Mo?iljska špilja;Croatia;25.3.2004.;2004-03-25;1m;1;Dysderidae;Stalagtia;sp. 5;Stalagtia sp. 5;;42.689061;18.071906;Tb;deep cave;42.68906118.071906;6;;15,4;15,825;;;;;;;;;;;;;;;;;;;
1643;Mo?iljska špilja;Croatia;21.6.2001.;2001-06-21;1f, 1 juv;2;Dysderidae;Stalagtia;sp. 5;Stalagtia sp. 5;;42.689061;18.071906;Tb;deep cave;42.68906118.071906;6;;15,4;15,825;;;;;;;;;;;;;;;;;;;
1644;Šipun;Croatia;12.2.2005.;2005-02-12;1f;1;Dysderidae;Stalagtia;sp. 1;Stalagtia sp. 1;;42.583646;18.217986;Tb;deep cave;42.58364618.217986;11;16;;;;;;;;;;;;;;;;;;;;;
1645;Šipun;Croatia;19.8.2005.;2005-08-19;2 juv;2;Dysderidae;Stalagtia;sp. 1;Stalagtia sp. 1;;42.583646;18.217986;Tb;deep cave;42.58364618.217986;11;16;;;;;;;;;;;;;;;;;;;;;
1646;Mo?iljska špilja;Croatia;27.6.2003.;2003-06-27;1juvm;1;Dysderidae;Stalagtia;sp. 5;Stalagtia sp. 5;;42.689061;18.071906;Tb;deep cave;42.68906118.071906;6;;15,4;15,825;;;;;;;;;;;;;;;;;;;
1647;Mo?iljska špilja;Croatia;28.3.2003.;2003-03-28;2 juv;2;Dysderidae;Stalagtia;sp. 5;Stalagtia sp. 5;;42.689061;18.071906;Tb;deep cave;42.68906118.071906;6;;15,4;15,825;;;;;;;;;;;;;;;;;;;
1649;Mo?iljska špilja;Croatia;1.11.2003.;2003-11-01;1 juv;1;Dysderidae;Stalagtia;sp. 5;Stalagtia sp. 5;;42.689061;18.071906;Tb;deep cave;42.68906118.071906;6;;15,4;15,825;;;;;;;;;;;;;;;;;;;
1652;Trogrla jama;Croatia;9.10.2010.;2010-10-09;1m, 1f;2;Nesticidae;Kryptonesticus;eremita;Kryptonesticus eremita;;44.014335;16.065195;tf;deep cave;44.01433516.065195;3;;;;;;;;;;;;;;;;;;;;;;
1653;Trogrla jama;Croatia;9.10.2010.;2010-10-09;1 juv;1;Dysderidae;Stalagtia;sp. 4;Stalagtia sp. 4;;44.014335;16.065195;Tb;deep cave;44.01433516.065195;3;;;;;;;;;;;;;;;;;;;;;;
1655;Trogrla jama;Croatia;9.10.2010.;2010-10-09;2juv;2;Dysderidae;Stalagtia;sp. 4;Stalagtia sp. 4;;44.014335;16.065195;Tb;deep cave;44.01433516.065195;3;;;;;;;;;;;;;;;;;;;;;;
1656;Stara jametina;Croatia;10.10.2010.;2010-10-10;1 juv;1;Dysderidae;Stalagtia;sp. 4;Stalagtia sp. 4;;43.794009;16.00259;Tb;deep cave;43.79400916.00259;6;;;;;;;;;;;;;;;;;;;;;;
1657;Miljacka 2;Croatia;8.10.2010.;2010-10-08;1m, 1f, 4 juv;6;Nesticidae;Kryptonesticus;eremita;Kryptonesticus eremita;;44.0002;16.016234;tf;deep cave;44.000216.016234;4;;;;;;;;;;;;;;;;;;;;;;
1658;Stara jametina;Croatia;10.10.2010.;2010-10-10;1juv;1;Dysderidae;Stalagtia;sp. 4;Stalagtia sp. 4;;43.794009;16.00259;Tb;deep cave;43.79400916.00259;6;;;;;;;;;;;;;;;;;;;;;;
1659;Stara jametina;Croatia;10.10.2010.;2010-10-10;1 juv;1;Agelenidae;Histopona;sp.;Histopona sp.;;43.794009;16.00259;;deep cave;43.79400916.00259;6;;;;;;;;;;;;;;;;;;;;;;
1661;Golubinka na Pozdravljanju;Croatia;9.10.2010.;2010-10-09;1m, 1 juv;2;Nesticidae;Kryptonesticus;eremita;Kryptonesticus eremita;;43.831451;15.925122;tf;deep cave;43.83145115.925122;2;;;;;;;;;;;;;;;;;;;;;;
1662;Špiljski sustav Miljacka 1-5;Croatia;8.10.2010.;2010-10-08;1m;1;Nesticidae;Kryptonesticus;eremita;Kryptonesticus eremita;;44.004754;16.023086;tf;deep cave;44.00475416.023086;2;;;;;;;;;;;;;;;;;;;;;;
1663;Sedrena špilja kod stola;Croatia;5.10.2010.;2010-10-05;1 m;1;Nesticidae;Kryptonesticus;eremita;Kryptonesticus eremita;;44.01385;16.068978;tf;deep cave;44.0138516.068978;2;;;;;;;;;;;;;;;;;;;;;;
1664;Miljacka 2;Croatia;8.10.2010.;2010-10-08;1m, 1f;2;Nesticidae;Kryptonesticus;eremita;Kryptonesticus eremita;;44.0002;16.016234;tf;deep cave;44.000216.016234;4;;;;;;;;;;;;;;;;;;;;;;
1665;Jazinka;Croatia;10.10.2010.;2010-10-10;1 juv;1;Dysderidae;Stalagtia;sp. 4;Stalagtia sp. 4;235;43.975892;16.029694;Tb;deep cave;43.97589216.029694;2;;;;;;;;;;;;;;;;;;;;;;
1667;Stara jametina;Croatia;10.10.2010.;2010-10-10;1m;1;Linyphiidae;Palliduphantes;istrianus;Palliduphantes istrianus;;43.794009;16.00259;Tf;deep cave;43.79400916.00259;6;;;;;;;;;;;;;;;;;;;;;;
1668;Stara jametina;Croatia;10.10.2010.;2010-10-10;1f;1;Linyphiidae;Palliduphantes;istrianus;Palliduphantes istrianus;;43.794009;16.00259;Tf;deep cave;43.79400916.00259;6;;;;;;;;;;;;;;;;;;;;;;
1669;Stara jametina;Croatia;10.10.2010.;2010-10-10;1f;1;Linyphiidae;Palliduphantes;istrianus;Palliduphantes istrianus;;43.794009;16.00259;Tf;deep cave;43.79400916.00259;6;;;;;;;;;;;;;;;;;;;;;;
1674;Golubinka na Pozdravljanju;Croatia;9.10.2010.;2010-10-09;1m, 2f;3;Linyphiidae;Palliduphantes;istrianus;Palliduphantes istrianus;;43.831451;15.925122;Tf;deep cave;43.83145115.925122;2;;;;;;;;;;;;;;;;;;;;;;
1675;Jama nasuprot Torka;Croatia;9.10.2010.;2010-10-09;1f, 4 juv;5;Nesticidae;Kryptonesticus;eremita;Kryptonesticus eremita;;43.82018;16.012303;tf;deep cave;43.8201816.012303;8;;;;;;;;;;;;;;;;;;;;;;
1676;Jama nasuprot Torka;Croatia;9.10.2010.;2010-10-09;1m;1;Agelenidae;Inermocoelotes;gasperinii;Inermocoelotes gasperinii;;43.82018;16.012303;;deep cave;43.8201816.012303;8;;;;;;;;;;;;;;;;;;;;;;
1677;Miljacka 2;Croatia;8.10.2010.;2010-10-08;1f, 1m;2;Nesticidae;Kryptonesticus;eremita;Kryptonesticus eremita;;44.0002;16.016234;tf;deep cave;44.000216.016234;4;;;;;;;;;;;;;;;;;;;;;;
1678;Miljacka 2;Croatia;8.10.2010.;2010-10-08;1f;1;Agelenidae;Tegenaria;domestica;Tegenaria domestica;;44.0002;16.016234;Tf;deep cave;44.000216.016234;4;;;;;;;;;;;;;;;;;;;;;;
1679;Miljacka 2;Croatia;8.10.2010.;2010-10-08;1f, 2 juv;3;Nesticidae;Kryptonesticus;eremita;Kryptonesticus eremita;;44.0002;16.016234;tf;deep cave;44.000216.016234;4;;;;;;;;;;;;;;;;;;;;;;
1680;Miljacka 2;Croatia;8.10.2010.;2010-10-08;1f, 1m;2;Agelenidae;Tegenaria;domestica;Tegenaria domestica;;44.0002;16.016234;Tf;deep cave;44.000216.016234;4;;;;;;;;;;;;;;;;;;;;;;
1681;Stara jametina;Croatia;10.10.2010.;2010-10-10;4 juv;4;Dysderidae;Stalagtia;sp. 4;Stalagtia sp. 4;;43.794009;16.00259;Tb;deep cave;43.79400916.00259;6;;;;;;;;;;;;;;;;;;;;;;
1683;Trogrla jama;Croatia;9.10.2010.;2010-10-09;1m, 1f;2;Tetragnathidae;Meta;bourneti;Meta bourneti;;44.014335;16.065195;Tf;deep cave;44.01433516.065195;3;;;;;;;;;;;;;;;;;;;;;;
1684;Stara jametina;Croatia;10.10.2010.;2010-10-10;2m, 6f, 1 juv;9;Linyphiidae;Micrargus;herbigradus;Micrargus herbigradus;;43.794009;16.00259;Tf;deep cave;43.79400916.00259;6;;;;;;;;;;;;;;;;;;;;;;
1685;Stara jametina;Croatia;10.10.2010.;2010-10-10;2m, 2f;4;Linyphiidae;Micrargus;herbigradus;Micrargus herbigradus;;43.794009;16.00259;Tf;deep cave;43.79400916.00259;6;;;;;;;;;;;;;;;;;;;;;;
1686;Stara jametina;Croatia;10.10.2010.;2010-10-10;1f;1;Linyphiidae;Micrargus;herbigradus;Micrargus herbigradus;;43.794009;16.00259;Tf;deep cave;43.79400916.00259;6;;;;;;;;;;;;;;;;;;;;;;
1687;Stara jametina;Croatia;10.10.2010.;2010-10-10;1f;1;Linyphiidae;Micrargus;herbigradus;Micrargus herbigradus;;43.794009;16.00259;Tf;deep cave;43.79400916.00259;6;;;;;;;;;;;;;;;;;;;;;;
1688;Stara jametina;Croatia;10.10.2010.;2010-10-10;1f;1;Linyphiidae;Micrargus;herbigradus;Micrargus herbigradus;;43.794009;16.00259;Tf;deep cave;43.79400916.00259;6;;;;;;;;;;;;;;;;;;;;;;
1689;Stara jametina;Croatia;10.10.2010.;2010-10-10;1f;1;Theridiidae;Episinus;cavernicola;Episinus cavernicola;;43.794009;16.00259;Tf;deep cave;43.79400916.00259;6;;;;;;;;;;;;;;;;;;;;;;
1694;Pavši?a pe?a;Croatia;30.7.2007.;2007-07-30;1m;1;Tetragnathidae;Meta;bourneti;Meta bourneti;;43.786027;16.665515;Tf;deep cave;43.78602716.665515;2;;;;;;;;;;;;;;;;;;;;;;
1695;Kranjica pe?ina;Croatia;13.10.2007.;2007-10-13;1f;1;Agelenidae;Tegenaria;bosnica;Tegenaria bosnica;820;43.959462;16.475197;;deep cave;43.95946216.475197;2;;;;;;;;;;;;;;;;;;;;;;
1697;Bundalova pe?ina;Croatia;11.7.2009.;2009-07-11;1 juv;1;Agelenidae;Histopona;sp.;Histopona sp.;230;44.195721;15.855588;;deep cave;44.19572115.855588;4;;;;;;;;;;;;;;;;;;;;;;
1698;Bojina jama;Croatia;5.8.2010.;2010-08-05;1f;1;Dysderidae;Parastalita;stygia;Parastalita stygia;1075;44.349429;15.412027;Tb;deep cave;44.34942915.412027;1;;;;;;;;;;;;;;;;;;;;;;
1699;Frkina jama;Croatia;20.11.2010.;2010-11-20;1f, 1 juv ;2;Tetragnathidae;Metellina;merianae;Metellina merianae;;44.21424;15.998543;Tf;deep cave;44.2142415.998543;1;;;;;;;;;;;;;;;;;;;;;;
1700;Budin pupak;Croatia;6.8.2009.;2009-08-06;1f;1;Linyphiidae;Gen. 10;sp. 1;Gen. 10 sp. 1;;44.739729;15.089755;;;44.73972915.089755;2;;;;;;;;;;;;;;;;;;;;;;
1701;Šipun;Croatia;27.3.2003.;2003-03-27;1 juv;1;Dysderidae;Stalagtia;sp. 1;Stalagtia sp. 1;;42.583646;18.217986;Tb;deep cave;42.58364618.217986;11;16;;;;;;;;;;;;;;;;;;;;;
1703;Šipun;Croatia;27.3.2003.;2003-03-27;2 juv;2;Dysderidae;Stalagtia;sp. 1;Stalagtia sp. 1;;42.583646;18.217986;Tb;deep cave;42.58364618.217986;11;16;;;;;;;;;;;;;;;;;;;;;
1704;Šipun;Croatia;19.8.2005.;2005-08-19;1 juv;1;Dysderidae;Stalagtia;sp. 1;Stalagtia sp. 1;;42.583646;18.217986;Tb;deep cave;42.58364618.217986;11;16;;;;;;;;;;;;;;;;;;;;;
1705;Šipun;Croatia;27.3.2003.;2003-03-27;1 juv;1;Dysderidae;Stalagtia;sp. 1;Stalagtia sp. 1;;42.583646;18.217986;Tb;deep cave;42.58364618.217986;11;16;;;;;;;;;;;;;;;;;;;;;
1706;Šipun;Croatia;27.6.2003.;2003-06-27;1 juv;1;Dysderidae;Stalagtia;sp. 1;Stalagtia sp. 1;;42.583646;18.217986;Tb;deep cave;42.58364618.217986;11;16;;;;;;;;;;;;;;;;;;;;;
1707;Šipun;Croatia;19.8.2005.;2005-08-19;1m, 1f;2;Dysderidae;Stalagtia;sp. 1;Stalagtia sp. 1;;42.583646;18.217986;Tb;deep cave;42.58364618.217986;11;16;;;;;;;;;;;;;;;;;;;;;
1709;Šipun;Croatia;29.6.2000.;2000-06-29;6 juv;6;Dysderidae;Stalagtia;sp. 1;Stalagtia sp. 1;;42.583646;18.217986;Tb;deep cave;42.58364618.217986;11;16;;;;;;;;;;;;;;;;;;;;;
1710;Tu?epska vilenja?a;Croatia;17.6.2002.;2002-06-17;1 juv;1;Dysderidae;Stalagtia;sp. 4;Stalagtia sp. 4;1181;43.286465;17.083638;Tb;deep cave;43.28646517.083638;8;;;;;;;;;;;;;;;;;;;;;;
1711;Mo?iljska špilja;Croatia;1.11.2003.;2003-11-01;1 juv;1;Dysderidae;Stalagtia;sp. 5;Stalagtia sp. 5;;42.689061;18.071906;Tb;deep cave;42.68906118.071906;6;;15,4;15,825;;;;;;;;;;;;;;;;;;;
1712;Tu?epska vilenja?a;Croatia;9.4.1999.;1999-04-09;1m;1;Dysderidae;Stalagtia;sp. 4;Stalagtia sp. 4;1181;43.286465;17.083638;Tb;deep cave;43.28646517.083638;8;;;;;;;;;;;;;;;;;;;;;;
1713;Šipun;Croatia;11.2.2005.;2005-02-11;2 juv;2;Dysderidae;Stalagtia;sp. 1;Stalagtia sp. 1;;42.583646;18.217986;Tb;deep cave;42.58364618.217986;11;16;;;;;;;;;;;;;;;;;;;;;
1716;Jama Vrap?anka;Croatia;8.2.2004.;2004-02-08;1m;1;Familia x;Gen.;sp.;Gen. sp.;397;45.848567;15.892337;;;45.84856715.892337;3;;;;;;;;;;;;;;;;;;;;;;
1719;?urovi?a jama;Croatia;27.5.2004.;2004-05-27;1 juv;1;Leptonetidae;Gen.;sp.;Gen. sp.;;42.559979;18.263559;;;42.55997918.263559;4;;;;;;;;;;;;;;;;;;;;;;
1720;Miljacka 2;Croatia;6.1.2005.;2005-01-06;1m;1;Tetragnathidae;Metellina;merianae;Metellina merianae;;44.0002;16.016234;Tf;deep cave;44.000216.016234;4;;;;;;;;;;;;;;;;;;;;;;
1725;Rudnik Zrinski;Croatia;8.10.2008.;2008-10-08;1 juv;1;Agelenidae;Tegenaria;sp.;Tegenaria sp.;804;45.887195;15.927871;;deep cave;45.88719515.927871;9;;;;;;;;;;;;;;;;;;;;;;
1726;Mo?iljska špilja;Croatia;28.4.2010.;2010-04-28;1 juv;1;Dysderidae;Stalagtia;sp. 5;Stalagtia sp. 5;;42.689061;18.071906;Tb;deep cave;42.68906118.071906;6;;15,4;15,825;;;;;;;;;;;;;;;;;;;
1728;Rudina;Croatia;9.9.2004.;2004-09-09;1 juv;1;Dysderidae;Stalagtia;sp.;Stalagtia sp.;;42.721999;18.015321;;;42.72199918.015321;3;9,9;;;;;;;;;;;;;;;;;;;;;
1730;Špilja u uvali Predpe?;Croatia;23.1.2011.;2011-01-23;1m;1;Nesticidae;Kryptonesticus;eremita;Kryptonesticus eremita;7;45.291576;14.510419;tf;deep cave;45.29157614.510419;4;;;;;;;;;;;;;;;;;;;;;;
1731;Zagorska pe? kod Ogulina;Croatia;7.9.2009.;2009-09-07;2m, 1f, 3 juv;6;Dysderidae;Parastalita;stygia;Parastalita stygia;335;45.196851;15.219904;Tb;deep cave;45.19685115.219904;3;;;;;;;;;;;;;;;;;;;;;;
1732;Zagorska pe? kod Ogulina;Croatia;7.9.2009.;2009-09-07;1juv;1;Dysderidae;Stalita;pretneri;Stalita pretneri;335;45.196851;15.219904;Tb;deep cave;45.19685115.219904;3;;;;;;;;;;;;;;;;;;;;;;
1733;Pišurka;Croatia;1.10.2007.;2007-10-01;3f, 3 juv;6;Nesticidae;Kryptonesticus;eremita;Kryptonesticus eremita;39;42.959451;17.129228;tf;deep cave;42.95945117.129228;5;;;;;;;;;;;;;;;;;;;;;;
1734;Pišurka;Croatia;1.10.2007.;2007-10-01;1f, 2 juv;3;Dysderidae;Folkia;haasi;Folkia haasi;;42.959451;17.129228;Tb;deep cave;42.95945117.129228;5;;;;;;;;;;;;;;;;;;;;;;
1735;Velebita- Dva javora;Croatia;12.-13.8.2007.;2007-08-12/2007-08-12;1m;1;Dysderidae;Gen. 1;sp. 1;Gen. 1 sp. 1;1560;44.757596;14.98636;Tb;deep cave;44.75759614.98636;2;;;;;;;;;;;;;;;;;;;;;;
1736;Slova?ka jama;Croatia;3.8.2002.;2002-08-03;1f;1;Dysderidae;Stalita;pretneri;Stalita pretneri;;44.748943;15.003173;Tb;deep cave;44.74894315.003173;1;;;;;;;;;;;;;;;;;;;;;;
1737;Gornja Cerova?ka špilja;Croatia;16.8.2006.;2006-08-16;1f;1;Dysderidae;Parastalita;stygia;Parastalita stygia;700;44.273382;15.884227;Tb;deep cave;44.27338215.884227;2;;;;;;;;;;;;;;;;;;;;;;
1738;Gornja Cerova?ka špilja;Croatia;6.6.2006.;2006-06-06;1 juv;1;Dysderidae;Parastalita;stygia;Parastalita stygia;700;44.273382;15.884227;Tb;deep cave;44.27338215.884227;2;;;;;;;;;;;;;;;;;;;;;;
1739;Gornja Cerova?ka špilja;Croatia;4.8.1998.;1998-08-04;1f;1;Dysderidae;Parastalita;stygia;Parastalita stygia;700;44.273382;15.884227;Tb;deep cave;44.27338215.884227;2;;;;;;;;;;;;;;;;;;;;;;
1740;Gornja Cerova?ka špilja;Croatia;6.6.2006.;2006-06-06;ostaci;;Dysderidae;Parastalita;stygia;Parastalita stygia;700;44.273382;15.884227;Tb;deep cave;44.27338215.884227;2;;;;;;;;;;;;;;;;;;;;;;
1741;Manita pe?;Croatia;7.6.2006.;2006-06-07;1m, 1f, 1 juv;3;Dysderidae;Parastalita;stygia;Parastalita stygia;520;44.314302;15.475264;Tb;deep cave;44.31430215.475264;7;;;;;;;;;;;;;;;;;;;;;;
1742;Manita pe?;Croatia;7.6.2006.;2006-06-07;2 juv;2;Dysderidae;Parastalita;stygia;Parastalita stygia;520;44.314302;15.475264;Tb;deep cave;44.31430215.475264;7;;;;;;;;;;;;;;;;;;;;;;
1743;?ude špilja;Croatia;4.8.2006.;2006-08-04;1m;1;Dysderidae;Parastalita;stygia;Parastalita stygia;70;44.212351;15.741592;Tb;deep cave;44.21235115.741592;2;;;;;;;;;;;;;;;;;;;;;;
1745;Babi?a Snježnja?a;Croatia;9.6.1984.;1984-06-09;1 f;1;Dysderidae;Parastalita;stygia;Parastalita stygia;;44.209779;16.103991;Tb;deep cave;44.20977916.103991;2;;;;;;;;;;;;;;;;;;;;;;
1746;Lasi?a špilja;Croatia;22.6.2009.;2009-06-22;1 juv m;1;Dysderidae;Stalita;pretneri;Stalita pretneri;;44.89408;15.09091;Tb;deep cave;44.8940815.09091;2;;;;;;;;;;;;;;;;;;;;;;
1747;Izvor špilja Studenac;Croatia;1.8.2010.;2010-08-01;1f;1;Dysderidae;Parastalita;stygia;Parastalita stygia;;45.134692;15.542765;Tb;deep cave;45.13469215.542765;1;;;;;;;;;;;;;;;;;;;;;;
1748;Bukovac;Croatia;20.2.1999.;1999-02-20;2 juv;2;Dysderidae;Stalita;pretneri;Stalita pretneri;881;45.34318;14.757647;Tb;deep cave;45.3431814.757647;5;;;;;;;;;;;;;;;;;;;;;;
1749;Špilja kod Stare Sušice;Croatia;25.7.2009.;2009-07-25;1m, 1f;2;Dysderidae;Parastalita;stygia;Parastalita stygia;725;45.387689;14.994379;Tb;deep cave;45.38768914.994379;11;7,4;;;;;;;;;;;;;;;;;;;;;
1750;Špilja pod Ma?kovom dragom;Croatia;10.7.2010.;2010-07-10;1m;1;Dysderidae;Parastalita;stygia;Parastalita stygia;620;45.261001;15.023822;Tb;deep cave;45.26100115.023822;1;7,4;;;;;;;;;;;;;;;;;;;;;
1752;Špilja za Groma?kom vlakom;Croatia;27.4.2010.;2010-04-27;1m, 2f, 1 juv;4;Dysderidae;Stalagtia;hercegovinensis;Stalagtia hercegovinensis;605;42.743509;18.027359;Tb;deep cave;42.74350918.027359;15;;;13,63043478;;;;;;;;;;;;;;;;;;;
1773;Kaverna pod vijaduktom kod Puljana;Croatia;23.6.2010.;2010-06-23;1m;1;Nesticidae;Kryptonesticus;eremita;Kryptonesticus eremita;;43.109322;17.475929;tf;deep cave;43.10932217.475929;1;;;;;;;;;;;;;;;;;;;;;;
1774;Jasena ponor;Croatia;4.8.2010.;2010-08-04;1 juv;1;Dysderidae;Stalagtia;sp. 4;Stalagtia sp. 4;;43.221246;17.2767;Tb;deep cave;43.22124617.2767;2;;;;;;;;;;;;;;;;;;;;;;
1775;Jamica u Docima;Croatia;30.4.2010.;2010-04-30;2 juv;2;Dysderidae;Stalagtia;sp. 4;Stalagtia sp. 4;310;43.066324;17.560915;Tb;deep cave;43.06632417.560915;1;;;;;;;;;;;;;;;;;;;;;;
1776;Mo?iljska špilja;Croatia;28.4.2010.;2010-04-28;1m;1;Dysderidae;Stalagtia;sp. 5;Stalagtia sp. 5;;42.689061;18.071906;Tb;deep cave;42.68906118.071906;6;;15,4;15,825;;;;;;;;;;;;;;;;;;;
1777;Vilina špilja-Izvor Omble;Croatia;29.4.2010.;2010-04-29;1f;1;Dysderidae;Stalagtia;sp. 2;Stalagtia sp. 2;137;42.67716;18.136236;Tb;deep cave;42.6771618.136236;5;;;14,2;;;;;;;;;;;;;;;;;;;
1778;Vilina špilja-Izvor Omble;Croatia;29.4.2010.;2010-04-29;1f, 1juv, 1juvm;3;Dysderidae;Stalagtia;sp. 2;Stalagtia sp. 2;137;42.67716;18.136236;Tb;deep cave;42.6771618.136236;5;;;14,2;;;;;;;;;;;;;;;;;;;
1779;Špilja za Groma?kom vlakom;Croatia;27.4.2010.;2010-04-27;1 juv;1;Dysderidae;Stalagtia;hercegovinensis;Stalagtia hercegovinensis;605;42.743509;18.027359;Tb;deep cave;42.74350918.027359;15;;;13,63043478;;;;;;;;;;;;;;;;;;;
1780;Maica Golubinka;Croatia;21.6.2010.;2010-06-21;1m;1;Dysderidae;Stalagtia;sp. 4;Stalagtia sp. 4;;43.108853;17.566424;Tb;deep cave;43.10885317.566424;6;;;;;;;;;;;;;;;;;;;;;;
1781;Špilja za Groma?kom vlakom;Croatia;27.4.2010.;2010-04-27;1m;1;Dysderidae;Stalagtia;hercegovinensis;Stalagtia hercegovinensis;605;42.743509;18.027359;Tb;deep cave;42.74350918.027359;15;;;13,63043478;;;;;;;;;;;;;;;;;;;
1782;?ampari;Croatia;29.11.2008.;2008-11-29;1f;1;Nesticidae;Kryptonesticus;eremita;Kryptonesticus eremita;312;45.123809;14.333655;tf;deep cave;45.12380914.333655;4;;;;;;;;;;;;;;;;;;;;;;
1784;Per?evi?a špilja;Croatia;29.1.2008.;2008-01-29;1f;1;Nesticidae;Nesticus;cellulanus;Nesticus cellulanus;207;45.242617;15.336296;tf;deep cave;45.24261715.336296;3;;;;;;;;;;;;;;;;;;;;;;
1786;Samograd;Croatia;30.9.2007.;2007-09-30;1 juv;1;Dysderidae;Folkia;haasi;Folkia haasi;;42.970451;16.995978;Tb;deep cave;42.97045116.995978;4;;;;;;;;;;;;;;;;;;;;;;
1787;Samograd;Croatia;30.9.2007.;2007-09-30;1 juv;1;Dysderidae;Folkia;haasi;Folkia haasi;;42.970451;16.995978;Tb;deep cave;42.97045116.995978;4;;;;;;;;;;;;;;;;;;;;;;
1788;Jama pod Vošcem;Croatia;15.7.2008.;2008-07-15;1 juv;1;Dysderidae;Harpactea;sp.;Harpactea sp.;1300;43.309566;17.046435;;;43.30956617.046435;1;;;;;;;;;;;;;;;;;;;;;;
1789;Medvje?a špilja;Croatia;25.5.2008.;2008-05-25;1m, 1f;2;Dysderidae;Parastalita;stygia;Parastalita stygia;809;45.363572;14.757905;Tb;deep cave;45.36357214.757905;3;;;;;;;;;;;;;;;;;;;;;;
1790;Pustinja;Croatia;7.6.2008.;2008-06-07;1 juv;1;Dysderidae;Parastalita;stygia;Parastalita stygia;775;45.372172;14.808873;Tb;deep cave;45.37217214.808873;3;;;;;;;;;;;;;;;;;;;;;;
1791;Samograd;Croatia;30.9.2007.;2007-09-30;1 juv;1;Dysderidae;Folkia;haasi;Folkia haasi;;42.970451;16.995978;Tb;deep cave;42.97045116.995978;4;;;;;;;;;;;;;;;;;;;;;;
1794;Francuski rudnik 1;Croatia;19.11.2004.;2004-11-19;1m;1;Agelenidae;Tegenaria;silvestris;Tegenaria silvestris;;45.91305;15.940454;Tf;deep cave;45.9130515.940454;3;;;;;;;;;;;;;;;;;;;;;;
1795;Vila;Croatia;6.11.2007.;2007-11-06;1m;1;Agelenidae;Inermocoelotes;inermis;Inermocoelotes inermis;613;46.265771;15.995721;;deep cave;46.26577115.995721;2;;;;;;;;;;;;;;;;;;;;;;
1796;outside in Zlobin;Croatia;22.2.1999.;1999-02-22;1m;1;Agelenidae;Inermocoelotes;anoplus;Inermocoelotes anoplus;;45.3;14.7;;Shallow subterranean habitat;45.314.7;1;;;;;;;;;;;;;;;;;;;;;;
1797;Špilja pod Kapelu;Croatia;15.3.2011.;2011-03-15;2juv m, 2 juv;4;Agelenidae;Hadites;tegenarioides;Hadites tegenarioides;119;43.184949;16.434233;TB;deep cave;43.18494916.434233;5;;;;;;;;;;;;;;;;;;;;;;
1798;Špilja pod Kapelu;Croatia;15.3.2011.;2011-03-15;2 juv;2;Agelenidae;Tegenaria;sp.;Tegenaria sp.;119;43.184949;16.434233;;deep cave;43.18494916.434233;5;;;;;;;;;;;;;;;;;;;;;;
1799;Vratolomka;Croatia;2.10.2010.;2010-10-02;1m, 7 juv;8;Agelenidae;Histopona;egonpretneri;Histopona egonpretneri;;44.191701;15.785015;Tb;deep cave;44.19170115.785015;2;;;;;;;;;;;;;;;;;;;;;;
1802;Golubnja?a, Žegar;Croatia;1.10.2010.;2010-10-01;1f, 1 juv;2;Nesticidae;Kryptonesticus;eremita;Kryptonesticus eremita;243;44.131933;15.851054;tf;deep cave;44.13193315.851054;6;;;;;;;;;;;;;;;;;;;;;;
1803;Bundalova pe?ina;Croatia;3.5.2010.;2010-05-03;1f, 1 juv;2;Agelenidae;Histopona;egonpretneri;Histopona egonpretneri;;44.195721;15.855588;Tb;deep cave;44.19572115.855588;4;;;;;;;;;;;;;;;;;;;;;;
1804;Špilja uz cestu;Croatia;1.5.2010.;2010-05-01;1m, 1f;2;Nesticidae;Kryptonesticus;eremita;Kryptonesticus eremita;;44.093064;16.082069;tf;deep cave;44.09306416.082069;1;;;;;;;;;;;;;;;;;;;;;;
1805;Bundalova pe?ina;Croatia;3.5.2010.;2010-05-03;5 juv;5;Agelenidae;Histopona;sp.;Histopona sp.;;44.195721;15.855588;;deep cave;44.19572115.855588;4;;;;;;;;;;;;;;;;;;;;;;
1806;Bundalova pe?ina;Croatia;3.5.2010.;2010-05-03;1 juv;1;Leptonetidae;Cataleptoneta;lingulata;Cataleptoneta lingulata;;44.195721;15.855588;tb;deep cave;44.19572115.855588;4;;;;;;;;;;;;;;;;;;;;;;
1807;Bundalova pe?ina;Croatia;3.5.2010.;2010-05-03;1 juv;1;Agelenidae;Histopona;sp.;Histopona sp.;;44.195721;15.855588;;deep cave;44.19572115.855588;4;;;;;;;;;;;;;;;;;;;;;;
1808;Špilja uz cestu;Croatia;1.5.2010.;2010-05-01;1f;1;Nesticidae;Kryptonesticus;eremita;Kryptonesticus eremita;;44.093064;16.082069;tf;deep cave;44.09306416.082069;1;;;;;;;;;;;;;;;;;;;;;;
1811;?avlinka;Croatia;2.5.2010.;2010-05-02;1f, 1 juv;2;Nesticidae;Kryptonesticus;eremita;Kryptonesticus eremita;30;44.212517;15.741685;tf;deep cave;44.21251715.741685;2;;;;;;;;;;;;;;;;;;;;;;
1813;Mili?a špilja;Croatia;5.5.2010.;2010-05-05;1 juv;1;Nesticidae;Kryptonesticus;eremita;Kryptonesticus eremita;240;44.143333;15.803133;tf;deep cave;44.14333315.803133;1;;;;;;;;;;;;;;;;;;;;;;
1815;Mateši?eva-Popova?a sustav;Croatia;11.4.2010.;2010-04-11;1f;1;Nesticidae;Nesticus;cellulanus;Nesticus cellulanus;266;45.108023;15.613894;tf;deep cave;45.10802315.613894;3;;;;;;;;;;;;;;;;;;;;;;
1818;Jama pod Osojem;Croatia;22.6.2003.;2003-06-22;1 juv f;1;Linyphiidae;Palliduphantes;sp.;Palliduphantes sp.;818;43.251441;17.118374;;;43.25144117.118374;3;;;;;;;;;;;;;;;;;;;;;;
1819;Markova jama kod Tara;Croatia;31.10.1998.;1998-10-31;4 juv;4;Dysderidae;Stalita;taenaria;Stalita taenaria;95;45.319298;13.631373;Tb;deep cave;45.31929813.631373;7;;;;;;;;;;;;;;;;;;;;;;
1820;Trbušnjak;Croatia;10.6.2007.;2007-06-10;1m, 2f;3;Linyphiidae;Diplocephalus;alpinus;Diplocephalus alpinus;;45.495969;17.263219;Tf;deep cave;45.49596917.263219;3;;;;;;;;;;;;;;;;;;;;;;
1821;Trbušnjak;Croatia;10.6.2007.;2007-06-10;1f;1;Linyphiidae;Diplocephalus;alpinus;Diplocephalus alpinus;;45.495969;17.263219;;;45.49596917.263219;3;;;;;;;;;;;;;;;;;;;;;;
1822;Trbušnjak;Croatia;10.6.2007.;2007-06-10;1m;1;Linyphiidae;Diplocephalus;alpinus;Diplocephalus alpinus;;45.495969;17.263219;;;45.49596917.263219;3;;;;;;;;;;;;;;;;;;;;;;
1823;Maksimova špilja;Croatia;22.4.2006.;2006-04-22;3f, 3 juv;6;Linyphiidae;Diplocephalus;cristatus;Diplocephalus cristatus;493;45.518313;17.68695;Tx;deep cave;45.51831317.68695;3;;;;;;;;;;;;;;;;;;;;;;
1825;Jelenova špilja;Croatia;21.4.2006.;2006-04-21;1f;1;Linyphiidae;Centromerus;sellarius;Centromerus sellarius;565;45.517695;17.668982;tf;deep cave;45.51769517.668982;2;;;;;;;;;;;;;;;;;;;;;;
1830;Uviraljka;Croatia;6.11.2004.;2004-11-06;1m, 4juv;5;Linyphiidae;Porrhomma;convexum;Porrhomma convexum;810;45.522243;17.62067;;deep cave;45.52224317.62067;3;;;;;;;;;;;;;;;;;;;;;;
1831;Antina špilja;Croatia;17.7.2004.;2004-07-17;1m;1;Agelenidae;Histopona;luxurians;Histopona luxurians;;45.497475;17.856553;tf;deep cave;45.49747517.856553;2;;;;;;;;;;;;;;;;;;;;;;
1832;Suhodolka;Croatia;5.6.2007.;2007-06-05;2f, 3 juv;5;Linyphiidae;Porrhomma;egeria;Porrhomma egeria;658;45.504451;17.698877;Tf;deep cave;45.50445117.698877;1;;8,55;8,62;;;;;;;;;;;;;;;;;;;
1833;Uviraljka;Croatia;6.11.2004.;2004-11-06;2f, 4 juv;6;Linyphiidae;Porrhomma;egeria;Porrhomma egeria;810;45.522243;17.62067;Tf;deep cave;45.52224317.62067;3;;;;;;;;;;;;;;;;;;;;;;
1835;Radetina velika špilja;Croatia;21.4.2006.;2006-04-21;3f, 1 juv;4;Linyphiidae;Porrhomma;egeria;Porrhomma egeria;612;45.500939;17.734302;Tf;deep cave;45.50093917.734302;1;;;;;;;;;;;;;;;;;;;;;;
1836;Maksimova špilja;Croatia;8.6.2007.;2007-06-08;1f;1;Linyphiidae;Porrhomma;egeria;Porrhomma egeria;493;45.518313;17.68695;Tf;deep cave;45.51831317.68695;3;;;;;;;;;;;;;;;;;;;;;;
1837;Uviraljka;Croatia;23.4.2006.;2006-04-23;2f, 3 juv;5;Linyphiidae;Porrhomma;egeria;Porrhomma egeria;810;45.522243;17.62067;Tf;deep cave;45.52224317.62067;3;;;;;;;;;;;;;;;;;;;;;;
1838;Uviraljka;Croatia;6.11.2004.;2004-11-06;1f;1;Linyphiidae;Porrhomma;egeria;Porrhomma egeria;810;45.522243;17.62067;Tf;deep cave;45.52224317.62067;3;;;;;;;;;;;;;;;;;;;;;;
1839;Jelenova špilja;Croatia;21.4.2006.;2006-04-21;1f;1;Linyphiidae;Porrhomma;microps;Porrhomma microps;565;45.517695;17.668982;Tf;deep cave;45.51769517.668982;2;;;;;;;;;;;;;;;;;;;;;;
1840;Suhodolka;Croatia;5.6.2007.;2007-06-05;1f, 1m, 1juv;3;Linyphiidae;Porrhomma;egeria;Porrhomma egeria;658;45.504451;17.698877;Tf;deep cave;45.50445117.698877;1;;8,55;8,62;;;;;;;;;;;;;;;;;;;
1841;Uviraljka;Croatia;19.7.2004.;2004-07-19;2f;2;Linyphiidae;Porrhomma;convexum;Porrhomma convexum;810;45.522243;17.62067;Tf;deep cave;45.52224317.62067;3;;;;;;;;;;;;;;;;;;;;;;
1842;Uviraljka;Croatia;19.7.2004.;2004-07-19;2f, 8 juv;1;Linyphiidae;Porrhomma;egeria;Porrhomma egeria;810;45.522243;17.62067;Tf;deep cave;45.52224317.62067;3;;;;;;;;;;;;;;;;;;;;;;
1843;Suhodolka;Croatia;5.6.2007.;2007-06-05;2m, 2 juv;4;Linyphiidae;Porrhomma;egeria;Porrhomma egeria;658;45.504451;17.698877;Tf;deep cave;45.50445117.698877;1;;8,55;8,62;;;;;;;;;;;;;;;;;;;
1844;Uviraljka;Croatia;20.4.2006.;2006-04-20;1m;1;Linyphiidae;Porrhomma;egeria;Porrhomma egeria;810;45.522243;17.62067;Tf;deep cave;45.52224317.62067;3;;;;;;;;;;;;;;;;;;;;;;
1845;Uviraljka;Croatia;20.4.2006.;2006-04-20;1f, 2m;3;Linyphiidae;Porrhomma;convexum;Porrhomma convexum;810;45.522243;17.62067;Tf;deep cave;45.52224317.62067;3;;;;;;;;;;;;;;;;;;;;;;
1846;Kova?ica jama;Croatia;2.10.2006.;2006-10-02;1m;1;Linyphiidae;Porrhomma;convexum;Porrhomma convexum;;45.519178;17.65444;Tf;deep cave;45.51917817.65444;4;9,3;;;;;;;;;;;;;;;;;;;;;
1847;Uviraljka;Croatia;20.4.2006.;2006-04-20;1f;1;Linyphiidae;Porrhomma;egeria;Porrhomma egeria;810;45.522243;17.62067;Tf;deep cave;45.52224317.62067;3;;;;;;;;;;;;;;;;;;;;;;
1848;Trbušnjak;Croatia;10.6.2007.;2007-06-10;1f, 1 juv;2;Linyphiidae;Porrhomma;convexum;Porrhomma convexum;;45.495969;17.263219;Tf;deep cave;45.49596917.263219;3;;;;;;;;;;;;;;;;;;;;;;
1849;Trbušnjak;Croatia;10.6.2007.;2007-06-10;1f, 1m;2;Linyphiidae;Porrhomma;convexum;Porrhomma convexum;;45.495969;17.263219;Tf;deep cave;45.49596917.263219;3;;;;;;;;;;;;;;;;;;;;;;
1850;Trbušnjak;Croatia;10.6.2007.;2007-06-10;1f;1;Linyphiidae;Porrhomma;convexum;Porrhomma convexum;;45.495969;17.263219;Tf;deep cave;45.49596917.263219;3;;;;;;;;;;;;;;;;;;;;;;
1851;Trbušnjak;Croatia;10.6.2007.;2007-06-10;3m;3;Linyphiidae;Porrhomma;convexum;Porrhomma convexum;;45.495969;17.263219;Tf;deep cave;45.49596917.263219;3;;;;;;;;;;;;;;;;;;;;;;
1852;Špilja u kamenolomu Tounj;Croatia;2.4.2011.;2011-04-02;2f, 1 juv;3;Linyphiidae;Troglohyphantes;croaticus;Troglohyphantes croaticus;263;45.245525;15.318946;Tb;deep cave;45.24552515.318946;3;;;;;;;;;;;;;;;;;;;;;;
1853;Špilja u kamenolomu Tounj;Croatia;2.4.2011.;2011-04-02;1f, 1 juv m;2;Linyphiidae;Porrhomma;egeria;Porrhomma egeria;263;45.245525;15.318946;Tf;deep cave;45.24552515.318946;3;;;;;;;;;;;;;;;;;;;;;;
1856;Zmajeva špilja;Croatia;12.3.2011.;2011-03-12;1m;1;Linyphiidae;Gen. 6;sp. 1;Gen. 6 sp. 1;;43.269174;16.598972;;;43.26917416.598972;4;;;;;;;;;;;;;;;;;;;;;;
1857;Jama za Mahrincem;Croatia;12.3.2011.;2011-03-12;1m;1;Nesticidae;Kryptonesticus;eremita;Kryptonesticus eremita;54;43.344348;16.74088;tf;deep cave;43.34434816.74088;2;;;;;;;;;;;;;;;;;;;;;;
1858;Jama kod Mateši?a stana;Croatia;14.3.2011.;2011-03-14;1f;1;Nesticidae;Kryptonesticus;eremita;Kryptonesticus eremita;;43.305943;16.75112;tf;deep cave;43.30594316.75112;2;;;;;;;;;;;;;;;;;;;;;;
1859;Bazgova?a;Croatia;13.3.2011.;2011-03-13;1m;1;Tetragnathidae;Metellina;merianae;Metellina merianae;;43.30647;16.622143;Tf;deep cave;43.3064716.622143;3;;5;6,675;;;;;;;;;;;;;;;;;;;
1860;Jama za Mahrincem;Croatia;12.3.2011.;2011-03-12;1f;1;Agelenidae;Tegenaria;bosnica;Tegenaria bosnica;54;43.344348;16.74088;;deep cave;43.34434816.74088;2;;;;;;;;;;;;;;;;;;;;;;
1861;Rudnik Minjera;Croatia;13.3.2011.;2011-03-13;1f;1;Nesticidae;Kryptonesticus;eremita;Kryptonesticus eremita;;43.361342;16.60633;tf;deep cave;43.36134216.60633;2;;;;;;;;;;;;;;;;;;;;;;
1863;Rudnik Minjera;Croatia;13.3.2011.;2011-03-13;1f;1;Nesticidae;Kryptonesticus;eremita;Kryptonesticus eremita;;43.361342;16.60633;tf;deep cave;43.36134216.60633;2;;;;;;;;;;;;;;;;;;;;;;
1866;Ješkalovica;Croatia;12.3.2011.;2011-03-12;1m;1;Nesticidae;Kryptonesticus;eremita;Kryptonesticus eremita;155;43.299857;16.839313;tf;deep cave;43.29985716.839313;2;;;;;;;;;;;;;;;;;;;;;;
1867;Bazgova?a;Croatia;13.3.2011.;2011-03-13;1m;1;Linyphiidae;Palliduphantes;spelaeorum;Palliduphantes spelaeorum;;43.30647;16.622143;Tf;deep cave;43.3064716.622143;3;;5;6,675;;;;;;;;;;;;;;;;;;;
1868;Bazgova?a;Croatia;13.3.2011.;2011-03-13;1m;1;Linyphiidae;Palliduphantes;spelaeorum;Palliduphantes spelaeorum;;43.30647;16.622143;Tf;deep cave;43.3064716.622143;3;;5;6,675;;;;;;;;;;;;;;;;;;;
1869;Jama kod Mateši?a stana;Croatia;14.3.2011.;2011-03-14;1m, 5 f;6;Linyphiidae;Palliduphantes;spelaeorum;Palliduphantes spelaeorum;;43.305943;16.75112;Tf;deep cave;43.30594316.75112;2;;;;;;;;;;;;;;;;;;;;;;
1870;Bazgova?a;Croatia;13.3.2011.;2011-03-13;1m;1;Linyphiidae;Palliduphantes;spelaeorum;Palliduphantes spelaeorum;;43.30647;16.622143;Tf;deep cave;43.3064716.622143;3;;5;6,675;;;;;;;;;;;;;;;;;;;
1871;Jama kod Mateši?a stana;Croatia;13.3.2011.;2011-03-13;1f;1;Linyphiidae;Palliduphantes;spelaeorum;Palliduphantes spelaeorum;;43.305943;16.75112;Tf;deep cave;43.30594316.75112;2;;;;;;;;;;;;;;;;;;;;;;
1874;Markova špilja, Hvar;Croatia;15.3.2011.;2011-03-15;1 juv m;1;Nesticidae;Kryptonesticus;eremita;Kryptonesticus eremita;58;43.190585;16.402907;tf;deep cave;43.19058516.402907;8;;;;;;;;;;;;;;;;;;;;;;
1875;Markova špilja, Hvar;Croatia;15.3.2011.;2011-03-15;1f;1;Linyphiidae;Centromerus;raridentatus sp.n.;Centromerus raridentatus sp.n.;;43.190585;16.402907;;;43.19058516.402907;8;;;;;;;;;;;;;;;;;;;;;;
1876;Škabac;Croatia;17.4.2011.;2011-04-17;1m, 1 juv;2;Theridiidae;Episinus;cavernicola;Episinus cavernicola;;45.259902;14.606487;Tf;deep cave;45.25990214.606487;10;;;;;;;;;;;;;;;;;;;;;;
1877;Škabac;Croatia;17.4.2011.;2011-04-17;1f, 96%;1;Tetragnathidae;Metellina;merianae;Metellina merianae;;45.259902;14.606487;Tf;deep cave;45.25990214.606487;10;;;;;;;;;;;;;;;;;;;;;;
1879;?epi? tunel;Croatia;16.4.2011.;2011-04-16;1f;1;Agelenidae;Tegenaria;silvestris;Tegenaria silvestris;;45.1639;14.161311;Tf;deep cave;45.163914.161311;1;;;;;;;;;;;;;;;;;;;;;;
1881;Vela špilja u Krugu;Croatia;17.4.2011.;2011-04-17;2f;2;Agelenidae;Tegenaria;silvestris;Tegenaria silvestris;629;45.447191;14.423879;Tf;deep cave;45.44719114.423879;2;;;;;;;;;;;;;;;;;;;;;;
1882;Vela špilja u Krugu;Croatia;17.4.2011.;2011-04-17;1m;1;Dysderidae;Parastalita;stygia;Parastalita stygia;629;45.447191;14.423879;Tb;deep cave;45.44719114.423879;2;;;;;;;;;;;;;;;;;;;;;;
1883;Škabac;Croatia;17.4.2011.;2011-04-17;1m, 1f;2;Nesticidae;Kryptonesticus;eremita;Kryptonesticus eremita;;45.259902;14.606487;tf;deep cave;45.25990214.606487;10;;;;;;;;;;;;;;;;;;;;;;
1885;Škabac;Croatia;17.4.2011.;2011-04-17;2 juv;2;Agelenidae;Histopona;egonpretneri;Histopona egonpretneri;;45.259902;14.606487;Tb;deep cave;45.25990214.606487;10;;;;;;;;;;;;;;;;;;;;;;
1886;Škabac;Croatia;17.4.2011.;2011-04-17;1f;1;Linyphiidae;Centromerus;sellarius;Centromerus sellarius;;45.259902;14.606487;tf;cave entrance;45.25990214.606487;10;;;;;;;;;;;;;;;;;;;;;;
1887;Škabac;Croatia;17.4.2011.;2011-04-17;3 f;3;Leptonetidae;Cataleptoneta;lingulata;Cataleptoneta lingulata;;45.259902;14.606487;tb;deep cave;45.25990214.606487;10;;;;;;;;;;;;;;;;;;;;;;
1888;?avlinka;Croatia;2.5.2010.;2010-05-02;1f;1;Dysderidae;Parastalita;stygia;Parastalita stygia;30;44.212517;15.741685;Tb;deep cave;44.21251715.741685;2;;;;;;;;;;;;;;;;;;;;;;
1890;Bezdanka;Croatia;7.7.2009.;2009-07-07;2 f;2;Dysderidae;Parastalita;stygia;Parastalita stygia;565;44.227473;15.852219;Tb;deep cave;44.22747315.852219;2;;;;;;;;;;;;;;;;;;;;;;
1894;Bezdanka;Croatia;28.9.2010.;2010-09-28;2f, 1juv;3;Linyphiidae;Troglohyphantes;roberti;Troglohyphantes roberti;565;44.227473;15.852219;tb;deep cave;44.22747315.852219;2;;;;;;;;;;;;;;;;;;;;;;
1899;Velika pe?ina, Gornji ?abri?i;Croatia;4.5.2010.;2010-05-04;1 f;1;Linyphiidae;Troglohyphantes;roberti;Troglohyphantes roberti;600;44.229974;15.855897;tb;deep cave;44.22997415.855897;4;;;;;;;;;;;;;;;;;;;;;;
1900;Golubnja?a, Žegar;Croatia;1.10.2010.;2010-10-01;1 f;1;Linyphiidae;Troglohyphantes;roberti;Troglohyphantes roberti;243;44.131933;15.851054;tb;deep cave;44.13193315.851054;6;;;;;;;;;;;;;;;;;;;;;;
1901;Golubnja?a, Žegar;Croatia;1.10.2010.;2010-10-01;1 f;1;Linyphiidae;Palliduphantes;istrianus;Palliduphantes istrianus;243;44.131933;15.851054;Tf;deep cave;44.13193315.851054;6;;;;;;;;;;;;;;;;;;;;;;
1904;Golubnja?a, Žegar;Croatia;1.10.2010.;2010-10-01;1f, 1 juv;2;Linyphiidae;Troglohyphantes;roberti;Troglohyphantes roberti;243;44.131933;15.851054;tb;deep cave;44.13193315.851054;6;;;;;;;;;;;;;;;;;;;;;;
1906;?ude špilja;Croatia;2.5.2010.;2010-05-02;1f;1;Theridiidae;Episinus;cavernicola;Episinus cavernicola;;44.212351;15.741592;Tf;deep cave;44.21235115.741592;2;;;;;;;;;;;;;;;;;;;;;;
1907;Velika pe?ina, Gornji ?abri?i;Croatia;28.9.2010.;2010-09-28;1m, 1 juv;2;Linyphiidae;Troglohyphantes;roberti;Troglohyphantes roberti;600;44.229974;15.855897;tb;deep cave;44.22997415.855897;4;;;;;;;;;;;;;;;;;;;;;;
1908;Bundalova pe?ina;Croatia;3.5.2010.;2010-05-03;1f, 1 juv;2;Linyphiidae;Asthenargus;bracianus;Asthenargus bracianus;;44.195721;15.855588;tf;deep cave;44.19572115.855588;4;;;;;;;;;;;;;;;;;;;;;;
1910;Vratolomka;Croatia;2.10.2010.;2010-10-02;3m, 2 juv;5;Leptonetidae;Cataleptoneta;lingulata;Cataleptoneta lingulata;;44.191701;15.785015;tb;deep cave;44.19170115.785015;2;;;;;;;;;;;;;;;;;;;;;;
1911;Vratolomka;Croatia;2.10.2010.;2010-10-02;5m, 5f, 2 juv;12;Leptonetidae;Cataleptoneta;lingulata;Cataleptoneta lingulata;;44.191701;15.785015;tb;deep cave;44.19170115.785015;2;;;;;;;;;;;;;;;;;;;;;;
1912;Jama iznad Sarana?a;Croatia;25.5.2004.;2004-05-25;1m;1;Nemesiidae;Nemesia;sp. 1;Nemesia sp. 1;770;43.249007;17.174663;;;43.24900717.174663;7;;;;;;;;;;;;;;;;;;;;;;
1913;Stonjska pe? gornja;Croatia;27.10.2003.;2003-10-27;1 f;1;Clubionidae;Clubiona;sp.;Clubiona sp.;625;43.315167;17.1304;;;43.31516717.1304;4;;;;;;;;;;;;;;;;;;;;;;
1914;Pružina špilja;Croatia;15.10.2002.;2002-10-15;1f, 1 juv;2;Dysderidae;Stalagtia;sp. 4;Stalagtia sp. 4;519;43.394238;17.058713;Tb;deep cave;43.39423817.058713;4;;;;;;;;;;;;;;;;;;;;;;
1915;Ga?ina jama;Croatia;15.10.2002.;2002-10-15;1juv/f?;1;Dysderidae;Mesostalita;comottii;Mesostalita comottii;591;43.401743;17.058436;Tb;deep cave;43.40174317.058436;3;;;;;;;;;;;;;;;;;;;;;;
1917;Velika pe?;Croatia;18.10.2002.;2002-10-18;2 juv m, 1 juv;3;Agelenidae;Histopona;sp.;Histopona sp.;505;43.417013;17.007608;;deep cave;43.41701317.007608;3;;;;;;;;;;;;;;;;;;;;;;
1918;Velika pe?;Croatia;18.10.2002.;2002-10-18;2f, 1 juv;3;Leptonetidae;Barusia;maheni;Barusia maheni;505;43.417013;17.007608;tf;deep cave;43.41701317.007608;3;;;;;;;;;;;;;;;;;;;;;;
1919;Pružina špilja;Croatia;15.10.2002.;2002-10-15;1f;1;Agelenidae;Histopona;conveniens;Histopona conveniens;519;43.394238;17.058713;Tf;deep cave;43.39423817.058713;4;;;;;;;;;;;;;;;;;;;;;;
1920;Špilja u Gaju;Croatia;18.10.2002.;2002-10-18;1f;1;Agelenidae;Histopona;conveniens;Histopona conveniens;440;43.382476;17.040666;Tf;deep cave;43.38247617.040666;7;;;;;;;;;;;;;;;;;;;;;;
1921;Špilja u Gaju;Croatia;18.10.2002.;2002-10-18;1f;1;Tetragnathidae;Metellina;merianae;Metellina merianae;440;43.382476;17.040666;Tf;deep cave;43.38247617.040666;7;;;;;;;;;;;;;;;;;;;;;;
1922;Špilja u Gaju;Croatia;18.10.2002.;2002-10-18;1f;1;Agelenidae;Tegenaria;annulata;Tegenaria annulata;440;43.382476;17.040666;tf;deep cave;43.38247617.040666;7;;;;;;;;;;;;;;;;;;;;;;
1923;Jujnovi?a špilja;Croatia;14.10.2002.;2002-10-14;4f;4;Agelenidae;Histopona;conveniens;Histopona conveniens;405;43.266579;17.19798;Tf;deep cave;43.26657917.19798;6;;;;;;;;;;;;;;;;;;;;;;
1924;Jujnovi?a špilja;Croatia;14.10.2002.;2002-10-14;1f;1;Agelenidae;Tegenaria;sp. 2;Tegenaria sp. 2;405;43.266579;17.19798;;deep cave;43.26657917.19798;6;;;;;;;;;;;;;;;;;;;;;;
1925;Jujnovi?a špilja;Croatia;14.10.2002.;2002-10-14;1f, 1 juv m;2;Dysderidae;Harpactea;damini;Harpactea damini;405;43.266579;17.19798;TF;deep cave;43.26657917.19798;6;;;;;;;;;;;;;;;;;;;;;;
1926;Pružina špilja;Croatia;15.10.2002.;2002-10-15;2m ;2;Pholcidae;Stygopholcus;absoloni;Stygopholcus absoloni;519;43.394238;17.058713;;deep cave;43.39423817.058713;4;;;;;;;;;;;;;;;;;;;;;;
1927;Jujnovi?a špilja;Croatia;14.10.2002.;2002-10-14;3f;3;Pholcidae;Stygopholcus;absoloni;Stygopholcus absoloni;405;43.266579;17.19798;;deep cave;43.26657917.19798;6;;;;;;;;;;;;;;;;;;;;;;
1928;Velika pe?;Croatia;18.10.2002.;2002-10-18;1m, 1 juv;2;Pholcidae;Stygopholcus;absoloni;Stygopholcus absoloni;505;43.417013;17.007608;;deep cave;43.41701317.007608;3;;;;;;;;;;;;;;;;;;;;;;
1930;cave near Zagvozd;Croatia;13.10.2002.;2002-10-13;1f;1;Pholcidae;Stygopholcus;absoloni;Stygopholcus absoloni;;43.39729;17.05435;;deep cave;43.3972917.05435;1;;;;;;;;;;;;;;;;;;;;;;
1932;Drinova 2;Croatia;23.3.2003.;2003-03-23;1f, 1 juv;2;Dysderidae;Stalagtia;sp. 4;Stalagtia sp. 4;725;43.407702;16.942899;Tb;deep cave;43.40770216.942899;3;;;;;;;;;;;;;;;;;;;;;;
1933;Baba;Croatia;25.6.2002.;2002-06-25;1 juv;1;Dysderidae;Stalagtia;sp. 4;Stalagtia sp. 4;;43.256469;17.162283;Tb;deep cave;43.25646917.162283;4;;;;;;;;;;;;;;;;;;;;;;
1934;?olnja?a;Croatia;23.5.2004.;2004-05-23;1 juv m, 1 juv;2;Dysderidae;Stalagtia;sp. 4;Stalagtia sp. 4;;43.409175;16.88745;Tb;deep cave;43.40917516.88745;4;;;;;;;;;;;;;;;;;;;;;;
1935;Oplemenjena špilja;Croatia;20.6.2003.;2003-06-20;1 juv;1;Dysderidae;Harpactea;sp.;Harpactea sp.;1100;43.369119;17.025884;;;43.36911917.025884;1;;;;;;;;;;;;;;;;;;;;;;
1936;Jama iznad Sarana?a;Croatia;25.3.2003.;2003-03-25;1 f;1;Dysderidae;Stalagtia;sp. 4;Stalagtia sp. 4;770;43.249007;17.174663;Tb;deep cave;43.24900717.174663;7;;;;;;;;;;;;;;;;;;;;;;
1937;Spila 2;Croatia;23.3.2004.;2004-03-23;1f?, 1 juv;2;Dysderidae;Stalagtia;sp. 4;Stalagtia sp. 4;516;43.26239;17.204021;Tb;deep cave;43.2623917.204021;6;;;;;;;;;;;;;;;;;;;;;;
1938;Mala jama u stijenama;Croatia;20.3.2003.;2003-03-20;1 juv;1;Dysderidae;Harpactea;sp.;Harpactea sp.;1115;43.365579;17.027668;;;43.36557917.027668;3;;;;;;;;;;;;;;;;;;;;;;
1939;Mala špilja kod Antunovi?a;Croatia;26.6.2002.;2002-06-26;3 juv;3;Dysderidae;Stalagtia;sp. 4;Stalagtia sp. 4;708;43.27698;17.226992;Tb;deep cave;43.2769817.226992;1;;;;;;;;;;;;;;;;;;;;;;
1940;Velika špilja kod Antunovi?a;Croatia;23.3.2004.;2004-03-23;1 juv;1;Dysderidae;Stalagtia;sp. 4;Stalagtia sp. 4;700;43.276843;17.227143;Tb;deep cave;43.27684317.227143;1;;;;;;;;;;;;;;;;;;;;;;
1941;Jamina, Biokovo;Croatia;26.10.2006.;2006-10-26;1juvm, 1 juv;2;Dysderidae;Stalagtia;sp. 4;Stalagtia sp. 4;617;43.386358;16.925277;Tb;deep cave;43.38635816.925277;4;;;;;;;;;;;;;;;;;;;;;;
1942;Tu?epska vilenja?a;Croatia;23.5.2004.;2004-05-23;1 juvm;1;Dysderidae;Stalagtia;sp. 4;Stalagtia sp. 4;1181;43.286465;17.083638;Tb;deep cave;43.28646517.083638;8;;;;;;;;;;;;;;;;;;;;;;
1943;Jamina, Biokovo;Croatia;24.3.2004.;2004-03-24;1 juv m, 1 juv;2;Dysderidae;Stalagtia;sp. 4;Stalagtia sp. 4;617;43.386358;16.925277;Tb;deep cave;43.38635816.925277;4;;;;;;;;;;;;;;;;;;;;;;
1944;Kamenolom u Bastu;Croatia;11.10.2003.;2003-10-11;1 m;1;Dysderidae;Dysdera;sp. 2;Dysdera sp. 2;;43.361995;16.97845;;;43.36199516.97845;1;;;;;;;;;;;;;;;;;;;;;;
1946;Mala špilja pod Spilom;Croatia;5.12.2009.;2009-12-05;2 juv;2;Dysderidae;Stalagtia;sp. 4;Stalagtia sp. 4;;43.262462;17.200927;Tb;deep cave;43.26246217.200927;2;;;;;;;;;;;;;;;;;;;;;;
1948;Ogra?ena špilja pod Sv. Jurom;Croatia;21.6.2003.;2003-06-21;1juvm;1;Dysderidae;Harpactea;sp.;Harpactea sp.;;43.348504;17.051475;;;43.34850417.051475;2;;;;;;;;;;;;;;;;;;;;;;
1950;Jama na Ka?koj glavici 3;Croatia;18.6.2003.;2003-06-18;1 juv;1;Dysderidae;Harpactea;sp.;Harpactea sp.;1107;43.368677;17.032184;;;43.36867717.032184;1;;;;;;;;;;;;;;;;;;;;;;
1951;Jamina, Biokovo;Croatia;26.10.2006.;2006-10-26;2 juv;2;Dysderidae;Stalagtia;sp. 4;Stalagtia sp. 4;617;43.386358;16.925277;Tb;deep cave;43.38635816.925277;4;;;;;;;;;;;;;;;;;;;;;;
1952;Špilja u Nevistinim stinama;Croatia;22.3.2003.;2003-03-22;2 juv;2;Dysderidae;Harpactea;sp.;Harpactea sp.;545;43.38269;16.942238;;;43.3826916.942238;1;;;;;;;;;;;;;;;;;;;;;;
1954;Kukor;Croatia;26.4.2002.;2002-04-26;1m;1;Dysderidae;Harpactea;damini;Harpactea damini;425;43.355609;16.991707;TF;deep cave;43.35560916.991707;10;;;;;;;;;;;;;;;;;;;;;;
1955;Spila 2;Croatia;26.3.2003.;2003-03-26;1 juv;1;Dysderidae;Stalagtia;sp. 4;Stalagtia sp. 4;516;43.26239;17.204021;Tb;deep cave;43.2623917.204021;6;;;;;;;;;;;;;;;;;;;;;;
1956;Gradska spila;Croatia;19.11.2005.;2005-11-19;1f;1;Dysderidae;Harpactea;damini;Harpactea damini;755;43.318029;17.117623;TF;deep cave;43.31802917.117623;4;;;;;;;;;;;;;;;;;;;;;;
1957;Kukor;Croatia;17.8.2000.;2000-08-17;2/3f, 1/2juv;3;Dysderidae;Harpactea;sp. 34;Harpactea sp. 34;425;43.355609;16.991707;;;43.35560916.991707;10;;;;;;;;;;;;;;;;;;;;;;
1958;Kukor;Croatia;28.7.2006.;2006-07-28;1 juv;1;Dysderidae;Harpactea;sp.;Harpactea sp.;425;43.355609;16.991707;;;43.35560916.991707;10;;;;;;;;;;;;;;;;;;;;;;
1959;Kukor;Croatia;26.8.1998.;1998-08-26;1juvm, 2 juv;3;Dysderidae;Harpactea;sp.;Harpactea sp.;425;43.355609;16.991707;;;43.35560916.991707;10;;;;;;;;;;;;;;;;;;;;;;
1960;Drinova;Croatia;22.3.2003.;2003-03-22;1 juv;1;Dysderidae;Dysdera;sp.;Dysdera sp.;;43.357899;17.112462;Tx;epigean habitat;43.35789917.112462;1;;;;;;;;;;;;;;;;;;;;;;
1961;Velika špilja kod Antunovi?a;Croatia;29.11.2009.;2009-11-29;2 juv;2;Dysderidae;Stalagtia;sp. 4;Stalagtia sp. 4;700;43.276843;17.227143;Tb;deep cave;43.27684317.227143;1;;;;;;;;;;;;;;;;;;;;;;
1962;Jamina, Biokovo;Croatia;24.3.2004.;2004-03-24;2 juv;2;Dysderidae;Stalagtia;sp. 4;Stalagtia sp. 4;617;43.386358;16.925277;Tb;deep cave;43.38635816.925277;4;;;;;;;;;;;;;;;;;;;;;;
1963;Jama iznad Prozor?i?a;Croatia;24.3.2004.;2004-03-24;1 f;1;Dysderidae;Stalagtia;sp. 4;Stalagtia sp. 4;617;43.38381;16.932036;Tb;deep cave;43.3838116.932036;5;;;;;;;;;;;;;;;;;;;;;;
1964;Obilježena jama;Croatia;20.6.2003.;2003-06-20;1 juv;1;Dysderidae;Harpactea;sp.;Harpactea sp.;;43.36813;17.026024;;;43.3681317.026024;2;;;;;;;;;;;;;;;;;;;;;;
1965;Bubnjava?a špilja;Croatia;27.10.2006.;2006-10-27;1f;1;Dysderidae;Harpactea;damini;Harpactea damini;;43.32252;17.009954;TF;deep cave;43.3225217.009954;2;;;;;;;;;;;;;;;;;;;;;;
1966;Kukor;Croatia;23.9.1999.;1999-09-23;2 juv;2;Dysderidae;Harpactea;sp.;Harpactea sp.;425;43.355609;16.991707;;;43.35560916.991707;10;;;;;;;;;;;;;;;;;;;;;;
1967;Jama na Saran?u;Croatia;25.3.2003.;2003-03-25;1f;1;Dysderidae;Harpactea;mateparlovi;Harpactea mateparlovi;;43.247108;17.176093;Tf;deep cave;43.24710817.176093;4;;;;;;;;;;;;;;;;;;;;;;
1968;Kukor;Croatia;27.7.2004.;2004-07-27;2 juv;2;Dysderidae;Harpactea;sp.;Harpactea sp.;425;43.355609;16.991707;;;43.35560916.991707;10;;;;;;;;;;;;;;;;;;;;;;
1969;Polušpilja iza ku?e u Bastu;Croatia;18.8.1998.;1998-08-18;1 juv m;1;Dysderidae;Dysdera;sp.;Dysdera sp.;285;43.354924;16.982503;Tx;;43.35492416.982503;3;;;;;;;;;;;;;;;;;;;;;;
1971;Mala špilja kod Antunovi?a;Croatia;29.11.2009.;2009-11-29;1 juv;1;Dysderidae;Stalagtia;sp. 4;Stalagtia sp. 4;708;43.27698;17.226992;Tb;deep cave;43.2769817.226992;1;;;;;;;;;;;;;;;;;;;;;;
1972;Poskokova rupa;Croatia;25.5.2004.;2004-05-25;1 juv;1;Dysderidae;Harpactea;sp.;Harpactea sp.;633;43.318607;17.119945;;;43.31860717.119945;2;;;;;;;;;;;;;;;;;;;;;;
1973;Samogorska špilja;Croatia;25.5.2004.;2004-05-25;1f;1;Dysderidae;Harpactea;damini;Harpactea damini;717;43.318227;17.121122;TF;deep cave;43.31822717.121122;6;;;;;;;;;;;;;;;;;;;;;;
1974;Jama na putu za Staru školu;Croatia;27.6.2002.;2002-06-27;1 juv;1;Agelenidae;Histopona;sp.;Histopona sp.;1465;43.337777;17.043231;;deep cave;43.33777717.043231;1;;;;;;;;;;;;;;;;;;;;;;
1975;Meduza;Croatia;8.8.2003.;2003-08-08;1f;1;Dysderidae;Gen. 1;sp. 1;Gen. 1 sp. 1;1600;44.76237;14.987194;Tb;deep cave;44.7623714.987194;1;;;;;;;;;;;;;;;;;;;;;;
1976;Krjava 2;Croatia;24.3.2004.;2004-03-24;1 f;1;Dysderidae;Mesostalita;comottii;Mesostalita comottii;903;43.329431;17.027011;Tb;deep cave;43.32943117.027011;3;;;;;;;;;;;;;;;;;;;;;;
1979;Jamina, Biokovo;Croatia;28.10.2004.;2004-10-28;2 juv;2;Dysderidae;Stalagtia;sp. 4;Stalagtia sp. 4;617;43.386358;16.925277;Tb;deep cave;43.38635816.925277;4;;;;;;;;;;;;;;;;;;;;;;
1980;Velika špilja kod Antunovi?a;Croatia;29.11.2009.;2009-11-29;1 juv;1;Dysderidae;Stalagtia;sp. 4;Stalagtia sp. 4;700;43.276843;17.227143;Tb;deep cave;43.27684317.227143;1;;;;;;;;;;;;;;;;;;;;;;
1981;Samogorska špilja;Croatia;25.5.2005.;2005-05-25;2 juv;2;Dysderidae;Harpactea;sp.;Harpactea sp.;717;43.318227;17.121122;;;43.31822717.121122;6;;;;;;;;;;;;;;;;;;;;;;
1982;Pozjata špilja;Croatia;26.10.2003.;2003-10-26;1 f;1;Dysderidae;Harpactea;sp. 34;Harpactea sp. 34;1435;43.387837;16.963748;;;43.38783716.963748;3;;;;;;;;;;;;;;;;;;;;;;
1983;Muci?a ledenica;Croatia;24.5.2004.;2004-05-24;1 juv;1;Dysderidae;Harpactea;sp.;Harpactea sp.;1250;43.35632;17.051544;;;43.3563217.051544;3;;;;;;;;;;;;;;;;;;;;;;
1984;Mala špilja kod Antunovi?a;Croatia;5.12.2009.;2009-12-05;1 juv;1;Dysderidae;Stalagtia;sp. 4;Stalagtia sp. 4;708;43.27698;17.226992;Tb;deep cave;43.2769817.226992;1;;;;;;;;;;;;;;;;;;;;;;
1985;Jama iznad Prozor?i?a;Croatia;26.10.2006.;2006-10-26;1 juv;1;Dysderidae;Stalagtia;sp. 4;Stalagtia sp. 4;617;43.38381;16.932036;Tb;deep cave;43.3838116.932036;5;;;;;;;;;;;;;;;;;;;;;;
1986;Kukor;Croatia;25.3.2004.;2004-03-25;1 juv;1;Dysderidae;Harpactea;sp.;Harpactea sp.;425;43.355609;16.991707;;;43.35560916.991707;10;;;;;;;;;;;;;;;;;;;;;;
1987;Kukor;Croatia;29.12.1997.;1997-12-29;1 juv;1;Dysderidae;Harpactea;sp.;Harpactea sp.;425;43.355609;16.991707;;;43.35560916.991707;10;;;;;;;;;;;;;;;;;;;;;;
1989;Ogra?ena špilja pod Sv. Jurom;Croatia;21.6.2003.;2003-06-21;1 juv;1;Dysderidae;Harpactea;sp.;Harpactea sp.;;43.348504;17.051475;;;43.34850417.051475;2;;;;;;;;;;;;;;;;;;;;;;
1991;Baba;Croatia;25.6.2002.;2002-06-25;1 juv;1;Dysderidae;Harpactea;sp.;Harpactea sp.;;43.256469;17.162283;;;43.25646917.162283;4;;;;;;;;;;;;;;;;;;;;;;
1992;Drinova 2;Croatia;14.11.2003.;2003-11-14;1 juv;1;Dysderidae;Stalagtia;sp. 4;Stalagtia sp. 4;725;43.407702;16.942899;Tb;deep cave;43.40770216.942899;3;;;;;;;;;;;;;;;;;;;;;;
1993;Špilja u Gaju;Croatia;18.10.2002.;2002-10-18;5f, 1m;6;Pholcidae;Stygopholcus;absoloni;Stygopholcus absoloni;440;43.382476;17.040666;;deep cave;43.38247617.040666;7;;;;;;;;;;;;;;;;;;;;;;
1995;Jama iznad Prozor?i?a;Croatia;24.3.2004.;2004-03-24;1 m;1;Pholcidae;Stygopholcus;absoloni;Stygopholcus absoloni;617;43.38381;16.932036;;deep cave;43.3838116.932036;5;;;;;;;;;;;;;;;;;;;;;;
1996;Jama u ?ikešima;Croatia;23.11.2005.;2005-11-23;1 m;1;Pholcidae;Stygopholcus;absoloni;Stygopholcus absoloni;200;43.416092;16.967015;;deep cave;43.41609216.967015;1;;;;;;;;;;;;;;;;;;;;;;
1997;Polušpilja iza ku?e u Bastu;Croatia;18.8.1998.;1998-08-18;2 f;2;Pholcidae;Pholcus;phalangioides;Pholcus phalangioides;285;43.354924;16.982503;;cave entrance;43.35492416.982503;3;;;;;;;;;;;;;;;;;;;;;;
1998;Jama iznad Sarana?a;Croatia;25.3.2003.;2003-03-25;1 f;1;Pholcidae;Stygopholcus;absoloni;Stygopholcus absoloni;770;43.249007;17.174663;;deep cave;43.24900717.174663;7;;;;;;;;;;;;;;;;;;;;;;
1999;Jujnovi?a špilja;Croatia;27.4.2002.;2002-04-27;1m, 1 juv;2;Pholcidae;Stygopholcus;absoloni;Stygopholcus absoloni;405;43.266579;17.19798;;deep cave;43.26657917.19798;6;;;;;;;;;;;;;;;;;;;;;;
2000;Brikinjava špilja;Croatia;17.11.2005.;2005-11-17;1f, 1 juv;2;Pholcidae;Stygopholcus;absoloni;Stygopholcus absoloni;740;43.345181;17.096904;;deep cave;43.34518117.096904;3;;;;;;;;;;;;;;;;;;;;;;
2001;Jama kod Tu?epske vilenja?e;Croatia;17.6.2002.;2002-06-17;2f, 1m, 1 juv;4;Pholcidae;Stygopholcus;absoloni;Stygopholcus absoloni;1195;43.284718;17.085044;;deep cave;43.28471817.085044;1;;;;;;;;;;;;;;;;;;;;;;
2003;Nikolina špilja;Croatia;23.3.2003.;2003-03-23;2m, 1 f;3;Pholcidae;Stygopholcus;absoloni;Stygopholcus absoloni;250;43.4253;16.8271;;deep cave;43.425316.8271;1;;;;;;;;;;;;;;;;;;;;;;
2005;Raputinova špilja;Croatia;24.11.2005.;2005-11-24;1 m;1;Pholcidae;Stygopholcus;absoloni;Stygopholcus absoloni;360;43.38645;17.019868;;deep cave;43.3864517.019868;1;;;;;;;;;;;;;;;;;;;;;;
2006;Jujnovi?a špilja;Croatia;14.10.2002.;2002-10-14;1 f;1;Pholcidae;Stygopholcus;absoloni;Stygopholcus absoloni;405;43.266579;17.19798;;deep cave;43.26657917.19798;6;;;;;;;;;;;;;;;;;;;;;;
2007;Mala špilja na Bukovcima;Croatia;21.11.2005.;2005-11-21;2m, 1 f;3;Pholcidae;Stygopholcus;absoloni;Stygopholcus absoloni;463;43.403677;17.021702;;deep cave;43.40367717.021702;1;;;;;;;;;;;;;;;;;;;;;;
2009;Špilja u Radinovcima;Croatia;25.10.2006.;2006-10-25;1 f;1;Pholcidae;Stygopholcus;absoloni;Stygopholcus absoloni;400;43.387285;17.0103;;deep cave;43.38728517.0103;4;;;;;;;;;;;;;;;;;;;;;;
2012;Svetica;Croatia;16.11.2005.;2005-11-16;1 f;1;Pholcidae;Stygopholcus;absoloni;Stygopholcus absoloni;300;43.401143;16.894548;;deep cave;43.40114316.894548;5;;;;;;;;;;;;;;;;;;;;;;
2013;Bužnja?a;Croatia;29.20.2003.;2003-20-29;1m;1;Pholcidae;Gen. 1;sp. 1;Gen. 1 sp. 1;860;43.370414;16.958245;;;43.37041416.958245;2;;;;;;;;;;;;;;;;;;;;;;
2027;Špilja u Gaju;Croatia;18.10.2002.;2002-10-18;1m;1;Linyphiidae;Typhlonyphia;sp. 1;Typhlonyphia sp. 1;440;43.382476;17.040666;Tb;deep cave;43.38247617.040666;7;;;;;;;;;;;;;;;;;;;;;;
2028;Baba;Croatia;16.10.2002.;2002-10-16;1m;1;Linyphiidae;Typhlonyphia;sp. 1;Typhlonyphia sp. 1;;43.256469;17.162283;Tb;deep cave;43.25646917.162283;4;;;;;;;;;;;;;;;;;;;;;;
2029;Jujnovi?a špilja;Croatia;14.10.2002.;2002-10-14;1m, 1f;2;Linyphiidae;Typhlonyphia;sp. 1;Typhlonyphia sp. 1;405;43.266579;17.19798;Tb;deep cave;43.26657917.19798;6;;;;;;;;;;;;;;;;;;;;;;
2030;Špilja u Gaju;Croatia;18.10.2002.;2002-10-18;1f, 1 juv;2;Linyphiidae;Typhlonyphia;sp. 1;Typhlonyphia sp. 1;440;43.382476;17.040666;Tb;deep cave;43.38247617.040666;7;;;;;;;;;;;;;;;;;;;;;;
2031;Baba;Croatia;15.10.2002.;2002-10-15;3f;3;Linyphiidae;Typhlonyphia;sp. 1;Typhlonyphia sp. 1;;43.256469;17.162283;Tb;deep cave;43.25646917.162283;4;;;;;;;;;;;;;;;;;;;;;;
2032;Pružina špilja;Croatia;15.10.2002.;2002-10-15;1f;1;Linyphiidae;Typhlonyphia;sp. 1;Typhlonyphia sp. 1;519;43.394238;17.058713;Tb;deep cave;43.39423817.058713;4;;;;;;;;;;;;;;;;;;;;;;
2033;Špilja u Gaju;Croatia;18.10.2002.;2002-10-18;2f, 2 juv;4;Linyphiidae;Typhlonyphia;sp. 1;Typhlonyphia sp. 1;440;43.382476;17.040666;Tb;deep cave;43.38247617.040666;7;;;;;;;;;;;;;;;;;;;;;;
2034;Jama na grebenu;Croatia;17.10.2002.;2002-10-17;  2f, 1 juv m, 1 juv;4;Linyphiidae;Typhlonyphia;sp. 1;Typhlonyphia sp. 1;;43.25927;17.147834;Tb;deep cave;43.2592717.147834;3;;;;;;;;;;;;;;;;;;;;;;
2035;Ga?ina jama;Croatia;15.10.2002.;2002-10-15;1m;1;Linyphiidae;Typhlonyphia;sp. 1;Typhlonyphia sp. 1;;43.401743;17.058436;Tb;deep cave;43.40174317.058436;3;;;;;;;;;;;;;;;;;;;;;;
2036;Špilja na Mrždolcu;Croatia;5.4.2006.;2006-04-05;1f, 1 juv;2;Linyphiidae;Typhlonyphia;sp. 1;Typhlonyphia sp. 1;461;43.405319;17.014811;Tb;deep cave;43.40531917.014811;3;;;;;;;;;;;;;;;;;;;;;;
2037;Bošak jama;Croatia;4.4.2006.;2006-04-04;1f;1;Linyphiidae;Typhlonyphia;sp. 1;Typhlonyphia sp. 1;739;43.347996;17.100045;Tb;deep cave;43.34799617.100045;2;;;;;;;;;;;;;;;;;;;;;;
2038;Bošak jama;Croatia;4.4.2006.;2006-04-04;1 f;1;Linyphiidae;Typhlonyphia;sp. 1;Typhlonyphia sp. 1;739;43.347996;17.100045;Tb;deep cave;43.34799617.100045;2;;;;;;;;;;;;;;;;;;;;;;
2039;Bošak jama;Croatia;17.11.2005.;2005-11-17;1f;1;Linyphiidae;Typhlonyphia;sp. 1;Typhlonyphia sp. 1;739;43.347996;17.100045;Tb;deep cave;43.34799617.100045;2;;;;;;;;;;;;;;;;;;;;;;
2040;Jama za Supinom;Croatia;18.11.2005.;2005-11-18;1m;1;Linyphiidae;Typhlonyphia;sp. 1;Typhlonyphia sp. 1;;43.250417;17.113278;Tb;deep cave;43.25041717.113278;7;;;;;;;;;;;;;;;;;;;;;;
2041;Ga?ina jama;Croatia;15.10.2002.;2002-10-15;2m, 1 f;3;Linyphiidae;Palliduphantes;spelaeorum;Palliduphantes spelaeorum;;43.401743;17.058436;Tf;deep cave;43.40174317.058436;3;;;;;;;;;;;;;;;;;;;;;;
2042;Jama na grebenu;Croatia;15.10.2002.;2002-10-15;1f;1;Linyphiidae;Palliduphantes;spelaeorum;Palliduphantes spelaeorum;;43.25927;17.147834;Tf;deep cave;43.2592717.147834;3;;;;;;;;;;;;;;;;;;;;;;
2043;Jama na grebenu;Croatia;15.10.2002.;2002-10-15;1 juv;1;Dysderidae;Stalagtia;sp. 4;Stalagtia sp. 4;;43.25927;17.147834;Tb;deep cave;43.2592717.147834;3;;;;;;;;;;;;;;;;;;;;;;
2047;Svetica;Croatia;22.5.2004.;2004-05-22;1f, 1 juv;2;Linyphiidae;Palliduphantes;spelaeorum;Palliduphantes spelaeorum;300;43.401143;16.894548;Tf;deep cave;43.40114316.894548;5;;;;;;;;;;;;;;;;;;;;;;
2048;Plošnica;Croatia;22.5.2004.;2004-05-22;1f;1;Linyphiidae;Palliduphantes;spelaeorum;Palliduphantes spelaeorum;605;43.385758;16.92863;Tf;deep cave;43.38575816.92863;1;;;;;;;;;;;;;;;;;;;;;;
2049;Jama za Supinom;Croatia;18.11.2005.;2005-11-18;1m;1;Linyphiidae;Palliduphantes;spelaeorum;Palliduphantes spelaeorum;;43.250417;17.113278;Tf;deep cave;43.25041717.113278;7;;;;;;;;;;;;;;;;;;;;;;
2050;Kukor;Croatia;2.1.1999.;1999-01-02;1f, 1 juv;2;Nesticidae;Kryptonesticus;deelemanae;Kryptonesticus deelemanae;425;43.355609;16.991707;tb;deep cave;43.35560916.991707;10;;;;;;;;;;;;;;;;;;;;;;
2051;?olnja?a;Croatia;25.10.2003.;2003-10-25;1m, 1 juv;2;Linyphiidae;Palliduphantes;spelaeorum;Palliduphantes spelaeorum;;43.409175;16.88745;Tf;deep cave;43.40917516.88745;4;;;;;;;;;;;;;;;;;;;;;;
2052;Jamina, Biokovo;Croatia;26.10.2003.;2003-10-26;2f;2;Linyphiidae;Palliduphantes;spelaeorum;Palliduphantes spelaeorum;617;43.386358;16.925277;Tf;deep cave;43.38635816.925277;4;;;;;;;;;;;;;;;;;;;;;;
2053;Jamina, Biokovo;Croatia;28.10.2003.;2003-10-28;2 f;2;Linyphiidae;Palliduphantes;spelaeorum;Palliduphantes spelaeorum;617;43.386358;16.925277;Tf;deep cave;43.38635816.925277;4;;;;;;;;;;;;;;;;;;;;;;
2054;Jama iznad Prozor?i?a;Croatia;26.10.2006.;2006-10-26;2f;2;Linyphiidae;Palliduphantes;spelaeorum;Palliduphantes spelaeorum;617;43.38381;16.932036;Tf;deep cave;43.3838116.932036;5;;;;;;;;;;;;;;;;;;;;;;
2055;Jama iznad Prozor?i?a;Croatia;28.10.2003.;2003-10-28;1f, 3 juv;4;Linyphiidae;Palliduphantes;spelaeorum;Palliduphantes spelaeorum;617;43.38381;16.932036;Tf;deep cave;43.3838116.932036;5;;;;;;;;;;;;;;;;;;;;;;
2057;Potkameni?ina jama;Croatia;25.10.2006.;2006-10-25;2 f;2;Linyphiidae;Typhlonyphia;sp. 1;Typhlonyphia sp. 1;321;43.393898;17.018204;Tb;deep cave;43.39389817.018204;1;;;;;;;;;;;;;;;;;;;;;;
2059;Jamina, Biokovo;Croatia;24.3.2004.;2004-03-24;3f, 2 juv;5;Linyphiidae;Palliduphantes;spelaeorum;Palliduphantes spelaeorum;617;43.386358;16.925277;Tf;deep cave;43.38635816.925277;4;;;;;;;;;;;;;;;;;;;;;;
2060;Jama za Supinom;Croatia;18.11.2005.;2005-11-18;2m, 2 f;4;Linyphiidae;Palliduphantes;spelaeorum;Palliduphantes spelaeorum;;43.250417;17.113278;Tf;deep cave;43.25041717.113278;7;;;;;;;;;;;;;;;;;;;;;;
2061;Pozjata špilja;Croatia;26.10.2003.;2003-10-26;1f, 2 juv;3;Linyphiidae;Palliduphantes;spelaeorum;Palliduphantes spelaeorum;1435;43.387837;16.963748;Tf;deep cave;43.38783716.963748;3;;;;;;;;;;;;;;;;;;;;;;
2062;Jamina, Biokovo;Croatia;26.10.2006.;2006-10-26;2f;2;Linyphiidae;Palliduphantes;spelaeorum;Palliduphantes spelaeorum;617;43.386358;16.925277;Tf;deep cave;43.38635816.925277;4;;;;;;;;;;;;;;;;;;;;;;
2063;?uli?a jama;Croatia;26.10.2003.;2003-10-26;1m, 1 juv;2;Linyphiidae;Palliduphantes;spelaeorum;Palliduphantes spelaeorum;1029;43.395082;16.950762;Tf;deep cave;43.39508216.950762;2;;;;;;;;;;;;;;;;;;;;;;
2064;Svetica;Croatia;22.5.2004.;2004-05-22;1m;1;Linyphiidae;Palliduphantes;spelaeorum;Palliduphantes spelaeorum;300;43.401143;16.894548;Tf;deep cave;43.40114316.894548;5;;;;;;;;;;;;;;;;;;;;;;
2065;Jamina, Biokovo;Croatia;26.10.2006.;2006-10-26;1f;1;Linyphiidae;Palliduphantes;spelaeorum;Palliduphantes spelaeorum;617;43.386358;16.925277;Tf;deep cave;43.38635816.925277;4;;;;;;;;;;;;;;;;;;;;;;
2066;Jamina, Biokovo;Croatia;28.10.2006.;2006-10-28;1m, 6f, 3 prosome;1;Linyphiidae;Palliduphantes;spelaeorum;Palliduphantes spelaeorum;617;43.386358;16.925277;Tf;deep cave;43.38635816.925277;4;;;;;;;;;;;;;;;;;;;;;;
2067;Crna ledenica;Croatia;24.5.2004.;2004-05-24;1 juv m;1;Nesticidae;Kryptonesticus;deelemanae;Kryptonesticus deelemanae;;43.348162;17.055328;tb;deep cave;43.34816217.055328;2;;;;;;;;;;;;;;;;;;;;;;
2068;Jama pod Osojem;Croatia;28.10.2003.;2003-10-28;1f, 3 juv;4;Linyphiidae;Palliduphantes;spelaeorum;Palliduphantes spelaeorum;;43.251441;17.118374;Tf;deep cave;43.25144117.118374;3;;;;;;;;;;;;;;;;;;;;;;
2069;Jamina, Biokovo;Croatia;24.3.2004.;2004-03-24;3f, 5 juv;8;Linyphiidae;Palliduphantes;spelaeorum;Palliduphantes spelaeorum;617;43.386358;16.925277;Tf;deep cave;43.38635816.925277;4;;;;;;;;;;;;;;;;;;;;;;
2070;Jamina, Biokovo;Croatia;24.3.2004.;2004-03-24;1f, 2 juv;3;Linyphiidae;Palliduphantes;spelaeorum;Palliduphantes spelaeorum;617;43.386358;16.925277;Tf;deep cave;43.38635816.925277;4;;;;;;;;;;;;;;;;;;;;;;
2071;Pozjata špilja;Croatia;26.10.2003.;2003-10-26;1f;1;Linyphiidae;Palliduphantes;spelaeorum;Palliduphantes spelaeorum;1435;43.387837;16.963748;Tf;deep cave;43.38783716.963748;3;;;;;;;;;;;;;;;;;;;;;;
2072;Jamina, Biokovo;Croatia;22.11.2005.;2005-11-22;1f;1;Linyphiidae;Palliduphantes;spelaeorum;Palliduphantes spelaeorum;617;43.386358;16.925277;Tf;deep cave;43.38635816.925277;4;;;;;;;;;;;;;;;;;;;;;;
2073;Svetica;Croatia;22.5.2004.;2004-05-22;1f;1;Linyphiidae;Palliduphantes;spelaeorum;Palliduphantes spelaeorum;300;43.401143;16.894548;Tf;deep cave;43.40114316.894548;5;;;;;;;;;;;;;;;;;;;;;;
2074;Ze?ica;Croatia;17.10.2002.;2002-10-17;1f;1;Linyphiidae;Palliduphantes;spelaeorum;Palliduphantes spelaeorum;1002;43.260392;17.146168;Tf;deep cave;43.26039217.146168;3;;;;;;;;;;;;;;;;;;;;;;
2075;Pozjata špilja;Croatia;26.10.2003.;2003-10-26;2f;2;Linyphiidae;Palliduphantes;spelaeorum;Palliduphantes spelaeorum;1435;43.387837;16.963748;Tf;deep cave;43.38783716.963748;3;;;;;;;;;;;;;;;;;;;;;;
2084;Kukor;Croatia;29.12.1997.;1997-12-29;1f, 1 juv;2;Nesticidae;Kryptonesticus;deelemanae;Kryptonesticus deelemanae;425;43.355609;16.991707;tb;deep cave;43.35560916.991707;10;;;;;;;;;;;;;;;;;;;;;;
2085;Kukor;Croatia;7.8.2000.;2000-08-07;1f, 7 juv;8;Nesticidae;Kryptonesticus;deelemanae;Kryptonesticus deelemanae;425;43.355609;16.991707;tb;deep cave;43.35560916.991707;10;;;;;;;;;;;;;;;;;;;;;;
2088;Kukor;Croatia;25.3.2004.;2004-03-25;1 juv;1;Nesticidae;Kryptonesticus;deelemanae;Kryptonesticus deelemanae;425;43.355609;16.991707;tb;deep cave;43.35560916.991707;10;;;;;;;;;;;;;;;;;;;;;;
2092;Svetica;Croatia;16.11.2005.;2005-11-16;1m, 2f, 3 juv;6;Linyphiidae;Palliduphantes;spelaeorum;Palliduphantes spelaeorum;300;43.401143;16.894548;Tf;deep cave;43.40114316.894548;5;;;;;;;;;;;;;;;;;;;;;;
2093;Kukor;Croatia;26.3.2004.;2004-03-26;1f, 1 juv;2;Nesticidae;Kryptonesticus;deelemanae;Kryptonesticus deelemanae;425;43.355609;16.991707;tb;deep cave;43.35560916.991707;10;;;;;;;;;;;;;;;;;;;;;;
2094;Spila 2;Croatia;26.3.2003.;2003-03-26;1 juv m;1;Linyphiidae;Typhlonyphia;sp. 1;Typhlonyphia sp. 1;516;43.26239;17.204021;Tb;deep cave;43.2623917.204021;6;;;;;;;;;;;;;;;;;;;;;;
2097;Baba;Croatia;27.4.2002.;2002-04-27;1 juv;1;Linyphiidae;Typhlonyphia;sp. 1;Typhlonyphia sp. 1;;43.256469;17.162283;Tb;deep cave;43.25646917.162283;4;;;;;;;;;;;;;;;;;;;;;;
2098;Jama na Saran?u;Croatia;25.3.2005.;2005-03-25;1 juv;1;Linyphiidae;Typhlonyphia;sp. 1;Typhlonyphia sp. 1;;43.247108;17.176093;Tb;deep cave;43.24710817.176093;4;;;;;;;;;;;;;;;;;;;;;;
2100;Bošak jama;Croatia;17.11.2005.;2005-11-17;1f;1;Linyphiidae;Typhlonyphia;sp. 1;Typhlonyphia sp. 1;739;43.347996;17.100045;Tb;deep cave;43.34799617.100045;2;;;;;;;;;;;;;;;;;;;;;;
2102;Tu?epska vilenja?a;Croatia;23.5.2004.;2004-05-23;1 juv m;1;Linyphiidae;Typhlonyphia;sp. 1;Typhlonyphia sp. 1;1181;43.286465;17.083638;Tb;deep cave;43.28646517.083638;8;;;;;;;;;;;;;;;;;;;;;;
2103;Spila 2;Croatia;26.3.2003.;2003-03-26;1 juv;1;Linyphiidae;Typhlonyphia;sp. 1;Typhlonyphia sp. 1;516;43.26239;17.204021;Tb;deep cave;43.2623917.204021;6;;;;;;;;;;;;;;;;;;;;;;
2104;?avlenova?a;Croatia;18.6.2002.;2002-06-18;1 juv;1;Nesticidae;Kryptonesticus;deelemanae;Kryptonesticus deelemanae;1460;43.334228;17.040746;tb;deep cave;43.33422817.040746;1;;;;;;;;;;;;;;;;;;;;;;
2105;Spila 2;Croatia;23.3.2004.;2004-03-23;2 juv;2;Linyphiidae;Typhlonyphia;sp. 1;Typhlonyphia sp. 1;516;43.26239;17.204021;Tb;deep cave;43.2623917.204021;6;;;;;;;;;;;;;;;;;;;;;;
2107;Jama za Supinom;Croatia;18.11.2005.;2005-11-18;2m, 1f;3;Linyphiidae;Palliduphantes;spelaeorum;Palliduphantes spelaeorum;;43.250417;17.113278;Tf;deep cave;43.25041717.113278;7;;;;;;;;;;;;;;;;;;;;;;
2108;Vlastelinka jama;Croatia;26.3.2003.;2003-03-26;1f;1;Linyphiidae;Palliduphantes;spelaeorum;Palliduphantes spelaeorum;410;43.269635;17.211206;Tf;deep cave;43.26963517.211206;2;;;;;;;;;;;;;;;;;;;;;;
2109;Jamina, Biokovo;Croatia;22.11.2005.;2005-11-22;3f, 1 juv m, 1 juv;5;Linyphiidae;Palliduphantes;spelaeorum;Palliduphantes spelaeorum;617;43.386358;16.925277;Tf;deep cave;43.38635816.925277;4;;;;;;;;;;;;;;;;;;;;;;
2111;Golubnja?a, Bartulovi?i;Croatia;23.3.2003.;2003-03-23;2 juv;2;Nesticidae;Kryptonesticus;deelemanae;Kryptonesticus deelemanae;;43.408559;16.942035;tb;deep cave;43.40855916.942035;2;;;;;;;;;;;;;;;;;;;;;;
2112;Jama na Saran?u;Croatia;25.3.2003.;2003-03-25;1m, 1 juv;2;Linyphiidae;Palliduphantes;spelaeorum;Palliduphantes spelaeorum;;43.247108;17.176093;Tf;deep cave;43.24710817.176093;4;;;;;;;;;;;;;;;;;;;;;;
2114;Kukor;Croatia;23.9.1999.;1999-09-23;1 juv;1;Nesticidae;Kryptonesticus;deelemanae;Kryptonesticus deelemanae;425;43.355609;16.991707;tb;deep cave;43.35560916.991707;10;;;;;;;;;;;;;;;;;;;;;;
2117;Jama u Bratušu;Croatia;27.10.2006.;2006-10-27;2m, 1f, 1 juv;4;Linyphiidae;Palliduphantes;spelaeorum;Palliduphantes spelaeorum;;43.328376;16.979405;Tf;deep cave;43.32837616.979405;4;;;;;;;;;;;;;;;;;;;;;;
2118;Jujnovi?a špilja;Croatia;27.4.2002.;2002-04-27;1 juv;1;Linyphiidae;Typhlonyphia;sp. 1;Typhlonyphia sp. 1;405;43.266579;17.19798;Tb;deep cave;43.26657917.19798;6;;;;;;;;;;;;;;;;;;;;;;
2119;Pružina špilja;Croatia;29.10.2003.;2003-10-29;1 juv;1;Linyphiidae;Typhlonyphia;sp. 1;Typhlonyphia sp. 1;519;43.394238;17.058713;Tb;deep cave;43.39423817.058713;4;;;;;;;;;;;;;;;;;;;;;;
2120;?uli?a jama;Croatia;26-10.2003.;2003-10-26;1 juv;1;Linyphiidae;Typhlonyphia;sp. 1;Typhlonyphia sp. 1;1029;43.395082;16.950762;Tb;deep cave;43.39508216.950762;2;;;;;;;;;;;;;;;;;;;;;;
2123;Jama za Supinom;Croatia;26.5.2004.;2004-05-26;1m, 2f, 1 juv;4;Linyphiidae;Palliduphantes;spelaeorum;Palliduphantes spelaeorum;;43.250417;17.113278;Tf;deep cave;43.25041717.113278;7;;;;;;;;;;;;;;;;;;;;;;
2131;Svetica;Croatia;25.10.2003.;2003-10-25;1m, 2 juv;3;Amaurobidae;Amaurobius;erberi;Amaurobius erberi;300;43.401143;16.894548;Tx;deep cave;43.40114316.894548;5;;;;;;;;;;;;;;;;;;;;;;
2133;Polušpilja iza ku?e u Bastu;Croatia;18.8.1998.;1998-08-18;1 juv/f;1;Scytodidae;Scytodes;thoracica;Scytodes thoracica;285;43.354924;16.982503;Tx;;43.35492416.982503;3;;;;;;;;;;;;;;;;;;;;;;
2142;Ga?ina jama;Croatia;15.10.2002.;2002-10-15;1 juv;1;Linyphiidae;Typhlonyphia;sp. 1;Typhlonyphia sp. 1;591;43.401743;17.058436;Tb;deep cave;43.40174317.058436;3;;;;;;;;;;;;;;;;;;;;;;
2146;Male spile;Croatia;29.10.2003.;2003-10-29;1m;1;Scytodidae;Scytodes;thoracica;Scytodes thoracica;790;43.369039;16.955554;Tx;;43.36903916.955554;1;;;;;;;;;;;;;;;;;;;;;;
2147;Pasji manastir;Croatia;2.3.2004.;2004-03-02;1 juv/f;1;Scytodidae;Scytodes;thoracica;Scytodes thoracica;712;43.367864;16.970923;Tx;;43.36786416.970923;2;;;;;;;;;;;;;;;;;;;;;;
2149;Špilja na Mrždolcu;Croatia;5.4.2006.;2006-04-05;1 juv;1;Linyphiidae;Typhlonyphia;sp. 1;Typhlonyphia sp. 1;461;43.405319;17.014811;Tb;deep cave;43.40531917.014811;3;;;;;;;;;;;;;;;;;;;;;;
2151;Muci?a ledenica;Croatia;24.5.2004.;2004-05-24;1f;1;Linyphiidae;Troglohyphantes;sp. 8;Troglohyphantes sp. 8;1250;43.35632;17.051544;Tf;deep cave;43.3563217.051544;3;;;;;;;;;;;;;;;;;;;;;;
2153;Kukor;Croatia;26.4.2002.;2002-04-26;2f juv;2;Leptonetidae;Sulcia;sp.;Sulcia sp.;425;43.355609;16.991707;;;43.35560916.991707;10;;;;;;;;;;;;;;;;;;;;;;
2154;Jama u Bratušu;Croatia;27.10.2006.;2006-10-27;1m;1;Linyphiidae;Centromerus;raridentatus sp.n.;Centromerus raridentatus sp.n.;25;43.328376;16.979405;;;43.32837616.979405;4;;;;;;;;;;;;;;;;;;;;;;
2155;Krjava 2;Croatia;27.10.2006.;2006-10-27;3f;3;Linyphiidae;Centromerus;cavernarum;Centromerus cavernarum;903;43.329431;17.027011;Tf;deep cave;43.32943117.027011;3;;;;;;;;;;;;;;;;;;;;;;
2156;Stonjska pe? gornja;Croatia;27.10.2003.;2003-10-27;1f, 1 juv;2;Linyphiidae;Centromerus;cavernarum;Centromerus cavernarum;625;43.315167;17.1304;Tf;deep cave;43.31516717.1304;4;;;;;;;;;;;;;;;;;;;;;;
2157;Jama iznad Prozor?i?a;Croatia;28.10.2003.;2003-10-28;1m, 1 juv m;2;Linyphiidae;Centromerus;silvicola;Centromerus silvicola;617;43.38381;16.932036;tx;deep cave;43.3838116.932036;5;;;;;;;;;;;;;;;;;;;;;;
2158;Jama iznad Prozor?i?a;Croatia;24.3.2004.;2004-03-24;1 m;1;Linyphiidae;Centromerus;silvicola;Centromerus silvicola;617;43.38381;16.932036;tx;deep cave;43.3838116.932036;5;;;;;;;;;;;;;;;;;;;;;;
2159;Mala jama u stijenama;Croatia;20.3.2003.;2003-03-20;1m, 1 juv;2;Linyphiidae;Centromerus;cavernarum;Centromerus cavernarum;1115;43.365579;17.027668;Tf;deep cave;43.36557917.027668;3;;;;;;;;;;;;;;;;;;;;;;
2161;Jama iznad Prozor?i?a;Croatia;28.10.2003.;2003-10-28;2m, 1f, 1 juv m;4;Linyphiidae;Centromerus;silvicola;Centromerus silvicola;617;43.38381;16.932036;tx;deep cave;43.3838116.932036;5;;;;;;;;;;;;;;;;;;;;;;
2162;Jama iznad Prozor?i?a;Croatia;1.4.2006.;2006-04-01;1f;1;Linyphiidae;Centromerus;silvicola;Centromerus silvicola;617;43.38381;16.932036;tx;deep cave;43.3838116.932036;5;;;;;;;;;;;;;;;;;;;;;;
2163;Jama iznad Prozor?i?a;Croatia;1.4.2006.;2006-04-01;1f;1;Linyphiidae;Centromerus;silvicola;Centromerus silvicola;617;43.38381;16.932036;tx;deep cave;43.3838116.932036;5;;;;;;;;;;;;;;;;;;;;;;
2164;Jama iznad Prozor?i?a;Croatia;28.10.2003.;2003-10-28;1f;1;Linyphiidae;Centromerus;silvicola;Centromerus silvicola;617;43.38381;16.932036;tx;deep cave;43.3838116.932036;5;;;;;;;;;;;;;;;;;;;;;;
2165;Jama iznad Prozor?i?a;Croatia;26.10.2006.;2006-10-26;2f;2;Linyphiidae;Centromerus;silvicola;Centromerus silvicola;617;43.38381;16.932036;tx;deep cave;43.3838116.932036;5;;;;;;;;;;;;;;;;;;;;;;
2169;Samogorska špilja;Croatia;25.5.2005.;2005-05-25;1 f;1;Linyphiidae;Gen. 8;sp. 1;Gen. 8 sp. 1;717;43.318227;17.121122;;;43.31822717.121122;6;;;;;;;;;;;;;;;;;;;;;;
2170;Samogorska špilja;Croatia;19.11.2005.;2005-11-19;1 f;1;Linyphiidae;Gen. 8;sp. 1;Gen. 8 sp. 1;717;43.318227;17.121122;;;43.31822717.121122;6;;;;;;;;;;;;;;;;;;;;;;
2180;Brikinjava špilja;Croatia;17.11.2005.;2005-11-17;3f, 1 juv m, 1 juv;5;Leptonetidae;Barusia;maheni;Barusia maheni;740;43.345181;17.096904;tf;deep cave;43.34518117.096904;3;;;;;;;;;;;;;;;;;;;;;;
2181;Brikinjava špilja;Croatia;21.3.2003.;2003-03-21;1f;1;Leptonetidae;Sulcia;sp.;Sulcia sp.;740;43.345181;17.096904;;;43.34518117.096904;3;;;;;;;;;;;;;;;;;;;;;;
2182;Kukor;Croatia;19.6.2002.;2002-06-19;1f, 1 juv;2;Leptonetidae;Sulcia;sp.;Sulcia sp.;425;43.355609;16.991707;;;43.35560916.991707;10;;;;;;;;;;;;;;;;;;;;;;
2183;Gradska spila;Croatia;19.11.2005.;2005-11-19;1f;1;Leptonetidae;Sulcia;sp.;Sulcia sp.;755;43.318029;17.117623;;;43.31802917.117623;4;;;;;;;;;;;;;;;;;;;;;;
2185;Gradska spila;Croatia;25.5.2004.;2004-05-25;2f, 1juv m, 3 juv;6;Leptonetidae;Sulcia;sp.;Sulcia sp.;755;43.318029;17.117623;;;43.31802917.117623;4;;;;;;;;;;;;;;;;;;;;;;
2186;Stonjska pe? donja;Croatia;27.10.2003.;2003-10-27;1 juv m, 1f;2;Leptonetidae;Sulcia;sp.;Sulcia sp.;608;43.315167;17.130659;;;43.31516717.130659;6;;;;;;;;;;;;;;;;;;;;;;
2188;Samogorska špilja;Croatia;19.11.2005.;2005-11-19;2f, 6 juv;8;Leptonetidae;Sulcia;sp.;Sulcia sp.;717;43.318227;17.121122;;;43.31822717.121122;6;;;;;;;;;;;;;;;;;;;;;;
2190;Kukor;Croatia;28.7.2006.;2006-07-28;1f;1;Leptonetidae;Barusia;maheni;Barusia maheni;425;43.355609;16.991707;tf;deep cave;43.35560916.991707;10;;;;;;;;;;;;;;;;;;;;;;
2192;Špilja na Mrždolcu;Croatia;21.11.2005.;2005-11-21;1f, 1 juv m, 1 juv;3;Leptonetidae;Barusia;maheni;Barusia maheni;461;43.405319;17.014811;tf;deep cave;43.40531917.014811;3;;;;;;;;;;;;;;;;;;;;;;
2194;Gradska spila;Croatia;4.4.2006.;2006-04-04;1f, 1 juv m, 3 juv;5;Leptonetidae;Sulcia;sp.;Sulcia sp.;755;43.318029;17.117623;;;43.31802917.117623;4;;;;;;;;;;;;;;;;;;;;;;
2196;Kukor;Croatia;24.9.2001.;2001-09-24;1f, 1 juv;2;Leptonetidae;Barusia;maheni;Barusia maheni;425;43.355609;16.991707;tf;deep cave;43.35560916.991707;10;;;;;;;;;;;;;;;;;;;;;;
2197;Pasji manastir;Croatia;20.3.2004.;2004-03-20;1f;1;Leptonetidae;Sulcia;sp.;Sulcia sp.;712;43.367864;16.970923;;;43.36786416.970923;2;;;;;;;;;;;;;;;;;;;;;;
2203;Samogorska špilja;Croatia;25.5.2005.;2005-05-25;3f, 3 juvm, 1 juv;7;Leptonetidae;Sulcia;sp.;Sulcia sp.;717;43.318227;17.121122;;;43.31822717.121122;6;;;;;;;;;;;;;;;;;;;;;;
2205;Samogorska špilja;Croatia;4.4.2006.;2006-04-04;6f, 1 juv;7;Leptonetidae;Sulcia;sp.;Sulcia sp.;717;43.318227;17.121122;;;43.31822717.121122;6;;;;;;;;;;;;;;;;;;;;;;
2207;Stonjska pe? donja;Croatia;27.10.2003.;2003-10-27;2f, 1 juvm;3;Leptonetidae;Barusia;maheni;Barusia maheni;608;43.315167;17.130659;tf;deep cave;43.31516717.130659;6;;;;;;;;;;;;;;;;;;;;;;
2209;Samogorska špilja;Croatia;25.5.2005.;2005-05-25;1f;1;Leptonetidae;Sulcia;sp.;Sulcia sp.;717;43.318227;17.121122;;;43.31822717.121122;6;;;;;;;;;;;;;;;;;;;;;;
2212;Jama na Brezdanu;Croatia;20.3.2004.;2004-03-20;1f, 2 juv;3;Leptonetidae;Sulcia;sp.;Sulcia sp.;915;43.369901;16.973172;;;43.36990116.973172;3;;;;;;;;;;;;;;;;;;;;;;
2218;Samogorska špilja;Croatia;4.4.2006.;2006-04-04;2f, 2 juv;4;Leptonetidae;Sulcia;sp.;Sulcia sp.;717;43.318227;17.121122;;;43.31822717.121122;6;;;;;;;;;;;;;;;;;;;;;;
2219;Matijaševa pe?;Croatia;4.4.2006.;2006-04-04;2f;2;Leptonetidae;Sulcia;sp.;Sulcia sp.;584;43.320551;17.122321;;;43.32055117.122321;6;;;;;;;;;;;;;;;;;;;;;;
2222;Matijaševa pe?;Croatia;4.4.2006.;2006-04-04;1f;1;Leptonetidae;Sulcia;sp.;Sulcia sp.;584;43.320551;17.122321;;;43.32055117.122321;6;;;;;;;;;;;;;;;;;;;;;;
2223;Kukor;Croatia;6.4.2006.;2006-04-06;1 juv f;1;Leptonetidae;Sulcia;sp.;Sulcia sp.;425;43.355609;16.991707;;;43.35560916.991707;10;;;;;;;;;;;;;;;;;;;;;;
2225;Sniježnica pod Ljubljanom;Croatia;23.6.2011.;2011-06-23;1f, 1 juv;2;Linyphiidae;Troglohyphantes;dalmaticus;Troglohyphantes dalmaticus;;43.537964;16.616241;tf;deep cave;43.53796416.616241;1;;;;;;;;;;;;;;;;;;;;;;
2226;Sniježnica pod Ljubljanom;Croatia;23.6.2011.;2011-06-23;1f, 4 juv;5;Linyphiidae;Troglohyphantes;dalmaticus;Troglohyphantes dalmaticus;;43.537964;16.616241;tf;deep cave;43.53796416.616241;1;;;;;;;;;;;;;;;;;;;;;;
2227;Židovske jame;Croatia;23.4.2005.;2005-04-23;3f, 3 juv;6;Linyphiidae;Troglohyphantes;sp. 12;Troglohyphantes sp. 12;;45.997503;16.038982;tf;deep cave;45.99750316.038982;2;;;;;;;;;;;;;;;;;;;;;;
2228;Židovske jame;Croatia;23.4.2005.;2005-04-23;3f, 3 juv;6;Linyphiidae;Troglohyphantes;sp. 12;Troglohyphantes sp. 12;;45.997503;16.038982;tf;deep cave;45.99750316.038982;2;;;;;;;;;;;;;;;;;;;;;;
2229;Glogova jama;Croatia;24.8.2005.;2005-08-24;1f;1;Linyphiidae;Troglohyphantes;lesserti;Troglohyphantes lesserti;;42.573189;18.361688;tb;deep cave;42.57318918.361688;1;;;;;;;;;;;;;;;;;;;;;;
2230;Bedara;Croatia;24.8.2002.;2002-08-24;1f;1;Linyphiidae;Troglohyphantes;sketi;Troglohyphantes sketi;620;45.751922;15.536692;;deep cave;45.75192215.536692;4;;;;;;;;;;;;;;;;;;;;;;
2231;Velika pe? (Rog);Croatia;20.3.2005.;2005-03-20;3f, 1 juvm, 1juvf, 1 juv;6;Linyphiidae;Troglohyphantes;sp. 12;Troglohyphantes sp. 12;;45.93776;16.06234;tf;deep cave;45.9377616.06234;4;;;;;;;;;;;;;;;;;;;;;;
2232;Jezero;Croatia;28.5.2004.;2004-05-28;1m;1;Linyphiidae;Troglohyphantes;lesserti;Troglohyphantes lesserti;903;42.580381;18.356073;tb;deep cave;42.58038118.356073;8;;;7,566666667;;;;;;;;;;;;;;;;;;;
2233;Drinova 2;Croatia;23.3.2003.;2003-03-23;1m, 1f, 1 juvm;3;Leptonetidae;Sulcia;sp. 3;Sulcia sp. 3;725;43.407702;16.942899;Tb;deep cave;43.40770216.942899;3;;;;;;;;;;;;;;;;;;;;;;
2234;Podrum;Croatia;22.5.2004.;2004-05-22;1m, 1 juvm;2;Leptonetidae;Sulcia;sp. 4;Sulcia sp. 4;;43.234263;17.091929;Tb;deep cave;43.23426317.091929;2;;;;;;;;;;;;;;;;;;;;;;
2235;Stonjska pe? donja;Croatia;27.10.2003.;2003-10-27;2m, 1f, 1 juv;4;Leptonetidae;Sulcia;sp. 4;Sulcia sp. 4;608;43.315167;17.130659;Tb;deep cave;43.31516717.130659;6;;;;;;;;;;;;;;;;;;;;;;
2236;Jama na Brezdanu;Croatia;20.3.2004.;2004-03-20;1m, 1f, 1 juvm;3;Leptonetidae;Sulcia;sp. 3;Sulcia sp. 3;915;43.369901;16.973172;Tb;deep cave;43.36990116.973172;3;;;;;;;;;;;;;;;;;;;;;;
2237;Kukor;Croatia;7.8.2000.;2000-08-07;5m, 3f, 4juv;12;Leptonetidae;Sulcia;sp. 4;Sulcia sp. 4;425;43.355609;16.991707;Tb;deep cave;43.35560916.991707;10;;;;;;;;;;;;;;;;;;;;;;
2238;Bužnja?a;Croatia;29.10.2003.;2003-10-29;1m;1;Leptonetidae;Sulcia;sp. 3;Sulcia sp. 3;;43.370414;16.958245;Tb;deep cave;43.37041416.958245;2;;;;;;;;;;;;;;;;;;;;;;
2239;Kukor;Croatia;27.3.2003.;2003-03-27;1m, 1 juv;2;Leptonetidae;Sulcia;sp. 3;Sulcia sp. 3;425;43.355609;16.991707;Tb;deep cave;43.35560916.991707;10;;;;;;;;;;;;;;;;;;;;;;
2240;Gradska spila;Croatia;19.11.2005.;2005-11-19;1m, 1 f, 1 juv;3;Leptonetidae;Sulcia;sp. 4;Sulcia sp. 4;755;43.318029;17.117623;Tb;deep cave;43.31802917.117623;4;;;;;;;;;;;;;;;;;;;;;;
2241;Samogorska špilja;Croatia;25.5.2004.;2004-05-25;1m, 2 juv;3;Leptonetidae;Sulcia;sp. 4;Sulcia sp. 4;717;43.318227;17.121122;Tb;deep cave;43.31822717.121122;6;;;;;;;;;;;;;;;;;;;;;;
2242;Kukor;Croatia;2.1.1999.;1999-01-02;1m;1;Leptonetidae;Sulcia;sp. 3;Sulcia sp. 3;425;43.355609;16.991707;Tb;deep cave;43.35560916.991707;10;;;;;;;;;;;;;;;;;;;;;;
2243;Kukor;Croatia;26.8.1998.;1998-08-26;1m;1;Leptonetidae;Sulcia;sp. 3;Sulcia sp. 3;425;43.355609;16.991707;Tb;deep cave;43.35560916.991707;10;;;;;;;;;;;;;;;;;;;;;;
2244;Samogorska špilja;Croatia;19.11.2005.;2005-11-19;1m, 5 juv;6;Leptonetidae;Sulcia;sp. 4;Sulcia sp. 4;717;43.318227;17.121122;Tb;deep cave;43.31822717.121122;6;;;;;;;;;;;;;;;;;;;;;;
2245;Samogorska špilja;Croatia;19.11.2005.;2005-11-19;1m, 2 juv;3;Leptonetidae;Sulcia;sp. 4;Sulcia sp. 4;717;43.318227;17.121122;Tb;deep cave;43.31822717.121122;6;;;;;;;;;;;;;;;;;;;;;;
2247;Kukor;Croatia;29.10.2006.;2006-10-29;1m, 1f, 1 juvm;3;Leptonetidae;Sulcia;sp. 3;Sulcia sp. 3;425;43.355609;16.991707;Tb;deep cave;43.35560916.991707;10;;;;;;;;;;;;;;;;;;;;;;
2249;Gradska spila;Croatia;19.11.2005.;2005-11-19;1m, 3f, 2 juv;6;Leptonetidae;Sulcia;sp. 4;Sulcia sp. 4;755;43.318029;17.117623;Tb;deep cave;43.31802917.117623;4;;;;;;;;;;;;;;;;;;;;;;
2250;Kukor;Croatia;27.7.2004.;2004-07-27;1m, 1f;2;Leptonetidae;Sulcia;sp. 3;Sulcia sp. 3;425;43.355609;16.991707;Tb;deep cave;43.35560916.991707;10;;;;;;;;;;;;;;;;;;;;;;
2251;Kukor;Croatia;20.10.2005.;2005-10-20;1m;1;Leptonetidae;Sulcia;sp. 3;Sulcia sp. 3;425;43.355609;16.991707;Tb;deep cave;43.35560916.991707;10;;;;;;;;;;;;;;;;;;;;;;
2252;Podrum;Croatia;22.5.2004.;2004-05-22;3m, 1f, 3juv;7;Leptonetidae;Sulcia;sp. 4;Sulcia sp. 4;;43.234263;17.091929;Tb;deep cave;43.23426317.091929;2;;;;;;;;;;;;;;;;;;;;;;
2253;Matijaševa pe?;Croatia;4.4.2006.;2006-04-04;1m, 1f;2;Leptonetidae;Sulcia;sp. 4;Sulcia sp. 4;584;43.320551;17.122321;Tb;deep cave;43.32055117.122321;6;;;;;;;;;;;;;;;;;;;;;;
2254;Samogorska špilja;Croatia;4.4.2006.;2006-04-04;3m, 1f;4;Leptonetidae;Sulcia;sp. 4;Sulcia sp. 4;717;43.318227;17.121122;Tb;deep cave;43.31822717.121122;6;;;;;;;;;;;;;;;;;;;;;;
2255;Stonjska pe? gornja;Croatia;27.10.2003.;2003-10-27;1m;1;Leptonetidae;Sulcia;sp. 4;Sulcia sp. 4;;43.315167;17.1304;Tb;deep cave;43.31516717.1304;4;;;;;;;;;;;;;;;;;;;;;;
2256;Gradska spila;Croatia;4.4.2006.;2006-04-04;2m, 2 juv;4;Leptonetidae;Sulcia;sp. 4;Sulcia sp. 4;755;43.318029;17.117623;Tb;deep cave;43.31802917.117623;4;;;;;;;;;;;;;;;;;;;;;;
2257;Tanki Ratac;Croatia;6.1.2009.;2009-01-06;1m, 1 juvm;2;Leptonetidae;Barusia;maheni;Barusia maheni;;43.360229;16.569356;tf;deep cave;43.36022916.569356;3;;;;;;;;;;;;;;;;;;;;;;
2258;Svetica;Croatia;16.11.2005.;2005-11-16;5m, 1f, 3 juv;9;Leptonetidae;Barusia;maheni;Barusia maheni;300;43.401143;16.894548;tf;deep cave;43.40114316.894548;5;;;;;;;;;;;;;;;;;;;;;;
2259;Jama u Bratušu;Croatia;27.10.2006.;2006-10-27;2m, 1f;3;Leptonetidae;Barusia;maheni;Barusia maheni;;43.328376;16.979405;tf;deep cave;43.32837616.979405;4;;;;;;;;;;;;;;;;;;;;;;
2260;Svetica;Croatia;25.10.2003.;2003-10-25;1m,1f;2;Leptonetidae;Barusia;maheni;Barusia maheni;300;43.401143;16.894548;tf;deep cave;43.40114316.894548;5;;;;;;;;;;;;;;;;;;;;;;
2261;Svetica;Croatia;22.5.2004.;2004-05-22;1m;1;Leptonetidae;Barusia;maheni;Barusia maheni;300;43.401143;16.894548;tf;deep cave;43.40114316.894548;5;;;;;;;;;;;;;;;;;;;;;;
2262;Jamski sustav Crnopac;Croatia;10.8.2011.;2011-08-10;1f;1;Linyphiidae;Troglohyphantes;sp. 9;Troglohyphantes sp. 9;;44.260625;15.85028;tb;deep cave;44.26062515.85028;1;;;;;;;;;;;;;;;;;;;;;;
2263;Špilja kod bare Vojnikuše;Croatia;3.8.2011.;2011-08-03;1m;1;Dysderidae;Parastalita;stygia;Parastalita stygia;590;44.62389;15.206584;Tb;deep cave;44.6238915.206584;1;;;;;;;;;;;;;;;;;;;;;;
2264;Špilja kod bare Vojnikuše;Croatia;3.8.2011.;2011-08-03;1f;1;Dysderidae;Parastalita;stygia;Parastalita stygia;590;44.62389;15.206584;Tb;deep cave;44.6238915.206584;1;;;;;;;;;;;;;;;;;;;;;;
2267;Klementina 21;Croatia;3.8.2011.;2011-08-03;1 juv m;1;Linyphiidae;Troglohyphantes;sp.;Troglohyphantes sp.;;44.650725;15.103309;;;44.65072515.103309;1;;;;;;;;;;;;;;;;;;;;;;
2268;Ponor Štirova?a;Croatia;7.8.2011.;2011-08-07;1f, 1 juv;2;Linyphiidae;Troglohyphantes;sp. 3;Troglohyphantes sp. 3;1060;44.693088;15.051176;tb;deep cave;44.69308815.051176;2;;;;;;;;;;;;;;;;;;;;;;
2269;Jama kod Lugarnice;Croatia;4.8.2011.;2011-08-04;2m, 4f, 1juv;7;Linyphiidae;Troglohyphantes;croaticus;Troglohyphantes croaticus;570;45.327864;15.092353;tb;deep cave;45.32786415.092353;3;;;;;;;;;;;;;;;;;;;;;;
2270;Jama kod Lugarnice;Croatia;4.8.2011.;2011-08-04;3f, 1m;4;Dysderidae;Parastalita;stygia;Parastalita stygia;570;45.327864;15.092353;Tb;deep cave;45.32786415.092353;3;;;;;;;;;;;;;;;;;;;;;;
2271;Špilja Šuplja?a;Croatia;1.8.2006.;2006-08-01;1f;1;Linyphiidae;Troglohyphantes;roberti;Troglohyphantes roberti;;44.228797;15.851735;tb;deep cave;44.22879715.851735;2;;;;;;;;;;;;;;;;;;;;;;
2272;Velika pe?ina, Gornji ?abri?i;Croatia;1.8.2006.;2006-08-01;3f, 2m, 3 juv;8;Linyphiidae;Troglohyphantes;roberti;Troglohyphantes roberti;;44.229974;15.855897;tb;deep cave;44.22997415.855897;4;;;;;;;;;;;;;;;;;;;;;;
2275;Jama prvi put;Croatia;13.8.2004.;2004-08-13;1m;1;Linyphiidae;Porrhomma;convexum;Porrhomma convexum;;44.258904;15.828678;;deep cave;44.25890415.828678;1;;;;;;;;;;;;;;;;;;;;;;
2277;Vodarica;Croatia;13.6.1999.;1999-06-13;1 juv m;1;Linyphiidae;Troglohyphantes;sp.;Troglohyphantes sp.;;44.31302;15.502487;;;44.3130215.502487;1;;;;;;;;;;;;;;;;;;;;;;
2278;Rastova?a;Croatia;28.9.2006.;2006-09-28;1m, 1f, 1juv;3;Linyphiidae;Troglohyphantes;roberti;Troglohyphantes roberti;380;44.233742;15.698969;tb;deep cave;44.23374215.698969;2;;;;;;;;;;;;;;;;;;;;;;
2279;Jama Kao-kao;Croatia;25.7.2001.;2001-07-25;1 juv f;1;Linyphiidae;Troglohyphantes;sp.;Troglohyphantes sp.;;44.45232;15.2474;;;44.4523215.2474;1;;;;;;;;;;;;;;;;;;;;;;
2286;Velika pe?ina, Gornji ?abri?i;Croatia;1.8.2006.;2006-08-01;1m;1;Linyphiidae;Bathyphantes;sp. 2;Bathyphantes sp. 2;585;44.229974;15.855897;Tx;;44.22997415.855897;4;;;;;;;;;;;;;;;;;;;;;;
2287;Vulva;Croatia;14.8.2006.;2006-08-14;1m;1;Linyphiidae;Porrhomma;convexum;Porrhomma convexum;;44.259766;15.828941;;deep cave;44.25976615.828941;2;;;;;;;;;;;;;;;;;;;;;;
2288;Jama lijepih fosila;Croatia;15.5.2006.;2006-05-15;1f;1;Dysderidae;Gen. 1;sp. 1;Gen. 1 sp. 1;1674;44.374877;15.490469;Tb;deep cave;44.37487715.490469;1;;;;;;;;;;;;;;;;;;;;;;
2289;Vaganka;Croatia;3.6.2006.;2006-06-03;1m, 1f;2;Dysderidae;Parastalita;stygia;Parastalita stygia;658;44.33853;15.43867;Tb;deep cave;44.3385315.43867;5;;;12,05;;;;;;;;;;;;;;;;;;;
2290;Jama Pisnica;Croatia;16.6.2006.;2006-06-16;1m;1;Dysderidae;Parastalita;stygia;Parastalita stygia;615;44.315196;15.492471;Tb;deep cave;44.31519615.492471;1;;;;;;;;;;;;;;;;;;;;;;
2291;Velika pe?ina, Gornji ?abri?i;Croatia;1.8.2006.;2006-08-01;1m;1;Dysderidae;Parastalita;stygia;Parastalita stygia;585;44.229974;15.855897;Tb;deep cave;44.22997415.855897;4;;;;;;;;;;;;;;;;;;;;;;
2292;Jatara špilja;Croatia;9.6.2006.;2006-06-09;1f;1;Linyphiidae;Centromerus;cavernarum;Centromerus cavernarum;;44.334974;15.446351;Tf;deep cave;44.33497415.446351;3;;;;;;;;;;;;;;;;;;;;;;
2293;Kad jaganjci utihnu;Croatia;5.6.2006.;2006-06-05;1m;1;Theridiidae;Episinus;cavernicola;Episinus cavernicola;;44.365085;15.314841;Tf;deep cave;44.36508515.314841;3;;;;;;;;;;;;;;;;;;;;;;
2294;Vulva;Croatia;14.8.2006.;2006-08-14;1m;1;Theridiidae;Episinus;cavernicola;Episinus cavernicola;;44.259766;15.828941;Tf;deep cave;44.25976615.828941;2;;;;;;;;;;;;;;;;;;;;;;
2299;Vrta?a kod jame Kajgana;Croatia;1.8.2005.;2005-08-01;1 juv;1;Dysderidae;Dysdera;sp.;Dysdera sp.;;44.487041;15.231807;Tx;;44.48704115.231807;2;;;;;;;;;;;;;;;;;;;;;;
2301;Rastova?a;Croatia;2.8.2005.;2005-08-02;1m, 1f;2;Dysderidae;Parastalita;stygia;Parastalita stygia;380;44.233742;15.698969;Tb;deep cave;44.23374215.698969;2;;;;;;;;;;;;;;;;;;;;;;
2302;Munižaba;Croatia;9.7.2011.;2011-07-09;1f, 1 juv;2;Linyphiidae;Troglohyphantes;roberti;Troglohyphantes roberti;;44.265901;15.864397;tb;deep cave;44.26590115.864397;1;;;;;;;;;;;;;;;;;;;;;;
2309;Vrta?a kod jame Kajgana;Croatia;1.8.2005.;2005-08-01;1f, 1 juv;2;Linyphiidae;Gen.;sp. X;Gen. sp. X;;44.487041;15.231807;;;44.48704115.231807;2;;;;;;;;;;;;;;;;;;;;;;
2319;Golubinka više Mrši?a strane;Croatia;4.8.2006.;2006-08-04;1m;1;Linyphiidae;Palliduphantes;istrianus;Palliduphantes istrianus;;44.12501;15.807683;Tf;deep cave;44.1250115.807683;3;;;;;;;;;;;;;;;;;;;;;;
2321;Jama B-5;Croatia;31.7.2000.;2000-07-31;1m;1;Linyphiidae;Micrargus;sp.;Micrargus sp.;;44.744468;15.066058;;;44.74446815.066058;1;;;;;;;;;;;;;;;;;;;;;;
2324;Babi?a Snježnja?a;Croatia;9.6.1984.;1984-06-09;1f;1;Linyphiidae;Troglohyphantes;kordunlikanus;Troglohyphantes kordunlikanus;800;44.209779;16.103991;tf;deep cave;44.20977916.103991;2;;;;;;;;;;;;;;;;;;;;;;
2328;Jama II kod Velikih Brisnica;Croatia;2.6.2006.;2006-06-02;1m;1;Familia x;Gen.;sp.;Gen. sp.;520;44.789027;14.918377;;;44.78902714.918377;3;;;;;;;;;;;;;;;;;;;;;;
2330;Školjka jama;Croatia;15.8.2007.;2007-08-15;1f;1;Linyphiidae;Porrhomma;egeria;Porrhomma egeria;1600;44.762398;14.986639;;deep cave;44.76239814.986639;1;;;;;;;;;;;;;;;;;;;;;;
2331;Jama na Kuželjevcu;Croatia;2.6.2006.;2006-06-02;1f;1;Linyphiidae;Palliduphantes;istrianus;Palliduphantes istrianus;;44.828665;14.910216;Tf;deep cave;44.82866514.910216;2;;;;;;;;;;;;;;;;;;;;;;
2333;Školjka jama;Croatia;7.8.2003.;2003-08-07;1m;1;Linyphiidae;Porrhomma;egeria;Porrhomma egeria;1600;44.762398;14.986639;;deep cave;44.76239814.986639;1;;;;;;;;;;;;;;;;;;;;;;
2336;Zelena;Croatia;2.8.2004.;2004-08-02;1m;1;Linyphiidae;Micrargus;sp.;Micrargus sp.;;44.756954;14.98717;;;44.75695414.98717;2;;;;;;;;;;;;;;;;;;;;;;
2337;Jama na Kuželjevcu;Croatia;2.6.2006.;2006-06-02;3m, 5f, 2 juv;1;Linyphiidae;Palliduphantes;istrianus;Palliduphantes istrianus;;44.828665;14.910216;Tf;deep cave;44.82866514.910216;2;;;;;;;;;;;;;;;;;;;;;;
2338;Dvorske lude;Croatia;22.7.2003.;2003-07-22;1m;1;Linyphiidae;Porrhomma;egeria;Porrhomma egeria;1150;44.740886;15.089898;;deep cave;44.74088615.089898;1;;;;;;;;;;;;;;;;;;;;;;
2342;Jama II kod Velikih Brisnica;Croatia;2.6.2006.;2006-06-02;1m;1;Linyphiidae;Palliduphantes;istrianus;Palliduphantes istrianus;520;44.789027;14.918377;Tf;deep cave;44.78902714.918377;3;;;;;;;;;;;;;;;;;;;;;;
2346;Zelena;Croatia;2.8.2004.;2004-08-02;1m, 1juv;2;Linyphiidae;Gen. 9;sp. 1;Gen. 9 sp. 1;;44.756954;14.98717;;;44.75695414.98717;2;;;;;;;;;;;;;;;;;;;;;;
2354;Puhova jama;Croatia;13.8.2006.;2006-08-13;1m;1;Linyphiidae;Micrargus;sp.;Micrargus sp.;;44.629717;15.131426;;;44.62971715.131426;1;;;;;;;;;;;;;;;;;;;;;;
2358;Zverina;Croatia;3.11.2005.;2005-11-03;1m;1;Linyphiidae;Troglohyphantes;wiehlei;Troglohyphantes wiehlei;;45.681296;15.445012;tf;deep cave;45.68129615.445012;2;;;;;;;;;;;;;;;;;;;;;;
2359;Gornja Cerova?ka špilja;Croatia;6.6.2006.;2006-06-06;1f;1;Linyphiidae;Troglohyphantes;roberti;Troglohyphantes roberti;700;44.27338;15.88422;tb;deep cave;44.2733815.88422;5;;;;;;;;;;;;;;;;;;;;;;
2360;Led 1;Croatia;21.6.2003.;2003-06-21;1f;1;Linyphiidae;Troglohyphantes;sp. 8;Troglohyphantes sp. 8;1475;43.344045;17.057588;Tf;deep cave;43.34404517.057588;3;;;;;;;;;;;;;;;;;;;;;;
2361;Vaginuša;Croatia;14.8.2006.;2006-08-14;1m;1;Linyphiidae;Bathyphantes;sp. 2;Bathyphantes sp. 2;;44.633812;15.12667;Tx;;44.63381215.12667;1;;;;;;;;;;;;;;;;;;;;;;
2362;Japagina 1;Croatia;15.8.2006.;2006-08-15;1m;1;Linyphiidae;Porrhomma;convexum;Porrhomma convexum;;44.645732;15.119398;;deep cave;44.64573215.119398;1;;;;;;;;;;;;;;;;;;;;;;
2363;Sini?i? špilja;Croatia;29.4.2004.;2004-04-29;1f;1;Linyphiidae;Troglohyphantes;kordunlikanus;Troglohyphantes kordunlikanus;;44.990698;15.177848;tf;deep cave;44.99069815.177848;6;;;;;;;;;;;;;;;;;;;;;;
2365;Babina jama, Sv. Rok;Croatia;2.9.2008.;2008-09-02;1 juv m, 3 juv;4;Linyphiidae;Troglohyphantes;roberti;Troglohyphantes roberti;;44.321352;15.678259;tb;deep cave;44.32135215.678259;1;;;;;;;;;;;;;;;;;;;;;;
2367;Pe? u ?ulinovim raljevinama;Croatia;25.6.2011.;2011-06-25;1 juv;1;Dysderidae;Stalagtia;sp. 4;Stalagtia sp. 4;;43.605854;16.575066;Tb;deep cave;43.60585416.575066;5;;;;;;;;;;;;;;;;;;;;;;
2368;Drinov?uša;Croatia;21.6.2011.;2011-06-21;1f;1;Dysderidae;Harpactea;damini;Harpactea damini;793;43.548476;16.638636;TF;deep cave;43.54847616.638636;4;;;;;;;;;;;;;;;;;;;;;;
2370;Tu?epska vilenja?a;Croatia;18.6.2011.;2011-06-18;1 juv;1;Agelenidae;Histopona;sp.;Histopona sp.;1181;43.286465;17.083638;;deep cave;43.28646517.083638;8;;;;;;;;;;;;;;;;;;;;;;
2371;Tu?epska vilenja?a;Croatia;18.6.2011.;2011-06-18;2f;2;Dysderidae;Stalagtia;sp. 4;Stalagtia sp. 4;1181;43.286465;17.083638;Tb;deep cave;43.28646517.083638;8;;;;;;;;;;;;;;;;;;;;;;
2372;Špilja Sv. Filipa i Jakoba;Croatia;14.6.2011.;2011-06-14;1f;1;Dysderidae;Stalagtia;sp. 4;Stalagtia sp. 4;;43.521135;16.091237;Tb;deep cave;43.52113516.091237;5;;;;;;;;;;;;;;;;;;;;;;
2373;Špilja Sv. Filipa i Jakoba;Croatia;14.6.2011.;2011-06-14;1 juv m;1;Dysderidae;Stalagtia;sp. 4;Stalagtia sp. 4;;43.521135;16.091237;Tb;deep cave;43.52113516.091237;5;;;;;;;;;;;;;;;;;;;;;;
2374;Špilja Sv. Filipa i Jakoba;Croatia;14.6.2011.;2011-06-14;1 juv;1;Nesticidae;Kryptonesticus;eremita;Kryptonesticus eremita;;43.521135;16.091237;;deep cave;43.52113516.091237;5;;;;;;;;;;;;;;;;;;;;;;
2375;Budina špilja;Croatia;11.6.2011.;2011-06-11;3f;3;Dysderidae;Parastalita;stygia;Parastalita stygia;570;44.71694;15.360985;Tb;deep cave;44.7169415.360985;6;;;;;;;;;;;;;;;;;;;;;;
2376;Budina špilja;Croatia;11.6.2011.;2011-06-11;1m;1;Nesticidae;Nesticus;cellulanus;Nesticus cellulanus;;44.71694;15.360985;tf;deep cave;44.7169415.360985;6;;;;;;;;;;;;;;;;;;;;;;
2377;Crna ledenica;Croatia;18.6.2011.;2011-06-18;1f;1;Nesticidae;Kryptonesticus;deelemanae;Kryptonesticus deelemanae;;43.348162;17.055328;tb;deep cave;43.34816217.055328;2;;;;;;;;;;;;;;;;;;;;;;
2378;Rodi?a špilja;Croatia;25.6.2011.;2011-06-25;1 juv m;1;Dysderidae;Stalita;pretneri;Stalita pretneri;;44.916872;15.5777;TB;deep cave;44.91687215.5777;4;;;;;;;;;;;;;;;;;;;;;;
2379;Pe? u ?ulinovim raljevinama;Croatia;25.6.2011.;2011-06-25;1 juv;1;Dysderidae;Stalagtia;sp. 4;Stalagtia sp. 4;;43.605854;16.575066;Tb;deep cave;43.60585416.575066;5;;;;;;;;;;;;;;;;;;;;;;
2380;Horvatova jama;Croatia;1.9.1998.;1998-09-01;1f;1;Tetragnathidae;Meta;menardi;Meta menardi;;45.437217;14.615996;Tf;deep cave;45.43721714.615996;1;;;;;;;;;;;;;;;;;;;;;;
2381;Škabac;Croatia;17.4.2011.;2011-04-17;4f;4;Linyphiidae;Centromerus;densidentatus sp.n.;Centromerus densidentatus sp.n.;;45.259902;14.606487;;;45.25990214.606487;10;;;;;;;;;;;;;;;;;;;;;;
2382;Špilja pod Kapelu;Croatia;29.9.2011.;2011-09-29;1 juv m;1;Agelenidae;Hadites;tegenarioides;Hadites tegenarioides;;43.184949;16.434233;TB;deep cave;43.18494916.434233;5;;;;;;;;;;;;;;;;;;;;;;
2384;Jama u uvali Vela Golubinka;Croatia;30.9.2011.;2011-09-30;2f, 3m, 6juv;11;Nesticidae;Kryptonesticus;eremita;Kryptonesticus eremita;;43.119256;16.870199;;deep cave;43.11925616.870199;1;;;;;;;;;;;;;;;;;;;;;;
2385;Špilja pod Kapelu;Croatia;29.9.2011.;2011-09-29;3 juv;3;Agelenidae;Hadites;tegenarioides;Hadites tegenarioides;;43.184949;16.434233;TB;deep cave;43.18494916.434233;5;;;;;;;;;;;;;;;;;;;;;;
2386;Grap?eva špilja;Croatia;30.9.2011.;2011-09-30;3 juv;3;Agelenidae;Hadites;tegenarioides;Hadites tegenarioides;200;43.134189;16.753732;TB;deep cave;43.13418916.753732;5;;;13,93333333;;;;;;;;;;;;;;;;;;;
2387;Pišurka;Croatia;1.10.2007.;2007-10-01;1juv;1;Dysderidae;Folkia;haasi;Folkia haasi;;42.959451;17.129228;Tb;deep cave;42.95945117.129228;5;;;;;;;;;;;;;;;;;;;;;;
2388;Babina jama, Sv. Rok;Croatia;9.4.2011.;2011-04-09;1m, 2f, 1 juv;4;Linyphiidae;Troglohyphantes;roberti;Troglohyphantes roberti;;44.321352;15.678259;tb;deep cave;44.32135215.678259;1;;;;;;;;;;;;;;;;;;;;;;
2390;Grap?eva špilja;Croatia;4.4.2005.;2005-04-04;1f, 2 juv;3;Leptonetidae;Barusia;insulana;Barusia insulana;200;43.134189;16.753732;tb;deep cave;43.13418916.753732;5;;;13,93333333;;;;;;;;;;;;;;;;;;;
2395;Pe? u ?ulinovim raljevinama;Croatia;4.8.2007.;2007-08-04;1f;1;Dysderidae;Stalagtia;sp. 4;Stalagtia sp. 4;;43.605854;16.575066;Tb;deep cave;43.60585416.575066;5;;;;;;;;;;;;;;;;;;;;;;
2396;Drinov?uša;Croatia;;;1m;1;Dysderidae;Stalagtia;sp. 4;Stalagtia sp. 4;793;43.548476;16.638636;Tb;deep cave;43.54847616.638636;4;;;;;;;;;;;;;;;;;;;;;;
2397;Pe? u ?ulinovim raljevinama;Croatia;4.8.2007.;2007-08-04;2 juv;2;Dysderidae;Stalagtia;sp. 4;Stalagtia sp. 4;;43.605854;16.575066;Tb;deep cave;43.60585416.575066;5;;;;;;;;;;;;;;;;;;;;;;
2398;Lokvina špilja;Croatia;7.5.2005.;2005-05-07;1f, 1 juv;2;Dysderidae;Stalagtia;sp. 4;Stalagtia sp. 4;;43.680442;16.406697;Tb;deep cave;43.68044216.406697;1;;;;;;;;;;;;;;;;;;;;;;
2399;Stražbenica;Croatia;29.3.2005.;2005-03-29;2 juv;2;Dysderidae;Stalagtia;sp. 4;Stalagtia sp. 4;;43.697353;16.029618;Tb;deep cave;43.69735316.029618;3;;;;;;;;;;;;;;;;;;;;;;
2400;Stara jametina;Croatia;7.1.2005.;2005-01-07;1f, 2 juv;3;Dysderidae;Stalagtia;sp. 4;Stalagtia sp. 4;;43.794009;16.00259;Tb;deep cave;43.79400916.00259;6;;;;;;;;;;;;;;;;;;;;;;
2401;Jama na Ka?inama;Croatia;15.7.1999.;1999-07-15;1 juv;1;Dysderidae;Stalagtia;sp. 4;Stalagtia sp. 4;;43.58848;16.914982;Tb;deep cave;43.5884816.914982;1;;;;;;;;;;;;;;;;;;;;;;
2403;Rastova?a;Croatia;28.9.2006.;2006-09-28;1m;1;Dysderidae;Parastalita;stygia;Parastalita stygia;380;44.233742;15.698969;Tb;deep cave;44.23374215.698969;2;;;;;;;;;;;;;;;;;;;;;;
2404;Špilja na Kamenitoj glavici;Croatia;23.3.1997.;1997-03-23;1 juv;1;Dysderidae;Stalita;pretneri;Stalita pretneri;;45.336025;14.681765;Tb;deep cave;45.33602514.681765;1;;;;;;;;;;;;;;;;;;;;;;
2405;Gornja Cerova?ka špilja;Croatia;4.12.2011.;2011-12-04;1m;1;Dysderidae;Stalita;pretneri;Stalita pretneri;700;44.273382;15.884227;Tb;deep cave;44.27338215.884227;2;;;;;;;;;;;;;;;;;;;;;;
2406;Topla pe?ina;Croatia;7.1.2005.;2005-01-07;4 juv;4;Dysderidae;Stalagtia;sp. 4;Stalagtia sp. 4;;43.839254;16.0536;Tb;deep cave;43.83925416.0536;4;;;;;;;;;;;;;;;;;;;;;;
2407;Grizeljeva jama;Croatia;8.8.2007.;2007-08-08;3f, 1 juv m, 1 juv;5;Linyphiidae;Troglohyphantes;svilajensis;Troglohyphantes svilajensis;;43.867534;16.399097;tb;deep cave;43.86753416.399097;5;;;;;;;;;;;;;;;;;;;;;;
2408;Grizeljeva jama;Croatia;8.8.2007.;2007-08-08;2m, 2f;4;Linyphiidae;Troglohyphantes;svilajensis;Troglohyphantes svilajensis;;43.867534;16.399097;tb;deep cave;43.86753416.399097;5;;;;;;;;;;;;;;;;;;;;;;
2409;Bali?a špilja;Croatia;4.8.2007.;2007-08-04;6f, 3m, 1juv;1;Linyphiidae;Troglohyphantes;giromettai;Troglohyphantes giromettai;405;43.57296;16.57002;tf;deep cave;43.5729616.57002;11;7,2;;;;;;;;;;;;;;;;;;;;;
2411;Bali?a špilja;Croatia;15.6.2011.;2011-06-15;1m;1;Linyphiidae;Troglohyphantes;giromettai;Troglohyphantes giromettai;405;43.57296;16.57002;tf;deep cave;43.5729616.57002;11;7,2;;;;;;;;;;;;;;;;;;;;;
2412;Bali?a špilja;Croatia;4.8.2007.;2007-08-04;1m;1;Linyphiidae;Troglohyphantes;giromettai;Troglohyphantes giromettai;405;43.57296;16.57002;tf;deep cave;43.5729616.57002;11;7,2;;;;;;;;;;;;;;;;;;;;;
2413;Bali?a špilja;Croatia;15.6.2011.;2011-06-15;1m, 1 juv m;2;Linyphiidae;Troglohyphantes;giromettai;Troglohyphantes giromettai;405;43.57296;16.57002;tf;deep cave;43.5729616.57002;11;7,2;;;;;;;;;;;;;;;;;;;;;
2414;Bali?a špilja;Croatia;1.10.2006.;2006-10-01;1f;1;Linyphiidae;Troglohyphantes;strandi;Troglohyphantes strandi;405;43.57296;16.57002;tb;deep cave;43.5729616.57002;11;7,2;;;;;;;;;;;;;;;;;;;;;
2417;Vranja?a špilja kod Dugopolja;Croatia;1.8.2007.;2007-08-01;1 juv m, 1 juv;2;Linyphiidae;Troglohyphantes;strandi;Troglohyphantes strandi;445;43.562235;16.648216;tb;deep cave;43.56223516.648216;5;;;;;;;;;;;;;;;;;;;;;;
2418;Vranja?a špilja kod Dugopolja;Croatia;25.6.2011.;2011-06-25;2 juv m;2;Linyphiidae;Troglohyphantes;strandi;Troglohyphantes strandi;445;43.562235;16.648216;tb;deep cave;43.56223516.648216;5;;;;;;;;;;;;;;;;;;;;;;
2419;Vranja?a špilja kod Dugopolja;Croatia;26.10.2007.;2007-10-26;2 juv;2;Linyphiidae;Troglohyphantes;strandi;Troglohyphantes strandi;445;43.562235;16.648216;tb;deep cave;43.56223516.648216;5;;;;;;;;;;;;;;;;;;;;;;
2422;Vranja?a špilja kod Dugopolja;Croatia;26.10.2007.;2007-10-26;1f;1;Linyphiidae;Troglohyphantes;strandi;Troglohyphantes strandi;445;43.562235;16.648216;tb;deep cave;43.56223516.648216;5;;;;;;;;;;;;;;;;;;;;;;
2423;Vranja?a špilja kod Dugopolja;Croatia;26.10.2007.;2007-10-26;1 juv;1;Linyphiidae;Troglohyphantes;strandi;Troglohyphantes strandi;445;43.562235;16.648216;tb;deep cave;43.56223516.648216;5;;;;;;;;;;;;;;;;;;;;;;
2424;Vranja?a špilja kod Dugopolja;Croatia;22.6.2011.;2011-06-22;1juv f, 2 juv;3;Linyphiidae;Troglohyphantes;strandi;Troglohyphantes strandi;445;43.562235;16.648216;tb;deep cave;43.56223516.648216;5;;;;;;;;;;;;;;;;;;;;;;
2425;Vranja?a špilja kod Dugopolja;Croatia;24.6.2011.;2011-06-24;1f;1;Linyphiidae;Troglohyphantes;strandi;Troglohyphantes strandi;445;43.562235;16.648216;tb;deep cave;43.56223516.648216;5;;;;;;;;;;;;;;;;;;;;;;
2426;Makluta?a;Croatia;24.6.2011.;2011-06-24;1m, 1f;2;Linyphiidae;Troglohyphantes;strandi;Troglohyphantes strandi;400;43.569268;16.620515;tb;deep cave;43.56926816.620515;6;;;;;;;;;;;;;;;;;;;;;;
2427;Makluta?a;Croatia;15.6.2011.;2011-06-15;1m;1;Linyphiidae;Troglohyphantes;giromettai;Troglohyphantes giromettai;400;43.569268;16.620515;tf;deep cave;43.56926816.620515;6;;;;;;;;;;;;;;;;;;;;;;
2428;Makluta?a;Croatia;24.6.2011.;2011-06-24;2f, 1m;3;Linyphiidae;Troglohyphantes;strandi;Troglohyphantes strandi;400;43.569268;16.620515;tb;deep cave;43.56926816.620515;6;;;;;;;;;;;;;;;;;;;;;;
2429;Golubinka, Vu?evica;Croatia;6.8.2007.;2007-08-06;1m, 1f;2;Linyphiidae;Troglohyphantes;strandi;Troglohyphantes strandi;;43.583491;16.413783;tb;deep cave;43.58349116.413783;1;;;;;;;;;;;;;;;;;;;;;;
2430;Pe? u ?ulinovim raljevinama;Croatia;4.8.2007.;2007-08-04;1m, 2f;3;Linyphiidae;Troglohyphantes;strandi;Troglohyphantes strandi;;43.605854;16.575066;tb;deep cave;43.60585416.575066;5;;;;;;;;;;;;;;;;;;;;;;
2431;Pe? u ?ulinovim raljevinama;Croatia;25.6.2011.;2011-06-25;1juv;1;Linyphiidae;Troglohyphantes;strandi;Troglohyphantes strandi;;43.605854;16.575066;tb;deep cave;43.60585416.575066;5;;;;;;;;;;;;;;;;;;;;;;
2432;Sniježnica pod Ljubljanom;Croatia;3.8.2007.;2007-08-03;1f;1;Linyphiidae;Troglohyphantes;dalmaticus;Troglohyphantes dalmaticus;;43.537964;16.616241;tf;deep cave;43.53796416.616241;1;;;;;;;;;;;;;;;;;;;;;;
2433;Špilja iznad Velikog Bresta;Croatia;21.12.2008.;2008-12-21;1m, 1f;2;Linyphiidae;Troglohyphantes;brignolii;Troglohyphantes brignolii;743;45.429588;14.095256;tb;deep cave;45.42958814.095256;3;;;;;;;;;;;;;;;;;;;;;;
2435;Vranja?a špilja kod Dugopolja;Croatia;1.8.2007.;2007-08-01;2f;2;Linyphiidae;Troglohyphantes;strandi;Troglohyphantes strandi;445;43.562235;16.648216;tb;deep cave;43.56223516.648216;5;;;;;;;;;;;;;;;;;;;;;;
2436;Golubnja?a, Žegar;Croatia;2.8.2006.;2006-08-02;1f;1;Linyphiidae;Troglohyphantes;roberti;Troglohyphantes roberti;243;44.131933;15.851054;tb;deep cave;44.13193315.851054;6;;;;;;;;;;;;;;;;;;;;;;
2439;Golubnja?a, Žegar;Croatia;2.8.2006.;2006-08-02;1f;1;Linyphiidae;Troglohyphantes;roberti;Troglohyphantes roberti;243;44.131933;15.851054;tb;deep cave;44.13193315.851054;6;;;;;;;;;;;;;;;;;;;;;;
2445;Gornja Cerova?ka špilja;Croatia;28.7.2007.;2007-07-28;1 juv m;1;Linyphiidae;Troglohyphantes;roberti;Troglohyphantes roberti;700;44.27338;15.88422;tb;deep cave;44.2733815.88422;5;;;;;;;;;;;;;;;;;;;;;;
2446;Zveka?a jama;Croatia;19.2.2010.;2010-02-19;2 juv;2;Dysderidae;Stalagtia;sp. 4;Stalagtia sp. 4;;43.67716;16.095044;Tb;deep cave;43.6771616.095044;1;;;;;;;;;;;;;;;;;;;;;;
2447;Zveka?a jama;Croatia;27.10.2010.;2010-10-27;1 juv;1;Dysderidae;Stalagtia;sp. 4;Stalagtia sp. 4;;43.67716;16.095044;Tb;deep cave;43.6771616.095044;1;;;;;;;;;;;;;;;;;;;;;;
2448;Zveka?a jama;Croatia;27.10.2010.;2010-10-27;1f;1;Dysderidae;Stalagtia;sp. 4;Stalagtia sp. 4;;43.67716;16.095044;Tb;deep cave;43.6771616.095044;1;;;;;;;;;;;;;;;;;;;;;;
2449;Stražbenica;Croatia;29.3.2005.;2005-03-29;3 juv;3;Dysderidae;Stalagtia;sp. 4;Stalagtia sp. 4;;43.697353;16.029618;Tb;deep cave;43.69735316.029618;3;;;;;;;;;;;;;;;;;;;;;;
2450;Špilja Sv. Filipa i Jakoba;Croatia;5.5.2005.;2005-05-05;1m;1;Dysderidae;Stalagtia;sp. 4;Stalagtia sp. 4;;43.521135;16.091237;Tb;deep cave;43.52113516.091237;5;;;;;;;;;;;;;;;;;;;;;;
2451;Jama na Grabiku;Croatia;25.11.2007.;2007-11-25;1m;1;Dysderidae;Stalita;hadzii;Stalita hadzii;;45.700607;15.293363;Tb;deep cave;45.70060715.293363;1;;;;;;;;;;;;;;;;;;;;;;
2452;Jama na vrhu Malog Šibenika;Croatia;19.6.2011.;2011-06-19;1m;1;Agelenidae;Histopona;conveniens;Histopona conveniens;;43.281102;17.233483;Tf;deep cave;43.28110217.233483;2;;;;;;;;;;;;;;;;;;;;;;
2455;Stražbenica;Croatia;3.5.2009.;2009-05-03;1 juv;1;Dysderidae;Stalagtia;sp. 4;Stalagtia sp. 4;;43.697353;16.029618;Tb;deep cave;43.69735316.029618;3;;;;;;;;;;;;;;;;;;;;;;
2456;Jeremika;Croatia;14.5.2005.;2005-05-14;2juv;2;Dysderidae;Stalagtia;sp. 4;Stalagtia sp. 4;;43.57057;16.41436;Tb;deep cave;43.5705716.41436;1;;;;;;;;;;;;;;;;;;;;;;
2458;Topla pe?ina;Croatia;29.7.2006.;2006-07-29;1m;1;Tetragnathidae;Meta;bourneti;Meta bourneti;;43.839254;16.0536;Tf;deep cave;43.83925416.0536;4;;;;;;;;;;;;;;;;;;;;;;
2459;Velika špilja kod Neori?a;Croatia;31.7.2007.;2007-07-31;1 juv m;1;Agelenidae;Tegenaria;sp.;Tegenaria sp.;703;43.686117;16.55312;;deep cave;43.68611716.55312;2;;;;;;;;;;;;;;;;;;;;;;
2461;Rupa u uvali Kozja;Croatia;11.4.2007.;2007-04-11;1f;1;Tetragnathidae;Meta;bourneti;Meta bourneti;;43.117027;16.971541;Tf;deep cave;43.11702716.971541;1;;;;;;;;;;;;;;;;;;;;;;
2462;Žejava jama;Croatia;23.10.2007.;2007-10-23;1juv f;1;Linyphiidae;Palliduphantes;sp.;Palliduphantes sp.;;43.284633;16.804046;;;43.28463316.804046;1;;;;;;;;;;;;;;;;;;;;;;
2465;Špilja pod Velji vrh;Croatia;25.4.2004.;2004-04-25;1 juv;1;Linyphiidae;Typhlonyphia;reimoseri;Typhlonyphia reimoseri;;42.953716;17.039919;tb;deep cave;42.95371617.039919;2;;;;;;;;;;;;;;;;;;;;;;
2467;Jama na Odvoru;Croatia;26.4.2004.;2004-04-26;1 juv;1;Linyphiidae;Typhlonyphia;reimoseri;Typhlonyphia reimoseri;;42.96718;16.999758;tb;deep cave;42.9671816.999758;2;;;;;;;;;;;;;;;;;;;;;;
2469;Samograd;Croatia;26.4.2004.;2004-04-26;1f;1;Linyphiidae;Gen.;sp. X;Gen. sp. X;;42.970451;16.995978;;;42.97045116.995978;4;;;;;;;;;;;;;;;;;;;;;;
2470;Požarova jama;Croatia;25.8.1997.;1997-08-25;1juvm;1;Dysderidae;Stalagtia;sp. 4;Stalagtia sp. 4;;43.058834;17.560907;Tb;deep cave;43.05883417.560907;1;;;;;;;;;;;;;;;;;;;;;;
2471;Špilja na Zalokavlju;Croatia;17.7.1997.;1997-07-17;1 juv;1;Dysderidae;Stalagtia;sp. 4_1;Stalagtia sp. 4_1;;42.968227;17.527103;Tb;deep cave;42.96822717.527103;1;;;;;;;;;;;;;;;;;;;;;;
2472;Špilja kod sela Kremena;Croatia;7.1.1998.;1998-01-07;1 juv;1;Dysderidae;Stalagtia;sp. 4_1;Stalagtia sp. 4_1;35;42.972502;17.500681;Tb;deep cave;42.97250217.500681;1;;;;;;;;;;;;;;;;;;;;;;
2473;Tunel Krotuša;Croatia;24.6.2010.;2010-06-24;1 m;1;Filistatidae;Filistata;insidiatrix;Filistata insidiatrix;;43.083;17.43399;;;43.08317.43399;1;;;;;;;;;;;;;;;;;;;;;;
2474;Jasena ponor;Croatia;4.8.2010.;2010-08-04;1f, 1 juv;2;Linyphiidae;Typhlonyphia;sp. 1;Typhlonyphia sp. 1;;43.221246;17.2767;Tb;deep cave;43.22124617.2767;2;;;;;;;;;;;;;;;;;;;;;;
2475;Pišurka;Croatia;26.12.2009.;2009-12-26;1 juv m;1;Dysderidae;Folkia;haasi;Folkia haasi;;42.959451;17.129228;Tb;deep cave;42.95945117.129228;5;;;;;;;;;;;;;;;;;;;;;;
2476;Pišurka;Croatia;26.12.2009.;2009-12-26;1 juv;1;Dysderidae;Folkia;haasi;Folkia haasi;;42.959451;17.129228;Tb;deep cave;42.95945117.129228;5;;;;;;;;;;;;;;;;;;;;;;
2477;Špilja u uvali Predpe?;Croatia;9.7.2007.;2007-07-09;1f;1;Dysderidae;Stalita;taenaria;Stalita taenaria;;45.291576;14.510419;Tb;deep cave;45.29157614.510419;4;;;;;;;;;;;;;;;;;;;;;;
2478;Nakovana spila;Croatia;25.9.2009.;2009-09-25;1f/juv, 2 juv;3;Dysderidae;Stalagtia;hercegovinensis;Stalagtia hercegovinensis;390;43.005018;17.091068;Tb;deep cave;43.00501817.091068;4;;;;;;;;;;;;;;;;;;;;;;
2479;Miki?a jama;Croatia;24.1.2010.;2010-01-24;1f;1;Dysderidae;Parastalita;stygia;Parastalita stygia;;45.279338;15.49413;Tb;deep cave;45.27933815.49413;2;;;;;;;;;;;;;;;;;;;;;;
2480;Vutla pe?;Croatia;18.5.2009.;2009-05-18;1m, 2 juv;3;Dysderidae;Harpactea;hombergi;Harpactea hombergi;;46.211188;15.954292;Tx;deep cave;46.21118815.954292;1;;;;;;;;;;;;;;;;;;;;;;
2481;Jama pod Kola?;Croatia;25.4.2004.;2004-04-25;2 juv;2;Dysderidae;Folkia;haasi;Folkia haasi;;42.922084;17.123592;Tb;deep cave;42.92208417.123592;1;;;;;;;;;;;;;;;;;;;;;;
2482;Ostaševica;Croatia;17.6.2001.;2001-06-17;1f;1;Dysderidae;Folkia;inermis;Folkia inermis;;42.748959;17.544404;Tb;deep cave;42.74895917.544404;9;11,6;;;;;;;;;;;;;;;;;;;;;
2483;Markova špilja, Hvar;Croatia;6.5.2011.;2011-05-06;5 juv;5;Nesticidae;Kryptonesticus;eremita;Kryptonesticus eremita;;43.190585;16.402907;tf;deep cave;43.19058516.402907;8;;;;;;;;;;;;;;;;;;;;;;
2485;Živa voda;Croatia;5.5.2011.;2011-05-05;2 juv;2;Nesticidae;Kryptonesticus;eremita;Kryptonesticus eremita;;43.116808;17.050393;tf;deep cave;43.11680817.050393;1;;;;;;;;;;;;;;;;;;;;;;
2486;Podarjuša;Croatia;5.5.2011.;2011-05-05;1 juv;1;Agelenidae;Hadites;tegenarioides;Hadites tegenarioides;;43.143173;16.842272;;deep cave;43.14317316.842272;2;;;;;;;;;;;;;;;;;;;;;;
2487;Podarjuša;Croatia;5.5.2011.;2011-05-05;1f;1;Nesticidae;Kryptonesticus;eremita;Kryptonesticus eremita;;43.143173;16.842272;;deep cave;43.14317316.842272;2;;;;;;;;;;;;;;;;;;;;;;
2488;Grap?eva špilja;Croatia;3.5.2011.;2011-05-03;1 juv;1;Nesticidae;Kryptonesticus;eremita;Kryptonesticus eremita;200;43.134189;16.753732;tf;deep cave;43.13418916.753732;5;;;13,93333333;;;;;;;;;;;;;;;;;;;
2493;Grap?eva špilja;Croatia;5.5.2011.;2011-05-05;2 juv;2;Agelenidae;Hadites;tegenarioides;Hadites tegenarioides;200;43.134189;16.753732;TB;deep cave;43.13418916.753732;5;;;13,93333333;;;;;;;;;;;;;;;;;;;
2494;Grap?eva špilja;Croatia;5.5.2011.;2011-05-05;1m, 5 juv;6;Nesticidae;Kryptonesticus;eremita;Kryptonesticus eremita;200;43.134189;16.753732;tf;deep cave;43.13418916.753732;5;;;13,93333333;;;;;;;;;;;;;;;;;;;
2495;Kraljevska jama na Gulišini;Croatia;5.5.2011.;2011-05-05;1f, 1 juv;2;Nesticidae;Kryptonesticus;eremita;Kryptonesticus eremita;;43.133120;16.744319;tf;deep cave;43.13312016.744319;3;;;;;;;;;;;;;;;;;;;;;;
2497;Markova špilja, Hvar;Croatia;6.5.2011.;2011-05-06;3 juv;3;Nesticidae;Kryptonesticus;eremita;Kryptonesticus eremita;;43.190585;16.402907;tf;deep cave;43.19058516.402907;8;;;;;;;;;;;;;;;;;;;;;;
2498;Kraljevska jama na Gulišini;Croatia;5.5.2011.;2011-05-05;1f;1;Nesticidae;Kryptonesticus;eremita;Kryptonesticus eremita;;43.133120;16.744319;tf;deep cave;43.13312016.744319;3;;;;;;;;;;;;;;;;;;;;;;
2500;Grap?eva špilja;Croatia;3.5.2011.;2011-05-03;1f, 1 juv;2;Leptonetidae;Barusia;insulana;Barusia insulana;200;43.134189;16.753732;tb;deep cave;43.13418916.753732;5;;;13,93333333;;;;;;;;;;;;;;;;;;;
2502;Grap?eva špilja;Croatia;3.5.2011.;2011-05-03;4 juv;4;Nesticidae;Kryptonesticus;eremita;Kryptonesticus eremita;200;43.134189;16.753732;tf;deep cave;43.13418916.753732;5;;;13,93333333;;;;;;;;;;;;;;;;;;;
2503;Podarjuša;Croatia;5.5.2011.;2011-05-05;1 juv;1;Nesticidae;Kryptonesticus;eremita;Kryptonesticus eremita;;43.143173;16.842272;;deep cave;43.14317316.842272;2;;;;;;;;;;;;;;;;;;;;;;
2504;Podarjuša;Croatia;5.5.2011.;2011-05-05;1 juv;1;Agelenidae;Hadites;tegenarioides;Hadites tegenarioides;;43.143173;16.842272;;deep cave;43.14317316.842272;2;;;;;;;;;;;;;;;;;;;;;;
2510;Špilja pod Kapelu;Croatia;2.5.2011.;2011-05-02;1 juv;1;Agelenidae;Hadites;tegenarioides;Hadites tegenarioides;;43.184949;16.434233;TB;deep cave;43.18494916.434233;5;;;;;;;;;;;;;;;;;;;;;;
2511;Grap?eva špilja;Croatia;3.5.2011.;2011-05-03;1 juv;1;Nesticidae;Kryptonesticus;eremita;Kryptonesticus eremita;200;43.134189;16.753732;tf;deep cave;43.13418916.753732;5;;;13,93333333;;;;;;;;;;;;;;;;;;;
2512;Grap?eva špilja;Croatia;3.5.2011.;2011-05-03;1f;1;Pholcidae;Stygopholcus;absoloni;Stygopholcus absoloni;200;43.134189;16.753732;;deep cave;43.13418916.753732;5;;;13,93333333;;;;;;;;;;;;;;;;;;;
2513;Špilja u Grli?u;Croatia;3.5.2011.;2011-05-03;1f;1;Pholcidae;Stygopholcus;absoloni;Stygopholcus absoloni;;43.158023;16.813636;;deep cave;43.15802316.813636;4;;;;;;;;;;;;;;;;;;;;;;
2514;Ružova?a;Croatia;1.3.1998.;1998-03-01;1f;1;Dysderidae;Stalagtia;sp. 4;Stalagtia sp. 4;390;43.229968;17.417439;Tb;deep cave;43.22996817.417439;1;;;;;;;;;;;;;;;;;;;;;;
2515;Špilja za Groma?kom vlakom;Croatia;25-26.6 2003.;2003-06-25/2003-06-26;1f;1;Dysderidae;Stalagtia;hercegovinensis;Stalagtia hercegovinensis;605;42.743509;18.027359;Tb;deep cave;42.74350918.027359;15;;;13,63043478;;;;;;;;;;;;;;;;;;;
2516;Šolkina jama;Croatia;1.12.2009.;2009-12-01;1 juv;1;Dysderidae;Stalagtia;sp. 4_1;Stalagtia sp. 4_1;230;42.966544;17.662484;Tb;deep cave;42.96654417.662484;4;;;;;;;;;;;;;;;;;;;;;;
2517;Vilina špilja-Izvor Omble;Croatia;22.6.2009.;2009-06-22;1 juv;1;Dysderidae;Stalagtia;sp. 2;Stalagtia sp. 2;;42.67716;18.136236;Tb;deep cave;42.6771618.136236;5;;;14,2;;;;;;;;;;;;;;;;;;;
2518;Višti?ina jama;Croatia;16.7.2009.;2009-07-16;1 juv m, 2 juv;3;Dysderidae;Stalagtia;sp. 4_1;Stalagtia sp. 4_1;200;42.985281;17.557541;Tb;deep cave;42.98528117.557541;3;;;;;;;;;;;;;;;;;;;;;;
2519;Jama Velika;Croatia;2.12.2009.;2009-12-02;1f;1;Dysderidae;Stalagtia;sp. 4_1;Stalagtia sp. 4_1;;42.971034;17.655644;Tb;deep cave;42.97103417.655644;1;;;;;;;;;;;;;;;;;;;;;;
2520;Vilina špilja-Izvor Omble;Croatia;11.8.2000.;2000-08-11;5 juv;5;Dysderidae;Stalagtia;sp. 2;Stalagtia sp. 2;137;42.67716;18.136236;Tb;deep cave;42.6771618.136236;5;;;14,2;;;;;;;;;;;;;;;;;;;
2523;Ra?a špilja;Croatia;31.10.1999.;1999-10-31;1f, 2 juv;3;Dysderidae;Folkia;sp. 2;Folkia sp. 2;;42.734493;16.910785;Tb;deep cave;42.73449316.910785;4;;16,5;14,42;;;;;;;;;;;;;;;;;;;
2524;Mala špilja, Blato;Croatia;19.6.2001.;2001-06-19;1m, 1f, 6 juv;8;Dysderidae;Folkia;inermis;Folkia inermis;;42.764498;17.471054;Tb;deep cave;42.76449817.471054;5;;;;;;;;;;;;;;;;;;;;;;
2525;Mala špilja, Blato;Croatia;19.6.2001.;2001-06-19;1m, 1f, 3 juv;5;Leptonetidae;Sulcia;nocturna;Sulcia nocturna;;42.764498;17.471054;;deep cave;42.76449817.471054;5;;;;;;;;;;;;;;;;;;;;;;
2526;Jama Jekavica;Croatia;1.3.1998.;1998-03-01;1f;1;Dysderidae;Stalagtia;sp. 4;Stalagtia sp. 4;;43.235773;17.368007;Tb;deep cave;43.23577317.368007;2;;;;;;;;;;;;;;;;;;;;;;
2527;Jama Jekavica;Croatia;1.3.1998.;1998-03-01;1f;1;Linyphiidae;Palliduphantes;spelaeorum;Palliduphantes spelaeorum;;43.235773;17.368007;Tf;deep cave;43.23577317.368007;2;;;;;;;;;;;;;;;;;;;;;;
2528;Jama pod Velji vrh;Croatia;14.6.2001.;2001-06-14;1m, 2f, 1juvm, 2juv;6;Dysderidae;Folkia;sp. 2;Folkia sp. 2;;42.766635;16.907278;Tb;deep cave;42.76663516.907278;2;;16,1;17,425;;;;;;;;;;;;;;;;;;;
2530;Špilja za Groma?kom vlakom;Croatia;29.5.2004.;2004-05-29;1m, 2f, 2juv;5;Dysderidae;Stalagtia;hercegovinensis;Stalagtia hercegovinensis;605;42.743509;18.027359;Tb;deep cave;42.74350918.027359;15;;;13,63043478;;;;;;;;;;;;;;;;;;;
2532;Male ponte;Croatia;21.6.2001.;2001-06-21;4 juv;4;Dysderidae;Folkia;sp. 5;Folkia sp. 5;;42.761389;17.430786;Tb;deep cave;42.76138917.430786;7;;14;14,6;;;;;;;;;;;;;;;;;;;
2534;Višti?ina jama;Croatia;8.2.1998.;1998-02-08;2 juv;2;Dysderidae;Stalagtia;sp. 4_1;Stalagtia sp. 4_1;200;42.985281;17.557541;Tb;deep cave;42.98528117.557541;3;;;;;;;;;;;;;;;;;;;;;;
2535;Jama u šumi uvale Bjejajka;Croatia;18.6.2011.;2011-06-18;1f, 3 juv m, 1 juv f;5;Linyphiidae;Palliduphantes;sp. 1;Palliduphantes sp. 1;;42.765231;17.385606;tf;deep cave;42.76523117.385606;6;;;;;;;;;;;;;;;;;;;;;;
2537;Jama u šumi uvale Bjejajka;Croatia;18.6.2011.;2011-06-18;1f;1;Dysderidae;Harpactea;sp. 26;Harpactea sp. 26;;42.765231;17.385606;;;42.76523117.385606;6;;;;;;;;;;;;;;;;;;;;;;
2538;Jama u šumi uvale Bjejajka;Croatia;18.6.2011.;2011-06-18;1m;1;Segestriidae;Segestria;sp. 1;Segestria sp. 1;;42.765231;17.385606;;;42.76523117.385606;6;;;;;;;;;;;;;;;;;;;;;;
2540;Jama pod Sv. Spasom;Croatia;20.6.2001.;2001-06-20;1f, 1 juv m, 1 juv;3;Linyphiidae;Palliduphantes;sp. 1;Palliduphantes sp. 1;;42.731779;17.542409;tf;deep cave;42.73177917.542409;6;;;;;;;;;;;;;;;;;;;;;;
2541;Jama pod Sv. Spasom;Croatia;20.6.2001.;2001-06-20;5 juv;5;Dysderidae;Folkia;inermis;Folkia inermis;;42.731779;17.542409;Tb;deep cave;42.73177917.542409;6;;;;;;;;;;;;;;;;;;;;;;
2542;Velika špilja, Blato;Croatia;19.6.2001.;2001-06-19;1m, 1 juvf, 2juv;4;Leptonetidae;Barusia;maheni;Barusia maheni;;42.76443;17.471825;tf;deep cave;42.7644317.471825;8;;;;;;;;;;;;;;;;;;;;;;
2543;Velika špilja, Blato;Croatia;19.6.2001.;2001-06-19;3 juv;3;Dysderidae;Folkia;inermis;Folkia inermis;;42.76443;17.471825;Tb;deep cave;42.7644317.471825;8;;;;;;;;;;;;;;;;;;;;;;
2544;Tabaina špilja;Croatia;19.4.2011.;2011-04-19;1 juv;1;Nesticidae;Kryptonesticus;eremita;Kryptonesticus eremita;;42.969749;16.71696;;deep cave;42.96974916.71696;1;;;;;;;;;;;;;;;;;;;;;;
2545;Spilja od Bilosoja;Croatia;8.5.2005.;2005-05-08;1 juv;1;Dysderidae;Stalagtia;sp. 4;Stalagtia sp. 4;;43.512286;16.260705;Tb;deep cave;43.51228616.260705;1;;;;;;;;;;;;;;;;;;;;;;
2546;Špilja u Solinama;Croatia;7.8.1996.;1996-08-07;1 juv;1;Dysderidae;Folkia;sp. 5;Folkia sp. 5;;42.768021;17.377062;Tb;deep cave;42.76802117.377062;5;;;7,6;;;;;;;;;;;;;;;;;;;
2547;?a?ina golubinka;Croatia;24.8.1997.;1997-08-24;3 juv;3;Dysderidae;Stalagtia;sp. 4;Stalagtia sp. 4;;43.10374;17.493279;Tb;deep cave;43.1037417.493279;1;;;;;;;;;;;;;;;;;;;;;;
2548;Špijaturica;Croatia;5.11.2008.;2008-11-05;1f;1;Leptonetidae;Barusia;maheni;Barusia maheni;;42.835204;17.806752;tf;deep cave;42.83520417.806752;3;;;;;;;;;;;;;;;;;;;;;;
2552;Jama Tre?a sre?a;Croatia;17.7.2003.;2003-07-17;1 juv;1;Dysderidae;Harpactea;sp.;Harpactea sp.;;44.74819;15.005114;;;44.7481915.005114;1;;;;;;;;;;;;;;;;;;;;;;
2556;Velika špilja kod Neori?a;Croatia;31.7.2007.;2007-07-31;1 juvm;1;Dysderidae;Harpactea;sp.;Harpactea sp.;703;43.686117;16.55312;;;43.68611716.55312;2;;;;;;;;;;;;;;;;;;;;;;
2557;Pe? u ?ulinovim raljevinama;Croatia;6.1.2009.;2009-01-06;1f;1;Linyphiidae;Centromerus;cavernarum;Centromerus cavernarum;;43.605854;16.575066;Tf;deep cave;43.60585416.575066;5;;;;;;;;;;;;;;;;;;;;;;
2558;Židovske jame;Croatia;7.7.2009.;2009-07-07;2f, 1 juv;3;Linyphiidae;Troglohyphantes;excavatus;Troglohyphantes excavatus;;45.997503;16.038982;tf;deep cave;45.99750316.038982;2;;;;;;;;;;;;;;;;;;;;;;
2563;Balan?ica;Croatia;7.10.2008.;2008-10-07;2f, 1m, 1juv;4;Leptonetidae;Barusia;maheni;Barusia maheni;;42.783131;17.357659;tf;deep cave;42.78313117.357659;1;;;;;;;;;;;;;;;;;;;;;;
2565;Jama u šumi uvale Bjejajka;Croatia;10.1.2008.;2008-01-10;2m, 1f, 2 juv f;5;Linyphiidae;Palliduphantes;sp. 1;Palliduphantes sp. 1;;42.765231;17.385606;tf;deep cave;42.76523117.385606;6;;;;;;;;;;;;;;;;;;;;;;
2566;Jama u šumi uvale Bjejajka;Croatia;10.1.2008.;2008-01-10;1f;1;Leptonetidae;Barusia;maheni;Barusia maheni;;42.765231;17.385606;tf;deep cave;42.76523117.385606;6;;;;;;;;;;;;;;;;;;;;;;
2568;Jama u šumi uvale Bjejajka;Croatia;10.1.2008.;2008-01-10;1f;1;Familia x;Gen.;sp.;Gen. sp.;;42.765231;17.385606;;;42.76523117.385606;6;;;;;;;;;;;;;;;;;;;;;;
2570;Golubnja?a, Žegar;Croatia;2.8.2006.;2006-08-02;1f;1;Linyphiidae;Centromerus;cavernarum;Centromerus cavernarum;243;44.131933;15.851054;Tf;deep cave;44.13193315.851054;6;;;;;;;;;;;;;;;;;;;;;;
2571;Jama na Visokoj;Croatia;18.10.2005.;2005-10-18;2 juv;2;Dysderidae;Harpactea;sp.;Harpactea sp.;;43.68201;16.607257;;;43.6820116.607257;3;;;;;;;;;;;;;;;;;;;;;;
2573;Špilja za Groma?kom vlakom;Croatia;5.10.2011.;2011-10-05;1 juv;1;Agelenidae;Histopona;sp.;Histopona sp.;605;42.743509;18.027359;;deep cave;42.74350918.027359;15;;;13,63043478;;;;;;;;;;;;;;;;;;;
2574;Špilja iznad Velikog Bresta;Croatia;21.12.2008.;2008-12-21;1f;1;Linyphiidae;Centromerus;cavernarum;Centromerus cavernarum;743;45.429588;14.095256;Tf;deep cave;45.42958814.095256;3;;;;;;;;;;;;;;;;;;;;;;
2575;Bobaj II;Croatia;3.10.2011.;2011-10-03;1f, 2 juv;3;Nesticidae;Kryptonesticus;eremita;Kryptonesticus eremita;;43.035229;17.600087;tf;deep cave;43.03522917.600087;3;;;;;;;;;;;;;;;;;;;;;;
2576;Bobaj II;Croatia;3.10.2011.;2011-10-03;1f;1;Linyphiidae;Palliduphantes;spelaeorum;Palliduphantes spelaeorum;;43.035229;17.600087;Tf;deep cave;43.03522917.600087;3;;;;;;;;;;;;;;;;;;;;;;
2577;Vranja?a špilja kod Dugopolja;Croatia;24.6.2011.;2011-06-24;1f;1;Linyphiidae;Palliduphantes;spelaeorum;Palliduphantes spelaeorum;445;43.562235;16.648216;Tf;deep cave;43.56223516.648216;5;;;;;;;;;;;;;;;;;;;;;;
2578;Špilja u uvali Predpe?;Croatia;9.7.2007.;2007-07-09;1f;1;Nesticidae;Kryptonesticus;eremita;Kryptonesticus eremita;;45.291576;14.510419;tf;deep cave;45.29157614.510419;4;;;;;;;;;;;;;;;;;;;;;;
2579;Grizeljeva jama;Croatia;30.4.2005.;2005-04-30;2 juv;2;Nesticidae;Kryptonesticus;eremita;Kryptonesticus eremita;;43.867534;16.399097;;deep cave;43.86753416.399097;5;;;;;;;;;;;;;;;;;;;;;;
2580;Špilja u Solinama;Croatia;8.1.2008.;2008-01-08;2m, 1 f;3;Leptonetidae;Barusia;maheni;Barusia maheni;;42.768021;17.377062;tf;deep cave;42.76802117.377062;5;;;7,6;;;;;;;;;;;;;;;;;;;
2583;Špilja za Groma?kom vlakom;Croatia;5.10.2011.;2011-10-05;1f;1;Agelenidae;Tegenaria;sp. X;Tegenaria sp. X;605;42.743509;18.027359;;deep cave;42.74350918.027359;15;;;13,63043478;;;;;;;;;;;;;;;;;;;
2584;Špilja za Groma?kom vlakom;Croatia;5.10.2011.;2011-10-05;1f, 1juv;2;Agelenidae;Histopona;dubia;Histopona dubia;605;42.743509;18.027359;tb;deep cave;42.74350918.027359;15;;;13,63043478;;;;;;;;;;;;;;;;;;;
2586;Jama Tu Fifti;Croatia;28.7.2001.;2001-07-28;2f;2;Dysderidae;Gen. 1;sp. 1;Gen. 1 sp. 1;1150;44.445011;15.246022;Tb;deep cave;44.44501115.246022;1;;;;;;;;;;;;;;;;;;;;;;
2587;Ledenica u Šugarskoj dulibi;Croatia;30.7. 2001.;2001-07-30;1f;1;Dysderidae;Parastalita;stygia;Parastalita stygia;1195;44.451173;15.248876;Tb;deep cave;44.45117315.248876;1;;;;;;;;;;;;;;;;;;;;;;
2588;Jama pod Bojinim kukom;Croatia;31.8.2001.;2001-08-31;2f;2;Dysderidae;Parastalita;stygia;Parastalita stygia;1100;44.349579;15.412948;Tb;deep cave;44.34957915.412948;2;;;;;;;;;;;;;;;;;;;;;;
2589;Ljiljanin sistem;Croatia;29.7.2005.;2005-07-29;1m;1;Dysderidae;Parastalita;stygia;Parastalita stygia;1215;44.487306;15.237074;Tb;deep cave;44.48730615.237074;2;;;;;;;;;;;;;;;;;;;;;;
2590;Ljiljanin sistem;Croatia;29.7.2005.;2005-07-29;1f;1;Dysderidae;Harpactea;sp. 23;Harpactea sp. 23;1215;44.487306;15.237074;;;44.48730615.237074;2;;;;;;;;;;;;;;;;;;;;;;
2592;Kapljarka;Croatia;8.6.2006.;2006-06-08;1f;1;Leptonetidae;Cataleptoneta;lingulata;Cataleptoneta lingulata;;44.294555;15.519648;tb;deep cave;44.29455515.519648;2;;;;;;;;;;;;;;;;;;;;;;
2595;Kad jaganjci utihnu;Croatia;5.6.2006.;2006-06-05;1f;1;Leptonetidae;Cataleptoneta;lingulata;Cataleptoneta lingulata;;44.365085;15.314841;tb;deep cave;44.36508515.314841;3;;;;;;;;;;;;;;;;;;;;;;
2596;Vaganka;Croatia;3.6.2006.;2006-06-03;1f, 1 juv m, 3 juv;5;Leptonetidae;Cataleptoneta;lingulata;Cataleptoneta lingulata;658;44.33853;15.43867;tb;deep cave;44.3385315.43867;5;;;12,05;;;;;;;;;;;;;;;;;;;
2597;Hircova jama;Croatia;2.5.2004.;2004-05-02;1 juv;1;Dysderidae;Stalita;pretneri;Stalita pretneri;;45.426113;14.664785;Tb;deep cave;45.42611314.664785;3;;;;;;;;;;;;;;;;;;;;;;
2598;Lokvarka;Croatia;1.2.2003.;2003-02-01;2 juv;2;Dysderidae;Parastalita;stygia;Parastalita stygia;775;45.361466;14.762671;Tb;deep cave;45.36146614.762671;2;;;;;;;;;;;;;;;;;;;;;;
2599;Gordanova jama;Croatia;23.4.1995.;1995-04-23;1m;1;Dysderidae;Parastalita;stygia;Parastalita stygia;875;45.455731;14.792266;Tb;deep cave;45.45573114.792266;2;;;;;;;;;;;;;;;;;;;;;;
2600;Lokvarka;Croatia;17.3.2007.;2007-03-17;1f;1;Dysderidae;Parastalita;stygia;Parastalita stygia;775;45.361466;14.762671;Tb;deep cave;45.36146614.762671;2;;;;;;;;;;;;;;;;;;;;;;
2601;Jama II kod Velikih Brisnica;Croatia;6.8.2005.;2005-08-06;1f;1;Dysderidae;Parastalita;stygia;Parastalita stygia;520;44.789027;14.918377;Tb;deep cave;44.78902714.918377;3;;;;;;;;;;;;;;;;;;;;;;
2603;Jama na vrtlu u Biljevini;Croatia;23.9.2005.;2005-09-23;1f;1;Dysderidae;Parastalita;stygia;Parastalita stygia;;44.921647;15.581161;Tb;deep cave;44.92164715.581161;2;;;;;;;;;;;;;;;;;;;;;;
2604;Velika pe?ina, Plaški;Croatia;29.7.2003.;2003-07-29;1 juv;1;Dysderidae;Parastalita;stygia;Parastalita stygia;;45.013517;15.407073;Tb;deep cave;45.01351715.407073;1;;;;;;;;;;;;;;;;;;;;;;
2605;Crna?ka špilja;Croatia;7.9.2002.;2002-09-07;1m;1;Dysderidae;Parastalita;stygia;Parastalita stygia;;45.058563;15.192941;Tb;deep cave;45.05856315.192941;2;;;;;;;;;;;;;;;;;;;;;;
2606;Gordanova jama;Croatia;23.4.2005.;2005-04-23;1 juv;1;Dysderidae;Parastalita;stygia;Parastalita stygia;875;45.455731;14.792266;Tb;deep cave;45.45573114.792266;2;;;;;;;;;;;;;;;;;;;;;;
2607;Mramornica, Lika;Croatia;30.5.1999.;1999-05-30;1m;1;Dysderidae;Parastalita;stygia;Parastalita stygia;;44.772186;15.181912;Tb;deep cave;44.77218615.181912;2;;;;;;;;;;;;;;;;;;;;;;
2609;Luška špilja;Croatia;3.7.2004.;2004-07-03;1f;1;Dysderidae;Parastalita;stygia;Parastalita stygia;620;45.224689;15.093741;Tb;deep cave;45.22468915.093741;2;;;;;;;;;;;;;;;;;;;;;;
2610;Pe?inik;Croatia;2.7.2004.;2004-07-02;1juv;1;Dysderidae;Parastalita;stygia;Parastalita stygia;;45.25813;15.198439;Tb;deep cave;45.2581315.198439;1;;;;;;;;;;;;;;;;;;;;;;
2611;Zagorska pe? kod Ogulina;Croatia;1.7.2004.;2004-07-01;1f, 1 juv;2;Dysderidae;Parastalita;stygia;Parastalita stygia;335;45.196851;15.219904;Tb;deep cave;45.19685115.219904;3;;;;;;;;;;;;;;;;;;;;;;
2612;Gornja Bara?eva;Croatia;15.5.2004.;2004-05-15;2 juv;2;Dysderidae;Stalita;pretneri;Stalita pretneri;;44.983895;15.721656;Tb;deep cave;44.98389515.721656;8;;;;;;;;;;;;;;;;;;;;;;
2613;Per?evi?a špilja;Croatia;27.8.2004.;2004-08-27;1m;1;Dysderidae;Parastalita;stygia;Parastalita stygia;;45.242617;15.336296;Tb;deep cave;45.24261715.336296;3;;;;;;;;;;;;;;;;;;;;;;
2614;Zagorska pe? kod Ogulina;Croatia;9.7.2004.;2004-07-09;1m;1;Dysderidae;Parastalita;stygia;Parastalita stygia;335;45.196851;15.219904;Tb;deep cave;45.19685115.219904;3;;;;;;;;;;;;;;;;;;;;;;
2615;Sopa? špilja;Croatia;25.8.2004.;2004-08-25;1 juv;1;Dysderidae;Parastalita;stygia;Parastalita stygia;;45.048113;15.408131;Tb;deep cave;45.04811315.408131;1;;;;;;;;;;;;;;;;;;;;;;
2616;Vidovi?a špilja;Croatia;10.7.2004.;2004-07-10;1 juv;1;Dysderidae;Parastalita;stygia;Parastalita stygia;;45.14975;15.0993;Tb;deep cave;45.1497515.0993;2;;;;;;;;;;;;;;;;;;;;;;
2617;Jankovi?a špilja;Croatia;22.7.2004.;2004-07-22;1f, 1 juv;2;Dysderidae;Parastalita;stygia;Parastalita stygia;;44.931328;15.708023;Tb;deep cave;44.93132815.708023;1;;;;;;;;;;;;;;;;;;;;;;
2618;Obilježena jama;Croatia;20.6.2003.;2003-06-20;1f;1;Theridiidae;Paidiscura;pallens;Paidiscura pallens;;43.36813;17.026024;;;43.3681317.026024;2;;;;;;;;;;;;;;;;;;;;;;
2619;Krjava 2;Croatia;27.10.2006.;2006-10-27;1f;1;Anapidae;Comaroma;sp. 1;Comaroma sp. 1;903;43.329431;17.027011;tb;deep cave;43.32943117.027011;3;;;;;;;;;;;;;;;;;;;;;;
2620;Vodena trepetljika;Croatia;20.6.2003.;2003-06-20;1f;1;Theridiidae;Paidiscura;pallens;Paidiscura pallens;;43.364147;17.029715;;;43.36414717.029715;1;;;;;;;;;;;;;;;;;;;;;;
2621;Spila 2;Croatia;23.3.2004.;2004-03-23;1m, 1f;2;Mysmenidae;Trogloneta;granulum;Trogloneta granulum;;43.26239;17.204021;Tf;deep cave;43.2623917.204021;6;;;;;;;;;;;;;;;;;;;;;;
2622;Crna ledenica;Croatia;24.5.2004.;2004-05-24;1m;1;Linyphiidae;Gen. 5;sp. 1;Gen. 5 sp. 1;;43.348162;17.055328;;;43.34816217.055328;2;;;;;;;;;;;;;;;;;;;;;;
2623;Jama iznad Sarana?a;Croatia;2.4.2006.;2006-04-02;1f;1;Mysmenidae;Trogloneta;granulum;Trogloneta granulum;770;43.249007;17.174663;Tf;deep cave;43.24900717.174663;7;;;;;;;;;;;;;;;;;;;;;;
2625;Svetica;Croatia;22.5.2004.;2004-05-22;1m, 1f;2;Leptonetidae;Barusia;maheni;Barusia maheni;300;43.401143;16.894548;tf;deep cave;43.40114316.894548;5;;;;;;;;;;;;;;;;;;;;;;
2626;Bazgova?a;Croatia;26.10.2006.;2006-10-26;1f;1;Linyphiidae;Palliduphantes;spelaeorum;Palliduphantes spelaeorum;;43.30647;16.622143;Tf;deep cave;43.3064716.622143;3;;5;6,675;;;;;;;;;;;;;;;;;;;
2627;Bazgova?a;Croatia;4.8.2004.;2004-08-04;4f, 1 juvm, 1 juv f;6;Linyphiidae;Palliduphantes;spelaeorum;Palliduphantes spelaeorum;;43.30647;16.622143;Tf;deep cave;43.3064716.622143;3;;5;6,675;;;;;;;;;;;;;;;;;;;
2628;Bazgova?a;Croatia;26.10.2006.;2006-10-26;1f;1;Linyphiidae;Palliduphantes;spelaeorum;Palliduphantes spelaeorum;;43.30647;16.622143;Tf;deep cave;43.3064716.622143;3;;5;6,675;;;;;;;;;;;;;;;;;;;
2629;Bazgova?a;Croatia;5.1.2009.;2009-01-05;1m, 1 juv f;2;Tetragnathidae;Metellina;merianae;Metellina merianae;;43.30647;16.622143;Tf;deep cave;43.3064716.622143;3;;5;6,675;;;;;;;;;;;;;;;;;;;
2631;Šipun;Croatia;31.10.2003.;2003-10-31;1 juv;1;Dysderidae;Stalagtia;sp. 1;Stalagtia sp. 1;;42.583646;18.217986;Tb;deep cave;42.58364618.217986;11;16;;;;;;;;;;;;;;;;;;;;;
2632;Pišurka;Croatia;23.4.2004.;2004-04-23;2 juv;2;Dysderidae;Folkia;haasi;Folkia haasi;;42.959451;17.129228;Tb;deep cave;42.95945117.129228;5;;;;;;;;;;;;;;;;;;;;;;
2633;Pišurka;Croatia;2.6.2000.;2000-06-02;2 juv;2;Dysderidae;Folkia;haasi;Folkia haasi;;42.959451;17.129228;Tb;deep cave;42.95945117.129228;5;;;;;;;;;;;;;;;;;;;;;;
2634;Pišurka;Croatia;2.6.2000.;2000-06-02;1f, 1 juv f, 1 juv;3;Tetragnathidae;Metellina;merianae;Metellina merianae;;42.959451;17.129228;Tf;deep cave;42.95945117.129228;5;;;;;;;;;;;;;;;;;;;;;;
2635;?ampari;Croatia;29.11.2008.;2008-11-29;1m;1;Linyphiidae;Troglohyphantes;liburnicus;Troglohyphantes liburnicus;312;45.123809;14.333655;Tb;deep cave;45.12380914.333655;4;;;;;;;;;;;;;;;;;;;;;;
2636;?ulin ponor-Medvedica;Croatia;1.2.2008.;2008-02-01;1f, 2m;3;Linyphiidae;Porrhomma;convexum;Porrhomma convexum;320;45.267036;15.223745;Tf;deep cave;45.26703615.223745;3;;;;;;;;;;;;;;;;;;;;;;
2640;Bukovac;Croatia;7.7.2007.;2007-07-07;2f;2;Linyphiidae;Diplocephalus;cristatus;Diplocephalus cristatus;881;45.34318;14.757647;Tx;deep cave;45.3431814.757647;5;;;;;;;;;;;;;;;;;;;;;;
2642;Gornja Bara?eva;Croatia;21.7.2002.;2002-07-21;2m, 2f, 2 juv m;6;Linyphiidae;Centromerus;cavernarum;Centromerus cavernarum;;44.983895;15.721656;Tf;deep cave;44.98389515.721656;8;;;;;;;;;;;;;;;;;;;;;;
2649;Špilja na Gradini kod Premanture;Croatia;13.7.2005.;2005-07-13;? juv;1;Nesticidae;Kryptonesticus;eremita;Kryptonesticus eremita;;44.810188;13.9075;tf;deep cave;44.81018813.9075;1;;;;;;;;;;;;;;;;;;;;;;
2650;Golubnja?a, Bartulovi?i;Croatia;23.3.2003.;2003-03-23;2m;2;Leptonetidae;Sulcia;sp. 3;Sulcia sp. 3;;43.408559;16.942035;Tb;deep cave;43.40855916.942035;2;;;;;;;;;;;;;;;;;;;;;;
2651;Tu?epska vilenja?a;Croatia;23.5.2004.;2004-05-23;1juv m, 1juv f;2;Linyphiidae;Typhlonyphia;sp. 1;Typhlonyphia sp. 1;1181;43.286465;17.083638;Tb;deep cave;43.28646517.083638;8;;;;;;;;;;;;;;;;;;;;;;
2652;Škrabuljica;Croatia;23.6.2006.;2006-06-23;1f;1;Linyphiidae;Centromerus;subcaecus;Centromerus subcaecus;685;42.567045;18.385063;Tf;deep cave;42.56704518.385063;5;;8,1;11,025;;;;;;;;;;;;;;;;;;;
2653;Glogova jama;Croatia;24.8.2005.;2005-08-24;1juv m, 1 juv;2;Linyphiidae;Troglohyphantes;lesserti;Troglohyphantes lesserti;;42.573189;18.361688;tb;deep cave;42.57318918.361688;1;;;;;;;;;;;;;;;;;;;;;;
2656;Jama pod Perova?om;Croatia;5.4.2007.;2007-04-05;1 juv m;1;Dysderidae;Stalagtia;hercegovinensis;Stalagtia hercegovinensis;;42.757595;17.945265;Tb;deep cave;42.75759517.945265;1;;;;;;;;;;;;;;;;;;;;;;
2657;Jama u Mikulin Dolcu;Croatia;23.4.2004.;2004-04-23;3 juv;3;Dysderidae;Folkia;haasi;Folkia haasi;;42.936719;17.087449;Tb;deep cave;42.93671917.087449;1;;;;;;;;;;;;;;;;;;;;;;
2658;Rudina;Croatia;9.9.2006.;2006-09-09;2 juv;2;Dysderidae;Stalagtia;hercegovinensis;Stalagtia hercegovinensis;;42.721999;18.015321;Tb;deep cave;42.72199918.015321;3;9,9;;;;;;;;;;;;;;;;;;;;;
2659;Kaverna u Konavoskom polju;Croatia;26.8.2005.;2005-08-26;3juv;3;Dysderidae;Stalagtia;sp. 1;Stalagtia sp. 1;;42.52633;18.3382;Tb;deep cave;42.5263318.3382;4;;;;;;;;;;;;;;;;;;;;;;
2660;Špilja za Groma?kom vlakom;Croatia;29.3.2003.;2003-03-29;1m, 3 juv;4;Dysderidae;Stalagtia;sp. 5;Stalagtia sp. 5;605;42.743509;18.027359;Tb;deep cave;42.74350918.027359;15;;;13,63043478;;;;;;;;;;;;;;;;;;;
2661;Špilja na vrh Toraca;Croatia;8.10.2004.;2004-10-08;1f;1;Dysderidae;Stalagtia;sp. 5;Stalagtia sp. 5;;42.705575;18.03049;Tb;deep cave;42.70557518.03049;3;;15,5;15,275;;;;;;;;;;;;;;;;;;;
2662;Škrabuljica;Croatia;1.11.2003.;2003-11-01;1f;1;Dysderidae;Stalagtia;sp. 2;Stalagtia sp. 2;685;42.567045;18.385063;Tb;deep cave;42.56704518.385063;5;;8,1;11,025;;;;;;;;;;;;;;;;;;;
2663;Špilja za Groma?kom vlakom;Croatia;25.-26.3.2003.;2003-03-25/2003-03-26;1m;1;Dysderidae;Stalagtia;hercegovinensis;Stalagtia hercegovinensis;605;42.743509;18.027359;Tb;deep cave;42.74350918.027359;15;;;13,63043478;;;;;;;;;;;;;;;;;;;
2664;Špilja za Groma?kom vlakom;Croatia;25.-26.3.2003.;2003-03-25/2003-03-26;1juv;1;Dysderidae;Stalagtia;hercegovinensis;Stalagtia hercegovinensis;605;42.743509;18.027359;Tb;deep cave;42.74350918.027359;15;;;13,63043478;;;;;;;;;;;;;;;;;;;
2665;Jama na Mehovnju;Croatia;24.4.2004.;2004-04-24;1juv;1;Dysderidae;Folkia;haasi;Folkia haasi;;42.935749;17.06541;Tb;deep cave;42.93574917.06541;1;;;;;;;;;;;;;;;;;;;;;;
2666;Jama u Dubokom dolu;Croatia;27.4.2004.;2004-04-27;1f, 1juv;2;Dysderidae;Folkia;haasi;Folkia haasi;;42.946895;17.022321;Tb;deep cave;42.94689517.022321;3;;;;;;;;;;;;;;;;;;;;;;
2667;Jama u Vrisju;Croatia;25.4.2004.;2004-04-25;1juv;1;Dysderidae;Folkia;haasi;Folkia haasi;;42.944287;17.118511;Tb;deep cave;42.94428717.118511;2;;;;;;;;;;;;;;;;;;;;;;
2668;Jama pod Bilušinim vrhom;Croatia;24.4.2004.;2004-04-24;1juv;1;Dysderidae;Folkia;haasi;Folkia haasi;;42.93959;17.11266;Tb;deep cave;42.9395917.11266;3;;;;;;;;;;;;;;;;;;;;;;
2669;Bežurova jama;Croatia;23.8.1997.;1997-08-23;1f, 1 juv;2;Dysderidae;Stalagtia;sp. 4;Stalagtia sp. 4;429;43.064004;17.559348;Tb;deep cave;43.06400417.559348;1;;;;;;;;;;;;;;;;;;;;;;
2670;Škrabuljica;Croatia;11.3.2003.;2003-03-11;1m;1;Dysderidae;Stalagtia;sp. 2;Stalagtia sp. 2;685;42.567045;18.385063;Tb;deep cave;42.56704518.385063;5;;8,1;11,025;;;;;;;;;;;;;;;;;;;
2672;Špilja za Groma?kom vlakom;Croatia;29.5.2004.;2004-05-29;1f, 2 juv;3;Dysderidae;Stalagtia;hercegovinensis;Stalagtia hercegovinensis;605;42.743509;18.027359;Tb;deep cave;42.74350918.027359;15;;;13,63043478;;;;;;;;;;;;;;;;;;;
2677;Špilja za Groma?kom vlakom;Croatia;29.5.2004.;2004-05-29;1 juv m;1;Dysderidae;Stalagtia;sp. 5;Stalagtia sp. 5;605;42.743509;18.027359;Tb;deep cave;42.74350918.027359;15;;;13,63043478;;;;;;;;;;;;;;;;;;;
2678;Vilina špilja, Gruda;Croatia;27.6.2003.;2003-06-27;1f, 2 juv;3;Dysderidae;Stalagtia;sp. 1;Stalagtia sp. 1;205;42.506621;18.391346;Tb;deep cave;42.50662118.391346;7;;;;;;;;;;;;;;;;;;;;;;
2680;Aragonka;Croatia;9.6.1985.;1985-06-09;1f/juv;1;Dysderidae;Stalagtia;sp. 5;Stalagtia sp. 5;;42.713284;18.019397;Tb;deep cave;42.71328418.019397;3;;;15,4;;;;;;;;;;;;;;;;;;;
2681;Špilja pod Velji vrh;Croatia;25.4.2004.;2004-04-25;1juv;1;Dysderidae;Folkia;haasi;Folkia haasi;;42.953716;17.039919;Tb;deep cave;42.95371617.039919;2;;;;;;;;;;;;;;;;;;;;;;
2682;Mo?iljska špilja;Croatia;1.4.2007.;2007-04-01;1 juv;1;Dysderidae;Stalagtia;sp. 5;Stalagtia sp. 5;;42.689061;18.071906;Tb;deep cave;42.68906118.071906;6;;15,4;15,825;;;;;;;;;;;;;;;;;;;
2683;Vilina špilja, Gruda;Croatia;27.6.2004.;2004-06-27;4juv;4;Dysderidae;Stalagtia;sp. 1;Stalagtia sp. 1;205;42.506621;18.391346;Tb;deep cave;42.50662118.391346;7;;;;;;;;;;;;;;;;;;;;;;
2684;Debela ljut;Croatia;7.4.2006.;2006-04-07;2 juv;2;Dysderidae;Stalagtia;sp. 5;Stalagtia sp. 5;;42.717699;18.022036;Tb;deep cave;42.71769918.022036;8;;15,6;13,78333333;;;;;;;;;;;;;;;;;;;
2685;Debela ljut;Croatia;7.4.2006.;2006-04-07;2 juv;2;Nesticidae;Kryptonesticus;eremita;Kryptonesticus eremita;;42.717699;18.022036;tf;deep cave;42.71769918.022036;8;;15,6;13,78333333;;;;;;;;;;;;;;;;;;;
2687;Špilja za Groma?kom vlakom;Croatia;2.11.2003.;2003-11-02;2 juv;2;Dysderidae;Stalagtia;sp. 5;Stalagtia sp. 5;605;42.743509;18.027359;Tb;deep cave;42.74350918.027359;15;;;13,63043478;;;;;;;;;;;;;;;;;;;
2688;Ostaševica;Croatia;17.6.2001.;2001-06-17;1 juv;1;Dysderidae;Folkia;inermis;Folkia inermis;;42.748959;17.544404;Tb;deep cave;42.74895917.544404;9;11,6;;;;;;;;;;;;;;;;;;;;;
2690;Vilina špilja-Izvor Omble;Croatia;7.10.2004.;2004-10-07;1 juv;1;Dysderidae;Stalagtia;sp. 2;Stalagtia sp. 2;137;42.67716;18.136236;Tb;deep cave;42.6771618.136236;5;;;14,2;;;;;;;;;;;;;;;;;;;
2691;Vilina špilja-Izvor Omble;Croatia;7.10.2004.;2004-10-07;1f, 1 juv;2;Dysderidae;Stalagtia;sp. 2;Stalagtia sp. 2;137;42.67716;18.136236;Tb;deep cave;42.6771618.136236;5;;;14,2;;;;;;;;;;;;;;;;;;;
2692;Jama pod Perova?om;Croatia;5.4.2007.;2007-04-05;1 juv m;1;Dysderidae;Stalagtia;hercegovinensis;Stalagtia hercegovinensis;;42.757595;17.945265;Tb;deep cave;42.75759517.945265;1;;;;;;;;;;;;;;;;;;;;;;
2693;Gorska jama;Croatia;3.11.2003.;2003-11-03;5 juv;5;Dysderidae;Stalagtia;hercegovinensis;Stalagtia hercegovinensis;200;42.92697;17.424809;Tb;deep cave;42.9269717.424809;2;16;;;;;;;;;;;;;;;;;;;;;
2696;Špilja za Groma?kom vlakom;Croatia;29.5.2004.;2004-05-29;1f, 2 juv;3;Dysderidae;Stalagtia;hercegovinensis;Stalagtia hercegovinensis;605;42.743509;18.027359;Tb;deep cave;42.74350918.027359;15;;;13,63043478;;;;;;;;;;;;;;;;;;;
2698;Mo?iljska špilja;Croatia;8.10.2004.;2004-10-08;3 juv;3;Dysderidae;Stalagtia;sp. 5;Stalagtia sp. 5;;42.689061;18.071906;Tb;deep cave;42.68906118.071906;6;;15,4;15,825;;;;;;;;;;;;;;;;;;;
2699;Špilja za Groma?kom vlakom;Croatia;25.-26.3.2003.;2003-03-25/2003-03-26;1f;1;Dysderidae;Kaemis;vernalis;Kaemis vernalis;605;42.743509;18.027359;Tx;deep cave;42.74350918.027359;15;;;13,63043478;;;;;;;;;;;;;;;;;;;
2700;Špilja za Groma?kom vlakom;Croatia;25.-26.3.2003.;2003-03-25/2003-03-26;4 juv;4;Dysderidae;Stalagtia;hercegovinensis;Stalagtia hercegovinensis;605;42.743509;18.027359;Tb;deep cave;42.74350918.027359;15;;;13,63043478;;;;;;;;;;;;;;;;;;;
2701;?urovi?a jama;Croatia;26.3.2004.;2004-03-26;1f/juv raspadnuto;1;Dysderidae;Stalagtia;sp. 1;Stalagtia sp. 1;;42.559979;18.263559;Tb;deep cave;42.55997918.263559;4;;;;;;;;;;;;;;;;;;;;;;
2702;Špilja za Groma?kom vlakom;Croatia;29.3.2003.;2003-03-29;1 juv;1;Dysderidae;Stalagtia;sp. 5;Stalagtia sp. 5;605;42.743509;18.027359;Tb;deep cave;42.74350918.027359;15;;;13,63043478;;;;;;;;;;;;;;;;;;;
2703;Jama u Vrisju;Croatia;25.4.2004.;2004-04-25;1juv;1;Dysderidae;Folkia;haasi;Folkia haasi;;42.944287;17.118511;Tb;deep cave;42.94428717.118511;2;;;;;;;;;;;;;;;;;;;;;;
2704;Špilja u Solinama;Croatia;18.6.2001.;2001-06-18;1 juv;1;Dysderidae;Folkia;sp. 5;Folkia sp. 5;;42.768021;17.377062;Tb;deep cave;42.76802117.377062;5;;;7,6;;;;;;;;;;;;;;;;;;;
2705;Špilja za Groma?kom vlakom;Croatia;29.3.2003.;2003-03-29;1 juv;1;Dysderidae;Stalagtia;sp. 5;Stalagtia sp. 5;605;42.743509;18.027359;Tb;deep cave;42.74350918.027359;15;;;13,63043478;;;;;;;;;;;;;;;;;;;
2706;Banova ljut;Croatia;7.9.2006.;2006-09-07;1 juv;1;Nesticidae;Kryptonesticus;eremita;Kryptonesticus eremita;;42.724023;18.023649;tf;deep cave;42.72402318.023649;4;15,2;;;;;;;;;;;;;;;;;;;;;
2707;Banova ljut;Croatia;7.9.2006.;2006-09-07;2 juv;2;Dysderidae;Stalagtia;sp. 5;Stalagtia sp. 5;;42.724023;18.023649;Tb;deep cave;42.72402318.023649;4;15,2;;;;;;;;;;;;;;;;;;;;;
2708;Mo?iljska špilja;Croatia;1.4.2007.;2007-04-01;1 juv;1;Dysderidae;Harpactea;sp.;Harpactea sp.;;42.689061;18.071906;;;42.68906118.071906;6;;15,4;15,825;;;;;;;;;;;;;;;;;;;
2709;Mo?iljska špilja;Croatia;1.4.2007.;2007-04-01;1 juv;1;Dysderidae;Harpactea;sp.;Harpactea sp.;;42.689061;18.071906;;;42.68906118.071906;6;;15,4;15,825;;;;;;;;;;;;;;;;;;;
2710;Vilinska jama;Croatia;9.6.2000.;2000-06-09;1 juv;1;Dysderidae;Stalagtia;sp. 2;Stalagtia sp. 2;121;42.728553;17.881121;Tb;deep cave;42.72855317.881121;10;13,6;;;;;;;;;;;;;;;;;;;;;
2711;Rudina;Croatia;9.9.2006.;2006-09-09;1 juv;1;Dysderidae;Stalagtia;hercegovinensis;Stalagtia hercegovinensis;;42.721999;18.015321;Tb;deep cave;42.72199918.015321;3;9,9;;;;;;;;;;;;;;;;;;;;;
2712;Špilja kod Nerezinog dola;Croatia;21.6.2001.;2001-06-21;1 juv;1;Dysderidae;Folkia;inermis;Folkia inermis;;42.758378;17.436094;Tb;deep cave;42.75837817.436094;6;;14,6;12,7875;;;;;;;;;;;;;;;;;;;
2718;Špilja za Groma?kom vlakom;Croatia;2.11.2003.;2003-11-02;5 juv;5;Dysderidae;Stalagtia;sp. 5;Stalagtia sp. 5;605;42.743509;18.027359;Tb;deep cave;42.74350918.027359;15;;;13,63043478;;;;;;;;;;;;;;;;;;;
2719;Špilja u Mikuli?ima;Croatia;18.12.2006.;2006-12-18;1 juv;1;Dysderidae;Stalagtia;sp. 1;Stalagtia sp. 1;;42.477655;18.414148;Tb;deep cave;42.47765518.414148;1;;;;;;;;;;;;;;;;;;;;;;
2721;Špilja za Groma?kom vlakom;Croatia;29.5.2004.;2004-05-29;1f;1;Dysderidae;Stalagtia;sp. 5;Stalagtia sp. 5;605;42.743509;18.027359;Tb;deep cave;42.74350918.027359;15;;;13,63043478;;;;;;;;;;;;;;;;;;;
2723;Špilja za Groma?kom vlakom;Croatia;2.11.2003.;2003-11-02;2 juv;2;Dysderidae;Stalagtia;sp.;Stalagtia sp.;605;42.743509;18.027359;;;42.74350918.027359;15;;;13,63043478;;;;;;;;;;;;;;;;;;;
2724;Jama na Odvoru;Croatia;26.4.2004.;2004-04-26;1juv;1;Dysderidae;Folkia;haasi;Folkia haasi;;42.96718;16.999758;Tb;deep cave;42.9671816.999758;2;;;;;;;;;;;;;;;;;;;;;;
2727;?urovi?a jama;Croatia;31.10.2003.;2003-10-31;1juv/f;1;Dysderidae;Rhode;sp. 2;Rhode sp. 2;;42.559979;18.263559;Tb;deep cave;42.55997918.263559;4;;;;;;;;;;;;;;;;;;;;;;
2729;Špilja za Groma?kom vlakom;Croatia;2.11.2003.;2003-11-02;2 juv;2;Dysderidae;Stalagtia;sp. 5;Stalagtia sp. 5;605;42.743509;18.027359;;;42.74350918.027359;15;;;13,63043478;;;;;;;;;;;;;;;;;;;
2730;Špilja za Groma?kom vlakom;Croatia;8.9.2006.;2006-09-08;1 juv;1;Dysderidae;Stalagtia;sp.;Stalagtia sp.;605;42.743509;18.027359;;;42.74350918.027359;15;;;13,63043478;;;;;;;;;;;;;;;;;;;
2733;Jama pod križem 2;Croatia;3.4.2007.;2007-04-03;1 juv;1;Nesticidae;Kryptonesticus;eremita;Kryptonesticus eremita;;42.712365;18.019469;;deep cave;42.71236518.019469;1;;;;;;;;;;;;;;;;;;;;;;
2737;Vilinska jama;Croatia;2.4.2007.;2007-04-02;1m;1;Leptonetidae;Barusia;maheni;Barusia maheni;121;42.728553;17.881121;tf;deep cave;42.72855317.881121;10;13,6;;;;;;;;;;;;;;;;;;;;;
2739;Vilina špilja-Izvor Omble;Croatia;19.3.2012.;2012-03-19;1f;1;Nesticidae;Kryptonesticus;eremita;Kryptonesticus eremita;;42.67716;18.136236;tf;deep cave;42.6771618.136236;5;;;14,2;;;;;;;;;;;;;;;;;;;
2744;Špilja za Groma?kom vlakom;Croatia;22.8.2005.;2005-08-22;1 juv;1;Dysderidae;Stalagtia;sp.;Stalagtia sp.;605;42.743509;18.027359;;;42.74350918.027359;15;;;13,63043478;;;;;;;;;;;;;;;;;;;
2745;Špilja za Groma?kom vlakom;Croatia;29.5.2004.;2004-05-29;1juv;1;Dysderidae;Stalagtia;sp. 5;Stalagtia sp. 5;605;42.743509;18.027359;Tb;deep cave;42.74350918.027359;15;;;13,63043478;;;;;;;;;;;;;;;;;;;
2747;Debela ljut;Croatia;7.4.2006.;2006-04-07;1juv;1;Dysderidae;Stalagtia;sp.;Stalagtia sp.;;42.717699;18.022036;;;42.71769918.022036;8;;15,6;13,78333333;;;;;;;;;;;;;;;;;;;
2748;Škrabuljica;Croatia;11.3.2003.;2003-03-11;3f, 2 juv;5;Linyphiidae;Centromerus;subcaecus;Centromerus subcaecus;685;42.567045;18.385063;Tf;deep cave;42.56704518.385063;5;;8,1;11,025;;;;;;;;;;;;;;;;;;;
2749;Špilja za Groma?kom vlakom;Croatia;2.11.2003.;2003-11-02;1m;1;Linyphiidae;Palliduphantes;sp. 3;Palliduphantes sp. 3;605;42.743509;18.027359;;;42.74350918.027359;15;;;13,63043478;;;;;;;;;;;;;;;;;;;
2750;Vilina špilja, Gruda;Croatia;27.6.2004.;2004-06-27;4f, 1 juv;5;Mysmenidae;Trogloneta;granulum;Trogloneta granulum;205;42.506621;18.391346;Tf;deep cave;42.50662118.391346;7;;;;;;;;;;;;;;;;;;;;;;
2752;Škrabuljica;Croatia;1.11.2003.;2003-11-01;1f, 1juvm, 3 juv;5;Linyphiidae;Centromerus;subcaecus;Centromerus subcaecus;685;42.567045;18.385063;Tf;deep cave;42.56704518.385063;5;;8,1;11,025;;;;;;;;;;;;;;;;;;;
2753;Jama za Rasohama;Croatia;23.6.2009.;2009-06-23;1m;1;Linyphiidae;Palliduphantes;spelaeorum;Palliduphantes spelaeorum;;42.800629;17.929995;Tf;deep cave;42.80062917.929995;2;;;;;;;;;;;;;;;;;;;;;;
2754;Jama za Rasohama;Croatia;23.6.2009.;2009-06-23;2f, 1juv m;3;Linyphiidae;Troglohyphantes;hadzii;Troglohyphantes hadzii;;42.800629;17.929995;tf;deep cave;42.80062917.929995;2;;;;;;;;;;;;;;;;;;;;;;
2756;Vranja?a špilja kod Dugopolja;Croatia;29.4.2012.;2012-04-29;1 juv;1;Dysderidae;Stalagtia;sp. 4;Stalagtia sp. 4;445;43.562235;16.648216;Tb;deep cave;43.56223516.648216;5;;;;;;;;;;;;;;;;;;;;;;
2757;Balešina jama;Croatia;28.4.2012.;2012-04-28;1f;1;Nesticidae;Kryptonesticus;eremita;Kryptonesticus eremita;310;43.578743;16.580621;tf;deep cave;43.57874316.580621;5;;;;;;;;;;;;;;;;;;;;;;
2758;Balešina jama;Croatia;28.4.2012.;2012-04-28;2f, 1m;3;Linyphiidae;Palliduphantes;spelaeorum;Palliduphantes spelaeorum;310;43.578743;16.580621;Tf;deep cave;43.57874316.580621;5;;;;;;;;;;;;;;;;;;;;;;
2759;Balešina jama;Croatia;28.4.2012.;2012-04-28;1f;1;Pholcidae;Stygopholcus;absoloni;Stygopholcus absoloni;310;43.578743;16.580621;;deep cave;43.57874316.580621;5;;;;;;;;;;;;;;;;;;;;;;
2760;Balešina jama;Croatia;28.4.2012.;2012-04-28;1 juv;1;Dysderidae;Stalagtia;sp. 4;Stalagtia sp. 4;310;43.578743;16.580621;Tb;deep cave;43.57874316.580621;5;;;;;;;;;;;;;;;;;;;;;;
2761;Bali?a špilja;Croatia;28.4.2012.;2012-04-28;1juv;1;Dysderidae;Rhode;sp. 1;Rhode sp. 1;405;43.57296;16.57002;Tb;deep cave;43.5729616.57002;11;7,2;;;;;;;;;;;;;;;;;;;;;
2762;Bali?a špilja;Croatia;28.4.2012.;2012-04-28;1f, 1 juv;2;Linyphiidae;Troglohyphantes;giromettai;Troglohyphantes giromettai;405;43.57296;16.57002;tf;deep cave;43.5729616.57002;11;7,2;;;;;;;;;;;;;;;;;;;;;
2763;Žmirina jama;Croatia;29.4.2012.;2012-04-29;1 juv;1;Dysderidae;Stalagtia;sp. 4;Stalagtia sp. 4;;43.570976;16.59734;Tb;deep cave;43.57097616.59734;5;;;;;;;;;;;;;;;;;;;;;;
2764;Višti?ina jama;Croatia;16.7.1997.;1997-07-16;2f;2;Linyphiidae;Palliduphantes;spelaeorum;Palliduphantes spelaeorum;;42.985281;17.557541;Tf;deep cave;42.98528117.557541;3;;;;;;;;;;;;;;;;;;;;;;
2765;Žmirina jama;Croatia;29.4.2012.;2012-04-29;1f, 1m, 1juv;3;Nesticidae;Kryptonesticus;eremita;Kryptonesticus eremita;;43.570976;16.59734;Tf;deep cave;43.57097616.59734;5;;;;;;;;;;;;;;;;;;;;;;
2766;Žmirina jama;Croatia;29.4.2012.;2012-04-29;1m, 1 juv;2;Leptonetidae;Barusia;maheni;Barusia maheni;;43.570976;16.59734;tf;deep cave;43.57097616.59734;5;;;;;;;;;;;;;;;;;;;;;;
2767;Žmirina jama;Croatia;29.4.2012.;2012-04-29;1m;1;Tetragnathidae;Metellina;merianae;Metellina merianae;;43.570976;16.59734;Tf;deep cave;43.57097616.59734;5;;;;;;;;;;;;;;;;;;;;;;
2770;Žmirina jama;Croatia;29.4.2012.;2012-04-29;1f;1;Linyphiidae;Centromerus;cavernarum;Centromerus cavernarum;;43.570976;16.59734;Tf;deep cave;43.57097616.59734;5;;;;;;;;;;;;;;;;;;;;;;
2771;Jujnovi?a špilja;Croatia;1.5.2012.;2012-05-01;1f;1;Linyphiidae;Typhlonyphia;sp. 1;Typhlonyphia sp. 1;405;43.266579;17.19798;Tb;deep cave;43.26657917.19798;6;;;;;;;;;;;;;;;;;;;;;;
2772;Jujnovi?a špilja;Croatia;1.5.2012.;2012-05-01;1f;1;Agelenidae;Histopona;conveniens;Histopona conveniens;405;43.266579;17.19798;Tf;deep cave;43.26657917.19798;6;;;;;;;;;;;;;;;;;;;;;;
2773;Jujnovi?a špilja;Croatia;1.5.2012.;2012-05-01;1f;1;Pholcidae;Stygopholcus;absoloni;Stygopholcus absoloni;405;43.266579;17.19798;;deep cave;43.26657917.19798;6;;;;;;;;;;;;;;;;;;;;;;
2774;Jujnovi?a špilja;Croatia;1.5.2012.;2012-05-01;1f, 1m, 1 juv;3;Agelenidae;Histopona;conveniens;Histopona conveniens;405;43.266579;17.19798;Tf;deep cave;43.26657917.19798;6;;;;;;;;;;;;;;;;;;;;;;
2775;Jujnovi?a špilja;Croatia;1.5.2012.;2012-05-01;1m;1;Linyphiidae;Typhlonyphia;sp. 1;Typhlonyphia sp. 1;405;43.266579;17.19798;Tb;deep cave;43.26657917.19798;6;;;;;;;;;;;;;;;;;;;;;;
2776;Jama V=13;Croatia;20.11.2011.;2011-11-20;1m;1;Pholcidae;Stygopholcus;skotophilus;Stygopholcus skotophilus;;42.574;18.352;;deep cave;42.57418.352;1;;;;;;;;;;;;;;;;;;;;;;
2777;Jezero;Croatia;16.3.2002.;2002-03-16;1f, 5 juv;6;Nesticidae;Kryptonesticus;arenstorffi;Kryptonesticus arenstorffi;903;42.580381;18.356073;tb;deep cave;42.58038118.356073;8;;;7,566666667;;;;;;;;;;;;;;;;;;;
2779;Škrabuljica;Croatia;7.11.2003.;2003-11-07;1f, 2 juv;3;Linyphiidae;Centromerus;subcaecus;Centromerus subcaecus;685;42.567045;18.385063;Tf;deep cave;42.56704518.385063;5;;8,1;11,025;;;;;;;;;;;;;;;;;;;
2783;Šimunkovi?a špilja;Croatia;6.4.2007.;2007-04-06;1f;1;Leptonetidae;Barusia;korculana;Barusia korculana;50;42.978588;17.129081;tb;deep cave;42.97858817.129081;7;;;;;;;;;;;;;;;;;;;;;;
2786;Vilina špilja-Izvor Omble;Croatia;5.5.2012.;2012-05-05;1f;1;Nesticidae;Kryptonesticus;eremita;Kryptonesticus eremita;;42.67716;18.136236;tf;deep cave;42.6771618.136236;5;;;14,2;;;;;;;;;;;;;;;;;;;
2787;Vilina špilja-Izvor Omble;Croatia;5.5.2012.;2012-05-05;1 juv;1;Agelenidae;Histopona;sp.;Histopona sp.;;42.67716;18.136236;;deep cave;42.6771618.136236;5;;;14,2;;;;;;;;;;;;;;;;;;;
2788;Vilina špilja-Izvor Omble;Croatia;5.5.2012.;2012-05-05;1f;1;Nesticidae;Kryptonesticus;eremita;Kryptonesticus eremita;;42.67716;18.136236;tf;deep cave;42.6771618.136236;5;;;14,2;;;;;;;;;;;;;;;;;;;
2789;Vilina špilja-Izvor Omble;Croatia;5.5.2012.;2012-05-05;1juv , 1 juv;2;Nesticidae;Kryptonesticus;eremita;Kryptonesticus eremita;;42.67716;18.136236;tf;deep cave;42.6771618.136236;5;;;14,2;;;;;;;;;;;;;;;;;;;
2790;Vilina špilja-Izvor Omble;Croatia;5.5.2012.;2012-05-05;1 juvm;1;Dysderidae;Stalagtia;sp. 2;Stalagtia sp. 2;;42.67716;18.136236;Tb;deep cave;42.6771618.136236;5;;;14,2;;;;;;;;;;;;;;;;;;;
2791;Vilina špilja-Izvor Omble;Croatia;6.5.2012.;2012-05-06;2f, 1 juv;3;Agelenidae;Histopona;dubia;Histopona dubia;;42.67716;18.136236;tb;deep cave;42.6771618.136236;5;;;14,2;;;;;;;;;;;;;;;;;;;
2792;Vilina špilja-Izvor Omble;Croatia;6.5.2012.;2012-05-06;2 juv m, 3f, 1 juv;6;Dysderidae;Stalagtia;sp. 2;Stalagtia sp. 2;;42.67716;18.136236;Tb;deep cave;42.6771618.136236;5;;;14,2;;;;;;;;;;;;;;;;;;;
2793;Vilina špilja-Izvor Omble;Croatia;6.5.2012.;2012-05-06;1m, 1f, 3 juv m, 4 juv;9;Leptonetidae;Sulcia;sp. 2;Sulcia sp. 2;;42.67716;18.136236;Tb;deep cave;42.6771618.136236;5;;;14,2;;;;;;;;;;;;;;;;;;;
2794;Vilina špilja-Izvor Omble;Croatia;6.5.2012.;2012-05-06;1 juv;1;Dysderidae;Stalagtia;sp. 2;Stalagtia sp. 2;;42.67716;18.136236;Tb;deep cave;42.6771618.136236;5;;;14,2;;;;;;;;;;;;;;;;;;;
2795;Vilina špilja-Izvor Omble;Croatia;17.6.2012.;2012-06-17;1f, 1 juv;2;Dysderidae;Stalagtia;sp. 2;Stalagtia sp. 2;;42.67716;18.136236;Tb;deep cave;42.6771618.136236;5;;;14,2;;;;;;;;;;;;;;;;;;;
2796;Vilina špilja-Izvor Omble;Croatia;16.6.2012.;2012-06-16;1 juv;1;Dysderidae;Stalagtia;sp. 2;Stalagtia sp. 2;;42.67716;18.136236;Tb;deep cave;42.6771618.136236;5;;;14,2;;;;;;;;;;;;;;;;;;;
2797;Vilina špilja-Izvor Omble;Croatia;17.6.2012.;2012-06-17;2 juv;2;Dysderidae;Stalagtia;sp. 2;Stalagtia sp. 2;;42.67716;18.136236;Tb;deep cave;42.6771618.136236;5;;;14,2;;;;;;;;;;;;;;;;;;;
2798;Vilina špilja-Izvor Omble;Croatia;16.6.2012.;2012-06-16;1 juv;1;Dysderidae;Stalagtia;sp. 2;Stalagtia sp. 2;;42.67716;18.136236;Tb;deep cave;42.6771618.136236;5;;;14,2;;;;;;;;;;;;;;;;;;;
2799;Vilina špilja-Izvor Omble;Croatia;17.6.2012.;2012-06-17;2 juv;2;Dysderidae;Stalagtia;sp. 2;Stalagtia sp. 2;;42.67716;18.136236;Tb;deep cave;42.6771618.136236;5;;;14,2;;;;;;;;;;;;;;;;;;;
2800;Vilina špilja-Izvor Omble;Croatia;17.6.2012.;2012-06-17;6 juv;6;Dysderidae;Stalagtia;sp. 2;Stalagtia sp. 2;;42.67716;18.136236;Tb;deep cave;42.6771618.136236;5;;;14,2;;;;;;;;;;;;;;;;;;;
2801;Vilina špilja-Izvor Omble;Croatia;17.6.2012.;2012-06-17;1f;1;Agelenidae;Histopona;dubia;Histopona dubia;;42.67716;18.136236;tb;deep cave;42.6771618.136236;5;;;14,2;;;;;;;;;;;;;;;;;;;
2802;Vilina špilja-Izvor Omble;Croatia;17.6.2012.;2012-06-17;1f;1;Agelenidae;Histopona;dubia;Histopona dubia;;42.67716;18.136236;tb;deep cave;42.6771618.136236;5;;;14,2;;;;;;;;;;;;;;;;;;;
2803;Vilina špilja-Izvor Omble;Croatia;17.6.2012.;2012-06-17;1 juv;1;Agelenidae;Histopona;dubia;Histopona dubia;;42.67716;18.136236;tb;deep cave;42.6771618.136236;5;;;14,2;;;;;;;;;;;;;;;;;;;
2804;Vilina špilja-Izvor Omble;Croatia;17.6.2012.;2012-06-17;1f, 8 juv;9;Agelenidae;Histopona;dubia;Histopona dubia;;42.67716;18.136236;tb;deep cave;42.6771618.136236;5;;;14,2;;;;;;;;;;;;;;;;;;;
2805;Vilina špilja-Izvor Omble;Croatia;17.6.2012.;2012-06-17;2f, 2 m;4;Leptonetidae;Sulcia;sp. 2;Sulcia sp. 2;;42.67716;18.136236;Tb;deep cave;42.6771618.136236;5;;;14,2;;;;;;;;;;;;;;;;;;;
2806;Vilina špilja-Izvor Omble;Croatia;17.6.2012.;2012-06-17;1m;1;Leptonetidae;Sulcia;sp. 2;Sulcia sp. 2;;42.67716;18.136236;Tb;deep cave;42.6771618.136236;5;;;14,2;;;;;;;;;;;;;;;;;;;
2807;Vilina špilja-Izvor Omble;Croatia;16.6.2012.;2012-06-16;1f, 1 juv m, 2 juv;4;Nesticidae;Kryptonesticus;eremita;Kryptonesticus eremita;;42.67716;18.136236;tf;deep cave;42.6771618.136236;5;;;14,2;;;;;;;;;;;;;;;;;;;
2808;Vilina špilja-Izvor Omble;Croatia;17.6.2012.;2012-06-17;1f, 2 juv;3;Nesticidae;Kryptonesticus;eremita;Kryptonesticus eremita;;42.67716;18.136236;tf;deep cave;42.6771618.136236;5;;;14,2;;;;;;;;;;;;;;;;;;;
2810;Zidane pe?ine;Croatia;28.2.2010.;2010-02-28;2f, 2m;4;Linyphiidae;Porrhomma;convexum;Porrhomma convexum;400;45.738992;15.497143;;deep cave;45.73899215.497143;7;;;;;;;;;;;;;;;;;;;;;;
2811;Vugrinova špilja;Croatia;7.7.2009.;2009-07-07;2f;2;Linyphiidae;Porrhomma;egeria;Porrhomma egeria;310;45.77395;15.70102;;deep cave;45.7739515.70102;7;;;;;;;;;;;;;;;;;;;;;;
2841;Veternica;Croatia;13.1.2010.;2010-01-13;1 m;1;Linyphiidae;Porrhomma;convexum;Porrhomma convexum;330;45.841058;15.873642;;deep cave;45.84105815.873642;6;;;;;;;;;;;;;;;;;;;;;;
2866;Gajina pe?;Croatia;13.6.2009.;2009-06-13;1 juv;1;Dysderidae;Stalita;pretneri;Stalita pretneri;535;44.956397;15.064298;Tb;deep cave;44.95639715.064298;1;;;;;;;;;;;;;;;;;;;;;;
2869;Sini?i? špilja;Croatia;7.10.2006.;2006-10-07;2m, 2f, 2 juv m;6;Linyphiidae;Porrhomma;convexum;Porrhomma convexum;;44.990698;15.177848;;deep cave;44.99069815.177848;6;;;;;;;;;;;;;;;;;;;;;;
2876;Vrta?a kod špilje Kame Hame;Croatia;24.6.2006.;2006-06-24;1f;1;Linyphiidae;Micrargus;apertus;Micrargus apertus;;45.551639;14.518065;;;45.55163914.518065;2;;;;;;;;;;;;;;;;;;;;;;
2881;Biserujka;Croatia;8.4.2012.;2012-04-08;1f;1;Nesticidae;Kryptonesticus;eremita;Kryptonesticus eremita;;45.187464;14.60981;tf;deep cave;45.18746414.60981;1;;;;;;;;;;;;;;;;;;;;;;
2885;?ampari;Croatia;7.4.2012.;2012-04-07;2f;2;Nesticidae;Kryptonesticus;eremita;Kryptonesticus eremita;312;45.123809;14.333655;tf;deep cave;45.12380914.333655;4;;;;;;;;;;;;;;;;;;;;;;
2886;Medova buža;Croatia;23.5.2010.;2010-05-23;1m, 2 juv;3;Nesticidae;Kryptonesticus;eremita;Kryptonesticus eremita;;44.813345;14.745867;;deep cave;44.81334514.745867;1;;;;;;;;;;;;;;;;;;;;;;
2888;Pliškovi?eva jama;Croatia;19.2.2007.;2007-02-19;3f, 2m, 3 juv;8;Linyphiidae;Porrhomma;convexum;Porrhomma convexum;;45.071604;13.872151;;deep cave;45.07160413.872151;4;;;;;;;;;;;;;;;;;;;;;;
2890;Markova jama kod Tara;Croatia;3.1999.;1999-03;1f, 3 juv;4;Nesticidae;Kryptonesticus;eremita;Kryptonesticus eremita;95;45.319298;13.631373;tf;deep cave;45.31929813.631373;7;;;;;;;;;;;;;;;;;;;;;;
2898;Kraljicina špilja;Croatia;19.10.2007.;2007-10-19;1 juv;1;Nesticidae;Kryptonesticus;eremita;Kryptonesticus eremita;;43.073661;16.100773;tf;deep cave;43.07366116.100773;2;;;;;;;;;;;;;;;;;;;;;;
2901;Špilja pod Kapelu;Croatia;13.4.2003.;2003-04-13;1 juv f, 3 juv;4;Linyphiidae;Palliduphantes;sp.;Palliduphantes sp.;;43.184949;16.434233;;;43.18494916.434233;5;;;;;;;;;;;;;;;;;;;;;;
2906;Tanki Ratac;Croatia;21.10.2007.;2007-10-21;1 juv;1;Nesticidae;Kryptonesticus;eremita;Kryptonesticus eremita;;43.360229;16.569356;tf;deep cave;43.36022916.569356;3;;;;;;;;;;;;;;;;;;;;;;
2916;Pišurka;Croatia;18.4.2011.;2011-04-18;1 juv m, 3 juv;4;Nesticidae;Kryptonesticus;eremita;Kryptonesticus eremita;;42.959451;17.129228;;deep cave;42.95945117.129228;5;;;;;;;;;;;;;;;;;;;;;;
2922;Golubnja?a, Žegar;Croatia;2.8.2006.;2006-08-02;3f;3;Linyphiidae;Micrargus;herbigradus;Micrargus herbigradus;243;44.131933;15.851054;Tf;deep cave;44.13193315.851054;6;;;;;;;;;;;;;;;;;;;;;;
2923;Uviraljka;Croatia;6.11.2004.;2004-11-06;1f;1;Linyphiidae;Porrhomma;egeria;Porrhomma egeria;810;45.522243;17.62067;;deep cave;45.52224317.62067;3;;;;;;;;;;;;;;;;;;;;;;
2924;Rogovac;Croatia;11.12.2004.;2004-12-11;1f;1;Linyphiidae;Gen. 4;sp.;Gen. 4 sp.;;45.674185;15.444223;;;45.67418515.444223;3;;;;;;;;;;;;;;;;;;;;;;
2925;Rogovac;Croatia;11.12.2004.;2004-12-11;1f;1;Linyphiidae;Gen.;sp. X;Gen. sp. X;;45.674185;15.444223;;;45.67418515.444223;3;;;;;;;;;;;;;;;;;;;;;;
2926;Rogovac;Croatia;11.12.2004.;2004-12-11;2f, 1 prosoma (f?);2;Linyphiidae;Porrhomma;convexum;Porrhomma convexum;;45.674185;15.444223;;deep cave;45.67418515.444223;3;;;;;;;;;;;;;;;;;;;;;;
2927;Bedara;Croatia;18.10.2003.;2003-10-18;1f;1;Linyphiidae;Porrhomma;egeria;Porrhomma egeria;620;45.751922;15.536692;;deep cave;45.75192215.536692;4;;;;;;;;;;;;;;;;;;;;;;
2928;Batinova jama;Croatia;23.1.2004.;2004-01-23;3f, 1m, 2 juv;6;Linyphiidae;Porrhomma;egeria;Porrhomma egeria;450;45.845957;15.868496;;deep cave;45.84595715.868496;2;;;;;;;;;;;;;;;;;;;;;;
2929;Jama na Ostrisnjaku;Croatia;27.10.2002.;2002-10-27;1m;1;Linyphiidae;Porrhomma;egeria;Porrhomma egeria;;45.77;15.45;;deep cave;45.7715.45;1;;;;;;;;;;;;;;;;;;;;;;
2931;Kus;Croatia;21.12.2003.;2003-12-21;3m, 1f, 2 juv;6;Linyphiidae;Micrargus;herbigradus;Micrargus herbigradus;;44.814755;14.426275;Tf;deep cave;44.81475514.426275;2;;;;;;;;;;;;;;;;;;;;;;
2932;Jelovec jama;Croatia;16.10.2006.;2006-10-16;1f;1;Linyphiidae;Porrhomma;egeria;Porrhomma egeria;525;46.276775;15.992573;;deep cave;46.27677515.992573;1;;;;;;;;;;;;;;;;;;;;;;
2933;Jama Staja;Croatia;14.8.2001.;2001-08-14;2f, 2 juv;4;Linyphiidae;Porrhomma;convexum;Porrhomma convexum;;44.919862;13.938147;;deep cave;44.91986213.938147;4;;;;;;;;;;;;;;;;;;;;;;
2934;Ponor Bele vode;Croatia;12.7.2005.;2005-07-12;2f;2;Linyphiidae;Porrhomma;sp. x;Porrhomma sp. x;;45.418527;14.693695;;;45.41852714.693695;3;;;;;;;;;;;;;;;;;;;;;;
2935;Francuski rudnik 3;Croatia;24.11.2004.;2004-11-24;1f;1;Linyphiidae;Porrhomma;convexum;Porrhomma convexum;;45.905584;15.940186;;deep cave;45.90558415.940186;2;;;;;;;;;;;;;;;;;;;;;;
2936;Velebita- Dva javora;Croatia;15.8.2007.;2007-08-15;1f;1;Linyphiidae;Porrhomma;egeria;Porrhomma egeria;1560;44.757596;14.98636;;deep cave;44.75759614.98636;2;;;;;;;;;;;;;;;;;;;;;;
2937;Dola?a;Croatia;7.3.2010.;2010-03-07;1m;1;Linyphiidae;Porrhomma;convexum;Porrhomma convexum;;45.739571;15.482755;;deep cave;45.73957115.482755;5;;;;;;;;;;;;;;;;;;;;;;
2938;Francuski rudnik 3;Croatia;16.4.2005.;2005-04-16;1f;1;Linyphiidae;Porrhomma;convexum;Porrhomma convexum;;45.905584;15.940186;;deep cave;45.90558415.940186;2;;;;;;;;;;;;;;;;;;;;;;
2939;Vari?akova špilja;Croatia;8.2002.;2002-08;1f;1;Linyphiidae;Porrhomma;convexum;Porrhomma convexum;;45.008251;15.736981;;deep cave;45.00825115.736981;5;;;;;;;;;;;;;;;;;;;;;;
2940;Bedara;Croatia;28.4.2002.;2002-04-28;3f;3;Linyphiidae;Porrhomma;egeria;Porrhomma egeria;620;45.751922;15.536692;;deep cave;45.75192215.536692;4;;;;;;;;;;;;;;;;;;;;;;
2941;Sini?i? špilja;Croatia;3.1.2010.;2010-01-03;2f, 1m, 2 juv;5;Linyphiidae;Porrhomma;convexum;Porrhomma convexum;;44.990698;15.177848;;deep cave;44.99069815.177848;6;;;;;;;;;;;;;;;;;;;;;;
2942;Zagorska pe? kod Ogulina;Croatia;17.6.2006.;2006-06-17;1m;1;Linyphiidae;Porrhomma;egeria;Porrhomma egeria;335;45.196851;15.219904;;deep cave;45.19685115.219904;3;;;;;;;;;;;;;;;;;;;;;;
2943;Velika špilja kod Goranca;Croatia;15.10.2006.;2006-10-15;1f;1;Linyphiidae;Porrhomma;convexum;Porrhomma convexum;;46.284655;16.032361;;deep cave;46.28465516.032361;5;;;;;;;;;;;;;;;;;;;;;;
2944;Jama iznad lova?og doma;Croatia;17.6.2006.;2006-06-17;3m, 2f, 1 prosoma (f?);5;Linyphiidae;Porrhomma;egeria;Porrhomma egeria;400;45.19;15.22;;deep cave;45.1915.22;1;;;;;;;;;;;;;;;;;;;;;;
2945;Pušina;Croatia;20.4.2008.;2008-04-20;3f;3;Linyphiidae;Porrhomma;egeria;Porrhomma egeria;724;45.740585;15.35653;;deep cave;45.74058515.35653;4;;;;;;;;;;;;;;;;;;;;;;
2946;Špilja iznad Crnog vrela;Croatia;30.6.2004.;2004-06-30;1m;1;Linyphiidae;Porrhomma;microps;Porrhomma microps;;45.16;15.08;Tf;deep cave;45.1615.08;1;;;;;;;;;;;;;;;;;;;;;;
2947;Sini?i? špilja;Croatia;11.8.2007.;2007-08-11;4m, 3f;7;Linyphiidae;Porrhomma;convexum;Porrhomma convexum;;44.990698;15.177848;;deep cave;44.99069815.177848;6;;;;;;;;;;;;;;;;;;;;;;
2948;Jama iznad lova?og doma;Croatia;17.6.2006.;2006-06-17;2m, 1f;3;Linyphiidae;Porrhomma;egeria;Porrhomma egeria;400;45.19;15.22;;deep cave;45.1915.22;1;;;;;;;;;;;;;;;;;;;;;;
2949;Bibi?ka špilja;Croatia;10.9.2000.;2000-09-10;1m;1;Linyphiidae;Porrhomma;egeria;Porrhomma egeria;200;45.335921;15.254079;;deep cave;45.33592115.254079;3;;;;;;;;;;;;;;;;;;;;;;
2950;Vukovi?a špilja;Croatia;10.5.2003.;2003-05-10;1f;1;Linyphiidae;Porrhomma;convexum;Porrhomma convexum;;45.121909;15.659938;;deep cave;45.12190915.659938;2;;;;;;;;;;;;;;;;;;;;;;
2951;Bedara;Croatia;20.12.2003.;2003-12-20;1f, 1m, 2 juv;4;Linyphiidae;Porrhomma;egeria;Porrhomma egeria;620;45.751922;15.536692;;deep cave;45.75192215.536692;4;;;;;;;;;;;;;;;;;;;;;;
2952;Ambarac;Croatia;11.6.2005.;2005-06-11;1f;1;Linyphiidae;Porrhomma;convexum;Porrhomma convexum;;45.231783;15.306426;;deep cave;45.23178315.306426;1;;;;;;;;;;;;;;;;;;;;;;
2953;Velika špilja kod Goranca;Croatia;15.10.2006.;2006-10-15;1f;1;Linyphiidae;Porrhomma;convexum;Porrhomma convexum;;46.284655;16.032361;;deep cave;46.28465516.032361;5;;;;;;;;;;;;;;;;;;;;;;
2954;?ulin ponor-Medvedica;Croatia;1.2.2004.;2004-02-01;1f, 1m;2;Linyphiidae;Porrhomma;convexum;Porrhomma convexum;320;45.267036;15.223745;Tf;deep cave;45.26703615.223745;3;;;;;;;;;;;;;;;;;;;;;;
2955;Sini?i? špilja;Croatia;29.6.2004.;2004-06-29;2f, 1m;3;Linyphiidae;Porrhomma;convexum;Porrhomma convexum;;44.990698;15.177848;;deep cave;44.99069815.177848;6;;;;;;;;;;;;;;;;;;;;;;
2956;Kapaljka 1;Croatia;1.6.1997.;1997-06-01;1m;1;Linyphiidae;Gen.;sp. X;Gen. sp. X;;45.459187;14.675404;;;45.45918714.675404;2;;;;;;;;;;;;;;;;;;;;;;
2957;Vukovi?a špilja;Croatia;5.5.2002.;2002-05-05;1m, 1 juv;2;Linyphiidae;Porrhomma;convexum;Porrhomma convexum;;45.121909;15.659938;;deep cave;45.12190915.659938;2;;;;;;;;;;;;;;;;;;;;;;
2958;Velika špilja kod Goranca;Croatia;14.5.2006.;2006-05-14;1f;1;Linyphiidae;Porrhomma;convexum;Porrhomma convexum;;46.284655;16.032361;;deep cave;46.28465516.032361;5;;;;;;;;;;;;;;;;;;;;;;
2959;Rudnik Zrinski;Croatia;16.4.2004.;2004-04-16;1f, 2 juv;3;Linyphiidae;Porrhomma;microps;Porrhomma microps;804;45.887195;15.927871;Tf;deep cave;45.88719515.927871;9;;;;;;;;;;;;;;;;;;;;;;
2960;Gojkova draga;Croatia;15.9.1998.;1998-09-15;1m;1;Linyphiidae;Porrhomma;egeria;Porrhomma egeria;600;45.779634;15.516718;;deep cave;45.77963415.516718;1;;;;;;;;;;;;;;;;;;;;;;
2962;Rudnik Zrinski;Croatia;16.6.2004.;2004-06-16;1f;1;Linyphiidae;Porrhomma;sp. 1;Porrhomma sp. 1;804;45.887195;15.927871;;;45.88719515.927871;9;;;;;;;;;;;;;;;;;;;;;;
2963;Hircova jama;Croatia;2.5.2004.;2004-05-02;1f;1;Linyphiidae;Porrhomma;convexum;Porrhomma convexum;;45.426113;14.664785;;deep cave;45.42611314.664785;3;;;;;;;;;;;;;;;;;;;;;;
2964;Ponor Bele vode;Croatia;12.7.2004.;2004-07-12;1m, 1f, 3 juv;5;Linyphiidae;Porrhomma;convexum;Porrhomma convexum;;45.418527;14.693695;;deep cave;45.41852714.693695;3;;;;;;;;;;;;;;;;;;;;;;
2965;Mrgi?a ponor;Croatia;9.1.1999.;1999-01-09;2f, 2m;4;Linyphiidae;Porrhomma;convexum;Porrhomma convexum;;45.268189;15.469236;;deep cave;45.26818915.469236;10;;;;;;;;;;;;;;;;;;;;;;
2966;izvor kod Crvenog križa;Croatia;21.5.2005.;2005-05-21;1m;1;Linyphiidae;Porrhomma;convexum;Porrhomma convexum;;45.856759;15.879739;;deep cave;45.85675915.879739;1;;;;;;;;;;;;;;;;;;;;;;
2967;Vrelo Jambrišak;Croatia;21.5.2005.;2005-05-21;1m;1;Linyphiidae;Porrhomma;convexum;Porrhomma convexum;;45.857115;15.880144;;deep cave;45.85711515.880144;1;;;;;;;;;;;;;;;;;;;;;;
2968;Jama Jamura;Croatia;15.9.2002.;2002-09-15;6f, 2 juv;8;Linyphiidae;Porrhomma;convexum;Porrhomma convexum;;45.754062;15.489269;;deep cave;45.75406215.489269;2;;;;;;;;;;;;;;;;;;;;;;
2970;Cinkalica 3;Croatia;14.5.2006.;2006-05-14;1f;1;Linyphiidae;Porrhomma;egeria;Porrhomma egeria;405;46.27707;16.041044;;deep cave;46.2770716.041044;2;;;;;;;;;;;;;;;;;;;;;;
2971;Ponor Vele vode;Croatia;12.7.2005.;2005-07-12;1f, 4 juv;5;Linyphiidae;Porrhomma;convexum;Porrhomma convexum;;45.418527;14.693695;;deep cave;45.41852714.693695;3;;;;;;;;;;;;;;;;;;;;;;
2972;Dvoga?a;Croatia;16.5.2006.;2006-05-16;1m;1;Linyphiidae;Porrhomma;microps;Porrhomma microps;450;45.850768;15.873148;Tf;deep cave;45.85076815.873148;2;;;;;;;;;;;;;;;;;;;;;;
2974;Špilja kod Dobre vode;Croatia;16.5.2006.;2006-05-16;1f, 1 juv;2;Linyphiidae;Porrhomma;convexum;Porrhomma convexum;;46.269643;16.002576;;deep cave;46.26964316.002576;4;;;;;;;;;;;;;;;;;;;;;;
2975;Baji?eva špilja 1;Croatia;5.6.2002.;2002-06-05;1f, 1 juv;2;Linyphiidae;Porrhomma;egeria;Porrhomma egeria;;45.251716;15.849502;;deep cave;45.25171615.849502;1;;;;;;;;;;;;;;;;;;;;;;
2976;Ponor Bele vode;Croatia;12.7.2005.;2005-07-12;1f;1;Linyphiidae;Porrhomma;convexum;Porrhomma convexum;;45.418527;14.693695;;deep cave;45.41852714.693695;3;;;;;;;;;;;;;;;;;;;;;;
2977;Izvor Križevš?ak;Croatia;28.5.2005.;2005-05-28;1f;1;Linyphiidae;Porrhomma;convexum;Porrhomma convexum;;45.837713;15.858133;;deep cave;45.83771315.858133;2;;;;;;;;;;;;;;;;;;;;;;
2978;Bedara;Croatia;18.12.2005.;2005-12-18;2f, 2 juv;4;Linyphiidae;Porrhomma;egeria;Porrhomma egeria;620;45.751922;15.536692;;deep cave;45.75192215.536692;4;;;;;;;;;;;;;;;;;;;;;;
2979;Dola?a;Croatia;8.12.2002.;2002-12-08;2f;2;Linyphiidae;Porrhomma;convexum;Porrhomma convexum;;45.739571;15.482755;;deep cave;45.73957115.482755;5;;;;;;;;;;;;;;;;;;;;;;
2980;Bedara;Croatia;24.8.2002.;2002-08-24;1f, 4 juv;5;Linyphiidae;Porrhomma;egeria;Porrhomma egeria;620;45.751922;15.536692;;deep cave;45.75192215.536692;4;;;;;;;;;;;;;;;;;;;;;;
2981;Cinkalica 3;Croatia;14.5.2006.;2006-05-14;2f, 1 juv;3;Linyphiidae;Porrhomma;egeria;Porrhomma egeria;405;46.27707;16.041044;;deep cave;46.2770716.041044;2;;;;;;;;;;;;;;;;;;;;;;
2982;Bedara;Croatia;12.10.2003.;2003-10-12;2m, 5f, 1 juv;8;Linyphiidae;Porrhomma;egeria;Porrhomma egeria;620;45.751922;15.536692;;deep cave;45.75192215.536692;4;;;;;;;;;;;;;;;;;;;;;;
2983;Mateši?eva-Popova?a sustav;Croatia;23.4.1998.;1998-04-23;2f;2;Linyphiidae;Porrhomma;convexum;Porrhomma convexum;;45.108023;15.613894;;deep cave;45.10802315.613894;3;;;;;;;;;;;;;;;;;;;;;;
2984;Špilja kod Dobre vode;Croatia;16.5.2006.;2006-05-16;1f;1;Linyphiidae;Porrhomma;convexum;Porrhomma convexum;;46.269643;16.002576;;deep cave;46.26964316.002576;4;;;;;;;;;;;;;;;;;;;;;;
2986;Dola?a;Croatia;17.10.2009.;2009-10-17;2f, 3 juv;5;Linyphiidae;Porrhomma;convexum;Porrhomma convexum;;45.739571;15.482755;;deep cave;45.73957115.482755;5;;;;;;;;;;;;;;;;;;;;;;
2987;Žlota;Croatia;2.2.2002.;2002-02-02;1f;1;Linyphiidae;Porrhomma;convexum;Porrhomma convexum;;45.659111;15.466604;;deep cave;45.65911115.466604;1;;;;;;;;;;;;;;;;;;;;;;
2989;Ambarac;Croatia;11.6.2004.;2004-06-11;2m;2;Linyphiidae;Porrhomma;convexum;Porrhomma convexum;;45.231783;15.306426;;deep cave;45.23178315.306426;1;;;;;;;;;;;;;;;;;;;;;;
2990;Mikuli?ka;Croatia;7.2.1999.;1999-02-07;1f, 1 juv;2;Linyphiidae;Porrhomma;egeria;Porrhomma egeria;585;45.759733;15.527833;;deep cave;45.75973315.527833;1;;;;;;;;;;;;;;;;;;;;;;
2991;Dola?a;Croatia;12.12.2004.;2004-12-12;6f, 3 juv;9;Linyphiidae;Porrhomma;convexum;Porrhomma convexum;;45.739571;15.482755;;deep cave;45.73957115.482755;5;;;;;;;;;;;;;;;;;;;;;;
2992;Sini?i? špilja;Croatia;7.10.2006.;2006-10-07;1m, 1f;2;Linyphiidae;Porrhomma;convexum;Porrhomma convexum;;44.990698;15.177848;;deep cave;44.99069815.177848;6;;;;;;;;;;;;;;;;;;;;;;
2993;Dola?a;Croatia;8.12.2002.;2002-12-08;1m, 1 juv;2;Linyphiidae;Porrhomma;convexum;Porrhomma convexum;;45.739571;15.482755;;deep cave;45.73957115.482755;5;;;;;;;;;;;;;;;;;;;;;;
2994;Vindija;Croatia;17.5.2006.;2006-05-17;2f;2;Linyphiidae;Gen. 11;sp. 1;Gen. 11 sp. 1;270;46.302462;16.079177;;;46.30246216.079177;6;;;;;;;;;;;;;;;;;;;;;;
2995;Cinkalica 3;Croatia;14.5.2006.;2006-05-14;2f, 2 juv;4;Linyphiidae;Porrhomma;egeria;Porrhomma egeria;405;46.27707;16.041044;;deep cave;46.2770716.041044;2;;;;;;;;;;;;;;;;;;;;;;
2996;Mikašinovi?a špilja;Croatia;31.1.2004.;2004-01-31;1f;1;Linyphiidae;Porrhomma;egeria;Porrhomma egeria;230;45.283788;15.28561;;deep cave;45.28378815.28561;3;;;;;;;;;;;;;;;;;;;;;;
2997;Jama u 6. odjelu;Croatia;8.6.2003.;2003-06-08;1f;1;Linyphiidae;Porrhomma;egeria;Porrhomma egeria;;45.733;15.307;;deep cave;45.73315.307;1;;;;;;;;;;;;;;;;;;;;;;
2998;Francuski rudnik 3;Croatia;24.11.2004.;2004-11-24;1f;1;Linyphiidae;Porrhomma;convexum;Porrhomma convexum;;45.905584;15.940186;;deep cave;45.90558415.940186;2;;;;;;;;;;;;;;;;;;;;;;
2999;Dola?a;Croatia;8.12.2003.;2003-12-08;3f, 1 juv;4;Linyphiidae;Porrhomma;convexum;Porrhomma convexum;;45.739571;15.482755;;deep cave;45.73957115.482755;5;;;;;;;;;;;;;;;;;;;;;;
3000;Pušina;Croatia;30.11.2002.;2002-11-30;2m;2;Linyphiidae;Porrhomma;egeria;Porrhomma egeria;724;45.740585;15.35653;;deep cave;45.74058515.35653;4;;;;;;;;;;;;;;;;;;;;;;
3001;Bedara;Croatia;20.12.2003.;2003-12-20;1m;1;Linyphiidae;Porrhomma;egeria;Porrhomma egeria;620;45.751922;15.536692;;deep cave;45.75192215.536692;4;;;;;;;;;;;;;;;;;;;;;;
3002;Batinova jama;Croatia;23.1.2004.;2004-01-23;3f, 1 juv;4;Linyphiidae;Porrhomma;egeria;Porrhomma egeria;450;45.845957;15.868496;;deep cave;45.84595715.868496;2;;;;;;;;;;;;;;;;;;;;;;
3003;Vindija;Croatia;17.5.2006.;2006-05-17;2f;2;Linyphiidae;Micrargus;sp.;Micrargus sp.;;46.302462;16.079177;;;46.30246216.079177;6;;;;;;;;;;;;;;;;;;;;;;
3004;Miljacka 2;Croatia;6.1.2005.;2005-01-06;1 juv m;1;Pholcidae;Holocnemus;sp.;Holocnemus sp.;;44.0002;16.016234;;;44.000216.016234;4;;;;;;;;;;;;;;;;;;;;;;
3005;Ješkalovica;Croatia;4.1.2009.;2009-01-04;1f;1;Linyphiidae;Asthenargus;bracianus;Asthenargus bracianus;;43.299857;16.839313;tf;deep cave;43.29985716.839313;2;;;;;;;;;;;;;;;;;;;;;;
3006;Jama na vrh Vrguda;Croatia;2.11.2008.;2008-11-02;1f;1;Linyphiidae;Asthenargus;bracianus;Asthenargus bracianus;;42.726207;18.039158;tf;deep cave;42.72620718.039158;9;;11;13,43333333;;;;;;;;;;;;;;;;;;;
3007;Atila;Croatia;28.7.2012.;2012-07-28;1f;1;Dysderidae;Stalita;pretneri;Stalita pretneri;950;44.677748;15.110767;Tb;deep cave;44.67774815.110767;2;;;;;;;;;;;;;;;;;;;;;;
3008;Kozjakuša jama;Croatia;2.8.2012.;2012-08-02;1f;1;Dysderidae;Parastalita;stygia;Parastalita stygia;1020;44.67531;15.109028;Tb;deep cave;44.6753115.109028;1;;;;;;;;;;;;;;;;;;;;;;
3010;Los Antonio;Croatia;3.8.2012.;2012-08-03;1m, 1 juv m;2;Linyphiidae;Troglohyphantes;sp. 4;Troglohyphantes sp. 4;;44.632703;15.136461;tb;deep cave;44.63270315.136461;1;;;;;;;;;;;;;;;;;;;;;;
3011;Bukvakuša špilja;Croatia;3.8.2012.;2012-08-03;1 juv;1;Dysderidae;Stalita;pretneri;Stalita pretneri;;44.672873;15.11359;Tb;deep cave;44.67287315.11359;1;;;;;;;;;;;;;;;;;;;;;;
3012;Manita pe?;Croatia;23.9.2012.;2012-09-23;1 juv;1;Dysderidae;Stalita;pretneri;Stalita pretneri;520;44.314302;15.475264;Tb;deep cave;44.31430215.475264;7;;;;;;;;;;;;;;;;;;;;;;
3013;Manita pe?;Croatia;25.7.2012.;2012-07-25;1f;1;Dysderidae;Parastalita;stygia;Parastalita stygia;520;44.314302;15.475264;Tb;deep cave;44.31430215.475264;7;;;;;;;;;;;;;;;;;;;;;;
3014;Manita pe?;Croatia;23.9.2012.;2012-09-23;1f;1;Dysderidae;Stalita;pretneri;Stalita pretneri;520;44.314302;15.475264;Tb;deep cave;44.31430215.475264;7;;;;;;;;;;;;;;;;;;;;;;
3015;Manita pe?;Croatia;25.7.2012.;2012-07-25;1f;1;Dysderidae;Parastalita;stygia;Parastalita stygia;520;44.314302;15.475264;Tb;deep cave;44.31430215.475264;7;;;;;;;;;;;;;;;;;;;;;;
3016;Manita pe?;Croatia;25.7.2012.;2012-07-25;1m;1;Dysderidae;Parastalita;stygia;Parastalita stygia;520;44.314302;15.475264;Tb;deep cave;44.31430215.475264;7;;;;;;;;;;;;;;;;;;;;;;
3017;Atila;Croatia;20.5.2012.;2012-05-20;1f;1;Linyphiidae;Troglohyphantes;sp. 4;Troglohyphantes sp. 4;;44.677748;15.110767;tb;deep cave;44.67774815.110767;2;;;;;;;;;;;;;;;;;;;;;;
3018;Kad jaganjci utihnu;Croatia;5.6.2006.;2006-06-05;2m;2;Leptonetidae;Cataleptoneta;lingulata;Cataleptoneta lingulata;;44.365085;15.314841;tb;deep cave;44.36508515.314841;3;;;;;;;;;;;;;;;;;;;;;;
3019;Špilja u Vukoti?a dragi;Croatia;1.6.2006.;2006-06-01;4m, 3f, 3 juv;1;Leptonetidae;Cataleptoneta;lingulata;Cataleptoneta lingulata;;44.808197;14.883737;tb;deep cave;44.80819714.883737;2;;;;;;;;;;;;;;;;;;;;;;
3020;Grunfova jama;Croatia;31.7.2012.;2012-07-31;1m;1;Linyphiidae;Gen.;sp. X;Gen. sp. X;;44.675604;15.109244;;;44.67560415.109244;1;;;;;;;;;;;;;;;;;;;;;;
3022;Jazinka;Croatia;20.10.2012.;2012-10-20;1m;1;Dysderidae;Stalagtia;sp. 4;Stalagtia sp. 4;235;43.975892;16.029694;Tb;deep cave;43.97589216.029694;2;;;;;;;;;;;;;;;;;;;;;;
3023;Stara jametina;Croatia;17.10.2012.;2012-10-17;1m;1;Dysderidae;Stalagtia;sp. 4;Stalagtia sp. 4;;43.794009;16.00259;Tb;deep cave;43.79400916.00259;6;;;;;;;;;;;;;;;;;;;;;;
3025;Stara jametina;Croatia;17.10.2012.;2012-10-17;1 juv;1;Dysderidae;Stalagtia;sp. 4;Stalagtia sp. 4;;43.794009;16.00259;Tb;deep cave;43.79400916.00259;6;;;;;;;;;;;;;;;;;;;;;;
3026;Miljacka 2;Croatia;18.10.2012.;2012-10-18;1m, 2 juvm, 2 juv;5;Nesticidae;Kryptonesticus;eremita;Kryptonesticus eremita;;44.0002;16.016234;tf;deep cave;44.000216.016234;4;;;;;;;;;;;;;;;;;;;;;;
3028;Miljacka 2;Croatia;21.10.2012.;2012-10-21;1m;1;Nesticidae;Kryptonesticus;eremita;Kryptonesticus eremita;;44.0002;16.016234;tf;deep cave;44.000216.016234;4;;;;;;;;;;;;;;;;;;;;;;
3030;Špilja u izvoru Krke;Croatia;19.10.2012.;2012-10-19;1f, 2juv;3;Nesticidae;Kryptonesticus;eremita;Kryptonesticus eremita;;44.0422953;16.2352157514;tf;deep cave;44.042295316.2352157514;2;;;;;;;;;;;;;;;;;;;;;;
3031;Sedrena špilja iza mlina;Croatia;19.10.2012.;2012-10-19;1f, 1 juv;2;Nesticidae;Kryptonesticus;eremita;Kryptonesticus eremita;198;44.013402;16.067798;tf;deep cave;44.01340216.067798;6;;;;;;;;;;;;;;;;;;;;;;
3032;Jazinka;Croatia;20.10.2012.;2012-10-20;1f, 2 juv;3;Nesticidae;Kryptonesticus;eremita;Kryptonesticus eremita;235;43.975892;16.029694;tf;deep cave;43.97589216.029694;2;;;;;;;;;;;;;;;;;;;;;;
3033;Miljacka 2;Croatia;18.10.2012.;2012-10-18;1m;1;Nesticidae;Kryptonesticus;eremita;Kryptonesticus eremita;;44.0002;16.016234;tf;deep cave;44.000216.016234;4;;;;;;;;;;;;;;;;;;;;;;
3034;Špilja u izvoru Krke;Croatia;19.10.2012.;2012-10-19;2f, 3 juv;5;Nesticidae;Kryptonesticus;eremita;Kryptonesticus eremita;;44.0422953;16.2352157514;tf;deep cave;44.042295316.2352157514;2;;;;;;;;;;;;;;;;;;;;;;
3035;Jama na Selinama;Croatia;22.10.2012.;2012-10-22;3f, 3 juv;6;Nesticidae;Kryptonesticus;eremita;Kryptonesticus eremita;;43.914655;15.962407;tf;deep cave;43.91465515.962407;4;;;;;;;;;;;;;;;;;;;;;;
3036;Jama na Bibinovcu;Croatia;22.10.2012.;2012-10-22;1f;1;Nesticidae;Kryptonesticus;eremita;Kryptonesticus eremita;;43.908757;15.957245;tf;deep cave;43.90875715.957245;3;;;;;;;;;;;;;;;;;;;;;;
3038;Stara jametina;Croatia;17.10.2012.;2012-10-17;1m, 3f;4;Linyphiidae;Micrargus;herbigradus;Micrargus herbigradus;;43.794009;16.00259;Tf;deep cave;43.79400916.00259;6;;;;;;;;;;;;;;;;;;;;;;
3040;Stara jametina;Croatia;17.10.2012.;2012-10-17;3f, 1 juv;4;Linyphiidae;Micrargus;herbigradus;Micrargus herbigradus;;43.794009;16.00259;Tf;deep cave;43.79400916.00259;6;;;;;;;;;;;;;;;;;;;;;;
3041;Stara jametina;Croatia;17.10.2012.;2012-10-17;1f;1;Theridiidae;Episinus;cavernicola;Episinus cavernicola;;43.794009;16.00259;Tf;deep cave;43.79400916.00259;6;;;;;;;;;;;;;;;;;;;;;;
3042;Stara jametina;Croatia;17.10.2012.;2012-10-17;1f, 1 juv;2;Theridiidae;Episinus;cavernicola;Episinus cavernicola;;43.794009;16.00259;Tf;deep cave;43.79400916.00259;6;;;;;;;;;;;;;;;;;;;;;;
3043;Stara jametina;Croatia;17.10.2012.;2012-10-17;1f, 1m;2;Linyphiidae;Micrargus;herbigradus;Micrargus herbigradus;;43.794009;16.00259;Tf;deep cave;43.79400916.00259;6;;;;;;;;;;;;;;;;;;;;;;
3044;Stara jametina;Croatia;17.10.2012.;2012-10-17;2m, 1f;3;Linyphiidae;Micrargus;herbigradus;Micrargus herbigradus;;43.794009;16.00259;Tf;deep cave;43.79400916.00259;6;;;;;;;;;;;;;;;;;;;;;;
3045;Stara jametina;Croatia;17.10.2012.;2012-10-17;1m, 1f;2;Linyphiidae;Micrargus;herbigradus;Micrargus herbigradus;;43.794009;16.00259;Tf;deep cave;43.79400916.00259;6;;;;;;;;;;;;;;;;;;;;;;
3047;Stara jametina;Croatia;17.10.2012.;2012-10-17;1f;1;Linyphiidae;Micrargus;herbigradus;Micrargus herbigradus;;43.794009;16.00259;Tf;deep cave;43.79400916.00259;6;;;;;;;;;;;;;;;;;;;;;;
3048;Stara jametina;Croatia;17.10.2012.;2012-10-17;1f, 1m;2;Linyphiidae;Micrargus;herbigradus;Micrargus herbigradus;;43.794009;16.00259;Tf;deep cave;43.79400916.00259;6;;;;;;;;;;;;;;;;;;;;;;
3049;Stara jametina;Croatia;17.10.2012.;2012-10-17;2f, 1 juv;3;Theridiidae;Episinus;cavernicola;Episinus cavernicola;;43.794009;16.00259;Tf;deep cave;43.79400916.00259;6;;;;;;;;;;;;;;;;;;;;;;
3050;Jama na Bibinovcu;Croatia;22.10.2012.;2012-10-22;1m;1;Agelenidae;Tegenaria;annulata;Tegenaria annulata;;43.908757;15.957245;Tf;deep cave;43.90875715.957245;3;;;;;;;;;;;;;;;;;;;;;;
3051;Miljacka 2;Croatia;18.10.2012.;2012-10-18;2m, 1f;3;Agelenidae;Tegenaria;domestica;Tegenaria domestica;;44.0002;16.016234;Tf;deep cave;44.000216.016234;4;;;;;;;;;;;;;;;;;;;;;;
3052;Miljacka 2;Croatia;18.10.2012.;2012-10-18;1m, 2 juv;3;Agelenidae;Tegenaria;domestica;Tegenaria domestica;;44.0002;16.016234;Tf;deep cave;44.000216.016234;4;;;;;;;;;;;;;;;;;;;;;;
3056;Keranova golubinka;Croatia;20.10.2012.;2012-10-20;3f, 1 juv;4;Linyphiidae;Palliduphantes;byzantinus;Palliduphantes byzantinus;;43.934367;16.058782;Tf;deep cave;43.93436716.058782;4;;;;;;;;;;;;;;;;;;;;;;
3057;Sedrena špilja kod stola;Croatia;19.10.2012.;2012-10-19;1f, 3juv;4;Nesticidae;Kryptonesticus;eremita;Kryptonesticus eremita;;44.01385;16.068978;tf;deep cave;44.0138516.068978;2;;;;;;;;;;;;;;;;;;;;;;
3058;Sedrena špilja kod stola;Croatia;19.10.2012.;2012-10-19;1f;1;Nesticidae;Kryptonesticus;eremita;Kryptonesticus eremita;;44.01385;16.068978;tf;deep cave;44.0138516.068978;2;;;;;;;;;;;;;;;;;;;;;;
3060;Miljacka 2;Croatia;18.10.2012.;2012-10-18;1f;1;Nesticidae;Kryptonesticus;eremita;Kryptonesticus eremita;;44.0002;16.016234;tf;deep cave;44.000216.016234;4;;;;;;;;;;;;;;;;;;;;;;
3061;Sedrena špilja s jamskim ulazom;Croatia;19.10.2012.;2012-10-19;1f;1;Nesticidae;Kryptonesticus;eremita;Kryptonesticus eremita;;44.013829;16.069202;tf;deep cave;44.01382916.069202;2;;;;;;;;;;;;;;;;;;;;;;
3062;Jama na Bibinovcu;Croatia;22.10.2012.;2012-10-22;1f, 1 juv;2;Nesticidae;Kryptonesticus;eremita;Kryptonesticus eremita;;43.908757;15.957245;tf;deep cave;43.90875715.957245;3;;;;;;;;;;;;;;;;;;;;;;
3063;Tradanj;Croatia;8.1.2005.;2005-01-08;1f, 1 juv;2;Pholcidae;Holocnemus;pluchei;Holocnemus pluchei;;43.793104;15.845439;tf;deep cave;43.79310415.845439;3;;;;;;;;;;;;;;;;;;;;;;
3064;Sedrena špilja iza mlina;Croatia;19.10.2012.;2012-10-19;1f;1;Leptonetidae;Barusia;maheni;Barusia maheni;198;44.013402;16.067798;tf;deep cave;44.01340216.067798;6;;;;;;;;;;;;;;;;;;;;;;
3065;Sedrena špilja iza mlina;Croatia;19.10.2012.;2012-10-19;1m;1;Leptonetidae;Barusia;maheni;Barusia maheni;198;44.013402;16.067798;tf;deep cave;44.01340216.067798;6;;;;;;;;;;;;;;;;;;;;;;
3066;Sedrena špilja iza mlina;Croatia;19.10.2012.;2012-10-19;1f, 3 juv;4;Leptonetidae;Barusia;maheni;Barusia maheni;198;44.013402;16.067798;tf;deep cave;44.01340216.067798;6;;;;;;;;;;;;;;;;;;;;;;
3067;Sedrena špilja iza mlina;Croatia;19.10.2012.;2012-10-19;1 juv f;1;Leptonetidae;Barusia;maheni;Barusia maheni;198;44.013402;16.067798;tf;deep cave;44.01340216.067798;6;;;;;;;;;;;;;;;;;;;;;;
3069;Stara jametina;Croatia;17.10.2012.;2012-10-17;1f;1;Linyphiidae;Palliduphantes;istrianus;Palliduphantes istrianus;;43.794009;16.00259;Tf;deep cave;43.79400916.00259;6;;;;;;;;;;;;;;;;;;;;;;
3070;Keranova golubinka;Croatia;20.10.2012.;2012-10-20;1m;1;Linyphiidae;Centromerus;cavernarum;Centromerus cavernarum;;43.934367;16.058782;Tf;deep cave;43.93436716.058782;4;;;;;;;;;;;;;;;;;;;;;;
3072;Keranova golubinka;Croatia;20.10.2012.;2012-10-20;1f;1;Linyphiidae;Gen. 4;sp. 1;Gen. 4 sp. 1;;43.934367;16.058782;;;43.93436716.058782;4;;;;;;;;;;;;;;;;;;;;;;
3073;Keranova golubinka;Croatia;20.10.2012.;2012-10-20;1m, 1 juv;2;Linyphiidae;Gen.;sp. X;Gen. sp. X;;43.934367;16.058782;;;43.93436716.058782;4;;;;;;;;;;;;;;;;;;;;;;
3074;Jama na Selinama;Croatia;22.10.2012.;2012-10-22;1m;1;Linyphiidae;Gen.;sp. X;Gen. sp. X;;43.914655;15.962407;;;43.91465515.962407;4;;;;;;;;;;;;;;;;;;;;;;
3075;Jama na Bibinovcu;Croatia;22.10.2012.;2012-10-22;1m;1;Linyphiidae;Gen.;sp. X;Gen. sp. X;;43.908757;15.957245;;;43.90875715.957245;3;;;;;;;;;;;;;;;;;;;;;;
3077;Jazinka;Croatia;16.12.2012.;2012-12-16;1f, 1juv;2;Nesticidae;Kryptonesticus;eremita;Kryptonesticus eremita;235;43.975892;16.029694;tf;deep cave;43.97589216.029694;2;;;;;;;;;;;;;;;;;;;;;;
3078;Jama u koritu Lemeš;Croatia;17.12.2012.;2012-12-17;1juvm, 2 juv;3;Nesticidae;Kryptonesticus;eremita;Kryptonesticus eremita;;43.884571;16.326893;;deep cave;43.88457116.326893;4;;;;;;;;;;;;;;;;;;;;;;
3079;Jama u koritu Lemeš;Croatia;17.12.2012.;2012-12-17;1juvm, 1 juv;2;Nesticidae;Kryptonesticus;eremita;Kryptonesticus eremita;;43.884571;16.326893;;deep cave;43.88457116.326893;4;;;;;;;;;;;;;;;;;;;;;;
3080;Škarin Samograd;Croatia;17.10.2009.;2009-10-17;1m;1;Nesticidae;Kryptonesticus;eremita;Kryptonesticus eremita;;43.781501;16.09613;tf;deep cave;43.78150116.09613;3;;;;;;;;;;;;;;;;;;;;;;
3081;Jagodnjak;Croatia;17.12.2012.;2012-12-17;1f, 1 juvm, 1 juv;3;Nesticidae;Kryptonesticus;eremita;Kryptonesticus eremita;;44.002869;16.074441;tf;deep cave;44.00286916.074441;2;;;;;;;;;;;;;;;;;;;;;;
3082;Golubnja?a u Grulovi?ima;Croatia;18.12.2012.;2012-12-18;2f;2;Nesticidae;Kryptonesticus;eremita;Kryptonesticus eremita;;44.006712;15.931138;tf;deep cave;44.00671215.931138;1;;;;;;;;;;;;;;;;;;;;;;
3083;Špilja ispod Vukovi?a poda;Croatia;19.12.2012.;2012-12-19;1f, 1 juv;2;Nesticidae;Kryptonesticus;eremita;Kryptonesticus eremita;;43.85296;15.97176;tf;deep cave;43.8529615.97176;3;;;;;;;;;;;;;;;;;;;;;;
3084;Špilja ispod Vukovi?a poda;Croatia;19.12.2012.;2012-12-19;1f;1;Dysderidae;Harpactea;sp. 11;Harpactea sp. 11;;43.85296;15.97176;Tf;deep cave;43.8529615.97176;3;;;;;;;;;;;;;;;;;;;;;;
3085;Špilja ispod Vukovi?a poda;Croatia;19.12.2012.;2012-12-19;1f;1;Nesticidae;Kryptonesticus;eremita;Kryptonesticus eremita;;43.85296;15.97176;tf;deep cave;43.8529615.97176;3;;;;;;;;;;;;;;;;;;;;;;
3086;Jama u koritu Lemeš;Croatia;17.12.2012.;2012-12-17;1 juv;1;Nesticidae;Kryptonesticus;eremita;Kryptonesticus eremita;;43.884571;16.326893;;deep cave;43.88457116.326893;4;;;;;;;;;;;;;;;;;;;;;;
3087;Jama u koritu Lemeš;Croatia;17.12.2012.;2012-12-17;1m;1;Dysderidae;Harpactea;sp. 18;Harpactea sp. 18;;43.884571;16.326893;Tf;deep cave;43.88457116.326893;4;;;;;;;;;;;;;;;;;;;;;;
3092;Makeljina špilja;Croatia;17.12.2012.;2012-12-17;1f;1;Tetragnathidae;Meta;bourneti;Meta bourneti;;43.995296;16.07216;Tf;deep cave;43.99529616.07216;5;;;;;;;;;;;;;;;;;;;;;;
3093;Makeljina špilja;Croatia;17.12.2012.;2012-12-17;1m;1;Agelenidae;Tegenaria;annulata;Tegenaria annulata;;43.995296;16.07216;Tf;deep cave;43.99529616.07216;5;;;;;;;;;;;;;;;;;;;;;;
3097;Dvostruka jama Lemeš I;Croatia;17.12.2012.;2012-12-17;1f;1;Tetragnathidae;Meta;menardi;Meta menardi;;43.882863;16.330514;Tf;deep cave;43.88286316.330514;1;;;;;;;;;;;;;;;;;;;;;;
3099;Jama na Selinama;Croatia;15.12.2012.;2012-12-15;1f;1;Agelenidae;Tegenaria;sp. 7;Tegenaria sp. 7;;43.914655;15.962407;;;43.91465515.962407;4;;;;;;;;;;;;;;;;;;;;;;
3103;Makeljina špilja;Croatia;17.12.2012.;2012-12-17;1 juv;1;Dysderidae;Stalagtia;sp. 4;Stalagtia sp. 4;;43.995296;16.07216;Tb;deep cave;43.99529616.07216;5;;;;;;;;;;;;;;;;;;;;;;
3104;Špilja kod Gornjih Krni?a;Croatia;15.12.2012.;2012-12-15;1f;1;Theridiidae;Episinus;cavernicola;Episinus cavernicola;;43.791103;16.015638;Tf;deep cave;43.79110316.015638;1;;;;;;;;;;;;;;;;;;;;;;
3105;Jama u koritu Lemeš;Croatia;17.12.2012.;2012-12-17;1f;1;Linyphiidae;Centromerus;cavernarum;Centromerus cavernarum;;43.884571;16.326893;Tf;deep cave;43.88457116.326893;4;;;;;;;;;;;;;;;;;;;;;;
3106;Jama u koritu Lemeš;Croatia;17.12.2012.;2012-12-17;2f;2;Linyphiidae;Palliduphantes;istrianus;Palliduphantes istrianus;;43.884571;16.326893;Tf;deep cave;43.88457116.326893;4;;;;;;;;;;;;;;;;;;;;;;
3108;Triši?a jama;Croatia;16.12.2102.;2012-12-16;1f, 1 m, 1 prosoma (f?);2;Linyphiidae;Palliduphantes;istrianus;Palliduphantes istrianus;;43.949231;15.947793;Tf;deep cave;43.94923115.947793;2;;;;;;;;;;;;;;;;;;;;;;
3109;Triši?a jama;Croatia;16.12.2102.;2012-12-16;1m;1;Linyphiidae;Micrargus;herbigradus;Micrargus herbigradus;;43.949231;15.947793;Tf;deep cave;43.94923115.947793;2;;;;;;;;;;;;;;;;;;;;;;
3112;Sedrena špilja iza mlina;Croatia;14.12.2012.;2012-12-14;1m;1;Leptonetidae;Barusia;maheni;Barusia maheni;198;44.013402;16.067798;tf;deep cave;44.01340216.067798;6;;;;;;;;;;;;;;;;;;;;;;
3113;Keranova golubinka;Croatia;18.12.2012.;2012-12-18;1f;1;Linyphiidae;Centromerus;cavernarum;Centromerus cavernarum;;43.934367;16.058782;Tf;deep cave;43.93436716.058782;4;;;;;;;;;;;;;;;;;;;;;;
3114;Keranova golubinka;Croatia;18.12.2012.;2012-12-18;1m, 7f, 2 juv;1;Linyphiidae;Palliduphantes;byzantinus;Palliduphantes byzantinus;;43.934367;16.058782;Tf;deep cave;43.93436716.058782;4;;;;;;;;;;;;;;;;;;;;;;
3115;Keranova golubinka;Croatia;18.12.2012.;2012-12-18;1f;1;Linyphiidae;Palliduphantes;byzantinus;Palliduphantes byzantinus;;43.934367;16.058782;Tf;deep cave;43.93436716.058782;4;;;;;;;;;;;;;;;;;;;;;;
3117;Keranova golubinka;Croatia;18.12.2012.;2012-12-18;2f, 2 juv;4;Linyphiidae;Palliduphantes;byzantinus;Palliduphantes byzantinus;;43.934367;16.058782;Tf;deep cave;43.93436716.058782;4;;;;;;;;;;;;;;;;;;;;;;
3118;Triši?a jama;Croatia;16.12.2102.;2012-12-16;2f;2;Linyphiidae;Palliduphantes;istrianus;Palliduphantes istrianus;;43.949231;15.947793;Tf;deep cave;43.94923115.947793;2;;;;;;;;;;;;;;;;;;;;;;
3119;Triši?a jama;Croatia;16.12.2102.;2012-12-16;2f;2;Linyphiidae;Micrargus;herbigradus;Micrargus herbigradus;;43.949231;15.947793;Tf;deep cave;43.94923115.947793;2;;;;;;;;;;;;;;;;;;;;;;
3120;Stara jametina;Croatia;15.12.2012.;2012-12-15;1m;1;Theridiidae;Episinus;cavernicola;Episinus cavernicola;;43.794009;16.00259;Tf;deep cave;43.79400916.00259;6;;;;;;;;;;;;;;;;;;;;;;
3122;Jagodnjak;Croatia;17.12.2012.;2012-12-17;1m;1;Linyphiidae;Palliduphantes;istrianus;Palliduphantes istrianus;;44.002869;16.074441;Tf;deep cave;44.00286916.074441;2;;;;;;;;;;;;;;;;;;;;;;
3123;Sedrena špilja kod stola;Croatia;14.12.2012.;2012-12-14;1 juv;1;Pholcidae;Holocnemus;sp.;Holocnemus sp.;;44.01385;16.068978;Tf?;;44.0138516.068978;2;;;;;;;;;;;;;;;;;;;;;;
3129;Jama na Selinama;Croatia;15.12.2012.;2012-12-15;1m;1;Linyphiidae;Gen. 9;sp. 1;Gen. 9 sp. 1;;43.914655;15.962407;;;43.91465515.962407;4;;;;;;;;;;;;;;;;;;;;;;
3130;Jama na Selinama;Croatia;15.12.2012.;2012-12-15;1f;1;Linyphiidae;Gen.;sp. X;Gen. sp. X;;43.914655;15.962407;;;43.91465515.962407;4;;;;;;;;;;;;;;;;;;;;;;
3131;Sedrena špilja iza mlina;Croatia;14.12.2012.;2012-12-14;1m, 3f, 1 juv;5;Leptonetidae;Barusia;maheni;Barusia maheni;198;44.013402;16.067798;tf;deep cave;44.01340216.067798;6;;;;;;;;;;;;;;;;;;;;;;
3133;Sedrena špilja iza mlina;Croatia;17.12.2012.;2012-12-17;2juv/f;2;Leptonetidae;Barusia;maheni;Barusia maheni;198;44.013402;16.067798;tf;deep cave;44.01340216.067798;6;;;;;;;;;;;;;;;;;;;;;;
3135;Sedrena špilja iza mlina;Croatia;17.12.2012.;2012-12-17;2f , 1 m;3;Leptonetidae;Barusia;maheni;Barusia maheni;198;44.013402;16.067798;tf;deep cave;44.01340216.067798;6;;;;;;;;;;;;;;;;;;;;;;
3136;Sedrena špilja iza mlina;Croatia;17.12.2012.;2012-12-17;1m;1;Leptonetidae;Barusia;maheni;Barusia maheni;198;44.013402;16.067798;tf;deep cave;44.01340216.067798;6;;;;;;;;;;;;;;;;;;;;;;
3137;Špilja u kamenolomu Tounj;Croatia;7.10.2007.;2007-10-07;1f, 2 juv;3;Linyphiidae;Troglohyphantes;croaticus;Troglohyphantes croaticus;263;45.245525;15.318946;tb;deep cave;45.24552515.318946;3;;;;;;;;;;;;;;;;;;;;;;
3138;Špilja u kamenolomu Tounj;Croatia;23.1.1999.;1999-01-23;1f, 1 juv m, 1 juv;3;Linyphiidae;Troglohyphantes;croaticus;Troglohyphantes croaticus;263;45.245525;15.318946;tb;deep cave;45.24552515.318946;3;;;;;;;;;;;;;;;;;;;;;;
3139;Špilja u kamenolomu Tounj;Croatia;23.1.1999.;1999-01-23;7f, 1 juv;8;Linyphiidae;Porrhomma;egeria;Porrhomma egeria;263;45.245525;15.318946;;deep cave;45.24552515.318946;3;;;;;;;;;;;;;;;;;;;;;;
3140;Špilja u kamenolomu Tounj;Croatia;23.1.1999.;1999-01-23;1 juv;1;Dysderidae;Stalita;pretneri;Stalita pretneri;263;45.245525;15.318946;Tb;deep cave;45.24552515.318946;3;;;;;;;;;;;;;;;;;;;;;;
3141;Tounj?ica;Croatia;18.6.2006.;2006-06-18;1f;1;Linyphiidae;Centromerus;cavernarum;Centromerus cavernarum;;45.248722;15.322408;Tf;deep cave;45.24872215.322408;5;14;;;;;;;;;;;;;;;;;;;;;
3142;Tounj?ica;Croatia;30.3.2004.;2004-03-30;2f;2;Linyphiidae;Centromerus;cavernarum;Centromerus cavernarum;;45.248722;15.322408;Tf;deep cave;45.24872215.322408;5;14;;;;;;;;;;;;;;;;;;;;;
3144;Tounj?ica;Croatia;18.6.2006.;2006-06-18;2 f;2;Linyphiidae;Centromerus;cavernarum;Centromerus cavernarum;;45.248722;15.322408;Tf;deep cave;45.24872215.322408;5;14;;;;;;;;;;;;;;;;;;;;;
3145;?ulin ponor-Medvedica;Croatia;25.2.2012.;2012-02-25;2f;2;Linyphiidae;Porrhomma;convexum;Porrhomma convexum;320;45.267036;15.223745;Tf;deep cave;45.26703615.223745;3;;;;;;;;;;;;;;;;;;;;;;
3146;?ulin ponor-Medvedica;Croatia;11.2.2006.;2006-02-11;1f;1;Linyphiidae;Porrhomma;convexum;Porrhomma convexum;320;45.267036;15.223745;Tf;deep cave;45.26703615.223745;3;;;;;;;;;;;;;;;;;;;;;;
3147;Brezdanja?a na Stražbenici;Croatia;11.11.1995.;1995-11-11;1m , 1f;2;Dysderidae;Parastalita;stygia;Parastalita stygia;;45.26712;14.691436;Tb;deep cave;45.2671214.691436;4;;;;;;;;;;;;;;;;;;;;;;
3148;Markova jama kod Tara;Croatia;12.5.2001.;2001-05-12;1f;1;Dysderidae;Stalita;taenaria;Stalita taenaria;95;45.319298;13.631373;Tb;deep cave;45.31929813.631373;7;;;;;;;;;;;;;;;;;;;;;;
3149;Jama Leopoldina;Croatia;30.10.2011.;2011-10-30;1f;1;Dysderidae;Stalita;taenaria;Stalita taenaria;;45.387514;13.777034;Tb;deep cave;45.38751413.777034;1;;;;;;;;;;;;;;;;;;;;;;
3150;Jama kod Buri?i;Croatia;12.5.2001.;2001-05-12;2 juv;2;Dysderidae;Stalita;taenaria;Stalita taenaria;;45.110672;13.83399;Tb;deep cave;45.11067213.83399;1;;;;;;;;;;;;;;;;;;;;;;
3151;Markova jama kod Tara;Croatia;28.8.1997.;1997-08-28;2 juv;2;Dysderidae;Stalita;taenaria;Stalita taenaria;95;45.319298;13.631373;Tb;deep cave;45.31929813.631373;7;;;;;;;;;;;;;;;;;;;;;;
3152;Jama Staja;Croatia;14.8.2001.;2001-08-14;2 juv;2;Dysderidae;Stalita;taenaria;Stalita taenaria;;44.919862;13.938147;Tb;deep cave;44.91986213.938147;4;;;;;;;;;;;;;;;;;;;;;;
3153;Pliškovi?eva jama;Croatia;19.2.2007.;2007-02-19;1 juv;1;Dysderidae;Stalita;taenaria;Stalita taenaria;;45.071604;13.872151;Tb;deep cave;45.07160413.872151;4;;;;;;;;;;;;;;;;;;;;;;
3154;Tamnica;Croatia;11.11.1998.;1998-11-11;1f;1;Dysderidae;Parastalita;stygia;Parastalita stygia;;45.27298;15.36197;Tb;deep cave;45.2729815.36197;3;;;;;;;;;;;;;;;;;;;;;;
3155;Tamnica;Croatia;11.11.1998.;1998-11-11;1 juv;1;Dysderidae;Dysdera;sp.;Dysdera sp.;;45.27298;15.36197;Tx;;45.2729815.36197;3;;;;;;;;;;;;;;;;;;;;;;
3156;Mateši?eva-Popova?a sustav;Croatia;23.4.1998.;1998-04-23;1f;1;Dysderidae;Parastalita;stygia;Parastalita stygia;;45.108023;15.613894;Tb;deep cave;45.10802315.613894;3;;;;;;;;;;;;;;;;;;;;;;
3157;?utno;Croatia;11.5.1998.;1998-05-11;2m, 1f;3;Dysderidae;Parastalita;stygia;Parastalita stygia;210;45.415607;15.233039;Tb;deep cave;45.41560715.233039;4;;;;;;;;;;;;;;;;;;;;;;
3158;?utno;Croatia;11.5.1998.;1998-05-11;1f;1;Dysderidae;Stalita;pretneri;Stalita pretneri;210;45.415607;15.233039;Tb;deep cave;45.41560715.233039;4;;;;;;;;;;;;;;;;;;;;;;
3159;Jama Jankonka;Croatia;16.1.1999.;1999-01-16;1m, 2 f;3;Dysderidae;Parastalita;stygia;Parastalita stygia;;45.397377;15.248276;Tb;deep cave;45.39737715.248276;1;;;;;;;;;;;;;;;;;;;;;;
3160;Panjkov ponor;Croatia;23.7.2003.;2003-07-23;1m;1;Dysderidae;Parastalita;stygia;Parastalita stygia;;45.015797;15.723489;Tb;deep cave;45.01579715.723489;1;;;;;;;;;;;;;;;;;;;;;;
3161;Gornja Bara?eva;Croatia;16.2.2002.;2002-02-16;1 juv;1;Dysderidae;Parastalita;stygia;Parastalita stygia;;44.983895;15.721656;Tb;deep cave;44.98389515.721656;8;;;;;;;;;;;;;;;;;;;;;;
3162;Tamnica;Croatia;26.5.2012.;2012-05-26;1m;1;Dysderidae;Parastalita;stygia;Parastalita stygia;;45.27298;15.36197;Tb;deep cave;45.2729815.36197;3;;;;;;;;;;;;;;;;;;;;;;
3163;Tamnica;Croatia;22.2.1998.;1998-02-22;1m, 1f;2;Dysderidae;Parastalita;stygia;Parastalita stygia;;45.27298;15.36197;Tb;deep cave;45.2729815.36197;3;;;;;;;;;;;;;;;;;;;;;;
3164;Eko špilja;Croatia;10.8.1998.;1998-08-10;1f;1;Dysderidae;Parastalita;stygia;Parastalita stygia;;45.350927;15.478623;Tb;deep cave;45.35092715.478623;1;;;;;;;;;;;;;;;;;;;;;;
3165;Jama na Škrilama;Croatia;16.10.1998.;1998-10-16;1f, 1 juv;2;Dysderidae;Parastalita;stygia;Parastalita stygia;;45.532375;15.344297;Tb;deep cave;45.53237515.344297;1;;;;;;;;;;;;;;;;;;;;;;
3166;Plantaža;Croatia;22.6.2007.;2007-06-22;1 juv;1;Dysderidae;Stalita;pretneri;Stalita pretneri;;45.227501;15.325084;Tb;deep cave;45.22750115.325084;2;;;;;;;;;;;;;;;;;;;;;;
3167;Kunina jama;Croatia;1.5.1999.;1999-05-01;1m;1;Dysderidae;Parastalita;stygia;Parastalita stygia;;45.04668;15.6877;Tb;deep cave;45.0466815.6877;2;;;;;;;;;;;;;;;;;;;;;;
3168;?utno;Croatia;3.10.1999.;1999-10-03;1f, 2 juv;3;Dysderidae;Stalita;pretneri;Stalita pretneri;210;45.415607;15.233039;Tb;deep cave;45.41560715.233039;4;;;;;;;;;;;;;;;;;;;;;;
3169;Zagorska pe? kod Ogulina;Croatia;17.6.2006.;2006-06-17;1f;1;Dysderidae;Parastalita;stygia;Parastalita stygia;335;45.196851;15.219904;Tb;deep cave;45.19685115.219904;3;;;;;;;;;;;;;;;;;;;;;;
3170;Zagorska pe? kod Ogulina;Croatia;17.6.2006.;2006-06-17;1juv;1;Dysderidae;Stalita;pretneri;Stalita pretneri;335;45.196851;15.219904;Tb;deep cave;45.19685115.219904;3;;;;;;;;;;;;;;;;;;;;;;
3171;?utno;Croatia;2.5.2000.;2000-05-02;1f;1;Dysderidae;Parastalita;stygia;Parastalita stygia;210;45.415607;15.233039;Tb;deep cave;45.41560715.233039;4;;;;;;;;;;;;;;;;;;;;;;
3173;Zvone?ka II;Croatia;1998.;1905-06-20;1m, 1f;2;Dysderidae;Parastalita;stygia;Parastalita stygia;;45.531095;15.367671;Tb;deep cave;45.53109515.367671;3;;;;;;;;;;;;;;;;;;;;;;
3174;Vodena špilja;Croatia;4.7.1998.;1998-07-04;1 juv;1;Dysderidae;Parastalita;stygia;Parastalita stygia;;45.354577;15.472853;Tb;deep cave;45.35457715.472853;2;;;;;;;;;;;;;;;;;;;;;;
3176;Mikašinovi?a špilja;Croatia;10.2000.;2000-10;;;Dysderidae;Parastalita;stygia;Parastalita stygia;230;45.283788;15.28561;Tb;deep cave;45.28378815.28561;3;;;;;;;;;;;;;;;;;;;;;;
3177;Vari?akova špilja;Croatia;30.7.2002.;2002-07-30;2f, 1m;3;Dysderidae;Parastalita;stygia;Parastalita stygia;;45.008251;15.736981;Tb;deep cave;45.00825115.736981;5;;;;;;;;;;;;;;;;;;;;;;
3178;Gornja Bara?eva;Croatia;17.5.2003.;2003-05-17;1m;1;Dysderidae;Parastalita;stygia;Parastalita stygia;;44.983895;15.721656;Tb;deep cave;44.98389515.721656;8;;;;;;;;;;;;;;;;;;;;;;
3179;Zagorska pe? kod Ogulina;Croatia;9.1.1999.;1999-01-09;1m;1;Dysderidae;Parastalita;stygia;Parastalita stygia;335;45.196851;15.219904;Tb;deep cave;45.19685115.219904;3;;;;;;;;;;;;;;;;;;;;;;
3180;Eko špilja;Croatia;4.7.1998.;1998-07-04;1 juv, 1 juv neki drugi;1;Dysderidae;Parastalita;stygia;Parastalita stygia;;45.350927;15.478623;Tb;deep cave;45.35092715.478623;1;;;;;;;;;;;;;;;;;;;;;;
3181;Mateši?eva-Popova?a sustav;Croatia;15.5.1999.;1999-05-15;1f;1;Dysderidae;Parastalita;stygia;Parastalita stygia;;45.108023;15.613894;Tb;deep cave;45.10802315.613894;3;;;;;;;;;;;;;;;;;;;;;;
3182;Bubijeva jama;Croatia;5.3.1999.;1999-03-05;1m;1;Dysderidae;Parastalita;stygia;Parastalita stygia;;45.339219;15.470103;Tb;deep cave;45.33921915.470103;1;;;;;;;;;;;;;;;;;;;;;;
3183;Vodena špilja;Croatia;31.5.1998.;1998-05-31;1f;1;Dysderidae;Parastalita;stygia;Parastalita stygia;;45.354577;15.472853;Tb;deep cave;45.35457715.472853;2;;;;;;;;;;;;;;;;;;;;;;
3184;Markova špilja, Kordun;Croatia;16.1.2000.;2000-01-16;1f;1;Dysderidae;Parastalita;stygia;Parastalita stygia;;45.329484;15.416581;Tb;deep cave;45.32948415.416581;1;;;;;;;;;;;;;;;;;;;;;;
3185;Jama Jankonka;Croatia;2.4.2000.;2000-04-02;1m;1;Dysderidae;Parastalita;stygia;Parastalita stygia;;45.397377;15.248276;Tb;deep cave;45.39737715.248276;1;;;;;;;;;;;;;;;;;;;;;;
3187;Makluta?a;Croatia;2.12.2012.;2012-12-02;2f, 2m, 3 juv;7;Linyphiidae;Troglohyphantes;giromettai;Troglohyphantes giromettai;400;43.569268;16.620515;tf;deep cave;43.56926816.620515;6;;;;;;;;;;;;;;;;;;;;;;
3188;Bali?a špilja;Croatia;12.5.2012.;2012-05-12;1f;1;Linyphiidae;Troglohyphantes;giromettai;Troglohyphantes giromettai;405;43.57296;16.57002;tf;deep cave;43.5729616.57002;11;7,2;;;;;;;;;;;;;;;;;;;;;
3189;Bali?a špilja;Croatia;12.5.2012.;2012-05-12;1f;1;Pholcidae;Stygopholcus;absoloni;Stygopholcus absoloni;405;43.57296;16.57002;;deep cave;43.5729616.57002;11;7,2;;;;;;;;;;;;;;;;;;;;;
3190;Bali?a špilja;Croatia;12.5.2012.;2012-05-12;2m, 1f;3;Leptonetidae;Barusia;maheni;Barusia maheni;405;43.57296;16.57002;tf;deep cave;43.5729616.57002;11;7,2;;;;;;;;;;;;;;;;;;;;;
3191;Bali?a špilja;Croatia;12.5.2012.;2012-05-12;4f;4;Zodariidae;Zodarion;sp. 1;Zodarion sp. 1;405;43.57296;16.57002;;;43.5729616.57002;11;7,2;;;;;;;;;;;;;;;;;;;;;
3192;Kravska jama 1;Croatia;11.5.2013.;2013-05-11;3f;3;Linyphiidae;Troglohyphantes;dalmaticus;Troglohyphantes dalmaticus;;43.549165;16.637531;tf;deep cave;43.54916516.637531;4;;;;;;;;;;;;;;;;;;;;;;
3193;Kravska jama 1;Croatia;11.5.2013.;2013-05-11;1m, 2f;3;Linyphiidae;Troglohyphantes;strandi;Troglohyphantes strandi;;43.549165;16.637531;tb;deep cave;43.54916516.637531;4;;;;;;;;;;;;;;;;;;;;;;
3194;Kravska jama 1;Croatia;11.5.2013.;2013-05-11;5f;5;Linyphiidae;Troglohyphantes;dalmaticus;Troglohyphantes dalmaticus;;43.549165;16.637531;tf;deep cave;43.54916516.637531;4;;;;;;;;;;;;;;;;;;;;;;
3196;Kravska jama 1;Croatia;11.5.2013.;2013-05-11;1f;1;Linyphiidae;Gen.;sp. X;Gen. sp. X;;43.549165;16.637531;;;43.54916516.637531;4;;;;;;;;;;;;;;;;;;;;;;
3197;Bali?a špilja;Croatia;12.5.2012.;2012-05-12;2f, 2juv;4;Linyphiidae;Troglohyphantes;strandi;Troglohyphantes strandi;405;43.57296;16.57002;tb;deep cave;43.5729616.57002;11;7,2;;;;;;;;;;;;;;;;;;;;;
3199;Bali?a špilja;Croatia;12.5.2012.;2012-05-12;1m, 1 juv;2;Linyphiidae;Troglohyphantes;giromettai;Troglohyphantes giromettai;405;43.57296;16.57002;tf;deep cave;43.5729616.57002;11;7,2;;;;;;;;;;;;;;;;;;;;;
3205;Špilja uz put za Vrdovo;Croatia;28.7.2012.;2012-07-28;1 juv;1;Dysderidae;Harpactea;sp.;Harpactea sp.;;43.963557;16.649787;;;43.96355716.649787;1;;;;;;;;;;;;;;;;;;;;;;
3207;Meandar 1;Croatia;25.7.2012.;2012-07-25;1m, 1 juv;2;Linyphiidae;Troglohyphantes;dekkingae;Troglohyphantes dekkingae;1556;43.932384;16.612019;tf;deep cave;43.93238416.612019;1;;;;;;;;;;;;;;;;;;;;;;
3215;Kornjatuša;Croatia;19.7.1997.;1997-07-19;1f? R;1;Dysderidae;Stalagtia;sp. 4_1;Stalagtia sp. 4_1;610;42.97909;17.673966;Tb;deep cave;42.9790917.673966;5;;;;;;;;;;;;;;;;;;;;;;
3218;Svetica;Croatia;22.5.2004.;2004-05-22;1f R;1;Amaurobidae;Amaurobius;erberi;Amaurobius erberi;300;43.401143;16.894548;Tx;deep cave;43.40114316.894548;5;;;;;;;;;;;;;;;;;;;;;;
3220;Golubinka, Desne;Croatia;23.7.1997.;1997-07-23;3 juv R;3;Dysderidae;Stalagtia;sp. 4;Stalagtia sp. 4;40;43.065371;17.527293;Tb;deep cave;43.06537117.527293;3;;;;;;;;;;;;;;;;;;;;;;
3221;Nevakuša špilja;Croatia;11.9.1997.;1997-09-11;1 juv R;1;Dysderidae;Stalagtia;sp. 4_1;Stalagtia sp. 4_1;;42.97412;17.686578;Tb;deep cave;42.9741217.686578;3;;;;;;;;;;;;;;;;;;;;;;
3222;Marasovi?a špilja;Croatia;26.9.1999.;1999-09-26;1 juv R;1;Agelenidae;Histopona;sp.;Histopona sp.;;44.309906;15.481716;;;44.30990615.481716;2;;;;;;;;;;;;;;;;;;;;;;
3223;Jama u Vrisju;Croatia;27.4.2007.;2007-04-27;1m, 1 juv R;2;Dysderidae;Folkia;haasi;Folkia haasi;;42.944287;17.118511;Tb;deep cave;42.94428717.118511;2;;;;;;;;;;;;;;;;;;;;;;
3225;Staje 8;Croatia;29.7.2001.;2001-07-29;1 juv R;1;Dysderidae;Stalita;taenaria;Stalita taenaria;;45.447413;14.143861;Tb;deep cave;45.44741314.143861;3;;;;;;;;;;;;;;;;;;;;;;
3226;?ukina jama;Croatia;19.3.2000.;2000-03-19;1 juv R;1;Dysderidae;Stalagtia;sp. 4;Stalagtia sp. 4;;43.556313;16.540533;Tb;deep cave;43.55631316.540533;1;;;;;;;;;;;;;;;;;;;;;;
3227;Eko špilja;Croatia;2002.;1905-06-24;1 m R;1;Dysderidae;Parastalita;stygia;Parastalita stygia;;45.350927;15.478623;Tb;deep cave;45.35092715.478623;1;;;;;;;;;;;;;;;;;;;;;;
3228;Velika špilja, Blato;Croatia;2.12.2001.;2001-12-02;1m R;1;Dysderidae;Folkia;inermis;Folkia inermis;;42.76443;17.471825;Tb;deep cave;42.7644317.471825;8;;;;;;;;;;;;;;;;;;;;;;
3229;Movrica;Croatia;17.6.2001.;2001-06-17;3 juv R;3;Agelenidae;Histopona;bidens;Histopona bidens;;42.752604;17.551145;tb;deep cave;42.75260417.551145;6;12,6;;;;;;;;;;;;;;;;;;;;;
3230;Jama Ikinica;Croatia;13.8.2001.;2001-08-13;13 juv R;13;Dysderidae;Stalita;taenaria;Stalita taenaria;;44.924393;13.947791;Tb;deep cave;44.92439313.947791;3;;;;;;;;;;;;;;;;;;;;;;
3232;Špilja za Groma?kom vlakom;Croatia;8.9.2006.;2006-09-08;1 juv R;1;Dysderidae;Stalagtia;sp. 5;Stalagtia sp. 5;605;42.743509;18.027359;Tb;deep cave;42.74350918.027359;15;;;13,63043478;;;;;;;;;;;;;;;;;;;
3234;Pišurka;Croatia;23.4.2004.;2004-04-23;1m, 1f, 4 juv R;6;Dysderidae;Folkia;haasi;Folkia haasi;;42.959451;17.129228;Tb;deep cave;42.95945117.129228;5;;;;;;;;;;;;;;;;;;;;;;
3235;Kaverna 781;Croatia;26.8.2005.;2005-08-26;1 juv R;1;Dysderidae;Stalagtia;sp. 1;Stalagtia sp. 1;;42.52633;18.3382;Tb;deep cave;42.5263318.3382;4;;;;;;;;;;;;;;;;;;;;;;
3236;Martina jama;Croatia;9.1.2005.;2005-01-09;  1 juv R;1;Dysderidae;Stalagtia;sp. 4;Stalagtia sp. 4;;43.81399;15.912668;Tb;deep cave;43.8139915.912668;1;;;;;;;;;;;;;;;;;;;;;;
3237;Piskovica;Croatia;1.11.1998.;1998-11-01;1f R;1;Nesticidae;Kryptonesticus;eremita;Kryptonesticus eremita;315;45.26207;14.03692;tf;deep cave;45.2620714.03692;1;;;;;;;;;;;;;;;;;;;;;;
3239;Špilja u Zuniškom dolcu;Croatia;17.9.2006.;2006-09-17;2 juv R;2;Agelenidae;Hadites;tegenarioides;Hadites tegenarioides;;43.132799;16.737843;TB;deep cave;43.13279916.737843;1;;;;;;;;;;;;;;;;;;;;;;
3242;Ze?ica (ispred);Croatia;26.5.2004.;2004-05-26;1 juv R;1;Agelenidae;Tegenaria;sp.;Tegenaria sp.;;43.260392;17.146168;;;43.26039217.146168;3;;;;;;;;;;;;;;;;;;;;;;
3245;Kraljevska jama na Gulišini;Croatia;5.8.1997.;1997-08-05;3 juv R;3;Agelenidae;Hadites;tegenarioides;Hadites tegenarioides;;43.133120;16.744319;TB;deep cave;43.13312016.744319;3;;;;;;;;;;;;;;;;;;;;;;
3248;Oštirova jama;Croatia;18.9.2007.;2007-09-18;1f, 4 juv R;5;Linyphiidae;Troglohyphantes;brignolii;Troglohyphantes brignolii;;45.355854;14.123988;tb;deep cave;45.35585414.123988;3;;;;;;;;;;;;;;;;;;;;;;
3250;Topolska pe?;Croatia;14.9.2007.;2007-09-14;1f, 1 juv R;2;Linyphiidae;Troglohyphantes;brignolii;Troglohyphantes brignolii;;45.30489;14.212681;tb;deep cave;45.3048914.212681;3;;;;;;;;;;;;;;;;;;;;;;
3253;Romanova jama;Croatia;30.9.1995.;1995-09-30;1 juv R;1;Nesticidae;Kryptonesticus;deelemanae;Kryptonesticus deelemanae;;43.307939;17.067563;tb;deep cave;43.30793917.067563;2;;;;;;;;;;;;;;;;;;;;;;
3258;Markova jama kod Tara;Croatia;31.10.1998.;1998-10-31;4f, 1 juv m R;5;Nesticidae;Kryptonesticus;eremita;Kryptonesticus eremita;95;45.319298;13.631373;tf;deep cave;45.31929813.631373;7;;;;;;;;;;;;;;;;;;;;;;
3259;Špilja kod mlina Miljacki (Miljacka 4);Croatia;6.1.2005.;2005-01-06;1f R;1;Agelenidae;Tegenaria;sp. 7;Tegenaria sp. 7;175;44.003485;16.019087;;;44.00348516.019087;2;;;;;;;;;;;;;;;;;;;;;;
3261;Lukina jama - Trojama;Croatia;9.8.2013.;2013-08-09;1 svlak juv;1;Dysderidae;Gen. 1;sp. 1;Gen. 1 sp. 1;1438;44.766939;15.026571;Tb;deep cave;44.76693915.026571;1;;;;;;;;;;;;;;;;;;;;;;
3263;Manita pe?;Croatia;23.9.2012.;2012-09-23;1f, 1 juv;2;Agelenidae;Histopona;egonpretneri;Histopona egonpretneri;520;44.314302;15.475264;Tb;deep cave;44.31430215.475264;7;;;;;;;;;;;;;;;;;;;;;;
3264;Manita pe?;Croatia;23.9.2012.;2012-09-23;1 juv;1;Agelenidae;Histopona;sp.;Histopona sp.;520;44.314302;15.475264;;;44.31430215.475264;7;;;;;;;;;;;;;;;;;;;;;;
3265;Manita pe?;Croatia;23.9.2012.;2012-09-23;1m, 1 juv;2;Leptonetidae;Cataleptoneta;lingulata;Cataleptoneta lingulata;520;44.314302;15.475264;tb;deep cave;44.31430215.475264;7;;;;;;;;;;;;;;;;;;;;;;
3266;Manita pe?;Croatia;20.4.2013.;2013-04-20;1m;1;Agelenidae;Histopona;egonpretneri;Histopona egonpretneri;520;44.314302;15.475264;Tb;deep cave;44.31430215.475264;7;;;;;;;;;;;;;;;;;;;;;;
3268;Manita pe?;Croatia;20.4.2013.;2013-04-20;1m;1;Dysderidae;Parastalita;stygia;Parastalita stygia;520;44.314302;15.475264;Tb;deep cave;44.31430215.475264;7;;;;;;;;;;;;;;;;;;;;;;
3269;Manita pe?;Croatia;3.12.2011.;2011-12-03;1 juv;1;Agelenidae;Histopona;sp.;Histopona sp.;520;44.314302;15.475264;;;44.31430215.475264;7;10,1;;;;;;;;;;;;;;;;;;;;;
3272;Manita pe?;Croatia;23.9.2012.;2012-09-23;2 juv;2;Agelenidae;Histopona;sp.;Histopona sp.;520;44.314302;15.475264;;;44.31430215.475264;7;;;;;;;;;;;;;;;;;;;;;;
3274;Manita pe?;Croatia;20.12.2012.;2012-12-20;1m, 3f, 2 juv;6;Leptonetidae;Cataleptoneta;lingulata;Cataleptoneta lingulata;520;44.314302;15.475264;tb;deep cave;44.31430215.475264;7;;;;;;;;;;;;;;;;;;;;;;
3275;Manita pe?;Croatia;3.12.2011.;2011-12-03;2m, 1f;3;Leptonetidae;Cataleptoneta;lingulata;Cataleptoneta lingulata;520;44.314302;15.475264;tb;deep cave;44.31430215.475264;7;10,1;;;;;;;;;;;;;;;;;;;;;
3276;Manita pe?;Croatia;3.12.2011.;2011-12-03;4m, 1f;5;Leptonetidae;Cataleptoneta;lingulata;Cataleptoneta lingulata;520;44.314302;15.475264;tb;deep cave;44.31430215.475264;7;10,1;;;;;;;;;;;;;;;;;;;;;
3277;Manita pe?;Croatia;20.12.2012.;2012-12-20;1 juv;1;Dysderidae;Parastalita;stygia;Parastalita stygia;520;44.314302;15.475264;Tb;deep cave;44.31430215.475264;7;;;;;;;;;;;;;;;;;;;;;;
3278;Manita pe?;Croatia;1.9.2012.;2012-09-01;1 juv;1;Agelenidae;Histopona;sp.;Histopona sp.;520;44.314302;15.475264;;;44.31430215.475264;7;;;;;;;;;;;;;;;;;;;;;;
3280;Manita pe?;Croatia;20.4.2013.;2013-04-20;1 juv;1;Dysderidae;Stalita;pretneri;Stalita pretneri;520;44.314302;15.475264;Tb;deep cave;44.31430215.475264;7;;;;;;;;;;;;;;;;;;;;;;
3281;Manita pe?;Croatia;3.12.2013.;2013-12-03;1 juv;1;Dysderidae;Parastalita;stygia;Parastalita stygia;520;44.314302;15.475264;Tb;deep cave;44.31430215.475264;7;;;;;;;;;;;;;;;;;;;;;;
3284;Manita pe?;Croatia;20.4.2013.;2013-04-20;1 juv;1;Dysderidae;Parastalita;stygia;Parastalita stygia;520;44.314302;15.475264;Tb;deep cave;44.31430215.475264;7;;;;;;;;;;;;;;;;;;;;;;
3287;Manita pe?;Croatia;10.2.2013.;2013-02-10;1m;1;Familia x;Gen.;sp.;Gen. sp.;520;44.314302;15.475264;;;44.31430215.475264;7;;;;;;;;;;;;;;;;;;;;;;
3297;Špilja od Vore;Croatia;30.3.2013.;2013-03-30;5 juv;5;Nesticidae;Kryptonesticus;eremita;Kryptonesticus eremita;;43.057273;16.135641;tf;deep cave;43.05727316.135641;1;;;;;;;;;;;;;;;;;;;;;;
3298;Mramorcina;Croatia;1.4.2013.;2013-04-01;2 juv;2;Nesticidae;Kryptonesticus;eremita;Kryptonesticus eremita;131;43.012358;16.113011;tf;deep cave;43.01235816.113011;2;;;;;;;;;;;;;;;;;;;;;;
3300;Gorska jama;Croatia;3.11.2003.;2003-11-03;1m, 1 juv;2;Leptonetidae;Barusia;maheni;Barusia maheni;;42.92697;17.424809;tf;deep cave;42.9269717.424809;2;16;;;;;;;;;;;;;;;;;;;;;
3301;Špilja na Pozalicu;Croatia;14.6.2001.;2001-06-14;1f, 2 juv;3;Leptonetidae;Barusia;sp. 1;Barusia sp. 1;60;42.76131;16.9129;tb;deep cave;42.7613116.9129;4;;12,65;14;;;;;;;;;;;;;;;;;;;
3302;Gorska jama;Croatia;3.11.2003.;2003-11-03;1f, 1m, 2 juv;4;Leptonetidae;Barusia;maheni;Barusia maheni;;42.92697;17.424809;tf;deep cave;42.9269717.424809;2;16;;;;;;;;;;;;;;;;;;;;;
3305;Jama pod Bilušinim vrhom;Croatia;24.4.2004.;2004-04-24;1f, 1 juvm, 1 juv;3;Leptonetidae;Barusia;korculana;Barusia korculana;;42.93959;17.11266;tb;deep cave;42.9395917.11266;3;;;;;;;;;;;;;;;;;;;;;;
3308;Mala špilja, Blato;Croatia;19.6.2001.;2001-06-19;2f, 2 juv m;4;Leptonetidae;Barusia;maheni;Barusia maheni;;42.764498;17.471054;tf;deep cave;42.76449817.471054;5;;;;;;;;;;;;;;;;;;;;;;
3310;Špilja pod Kaštel;Croatia;14.6.2001.;2001-06-14;1f;1;Leptonetidae;Barusia;sp. 1;Barusia sp. 1;;42.768041;16.899005;tb;deep cave;42.76804116.899005;2;;15,3;17,5;;;;;;;;;;;;;;;;;;;
3311;Stonjska pe? donja;Croatia;1.5.2012.;2012-05-01;1 juv f;1;Leptonetidae;Barusia;maheni;Barusia maheni;608;43.315167;17.130659;tf;deep cave;43.31516717.130659;6;;;;;;;;;;;;;;;;;;;;;;
3313;Stonjska pe? donja;Croatia;1.5.2012.;2012-05-01;1m;1;Leptonetidae;Barusia;maheni;Barusia maheni;608;43.315167;17.130659;tf;deep cave;43.31516717.130659;6;;;;;;;;;;;;;;;;;;;;;;
3314;Jezero na Gatuli;Croatia;2.10.2005.;2005-10-02;1f;1;Leptonetidae;Barusia;sp. 1;Barusia sp. 1;;42.960756;16.003363;tb;deep cave;42.96075616.003363;1;;;;;;;;;;;;;;;;;;;;;;
3316;Svetica;Croatia;22.5.2004.;2004-05-22;1f, 4 juv;5;Leptonetidae;Barusia;maheni;Barusia maheni;300;43.401143;16.894548;tf;deep cave;43.40114316.894548;5;;;;;;;;;;;;;;;;;;;;;;
3317;Jezero na Gatuli;Croatia;18.10.2007.;2007-10-18;1m, 1f;2;Leptonetidae;Barusia;sp. 1;Barusia sp. 1;;42.960756;16.003363;tb;deep cave;42.96075616.003363;1;;;;;;;;;;;;;;;;;;;;;;
3318;Vilina špilja-Izvor Omble;Croatia;29.4.2010.;2010-04-29;1m;1;Leptonetidae;Sulcia;sp. 2;Sulcia sp. 2;;42.67716;18.136236;Tb;deep cave;42.6771618.136236;5;;;14,2;;;;;;;;;;;;;;;;;;;
3320;Mrgi?a ponor (suha pe?ina);Croatia;9.1.1999.;1999-01-09;1 juv f;1;Leptonetidae;Gen. 2;sp. 1;Gen. 2 sp. 1;;45.267996;15.469321;;deep cave;45.26799615.469321;1;;;;;;;;;;;;;;;;;;;;;;
3321;Špilja kod izvora Rude;Croatia;17.8.2005.;2005-08-17;2f;2;Leptonetidae;Barusia;maheni;Barusia maheni;;43.779865;16.657316;tf;deep cave;43.77986516.657316;1;;;;;;;;;;;;;;;;;;;;;;
3323;Jama na Visokoj;Croatia;7.8.2007.;2007-08-07;1f;1;Leptonetidae;Barusia;maheni;Barusia maheni;;43.68201;16.607257;tf;deep cave;43.6820116.607257;3;;;;;;;;;;;;;;;;;;;;;;
3324;Jezero na Gatuli;Croatia;18.10.2007.;2007-10-18;4f, 2m, 1 juv;7;Leptonetidae;Barusia;sp. 1;Barusia sp. 1;;42.960756;16.003363;tb;deep cave;42.96075616.003363;1;;;;;;;;;;;;;;;;;;;;;;
3325;Stonjska pe? donja;Croatia;1.5.2012.;2012-05-01;1m;1;Leptonetidae;Sulcia;sp. 4;Sulcia sp. 4;608;43.315167;17.130659;Tb;deep cave;43.31516717.130659;6;;;;;;;;;;;;;;;;;;;;;;
3327;Poskokova jama;Croatia;2.8.2002.;2002-08-02;1f;1;Leptonetidae;Barusia;korculana;Barusia korculana;;43.001888;17.134002;tb;deep cave;43.00188817.134002;4;;;;;;;;;;;;;;;;;;;;;;
3328;Šolkina jama;Croatia;1.12.2009.;2009-12-01;1m, 2f, 1 juv;4;Leptonetidae;Sulcia;sp. 5;Sulcia sp. 5;230;42.966544;17.662484;;;42.96654417.662484;4;;;;;;;;;;;;;;;;;;;;;;
3353;Pe? u ?ulinovim raljevinama;Croatia;6.1.2009.;2009-01-06;3m, 1f;4;Leptonetidae;Barusia;maheni;Barusia maheni;;43.605854;16.575066;tf;deep cave;43.60585416.575066;5;;;;;;;;;;;;;;;;;;;;;;
3355;?agjina jama;Croatia;6.4.2007.;2007-04-06;2m;2;Leptonetidae;Barusia;korculana;Barusia korculana;113;42.977147;17.155166;tb;deep cave;42.97714717.155166;5;;;;;;;;;;;;;;;;;;;;;;
3356;Jezero;Croatia;16.3.2002.;2002-03-16;1m, 2f, 3 juv;6;Pholcidae;Stygopholcus;skotophilus;Stygopholcus skotophilus;903;42.580381;18.356073;;deep cave;42.58038118.356073;8;;;7,566666667;;;;;;;;;;;;;;;;;;;
3357;Getaldi?eva špilja;Croatia;11.8.2000.;2000-08-11;1m, 1 juv;2;Pholcidae;Pholcus;phalangioides;Pholcus phalangioides;;42.638504;18.126604;;deep cave;42.63850418.126604;1;;;;;;;;;;;;;;;;;;;;;;
3360;Jezero;Croatia;28.5.2004.;2004-05-28;2 juv;2;Pholcidae;Stygopholcus;skotophilus;Stygopholcus skotophilus;903;42.580381;18.356073;;deep cave;42.58038118.356073;8;;;7,566666667;;;;;;;;;;;;;;;;;;;
3361;Karle;Croatia;12.2.2005.;2005-02-12;1m;1;Pholcidae;Pholcus;phalangioides;Pholcus phalangioides;;42.657575;18.088819;;deep cave;42.65757518.088819;1;;;;;;;;;;;;;;;;;;;;;;
3363;Franetova jama;Croatia;28.2.1999.;1999-02-28;1f, 1 juv;2;Pholcidae;Stygopholcus;absoloni;Stygopholcus absoloni;;43.1361;16.9384;;deep cave;43.136116.9384;2;;;;;;;;;;;;;;;;;;;;;;
3367;Kukor;Croatia;2.1.1999.;1999-01-02;1m, 1f, 1 juv;3;Pholcidae;Stygopholcus;absoloni;Stygopholcus absoloni;425;43.355609;16.991707;;deep cave;43.35560916.991707;10;;;;;;;;;;;;;;;;;;;;;;
3369;Tu?epska vilenja?a;Croatia;30.4.2012.;2012-04-30;1 juv;1;Linyphiidae;Typhlonyphia;sp. 1;Typhlonyphia sp. 1;1181;43.286465;17.083638;Tb;deep cave;43.28646517.083638;8;;;;;;;;;;;;;;;;;;;;;;
3370;Tu?epska vilenja?a;Croatia;30.4.2012.;2012-04-30;1f;1;Pholcidae;Stygopholcus;absoloni;Stygopholcus absoloni;1181;43.286465;17.083638;;deep cave;43.28646517.083638;8;;;;;;;;;;;;;;;;;;;;;;
3373;Kapljarka;Croatia;8.6.2006.;2006-06-08;1m ,2f, 1 juvm, 2 juv;6;Leptonetidae;Cataleptoneta;lingulata;Cataleptoneta lingulata;;44.294555;15.519648;tb;deep cave;44.29455515.519648;2;;;;;;;;;;;;;;;;;;;;;;
3374;Velika špilja kod Neori?a;Croatia;31.7.2007.;2007-07-31;1m;1;Pholcidae;Stygopholcus;absoloni;Stygopholcus absoloni;703;43.686117;16.55312;;deep cave;43.68611716.55312;2;;;;;;;;;;;;;;;;;;;;;;
3384;Kornjatuša;Croatia;2.11.2013.;2013-11-02;2f;2;Pholcidae;Stygopholcus;absoloni;Stygopholcus absoloni;610;42.97909;17.673966;;deep cave;42.9790917.673966;5;;;;;;;;;;;;;;;;;;;;;;
3385;Gavranova jama;Croatia;13.8.2013.;2013-08-13;1 juv;1;Linyphiidae;Troglohyphantes;sp. 3;Troglohyphantes sp. 3;;44.745184;15.072389;tb;deep cave;44.74518415.072389;1;;;;;;;;;;;;;;;;;;;;;;
3388;Kornjatuša;Croatia;2.11.2013.;2013-11-02;1f;1;Leptonetidae;Sulcia;sp.;Sulcia sp.;610;42.97909;17.673966;;;42.9790917.673966;5;;;;;;;;;;;;;;;;;;;;;;
3391;Zmajeva špilja;Croatia;26.6.1937.;1937-06-26;1f;1;Amaurobidae;Amaurobius;kratochvili;Amaurobius kratochvili;;43.269174;16.598972;Tx;epigean habitat;43.26917416.598972;4;;;;;;;;;;;;;;;;;;;;;;
3392;Grgosova špilja stara;Croatia;4.11.2014.;2014-11-04;6juv;6;Nesticidae;Nesticus;cellulanus;Nesticus cellulanus;;45.818969;15.67855;tf;deep cave;45.81896915.67855;6;;;;;;;;;;;;;;;;;;;;;;
3393;Grgosova špilja stara;Croatia;4.11.2014.;2014-11-04;3f, 1juv m;4;Linyphiidae;Gen.;sp. X;Gen. sp. X;;45.818969;15.67855;;;45.81896915.67855;6;;;;;;;;;;;;;;;;;;;;;;
3394;Grgosova špilja nova;Croatia;4.11.2014.;2014-11-04;1 juv;1;Nesticidae;Nesticus;cellulanus;Nesticus cellulanus;;45.818715;15.67827;tf;deep cave;45.81871515.67827;3;;;;;;;;;;;;;;;;;;;;;;
3395;Grgosova špilja nova;Croatia;4.11.2014.;2014-11-04;1 juv;1;Nesticidae;Nesticus;cellulanus;Nesticus cellulanus;;45.818715;15.67827;tf;deep cave;45.81871515.67827;3;;;;;;;;;;;;;;;;;;;;;;
3396;Bali?a špilja;Croatia;5.2013.;2013-05;1 juv m;1;Dysderidae;Rhode;sp. 1;Rhode sp. 1;405;43.57296;16.57002;Tb;deep cave;43.5729616.57002;11;7,2;;;;;;;;;;;;;;;;;;;;;
3397;Sirena;Croatia;21.4.2014.;2014-04-21;1m, 1f;2;Dysderidae;Gen. 1;sp. 1;Gen. 1 sp. 1;1543;44.768103;14.98756;Tb;deep cave;44.76810314.98756;1;;;;;;;;;;;;;;;;;;;;;;
3399;Grgosova špilja nova;Croatia;26.11.2014.;2014-11-26;1f, 1juv;2;Nesticidae;Nesticus;cellulanus;Nesticus cellulanus;;45.818715;15.67827;tf;deep cave;45.81871515.67827;3;;;;;;;;;;;;;;;;;;;;;;
3401;Grgosova špilja nova;Croatia;26.11.2014.;2014-11-26;1f;1;Nesticidae;Nesticus;cellulanus;Nesticus cellulanus;;45.818715;15.67827;tf;deep cave;45.81871515.67827;3;;;;;;;;;;;;;;;;;;;;;;
3402;Grgosova špilja nova;Croatia;26.11.2014.;2014-11-26;1m;1;Linyphiidae;Porrhomma;microphthalmum;Porrhomma microphthalmum;;45.818715;15.67827;Tx;deep cave;45.81871515.67827;3;;;;;;;;;;;;;;;;;;;;;;
3403;Grgosova špilja stara;Croatia;26.11.2014.;2014-11-26;2juvm, 2 juv;4;Nesticidae;Nesticus;cellulanus;Nesticus cellulanus;;45.818969;15.67855;tf;deep cave;45.81896915.67855;6;;;;;;;;;;;;;;;;;;;;;;
3405;Grgosova špilja nova;Croatia;26.11.2014.;2014-11-26;1m;1;Amaurobidae;Amaurobius;ferox;Amaurobius ferox;;45.818715;15.67827;Tf;deep cave;45.81871515.67827;3;;;;;;;;;;;;;;;;;;;;;;
3406;Grgosova špilja stara;Croatia;26.11.2014.;2014-11-26;2f, 5 juv;7;Nesticidae;Nesticus;cellulanus;Nesticus cellulanus;;45.818969;15.67855;tf;deep cave;45.81896915.67855;6;;;;;;;;;;;;;;;;;;;;;;
3408;Grgosova špilja stara;Croatia;26.11.2014.;2014-11-26;1f;1;Linyphiidae;Centromerus;cavernarum;Centromerus cavernarum;;45.818969;15.67855;Tf;deep cave;45.81896915.67855;6;;;;;;;;;;;;;;;;;;;;;;
3409;Grgosova špilja stara;Croatia;26.11.2014.;2014-11-26;1m;1;Tetragnathidae;Meta;menardi;Meta menardi;;45.818969;15.67855;Tf;deep cave;45.81896915.67855;6;;;;;;;;;;;;;;;;;;;;;;
3410;Židovske jame;Croatia;26.11.2014.;2014-11-26;1f;1;Linyphiidae;Troglohyphantes;sp. 12;Troglohyphantes sp. 12;;45.997503;16.038982;tf;deep cave;45.99750316.038982;2;;;;;;;;;;;;;;;;;;;;;;
3412;Kukova pe?;Croatia;30.11.2014.;2014-11-30;3f, 2m, 3 juv;8;Tetragnathidae;Meta;bourneti;Meta bourneti;;42.726992;17.96566;Tf;deep cave;42.72699217.96566;5;;17;16,62;;;;;;;;;;;;;;;;;;;
3413;Židovske jame;Croatia;21.12.2014.;2014-12-21;1f, 1 juvm, 2 juv;4;Linyphiidae;Troglohyphantes;excavatus;Troglohyphantes excavatus;;45.997503;16.038982;tf;deep cave;45.99750316.038982;2;;;;;;;;;;;;;;;;;;;;;;
3414;Židovske jame;Croatia;21.12.2014.;2014-12-21;1f;1;Linyphiidae;Troglohyphantes;excavatus;Troglohyphantes excavatus;;45.997503;16.038982;tf;deep cave;45.99750316.038982;2;;;;;;;;;;;;;;;;;;;;;;
3415;Židovske jame;Croatia;21.12.2014.;2014-12-21;1f, 1 juv;2;Linyphiidae;Troglohyphantes;excavatus;Troglohyphantes excavatus;;45.997503;16.038982;tf;deep cave;45.99750316.038982;2;;;;;;;;;;;;;;;;;;;;;;
3417;Židovske jame;Croatia;21.12.2014.;2014-12-21;1f, 1juv;2;Linyphiidae;Troglohyphantes;sp. 12;Troglohyphantes sp. 12;;45.997503;16.038982;tf;deep cave;45.99750316.038982;2;;;;;;;;;;;;;;;;;;;;;;
3418;Židovske jame;Croatia;21.12.2014.;2014-12-21;1f;1;Linyphiidae;Troglohyphantes;excavatus;Troglohyphantes excavatus;;45.997503;16.038982;tf;deep cave;45.99750316.038982;2;;;;;;;;;;;;;;;;;;;;;;
3419;Židovske jame;Croatia;21.12.2014.;2014-12-21;1f, 1juv;2;Linyphiidae;Troglohyphantes;sp. 12;Troglohyphantes sp. 12;;45.997503;16.038982;tf;deep cave;45.99750316.038982;2;;;;;;;;;;;;;;;;;;;;;;
3420;Brušane (CLD, materijal od doma);Croatia;16.10.1980.;1980-10-16;1f, 1m;2;Dysderidae;Harpactea;lepida;Harpactea lepida;;44.500768;15.270244;Tx;deep cave;44.50076815.270244;1;;;;;;;;;;;;;;;;;;;;;;
3422;Vrelo;Croatia;20.4.1974.;1974-04-20;1f;1;Linyphiidae;Troglohyphantes;croaticus;Troglohyphantes croaticus;730;45.326489;14.704217;tb;deep cave;45.32648914.704217;8;;;;;;;;;;;;;;;;;;;;;;
3423;Njivice, Krk (CLD, materijal od doma);Croatia;27.10.1980.;1980-10-27;1m, 1f, 1juvm;3;Dysderidae;Dysdera;ninnii;Dysdera ninnii;;45.158049;14.538878;Tx;;45.15804914.538878;1;;;;;;;;;;;;;;;;;;;;;;
3424;Ozaljska špilja;Croatia;22.4.1973.;1973-04-22;1f;1;Agelenidae;Tegenaria;sp. X;Tegenaria sp. X;;45.615811;15.465045;;;45.61581115.465045;5;;;;;;;;;;;;;;;;;;;;;;
3425;NP Paklenica (CLD, materijal od doma);Croatia;19.10.1980.;1980-10-19;1m, 1f, 1 juvm;3;Amaurobidae;Amaurobius;sp. x;Amaurobius sp. x;;44.343694;15.483995;Tx;;44.34369415.483995;1;;;;;;;;;;;;;;;;;;;;;;
3429;Hvar (CLD, materijal od doma);Croatia;12.4.1977.;1977-04-12;1f, Rm bulbus;1;Dysderidae;Dysdera;bottazziae;Dysdera bottazziae;;43.133332;16.733332;Tx;;43.13333216.733332;1;;;;;;;;;;;;;;;;;;;;;;
3434;Ami?ina pe?ina;Croatia;11.5.2014.;2014-05-11;1f;1;Dysderidae;Parastalita;stygia;Parastalita stygia;;44.636775;15.361277;Tb;deep cave;44.63677515.361277;1;;;;;;;;;;;;;;;;;;;;;;
3436;Sitvukova špilja;Croatia;8.8.2014.;2014-08-08;1f;1;Dysderidae;Parastalita;stygia;Parastalita stygia;;44.67871;15.344906;Tb;deep cave;44.6787115.344906;2;;;;;;;;;;;;;;;;;;;;;;
3437;Sitvukova špilja;Croatia;8.8.2014.;2014-08-08;1juvm;1;Dysderidae;Stalita;pretneri;Stalita pretneri;;44.67871;15.344906;Tb;deep cave;44.6787115.344906;2;;;;;;;;;;;;;;;;;;;;;;
3438;Milinkovi?eva špilja;Croatia;;;1m, 1f;2;Linyphiidae;Tenuiphantes;tenuis;Tenuiphantes tenuis;;44.658953;15.194442;;;44.65895315.194442;1;;;;;;;;;;;;;;;;;;;;;;
3439;Pe?ina kod Garište;Croatia;15.4.1974.;1974-04-15;1f, 3 juv, dio bulbusa m;4;Linyphiidae;Centromerus;sylvaticus;Centromerus sylvaticus;;43.756233;16.730879;tx;deep cave;43.75623316.730879;1;;;;;;;;;;;;;;;;;;;;;;
3444;Ozaljska špilja;Croatia;22.4.1973.;1973-04-22;1f;1;Linyphiidae;Formiphantes;lepthyphantiformis;Formiphantes lepthyphantiformis;;45.615811;15.465045;Tf;deep cave;45.61581115.465045;5;;;;;;;;;;;;;;;;;;;;;;
3452;Šipun;Croatia;5.8.1969.;1969-08-05;1f;1;Linyphiidae;Palliduphantes;brignolii;Palliduphantes brignolii;;42.583646;18.217986;Tb;deep cave;42.58364618.217986;11;16;;;;;;;;;;;;;;;;;;;;;
3466;Mjese?evi?a špilja;Croatia;3.12.2014.;2014-12-03;1f, 1juv;2;Leptonetidae;Sulcia;sp. 2;Sulcia sp. 2;;42.480511;18.411965;Tb;deep cave;42.48051118.411965;3;;;;;;;;;;;;;;;;;;;;;;
3529;Regrutova spila ol Vore;Croatia;26.4.2015.;2015-04-26;2juvm, 1 juv;3;Nesticidae;Kryptonesticus;eremita;Kryptonesticus eremita;110;43.0688;16.120592;tf;deep cave;43.068816.120592;1;;;;;;;;;;;;;;;;;;;;;;
3530;Mo?iljska špilja;Croatia;26.8.2014.;2014-08-26;3f;3;Leptonetidae;Sulcia;sp.;Sulcia sp.;;42.689061;18.071906;;;42.68906118.071906;6;;15,4;15,825;;;;;;;;;;;;;;;;;;;
3531;Jama na vrh Prodoli;Croatia;23.8.2014.;2014-08-23;1m;1;Leptonetidae;Barusia;maheni;Barusia maheni;;42.720837;18.021231;tf;deep cave;42.72083718.021231;1;;21,6;;;;;;;;;;;;;;;;;;;;
3533;Vilinska jama;Croatia;5.6.2014.;2014-06-05;2m, 2f;4;Leptonetidae;Barusia;maheni;Barusia maheni;121;42.728553;17.881121;tf;deep cave;42.72855317.881121;10;13,6;;;;;;;;;;;;;;;;;;;;;
3534;Tihinja;Croatia;8.6.2014.;2014-06-08;2f;2;Linyphiidae;Centromerus;raridentatus sp.n.;Centromerus raridentatus sp.n.;50;42.866729;17.67021;;;42.86672917.67021;5;;;;;;;;;;;;;;;;;;;;;;
3535;Tihinja;Croatia;8.6.2014.;2014-06-08;3f, 2m, 3 juv;8;Linyphiidae;Palliduphantes;sp. 6;Palliduphantes sp. 6;50;42.866729;17.67021;;;42.86672917.67021;5;;;;;;;;;;;;;;;;;;;;;;
3536;Tihinja;Croatia;8.6.2014.;2014-06-08;1m, 1f, 2juvm;4;Leptonetidae;Sulcia;sp. 13;Sulcia sp. 13;50;42.866729;17.67021;;deep cave;42.86672917.67021;5;;;;;;;;;;;;;;;;;;;;;;
3537;Meduza;Croatia;1.8.2015.;2015-08-01;2 svlaka, 1 bulbus;;Dysderidae;Gen. 1;sp. 1;Gen. 1 sp. 1;1600;44.76237;14.987194;Tb;deep cave;44.7623714.987194;1;;;;;;;;;;;;;;;;;;;;;;
3538;Meduza;Croatia;4.8.2015.;2015-08-04;1f;1;Dysderidae;Gen. 1;sp. 1;Gen. 1 sp. 1;1600;44.76237;14.987194;Tb;deep cave;44.7623714.987194;1;;;;;;;;;;;;;;;;;;;;;;
3541;Gornja Cerova?ka špilja;Croatia;2.5.2015.;2015-05-02;1f;1;Dysderidae;Stalita;pretneri;Stalita pretneri;700;44.273382;15.884227;Tb;deep cave;44.27338215.884227;2;;;;;;;;;;;;;;;;;;;;;;
3542;Gornja Cerova?ka špilja;Croatia;2.5.2015.;2015-05-02;1 juv;1;Dysderidae;Parastalita;stygia;Parastalita stygia;700;44.273382;15.884227;Tb;deep cave;44.27338215.884227;2;;;;;;;;;;;;;;;;;;;;;;
3544;Jama na Strmici;Croatia;11.4.2015.;2015-04-11;1m;1;Dysderidae;Dasumia;amoena;Dasumia amoena;;42.767364;17.452506;tx;deep cave;42.76736417.452506;6;;;;;;;;;;;;;;;;;;;;;;
3547;Do?ina špilja;Croatia;11.4.2015.;2015-04-11;5 juv;5;Agelenidae;Histopona;sp.;Histopona sp.;;42.758091;17.489642;tx;;42.75809117.489642;1;;;;;;;;;;;;;;;;;;;;;;
3549;Špilja kod Nerezinog dola;Croatia;5.4.2015.;2015-04-05;2 juv;2;Dysderidae;Folkia;inermis;Folkia inermis;;42.758378;17.436094;tb;deep cave;42.75837817.436094;6;;14,6;12,7875;;;;;;;;;;;;;;;;;;;
3550;Jama na Brekalcima;Croatia;6.5.2015.;2015-05-06;1juv;1;Agelenidae;Histopona;bidens;Histopona bidens;;42.781895;17.407747;tb;deep cave;42.78189517.407747;1;12,86666667;;;;;;;;;;;;;;;;;;;;;
3551;Jama na Žutim kokom;Croatia;9.4.2015.;2015-04-09;5 juv;5;Agelenidae;Histopona;bidens;Histopona bidens;;42.712746;17.682621;tb;deep cave;42.71274617.682621;3;;;;;;;;;;;;;;;;;;;;;;
3552;Jama iznad Dugog polja;Croatia;11.4.2015.;2015-04-11;1f;1;Leptonetidae;Barusia;maheni;Barusia maheni;;42.75873;17.448697;tf;deep cave;42.7587317.448697;5;;;;;;;;;;;;;;;;;;;;;;
3553;Jama iznad Dugog polja;Croatia;11.4.2015.;2015-04-11;1 juv;1;Agelenidae;Histopona;bidens;Histopona bidens;;42.75873;17.448697;tb;deep cave;42.7587317.448697;5;;;;;;;;;;;;;;;;;;;;;;
3554;Jama Veja Gora;Croatia;11.4.2015.;2015-04-11;2 juv;2;Agelenidae;Histopona;bidens;Histopona bidens;;42.780094;17.417734;tb;deep cave;42.78009417.417734;1;;;;;;;;;;;;;;;;;;;;;;
3555;Movrica;Croatia;8.4.2015.;2015-04-08;1 juv f, 1 juv;2;Agelenidae;Histopona;bidens;Histopona bidens;;42.752604;17.551145;tb;deep cave;42.75260417.551145;6;12,6;;;;;;;;;;;;;;;;;;;;;
3556;Jama za Sv. Ilijom;Croatia;10.4.2015.;2015-04-10;1 juv;1;Agelenidae;Histopona;bidens;Histopona bidens;;42.744428;17.515269;tb;deep cave;42.74442817.515269;3;;;13,2;;;;;;;;;;;;;;;;;;;
3557;Špilja u Solinama;Croatia;4.4.2015.;2015-04-04;2 juv m;2;Leptonetidae;Sulcia;sp.;Sulcia sp.;;42.768021;17.377062;tx;;42.76802117.377062;5;;;7,6;;;;;;;;;;;;;;;;;;;
3559;Ostaševica;Croatia;8.4.2015.;2015-04-08;1 juv;1;Agelenidae;Histopona;bidens;Histopona bidens;;42.748959;17.544404;tb;deep cave;42.74895917.544404;9;11,6;;;;;;;;;;;;;;;;;;;;;
3560;Špilja na Bugarima;Croatia;7.4.2015.;2015-04-07;1 juv;1;Agelenidae;Histopona;bidens;Histopona bidens;;42.752459;17.474369;tb;deep cave;42.75245917.474369;3;;;;;;;;;;;;;;;;;;;;;;
3561;Špilja na Bugarima;Croatia;7.4.2015.;2015-04-07;1f;1;Leptonetidae;Sulcia;sp.;Sulcia sp.;;42.752459;17.474369;tx;;42.75245917.474369;3;;;;;;;;;;;;;;;;;;;;;;
3562;Jara? na ponti od Graca;Croatia;6.4.2015.;2015-04-06;1f;1;Agelenidae;Histopona;bidens;Histopona bidens;;42.785308;17.392067;tb;deep cave;42.78530817.392067;2;10,55;;;;;;;;;;;;;;;;;;;;;
3566;Špilja na Bugarima;Croatia;7.4.2015.;2015-04-07;1 juv;1;Agelenidae;Histopona;bidens;Histopona bidens;;42.752459;17.474369;tb;deep cave;42.75245917.474369;3;;;;;;;;;;;;;;;;;;;;;;
3567;Špilja na Bugarima;Croatia;7.4.2015.;2015-04-07;1m, 1 juv m;2;Leptonetidae;Barusia;maheni;Barusia maheni;;42.752459;17.474369;tf;deep cave;42.75245917.474369;3;;;;;;;;;;;;;;;;;;;;;;
3575;Velika špilja, Blato;Croatia;5.4.2015.;2015-04-05;2f?, 2 juv;4;Leptonetidae;Barusia;maheni;Barusia maheni;;42.76443;17.471825;tf;deep cave;42.7644317.471825;8;;;;;;;;;;;;;;;;;;;;;;
3577;Špilja kod Vrha spile;Croatia;6.4.2015.;2015-04-06;1 juv;1;Agelenidae;Tegenaria;sp.;Tegenaria sp.;;42.776757;17.420591;tx;;42.77675717.420591;3;9,4;;;;;;;;;;;;;;;;;;;;;
3578;Špilja kod Vrha spile;Croatia;6.4.2015.;2015-04-06;1m, 1f/juv;2;Leptonetidae;Barusia;maheni;Barusia maheni;;42.776757;17.420591;tf;deep cave;42.77675717.420591;3;9,4;;;;;;;;;;;;;;;;;;;;;
3581;Špilja kod Nerezinog dola;Croatia;6.4.2015.;2015-04-06;1f/juv;1;Leptonetidae;Barusia;maheni;Barusia maheni;;42.758378;17.436094;tf;deep cave;42.75837817.436094;6;;14,6;12,7875;;;;;;;;;;;;;;;;;;;
3583;Jara? na ponti od Graca;Croatia;6.4.2015.;2015-04-06;1 juv m;1;Leptonetidae;Barusia;maheni;Barusia maheni;;42.785308;17.392067;tf;deep cave;42.78530817.392067;2;10,55;;;;;;;;;;;;;;;;;;;;;
3586;Špilja u Brdskoj gori;Croatia;7.4.2015.;2015-04-07;1m, 3 juv;4;Leptonetidae;Sulcia;nocturna;Sulcia nocturna;;42.756339;17.49651;tb;deep cave;42.75633917.49651;1;;;;;;;;;;;;;;;;;;;;;;
3587;Gali?njak;Croatia;9.4.2015.;2015-04-09;1f;1;Leptonetidae;Barusia;maheni;Barusia maheni;;42.720118;17.67071;tf;deep cave;42.72011817.67071;11;12;;;;;;;;;;;;;;;;;;;;;
3588;Gali?njak;Croatia;9.4.2015.;2015-04-09;2m, 3f, 2juv m, 4 juv;11;Leptonetidae;Sulcia;sp. 6;Sulcia sp. 6;;42.720118;17.67071;tf;cave entrance;42.72011817.67071;11;12;;;;;;;;;;;;;;;;;;;;;
3592;Velika špilja, Blato;Croatia;5.4.2015.;2015-04-05;1 juv;1;Dysderidae;Folkia;inermis;Folkia inermis;;42.76443;17.471825;Tb;deep cave;42.7644317.471825;8;;;;;;;;;;;;;;;;;;;;;;
3593;Velika špilja, Blato;Croatia;5.4.2015.;2015-04-05;1f;1;Pholcidae;Spermophora;senoculata;Spermophora senoculata;;42.76443;17.471825;Tf;deep cave;42.7644317.471825;8;;;;;;;;;;;;;;;;;;;;;;
3594;Velika špilja, Blato;Croatia;5.4.2015.;2015-04-05;2m,2 juv;4;Leptonetidae;Barusia;maheni;Barusia maheni;;42.76443;17.471825;tf;deep cave;42.7644317.471825;8;;;;;;;;;;;;;;;;;;;;;;
3595;Velika špilja, Blato;Croatia;5.4.2015.;2015-04-05;1m;1;Theridiidae;Pholcomma;gibbum;Pholcomma gibbum;;42.76443;17.471825;Tx;;42.7644317.471825;8;;;;;;;;;;;;;;;;;;;;;;
3597;Špilja kod Nerezinog dola;Croatia;5.4.2015.;2015-04-05;1 juv;1;Dysderidae;Folkia;inermis;Folkia inermis;;42.758378;17.436094;Tb;deep cave;42.75837817.436094;6;;14,6;12,7875;;;;;;;;;;;;;;;;;;;
3598;Špilja kod Nerezinog dola;Croatia;5.4.2015.;2015-04-05;1f, 3 juv;4;Agelenidae;Histopona;bidens;Histopona bidens;;42.758378;17.436094;tb;deep cave;42.75837817.436094;6;;14,6;12,7875;;;;;;;;;;;;;;;;;;;
3601;Jama iznad Dugog polja;Croatia;11.4.2015.;2015-04-11;1f, 3 juv;4;Agelenidae;Histopona;bidens;Histopona bidens;;42.75873;17.448697;tb;deep cave;42.7587317.448697;5;;;;;;;;;;;;;;;;;;;;;;
3602;Jama iznad Dugog polja;Croatia;11.4.2015.;2015-04-11;1 juv m, 2 juv;3;Agelenidae;Histopona;sp.;Histopona sp.;;42.75873;17.448697;;;42.7587317.448697;5;;;;;;;;;;;;;;;;;;;;;;
3603;Jama iznad Dugog polja;Croatia;11.4.2015.;2015-04-11;1 juv;1;Dysderidae;Folkia;inermis;Folkia inermis;;42.75873;17.448697;Tb;deep cave;42.7587317.448697;5;;;;;;;;;;;;;;;;;;;;;;
3604;Stražbenica;Croatia;6.3.2015.;2015-03-06;1m;1;Nesticidae;Kryptonesticus;eremita;Kryptonesticus eremita;;43.697353;16.029618;tf;deep cave;43.69735316.029618;3;;;;;;;;;;;;;;;;;;;;;;
3605;Stražbenica;Croatia;14.12.2014.;2014-12-14;1m, 1f;2;Nesticidae;Kryptonesticus;eremita;Kryptonesticus eremita;;43.697353;16.029618;tf;deep cave;43.69735316.029618;3;;;;;;;;;;;;;;;;;;;;;;
3606;Stražbenica;Croatia;14.12.2014.;2014-12-14;1 juv;1;Dysderidae;Stalagtia;sp. 4;Stalagtia sp. 4;;43.697353;16.029618;Tb;deep cave;43.69735316.029618;3;;;;;;;;;;;;;;;;;;;;;;
3607;Stražbenica;Croatia;14.12.2014.;2014-12-14;3f;3;Linyphiidae;Palliduphantes;istrianus;Palliduphantes istrianus;;43.697353;16.029618;Tf;deep cave;43.69735316.029618;3;;;;;;;;;;;;;;;;;;;;;;
3608;Mandalina;Croatia;14.12.2014.;2014-12-14;1f;1;Dysderidae;Stalagtia;sp. 4;Stalagtia sp. 4;;43.711127;15.902143;Tb;deep cave;43.71112715.902143;2;;;;;;;;;;;;;;;;;;;;;;
3609;Mandalina;Croatia;14.12.2014.;2014-12-14;1m, 2f, 2 juv;5;Nesticidae;Kryptonesticus;eremita;Kryptonesticus eremita;;43.711127;15.902143;tf;deep cave;43.71112715.902143;2;;;;;;;;;;;;;;;;;;;;;;
3610;Topla pe?ina;Croatia;6.3.2015.;2015-03-06;1f;1;Nesticidae;Kryptonesticus;eremita;Kryptonesticus eremita;;43.839254;16.0536;tf;deep cave;43.83925416.0536;4;;;;;;;;;;;;;;;;;;;;;;
3611;Topla pe?ina;Croatia;6.3.2015.;2015-03-06;1m;1;Dysderidae;Stalagtia;sp. 4;Stalagtia sp. 4;;43.839254;16.0536;Tb;deep cave;43.83925416.0536;4;;;;;;;;;;;;;;;;;;;;;;
3612;Triši?a jama;Croatia;13.12.2014.;2014-12-13;1f;1;Linyphiidae;Palliduphantes;istrianus;Palliduphantes istrianus;;43.949231;15.947793;Tf;deep cave;43.94923115.947793;2;;;;;;;;;;;;;;;;;;;;;;
3613;Triši?a jama;Croatia;13.12.2014.;2014-12-13;1m;1;Linyphiidae;Micrargus;herbigradus;Micrargus herbigradus;;43.949231;15.947793;Tf;deep cave;43.94923115.947793;2;;;;;;;;;;;;;;;;;;;;;;
3614;Triši?a jama;Croatia;13.12.2014.;2014-12-13;1m, 1f;2;Linyphiidae;Micrargus;herbigradus;Micrargus herbigradus;;43.949231;15.947793;Tf;deep cave;43.94923115.947793;2;;;;;;;;;;;;;;;;;;;;;;
3615;Triši?a jama;Croatia;13.12.2014.;2014-12-13;1m;1;Linyphiidae;Palliduphantes;istrianus;Palliduphantes istrianus;;43.949231;15.947793;Tf;deep cave;43.94923115.947793;2;;;;;;;;;;;;;;;;;;;;;;
3616;Jazinka;Croatia;7.3.2015.;2015-03-07;1m;1;Nesticidae;Kryptonesticus;eremita;Kryptonesticus eremita;235;43.975892;16.029694;tf;deep cave;43.97589216.029694;2;;;;;;;;;;;;;;;;;;;;;;
3617;Jazinka;Croatia;16.12.2014.;2014-12-16;1m;1;Dysderidae;Stalagtia;sp. 4;Stalagtia sp. 4;235;43.975892;16.029694;Tb;deep cave;43.97589216.029694;2;;;;;;;;;;;;;;;;;;;;;;
3620;Ozi?ana pe?ina;Croatia;17.12.2014.;2014-12-17;1f;1;Dysderidae;Stalagtia;sp. 4;Stalagtia sp. 4;;43.90774;15.980634;Tb;deep cave;43.9077415.980634;4;;;;;;;;;;;;;;;;;;;;;;
3621;Ozi?ana pe?ina;Croatia;17.12.2014.;2014-12-17;1f;1;Theridiidae;Gen.;sp.;Gen. sp.;;43.90774;15.980634;;;43.9077415.980634;4;;;;;;;;;;;;;;;;;;;;;;
3622;Ozi?ana pe?ina;Croatia;17.12.2014.;2014-12-17;1m, 1f;2;Pholcidae;Holocnemus;pluchei;Holocnemus pluchei;;43.90774;15.980634;tf;deep cave;43.9077415.980634;4;;;;;;;;;;;;;;;;;;;;;;
3623;Ozi?ana pe?ina;Croatia;17.12.2014.;2014-12-17;2f, 1 juvm, 4 juv;7;Nesticidae;Kryptonesticus;eremita;Kryptonesticus eremita;;43.90774;15.980634;tf;deep cave;43.9077415.980634;4;;;;;;;;;;;;;;;;;;;;;;
3624;Stara jametina;Croatia;13.12.2014.;2014-12-13;1m, 1f;2;Linyphiidae;Micrargus;herbigradus;Micrargus herbigradus;;44.013402;16.067798;Tf;deep cave;44.01340216.067798;6;;;;;;;;;;;;;;;;;;;;;;
3625;Stara jametina;Croatia;13.12.2014.;2014-12-13;1m;1;Linyphiidae;Palliduphantes;istrianus;Palliduphantes istrianus;;43.794009;16.00259;Tf;deep cave;43.79400916.00259;6;;;;;;;;;;;;;;;;;;;;;;
3626;Stara jametina;Croatia;13.12.2014.;2014-12-13;1m;1;Linyphiidae;Micrargus;herbigradus;Micrargus herbigradus;;43.794009;16.00259;Tf;deep cave;43.79400916.00259;6;;;;;;;;;;;;;;;;;;;;;;
3628;Stara jametina;Croatia;6.3.2015.;2015-03-06;1f, 1 juv;2;Theridiidae;Episinus;cavernicola;Episinus cavernicola;;43.794009;16.00259;Tf;deep cave;43.79400916.00259;6;;;;;;;;;;;;;;;;;;;;;;
3630;Stara jametina;Croatia;13.12.2014.;2014-12-13;1m;1;Linyphiidae;Micrargus;herbigradus;Micrargus herbigradus;;43.794009;16.00259;Tf;deep cave;43.79400916.00259;6;;;;;;;;;;;;;;;;;;;;;;
3631;Stara jametina;Croatia;13.12.2014.;2014-12-13;1m;1;Dysderidae;Harpactea;sp. 18;Harpactea sp. 18;;43.794009;16.00259;Tf;deep cave;43.79400916.00259;6;;;;;;;;;;;;;;;;;;;;;;
3705;Jama pod Sinji kuk;Croatia;24.10.2015.;2015-10-24;2 juv;2;Nesticidae;Kryptonesticus;eremita;Kryptonesticus eremita;;42.709828;17.988632;tf;deep cave;42.70982817.988632;5;16,2;;;;;;;;;;;;;;;;;;;;;
3706;Jama pod Sinji kuk;Croatia;24.10.2015.;2015-10-24;1f, 1 juv;2;Nesticidae;Kryptonesticus;eremita;Kryptonesticus eremita;;42.709828;17.988632;tf;deep cave;42.70982817.988632;5;16,2;;;;;;;;;;;;;;;;;;;;;
3707;Jama pod Sinji kuk;Croatia;24.10.2015.;2015-10-24;1 juv;1;Leptonetidae;Gen. 1;sp. 1;Gen. 1 sp. 1;;42.709828;17.988632;Tb;deep cave;42.70982817.988632;5;16,2;;;;;;;;;;;;;;;;;;;;;
3708;Jama pod Sinji kuk;Croatia;24.10.2015.;2015-10-24;2f;2;Pholcidae;Holocnemus;pluchei;Holocnemus pluchei;;42.709828;17.988632;tf;deep cave;42.70982817.988632;5;16,2;;;;;;;;;;;;;;;;;;;;;
3709;Jama pod Sinji kuk;Croatia;24.10.2015.;2015-10-24;2f;2;Linyphiidae;Asthenargus;bracianus;Asthenargus bracianus;;42.709828;17.988632;tf;deep cave;42.70982817.988632;5;16,2;;;;;;;;;;;;;;;;;;;;;
3817;Jama pod Sinji kuk;Croatia;24.10.2015.;2015-10-24;1m, 1f, 2 juv;4;Leptonetidae;Gen. 1;sp. 1;Gen. 1 sp. 1;;42.709828;17.988632;Tb;deep cave;42.70982817.988632;5;16,2;;;;;;;;;;;;;;;;;;;;;
3819;Jama pod Sinji kuk;Croatia;24.10.2015.;2015-10-24;1 juvm, 1 juv, 1f;3;Leptonetidae;Gen. 1;sp. 1;Gen. 1 sp. 1;;42.709828;17.988632;Tb;deep cave;42.70982817.988632;5;16,2;;;;;;;;;;;;;;;;;;;;;
3820;Jama pod Sinji kuk;Croatia;24.10.2015.;2015-10-24;2 juv;2;Nesticidae;Kryptonesticus;eremita;Kryptonesticus eremita;;42.709828;17.988632;tf;deep cave;42.70982817.988632;5;16,2;;;;;;;;;;;;;;;;;;;;;
3825;Punar u Luci;Croatia;4.8.2015.;2015-08-04;1 juv;1;Dysderidae;Parastalita;stygia;Parastalita stygia;;44.345815;15.988437;Tb;deep cave;44.34581515.988437;1;;;;;;;;;;;;;;;;;;;;;;
3826;Spila 2;Croatia;7.7.2015.;2015-07-07;1 juv;1;Dysderidae;Stalagtia;sp. 4;Stalagtia sp. 4;;43.26239;17.204021;Tb;deep cave;43.2623917.204021;6;;;;;;;;;;;;;;;;;;;;;;
3827;Male ponte;Croatia;19.10.2015.;2015-10-19;2f, 2 juv;4;Leptonetidae;Sulcia;sp.;Sulcia sp.;;42.761389;17.430786;;;42.76138917.430786;7;;14;14,6;;;;;;;;;;;;;;;;;;;
3830;Male ponte;Croatia;19.10.2015.;2015-10-19;1 juv;1;Dysderidae;Folkia;sp. 5;Folkia sp. 5;;42.761389;17.430786;Tb;deep cave;42.76138917.430786;7;;14;14,6;;;;;;;;;;;;;;;;;;;
3831;Male ponte;Croatia;19.10.2015.;2015-10-19;1f, 1m;2;Leptonetidae;Sulcia;nocturna;Sulcia nocturna;;42.761389;17.430786;;deep cave;42.76138917.430786;7;;14;14,6;;;;;;;;;;;;;;;;;;;
3833;Gali?njak;Croatia;22.10.2015.;2015-10-22;1f, 1m, 1juvm, 3 juv/f, 4 juv;1;Leptonetidae;Sulcia;sp. 6;Sulcia sp. 6;;42.720118;17.67071;Tf;cave entrance;42.72011817.67071;11;12;;;;;;;;;;;;;;;;;;;;;
3834;Gali?njak;Croatia;22.10.2015.;2015-10-22;3f, 7 juv, 2m;12;Leptonetidae;Sulcia;sp. 6;Sulcia sp. 6;;42.720118;17.67071;Tf;cave entrance;42.72011817.67071;11;12;;;;;;;;;;;;;;;;;;;;;
3836;Špilja kod Nerezinog dola;Croatia;19.10.2015.;2015-10-19;1f;1;Dysderidae;Folkia;inermis;Folkia inermis;;42.758378;17.436094;Tb;deep cave;42.75837817.436094;6;;14,6;12,7875;;;;;;;;;;;;;;;;;;;
3841;Špilja kod Nerezinog dola;Croatia;19.10.2015.;2015-10-19;1 juv;1;Dysderidae;Folkia;inermis;Folkia inermis;;42.758378;17.436094;Tb;deep cave;42.75837817.436094;6;;14,6;12,7875;;;;;;;;;;;;;;;;;;;
3844;Kneži? jama;Croatia;20.10.2015.;2015-10-20;1juvm, 3 juv;4;Agelenidae;Histopona;bidens;Histopona bidens;;42.7783;17.459681;tb;deep cave;42.778317.459681;1;;;;;;;;;;;;;;;;;;;;;;
3847;Špilja u Solinama;Croatia;19.10.2015.;2015-10-19;2m,  2juv;4;Leptonetidae;Sulcia;nocturna;Sulcia nocturna;;42.768021;17.377062;;deep cave;42.76802117.377062;5;;;7,6;;;;;;;;;;;;;;;;;;;
3849;Jama za Sv. Ilijom;Croatia;22.10.2015.;2015-10-22;1m, 1f;2;Leptonetidae;Sulcia;nocturna;Sulcia nocturna;;42.744428;17.515269;;deep cave;42.74442817.515269;3;;;13,2;;;;;;;;;;;;;;;;;;;
3850;Jama na Strmici;Croatia;20.10.2015.;2015-10-20;1m, 1 juv;2;Leptonetidae;Barusia;maheni;Barusia maheni;;42.767364;17.452506;tf;deep cave;42.76736417.452506;6;;;;;;;;;;;;;;;;;;;;;;
3851;Jama na Strmici;Croatia;20.10.2015.;2015-10-20;1m;1;Linyphiidae;Palliduphantes;sp. 1;Palliduphantes sp. 1;;42.767364;17.452506;tf;deep cave;42.76736417.452506;6;;;;;;;;;;;;;;;;;;;;;;
3853;Jama na Strmici;Croatia;20.10.2015.;2015-10-20;7m, 1 f/juv, 4 juv;12;Leptonetidae;Barusia;maheni;Barusia maheni;;42.767364;17.452506;tf;deep cave;42.76736417.452506;6;;;;;;;;;;;;;;;;;;;;;;
3855;Gali?njak;Croatia;22.10.2015.;2015-10-22;1f;1;Leptonetidae;Gen.;sp.;Gen. sp.;;42.720118;17.67071;;;42.72011817.67071;11;12;;;;;;;;;;;;;;;;;;;;;
3856;Gali?njak;Croatia;22.10.2015.;2015-10-22;1f;1;Theridiidae;Gen.;sp.;Gen. sp.;;42.720118;17.67071;;;42.72011817.67071;11;12;;;;;;;;;;;;;;;;;;;;;
3858;Jama iznad Dugog polja;Croatia;18.10.2015.;2015-10-18;1 juv;1;Dysderidae;Folkia;inermis;Folkia inermis;;42.75873;17.448697;Tb;deep cave;42.7587317.448697;5;;;;;;;;;;;;;;;;;;;;;;
3859;Jama iznad Dugog polja;Croatia;18.10.2015.;2015-10-18;1 juv;1;Dysderidae;Folkia;inermis;Folkia inermis;;42.75873;17.448697;Tb;deep cave;42.7587317.448697;5;;;;;;;;;;;;;;;;;;;;;;
3860;Jama iznad Dugog polja;Croatia;18.10.2015.;2015-10-18;1 juv;1;Dysderidae;Folkia;inermis;Folkia inermis;;42.75873;17.448697;Tb;deep cave;42.7587317.448697;5;;;;;;;;;;;;;;;;;;;;;;
3862;Jama na Žutim kokom;Croatia;22.10.2015.;2015-10-22;1f;1;Agelenidae;Histopona;bidens;Histopona bidens;;42.712746;17.682621;tb;deep cave;42.71274617.682621;3;;;;;;;;;;;;;;;;;;;;;;
3863;Špilja kod Špilje kod Jaruge;Croatia;23.10.2015.;2015-10-23;1f;1;Agelenidae;Tegenaria;sp. X;Tegenaria sp. X;;42.782558;17.422514;;;42.78255817.422514;4;;;;;;;;;;;;;;;;;;;;;;
3864;Špilja kod Špilje kod Jaruge;Croatia;23.10.2015.;2015-10-23;1f;1;Linyphiidae;Palliduphantes;sp. 1;Palliduphantes sp. 1;;42.782558;17.422514;tf;deep cave;42.78255817.422514;4;;;;;;;;;;;;;;;;;;;;;;
3866;pod kamenjem oko jame Jaruga;Croatia;23.10.2015.;2015-10-23;1 juv;1;Dysderidae;Harpactea;sp.;Harpactea sp.;;42.782558;17.422514;;;42.78255817.422514;4;;;;;;;;;;;;;;;;;;;;;;
3867;pod kamenjem oko jame Jaruga;Croatia;23.10.2015.;2015-10-23;1f;1;Dysderidae;Dysdera;sp.;Dysdera sp.;;42.782558;17.422514;Tx;;42.78255817.422514;4;;;;;;;;;;;;;;;;;;;;;;
3868;Špilja kod Jaruge;Croatia;23.10.2015.;2015-10-23;3m, 1f, 1 juv;5;Leptonetidae;Barusia;maheni;Barusia maheni;;42.782558;17.422514;tf;deep cave;42.78255817.422514;4;;;;;;;;;;;;;;;;;;;;;;
3869;Polušpilja na Rožancu;Croatia;21.10.2015.;2015-10-21;1m, 1f;2;Agelenidae;Tegenaria;bosnica;Tegenaria bosnica;;42.769951;17.436488;;;42.76995117.436488;3;;;;;;;;;;;;;;;;;;;;;;
3870;Polušpilja na Rožancu;Croatia;21.10.2015.;2015-10-21;1 juv/f;1;Dysderidae;Harpactea;rucnerorum;Harpactea rucnerorum;;42.769951;17.436488;Tf;shallow subterranean habitat;42.76995117.436488;3;;;;;;;;;;;;;;;;;;;;;;
3871;Jama za Sv. Ilijom;Croatia;22.10.2015.;2015-10-22;1f/juv, 1 juv;2;Leptonetidae;Barusia;maheni;Barusia maheni;;42.744428;17.515269;tf;deep cave;42.74442817.515269;3;;;13,2;;;;;;;;;;;;;;;;;;;
3872;Jama za Sv. Ilijom;Croatia;22.10.2015.;2015-10-22;1m, 1f;2;Leptonetidae;Sulcia;nocturna;Sulcia nocturna;;42.744428;17.515269;;deep cave;42.74442817.515269;3;;;13,2;;;;;;;;;;;;;;;;;;;
3873;Male ponte;Croatia;19.10.2015.;2015-10-19;1f;1;Dysderidae;Folkia;sp. 5;Folkia sp. 5;;42.761389;17.430786;Tb;deep cave;42.76138917.430786;7;;14;14,6;;;;;;;;;;;;;;;;;;;
3874;Jama na Strmici;Croatia;20.10.2015.;2015-10-20;1f;1;Leptonetidae;Sulcia;sp.;Sulcia sp.;;42.767364;17.452506;;;42.76736417.452506;6;;;;;;;;;;;;;;;;;;;;;;
3876;Špilja na Strmici;Croatia;20.10.2015.;2015-10-20;1 juv;1;Dysderidae;Folkia;inermis;Folkia inermis;;42.767242;17.453338;Tb;deep cave;42.76724217.453338;4;;;;;;;;;;;;;;;;;;;;;;
3877;Gali?njak;Croatia;22.10.2015.;2015-10-22;5f, 1m;6;Leptonetidae;Sulcia;sp. 6;Sulcia sp. 6;;42.720118;17.67071;Tf;cave entrance;42.72011817.67071;11;12;;;;;;;;;;;;;;;;;;;;;
3878;Gali?njak;Croatia;22.10.2015.;2015-10-22;1m;1;Linyphiidae;Gen.;sp. X;Gen. sp. X;;42.720118;17.67071;;;42.72011817.67071;11;12;;;;;;;;;;;;;;;;;;;;;
3879;Gali?njak;Croatia;22.10.2015.;2015-10-22;1f;1;Theridiidae;Gen.;sp.;Gen. sp.;;42.720118;17.67071;;;42.72011817.67071;11;12;;;;;;;;;;;;;;;;;;;;;
3880;Jama na Strmici;Croatia;20.10.2015.;2015-10-20;2m, 3f;5;Linyphiidae;Palliduphantes;sp. 1;Palliduphantes sp. 1;;42.767364;17.452506;tf;deep cave;42.76736417.452506;6;;;;;;;;;;;;;;;;;;;;;;
3881;Jama na Strmici;Croatia;20.10.2015.;2015-10-20;1f, 2m;3;Linyphiidae;Gen.;sp. X;Gen. sp. X;;42.767364;17.452506;;;42.76736417.452506;6;;;;;;;;;;;;;;;;;;;;;;
3882;Jama na Strmici;Croatia;20.10.2015.;2015-10-20;1 juv;1;Dysderidae;Folkia;inermis;Folkia inermis;;42.767364;17.452506;Tb;deep cave;42.76736417.452506;6;;;;;;;;;;;;;;;;;;;;;;
3883;Jama na Strmici;Croatia;20.10.2015.;2015-10-20;2m, 1 juvf, 1 juv m;4;Leptonetidae;Barusia;maheni;Barusia maheni;;42.767364;17.452506;tf;deep cave;42.76736417.452506;6;;;;;;;;;;;;;;;;;;;;;;
3884;Velika špilja, Blato;Croatia;19.10.2015.;2015-10-19;9m, 2f, 3 juv;14;Leptonetidae;Barusia;maheni;Barusia maheni;;42.76443;17.471825;tf;deep cave;42.7644317.471825;8;;;;;;;;;;;;;;;;;;;;;;
3885;Špilja u Solinama;Croatia;19.10.2015.;2015-10-19;2m, 3f, 3 juv;8;Leptonetidae;Barusia;maheni;Barusia maheni;;42.768021;17.377062;tf;deep cave;42.76802117.377062;5;;;7,6;;;;;;;;;;;;;;;;;;;
3886;Polušpilja na Rožancu;Croatia;21.10.2015.;2015-10-21;5m, 1f, 4 juv;1;Leptonetidae;Barusia;maheni;Barusia maheni;;42.769951;17.436488;tf;cave entrance;42.76995117.436488;3;;;;;;;;;;;;;;;;;;;;;;
3887;Jama na Žutim kokom;Croatia;22.10.2015.;2015-10-22;2m, 3f, 3 juv;8;Leptonetidae;Barusia;maheni;Barusia maheni;;42.712746;17.682621;tf;deep cave;42.71274617.682621;3;;;;;;;;;;;;;;;;;;;;;;
3888;Jama u šumi uvale Bjejajka;Croatia;19.10.2015.;2015-10-19;1m, 1f, 1 juv;3;Leptonetidae;Barusia;maheni;Barusia maheni;;42.765231;17.385606;tf;deep cave;42.76523117.385606;6;;;;;;;;;;;;;;;;;;;;;;
3889;Tunel kod Kulijera;Croatia;23.10.2015.;2015-10-23;4m, 2f, 8 juv;14;Leptonetidae;Barusia;maheni;Barusia maheni;;42.787249;17.328395;tf;deep cave;42.78724917.328395;3;;;;;;;;;;;;;;;;;;;;;;
3890;Špilja kod Nerezinog dola;Croatia;19.10.2015.;2015-10-19;3m, 4f, 1 juv;8;Leptonetidae;Barusia;maheni;Barusia maheni;;42.758378;17.436094;tf;deep cave;42.75837817.436094;6;;14,6;12,7875;;;;;;;;;;;;;;;;;;;
3891;Male ponte;Croatia;19.10.2015.;2015-10-19;2f, 1m;3;Linyphiidae;Palliduphantes;sp. 1;Palliduphantes sp. 1;;42.761389;17.430786;tf;deep cave;42.76138917.430786;7;;14;14,6;;;;;;;;;;;;;;;;;;;
3892;Male ponte;Croatia;19.10.2015.;2015-10-19;3f, 1m, 4 juv;8;Leptonetidae;Sulcia;nocturna;Sulcia nocturna;;42.761389;17.430786;;deep cave;42.76138917.430786;7;;14;14,6;;;;;;;;;;;;;;;;;;;
3893;Jama iznad Dugog polja;Croatia;18.10.2015.;2015-10-18;1m, 2f, 3 juv;6;Leptonetidae;Barusia;maheni;Barusia maheni;;42.75873;17.448697;tf;deep cave;42.7587317.448697;5;;;;;;;;;;;;;;;;;;;;;;
3894;Jama iznad Dugog polja;Croatia;18.10.2015.;2015-10-18;1m, 2f, 1 juv;4;Leptonetidae;Barusia;maheni;Barusia maheni;;42.75873;17.448697;tf;deep cave;42.7587317.448697;5;;;;;;;;;;;;;;;;;;;;;;
3895;Jama iznad Dugog polja;Croatia;18.10.2015.;2015-10-18;1f;1;Leptonetidae;Sulcia;nocturna;Sulcia nocturna;;42.75873;17.448697;;deep cave;42.7587317.448697;5;;;;;;;;;;;;;;;;;;;;;;
3896;Pe?ina u Dunjaku;Croatia;28.11.2015.;2015-11-28;1m, 1f, 1juv;3;Linyphiidae;Porrhomma;egeria;Porrhomma egeria;205;45.23655;15.668962;;deep cave;45.2365515.668962;1;;;;;;;;;;;;;;;;;;;;;;
3899;Jama Blitvica;Croatia;25.6.2015.;2015-06-25;2f, 1 juv m;3;Linyphiidae;Centromerus;densidentatus sp.n.;Centromerus densidentatus sp.n.;;43.765234;15.352649;;;43.76523415.352649;2;;;;;;;;;;;;;;;;;;;;;;
3901;Jama u šumi uvale Bjejajka;Croatia;19.10.2015.;2015-10-19;1m, 2f;3;Leptonetidae;Barusia;maheni;Barusia maheni;;42.765231;17.385606;tf;deep cave;42.76523117.385606;6;;;;;;;;;;;;;;;;;;;;;;
3902;Jama u šumi uvale Bjejajka;Croatia;19.10.2015.;2015-10-19;2f;2;Linyphiidae;Palliduphantes;sp. 1;Palliduphantes sp. 1;;42.765231;17.385606;tf;deep cave;42.76523117.385606;6;;;;;;;;;;;;;;;;;;;;;;
3904;oko Jame u šumi uvale Bjejajka;Croatia;19.10.2015.;2015-10-19;1m, 1 juv;2;Scytodidae;Scytodes;thoracica;Scytodes thoracica;;42.765288;17.385591;Tx;;42.76528817.385591;1;;;;;;;;;;;;;;;;;;;;;;
3906;Špilja u Radinovcima;Croatia;1.5.2014.;2014-05-01;2 juv m;2;Nesticidae;Kryptonesticus;deelemanae;Kryptonesticus deelemanae;400;43.387285;17.0103;tb;deep cave;43.38728517.0103;4;;;;;;;;;;;;;;;;;;;;;;
3907;Kašogijeva jama;Croatia;11.10.2014.;2014-10-11;1f;1;Agelenidae;Histopona;conveniens;Histopona conveniens;;43.338971;17.05039;Tf;deep cave;43.33897117.05039;2;;;;;;;;;;;;;;;;;;;;;;
3908;Tu?epska vilenja?a;Croatia;14.10.2014.;2014-10-14;1m, 4f;5;Linyphiidae;Typhlonyphia;sp. 1;Typhlonyphia sp. 1;1181;43.286465;17.083638;Tb;deep cave;43.28646517.083638;8;;;;;;;;;;;;;;;;;;;;;;
3909;Jama pod Svetim Jurom;Croatia;11.10.2014.;2014-10-11;1juv;1;Nesticidae;Kryptonesticus;deelemanae;Kryptonesticus deelemanae;;43.339049;17.054385;tb;deep cave;43.33904917.054385;1;;;;;;;;;;;;;;;;;;;;;;
3910;Jama iznad Sarana?a;Croatia;2.5.2014.;2014-05-02;1f;1;Linyphiidae;Palliduphantes;spelaeorum;Palliduphantes spelaeorum;770;43.249007;17.174663;Tf;deep cave;43.24900717.174663;7;;;;;;;;;;;;;;;;;;;;;;
3911;Spila 1;Croatia;15.10.2014.;2014-10-15;1 juv;1;Dysderidae;Harpactea;damini;Harpactea damini;340;43.262438;17.203945;TF;deep cave;43.26243817.203945;3;;;;;;;;;;;;;;;;;;;;;;
3912;Špilja u Radinovcima;Croatia;15.10.2014.;2014-10-15;1 juv;1;Nesticidae;Kryptonesticus;deelemanae;Kryptonesticus deelemanae;400;43.387285;17.0103;tb;deep cave;43.38728517.0103;4;;;;;;;;;;;;;;;;;;;;;;
3913;Tu?epska vilenja?a;Croatia;14.10.2014.;2014-10-14;1 juv;1;Dysderidae;Stalagtia;sp. 4;Stalagtia sp. 4;1181;43.286465;17.083638;Tb;deep cave;43.28646517.083638;8;;;;;;;;;;;;;;;;;;;;;;
3914;Jama za Supinom;Croatia;14.10.2014.;2014-10-14;1f;1;Linyphiidae;Typhlonyphia;sp. 1;Typhlonyphia sp. 1;;43.250417;17.113278;Tb;deep cave;43.25041717.113278;7;;;;;;;;;;;;;;;;;;;;;;
3915;Kašogijeva jama;Croatia;11.10.2014.;2014-10-11;1f;1;Nesticidae;Kryptonesticus;deelemanae;Kryptonesticus deelemanae;;43.338971;17.05039;tb;deep cave;43.33897117.05039;2;;;;;;;;;;;;;;;;;;;;;;
3916;Jujnovi?a špilja;Croatia;29.4.2014.;2014-04-29;1f;1;Dysderidae;Harpactea;damini;Harpactea damini;405;43.266579;17.19798;TF;deep cave;43.26657917.19798;6;;;;;;;;;;;;;;;;;;;;;;
3917;Spila 2;Croatia;29.4.2014.;2014-04-29;2 juv;2;Dysderidae;Harpactea;damini;Harpactea damini;338;43.26239;17.204021;TF;deep cave;43.2623917.204021;6;;;;;;;;;;;;;;;;;;;;;;
3918;Spila 1;Croatia;1.5.2014.;2014-05-01;1 juv;1;Dysderidae;Harpactea;damini;Harpactea damini;340;43.262438;17.203945;TF;deep cave;43.26243817.203945;3;;;;;;;;;;;;;;;;;;;;;;
3919;Jujnovi?a špilja;Croatia;29.4.2014.;2014-04-29;1m, 3 juv;4;Dysderidae;Harpactea;damini;Harpactea damini;405;43.266579;17.19798;TF;deep cave;43.26657917.19798;6;;;;;;;;;;;;;;;;;;;;;;
3920;Karabitkin let;Croatia;4.6.2015.;2015-06-04;1f;1;Linyphiidae;Troglohyphantes;sp. 3;Troglohyphantes sp. 3;;44.742824;15.060869;tb;deep cave;44.74282415.060869;1;;;;;;;;;;;;;;;;;;;;;;
3921;Jubilarna jama;Croatia;5.8.2015.;2015-08-05;1f, 1m;2;Linyphiidae;Troglohyphantes;sp. 4;Troglohyphantes sp. 4;;44.658654;15.129563;tb;deep cave;44.65865415.129563;1;;;;;;;;;;;;;;;;;;;;;;
3922;Špilja na Dani?a kosi;Croatia;2.8.2015.;2015-08-02;1juvf, 1juvm;2;Linyphiidae;Troglohyphantes;sp.;Troglohyphantes sp.;;44.661778;15.128574;;deep cave;44.66177815.128574;2;;;;;;;;;;;;;;;;;;;;;;
3923;Špilja na Dani?a kosi;Croatia;2.8.2015.;2015-08-02;1f;1;Dysderidae;Parastalita;stygia;Parastalita stygia;800;44.661778;15.128574;Tb;deep cave;44.66177815.128574;2;;;;;;;;;;;;;;;;;;;;;;
3924;Fau 1 - V1;Croatia;x.8.1998.;1998-08;1m;1;Agelenidae;Histopona;luxurians;Histopona luxurians;;44.741925;15.000015;tf;deep cave;44.74192515.000015;1;;;;;;;;;;;;;;;;;;;;;;
3925;Anti?a špilja;Croatia;23.7.2015.;2015-07-23;1f, 1 juv;2;Dysderidae;Parastalita;stygia;Parastalita stygia;;44.956848;15.3167;Tb;deep cave;44.95684815.3167;1;;;;;;;;;;;;;;;;;;;;;;
3927;Skusa?a jama;Croatia;3.8.2015.;2015-08-03;2f, 1 juvf, 2 juvm, 1 juv;6;Linyphiidae;Troglohyphantes;sp. 4;Troglohyphantes sp. 4;;44.65566;15.13489;tb;deep cave;44.6556615.13489;1;;;;;;;;;;;;;;;;;;;;;;
3930;Pe?ina na ?akovcu;Croatia;2.8.2015.;2015-08-02;1 juv;1;Dysderidae;Stalita;pretneri;Stalita pretneri;;44.697677;15.280168;Tb;deep cave;44.69767715.280168;1;;;;;;;;;;;;;;;;;;;;;;
3931;Atila;Croatia;27.7.2014.;2014-07-27;1f;1;Dysderidae;Stalita;pretneri;Stalita pretneri;;44.677748;15.110767;Tb;deep cave;44.67774815.110767;2;;;;;;;;;;;;;;;;;;;;;;
3932;Samogorska špilja;Croatia;23.1.2016.;2016-01-23;1m, 7f, 3 juvm, 3 juv;14;Nesticidae;Kryptonesticus;deelemanae;Kryptonesticus deelemanae;717;43.318227;17.121122;tb;deep cave;43.31822717.121122;6;;;;;;;;;;;;;;;;;;;;;;
3933;Samogorska špilja;Croatia;23.1.2016.;2016-01-23;9f;9;Nesticidae;Kryptonesticus;deelemanae;Kryptonesticus deelemanae;717;43.318227;17.121122;tb;deep cave;43.31822717.121122;6;;;;;;;;;;;;;;;;;;;;;;
3934;Samogorska špilja;Croatia;23.1.2016.;2016-01-23;9f, 3m, 2juv;14;Nesticidae;Kryptonesticus;deelemanae;Kryptonesticus deelemanae;717;43.318227;17.121122;tb;deep cave;43.31822717.121122;6;;;;;;;;;;;;;;;;;;;;;;
3935;Samogorska špilja;Croatia;23.1.2016.;2016-01-23;1m;1;Pholcidae;Stygopholcus;absoloni;Stygopholcus absoloni;717;43.318227;17.121122;;deep cave;43.31822717.121122;6;;;;;;;;;;;;;;;;;;;;;;
3936;Samogorska špilja;Croatia;23.1.2016.;2016-01-23;3 juv, 1juvm;4;Nesticidae;Kryptonesticus;deelemanae;Kryptonesticus deelemanae;717;43.318227;17.121122;tb;deep cave;43.31822717.121122;6;;;;;;;;;;;;;;;;;;;;;;
3937;Samogorska špilja;Croatia;23.1.2016.;2016-01-23;1m, 3f, 1juv;5;Leptonetidae;Sulcia;sp. 4;Sulcia sp. 4;717;43.318227;17.121122;Tb;deep cave;43.31822717.121122;6;;;;;;;;;;;;;;;;;;;;;;
3938;Stonjska pe? gornja;Croatia;22.1.2016.;2016-01-22;2f, 1juv;3;Nesticidae;Kryptonesticus;deelemanae;Kryptonesticus deelemanae;;43.315167;17.1304;tb;deep cave;43.31516717.1304;4;;;;;;;;;;;;;;;;;;;;;;
3939;Stonjska pe? gornja;Croatia;22.1.2016.;2016-01-22;1f;1;Leptonetidae;Sulcia;sp.;Sulcia sp.;;43.315167;17.1304;;;43.31516717.1304;4;;;;;;;;;;;;;;;;;;;;;;
3940;Stonjska pe? gornja;Croatia;22.1.2016.;2016-01-22;1f;1;Linyphiidae;Centromerus;cavernarum;Centromerus cavernarum;;43.315167;17.1304;Tf;deep cave;43.31516717.1304;4;;;;;;;;;;;;;;;;;;;;;;
3941;Stonjska pe? gornja;Croatia;22.1.2016.;2016-01-22;2f, 1m;3;Nesticidae;Kryptonesticus;deelemanae;Kryptonesticus deelemanae;;43.315167;17.1304;tb;deep cave;43.31516717.1304;4;;;;;;;;;;;;;;;;;;;;;;
3944;Stonjska pe? donja;Croatia;22.1.2016.;2016-01-22;3juv;3;Nesticidae;Kryptonesticus;deelemanae;Kryptonesticus deelemanae;608;43.315167;17.130659;tb;deep cave;43.31516717.130659;6;;;;;;;;;;;;;;;;;;;;;;
3945;Stonjska pe? donja;Croatia;22.1.2016.;2016-01-22;1f;1;Nesticidae;Kryptonesticus;deelemanae;Kryptonesticus deelemanae;608;43.315167;17.130659;tb;deep cave;43.31516717.130659;6;;;;;;;;;;;;;;;;;;;;;;
3947;Stonjska pe? donja;Croatia;22.1.2016.;2016-01-22;5f;5;Nesticidae;Kryptonesticus;deelemanae;Kryptonesticus deelemanae;608;43.315167;17.130659;tb;deep cave;43.31516717.130659;6;;;;;;;;;;;;;;;;;;;;;;
3949;Kukor;Croatia;21.1.2016.;2016-01-21;2f;2;Nesticidae;Kryptonesticus;deelemanae;Kryptonesticus deelemanae;425;43.355609;16.991707;tb;deep cave;43.35560916.991707;10;;;;;;;;;;;;;;;;;;;;;;
3950;Kukor;Croatia;21.1.2016.;2016-01-21;1f, 4juv;5;Nesticidae;Kryptonesticus;deelemanae;Kryptonesticus deelemanae;425;43.355609;16.991707;tb;deep cave;43.35560916.991707;10;;;;;;;;;;;;;;;;;;;;;;
3951;Kukor;Croatia;21.1.2016.;2016-01-21;1f;1;Scytodidae;Scytodes;thoracica;Scytodes thoracica;425;43.355609;16.991707;Tx;;43.35560916.991707;10;;;;;;;;;;;;;;;;;;;;;;
3952;Kukor;Croatia;21.1.2016.;2016-01-21;2m;2;Pholcidae;Stygopholcus;absoloni;Stygopholcus absoloni;425;43.355609;16.991707;;deep cave;43.35560916.991707;10;;;;;;;;;;;;;;;;;;;;;;
3953;Matijaševa pe?;Croatia;23.1.2016.;2016-01-23;1f, 1juv;2;Nesticidae;Kryptonesticus;deelemanae;Kryptonesticus deelemanae;584;43.320551;17.122321;tb;deep cave;43.32055117.122321;6;;;;;;;;;;;;;;;;;;;;;;
3954;Matijaševa pe?;Croatia;23.1.2016.;2016-01-23;1m;1;Pholcidae;Stygopholcus;absoloni;Stygopholcus absoloni;584;43.320551;17.122321;;deep cave;43.32055117.122321;6;;;;;;;;;;;;;;;;;;;;;;
3955;Matijaševa pe?;Croatia;23.1.2016.;2016-01-23;3juv;3;Nesticidae;Kryptonesticus;deelemanae;Kryptonesticus deelemanae;584;43.320551;17.122321;tb;deep cave;43.32055117.122321;6;;;;;;;;;;;;;;;;;;;;;;
3957;Matijaševa pe?;Croatia;23.1.2016.;2016-01-23;2juv;2;Nesticidae;Kryptonesticus;deelemanae;Kryptonesticus deelemanae;584;43.320551;17.122321;tb;deep cave;43.32055117.122321;6;;;;;;;;;;;;;;;;;;;;;;
3958;Matijaševa pe?;Croatia;23.1.2016.;2016-01-23;1f;1;Leptonetidae;Barusia;maheni;Barusia maheni;584;43.320551;17.122321;tf;deep cave;43.32055117.122321;6;;;;;;;;;;;;;;;;;;;;;;
3960;Matijaševa pe?;Croatia;23.1.2016.;2016-01-23;1f;1;Pholcidae;Stygopholcus;absoloni;Stygopholcus absoloni;584;43.320551;17.122321;;deep cave;43.32055117.122321;6;;;;;;;;;;;;;;;;;;;;;;
3961;Samogorska špilja;Croatia;23.1.2016.;2016-01-23;1m, 1juv;2;Leptonetidae;Sulcia;sp. 4;Sulcia sp. 4;717;43.318227;17.121122;Tb;deep cave;43.31822717.121122;6;;;;;;;;;;;;;;;;;;;;;;
3962;Samogorska špilja;Croatia;23.1.2016.;2016-01-23;1m;1;Pholcidae;Stygopholcus;absoloni;Stygopholcus absoloni;717;43.318227;17.121122;;deep cave;43.31822717.121122;6;;;;;;;;;;;;;;;;;;;;;;
3964;Kukor;Croatia;21.1.2016.;2016-01-21;5f, 1m, 2juv;8;Leptonetidae;Sulcia;sp. 3;Sulcia sp. 3;425;43.355609;16.991707;Tb;deep cave;43.35560916.991707;10;;;;;;;;;;;;;;;;;;;;;;
3965;Kukor;Croatia;21.1.2016.;2016-01-21;6m, 13f/juv;19;Leptonetidae;Sulcia;sp. 3;Sulcia sp. 3;425;43.355609;16.991707;Tb;deep cave;43.35560916.991707;10;;;;;;;;;;;;;;;;;;;;;;
3967;Kukor;Croatia;21.1.2016.;2016-01-21;4m, 9f/juv;13;Leptonetidae;Sulcia;sp. 3;Sulcia sp. 3;425;43.355609;16.991707;Tb;deep cave;43.35560916.991707;10;;;;;;;;;;;;;;;;;;;;;;
3968;Kukor;Croatia;21.1.2016.;2016-01-21;1m;1;Pholcidae;Stygopholcus;absoloni;Stygopholcus absoloni;425;43.355609;16.991707;;deep cave;43.35560916.991707;10;;;;;;;;;;;;;;;;;;;;;;
3969;Kukor;Croatia;21.1.2016.;2016-01-21;1m;1;Agelenidae;Histopona;conveniens;Histopona conveniens;425;43.355609;16.991707;Tf;deep cave;43.35560916.991707;10;;;;;;;;;;;;;;;;;;;;;;
3971;Kukor;Croatia;21.1.2016.;2016-01-21;3f, 1juv;4;Pholcidae;Stygopholcus;absoloni;Stygopholcus absoloni;425;43.355609;16.991707;;deep cave;43.35560916.991707;10;;;;;;;;;;;;;;;;;;;;;;
3973;Stonjska pe? donja;Croatia;22.1.2016.;2016-01-22;1juvm, 1juv;2;Nesticidae;Kryptonesticus;deelemanae;Kryptonesticus deelemanae;608;43.315167;17.130659;tb;deep cave;43.31516717.130659;6;;;;;;;;;;;;;;;;;;;;;;
3975;Stonjska pe? donja;Croatia;22.1.2016.;2016-01-22;1m, 1f;2;Pholcidae;Stygopholcus;absoloni;Stygopholcus absoloni;608;43.315167;17.130659;;deep cave;43.31516717.130659;6;;;;;;;;;;;;;;;;;;;;;;
3976;Stonjska pe? gornja;Croatia;22.1.2016.;2016-01-22;3m, 6f;9;Leptonetidae;Sulcia;sp. 4;Sulcia sp. 4;;43.315167;17.1304;Tb;deep cave;43.31516717.1304;4;;;;;;;;;;;;;;;;;;;;;;
3977;Stonjska pe? gornja;Croatia;22.1.2016.;2016-01-22;1juvm;1;Nesticidae;Kryptonesticus;deelemanae;Kryptonesticus deelemanae;;43.315167;17.1304;tb;deep cave;43.31516717.1304;4;;;;;;;;;;;;;;;;;;;;;;
3979;Gradska spila;Croatia;23.1.2016.;2016-01-23;1m, 2f, 3juv;6;Leptonetidae;Sulcia;sp. 4;Sulcia sp. 4;755;43.318029;17.117623;Tb;deep cave;43.31802917.117623;4;;;;;;;;;;;;;;;;;;;;;;
3980;Gradska spila;Croatia;23.1.2016.;2016-01-23;1m;1;Pholcidae;Stygopholcus;absoloni;Stygopholcus absoloni;755;43.318029;17.117623;;deep cave;43.31802917.117623;4;;;;;;;;;;;;;;;;;;;;;;
3981;Gradska spila;Croatia;23.1.2016.;2016-01-23;1m, 3f, 1juv;5;Leptonetidae;Sulcia;sp. 4;Sulcia sp. 4;755;43.318029;17.117623;Tb;deep cave;43.31802917.117623;4;;;;;;;;;;;;;;;;;;;;;;
3982;Gradska spila;Croatia;23.1.2016.;2016-01-23;3m, 2f;5;Leptonetidae;Sulcia;sp. 4;Sulcia sp. 4;755;43.318029;17.117623;Tb;deep cave;43.31802917.117623;4;;;;;;;;;;;;;;;;;;;;;;
3983;Mala špilja kod Antunovi?a;Croatia;22.1.2016.;2016-01-22;1f;1;Dysderidae;Stalagtia;sp. 4;Stalagtia sp. 4;708;43.27698;17.226992;Tb;deep cave;43.2769817.226992;1;;;;;;;;;;;;;;;;;;;;;;
3984;Mala špilja kod Antunovi?a;Croatia;22.1.2016.;2016-01-22;1f;1;Dysderidae;Stalagtia;sp. 4;Stalagtia sp. 4;708;43.27698;17.226992;Tb;deep cave;43.2769817.226992;1;;;;;;;;;;;;;;;;;;;;;;
3985;?utno;Croatia;20.3.2016.;2016-03-20;3 juv;3;Dysderidae;Stalita;pretneri;Stalita pretneri;210;45.415607;15.233039;Tb;deep cave;45.41560715.233039;4;;;;;;;;;;;;;;;;;;;;;;
3986;Šolkina jama;Croatia;27.2.2016.;2016-02-27;4m, 2f;6;Leptonetidae;Sulcia;sp.;Sulcia sp.;230;42.966544;17.662484;;;42.96654417.662484;4;;;;;;;;;;;;;;;;;;;;;;
3987;Šolkina jama;Croatia;27.2.2016.;2016-02-27;1juv;1;Agelenidae;Tegenaria;sp.;Tegenaria sp.;230;42.966544;17.662484;;;42.96654417.662484;4;;;;;;;;;;;;;;;;;;;;;;
3989;Šolkina jama;Croatia;27.2.2016.;2016-02-27;1f;1;Pholcidae;Stygopholcus;absoloni;Stygopholcus absoloni;230;42.966544;17.662484;;deep cave;42.96654417.662484;4;;;;;;;;;;;;;;;;;;;;;;
3991;Batista jama;Croatia;13.-15.7.2016.;2016-07-13/2016-07-15;2m;2;Linyphiidae;Palliduphantes;spelaeorum;Palliduphantes spelaeorum;;43.33236;16.43605;Tf;deep cave;43.3323616.43605;2;;;;;;;;;;;;;;;;;;;;;;
3992;Batista jama;Croatia;13.-15.7.2016.;2016-07-13/2016-07-15;2f, 1juvm, 1 juv;4;Nesticidae;Kryptonesticus;eremita;Kryptonesticus eremita;;43.33236;16.43605;tf;deep cave;43.3323616.43605;2;;;;;;;;;;;;;;;;;;;;;;
3994;Batista jama;Croatia;13.-15.7.2016.;2016-07-13/2016-07-15;1f, 1m, 1 juv f;3;Linyphiidae;Palliduphantes;spelaeorum;Palliduphantes spelaeorum;;43.33236;16.43605;Tf;deep cave;43.3323616.43605;2;;;;;;;;;;;;;;;;;;;;;;
3995;Tu?epska vilenja?a;Croatia;21.8.2016.;2016-08-21;1f;1;Dysderidae;Mesostalita;comottii;Mesostalita comottii;1181;43.286465;17.083638;Tb;deep cave;43.28646517.083638;8;;;;;;;;;;;;;;;;;;;;;;
3996;Špilja u Grli?u;Croatia;19.8.2016.;2016-08-19;2m;2;Pholcidae;Stygopholcus;absoloni;Stygopholcus absoloni;;43.158023;16.813636;;deep cave;43.15802316.813636;4;;;;;;;;;;;;;;;;;;;;;;
3997;Vojni tunel na Kamenicama;Croatia;17.8.2016.;2016-08-17;1f;1;Pholcidae;Pholcus;phalangioides;Pholcus phalangioides;;42.72749;16.840169;;deep cave;42.7274916.840169;2;;;;;;;;;;;;;;;;;;;;;;
3999;Špilja na Pozalicu;Croatia;16.8.2016.;2016-08-16;1m, 1f, 1juvm, 1juv;4;Leptonetidae;Barusia;sp. 1;Barusia sp. 1;;42.76131;16.9129;tb;deep cave;42.7613116.9129;4;;12,65;14;;;;;;;;;;;;;;;;;;;
4000;Vojni tunel na Kamenicama;Croatia;17.8.2016.;2016-08-17;4f, 2 juvm, 3 juv;9;Leptonetidae;Barusia;sp. 1;Barusia sp. 1;;42.72749;16.840169;tb;deep cave;42.7274916.840169;2;;;;;;;;;;;;;;;;;;;;;;
4001;Špilja na Pozalicu;Croatia;16.8.2016.;2016-08-16;1m, 1f;2;Leptonetidae;Barusia;sp. 1;Barusia sp. 1;;42.76131;16.9129;tb;deep cave;42.7613116.9129;4;;12,65;14;;;;;;;;;;;;;;;;;;;
4002;Vojni tunel na Kamenicama;Croatia;17.8.2016.;2016-08-17;1f, 1 juv m;2;Leptonetidae;Barusia;sp. 1;Barusia sp. 1;;42.72749;16.840169;tb;deep cave;42.7274916.840169;2;;;;;;;;;;;;;;;;;;;;;;
4003;Ra?a špilja;Croatia;16.8.2016.;2016-08-16;1 juv;1;Dysderidae;Folkia;sp. 2;Folkia sp. 2;;42.734493;16.910785;Tb;deep cave;42.73449316.910785;4;;16,5;14,42;;;;;;;;;;;;;;;;;;;
4004;Ra?a špilja;Croatia;16.8.2016.;2016-08-16;2m;2;Leptonetidae;Barusia;sp. 1;Barusia sp. 1;;42.734493;16.910785;tb;deep cave;42.73449316.910785;4;;16,5;14,42;;;;;;;;;;;;;;;;;;;
4005;Ra?a špilja;Croatia;16.8.2016.;2016-08-16;11f/juv;11;Leptonetidae;Barusia;sp. 1;Barusia sp. 1;;42.734493;16.910785;tb;deep cave;42.73449316.910785;4;;16,5;14,42;;;;;;;;;;;;;;;;;;;
4007;Ra?a špilja;Croatia;16.8.2016.;2016-08-16;1m, 3f, 1 juvm;5;Leptonetidae;Barusia;sp. 1;Barusia sp. 1;;42.734493;16.910785;tb;deep cave;42.73449316.910785;4;;16,5;14,42;;;;;;;;;;;;;;;;;;;
4008;Ra?a špilja;Croatia;16.8.2016.;2016-08-16;1m;1;Leptonetidae;Barusia;sp. 1;Barusia sp. 1;;42.734493;16.910785;tb;deep cave;42.73449316.910785;4;;16,5;14,42;;;;;;;;;;;;;;;;;;;
4009;Špilja u Grli?u;Croatia;19.8.2016.;2016-08-19;2f, 4juv m, 2 juv;8;Leptonetidae;Barusia;maheni;Barusia maheni;;43.158023;16.813636;tf;deep cave;43.15802316.813636;4;;;;;;;;;;;;;;;;;;;;;;
4010;Špilja u Grli?u;Croatia;19.8.2016.;2016-08-19;1f, 2 juvm, 1 juv;4;Leptonetidae;Barusia;maheni;Barusia maheni;;43.158023;16.813636;tf;deep cave;43.15802316.813636;4;;;;;;;;;;;;;;;;;;;;;;
4011;Špilja u Grli?u;Croatia;19.8.2016.;2016-08-19;1juv m, 2juv/f, 3 juv;6;Leptonetidae;Barusia;maheni;Barusia maheni;;43.158023;16.813636;tf;deep cave;43.15802316.813636;4;;;;;;;;;;;;;;;;;;;;;;
4012;Špilja u Grli?u;Croatia;19.8.2016.;2016-08-19;1f, 1juvm, 1juvf/juv, 1 juv;4;Leptonetidae;Barusia;maheni;Barusia maheni;;43.158023;16.813636;tf;deep cave;43.15802316.813636;4;;;;;;;;;;;;;;;;;;;;;;
4013;Grap?eva špilja;Croatia;20.8.2016.;2016-08-20;4juv;4;Agelenidae;Hadites;tegenarioides;Hadites tegenarioides;200;43.134189;16.753732;TB;deep cave;43.13418916.753732;5;;;13,93333333;;;;;;;;;;;;;;;;;;;
4014;Grap?eva špilja;Croatia;20.8.2016.;2016-08-20;1f, 7juv;8;Agelenidae;Hadites;tegenarioides;Hadites tegenarioides;200;43.134189;16.753732;TB;deep cave;43.13418916.753732;5;;;13,93333333;;;;;;;;;;;;;;;;;;;
4015;Grap?eva špilja;Croatia;20.8.2016.;2016-08-20;1f;1;Nesticidae;Kryptonesticus;eremita;Kryptonesticus eremita;200;43.134189;16.753732;tf;deep cave;43.13418916.753732;5;;;13,93333333;;;;;;;;;;;;;;;;;;;
4017;Grap?eva špilja;Croatia;20.8.2016.;2016-08-20;1m, 1 juv m;2;Leptonetidae;Barusia;insulana;Barusia insulana;200;43.134189;16.753732;tb;deep cave;43.13418916.753732;5;;;13,93333333;;;;;;;;;;;;;;;;;;;
4018;Špilja pod Kapelu;Croatia;18.8.2016.;2016-08-18;1 juv;1;Agelenidae;Hadites;tegenarioides;Hadites tegenarioides;;43.184949;16.434233;TB;deep cave;43.18494916.434233;5;;;;;;;;;;;;;;;;;;;;;;
4024;Fosilka;Croatia;5.8.2016.;2016-08-05;2f, 1m, 1 juv m;4;Linyphiidae;Troglohyphantes;sp. 4;Troglohyphantes sp. 4;;44.623188;15.130654;tb;deep cave;44.62318815.130654;1;;;;;;;;;;;;;;;;;;;;;;
4025;Fosilka;Croatia;3.8.2016.;2016-08-03;4f;4;Linyphiidae;Troglohyphantes;sp. 4;Troglohyphantes sp. 4;;44.623188;15.130654;tb;deep cave;44.62318815.130654;1;;;;;;;;;;;;;;;;;;;;;;
4026;Markov ponor;Croatia;3.8.2016.;2016-08-03;1juv;1;Linyphiidae;Troglohyphantes;sp. 3;Troglohyphantes sp. 3;;44.765318;15.176875;tb;deep cave;44.76531815.176875;1;;;;;;;;;;;;;;;;;;;;;;
4029;Ponor Štirova?a;Croatia;5.8.2016.;2016-08-05;2f, 3juv;5;Linyphiidae;Troglohyphantes;sp. 3;Troglohyphantes sp. 3;1060;44.693088;15.051176;tb;deep cave;44.69308815.051176;2;;;;;;;;;;;;;;;;;;;;;;
4030;Ra?a špilja;Croatia;16.8.2016.;2016-08-16;1m;1;Tetragnathidae;Meta;bourneti;Meta bourneti;;42.734493;16.910785;Tf;deep cave;42.73449316.910785;4;;16,5;14,42;;;;;;;;;;;;;;;;;;;
4031;Špilja na Pozalicu;Croatia;16.8.2016.;2016-08-16;1f;1;Nesticidae;Kryptonesticus;eremita;Kryptonesticus eremita;;42.76131;16.9129;tf;deep cave;42.7613116.9129;4;;12,65;14;;;;;;;;;;;;;;;;;;;
4032;Špilja pod Kapelu;Croatia;18.8.2016.;2016-08-18;1juv;1;Agelenidae;Tegenaria;sp.;Tegenaria sp.;;43.184949;16.434233;;;43.18494916.434233;5;;;;;;;;;;;;;;;;;;;;;;
4033;Špilja pod Kapelu;Croatia;18.8.2016.;2016-08-18;2f;2;Linyphiidae;Palliduphantes;sp. X;Palliduphantes sp. X;;43.184949;16.434233;;;43.18494916.434233;5;;;;;;;;;;;;;;;;;;;;;;
4034;Spilja pod Kuk;Croatia;19.8.2016.;2016-08-19;1m;1;Sicariidae;Loxosceles;rufescens;Loxosceles rufescens;;43.156687;16.814810;Tf;deep cave;43.15668716.814810;2;;;;;;;;;;;;;;;;;;;;;;
4035;Spilja pod Kuk;Croatia;19.8.2016.;2016-08-19;1m, 1f, 1juv;3;Sicariidae;Loxosceles;rufescens;Loxosceles rufescens;;43.156687;16.814810;Tf;deep cave;43.15668716.814810;2;;;;;;;;;;;;;;;;;;;;;;
4037;Grap?eva špilja;Croatia;20.8.2016.;2016-08-20;1juv/f;1;Dysderidae;Dysdera;sp.;Dysdera sp.;200;43.134189;16.753732;Tx;;43.13418916.753732;5;;;13,93333333;;;;;;;;;;;;;;;;;;;
4038;Tu?epska vilenja?a;Croatia;21.8.2016.;2016-08-21;1f;1;Linyphiidae;Typhlonyphia;sp. 1;Typhlonyphia sp. 1;1181;43.286465;17.083638;Tb;deep cave;43.28646517.083638;8;;;;;;;;;;;;;;;;;;;;;;
4039;Bali?a špilja;Croatia;22.8.2016.;2016-08-22;1m;1;Linyphiidae;Troglohyphantes;giromettai;Troglohyphantes giromettai;405;43.57296;16.57002;tf;deep cave;43.5729616.57002;11;7,2;;;;;;;;;;;;;;;;;;;;;
4040;Ponor Dražice;Croatia;24.8.2016.;2016-08-24;4f, 1juvf;5;Linyphiidae;Troglohyphantes;sp. 3;Troglohyphantes sp. 3;;44.768838;15.171299;tb;deep cave;44.76883815.171299;1;;;;;;;;;;;;;;;;;;;;;;
4041;Crkviš?e;Croatia;9.9.2016.;2016-09-09;1m;1;Linyphiidae;Troglohyphantes;kordunlikanus;Troglohyphantes kordunlikanus;;45.398087;15.437771;tf;shallow subterranean habitat;45.39808715.437771;1;;;;;;;;;;;;;;;;;;;;;;
4042;Grap?eva špilja;Croatia;20.8.2016.;2016-08-20;1juvm;1;Agelenidae;Hadites;tegenarioides;Hadites tegenarioides;200;43.134189;16.753732;TB;deep cave;43.13418916.753732;5;;;13,93333333;;;;;;;;;;;;;;;;;;;
4043;Mandelaja;Croatia;17.4.2016.;2016-04-17;1f;1;Linyphiidae;Troglohyphantes;excavatus;Troglohyphantes excavatus;;45.233397;15.30015;tf;deep cave;45.23339715.30015;7;;;;;;;;;;;;;;;;;;;;;;
4044;Ponor Dražice;Croatia;24.8.2016.;2016-08-24;1m, 1f;2;Linyphiidae;Troglohyphantes;sp. 3;Troglohyphantes sp. 3;;44.768838;15.171299;tb;deep cave;44.76883815.171299;1;;;;;;;;;;;;;;;;;;;;;;
4046;Ponor Dražice;Croatia;25.8.2016.;2016-08-25;1f, 4 juv;5;Linyphiidae;Troglohyphantes;sp. 3;Troglohyphantes sp. 3;;44.768838;15.171299;tb;deep cave;44.76883815.171299;1;;;;;;;;;;;;;;;;;;;;;;
4048;Ponor Dražice;Croatia;26.8.2016.;2016-08-26;1m;1;Linyphiidae;Troglohyphantes;sp. 3;Troglohyphantes sp. 3;;44.768838;15.171299;tb;deep cave;44.76883815.171299;1;;;;;;;;;;;;;;;;;;;;;;
4049;Kuštrovka;Croatia;24.9.2016.;2016-09-24;1f, 2 juv;3;Dysderidae;Stalita;pretneri;Stalita pretneri;450;45.346234;15.219338;Tb;deep cave;45.34623415.219338;3;;;;;;;;;;;;;;;;;;;;;;
4050;Šipun;Croatia;4.5.2012.;2012-05-04;1f/juv;1;Dysderidae;Stalagtia;sp. 1;Stalagtia sp. 1;;42.583646;18.217986;Tb;deep cave;42.58364618.217986;11;16;;;;;;;;;;;;;;;;;;;;;
4051;Šipun;Croatia;4.5.2012.;2012-05-04;1f;1;Tetragnathidae;Meta;bourneti;Meta bourneti;;42.583646;18.217986;Tf;deep cave;42.58364618.217986;11;16;;;;;;;;;;;;;;;;;;;;;
4052;Špilja u izvoru Krke;Croatia;10.9.2015.;2015-09-10;1f;1;Nesticidae;Kryptonesticus;eremita;Kryptonesticus eremita;;44.0422953;16.2352157514;tf;deep cave;44.042295316.2352157514;2;;;;;;;;;;;;;;;;;;;;;;
4053;Sedrena špilja iza mlina;Croatia;7.3.2015.;2015-03-07;3juv;3;Tetragnathidae;Meta;sp.;Meta sp.;198;44.013402;16.067798;;;44.01340216.067798;6;;;;;;;;;;;;;;;;;;;;;;
4055;Mandelaja;Croatia;28.1.1995.;1995-01-28;1f,1 juv;2;Tetragnathidae;Meta;menardi;Meta menardi;;45.233397;15.30015;Tf;deep cave;45.23339715.30015;7;;;;;;;;;;;;;;;;;;;;;;
4056;Gornja Bara?eva;Croatia;29.7.2002.;2002-07-29;1f, 1juvm, 1 juv;3;Tetragnathidae;Meta;menardi;Meta menardi;;44.983895;15.721656;Tf;deep cave;44.98389515.721656;8;;;;;;;;;;;;;;;;;;;;;;
4057;Mrgi?a ponor;Croatia;9.1.1999.;1999-01-09;2m, 1f;3;Tetragnathidae;Meta;menardi;Meta menardi;;45.268189;15.469236;Tf;deep cave;45.26818915.469236;10;;;;;;;;;;;;;;;;;;;;;;
4058;Mrgi?a ponor;Croatia;9.1.1999.;1999-01-09;1m;1;Tetragnathidae;Metellina;merianae;Metellina merianae;;45.268189;15.469236;Tf;deep cave;45.26818915.469236;10;;;;;;;;;;;;;;;;;;;;;;
4059;Mrgi?a ponor;Croatia;9.1.1999.;1999-01-09;1m;1;Agelenidae;Tegenaria;silvestris;Tegenaria silvestris;;45.268189;15.469236;Tf;deep cave;45.26818915.469236;10;;;;;;;;;;;;;;;;;;;;;;
4060;Gornja Bara?eva;Croatia;17.5.2003.;2003-05-17;1f;1;Tetragnathidae;Meta;menardi;Meta menardi;;44.983895;15.721656;Tf;deep cave;44.98389515.721656;8;;;;;;;;;;;;;;;;;;;;;;
4061;Mrgi?a ponor;Croatia;13.9.1998.;1998-09-13;1f;1;Tetragnathidae;Meta;menardi;Meta menardi;;45.268189;15.469236;Tf;deep cave;45.26818915.469236;10;;;;;;;;;;;;;;;;;;;;;;
4063;Crna?ka špilja;Croatia;14.11.1995.;1995-11-14;1m;1;Tetragnathidae;Meta;menardi;Meta menardi;;45.058563;15.192941;Tf;deep cave;45.05856315.192941;2;;;;;;;;;;;;;;;;;;;;;;
4067;Gvozdenica;Croatia;9.12.1997.;1997-12-09;1m;1;Tetragnathidae;Meta;menardi;Meta menardi;;45.299765;15.589405;Tf;deep cave;45.29976515.589405;4;8,7;;;;;;;;;;;;;;;;;;;;;
4070;Špilja pod Ma?kovom dragom;Croatia;11.7.2010.;2010-07-11;1m;1;Dysderidae;Parastalita;stygia;Parastalita stygia;;45.261001;15.023822;Tb;deep cave;45.26100115.023822;1;7,4;;;;;;;;;;;;;;;;;;;;;
4073;Makeljina špilja;Croatia;19.2.2016.;2016-02-19;1f;1;Nesticidae;Kryptonesticus;eremita;Kryptonesticus eremita;;43.995296;16.07216;tf;deep cave;43.99529616.07216;5;;;;;;;;;;;;;;;;;;;;;;
4074;Špilja u izvoru Krke;Croatia;30.4.2015.;2015-04-30;1f;1;Nesticidae;Kryptonesticus;eremita;Kryptonesticus eremita;;44.0422953;16.2352157514;tf;deep cave;44.042295316.2352157514;2;;;;;;;;;;;;;;;;;;;;;;
4075;Stara jametina;Croatia;2.5.2015.;2015-05-02;1f;1;Linyphiidae;Micrargus;herbigradus;Micrargus herbigradus;;43.794009;16.00259;Tf;deep cave;43.79400916.00259;6;;;;;;;;;;;;;;;;;;;;;;
4076;Stara jametina;Croatia;2.5.2015.;2015-05-02;2f;2;Theridiidae;Episinus;cavernicola;Episinus cavernicola;;43.794009;16.00259;Tf;deep cave;43.79400916.00259;6;;;;;;;;;;;;;;;;;;;;;;
4077;Stara jametina;Croatia;2.5.2015.;2015-05-02;1f, 1 juvm;2;Linyphiidae;Micrargus;herbigradus;Micrargus herbigradus;;43.794009;16.00259;Tf;deep cave;43.79400916.00259;6;;;;;;;;;;;;;;;;;;;;;;
4078;Stara jametina;Croatia;2.5.2015.;2015-05-02;1 juv;1;Dysderidae;Stalagtia;sp. 4;Stalagtia sp. 4;;43.794009;16.00259;Tb;deep cave;43.79400916.00259;6;;;;;;;;;;;;;;;;;;;;;;
4080;Stara jametina;Croatia;2.5.2015.;2015-05-02;1f, 2 juv;3;Linyphiidae;Micrargus;herbigradus;Micrargus herbigradus;;43.794009;16.00259;Tf;deep cave;43.79400916.00259;6;;;;;;;;;;;;;;;;;;;;;;
4082;Sedrena špilja iza mlina;Croatia;9.10.2016.;2016-10-09;1m, 1f;2;Tetragnathidae;Metellina;merianae;Metellina merianae;198;44.013402;16.067798;Tf;deep cave;44.01340216.067798;6;;;;;;;;;;;;;;;;;;;;;;
4083;Sedrena špilja iza mlina;Croatia;9.10.2016.;2016-10-09;1juv, 1f;2;Tetragnathidae;Meta;bourneti;Meta bourneti;198;44.013402;16.067798;Tf;deep cave;44.01340216.067798;6;;;;;;;;;;;;;;;;;;;;;;
4084;Stara jametina;Croatia;10.10.2016.;2016-10-10;5juv;5;Dysderidae;Stalagtia;sp. 4;Stalagtia sp. 4;;43.794009;16.00259;Tb;deep cave;43.79400916.00259;6;;;;;;;;;;;;;;;;;;;;;;
4085;Jazinka;Croatia;10.10.2016.;2016-10-10;1 juv;1;Dysderidae;Stalagtia;sp. 4;Stalagtia sp. 4;235;43.975892;16.029694;Tb;deep cave;43.97589216.029694;2;;;;;;;;;;;;;;;;;;;;;;
4086;Sedrena špilja iza mlina;Croatia;9.10.2016.;2016-10-09;1 juvm;1;Tetragnathidae;Meta;sp.;Meta sp.;198;44.013402;16.067798;;;44.01340216.067798;6;;;;;;;;;;;;;;;;;;;;;;
4087;Stara jametina;Croatia;10.10.2016.;2016-10-10;1f, 4 juv;5;Dysderidae;Stalagtia;sp. 4;Stalagtia sp. 4;;43.794009;16.00259;Tb;deep cave;43.79400916.00259;6;;;;;;;;;;;;;;;;;;;;;;
4088;Stara jametina;Croatia;10.10.2016.;2016-10-10;1m;1;Theridiidae;Episinus;cavernicola;Episinus cavernicola;;43.794009;16.00259;Tf;deep cave;43.79400916.00259;6;;;;;;;;;;;;;;;;;;;;;;
4089;Stara jametina;Croatia;10.10.2016.;2016-10-10;3juv;3;Dysderidae;Stalagtia;sp. 4;Stalagtia sp. 4;;43.794009;16.00259;Tb;deep cave;43.79400916.00259;6;;;;;;;;;;;;;;;;;;;;;;
4090;Ozi?ana pe?ina;Croatia;9.10.2016.;2016-10-09;3 juv m;3;Pholcidae;Holocnemus;sp.;Holocnemus sp.;;43.90774;15.980634;;;43.9077415.980634;4;;;;;;;;;;;;;;;;;;;;;;
4091;Potkapina ispod Jame nasuprot Torka;Croatia;8.10.2016.;2016-10-08;1f, 1 juvm;2;Theridiidae;Episinus;cavernicola;Episinus cavernicola;;43.82018;16.012303;Tf;shallow subterranean habitat;43.8201816.012303;8;;;;;;;;;;;;;;;;;;;;;;
4092;Potkapina ispod Jame nasuprot Torka, pod kamenjem;Croatia;8.10.2016.;2016-10-08;1f;1;Amaurobidae;Amaurobius;erberi;Amaurobius erberi;;43.82018;16.012303;Tx;epigean habitat;43.8201816.012303;8;;;;;;;;;;;;;;;;;;;;;;
4095;Potkapina ispod Jame nasuprot Torka;Croatia;8.10.2016.;2016-10-08;1m;1;Dysderidae;Harpactea;rucnerorum;Harpactea rucnerorum;;43.82018;16.012303;Tf;shallow subterranean habitat;43.8201816.012303;8;;;;;;;;;;;;;;;;;;;;;;
4096;Sedrena špilja s jamskim ulazom;Croatia;9.10.2016.;2016-10-09;1m;1;Agelenidae;Tegenaria;bosnica;Tegenaria bosnica;;44.013829;16.069202;;deep cave;44.01382916.069202;2;;;;;;;;;;;;;;;;;;;;;;
4097;Špilja u izvoru Krke;Croatia;10.10.2016.;2016-10-10;1f, 1 juvm, 1 juv;3;Nesticidae;Kryptonesticus;eremita;Kryptonesticus eremita;;44.0422953;16.2352157514;tf;deep cave;44.042295316.2352157514;2;;;;;;;;;;;;;;;;;;;;;;
4098;Špilja u izvoru Krke;Croatia;10.10.2016.;2016-10-10;1juvm;1;Pholcidae;Pholcus;sp.;Pholcus sp.;;44.0422953;16.2352157514;;;44.042295316.2352157514;2;;;;;;;;;;;;;;;;;;;;;;
4100;Potkapina ispod Jame nasuprot Torka;Croatia;8.10.2016.;2016-10-08;1m, 1f, 3 juv;5;Dysderidae;Harpactea;rucnerorum;Harpactea rucnerorum;;43.82018;16.012303;Tf;shallow subterranean habitat;43.8201816.012303;8;;;;;;;;;;;;;;;;;;;;;;
4101;Potkapina ispod Jame nasuprot Torka, pod kamenjem;Croatia;8.10.2016.;2016-10-08;1m;1;Amaurobidae;Amaurobius;erberi;Amaurobius erberi;;43.82018;16.012303;Tx;epigean habitat;43.8201816.012303;8;;;;;;;;;;;;;;;;;;;;;;
4102;Potkapina ispod Jame nasuprot Torka, pod kamenjem;Croatia;8.10.2016.;2016-10-08;2f;2;Linyphiidae;Gen.;sp. X;Gen. sp. X;;43.82018;16.012303;;;43.8201816.012303;8;;;;;;;;;;;;;;;;;;;;;;
4103;Potkapina ispod Jame nasuprot Torka, pod kamenjem;Croatia;8.10.2016.;2016-10-08;1m;1;Theridiidae;Steatoda;triangulosa;Steatoda triangulosa;;43.82018;16.012303;Tf;cave entrance;43.8201816.012303;8;;;;;;;;;;;;;;;;;;;;;;
4104;Potkapina ispod Jame nasuprot Torka, pod kamenjem;Croatia;8.10.2016.;2016-10-08;1m, 3f;4;Amaurobidae;Amaurobius;erberi;Amaurobius erberi;;43.82018;16.012303;Tx;epigean habitat;43.8201816.012303;8;;;;;;;;;;;;;;;;;;;;;;
4105;Potkapina ispod Jame nasuprot Torka, under stones;Croatia;8.10.2016.;2016-10-08;1f;1;Agelenidae;Inermocoelotes;gasperinii;Inermocoelotes gasperinii;;43.82018;16.012303;;;43.8201816.012303;8;;;;;;;;;;;;;;;;;;;;;;
4107;Potkapina ispod Jame nasuprot Torka, pod kamenjem;Croatia;8.10.2016.;2016-10-08;1f;1;Clubionidae;Gen.;sp.;Gen. sp.;;43.82018;16.012303;;;43.8201816.012303;8;;;;;;;;;;;;;;;;;;;;;;
4108;Miljacka 2;Croatia;1.6.2016.;2016-06-01;1m;1;Agelenidae;Tegenaria;domestica;Tegenaria domestica;;44.0002;16.016234;Tf;deep cave;44.000216.016234;4;;;;;;;;;;;;;;;;;;;;;;
4109;Špilja na Gradini kod Premanture;Croatia;16.7.2016.;2016-07-16;5 juv;5;Nesticidae;Kryptonesticus;eremita;Kryptonesticus eremita;;44.786909;13.907968;tf;deep cave;44.78690913.907968;3;;;;;;;;;;;;;;;;;;;;;;
4111;Špilja na Gradini kod Premanture;Croatia;30.4.2016.;2016-04-30;3f, 1juv m, 7 juv;11;Nesticidae;Kryptonesticus;eremita;Kryptonesticus eremita;;44.786909;13.907968;tf;deep cave;44.78690913.907968;3;;;;;;;;;;;;;;;;;;;;;;
4112;Špilja na Gradini kod Premanture;Croatia;30.4.2016.;2016-04-30;1m, 1juvm, 2 juv;4;Nesticidae;Kryptonesticus;eremita;Kryptonesticus eremita;;44.786909;13.907968;tf;deep cave;44.78690913.907968;3;;;;;;;;;;;;;;;;;;;;;;
4113;Špilja na Gradini kod Premanture;Croatia;16.7.2016.;2016-07-16;2juv;2;Nesticidae;Kryptonesticus;eremita;Kryptonesticus eremita;;44.786909;13.907968;tf;deep cave;44.78690913.907968;3;;;;;;;;;;;;;;;;;;;;;;
4114;Špilja na Gradini kod Premanture;Croatia;30.4.2016.;2016-04-30;1f, 1juvm, 1juv;3;Nesticidae;Kryptonesticus;eremita;Kryptonesticus eremita;;44.786909;13.907968;tf;deep cave;44.78690913.907968;3;;;;;;;;;;;;;;;;;;;;;;
4115;Špilja na Gradini kod Premanture;Croatia;16.7.2016.;2016-07-16;1m, 1f, 3juv;5;Nesticidae;Kryptonesticus;eremita;Kryptonesticus eremita;;44.786909;13.907968;tf;deep cave;44.78690913.907968;3;;;;;;;;;;;;;;;;;;;;;;
4116;Špilja na Gradini kod Premanture;Croatia;30.4.2016.;2016-04-30;2juv;2;Nesticidae;Kryptonesticus;eremita;Kryptonesticus eremita;;44.786909;13.907968;tf;deep cave;44.78690913.907968;3;;;;;;;;;;;;;;;;;;;;;;
4117;Špilja na Gradini kod Premanture;Croatia;16.7.2016.;2016-07-16;1m;1;Nesticidae;Kryptonesticus;eremita;Kryptonesticus eremita;;44.786909;13.907968;tf;deep cave;44.78690913.907968;3;;;;;;;;;;;;;;;;;;;;;;
4118;Špilja na Gradini kod Premanture;Croatia;16.7.2016.;2016-07-16;1f, 1juvm, 4juv;6;Nesticidae;Kryptonesticus;eremita;Kryptonesticus eremita;;44.786909;13.907968;tf;deep cave;44.78690913.907968;3;;;;;;;;;;;;;;;;;;;;;;
4119;Špilja na Gradini kod Premanture;Croatia;16.7.2016.;2016-07-16;1juv;1;Nesticidae;Kryptonesticus;eremita;Kryptonesticus eremita;;44.786909;13.907968;tf;deep cave;44.78690913.907968;3;;;;;;;;;;;;;;;;;;;;;;
4120;Špilja na Gradini kod Premanture;Croatia;16.7.2016.;2016-07-16;1f, 2juv;3;Nesticidae;Kryptonesticus;eremita;Kryptonesticus eremita;;44.786909;13.907968;tf;deep cave;44.78690913.907968;3;;;;;;;;;;;;;;;;;;;;;;
4121;Špilja na Gradini kod Premanture;Croatia;16.7.2016.;2016-07-16;2juv;2;Nesticidae;Kryptonesticus;eremita;Kryptonesticus eremita;;44.786909;13.907968;tf;deep cave;44.78690913.907968;3;;;;;;;;;;;;;;;;;;;;;;
4122;Šipun;Croatia;4.6.2014.;2014-06-04;1m;1;Dysderidae;Stalagtia;sp. 1;Stalagtia sp. 1;;42.583646;18.217986;Tb;deep cave;42.58364618.217986;11;16;;;;;;;;;;;;;;;;;;;;;
4123;Tihinja;Croatia;8.6.2014.;2014-06-08;1m, 1 juv;2;Tetragnathidae;Metellina;merianae;Metellina merianae;50;42.866729;17.67021;Tf;deep cave;42.86672917.67021;5;;;;;;;;;;;;;;;;;;;;;;
4124;Špilja u Žarmi;Croatia;2.6.2014.;2014-06-02;1f, 1juv/f, 3 juv;5;Dysderidae;Stalagtia;hercegovinensis;Stalagtia hercegovinensis;37;42.935427;17.43822;Tb;deep cave;42.93542717.43822;7;;;;;;;;;;;;;;;;;;;;;;
4126;Bezdan;Croatia;3.6.2014.;2014-06-03;1juv;1;Dysderidae;Stalagtia;sp. 1;Stalagtia sp. 1;;42.530343;18.316239;Tb;deep cave;42.53034318.316239;2;;;;;;;;;;;;;;;;;;;;;;
4130;Vilinska jama;Croatia;5.6.2014.;2014-06-05;1m;1;Nesticidae;Kryptonesticus;eremita;Kryptonesticus eremita;121;42.728553;17.881121;tf;deep cave;42.72855317.881121;10;13,6;;;;;;;;;;;;;;;;;;;;;
4132;Vilinska jama;Croatia;5.6.2014.;2014-06-05;1f;1;Leptonetidae;Sulcia;sp. 15;Sulcia sp. 15;121;42.728553;17.881121;;;42.72855317.881121;10;13,6;;;;;;;;;;;;;;;;;;;;;
4133;Vilinska jama;Croatia;5.6.2014.;2014-06-05;1f, 1m, 3f?, 3juv;8;Leptonetidae;Barusia;maheni;Barusia maheni;121;42.728553;17.881121;tf;deep cave;42.72855317.881121;10;13,6;;;;;;;;;;;;;;;;;;;;;
4134;Mala špilja izme?u Dubrovnika i Komolca;Croatia;4.6.2014.;2014-06-04;1f;1;Nesticidae;Kryptonesticus;eremita;Kryptonesticus eremita;;42.644127;18.137798;tf;deep cave;42.64412718.137798;3;;;;;;;;;;;;;;;;;;;;;;
4135;Mala špilja izme?u Dubrovnika i Komolca;Croatia;4.6.2014.;2014-06-04;1f, 2juv;3;Agelenidae;Histopona;dubia;Histopona dubia;;42.644127;18.137798;tb;deep cave;42.64412718.137798;3;;;;;;;;;;;;;;;;;;;;;;
4136;Vilinska jama;Croatia;5.6.2014.;2014-06-05;2juv;2;Dysderidae;Stalagtia;sp. 2;Stalagtia sp. 2;121;42.728553;17.881121;Tb;deep cave;42.72855317.881121;10;13,6;;;;;;;;;;;;;;;;;;;;;
4137;Jezero;Croatia;7.6.2014.;2014-06-07;1f;1;Nesticidae;Kryptonesticus;arenstorffi;Kryptonesticus arenstorffi;903;42.580381;18.356073;tb;deep cave;42.58038118.356073;8;;;7,566666667;;;;;;;;;;;;;;;;;;;
4139;Šipun;Croatia;4.6.2014.;2014-06-04;2f;2;Agelenidae;Histopona;dubia;Histopona dubia;;42.583646;18.217986;tb;deep cave;42.58364618.217986;11;16;;;;;;;;;;;;;;;;;;;;;
4141;Jezero;Croatia;7.6.2014.;2014-06-07;1juv;1;Linyphiidae;Troglohyphantes;troglodytes;Troglohyphantes troglodytes;903;42.580381;18.356073;tf;deep cave;42.58038118.356073;8;;;7,566666667;;;;;;;;;;;;;;;;;;;
4142;?urovi?a jama;Croatia;3.6.2014.;2014-06-03;1f;1;Nesticidae;Kryptonesticus;eremita;Kryptonesticus eremita;;42.559979;18.263559;tf;deep cave;42.55997918.263559;4;;;;;;;;;;;;;;;;;;;;;;
4143;Vilinska jama;Croatia;5.6.2014.;2014-06-05;1f;1;Nesticidae;Kryptonesticus;eremita;Kryptonesticus eremita;121;42.728553;17.881121;tf;deep cave;42.72855317.881121;10;13,6;;;;;;;;;;;;;;;;;;;;;
4144;Vilinska jama;Croatia;5.6.2014.;2014-06-05;1juv m;1;Leptonetidae;Barusia;maheni;Barusia maheni;121;42.728553;17.881121;tf;deep cave;42.72855317.881121;10;13,6;;;;;;;;;;;;;;;;;;;;;
4148;Bezdan;Croatia;3.6.2014.;2014-06-03;1f;1;Dysderidae;Stalagtia;sp. 1;Stalagtia sp. 1;;42.530343;18.316239;Tb;deep cave;42.53034318.316239;2;;;;;;;;;;;;;;;;;;;;;;
4149;Mala špilja izme?u Dubrovnika i Komolca;Croatia;4.6.2014.;2014-06-04;1m, 2f/juv, 1juv;4;Leptonetidae;Sulcia;sp. 10;Sulcia sp. 10;;42.644127;18.137798;;;42.64412718.137798;3;;;;;;;;;;;;;;;;;;;;;;
4196;Topla pe?ina;Croatia;9.10.2016.;2016-10-09;2m, 1f, 1juvm;4;Leptonetidae;Barusia;maheni;Barusia maheni;;43.839254;16.0536;tf;deep cave;43.83925416.0536;4;;;;;;;;;;;;;;;;;;;;;;
4197;Kukova pe?;Croatia;30.11.2014.;2014-11-30;1m;1;Dysderidae;Stalagtia;hercegovinensis;Stalagtia hercegovinensis;;42.726992;17.96566;Tb;deep cave;42.72699217.96566;5;;17;16,62;;;;;;;;;;;;;;;;;;;
4198;Mjese?evi?a špilja;Croatia;3.12.2014.;2014-12-03;1f;1;Linyphiidae;Asthenargus;bracianus;Asthenargus bracianus;;42.480511;18.411965;tf;deep cave;42.48051118.411965;3;;;;;;;;;;;;;;;;;;;;;;
4199;Mjese?evi?a špilja;Croatia;3.12.2014.;2014-12-03;1juv, 1f/juv;2;Leptonetidae;Sulcia;sp. 2;Sulcia sp. 2;;42.480511;18.411965;Tb;deep cave;42.48051118.411965;3;;;;;;;;;;;;;;;;;;;;;;
4200;Mjese?evi?a špilja;Croatia;3.12.2014.;2014-12-03;1juv;1;Dysderidae;Stalagtia;sp. 1;Stalagtia sp. 1;;42.480511;18.411965;Tb;deep cave;42.48051118.411965;3;;;;;;;;;;;;;;;;;;;;;;
4215;Kukova pe?;Croatia;30.11.2014.;2014-11-30;2m, 1f, 1juv;4;Agelenidae;Histopona;dubia;Histopona dubia;;42.726992;17.96566;tb;deep cave;42.72699217.96566;5;;17;16,62;;;;;;;;;;;;;;;;;;;
4216;Kukova pe?;Croatia;30.11.2014.;2014-11-30;1m;1;Agelenidae;Histopona;dubia;Histopona dubia;;42.726992;17.96566;tb;deep cave;42.72699217.96566;5;;17;16,62;;;;;;;;;;;;;;;;;;;
4224;Mo?iljska špilja;Croatia;2.12.2014.;2014-12-02;1juv;1;Dysderidae;Stalagtia;sp. 5;Stalagtia sp. 5;;42.689061;18.071906;Tb;deep cave;42.68906118.071906;6;;15,4;15,825;;;;;;;;;;;;;;;;;;;
4226;Mo?iljska špilja;Croatia;1.12.2014.;2014-12-01;1f/juv, 1 juv;2;Leptonetidae;Sulcia;sp.;Sulcia sp.;;42.689061;18.071906;;;42.68906118.071906;6;;15,4;15,825;;;;;;;;;;;;;;;;;;;
4232;Višti?ina jama;Croatia;1.11.2013.;2013-11-01;1f;1;Dysderidae;Stalagtia;sp. 4_1;Stalagtia sp. 4_1;200;42.985281;17.557541;Tb;deep cave;42.98528117.557541;3;;;;;;;;;;;;;;;;;;;;;;
4233;Jama na ple?aša gradini;Croatia;8.2.2015.;2015-02-08;1f;1;Dysderidae;Stalagtia;sp. 4;Stalagtia sp. 4;;43.113314;17.572389;Tb;deep cave;43.11331417.572389;1;;;;;;;;;;;;;;;;;;;;;;
4234;Ze?ev ponor;Croatia;17.8.2014.;2014-08-17;1m, 1juv;2;Dysderidae;Parastalita;stygia;Parastalita stygia;;45.144293;15.112223;Tb;deep cave;45.14429315.112223;2;;;;;;;;;;;;;;;;;;;;;;
4236;Kornjatuša;Croatia;2.11.2013.;2013-11-02;1m, 1f;2;Dysderidae;Stalagtia;sp. 4_1;Stalagtia sp. 4_1;610;42.97909;17.673966;Tb;deep cave;42.9790917.673966;5;;;;;;;;;;;;;;;;;;;;;;
4238;Višti?ina jama;Croatia;1.11.2013.;2013-11-01;2juv;2;Dysderidae;Stalagtia;sp. 4_1;Stalagtia sp. 4_1;200;42.985281;17.557541;Tb;deep cave;42.98528117.557541;3;;;;;;;;;;;;;;;;;;;;;;
4239;Tihinja;Croatia;7.12.2013.;2013-12-07;1f;1;Dysderidae;Harpactea;sp. 3;Harpactea sp. 3;50;42.866729;17.67021;tb;deep cave;42.86672917.67021;5;;;;;;;;;;;;;;;;;;;;;;
4240;Jama Pavli?evica;Croatia;16.11.2014.;2014-11-16;1f;1;Dysderidae;Stalagtia;sp. 4;Stalagtia sp. 4;;43.106024;17.587711;Tb;deep cave;43.10602417.587711;1;;;;;;;;;;;;;;;;;;;;;;
4241;Pe?inik;Croatia;18.6.2014.;2014-06-18;1f;1;Dysderidae;Parastalita;stygia;Parastalita stygia;;45.25813;15.198439;Tb;deep cave;45.2581315.198439;1;;;;;;;;;;;;;;;;;;;;;;
4242;Ze?ev ponor;Croatia;17.8.2014.;2014-08-17;1m;1;Dysderidae;Parastalita;stygia;Parastalita stygia;;45.144293;15.112223;Tb;deep cave;45.14429315.112223;2;;;;;;;;;;;;;;;;;;;;;;
4243;Kornjatuša;Croatia;5.11.2013.;2013-11-05;1juv;1;Dysderidae;Stalagtia;sp. 4_1;Stalagtia sp. 4_1;610;42.97909;17.673966;Tb;deep cave;42.9790917.673966;5;;;;;;;;;;;;;;;;;;;;;;
4244;Kornjatuša;Croatia;5.11.2013.;2013-11-05;1juvm;1;Dysderidae;Stalagtia;sp. 4_1;Stalagtia sp. 4_1;610;42.97909;17.673966;Tb;deep cave;42.9790917.673966;5;;;;;;;;;;;;;;;;;;;;;;
4245;Kornjatuša;Croatia;5.11.2013.;2013-11-05;1m;1;Agelenidae;Histopona;luxurians;Histopona luxurians;610;42.97909;17.673966;tf;deep cave;42.9790917.673966;5;;;;;;;;;;;;;;;;;;;;;;
4246;Višti?ina jama;Croatia;1.11.2013.;2013-11-01;1f;1;Dysderidae;Stalagtia;sp. 4_1;Stalagtia sp. 4_1;200;42.985281;17.557541;Tb;deep cave;42.98528117.557541;3;;;;;;;;;;;;;;;;;;;;;;
4247;Jama na Benkotovu;Croatia;3.8.2014.;2014-08-03;1m;1;Linyphiidae;Palliduphantes;spelaeorum;Palliduphantes spelaeorum;;43.37569;16.272059;Tf;deep cave;43.3756916.272059;3;;;;;;;;;;;;;;;;;;;;;;
4248;Stara jametina;Croatia;19.2.2016.;2016-02-19;1m;1;Dysderidae;Stalagtia;sp. 4;Stalagtia sp. 4;;43.794009;16.00259;Tb;deep cave;43.79400916.00259;6;;;;;;;;;;;;;;;;;;;;;;
4249;Špilja iznad Kopren dola;Croatia;3.11.2013.;2013-11-03;1f, 4juv;5;Dysderidae;Stalagtia;sp. 4_1;Stalagtia sp. 4_1;;42.983916;17.62401;Tb;deep cave;42.98391617.62401;1;;;;;;;;;;;;;;;;;;;;;;
4250;Vodeni tobogan;Croatia;27.2.2016.;2016-02-27;1juvm;1;Dysderidae;Harpactea;sp.;Harpactea sp.;;44.45424;15.32186;;;44.4542415.32186;3;;;;;;;;;;;;;;;;;;;;;;
4251;Jama pod Veli vrh;Croatia;7.2.2016.;2016-02-07;1juv;1;Dysderidae;Folkia;inermis;Folkia inermis;;42.737471;17.516324;Tb;deep cave;42.73747117.516324;1;;;;;;;;;;;;;;;;;;;;;;
4254;Višti?ina jama;Croatia;1.11.2013.;2013-11-01;1juv;1;Dysderidae;Stalagtia;sp. 4_1;Stalagtia sp. 4_1;200;42.985281;17.557541;Tb;deep cave;42.98528117.557541;3;;;;;;;;;;;;;;;;;;;;;;
4255;Višti?ina jama;Croatia;1.11.2013.;2013-11-01;1f, 2m;3;Linyphiidae;Palliduphantes;spelaeorum;Palliduphantes spelaeorum;;42.985281;17.557541;Tf;deep cave;42.98528117.557541;3;;;;;;;;;;;;;;;;;;;;;;
4256;Tihinja;Croatia;3.11.2013.;2013-11-03;1f;1;Linyphiidae;Palliduphantes;sp. 6;Palliduphantes sp. 6;50;42.866729;17.67021;;;42.86672917.67021;5;;;;;;;;;;;;;;;;;;;;;;
4257;Tihinja;Croatia;3.11.2013.;2013-11-03;1juv;1;Dysderidae;Harpactea;sp. 3;Harpactea sp. 3;50;42.866729;17.67021;tb;deep cave;42.86672917.67021;5;;;;;;;;;;;;;;;;;;;;;;
4259;Špilja Sopa?a;Croatia;18.8.2014.;2014-08-18;1juvm;1;Nesticidae;Nesticus;cellulanus;Nesticus cellulanus;475;45.144737;15.114;tf;deep cave;45.14473715.114;2;;;;;;;;;;;;;;;;;;;;;;
4260;Kornjatuša;Croatia;2.11.2013.;2013-11-02;1juv;1;Dysderidae;Stalagtia;sp. 4_1;Stalagtia sp. 4_1;610;42.97909;17.673966;Tb;deep cave;42.9790917.673966;5;;;;;;;;;;;;;;;;;;;;;;
4261;Kornjatuša;Croatia;2.11.2013.;2013-11-02;1m, 1juv;2;Linyphiidae;Palliduphantes;spelaeorum;Palliduphantes spelaeorum;610;42.97909;17.673966;Tf;deep cave;42.9790917.673966;5;;;;;;;;;;;;;;;;;;;;;;
4262;Piškera;Croatia;1.8.2014.;2014-08-01;1m, 2juv;3;Nesticidae;Kryptonesticus;eremita;Kryptonesticus eremita;;43.37699;16.316203;tf;deep cave;43.3769916.316203;1;;;;;;;;;;;;;;;;;;;;;;
4263;Jama iznad Praži?a jaruge;Croatia;16.8.2014.;2014-08-16;1m;1;Nesticidae;Nesticus;cellulanus;Nesticus cellulanus;;45.160973;15.111286;tf;deep cave;45.16097315.111286;1;;;;;;;;;;;;;;;;;;;;;;
4264;?utno;Croatia;20.3.2016.;2016-03-20;1juvf;1;Linyphiidae;Troglohyphantes;croaticus;Troglohyphantes croaticus;210;45.415607;15.233039;tb;deep cave;45.41560715.233039;4;;;;;;;;;;;;;;;;;;;;;;
4265;Kornjatuša;Croatia;5.11.2013.;2013-11-05;1juvm;1;Dysderidae;Stalagtia;sp. 4_1;Stalagtia sp. 4_1;610;42.97909;17.673966;Tb;deep cave;42.9790917.673966;5;;;;;;;;;;;;;;;;;;;;;;
4266;Kornjatuša;Croatia;5.11.2013.;2013-11-05;1m;1;Linyphiidae;Palliduphantes;spelaeorum;Palliduphantes spelaeorum;610;42.97909;17.673966;Tf;deep cave;42.9790917.673966;5;;;;;;;;;;;;;;;;;;;;;;
4267;Gornja Cerova?ka špilja;Croatia;6.3.2016.;2016-03-06;ostaci;;Dysderidae;Parastalita;stygia;Parastalita stygia;700;44.273382;15.884227;Tb;deep cave;44.27338215.884227;2;;;;;;;;;;;;;;;;;;;;;;
4268;Praži?a jaruga ponor;Croatia;16.8.2014.;2014-08-16;1m, 1f, 1juvm, 3juv;6;Linyphiidae;Troglohyphantes;kordunlikanus;Troglohyphantes kordunlikanus;;45.161339;15.110947;tf;deep cave;45.16133915.110947;2;;;;;;;;;;;;;;;;;;;;;;
4269;Praži?a jaruga ponor;Croatia;16.8.2014.;2014-08-16;2f, 4juv;6;Linyphiidae;Troglohyphantes;kordunlikanus;Troglohyphantes kordunlikanus;;45.161339;15.110947;tf;deep cave;45.16133915.110947;2;;;;;;;;;;;;;;;;;;;;;;
4270;Praži?a jaruga ponor;Croatia;16.8.2014.;2014-08-16;1f;1;Linyphiidae;Porrhomma;sp. x;Porrhomma sp. x;;45.161339;15.110947;;;45.16133915.110947;2;;;;;;;;;;;;;;;;;;;;;;
4271;Jama u Radovnici;Croatia;20.3.2016.;2016-03-20;1f;1;Linyphiidae;Troglohyphantes;croaticus;Troglohyphantes croaticus;;45.416563;15.230843;tb;deep cave;45.41656315.230843;1;;;;;;;;;;;;;;;;;;;;;;
4272;Špilja na Livadicama;Croatia;20.3.2016.;2016-03-20;1m, 2f, 1juv;4;Linyphiidae;Troglohyphantes;croaticus;Troglohyphantes croaticus;222;45.409582;15.230035;tb;deep cave;45.40958215.230035;1;;;;;;;;;;;;;;;;;;;;;;
4273;?utno;Croatia;20.3.2016.;2016-03-20;1m, 1juv;2;Linyphiidae;Troglohyphantes;croaticus;Troglohyphantes croaticus;210;45.415607;15.233039;tb;deep cave;45.41560715.233039;4;;;;;;;;;;;;;;;;;;;;;;
4274;?utno;Croatia;20.3.2016.;2016-03-20;1f, 2m, 1juvm, 1juvf;5;Linyphiidae;Troglohyphantes;croaticus;Troglohyphantes croaticus;210;45.415607;15.233039;tb;deep cave;45.41560715.233039;4;;;;;;;;;;;;;;;;;;;;;;
4275;Vrlovka;Croatia;26.3.2016.;2016-03-26;1f, 1juvm, 1juv;3;Linyphiidae;Troglohyphantes;excavatus;Troglohyphantes excavatus;;45.63707;15.390544;tf;deep cave;45.6370715.390544;2;;;;;;;;;;;;;;;;;;;;;;
4276;Pe?ina u Dunjaku;Croatia;29.12.2015.;2015-12-29;6f;6;Linyphiidae;Porrhomma;egeria;Porrhomma egeria;205;45.23655;15.668962;;deep cave;45.2365515.668962;1;;;;;;;;;;;;;;;;;;;;;;
4278;Tu?epska vilenja?a;Croatia;9.8.1998.;1998-08-09;1f;1;Dysderidae;Mesostalita;comottii;Mesostalita comottii;1181;43.286465;17.083638;Tb;deep cave;43.28646517.083638;8;;;;;;;;;;;;;;;;;;;;;;
4279;Tu?epska vilenja?a;Croatia;9.8.1998.;1998-08-09;2f;2;Dysderidae;Mesostalita;comottii;Mesostalita comottii;1181;43.286465;17.083638;Tb;deep cave;43.28646517.083638;8;;;;;;;;;;;;;;;;;;;;;;
4280;Jama pod Gažnovcem;Croatia;4.11.2016.;2016-11-04;1f;1;Dysderidae;Harpactea;sp. 2;Harpactea sp. 2;510;43.229672;17.314159;Tb;deep cave;43.22967217.314159;8;;;;;;;;;;;;;;;;;;;;;;
4281;Jama pod Gažnovcem;Croatia;4.11.2016.;2016-11-04;4juv;4;Dysderidae;Stalagtia;sp. 4;Stalagtia sp. 4;510;43.229672;17.314159;Tb;deep cave;43.22967217.314159;8;;;;;;;;;;;;;;;;;;;;;;
4282;Jama pod Gažnovcem;Croatia;4.11.2016.;2016-11-04;2f, 1m, 7juv;1;Linyphiidae;Typhlonyphia;sp. 1;Typhlonyphia sp. 1;510;43.229672;17.314159;Tb;deep cave;43.22967217.314159;8;;;;;;;;;;;;;;;;;;;;;;
4283;Jama pod Gažnovcem;Croatia;4.11.2016.;2016-11-04;2f, 1m;3;Pholcidae;Stygopholcus;absoloni;Stygopholcus absoloni;510;43.229672;17.314159;;deep cave;43.22967217.314159;8;;;;;;;;;;;;;;;;;;;;;;
4284;Jama pod Gažnovcem;Croatia;4.11.2016.;2016-11-04;1m, 4f;5;Linyphiidae;Palliduphantes;spelaeorum;Palliduphantes spelaeorum;510;43.229672;17.314159;Tf;deep cave;43.22967217.314159;8;;;;;;;;;;;;;;;;;;;;;;
4285;Jama pod Gažnovcem;Croatia;4.11.2016.;2016-11-04;2m;2;Linyphiidae;Centromerus;cavernarum;Centromerus cavernarum;510;43.229672;17.314159;Tf;deep cave;43.22967217.314159;8;;;;;;;;;;;;;;;;;;;;;;
4286;Pe? u ?ulinovim raljevinama;Croatia;5.11.2016.;2016-11-05;5juv;5;Dysderidae;Stalagtia;sp. 4;Stalagtia sp. 4;;43.605854;16.575066;Tb;deep cave;43.60585416.575066;5;;;;;;;;;;;;;;;;;;;;;;
4287;Pe? u ?ulinovim raljevinama;Croatia;5.11.2016.;2016-11-05;1m;1;Nesticidae;Kryptonesticus;eremita;Kryptonesticus eremita;;43.605854;16.575066;tf;deep cave;43.60585416.575066;5;;;;;;;;;;;;;;;;;;;;;;
4288;Tu?epska vilenja?a;Croatia;28.4.2014.;2014-04-28;1f, 1juv;2;Dysderidae;Stalagtia;sp. 4;Stalagtia sp. 4;1181;43.286465;17.083638;Tb;deep cave;43.28646517.083638;8;;;;;;;;;;;;;;;;;;;;;;
4289;Tu?epska vilenja?a;Croatia;28.4.2014.;2014-04-28;1juv;1;Agelenidae;Histopona;sp.;Histopona sp.;1181;43.286465;17.083638;;;43.28646517.083638;8;;;;;;;;;;;;;;;;;;;;;;
4290;Jujnovi?a špilja;Croatia;29.4.2014.;2014-04-29;1juv;1;Agelenidae;Histopona;sp.;Histopona sp.;405;43.266579;17.19798;;;43.26657917.19798;6;;;;;;;;;;;;;;;;;;;;;;
4293;Jujnovi?a špilja;Croatia;14.5.2016.;2016-05-14;1f, 1juv;2;Dysderidae;Harpactea;damini;Harpactea damini;405;43.266579;17.19798;TF;deep cave;43.26657917.19798;6;;;;;;;;;;;;;;;;;;;;;;
4294;Pe? u ?ulinovim raljevinama;Croatia;20.5.2016.;2016-05-20;2juv;2;Dysderidae;Stalagtia;sp. 4;Stalagtia sp. 4;;43.605854;16.575066;Tb;deep cave;43.60585416.575066;5;;;;;;;;;;;;;;;;;;;;;;
4296;Pe? u ?ulinovim raljevinama;Croatia;20.5.2016.;2016-05-20;2f;2;Linyphiidae;Centromerus;cavernarum;Centromerus cavernarum;;43.605854;16.575066;Tf;deep cave;43.60585416.575066;5;;;;;;;;;;;;;;;;;;;;;;
4297;Jama za Supinom;Croatia;18.5.2016.;2016-05-18;1juv;1;Dysderidae;Stalagtia;sp. 4;Stalagtia sp. 4;;43.250417;17.113278;Tb;deep cave;43.25041717.113278;7;;;;;;;;;;;;;;;;;;;;;;
4299;Golubinka u kalaševin dugin njivaman;Croatia;21.5.2016.;2016-05-21;1f;1;Dysderidae;Harpactea;sp. 18;Harpactea sp. 18;;43.681411;16.309627;Tf;deep cave;43.68141116.309627;3;;;;;;;;;;;;;;;;;;;;;;
4300;Jama za Supinom;Croatia;18.5.2016.;2016-05-18;1f;1;Dysderidae;Stalagtia;sp. 4;Stalagtia sp. 4;;43.250417;17.113278;Tb;deep cave;43.25041717.113278;7;;;;;;;;;;;;;;;;;;;;;;
4301;Pretnerova jama;Croatia;19.5.2016.;2016-05-19;1f;1;Nesticidae;Kryptonesticus;deelemanae;Kryptonesticus deelemanae;;43.339276;17.038312;tb;deep cave;43.33927617.038312;2;;;;;;;;;;;;;;;;;;;;;;
4302;Gradska spila;Croatia;15.5.2016.;2016-05-15;1m;1;Dysderidae;Harpactea;damini;Harpactea damini;755;43.318029;17.117623;TF;deep cave;43.31802917.117623;4;;;;;;;;;;;;;;;;;;;;;;
4303;Gradska spila;Croatia;15.5.2016.;2016-05-15;8m, plur f i juv;8;Leptonetidae;Sulcia;sp.;Sulcia sp.;755;43.318029;17.117623;;;43.31802917.117623;4;;;;;;;;;;;;;;;;;;;;;;
4304;Tu?epska vilenja?a;Croatia;18.9.2016.;2016-09-18;1juvm;1;Dysderidae;Stalagtia;sp. 4;Stalagtia sp. 4;1181;43.286465;17.083638;Tb;deep cave;43.28646517.083638;8;;;;;;;;;;;;;;;;;;;;;;
4305;Tu?epska vilenja?a;Croatia;18.9.2016.;2016-09-18;1m, 1f, 1juv;3;Linyphiidae;Typhlonyphia;sp. 1;Typhlonyphia sp. 1;1181;43.286465;17.083638;Tb;deep cave;43.28646517.083638;8;;;;;;;;;;;;;;;;;;;;;;
4306;Pe? u ?ulinovim raljevinama;Croatia;20.5.2016.;2016-05-20;1juv;1;Dysderidae;Stalagtia;sp. 4;Stalagtia sp. 4;;43.605854;16.575066;Tb;deep cave;43.60585416.575066;5;;;;;;;;;;;;;;;;;;;;;;
4307;Gradska spila;Croatia;15.5.2016.;2016-05-15;1f;1;Dysderidae;Harpactea;damini;Harpactea damini;755;43.318029;17.117623;TF;deep cave;43.31802917.117623;4;;;;;;;;;;;;;;;;;;;;;;
4308;Gradska spila;Croatia;15.5.2016.;2016-05-15;1m, 1juv;2;Leptonetidae;Sulcia;sp.;Sulcia sp.;755;43.318029;17.117623;;;43.31802917.117623;4;;;;;;;;;;;;;;;;;;;;;;
4309;Pe? u ?ulinovim raljevinama;Croatia;20.5.2016.;2016-05-20;1juv;1;Dysderidae;Stalagtia;sp. 4;Stalagtia sp. 4;;43.605854;16.575066;Tb;deep cave;43.60585416.575066;5;;;;;;;;;;;;;;;;;;;;;;
4311;Spila 2;Croatia;14.5.2016.;2016-05-14;1f, 1juv;2;Dysderidae;Stalagtia;sp. 4;Stalagtia sp. 4;;43.26239;17.204021;Tb;deep cave;43.2623917.204021;6;;;;;;;;;;;;;;;;;;;;;;
4312;Spila 2;Croatia;14.5.2016.;2016-05-14;1f;1;Agelenidae;Histopona;conveniens;Histopona conveniens;;43.26239;17.204021;Tf;deep cave;43.2623917.204021;6;;;;;;;;;;;;;;;;;;;;;;
