sample ID;locality;country;Collection date;eventDate;Number and gender;individualCount;Family;Genus;species;scientific name;Z;decimalLatitude;decimalLongitude;Troglomorphy;habitat;joint coordinates;unique species count;air temperature;deepest air temperature;média temperature
1;Špilja na Pozalicu;Croatia;29.9.2007.;2007-09-29;1 m, 1 f;2;Nesticidae;Kryptonesticus;eremita;;60;4 276 131;169 129;tf;deep cave;;4;;12,65;14
2;Špilja na Pozalicu;Croatia;4.3.2008.;2008-03-04;1 m, 1 f;2;Nesticidae;Kryptonesticus;eremita;Kryptonesticus eremita;60;4 276 131;169 129;tf;deep cave;4 276 131 169 129;4;;12,65;14
3;oko kampa u Skrivenoj Luci;Croatia;4.3.2008.;2008-03-04;1 f;1;Dysderidae;Dysdera;sp.;Dysdera sp.;;42 741 872;1 688 264;Tx;;427 418 721 688 264;1;;;
4;Jama pod Velji vrh;Croatia;30.9.2007.;2007-09-30;3 juv;3;Dysderidae;Folkia;sp. 2;Folkia sp. 2;70;42 766 635;16 907 278;Tb;deep cave;4 276 663 516 907 270;2;;;16,567
5;Medvidina špilja;Croatia;3.3.2008.;2008-03-03;2f, 4 juv;6;Nesticidae;Kryptonesticus;eremita;Kryptonesticus eremita;;42 734 776;16 863 532;tf;deep cave;4 273 477 616 863 530;1;;;
7;Špilja na Pozalicu;Croatia;29.9.2007.;2007-09-29;1 juv;1;Cheiracanthiidae;Gen.;sp.;Gen. sp.;60;4 276 131;169 129;;;4 276 131 169 129;4;;12,65;14
8;Špilja na Pozalicu;Croatia;3.3.2008.;2008-03-03;6 juv;6;Nesticidae;Kryptonesticus;eremita;Kryptonesticus eremita;60;4 276 131;169 129;tf;deep cave;4 276 131 169 129;4;;12,65;14
9;Ra?a špilja;Croatia;28.9.2007.;2007-09-28;1 juv;1;Dysderidae;Folkia;sp. 2;Folkia sp. 2;141;42 734 493;16 910 785;Tb;deep cave;4 273 449 316 910 780;4;;14,8;14,42
10;Jama pod Velji vrh;Croatia;30.9.2007.;2007-09-30;1 juv;1;Dysderidae;Folkia;sp. 2;Folkia sp. 2;;42 766 635;16 907 278;Tb;deep cave;4 276 663 516 907 270;2;;;16,567
11;Hrastovska špilja;Croatia;2.10.2007.;2007-10-02;5 juv;5;Nesticidae;Kryptonesticus;eremita;Kryptonesticus eremita;120;42 756 282;16 875 635;tf;deep cave;4 275 628 216 875 630;4;;;12,6
12;Ra?a špilja;Croatia;28.9.2007.;2007-09-28;1 f;1;Dysderidae;Folkia;sp. 2;Folkia sp. 2;141;42 734 493;16 910 785;Tb;deep cave;4 273 449 316 910 780;4;;14,8;14,42
13;Jama pod Velji vrh;Croatia;30.9.2007.;2007-09-30;1 juv;1;Dysderidae;Folkia;sp. 2;Folkia sp. 2;;42 766 635;16 907 278;Tb;deep cave;4 276 663 516 907 270;2;;;16,567
14;Špilja na Pozalicu;Croatia;4.3.2008.;2008-03-04;1 f;1;Leptonetidae;Barusia;sp. 1;Barusia sp. 1;60;4 276 131;169 129;tb;deep cave;4 276 131 169 129;4;;12,65;14
16;Polušpilja na Mr?ari;Croatia;1.10.2007.;2007-10-01;1f, 2 juv;3;Agelenidae;Tegenaria;domestica;Tegenaria domestica;;42 768 583;16 788 965;Tf;cave entrance;4 276 858 316 788 960;2;;;19,4
18;Špilja na Pozalicu;Croatia;29.9.2007.;2007-09-29;1 f, 1 juv;2;Nesticidae;Kryptonesticus;eremita;Kryptonesticus eremita;60;4 276 131;169 129;tf;deep cave;4 276 131 169 129;4;;12,65;14
19;Špilja na Pozalicu;Croatia;3.3.2008.;2008-03-03;1 juv;1;Nesticidae;Kryptonesticus;eremita;Kryptonesticus eremita;60;4 276 131;169 129;tf;deep cave;4 276 131 169 129;4;;12,65;14
20;Jama pod Velji vrh;Croatia;30.9.2007.;2007-09-30;1 f, 1 juv;2;Nesticidae;Kryptonesticus;eremita;Kryptonesticus eremita;;42 766 635;16 907 278;tf;deep cave;4 276 663 516 907 270;2;;;16,567
21;Špilja na Pozalicu;Croatia;29.9.2007.;2007-09-29;2 juv;2;Nesticidae;Kryptonesticus;eremita;Kryptonesticus eremita;60;4 276 131;169 129;tf;deep cave;4 276 131 169 129;4;;12,65;14
22;Jama pod Velji vrh (ispred);Croatia;2.3.2008.;2008-03-02;1 juv;1;Dysderidae;Folkia;sp. 2;Folkia sp. 2;;42 766 635;16 907 278;Tb;shallow subterranean habitat;4 276 663 516 907 270;2;;;
23;Hrastovska špilja;Croatia;3.3.2008.;2008-03-03;2 juv;2;Nesticidae;Kryptonesticus;eremita;Kryptonesticus eremita;120;42 756 282;16 875 635;tf;deep cave;4 275 628 216 875 630;4;;;12,6
25;Ra?a špilja;Croatia;28.9.2007.;2007-09-28;1f;1;Dysderidae;Folkia;sp. 2;Folkia sp. 2;141;42 734 493;16 910 785;Tb;deep cave;4 273 449 316 910 780;4;;14,8;14,42
26;Špilja pod Kaštel;Croatia;4.3.2008.;2008-03-04;1 m;1;Leptonetidae;Barusia;sp. 1;Barusia sp. 1;;42 768 041;16 899 005;tb;deep cave;4 276 804 116 899 000;2;;15,3;16,95
29;Hrastovska špilja;Croatia;4.3.2008.;2008-03-04;6 juv;6;Nesticidae;Kryptonesticus;eremita;Kryptonesticus eremita;120;42 756 282;16 875 635;tf;deep cave;4 275 628 216 875 630;4;;;12,6
30;Ra?a špilja;Croatia;28.9.2007.;2007-09-28;1 juv;1;Dysderidae;Folkia;sp. 2;Folkia sp. 2;141;42 734 493;16 910 785;Tb;deep cave;4 273 449 316 910 780;4;;14,8;14,42
31;Hrastovska špilja;Croatia;2.10.2007.;2007-10-02;5 juv;5;Nesticidae;Kryptonesticus;eremita;Kryptonesticus eremita;120;42 756 282;16 875 635;tf;deep cave;4 275 628 216 875 630;4;;;12,6
32;Hrastovska špilja;Croatia;3.3.2008.;2008-03-03;1 f, 1 juv m;2;Nesticidae;Kryptonesticus;eremita;Kryptonesticus eremita;120;42 756 282;16 875 635;tf;deep cave;4 275 628 216 875 630;4;;;12,6
33;Jama pod Velji vrh;Croatia;30.9.2007.;2007-09-30;3 juv;3;Dysderidae;Folkia;sp. 2;Folkia sp. 2;;42 766 635;16 907 278;Tb;deep cave;4 276 663 516 907 270;2;;;16,567
34;Ra?a špilja;Croatia;28.9.2007.;2007-09-28;1 juv;1;Dysderidae;Folkia;sp. 2;Folkia sp. 2;141;42 734 493;16 910 785;Tb;deep cave;4 273 449 316 910 780;4;;14,8;14,42
35;Špilja na Pozalicu;Croatia;3.3.2008.;2008-03-03;1 f;1;Pholcidae;Pholcus;phalangioides;Pholcus phalangioides;60;4 276 131;169 129;;deep cave;4 276 131 169 129;4;;12,65;14
36;Hrastovska špilja;Croatia;3.3.2008.;2008-03-03;1 juv;1;Dysderidae;Folkia;sp. 2;Folkia sp. 2;120;42 756 282;16 875 635;Tb;deep cave;4 275 628 216 875 630;4;;;12,6
37;Medvidina špilja;Croatia;3.3.2008.;2008-03-03;1 f, 1 juv m;2;Nesticidae;Kryptonesticus;eremita;Kryptonesticus eremita;;42 734 776;16 863 532;tf;deep cave;4 273 477 616 863 530;1;;;
39;Špilja pod Kaštel;Croatia;27.9.2007.;2007-09-27;2 juv;2;Nesticidae;Kryptonesticus;eremita;Kryptonesticus eremita;;42 768 041;16 899 005;tf;deep cave;4 276 804 116 899 000;2;;15,3;16,95
41;Ra?a špilja;Croatia;2.10.2007.;2007-10-02;1 juv;1;Agelenidae;Tegenaria;sp.;Tegenaria sp.;141;42 734 493;16 910 785;;deep cave;4 273 449 316 910 780;4;;14,8;14,42
42;Jama Cvjetana Barbi?a;Croatia;1.10.2007.;2007-10-01;2 juv;2;Nesticidae;Kryptonesticus;eremita;Kryptonesticus eremita;73;42 740 282;16 879 112;tf;deep cave;4 274 028 216 879 110;1;;;17,2
44;Jama pod Velji vrh;Croatia;30.9.2007.;2007-09-30;1 juv;1;Nesticidae;Kryptonesticus;eremita;Kryptonesticus eremita;70;42 766 635;16 907 278;tf;deep cave;4 276 663 516 907 270;2;;;16,567
45;Hrastovska špilja;Croatia;2.10.2007.;2007-10-02;2 juv;2;Dysderidae;Folkia;sp. 2;Folkia sp. 2;120;42 756 282;16 875 635;Tb;deep cave;4 275 628 216 875 630;4;;;12,6
46;Špilja na Pozalicu;Croatia;3.3.2008.;2008-03-03;1 m;1;Nesticidae;Kryptonesticus;eremita;Kryptonesticus eremita;60;4 276 131;169 129;tf;deep cave;4 276 131 169 129;4;;12,65;14
47;Jama pod Velji vrh;Croatia;2.3.2008.;2008-03-02;1 juv;1;Dysderidae;Folkia;sp. 2;Folkia sp. 2;;42 766 635;16 907 278;Tb;deep cave;4 276 663 516 907 270;2;;;16,567
48;Hrastovska špilja;Croatia;3.3.2008.;2008-03-03;1 f, 1 juv;2;Leptonetidae;Barusia;sp. 1;Barusia sp. 1;120;42 756 282;16 875 635;tb;deep cave;4 275 628 216 875 630;4;;;12,6
50;Hrastovska špilja;Croatia;3.3.2008.;2008-03-03;2 juv;2;Nesticidae;Kryptonesticus;eremita;Kryptonesticus eremita;120;42 756 282;16 875 635;tf;deep cave;4 275 628 216 875 630;4;;;12,6
51;Hrastovska špilja;Croatia;2.10.2007.;2007-10-02;1 f;1;Linyphiidae;Bathyphantes;sp. 1;Bathyphantes sp. 1;120;42 756 282;16 875 635;Tx;;4 275 628 216 875 630;4;;;12,6
53;Špilja pod Kaštel;Croatia;4.3.2008.;2008-03-04;1 m;1;Nesticidae;Kryptonesticus;eremita;Kryptonesticus eremita;;42 768 041;16 899 005;tf;deep cave;4 276 804 116 899 000;2;;15,3;16,95
54;Špilja na Pozalicu;Croatia;29.9.2007.;2007-09-29;1 juv;1;Nesticidae;Kryptonesticus;eremita;Kryptonesticus eremita;60;4 276 131;169 129;tf;deep cave;4 276 131 169 129;4;;12,65;14
56;Breg jama;Croatia;30.4.2008.;2008-04-30;1 juv;1;Dysderidae;Harpactea;sp.;Harpactea sp.;;42 723 459;17 591 234;;;4 272 345 917 591 230;1;;;14,9
57;Jama Me?ugra?en;Croatia;30.4.2008.;2008-04-30;1m, 2 juv?;3;Dysderidae;Harpactea;sp. 9;Harpactea sp. 9;;42 737 934;1 755 671;Tb;deep cave;427 379 341 755 671;3;;;15,8
58;Jama Me?ugra?en;Croatia;30.4.2008.;2008-04-30;1f, 2juv;3;Agelenidae;Histopona;bidens;Histopona bidens;;42 737 934;1 755 671;tb;deep cave;427 379 341 755 671;3;;;15,8
59;Jara? na ponti od Graca;Croatia;3.5.2008.;2008-05-03;2 juv;2;Agelenidae;Histopona;bidens;Histopona bidens;;42 785 308;17 392 067;tb;deep cave;4 278 530 817 392 060;2;;;10,833
60;Jama na Žutim kokom;Croatia;2.5.2008.;2008-05-02;1 juv;1;Agelenidae;Histopona;bidens;Histopona bidens;326;42 712 746;17 682 621;tb;deep cave;4 271 274 617 682 620;3;;;
61;Ostaševica;Croatia;28.4.2008.;2008-04-28;1f, 1juv m;2;Agelenidae;Histopona;bidens;Histopona bidens;220;42 748 959;17 544 404;tb;deep cave;4 274 895 917 544 400;9;;;11,4
62;Jama na Brekalcima;Croatia;29.4.2008.;2008-04-29;1m, 1f;2;Agelenidae;Histopona;bidens;Histopona bidens;;42 781 895;17 407 747;tb;deep cave;4 278 189 517 407 740;1;;;12,867
63;Jama pod Sv. Spasom;Croatia;3.5.2008.;2008-05-03;1f;1;Agelenidae;Histopona;bidens;Histopona bidens;134;42 731 779;17 542 409;tb;deep cave;4 273 177 917 542 400;6;;;14,6
64;Jama pod Sv. Spasom;Croatia;3.5.2008.;2008-05-03;1f;1;Dysderidae;Folkia;inermis;Folkia inermis;;42 731 779;17 542 409;Tb;deep cave;4 273 177 917 542 400;6;;;14,6
65;Movrica;Croatia;28.4.2008.;2008-04-28;1 juv m;1;Agelenidae;Histopona;bidens;Histopona bidens;210;42 752 604;17 551 145;tb;deep cave;4 275 260 417 551 140;6;;;11,9
66;Male ponte;Croatia;27.4.2008.;2008-04-27;1 juv m;1;Agelenidae;Histopona;bidens;Histopona bidens;250;42 761 389;17 430 786;tb;deep cave;4 276 138 917 430 780;7;;;14,45
67;Movrica;Croatia;28.4.2008.;2008-04-28;1m, 1f, 3 juv;5;Agelenidae;Histopona;bidens;Histopona bidens;;42 752 604;17 551 145;tb;deep cave;4 275 260 417 551 140;6;;;11,9
68;Špilja u Solinama;Croatia;26.4.2008.;2008-04-26;1f, 2juv;3;Agelenidae;Histopona;bidens;Histopona bidens;17;42 768 021;17 377 062;tb;deep cave;4 276 802 117 377 060;5;;;10,3
68;Špilja u Solinama;Croatia;26.4.2008.;2008-04-26;1f, 2juv;3;Agelenidae;Histopona;bidens;Histopona bidens;17;42 768 021;17 377 062;tb;deep cave;4 276 802 117 377 060;5;;;6,25
68;Špilja u Solinama;Croatia;26.4.2008.;2008-04-26;1f, 2juv;3;Agelenidae;Histopona;bidens;Histopona bidens;17;42 768 021;17 377 062;tb;deep cave;4 276 802 117 377 060;5;;;10,3
70;Špilja u Solinama;Croatia;26.4.2008.;2008-04-26;1 juv;1;Dysderidae;Gen.;sp.;Gen.  sp.;;42 768 021;17 377 062;Tb;deep cave;4 276 802 117 377 060;5;;;10,3
70;Špilja u Solinama;Croatia;26.4.2008.;2008-04-26;1 juv;1;Dysderidae;Gen.;sp.;Gen.  sp.;;42 768 021;17 377 062;Tb;deep cave;4 276 802 117 377 060;5;;;6,25
70;Špilja u Solinama;Croatia;26.4.2008.;2008-04-26;1 juv;1;Dysderidae;Gen.;sp.;Gen.  sp.;;42 768 021;17 377 062;Tb;deep cave;4 276 802 117 377 060;5;;;10,3
71;Špilja u Solinama;Croatia;26.4.2008.;2008-04-26;1 juv;1;Dysderidae;Folkia;sp. 5;Folkia sp. 5;;42 768 021;17 377 062;Tb;deep cave;4 276 802 117 377 060;5;;;10,3
71;Špilja u Solinama;Croatia;26.4.2008.;2008-04-26;1 juv;1;Dysderidae;Folkia;sp. 5;Folkia sp. 5;;42 768 021;17 377 062;Tb;deep cave;4 276 802 117 377 060;5;;;6,25
71;Špilja u Solinama;Croatia;26.4.2008.;2008-04-26;1 juv;1;Dysderidae;Folkia;sp. 5;Folkia sp. 5;;42 768 021;17 377 062;Tb;deep cave;4 276 802 117 377 060;5;;;10,3
72;Jama na Brekalcima;Croatia;29.4.2008.;2008-04-29;1f;1;Agelenidae;Histopona;bidens;Histopona bidens;;42 781 895;17 407 747;tb;deep cave;4 278 189 517 407 740;1;;;12,867
73;Špilja kod Nerezinog dola;Croatia;27.4.2008.;2008-04-27;1 juv;1;Agelenidae;Tegenaria;sp.;Tegenaria sp.;201;42 758 378;17 436 094;;deep cave;4 275 837 817 436 090;6;;;15,5
73;Špilja kod Nerezinog dola;Croatia;27.4.2008.;2008-04-27;1 juv;1;Agelenidae;Tegenaria;sp.;Tegenaria sp.;201;42 758 378;17 436 094;;deep cave;4 275 837 817 436 090;6;;;12,267
74;Male ponte;Croatia;27.4.2008.;2008-04-27;2 juv;2;Agelenidae;Histopona;bidens;Histopona bidens;250;42 761 389;17 430 786;tb;deep cave;4 276 138 917 430 780;7;;;14,45
75;Jama za Sv. Ilijom;Croatia;2.5.2008.;2008-05-02;2 juv;2;Agelenidae;Histopona;bidens;Histopona bidens;;42 744 428;17 515 269;tb;deep cave;4 274 442 817 515 260;3;;;12,533
76;Jama na Žutim kokom;Croatia;2.5.2008.;2008-05-02;1 juv;1;Dysderidae;Folkia;inermis;Folkia inermis;;42 712 746;17 682 621;Tb;deep cave;4 271 274 617 682 620;3;;;
77;Gali?njak;Croatia;2.5.2008.;2008-05-02;1 juv;1;Agelenidae;Histopona;bidens;Histopona bidens;;42 720 118;1 767 071;tb;deep cave;427 201 181 767 071;11;;;13,6
78;Gali?njak;Croatia;2.5.2008.;2008-05-02;1 f;1;Leptonetidae;Sulcia;sp. 6;Sulcia sp. 6;;42 720 118;1 767 071;Tf;cave entrance;427 201 181 767 071;11;;;13,6
79;Gali?njak;Croatia;2.5.2008.;2008-05-02;2 m, 2 f, 1 juv;5;Leptonetidae;Sulcia;sp. 6;Sulcia sp. 6;;42 720 118;1 767 071;Tf;cave entrance;427 201 181 767 071;11;;;13,6
80;Gali?njak;Croatia;2.5.2008.;2008-05-02;1m, 1f, 1 juv;3;Leptonetidae;Sulcia;sp. 6;Sulcia sp. 6;;42 720 118;1 767 071;Tf;cave entrance;427 201 181 767 071;11;;;13,6
86;Gali?njak;Croatia;2.5.2008.;2008-05-02;2 m, 1 juv;3;Leptonetidae;Barusia;maheni;Barusia maheni;;42 720 118;1 767 071;tf;deep cave;427 201 181 767 071;11;;;13,6
87;Špilja kod Nerezinog dola;Croatia;27.4.2008.;2008-04-27;1 juv f;1;Leptonetidae;Barusia;maheni;Barusia maheni;;42 758 378;17 436 094;tf;deep cave;4 275 837 817 436 090;6;;;15,5
87;Špilja kod Nerezinog dola;Croatia;27.4.2008.;2008-04-27;1 juv f;1;Leptonetidae;Barusia;maheni;Barusia maheni;;42 758 378;17 436 094;tf;deep cave;4 275 837 817 436 090;6;;;12,267
89;Movrica;Croatia;28.4.2008.;2008-04-28;1 f, 2 juv m;3;Leptonetidae;Sulcia;nocturna;Sulcia nocturna;;42 752 604;17 551 145;;deep cave;4 275 260 417 551 140;6;;;11,9
90;Male ponte;Croatia;27.4.2008.;2008-04-27;1 f;1;Linyphiidae;Palliduphantes;sp. 1;Palliduphantes sp. 1;;42 761 389;17 430 786;tf;deep cave;4 276 138 917 430 780;7;;;14,45
96;Male ponte;Croatia;14.4.2007.;2007-04-14;1f, 1 juv;2;Leptonetidae;Sulcia;nocturna;Sulcia nocturna;;42 761 389;17 430 786;;deep cave;4 276 138 917 430 780;7;;;14,45
98;Gali?njak;Croatia;10.4.2007.;2007-04-10;1 m;1;Leptonetidae;Barusia;maheni;Barusia maheni;;42 720 118;1 767 071;tf;deep cave;427 201 181 767 071;11;;;13,6
99;Ostaševica;Croatia;8.4.2007.;2007-04-08;1f, 1 juv;2;Leptonetidae;Sulcia;nocturna;Sulcia nocturna;220;42 748 959;17 544 404;;deep cave;4 274 895 917 544 400;9;;;11,4
100;Gali?njak;Croatia;14.4.2007.;2007-04-14;1 m;1;Leptonetidae;Barusia;maheni;Barusia maheni;;42 720 118;1 767 071;tf;deep cave;427 201 181 767 071;11;;;13,6
102;Male ponte;Croatia;9.4.2007.;2007-04-09;1 f;1;Leptonetidae;Barusia;maheni;Barusia maheni;;42 761 389;17 430 786;tf;deep cave;4 276 138 917 430 780;7;;;14,45
103;Male ponte;Croatia;9.4.2007.;2007-04-09;1 m, 1 f, 1 juv;3;Leptonetidae;Sulcia;nocturna;Sulcia nocturna;;42 761 389;17 430 786;;deep cave;4 276 138 917 430 780;7;;;14,45
104;Špilja kod Nerezinog dola;Croatia;7.4.2007.;2007-04-07;1 m, 3 juv;4;Leptonetidae;Barusia;maheni;Barusia maheni;;42 758 378;17 436 094;tf;deep cave;4 275 837 817 436 090;6;;;15,5
104;Špilja kod Nerezinog dola;Croatia;7.4.2007.;2007-04-07;1 m, 3 juv;4;Leptonetidae;Barusia;maheni;Barusia maheni;;42 758 378;17 436 094;tf;deep cave;4 275 837 817 436 090;6;;;12,267
105;Špilja u Solinama;Croatia;11.4.2007.;2007-04-11;1 m, 1 f;2;Leptonetidae;Barusia;maheni;Barusia maheni;17;42 768 021;17 377 062;tf;deep cave;4 276 802 117 377 060;5;;;10,3
105;Špilja u Solinama;Croatia;11.4.2007.;2007-04-11;1 m, 1 f;2;Leptonetidae;Barusia;maheni;Barusia maheni;17;42 768 021;17 377 062;tf;deep cave;4 276 802 117 377 060;5;;;6,25
105;Špilja u Solinama;Croatia;11.4.2007.;2007-04-11;1 m, 1 f;2;Leptonetidae;Barusia;maheni;Barusia maheni;17;42 768 021;17 377 062;tf;deep cave;4 276 802 117 377 060;5;;;10,3
109;Špilja kod Nerezinog dola;Croatia;7.4.2007.;2007-04-07;1 m, 2 f;3;Leptonetidae;Barusia;maheni;Barusia maheni;;42 758 378;17 436 094;tf;deep cave;4 275 837 817 436 090;6;;;15,5
109;Špilja kod Nerezinog dola;Croatia;7.4.2007.;2007-04-07;1 m, 2 f;3;Leptonetidae;Barusia;maheni;Barusia maheni;;42 758 378;17 436 094;tf;deep cave;4 275 837 817 436 090;6;;;12,267
111;Male ponte;Croatia;9.4.2007.;2007-04-09;1 f;1;Linyphiidae;Palliduphantes;sp. 1;Palliduphantes sp. 1;;42 761 389;17 430 786;tf;deep cave;4 276 138 917 430 780;7;;;14,45
112;Ostaševica;Croatia;8.4.2007.;2007-04-08;2 juv;2;Agelenidae;Histopona;bidens;Histopona bidens;220;42 748 959;17 544 404;tb;deep cave;4 274 895 917 544 400;9;;;11,4
113;Špilja kod Nerezinog dola;Croatia;7.4.2007.;2007-04-07;1 juv;1;Agelenidae;Histopona;bidens;Histopona bidens;;42 758 378;17 436 094;tb;deep cave;4 275 837 817 436 090;6;;;15,5
113;Špilja kod Nerezinog dola;Croatia;7.4.2007.;2007-04-07;1 juv;1;Agelenidae;Histopona;bidens;Histopona bidens;;42 758 378;17 436 094;tb;deep cave;4 275 837 817 436 090;6;;;12,267
114;Male ponte;Croatia;9.4.2007.;2007-04-09;1 juv;1;Agelenidae;Histopona;bidens;Histopona bidens;250;42 761 389;17 430 786;tb;deep cave;4 276 138 917 430 780;7;;;14,45
118;Gali?njak;Croatia;10.4.2007.;2007-04-10;1m;1;Nemesiidae;Nemesia;sp. 1;Nemesia sp. 1;;42 720 118;1 767 071;;;427 201 181 767 071;11;;;13,6
119;Gali?njak;Croatia;14.4.2007.;2007-04-14;2 juv;2;Agelenidae;Histopona;bidens;Histopona bidens;;42 720 118;1 767 071;tb;deep cave;427 201 181 767 071;11;;;13,6
120;Male ponte;Croatia;9.4.2007.;2007-04-09;2 juv;2;Agelenidae;Histopona;bidens;Histopona bidens;250;42 761 389;17 430 786;tb;deep cave;4 276 138 917 430 780;7;;;14,45
122;Movrica;Croatia;8.4.2007.;2007-04-08;2 juv;2;Agelenidae;Histopona;bidens;Histopona bidens;;42 752 604;17 551 145;tb;deep cave;4 275 260 417 551 140;6;;;11,9
123;Špilja kod Vrha spile;Croatia;9.4.2007.;2007-04-09;1 juv;1;Agelenidae;Histopona;bidens;Histopona bidens;;42 776 757;17 420 591;tb;deep cave;4 277 675 717 420 590;3;;;9,4
124;Mala špilja, Blato;Croatia;12.4.2007.;2007-04-12;2 juv;2;Dysderidae;Folkia;inermis;Folkia inermis;;42 764 498;17 471 054;Tb;deep cave;4 276 449 817 471 050;5;;;
125;Gali?njak;Croatia;10.4.2007.;2007-04-10;1 juv;1;Dysderidae;Harpactea;sp.;Harpactea sp.;;42 720 118;1 767 071;;;427 201 181 767 071;11;;;13,6
126;Špilja u Solinama;Croatia;11.4.2007.;2007-04-11;1 juv;1;Dysderidae;Folkia;sp. 5;Folkia sp. 5;17;42 768 021;17 377 062;Tb;deep cave;4 276 802 117 377 060;5;;;10,3
126;Špilja u Solinama;Croatia;11.4.2007.;2007-04-11;1 juv;1;Dysderidae;Folkia;sp. 5;Folkia sp. 5;17;42 768 021;17 377 062;Tb;deep cave;4 276 802 117 377 060;5;;;6,25
126;Špilja u Solinama;Croatia;11.4.2007.;2007-04-11;1 juv;1;Dysderidae;Folkia;sp. 5;Folkia sp. 5;17;42 768 021;17 377 062;Tb;deep cave;4 276 802 117 377 060;5;;;10,3
127;Mala špilja, Blato;Croatia;12.4.2007.;2007-04-12;1 juv;1;Dysderidae;Folkia;inermis;Folkia inermis;;42 764 498;17 471 054;Tb;deep cave;4 276 449 817 471 050;5;;;
128;Male ponte;Croatia;9.4.2007.;2007-04-09;1 juv;1;Dysderidae;Folkia;sp. 5;Folkia sp. 5;;42 761 389;17 430 786;Tb;deep cave;4 276 138 917 430 780;7;;;14,45
129;Špilja kod Nerezinog dola;Croatia;7.4.2007.;2007-04-07;1 juv;1;Dysderidae;Folkia;inermis;Folkia inermis;;42 758 378;17 436 094;Tb;deep cave;4 275 837 817 436 090;6;;;15,5
129;Špilja kod Nerezinog dola;Croatia;7.4.2007.;2007-04-07;1 juv;1;Dysderidae;Folkia;inermis;Folkia inermis;;42 758 378;17 436 094;Tb;deep cave;4 275 837 817 436 090;6;;;12,267
130;Mala špilja, Blato;Croatia;12.4.2007.;2007-04-12;1 juv;1;Dysderidae;Folkia;inermis;Folkia inermis;;42 764 498;17 471 054;Tb;deep cave;4 276 449 817 471 050;5;;;
131;Male ponte;Croatia;13.4.2007.;2007-04-13;1f;1;Dysderidae;Folkia;sp. 5;Folkia sp. 5;;42 761 389;17 430 786;Tb;deep cave;4 276 138 917 430 780;7;;;14,45
133;Movrica;Croatia;8.4.2007.;2007-04-08;1 f;1;Linyphiidae;Bathyphantes;sp. 1;Bathyphantes sp. 1;;42 752 604;17 551 145;Tx;;4 275 260 417 551 140;6;;;11,9
134;Špilja u Solinama;Croatia;11.4.2007.;2007-04-11;1 f;1;Familia x;Gen.;sp.;Gen. sp.;17;42 768 021;17 377 062;;;4 276 802 117 377 060;5;;;10,3
134;Špilja u Solinama;Croatia;11.4.2007.;2007-04-11;1 f;1;Familia x;Gen.;sp.;Gen. sp.;17;42 768 021;17 377 062;;;4 276 802 117 377 060;5;;;6,25
134;Špilja u Solinama;Croatia;11.4.2007.;2007-04-11;1 f;1;Familia x;Gen.;sp.;Gen. sp.;17;42 768 021;17 377 062;;;4 276 802 117 377 060;5;;;10,3
135;Male ponte;Croatia;9.4.2007.;2007-04-09;1 f;1;Linyphiidae;Bathyphantes;sp. 1;Bathyphantes sp. 1;;42 761 389;17 430 786;Tx;;4 276 138 917 430 780;7;;;14,45
136;Mala špilja, Blato;Croatia;12.4.2007.;2007-04-12;1 f;1;Linyphiidae;Bathyphantes;sp. 1;Bathyphantes sp. 1;;42 764 498;17 471 054;Tx;;4 276 449 817 471 050;5;;;
139;Ostaševica;Croatia;28.4.2008.;2008-04-28;1m;1;Dysderidae;Folkia;inermis;Folkia inermis;220;42 748 959;17 544 404;Tb;deep cave;4 274 895 917 544 400;9;;;11,4
140;Ostaševica;Croatia;28.4.2008.;2008-04-28;1m;1;Agelenidae;Histopona;bidens;Histopona bidens;220;42 748 959;17 544 404;tb;deep cave;4 274 895 917 544 400;9;;;11,4
141;Jama Me?ugra?en;Croatia;30.4.2008.;2008-04-30;3 juv;3;Agelenidae;Histopona;bidens;Histopona bidens;;42 737 934;1 755 671;tb;deep cave;427 379 341 755 671;3;;;15,8
142;Jama Me?ugra?en;Croatia;30.4.2008.;2008-04-30;1f;1;Dysderidae;Folkia;inermis;Folkia inermis;;42 737 934;1 755 671;Tb;deep cave;427 379 341 755 671;3;;;15,8
143;Vilina špilja-Izvor Omble;Croatia;1.11.2008.;2008-11-01;2m, 1 juv;3;Leptonetidae;Sulcia;sp. 2;Sulcia sp. 2;137;4 267 716;18 136 236;Tb;deep cave;426 771 618 136 236;5;;;
144;Mo?iljska špilja;Croatia;1.11.2008.;2008-11-01;1f;1;Nesticidae;Kryptonesticus;eremita;Kryptonesticus eremita;410;42 689 061;18 071 906;tf;deep cave;4 268 906 118 071 900;6;;15,4;14,7
146;Debela ljut;Croatia;31.10.2008.;2008-10-31;1f, 2 juv;3;Nesticidae;Kryptonesticus;eremita;Kryptonesticus eremita;258;42 717 699;18 022 036;tf;deep cave;4 271 769 918 022 030;8;;15,6;15,6
147;Debela ljut;Croatia;31.10.2008.;2008-10-31;1 f;1;Linyphiidae;Gen.;sp. X;Gen. sp. X;;42 717 699;18 022 036;;;4 271 769 918 022 030;8;;15,6;15,6
148;Banova ljut;Croatia;31.10.2008.;2008-10-31;1 juv m;1;Nesticidae;Kryptonesticus;eremita;Kryptonesticus eremita;;42 724 023;18 023 649;tf;deep cave;4 272 402 318 023 640;4;;;15,2
152;Jama Zadubravica;Croatia;3.11.2008.;2008-11-03;1 juv m, 1f;2;Leptonetidae;Sulcia;sp. X;Sulcia sp. X;;42 771 666;17 936 425;;;4 277 166 617 936 420;3;;;11,45
154;Jama na vrh Prodoli;Croatia;4.11.2008.;2008-11-04;1 m;1;Leptonetidae;Barusia;maheni;Barusia maheni;;42 720 837;18 021 231;tf;deep cave;4 272 083 718 021 230;1;;;21,6
156;Debela ljut;Croatia;31.10.2008.;2008-10-31;1m, 1 juv;2;Leptonetidae;Barusia;maheni;Barusia maheni;;42 717 699;18 022 036;tf;deep cave;4 271 769 918 022 030;8;;15,6;15,6
160;Pe?ina u Gaju;Croatia;1.11.2008.;2008-11-01;1 juv;1;Agelenidae;Histopona;sp.;Histopona sp.;;42 704 486;1 808 282;;deep cave;427 044 861 808 282;2;;;
161;Pe?ina u Gaju;Croatia;1.11.2008.;2008-11-01;1m, 1juv f;2;Leptonetidae;Sulcia;sp. 14;Sulcia sp. 14;;42 704 486;1 808 282;;;427 044 861 808 282;2;;;
162;Špijaturica;Croatia;5.11.2008.;2008-11-05;1m, 1f;2;Leptonetidae;Barusia;maheni;Barusia maheni;340;42 835 204;17 806 752;tf;deep cave;4 283 520 417 806 750;3;;;
169;Vilina špilja-Izvor Omble;Croatia;1.11.2008.;2008-11-01;1f;1;Agelenidae;Histopona;dubia;Histopona dubia;137;4 267 716;18 136 236;tb;deep cave;426 771 618 136 236;5;;;
170;Vilinska špilja;Croatia;4.11.2008.;2008-11-04;1f;1;Linyphiidae;Troglohyphantes;salax;Troglohyphantes salax;;42 797 852;17 922 663;tb;deep cave;4 279 785 217 922 660;2;;;
171;Jama na vrh Vrguda;Croatia;2.11.2008.;2008-11-02;1 m;1;Leptonetidae;Barusia;maheni;Barusia maheni;523;42 726 207;18 039 158;tf;deep cave;4 272 620 718 039 150;9;;;
173;Jama na vrh Vrguda;Croatia;2.11.2008.;2008-11-02;1 juv m;1;Agelenidae;Histopona;dubia;Histopona dubia;523;42 726 207;18 039 158;tb;deep cave;4 272 620 718 039 150;9;;;
174;Špijaturica;Croatia;5.11.2008.;2008-11-05;5m, 2f;7;Leptonetidae;Barusia;maheni;Barusia maheni;;42 835 204;17 806 752;tf;deep cave;4 283 520 417 806 750;3;;;
175;Vilina špilja-Izvor Omble;Croatia;1.11.2008.;2008-11-01;1 juv;1;Agelenidae;Histopona;sp.;Histopona sp.;137;4 267 716;18 136 236;;deep cave;426 771 618 136 236;5;;;
176;Vilina špilja-Izvor Omble;Croatia;1.11.2008.;2008-11-01;2m, 1f, 3 juv;6;Leptonetidae;Sulcia;sp. 2;Sulcia sp. 2;137;4 267 716;18 136 236;Tb;deep cave;426 771 618 136 236;5;;;
180;Jama Zadubravica;Croatia;3.11.2008.;2008-11-03;1f;1;Agelenidae;Histopona;conveniens;Histopona conveniens;;42 771 666;17 936 425;Tf;deep cave;4 277 166 617 936 420;3;;;11,45
181;Aragonka;Croatia;26.3.2008.;2008-03-26;1 juv;1;Agelenidae;Histopona;sp.;Histopona sp.;306;42 713 284;18 019 397;;deep cave;4 271 328 418 019 390;3;;;
182;Aragonka;Croatia;26.3.2008.;2008-03-26;1 f;1;Agelenidae;Histopona;dubia;Histopona dubia;306;42 713 284;18 019 397;tb;deep cave;4 271 328 418 019 390;3;;;
183;Jama u Zabira?u;Croatia;30.3.2008.;2008-03-30;1m, 2 juv;3;Dysderidae;Dysdera;sp. 1;Dysdera sp. 1;;42 732 667;18 049 328;;;4 273 266 718 049 320;3;;;11,9
184;Kriva?a špilja;Croatia;31.3.2008.;2008-03-31;1f;1;Dysderidae;Stalagtia;hercegovinensis;Stalagtia hercegovinensis;;42 730 217;18 067 602;Tb;deep cave;4 273 021 718 067 600;1;;;8,9
185;Jama u Zabira?u;Croatia;30.3.2008.;2008-03-30;1m;1;Dysderidae;Stalagtia;sp. 5;Stalagtia sp. 5;;42 732 667;18 049 328;Tb;deep cave;4 273 266 718 049 320;3;;;11,9
186;Jama na vrh Vrguda;Croatia;2.11.2008.;2008-11-02;1 f;1;Agelenidae;Tegenaria;annulata;Tegenaria annulata;523;42 726 207;18 039 158;tf;deep cave;4 272 620 718 039 150;9;;;
187;Jama na vrh Vrguda;Croatia;2.11.2008.;2008-11-02;1m, 2 juv;3;Dysderidae;Stalagtia;sp. 5;Stalagtia sp. 5;523;42 726 207;18 039 158;Tb;deep cave;4 272 620 718 039 150;9;;;
188;Jama na vrh Vrguda;Croatia;2.11.2008.;2008-11-02;1f;1;Linyphiidae;Troglohyphantes;affinis;Troglohyphantes affinis;523;42 726 207;18 039 158;tb;deep cave;4 272 620 718 039 150;9;;;
189;Kriva?a špilja;Croatia;31.3.2008.;2008-03-31;1f;1;Dysderidae;Stalagtia;hercegovinensis;Stalagtia hercegovinensis;;42 730 217;18 067 602;Tb;deep cave;4 273 021 718 067 600;1;;;8,9
190;Jama u Zabira?u;Croatia;2.11.2008.;2008-11-02;2f;2;Dysderidae;Stalagtia;sp. 5;Stalagtia sp. 5;;42 732 667;18 049 328;Tb;deep cave;4 273 266 718 049 320;3;;;11,9
191;Jama Zadubravica;Croatia;3.11.2008.;2008-11-03;1f;1;Dysderidae;Stalagtia;hercegovinensis;Stalagtia hercegovinensis;;42 771 666;17 936 425;Tb;deep cave;4 277 166 617 936 420;3;;;11,45
192;Vilina špilja-Izvor Omble;Croatia;1.11.2008.;2008-11-01;1f;1;Dysderidae;Stalagtia;sp. 2;Stalagtia sp. 2;137;4 267 716;18 136 236;Tb;deep cave;426 771 618 136 236;5;;;
193;Aragonka;Croatia;26.3.2008.;2008-03-26;1f, 1 juv;2;Dysderidae;Stalagtia;sp. 5;Stalagtia sp. 5;306;42 713 284;18 019 397;Tb;deep cave;4 271 328 418 019 390;3;;;
194;Špilja na vrh Toraca;Croatia;26.3.2008.;2008-03-26;1f;1;Dysderidae;Stalagtia;sp. 5;Stalagtia sp. 5;;42 705 575;1 803 049;Tb;deep cave;427 055 751 803 049;3;;15,5;15,275
195;Špijaturica;Croatia;5.11.2008.;2008-11-05;1 juv;1;Dysderidae;Stalagtia;hercegovinensis;Stalagtia hercegovinensis;;42 835 204;17 806 752;Tb;deep cave;4 283 520 417 806 750;3;;;
196;Jama uz stazu na Sv. Nikoli;Croatia;28.3.2008.;2008-03-28;2 juv;2;Dysderidae;Stalagtia;sp. 5;Stalagtia sp. 5;;42 700 426;18 028 022;Tb;deep cave;4 270 042 618 028 020;2;;;
197;Vilina špilja-Izvor Omble;Croatia;1.11.2008.;2008-11-01;1 juv;1;Dysderidae;Stalagtia;sp. 2;Stalagtia sp. 2;137;4 267 716;18 136 236;Tb;deep cave;426 771 618 136 236;5;;;
198;Vilinska špilja;Croatia;4.11.2008.;2008-11-04;2 juv;2;Dysderidae;Stalagtia;hercegovinensis;Stalagtia hercegovinensis;;42 797 852;17 922 663;Tb;deep cave;4 279 785 217 922 660;2;;;
199;Rudina;Croatia;27.3.2008.;2008-03-27;1 juv;1;Dysderidae;Stalagtia;hercegovinensis;Stalagtia hercegovinensis;;42 721 999;18 015 321;Tb;deep cave;4 272 199 918 015 320;3;;;
200;Jama na vrh Vrguda;Croatia;2.11.2008.;2008-11-02;1 juv;1;Dysderidae;Harpactea;sp.;Harpactea sp.;523;42 726 207;18 039 158;;;4 272 620 718 039 150;9;;;
201;Jama Zadubravica;Croatia;31.3.2008.;2008-03-31;3 juv;3;Dysderidae;Stalagtia;hercegovinensis;Stalagtia hercegovinensis;;42 771 666;17 936 425;Tb;deep cave;4 277 166 617 936 420;3;;;11,45
202;Mo?iljska špilja;Croatia;1.11.2008.;2008-11-01;1 juv;1;Dysderidae;Stalagtia;sp. 5;Stalagtia sp. 5;410;42 689 061;18 071 906;Tb;deep cave;4 268 906 118 071 900;6;;15,4;14,7
203;Jama na vrh Vrguda;Croatia;2.11.2008.;2008-11-02;1m;1;Linyphiidae;Micrargus;herbigradus;Micrargus herbigradus;523;42 726 207;18 039 158;Tf;deep cave;4 272 620 718 039 150;9;;;
204;Špijaturica;Croatia;5.11.2008.;2008-11-05;2 f;2;Linyphiidae;Asthenargus;bracianus;Asthenargus bracianus;;42 835 204;17 806 752;tf;deep cave;4 283 520 417 806 750;3;;;
205;Debela ljut;Croatia;31.10.2008.;2008-10-31;1f, 1m;2;Linyphiidae;Asthenargus;bracianus;Asthenargus bracianus;;42 717 699;18 022 036;tf;deep cave;4 271 769 918 022 030;8;;15,6;15,6
207;Debela ljut;Croatia;31.10.2008.;2008-10-31;1 f;1;Linyphiidae;Asthenargus;bracianus;Asthenargus bracianus;;42 717 699;18 022 036;tf;deep cave;4 271 769 918 022 030;8;;15,6;15,6
208;Jama u Zabira?u;Croatia;30.3.2008.;2008-03-30;1f;1;Linyphiidae;Centromerus;raridentatus sp.n.;Centromerus raridentatus sp.n.;;42 732 667;18 049 328;;;4 273 266 718 049 320;3;;;11,9
209;Jama uz stazu na Sv. Nikoli;Croatia;28.3.2008.;2008-03-28;1 f;1;Linyphiidae;Gen. 2;sp. 1;Gen. 2 sp. 1;;42 700 426;18 028 022;;;4 270 042 618 028 020;2;;;
210;Jama na vrh Vrguda;Croatia;2.11.2008.;2008-11-02;1 m;1;Linyphiidae;Asthenargus;bracianus;Asthenargus bracianus;523;42 726 207;18 039 158;tf;deep cave;4 272 620 718 039 150;9;;;
211;Jama na vrh Vrguda;Croatia;2.11.2008.;2008-11-02;1 ?;;Linyphiidae;Gen. 1;sp. 1;Gen. 1 sp. 1;523;42 726 207;18 039 158;;;4 272 620 718 039 150;9;;;
213;Špijaturica;Croatia;5.11.2008.;2008-11-05;2f, 2m;4;Linyphiidae;Asthenargus;bracianus;Asthenargus bracianus;;42 835 204;17 806 752;tf;deep cave;4 283 520 417 806 750;3;;;
214;?injadra;Croatia;5.1.2009.;2009-01-05;1 f, 1 juv;2;Nesticidae;Kryptonesticus;eremita;Kryptonesticus eremita;294;43 339 771;16 599 423;tf;deep cave;4 333 977 116 599 420;2;;;15,1
215;?injadra;Croatia;22.10.2007.;2007-10-22;1 f, 5 juv;6;Nesticidae;Kryptonesticus;eremita;Kryptonesticus eremita;294;43 339 771;16 599 423;tf;deep cave;4 333 977 116 599 420;2;;;15,1
219;Špilja pod Zimzelom;Croatia;25.6.2008.;2008-06-25;1 m;1;Dysderidae;Parastalita;stygia;Parastalita stygia;765;45 281 948;15 115 239;Tb;deep cave;4 528 194 815 115 230;1;;;8
220;Špilja pod Zimzelom;Croatia;25.6.2008.;2008-06-25;1 m, 1f;2;Dysderidae;Parastalita;stygia;Parastalita stygia;765;45 281 948;15 115 239;Tb;deep cave;4 528 194 815 115 230;1;;;8
221;Špilja pod Zimzelom;Croatia;14.12.2008.;2008-12-14;1 m;1;Dysderidae;Parastalita;stygia;Parastalita stygia;765;45 281 948;15 115 239;Tb;deep cave;4 528 194 815 115 230;1;;;8
222;Špilja pod Zimzelom;Croatia;14.12.2008.;2008-12-14;2 f;2;Dysderidae;Parastalita;stygia;Parastalita stygia;765;45 281 948;15 115 239;Tb;deep cave;4 528 194 815 115 230;1;;;8
223;Krumpirište;Croatia;13.10.2007.;2007-10-13;1 m;1;Linyphiidae;Troglohyphantes;sp. 12;Troglohyphantes sp. 12;860;4 590 677;1 595 285;tf;shallow subterranean habitat;45 906 771 595 285;1;;;
224;Kranjica pe?ina;Croatia;13.10.2007.;2007-10-13;1m, 1f;2;Agelenidae;Tegenaria;bosnica;Tegenaria bosnica;820;43 959 462;16 475 197;;deep cave;4 395 946 216 475 190;2;;;
225;Suhodolka;Croatia;26.10.2008.;2008-10-26;1f;1;Linyphiidae;Porrhomma;egeria;Porrhomma egeria;658;45 504 451;17 698 877;;deep cave;4 550 445 117 698 870;1;;;
226;Suhodolka;Croatia;24.10.2008.;2008-10-24;1f;1;Linyphiidae;Porrhomma;egeria;Porrhomma egeria;658;45 504 451;17 698 877;;deep cave;4 550 445 117 698 870;1;;;
227;Kova?ica jama;Croatia;25.10.2008.;2008-10-25;1f, 1m, 1juv;3;Linyphiidae;Porrhomma;convexum;Porrhomma convexum;;45 519 178;1 765 444;;deep cave;455 191 781 765 444;4;;;9,3
228;Lijepa jama;Croatia;27.10.2008.;2008-10-27;2m, 1 juv;3;Linyphiidae;Porrhomma;egeria;Porrhomma egeria;725;45 501 686;17 708 297;;deep cave;4 550 168 617 708 290;1;;;10,8
230;Jama iznad Jezerca;Croatia;27.10.2008.;2008-10-27;2 m;2;Linyphiidae;Porrhomma;microps;Porrhomma microps;607;45 504 726;17 684 095;Tf;deep cave;4 550 472 617 684 090;1;;9,6;9,85
231;Jama na Bilu;Croatia;25.10.2008.;2008-10-25;1m, 2f, 1juv;4;Linyphiidae;Porrhomma;egeria;Porrhomma egeria;630;45 512 599;17 693 701;;deep cave;4 551 259 917 693 700;1;;;8,9
233;Suhodolka;Croatia;24.10.2008.;2008-10-24;6m, 7f, 5juv;18;Linyphiidae;Porrhomma;egeria;Porrhomma egeria;658;45 504 451;17 698 877;;deep cave;4 550 445 117 698 870;1;;;
235;Oko jame Kova?ice;Croatia;25.10.2008.;2008-10-25;1m;1;Cybaeidae;Mastigusa;macrophthalma;Mastigusa macrophthalma;;45 519 178;1 765 444;Tx;Shallow subterranean habitat;455 191 781 765 444;4;;;
236;Oko jame Kova?ice;Croatia;25.10.2008.;2008-10-25;1f;1;Amaurobidae;Amaurobius;jugorum;Amaurobius jugorum;;45 519 178;1 765 444;Tx;epigean habitat;455 191 781 765 444;4;;;
237;Oko jame Kova?ice;Croatia;25.10.2008.;2008-10-25;1f;1;Hahniidae;Cicurina;cicur;Cicurina cicur;;45 519 178;1 765 444;tf;epigean habitat;455 191 781 765 444;4;;;
239;Osinec jama;Croatia;14.10.2008.;2008-10-14;1f;1;Agelenidae;Tegenaria;ferruginea;Tegenaria ferruginea;524;46 163 969;16 111 277;Tf;deep cave;4 616 396 916 111 270;2;;;
240;Velika špilja, Pokojec;Croatia;19.10.2008.;2008-10-19;1 f;1;Corinnidae;Gen.;sp.;Gen. sp.;;46 170 142;16 237 915;;;4 617 014 216 237 910;1;;;
241;Matekova špilja 2;Croatia;16.10.2008.;2008-10-16;1 f;1;Cybaeidae;Cybaeus;sp. 1;Cybaeus sp. 1;;46 188 341;16 123 401;;;4 618 834 116 123 400;1;;;
242;Špilja u Bukevju;Croatia;18.10.2008.;2008-10-18;2f;2;Amaurobidae;Amaurobius;fenestralis;Amaurobius fenestralis;;46 206 924;16 143 971;Tx;deep cave;4 620 692 416 143 970;2;;;
243;Osinec jama;Croatia;29.5.2008.;2008-05-29;3 juv;3;Nesticidae;Nesticus;cellulanus;Nesticus cellulanus;524;46 163 969;16 111 277;;deep cave;4 616 396 916 111 270;2;;;
244;Špilja na Pisanoj pe?ini;Croatia;19.10.2008.;2008-10-19;3 juv;3;Nesticidae;Nesticus;cellulanus;Nesticus cellulanus;461;46 177 112;16 220 637;;deep cave;4 617 711 216 220 630;1;;;
245;Špilja na Pisanoj pe?ini;Croatia;14.5.2008.;2008-05-14;1 juv;1;Nesticidae;Nesticus;cellulanus;Nesticus cellulanus;461;46 177 112;16 220 637;;deep cave;4 617 711 216 220 630;1;;;
247;Zdenec pri Ciglaru;Croatia;14.5.2008.;2008-05-14;2 juv;2;Nesticidae;Nesticus;cellulanus;Nesticus cellulanus;251;46 283 906;1 606 104;tf;deep cave;462 839 061 606 104;4;;;
248;Osinec jama;Croatia;14.5.2008.;2008-05-14;1 juv;1;Nesticidae;Nesticus;cellulanus;Nesticus cellulanus;524;46 163 969;16 111 277;;deep cave;4 616 396 916 111 270;2;;;
251;Matekova špilja 1;Croatia;14.5.2008.;2008-05-14;1f, 1m;2;Linyphiidae;Diplocephalus;alpinus;Diplocephalus alpinus;;4 618 834;16 123 531;Tf;deep cave;461 883 416 123 531;2;;;
254;Hanžekova jama;Croatia;17.10.2008.;2008-10-17;1f, 2m;3;Linyphiidae;Troglohyphantes;sp. 2;Troglohyphantes sp. 2;390;46 155 463;161 171;tb;deep cave;46 155 463 161 171;5;;;
255;Hanžekova jama;Croatia;14.5.2008.;2008-05-14;6f, 1m;7;Linyphiidae;Porrhomma;egeria;Porrhomma egeria;390;46 155 463;161 171;Tf;deep cave;46 155 463 161 171;5;;;
257;Hanžekova jama;Croatia;12.5.2008.;2008-05-12;2 f;2;Linyphiidae;Troglohyphantes;sp. 2;Troglohyphantes sp. 2;390;46 155 463;161 171;tb;deep cave;46 155 463 161 171;5;;;
258;Duplja jama;Croatia;13.5.2008.;2008-05-13;1 juv m;1;Nesticidae;Nesticus;cellulanus;Nesticus cellulanus;539;46 281 676;1 599 087;;deep cave;462 816 761 599 087;2;;;
259;Duplja jama;Croatia;13.5.2008.;2008-05-13;1 m;1;Linyphiidae;Troglohyphantes;excavatus;Troglohyphantes excavatus;539;46 281 676;1 599 087;tf;deep cave;462 816 761 599 087;2;;;
261;Duplja jama;Croatia;13.5.2008.;2008-05-13;1 f;1;Linyphiidae;Troglohyphantes;excavatus;Troglohyphantes excavatus;539;46 281 676;1 599 087;tf;deep cave;462 816 761 599 087;2;;;
262;Rudnik Kraševski zviri;Croatia;14.5.2008.;2008-05-14;5m, 2f, 2 juv;9;Linyphiidae;Porrhomma;convexum;Porrhomma convexum;;46 203 313;16 109 739;Tf;deep cave;4 620 331 316 109 730;3;;;
263;Špilja u Bukevju;Croatia;14.5.2008.;2008-05-14;1 juv;1;Agelenidae;Tegenaria;sp.;Tegenaria sp.;107;46 206 924;16 143 971;;deep cave;4 620 692 416 143 970;2;;;
265;Rudnik Kraševski zviri;Croatia;14.5.2008.;2008-05-14;1 f;1;Linyphiidae;Gen.;sp. X;Gen. sp. X;;46 203 313;16 109 739;;;4 620 331 316 109 730;3;;;
266;Matekova špilja 1;Croatia;14.5.2008.;2008-05-14;1 juv;1;Dysderidae;Harpactea;sp.;Harpactea sp.;;4 618 834;16 123 531;;;461 883 416 123 531;2;;;
267;Bazgova?a;Croatia;5.1.2009.;2009-01-05;1f, 2m, 1juv;4;Linyphiidae;Palliduphantes;spelaeorum;Palliduphantes spelaeorum;;4 330 647;16 622 143;Tf;deep cave;433 064 716 622 143;3;;;7,2
270;Grap?eva špilja;Croatia;16.10.2007.;2007-10-16;1m, 2 f, 1 juv;4;Nesticidae;Kryptonesticus;eremita;Kryptonesticus eremita;200;43 134 189;16 753 732;tf;deep cave;4 313 418 916 753 730;5;;;11,1
270;Grap?eva špilja;Croatia;16.10.2007.;2007-10-16;1m, 2 f, 1 juv;4;Nesticidae;Kryptonesticus;eremita;Kryptonesticus eremita;200;43 134 189;16 753 732;tf;deep cave;4 313 418 916 753 730;5;;;15,35
271;Grap?eva špilja;Croatia;16.10.2007.;2007-10-16;1 juv;1;Agelenidae;Hadites;tegenarioides;Hadites tegenarioides;200;43 134 189;16 753 732;TB;deep cave;4 313 418 916 753 730;5;;;11,1
271;Grap?eva špilja;Croatia;16.10.2007.;2007-10-16;1 juv;1;Agelenidae;Hadites;tegenarioides;Hadites tegenarioides;200;43 134 189;16 753 732;TB;deep cave;4 313 418 916 753 730;5;;;15,35
273;Kranjica pe?ina;Croatia;13.10.2007.;2007-10-13;1 juv;1;Dysderidae;Harpactea;sp.;Harpactea sp.;820;43 959 462;16 475 197;;;4 395 946 216 475 190;2;;;
274;Grap?eva špilja;Croatia;16.10.2007.;2007-10-16;1 m, 1 juv;2;Nesticidae;Kryptonesticus;eremita;Kryptonesticus eremita;200;43 134 189;16 753 732;tf;deep cave;4 313 418 916 753 730;5;;;11,1
274;Grap?eva špilja;Croatia;16.10.2007.;2007-10-16;1 m, 1 juv;2;Nesticidae;Kryptonesticus;eremita;Kryptonesticus eremita;200;43 134 189;16 753 732;tf;deep cave;4 313 418 916 753 730;5;;;15,35
275;Zmajeva špilja;Croatia;21.7.2007.;2007-07-21;1 f;1;Agelenidae;Tegenaria;sp. 3;Tegenaria sp. 3;323;43 269 174;16 598 972;;deep cave;4 326 917 416 598 970;4;;;
276;Zmajeva špilja;Croatia;21.10.2007.;2007-10-21;2 juv;2;Agelenidae;Tegenaria;sp.;Tegenaria sp.;323;43 269 174;16 598 972;;deep cave;4 326 917 416 598 970;4;;;
277;Zmajeva špilja;Croatia;21.10.2007.;2007-10-21;1f, 3 juv;4;Amaurobidae;Amaurobius;sp. 1;Amaurobius sp. 1;;43 269 174;16 598 972;Tx;;4 326 917 416 598 970;4;;;
278;Vodena pe?a;Croatia;17.8.2005.;2005-08-17;1f;1;Linyphiidae;Troglohyphantes;dinaricus;Troglohyphantes dinaricus;610;43 792 496;16 671 447;tb;deep cave;4 379 249 616 671 440;8;;;
279;Vodena pe?a;Croatia;30.7.2007.;2007-07-30;1f;1;Linyphiidae;Troglohyphantes;dinaricus;Troglohyphantes dinaricus;610;43 792 496;16 671 447;tb;deep cave;4 379 249 616 671 440;8;;;
280;Vodena pe?a;Croatia;30.7.2007.;2007-07-30;1f, 1 m;2;Linyphiidae;Troglohyphantes;dinaricus;Troglohyphantes dinaricus;610;43 792 496;16 671 447;tb;deep cave;4 379 249 616 671 440;8;;;
281;Boži?eva špilja;Croatia;12.8.2007.;2007-08-12;2f, 1m;3;Linyphiidae;Troglohyphantes;kordunlikanus;Troglohyphantes kordunlikanus;285;45 000 041;15 776 525;tf;deep cave;4 500 004 115 776 520;7;;;10,84
282;Boži?eva špilja;Croatia;12.8.2007.;2007-08-12;2f;2;Linyphiidae;Troglohyphantes;kordunlikanus;Troglohyphantes kordunlikanus;;45 000 041;15 776 525;tf;deep cave;4 500 004 115 776 520;7;;;10,84
283;Boži?eva špilja;Croatia;12.8.2007.;2007-08-12;2f, 2 juv;4;Linyphiidae;Troglohyphantes;kordunlikanus;Troglohyphantes kordunlikanus;;45 000 041;15 776 525;tf;deep cave;4 500 004 115 776 520;7;;;10,84
284;Boži?eva špilja;Croatia;12.8.2007.;2007-08-12;1f;1;Linyphiidae;Centromerus;cavernarum;Centromerus cavernarum;;45 000 041;15 776 525;Tf;deep cave;4 500 004 115 776 520;7;;;10,84
285;Boži?eva špilja;Croatia;12.8.2007.;2007-08-12;1f;1;Linyphiidae;Troglohyphantes;kordunlikanus;Troglohyphantes kordunlikanus;;45 000 041;15 776 525;tf;deep cave;4 500 004 115 776 520;7;;;10,84
286;Boži?eva špilja;Croatia;12.8.2007.;2007-08-12;1m;1;Linyphiidae;Centromerus;cavernarum;Centromerus cavernarum;;45 000 041;15 776 525;Tf;deep cave;4 500 004 115 776 520;7;;;10,84
287;Boži?eva špilja;Croatia;12.8.2007.;2007-08-12;1m;1;Nesticidae;Nesticus;cellulanus;Nesticus cellulanus;35;45 000 041;15 776 525;tf;deep cave;4 500 004 115 776 520;7;;;10,84
291;Mikašinovi?a špilja;Croatia;7.12.2008.;2008-12-07;1 f, 1 juv;2;Linyphiidae;Troglohyphantes;croaticus;Troglohyphantes croaticus;230;45 283 788;1 528 561;Tb;deep cave;452 837 881 528 561;3;;;
294;Jastrebina špilja;Croatia;5.12.2008.;2008-12-05;1f, 3 juv;4;Linyphiidae;Centromerus;cavernarum;Centromerus cavernarum;187;45 456 129;1 544 341;Tf;deep cave;454 561 291 544 341;5;;;
295;Danetska pe?ina;Croatia;20.6.2008.;2008-06-20;1 juv m;1;Dysderidae;Dysdera;ninnii;Dysdera ninnii;160;45 351 625;15 327 998;Tx;;4 535 162 515 327 990;2;;;
296;Kuštrovka;Croatia;19.6.2008.;2008-06-19;1 juv;1;Dysderidae;Stalita;pretneri;Stalita pretneri;450;45 346 234;15 219 338;Tb;deep cave;4 534 623 415 219 330;3;;;
297;Hajdu?ka pe?ina;Croatia;17.6.2008.;2008-06-17;1 f;1;Linyphiidae;Troglohyphantes;croaticus;Troglohyphantes croaticus;;4 527 146;1 528 981;Tb;deep cave;45 271 461 528 981;3;;;
298;Hajdu?ka pe?ina;Croatia;17.6.2008.;2008-06-17;1 f;1;Dysderidae;Parastalita;stygia;Parastalita stygia;;4 527 146;1 528 981;Tb;deep cave;45 271 461 528 981;3;;;
299;Jezero;Croatia;16.3.2002.;2002-03-16;2 m;2;Linyphiidae;Troglohyphantes;troglodytes;Troglohyphantes troglodytes;903;42 580 381;18 356 073;tf;deep cave;4 258 038 118 356 070;8;;;7,567
300;Škrabuljica;Croatia;1.11.2003.;2003-11-01;1m, 1 juv;2;Linyphiidae;Troglohyphantes;troglodytes;Troglohyphantes troglodytes;685;42 567 045;18 385 063;tf;deep cave;4 256 704 518 385 060;5;;;10,867
301;Kuštrovka;Croatia;19.6.2008.;2008-06-19;6f, 1m, 1 juv;8;Linyphiidae;Troglohyphantes;croaticus;Troglohyphantes croaticus;450;45 346 234;15 219 338;Tb;deep cave;4 534 623 415 219 330;3;;;
302;Dragina pe?ina na Dobri;Croatia;18.6.2008.;2008-06-18;1 m;1;Nesticidae;Nesticus;cellulanus;Nesticus cellulanus;156;45 346 751;15 290 094;tf;deep cave;4 534 675 115 290 090;4;;;
303;Dragina pe?ina na Dobri;Croatia;18.6.2008.;2008-06-18;1 m;1;Linyphiidae;Troglohyphantes;excavatus;Troglohyphantes excavatus;156;45 346 751;15 290 094;tf;deep cave;4 534 675 115 290 090;4;;;
304;Jastrebina špilja;Croatia;14.6.2008.;2008-06-14;1m, 1 juv;2;Nesticidae;Nesticus;cellulanus;Nesticus cellulanus;187;45 456 129;1 544 341;tf;deep cave;454 561 291 544 341;5;;;
306;Bibi?ka špilja;Croatia;22.6.2008.;2008-06-22;1 f;1;Linyphiidae;Troglohyphantes;excavatus;Troglohyphantes excavatus;200;45 335 921;15 254 079;tf;deep cave;4 533 592 115 254 070;3;;;
307;Špilja u Rebi?ima;Croatia;15.6.2008.;2008-06-15;1f;1;Linyphiidae;Troglohyphantes;croaticus;Troglohyphantes croaticus;;4 532 087;15 341 565;Tb;deep cave;453 208 715 341 565;1;;;
309;Jama na Solinskom vrhu;Croatia;23.6.2008.;2008-06-23;1m, 2 juv;3;Linyphiidae;Troglohyphantes;excavatus;Troglohyphantes excavatus;;45 359 492;15 313 756;tf;deep cave;4 535 949 215 313 750;1;;;
310;Hajdu?ka pe?ina;Croatia;17.6.2008.;2008-06-17;1f;1;Linyphiidae;Troglohyphantes;croaticus;Troglohyphantes croaticus;;4 527 146;1 528 981;Tb;deep cave;45 271 461 528 981;3;;;
312;Jama na rubu;Croatia;16.6.2008.;2008-06-16;1m;1;Anapidae;Comaroma;simoni;Comaroma simoni;;45 324 782;15 284 649;tf;deep cave;4 532 478 215 284 640;3;;;
314;Jama na Solinskom vrhu;Croatia;23.6.2008.;2008-06-23;1m, 2 juv;3;Linyphiidae;Troglohyphantes;excavatus;Troglohyphantes excavatus;;45 359 492;15 313 756;tf;deep cave;4 535 949 215 313 750;1;;;
316;Špilja u kanjonu Dobre ispod Podjakši?a;Croatia;20.6.2008.;2008-06-20;1f, 1juv;2;Nesticidae;Nesticus;cellulanus;Nesticus cellulanus;473;45 348 914;15 340 795;tf;deep cave;4 534 891 415 340 790;1;;;
317;Guge?ka špilja;Croatia;17.6.2008.;2008-06-17;1f;1;Nesticidae;Kryptonesticus;eremita;Kryptonesticus eremita;265;45 270 615;1 530 004;tf;deep cave;452 706 151 530 004;1;;;
319;Jama na rubu;Croatia;16.6.2008.;2008-06-16;1f, 1 juv;2;Nesticidae;Nesticus;cellulanus;Nesticus cellulanus;214;45 324 782;15 284 649;tf;deep cave;4 532 478 215 284 640;3;;;
320;Jama na rubu;Croatia;16.6.2008.;2008-06-16;1f;1;Linyphiidae;Porrhomma;egeria;Porrhomma egeria;214;45 324 782;15 284 649;Tf;deep cave;4 532 478 215 284 640;3;;;
321;Pave?a špilja;Croatia;18.6.2008.;2008-06-18;1 m;1;Linyphiidae;Troglohyphantes;excavatus;Troglohyphantes excavatus;180;45 353 264;15 317 461;tf;deep cave;4 535 326 415 317 460;2;;;
322;Jama kod Kasuni?a;Croatia;20.6.2008.;2008-06-20;3f, 1juv;4;Linyphiidae;Troglohyphantes;excavatus;Troglohyphantes excavatus;223;45 353 478;15 312 285;tf;deep cave;4 535 347 815 312 280;2;;;
323;Jama na rubu;Croatia;16.6.2008.;2008-06-16;1m;1;Nesticidae;Nesticus;cellulanus;Nesticus cellulanus;214;45 324 782;15 284 649;tf;deep cave;4 532 478 215 284 640;3;;;
324;Dragina pe?ina na Dobri;Croatia;18.6.2008.;2008-06-18;2m, 2juv;4;Nesticidae;Nesticus;cellulanus;Nesticus cellulanus;156;45 346 751;15 290 094;tf;deep cave;4 534 675 115 290 090;4;;;
325;Kuštrovka;Croatia;27.8.2008.;2008-08-27;2m, 4 f;6;Linyphiidae;Troglohyphantes;croaticus;Troglohyphantes croaticus;450;45 346 234;15 219 338;Tb;deep cave;4 534 623 415 219 330;3;;;
326;Kuštrovka;Croatia;27.8.2008.;2008-08-27;2f, 3juv;5;Linyphiidae;Troglohyphantes;croaticus;Troglohyphantes croaticus;450;45 346 234;15 219 338;Tb;deep cave;4 534 623 415 219 330;3;;;
327;Jama u kanjonu Dobre ispod Grabrka;Croatia;26.8.2008.;2008-08-26;1f;1;Linyphiidae;Troglohyphantes;excavatus;Troglohyphantes excavatus;;45 353 879;15 299 838;tf;deep cave;4 535 387 915 299 830;3;;;
328;Lipa na Protulipi;Croatia;24.8.2008.;2008-08-24;2f, 2m;4;Linyphiidae;Porrhomma;egeria;Porrhomma egeria;135;45 406 127;15 385 848;Tf;deep cave;4 540 612 715 385 840;2;;;
329;Trijama II;Croatia;23.8.2008.;2008-08-23;1m, 2f, 1juv;4;Linyphiidae;Troglohyphantes;excavatus;Troglohyphantes excavatus;;45 364 356;15 315 804;tf;deep cave;4 536 435 615 315 800;2;;;
332;Kuštrovka;Croatia;27.8.2008.;2008-08-27;1f, 1juv;2;Linyphiidae;Troglohyphantes;croaticus;Troglohyphantes croaticus;450;45 346 234;15 219 338;Tb;deep cave;4 534 623 415 219 330;3;;;
334;Kuštrovka;Croatia;27.8.2008.;2008-08-27;4f, 2juv;6;Linyphiidae;Troglohyphantes;croaticus;Troglohyphantes croaticus;450;45 346 234;15 219 338;Tb;deep cave;4 534 623 415 219 330;3;;;
335;Jastrebina špilja;Croatia;14.6.2008.;2008-06-14;3f;3;Linyphiidae;Porrhomma;egeria;Porrhomma egeria;187;45 456 129;1 544 341;Tf;deep cave;454 561 291 544 341;5;;;
336;Jama kod Kasuni?a;Croatia;20.6.2008.;2008-06-20;1m;1;Linyphiidae;Troglohyphantes;excavatus;Troglohyphantes excavatus;223;45 353 478;15 312 285;tf;deep cave;4 535 347 815 312 280;2;;;
337;Jama kod Kasuni?a;Croatia;20.6.2008.;2008-06-20;1f, 1 juv 2;2;Linyphiidae;Porrhomma;egeria;Porrhomma egeria;223;45 353 478;15 312 285;Tf;deep cave;4 535 347 815 312 280;2;;;
339;Danetska pe?ina;Croatia;20.6.2008.;2008-06-20;1f, 1juv;2;Linyphiidae;Troglohyphantes;excavatus;Troglohyphantes excavatus;;45 351 625;15 327 998;tf;deep cave;4 535 162 515 327 990;2;;;
341;Jama kod Koli?a 2;Croatia;15.6.2008.;2008-06-15;1f, 3juv;4;Linyphiidae;Troglohyphantes;croaticus;Troglohyphantes croaticus;;45 343 306;15 316 733;Tb;deep cave;4 534 330 615 316 730;2;;;
342;Jama kod Koli?a 2;Croatia;15.6.2008.;2008-06-15;1juv m;1;Dysderidae;Parastalita;stygia;Parastalita stygia;;45 343 306;15 316 733;Tb;deep cave;4 534 330 615 316 730;2;;;
343;Jama u kanjonu Dobre ispod Grabrka;Croatia;26.8.2008.;2008-08-26;1 juv;1;Dysderidae;Parastalita;stygia;Parastalita stygia;;45 353 879;15 299 838;Tb;deep cave;4 535 387 915 299 830;3;;;
344;Kuštrovka;Croatia;27.8.2008.;2008-08-27;1m;1;Dysderidae;Stalita;pretneri;Stalita pretneri;450;45 346 234;15 219 338;Tb;deep cave;4 534 623 415 219 330;3;;;
345;Kuštrovka;Croatia;27.8.2008.;2008-08-27;1m;1;Dysderidae;Parastalita;stygia;Parastalita stygia;450;45 346 234;15 219 338;Tb;deep cave;4 534 623 415 219 330;3;;;
346;Kuštrovka;Croatia;27.8.2008.;2008-08-27;1f, 1juv;2;Dysderidae;Stalita;pretneri;Stalita pretneri;450;45 346 234;15 219 338;Tb;deep cave;4 534 623 415 219 330;3;;;
347;Kuštrovka;Croatia;27.8.2008.;2008-08-27;1f;1;Dysderidae;Parastalita;stygia;Parastalita stygia;450;45 346 234;15 219 338;Tb;deep cave;4 534 623 415 219 330;3;;;
349;Pave?a špilja;Croatia;18.6.2008.;2008-06-18;1f;1;Linyphiidae;Porrhomma;egeria;Porrhomma egeria;180;45 353 264;15 317 461;Tf;deep cave;4 535 326 415 317 460;2;;;
350;Jastrebina špilja;Croatia;14.6.2008.;2008-06-14;1m;1;Linyphiidae;Porrhomma;convexum;Porrhomma convexum;187;45 456 129;1 544 341;Tf;deep cave;454 561 291 544 341;5;;;
352;Špilja u kanjonu Bistraca kod Kromara;Croatia;25.8.2008.;2008-08-25;3f, 1juv;4;Linyphiidae;Porrhomma;convexum;Porrhomma convexum;230;45 280 604;15 289 475;Tf;deep cave;4 528 060 415 289 470;2;;;
353;Jastrebina špilja;Croatia;14.6.2008.;2008-06-14;1f, 1juv;2;Linyphiidae;Gen.;sp. X;Gen. sp. X;187;45 456 129;1 544 341;;;454 561 291 544 341;5;;;
354;Jastrebina špilja;Croatia;14.6.2008.;2008-06-14;1m;1;Linyphiidae;Centromerus;cavernarum;Centromerus cavernarum;187;45 456 129;1 544 341;Tf;deep cave;454 561 291 544 341;5;;;
355;Lipa na Protulipi;Croatia;24.8.2008.;2008-08-24;4f, 2m, 1juv;7;Linyphiidae;Porrhomma;egeria;Porrhomma egeria;135;45 406 127;15 385 848;Tf;deep cave;4 540 612 715 385 840;2;;;
357;Ledenica u ?ažinki;Croatia;15.6.2008.;2008-06-15;1m;1;Thomisidae;Xysticus;lanio;Xysticus lanio;;45 342 702;15 299 779;Tx;deep cave;4 534 270 215 299 770;2;;;
360;Vaganka;Croatia;27.9.2008.;2008-09-27;1 juv;1;Dysderidae;Parastalita;stygia;Parastalita stygia;658;4 433 853;1 543 867;Tb;deep cave;44 338 531 543 867;5;;;12,2
361;Špilja u Lužnama;Croatia;27.9.2008.;2008-09-27;1 m;1;Dysderidae;Parastalita;stygia;Parastalita stygia;629;44 328 901;15 454 175;Tb;deep cave;4 432 890 115 454 170;2;;;
362;Jama Nangilija;Croatia;29.9.2008.;2008-09-29;1 juv;1;Agelenidae;Histopona;sp.;Histopona sp.;430;44 346 542;15 385 818;;deep cave;4 434 654 215 385 810;1;;;12,2
364;Manita pe?;Croatia;1.10.2008.;2008-10-01;1 f;1;Dysderidae;Parastalita;stygia;Parastalita stygia;520;44 314 302;15 475 264;Tb;deep cave;4 431 430 215 475 260;7;;;9,8
364;Manita pe?;Croatia;1.10.2008.;2008-10-01;1 f;1;Dysderidae;Parastalita;stygia;Parastalita stygia;520;44 314 302;15 475 264;Tb;deep cave;4 431 430 215 475 260;7;;8,8;9,25
365;Jatara špilja;Croatia;26.9.2008.;2008-09-26;1 juv;1;Agelenidae;Histopona;sp.;Histopona sp.;600;44 334 974;15 446 351;;deep cave;4 433 497 415 446 350;3;;;
366;Jatara špilja;Croatia;26.9.2008.;2008-09-26;1 f;1;Agelenidae;Histopona;egonpretneri;Histopona egonpretneri;600;44 334 974;15 446 351;Tb;deep cave;4 433 497 415 446 350;3;;;
367;Jatara špilja;Croatia;26.9.2008.;2008-09-26;1f, 1 m;2;Linyphiidae;Centromerus;cavernarum;Centromerus cavernarum;;44 334 974;15 446 351;Tf;deep cave;4 433 497 415 446 350;3;;;
368;Vaganka;Croatia;27.9.2008.;2008-09-27;1 juv;1;Agelenidae;Histopona;sp.;Histopona sp.;658;4 433 853;1 543 867;;deep cave;44 338 531 543 867;5;;;12,2
370;Vaganka;Croatia;27.9.2008.;2008-09-27;1f;1;Dysderidae;Mesostalita;sp. 3;Mesostalita sp. 3;658;4 433 853;1 543 867;Tb;deep cave;44 338 531 543 867;5;;;12,2
371;Vaganka;Croatia;27.9.2008.;2008-09-27;1 juv;1;Agelenidae;Histopona;sp.;Histopona sp.;658;4 433 853;1 543 867;;deep cave;44 338 531 543 867;5;;;12,2
372;Vaganka;Croatia;27.9.2008.;2008-09-27;1 f;1;Leptonetidae;Cataleptoneta;lingulata;Cataleptoneta lingulata;658;4 433 853;1 543 867;tb;deep cave;44 338 531 543 867;5;;;12,2
375;Lažnjakuša lajava;Croatia;30.9.2008.;2008-09-30;2 juv;2;Agelenidae;Histopona;sp.;Histopona sp.;654;44 333 719;15 451 152;;deep cave;4 433 371 915 451 150;1;;;
383;Strmoglavica;Croatia;29.9.2008.;2008-09-29;1f;1;Leptonetidae;Cataleptoneta;lingulata;Cataleptoneta lingulata;;44 346 729;15 386 425;tb;deep cave;4 434 672 915 386 420;1;;;
385;Špilja pod pekon;Croatia;28.9.2008.;2008-09-28;1 juv;1;Agelenidae;Histopona;sp.;Histopona sp.;731;44 337 685;1 542 639;;deep cave;443 376 851 542 639;1;;;
386;Jama pod kukom;Croatia;28.9.2008.;2008-09-28;1 f;1;Linyphiidae;Porrhomma;convexum;Porrhomma convexum;;44 346 245;15 414 066;;deep cave;4 434 624 515 414 060;1;;;
387;Ledenica u ?ažinki;Croatia;15.6.2008.;2008-06-15;1 m;1;Linyphiidae;Troglohyphantes;croaticus;Troglohyphantes croaticus;;45 342 702;15 299 779;Tb;deep cave;4 534 270 215 299 770;2;;;
388;Izvor špilja Bijeli bunar;Croatia;18.7.2004.;2004-07-18;1 f;1;Linyphiidae;Porrhomma;convexum;Porrhomma convexum;;45 609 794;17 536 299;;deep cave;4 560 979 417 536 290;2;;;11,6
389;Izvor špilja Bijeli bunar;Croatia;18.7.2004.;2004-07-18;1 juv;1;Nesticidae;Nesticus;cellulanus;Nesticus cellulanus;;45 609 794;17 536 299;;deep cave;4 560 979 417 536 290;2;;;11,6
390;Kosilova jama;Croatia;15.9.2005.;2005-09-15;1m, 2 juv;3;Linyphiidae;Troglohyphantes;wiebesi;Troglohyphantes wiebesi;;44 105 772;16 347 082;tb;deep cave;4 410 577 216 347 080;1;;;
391;Kotluša;Croatia;13.8.2005.;2005-08-13;1 f;1;Nesticidae;Kryptonesticus;eremita;Kryptonesticus eremita;390;43 949 126;16 399 081;tf;deep cave;4 394 912 616 399 080;1;;;11,7
392;Gospodska špilja;Croatia;21.8.2004.;2004-08-21;1 juv;1;Nesticidae;Kryptonesticus;eremita;Kryptonesticus eremita;440;43 982 279;16 432 905;tf;deep cave;4 398 227 916 432 900;1;;;10,45
394;Rudeli?a pe?ina;Croatia;15.8.2005.;2005-08-15;1 juv m;1;Nesticidae;Kryptonesticus;eremita;Kryptonesticus eremita;;43 970 543;16 418 533;tf;deep cave;4 397 054 316 418 530;2;;;
395;Rudeli?a pe?ina;Croatia;22.8.2004.;2004-08-22;1 juv m, 3 juv;4;Nesticidae;Kryptonesticus;eremita;Kryptonesticus eremita;;43 970 543;16 418 533;tf;deep cave;4 397 054 316 418 530;2;;;
396;Rudeli?a pe?ina;Croatia;22.8.2004.;2004-08-22;1m, 1f, 2 juv;4;Theridiidae;Episinus;cavernicola;Episinus cavernicola;;43 970 543;16 418 533;Tf;deep cave;4 397 054 316 418 530;2;;;
397;Budin pupak;Croatia;22.7.2003.;2003-07-22;1 f;1;Linyphiidae;Troglohyphantes;sp. 3;Troglohyphantes sp. 3;;44 739 729;15 089 755;tb;deep cave;4 473 972 915 089 750;2;;;
398;Vodena pe?a;Croatia;31.1.2002.;2002-01-31;1 f;1;Nesticidae;Kryptonesticus;eremita;Kryptonesticus eremita;610;43 792 496;16 671 447;tf;deep cave;4 379 249 616 671 440;8;;;
402;Vodena pe?a;Croatia;31.1.2002.;2002-01-31;1 f;1;Linyphiidae;Centromerus;cavernarum;Centromerus cavernarum;610;43 792 496;16 671 447;Tf;deep cave;4 379 249 616 671 440;8;;;
403;Vodena pe?a;Croatia;17.8.2005.;2005-08-17;1f;1;Linyphiidae;Centromerus;cavernarum;Centromerus cavernarum;610;43 792 496;16 671 447;Tf;deep cave;4 379 249 616 671 440;8;;;
406;Vodena pe?a;Croatia;17.8.2005.;2005-08-17;1f, 2 juv, 2 juv m;5;Nesticidae;Kryptonesticus;eremita;Kryptonesticus eremita;610;43 792 496;16 671 447;tf;deep cave;4 379 249 616 671 440;8;;;
407;Vodena pe?a;Croatia;17.8.2005.;2005-08-17;1 m;1;Nesticidae;Kryptonesticus;eremita;Kryptonesticus eremita;610;43 792 496;16 671 447;tf;deep cave;4 379 249 616 671 440;8;;;
408;Vodena pe?a;Croatia;4.2.2006.;2006-02-04;1m, 1 f;2;Nesticidae;Kryptonesticus;eremita;Kryptonesticus eremita;610;43 792 496;16 671 447;tf;deep cave;4 379 249 616 671 440;8;;;
410;Vodena pe?a;Croatia;4.2.2006.;2006-02-04;2 juv;2;Dysderidae;Stalagtia;sp. 4;Stalagtia sp. 4;610;43 792 496;16 671 447;Tb;deep cave;4 379 249 616 671 440;8;;;
411;Vodena pe?a;Croatia;4.2.2006.;2006-02-04;1 juv;1;Dysderidae;Stalagtia;sp. 4;Stalagtia sp. 4;610;43 792 496;16 671 447;Tb;deep cave;4 379 249 616 671 440;8;;;
412;Kravarica;Croatia;25.1.2008.;2008-01-25;1 f;1;Dysderidae;Stalagtia;sp. 4;Stalagtia sp. 4;;43 779 322;16 688 191;Tb;deep cave;4 377 932 216 688 190;3;;;
413;Krsta?ka jama;Croatia;22.7.2007.;2007-07-22;1m;1;Dysderidae;Harpactea;sp. 18;Harpactea sp. 18;;43 840 788;16 638 797;Tf;deep cave;4 384 078 816 638 790;2;;;
414;Jama na Suhom Ruminu;Croatia;27.7.2007.;2007-07-27;1m, 3 juv;4;Nesticidae;Kryptonesticus;eremita;Kryptonesticus eremita;391;43 782 202;16 645 051;tf;deep cave;4 378 220 216 645 050;1;;;
415;Jama na Suhom Ruminu;Croatia;28.7.2007.;2007-07-28;4 m;4;Nesticidae;Kryptonesticus;eremita;Kryptonesticus eremita;391;43 782 202;16 645 051;tf;deep cave;4 378 220 216 645 050;1;;;
416;Krsta?ka jama;Croatia;22.7.2007.;2007-07-22;1 m;1;Pholcidae;Pholcus;sp.;Pholcus sp.;;43 840 788;16 638 797;;;4 384 078 816 638 790;2;;;
420;Žablja jama;Croatia;27.6.2009.;2009-06-27;2f, 3 juv;5;Dysderidae;Stalagtia;sp. 4;Stalagtia sp. 4;;43 791 308;16 666 362;Tb;deep cave;4 379 130 816 666 360;2;;;
421;Žablja jama;Croatia;27.6.2009.;2009-06-27;1 juv;1;Scytodidae;Scytodes;sp.;Scytodes sp.;;43 791 308;16 666 362;;;4 379 130 816 666 360;2;;;
424;Jama pastirski stan;Croatia;4.8.2009.;2009-08-04;1juv;1;Dysderidae;Stalagtia;sp. 4;Stalagtia sp. 4;;43 841 966;16 648 348;Tb;deep cave;4 384 196 616 648 340;1;;;
425;Pti?arka;Croatia;29.6.2009.;2009-06-29;1 f;1;Linyphiidae;Porrhomma;convexum;Porrhomma convexum;;43 855 242;16 622 618;;deep cave;4 385 524 216 622 610;1;;;
426;Highlander;Croatia;3.8.2009.;2009-08-03;1 juv;1;Agelenidae;Tegenaria;sp.;Tegenaria sp.;927;43 845 735;16 653 759;;deep cave;4 384 573 516 653 750;2;;;
427;Highlander;Croatia;3.8.2009.;2009-08-03;1 m;1;Linyphiidae;Gen.;sp. X;Gen. sp. X;;43 845 735;16 653 759;;;4 384 573 516 653 750;2;;;
428;Gvozdenica;Croatia;13.2.2009.;2009-02-13;1f, 1 juv;2;Nesticidae;Nesticus;cellulanus;Nesticus cellulanus;200;45 299 765;15 589 405;tf;deep cave;4 529 976 515 589 400;4;;;8,7
429;Gvozdenica;Croatia;13.2.2009.;2009-02-13;1 m;1;Linyphiidae;Troglohyphantes;kordunlikanus;Troglohyphantes kordunlikanus;;45 299 765;15 589 405;tf;deep cave;4 529 976 515 589 400;4;;;8,7
430;Kuštrovka;Croatia;14.2.2009.;2009-02-14;2f;2;Linyphiidae;Troglohyphantes;croaticus;Troglohyphantes croaticus;450;45 346 234;15 219 338;Tb;deep cave;4 534 623 415 219 330;3;;;
431;Kuštrovka;Croatia;14.2.2009.;2009-02-14;1f;1;Linyphiidae;Troglohyphantes;croaticus;Troglohyphantes croaticus;450;45 346 234;15 219 338;Tb;deep cave;4 534 623 415 219 330;3;;;
433;Gvozdenica;Croatia;13.2.2009.;2009-02-13;1 f;1;Linyphiidae;Centromerus;cavernarum;Centromerus cavernarum;;45 299 765;15 589 405;Tf;deep cave;4 529 976 515 589 400;4;;;8,7
434;Luška špilja;Croatia;8.9.2009.;2009-09-08;1 f;1;Linyphiidae;Troglohyphantes;croaticus;Troglohyphantes croaticus;620;45 224 689;15 093 741;Tb;deep cave;4 522 468 915 093 740;2;;;
435;Luška špilja;Croatia;9.9.2009.;2009-09-09;1 f;1;Linyphiidae;Troglohyphantes;croaticus;Troglohyphantes croaticus;620;45 224 689;15 093 741;Tb;deep cave;4 522 468 915 093 740;2;;;
436;Mandelaja;Croatia;10.9.2009.;2009-09-10;2f;2;Linyphiidae;Troglohyphantes;croaticus;Troglohyphantes croaticus;340;45 233 397;1 530 015;Tb;deep cave;452 333 971 530 015;7;;;
438;?ulin ponor-Medvedica;Croatia;5.9.2009.;2009-09-05;1m, 1f;2;Linyphiidae;Porrhomma;convexum;Porrhomma convexum;320;45 267 036;15 223 745;Tf;deep cave;4 526 703 615 223 740;3;;;
439;?ulin ponor-Medvedica;Croatia;5.9.2009.;2009-09-05;1f;1;Linyphiidae;Porrhomma;egeria;Porrhomma egeria;320;45 267 036;15 223 745;Tf;deep cave;4 526 703 615 223 740;3;;;
440;Ponor Sušik;Croatia;8.9.2009.;2009-09-08;2f;2;Linyphiidae;Porrhomma;convexum;Porrhomma convexum;470;45 145 514;15 538 934;Tf;deep cave;4 514 551 415 538 930;4;;;9,6
441;Ponor Sušik;Croatia;8.9.2009.;2009-09-08;2f;2;Linyphiidae;Porrhomma;egeria;Porrhomma egeria;470;45 145 514;15 538 934;Tf;deep cave;4 514 551 415 538 930;4;;;9,6
442;Ambarac;Croatia;7.9.2009.;2009-09-07;2m, 6f;8;Linyphiidae;Porrhomma;convexum;Porrhomma convexum;;45 231 783;15 306 426;Tf;deep cave;4 523 178 315 306 420;1;;;
443;Tounj?ica;Croatia;15.2.2009.;2009-02-15;1f;1;Nesticidae;Nesticus;cellulanus;Nesticus cellulanus;230;45 248 722;15 322 408;tf;deep cave;4 524 872 215 322 400;5;;;14
444;Tounj?ica;Croatia;15.2.2009.;2009-02-15;1f;1;Linyphiidae;Troglohyphantes;croaticus;Troglohyphantes croaticus;;45 248 722;15 322 408;Tb;deep cave;4 524 872 215 322 400;5;;;14
445;Tounj?ica;Croatia;15.2.2009.;2009-02-15;1 m;1;Tetragnathidae;Meta;menardi;Meta menardi;;45 248 722;15 322 408;tf;deep cave;4 524 872 215 322 400;5;;;14
447;Vreli? špilja;Croatia;12.9.2009.;2009-09-12;1f;1;Linyphiidae;Porrhomma;egeria;Porrhomma egeria;180;45 311 898;15 351 451;Tf;deep cave;4 531 189 815 351 450;3;;;
448;Vidovi?a špilja;Croatia;8.9.2009.;2009-09-08;2f;2;Linyphiidae;Troglohyphantes;croaticus;Troglohyphantes croaticus;463;4 514 975;150 993;Tb;deep cave;4 514 975 150 993;2;;;
449;Lištrovica jama;Croatia;9.9.2009.;2009-09-09;3f, 3m;6;Linyphiidae;Troglohyphantes;croaticus;Troglohyphantes croaticus;;4 520 141;1 512 398;Tb;deep cave;45 201 411 512 398;2;;;
451;Zvone?ka II;Croatia;17.9.2009.;2009-09-17;1f;1;Dysderidae;Parastalita;stygia;Parastalita stygia;;45 531 095;15 367 671;Tb;deep cave;4 553 109 515 367 670;3;;;
452;Špilja pod Ma?kovom dragom;Croatia;9.9.2009.;2009-09-09;1 juv m;1;Dysderidae;Parastalita;stygia;Parastalita stygia;;45 261 001;15 023 822;Tb;deep cave;4 526 100 115 023 820;1;;;7,4
453;Špilja pod Ma?kovom dragom;Croatia;17.5.2009.;2009-05-17;2m;2;Dysderidae;Parastalita;stygia;Parastalita stygia;;45 261 001;15 023 822;Tb;deep cave;4 526 100 115 023 820;1;;;7,4
454;Rokina Bezdana;Croatia;7.9.2009.;2009-09-07;1f;1;Dysderidae;Parastalita;stygia;Parastalita stygia;;45 069 717;15 192 231;Tb;deep cave;4 506 971 715 192 230;1;;;
455;Luška špilja;Croatia;8.9.2009.;2009-09-08;1f;1;Dysderidae;Parastalita;stygia;Parastalita stygia;620;45 224 689;15 093 741;Tb;deep cave;4 522 468 915 093 740;2;;;
456;Mandelaja;Croatia;10.9.2009.;2009-09-10;1m;1;Dysderidae;Parastalita;stygia;Parastalita stygia;;45 233 397;1 530 015;Tb;deep cave;452 333 971 530 015;7;;;
457;Vidovi?a špilja;Croatia;8.9.2009.;2009-09-08;1m;1;Dysderidae;Parastalita;stygia;Parastalita stygia;;4 514 975;150 993;Tb;deep cave;4 514 975 150 993;2;;;
458;Vreli? špilja;Croatia;12.9.2009.;2009-09-12;1 juv;1;Dysderidae;Stalita;pretneri;Stalita pretneri;180;45 311 898;15 351 451;Tb;deep cave;4 531 189 815 351 450;3;;;
459;Tamnica;Croatia;12.3.2009.;2009-03-12;1m, 1f;2;Dysderidae;Parastalita;stygia;Parastalita stygia;;4 527 298;1 536 197;Tb;deep cave;45 272 981 536 197;3;;;
460;Rokina Bezdana;Croatia;7.9.2009.;2009-09-07;1m;1;Dysderidae;Parastalita;stygia;Parastalita stygia;;45 069 717;15 192 231;Tb;deep cave;4 506 971 715 192 230;1;;;
461;Lištrovica jama;Croatia;9.9.2009.;2009-09-09;1m, 2f;3;Dysderidae;Parastalita;stygia;Parastalita stygia;;4 520 141;1 512 398;Tb;deep cave;45 201 411 512 398;2;;;
462;Lištrovica jama;Croatia;14.6.2009.;2009-06-14;1f, 1 m;2;Dysderidae;Parastalita;stygia;Parastalita stygia;;4 520 141;1 512 398;Tb;deep cave;45 201 411 512 398;2;;;
463;Špilja pod Ma?kovom dragom;Croatia;14.6.2009.;2009-06-14;1m, 2f;3;Dysderidae;Parastalita;stygia;Parastalita stygia;;45 261 001;15 023 822;Tb;deep cave;4 526 100 115 023 820;1;;;7,4
464;Špilja pod Ma?kovom dragom;Croatia;14.6.2009.;2009-06-14;1m;1;Dysderidae;Parastalita;stygia;Parastalita stygia;;45 261 001;15 023 822;Tb;deep cave;4 526 100 115 023 820;1;;;7,4
465;Jama u kanjonu Dobre ispod Grabrka;Croatia;6.9.2009.;2009-09-06;1f;1;Dysderidae;Parastalita;stygia;Parastalita stygia;;45 353 879;15 299 838;Tb;deep cave;4 535 387 915 299 830;3;;;
467;Hajdu?ka pe?ina;Croatia;10.5.2009.;2009-05-10;1 juv;1;Dysderidae;Stalita;pretneri;Stalita pretneri;;4 527 146;1 528 981;Tb;deep cave;45 271 461 528 981;3;;;
468;Trijama II;Croatia;24.5.2009.;2009-05-24;1 juv m;1;Dysderidae;Stalita;pretneri;Stalita pretneri;;45 364 356;15 315 804;Tb;deep cave;4 536 435 615 315 800;2;;;
469;Trijama II;Croatia;24.5.2009.;2009-05-24;2f, 2 juv;4;Linyphiidae;Troglohyphantes;excavatus;Troglohyphantes excavatus;;45 364 356;15 315 804;tf;deep cave;4 536 435 615 315 800;2;;;
470;Dragina pe?ina na Dobri;Croatia;3.10.2009.;2009-10-03;1m, 2f;3;Nesticidae;Nesticus;cellulanus;Nesticus cellulanus;156;45 346 751;15 290 094;tf;deep cave;4 534 675 115 290 090;4;;;
471;Izvor špilja kod Trošmarije;Croatia;10.5.2009.;2009-05-10;1m, 2 juv;3;Nesticidae;Nesticus;cellulanus;Nesticus cellulanus;175;45 318 215;15 272 614;tf;deep cave;4 531 821 515 272 610;1;;;
473;Hajdu?ka pe?ina;Croatia;10.5.2009.;2009-05-10;1f;1;Linyphiidae;Troglohyphantes;croaticus;Troglohyphantes croaticus;;4 527 146;1 528 981;Tb;deep cave;45 271 461 528 981;3;;;
474;Kuštrovka;Croatia;12.5.2009.;2009-05-12;2m, 4f, 2juv;8;Linyphiidae;Troglohyphantes;croaticus;Troglohyphantes croaticus;450;45 346 234;15 219 338;Tb;deep cave;4 534 623 415 219 330;3;;;
475;Kuštrovka;Croatia;12.5.2009.;2009-05-12;2f;2;Dysderidae;Stalita;pretneri;Stalita pretneri;450;45 346 234;15 219 338;Tb;deep cave;4 534 623 415 219 330;3;;;
477;Hajdu?ka pe?ina;Croatia;13.5.2009.;2009-05-13;1f;1;Linyphiidae;Troglohyphantes;croaticus;Troglohyphantes croaticus;;4 527 146;1 528 981;Tb;deep cave;45 271 461 528 981;3;;;
478;Jama kod Koli?a 2;Croatia;13.5.2009.;2009-05-13;1f;1;Linyphiidae;Troglohyphantes;croaticus;Troglohyphantes croaticus;;45 343 306;15 316 733;Tb;deep cave;4 534 330 615 316 730;2;;;
479;Jama 3;Croatia;14.5.2009.;2009-05-14;2m, 2f;4;Linyphiidae;Porrhomma;egeria;Porrhomma egeria;335;45 346 666;15 242 214;Tf;deep cave;4 534 666 615 242 210;2;;;
480;Jama 3;Croatia;14.5.2009.;2009-05-14;1f, 1m, 3juv;5;Linyphiidae;Troglohyphantes;croaticus;Troglohyphantes croaticus;335;45 346 666;15 242 214;Tb;deep cave;4 534 666 615 242 210;2;;;
481;Pe?ina pod Pe?anima;Croatia;13.5.2009.;2009-05-13;1f;1;Linyphiidae;Troglohyphantes;kordunlikanus;Troglohyphantes kordunlikanus;;45 350 909;15 326 449;tf;deep cave;4 535 090 915 326 440;2;;;
482;Jama kod Koli?a 2;Croatia;9.5.2009.;2009-05-09;2f, 1 juv m;3;Linyphiidae;Troglohyphantes;croaticus;Troglohyphantes croaticus;;45 343 306;15 316 733;Tb;deep cave;4 534 330 615 316 730;2;;;
484;Jama kod Koli?a 2;Croatia;13.5.2009.;2009-05-13;2m, 2f, 3 juv;7;Linyphiidae;Troglohyphantes;croaticus;Troglohyphantes croaticus;;45 343 306;15 316 733;Tb;deep cave;4 534 330 615 316 730;2;;;
485;Vodena jama;Croatia;10.5.2009.;2009-05-10;1f;1;Linyphiidae;Troglohyphantes;excavatus;Troglohyphantes excavatus;;4 533 849;15 326 748;tf;deep cave;453 384 915 326 748;2;;;
486;Vodena jama;Croatia;9.5.2009.;2009-05-09;1m;1;Linyphiidae;Troglohyphantes;excavatus;Troglohyphantes excavatus;;4 533 849;15 326 748;tf;deep cave;453 384 915 326 748;2;;;
487;Jama u kanjonu Dobre ispod Grabrka;Croatia;24.5.2009.;2009-05-24;1f;1;Linyphiidae;Troglohyphantes;excavatus;Troglohyphantes excavatus;;45 353 879;15 299 838;tf;deep cave;4 535 387 915 299 830;3;;;
488;Vreli? špilja;Croatia;11.5.2009.;2009-05-11;1f;1;Linyphiidae;Troglohyphantes;kordunlikanus;Troglohyphantes kordunlikanus;180;45 311 898;15 351 451;tf;deep cave;4 531 189 815 351 450;3;;;
489;Pe?ina pod Pe?anima;Croatia;13.5.2009.;2009-05-13;1f;1;Linyphiidae;Troglohyphantes;croaticus;Troglohyphantes croaticus;;45 350 909;15 326 449;Tb;deep cave;4 535 090 915 326 440;2;;;
490;Sušica ponor;Croatia;11.5.2009.;2009-05-11;1f;1;Linyphiidae;Porrhomma;convexum;Porrhomma convexum;;453 156;15 344 255;Tf;deep cave;45 315 615 344 255;2;;;
491;Jama u kanjonu Dobre ispod Grabrka;Croatia;12.5.2009.;2009-05-12;1f;1;Linyphiidae;Troglohyphantes;excavatus;Troglohyphantes excavatus;;45 353 879;15 299 838;tf;deep cave;4 535 387 915 299 830;3;;;
492;Sušica ponor;Croatia;11.5.2009.;2009-05-11;1f;1;Linyphiidae;Porrhomma;convexum;Porrhomma convexum;;453 156;15 344 255;Tf;deep cave;45 315 615 344 255;2;;;
493;Vreli? špilja;Croatia;11.5.2009.;2009-05-11;1m;1;Linyphiidae;Porrhomma;egeria;Porrhomma egeria;180;45 311 898;15 351 451;Tf;deep cave;4 531 189 815 351 450;3;;;
495;Trijama II;Croatia;23.8.2009.;2009-08-23;1m, 1juv m;2;Linyphiidae;Troglohyphantes;excavatus;Troglohyphantes excavatus;;45 364 356;15 315 804;tf;deep cave;4 536 435 615 315 800;2;;;
498;Trijama II;Croatia;12.5.2009.;2009-05-12;1m, 4 juv;5;Linyphiidae;Troglohyphantes;excavatus;Troglohyphantes excavatus;;45 364 356;15 315 804;tf;deep cave;4 536 435 615 315 800;2;;;
499;Jama na Bertiji 1;Croatia;14.5.2009.;2009-05-14;1m, 2 juv;3;Linyphiidae;Troglohyphantes;croaticus;Troglohyphantes croaticus;;45 347 083;15 249 043;Tb;deep cave;4 534 708 315 249 040;1;;;
500;Sušica ponor;Croatia;11.5.2009.;2009-05-11;1m;1;Linyphiidae;Porrhomma;convexum;Porrhomma convexum;;453 156;15 344 255;Tf;deep cave;45 315 615 344 255;2;;;
501;Jama na Bertiji 2;Croatia;14.5.2009.;2009-05-14;2f;2;Linyphiidae;Troglohyphantes;croaticus;Troglohyphantes croaticus;;45 347 147;15 248 737;Tb;deep cave;4 534 714 715 248 730;1;;;
502;Jama na Bertiji 2;Croatia;14.5.2009.;2009-05-14;2f;2;Linyphiidae;Troglohyphantes;croaticus;Troglohyphantes croaticus;;45 347 147;15 248 737;Tb;deep cave;4 534 714 715 248 730;1;;;
503;Šutova?ka špilja;Croatia;10.5.2009.;2009-05-10;4f;4;Linyphiidae;Troglohyphantes;croaticus;Troglohyphantes croaticus;;45 313 742;15 269 264;Tb;deep cave;4 531 374 215 269 260;1;;;
504;Sušica ponor;Croatia;11.5.2009.;2009-05-11;4f, 1m, 1juv;6;Linyphiidae;Porrhomma;convexum;Porrhomma convexum;;453 156;15 344 255;Tf;deep cave;45 315 615 344 255;2;;;
505;Sušica ponor;Croatia;11.5.2009.;2009-05-11;2f;2;Linyphiidae;Troglohyphantes;excavatus;Troglohyphantes excavatus;;453 156;15 344 255;tf;deep cave;45 315 615 344 255;2;;;
506;Lipa na Protulipi;Croatia;24.5.2009.;2009-05-24;1m;1;Nesticidae;Nesticus;cellulanus;Nesticus cellulanus;135;45 406 127;15 385 848;tf;deep cave;4 540 612 715 385 840;2;;;
508;Vodena jama;Croatia;9.5.2009.;2009-05-09;1m;1;Hahniidae;Gen. 1;sp. 1;Gen. 1 sp. 1;;4 533 849;15 326 748;;;453 384 915 326 748;2;;;
510;Vilina špilja-Izvor Omble;Croatia;22.6.2009.;2009-06-22;1juv? Osušen;1;Dysderidae;Stalagtia;sp. 2;Stalagtia sp. 2;137;4 267 716;18 136 236;Tb;deep cave;426 771 618 136 236;5;;;
513;Vilinska špilja;Croatia;23.6.2009.;2009-06-23;1juv;1;Dysderidae;Stalagtia;hercegovinensis;Stalagtia hercegovinensis;;42 797 852;17 922 663;Tb;deep cave;4 279 785 217 922 660;2;;;
514;Vilina špilja-Izvor Omble;Croatia;22.6.2009.;2009-06-22;4f, 4 juv;8;Leptonetidae;Sulcia;sp. 2;Sulcia sp. 2;137;4 267 716;18 136 236;Tb;deep cave;426 771 618 136 236;5;;;
515;Vilina špilja-Izvor Omble;Croatia;22.6.2009.;2009-06-22;1 juv;1;Agelenidae;Histopona;sp.;Histopona sp.;137;4 267 716;18 136 236;;deep cave;426 771 618 136 236;5;;;
516;Vilina špilja-Izvor Omble;Croatia;22.6.2009.;2009-06-22;1 juv;1;Dysderidae;Stalagtia;sp. 2;Stalagtia sp. 2;137;4 267 716;18 136 236;Tb;deep cave;426 771 618 136 236;5;;;
517;Vilina špilja-Izvor Omble;Croatia;22.6.2009.;2009-06-22;4f, 2m, 2 juv;8;Leptonetidae;Sulcia;sp. 2;Sulcia sp. 2;137;4 267 716;18 136 236;Tb;deep cave;426 771 618 136 236;5;;;
518;Vilina špilja-Izvor Omble;Croatia;22.6.2009.;2009-06-22;3 juv;3;Agelenidae;Histopona;sp.;Histopona sp.;137;4 267 716;18 136 236;;deep cave;426 771 618 136 236;5;;;
519;Kukova pe?;Croatia;8.10.2009.;2009-10-08;2 juv;2;Agelenidae;Histopona;sp.;Histopona sp.;274;42 726 992;1 796 566;;deep cave;427 269 921 796 566;5;;17;16,6
520;Kukova pe?;Croatia;8.10.2009.;2009-10-08;1f, 1m;2;Linyphiidae;Agyneta;sp.;Agyneta sp.;;42 726 992;1 796 566;;;427 269 921 796 566;5;;17;16,6
521;Kukova pe?;Croatia;8.10.2009.;2009-10-08;1m, 4 juv/f;5;Dysderidae;Stalagtia;hercegovinensis;Stalagtia hercegovinensis;;42 726 992;1 796 566;Tb;deep cave;427 269 921 796 566;5;;17;16,6
522;Špilja za Groma?kom vlakom;Croatia;6.9.2006.;2006-09-06;1juv m, 2 juv;3;Dysderidae;Stalagtia;hercegovinensis;Stalagtia hercegovinensis;605;42 743 509;18 027 359;Tb;deep cave;4 274 350 918 027 350;15;;;13,378
523;Špilja za Groma?kom vlakom;Croatia;6.9.2006.;2006-09-06;1 juv;1;Agelenidae;Histopona;sp.;Histopona sp.;605;42 743 509;18 027 359;;deep cave;4 274 350 918 027 350;15;;;13,378
524;Jama pod Sinji kuk;Croatia;10.10.2009.;2009-10-10;3m, 1f, 1 juv;5;Leptonetidae;Gen. 1;sp. 1;Gen. 1 sp. 1;295;42 709 828;17 988 632;Tb;deep cave;4 270 982 817 988 630;5;;;16,2
525;Jama pod Sinji kuk;Croatia;10.10.2009.;2009-10-10;1f;1;Dysderidae;Stalagtia;hercegovinensis;Stalagtia hercegovinensis;;42 709 828;17 988 632;Tb;deep cave;4 270 982 817 988 630;5;;;16,2
526;Špilja na vrh Kr?evina;Croatia;9.10.2009.;2009-10-09;1 juv;1;Dysderidae;Stalagtia;hercegovinensis;Stalagtia hercegovinensis;;42 717 692;18 006 249;Tb;deep cave;4 271 769 218 006 240;2;;16,5;17,75
527;Špilja ispod Krsta;Croatia;6.10.2009.;2009-10-06;2 juv;2;Nesticidae;Kryptonesticus;eremita;Kryptonesticus eremita;;42 677 813;18 063 701;;deep cave;4 267 781 318 063 700;2;;;
528;Špilja ispod Krsta;Croatia;6.10.2009.;2009-10-06;1 juv;1;Dysderidae;Stalagtia;sp. 2;Stalagtia sp. 2;;42 677 813;18 063 701;Tb;deep cave;4 267 781 318 063 700;2;;;
529;Špilja na vrh Kr?evina;Croatia;9.10.2009.;2009-10-09;1 juv;1;Nesticidae;Kryptonesticus;eremita;Kryptonesticus eremita;;42 717 692;18 006 249;;deep cave;4 271 769 218 006 240;2;;16,5;17,75
530;Špilja na vrh Kr?evina;Croatia;9.10.2009.;2009-10-09;1f, 2juv;3;Dysderidae;Stalagtia;hercegovinensis;Stalagtia hercegovinensis;;42 717 692;18 006 249;Tb;deep cave;4 271 769 218 006 240;2;;16,5;17,75
531;Vitkova?a jama;Croatia;25.6.2009.;2009-06-25;1 juv;1;Dysderidae;Stalagtia;hercegovinensis;Stalagtia hercegovinensis;;42 752 378;1 794 736;Tb;deep cave;427 523 781 794 736;1;;;
533;Kukova pe?;Croatia;7.10.2009.;2009-10-07;1 juv;1;Agelenidae;Histopona;sp.;Histopona sp.;;42 726 992;1 796 566;;deep cave;427 269 921 796 566;5;;17;16,6
534;Kukova pe?;Croatia;7.10.2009.;2009-10-07;1f, 1juv m;2;Linyphiidae;Agyneta;sp.;Agyneta sp.;;42 726 992;1 796 566;;;427 269 921 796 566;5;;17;16,6
535;Pasja jama, Brse?ine;Croatia;7.10.2009.;2009-10-07;1?;;Orthognatha;Gen.;sp.;Gen. sp.;;42 731 152;17 965 877;;;4 273 115 217 965 870;4;;;
536;Pasja jama, Brse?ine;Croatia;7.10.2009.;2009-10-07;3 juv;3;Dysderidae;Stalagtia;hercegovinensis;Stalagtia hercegovinensis;;42 731 152;17 965 877;Tb;deep cave;4 273 115 217 965 870;4;;;
538;Pasja jama, Brse?ine;Croatia;7.10.2009.;2009-10-07;2f;2;Linyphiidae;Gen.;sp. X;Gen. sp. X;;42 731 152;17 965 877;;;4 273 115 217 965 870;4;;;
539;Pasja jama, Brse?ine;Croatia;7.10.2009.;2009-10-07;1 juv;1;Dysderidae;Dysdera;sp.;Dysdera sp.;;42 731 152;17 965 877;Tx;;4 273 115 217 965 870;4;;;
540;Zadiljke jama;Croatia;4.10.2009.;2009-10-04;1f;1;Linyphiidae;Troglohyphantes;hadzii;Troglohyphantes hadzii;;42 768 482;1 796 906;tf;deep cave;427 684 821 796 906;1;;;
542;Sumpora?a velika;Croatia;7.10.2009.;2009-10-07;2 juv;2;Nesticidae;Kryptonesticus;eremita;Kryptonesticus eremita;;42 673 168;18 089 354;tf;deep cave;4 267 316 818 089 350;5;;;
543;Sumpora?a velika;Croatia;7.10.2009.;2009-10-07;1 juv;1;Pholcidae;Pholcus;sp.;Pholcus sp.;;42 673 168;18 089 354;;;4 267 316 818 089 350;5;;;
544;Jama na Zovi do;Croatia;4.10.2009.;2009-10-04;1 juv;1;Pholcidae;Pholcus;sp.;Pholcus sp.;;42 758 221;1 797 901;;;427 582 211 797 901;3;;;
545;Jama na Zovi do;Croatia;4.10.2009.;2009-10-04;1m, 3f, 2 juv;6;Linyphiidae;Troglohyphantes;hadzii;Troglohyphantes hadzii;;42 758 221;1 797 901;tf;deep cave;427 582 211 797 901;3;;;
546;Jama na Zovi do;Croatia;4.10.2009.;2009-10-04;2f, 1m;3;Linyphiidae;Gen.;sp. X;Gen. sp. X;;42 758 221;1 797 901;;;427 582 211 797 901;3;;;
547;Pasja jama, Brse?ine;Croatia;7.10.2009.;2009-10-07;1m;1;Linyphiidae;Asthenargus;bracianus;Asthenargus bracianus;;42 731 152;17 965 877;tf;deep cave;4 273 115 217 965 870;4;;;
548;Zvone?ka II;Croatia;19.3.2009.;2009-03-19;1 m;1;Dysderidae;Parastalita;stygia;Parastalita stygia;;45 531 095;15 367 671;Tb;deep cave;4 553 109 515 367 670;3;;;
549;?ot jama;Croatia;6.6.2009.;2009-06-06;1 m;1;Dysderidae;Parastalita;stygia;Parastalita stygia;;45 536 515;15 338 202;Tb;deep cave;4 553 651 515 338 200;3;;;
550;Zvone?ka II;Croatia;19.3.2009.;2009-03-19;3 juv;3;Dysderidae;Parastalita;stygia;Parastalita stygia;;45 531 095;15 367 671;Tb;deep cave;4 553 109 515 367 670;3;;;
551;Zvone?ka II;Croatia;6.6.2009.;2009-06-06;3m, 1 juv;4;Dysderidae;Parastalita;stygia;Parastalita stygia;;45 531 095;15 367 671;Tb;deep cave;4 553 109 515 367 670;3;;;
552;Riobamba jama;Croatia;21.3.2009.;2009-03-21;2f, 1 juv;3;Nesticidae;Kryptonesticus;eremita;Kryptonesticus eremita;;4 564 562;15 421 545;Tf;deep cave;456 456 215 421 545;2;;;
553;Špilja pokraj Kozja?e;Croatia;17.9.2009.;2009-09-17;1 m;1;Linyphiidae;Porrhomma;microps;Porrhomma microps;145;45 638 885;15 394 546;Tf;deep cave;4 563 888 515 394 540;1;;;
555;Vrlovka;Croatia;17.3.2009.;2009-03-17;1m, 1 juvf, 1juv;3;Linyphiidae;Troglohyphantes;excavatus;Troglohyphantes excavatus;;4 563 707;15 390 544;tf;deep cave;456 370 715 390 544;2;;;
556;?ot jama;Croatia;6.6.2009.;2009-06-06;1 juv;1;Dysderidae;Stalita;pretneri;Stalita pretneri;;45 536 515;15 338 202;Tb;deep cave;4 553 651 515 338 200;3;;;
557;?ot jama;Croatia;6.6.2009.;2009-06-06;1 f;1;Linyphiidae;Troglohyphantes;excavatus;Troglohyphantes excavatus;;45 536 515;15 338 202;tf;deep cave;4 553 651 515 338 200;3;;;
562;K`U?ka;Croatia;23.4.2009.;2009-04-23;1 juv m;1;Dysderidae;Stalita;taenaria;Stalita taenaria;1100;45 303 353;14 210 369;Tb;deep cave;4 530 335 314 210 360;3;;;
563;Borušnjak 3;Croatia;25.6.2009.;2009-06-25;1 juv;1;Dysderidae;Stalita;taenaria;Stalita taenaria;;45 375 119;14 180 968;Tb;deep cave;4 537 511 914 180 960;1;;;
564;Jama pod Velikim Knezgradom;Croatia;28.6.2009.;2009-06-28;1 juv;1;Dysderidae;Stalita;taenaria;Stalita taenaria;;4 528 092;14 249 305;Tb;deep cave;452 809 214 249 305;2;;;9,7
565;Jama pod Križ;Croatia;27.6.2009.;2009-06-27;2f;2;Linyphiidae;Troglohyphantes;brignolii;Troglohyphantes brignolii;;45 374 314;14 113 041;Tb;deep cave;4 537 431 414 113 040;1;;;8,5
567;Borušnjak 1;Croatia;25.6.2009.;2009-06-25;1m;1;Linyphiidae;Troglohyphantes;brignolii;Troglohyphantes brignolii;;45 370 735;14 186 981;Tb;deep cave;4 537 073 514 186 980;1;;;
568;Pe?ina kod planinarske ku?e Pavlovac;Croatia;20.9.2008.;2008-09-20;2m;2;Linyphiidae;Troglohyphantes;brignolii;Troglohyphantes brignolii;;45 371 352;14 191 845;Tb;deep cave;4 537 135 214 191 840;1;;;4,1
569;ZV-1;Croatia;24.4.2009.;2009-04-24;4f, 2m;6;Linyphiidae;Troglohyphantes;brignolii;Troglohyphantes brignolii;;45 352 478;14 253 225;Tb;deep cave;4 535 247 814 253 220;2;;;5
570;ZV-1;Croatia;24.4.2009.;2009-04-24;1m;1;Linyphiidae;Tenuiphantes;cristatus;Tenuiphantes cristatus;;45 352 478;14 253 225;SubTf?;;4 535 247 814 253 220;2;;;5
572;Jama u Debelom bregu;Croatia;25.4.2009.;2009-04-25;1f, 1m;2;Linyphiidae;Troglohyphantes;brignolii;Troglohyphantes brignolii;;45 358 239;1 425 243;Tb;deep cave;453 582 391 425 243;1;;;3,9
573;Borušnjak 1;Croatia;25.6.2009.;2009-06-25;1f;1;Linyphiidae;Troglohyphantes;brignolii;Troglohyphantes brignolii;;45 370 735;14 186 981;Tb;deep cave;4 537 073 514 186 980;1;;;
574;Jama pod Velikim Knezgradom;Croatia;28.6.2009.;2009-06-28;3f;3;Linyphiidae;Troglohyphantes;brignolii;Troglohyphantes brignolii;;4 528 092;14 249 305;Tb;deep cave;452 809 214 249 305;2;;;9,7
575;Špilja iznad Velikog Bresta;Croatia;20.9.2009.;2009-09-20;5f, 1juv f;6;Linyphiidae;Troglohyphantes;brignolii;Troglohyphantes brignolii;743;45 429 588;14 095 256;tb;deep cave;4 542 958 814 095 250;3;;;
576;Borušnjak 2;Croatia;25.6.2009.;2009-06-25;2f, 2juv;4;Linyphiidae;Troglohyphantes;brignolii;Troglohyphantes brignolii;;45 374 948;14 180 971;Tb;deep cave;4 537 494 814 180 970;1;;;
578;Jama u Debelom bregu;Croatia;25.4.2009.;2009-04-25;1f, 1juv m;2;Linyphiidae;Troglohyphantes;brignolii;Troglohyphantes brignolii;;45 358 239;1 425 243;Tb;deep cave;453 582 391 425 243;1;;;3,9
579;Jama na Mahencu 1;Croatia;22.4.2009.;2009-04-22;1f, 1m, 7juv;9;Linyphiidae;Troglohyphantes;brignolii;Troglohyphantes brignolii;;45 348 186;14 239 877;Tb;deep cave;4 534 818 614 239 870;1;;;4
580;Jame na Zaluki;Croatia;22.4.2009.;2009-04-22;1m;1;Linyphiidae;Troglohyphantes;brignolii;Troglohyphantes brignolii;;4 534 416;14 235 222;Tb;deep cave;453 441 614 235 222;2;;;
581;Jama na Mahencu 2;Croatia;22.4.2009.;2009-04-22;1f;1;Cheiracanthiidae;Gen.;sp.;Gen. sp.;890;45 348 335;1 423 389;SubTf?;;453 483 351 423 389;4;;;4
582;Pe?ina kod sela Puhari;Croatia;21.4.2009.;2009-04-21;1f, 1juv m;2;Linyphiidae;Troglohyphantes;excavatus;Troglohyphantes excavatus;;45 328 896;14 256 583;Tf;deep cave;4 532 889 614 256 580;2;;;
583;Pe?ina kod sela Puhari;Croatia;21.4.2009.;2009-04-21;1f, 1juv f;2;Linyphiidae;Troglohyphantes;liburnicus;Troglohyphantes liburnicus;;45 328 896;14 256 583;Tb;deep cave;4 532 889 614 256 580;2;;;
585;Pe?ina kod planinarske ku?e Pavlovac;Croatia;20.6.2009.;2009-06-20;1f;1;Linyphiidae;Troglohyphantes;brignolii;Troglohyphantes brignolii;;45 371 352;14 191 845;Tb;deep cave;4 537 135 214 191 840;1;;;4,1
586;Druška pe?;Croatia;24.4.2009.;2009-04-24;1m, 1juv m;2;Nesticidae;Kryptonesticus;eremita;Kryptonesticus eremita;;45 249 486;14 231 421;Tf;deep cave;4 524 948 614 231 420;2;;;12,5
587;Borušnjak 1;Croatia;25.6.2009.;2009-06-25;1m, 2juv m;3;Linyphiidae;Troglohyphantes;brignolii;Troglohyphantes brignolii;;45 370 735;14 186 981;Tb;deep cave;4 537 073 514 186 980;1;;;
589;Jama na Mahencu 2;Croatia;22.4.2009.;2009-04-22;2f, 1juv;3;Linyphiidae;Troglohyphantes;brignolii;Troglohyphantes brignolii;;45 348 335;1 423 389;Tb;deep cave;453 483 351 423 389;4;;;4
590;K`U?ka;Croatia;23.4.2009.;2009-04-23;1f juv;1;Linyphiidae;Troglohyphantes;brignolii;Troglohyphantes brignolii;;45 303 353;14 210 369;Tf;deep cave;4 530 335 314 210 360;3;;;
591;K`U?ka;Croatia;23.4.2009.;2009-04-23;1f;1;Agelenidae;Histopona;luxurians;Histopona luxurians;;45 303 353;14 210 369;tf;deep cave;4 530 335 314 210 360;3;;;
592;Borušnjak 2;Croatia;25.6.2009.;2009-06-25;1m, 2f;3;Linyphiidae;Troglohyphantes;brignolii;Troglohyphantes brignolii;;45 374 948;14 180 971;Tb;deep cave;4 537 494 814 180 970;1;;;
593;ZV-1;Croatia;24.4.2009.;2009-04-24;1m, 1f, 1juv;3;Linyphiidae;Troglohyphantes;brignolii;Troglohyphantes brignolii;;45 352 478;14 253 225;Tb;deep cave;4 535 247 814 253 220;2;;;5
594;Druška pe?;Croatia;24.4.2009.;2009-04-24;1 juv;1;Pholcidae;Pholcus;sp.;Pholcus sp.;;45 249 486;14 231 421;Tf;;4 524 948 614 231 420;2;;;12,5
595;Jama u Vetvi;Croatia;26.4.2009.;2009-04-26;1m;1;Dysderidae;Dysdera;adriatica;Dysdera adriatica;;45 332 148;14 240 733;Tx;;4 533 214 814 240 730;3;;;9,6
598;Pe?ina pod Brložnikom;Croatia;13.9.2008.;2008-09-13;1f, 1juv;2;Linyphiidae;Troglohyphantes;brignolii;Troglohyphantes brignolii;;45 336 603;14 227 302;Tb;deep cave;4 533 660 314 227 300;1;;;8,3
599;Proljetna jama;Croatia;28.6.2009.;2009-06-28;1f, 1juv m;2;Linyphiidae;Troglohyphantes;liburnicus;Troglohyphantes liburnicus;;45 284 901;1 424 706;Tb;deep cave;452 849 011 424 706;1;;;9,5
600;Jama SD 2;Croatia;24.4.2009.;2009-04-24;1f;1;Linyphiidae;Troglohyphantes;brignolii;Troglohyphantes brignolii;;45 356 722;14 228 408;Tb;deep cave;4 535 672 214 228 400;1;;;5,6
601;Jama na Lipovice;Croatia;25.4.2009.;2009-04-25;1f;1;Linyphiidae;Troglohyphantes;excavatus;Troglohyphantes excavatus;940;45 368 907;14 245 975;Tf;deep cave;4 536 890 714 245 970;4;;;2,9
602;Jama na Lipovice;Croatia;25.4.2009.;2009-04-25;1m, 2f, 1juv;4;Linyphiidae;Troglohyphantes;brignolii;Troglohyphantes brignolii;;45 368 907;14 245 975;Tb;deep cave;4 536 890 714 245 970;4;;;2,9
603;Jama na Lipovice;Croatia;25.4.2009.;2009-04-25;1m;1;Linyphiidae;Tenuiphantes;cristatus;Tenuiphantes cristatus;;45 368 907;14 245 975;SubTf?;;4 536 890 714 245 970;4;;;2,9
604;Jama pod Velikim Knezgradom;Croatia;28.6.2009.;2009-06-28;1f;1;Linyphiidae;Troglohyphantes;brignolii;Troglohyphantes brignolii;;4 528 092;14 249 305;Tb;deep cave;452 809 214 249 305;2;;;9,7
605;Jama na Zaluki (ispred);Croatia;22.4.2009.;2009-04-22;1f;1;Linyphiidae;Palliduphantes;istrianus;Palliduphantes istrianus;;4 534 416;14 235 222;Tf;shallow subterranean habitat;453 441 614 235 222;2;;;
607;Barinova jama;Croatia;11.9.2008.;2008-09-11;1m, 1juv m;2;Linyphiidae;Troglohyphantes;brignolii;Troglohyphantes brignolii;;45 354 889;14 126 033;Tb;deep cave;4 535 488 914 126 030;1;;;5,9
608;Rudnik u Medveji;Croatia;24.4.2009.;2009-04-24;1f, 1juv;2;Nesticidae;Kryptonesticus;eremita;Kryptonesticus eremita;;45 271 377;14 268 107;Tf;deep cave;4 527 137 714 268 100;1;;;13,8
609;Jama u Vetvi;Croatia;26.4.2009.;2009-04-26;1f;1;Linyphiidae;Troglohyphantes;liburnicus;Troglohyphantes liburnicus;;45 332 148;14 240 733;Tb;deep cave;4 533 214 814 240 730;3;;;9,6
610;ZV-1;Croatia;24.4.2009.;2009-04-24;1f, 1m;2;Linyphiidae;Troglohyphantes;brignolii;Troglohyphantes brignolii;;45 352 478;14 253 225;Tb;deep cave;4 535 247 814 253 220;2;;;5
613;Jama na Lipovice;Croatia;25.4.2009.;2009-04-25;1f;1;Linyphiidae;Troglohyphantes;brignolii;Troglohyphantes brignolii;;45 368 907;14 245 975;Tb;deep cave;4 536 890 714 245 970;4;;;2,9
615;ZV-1;Croatia;24.4.2009.;2009-04-24;6f, 1m;7;Linyphiidae;Troglohyphantes;brignolii;Troglohyphantes brignolii;;45 352 478;14 253 225;Tb;deep cave;4 535 247 814 253 220;2;;;5
616;Jama na Mahencu 2;Croatia;22.4.2009.;2009-04-22;1m, 5f;6;Linyphiidae;Troglohyphantes;brignolii;Troglohyphantes brignolii;;45 348 335;1 423 389;Tb;deep cave;453 483 351 423 389;4;;;4
617;Jama u Velim Sapcima 3;Croatia;26.4.2009.;2009-04-26;1f, 2juv;3;Linyphiidae;Troglohyphantes;liburnicus;Troglohyphantes liburnicus;850;45 359 003;14 242 656;Tb;deep cave;4 535 900 314 242 650;5;;;7,6
618;Jama u Velim Sapcima 3;Croatia;26.4.2009.;2009-04-26;1f, 1m;2;Linyphiidae;Troglohyphantes;excavatus;Troglohyphantes excavatus;;45 359 003;14 242 656;Tf;deep cave;4 535 900 314 242 650;5;;;7,6
619;Jama u Velim Sapcima 3;Croatia;26.4.2009.;2009-04-26;1m;1;Tetragnathidae;Metellina;mengei;Metellina mengei;;45 359 003;14 242 656;SubTf?;;4 535 900 314 242 650;5;;;7,6
622;Jama na Lipovice;Croatia;25.4.2009.;2009-04-25;2f;2;Tetragnathidae;Metellina;merianae;Metellina merianae;;45 368 907;14 245 975;tf;deep cave;4 536 890 714 245 970;4;;;2,9
623;Jama na Mahencu 2;Croatia;22.4.2009.;2009-04-22;1m;1;Tetragnathidae;Metellina;merianae;Metellina merianae;;45 348 335;1 423 389;tf;deep cave;453 483 351 423 389;4;;;4
624;Jama na Mahencu 2;Croatia;22.4.2009.;2009-04-22;1f;1;Agelenidae;Tegenaria;silvestris;Tegenaria silvestris;;45 348 335;1 423 389;Tf;deep cave;453 483 351 423 389;4;;;4
625;Jama u Velim Sapcima 3;Croatia;26.4.2009.;2009-04-26;1f;1;Agelenidae;Tegenaria;sp. 1;Tegenaria sp. 1;;45 359 003;14 242 656;SubTf?;deep cave;4 535 900 314 242 650;5;;;7,6
627;Jama u Vetvi;Croatia;26.4.2009.;2009-04-26;1m;1;cf. Tetragnathidae;Gen. 1;sp. 1;Gen. 1 sp. 1;;45 332 148;14 240 733;Tx;;4 533 214 814 240 730;3;;;9,6
628;Ledenica u Špeharima;Croatia;3.12.2009.;2009-12-03;1m;1;Dysderidae;Parastalita;stygia;Parastalita stygia;;45 371 029;15 317 544;Tb;deep cave;4 537 102 915 317 540;1;;;
632;Jama kod Koli?a 2;Croatia;2.12.2009.;2009-12-02;1m;1;Linyphiidae;Troglohyphantes;croaticus;Troglohyphantes croaticus;;45 343 306;15 316 733;Tb;deep cave;4 534 330 615 316 730;2;;;
633;Tounj?ica;Croatia;5.12.2009.;2009-12-05;2f;2;Linyphiidae;Porrhomma;convexum;Porrhomma convexum;;45 248 722;15 322 408;Tf;deep cave;4 524 872 215 322 400;5;;;14
634;Špilja u kanjonu Bistraca kod Kromara;Croatia;25.8.2008.;2008-08-25;1f;1;Linyphiidae;Porrhomma;egeria;Porrhomma egeria;230;45 280 604;15 289 475;Tf;deep cave;4 528 060 415 289 470;2;;;
635;Urinjska špilja;Croatia;17.10.2009.;2009-10-17;1f;1;Nesticidae;Kryptonesticus;eremita;Kryptonesticus eremita;10;45 285 721;14 524 173;tf;deep cave;4 528 572 114 524 170;5;;;10,3
636;Urinjska špilja;Croatia;17.10.2009.;2009-10-17;1 juv;1;Dysderidae;Stalita;taenaria;Stalita taenaria;;45 285 721;14 524 173;Tb;deep cave;4 528 572 114 524 170;5;;;10,3
637;Mali štumbur;Croatia;18.10.2009.;2009-10-18;1m;1;Dysderidae;Stalita;taenaria;Stalita taenaria;48;45 297 181;14 503 575;Tb;deep cave;4 529 718 114 503 570;2;;;9,8
639;Špilja kod kompresorske stanice;Croatia;17.10.2009.;2009-10-17;1m, 2juv;3;Nesticidae;Kryptonesticus;eremita;Kryptonesticus eremita;;45 315 027;14 483 783;tf;deep cave;4 531 502 714 483 780;2;;;13,8
640;Špilja kod kompresorske stanice;Croatia;17.10.2009.;2009-10-17;1 juv;1;Pholcidae;Pholcus;sp.;Pholcus sp.;;45 315 027;14 483 783;;;4 531 502 714 483 780;2;;;13,8
641;Urinjska špilja;Croatia;15.10.2009.;2009-10-15;1 m;1;Nesticidae;Kryptonesticus;eremita;Kryptonesticus eremita;;45 285 721;14 524 173;tf;deep cave;4 528 572 114 524 170;5;;;10,3
642;Urinjska špilja;Croatia;17.10.2009.;2009-10-17;1f;1;Nesticidae;Kryptonesticus;eremita;Kryptonesticus eremita;;45 285 721;14 524 173;tf;deep cave;4 528 572 114 524 170;5;;;10,3
643;Rudnik iznad uvale Martinš?ica;Croatia;29.4.2009.;2009-04-29;1m, 1f;2;Nesticidae;Kryptonesticus;eremita;Kryptonesticus eremita;;4 531 777;14 487 393;tf;deep cave;453 177 714 487 393;1;;;12,6
647;Rudnik iznad uvale Martinš?ica;Croatia;29.4.2009.;2009-04-29;1f, 2juv m, 2juv;5;Nesticidae;Kryptonesticus;eremita;Kryptonesticus eremita;;4 531 777;14 487 393;tf;deep cave;453 177 714 487 393;1;;;12,6
649;Bunetova jama;Croatia;28.4.2009.;2009-04-28;2f, 2juv;4;Nesticidae;Kryptonesticus;eremita;Kryptonesticus eremita;;45 300 434;14 526 307;tf;deep cave;4 530 043 414 526 300;1;;;9,3
652;Mali štumbur;Croatia;18.10.2009.;2009-10-18;1f;1;Nesticidae;Kryptonesticus;eremita;Kryptonesticus eremita;;45 297 181;14 503 575;tf;deep cave;4 529 718 114 503 570;2;;;9,8
653;Špilja iznad ceste;Croatia;17.10.2009.;2009-10-17;1f;1;Nesticidae;Kryptonesticus;eremita;Kryptonesticus eremita;;4 531 381;14 483 246;tf;deep cave;453 138 114 483 246;3;;;17,9
655;Špilja iznad ceste;Croatia;17.10.2009.;2009-10-17;2f;2;Nesticidae;Kryptonesticus;eremita;Kryptonesticus eremita;;4 531 381;14 483 246;tf;deep cave;453 138 114 483 246;3;;;17,9
660;Špilja kod kompresorske stanice;Croatia;17.10.2009.;2009-10-17;1 juv;1;Pholcidae;Pholcus;sp.;Pholcus sp.;;45 315 027;14 483 783;;;4 531 502 714 483 780;2;;;13,8
661;Špilja iznad ceste;Croatia;17.10.2009.;2009-10-17;1 juv;1;Pholcidae;Pholcus;sp.;Pholcus sp.;;4 531 381;14 483 246;;;453 138 114 483 246;3;;;17,9
663;Špilja u uvali Predpe?;Croatia;27.4.2009.;2009-04-27;1f;1;Dysderidae;Rhode;aspinifera;Rhode aspinifera;;45 291 576;14 510 419;Tb;deep cave;4 529 157 614 510 410;4;;10,3;10,625
664;Urinjska špilja;Croatia;29.4.2009.;2009-04-29;1f;1;Linyphiidae;Centromerus;sellarius;Centromerus sellarius;;45 285 721;14 524 173;tf;deep cave;4 528 572 114 524 170;5;;;10,3
665;Urinjska špilja;Croatia;17.10.2009.;2009-10-17;2f, 2juv;4;Linyphiidae;Centromerus;sellarius;Centromerus sellarius;;45 285 721;14 524 173;tf;deep cave;4 528 572 114 524 170;5;;;10,3
666;Špilja iznad ceste;Croatia;17.10.2009.;2009-10-17;1f;1;Theridiidae;Episinus;cavernicola;Episinus cavernicola;;4 531 381;14 483 246;Tf;deep cave;453 138 114 483 246;3;;;17,9
669;Ton?akova jama;Croatia;18.10.2009.;2009-10-18;1f, 1 juv m, 2 juv;4;Theridiidae;Episinus;cavernicola;Episinus cavernicola;;45 304 426;14 521 058;Tf;deep cave;4 530 442 614 521 050;1;;;
671;Urinjska špilja;Croatia;29.4.2009.;2009-04-29;1 juv;1;Dysderidae;Rhode;aspinifera;Rhode aspinifera;;45 285 721;14 524 173;Tb;deep cave;4 528 572 114 524 170;5;;;10,3
672;Urinjska špilja;Croatia;29.4.2009.;2009-04-29;1m;1;Dictynidae;Nigma;flavescens;Nigma flavescens;;45 285 721;14 524 173;Tx;;4 528 572 114 524 170;5;;;10,3
674;Biserujka;Croatia;26.5.2009.;2009-05-26;1 f;1;Nesticidae;Kryptonesticus;eremita;Kryptonesticus eremita;;45 187 464;1 460 981;tf;deep cave;451 874 641 460 981;1;;;14,8
677;Vilska luknja;Croatia;16.5.2009.;2009-05-16;1 f;1;Linyphiidae;Porrhomma;sp. 1;Porrhomma sp. 1;;46.19;15.9;;;46.1915.9;3;;;
679;Hanžekova jama;Croatia;20.5.2009.;2009-05-20;1f, 2m, 2juv;5;Linyphiidae;Porrhomma;egeria;Porrhomma egeria;390;46 155 463;161 171;Tf;deep cave;46 155 463 161 171;5;;;
681;Volarš?ica;Croatia;19.11.2009.;2009-11-19;1 juv;1;Dysderidae;Harpactea;sp.;Harpactea sp.;;46 184 293;15 893 218;;;4 618 429 315 893 210;3;;;
682;Volarš?ica;Croatia;19.11.2009.;2009-11-19;1m;1;Agelenidae;Tegenaria;silvestris;Tegenaria silvestris;;46 184 293;15 893 218;Tf;deep cave;4 618 429 315 893 210;3;;;
686;Vilska luknja;Croatia;16.5.2009.;2009-05-16;1 m;1;Linyphiidae;Porrhomma;microps;Porrhomma microps;;46.19;15.9;Tf;deep cave;46.1915.9;3;;;
687;Vilska luknja;Croatia;16.5.2009.;2009-05-16;2 f;2;Theridiidae;Pholcomma;gibbum;Pholcomma gibbum;;46.19;15.9;Tx;;46.1915.9;3;;;
688;Volarš?ica;Croatia;19.11.2009.;2009-11-19;1 m;1;Theridiidae;Pholcomma;gibbum;Pholcomma gibbum;;46 184 293;15 893 218;Tx;;4 618 429 315 893 210;3;;;
689;Jama iznad Vrulja;Croatia;26.9.2009.;2009-09-26;1 juv;1;Agelenidae;Tegenaria;sp.;Tegenaria sp.;;4 381 234;15 301 095;;deep cave;438 123 415 301 095;5;;16;17,75
689;Jama iznad Vrulja;Croatia;26.9.2009.;2009-09-26;1 juv;1;Agelenidae;Tegenaria;sp.;Tegenaria sp.;;4 381 234;15 301 095;;deep cave;438 123 415 301 095;5;;16,8;15,533
692;Vjetruša;Croatia;28.9.2009.;2009-09-28;1 juv;1;Agelenidae;Tegenaria;sp.;Tegenaria sp.;;4 377 419;15 349 733;;deep cave;437 741 915 349 733;1;;;15,5
695;Donja Bara?eva;Croatia;17.4.2004.;2004-04-17;1f;1;Dysderidae;Parastalita;stygia;Parastalita stygia;310;44 984 157;15 723 225;Tb;deep cave;4 498 415 715 723 220;8;;;
696;Donja Bara?eva;Croatia;17.4.2004.;2004-04-17;1m, 1 juv f - možda Therii;2;Linyphiidae;Troglohyphantes;excavatus;Troglohyphantes excavatus;310;44 984 157;15 723 225;tf;deep cave;4 498 415 715 723 220;8;;;
697;Manita pe?;Croatia;12.8.1998.;1998-08-12;1m, 2 juv;3;Dysderidae;Parastalita;stygia;Parastalita stygia;520;44 314 302;15 475 264;Tb;deep cave;4 431 430 215 475 260;7;;;9,8
697;Manita pe?;Croatia;12.8.1998.;1998-08-12;1m, 2 juv;3;Dysderidae;Parastalita;stygia;Parastalita stygia;520;44 314 302;15 475 264;Tb;deep cave;4 431 430 215 475 260;7;;8,8;9,25
698;Manita pe?;Croatia;12.8.1998.;1998-08-12;1f, 1 juv;2;Dysderidae;Stalita;pretneri;Stalita pretneri;520;44 314 302;15 475 264;Tb;deep cave;4 431 430 215 475 260;7;;;9,8
698;Manita pe?;Croatia;12.8.1998.;1998-08-12;1f, 1 juv;2;Dysderidae;Stalita;pretneri;Stalita pretneri;520;44 314 302;15 475 264;Tb;deep cave;4 431 430 215 475 260;7;;8,8;9,25
699;Manita pe?;Croatia;13.6.1999.;1999-06-13;1m, 1 juv;2;Dysderidae;Parastalita;stygia;Parastalita stygia;520;44 314 302;15 475 264;Tb;deep cave;4 431 430 215 475 260;7;;;9,8
699;Manita pe?;Croatia;13.6.1999.;1999-06-13;1m, 1 juv;2;Dysderidae;Parastalita;stygia;Parastalita stygia;520;44 314 302;15 475 264;Tb;deep cave;4 431 430 215 475 260;7;;8,8;9,25
700;Manita pe?;Croatia;13.6.1999.;1999-06-13;1 juv;1;Dysderidae;Stalita;pretneri;Stalita pretneri;520;44 314 302;15 475 264;Tb;deep cave;4 431 430 215 475 260;7;;;9,8
700;Manita pe?;Croatia;13.6.1999.;1999-06-13;1 juv;1;Dysderidae;Stalita;pretneri;Stalita pretneri;520;44 314 302;15 475 264;Tb;deep cave;4 431 430 215 475 260;7;;8,8;9,25
701;Jama u Velim Sapcima 3;Croatia;26.4.2009.;2009-04-26;1m;1;Agelenidae;Histopona;torpida;Histopona torpida;;45 359 003;14 242 656;Tx;deep cave;4 535 900 314 242 650;5;;;7,6
702;Tu?epska vilenja?a;Croatia;31.5.2007.;2007-05-31;1m;1;Dysderidae;Stalagtia;sp. 4;Stalagtia sp. 4;1181;43 286 465;17 083 638;Tb;deep cave;4 328 646 517 083 630;8;;;9,967
702;Tu?epska vilenja?a;Croatia;31.5.2007.;2007-05-31;1m;1;Dysderidae;Stalagtia;sp. 4;Stalagtia sp. 4;1181;43 286 465;17 083 638;Tb;deep cave;4 328 646 517 083 630;8;;;11,2
702;Tu?epska vilenja?a;Croatia;31.5.2007.;2007-05-31;1m;1;Dysderidae;Stalagtia;sp. 4;Stalagtia sp. 4;1181;43 286 465;17 083 638;Tb;deep cave;4 328 646 517 083 630;8;;10,6;11,025
703;Vranja?a špilja kod Dugopolja;Croatia;1.8.2007.;2007-08-01;1m;1;Dysderidae;Rhode;sp. 1;Rhode sp. 1;445;43 562 235;16 648 216;Tb;deep cave;4 356 223 516 648 210;5;;;8,7
704;Tu?epska vilenja?a;Croatia;9.4.1990.;1990-04-09;1m;1;Dysderidae;Harpactea;mateparlovi;Harpactea mateparlovi;1181;43 286 465;17 083 638;Tf;deep cave;4 328 646 517 083 630;8;;;9,967
704;Tu?epska vilenja?a;Croatia;9.4.1990.;1990-04-09;1m;1;Dysderidae;Harpactea;mateparlovi;Harpactea mateparlovi;1181;43 286 465;17 083 638;Tf;deep cave;4 328 646 517 083 630;8;;;11,2
704;Tu?epska vilenja?a;Croatia;9.4.1990.;1990-04-09;1m;1;Dysderidae;Harpactea;mateparlovi;Harpactea mateparlovi;1181;43 286 465;17 083 638;Tf;deep cave;4 328 646 517 083 630;8;;10,6;11,025
705;Kuna špilja;Croatia;27.8.1998.;1998-08-27;1m;1;Dysderidae;Harpactea;mateparlovi;Harpactea mateparlovi;1401;43 324 523;17 055 953;Tf;deep cave;4 332 452 317 055 950;2;;;4,5
706;Vilina špilja, Gruda;Croatia;27.6.2003.;2003-06-27;1f;1;Linyphiidae;Palliduphantes;sp. X;Palliduphantes sp. X;205;42 506 621;18 391 346;;deep cave;4 250 662 118 391 340;7;;;
707;Drenova?a;Croatia;6.5.2010.;2010-05-06;1f, 1 juv m;2;Linyphiidae;Palliduphantes;istrianus;Palliduphantes istrianus;;43 954 975;15 946 464;Tf;deep cave;4 395 497 515 946 460;2;;;
708;Jama kod Zaskoka;Croatia;6.5.2010.;2010-05-06;1m, 2 f;3;Linyphiidae;Palliduphantes;istrianus;Palliduphantes istrianus;;43 914 245;15 975 538;Tf;deep cave;4 391 424 515 975 530;1;;;
715;Stara jametina;Croatia;7.5.2010.;2010-05-07;1m, 1 juv;2;Theridiidae;Episinus;cavernicola;Episinus cavernicola;;43 794 009;1 600 259;Tf;deep cave;437 940 091 600 259;6;;;13
715;Stara jametina;Croatia;7.5.2010.;2010-05-07;1m, 1 juv;2;Theridiidae;Episinus;cavernicola;Episinus cavernicola;;43 794 009;1 600 259;Tf;deep cave;437 940 091 600 259;6;;13,4;13,4
716;Stara jametina;Croatia;7.5.2010.;2010-05-07;1f;1;Dysderidae;Stalagtia;sp. 4;Stalagtia sp. 4;;43 794 009;1 600 259;Tb;deep cave;437 940 091 600 259;6;;;13
716;Stara jametina;Croatia;7.5.2010.;2010-05-07;1f;1;Dysderidae;Stalagtia;sp. 4;Stalagtia sp. 4;;43 794 009;1 600 259;Tb;deep cave;437 940 091 600 259;6;;13,4;13,4
717;Jazinka;Croatia;6.5.2010.;2010-05-06;1m;1;Dysderidae;Stalagtia;sp. 4;Stalagtia sp. 4;235;43 975 892;16 029 694;Tb;deep cave;4 397 589 216 029 690;2;;;13
718;Topla pe?ina;Croatia;5.5.2010.;2010-05-05;1f;1;Dysderidae;Stalagtia;sp. 4;Stalagtia sp. 4;155;43 839 254;160 536;Tb;deep cave;43 839 254 160 536;4;;;
719;Topla pe?ina;Croatia;5.5.2010.;2010-05-05;1m;1;Dysderidae;Stalagtia;sp. 4;Stalagtia sp. 4;;43 839 254;160 536;Tb;deep cave;43 839 254 160 536;4;;;
720;Stara jametina;Croatia;7.5.2010.;2010-05-07;1m;1;Dysderidae;Stalagtia;sp. 4;Stalagtia sp. 4;;43 794 009;1 600 259;Tb;deep cave;437 940 091 600 259;6;;;13
720;Stara jametina;Croatia;7.5.2010.;2010-05-07;1m;1;Dysderidae;Stalagtia;sp. 4;Stalagtia sp. 4;;43 794 009;1 600 259;Tb;deep cave;437 940 091 600 259;6;;13,4;13,4
721;Stara jametina;Croatia;7.5.2010.;2010-05-07;1f;1;Linyphiidae;Micrargus;herbigradus;Micrargus herbigradus;;43 794 009;1 600 259;Tf;deep cave;437 940 091 600 259;6;;;13
721;Stara jametina;Croatia;7.5.2010.;2010-05-07;1f;1;Linyphiidae;Micrargus;herbigradus;Micrargus herbigradus;;43 794 009;1 600 259;Tf;deep cave;437 940 091 600 259;6;;13,4;13,4
722;Stara jametina;Croatia;7.5.2010.;2010-05-07;3 juv;3;Dysderidae;Stalagtia;sp. 4;Stalagtia sp. 4;;43 794 009;1 600 259;Tb;deep cave;437 940 091 600 259;6;;;13
722;Stara jametina;Croatia;7.5.2010.;2010-05-07;3 juv;3;Dysderidae;Stalagtia;sp. 4;Stalagtia sp. 4;;43 794 009;1 600 259;Tb;deep cave;437 940 091 600 259;6;;13,4;13,4
723;Jazinka;Croatia;6.5.2010.;2010-05-06;1 juv;1;Dysderidae;Stalagtia;sp. 4;Stalagtia sp. 4;235;43 975 892;16 029 694;Tb;deep cave;4 397 589 216 029 690;2;;;13
724;Stara jametina;Croatia;7.5.2010.;2010-05-07;1 juv;1;Dysderidae;Stalagtia;sp. 4;Stalagtia sp. 4;;43 794 009;1 600 259;Tb;deep cave;437 940 091 600 259;6;;;13
724;Stara jametina;Croatia;7.5.2010.;2010-05-07;1 juv;1;Dysderidae;Stalagtia;sp. 4;Stalagtia sp. 4;;43 794 009;1 600 259;Tb;deep cave;437 940 091 600 259;6;;13,4;13,4
725;Stara jametina;Croatia;7.5.2010.;2010-05-07;1 juv;1;Dysderidae;Stalagtia;sp. 4;Stalagtia sp. 4;;43 794 009;1 600 259;Tb;deep cave;437 940 091 600 259;6;;;13
725;Stara jametina;Croatia;7.5.2010.;2010-05-07;1 juv;1;Dysderidae;Stalagtia;sp. 4;Stalagtia sp. 4;;43 794 009;1 600 259;Tb;deep cave;437 940 091 600 259;6;;13,4;13,4
726;Jazinka;Croatia;6.5.2010.;2010-05-06;1 juv;1;Dysderidae;Stalagtia;sp. 4;Stalagtia sp. 4;235;43 975 892;16 029 694;Tb;deep cave;4 397 589 216 029 690;2;;;13
727;Topla pe?ina;Croatia;5.5.2010.;2010-05-05;1 juv;1;Dysderidae;Stalagtia;sp. 4;Stalagtia sp. 4;;43 839 254;160 536;Tb;deep cave;43 839 254 160 536;4;;;
729;Sedrena špilja kod stola;Croatia;3.5.2010.;2010-05-03;1 juv;1;Agelenidae;Histopona;sp.;Histopona sp.;;4 401 385;16 068 978;;deep cave;440 138 516 068 978;2;;6,1;6,1
730;Ozi?ana pe?ina;Croatia;6.5.2010.;2010-05-06;2f;2;Nesticidae;Kryptonesticus;eremita;Kryptonesticus eremita;;4 390 774;15 980 634;tf;deep cave;439 077 415 980 634;4;;;
731;Miljacka 2;Croatia;6.1.2005.;2005-01-06;2 juv;2;Agelenidae;Tegenaria;sp.;Tegenaria sp.;;440 002;16 016 234;;deep cave;44 000 216 016 234;4;;;12,6
733;Drenova?a;Croatia;8.1.2005.;2005-01-08;1 f;1;Linyphiidae;Palliduphantes;istrianus;Palliduphantes istrianus;;43 954 975;15 946 464;Tf;deep cave;4 395 497 515 946 460;2;;;
734;Drenova?a;Croatia;8.1.2005.;2005-01-08;2m, 3 juv;5;Linyphiidae;Palliduphantes;istrianus;Palliduphantes istrianus;;43 954 975;15 946 464;Tf;deep cave;4 395 497 515 946 460;2;;;
735;Triši?a jama;Croatia;8.1.2005.;2005-01-08;3f, 4 juv;7;Linyphiidae;Palliduphantes;istrianus;Palliduphantes istrianus;;43 949 231;15 947 793;Tf;deep cave;4 394 923 115 947 790;2;;;10,38
736;Triši?a jama;Croatia;8.1.2005.;2005-01-08;2f;2;Linyphiidae;Palliduphantes;istrianus;Palliduphantes istrianus;;43 949 231;15 947 793;Tf;deep cave;4 394 923 115 947 790;2;;;10,38
737;Triši?a jama;Croatia;8.1.2005.;2005-01-08;1m, 1 juv;2;Linyphiidae;Micrargus;herbigradus;Micrargus herbigradus;;43 949 231;15 947 793;Tf;deep cave;4 394 923 115 947 790;2;;;10,38
739;Jama u šumi uvale Bjejajka;Croatia;18.6.2010.;2010-06-18;1f;1;Linyphiidae;Gen. 4;sp.;Gen. 4 sp.;;42 765 231;17 385 606;;;4 276 523 117 385 600;6;;;15,4
739;Jama u šumi uvale Bjejajka;Croatia;18.6.2010.;2010-06-18;1f;1;Linyphiidae;Gen. 4;sp.;Gen. 4 sp.;;42 765 231;17 385 606;;;4 276 523 117 385 600;6;;;12,867
740;Jama u šumi uvale Bjejajka;Croatia;18.6.2010.;2010-06-18;1 f, 1 juv m;2;Linyphiidae;Palliduphantes;sp. 1;Palliduphantes sp. 1;;42 765 231;17 385 606;tf;deep cave;4 276 523 117 385 600;6;;;15,4
740;Jama u šumi uvale Bjejajka;Croatia;18.6.2010.;2010-06-18;1 f, 1 juv m;2;Linyphiidae;Palliduphantes;sp. 1;Palliduphantes sp. 1;;42 765 231;17 385 606;tf;deep cave;4 276 523 117 385 600;6;;;12,867
744;Veternica;Croatia;28.12.2003.;2003-12-28;2 m,3  juv;5;Linyphiidae;Troglohyphantes;excavatus;Troglohyphantes excavatus;330;45 841 058;15 873 642;tf;deep cave;4 584 105 815 873 640;6;;;
745;Los Antonio;Croatia;10.8.2006.;2006-08-10;1f;1;Linyphiidae;Troglohyphantes;sp. 4;Troglohyphantes sp. 4;;44 632 703;15 136 461;tb;deep cave;4 463 270 315 136 460;1;;;
746;Mravinjuša jama;Croatia;21.3.2004.;2004-03-21;2 f, 2juv;4;Linyphiidae;Typhlonyphia;sp. 1;Typhlonyphia sp. 1;730;43 346 139;17 099 776;Tb;deep cave;4 334 613 917 099 770;1;;8,1;8,1
747;Dvoga?a;Croatia;4.12.2004.;2004-12-04;1 f;1;Linyphiidae;Troglohyphantes;excavatus;Troglohyphantes excavatus;450;45 850 768;15 873 148;tf;deep cave;4 585 076 815 873 140;2;;;
748;Francuski rudnik 1;Croatia;19.11.2004.;2004-11-19;1 f;1;Linyphiidae;Troglohyphantes;excavatus;Troglohyphantes excavatus;700;4 591 305;15 940 454;tf;deep cave;459 130 515 940 454;3;;;
749;Gornja Bara?eva;Croatia;15.5.2004.;2004-05-15;6 f;6;Linyphiidae;Troglohyphantes;excavatus;Troglohyphantes excavatus;;44 983 895;15 721 656;tf;deep cave;4 498 389 515 721 650;8;;;
750;Kosi?ev ponor;Croatia;26.5.2005.;2005-05-26;1 m;1;Linyphiidae;Troglohyphantes;excavatus;Troglohyphantes excavatus;305;45 835 763;15 846 355;tf;deep cave;4 583 576 315 846 350;2;;;
751;Zverina;Croatia;3.11.2002.;2002-11-03;2f,1m;3;Linyphiidae;Troglohyphantes;excavatus;Troglohyphantes excavatus;320;45 681 296;15 445 012;tf;deep cave;4 568 129 615 445 010;2;;;
752;Vranja?a špilja kod Dugopolja;Croatia;20.7.2004.;2004-07-20;1f,1juv;2;Linyphiidae;Troglohyphantes;strandi;Troglohyphantes strandi;445;43 562 235;16 648 216;tb;deep cave;4 356 223 516 648 210;5;;;8,7
753;Dvocijevka;Croatia;28.7.2004.;2004-07-28;1 m,1juv;2;Linyphiidae;Troglohyphantes;croaticus;Troglohyphantes croaticus;1359;45 437 456;14 617 413;Tb;deep cave;4 543 745 614 617 410;1;;;
754;Jama na Puharevom;Croatia;2.11.2003.;2003-11-02;1 m;1;Linyphiidae;Troglohyphantes;liburnicus;Troglohyphantes liburnicus;;45 410 155;1 430 419;Tb;deep cave;454 101 551 430 419;2;;;
755;Luška špilja;Croatia;3.7.2004.;2004-07-03;1 f;1;Linyphiidae;Troglohyphantes;croaticus;Troglohyphantes croaticus;620;45 224 689;15 093 741;Tb;deep cave;4 522 468 915 093 740;2;;;
756;Jama blizu ceste MV 3;Croatia;27.-28.7.2002;2002-07-27/2002-07-28;1m;1;Linyphiidae;Troglohyphantes;brignolii;Troglohyphantes brignolii;;45 449 439;1 413 203;tb;deep cave;454 494 391 413 203;1;;;
757;Veternica;Croatia;20.12.2004.;2004-12-20;1 f;1;Linyphiidae;Troglohyphantes;excavatus;Troglohyphantes excavatus;330;45 841 058;15 873 642;tf;deep cave;4 584 105 815 873 640;6;;;
758;Francuski rudnik 1;Croatia;24.11.2004.;2004-11-24;1 m,1 juv;2;Linyphiidae;Troglohyphantes;excavatus;Troglohyphantes excavatus;;4 591 305;15 940 454;tf;deep cave;459 130 515 940 454;3;;;
759;Kosi?ev ponor;Croatia;26.5.2005.;2005-05-26;1 f,1 m;2;Linyphiidae;Troglohyphantes;excavatus;Troglohyphantes excavatus;305;45 835 763;15 846 355;tf;deep cave;4 583 576 315 846 350;2;;;
760;Veternica;Croatia;26.2.2005.;2005-02-26;1 f;1;Linyphiidae;Troglohyphantes;excavatus;Troglohyphantes excavatus;330;45 841 058;15 873 642;tf;deep cave;4 584 105 815 873 640;6;;;
761;Mravinjuša jama;Croatia;21.3.2004.;2004-03-21;2 f, 1 juv;3;Linyphiidae;Typhlonyphia;sp. 1;Typhlonyphia sp. 1;730;43 346 139;17 099 776;Tb;deep cave;4 334 613 917 099 770;1;;8,1;8,1
762;Rudnik Zrinski;Croatia;16.4.2004.;2004-04-16;1 f,1 m;2;Linyphiidae;Troglohyphantes;excavatus;Troglohyphantes excavatus;804;45 887 195;15 927 871;tf;deep cave;4 588 719 515 927 870;9;;;
763;Bošak jama;Croatia;21.3.2004.;2004-03-21;2 f;2;Linyphiidae;Typhlonyphia;sp. 1;Typhlonyphia sp. 1;739;43 347 996;17 100 045;Tb;deep cave;4 334 799 617 100 040;2;;;7,4
764;Batinova jama;Croatia;3.12.2004.;2004-12-03;1 f;1;Linyphiidae;Troglohyphantes;excavatus;Troglohyphantes excavatus;450;45 845 957;15 868 496;tf;deep cave;4 584 595 715 868 490;2;;;
765;Batinova jama;Croatia;23.1.2004.;2004-01-23;1 m;1;Linyphiidae;Troglohyphantes;excavatus;Troglohyphantes excavatus;450;45 845 957;15 868 496;tf;deep cave;4 584 595 715 868 490;2;;;
766;Staje 8;Croatia;29.7.2001.;2001-07-29;1 f;1;Linyphiidae;Troglohyphantes;excavatus;Troglohyphantes excavatus;;45 447 413;14 143 861;Tf;deep cave;4 544 741 314 143 860;3;;;
767;Batinova jama;Croatia;3.12.2004.;2004-12-03;1 f,1 m;2;Linyphiidae;Troglohyphantes;excavatus;Troglohyphantes excavatus;450;45 845 957;15 868 496;tf;deep cave;4 584 595 715 868 490;2;;;
768;Veternica;Croatia;21.4.2003.;2003-04-21;1 f;1;Linyphiidae;Troglohyphantes;excavatus;Troglohyphantes excavatus;330;45 841 058;15 873 642;tf;deep cave;4 584 105 815 873 640;6;;;
769;Židovske jame;Croatia;23.4.2005.;2005-04-23;1 f;1;Linyphiidae;Troglohyphantes;excavatus;Troglohyphantes excavatus;233;45 997 503;16 038 982;tf;deep cave;4 599 750 316 038 980;2;;;
770;Tisin ponor (ispred);Croatia;22.5.2005.;2005-05-22;1 m;1;Linyphiidae;Troglohyphantes;excavatus;Troglohyphantes excavatus;649;45 918 842;15 963 461;Tf;shallow subterranean habitat;4 591 884 215 963 460;2;;;
771;Veternica;Croatia;4.12.2004.;2004-12-04;1 f;1;Linyphiidae;Troglohyphantes;excavatus;Troglohyphantes excavatus;330;45 841 058;15 873 642;tf;deep cave;4 584 105 815 873 640;6;;;
772;Veternica;Croatia;13.5.2004.;2004-05-13;1 f;1;Linyphiidae;Troglohyphantes;excavatus;Troglohyphantes excavatus;330;45 841 058;15 873 642;tf;deep cave;4 584 105 815 873 640;6;;;
773;Rudnik Zrinski;Croatia;14.6.2004.;2004-06-14;2 f,1 m,1 juv;4;Linyphiidae;Troglohyphantes;excavatus;Troglohyphantes excavatus;804;45 887 195;15 927 871;tf;deep cave;4 588 719 515 927 870;9;;;
774;Batinova jama;Croatia;23.1.2004.;2004-01-23;2 f;2;Linyphiidae;Troglohyphantes;excavatus;Troglohyphantes excavatus;450;45 845 957;15 868 496;tf;deep cave;4 584 595 715 868 490;2;;;
775;Francuski rudnik 1;Croatia;16.4.2005.;2005-04-16;1f;1;Linyphiidae;Troglohyphantes;excavatus;Troglohyphantes excavatus;;4 591 305;15 940 454;tf;deep cave;459 130 515 940 454;3;;;
776;Jama Bijele sige;Croatia;24.1.2004.;2004-01-24;1 f,2 m;3;Linyphiidae;Troglohyphantes;excavatus;Troglohyphantes excavatus;;45 855 153;15 863 263;tf;deep cave;4 585 515 315 863 260;1;;;
777;Veternica;Croatia;13.5.2004.;2004-05-13;1 f;1;Linyphiidae;Troglohyphantes;excavatus;Troglohyphantes excavatus;330;45 841 058;15 873 642;tf;deep cave;4 584 105 815 873 640;6;;;
778;Veternica;Croatia;2.6.2001.;2001-06-02;1 f;1;Linyphiidae;Troglohyphantes;excavatus;Troglohyphantes excavatus;330;45 841 058;15 873 642;tf;deep cave;4 584 105 815 873 640;6;;;
779;Los Antonio;Croatia;10.8.2006.;2006-08-10;1 f;1;Linyphiidae;Troglohyphantes;sp. 4;Troglohyphantes sp. 4;;44 632 703;15 136 461;tb;deep cave;4 463 270 315 136 460;1;;;
780;Mili?ka;Croatia;26.4.2003.;2003-04-26;1m;1;Linyphiidae;Troglohyphantes;wiehlei;Troglohyphantes wiehlei;553;45 716 744;15 310 831;tf;deep cave;4 571 674 415 310 830;6;;;
781;Batinova jama;Croatia;3.12.2004.;2004-12-03;1 f, 1 m, 1 juv m;3;Linyphiidae;Troglohyphantes;excavatus;Troglohyphantes excavatus;450;45 845 957;15 868 496;tf;deep cave;4 584 595 715 868 490;2;;;
782;Bedara;Croatia;18.12.2005.;2005-12-18;1 m;1;Linyphiidae;Troglohyphantes;excavatus;Troglohyphantes excavatus;620;45 751 922;15 536 692;tf;deep cave;4 575 192 215 536 690;4;;;
783;Spilja Lisina;Croatia;17.10.1999.;1999-10-17;1 f;1;Linyphiidae;Troglohyphantes;excavatus;Troglohyphantes excavatus;277;4 569 351;15 441 668;tf;deep cave;456 935 115 441 668;1;;;
784;Dola?a;Croatia;8.12.2002.;2002-12-08;1 f;1;Linyphiidae;Troglohyphantes;excavatus;Troglohyphantes excavatus;410;45 739 571;15 482 755;tf;deep cave;4 573 957 115 482 750;5;;;
785;Jama u Vrloj strani;Croatia;7.6.2003.;2003-06-07;1f;1;Linyphiidae;Troglohyphantes;wiehlei;Troglohyphantes wiehlei;;4 572 603;1 527 504;tf;deep cave;45 726 031 527 504;1;;;7,9
786;Zidane pe?ine;Croatia;11.10.1998.;1998-10-11;1f;1;Linyphiidae;Troglohyphantes;wiehlei;Troglohyphantes wiehlei;400;45 738 992;15 497 143;tf;deep cave;4 573 899 215 497 140;7;;;
787;Jama Jamura;Croatia;15.9.2002.;2002-09-15;2 f,1 m;3;Linyphiidae;Troglohyphantes;excavatus;Troglohyphantes excavatus;350;45 754 062;15 489 269;tf;deep cave;4 575 406 215 489 260;2;;;
788;Jama na Javorniku;Croatia;7.6.2003.;2003-06-07;1 f;1;Linyphiidae;Troglohyphantes;excavatus;Troglohyphantes excavatus;729;45 732 907;15 282 397;tf;deep cave;4 573 290 715 282 390;1;;;
789;Zidane pe?ine;Croatia;9.6.2002.;2002-06-09;1 f;1;Linyphiidae;Troglohyphantes;excavatus;Troglohyphantes excavatus;400;45 738 992;15 497 143;tf;deep cave;4 573 899 215 497 140;7;;;
790;Jamina;Croatia;2.11.2002.;2002-11-02;1 f;1;Linyphiidae;Troglohyphantes;excavatus;Troglohyphantes excavatus;393;45 699 157;15 424 684;tf;deep cave;4 569 915 715 424 680;3;;10,8;10,1
791;Dola?a;Croatia;8.12.2002.;2002-12-08;1 f;1;Linyphiidae;Troglohyphantes;excavatus;Troglohyphantes excavatus;410;45 739 571;15 482 755;tf;deep cave;4 573 957 115 482 750;5;;;
792;Golubnja?a, Žegar;Croatia;9.1.2005.;2005-01-09;1 f;1;Linyphiidae;Troglohyphantes;roberti;Troglohyphantes roberti;243;44 131 933;15 851 054;tb;deep cave;4 413 193 315 851 050;6;;;
793;Golubnja?a, Žegar;Croatia;9.1.2005.;2005-01-09;1 f,5 juv;6;Linyphiidae;Troglohyphantes;roberti;Troglohyphantes roberti;243;44 131 933;15 851 054;tb;deep cave;4 413 193 315 851 050;6;;;
794;Špilja u zubu Buljme;Croatia;13.9.2006.;2006-09-13;1 f;1;Linyphiidae;Troglohyphantes;sp. 14;Troglohyphantes sp. 14;;44 366 906;15 470 541;tb;deep cave;4 436 690 615 470 540;1;;;5,4
795;Jama Nuga;Croatia;5.6.2000.;2000-06-05;1f, 1juv m;2;Linyphiidae;Troglohyphantes;roberti;Troglohyphantes roberti;;44 326 231;15 656 986;tb;deep cave;4 432 623 115 656 980;1;;;
796;Špilja Vranik;Croatia;8.5.2004.;2004-05-08;2 f;2;Linyphiidae;Troglohyphantes;roberti;Troglohyphantes roberti;;44 433 612;15 686 039;tb;deep cave;4 443 361 215 686 030;1;;;
797;Bonagracije;Croatia;5.8.2004.;2004-08-05;1 f;1;Linyphiidae;Troglohyphantes;sp. 4;Troglohyphantes sp. 4;;44 631 808;15 123 855;tb;deep cave;4 463 180 815 123 850;1;;;
798;Zverina;Croatia;3.11.2002.;2002-11-03;1 f;1;Linyphiidae;Troglohyphantes;excavatus;Troglohyphantes excavatus;320;45 681 296;15 445 012;tf;deep cave;4 568 129 615 445 010;2;;;
799;Bezdanka;Croatia;13.4.1984.;1984-04-13;3 f;3;Linyphiidae;Troglohyphantes;roberti;Troglohyphantes roberti;565;44 227 473;15 852 219;tb;deep cave;4 422 747 315 852 210;2;;;14,367
800;Jama sa strane;Croatia;13.8.2006.;2006-08-13;1 m;1;Linyphiidae;Troglohyphantes;kordunlikanus;Troglohyphantes kordunlikanus;;44 635 406;15 130 318;tf;deep cave;4 463 540 615 130 310;1;;;
801;Baji?eva špilja 4;Croatia;5.6.2002.;2002-06-05;1f;1;Nesticidae;Nesticus;cellulanus;Nesticus cellulanus;;4 525 183;15 848 764;tf;deep cave;452 518 315 848 764;1;;;
803;Mrgi?a ponor;Croatia;2.9.2009.;2009-09-02;1 f;1;Nesticidae;Nesticus;cellulanus;Nesticus cellulanus;;45 268 189;15 469 236;tf;deep cave;4 526 818 915 469 230;10;;;
805;Gradusa špilja;Croatia;27.2.2009.;2009-02-27;1 juv;1;Nesticidae;Nesticus;cellulanus;Nesticus cellulanus;;45 328 293;16 436 304;tf;deep cave;4 532 829 316 436 300;1;;;
806;Gradusa špilja;Croatia;6.3.2009.;2009-03-06;1 juv;1;Nesticidae;Nesticus;cellulanus;Nesticus cellulanus;;45 328 293;16 436 304;tf;deep cave;4 532 829 316 436 300;1;;;
808;Kukuruzovi?eva špilja;Croatia;18.6.2005.;2005-06-18;1 m, 2 juv;3;Nesticidae;Nesticus;cellulanus;Nesticus cellulanus;319;44 914 821;15 702 486;tf;deep cave;4 491 482 115 702 480;3;;;10,8
809;Mandelaja;Croatia;28.1.1995.;1995-01-28;1 f;1;Nesticidae;Nesticus;cellulanus;Nesticus cellulanus;;45 233 397;1 530 015;tf;deep cave;452 333 971 530 015;7;;;
812;Gradusa špilja;Croatia;27.2.2009.;2009-02-27;1f, 2juv;3;Nesticidae;Nesticus;cellulanus;Nesticus cellulanus;;45 328 293;16 436 304;tf;deep cave;4 532 829 316 436 300;1;;;
815;Gvozdenica;Croatia;9.12.1997.;1997-12-09;1 f;1;Nesticidae;Nesticus;cellulanus;Nesticus cellulanus;;45 299 765;15 589 405;tf;deep cave;4 529 976 515 589 400;4;;;8,7
820;Water well in Uble;Croatia;15.6.2001.;2001-06-15;1 m;1;Nesticidae;Kryptonesticus;eremita;Kryptonesticus eremita;;42 743 393;16 827 354;tf;cave entrance;4 274 339 316 827 350;1;;;
821;?urovi?a jama;Croatia;31.10.2003.;2003-10-31;1 f;1;Nesticidae;Kryptonesticus;eremita;Kryptonesticus eremita;;42 559 979;18 263 559;tf;deep cave;4 255 997 918 263 550;4;;;17,267
822;Jama pod Bilušinim vrhom;Croatia;24.4.2004.;2004-04-24;1 juv;1;Nesticidae;Kryptonesticus;eremita;Kryptonesticus eremita;;4 293 959;1 711 266;;deep cave;42 939 591 711 266;3;;;
823;Jezero;Croatia;28.5.2004.;2004-05-28;1f;1;Nesticidae;Kryptonesticus;arenstorffi;Kryptonesticus arenstorffi;903;42 580 381;18 356 073;tb;deep cave;4 258 038 118 356 070;8;;;7,567
824;Jezero;Croatia;28.5.2004.;2004-05-28;1f, 2 juv;3;Nesticidae;Kryptonesticus;arenstorffi;Kryptonesticus arenstorffi;903;42 580 381;18 356 073;tb;deep cave;4 258 038 118 356 070;8;;;7,567
825;Jama pod Bilušinim vrhom;Croatia;24.4.2004.;2004-04-24;1f, 2 juv m,1 juv;4;Nesticidae;Kryptonesticus;eremita;Kryptonesticus eremita;176;4 293 959;1 711 266;tf;deep cave;42 939 591 711 266;3;;;
831;Samograd;Croatia;26.4.2004.;2004-04-26;2 m;2;Nesticidae;Kryptonesticus;eremita;Kryptonesticus eremita;68;42 970 451;16 995 978;tf;deep cave;4 297 045 116 995 970;4;;;
832;Baši?a jama;Croatia;17.12.2008.;2008-12-17;1f,1 juv;2;Nesticidae;Kryptonesticus;eremita;Kryptonesticus eremita;;42 513 988;1 838 209;;deep cave;425 139 881 838 209;1;;;
833;Jama u Vrisju;Croatia;25.4.2004.;2004-04-25;5 juv;5;Nesticidae;Kryptonesticus;eremita;Kryptonesticus eremita;;42 944 287;17 118 511;;deep cave;4 294 428 717 118 510;2;;;
835;Jama u Dubokom dolu;Croatia;27.4.2004.;2004-04-27;1 juv;1;Nesticidae;Kryptonesticus;eremita;Kryptonesticus eremita;;42 946 895;17 022 321;;deep cave;4 294 689 517 022 320;3;;;
839;Pr?eva pe?;Croatia;8.12.2004.;2004-12-08;1 f;1;Nesticidae;Kryptonesticus;eremita;Kryptonesticus eremita;;4 398 118;1 596 072;tf;deep cave;43 981 181 596 072;1;;;
842;Šupljara;Croatia;24.9.2005.;2005-09-24;1 juv;1;Nesticidae;Nesticus;cellulanus;Nesticus cellulanus;;44 899 906;15 612 099;Tf;deep cave;4 489 990 615 612 090;5;;;
847;Velika pe?ina, kanjon Korane;Croatia;24.9.2005.;2005-09-24;1 juv;1;Nesticidae;Nesticus;cellulanus;Nesticus cellulanus;470;4 491 106;15 606 811;Tf;deep cave;449 110 615 606 811;1;;;
848;Vrtare male;Croatia;2.7.2005.;2005-07-02;1f,2 juv;3;Nesticidae;Kryptonesticus;eremita;Kryptonesticus eremita;;45 197 431;14 660 523;tf;deep cave;4 519 743 114 660 520;1;;;
854;Mra?na pe?ina;Croatia;24.9.2005.;2005-09-24;1 juv;1;Nesticidae;Nesticus;cellulanus;Nesticus cellulanus;;44 909 793;15 606 582;Tf;deep cave;4 490 979 315 606 580;1;;;
856;Vrtare male;Croatia;3.7.2005.;2005-07-03;1f,1 juv;2;Nesticidae;Kryptonesticus;eremita;Kryptonesticus eremita;;45 197 431;14 660 523;tf;deep cave;4 519 743 114 660 520;1;;;
862;Velika špilja kod Goranca;Croatia;15.10.2006.;2006-10-15;1 juv;1;Nesticidae;Nesticus;cellulanus;Nesticus cellulanus;;46 284 655;16 032 361;tf;deep cave;4 628 465 516 032 360;5;;;
863;Zdenec pri Ciglaru;Croatia;26.5.2007.;2007-05-26;1 juv;1;Nesticidae;Nesticus;cellulanus;Nesticus cellulanus;251;46 283 906;1 606 104;tf;deep cave;462 839 061 606 104;4;;;
864;Vu?ilnica špilja;Croatia;27.5.2007.;2007-05-27;1 juv;1;Nesticidae;Nesticus;cellulanus;Nesticus cellulanus;449;46 284 875;15 996 239;;deep cave;4 628 487 515 996 230;1;;;
867;Velika špilja kod Goranca;Croatia;15.10.2007.;2007-10-15;1 juv;1;Nesticidae;Nesticus;cellulanus;Nesticus cellulanus;;46 284 655;16 032 361;tf;deep cave;4 628 465 516 032 360;5;;;
868;Jama pod cestom;Croatia;2.11.2007.;2007-11-02;1 juv;1;Agelenidae;Histopona;sp.;Histopona sp.;;46 275 852;16 060 171;;deep cave;4 627 585 216 060 170;2;;;
871;Špilja Kukelj 1;Croatia;15.10.2006.;2006-10-15;1 f;1;Nesticidae;Nesticus;cellulanus;Nesticus cellulanus;;46 291 887;16 032 305;tf;deep cave;4 629 188 716 032 300;1;;;
872;Velika špilja kod Goranca;Croatia;14.5.2006.;2006-05-14;1f,3 juv;4;Nesticidae;Nesticus;cellulanus;Nesticus cellulanus;;46 284 655;16 032 361;tf;deep cave;4 628 465 516 032 360;5;;;
873;Cinkalica 1;Croatia;15.10.2006.;2006-10-15;1f;1;Nesticidae;Nesticus;cellulanus;Nesticus cellulanus;448;46 288 913;16 039 777;tf;deep cave;4 628 891 316 039 770;2;;;
874;Velika špilja kod Goranca;Croatia;14.5.2006.;2006-05-14;1f,1 juv;2;Nesticidae;Nesticus;cellulanus;Nesticus cellulanus;;46 284 655;16 032 361;tf;deep cave;4 628 465 516 032 360;5;;;
875;Ledenica kod Bednjice;Croatia;27.5.2007.;2007-05-27;1 m;1;Nesticidae;Nesticus;cellulanus;Nesticus cellulanus;;46 280 843;15 975 585;tf;deep cave;4 628 084 315 975 580;1;;;
876;Zdenec pri Ciglaru;Croatia;15.5.2006.;2006-05-15;1f;1;Nesticidae;Nesticus;cellulanus;Nesticus cellulanus;251;46 283 906;1 606 104;tf;deep cave;462 839 061 606 104;4;;;
877;Rudnik u Velikoj Sotinskoj;Croatia;28.5.2007.;2007-05-28;1 f, 2 juv;3;Nesticidae;Nesticus;cellulanus;Nesticus cellulanus;400;46 286 677;16 028 417;tf;deep cave;4 628 667 716 028 410;1;;;
878;Zdenec pri Ciglaru;Croatia;15.5.2006.;2006-05-15;1f, 1m, 1 juv;3;Nesticidae;Nesticus;cellulanus;Nesticus cellulanus;251;46 283 906;1 606 104;tf;deep cave;462 839 061 606 104;4;;;
879;Zdenec pri Ciglaru;Croatia;26.5.2007.;2007-05-26;1f, 1m,1 juv;3;Nesticidae;Nesticus;cellulanus;Nesticus cellulanus;251;46 283 906;1 606 104;tf;deep cave;462 839 061 606 104;4;;;
882;Dopolanš?ica;Croatia;15.5.2006.;2006-05-15;2 juv;2;Nesticidae;Nesticus;cellulanus;Nesticus cellulanus;;46 275 198;1 605 968;;deep cave;462 751 981 605 968;2;;;
883;Velika špilja kod Goranca;Croatia;14.5.2006.;2006-05-14;1 juv;1;Nesticidae;Nesticus;cellulanus;Nesticus cellulanus;;46 284 655;16 032 361;tf;deep cave;4 628 465 516 032 360;5;;;
884;Zdenec pri Ciglaru;Croatia;26.5.2007.;2007-05-26;6 juv;6;Nesticidae;Nesticus;cellulanus;Nesticus cellulanus;251;46 283 906;1 606 104;tf;deep cave;462 839 061 606 104;4;;;
885;Jama pod cestom;Croatia;2.11.2007.;2007-11-02;1 juv;1;Nesticidae;Nesticus;cellulanus;Nesticus cellulanus;;46 275 852;16 060 171;;deep cave;4 627 585 216 060 170;2;;;
887;Velika špilja kod Goranca;Croatia;14.5.2007.;2007-05-14;2 juv;2;Nesticidae;Nesticus;cellulanus;Nesticus cellulanus;;46 284 655;16 032 361;tf;deep cave;4 628 465 516 032 360;5;;;
888;Šupljara;Croatia;24.9.2005.;2005-09-24;1f,2 juv;3;Nesticidae;Nesticus;cellulanus;Nesticus cellulanus;;44 899 906;15 612 099;tf;deep cave;4 489 990 615 612 090;5;;;
889;Mra?na pe?ina;Croatia;24.9.2005.;2005-09-24;1f, 1 m;2;Nesticidae;Nesticus;cellulanus;Nesticus cellulanus;;44 909 793;15 606 582;tf;deep cave;4 490 979 315 606 580;1;;;
890;Špilja pod Kaštel;Croatia;14.6.2001.;2001-06-14;1 juv f,1 juv m,4 juv;6;Nesticidae;Kryptonesticus;eremita;Kryptonesticus eremita;;42 768 041;16 899 005;tf;deep cave;4 276 804 116 899 000;2;;15,3;16,95
892;Špilja Kukelj Sjever;Croatia;3.11.2007.;2007-11-03;1m;1;Agelenidae;Tegenaria;silvestris;Tegenaria silvestris;400;46 293 861;16 036 898;Tf;deep cave;4 629 386 116 036 890;1;;;
893;Mandelaja;Croatia;28.1.1995.;1995-01-28;1f;1;Agelenidae;Tegenaria;silvestris;Tegenaria silvestris;;45 233 397;1 530 015;Tf;deep cave;452 333 971 530 015;7;;;
895;Tunel u Markuševcu;Croatia;10.4.2005.;2005-04-10;1f,1 juv m;2;Nesticidae;Nesticus;cellulanus;Nesticus cellulanus;;45 890 469;15 991 149;tf;deep cave;4 589 046 915 991 140;2;;;
898;Tunel u Markuševcu;Croatia;10.4.2005.;2005-04-10;1 m, 1 juv;2;Nesticidae;Nesticus;cellulanus;Nesticus cellulanus;;45 890 469;15 991 149;tf;deep cave;4 589 046 915 991 140;2;;;
905;Francuski rudnik 3;Croatia;24.11.2004.;2004-11-24;1juv m;1;Nesticidae;Nesticus;cellulanus;Nesticus cellulanus;;45 905 584;15 940 186;;deep cave;4 590 558 415 940 180;2;;;
908;Velika pe? (Rog);Croatia;20.3.2005.;2005-03-20;2 juv;2;Nesticidae;Nesticus;cellulanus;Nesticus cellulanus;;4 593 776;1 606 234;tf;deep cave;45 937 761 606 234;4;;;
909;Tunel u Markuševcu;Croatia;10.4.2005.;2005-04-10;1f,1 juv;2;Nesticidae;Nesticus;cellulanus;Nesticus cellulanus;;45 890 469;15 991 149;tf;deep cave;4 589 046 915 991 140;2;;;
913;Kosi?ev ponor;Croatia;20.5.2005.;2005-05-20;1 m;1;Nesticidae;Nesticus;cellulanus;Nesticus cellulanus;305;45 835 763;15 846 355;tf;deep cave;4 583 576 315 846 350;2;;;
917;Jama Vrap?anka;Croatia;8.2.2004.;2004-02-08;1 juv;1;Nesticidae;Nesticus;cellulanus;Nesticus cellulanus;397;45 848 567;15 892 337;;deep cave;4 584 856 715 892 330;3;;;
918;Križevš?ak spring;Croatia;28.5.2005.;2005-05-28;1 m;1;Nesticidae;Nesticus;cellulanus;Nesticus cellulanus;;45 837 713;15 858 133;tf;cave entrance;4 583 771 315 858 130;2;;;
924;Špilja Mikuli?ka;Croatia;7.2.1999.;1999-02-07;1m, 1 juv;2;Tetragnathidae;Metellina;merianae;Metellina merianae;585;45 759 693;15 527 832;Tf;deep cave;4 575 969 315 527 830;1;;;
926;Veternica;Croatia;13.5.2004.;2004-05-13;1 juv m;1;Nesticidae;Nesticus;cellulanus;Nesticus cellulanus;330;45 841 058;15 873 642;tf;deep cave;4 584 105 815 873 640;6;;;
929;Francuski rudnik 1;Croatia;16.4.2005.;2005-04-16;1 f;1;Nesticidae;Nesticus;cellulanus;Nesticus cellulanus;;4 591 305;15 940 454;tf;deep cave;459 130 515 940 454;3;;;
935;Jama Vrap?anka;Croatia;8.2.2004.;2004-02-08;1f;1;Linyphiidae;Gen.;sp. X;Gen. sp. X;397;45 848 567;15 892 337;;;4 584 856 715 892 330;3;;;
936;Oko Tisinog ponora;Croatia;22.5.2005.;2005-05-22;1f, 1 juv;2;Nesticidae;Gen.;sp.;Gen. sp.;649;45 918 842;15 963 461;;Shallow subterranean habitat;4 591 884 215 963 460;2;;;
937;Grgosova špilja stara;Croatia;13.10.2004.;2004-10-13;1 m,1 juv m;2;Nesticidae;Gen.;sp.;Gen. sp.;240;45 818 969;1 567 855;;deep cave;458 189 691 567 855;6;;;
939;Jama kraj ceste u Plitvi?kom klancu (ispred);Croatia;23.9.2005.;2005-09-23;1m;1;Agelenidae;Histopona;torpida;Histopona torpida;499;44 912 378;15 599 213;Tx;shallow subterranean habitat;4 491 237 815 599 210;1;;;
941;Tunel u Markuševcu;Croatia;10.4.2005.;2005-04-10;1 m;1;Agelenidae;Histopona;torpida;Histopona torpida;;45 890 469;15 991 149;Tx;deep cave;4 589 046 915 991 140;2;;;
944;Golubinka, Desne;Croatia;23.7.1997.;1997-07-23;2 juv m;2;Agelenidae;Histopona;sp.;Histopona sp.;40;43 065 371;17 527 293;;deep cave;4 306 537 117 527 290;3;;;
946;Špilja u Solinama;Croatia;18.6.2001.;2001-06-18;1 f;1;Agelenidae;Histopona;bidens;Histopona bidens;17;42 768 021;17 377 062;tb;deep cave;4 276 802 117 377 060;5;;;10,3
946;Špilja u Solinama;Croatia;18.6.2001.;2001-06-18;1 f;1;Agelenidae;Histopona;bidens;Histopona bidens;17;42 768 021;17 377 062;tb;deep cave;4 276 802 117 377 060;5;;;6,25
946;Špilja u Solinama;Croatia;18.6.2001.;2001-06-18;1 f;1;Agelenidae;Histopona;bidens;Histopona bidens;17;42 768 021;17 377 062;tb;deep cave;4 276 802 117 377 060;5;;;10,3
953;Kosi?ev ponor;Croatia;26.5.2005.;2005-05-26;1juv;1;Nesticidae;Nesticus;cellulanus;Nesticus cellulanus;305;45 835 763;15 846 355;tf;deep cave;4 583 576 315 846 350;2;;;
954;Šupljara;Croatia;24.9.2006.;2006-09-24;1 juv;1;Agelenidae;Tegenaria;sp.;Tegenaria sp.;;44 899 906;15 612 099;;deep cave;4 489 990 615 612 090;5;;;
956;Jamina, Biokovo;Croatia;28.10.2003.;2003-10-28;1 f;1;Agelenidae;Histopona;conveniens;Histopona conveniens;617;43 386 358;16 925 277;Tf;deep cave;4 338 635 816 925 270;4;;;
957;Kraljevska jama na Gulišini;Croatia;26.9.2000.;2000-09-26;1 juv;1;Agelenidae;Hadites;tegenarioides;Hadites tegenarioides;;43 133 120;16 744 319;TB;deep cave;4 313 312 016 744 310;3;;;
958;Jama pod Humcem;Croatia;7.8.1997.;1997-08-07;1juv f, 1 juv;2;Agelenidae;Hadites;tegenarioides;Hadites tegenarioides;;43 138 508;1 676 188;TB;deep cave;431 385 081 676 188;1;;;
959;Špilja Šparova greda;Croatia;2.3.2002.;2002-03-02;1 juv m;1;Agelenidae;Textrix;sp.;Textrix sp.;;43 811 864;1 651 955;;deep cave;438 118 641 651 955;2;;;
960;Jama pod Sv. Spasom;Croatia;17.6.2001.;2001-06-17;1f, 1m,5 juv;7;Agelenidae;Histopona;bidens;Histopona bidens;;42 731 779;17 542 409;tb;deep cave;4 273 177 917 542 400;6;;;14,6
961;?olnja?a;Croatia;19.1.1997.;1997-01-19;1 juv;1;Agelenidae;Histopona;sp.;Histopona sp.;;43 409 175;1 688 745;;deep cave;434 091 751 688 745;4;;;
962;Kukor;Croatia;27.7.2004.;2004-07-27;1 juv;1;Agelenidae;Histopona;sp.;Histopona sp.;425;43 355 609;16 991 707;;deep cave;4 335 560 916 991 700;10;;;15,4
964;Špilja pod Kapelu;Croatia;13.4.2003.;2003-04-13;1 juv m, 1 juv;2;Agelenidae;Hadites;tegenarioides;Hadites tegenarioides;;43 184 949;16 434 233;TB;deep cave;4 318 494 916 434 230;5;;;11,1
964;Špilja pod Kapelu;Croatia;13.4.2003.;2003-04-13;1 juv m, 1 juv;2;Agelenidae;Hadites;tegenarioides;Hadites tegenarioides;;43 184 949;16 434 233;TB;deep cave;4 318 494 916 434 230;5;;;14,333
965;Vlastelinka jama;Croatia;26.3.2003.;2003-03-26;2 juv;2;Agelenidae;Histopona;sp.;Histopona sp.;410;43 269 635;17 211 206;;deep cave;4 326 963 517 211 200;2;;;11,4
966;Jama na Teruncu;Croatia;26.7.2003.;2003-07-26;1f, 1 juv;2;Agelenidae;Hadites;tegenarioides;Hadites tegenarioides;244;4 313 221;16 991 729;TB;deep cave;431 322 116 991 729;2;;;
968;Modri? špilja;Croatia;20.9.2003.;2003-09-20;1 juv m;1;Agelenidae;Histopona;sp.;Histopona sp.;;4 425 684;15 537 248;;deep cave;442 568 415 537 248;1;;;16,3
970;Drinova 2;Croatia;23.3.2003.;2003-03-23;1 juv m;1;Agelenidae;Histopona;sp.;Histopona sp.;725;43 407 702;16 942 899;;deep cave;4 340 770 216 942 890;3;;;
971;Kraljevska jama na Gulišini;Croatia;27.2.1999.;1999-02-27;1f, 2 juv;3;Agelenidae;Hadites;tegenarioides;Hadites tegenarioides;;43 133 120;16 744 319;TB;deep cave;4 313 312 016 744 310;3;;;
972;Ješkalovica;Croatia;4.1.2009.;2009-01-04;1 f,1 juv;2;Nesticidae;Kryptonesticus;eremita;Kryptonesticus eremita;155;43 299 857;16 839 313;tf;deep cave;4 329 985 716 839 310;2;;;15,4
973;Pavši?a pe?a;Croatia;30.7.2007.;2007-07-30;3m, 1f, 3 juv;7;Nesticidae;Kryptonesticus;eremita;Kryptonesticus eremita;520;43 786 027;16 665 515;tf;deep cave;4 378 602 716 665 510;2;;;
974;Spilja od Tankega rota;Croatia;9.1.2000.;2000-01-09;4 f;4;Nesticidae;Kryptonesticus;eremita;Kryptonesticus eremita;115;43 012 832;16 111 537;tf;deep cave;4 301 283 216 111 530;1;;;17
975;Kraljevska jama na Gulišini;Croatia;27.2.1999.;1999-02-27;3 f;3;Nesticidae;Kryptonesticus;eremita;Kryptonesticus eremita;146;43 133 120;16 744 319;tf;deep cave;4 313 312 016 744 310;3;;;
976;Špilja na Vršinoj glavici;Croatia;30.7.2007.;2007-07-30;1f, 1juv;2;Nesticidae;Kryptonesticus;eremita;Kryptonesticus eremita;709;4 370 718;167 843;tf;deep cave;4 370 718 167 843;2;;;8,1
977;Kraljevska jama na Gulišini;Croatia;5.8.1997.;1997-08-05;2 f;2;Nesticidae;Kryptonesticus;eremita;Kryptonesticus eremita;146;43 133 120;16 744 319;tf;deep cave;4 313 312 016 744 310;3;;;
978;Živa voda;Croatia;9.-10.4.2004.;2004-04-09/2004-04-10;4 juv;4;Nesticidae;Kryptonesticus;eremita;Kryptonesticus eremita;;43 116 808;17 050 393;tf;deep cave;4 311 680 817 050 390;1;;;13,5
979;Dan?evi?a jama;Croatia;18.9.2005.;2005-09-18;1 f;1;Nesticidae;Kryptonesticus;eremita;Kryptonesticus eremita;;4 314 142;1 675 466;Tf;deep cave;43 141 421 675 466;2;;;
981;Kraljicina špilja;Croatia;3.4.1995.;1995-04-03;1f, 1 juv;2;Nesticidae;Kryptonesticus;eremita;Kryptonesticus eremita;;43 073 661;16 100 773;tf;deep cave;4 307 366 116 100 770;2;;;15,1
983;Špilja Šparova greda;Croatia;2.3.2002.;2002-03-02;1f;1;Nesticidae;Kryptonesticus;eremita;Kryptonesticus eremita;;43 811 864;1 651 955;tf;deep cave;438 118 641 651 955;2;;;
984;Brajkovica;Croatia;11.1.2000.;2000-01-11;1f, 1 juv;2;Nesticidae;Kryptonesticus;eremita;Kryptonesticus eremita;;43 042 669;16 099 975;tf;deep cave;4 304 266 916 099 970;2;;;
985;Živa voda;Croatia;9.8.1997.;1997-08-09;1f;1;Nesticidae;Kryptonesticus;eremita;Kryptonesticus eremita;;43 116 808;17 050 393;tf;deep cave;4 311 680 817 050 390;1;;;13,5
986;Živa voda;Croatia;27.-28.9.2000.;2000-09-27/2000-09-28;4 juv;4;Nesticidae;Kryptonesticus;eremita;Kryptonesticus eremita;;43 116 808;17 050 393;tf;deep cave;4 311 680 817 050 390;1;;;13,5
987;Dujina jama;Croatia;17.10.1999.;1999-10-17;3f, 1 juv m;4;Nesticidae;Kryptonesticus;eremita;Kryptonesticus eremita;77;43 489 889;1 606 565;tf;deep cave;434 898 891 606 565;1;;;
988;Živa voda;Croatia;9.-10.4.2004.;2004-04-09/2004-04-10;1juv m, 1 juv;2;Nesticidae;Kryptonesticus;eremita;Kryptonesticus eremita;;43 116 808;17 050 393;tf;deep cave;4 311 680 817 050 390;1;;;13,5
990;Kraljicina špilja;Croatia;10.1.2000.;2000-01-10;5 f,1 juv m,6 juv;12;Nesticidae;Kryptonesticus;eremita;Kryptonesticus eremita;;43 073 661;16 100 773;tf;deep cave;4 307 366 116 100 770;2;;;15,1
992;Franetova jama;Croatia;28.2.1999.;1999-02-28;2f;2;Nesticidae;Kryptonesticus;eremita;Kryptonesticus eremita;;431 361;169 384;tf;deep cave;431 361 169 384;2;;;
993;Špilja iznad Grap?eve špilje;Croatia;17.9.1995.;1995-09-17;1f;1;Nesticidae;Kryptonesticus;eremita;Kryptonesticus eremita;;43 137 114;16 753 747;tf;deep cave;4 313 711 416 753 740;1;;;
994;Tužna jama;Croatia;9.1.2000.;2000-01-09;1f, 1 juv;2;Nesticidae;Kryptonesticus;eremita;Kryptonesticus eremita;302;43 059 014;16 137 969;tf;deep cave;4 305 901 416 137 960;1;;;
997;Kraljevska jama na Gulišini;Croatia;26.9.2000.;2000-09-26;1 juv;1;Nesticidae;Kryptonesticus;eremita;Kryptonesticus eremita;;43 133 120;16 744 319;tf;deep cave;4 313 312 016 744 310;3;;;
998;Bežmekova jama;Croatia;29.9.1996.;1996-09-29;2 juv;2;Nesticidae;Kryptonesticus;eremita;Kryptonesticus eremita;565;43 311 389;16 625 833;;deep cave;4 331 138 916 625 830;1;;;
999;Kraljevska jama na Gulišini;Croatia;2.4.2005.;2005-04-02;1 juv m;1;Nesticidae;Kryptonesticus;eremita;Kryptonesticus eremita;;43 133 120;16 744 319;tf;deep cave;4 313 312 016 744 310;3;;;
1001;Škrabuljica;Croatia;11.3.2003.;2003-03-11;1 juv;1;Dysderidae;Stalagtia;sp. 2;Stalagtia sp. 2;685;42 567 045;18 385 063;Tb;deep cave;4 256 704 518 385 060;5;;;10,867
1002;Vratolomka;Croatia;31.7.2006.;2006-07-31;1 f;1;Agelenidae;Histopona;egonpretneri;Histopona egonpretneri;35;44 191 701;15 785 015;Tb;deep cave;4 419 170 115 785 010;2;;;
1003;Špilja kod mlina Miljacki (Miljacka 4);Croatia;6.1.2005.;2005-01-06;2 juv;2;Agelenidae;Tegenaria;sp.;Tegenaria sp.;175;44 003 485;16 019 087;;deep cave;4 400 348 516 019 080;2;;;16
1004;Tradanj;Croatia;8.1.2005.;2005-01-08;1f;1;Agelenidae;Tegenaria;domestica;Tegenaria domestica;;43 793 104;15 845 439;Tf;deep cave;4 379 310 415 845 430;3;;;
1005;Miljacka 2;Croatia;6.1.2005.;2005-01-06;1f;1;Agelenidae;Gen.;sp.;Gen. sp.;;440 002;16 016 234;;deep cave;44 000 216 016 234;4;;;12,6
1008;Topla pe?ina;Croatia;7.1.2005.;2005-01-07;1 f,3 juv;4;Nesticidae;Kryptonesticus;eremita;Kryptonesticus eremita;;43 839 254;160 536;tf;deep cave;43 839 254 160 536;4;;;
1009;Miljacka 2;Croatia;6.1.2005.;2005-01-06;2f, 1m;3;Nesticidae;Kryptonesticus;eremita;Kryptonesticus eremita;;440 002;16 016 234;tf;deep cave;44 000 216 016 234;4;;;12,6
1011;Špilja kod Vilišnice;Croatia;4.5.2005.;2005-05-04;1f;1;Nesticidae;Kryptonesticus;eremita;Kryptonesticus eremita;;43 960 355;15 450 916;tf;deep cave;4 396 035 515 450 910;2;;;12,9
1014;Mili?a špilja;Croatia;30.7.2006.;2006-07-30;1 f;1;Nesticidae;Kryptonesticus;eremita;Kryptonesticus eremita;;44 143 333;15 803 133;tf;deep cave;4 414 333 315 803 130;1;;;13
1014;Mili?a špilja;Croatia;30.7.2006.;2006-07-30;1 f;1;Nesticidae;Kryptonesticus;eremita;Kryptonesticus eremita;;44 143 333;15 803 133;tf;deep cave;4 414 333 315 803 130;1;;;12,2
1015;Tradanj;Croatia;8.1.2005.;2005-01-08;1 f;1;Theridiidae;Episinus;cavernicola;Episinus cavernicola;;43 793 104;15 845 439;Tf;deep cave;4 379 310 415 845 430;3;;;
1018;Špilja kod Vilišnice;Croatia;4.5.2005.;2005-05-04;1 m,2 juv;3;Nesticidae;Kryptonesticus;eremita;Kryptonesticus eremita;;43 960 355;15 450 916;tf;deep cave;4 396 035 515 450 910;2;;;12,9
1021;Jezero, Iž;Croatia;30.7.1995.;1995-07-30;2 f,1 juv;3;Nesticidae;Kryptonesticus;eremita;Kryptonesticus eremita;;44 030 833;15 132 778;Tf;deep cave;4 403 083 315 132 770;1;;;
1022;Topla pe?ina;Croatia;7.1.2005.;2005-01-07;2 f,1 m,1 juv;4;Nesticidae;Kryptonesticus;eremita;Kryptonesticus eremita;;43 839 254;160 536;tf;deep cave;43 839 254 160 536;4;;;
1023;Stražbenica;Croatia;29.3.2005.;2005-03-29;1 f,1 juv m,3 juv;5;Nesticidae;Kryptonesticus;eremita;Kryptonesticus eremita;;43 697 353;16 029 618;tf;deep cave;4 369 735 316 029 610;3;;;14,7
1024;Drenova?a;Croatia;12.10.2003.;2003-10-12;1 f;1;Nesticidae;Kryptonesticus;eremita;Kryptonesticus eremita;;43 954 975;15 946 464;tf;deep cave;4 395 497 515 946 460;2;;;
1025;Tavnica;Croatia;8.1.2005.;2005-01-08;2 f,3 juv;5;Nesticidae;Kryptonesticus;eremita;Kryptonesticus eremita;;43 972 099;15 947 296;tf;deep cave;4 397 209 915 947 290;3;;;
1026;Stražbenica;Croatia;31.1.2001.;2001-01-31;1 f,1 juv m;2;Nesticidae;Kryptonesticus;eremita;Kryptonesticus eremita;;43 697 353;16 029 618;tf;deep cave;4 369 735 316 029 610;3;;;14,7
1027;Velika Kusa?a;Croatia;29.7.2003.;2003-07-29;1 juv;1;Nesticidae;Kryptonesticus;eremita;Kryptonesticus eremita;;44 139 892;15 842 169;tf;deep cave;4 413 989 215 842 160;1;;;13,2
1027;Velika Kusa?a;Croatia;29.7.2003.;2003-07-29;1 juv;1;Nesticidae;Kryptonesticus;eremita;Kryptonesticus eremita;;44 139 892;15 842 169;tf;deep cave;4 413 989 215 842 160;1;;;13,4
1030;Mili?a špilja;Croatia;30.7.2006.;2006-07-30;1 f, 3 juv;4;Nesticidae;Kryptonesticus;eremita;Kryptonesticus eremita;;44 143 333;15 803 133;tf;deep cave;4 414 333 315 803 130;1;;;13
1030;Mili?a špilja;Croatia;30.7.2006.;2006-07-30;1 f, 3 juv;4;Nesticidae;Kryptonesticus;eremita;Kryptonesticus eremita;;44 143 333;15 803 133;tf;deep cave;4 414 333 315 803 130;1;;;12,2
1031;Mala Kusa?a;Croatia;29.7.2006.;2006-07-29;1 f,1 m,1juv;3;Nesticidae;Kryptonesticus;eremita;Kryptonesticus eremita;;44 139 831;15 842 079;tf;deep cave;4 413 983 115 842 070;2;;;13,3
1032;Maksimova špilja;Croatia;22.4.2006.;2006-04-22;1 juv;1;Nesticidae;Nesticus;cellulanus;Nesticus cellulanus;493;45 518 313;1 768 695;tf;deep cave;455 183 131 768 695;3;;;10,1
1032;Maksimova špilja;Croatia;22.4.2006.;2006-04-22;1 juv;1;Nesticidae;Nesticus;cellulanus;Nesticus cellulanus;493;45 518 313;1 768 695;tf;deep cave;455 183 131 768 695;3;;10,8;10,8
1033;Trbušnjak;Croatia;29.7.2006.;2006-07-29;1f;1;Nesticidae;Nesticus;cellulanus;Nesticus cellulanus;185;45 495 969;17 263 219;tf;deep cave;4 549 596 917 263 210;3;;;
1034;Trbušnjak;Croatia;10.6.2007.;2007-06-10;1 m;1;Nesticidae;Nesticus;cellulanus;Nesticus cellulanus;;45 495 969;17 263 219;tf;deep cave;4 549 596 917 263 210;3;;;
1035;Sokolina špilja;Croatia;19.7.2004.;2004-07-19;1 m;1;Nesticidae;Nesticus;cellulanus;Nesticus cellulanus;;45 461 454;17 566 155;Tf;deep cave;4 546 145 417 566 150;1;;;10,8
1047;Uviraljka;Croatia;23.4.2006.;2006-04-23;1m;1;Agelenidae;Histopona;luxurians;Histopona luxurians;810;45 522 243;1 762 067;tf;deep cave;455 222 431 762 067;3;;;
1048;Medvje?a špilja, Mali Lošinj;Croatia;20.3.2005.;2005-03-20;1f,1 juv m;2;Nesticidae;Kryptonesticus;eremita;Kryptonesticus eremita;;44 605 518;1 440 794;tf;deep cave;446 055 181 440 794;1;;;
1050;Biserujka;Croatia;19.10.2000.;2000-10-19;1f;1;Nesticidae;Kryptonesticus;eremita;Kryptonesticus eremita;;45 187 464;1 460 981;tf;deep cave;451 874 641 460 981;1;;;14,8
1051;Jama Baredine;Croatia;31.10.1998.;1998-10-31;1f,1 juv m;2;Nesticidae;Kryptonesticus;eremita;Kryptonesticus eremita;;45 270 267;13 661 985;tf;deep cave;4 527 026 713 661 980;1;;;
1052;Medova buža;Croatia;29.5.2001.;2001-05-29;1 f;1;Nesticidae;Kryptonesticus;eremita;Kryptonesticus eremita;;44 813 345;14 745 867;;deep cave;4 481 334 514 745 860;1;;;14,9
1055;Sedrena špilja iza mlina;Croatia;3.5.2010.;2010-05-03;1m;1;Leptonetidae;Barusia;maheni;Barusia maheni;198;44 013 402;16 067 798;tf;deep cave;4 401 340 216 067 790;6;;;7,9
1056;Piskovica;Croatia;13.5.2002.;2002-05-13;1 f;1;Nesticidae;Kryptonesticus;eremita;Kryptonesticus eremita;315;4 526 207;1 403 692;tf;deep cave;45 262 071 403 692;1;;;
1058;?ampari;Croatia;20.10.2000.;2000-10-20;1 m,1 juv;2;Agelenidae;Tegenaria;silvestris;Tegenaria silvestris;312;45 123 809;14 333 655;Tf;deep cave;4 512 380 914 333 650;4;;;
1059;Oštirova jama;Croatia;18.9.2007.;2007-09-18;1f,1 juv;2;Agelenidae;Tegenaria;sp. 1;Tegenaria sp. 1;740;45 355 854;14 123 988;SubTf?;deep cave;4 535 585 414 123 980;3;;;
1060;Jama za greben;Croatia;6.11.2006.;2006-11-06;1juv;1;Agelenidae;Tegenaria;sp.;Tegenaria sp.;;45 314 602;14 205 191;SubTf?;deep cave;4 531 460 214 205 190;1;;;
1061;Pe?ina poli vrti?a;Croatia;6.11.2006.;2006-11-06;1f;1;Agelenidae;Tegenaria;silvestris;Tegenaria silvestris;;45 327 434;14 180 962;Tf;deep cave;4 532 743 414 180 960;1;;;
1063;Jama u Krogu;Croatia;15.9.2007.;2007-09-15;1f;1;Agelenidae;Tegenaria;sp. 1;Tegenaria sp. 1;;45 378 389;1 416 897;SubTf?;deep cave;453 783 891 416 897;2;;2,5;2,45
1064;Markova jama kod Tara;Croatia;12.5.2001.;2001-05-12;2f,1 juv m,5 juv;8;Nesticidae;Kryptonesticus;eremita;Kryptonesticus eremita;95;45 319 298;13 631 373;tf;deep cave;4 531 929 813 631 370;7;;;
1066;Romualdova špilja;Croatia;28.8.1997.;1997-08-28;1f,1 juv;2;Nesticidae;Kryptonesticus;eremita;Kryptonesticus eremita;120;45 127 466;13 737 433;tf;deep cave;4 512 746 613 737 430;1;;;
1068;Piskovica;Croatia;6.8.2003.;2003-08-06;1f;1;Nesticidae;Kryptonesticus;eremita;Kryptonesticus eremita;315;4 526 207;1 403 692;tf;deep cave;45 262 071 403 692;1;;;
1069;Kus;Croatia;2.11.2001.;2001-11-02;1 juv m;1;Nesticidae;Kryptonesticus;eremita;Kryptonesticus eremita;165;44 814 755;14 426 275;;deep cave;4 481 475 514 426 270;2;;;
1070;Rupe 1;Croatia;17.9.2007.;2007-09-17;1f;1;Agelenidae;Tegenaria;silvestris;Tegenaria silvestris;;45 253 697;14 199 858;Tf;deep cave;4 525 369 714 199 850;1;;;
1071;Jama u Krogu;Croatia;15.9.1997.;1997-09-15;1f;1;Agelenidae;Tegenaria;sp. 1;Tegenaria sp. 1;;45 378 389;1 416 897;SubTf?;deep cave;453 783 891 416 897;2;;2,5;2,45
1076;Jama Ikinica;Croatia;13.8.2001.;2001-08-13;1 juv;1;Nesticidae;Kryptonesticus;eremita;Kryptonesticus eremita;;44 924 393;13 947 791;;deep cave;4 492 439 313 947 790;3;;;
1082;Jama kod potoka Banine 3;Croatia;4.11.2006.;2006-11-04;1 f;1;Nesticidae;Kryptonesticus;eremita;Kryptonesticus eremita;509;45 313 714;14 242 713;Tf;deep cave;4 531 371 414 242 710;3;;;
1088;Sini?i? špilja;Croatia;7.10.2006.;2006-10-07;1f,1 juv m;2;Agelenidae;Tegenaria;silvestris;Tegenaria silvestris;;44 990 698;15 177 848;Tf;deep cave;4 499 069 815 177 840;6;;;
1090;Vrelo 2;Croatia;6.9.1995.;1995-09-06;1m;1;Agelenidae;Tegenaria;silvestris;Tegenaria silvestris;;45 326 489;14 704 217;Tf;deep cave;4 532 648 914 704 210;8;;;
1092;Vrtare male;Croatia;7.10.2006.;2006-10-07;1f,1m,1 juv;3;Nesticidae;Kryptonesticus;eremita;Kryptonesticus eremita;;45 197 431;14 660 523;tf;deep cave;4 519 743 114 660 520;1;;;
1094;Vrtare male;Croatia;10.7.2005.;2005-07-10;1 juv m;1;Nesticidae;Kryptonesticus;eremita;Kryptonesticus eremita;;45 197 431;14 660 523;tf;deep cave;4 519 743 114 660 520;1;;;
1098;Mramornica, Lika;Croatia;30.6.1999.;1999-06-30;1f;1;Theridiidae;Gen.;sp.;Gen. sp.;;44 772 186;15 181 912;;;4 477 218 615 181 910;2;;;
1106;Piliš?e;Croatia;6.2.1999.;1999-02-06;1f;1;Agelenidae;Inermocoelotes;inermis;Inermocoelotes inermis;;46 231 366;16 511 903;;deep cave;4 623 136 616 511 900;1;;;
1108;Vila;Croatia;6.11.2007.;2007-11-06;1f;1;Nesticidae;Nesticus;cellulanus;Nesticus cellulanus;613;46 265 771;15 995 721;tf;deep cave;4 626 577 115 995 720;2;;;
1115;Jama u Dubokom dolu;Croatia;27.4.2004.;2004-04-27;1 f,4 juv;5;Linyphiidae;Typhlonyphia;reimoseri;Typhlonyphia reimoseri;;42 946 895;17 022 321;tb;deep cave;4 294 689 517 022 320;3;;;
1116;Jama MB3;Croatia;23.6.2005.;2005-06-23;1f, 1 juv m;2;Linyphiidae;Troglohyphantes;sp. 14;Troglohyphantes sp. 14;;44 362 422;15 490 195;tb;deep cave;4 436 242 215 490 190;1;;;
1117;Špilja u zubu Buljme;Croatia;13.9.2006.;2006-09-13;1 f;1;Linyphiidae;Troglohyphantes;sp. 14;Troglohyphantes sp. 14;;44 366 906;15 470 541;tb;deep cave;4 436 690 615 470 540;1;;;5,4
1118;Špilja pod Velji vrh;Croatia;25.4.2004.;2004-04-25;1 f;1;Linyphiidae;Typhlonyphia;reimoseri;Typhlonyphia reimoseri;;42 953 716;17 039 919;tb;deep cave;4 295 371 617 039 910;2;;;
1119;Bošak jama;Croatia;21.3.2004.;2004-03-21;1 f,5 juv;6;Linyphiidae;Typhlonyphia;sp. 1;Typhlonyphia sp. 1;739;43 347 996;17 100 045;Tb;deep cave;4 334 799 617 100 040;2;;;7,4
1120;?ampari;Croatia;20.10.2000.;2000-10-20;1 m;1;Linyphiidae;Troglohyphantes;liburnicus;Troglohyphantes liburnicus;312;45 123 809;14 333 655;Tb;deep cave;4 512 380 914 333 650;4;;;
1121;Rastova?a;Croatia;2.8.2005.;2005-08-02;2 f,4 juv;6;Linyphiidae;Troglohyphantes;roberti;Troglohyphantes roberti;380;44 233 742;15 698 969;tb;deep cave;4 423 374 215 698 960;2;;;
1122;Jama pod Osojem;Croatia;28.10.2008.;2008-10-28;1f, 1m;2;Linyphiidae;Typhlonyphia;sp. 1;Typhlonyphia sp. 1;;43 251 441;17 118 374;Tb;deep cave;4 325 144 117 118 370;3;;7;7
1123;Bršljanovica;Croatia;22.3.1997.;1997-03-22;1 f;1;Linyphiidae;Troglohyphantes;brignolii;Troglohyphantes brignolii;;45 348 192;14 134 112;tb;deep cave;4 534 819 214 134 110;1;;;
1124;Kapaljka 1;Croatia;1.6.1997.;1997-06-01;3 f,1 m;4;Linyphiidae;Troglohyphantes;croaticus;Troglohyphantes croaticus;;45 459 187;14 675 404;Tb;deep cave;4 545 918 714 675 400;2;;;
1125;Jama na Horvatovoj stazi;Croatia;2.8.2003.;2003-08-02;1 f,1 m;2;Linyphiidae;Troglohyphantes;croaticus;Troglohyphantes croaticus;850;45 426 902;1 467 011;Tb;deep cave;454 269 021 467 011;1;;;
1126;Volareva jama;Croatia;25.3.1999.;1999-03-25;1f;1;Linyphiidae;Troglohyphantes;liburnicus;Troglohyphantes liburnicus;;45 414 689;14 300 831;Tb;deep cave;4 541 468 914 300 830;1;;;
1128;Mar?ina jama;Croatia;6.4.1997.;1997-04-06;1 f;1;Linyphiidae;Troglohyphantes;strandi;Troglohyphantes strandi;;43 597 526;16 221 955;tb;deep cave;4 359 752 616 221 950;1;;;
1129;Ponor Vele vode;Croatia;12.7.2004.;2004-07-12;1 f,2 juv;3;Linyphiidae;Troglohyphantes;croaticus;Troglohyphantes croaticus;680;45 418 527;14 693 695;Tb;deep cave;4 541 852 714 693 690;3;;;
1130;Sinkhole in Javorje;Croatia;18.7.1999.;1999-07-18;1 m;1;Linyphiidae;Troglohyphantes;excavatus;Troglohyphantes excavatus;;45 096 444;14 916 321;tf;shallow subterranean habitat;4 509 644 414 916 320;1;;;
1131;Brezdanja?a na Stražbenici;Croatia;15.8.1993.;1993-08-15;1f;1;Linyphiidae;Troglohyphantes;liburnicus;Troglohyphantes liburnicus;;4 526 712;14 691 436;Tb;deep cave;452 671 214 691 436;4;;;
1132;Gordanova jama;Croatia;23.4.2000.;2000-04-23;1f;1;Linyphiidae;Troglohyphantes;croaticus;Troglohyphantes croaticus;875;45 455 731;14 792 266;Tb;deep cave;4 545 573 114 792 260;2;;;
1133;Poputna jama;Croatia;30.7.2003.;2003-07-30;1f;1;Linyphiidae;Troglohyphantes;croaticus;Troglohyphantes croaticus;1292;45 435 917;1 461 605;Tb;deep cave;454 359 171 461 605;1;;;
1134;Brezdanja?a na Stražbenici;Croatia;15.8.1993.;1993-08-15;1 m;1;Linyphiidae;Troglohyphantes;croaticus;Troglohyphantes croaticus;;4 526 712;14 691 436;Tb;deep cave;452 671 214 691 436;4;;;
1135;Kuštrovka;Croatia;13.12.2003.;2003-12-13;2 f;2;Linyphiidae;Troglohyphantes;croaticus;Troglohyphantes croaticus;450;45 346 234;15 219 338;Tb;deep cave;4 534 623 415 219 330;3;;;
1136;Jama Štemajzlinka;Croatia;2.8.2003.;2003-08-02;1 f;1;Linyphiidae;Troglohyphantes;croaticus;Troglohyphantes croaticus;963;45 462 153;14 613 912;Tb;deep cave;4 546 215 314 613 910;1;;;
1137;Gornja Bara?eva;Croatia;17.5.2004.;2004-05-17;3 f;3;Linyphiidae;Troglohyphantes;excavatus;Troglohyphantes excavatus;;44 983 895;15 721 656;tf;deep cave;4 498 389 515 721 650;8;;;
1138;Špilja kod Turkovi?a;Croatia;1.7.2004.;2004-07-01;1 m;1;Linyphiidae;Troglohyphantes;croaticus;Troglohyphantes croaticus;;45 275 344;15 164 792;Tb;deep cave;4 527 534 415 164 790;1;;;
1139;Jama na vrtlu u Biljevini;Croatia;23.9.2005.;2005-09-23;1 f;1;Linyphiidae;Troglohyphantes;excavatus;Troglohyphantes excavatus;;44 921 647;15 581 161;tf;deep cave;4 492 164 715 581 160;2;;;
1140;Francuski rudnik 1;Croatia;16.4.2004.;2004-04-16;1 f;1;Linyphiidae;Troglohyphantes;excavatus;Troglohyphantes excavatus;;4 591 305;15 940 454;tf;deep cave;459 130 515 940 454;3;;;
1141;Tounj?ica;Croatia;18.6.2006.;2006-06-18;2 f;2;Linyphiidae;Troglohyphantes;croaticus;Troglohyphantes croaticus;;45 248 722;15 322 408;Tb;deep cave;4 524 872 215 322 400;5;;;14
1142;Golubinka više Mrši?a strane;Croatia;5.8.2006.;2006-08-05;2 f;2;Linyphiidae;Troglohyphantes;roberti;Troglohyphantes roberti;;4 412 501;15 807 683;tb;deep cave;441 250 115 807 683;3;;7,1;7,45
1143;Tounj?ica;Croatia;19.8.1999.;1999-08-19;3 f;3;Linyphiidae;Troglohyphantes;croaticus;Troglohyphantes croaticus;;45 248 722;15 322 408;Tb;deep cave;4 524 872 215 322 400;5;;;14
1144;Plantaža;Croatia;11.6.2005.;2005-06-11;1 f;1;Linyphiidae;Troglohyphantes;croaticus;Troglohyphantes croaticus;;45 227 501;15 325 084;Tb;deep cave;4 522 750 115 325 080;2;;;
1145;Pe?ina u Topolovcu;Croatia;22.9.2001.;2001-09-22;1 m;1;Linyphiidae;Troglohyphantes;brignolii;Troglohyphantes brignolii;;45 374 121;14 193 699;Tb;deep cave;4 537 412 114 193 690;2;;;
1147;?utno;Croatia;27.1.2001.;2001-01-27;1 f,1 juv;2;Linyphiidae;Troglohyphantes;croaticus;Troglohyphantes croaticus;210;45 415 607;15 233 039;tb;deep cave;4 541 560 715 233 030;4;;;7,75
1149;Golubinka, Desne;Croatia;23.7.1997.;1997-07-23;1 juv;1;Nesticidae;Kryptonesticus;eremita;Kryptonesticus eremita;40;43 065 371;17 527 293;;deep cave;4 306 537 117 527 290;3;;;
1150;Movrica;Croatia;17.6.2001.;2001-06-17;3 f,1 juv;4;Agelenidae;Histopona;bidens;Histopona bidens;;42 752 604;17 551 145;tb;deep cave;4 275 260 417 551 140;6;;;11,9
1152;Špilja kod Nerezinog dola;Croatia;2.12.2001.;2001-12-02;1 juv;1;Agelenidae;Histopona;bidens;Histopona bidens;;42 758 378;17 436 094;tb;deep cave;4 275 837 817 436 090;6;;;15,5
1152;Špilja kod Nerezinog dola;Croatia;2.12.2001.;2001-12-02;1 juv;1;Agelenidae;Histopona;bidens;Histopona bidens;;42 758 378;17 436 094;tb;deep cave;4 275 837 817 436 090;6;;;12,267
1154;Grizeljeva jama;Croatia;8.8.2007.;2007-08-08;2 juv m;2;Nesticidae;Kryptonesticus;eremita;Kryptonesticus eremita;;43 867 534;16 399 097;;deep cave;4 386 753 416 399 090;5;;;
1155;Špilja na Gradini kod Premanture;Croatia;13.7.2005.;2005-07-13;2 juv;2;Nesticidae;Kryptonesticus;eremita;Kryptonesticus eremita;38;44 786 909;13 907 968;tf;deep cave;4 478 690 913 907 960;3;;;13,875
1157;Tu?epska vilenja?a;Croatia;17.6.2002.;2002-06-17;1 juv,1juv m,1f;3;Agelenidae;Histopona;conveniens;Histopona conveniens;1181;43 286 465;17 083 638;Tf;deep cave;4 328 646 517 083 630;8;;;9,967
1157;Tu?epska vilenja?a;Croatia;17.6.2002.;2002-06-17;1 juv,1juv m,1f;3;Agelenidae;Histopona;conveniens;Histopona conveniens;1181;43 286 465;17 083 638;Tf;deep cave;4 328 646 517 083 630;8;;;11,2
1157;Tu?epska vilenja?a;Croatia;17.6.2002.;2002-06-17;1 juv,1juv m,1f;3;Agelenidae;Histopona;conveniens;Histopona conveniens;1181;43 286 465;17 083 638;Tf;deep cave;4 328 646 517 083 630;8;;10,6;11,025
1158;Ostaševica;Croatia;17.6.2001.;2001-06-17;1f,1 juv;2;Agelenidae;Histopona;bidens;Histopona bidens;;42 748 959;17 544 404;tb;deep cave;4 274 895 917 544 400;9;;;11,4
1159;Manita pe?;Croatia;12.8.1998.;1998-08-12;1 juv;1;Agelenidae;Histopona;sp.;Histopona sp.;520;44 314 302;15 475 264;;deep cave;4 431 430 215 475 260;7;;;9,8
1159;Manita pe?;Croatia;12.8.1998.;1998-08-12;1 juv;1;Agelenidae;Histopona;sp.;Histopona sp.;520;44 314 302;15 475 264;;deep cave;4 431 430 215 475 260;7;;8,8;9,25
1160;Mo?iljska špilja;Croatia;21.6.2001.;2001-06-21;2f,2m,2 juv;6;Nesticidae;Kryptonesticus;eremita;Kryptonesticus eremita;;42 689 061;18 071 906;tf;deep cave;4 268 906 118 071 900;6;;15,4;14,7
1161;Tu?epska vilenja?a;Croatia;17.6.2002.;2002-06-17;1 m, 2juv;3;Agelenidae;Histopona;conveniens;Histopona conveniens;1181;43 286 465;17 083 638;Tf;deep cave;4 328 646 517 083 630;8;;;9,967
1161;Tu?epska vilenja?a;Croatia;17.6.2002.;2002-06-17;1 m, 2juv;3;Agelenidae;Histopona;conveniens;Histopona conveniens;1181;43 286 465;17 083 638;Tf;deep cave;4 328 646 517 083 630;8;;;11,2
1161;Tu?epska vilenja?a;Croatia;17.6.2002.;2002-06-17;1 m, 2juv;3;Agelenidae;Histopona;conveniens;Histopona conveniens;1181;43 286 465;17 083 638;Tf;deep cave;4 328 646 517 083 630;8;;10,6;11,025
1162;Tu?epska vilenja?a;Croatia;23.5.2004.;2004-05-23;1 juv;1;Agelenidae;Histopona;sp.;Histopona sp.;1181;43 286 465;17 083 638;;deep cave;4 328 646 517 083 630;8;;;9,967
1162;Tu?epska vilenja?a;Croatia;23.5.2004.;2004-05-23;1 juv;1;Agelenidae;Histopona;sp.;Histopona sp.;1181;43 286 465;17 083 638;;deep cave;4 328 646 517 083 630;8;;;11,2
1162;Tu?epska vilenja?a;Croatia;23.5.2004.;2004-05-23;1 juv;1;Agelenidae;Histopona;sp.;Histopona sp.;1181;43 286 465;17 083 638;;deep cave;4 328 646 517 083 630;8;;10,6;11,025
1164;Pišurka;Croatia;2.6.2000.;2000-06-02;1f,1 juv m,1 juv;3;Nesticidae;Kryptonesticus;eremita;Kryptonesticus eremita;39;42 959 451;17 129 228;tf;deep cave;4 295 945 117 129 220;5;;;13,925
1165;Jama za Mahrincem;Croatia;5.1.2009.;2009-01-05;3f,2m,2 juv;7;Nesticidae;Kryptonesticus;eremita;Kryptonesticus eremita;;43 344 348;1 674 088;tf;deep cave;433 443 481 674 088;2;;;9,9
1166;Bazgova?a;Croatia;4.8.2004.;2004-08-04;1 juv;1;Nesticidae;Kryptonesticus;eremita;Kryptonesticus eremita;;4 330 647;16 622 143;;deep cave;433 064 716 622 143;3;;;7,2
1167;Jama za Mahrincem;Croatia;24.10.2007.;2007-10-24;1f,1m,4 juv;6;Nesticidae;Kryptonesticus;eremita;Kryptonesticus eremita;;43 344 348;1 674 088;tf;deep cave;433 443 481 674 088;2;;;9,9
1168;Bali?a špilja;Croatia;4.8.2007.;2007-08-04;1 m;1;Nesticidae;Kryptonesticus;eremita;Kryptonesticus eremita;405;4 357 296;1 657 002;tf;deep cave;43 572 961 657 002;11;;;7,2
1169;Golubnja?a, Žegar;Croatia;2.8.2006.;2006-08-02;1f,1m;2;Nesticidae;Kryptonesticus;eremita;Kryptonesticus eremita;243;44 131 933;15 851 054;tf;deep cave;4 413 193 315 851 050;6;;;
1171;Golubnja?a, Žegar;Croatia;2.8.2006.;2006-08-02;1 f;1;Nesticidae;Kryptonesticus;eremita;Kryptonesticus eremita;243;44 131 933;15 851 054;tf;deep cave;4 413 193 315 851 050;6;;;
1172;Manita pe?;Croatia;3.9.1999.;1999-09-03;1 juv;1;Agelenidae;Histopona;sp.;Histopona sp.;520;44 314 302;15 475 264;;deep cave;4 431 430 215 475 260;7;;;9,8
1172;Manita pe?;Croatia;3.9.1999.;1999-09-03;1 juv;1;Agelenidae;Histopona;sp.;Histopona sp.;520;44 314 302;15 475 264;;deep cave;4 431 430 215 475 260;7;;8,8;9,25
1173;Manita pe?;Croatia;7.6.2006.;2006-06-07;1 f;1;Agelenidae;Histopona;egonpretneri;Histopona egonpretneri;520;44 314 302;15 475 264;Tb;deep cave;4 431 430 215 475 260;7;;;9,8
1173;Manita pe?;Croatia;7.6.2006.;2006-06-07;1 f;1;Agelenidae;Histopona;egonpretneri;Histopona egonpretneri;520;44 314 302;15 475 264;Tb;deep cave;4 431 430 215 475 260;7;;8,8;9,25
1175;Grap?eva špilja;Croatia;4.4.2005.;2005-04-04;1 juv;1;Agelenidae;Hadites;tegenarioides;Hadites tegenarioides;200;43 134 189;16 753 732;TB;deep cave;4 313 418 916 753 730;5;;;11,1
1175;Grap?eva špilja;Croatia;4.4.2005.;2005-04-04;1 juv;1;Agelenidae;Hadites;tegenarioides;Hadites tegenarioides;200;43 134 189;16 753 732;TB;deep cave;4 313 418 916 753 730;5;;;15,35
1176;Grap?eva špilja;Croatia;4.4.2005.;2005-04-04;1 f,2 juv;3;Nesticidae;Kryptonesticus;eremita;Kryptonesticus eremita;200;43 134 189;16 753 732;tf;deep cave;4 313 418 916 753 730;5;;;11,1
1176;Grap?eva špilja;Croatia;4.4.2005.;2005-04-04;1 f,2 juv;3;Nesticidae;Kryptonesticus;eremita;Kryptonesticus eremita;200;43 134 189;16 753 732;tf;deep cave;4 313 418 916 753 730;5;;;15,35
1177;Špilja na Gradini kod Premanture;Croatia;13.7.2004.;2004-07-13;2 f,3 juv;5;Nesticidae;Kryptonesticus;eremita;Kryptonesticus eremita;38;44 786 909;13 907 968;tf;deep cave;4 478 690 913 907 960;3;;;13,875
1178;Špilja na Gradini kod Premanture;Croatia;20.11.2006.;2006-11-20;2f;2;Nesticidae;Kryptonesticus;eremita;Kryptonesticus eremita;38;44 786 909;13 907 968;tf;deep cave;4 478 690 913 907 960;3;;;13,875
1180;Špilja u uvali Predpe?;Croatia;6.4.2008.;2008-04-06;1 f,2 juv;3;Nesticidae;Kryptonesticus;eremita;Kryptonesticus eremita;;45 291 576;14 510 419;tf;deep cave;4 529 157 614 510 410;4;;10,3;10,625
1181;Golubnja?a, kanjon Korane;Croatia;24.9.2005.;2005-09-24;1 juv;1;Nesticidae;Nesticus;cellulanus;Nesticus cellulanus;;44 761 303;15 590 569;Tf;deep cave;4 476 130 315 590 560;1;;;
1183;Šipun;Croatia;27.3.2003.;2003-03-27;3 juv;3;Agelenidae;Histopona;sp.;Histopona sp.;;42 583 646;18 217 986;;deep cave;4 258 364 618 217 980;11;;;15,4
1184;Šipun;Croatia;11.2.2005.;2005-02-11;1 f,2juv;3;Agelenidae;Histopona;dubia;Histopona dubia;;42 583 646;18 217 986;tb;deep cave;4 258 364 618 217 980;11;;;15,4
1189;Šipun;Croatia;11.2.2005.;2005-02-11;1 juv;1;Agelenidae;Histopona;sp.;Histopona sp.;;42 583 646;18 217 986;;deep cave;4 258 364 618 217 980;11;;;15,4
1191;Šipun;Croatia;27.3.2003.;2003-03-27;1 juv;1;Agelenidae;Histopona;sp.;Histopona sp.;;42 583 646;18 217 986;;deep cave;4 258 364 618 217 980;11;;;15,4
1196;Šipun;Croatia;12.2.2005.;2005-02-12;1 juv;1;Agelenidae;Histopona;sp.;Histopona sp.;;42 583 646;18 217 986;;deep cave;4 258 364 618 217 980;11;;;15,4
1198;Šipun;Croatia;19.8.2005.;2005-08-19;1f, 1 juv;2;Nesticidae;Kryptonesticus;eremita;Kryptonesticus eremita;;42 583 646;18 217 986;tf;deep cave;4 258 364 618 217 980;11;;;15,4
1199;Šipun;Croatia;27.3.2003.;2003-03-27;2 juv;2;Agelenidae;Histopona;sp.;Histopona sp.;;42 583 646;18 217 986;;deep cave;4 258 364 618 217 980;11;;;15,4
1200;Šipun;Croatia;19.8.2005.;2005-08-19;1 juv;1;Agelenidae;Histopona;sp.;Histopona sp.;;42 583 646;18 217 986;;deep cave;4 258 364 618 217 980;11;;;15,4
1201;Pišurka;Croatia;27.4.2004.;2004-04-27;1 juv;1;Nesticidae;Kryptonesticus;eremita;Kryptonesticus eremita;39;42 959 451;17 129 228;;deep cave;4 295 945 117 129 220;5;;;13,925
1203;?urovi?a jama;Croatia;27.6.2003.;2003-06-27;1f,1m,1 juv;3;Nesticidae;Kryptonesticus;eremita;Kryptonesticus eremita;;42 559 979;18 263 559;tf;deep cave;4 255 997 918 263 550;4;;;17,267
1204;?urovi?a jama;Croatia;27.5.2004.;2004-05-27;1f, 1juv;2;Nesticidae;Kryptonesticus;eremita;Kryptonesticus eremita;;42 559 979;18 263 559;tf;deep cave;4 255 997 918 263 550;4;;;17,267
1205;Runjova?a;Croatia;23.8.2005.;2005-08-23;1 m;1;Nesticidae;Kryptonesticus;eremita;Kryptonesticus eremita;;42 547 018;18 262 348;tf;deep cave;4 254 701 818 262 340;1;;;
1207;Jama II kod Velikih Brisnica;Croatia;2.6.2006.;2006-06-02;1 juv;1;Agelenidae;Histopona;sp.;Histopona sp.;520;44 789 027;14 918 377;;deep cave;4 478 902 714 918 370;3;;;
1209;Jama II kod Velikih Brisnica;Croatia;2.6.2006.;2006-06-02;1 juv;1;Agelenidae;Histopona;sp.;Histopona sp.;520;44 789 027;14 918 377;;deep cave;4 478 902 714 918 370;3;;;
1210;Jama na Kuželjevcu;Croatia;2.6.2006.;2006-06-02;1f,1m,1 juv;3;Agelenidae;Histopona;egonpretneri;Histopona egonpretneri;400;44 828 665;14 910 216;Tb;deep cave;4 482 866 514 910 210;2;;;
1219;Špilja u Vukoti?a dragi;Croatia;1.6.2006.;2006-06-01;1f, 1m, 2juv;4;Agelenidae;Histopona;egonpretneri;Histopona egonpretneri;;44 808 197;14 883 737;Tb;deep cave;4 480 819 714 883 730;2;;;
1221;Tamnica;Croatia;11.11.1998.;1998-11-11;1m;1;Agelenidae;Tegenaria;silvestris;Tegenaria silvestris;;4 527 298;1 536 197;Tf;deep cave;45 272 981 536 197;3;;;
1225;Baji?a 3 špilja;Croatia;26.2.2009.;2009-02-26;1f;1;Nesticidae;Nesticus;cellulanus;Nesticus cellulanus;180;45 251 779;15 849 009;tf;deep cave;4 525 177 915 849 000;2;;;
1226;Dragina pe?ina na Dobri;Croatia;27.2.2000.;2000-02-27;1 f,1juv m,1juv;3;Nesticidae;Nesticus;cellulanus;Nesticus cellulanus;156;45 346 751;15 290 094;tf;deep cave;4 534 675 115 290 090;4;;;
1227;Dragina pe?ina na Dobri;Croatia;27.2.2000.;2000-02-27;1f, 2m;3;Agelenidae;Tegenaria;silvestris;Tegenaria silvestris;156;45 346 751;15 290 094;Tf;deep cave;4 534 675 115 290 090;4;;;
1236;Dragina pe?ina na Dobri;Croatia;17.2.1999.;1999-02-17;1m;1;Agelenidae;Tegenaria;silvestris;Tegenaria silvestris;156;45 346 751;15 290 094;Tf;deep cave;4 534 675 115 290 090;4;;;
1237;Dragina pe?ina na Dobri;Croatia;17.2.1999.;1999-02-17;1 f,2 juv;3;Nesticidae;Nesticus;cellulanus;Nesticus cellulanus;156;45 346 751;15 290 094;tf;deep cave;4 534 675 115 290 090;4;;;
1238;Gornja Bara?eva;Croatia;17.5.2003.;2003-05-17;1 juv;1;Agelenidae;Tegenaria;sp.;Tegenaria sp.;;44 983 895;15 721 656;;deep cave;4 498 389 515 721 650;8;;;
1240;Antina špilja;Croatia;17.7.2004.;2004-07-17;1 f,2 juv;3;Nesticidae;Nesticus;cellulanus;Nesticus cellulanus;;45 497 475;17 856 553;tf;deep cave;4 549 747 517 856 550;2;;;13,2
1255;Dopolanš?ica;Croatia;9.1.2002.;2002-01-09;1m;1;Agelenidae;Tegenaria;silvestris;Tegenaria silvestris;;46 275 198;1 605 968;Tf;deep cave;462 751 981 605 968;2;;;
1257;Klari?eva jama;Croatia;20.2.2007.;2007-02-20;1 f;1;Nesticidae;Kryptonesticus;eremita;Kryptonesticus eremita;88;45 150 294;13 673 661;tf;deep cave;4 515 029 413 673 660;2;;;
1260;Jama Baredine;Croatia;30.11.2007.;2007-11-30;1 f;1;Nesticidae;Kryptonesticus;eremita;Kryptonesticus eremita;;45 270 267;13 661 985;tf;deep cave;4 527 026 713 661 980;1;;;
1262;Pliškovi?eva jama;Croatia;19.2.2007.;2007-02-19;1 f,2 m,1 juv;4;Nesticidae;Kryptonesticus;eremita;Kryptonesticus eremita;256;45 071 604;13 872 151;tf;deep cave;4 507 160 413 872 150;4;;;
1263;Jama Baredine;Croatia;30.11.2007.;2007-11-30;1 juv;1;Nesticidae;Kryptonesticus;eremita;Kryptonesticus eremita;;45 270 267;13 661 985;;deep cave;4 527 026 713 661 980;1;;;
1265;Medvje?a špilja, Mali Lošinj;Croatia;13.1.2000.;2000-01-13;1 f,1 juv;2;Nesticidae;Kryptonesticus;eremita;Kryptonesticus eremita;;44 605 518;1 440 794;tf;deep cave;446 055 181 440 794;1;;;
1268;Kukor;Croatia;8.9.2005.;2005-09-08;1 f;1;Nesticidae;Kryptonesticus;deelemanae;Kryptonesticus deelemanae;425;43 355 609;16 991 707;tb;deep cave;4 335 560 916 991 700;10;;;15,4
1269;Ogra?ena špilja pod Sv. Jurom;Croatia;21.6.2003.;2003-06-21;2 juv;2;Nesticidae;Kryptonesticus;deelemanae;Kryptonesticus deelemanae;1462;43 348 504;17 051 475;tb;deep cave;4 334 850 417 051 470;2;;;
1271;Matijaševa pe?;Croatia;4.4.2006.;2006-04-04;1 juv;1;Nesticidae;Kryptonesticus;deelemanae;Kryptonesticus deelemanae;584;43 320 551;17 122 321;tb;deep cave;4 332 055 117 122 320;6;;8,3;6,933
1272;Kukor;Croatia;27.7.2004.;2004-07-27;1 juv;1;Nesticidae;Kryptonesticus;deelemanae;Kryptonesticus deelemanae;425;43 355 609;16 991 707;tb;deep cave;4 335 560 916 991 700;10;;;15,4
1273;Špilja u Radinovcima;Croatia;25.10.2006.;2006-10-25;2f, 2m, 2 juv;6;Nesticidae;Kryptonesticus;deelemanae;Kryptonesticus deelemanae;400;43 387 285;170 103;tb;deep cave;43 387 285 170 103;4;;;8,3
1273;Špilja u Radinovcima;Croatia;25.10.2006.;2006-10-25;2f, 2m, 2 juv;6;Nesticidae;Kryptonesticus;deelemanae;Kryptonesticus deelemanae;400;43 387 285;170 103;tb;deep cave;43 387 285 170 103;4;;;8,75
1274;Poskokova rupa;Croatia;25.5.2004.;2004-05-25;1 f;1;Nesticidae;Kryptonesticus;deelemanae;Kryptonesticus deelemanae;633;43 318 607;17 119 945;tb;deep cave;4 331 860 717 119 940;2;;;
1275;Kukor;Croatia;19.6.2002.;2002-06-19;1f, 2 juv;3;Nesticidae;Kryptonesticus;deelemanae;Kryptonesticus deelemanae;425;43 355 609;16 991 707;tb;deep cave;4 335 560 916 991 700;10;;;15,4
1276;Kukor;Croatia;29.10.2006.;2006-10-29;1 f;1;Nesticidae;Kryptonesticus;deelemanae;Kryptonesticus deelemanae;425;43 355 609;16 991 707;tb;deep cave;4 335 560 916 991 700;10;;;15,4
1277;Crna ledenica;Croatia;24.10.2006.;2006-10-24;1 m;1;Nesticidae;Kryptonesticus;deelemanae;Kryptonesticus deelemanae;1500;43 348 162;17 055 328;tb;deep cave;4 334 816 217 055 320;2;;;0,3
1281;Ledenica kod Stare škole;Croatia;28.6.2002.;2002-06-28;2 juv;2;Nesticidae;Kryptonesticus;deelemanae;Kryptonesticus deelemanae;1469;43 342 082;17 041 289;tb;deep cave;4 334 208 217 041 280;1;;1,8;3
1284;Spasiteljica;Croatia;23.3.2003.;2003-03-23;1 f;1;Nesticidae;Kryptonesticus;deelemanae;Kryptonesticus deelemanae;521;43 408 514;1 694 211;tb;deep cave;434 085 141 694 211;1;;;
1285;Mala jama u stijenama;Croatia;20.6.2003.;2003-06-20;1 juv;1;Nesticidae;Kryptonesticus;deelemanae;Kryptonesticus deelemanae;1115;43 365 579;17 027 668;tb;deep cave;4 336 557 917 027 660;3;;9,3;9,3
1286;Kukor;Croatia;6.4.2006.;2006-04-06;1 juv;1;Nesticidae;Kryptonesticus;deelemanae;Kryptonesticus deelemanae;425;43 355 609;16 991 707;tb;deep cave;4 335 560 916 991 700;10;;;15,4
1287;Stonjska pe? donja;Croatia;27.10.2003.;2003-10-27;1m, 1 juv;2;Nesticidae;Kryptonesticus;deelemanae;Kryptonesticus deelemanae;608;43 315 167;17 130 659;tb;deep cave;4 331 516 717 130 650;6;;;
1288;Kuna špilja;Croatia;15.6.2002.;2002-06-15;1 juv m;1;Nesticidae;Kryptonesticus;deelemanae;Kryptonesticus deelemanae;1401;43 324 523;17 055 953;tb;deep cave;4 332 452 317 055 950;2;;;4,5
1289;Kukor;Croatia;6.4.2006.;2006-04-06;1 juv;1;Nesticidae;Kryptonesticus;deelemanae;Kryptonesticus deelemanae;425;43 355 609;16 991 707;tb;deep cave;4 335 560 916 991 700;10;;;15,4
1290;Samogorska špilja;Croatia;4.4.2006.;2006-04-04;1 juv m;1;Nesticidae;Kryptonesticus;deelemanae;Kryptonesticus deelemanae;717;43 318 227;17 121 122;tb;deep cave;4 331 822 717 121 120;6;;;13,1
1290;Samogorska špilja;Croatia;4.4.2006.;2006-04-04;1 juv m;1;Nesticidae;Kryptonesticus;deelemanae;Kryptonesticus deelemanae;717;43 318 227;17 121 122;tb;deep cave;4 331 822 717 121 120;6;;7,1;4,967
1291;Kuna špilja;Croatia;28.4.2002.;2002-04-28;1 juv m;1;Nesticidae;Kryptonesticus;deelemanae;Kryptonesticus deelemanae;1401;43 324 523;17 055 953;tb;deep cave;4 332 452 317 055 950;2;;;4,5
1292;Jama iznad Lipog do?i?a;Croatia;26.2.2001.;2001-02-26;1 juv m;1;Nesticidae;Kryptonesticus;deelemanae;Kryptonesticus deelemanae;1500;43 338 669;17 055 229;tb;deep cave;4 333 866 917 055 220;1;;;
1293;Pretnerova jama;Croatia;28.10.2006.;2006-10-28;1 f;1;Nesticidae;Kryptonesticus;deelemanae;Kryptonesticus deelemanae;1409;43 339 276;17 038 312;tb;deep cave;4 333 927 617 038 310;2;;;6,1
1293;Pretnerova jama;Croatia;28.10.2006.;2006-10-28;1 f;1;Nesticidae;Kryptonesticus;deelemanae;Kryptonesticus deelemanae;1409;43 339 276;17 038 312;tb;deep cave;4 333 927 617 038 310;2;;;4,78
1294;Crna ledenica;Croatia;25.4.2004.;2004-04-25;1f, 1 juv m;2;Nesticidae;Kryptonesticus;deelemanae;Kryptonesticus deelemanae;1500;43 348 162;17 055 328;tb;deep cave;4 334 816 217 055 320;2;;;0,3
1296;Kukor;Croatia;27.7.2004.;2004-07-27;1 f;1;Nesticidae;Kryptonesticus;deelemanae;Kryptonesticus deelemanae;425;43 355 609;16 991 707;tb;deep cave;4 335 560 916 991 700;10;;;15,4
1297;Špilja u Radinovcima;Croatia;25.10.2006.;2006-10-25;2f, 1m, 7 juv;1;Nesticidae;Kryptonesticus;deelemanae;Kryptonesticus deelemanae;400;43 387 285;170 103;tb;deep cave;43 387 285 170 103;4;;;8,3
1297;Špilja u Radinovcima;Croatia;25.10.2006.;2006-10-25;2f, 1m, 7 juv;1;Nesticidae;Kryptonesticus;deelemanae;Kryptonesticus deelemanae;400;43 387 285;170 103;tb;deep cave;43 387 285 170 103;4;;;8,75
1298;Samogorska špilja;Croatia;4.4.2006.;2006-04-04;1 f;1;Nesticidae;Kryptonesticus;deelemanae;Kryptonesticus deelemanae;717;43 318 227;17 121 122;tb;deep cave;4 331 822 717 121 120;6;;;13,1
1298;Samogorska špilja;Croatia;4.4.2006.;2006-04-04;1 f;1;Nesticidae;Kryptonesticus;deelemanae;Kryptonesticus deelemanae;717;43 318 227;17 121 122;tb;deep cave;4 331 822 717 121 120;6;;7,1;4,967
1299;Špilja u Radinovcima;Croatia;26.10.2006.;2006-10-26;2f, 2juv;4;Nesticidae;Kryptonesticus;deelemanae;Kryptonesticus deelemanae;400;43 387 285;170 103;tb;deep cave;43 387 285 170 103;4;;;8,3
1299;Špilja u Radinovcima;Croatia;26.10.2006.;2006-10-26;2f, 2juv;4;Nesticidae;Kryptonesticus;deelemanae;Kryptonesticus deelemanae;400;43 387 285;170 103;tb;deep cave;43 387 285 170 103;4;;;8,75
1301;Jama na Puharevom;Croatia;2.11.2003.;2003-11-02;1f;1;Dysderidae;Stalita;taenaria;Stalita taenaria;;45 410 155;1 430 419;Tb;deep cave;454 101 551 430 419;2;;;
1302;Jama na Plase, Plas;Croatia;16.9.2007.;2007-09-16;1m;1;Clubionidae;Clubiona;terrestris;Clubiona terrestris;;45 296 416;14 205 266;Tx;;4 529 641 614 205 260;1;;;
1303;Šparožna pe?ina;Croatia;14.4.2001.;2001-04-14;1f;1;Dysderidae;Stalita;taenaria;Stalita taenaria;;45 407 967;14 332 456;Tb;deep cave;4 540 796 714 332 450;4;;;
1304;Šparožna pe?ina;Croatia;6.3.2003.;2003-03-06;2f;2;Dysderidae;Stalita;taenaria;Stalita taenaria;;45 407 967;14 332 456;Tb;deep cave;4 540 796 714 332 450;4;;;
1305;Božinkina jama;Croatia;4.1.2004.;2004-01-04;1m, 1f;2;Dysderidae;Stalita;taenaria;Stalita taenaria;350;4 540 466;1 430 388;Tb;deep cave;45 404 661 430 388;2;;;10,2
1306;Jama u Vetvi;Croatia;4.6.2010.;2010-06-04;1m;1;Dysderidae;Dysdera;adriatica;Dysdera adriatica;;45 332 148;14 240 733;Tx;;4 533 214 814 240 730;3;;;9,6
1307;Jama u Vetvi;Croatia;4.6.2010.;2010-06-04;1f;1;Linyphiidae;Troglohyphantes;liburnicus;Troglohyphantes liburnicus;;45 332 148;14 240 733;Tb;deep cave;4 533 214 814 240 730;3;;;9,6
1308;Oštirova jama;Croatia;18.9.2007.;2007-09-18;2f, 2m;4;Linyphiidae;Troglohyphantes;brignolii;Troglohyphantes brignolii;;45 355 854;14 123 988;Tb;deep cave;4 535 585 414 123 980;3;;;
1309;Jama pod Križ;Croatia;4.6.2010.;2010-06-04;1f;1;Linyphiidae;Troglohyphantes;brignolii;Troglohyphantes brignolii;;45 374 314;14 113 041;Tb;deep cave;4 537 431 414 113 040;1;;;8,5
1310;Jama pod Križ;Croatia;4.6.2010.;2010-06-04;1f, 3 juv m;4;Linyphiidae;Troglohyphantes;brignolii;Troglohyphantes brignolii;;45 374 314;14 113 041;Tb;deep cave;4 537 431 414 113 040;1;;;8,5
1311;Barinova jama;Croatia;18.9.2007.;2007-09-18;3f;3;Linyphiidae;Troglohyphantes;brignolii;Troglohyphantes brignolii;;45 354 889;14 126 033;Tb;deep cave;4 535 488 914 126 030;1;;;5,9
1312;Vrta?a kod doma na Poklonu;Croatia;7.11.2006.;2006-11-07;1f;1;Linyphiidae;Troglohyphantes;brignolii;Troglohyphantes brignolii;;45 311 536;14 212 207;Tb;shallow subterranean habitat;4 531 153 614 212 200;3;;;
1315;Jama pul Bani;Croatia;11.9.1999.;1999-09-11;1f;1;Linyphiidae;Troglohyphantes;liburnicus;Troglohyphantes liburnicus;282;45 374 679;14 364 057;Tb;deep cave;4 537 467 914 364 050;2;;;
1316;Jama pod zavojem;Croatia;1.6.2010.;2010-06-01;2f, 1 juv m;3;Linyphiidae;Troglohyphantes;brignolii;Troglohyphantes brignolii;;45 375 853;14 191 785;Tb;deep cave;4 537 585 314 191 780;1;;;
1317;Jama na Lovranskim Lazi?ima;Croatia;4.11.2006.;2006-11-04;1f, 2m, 4 juv;7;Linyphiidae;Troglohyphantes;brignolii;Troglohyphantes brignolii;;45 309 912;14 240 736;Tb;deep cave;4 530 991 214 240 730;1;;;
1318;Topolska pe?;Croatia;14.9.2007.;2007-09-14;1f;1;Linyphiidae;Troglohyphantes;brignolii;Troglohyphantes brignolii;;4 530 489;14 212 681;Tb;deep cave;453 048 914 212 681;3;;;6,4
1319;Lovranski Lazi?i 1;Croatia;4.11.2006.;2006-11-04;1m;1;Linyphiidae;Troglohyphantes;excavatus;Troglohyphantes excavatus;;45 310 255;14 240 885;Tf;deep cave;4 531 025 514 240 880;2;;;
1320;Lovranski Lazi?i 1;Croatia;4.11.2006.;2006-11-04;5f, 4m, 3 juv;12;Linyphiidae;Troglohyphantes;brignolii;Troglohyphantes brignolii;;45 310 255;14 240 885;Tb;deep cave;4 531 025 514 240 880;2;;;
1321;Jama mrtvih golubova;Croatia;7.11.2006.;2006-11-07;2f, 1juv m, 1 juv;4;Linyphiidae;Palliduphantes;pallidus;Palliduphantes pallidus;;45 280 855;14 188 262;Tf;deep cave;4 528 085 514 188 260;1;;;
1323;Jama iznad Vranjske drage;Croatia;2.6.2010.;2010-06-02;3f, 2 juv;5;Linyphiidae;Troglohyphantes;brignolii;Troglohyphantes brignolii;306;45 310 568;14 152 319;Tb;deep cave;4 531 056 814 152 310;3;;;
1324;Jama iznad Vranjske drage;Croatia;2.6.2010.;2010-06-02;2m;2;Nesticidae;Kryptonesticus;eremita;Kryptonesticus eremita;;45 310 568;14 152 319;Tf;deep cave;4 531 056 814 152 310;3;;;
1325;Jama iznad Vranjske drage;Croatia;2.6.2010.;2010-06-02;1f;1;Linyphiidae;Palliduphantes;istrianus;Palliduphantes istrianus;;45 310 568;14 152 319;Tf;deep cave;4 531 056 814 152 310;3;;;
1326;Oštirova jama;Croatia;18.9.2007.;2007-09-18;1m, 1f;2;Linyphiidae;Troglohyphantes;brignolii;Troglohyphantes brignolii;;45 355 854;14 123 988;Tb;deep cave;4 535 585 414 123 980;3;;;
1327;Jama kod potoka Banine 3;Croatia;17.9.2007.;2007-09-17;2f;2;Linyphiidae;Troglohyphantes;liburnicus;Troglohyphantes liburnicus;;45 313 714;14 242 713;Tb;deep cave;4 531 371 414 242 710;3;;;
1328;Jama na Poklonu;Croatia;14.9.2007.;2007-09-14;2f;2;Linyphiidae;Troglohyphantes;excavatus;Troglohyphantes excavatus;;45 307 227;14 214 922;Tf;deep cave;4 530 722 714 214 920;2;;;
1329;Babina jama, Brest;Croatia;5.11.2006.;2006-11-05;1f, 1m, 1 juv;3;Linyphiidae;Troglohyphantes;brignolii;Troglohyphantes brignolii;;45 345 066;14 151 693;Tb;deep cave;4 534 506 614 151 690;1;;;
1334;Vrta?a kod doma na Poklonu;Croatia;14.9.2007.;2007-09-14;1m;1;Linyphiidae;Centromerus;sellarius;Centromerus sellarius;;45 311 536;14 212 207;tf;deep cave;4 531 153 614 212 200;3;;;
1335;Jama kod crvenog gloga;Croatia;7.11.2006.;2006-11-07;5f, 2 m, 1 juv;8;Linyphiidae;Palliduphantes;istrianus;Palliduphantes istrianus;;45 280 222;14 187 889;Tf;deep cave;4 528 022 214 187 880;1;;;
1336;Topolska pe?;Croatia;26.7.2006.;2006-07-26;1m, 3 juv;4;Linyphiidae;Troglohyphantes;brignolii;Troglohyphantes brignolii;;4 530 489;14 212 681;Tb;deep cave;453 048 914 212 681;3;;;6,4
1337;Topolska pe?;Croatia;26.7.2006.;2006-07-26;1f, 1 juv;2;Linyphiidae;Troglohyphantes;brignolii;Troglohyphantes brignolii;;4 530 489;14 212 681;Tb;deep cave;453 048 914 212 681;3;;;6,4
1338;Bršljanovica;Croatia;3.6.2010.;2010-06-03;1f;1;Linyphiidae;Troglohyphantes;brignolii;Troglohyphantes brignolii;;45 348 192;14 134 112;Tb;deep cave;4 534 819 214 134 110;1;;;
1339;Pe?ina kod dje?jeg oporavilišta;Croatia;8.11.2006.;2006-11-08;1f, 1 juv;2;Linyphiidae;Troglohyphantes;brignolii;Troglohyphantes brignolii;;45 311 037;14 223 287;Tb;deep cave;4 531 103 714 223 280;1;;;
1340;Rupe 2;Croatia;17.9.2007.;2007-09-17;1m;1;Linyphiidae;Centromerus;sellarius;Centromerus sellarius;;45 251 804;14 199 476;tf;deep cave;4 525 180 414 199 470;1;;;
1341;Vrta?a kod doma na Poklonu;Croatia;14.9.2007.;2007-09-14;1m, 1f;2;Anapidae;Comaroma;simoni;Comaroma simoni;;45 311 536;14 212 207;tf;shallow subterranean habitat;4 531 153 614 212 200;3;;;
1342;Babina jama, Brest;Croatia;5.11.2006.;2006-11-05;1f;1;Linyphiidae;Troglohyphantes;brignolii;Troglohyphantes brignolii;;45 345 066;14 151 693;Tb;deep cave;4 534 506 614 151 690;1;;;
1345;Jama na Poklonu;Croatia;14.9.2007.;2007-09-14;1m;1;Linyphiidae;Tenuiphantes;tenebricola;Tenuiphantes tenebricola;;45 307 227;14 214 922;Tx;deep cave;4 530 722 714 214 920;2;;;
1346;Jama na Balaguštini;Croatia;16.9.2007.;2007-09-16;1f;1;Linyphiidae;Troglohyphantes;brignolii;Troglohyphantes brignolii;;4 531 343;14 227 259;Tb;deep cave;453 134 314 227 259;1;;;
1348;Staje 8;Croatia;29.7.2001.;2001-07-29;1f;1;Linyphiidae;Tenuiphantes;flavipes;Tenuiphantes flavipes;;45 447 413;14 143 861;Tf;deep cave;4 544 741 314 143 860;3;;;
1349;Vela pe?;Croatia;4.6.2010.;2010-06-04;1f;1;Linyphiidae;Troglohyphantes;brignolii;Troglohyphantes brignolii;;45 333 194;14 158 683;Tb;deep cave;4 533 319 414 158 680;1;;;6,6
1351;Lovranski Lazi?i 1;Croatia;4.11.2006.;2006-11-04;1f;1;Linyphiidae;Troglohyphantes;brignolii;Troglohyphantes brignolii;;45 310 255;14 240 885;Tb;deep cave;4 531 025 514 240 880;2;;;
1355;Jama na Prevoji?u;Croatia;1.6.2010.;2010-06-01;2f, 1 juv m;3;Linyphiidae;Troglohyphantes;brignolii;Troglohyphantes brignolii;;45 381 621;14 189 238;Tb;deep cave;4 538 162 114 189 230;2;;;
1356;Jama na Prevoji?u;Croatia;1.6.2010.;2010-06-01;3m;3;Amaurobidae;Amaurobius;obustus;Amaurobius obustus;;45 381 621;14 189 238;Tx;deep cave;4 538 162 114 189 230;2;;;
1358;Oštirova jama;Croatia;18.9.2007.;2007-09-18;1f;1;Gnaphosidae;Drassodes;lapidosus;Drassodes lapidosus;;45 355 854;14 123 988;Tx;;4 535 585 414 123 980;3;;;
1359;Jama kod crvenog gloga;Croatia;7.11.2006.;2006-11-07;1f;1;Linyphiidae;Palliduphantes;istrianus;Palliduphantes istrianus;;45 280 222;14 187 889;Tf;deep cave;4 528 022 214 187 880;1;;;
1367;Rudnik Karlota;Croatia;17.2.2007.;2007-02-17;1f;1;Nesticidae;Kryptonesticus;eremita;Kryptonesticus eremita;;4 507 732;14 090 585;;deep cave;450 773 214 090 585;1;;;
1369;Jama pul Bani;Croatia;11.9.1999.;1999-09-11;1m;1;Linyphiidae;Palliduphantes;istrianus;Palliduphantes istrianus;282;45 374 679;14 364 057;Tf;deep cave;4 537 467 914 364 050;2;;;
1370;Strguljin grad 2;Croatia;3.8.2001.;2001-08-03;1f;1;Cybaeidae;Cybaeus;sp. 1;Cybaeus sp. 1;;45 452 235;14 141 663;;;4 545 223 514 141 660;2;;;
1372;Staje 9;Croatia;23.5.2003.;2003-05-23;1m;1;Anapidae;Comaroma;simoni;Comaroma simoni;;45 447 795;14 144 849;tf;deep cave;4 544 779 514 144 840;2;;;
1373;Jama Blaži?i 1;Croatia;8.4.2001.;2001-04-08;1f, 5 juv;6;Linyphiidae;Troglohyphantes;liburnicus;Troglohyphantes liburnicus;;45 381 586;14 399 848;Tb;deep cave;4 538 158 614 399 840;1;;;
1374;Staje 9 (ispred);Croatia;23.5.2003.;2003-05-23;1m;1;Anapidae;Comaroma;simoni;Comaroma simoni;;45 447 795;14 144 849;tf;shallow subterranean habitat;4 544 779 514 144 840;2;;;
1375;oko ulaza pod kamenjem kod jame Staje 9;Croatia;23.5.2003.;2003-05-23;2f;2;Amaurobidae;Amaurobius;sp. 2;Amaurobius sp. 2;;45 447 795;14 144 849;Tx;Shallow subterranean habitat;4 544 779 514 144 840;2;;;
1376;Radota;Croatia;29.7.2001.;2001-07-29;2m, 1 juv;3;Linyphiidae;Centromerus;cavernarum;Centromerus cavernarum;595;45 456 089;13 984 855;Tf;deep cave;4 545 608 913 984 850;6;;;
1377;Staje 12;Croatia;30.7.2007.;2007-07-30;1f, 1 juv;2;Linyphiidae;Tenuiphantes;flavipes;Tenuiphantes flavipes;;45 448 664;1 414 793;Tf;deep cave;454 486 641 414 793;1;;;
1378;Strguljin grad 2;Croatia;3.8.2001.;2001-08-03;1f;1;Linyphiidae;Tenuiphantes;flavipes;Tenuiphantes flavipes;;45 452 235;14 141 663;Tf;deep cave;4 545 223 514 141 660;2;;;
1381;Velebita- Dva javora;Croatia;15.8.2007.;2007-08-15;1f;1;Linyphiidae;Porrhomma;egeria;Porrhomma egeria;1560;44 757 596;1 498 636;;deep cave;447 575 961 498 636;2;;;
1384;Gavranova jama;Croatia;7.8.2009.;2009-08-07;1f;1;Linyphiidae;Troglohyphantes;sp. 3;Troglohyphantes sp. 3;;44 745 184;15 072 389;tb;deep cave;4 474 518 415 072 380;1;;;
1385;Gavranova jama;Croatia;7.8.2009.;2009-08-07;2m;2;Linyphiidae;Troglohyphantes;sp. 3;Troglohyphantes sp. 3;;44 745 184;15 072 389;tb;deep cave;4 474 518 415 072 380;1;;;
1393;Medvje?a špilja, Mali Lošinj;Croatia;27.-28.3.2010.;2010-03-27/2010-03-28;1f, 1 juv;2;Nesticidae;Kryptonesticus;eremita;Kryptonesticus eremita;;44 605 518;1 440 794;tf;deep cave;446 055 181 440 794;1;;;
1396;Špilja kod Stare Sušice;Croatia;12.6.2009.;2009-06-12;1m;1;Anapidae;Comaroma;simoni;Comaroma simoni;;45 387 689;14 994 379;tf;deep cave;4 538 768 914 994 370;11;;;7,4
1397;Pe? u ?ulinovim raljevinama;Croatia;6.1.2009.;2009-01-06;1f;1;Linyphiidae;Troglohyphantes;strandi;Troglohyphantes strandi;428;43 605 854;16 575 066;tb;deep cave;4 360 585 416 575 060;5;;;11
1398;Dragina pe?ina na Dobri;Croatia;27.2.2000.;2000-02-27;1f;1;Tetragnathidae;Metellina;merianae;Metellina merianae;;45 346 751;15 290 094;Tf;deep cave;4 534 675 115 290 090;4;;;
1400;Jama u Krogu;Croatia;15.9.2007.;2007-09-15;1m;1;Linyphiidae;Labulla;thoracica;Labulla thoracica;;45 378 389;1 416 897;;;453 783 891 416 897;2;;2,5;2,45
1401;Kukor;Croatia;28.7.2006.;2006-07-28;1 juv;1;Nesticidae;Kryptonesticus;deelemanae;Kryptonesticus deelemanae;425;43 355 609;16 991 707;tb;deep cave;4 335 560 916 991 700;10;;;15,4
1402;Matijaševa pe?;Croatia;19.11.2005.;2005-11-19;1 juv;1;Nesticidae;Kryptonesticus;deelemanae;Kryptonesticus deelemanae;584;43 320 551;17 122 321;tb;deep cave;4 332 055 117 122 320;6;;8,3;6,933
1403;Jama iznad Sarana?a;Croatia;2.4.2006.;2006-04-02;1 juv m;1;Agelenidae;Histopona;sp.;Histopona sp.;770;43 249 007;17 174 663;;deep cave;4 324 900 717 174 660;7;;10,8;10,025
1403;Jama iznad Sarana?a;Croatia;2.4.2006.;2006-04-02;1 juv m;1;Agelenidae;Histopona;sp.;Histopona sp.;770;43 249 007;17 174 663;;deep cave;4 324 900 717 174 660;7;;;12,2
1405;Veli Sklop 4;Croatia;7.6.2006.;2006-06-07;1 juv m;1;Agelenidae;Histopona;sp.;Histopona sp.;467;44 310 221;15 483 825;;deep cave;4 431 022 115 483 820;1;;;
1406;Vaganka;Croatia;3.6.2006.;2006-06-03;3 juv;3;Agelenidae;Histopona;sp.;Histopona sp.;658;4 433 853;1 543 867;;deep cave;44 338 531 543 867;5;;;12,2
1408;Jama pod isto?nom stijenom Buljme;Croatia;13.9.2006.;2006-09-13;1 f;1;Agelenidae;Histopona;egonpretneri;Histopona egonpretneri;1421;44 368 375;15 467 868;Tb;deep cave;4 436 837 515 467 860;3;;;4,8
1409;Šoši?a jama;Croatia;29.9.2006.;2006-09-29;1 juv;1;Agelenidae;Histopona;sp.;Histopona sp.;;44 319 599;15 408 031;;deep cave;4 431 959 915 408 030;1;;;
1411;Topla pe?ina;Croatia;29.7.2006.;2006-07-29;1 m,8 juv;9;Nesticidae;Kryptonesticus;eremita;Kryptonesticus eremita;;43 839 254;160 536;tf;deep cave;43 839 254 160 536;4;;;
1412;Marasovi?a špilja;Croatia;7.6.2006.;2006-06-07;3 juv;3;Agelenidae;Histopona;sp.;Histopona sp.;303;44 309 906;15 481 716;;deep cave;4 430 990 615 481 710;2;;;
1414;Markova špilja, Seline;Croatia;4.6.2006.;2006-06-04;1 f,2 juv;3;Nesticidae;Kryptonesticus;eremita;Kryptonesticus eremita;14;44 279 837;1 547 716;tf;deep cave;442 798 371 547 716;3;;;
1416;Ivina jama, Paklenica;Croatia;16.9.2006.;2006-09-16;2 juv;2;Agelenidae;Histopona;sp.;Histopona sp.;634;44 330 962;15 467 557;;deep cave;4 433 096 215 467 550;1;;;
1417;Kapljarka;Croatia;8.6.2006.;2006-06-08;2 juv;2;Agelenidae;Histopona;sp.;Histopona sp.;410;44 294 555;15 519 648;;deep cave;4 429 455 515 519 640;2;;;
1419;Kad jaganjci utihnu;Croatia;5.6.2006.;2006-06-05;1f, 32 juv;33;Theridiidae;Episinus;cavernicola;Episinus cavernicola;223;44 365 085;15 314 841;Tf;deep cave;4 436 508 515 314 840;3;;;
1422;Jatara špilja;Croatia;9.6.2006.;2006-06-09;3 juv;3;Agelenidae;Histopona;sp.;Histopona sp.;600;44 334 974;15 446 351;;deep cave;4 433 497 415 446 350;3;;;
1424;Špilja u Lužnama;Croatia;9.6.2006.;2006-06-09;1 juv m;1;Agelenidae;Histopona;sp.;Histopona sp.;629;44 328 901;15 454 175;;deep cave;4 432 890 115 454 170;2;;;
1425;Jatara špilja;Croatia;9.6.2006.;2006-06-09;1 juv m,3 juv;4;Agelenidae;Histopona;sp.;Histopona sp.;600;44 334 974;15 446 351;;deep cave;4 433 497 415 446 350;3;;;
1426;Kapljarka;Croatia;8.6.2006.;2006-06-08;1 juv;1;Agelenidae;Histopona;sp.;Histopona sp.;410;44 294 555;15 519 648;;deep cave;4 429 455 515 519 640;2;;;
1427;Kad jaganjci utihnu;Croatia;5.6.2006.;2006-06-05;3 juv;3;Agelenidae;Histopona;sp.;Histopona sp.;223;44 365 085;15 314 841;;deep cave;4 436 508 515 314 840;3;;;
1428;Markova špilja, Seline;Croatia;5.6.2006.;2006-06-05;2 juv;2;Agelenidae;Histopona;sp.;Histopona sp.;14;44 279 837;1 547 716;;deep cave;442 798 371 547 716;3;;;
1430;Jama kod Jatare 1;Croatia;12.9.2006.;2006-09-12;1 f;1;Agelenidae;Histopona;egonpretneri;Histopona egonpretneri;643;44 333 263;15 448 252;Tb;deep cave;4 433 326 315 448 250;1;;;
1432;Kukor;Croatia;2.1.1999.;1999-01-02;1 f;1;Agelenidae;Histopona;conveniens;Histopona conveniens;425;43 355 609;16 991 707;Tf;deep cave;4 335 560 916 991 700;10;;;15,4
1433;?olnja?a;Croatia;25.10.2003.;2003-10-25;1f;1;Agelenidae;Histopona;conveniens;Histopona conveniens;;43 409 175;1 688 745;Tf;deep cave;434 091 751 688 745;4;;;
1434;Pozjata špilja;Croatia;26.10.2003.;2003-10-26;1m;1;Agelenidae;Histopona;conveniens;Histopona conveniens;1435;43 387 837;16 963 748;Tf;deep cave;4 338 783 716 963 740;3;;;7,85
1435;Jujnovi?a špilja;Croatia;27.4.2002.;2002-04-27;1f;1;Agelenidae;Histopona;conveniens;Histopona conveniens;405;43 266 579;1 719 798;Tf;deep cave;432 665 791 719 798;6;;;10,35
1435;Jujnovi?a špilja;Croatia;27.4.2002.;2002-04-27;1f;1;Agelenidae;Histopona;conveniens;Histopona conveniens;405;43 266 579;1 719 798;Tf;deep cave;432 665 791 719 798;6;;13,8;11,35
1436;Ze?ica;Croatia;2.4.2006.;2006-04-02;1m;1;Agelenidae;Histopona;conveniens;Histopona conveniens;1002;43 260 392;17 146 168;Tf;deep cave;4 326 039 217 146 160;3;;;
1437;Jama za Supinom;Croatia;18.11.2005.;2005-11-18;1 f;1;Agelenidae;Histopona;conveniens;Histopona conveniens;;43 250 417;17 113 278;Tf;deep cave;4 325 041 717 113 270;7;;;10,1
1437;Jama za Supinom;Croatia;18.11.2005.;2005-11-18;1 f;1;Agelenidae;Histopona;conveniens;Histopona conveniens;;43 250 417;17 113 278;Tf;deep cave;4 325 041 717 113 270;7;;;11,4
1438;Jama za Supinom;Croatia;18.11.2005.;2005-11-18;2m,1 juv;3;Agelenidae;Histopona;conveniens;Histopona conveniens;;43 250 417;17 113 278;Tf;deep cave;4 325 041 717 113 270;7;;;10,1
1438;Jama za Supinom;Croatia;18.11.2005.;2005-11-18;2m,1 juv;3;Agelenidae;Histopona;conveniens;Histopona conveniens;;43 250 417;17 113 278;Tf;deep cave;4 325 041 717 113 270;7;;;11,4
1439;Romanova jama;Croatia;30.9.1995.;1995-09-30;1f;1;Agelenidae;Histopona;conveniens;Histopona conveniens;1330;43 307 939;17 067 563;Tf;deep cave;4 330 793 917 067 560;2;;;
1440;Bošak jama;Croatia;4.4.2006.;2006-04-04;1 juv;1;Agelenidae;Histopona;sp.;Histopona sp.;739;43 347 996;17 100 045;;deep cave;4 334 799 617 100 040;2;;;7,4
1441;Jama iznad Sarana?a;Croatia;25.3.2003.;2003-03-25;1f;1;Agelenidae;Histopona;conveniens;Histopona conveniens;770;43 249 007;17 174 663;Tf;deep cave;4 324 900 717 174 660;7;;10,8;10,025
1441;Jama iznad Sarana?a;Croatia;25.3.2003.;2003-03-25;1f;1;Agelenidae;Histopona;conveniens;Histopona conveniens;770;43 249 007;17 174 663;Tf;deep cave;4 324 900 717 174 660;7;;;12,2
1442;Kukor;Croatia;6.4.2006.;2006-04-06;1m;1;Agelenidae;Histopona;conveniens;Histopona conveniens;425;43 355 609;16 991 707;Tf;deep cave;4 335 560 916 991 700;10;;;15,4
1443;Kukor;Croatia;23.9.1999.;1999-09-23;1f,1 juv m;2;Agelenidae;Histopona;conveniens;Histopona conveniens;425;43 355 609;16 991 707;Tf;deep cave;4 335 560 916 991 700;10;;;15,4
1444;Špilja u Radinovcima;Croatia;25.10.2006.;2006-10-25;1f;1;Agelenidae;Histopona;conveniens;Histopona conveniens;400;43 387 285;170 103;Tf;deep cave;43 387 285 170 103;4;;;8,3
1444;Špilja u Radinovcima;Croatia;25.10.2006.;2006-10-25;1f;1;Agelenidae;Histopona;conveniens;Histopona conveniens;400;43 387 285;170 103;Tf;deep cave;43 387 285 170 103;4;;;8,75
1445;Spila 1;Croatia;26.3.2003.;2003-03-26;1f;1;Agelenidae;Histopona;conveniens;Histopona conveniens;516;43 262 438;17 203 945;Tf;deep cave;4 326 243 817 203 940;3;;10,4;10,4
1446;Baba;Croatia;27.4.2002.;2002-04-27;1m;1;Agelenidae;Histopona;conveniens;Histopona conveniens;965;43 256 469;17 162 283;Tf;deep cave;4 325 646 917 162 280;4;;;
1447;Špilja u Radinovcima;Croatia;25.10.2006.;2006-10-25;1m;1;Agelenidae;Histopona;conveniens;Histopona conveniens;400;43 387 285;170 103;Tf;deep cave;43 387 285 170 103;4;;;8,3
1447;Špilja u Radinovcima;Croatia;25.10.2006.;2006-10-25;1m;1;Agelenidae;Histopona;conveniens;Histopona conveniens;400;43 387 285;170 103;Tf;deep cave;43 387 285 170 103;4;;;8,75
1448;Jama za Supinom;Croatia;3.4.2006.;2006-04-03;1m;1;Agelenidae;Histopona;conveniens;Histopona conveniens;;43 250 417;17 113 278;Tf;deep cave;4 325 041 717 113 270;7;;;10,1
1448;Jama za Supinom;Croatia;3.4.2006.;2006-04-03;1m;1;Agelenidae;Histopona;conveniens;Histopona conveniens;;43 250 417;17 113 278;Tf;deep cave;4 325 041 717 113 270;7;;;11,4
1449;Jama na Brezdanu;Croatia;20.3.2004.;2004-03-20;1f;1;Agelenidae;Histopona;conveniens;Histopona conveniens;915;43 369 901;16 973 172;Tf;deep cave;4 336 990 116 973 170;3;;8,5;8,5
1450;Matijaševa pe?;Croatia;4.4.2006.;2006-04-04;1 juv;1;Agelenidae;Histopona;sp.;Histopona sp.;584;43 320 551;17 122 321;;deep cave;4 332 055 117 122 320;6;;8,3;6,933
1451;Oplemenjena špilja;Croatia;20.6.2003.;2003-06-20;1 juv;1;Agelenidae;Histopona;sp.;Histopona sp.;1100;43 369 119;17 025 884;;deep cave;4 336 911 917 025 880;1;;7;7
1452;Kukor;Croatia;19.6.2002.;2002-06-19;1 juv;1;Agelenidae;Histopona;sp.;Histopona sp.;425;43 355 609;16 991 707;;deep cave;4 335 560 916 991 700;10;;;15,4
1454;Spila 2;Croatia;23.3.2004.;2004-03-23;1 juv;1;Agelenidae;Histopona;sp.;Histopona sp.;516;4 326 239;17 204 021;;deep cave;432 623 917 204 021;6;;12;12
1455;Jama iznad Prozor?i?a;Croatia;22.11.2005.;2005-11-22;1 juv;1;Agelenidae;Histopona;sp.;Histopona sp.;617;4 338 381;16 932 036;;deep cave;433 838 116 932 036;5;;12,5;8,9
1456;Jama iznad Prozor?i?a;Croatia;24.3.2004.;2004-03-24;2 juv;2;Agelenidae;Histopona;sp.;Histopona sp.;617;4 338 381;16 932 036;;deep cave;433 838 116 932 036;5;;12,5;8,9
1457;Podrum;Croatia;22.5.2004.;2004-05-22;1 juv;1;Agelenidae;Histopona;sp.;Histopona sp.;180;43 234 263;17 091 929;;deep cave;4 323 426 317 091 920;2;;;
1459;Svetica;Croatia;25.10.2003.;2003-10-25;3 juv;3;Agelenidae;Histopona;sp.;Histopona sp.;300;43 401 143;16 894 548;;deep cave;4 340 114 316 894 540;5;;;
1460;Jamina, Biokovo;Croatia;24.3.2004.;2004-03-24;2 juv;2;Agelenidae;Histopona;sp.;Histopona sp.;617;43 386 358;16 925 277;;deep cave;4 338 635 816 925 270;4;;;
1461;Stonjska pe? donja;Croatia;27.10.2003.;2003-10-27;1 juv f;1;Agelenidae;Histopona;sp.;Histopona sp.;608;43 315 167;17 130 659;;deep cave;4 331 516 717 130 650;6;;;
1462;Jama za Supinom;Croatia;26.5.2004.;2004-05-26;3 juv;3;Agelenidae;Histopona;sp.;Histopona sp.;;43 250 417;17 113 278;;deep cave;4 325 041 717 113 270;7;;;10,1
1462;Jama za Supinom;Croatia;26.5.2004.;2004-05-26;3 juv;3;Agelenidae;Histopona;sp.;Histopona sp.;;43 250 417;17 113 278;;deep cave;4 325 041 717 113 270;7;;;11,4
1466;?olnja?a;Croatia;23.5.2004.;2004-05-23;1 juv;1;Agelenidae;Histopona;sp.;Histopona sp.;;43 409 175;1 688 745;;deep cave;434 091 751 688 745;4;;;
1467;Špilja na Mrždolcu;Croatia;21.11.2005.;2005-11-21;1 juv m;1;Agelenidae;Histopona;sp.;Histopona sp.;461;43 405 319;17 014 811;;deep cave;4 340 531 917 014 810;3;;;7,5
1468;Jama u Bratušu;Croatia;27.10.2006.;2006-10-27;1 juv;1;Agelenidae;Histopona;sp.;Histopona sp.;25;43 328 376;16 979 405;;deep cave;4 332 837 616 979 400;4;;12,5;13,15
1469;Ješkalovica;Croatia;4.1.2009.;2009-01-04;1f;1;Nesticidae;Kryptonesticus;eremita;Kryptonesticus eremita;155;43 299 857;16 839 313;tf;deep cave;4 329 985 716 839 310;2;;;15,4
1472;Rudnik Zrinski;Croatia;8.10.2008.;2008-10-08;1f,2 juv;3;Agelenidae;Histopona;torpida;Histopona torpida;804;45 887 195;15 927 871;Tx;deep cave;4 588 719 515 927 870;9;;;
1473;Špilja u Nevistinim stinama;Croatia;22.3.2003.;2003-03-22;1 juv;1;Agelenidae;Tegenaria;sp.;Tegenaria sp.;545;4 338 269;16 942 238;;deep cave;433 826 916 942 238;1;;;
1475;Jama na Saran?u;Croatia;25.3.2005.;2005-03-25;1f;1;Agelenidae;Tegenaria;sp. 4;Tegenaria sp. 4;725;43 247 108;17 176 093;;deep cave;4 324 710 817 176 090;4;;;
1476;Muci?a ledenica;Croatia;24.5.2004.;2004-05-24;1f;1;Agelenidae;Tegenaria;sp. 2;Tegenaria sp. 2;1250;4 335 632;17 051 544;;deep cave;433 563 217 051 544;3;;0,8;0,8
1478;Špilja u uvali Svežanj;Croatia;6.4.2008.;2008-04-06;2 juv m,1 juv;3;Nesticidae;Kryptonesticus;eremita;Kryptonesticus eremita;3;45 298 144;1 449 561;;deep cave;452 981 441 449 561;1;;;7,8
1481;Kukor;Croatia;17.8.2000.;2000-08-17;1f,1 juv;2;Nesticidae;Kryptonesticus;deelemanae;Kryptonesticus deelemanae;425;43 355 609;16 991 707;tb;deep cave;4 335 560 916 991 700;10;;;15,4
1483;Kuter?eva špilja;Croatia;25.5.2008.;2008-05-25;1m,1 juv;2;Nesticidae;Nesticus;cellulanus;Nesticus cellulanus;221;45 120 864;15 635 259;tf;deep cave;4 512 086 415 635 250;3;;;
1484;Stara Ledenica;Croatia;16.6.2002.;2002-06-16;1 juv;1;Agelenidae;Tegenaria;sp.;Tegenaria sp.;;43 318 824;17 050 297;;deep cave;4 331 882 417 050 290;1;;;
1485;Kuter?eva špilja;Croatia;8.6.2003.;2003-06-08;1f,1 juv;2;Nesticidae;Nesticus;cellulanus;Nesticus cellulanus;221;45 120 864;15 635 259;tf;deep cave;4 512 086 415 635 250;3;;;
1486;Mili?a špilja;Croatia;30.7.2006.;2006-07-30;1f;1;Nesticidae;Kryptonesticus;eremita;Kryptonesticus eremita;;44 143 333;15 803 133;tf;deep cave;4 414 333 315 803 130;1;;;13
1486;Mili?a špilja;Croatia;30.7.2006.;2006-07-30;1f;1;Nesticidae;Kryptonesticus;eremita;Kryptonesticus eremita;;44 143 333;15 803 133;tf;deep cave;4 414 333 315 803 130;1;;;12,2
1487;Dvojama, Klana;Croatia;29.3.2007.;2007-03-29;1m;1;Agelenidae;Tegenaria;ferruginea;Tegenaria ferruginea;614;45 448 806;14 424 279;Tf;deep cave;4 544 880 614 424 270;3;;;
1488;Grizeljeva jama;Croatia;30.4.2005.;2005-04-30;1f;1;Agelenidae;Tegenaria;sp. 4;Tegenaria sp. 4;930;43 867 534;16 399 097;;deep cave;4 386 753 416 399 090;5;;;
1489;Jama u Bratušu;Croatia;27.8.2005.;2005-08-27;3 juv;3;Agelenidae;Histopona;sp.;Histopona sp.;25;43 328 376;16 979 405;;deep cave;4 332 837 616 979 400;4;;12,5;13,15
1490;Velika špilja na Bukovcima;Croatia;21.11.2005.;2005-11-21;1 juv;1;Agelenidae;Histopona;sp.;Histopona sp.;459;43 403 686;17 022 825;;deep cave;4 340 368 617 022 820;1;;;7,7
1491;Nevakuša špilja;Croatia;2.12.2009.;2009-12-02;1f;1;Agelenidae;Histopona;conveniens;Histopona conveniens;;4 297 412;17 686 578;Tf;deep cave;429 741 217 686 578;3;;;
1494;Pišurka;Croatia;2.6.2000.;2000-06-02;2f;2;Agelenidae;Tegenaria;annulata;Tegenaria annulata;39;42 959 451;17 129 228;tf;deep cave;4 295 945 117 129 220;5;;;13,925
1495;Kuna špilja;Croatia;27.8.1998.;1998-08-27;1m;1;Nesticidae;Kryptonesticus;deelemanae;Kryptonesticus deelemanae;1401;43 324 523;17 055 953;tb;deep cave;4 332 452 317 055 950;2;;;4,5
1496;Jama na Ka?ju;Croatia;21.7.2006.;2006-07-21;1m;1;Nesticidae;Kryptonesticus;eremita;Kryptonesticus eremita;;45 553 891;14 504 034;Tf;deep cave;4 555 389 114 504 030;1;;;
1497;Kuter?eva špilja;Croatia;25.5.2008.;2008-05-25;1f,2 m;3;Nesticidae;Nesticus;cellulanus;Nesticus cellulanus;221;45 120 864;15 635 259;tf;deep cave;4 512 086 415 635 250;3;;;
1498;Jama na Suhom Ruminu;Croatia;27.7.2002.;2002-07-27;1m;1;Nesticidae;Kryptonesticus;eremita;Kryptonesticus eremita;391;43 782 202;16 645 051;tf;deep cave;4 378 220 216 645 050;1;;;
1500;Kraljicina špilja;Croatia;19.10.2007.;2007-10-19;4f,1m;5;Nesticidae;Kryptonesticus;eremita;Kryptonesticus eremita;44;43 073 661;16 100 773;tf;deep cave;4 307 366 116 100 770;2;;;15,1
1501;Brajkovica;Croatia;24.8.2006.;2006-08-24;1f;1;Nesticidae;Kryptonesticus;eremita;Kryptonesticus eremita;;43 042 669;16 099 975;tf;deep cave;4 304 266 916 099 970;2;;;
1502;Kraljicina špilja;Croatia;19.10.2007.;2007-10-19;1 juv;1;Agelenidae;Histopona;sp.;Histopona sp.;44;43 073 661;16 100 773;;deep cave;4 307 366 116 100 770;2;;;15,1
1503;Kraljicina špilja;Croatia;19.10.2007.;2007-10-19;1 juv;1;Nesticidae;Kryptonesticus;eremita;Kryptonesticus eremita;44;43 073 661;16 100 773;tf;deep cave;4 307 366 116 100 770;2;;;15,1
1504;Jama za Mahrincem;Croatia;5.1.2005.;2005-01-05;2f,1 juv;3;Nesticidae;Kryptonesticus;eremita;Kryptonesticus eremita;54;43 344 348;1 674 088;tf;deep cave;433 443 481 674 088;2;;;9,9
1505;Polušpilja na Mr?ari;Croatia;1.10.2007.;2007-10-01;2 juv;2;Agelenidae;Tegenaria;sp.;Tegenaria sp.;;42 768 583;16 788 965;;deep cave;4 276 858 316 788 960;2;;;19,4
1506;Kraljicina špilja;Croatia;3.10.2005.;2005-10-03;1f;1;Nesticidae;Kryptonesticus;eremita;Kryptonesticus eremita;44;43 073 661;16 100 773;tf;deep cave;4 307 366 116 100 770;2;;;15,1
1516;Špilja Jama;Croatia;17.3.2002.;2002-03-17;1f;1;Agelenidae;Tegenaria;bosnica;Tegenaria bosnica;;43 110 888;17 354 016;;deep cave;4 311 088 817 354 010;1;;9,1;13,8
1517;Jama na Srakinju;Croatia;18.9.1996.;1996-09-18;1m;1;Agelenidae;Tegenaria;sp. X;Tegenaria sp. X;;43.2;16.7;;deep cave;43.216.7;1;;;
1518;Špilja na vrh Toraca;Croatia;23.8.2005.;2005-08-23;1 juv;1;Nesticidae;Kryptonesticus;eremita;Kryptonesticus eremita;;42 705 575;1 803 049;tf;deep cave;427 055 751 803 049;3;;15,5;15,275
1521;Hrastovska špilja;Croatia;2.10.2007.;2007-10-02;2 juv;2;Nesticidae;Kryptonesticus;eremita;Kryptonesticus eremita;120;42 756 282;16 875 635;tf;deep cave;4 275 628 216 875 630;4;;;12,6
1522;Nevakuša špilja;Croatia;11.9.1997.;1997-09-11;1 juv;1;Agelenidae;Histopona;sp.;Histopona sp.;;4 297 412;17 686 578;;deep cave;429 741 217 686 578;3;;;
1523;Stražbenica;Croatia;3.5.2009.;2009-05-03;3f;3;Nesticidae;Kryptonesticus;eremita;Kryptonesticus eremita;213;43 697 353;16 029 618;tf;deep cave;4 369 735 316 029 610;3;;;14,7
1524;Male ponte;Croatia;21.6.2001.;2001-06-21;3 juv;3;Agelenidae;Histopona;bidens;Histopona bidens;250;42 761 389;17 430 786;tb;deep cave;4 276 138 917 430 780;7;;;14,45
1526;Kaverna u tunelu HE Plat;Croatia;10.8.2000.;2000-08-10;4f,2 juv;6;Nesticidae;Kryptonesticus;eremita;Kryptonesticus eremita;;42 603 833;18 232 834;tf;deep cave;4 260 383 318 232 830;2;;;
1528;Mo?iljska špilja;Croatia;1.11.2003.;2003-11-01;1f,1 juv;2;Agelenidae;Histopona;dubia;Histopona dubia;410;42 689 061;18 071 906;tb;deep cave;4 268 906 118 071 900;6;;15,4;14,7
1529;Vilina špilja-Izvor Omble;Croatia;7.10.2004.;2004-10-07;1f,8 juv;9;Agelenidae;Histopona;dubia;Histopona dubia;137;4 267 716;18 136 236;tb;deep cave;426 771 618 136 236;5;;;
1530;Ostaševica;Croatia;17.6.2001.;2001-06-17;1f,1 juv;2;Agelenidae;Histopona;bidens;Histopona bidens;220;42 748 959;17 544 404;tb;deep cave;4 274 895 917 544 400;9;;;11,4
1531;Vilinska jama;Croatia;2.4.2007.;2007-04-02;1 juv;1;Agelenidae;Histopona;sp.;Histopona sp.;121;42 728 553;17 881 121;;deep cave;4 272 855 317 881 120;10;;;13,6
1532;Banova ljut;Croatia;4.4.2007.;2007-04-04;1f,1 juv;2;Nesticidae;Kryptonesticus;eremita;Kryptonesticus eremita;;42 724 023;18 023 649;tf;deep cave;4 272 402 318 023 640;4;;;15,2
1533;Banova ljut;Croatia;4.4.2007.;2007-04-04;2 juv;2;Agelenidae;Histopona;sp.;Histopona sp.;;42 724 023;18 023 649;;deep cave;4 272 402 318 023 640;4;;;15,2
1534;Špilja za Groma?kom vlakom;Croatia;29.5.2004.;2004-05-29;1 f;1;Agelenidae;Histopona;dubia;Histopona dubia;605;42 743 509;18 027 359;tb;deep cave;4 274 350 918 027 350;15;;;13,378
1535;Jama pod Velji vrh;Croatia;14.6.2001.;2001-06-14;2m,1f, 2 juv;5;Nesticidae;Kryptonesticus;eremita;Kryptonesticus eremita;;42 766 635;16 907 278;tf;deep cave;4 276 663 516 907 270;2;;;16,567
1536;Špilja na vrh Toraca;Croatia;8.10.2004.;2004-10-08;2 juv;2;Agelenidae;Histopona;sp.;Histopona sp.;;42 705 575;1 803 049;;deep cave;427 055 751 803 049;3;;15,5;15,275
1537;Špilja za Groma?kom vlakom;Croatia;29.5.2004.;2004-05-29;2f;2;Agelenidae;Histopona;dubia;Histopona dubia;605;42 743 509;18 027 359;tb;deep cave;4 274 350 918 027 350;15;;;13,378
1539;Vilina špilja-Izvor Omble;Croatia;11.8.2000.;2000-08-11;4 juv;4;Agelenidae;Histopona;sp.;Histopona sp.;137;4 267 716;18 136 236;;deep cave;426 771 618 136 236;5;;;
1540;Rudina;Croatia;9.9.2006.;2006-09-09;1f;1;Agelenidae;Histopona;dubia;Histopona dubia;;42 721 999;18 015 321;tb;deep cave;4 272 199 918 015 320;3;;;
1541;Rudina;Croatia;9.9.2004.;2004-09-09;2 juv;2;Agelenidae;HIstopona;sp.;HIstopona sp.;;42 721 999;18 015 321;;deep cave;4 272 199 918 015 320;3;;;
1542;Špilja na vrh Toraca;Croatia;8.10.2004.;2004-10-08;3 juv;3;Agelenidae;Histopona;sp.;Histopona sp.;;42 705 575;1 803 049;;deep cave;427 055 751 803 049;3;;15,5;15,275
1543;Banova ljut;Croatia;7.9.2006.;2006-09-07;1f;1;Agelenidae;Histopona;dubia;Histopona dubia;;42 724 023;18 023 649;tb;deep cave;4 272 402 318 023 640;4;;;15,2
1544;Debela ljut;Croatia;7.4.2006.;2006-04-07;2 juv;2;Nesticidae;Kryptonesticus;eremita;Kryptonesticus eremita;;42 717 699;18 022 036;tf;deep cave;4 271 769 918 022 030;8;;15,6;15,6
1545;Špilja za Groma?kom vlakom;Croatia;25.-26.3.2003.;2003-03-25/2003-03-26;2 f;2;Tetragnathidae;Metellina;merianae;Metellina merianae;605;42 743 509;18 027 359;Tf;deep cave;4 274 350 918 027 350;15;;;13,378
1546;Špilja za Groma?kom vlakom;Croatia;25.-26.3.2003.;2003-03-25/2003-03-26;1f,2 juv;3;Agelenidae;Histopona;dubia;Histopona dubia;605;42 743 509;18 027 359;tb;deep cave;4 274 350 918 027 350;15;;;13,378
1547;Špilja za Groma?kom vlakom;Croatia;8.5.2006.;2006-05-08;1f;1;Agelenidae;Histopona;dubia;Histopona dubia;605;42 743 509;18 027 359;tb;deep cave;4 274 350 918 027 350;15;;;13,378
1548;Špilja za Groma?kom vlakom;Croatia;29.3.2003.;2003-03-29;1 juv;1;Agelenidae;Histopona;sp.;Histopona sp.;605;42 743 509;18 027 359;;deep cave;4 274 350 918 027 350;15;;;13,378
1549;Špilja na vrh Toraca;Croatia;23.8.2005.;2005-08-23;1 juv;1;Agelenidae;Histopona;sp.;Histopona sp.;;42 705 575;1 803 049;;deep cave;427 055 751 803 049;3;;15,5;15,275
1550;Banova ljut;Croatia;4.4.2007.;2007-04-04;2 juv;2;Agelenidae;Histopona;sp.;Histopona sp.;;42 724 023;18 023 649;;deep cave;4 272 402 318 023 640;4;;;15,2
1551;Banova ljut;Croatia;4.4.2007.;2007-04-04;1f, 1 juv;2;Agelenidae;Histopona;dubia;Histopona dubia;;42 724 023;18 023 649;tb;deep cave;4 272 402 318 023 640;4;;;15,2
1552;Banova ljut;Croatia;7.9.2006.;2006-09-07;1 f;1;Nesticidae;Kryptonesticus;eremita;Kryptonesticus eremita;;42 724 023;18 023 649;tf;deep cave;4 272 402 318 023 640;4;;;15,2
1553;Špilja za Groma?kom vlakom;Croatia;29.3.2003.;2003-03-29;1 juv;1;Agelenidae;Histopona;sp.;Histopona sp.;605;42 743 509;18 027 359;;deep cave;4 274 350 918 027 350;15;;;13,378
1554;Špilja za Groma?kom vlakom;Croatia;25.-26.3.2003.;2003-03-25/2003-03-26;2 f,1juv;3;Agelenidae;Histopona;dubia;Histopona dubia;605;42 743 509;18 027 359;tb;deep cave;4 274 350 918 027 350;15;;;13,378
1555;Špilja na vrh Toraca;Croatia;23.8.2005.;2005-08-23;1f;1;Nesticidae;Kryptonesticus;eremita;Kryptonesticus eremita;;42 705 575;1 803 049;tf;deep cave;427 055 751 803 049;3;;15,5;15,275
1556;Mo?iljska špilja;Croatia;28.3.2003.;2003-03-28;1 m;1;Agelenidae;Histopona;dubia;Histopona dubia;410;42 689 061;18 071 906;tb;deep cave;4 268 906 118 071 900;6;;15,4;14,7
1557;Mo?iljska špilja;Croatia;;;1 juv;1;Agelenidae;Histopona;sp.;Histopona sp.;410;42 689 061;18 071 906;;deep cave;4 268 906 118 071 900;6;;15,4;14,7
1558;Mo?iljska špilja;Croatia;28.3.2003.;2003-03-28;5 juv;5;Agelenidae;Histopona;sp.;Histopona sp.;410;42 689 061;18 071 906;;deep cave;4 268 906 118 071 900;6;;15,4;14,7
1559;Mo?iljska špilja;Croatia;8.10.2004.;2004-10-08;2 juv;2;Agelenidae;Histopona;sp.;Histopona sp.;410;42 689 061;18 071 906;;deep cave;4 268 906 118 071 900;6;;15,4;14,7
1561;Mo?iljska špilja;Croatia;1.4.2007.;2007-04-01;1 m, 1f;2;Agelenidae;Histopona;dubia;Histopona dubia;410;42 689 061;18 071 906;tb;deep cave;4 268 906 118 071 900;6;;15,4;14,7
1563;Vilinska jama;Croatia;2.4.2007.;2007-04-02;1f;1;Agelenidae;Histopona;dubia;Histopona dubia;121;42 728 553;17 881 121;tb;deep cave;4 272 855 317 881 120;10;;;13,6
1564;Jama pod Sv. Spasom;Croatia;20.6.2001.;2001-06-20;1juv m, 3 juv;4;Agelenidae;Histopona;bidens;Histopona bidens;134;42 731 779;17 542 409;tb;deep cave;4 273 177 917 542 400;6;;;14,6
1565;Jama pod Sv. Spasom;Croatia;2.12.2001.;2001-12-02;1 m;1;Tetragnathidae;Metellina;merianae;Metellina merianae;;42 731 779;17 542 409;Tf;deep cave;4 273 177 917 542 400;6;;;14,6
1567;Vilina špilja-Izvor Omble;Croatia;11.8.2000.;2000-08-11;1 juv;1;Nesticidae;Kryptonesticus;eremita;Kryptonesticus eremita;;4 267 716;18 136 236;tf;deep cave;426 771 618 136 236;5;;;
1569;Škarin Samograd;Croatia;8.1.2005.;2005-01-08;1m,1 juv m, 1juv;3;Tetragnathidae;Metellina;merianae;Metellina merianae;;43 781 501;1 609 613;Tf;deep cave;437 815 011 609 613;3;;;
1570;Mo?iljska špilja;Croatia;28.4.2010.;2010-04-28;1m, 1juv;2;Nesticidae;Kryptonesticus;eremita;Kryptonesticus eremita;410;42 689 061;18 071 906;tf;deep cave;4 268 906 118 071 900;6;;15,4;14,7
1571;Mo?iljska špilja;Croatia;28.4.2010.;2010-04-28;2 juv;2;Agelenidae;Histopona;sp.;Histopona sp.;410;42 689 061;18 071 906;;deep cave;4 268 906 118 071 900;6;;15,4;14,7
1572;Mo?iljska špilja;Croatia;28.4.2010.;2010-04-28;1 juv m,1juv;2;Nesticidae;Kryptonesticus;eremita;Kryptonesticus eremita;410;42 689 061;18 071 906;tf;deep cave;4 268 906 118 071 900;6;;15,4;14,7
1573;Mo?iljska špilja;Croatia;28.4.2010.;2010-04-28;1 juv;1;Agelenidae;Histopona;sp.;Histopona sp.;410;42 689 061;18 071 906;;deep cave;4 268 906 118 071 900;6;;15,4;14,7
1574;Vilina špilja-Izvor Omble;Croatia;29.4.2010.;2010-04-29;1f,1 juv m;2;Agelenidae;Histopona;dubia;Histopona dubia;137;4 267 716;18 136 236;tb;deep cave;426 771 618 136 236;5;;;
1575;Špilja za Groma?kom vlakom;Croatia;27.4.2010.;2010-04-27;1f;1;Agelenidae;Histopona;dubia;Histopona dubia;605;42 743 509;18 027 359;tb;deep cave;4 274 350 918 027 350;15;;;13,378
1576;Špilja za Groma?kom vlakom;Croatia;27.4.2010.;2010-04-27;5 juv;5;Agelenidae;Histopona;sp.;Histopona sp.;605;42 743 509;18 027 359;;deep cave;4 274 350 918 027 350;15;;;13,378
1581;Banova ljut;Croatia;4.4.2007.;2007-04-04;1 juv;1;Nesticidae;Kryptonesticus;eremita;Kryptonesticus eremita;;42 724 023;18 023 649;tf;deep cave;4 272 402 318 023 640;4;;;15,2
1583;Jama pod Sv. Spasom;Croatia;20.6.2001.;2001-06-20;1juv;1;Agelenidae;Tegenaria;sp.;Tegenaria sp.;134;42 731 779;17 542 409;;deep cave;4 273 177 917 542 400;6;;;14,6
1584;Piskovica;Croatia;13.5.2001.;2001-05-13;1f;1;Nesticidae;Kryptonesticus;eremita;Kryptonesticus eremita;315;4 526 207;1 403 692;tf;deep cave;45 262 071 403 692;1;;;
1585;Uviraljka;Croatia;21.9.2010.;2010-09-21;4f, 1m;5;Linyphiidae;Porrhomma;egeria;Porrhomma egeria;810;45 522 243;1 762 067;Tf;deep cave;455 222 431 762 067;3;;;
1586;Uviraljka;Croatia;21.9.2010.;2010-09-21;3f, 3 juv;6;Linyphiidae;Porrhomma;egeria;Porrhomma egeria;810;45 522 243;1 762 067;Tf;deep cave;455 222 431 762 067;3;;;
1587;Jan?ikin guz;Croatia;23.9.2010.;2010-09-23;1f;1;Linyphiidae;Centromerus;cavernarum;Centromerus cavernarum;;45 517 713;17 668 957;Tf;deep cave;4 551 771 317 668 950;1;;;
1589;Miljacka 1- 5;Croatia;8.10.2010.;2010-10-08;1 juv;1;Agelenidae;Histopona;sp.;Histopona sp.;;44 004 754;16 023 086;;deep cave;4 400 475 416 023 080;2;;;
1591;Kukor;Croatia;19.6.2002.;2002-06-19;1f;1;Theridiidae;Gen.;sp.;Gen. sp.;425;43 355 609;16 991 707;;;4 335 560 916 991 700;10;;;15,4
1593;Markov ponor;Croatia;15.8.2009.;2009-08-15;1f;1;Linyphiidae;Troglohyphantes;sp. 3;Troglohyphantes sp. 3;;44 765 318;15 176 875;tb;deep cave;4 476 531 815 176 870;1;;;6,6
1595;Mala Golubnja?a;Croatia;16.8.2009.;2009-08-16;1juv f;1;Nesticidae;Nesticus;cellulanus;Nesticus cellulanus;;44 756 723;15 189 413;tf;deep cave;4 475 672 315 189 410;2;;;
1596;Mala Golubnja?a;Croatia;16.8.2009.;2009-08-16;2m, 4 juv;6;Linyphiidae;Troglohyphantes;sp. 3;Troglohyphantes sp. 3;;44 756 723;15 189 413;tb;deep cave;4 475 672 315 189 410;2;;;
1597;Velika Golubnja?a;Croatia;16.8.2009.;2009-08-16;2m, 7f, 1 juv;1;Linyphiidae;Troglohyphantes;sp. 3;Troglohyphantes sp. 3;;44 756 325;15 190 472;tb;deep cave;4 475 632 515 190 470;1;;;
1598;Markarova špilja;Croatia;14.10.1995.;1995-10-14;1m;1;Tetragnathidae;Metellina;merianae;Metellina merianae;;45 033 811;15 258 625;Tf;deep cave;4 503 381 115 258 620;1;;;
1600;Vrelo;Croatia;20.2.1999.;1999-02-20;1f;1;Linyphiidae;Troglohyphantes;croaticus;Troglohyphantes croaticus;730;45 326 489;14 704 217;Tb;deep cave;4 532 648 914 704 210;8;;;
1601;Vrelo;Croatia;20.2.1999.;1999-02-20;1f;1;Linyphiidae;Gen. 6;sp. 1;Gen. 6 sp. 1;730;45 326 489;14 704 217;;;4 532 648 914 704 210;8;;;
1603;Vrelo;Croatia;20.2.1999.;1999-02-20;1m;1;Dysderidae;Stalita;pretneri;Stalita pretneri;730;45 326 489;14 704 217;Tb;deep cave;4 532 648 914 704 210;8;;;
1604;Vrelo;Croatia;3.7.1994.;1994-07-03;1f, 1 juv;2;Dysderidae;Parastalita;stygia;Parastalita stygia;730;45 326 489;14 704 217;Tb;deep cave;4 532 648 914 704 210;8;;;
1605;Vrelo;Croatia;30.3.1996.;1996-03-30;1f;1;Linyphiidae;Troglohyphantes;croaticus;Troglohyphantes croaticus;730;45 326 489;14 704 217;Tb;deep cave;4 532 648 914 704 210;8;;;
1606;Vrelo;Croatia;8.9.1994.;1994-09-08;2f;2;Dysderidae;Parastalita;stygia;Parastalita stygia;730;45 326 489;14 704 217;Tb;deep cave;4 532 648 914 704 210;8;;;
1607;Vrelo 2;Croatia;6.9.1995.;1995-09-06;1m;1;Dysderidae;Parastalita;stygia;Parastalita stygia;730;45 326 489;14 704 217;Tb;deep cave;4 532 648 914 704 210;8;;;
1608;Lokvarka;Croatia;1.- 2.9.2001.;2001-09-01/2001-09-02;1m, 3 juv;4;Dysderidae;Parastalita;stygia;Parastalita stygia;775;45 361 466;14 762 671;Tb;deep cave;4 536 146 614 762 670;2;;;
1609;Stupina jama;Croatia;10.9.1995.;1995-09-10;1m;1;Dysderidae;Parastalita;stygia;Parastalita stygia;920;45 242 487;14 788 115;Tb;deep cave;4 524 248 714 788 110;1;;;
1610;Medvje?a špilja;Croatia;20.10.1996.;1996-10-20;2m, 2f;4;Dysderidae;Parastalita;stygia;Parastalita stygia;809;45 363 572;14 757 905;Tb;deep cave;4 536 357 214 757 900;3;;;10,95
1611;Medvje?a špilja;Croatia;20.10.1996.;1996-10-20;1 juv m?;1;Dysderidae;Stalita;pretneri;Stalita pretneri;809;45 363 572;14 757 905;Tb;deep cave;4 536 357 214 757 900;3;;;10,95
1612;Vrtložna jama;Croatia;1.7.2006.;2006-07-01;1m;1;Dysderidae;Parastalita;stygia;Parastalita stygia;875;45 590 817;14 515 796;Tb;deep cave;4 559 081 714 515 790;1;;;
1613;Jama kod Vrbovskog;Croatia;30.9.1996.;1996-09-30;1f;1;Dysderidae;Parastalita;stygia;Parastalita stygia;;45 358 714;15 073 242;Tb;deep cave;4 535 871 415 073 240;2;;;
1614;Jama na Vrši?ku;Croatia;1.9.2006.;2006-09-01;1m;1;Dysderidae;Parastalita;stygia;Parastalita stygia;873;45 453 146;14 701 154;Tb;deep cave;4 545 314 614 701 150;1;;;
1615;Lokvarka;Croatia;17.3.2007.;2007-03-17;1m;1;Dysderidae;Parastalita;stygia;Parastalita stygia;775;45 361 466;14 762 671;Tb;deep cave;4 536 146 614 762 670;2;;;
1616;Lokvarka;Croatia;12.9.1996.;1996-09-12;3m;3;Dysderidae;Parastalita;stygia;Parastalita stygia;775;45 361 466;14 762 671;Tb;deep cave;4 536 146 614 762 670;2;;;
1617;Lokvarka;Croatia;14.6.1997.;1997-06-14;1juv;1;Dysderidae;Parastalita;stygia;Parastalita stygia;775;45 361 466;14 762 671;Tb;deep cave;4 536 146 614 762 670;2;;;
1618;Hircova jama;Croatia;2.8.2002.;2002-08-02;1m;1;Dysderidae;Parastalita;stygia;Parastalita stygia;923;45 426 113;14 664 785;Tb;deep cave;4 542 611 314 664 780;3;;;
1619;Vrelo Li?anke;Croatia;20.7.1998.;1998-07-20;1m;1;Dysderidae;Parastalita;stygia;Parastalita stygia;740;45 329 044;14 701 574;Tb;deep cave;4 532 904 414 701 570;1;;;
1620;Lokvarka;Croatia;27.9.1997.;1997-09-27;1juv;1;Dysderidae;Parastalita;stygia;Parastalita stygia;775;45 361 466;14 762 671;Tb;deep cave;4 536 146 614 762 670;2;;;
1621;Grizeljeva jama;Croatia;8.8.2007.;2007-08-08;1f;1;Dysderidae;Harpactea;sp. 27;Harpactea sp. 27;;43 867 534;16 399 097;;;4 386 753 416 399 090;5;;;
1622;Jakasova spila;Croatia;25.4.2004.;2004-04-25;3 juv;3;Dysderidae;Folkia;haasi;Folkia haasi;95;4 291 615;1 712 834;Tb;deep cave;42 916 151 712 834;1;;;
1623;Jakasova spila;Croatia;27.8.1995.;1995-08-27;2 juv;2;Dysderidae;Folkia;haasi;Folkia haasi;;4 291 615;1 712 834;Tb;deep cave;42 916 151 712 834;1;;;
1624;Špilja kod Nerezinog dola;Croatia;8.8.1996.;1996-08-08;1m, 1juv;2;Dysderidae;Folkia;inermis;Folkia inermis;;42 758 378;17 436 094;Tb;deep cave;4 275 837 817 436 090;6;;;15,5
1624;Špilja kod Nerezinog dola;Croatia;8.8.1996.;1996-08-08;1m, 1juv;2;Dysderidae;Folkia;inermis;Folkia inermis;;42 758 378;17 436 094;Tb;deep cave;4 275 837 817 436 090;6;;;12,267
1625;Samograd;Croatia;26.4.2004.;2004-04-26;1m, 1juv;2;Dysderidae;Folkia;haasi;Folkia haasi;;42 970 451;16 995 978;Tb;deep cave;4 297 045 116 995 970;4;;;
1626;Pišurka;Croatia;28.8.1995.;1995-08-28;1juv;1;Dysderidae;Folkia;haasi;Folkia haasi;;42 959 451;17 129 228;Tb;deep cave;4 295 945 117 129 220;5;;;13,925
1627;Samograd;Croatia;1.9.1995.;1995-09-01;1juv;1;Dysderidae;Folkia;haasi;Folkia haasi;;42 970 451;16 995 978;Tb;deep cave;4 297 045 116 995 970;4;;;
1628;Pišurka;Croatia;12.2.1998.;1998-02-12;2 juv;2;Dysderidae;Folkia;haasi;Folkia haasi;;42 959 451;17 129 228;Tb;deep cave;4 295 945 117 129 220;5;;;13,925
1630;Samograd;Croatia;4.6.2000.;2000-06-04;3f, 1juv;4;Dysderidae;Folkia;haasi;Folkia haasi;;42 970 451;16 995 978;Tb;deep cave;4 297 045 116 995 970;4;;;
1631;Samograd;Croatia;12.2.1998.;1998-02-12;1 juvm, 2 juv;3;Dysderidae;Folkia;haasi;Folkia haasi;;42 970 451;16 995 978;Tb;deep cave;4 297 045 116 995 970;4;;;
1632;Jakasova spila;Croatia;3.6.2000.;2000-06-03;1f, 1 juv;2;Dysderidae;Folkia;haasi;Folkia haasi;;4 291 615;1 712 834;Tb;deep cave;42 916 151 712 834;1;;;
1633;Samograd;Croatia;26.4.2004.;2004-04-26;2 juv;2;Dysderidae;Folkia;haasi;Folkia haasi;;42 970 451;16 995 978;Tb;deep cave;4 297 045 116 995 970;4;;;
1634;Pišurka;Croatia;2.6.2000.;2000-06-02;2 juv;2;Dysderidae;Folkia;haasi;Folkia haasi;;42 959 451;17 129 228;Tb;deep cave;4 295 945 117 129 220;5;;;13,925
1635;Jakasova spila;Croatia;25.4.2004.;2004-04-25;2 juv;2;Dysderidae;Folkia;haasi;Folkia haasi;;4 291 615;1 712 834;Tb;deep cave;42 916 151 712 834;1;;;
1636;Vodena pe?a;Croatia;17.8.2005.;2005-08-17;1f;1;Dysderidae;Stalagtia;sp. 4;Stalagtia sp. 4;610;43 792 496;16 671 447;Tb;deep cave;4 379 249 616 671 440;8;;;
1637;Grizeljeva jama;Croatia;8.8.2007.;2007-08-08;1juvm, 1juv;2;Dysderidae;Harpactea;sp.;Harpactea sp.;;43 867 534;16 399 097;;;4 386 753 416 399 090;5;;;
1638;Vodena pe?a;Croatia;17.8.2005.;2005-08-17;1f;1;Dysderidae;Harpactea;sp. 33;Harpactea sp. 33;610;43 792 496;16 671 447;;;4 379 249 616 671 440;8;;;
1639;Mo?iljska špilja;Croatia;1.11.2003.;2003-11-01;1m;1;Dysderidae;Stalagtia;sp. 5;Stalagtia sp. 5;;42 689 061;18 071 906;Tb;deep cave;4 268 906 118 071 900;6;;15,4;14,7
1640;Šipun;Croatia;26.3.2004.;2004-03-26;1f;1;Dysderidae;Stalagtia;sp. 1;Stalagtia sp. 1;;42 583 646;18 217 986;Tb;deep cave;4 258 364 618 217 980;11;;;15,4
1641;Mo?iljska špilja;Croatia;9.2.1998.;1998-02-09;1f;1;Dysderidae;Stalagtia;sp. 5;Stalagtia sp. 5;;42 689 061;18 071 906;Tb;deep cave;4 268 906 118 071 900;6;;15,4;14,7
1642;Mo?iljska špilja;Croatia;25.3.2004.;2004-03-25;1m;1;Dysderidae;Stalagtia;sp. 5;Stalagtia sp. 5;;42 689 061;18 071 906;Tb;deep cave;4 268 906 118 071 900;6;;15,4;14,7
1643;Mo?iljska špilja;Croatia;21.6.2001.;2001-06-21;1f, 1 juv;2;Dysderidae;Stalagtia;sp. 5;Stalagtia sp. 5;;42 689 061;18 071 906;Tb;deep cave;4 268 906 118 071 900;6;;15,4;14,7
1644;Šipun;Croatia;12.2.2005.;2005-02-12;1f;1;Dysderidae;Stalagtia;sp. 1;Stalagtia sp. 1;;42 583 646;18 217 986;Tb;deep cave;4 258 364 618 217 980;11;;;15,4
1645;Šipun;Croatia;19.8.2005.;2005-08-19;2 juv;2;Dysderidae;Stalagtia;sp. 1;Stalagtia sp. 1;;42 583 646;18 217 986;Tb;deep cave;4 258 364 618 217 980;11;;;15,4
1646;Mo?iljska špilja;Croatia;27.6.2003.;2003-06-27;1juvm;1;Dysderidae;Stalagtia;sp. 5;Stalagtia sp. 5;;42 689 061;18 071 906;Tb;deep cave;4 268 906 118 071 900;6;;15,4;14,7
1647;Mo?iljska špilja;Croatia;28.3.2003.;2003-03-28;2 juv;2;Dysderidae;Stalagtia;sp. 5;Stalagtia sp. 5;;42 689 061;18 071 906;Tb;deep cave;4 268 906 118 071 900;6;;15,4;14,7
1649;Mo?iljska špilja;Croatia;1.11.2003.;2003-11-01;1 juv;1;Dysderidae;Stalagtia;sp. 5;Stalagtia sp. 5;;42 689 061;18 071 906;Tb;deep cave;4 268 906 118 071 900;6;;15,4;14,7
1652;Trogrla jama;Croatia;9.10.2010.;2010-10-09;1m, 1f;2;Nesticidae;Kryptonesticus;eremita;Kryptonesticus eremita;;44 014 335;16 065 195;tf;deep cave;4 401 433 516 065 190;3;;;
1653;Trogrla jama;Croatia;9.10.2010.;2010-10-09;1 juv;1;Dysderidae;Stalagtia;sp. 4;Stalagtia sp. 4;;44 014 335;16 065 195;Tb;deep cave;4 401 433 516 065 190;3;;;
1655;Trogrla jama;Croatia;9.10.2010.;2010-10-09;2juv;2;Dysderidae;Stalagtia;sp. 4;Stalagtia sp. 4;;44 014 335;16 065 195;Tb;deep cave;4 401 433 516 065 190;3;;;
1656;Stara jametina;Croatia;10.10.2010.;2010-10-10;1 juv;1;Dysderidae;Stalagtia;sp. 4;Stalagtia sp. 4;;43 794 009;1 600 259;Tb;deep cave;437 940 091 600 259;6;;;13
1656;Stara jametina;Croatia;10.10.2010.;2010-10-10;1 juv;1;Dysderidae;Stalagtia;sp. 4;Stalagtia sp. 4;;43 794 009;1 600 259;Tb;deep cave;437 940 091 600 259;6;;13,4;13,4
1657;Miljacka 2;Croatia;8.10.2010.;2010-10-08;1m, 1f, 4 juv;6;Nesticidae;Kryptonesticus;eremita;Kryptonesticus eremita;;440 002;16 016 234;tf;deep cave;44 000 216 016 234;4;;;12,6
1658;Stara jametina;Croatia;10.10.2010.;2010-10-10;1juv;1;Dysderidae;Stalagtia;sp. 4;Stalagtia sp. 4;;43 794 009;1 600 259;Tb;deep cave;437 940 091 600 259;6;;;13
1658;Stara jametina;Croatia;10.10.2010.;2010-10-10;1juv;1;Dysderidae;Stalagtia;sp. 4;Stalagtia sp. 4;;43 794 009;1 600 259;Tb;deep cave;437 940 091 600 259;6;;13,4;13,4
1659;Stara jametina;Croatia;10.10.2010.;2010-10-10;1 juv;1;Agelenidae;Histopona;sp.;Histopona sp.;;43 794 009;1 600 259;;deep cave;437 940 091 600 259;6;;;13
1659;Stara jametina;Croatia;10.10.2010.;2010-10-10;1 juv;1;Agelenidae;Histopona;sp.;Histopona sp.;;43 794 009;1 600 259;;deep cave;437 940 091 600 259;6;;13,4;13,4
1661;Golubinka na Pozdravljanju;Croatia;9.10.2010.;2010-10-09;1m, 1 juv;2;Nesticidae;Kryptonesticus;eremita;Kryptonesticus eremita;;43 831 451;15 925 122;tf;deep cave;4 383 145 115 925 120;2;;;
1662;Špiljski sustav Miljacka 1-5;Croatia;8.10.2010.;2010-10-08;1m;1;Nesticidae;Kryptonesticus;eremita;Kryptonesticus eremita;;44 004 754;16 023 086;tf;deep cave;4 400 475 416 023 080;2;;;
1663;Sedrena špilja kod stola;Croatia;5.10.2010.;2010-10-05;1 m;1;Nesticidae;Kryptonesticus;eremita;Kryptonesticus eremita;;4 401 385;16 068 978;tf;deep cave;440 138 516 068 978;2;;6,1;6,1
1664;Miljacka 2;Croatia;8.10.2010.;2010-10-08;1m, 1f;2;Nesticidae;Kryptonesticus;eremita;Kryptonesticus eremita;;440 002;16 016 234;tf;deep cave;44 000 216 016 234;4;;;12,6
1665;Jazinka;Croatia;10.10.2010.;2010-10-10;1 juv;1;Dysderidae;Stalagtia;sp. 4;Stalagtia sp. 4;235;43 975 892;16 029 694;Tb;deep cave;4 397 589 216 029 690;2;;;13
1667;Stara jametina;Croatia;10.10.2010.;2010-10-10;1m;1;Linyphiidae;Palliduphantes;istrianus;Palliduphantes istrianus;;43 794 009;1 600 259;Tf;deep cave;437 940 091 600 259;6;;;13
1667;Stara jametina;Croatia;10.10.2010.;2010-10-10;1m;1;Linyphiidae;Palliduphantes;istrianus;Palliduphantes istrianus;;43 794 009;1 600 259;Tf;deep cave;437 940 091 600 259;6;;13,4;13,4
1668;Stara jametina;Croatia;10.10.2010.;2010-10-10;1f;1;Linyphiidae;Palliduphantes;istrianus;Palliduphantes istrianus;;43 794 009;1 600 259;Tf;deep cave;437 940 091 600 259;6;;;13
1668;Stara jametina;Croatia;10.10.2010.;2010-10-10;1f;1;Linyphiidae;Palliduphantes;istrianus;Palliduphantes istrianus;;43 794 009;1 600 259;Tf;deep cave;437 940 091 600 259;6;;13,4;13,4
1669;Stara jametina;Croatia;10.10.2010.;2010-10-10;1f;1;Linyphiidae;Palliduphantes;istrianus;Palliduphantes istrianus;;43 794 009;1 600 259;Tf;deep cave;437 940 091 600 259;6;;;13
1669;Stara jametina;Croatia;10.10.2010.;2010-10-10;1f;1;Linyphiidae;Palliduphantes;istrianus;Palliduphantes istrianus;;43 794 009;1 600 259;Tf;deep cave;437 940 091 600 259;6;;13,4;13,4
1674;Golubinka na Pozdravljanju;Croatia;9.10.2010.;2010-10-09;1m, 2f;3;Linyphiidae;Palliduphantes;istrianus;Palliduphantes istrianus;;43 831 451;15 925 122;Tf;deep cave;4 383 145 115 925 120;2;;;
1675;Jama nasuprot Torka;Croatia;9.10.2010.;2010-10-09;1f, 4 juv;5;Nesticidae;Kryptonesticus;eremita;Kryptonesticus eremita;;4 382 018;16 012 303;tf;deep cave;438 201 816 012 303;8;;;
1676;Jama nasuprot Torka;Croatia;9.10.2010.;2010-10-09;1m;1;Agelenidae;Inermocoelotes;gasperinii;Inermocoelotes gasperinii;;4 382 018;16 012 303;;deep cave;438 201 816 012 303;8;;;
1677;Miljacka 2;Croatia;8.10.2010.;2010-10-08;1f, 1m;2;Nesticidae;Kryptonesticus;eremita;Kryptonesticus eremita;;440 002;16 016 234;tf;deep cave;44 000 216 016 234;4;;;12,6
1678;Miljacka 2;Croatia;8.10.2010.;2010-10-08;1f;1;Agelenidae;Tegenaria;domestica;Tegenaria domestica;;440 002;16 016 234;Tf;deep cave;44 000 216 016 234;4;;;12,6
1679;Miljacka 2;Croatia;8.10.2010.;2010-10-08;1f, 2 juv;3;Nesticidae;Kryptonesticus;eremita;Kryptonesticus eremita;;440 002;16 016 234;tf;deep cave;44 000 216 016 234;4;;;12,6
1680;Miljacka 2;Croatia;8.10.2010.;2010-10-08;1f, 1m;2;Agelenidae;Tegenaria;domestica;Tegenaria domestica;;440 002;16 016 234;Tf;deep cave;44 000 216 016 234;4;;;12,6
1681;Stara jametina;Croatia;10.10.2010.;2010-10-10;4 juv;4;Dysderidae;Stalagtia;sp. 4;Stalagtia sp. 4;;43 794 009;1 600 259;Tb;deep cave;437 940 091 600 259;6;;;13
1681;Stara jametina;Croatia;10.10.2010.;2010-10-10;4 juv;4;Dysderidae;Stalagtia;sp. 4;Stalagtia sp. 4;;43 794 009;1 600 259;Tb;deep cave;437 940 091 600 259;6;;13,4;13,4
1683;Trogrla jama;Croatia;9.10.2010.;2010-10-09;1m, 1f;2;Tetragnathidae;Meta;bourneti;Meta bourneti;;44 014 335;16 065 195;Tf;deep cave;4 401 433 516 065 190;3;;;
1684;Stara jametina;Croatia;10.10.2010.;2010-10-10;2m, 6f, 1 juv;9;Linyphiidae;Micrargus;herbigradus;Micrargus herbigradus;;43 794 009;1 600 259;Tf;deep cave;437 940 091 600 259;6;;;13
1684;Stara jametina;Croatia;10.10.2010.;2010-10-10;2m, 6f, 1 juv;9;Linyphiidae;Micrargus;herbigradus;Micrargus herbigradus;;43 794 009;1 600 259;Tf;deep cave;437 940 091 600 259;6;;13,4;13,4
1685;Stara jametina;Croatia;10.10.2010.;2010-10-10;2m, 2f;4;Linyphiidae;Micrargus;herbigradus;Micrargus herbigradus;;43 794 009;1 600 259;Tf;deep cave;437 940 091 600 259;6;;;13
1685;Stara jametina;Croatia;10.10.2010.;2010-10-10;2m, 2f;4;Linyphiidae;Micrargus;herbigradus;Micrargus herbigradus;;43 794 009;1 600 259;Tf;deep cave;437 940 091 600 259;6;;13,4;13,4
1686;Stara jametina;Croatia;10.10.2010.;2010-10-10;1f;1;Linyphiidae;Micrargus;herbigradus;Micrargus herbigradus;;43 794 009;1 600 259;Tf;deep cave;437 940 091 600 259;6;;;13
1686;Stara jametina;Croatia;10.10.2010.;2010-10-10;1f;1;Linyphiidae;Micrargus;herbigradus;Micrargus herbigradus;;43 794 009;1 600 259;Tf;deep cave;437 940 091 600 259;6;;13,4;13,4
1687;Stara jametina;Croatia;10.10.2010.;2010-10-10;1f;1;Linyphiidae;Micrargus;herbigradus;Micrargus herbigradus;;43 794 009;1 600 259;Tf;deep cave;437 940 091 600 259;6;;;13
1687;Stara jametina;Croatia;10.10.2010.;2010-10-10;1f;1;Linyphiidae;Micrargus;herbigradus;Micrargus herbigradus;;43 794 009;1 600 259;Tf;deep cave;437 940 091 600 259;6;;13,4;13,4
1688;Stara jametina;Croatia;10.10.2010.;2010-10-10;1f;1;Linyphiidae;Micrargus;herbigradus;Micrargus herbigradus;;43 794 009;1 600 259;Tf;deep cave;437 940 091 600 259;6;;;13
1688;Stara jametina;Croatia;10.10.2010.;2010-10-10;1f;1;Linyphiidae;Micrargus;herbigradus;Micrargus herbigradus;;43 794 009;1 600 259;Tf;deep cave;437 940 091 600 259;6;;13,4;13,4
1689;Stara jametina;Croatia;10.10.2010.;2010-10-10;1f;1;Theridiidae;Episinus;cavernicola;Episinus cavernicola;;43 794 009;1 600 259;Tf;deep cave;437 940 091 600 259;6;;;13
1689;Stara jametina;Croatia;10.10.2010.;2010-10-10;1f;1;Theridiidae;Episinus;cavernicola;Episinus cavernicola;;43 794 009;1 600 259;Tf;deep cave;437 940 091 600 259;6;;13,4;13,4
1694;Pavši?a pe?a;Croatia;30.7.2007.;2007-07-30;1m;1;Tetragnathidae;Meta;bourneti;Meta bourneti;;43 786 027;16 665 515;Tf;deep cave;4 378 602 716 665 510;2;;;
1695;Kranjica pe?ina;Croatia;13.10.2007.;2007-10-13;1f;1;Agelenidae;Tegenaria;bosnica;Tegenaria bosnica;820;43 959 462;16 475 197;;deep cave;4 395 946 216 475 190;2;;;
1697;Bundalova pe?ina;Croatia;11.7.2009.;2009-07-11;1 juv;1;Agelenidae;Histopona;sp.;Histopona sp.;230;44 195 721;15 855 588;;deep cave;4 419 572 115 855 580;4;;;10,4
1698;Bojina jama;Croatia;5.8.2010.;2010-08-05;1f;1;Dysderidae;Parastalita;stygia;Parastalita stygia;1075;44 349 429;15 412 027;Tb;deep cave;4 434 942 915 412 020;1;;;
1699;Frkina jama;Croatia;20.11.2010.;2010-11-20;1f, 1 juv;2;Tetragnathidae;Metellina;merianae;Metellina merianae;;4 421 424;15 998 543;Tf;deep cave;442 142 415 998 543;1;;;6,8
1700;Budin pupak;Croatia;6.8.2009.;2009-08-06;1f;1;Linyphiidae;Gen. 10;sp. 1;Gen. 10 sp. 1;;44 739 729;15 089 755;;;4 473 972 915 089 750;2;;;
1701;Šipun;Croatia;27.3.2003.;2003-03-27;1 juv;1;Dysderidae;Stalagtia;sp. 1;Stalagtia sp. 1;;42 583 646;18 217 986;Tb;deep cave;4 258 364 618 217 980;11;;;15,4
1703;Šipun;Croatia;27.3.2003.;2003-03-27;2 juv;2;Dysderidae;Stalagtia;sp. 1;Stalagtia sp. 1;;42 583 646;18 217 986;Tb;deep cave;4 258 364 618 217 980;11;;;15,4
1704;Šipun;Croatia;19.8.2005.;2005-08-19;1 juv;1;Dysderidae;Stalagtia;sp. 1;Stalagtia sp. 1;;42 583 646;18 217 986;Tb;deep cave;4 258 364 618 217 980;11;;;15,4
1705;Šipun;Croatia;27.3.2003.;2003-03-27;1 juv;1;Dysderidae;Stalagtia;sp. 1;Stalagtia sp. 1;;42 583 646;18 217 986;Tb;deep cave;4 258 364 618 217 980;11;;;15,4
1706;Šipun;Croatia;27.6.2003.;2003-06-27;1 juv;1;Dysderidae;Stalagtia;sp. 1;Stalagtia sp. 1;;42 583 646;18 217 986;Tb;deep cave;4 258 364 618 217 980;11;;;15,4
1707;Šipun;Croatia;19.8.2005.;2005-08-19;1m, 1f;2;Dysderidae;Stalagtia;sp. 1;Stalagtia sp. 1;;42 583 646;18 217 986;Tb;deep cave;4 258 364 618 217 980;11;;;15,4
1709;Šipun;Croatia;29.6.2000.;2000-06-29;6 juv;6;Dysderidae;Stalagtia;sp. 1;Stalagtia sp. 1;;42 583 646;18 217 986;Tb;deep cave;4 258 364 618 217 980;11;;;15,4
1710;Tu?epska vilenja?a;Croatia;17.6.2002.;2002-06-17;1 juv;1;Dysderidae;Stalagtia;sp. 4;Stalagtia sp. 4;1181;43 286 465;17 083 638;Tb;deep cave;4 328 646 517 083 630;8;;;9,967
1710;Tu?epska vilenja?a;Croatia;17.6.2002.;2002-06-17;1 juv;1;Dysderidae;Stalagtia;sp. 4;Stalagtia sp. 4;1181;43 286 465;17 083 638;Tb;deep cave;4 328 646 517 083 630;8;;;11,2
1710;Tu?epska vilenja?a;Croatia;17.6.2002.;2002-06-17;1 juv;1;Dysderidae;Stalagtia;sp. 4;Stalagtia sp. 4;1181;43 286 465;17 083 638;Tb;deep cave;4 328 646 517 083 630;8;;10,6;11,025
1711;Mo?iljska špilja;Croatia;1.11.2003.;2003-11-01;1 juv;1;Dysderidae;Stalagtia;sp. 5;Stalagtia sp. 5;;42 689 061;18 071 906;Tb;deep cave;4 268 906 118 071 900;6;;15,4;14,7
1712;Tu?epska vilenja?a;Croatia;9.4.1999.;1999-04-09;1m;1;Dysderidae;Stalagtia;sp. 4;Stalagtia sp. 4;1181;43 286 465;17 083 638;Tb;deep cave;4 328 646 517 083 630;8;;;9,967
1712;Tu?epska vilenja?a;Croatia;9.4.1999.;1999-04-09;1m;1;Dysderidae;Stalagtia;sp. 4;Stalagtia sp. 4;1181;43 286 465;17 083 638;Tb;deep cave;4 328 646 517 083 630;8;;;11,2
1712;Tu?epska vilenja?a;Croatia;9.4.1999.;1999-04-09;1m;1;Dysderidae;Stalagtia;sp. 4;Stalagtia sp. 4;1181;43 286 465;17 083 638;Tb;deep cave;4 328 646 517 083 630;8;;10,6;11,025
1713;Šipun;Croatia;11.2.2005.;2005-02-11;2 juv;2;Dysderidae;Stalagtia;sp. 1;Stalagtia sp. 1;;42 583 646;18 217 986;Tb;deep cave;4 258 364 618 217 980;11;;;15,4
1716;Jama Vrap?anka;Croatia;8.2.2004.;2004-02-08;1m;1;Familia x;Gen.;sp.;Gen. sp.;397;45 848 567;15 892 337;;;4 584 856 715 892 330;3;;;
1719;?urovi?a jama;Croatia;27.5.2004.;2004-05-27;1 juv;1;Leptonetidae;Gen.;sp.;Gen. sp.;;42 559 979;18 263 559;;;4 255 997 918 263 550;4;;;17,267
1720;Miljacka 2;Croatia;6.1.2005.;2005-01-06;1m;1;Tetragnathidae;Metellina;merianae;Metellina merianae;;440 002;16 016 234;Tf;deep cave;44 000 216 016 234;4;;;12,6
1725;Rudnik Zrinski;Croatia;8.10.2008.;2008-10-08;1 juv;1;Agelenidae;Tegenaria;sp.;Tegenaria sp.;804;45 887 195;15 927 871;;deep cave;4 588 719 515 927 870;9;;;
1726;Mo?iljska špilja;Croatia;28.4.2010.;2010-04-28;1 juv;1;Dysderidae;Stalagtia;sp. 5;Stalagtia sp. 5;;42 689 061;18 071 906;Tb;deep cave;4 268 906 118 071 900;6;;15,4;14,7
1728;Rudina;Croatia;9.9.2004.;2004-09-09;1 juv;1;Dysderidae;Stalagtia;sp.;Stalagtia sp.;;42 721 999;18 015 321;;;4 272 199 918 015 320;3;;;
1730;Špilja u uvali Predpe?;Croatia;23.1.2011.;2011-01-23;1m;1;Nesticidae;Kryptonesticus;eremita;Kryptonesticus eremita;7;45 291 576;14 510 419;tf;deep cave;4 529 157 614 510 410;4;;10,3;10,625
1731;Zagorska pe? kod Ogulina;Croatia;7.9.2009.;2009-09-07;2m, 1f, 3 juv;6;Dysderidae;Parastalita;stygia;Parastalita stygia;335;45 196 851;15 219 904;Tb;deep cave;4 519 685 115 219 900;3;;;
1732;Zagorska pe? kod Ogulina;Croatia;7.9.2009.;2009-09-07;1juv;1;Dysderidae;Stalita;pretneri;Stalita pretneri;335;45 196 851;15 219 904;Tb;deep cave;4 519 685 115 219 900;3;;;
1733;Pišurka;Croatia;1.10.2007.;2007-10-01;3f, 3 juv;6;Nesticidae;Kryptonesticus;eremita;Kryptonesticus eremita;39;42 959 451;17 129 228;tf;deep cave;4 295 945 117 129 220;5;;;13,925
1734;Pišurka;Croatia;1.10.2007.;2007-10-01;1f, 2 juv;3;Dysderidae;Folkia;haasi;Folkia haasi;;42 959 451;17 129 228;Tb;deep cave;4 295 945 117 129 220;5;;;13,925
1735;Velebita- Dva javora;Croatia;12.-13.8.2007.;2007-08-12/2007-08-12;1m;1;Dysderidae;Gen. 1;sp. 1;Gen. 1 sp. 1;1560;44 757 596;1 498 636;Tb;deep cave;447 575 961 498 636;2;;;
1736;Slova?ka jama;Croatia;3.8.2002.;2002-08-03;1f;1;Dysderidae;Stalita;pretneri;Stalita pretneri;;44 748 943;15 003 173;Tb;deep cave;4 474 894 315 003 170;1;;;4,4
1737;Gornja Cerova?ka špilja;Croatia;16.8.2006.;2006-08-16;1f;1;Dysderidae;Parastalita;stygia;Parastalita stygia;700;44 273 382;15 884 227;Tb;deep cave;4 427 338 215 884 220;2;;;
1738;Gornja Cerova?ka špilja;Croatia;6.6.2006.;2006-06-06;1 juv;1;Dysderidae;Parastalita;stygia;Parastalita stygia;700;44 273 382;15 884 227;Tb;deep cave;4 427 338 215 884 220;2;;;
1739;Gornja Cerova?ka špilja;Croatia;4.8.1998.;1998-08-04;1f;1;Dysderidae;Parastalita;stygia;Parastalita stygia;700;44 273 382;15 884 227;Tb;deep cave;4 427 338 215 884 220;2;;;
1740;Gornja Cerova?ka špilja;Croatia;6.6.2006.;2006-06-06;ostaci;;Dysderidae;Parastalita;stygia;Parastalita stygia;700;44 273 382;15 884 227;Tb;deep cave;4 427 338 215 884 220;2;;;
1741;Manita pe?;Croatia;7.6.2006.;2006-06-07;1m, 1f, 1 juv;3;Dysderidae;Parastalita;stygia;Parastalita stygia;520;44 314 302;15 475 264;Tb;deep cave;4 431 430 215 475 260;7;;;9,8
1741;Manita pe?;Croatia;7.6.2006.;2006-06-07;1m, 1f, 1 juv;3;Dysderidae;Parastalita;stygia;Parastalita stygia;520;44 314 302;15 475 264;Tb;deep cave;4 431 430 215 475 260;7;;8,8;9,25
1742;Manita pe?;Croatia;7.6.2006.;2006-06-07;2 juv;2;Dysderidae;Parastalita;stygia;Parastalita stygia;520;44 314 302;15 475 264;Tb;deep cave;4 431 430 215 475 260;7;;;9,8
1742;Manita pe?;Croatia;7.6.2006.;2006-06-07;2 juv;2;Dysderidae;Parastalita;stygia;Parastalita stygia;520;44 314 302;15 475 264;Tb;deep cave;4 431 430 215 475 260;7;;8,8;9,25
1743;?ude špilja;Croatia;4.8.2006.;2006-08-04;1m;1;Dysderidae;Parastalita;stygia;Parastalita stygia;70;44 212 351;15 741 592;Tb;deep cave;4 421 235 115 741 590;2;;;13,4
1745;Babi?a Snježnja?a;Croatia;9.6.1984.;1984-06-09;1 f;1;Dysderidae;Parastalita;stygia;Parastalita stygia;;44 209 779;16 103 991;Tb;deep cave;4 420 977 916 103 990;2;;;
1746;Lasi?a špilja;Croatia;22.6.2009.;2009-06-22;1 juv m;1;Dysderidae;Stalita;pretneri;Stalita pretneri;;4 489 408;1 509 091;Tb;deep cave;44 894 081 509 091;2;;;
1747;Izvor špilja Studenac;Croatia;1.8.2010.;2010-08-01;1f;1;Dysderidae;Parastalita;stygia;Parastalita stygia;;45 134 692;15 542 765;Tb;deep cave;4 513 469 215 542 760;1;;;
1748;Bukovac;Croatia;20.2.1999.;1999-02-20;2 juv;2;Dysderidae;Stalita;pretneri;Stalita pretneri;881;4 534 318;14 757 647;Tb;deep cave;453 431 814 757 647;5;;;7,8
1749;Špilja kod Stare Sušice;Croatia;25.7.2009.;2009-07-25;1m, 1f;2;Dysderidae;Parastalita;stygia;Parastalita stygia;725;45 387 689;14 994 379;Tb;deep cave;4 538 768 914 994 370;11;;;7,4
1750;Špilja pod Ma?kovom dragom;Croatia;10.7.2010.;2010-07-10;1m;1;Dysderidae;Parastalita;stygia;Parastalita stygia;620;45 261 001;15 023 822;Tb;deep cave;4 526 100 115 023 820;1;;;7,4
1752;Špilja za Groma?kom vlakom;Croatia;27.4.2010.;2010-04-27;1m, 2f, 1 juv;4;Dysderidae;Stalagtia;hercegovinensis;Stalagtia hercegovinensis;605;42 743 509;18 027 359;Tb;deep cave;4 274 350 918 027 350;15;;;13,378
1773;Kaverna pod vijaduktom kod Puljana;Croatia;23.6.2010.;2010-06-23;1m;1;Nesticidae;Kryptonesticus;eremita;Kryptonesticus eremita;;43 109 322;17 475 929;tf;deep cave;4 310 932 217 475 920;1;;;
1774;Jasena ponor;Croatia;4.8.2010.;2010-08-04;1 juv;1;Dysderidae;Stalagtia;sp. 4;Stalagtia sp. 4;;43 221 246;172 767;Tb;deep cave;43 221 246 172 767;2;;;
1775;Jamica u Docima;Croatia;30.4.2010.;2010-04-30;2 juv;2;Dysderidae;Stalagtia;sp. 4;Stalagtia sp. 4;310;43 066 324;17 560 915;Tb;deep cave;4 306 632 417 560 910;1;;;
1776;Mo?iljska špilja;Croatia;28.4.2010.;2010-04-28;1m;1;Dysderidae;Stalagtia;sp. 5;Stalagtia sp. 5;;42 689 061;18 071 906;Tb;deep cave;4 268 906 118 071 900;6;;15,4;14,7
1777;Vilina špilja-Izvor Omble;Croatia;29.4.2010.;2010-04-29;1f;1;Dysderidae;Stalagtia;sp. 2;Stalagtia sp. 2;137;4 267 716;18 136 236;Tb;deep cave;426 771 618 136 236;5;;;
1778;Vilina špilja-Izvor Omble;Croatia;29.4.2010.;2010-04-29;1f, 1juv, 1juvm;3;Dysderidae;Stalagtia;sp. 2;Stalagtia sp. 2;137;4 267 716;18 136 236;Tb;deep cave;426 771 618 136 236;5;;;
1779;Špilja za Groma?kom vlakom;Croatia;27.4.2010.;2010-04-27;1 juv;1;Dysderidae;Stalagtia;hercegovinensis;Stalagtia hercegovinensis;605;42 743 509;18 027 359;Tb;deep cave;4 274 350 918 027 350;15;;;13,378
1780;Maica Golubinka;Croatia;21.6.2010.;2010-06-21;1m;1;Dysderidae;Stalagtia;sp. 4;Stalagtia sp. 4;;43 108 853;17 566 424;Tb;deep cave;4 310 885 317 566 420;6;;;13,9
1781;Špilja za Groma?kom vlakom;Croatia;27.4.2010.;2010-04-27;1m;1;Dysderidae;Stalagtia;hercegovinensis;Stalagtia hercegovinensis;605;42 743 509;18 027 359;Tb;deep cave;4 274 350 918 027 350;15;;;13,378
1782;?ampari;Croatia;29.11.2008.;2008-11-29;1f;1;Nesticidae;Kryptonesticus;eremita;Kryptonesticus eremita;312;45 123 809;14 333 655;tf;deep cave;4 512 380 914 333 650;4;;;
1784;Per?evi?a špilja;Croatia;29.1.2008.;2008-01-29;1f;1;Nesticidae;Nesticus;cellulanus;Nesticus cellulanus;207;45 242 617;15 336 296;tf;deep cave;4 524 261 715 336 290;3;;;
1786;Samograd;Croatia;30.9.2007.;2007-09-30;1 juv;1;Dysderidae;Folkia;haasi;Folkia haasi;;42 970 451;16 995 978;Tb;deep cave;4 297 045 116 995 970;4;;;
1787;Samograd;Croatia;30.9.2007.;2007-09-30;1 juv;1;Dysderidae;Folkia;haasi;Folkia haasi;;42 970 451;16 995 978;Tb;deep cave;4 297 045 116 995 970;4;;;
1788;Jama pod Vošcem;Croatia;15.7.2008.;2008-07-15;1 juv;1;Dysderidae;Harpactea;sp.;Harpactea sp.;1300;43 309 566;17 046 435;;;4 330 956 617 046 430;1;;;6,6
1788;Jama pod Vošcem;Croatia;15.7.2008.;2008-07-15;1 juv;1;Dysderidae;Harpactea;sp.;Harpactea sp.;1300;43 309 566;17 046 435;;;4 330 956 617 046 430;1;;;7,7
1789;Medvje?a špilja;Croatia;25.5.2008.;2008-05-25;1m, 1f;2;Dysderidae;Parastalita;stygia;Parastalita stygia;809;45 363 572;14 757 905;Tb;deep cave;4 536 357 214 757 900;3;;;10,95
1790;Pustinja;Croatia;7.6.2008.;2008-06-07;1 juv;1;Dysderidae;Parastalita;stygia;Parastalita stygia;775;45 372 172;14 808 873;Tb;deep cave;4 537 217 214 808 870;3;;;5,75
1791;Samograd;Croatia;30.9.2007.;2007-09-30;1 juv;1;Dysderidae;Folkia;haasi;Folkia haasi;;42 970 451;16 995 978;Tb;deep cave;4 297 045 116 995 970;4;;;
1794;Francuski rudnik 1;Croatia;19.11.2004.;2004-11-19;1m;1;Agelenidae;Tegenaria;silvestris;Tegenaria silvestris;;4 591 305;15 940 454;Tf;deep cave;459 130 515 940 454;3;;;
1795;Vila;Croatia;6.11.2007.;2007-11-06;1m;1;Agelenidae;Inermocoelotes;inermis;Inermocoelotes inermis;613;46 265 771;15 995 721;;deep cave;4 626 577 115 995 720;2;;;
1796;outside in Zlobin;Croatia;22.2.1999.;1999-02-22;1m;1;Agelenidae;Inermocoelotes;anoplus;Inermocoelotes anoplus;;45.3;14.7;;Shallow subterranean habitat;45.314.7;1;;;
1797;Špilja pod Kapelu;Croatia;15.3.2011.;2011-03-15;2juv m, 2 juv;4;Agelenidae;Hadites;tegenarioides;Hadites tegenarioides;119;43 184 949;16 434 233;TB;deep cave;4 318 494 916 434 230;5;;;11,1
1797;Špilja pod Kapelu;Croatia;15.3.2011.;2011-03-15;2juv m, 2 juv;4;Agelenidae;Hadites;tegenarioides;Hadites tegenarioides;119;43 184 949;16 434 233;TB;deep cave;4 318 494 916 434 230;5;;;14,333
1798;Špilja pod Kapelu;Croatia;15.3.2011.;2011-03-15;2 juv;2;Agelenidae;Tegenaria;sp.;Tegenaria sp.;119;43 184 949;16 434 233;;deep cave;4 318 494 916 434 230;5;;;11,1
1798;Špilja pod Kapelu;Croatia;15.3.2011.;2011-03-15;2 juv;2;Agelenidae;Tegenaria;sp.;Tegenaria sp.;119;43 184 949;16 434 233;;deep cave;4 318 494 916 434 230;5;;;14,333
1799;Vratolomka;Croatia;2.10.2010.;2010-10-02;1m, 7 juv;8;Agelenidae;Histopona;egonpretneri;Histopona egonpretneri;;44 191 701;15 785 015;Tb;deep cave;4 419 170 115 785 010;2;;;
1802;Golubnja?a, Žegar;Croatia;1.10.2010.;2010-10-01;1f, 1 juv;2;Nesticidae;Kryptonesticus;eremita;Kryptonesticus eremita;243;44 131 933;15 851 054;tf;deep cave;4 413 193 315 851 050;6;;;
1803;Bundalova pe?ina;Croatia;3.5.2010.;2010-05-03;1f, 1 juv;2;Agelenidae;Histopona;egonpretneri;Histopona egonpretneri;;44 195 721;15 855 588;Tb;deep cave;4 419 572 115 855 580;4;;;10,4
1804;Špilja uz cestu;Croatia;1.5.2010.;2010-05-01;1m, 1f;2;Nesticidae;Kryptonesticus;eremita;Kryptonesticus eremita;;44 093 064;16 082 069;tf;deep cave;4 409 306 416 082 060;1;;;12,6
1805;Bundalova pe?ina;Croatia;3.5.2010.;2010-05-03;5 juv;5;Agelenidae;Histopona;sp.;Histopona sp.;;44 195 721;15 855 588;;deep cave;4 419 572 115 855 580;4;;;10,4
1806;Bundalova pe?ina;Croatia;3.5.2010.;2010-05-03;1 juv;1;Leptonetidae;Cataleptoneta;lingulata;Cataleptoneta lingulata;;44 195 721;15 855 588;tb;deep cave;4 419 572 115 855 580;4;;;10,4
1807;Bundalova pe?ina;Croatia;3.5.2010.;2010-05-03;1 juv;1;Agelenidae;Histopona;sp.;Histopona sp.;;44 195 721;15 855 588;;deep cave;4 419 572 115 855 580;4;;;10,4
1808;Špilja uz cestu;Croatia;1.5.2010.;2010-05-01;1f;1;Nesticidae;Kryptonesticus;eremita;Kryptonesticus eremita;;44 093 064;16 082 069;tf;deep cave;4 409 306 416 082 060;1;;;12,6
1811;?avlinka;Croatia;2.5.2010.;2010-05-02;1f, 1 juv;2;Nesticidae;Kryptonesticus;eremita;Kryptonesticus eremita;30;44 212 517;15 741 685;tf;deep cave;4 421 251 715 741 680;2;;;
1813;Mili?a špilja;Croatia;5.5.2010.;2010-05-05;1 juv;1;Nesticidae;Kryptonesticus;eremita;Kryptonesticus eremita;240;44 143 333;15 803 133;tf;deep cave;4 414 333 315 803 130;1;;;13
1813;Mili?a špilja;Croatia;5.5.2010.;2010-05-05;1 juv;1;Nesticidae;Kryptonesticus;eremita;Kryptonesticus eremita;240;44 143 333;15 803 133;tf;deep cave;4 414 333 315 803 130;1;;;12,2
1815;Mateši?eva-Popova?a sustav;Croatia;11.4.2010.;2010-04-11;1f;1;Nesticidae;Nesticus;cellulanus;Nesticus cellulanus;266;45 108 023;15 613 894;tf;deep cave;4 510 802 315 613 890;3;;;
1818;Jama pod Osojem;Croatia;22.6.2003.;2003-06-22;1 juv f;1;Linyphiidae;Palliduphantes;sp.;Palliduphantes sp.;818;43 251 441;17 118 374;;;4 325 144 117 118 370;3;;7;7
1819;Markova jama kod Tara;Croatia;31.10.1998.;1998-10-31;4 juv;4;Dysderidae;Stalita;taenaria;Stalita taenaria;95;45 319 298;13 631 373;Tb;deep cave;4 531 929 813 631 370;7;;;
1820;Trbušnjak;Croatia;10.6.2007.;2007-06-10;1m, 2f;3;Linyphiidae;Diplocephalus;alpinus;Diplocephalus alpinus;;45 495 969;17 263 219;Tf;deep cave;4 549 596 917 263 210;3;;;
1821;Trbušnjak;Croatia;10.6.2007.;2007-06-10;1f;1;Linyphiidae;Diplocephalus;alpinus;Diplocephalus alpinus;;45 495 969;17 263 219;;;4 549 596 917 263 210;3;;;
1822;Trbušnjak;Croatia;10.6.2007.;2007-06-10;1m;1;Linyphiidae;Diplocephalus;alpinus;Diplocephalus alpinus;;45 495 969;17 263 219;;;4 549 596 917 263 210;3;;;
1823;Maksimova špilja;Croatia;22.4.2006.;2006-04-22;3f, 3 juv;6;Linyphiidae;Diplocephalus;cristatus;Diplocephalus cristatus;493;45 518 313;1 768 695;Tx;deep cave;455 183 131 768 695;3;;;10,1
1823;Maksimova špilja;Croatia;22.4.2006.;2006-04-22;3f, 3 juv;6;Linyphiidae;Diplocephalus;cristatus;Diplocephalus cristatus;493;45 518 313;1 768 695;Tx;deep cave;455 183 131 768 695;3;;10,8;10,8
1825;Jelenova špilja;Croatia;21.4.2006.;2006-04-21;1f;1;Linyphiidae;Centromerus;sellarius;Centromerus sellarius;565;45 517 695;17 668 982;tf;deep cave;4 551 769 517 668 980;2;;;6
1825;Jelenova špilja;Croatia;21.4.2006.;2006-04-21;1f;1;Linyphiidae;Centromerus;sellarius;Centromerus sellarius;565;45 517 695;17 668 982;tf;deep cave;4 551 769 517 668 980;2;;;13,5
1830;Uviraljka;Croatia;6.11.2004.;2004-11-06;1m, 4juv;5;Linyphiidae;Porrhomma;convexum;Porrhomma convexum;810;45 522 243;1 762 067;;deep cave;455 222 431 762 067;3;;;
1831;Antina špilja;Croatia;17.7.2004.;2004-07-17;1m;1;Agelenidae;Histopona;luxurians;Histopona luxurians;;45 497 475;17 856 553;tf;deep cave;4 549 747 517 856 550;2;;;13,2
1832;Suhodolka;Croatia;5.6.2007.;2007-06-05;2f, 3 juv;5;Linyphiidae;Porrhomma;egeria;Porrhomma egeria;658;45 504 451;17 698 877;Tf;deep cave;4 550 445 117 698 870;1;;;
1833;Uviraljka;Croatia;6.11.2004.;2004-11-06;2f, 4 juv;6;Linyphiidae;Porrhomma;egeria;Porrhomma egeria;810;45 522 243;1 762 067;Tf;deep cave;455 222 431 762 067;3;;;
1835;Radetina velika špilja;Croatia;21.4.2006.;2006-04-21;3f, 1 juv;4;Linyphiidae;Porrhomma;egeria;Porrhomma egeria;612;45 500 939;17 734 302;Tf;deep cave;4 550 093 917 734 300;1;;;
1836;Maksimova špilja;Croatia;8.6.2007.;2007-06-08;1f;1;Linyphiidae;Porrhomma;egeria;Porrhomma egeria;493;45 518 313;1 768 695;Tf;deep cave;455 183 131 768 695;3;;;10,1
1836;Maksimova špilja;Croatia;8.6.2007.;2007-06-08;1f;1;Linyphiidae;Porrhomma;egeria;Porrhomma egeria;493;45 518 313;1 768 695;Tf;deep cave;455 183 131 768 695;3;;10,8;10,8
1837;Uviraljka;Croatia;23.4.2006.;2006-04-23;2f, 3 juv;5;Linyphiidae;Porrhomma;egeria;Porrhomma egeria;810;45 522 243;1 762 067;Tf;deep cave;455 222 431 762 067;3;;;
1838;Uviraljka;Croatia;6.11.2004.;2004-11-06;1f;1;Linyphiidae;Porrhomma;egeria;Porrhomma egeria;810;45 522 243;1 762 067;Tf;deep cave;455 222 431 762 067;3;;;
1839;Jelenova špilja;Croatia;21.4.2006.;2006-04-21;1f;1;Linyphiidae;Porrhomma;microps;Porrhomma microps;565;45 517 695;17 668 982;Tf;deep cave;4 551 769 517 668 980;2;;;6
1839;Jelenova špilja;Croatia;21.4.2006.;2006-04-21;1f;1;Linyphiidae;Porrhomma;microps;Porrhomma microps;565;45 517 695;17 668 982;Tf;deep cave;4 551 769 517 668 980;2;;;13,5
1840;Suhodolka;Croatia;5.6.2007.;2007-06-05;1f, 1m, 1juv;3;Linyphiidae;Porrhomma;egeria;Porrhomma egeria;658;45 504 451;17 698 877;Tf;deep cave;4 550 445 117 698 870;1;;;
1841;Uviraljka;Croatia;19.7.2004.;2004-07-19;2f;2;Linyphiidae;Porrhomma;convexum;Porrhomma convexum;810;45 522 243;1 762 067;Tf;deep cave;455 222 431 762 067;3;;;
1842;Uviraljka;Croatia;19.7.2004.;2004-07-19;2f, 8 juv;1;Linyphiidae;Porrhomma;egeria;Porrhomma egeria;810;45 522 243;1 762 067;Tf;deep cave;455 222 431 762 067;3;;;
1843;Suhodolka;Croatia;5.6.2007.;2007-06-05;2m, 2 juv;4;Linyphiidae;Porrhomma;egeria;Porrhomma egeria;658;45 504 451;17 698 877;Tf;deep cave;4 550 445 117 698 870;1;;;
1844;Uviraljka;Croatia;20.4.2006.;2006-04-20;1m;1;Linyphiidae;Porrhomma;egeria;Porrhomma egeria;810;45 522 243;1 762 067;Tf;deep cave;455 222 431 762 067;3;;;
1845;Uviraljka;Croatia;20.4.2006.;2006-04-20;1f, 2m;3;Linyphiidae;Porrhomma;convexum;Porrhomma convexum;810;45 522 243;1 762 067;Tf;deep cave;455 222 431 762 067;3;;;
1846;Kova?ica jama;Croatia;2.10.2006.;2006-10-02;1m;1;Linyphiidae;Porrhomma;convexum;Porrhomma convexum;;45 519 178;1 765 444;Tf;deep cave;455 191 781 765 444;4;;;9,3
1847;Uviraljka;Croatia;20.4.2006.;2006-04-20;1f;1;Linyphiidae;Porrhomma;egeria;Porrhomma egeria;810;45 522 243;1 762 067;Tf;deep cave;455 222 431 762 067;3;;;
1848;Trbušnjak;Croatia;10.6.2007.;2007-06-10;1f, 1 juv;2;Linyphiidae;Porrhomma;convexum;Porrhomma convexum;;45 495 969;17 263 219;Tf;deep cave;4 549 596 917 263 210;3;;;
1849;Trbušnjak;Croatia;10.6.2007.;2007-06-10;1f, 1m;2;Linyphiidae;Porrhomma;convexum;Porrhomma convexum;;45 495 969;17 263 219;Tf;deep cave;4 549 596 917 263 210;3;;;
1850;Trbušnjak;Croatia;10.6.2007.;2007-06-10;1f;1;Linyphiidae;Porrhomma;convexum;Porrhomma convexum;;45 495 969;17 263 219;Tf;deep cave;4 549 596 917 263 210;3;;;
1851;Trbušnjak;Croatia;10.6.2007.;2007-06-10;3m;3;Linyphiidae;Porrhomma;convexum;Porrhomma convexum;;45 495 969;17 263 219;Tf;deep cave;4 549 596 917 263 210;3;;;
1852;Špilja u kamenolomu Tounj;Croatia;2.4.2011.;2011-04-02;2f, 1 juv;3;Linyphiidae;Troglohyphantes;croaticus;Troglohyphantes croaticus;263;45 245 525;15 318 946;Tb;deep cave;4 524 552 515 318 940;3;;;9,54
1853;Špilja u kamenolomu Tounj;Croatia;2.4.2011.;2011-04-02;1f, 1 juv m;2;Linyphiidae;Porrhomma;egeria;Porrhomma egeria;263;45 245 525;15 318 946;Tf;deep cave;4 524 552 515 318 940;3;;;9,54
1856;Zmajeva špilja;Croatia;12.3.2011.;2011-03-12;1m;1;Linyphiidae;Gen. 6;sp. 1;Gen. 6 sp. 1;;43 269 174;16 598 972;;;4 326 917 416 598 970;4;;;
1857;Jama za Mahrincem;Croatia;12.3.2011.;2011-03-12;1m;1;Nesticidae;Kryptonesticus;eremita;Kryptonesticus eremita;54;43 344 348;1 674 088;tf;deep cave;433 443 481 674 088;2;;;9,9
1858;Jama kod Mateši?a stana;Croatia;14.3.2011.;2011-03-14;1f;1;Nesticidae;Kryptonesticus;eremita;Kryptonesticus eremita;;43 305 943;1 675 112;tf;deep cave;433 059 431 675 112;2;;;13,35
1859;Bazgova?a;Croatia;13.3.2011.;2011-03-13;1m;1;Tetragnathidae;Metellina;merianae;Metellina merianae;;4 330 647;16 622 143;Tf;deep cave;433 064 716 622 143;3;;;7,2
1860;Jama za Mahrincem;Croatia;12.3.2011.;2011-03-12;1f;1;Agelenidae;Tegenaria;bosnica;Tegenaria bosnica;54;43 344 348;1 674 088;;deep cave;433 443 481 674 088;2;;;9,9
1861;Rudnik Minjera;Croatia;13.3.2011.;2011-03-13;1f;1;Nesticidae;Kryptonesticus;eremita;Kryptonesticus eremita;;43 361 342;1 660 633;tf;deep cave;433 613 421 660 633;2;;;11,8
1861;Rudnik Minjera;Croatia;13.3.2011.;2011-03-13;1f;1;Nesticidae;Kryptonesticus;eremita;Kryptonesticus eremita;;43 361 342;1 660 633;tf;deep cave;433 613 421 660 633;2;;;13,5
1863;Rudnik Minjera;Croatia;13.3.2011.;2011-03-13;1f;1;Nesticidae;Kryptonesticus;eremita;Kryptonesticus eremita;;43 361 342;1 660 633;tf;deep cave;433 613 421 660 633;2;;;11,8
1863;Rudnik Minjera;Croatia;13.3.2011.;2011-03-13;1f;1;Nesticidae;Kryptonesticus;eremita;Kryptonesticus eremita;;43 361 342;1 660 633;tf;deep cave;433 613 421 660 633;2;;;13,5
1866;Ješkalovica;Croatia;12.3.2011.;2011-03-12;1m;1;Nesticidae;Kryptonesticus;eremita;Kryptonesticus eremita;155;43 299 857;16 839 313;tf;deep cave;4 329 985 716 839 310;2;;;15,4
1867;Bazgova?a;Croatia;13.3.2011.;2011-03-13;1m;1;Linyphiidae;Palliduphantes;spelaeorum;Palliduphantes spelaeorum;;4 330 647;16 622 143;Tf;deep cave;433 064 716 622 143;3;;;7,2
1868;Bazgova?a;Croatia;13.3.2011.;2011-03-13;1m;1;Linyphiidae;Palliduphantes;spelaeorum;Palliduphantes spelaeorum;;4 330 647;16 622 143;Tf;deep cave;433 064 716 622 143;3;;;7,2
1869;Jama kod Mateši?a stana;Croatia;14.3.2011.;2011-03-14;1m, 5 f;6;Linyphiidae;Palliduphantes;spelaeorum;Palliduphantes spelaeorum;;43 305 943;1 675 112;Tf;deep cave;433 059 431 675 112;2;;;13,35
1870;Bazgova?a;Croatia;13.3.2011.;2011-03-13;1m;1;Linyphiidae;Palliduphantes;spelaeorum;Palliduphantes spelaeorum;;4 330 647;16 622 143;Tf;deep cave;433 064 716 622 143;3;;;7,2
1871;Jama kod Mateši?a stana;Croatia;13.3.2011.;2011-03-13;1f;1;Linyphiidae;Palliduphantes;spelaeorum;Palliduphantes spelaeorum;;43 305 943;1 675 112;Tf;deep cave;433 059 431 675 112;2;;;13,35
1874;Markova špilja, Hvar;Croatia;15.3.2011.;2011-03-15;1 juv m;1;Nesticidae;Kryptonesticus;eremita;Kryptonesticus eremita;58;43 190 585;16 402 907;tf;deep cave;4 319 058 516 402 900;8;;;
1875;Markova špilja, Hvar;Croatia;15.3.2011.;2011-03-15;1f;1;Linyphiidae;Centromerus;raridentatus sp.n.;Centromerus raridentatus sp.n.;;43 190 585;16 402 907;;;4 319 058 516 402 900;8;;;
1876;Škabac;Croatia;17.4.2011.;2011-04-17;1m, 1 juv;2;Theridiidae;Episinus;cavernicola;Episinus cavernicola;;45 259 902;14 606 487;Tf;deep cave;4 525 990 214 606 480;10;;;12
1877;Škabac;Croatia;17.4.2011.;2011-04-17;1f, 96%;1;Tetragnathidae;Metellina;merianae;Metellina merianae;;45 259 902;14 606 487;Tf;deep cave;4 525 990 214 606 480;10;;;12
1879;?epi? tunel;Croatia;16.4.2011.;2011-04-16;1f;1;Agelenidae;Tegenaria;silvestris;Tegenaria silvestris;;451 639;14 161 311;Tf;deep cave;45 163 914 161 311;1;;;13
1881;Vela špilja u Krugu;Croatia;17.4.2011.;2011-04-17;2f;2;Agelenidae;Tegenaria;silvestris;Tegenaria silvestris;629;45 447 191;14 423 879;Tf;deep cave;4 544 719 114 423 870;2;;;10,4
1882;Vela špilja u Krugu;Croatia;17.4.2011.;2011-04-17;1m;1;Dysderidae;Parastalita;stygia;Parastalita stygia;629;45 447 191;14 423 879;Tb;deep cave;4 544 719 114 423 870;2;;;10,4
1883;Škabac;Croatia;17.4.2011.;2011-04-17;1m, 1f;2;Nesticidae;Kryptonesticus;eremita;Kryptonesticus eremita;;45 259 902;14 606 487;tf;deep cave;4 525 990 214 606 480;10;;;12
1885;Škabac;Croatia;17.4.2011.;2011-04-17;2 juv;2;Agelenidae;Histopona;egonpretneri;Histopona egonpretneri;;45 259 902;14 606 487;Tb;deep cave;4 525 990 214 606 480;10;;;12
1886;Škabac;Croatia;17.4.2011.;2011-04-17;1f;1;Linyphiidae;Centromerus;sellarius;Centromerus sellarius;;45 259 902;14 606 487;tf;cave entrance;4 525 990 214 606 480;10;;;12
1887;Škabac;Croatia;17.4.2011.;2011-04-17;3 f;3;Leptonetidae;Cataleptoneta;lingulata;Cataleptoneta lingulata;;45 259 902;14 606 487;tb;deep cave;4 525 990 214 606 480;10;;;12
1888;?avlinka;Croatia;2.5.2010.;2010-05-02;1f;1;Dysderidae;Parastalita;stygia;Parastalita stygia;30;44 212 517;15 741 685;Tb;deep cave;4 421 251 715 741 680;2;;;
1890;Bezdanka;Croatia;7.7.2009.;2009-07-07;2 f;2;Dysderidae;Parastalita;stygia;Parastalita stygia;565;44 227 473;15 852 219;Tb;deep cave;4 422 747 315 852 210;2;;;14,367
1894;Bezdanka;Croatia;28.9.2010.;2010-09-28;2f, 1juv;3;Linyphiidae;Troglohyphantes;roberti;Troglohyphantes roberti;565;44 227 473;15 852 219;tb;deep cave;4 422 747 315 852 210;2;;;14,367
1899;Velika pe?ina, Gornji ?abri?i;Croatia;4.5.2010.;2010-05-04;1 f;1;Linyphiidae;Troglohyphantes;roberti;Troglohyphantes roberti;600;44 229 974;15 855 897;tb;deep cave;4 422 997 415 855 890;4;;;
1900;Golubnja?a, Žegar;Croatia;1.10.2010.;2010-10-01;1 f;1;Linyphiidae;Troglohyphantes;roberti;Troglohyphantes roberti;243;44 131 933;15 851 054;tb;deep cave;4 413 193 315 851 050;6;;;
1901;Golubnja?a, Žegar;Croatia;1.10.2010.;2010-10-01;1 f;1;Linyphiidae;Palliduphantes;istrianus;Palliduphantes istrianus;243;44 131 933;15 851 054;Tf;deep cave;4 413 193 315 851 050;6;;;
1904;Golubnja?a, Žegar;Croatia;1.10.2010.;2010-10-01;1f, 1 juv;2;Linyphiidae;Troglohyphantes;roberti;Troglohyphantes roberti;243;44 131 933;15 851 054;tb;deep cave;4 413 193 315 851 050;6;;;
1906;?ude špilja;Croatia;2.5.2010.;2010-05-02;1f;1;Theridiidae;Episinus;cavernicola;Episinus cavernicola;;44 212 351;15 741 592;Tf;deep cave;4 421 235 115 741 590;2;;;13,4
1907;Velika pe?ina, Gornji ?abri?i;Croatia;28.9.2010.;2010-09-28;1m, 1 juv;2;Linyphiidae;Troglohyphantes;roberti;Troglohyphantes roberti;600;44 229 974;15 855 897;tb;deep cave;4 422 997 415 855 890;4;;;
1908;Bundalova pe?ina;Croatia;3.5.2010.;2010-05-03;1f, 1 juv;2;Linyphiidae;Asthenargus;bracianus;Asthenargus bracianus;;44 195 721;15 855 588;tf;deep cave;4 419 572 115 855 580;4;;;10,4
1910;Vratolomka;Croatia;2.10.2010.;2010-10-02;3m, 2 juv;5;Leptonetidae;Cataleptoneta;lingulata;Cataleptoneta lingulata;;44 191 701;15 785 015;tb;deep cave;4 419 170 115 785 010;2;;;
1911;Vratolomka;Croatia;2.10.2010.;2010-10-02;5m, 5f, 2 juv;12;Leptonetidae;Cataleptoneta;lingulata;Cataleptoneta lingulata;;44 191 701;15 785 015;tb;deep cave;4 419 170 115 785 010;2;;;
1912;Jama iznad Sarana?a;Croatia;25.5.2004.;2004-05-25;1m;1;Nemesiidae;Nemesia;sp. 1;Nemesia sp. 1;770;43 249 007;17 174 663;;;4 324 900 717 174 660;7;;10,8;10,025
1912;Jama iznad Sarana?a;Croatia;25.5.2004.;2004-05-25;1m;1;Nemesiidae;Nemesia;sp. 1;Nemesia sp. 1;770;43 249 007;17 174 663;;;4 324 900 717 174 660;7;;;12,2
1913;Stonjska pe? gornja;Croatia;27.10.2003.;2003-10-27;1 f;1;Clubionidae;Clubiona;sp.;Clubiona sp.;625;43 315 167;171 304;;;43 315 167 171 304;4;;;
1914;Pružina špilja;Croatia;15.10.2002.;2002-10-15;1f, 1 juv;2;Dysderidae;Stalagtia;sp. 4;Stalagtia sp. 4;519;43 394 238;17 058 713;Tb;deep cave;4 339 423 817 058 710;4;;;11,9
1915;Ga?ina jama;Croatia;15.10.2002.;2002-10-15;1juv/f?;1;Dysderidae;Mesostalita;comottii;Mesostalita comottii;591;43 401 743;17 058 436;Tb;deep cave;4 340 174 317 058 430;3;;;
1917;Velika pe?;Croatia;18.10.2002.;2002-10-18;2 juv m, 1 juv;3;Agelenidae;Histopona;sp.;Histopona sp.;505;43 417 013;17 007 608;;deep cave;4 341 701 317 007 600;3;;;8,4
1918;Velika pe?;Croatia;18.10.2002.;2002-10-18;2f, 1 juv;3;Leptonetidae;Barusia;maheni;Barusia maheni;505;43 417 013;17 007 608;tf;deep cave;4 341 701 317 007 600;3;;;8,4
1919;Pružina špilja;Croatia;15.10.2002.;2002-10-15;1f;1;Agelenidae;Histopona;conveniens;Histopona conveniens;519;43 394 238;17 058 713;Tf;deep cave;4 339 423 817 058 710;4;;;11,9
1920;Špilja u Gaju;Croatia;18.10.2002.;2002-10-18;1f;1;Agelenidae;Histopona;conveniens;Histopona conveniens;440;43 382 476;17 040 666;Tf;deep cave;4 338 247 617 040 660;7;;10,6;10,6
1920;Špilja u Gaju;Croatia;18.10.2002.;2002-10-18;1f;1;Agelenidae;Histopona;conveniens;Histopona conveniens;440;43 382 476;17 040 666;Tf;deep cave;4 338 247 617 040 660;7;;;11,05
1921;Špilja u Gaju;Croatia;18.10.2002.;2002-10-18;1f;1;Tetragnathidae;Metellina;merianae;Metellina merianae;440;43 382 476;17 040 666;Tf;deep cave;4 338 247 617 040 660;7;;10,6;10,6
1921;Špilja u Gaju;Croatia;18.10.2002.;2002-10-18;1f;1;Tetragnathidae;Metellina;merianae;Metellina merianae;440;43 382 476;17 040 666;Tf;deep cave;4 338 247 617 040 660;7;;;11,05
1922;Špilja u Gaju;Croatia;18.10.2002.;2002-10-18;1f;1;Agelenidae;Tegenaria;annulata;Tegenaria annulata;440;43 382 476;17 040 666;tf;deep cave;4 338 247 617 040 660;7;;10,6;10,6
1922;Špilja u Gaju;Croatia;18.10.2002.;2002-10-18;1f;1;Agelenidae;Tegenaria;annulata;Tegenaria annulata;440;43 382 476;17 040 666;tf;deep cave;4 338 247 617 040 660;7;;;11,05
1923;Jujnovi?a špilja;Croatia;14.10.2002.;2002-10-14;4f;4;Agelenidae;Histopona;conveniens;Histopona conveniens;405;43 266 579;1 719 798;Tf;deep cave;432 665 791 719 798;6;;;10,35
1923;Jujnovi?a špilja;Croatia;14.10.2002.;2002-10-14;4f;4;Agelenidae;Histopona;conveniens;Histopona conveniens;405;43 266 579;1 719 798;Tf;deep cave;432 665 791 719 798;6;;13,8;11,35
1924;Jujnovi?a špilja;Croatia;14.10.2002.;2002-10-14;1f;1;Agelenidae;Tegenaria;sp. 2;Tegenaria sp. 2;405;43 266 579;1 719 798;;deep cave;432 665 791 719 798;6;;;10,35
1924;Jujnovi?a špilja;Croatia;14.10.2002.;2002-10-14;1f;1;Agelenidae;Tegenaria;sp. 2;Tegenaria sp. 2;405;43 266 579;1 719 798;;deep cave;432 665 791 719 798;6;;13,8;11,35
1925;Jujnovi?a špilja;Croatia;14.10.2002.;2002-10-14;1f, 1 juv m;2;Dysderidae;Harpactea;damini;Harpactea damini;405;43 266 579;1 719 798;TF;deep cave;432 665 791 719 798;6;;;10,35
1925;Jujnovi?a špilja;Croatia;14.10.2002.;2002-10-14;1f, 1 juv m;2;Dysderidae;Harpactea;damini;Harpactea damini;405;43 266 579;1 719 798;TF;deep cave;432 665 791 719 798;6;;13,8;11,35
1926;Pružina špilja;Croatia;15.10.2002.;2002-10-15;2m;2;Pholcidae;Stygopholcus;absoloni;Stygopholcus absoloni;519;43 394 238;17 058 713;;deep cave;4 339 423 817 058 710;4;;;11,9
1927;Jujnovi?a špilja;Croatia;14.10.2002.;2002-10-14;3f;3;Pholcidae;Stygopholcus;absoloni;Stygopholcus absoloni;405;43 266 579;1 719 798;;deep cave;432 665 791 719 798;6;;;10,35
1927;Jujnovi?a špilja;Croatia;14.10.2002.;2002-10-14;3f;3;Pholcidae;Stygopholcus;absoloni;Stygopholcus absoloni;405;43 266 579;1 719 798;;deep cave;432 665 791 719 798;6;;13,8;11,35
1928;Velika pe?;Croatia;18.10.2002.;2002-10-18;1m, 1 juv;2;Pholcidae;Stygopholcus;absoloni;Stygopholcus absoloni;505;43 417 013;17 007 608;;deep cave;4 341 701 317 007 600;3;;;8,4
1930;cave near Zagvozd;Croatia;13.10.2002.;2002-10-13;1f;1;Pholcidae;Stygopholcus;absoloni;Stygopholcus absoloni;;4 339 729;1 705 435;;deep cave;43 397 291 705 435;1;;;
1932;Drinova 2;Croatia;23.3.2003.;2003-03-23;1f, 1 juv;2;Dysderidae;Stalagtia;sp. 4;Stalagtia sp. 4;725;43 407 702;16 942 899;Tb;deep cave;4 340 770 216 942 890;3;;;
1933;Baba;Croatia;25.6.2002.;2002-06-25;1 juv;1;Dysderidae;Stalagtia;sp. 4;Stalagtia sp. 4;;43 256 469;17 162 283;Tb;deep cave;4 325 646 917 162 280;4;;;
1934;?olnja?a;Croatia;23.5.2004.;2004-05-23;1 juv m, 1 juv;2;Dysderidae;Stalagtia;sp. 4;Stalagtia sp. 4;;43 409 175;1 688 745;Tb;deep cave;434 091 751 688 745;4;;;
1935;Oplemenjena špilja;Croatia;20.6.2003.;2003-06-20;1 juv;1;Dysderidae;Harpactea;sp.;Harpactea sp.;1100;43 369 119;17 025 884;;;4 336 911 917 025 880;1;;7;7
1936;Jama iznad Sarana?a;Croatia;25.3.2003.;2003-03-25;1 f;1;Dysderidae;Stalagtia;sp. 4;Stalagtia sp. 4;770;43 249 007;17 174 663;Tb;deep cave;4 324 900 717 174 660;7;;10,8;10,025
1936;Jama iznad Sarana?a;Croatia;25.3.2003.;2003-03-25;1 f;1;Dysderidae;Stalagtia;sp. 4;Stalagtia sp. 4;770;43 249 007;17 174 663;Tb;deep cave;4 324 900 717 174 660;7;;;12,2
1937;Spila 2;Croatia;23.3.2004.;2004-03-23;1f?, 1 juv;2;Dysderidae;Stalagtia;sp. 4;Stalagtia sp. 4;516;4 326 239;17 204 021;Tb;deep cave;432 623 917 204 021;6;;12;12
1938;Mala jama u stijenama;Croatia;20.3.2003.;2003-03-20;1 juv;1;Dysderidae;Harpactea;sp.;Harpactea sp.;1115;43 365 579;17 027 668;;;4 336 557 917 027 660;3;;9,3;9,3
1939;Mala špilja kod Antunovi?a;Croatia;26.6.2002.;2002-06-26;3 juv;3;Dysderidae;Stalagtia;sp. 4;Stalagtia sp. 4;708;4 327 698;17 226 992;Tb;deep cave;432 769 817 226 992;1;;;
1940;Velika špilja kod Antunovi?a;Croatia;23.3.2004.;2004-03-23;1 juv;1;Dysderidae;Stalagtia;sp. 4;Stalagtia sp. 4;700;43 276 843;17 227 143;Tb;deep cave;4 327 684 317 227 140;1;;11,9;12,1
1941;Jamina, Biokovo;Croatia;26.10.2006.;2006-10-26;1juvm, 1 juv;2;Dysderidae;Stalagtia;sp. 4;Stalagtia sp. 4;617;43 386 358;16 925 277;Tb;deep cave;4 338 635 816 925 270;4;;;
1942;Tu?epska vilenja?a;Croatia;23.5.2004.;2004-05-23;1 juvm;1;Dysderidae;Stalagtia;sp. 4;Stalagtia sp. 4;1181;43 286 465;17 083 638;Tb;deep cave;4 328 646 517 083 630;8;;;9,967
1942;Tu?epska vilenja?a;Croatia;23.5.2004.;2004-05-23;1 juvm;1;Dysderidae;Stalagtia;sp. 4;Stalagtia sp. 4;1181;43 286 465;17 083 638;Tb;deep cave;4 328 646 517 083 630;8;;;11,2
1942;Tu?epska vilenja?a;Croatia;23.5.2004.;2004-05-23;1 juvm;1;Dysderidae;Stalagtia;sp. 4;Stalagtia sp. 4;1181;43 286 465;17 083 638;Tb;deep cave;4 328 646 517 083 630;8;;10,6;11,025
1943;Jamina, Biokovo;Croatia;24.3.2004.;2004-03-24;1 juv m, 1 juv;2;Dysderidae;Stalagtia;sp. 4;Stalagtia sp. 4;617;43 386 358;16 925 277;Tb;deep cave;4 338 635 816 925 270;4;;;
1944;Kamenolom u Bastu;Croatia;11.10.2003.;2003-10-11;1 m;1;Dysderidae;Dysdera;sp. 2;Dysdera sp. 2;;43 361 995;1 697 845;;;433 619 951 697 845;1;;;
1946;Mala špilja pod Spilom;Croatia;5.12.2009.;2009-12-05;2 juv;2;Dysderidae;Stalagtia;sp. 4;Stalagtia sp. 4;;43 262 462;17 200 927;Tb;deep cave;4 326 246 217 200 920;2;;;11
1948;Ogra?ena špilja pod Sv. Jurom;Croatia;21.6.2003.;2003-06-21;1juvm;1;Dysderidae;Harpactea;sp.;Harpactea sp.;;43 348 504;17 051 475;;;4 334 850 417 051 470;2;;;
1950;Jama na Ka?koj glavici 3;Croatia;18.6.2003.;2003-06-18;1 juv;1;Dysderidae;Harpactea;sp.;Harpactea sp.;1107;43 368 677;17 032 184;;;4 336 867 717 032 180;1;;5;4,75
1951;Jamina, Biokovo;Croatia;26.10.2006.;2006-10-26;2 juv;2;Dysderidae;Stalagtia;sp. 4;Stalagtia sp. 4;617;43 386 358;16 925 277;Tb;deep cave;4 338 635 816 925 270;4;;;
1952;Špilja u Nevistinim stinama;Croatia;22.3.2003.;2003-03-22;2 juv;2;Dysderidae;Harpactea;sp.;Harpactea sp.;545;4 338 269;16 942 238;;;433 826 916 942 238;1;;;
1954;Kukor;Croatia;26.4.2002.;2002-04-26;1m;1;Dysderidae;Harpactea;damini;Harpactea damini;425;43 355 609;16 991 707;TF;deep cave;4 335 560 916 991 700;10;;;15,4
1955;Spila 2;Croatia;26.3.2003.;2003-03-26;1 juv;1;Dysderidae;Stalagtia;sp. 4;Stalagtia sp. 4;516;4 326 239;17 204 021;Tb;deep cave;432 623 917 204 021;6;;12;12
1956;Gradska spila;Croatia;19.11.2005.;2005-11-19;1f;1;Dysderidae;Harpactea;damini;Harpactea damini;755;43 318 029;17 117 623;TF;deep cave;4 331 802 917 117 620;4;;;6,6
1957;Kukor;Croatia;17.8.2000.;2000-08-17;2/3f, 1/2juv;3;Dysderidae;Harpactea;sp. 34;Harpactea sp. 34;425;43 355 609;16 991 707;;;4 335 560 916 991 700;10;;;15,4
1958;Kukor;Croatia;28.7.2006.;2006-07-28;1 juv;1;Dysderidae;Harpactea;sp.;Harpactea sp.;425;43 355 609;16 991 707;;;4 335 560 916 991 700;10;;;15,4
1959;Kukor;Croatia;26.8.1998.;1998-08-26;1juvm, 2 juv;3;Dysderidae;Harpactea;sp.;Harpactea sp.;425;43 355 609;16 991 707;;;4 335 560 916 991 700;10;;;15,4
1960;Drinova;Croatia;22.3.2003.;2003-03-22;1 juv;1;Dysderidae;Dysdera;sp.;Dysdera sp.;;43 357 899;17 112 462;Tx;epigean habitat;4 335 789 917 112 460;1;;;
1961;Velika špilja kod Antunovi?a;Croatia;29.11.2009.;2009-11-29;2 juv;2;Dysderidae;Stalagtia;sp. 4;Stalagtia sp. 4;700;43 276 843;17 227 143;Tb;deep cave;4 327 684 317 227 140;1;;11,9;12,1
1962;Jamina, Biokovo;Croatia;24.3.2004.;2004-03-24;2 juv;2;Dysderidae;Stalagtia;sp. 4;Stalagtia sp. 4;617;43 386 358;16 925 277;Tb;deep cave;4 338 635 816 925 270;4;;;
1963;Jama iznad Prozor?i?a;Croatia;24.3.2004.;2004-03-24;1 f;1;Dysderidae;Stalagtia;sp. 4;Stalagtia sp. 4;617;4 338 381;16 932 036;Tb;deep cave;433 838 116 932 036;5;;12,5;8,9
1964;Obilježena jama;Croatia;20.6.2003.;2003-06-20;1 juv;1;Dysderidae;Harpactea;sp.;Harpactea sp.;;4 336 813;17 026 024;;;433 681 317 026 024;2;;2,5;2,5
1965;Bubnjava?a špilja;Croatia;27.10.2006.;2006-10-27;1f;1;Dysderidae;Harpactea;damini;Harpactea damini;;4 332 252;17 009 954;TF;deep cave;433 225 217 009 954;2;;16,8;16
1965;Bubnjava?a špilja;Croatia;27.10.2006.;2006-10-27;1f;1;Dysderidae;Harpactea;damini;Harpactea damini;;4 332 252;17 009 954;TF;deep cave;433 225 217 009 954;2;;;17
1966;Kukor;Croatia;23.9.1999.;1999-09-23;2 juv;2;Dysderidae;Harpactea;sp.;Harpactea sp.;425;43 355 609;16 991 707;;;4 335 560 916 991 700;10;;;15,4
1967;Jama na Saran?u;Croatia;25.3.2003.;2003-03-25;1f;1;Dysderidae;Harpactea;mateparlovi;Harpactea mateparlovi;;43 247 108;17 176 093;Tf;deep cave;4 324 710 817 176 090;4;;;
1968;Kukor;Croatia;27.7.2004.;2004-07-27;2 juv;2;Dysderidae;Harpactea;sp.;Harpactea sp.;425;43 355 609;16 991 707;;;4 335 560 916 991 700;10;;;15,4
1969;Polušpilja iza ku?e u Bastu;Croatia;18.8.1998.;1998-08-18;1 juv m;1;Dysderidae;Dysdera;sp.;Dysdera sp.;285;43 354 924;16 982 503;Tx;;4 335 492 416 982 500;3;;;
1971;Mala špilja kod Antunovi?a;Croatia;29.11.2009.;2009-11-29;1 juv;1;Dysderidae;Stalagtia;sp. 4;Stalagtia sp. 4;708;4 327 698;17 226 992;Tb;deep cave;432 769 817 226 992;1;;;
1972;Poskokova rupa;Croatia;25.5.2004.;2004-05-25;1 juv;1;Dysderidae;Harpactea;sp.;Harpactea sp.;633;43 318 607;17 119 945;;;4 331 860 717 119 940;2;;;
1973;Samogorska špilja;Croatia;25.5.2004.;2004-05-25;1f;1;Dysderidae;Harpactea;damini;Harpactea damini;717;43 318 227;17 121 122;TF;deep cave;4 331 822 717 121 120;6;;;13,1
1973;Samogorska špilja;Croatia;25.5.2004.;2004-05-25;1f;1;Dysderidae;Harpactea;damini;Harpactea damini;717;43 318 227;17 121 122;TF;deep cave;4 331 822 717 121 120;6;;7,1;4,967
1974;Jama na putu za Staru školu;Croatia;27.6.2002.;2002-06-27;1 juv;1;Agelenidae;Histopona;sp.;Histopona sp.;1465;43 337 777;17 043 231;;deep cave;4 333 777 717 043 230;1;;8;8
1975;Meduza;Croatia;8.8.2003.;2003-08-08;1f;1;Dysderidae;Gen. 1;sp. 1;Gen. 1 sp. 1;1600;4 476 237;14 987 194;Tb;deep cave;447 623 714 987 194;1;;;
1976;Krjava 2;Croatia;24.3.2004.;2004-03-24;1 f;1;Dysderidae;Mesostalita;comottii;Mesostalita comottii;903;43 329 431;17 027 011;Tb;deep cave;4 332 943 117 027 010;3;;;7,425
1979;Jamina, Biokovo;Croatia;28.10.2004.;2004-10-28;2 juv;2;Dysderidae;Stalagtia;sp. 4;Stalagtia sp. 4;617;43 386 358;16 925 277;Tb;deep cave;4 338 635 816 925 270;4;;;
1980;Velika špilja kod Antunovi?a;Croatia;29.11.2009.;2009-11-29;1 juv;1;Dysderidae;Stalagtia;sp. 4;Stalagtia sp. 4;700;43 276 843;17 227 143;Tb;deep cave;4 327 684 317 227 140;1;;11,9;12,1
1981;Samogorska špilja;Croatia;25.5.2005.;2005-05-25;2 juv;2;Dysderidae;Harpactea;sp.;Harpactea sp.;717;43 318 227;17 121 122;;;4 331 822 717 121 120;6;;;13,1
1981;Samogorska špilja;Croatia;25.5.2005.;2005-05-25;2 juv;2;Dysderidae;Harpactea;sp.;Harpactea sp.;717;43 318 227;17 121 122;;;4 331 822 717 121 120;6;;7,1;4,967
1982;Pozjata špilja;Croatia;26.10.2003.;2003-10-26;1 f;1;Dysderidae;Harpactea;sp. 34;Harpactea sp. 34;1435;43 387 837;16 963 748;;;4 338 783 716 963 740;3;;;7,85
1983;Muci?a ledenica;Croatia;24.5.2004.;2004-05-24;1 juv;1;Dysderidae;Harpactea;sp.;Harpactea sp.;1250;4 335 632;17 051 544;;;433 563 217 051 544;3;;0,8;0,8
1984;Mala špilja kod Antunovi?a;Croatia;5.12.2009.;2009-12-05;1 juv;1;Dysderidae;Stalagtia;sp. 4;Stalagtia sp. 4;708;4 327 698;17 226 992;Tb;deep cave;432 769 817 226 992;1;;;
1985;Jama iznad Prozor?i?a;Croatia;26.10.2006.;2006-10-26;1 juv;1;Dysderidae;Stalagtia;sp. 4;Stalagtia sp. 4;617;4 338 381;16 932 036;Tb;deep cave;433 838 116 932 036;5;;12,5;8,9
1986;Kukor;Croatia;25.3.2004.;2004-03-25;1 juv;1;Dysderidae;Harpactea;sp.;Harpactea sp.;425;43 355 609;16 991 707;;;4 335 560 916 991 700;10;;;15,4
1987;Kukor;Croatia;29.12.1997.;1997-12-29;1 juv;1;Dysderidae;Harpactea;sp.;Harpactea sp.;425;43 355 609;16 991 707;;;4 335 560 916 991 700;10;;;15,4
1989;Ogra?ena špilja pod Sv. Jurom;Croatia;21.6.2003.;2003-06-21;1 juv;1;Dysderidae;Harpactea;sp.;Harpactea sp.;;43 348 504;17 051 475;;;4 334 850 417 051 470;2;;;
1991;Baba;Croatia;25.6.2002.;2002-06-25;1 juv;1;Dysderidae;Harpactea;sp.;Harpactea sp.;;43 256 469;17 162 283;;;4 325 646 917 162 280;4;;;
1992;Drinova 2;Croatia;14.11.2003.;2003-11-14;1 juv;1;Dysderidae;Stalagtia;sp. 4;Stalagtia sp. 4;725;43 407 702;16 942 899;Tb;deep cave;4 340 770 216 942 890;3;;;
1993;Špilja u Gaju;Croatia;18.10.2002.;2002-10-18;5f, 1m;6;Pholcidae;Stygopholcus;absoloni;Stygopholcus absoloni;440;43 382 476;17 040 666;;deep cave;4 338 247 617 040 660;7;;10,6;10,6
1993;Špilja u Gaju;Croatia;18.10.2002.;2002-10-18;5f, 1m;6;Pholcidae;Stygopholcus;absoloni;Stygopholcus absoloni;440;43 382 476;17 040 666;;deep cave;4 338 247 617 040 660;7;;;11,05
1995;Jama iznad Prozor?i?a;Croatia;24.3.2004.;2004-03-24;1 m;1;Pholcidae;Stygopholcus;absoloni;Stygopholcus absoloni;617;4 338 381;16 932 036;;deep cave;433 838 116 932 036;5;;12,5;8,9
1996;Jama u ?ikešima;Croatia;23.11.2005.;2005-11-23;1 m;1;Pholcidae;Stygopholcus;absoloni;Stygopholcus absoloni;200;43 416 092;16 967 015;;deep cave;4 341 609 216 967 010;1;;;12,4
1997;Polušpilja iza ku?e u Bastu;Croatia;18.8.1998.;1998-08-18;2 f;2;Pholcidae;Pholcus;phalangioides;Pholcus phalangioides;285;43 354 924;16 982 503;;cave entrance;4 335 492 416 982 500;3;;;
1998;Jama iznad Sarana?a;Croatia;25.3.2003.;2003-03-25;1 f;1;Pholcidae;Stygopholcus;absoloni;Stygopholcus absoloni;770;43 249 007;17 174 663;;deep cave;4 324 900 717 174 660;7;;10,8;10,025
1998;Jama iznad Sarana?a;Croatia;25.3.2003.;2003-03-25;1 f;1;Pholcidae;Stygopholcus;absoloni;Stygopholcus absoloni;770;43 249 007;17 174 663;;deep cave;4 324 900 717 174 660;7;;;12,2
1999;Jujnovi?a špilja;Croatia;27.4.2002.;2002-04-27;1m, 1 juv;2;Pholcidae;Stygopholcus;absoloni;Stygopholcus absoloni;405;43 266 579;1 719 798;;deep cave;432 665 791 719 798;6;;;10,35
1999;Jujnovi?a špilja;Croatia;27.4.2002.;2002-04-27;1m, 1 juv;2;Pholcidae;Stygopholcus;absoloni;Stygopholcus absoloni;405;43 266 579;1 719 798;;deep cave;432 665 791 719 798;6;;13,8;11,35
2000;Brikinjava špilja;Croatia;17.11.2005.;2005-11-17;1f, 1 juv;2;Pholcidae;Stygopholcus;absoloni;Stygopholcus absoloni;740;43 345 181;17 096 904;;deep cave;4 334 518 117 096 900;3;;;5,533
2001;Jama kod Tu?epske vilenja?e;Croatia;17.6.2002.;2002-06-17;2f, 1m, 1 juv;4;Pholcidae;Stygopholcus;absoloni;Stygopholcus absoloni;1195;43 284 718;17 085 044;;deep cave;4 328 471 817 085 040;1;;;
2003;Nikolina špilja;Croatia;23.3.2003.;2003-03-23;2m, 1 f;3;Pholcidae;Stygopholcus;absoloni;Stygopholcus absoloni;250;434 253;168 271;;deep cave;434 253 168 271;1;;;
2005;Raputinova špilja;Croatia;24.11.2005.;2005-11-24;1 m;1;Pholcidae;Stygopholcus;absoloni;Stygopholcus absoloni;360;4 338 645;17 019 868;;deep cave;433 864 517 019 868;1;;;4,15
2006;Jujnovi?a špilja;Croatia;14.10.2002.;2002-10-14;1 f;1;Pholcidae;Stygopholcus;absoloni;Stygopholcus absoloni;405;43 266 579;1 719 798;;deep cave;432 665 791 719 798;6;;;10,35
2006;Jujnovi?a špilja;Croatia;14.10.2002.;2002-10-14;1 f;1;Pholcidae;Stygopholcus;absoloni;Stygopholcus absoloni;405;43 266 579;1 719 798;;deep cave;432 665 791 719 798;6;;13,8;11,35
2007;Mala špilja na Bukovcima;Croatia;21.11.2005.;2005-11-21;2m, 1 f;3;Pholcidae;Stygopholcus;absoloni;Stygopholcus absoloni;463;43 403 677;17 021 702;;deep cave;4 340 367 717 021 700;1;;;7,95
2009;Špilja u Radinovcima;Croatia;25.10.2006.;2006-10-25;1 f;1;Pholcidae;Stygopholcus;absoloni;Stygopholcus absoloni;400;43 387 285;170 103;;deep cave;43 387 285 170 103;4;;;8,3
2009;Špilja u Radinovcima;Croatia;25.10.2006.;2006-10-25;1 f;1;Pholcidae;Stygopholcus;absoloni;Stygopholcus absoloni;400;43 387 285;170 103;;deep cave;43 387 285 170 103;4;;;8,75
2012;Svetica;Croatia;16.11.2005.;2005-11-16;1 f;1;Pholcidae;Stygopholcus;absoloni;Stygopholcus absoloni;300;43 401 143;16 894 548;;deep cave;4 340 114 316 894 540;5;;;
2013;Bužnja?a;Croatia;29.20.2003.;2003-20-29;1m;1;Pholcidae;Gen. 1;sp. 1;Gen. 1 sp. 1;860;43 370 414;16 958 245;;;4 337 041 416 958 240;2;;;
2027;Špilja u Gaju;Croatia;18.10.2002.;2002-10-18;1m;1;Linyphiidae;Typhlonyphia;sp. 1;Typhlonyphia sp. 1;440;43 382 476;17 040 666;Tb;deep cave;4 338 247 617 040 660;7;;10,6;10,6
2027;Špilja u Gaju;Croatia;18.10.2002.;2002-10-18;1m;1;Linyphiidae;Typhlonyphia;sp. 1;Typhlonyphia sp. 1;440;43 382 476;17 040 666;Tb;deep cave;4 338 247 617 040 660;7;;;11,05
2028;Baba;Croatia;16.10.2002.;2002-10-16;1m;1;Linyphiidae;Typhlonyphia;sp. 1;Typhlonyphia sp. 1;;43 256 469;17 162 283;Tb;deep cave;4 325 646 917 162 280;4;;;
2029;Jujnovi?a špilja;Croatia;14.10.2002.;2002-10-14;1m, 1f;2;Linyphiidae;Typhlonyphia;sp. 1;Typhlonyphia sp. 1;405;43 266 579;1 719 798;Tb;deep cave;432 665 791 719 798;6;;;10,35
2029;Jujnovi?a špilja;Croatia;14.10.2002.;2002-10-14;1m, 1f;2;Linyphiidae;Typhlonyphia;sp. 1;Typhlonyphia sp. 1;405;43 266 579;1 719 798;Tb;deep cave;432 665 791 719 798;6;;13,8;11,35
2030;Špilja u Gaju;Croatia;18.10.2002.;2002-10-18;1f, 1 juv;2;Linyphiidae;Typhlonyphia;sp. 1;Typhlonyphia sp. 1;440;43 382 476;17 040 666;Tb;deep cave;4 338 247 617 040 660;7;;10,6;10,6
2030;Špilja u Gaju;Croatia;18.10.2002.;2002-10-18;1f, 1 juv;2;Linyphiidae;Typhlonyphia;sp. 1;Typhlonyphia sp. 1;440;43 382 476;17 040 666;Tb;deep cave;4 338 247 617 040 660;7;;;11,05
2031;Baba;Croatia;15.10.2002.;2002-10-15;3f;3;Linyphiidae;Typhlonyphia;sp. 1;Typhlonyphia sp. 1;;43 256 469;17 162 283;Tb;deep cave;4 325 646 917 162 280;4;;;
2032;Pružina špilja;Croatia;15.10.2002.;2002-10-15;1f;1;Linyphiidae;Typhlonyphia;sp. 1;Typhlonyphia sp. 1;519;43 394 238;17 058 713;Tb;deep cave;4 339 423 817 058 710;4;;;11,9
2033;Špilja u Gaju;Croatia;18.10.2002.;2002-10-18;2f, 2 juv;4;Linyphiidae;Typhlonyphia;sp. 1;Typhlonyphia sp. 1;440;43 382 476;17 040 666;Tb;deep cave;4 338 247 617 040 660;7;;10,6;10,6
2033;Špilja u Gaju;Croatia;18.10.2002.;2002-10-18;2f, 2 juv;4;Linyphiidae;Typhlonyphia;sp. 1;Typhlonyphia sp. 1;440;43 382 476;17 040 666;Tb;deep cave;4 338 247 617 040 660;7;;;11,05
2034;Jama na grebenu;Croatia;17.10.2002.;2002-10-17;2f, 1 juv m, 1 juv;4;Linyphiidae;Typhlonyphia;sp. 1;Typhlonyphia sp. 1;;4 325 927;17 147 834;Tb;deep cave;432 592 717 147 834;3;;10,8;10,8
2035;Ga?ina jama;Croatia;15.10.2002.;2002-10-15;1m;1;Linyphiidae;Typhlonyphia;sp. 1;Typhlonyphia sp. 1;;43 401 743;17 058 436;Tb;deep cave;4 340 174 317 058 430;3;;;
2036;Špilja na Mrždolcu;Croatia;5.4.2006.;2006-04-05;1f, 1 juv;2;Linyphiidae;Typhlonyphia;sp. 1;Typhlonyphia sp. 1;461;43 405 319;17 014 811;Tb;deep cave;4 340 531 917 014 810;3;;;7,5
2037;Bošak jama;Croatia;4.4.2006.;2006-04-04;1f;1;Linyphiidae;Typhlonyphia;sp. 1;Typhlonyphia sp. 1;739;43 347 996;17 100 045;Tb;deep cave;4 334 799 617 100 040;2;;;7,4
2038;Bošak jama;Croatia;4.4.2006.;2006-04-04;1 f;1;Linyphiidae;Typhlonyphia;sp. 1;Typhlonyphia sp. 1;739;43 347 996;17 100 045;Tb;deep cave;4 334 799 617 100 040;2;;;7,4
2039;Bošak jama;Croatia;17.11.2005.;2005-11-17;1f;1;Linyphiidae;Typhlonyphia;sp. 1;Typhlonyphia sp. 1;739;43 347 996;17 100 045;Tb;deep cave;4 334 799 617 100 040;2;;;7,4
2040;Jama za Supinom;Croatia;18.11.2005.;2005-11-18;1m;1;Linyphiidae;Typhlonyphia;sp. 1;Typhlonyphia sp. 1;;43 250 417;17 113 278;Tb;deep cave;4 325 041 717 113 270;7;;;10,1
2040;Jama za Supinom;Croatia;18.11.2005.;2005-11-18;1m;1;Linyphiidae;Typhlonyphia;sp. 1;Typhlonyphia sp. 1;;43 250 417;17 113 278;Tb;deep cave;4 325 041 717 113 270;7;;;11,4
2041;Ga?ina jama;Croatia;15.10.2002.;2002-10-15;2m, 1 f;3;Linyphiidae;Palliduphantes;spelaeorum;Palliduphantes spelaeorum;;43 401 743;17 058 436;Tf;deep cave;4 340 174 317 058 430;3;;;
2042;Jama na grebenu;Croatia;15.10.2002.;2002-10-15;1f;1;Linyphiidae;Palliduphantes;spelaeorum;Palliduphantes spelaeorum;;4 325 927;17 147 834;Tf;deep cave;432 592 717 147 834;3;;10,8;10,8
2043;Jama na grebenu;Croatia;15.10.2002.;2002-10-15;1 juv;1;Dysderidae;Stalagtia;sp. 4;Stalagtia sp. 4;;4 325 927;17 147 834;Tb;deep cave;432 592 717 147 834;3;;10,8;10,8
2047;Svetica;Croatia;22.5.2004.;2004-05-22;1f, 1 juv;2;Linyphiidae;Palliduphantes;spelaeorum;Palliduphantes spelaeorum;300;43 401 143;16 894 548;Tf;deep cave;4 340 114 316 894 540;5;;;
2048;Plošnica;Croatia;22.5.2004.;2004-05-22;1f;1;Linyphiidae;Palliduphantes;spelaeorum;Palliduphantes spelaeorum;605;43 385 758;1 692 863;Tf;deep cave;433 857 581 692 863;1;;;
2049;Jama za Supinom;Croatia;18.11.2005.;2005-11-18;1m;1;Linyphiidae;Palliduphantes;spelaeorum;Palliduphantes spelaeorum;;43 250 417;17 113 278;Tf;deep cave;4 325 041 717 113 270;7;;;10,1
2049;Jama za Supinom;Croatia;18.11.2005.;2005-11-18;1m;1;Linyphiidae;Palliduphantes;spelaeorum;Palliduphantes spelaeorum;;43 250 417;17 113 278;Tf;deep cave;4 325 041 717 113 270;7;;;11,4
2050;Kukor;Croatia;2.1.1999.;1999-01-02;1f, 1 juv;2;Nesticidae;Kryptonesticus;deelemanae;Kryptonesticus deelemanae;425;43 355 609;16 991 707;tb;deep cave;4 335 560 916 991 700;10;;;15,4
2051;?olnja?a;Croatia;25.10.2003.;2003-10-25;1m, 1 juv;2;Linyphiidae;Palliduphantes;spelaeorum;Palliduphantes spelaeorum;;43 409 175;1 688 745;Tf;deep cave;434 091 751 688 745;4;;;
2052;Jamina, Biokovo;Croatia;26.10.2003.;2003-10-26;2f;2;Linyphiidae;Palliduphantes;spelaeorum;Palliduphantes spelaeorum;617;43 386 358;16 925 277;Tf;deep cave;4 338 635 816 925 270;4;;;
2053;Jamina, Biokovo;Croatia;28.10.2003.;2003-10-28;2 f;2;Linyphiidae;Palliduphantes;spelaeorum;Palliduphantes spelaeorum;617;43 386 358;16 925 277;Tf;deep cave;4 338 635 816 925 270;4;;;
2054;Jama iznad Prozor?i?a;Croatia;26.10.2006.;2006-10-26;2f;2;Linyphiidae;Palliduphantes;spelaeorum;Palliduphantes spelaeorum;617;4 338 381;16 932 036;Tf;deep cave;433 838 116 932 036;5;;12,5;8,9
2055;Jama iznad Prozor?i?a;Croatia;28.10.2003.;2003-10-28;1f, 3 juv;4;Linyphiidae;Palliduphantes;spelaeorum;Palliduphantes spelaeorum;617;4 338 381;16 932 036;Tf;deep cave;433 838 116 932 036;5;;12,5;8,9
2057;Potkameni?ina jama;Croatia;25.10.2006.;2006-10-25;2 f;2;Linyphiidae;Typhlonyphia;sp. 1;Typhlonyphia sp. 1;321;43 393 898;17 018 204;Tb;deep cave;4 339 389 817 018 200;1;;;13
2059;Jamina, Biokovo;Croatia;24.3.2004.;2004-03-24;3f, 2 juv;5;Linyphiidae;Palliduphantes;spelaeorum;Palliduphantes spelaeorum;617;43 386 358;16 925 277;Tf;deep cave;4 338 635 816 925 270;4;;;
2060;Jama za Supinom;Croatia;18.11.2005.;2005-11-18;2m, 2 f;4;Linyphiidae;Palliduphantes;spelaeorum;Palliduphantes spelaeorum;;43 250 417;17 113 278;Tf;deep cave;4 325 041 717 113 270;7;;;10,1
2060;Jama za Supinom;Croatia;18.11.2005.;2005-11-18;2m, 2 f;4;Linyphiidae;Palliduphantes;spelaeorum;Palliduphantes spelaeorum;;43 250 417;17 113 278;Tf;deep cave;4 325 041 717 113 270;7;;;11,4
2061;Pozjata špilja;Croatia;26.10.2003.;2003-10-26;1f, 2 juv;3;Linyphiidae;Palliduphantes;spelaeorum;Palliduphantes spelaeorum;1435;43 387 837;16 963 748;Tf;deep cave;4 338 783 716 963 740;3;;;7,85
2062;Jamina, Biokovo;Croatia;26.10.2006.;2006-10-26;2f;2;Linyphiidae;Palliduphantes;spelaeorum;Palliduphantes spelaeorum;617;43 386 358;16 925 277;Tf;deep cave;4 338 635 816 925 270;4;;;
2063;?uli?a jama;Croatia;26.10.2003.;2003-10-26;1m, 1 juv;2;Linyphiidae;Palliduphantes;spelaeorum;Palliduphantes spelaeorum;1029;43 395 082;16 950 762;Tf;deep cave;4 339 508 216 950 760;2;;;
2064;Svetica;Croatia;22.5.2004.;2004-05-22;1m;1;Linyphiidae;Palliduphantes;spelaeorum;Palliduphantes spelaeorum;300;43 401 143;16 894 548;Tf;deep cave;4 340 114 316 894 540;5;;;
2065;Jamina, Biokovo;Croatia;26.10.2006.;2006-10-26;1f;1;Linyphiidae;Palliduphantes;spelaeorum;Palliduphantes spelaeorum;617;43 386 358;16 925 277;Tf;deep cave;4 338 635 816 925 270;4;;;
2066;Jamina, Biokovo;Croatia;28.10.2006.;2006-10-28;1m, 6f, 3 prosome;1;Linyphiidae;Palliduphantes;spelaeorum;Palliduphantes spelaeorum;617;43 386 358;16 925 277;Tf;deep cave;4 338 635 816 925 270;4;;;
2067;Crna ledenica;Croatia;24.5.2004.;2004-05-24;1 juv m;1;Nesticidae;Kryptonesticus;deelemanae;Kryptonesticus deelemanae;;43 348 162;17 055 328;tb;deep cave;4 334 816 217 055 320;2;;;0,3
2068;Jama pod Osojem;Croatia;28.10.2003.;2003-10-28;1f, 3 juv;4;Linyphiidae;Palliduphantes;spelaeorum;Palliduphantes spelaeorum;;43 251 441;17 118 374;Tf;deep cave;4 325 144 117 118 370;3;;7;7
2069;Jamina, Biokovo;Croatia;24.3.2004.;2004-03-24;3f, 5 juv;8;Linyphiidae;Palliduphantes;spelaeorum;Palliduphantes spelaeorum;617;43 386 358;16 925 277;Tf;deep cave;4 338 635 816 925 270;4;;;
2070;Jamina, Biokovo;Croatia;24.3.2004.;2004-03-24;1f, 2 juv;3;Linyphiidae;Palliduphantes;spelaeorum;Palliduphantes spelaeorum;617;43 386 358;16 925 277;Tf;deep cave;4 338 635 816 925 270;4;;;
2071;Pozjata špilja;Croatia;26.10.2003.;2003-10-26;1f;1;Linyphiidae;Palliduphantes;spelaeorum;Palliduphantes spelaeorum;1435;43 387 837;16 963 748;Tf;deep cave;4 338 783 716 963 740;3;;;7,85
2072;Jamina, Biokovo;Croatia;22.11.2005.;2005-11-22;1f;1;Linyphiidae;Palliduphantes;spelaeorum;Palliduphantes spelaeorum;617;43 386 358;16 925 277;Tf;deep cave;4 338 635 816 925 270;4;;;
2073;Svetica;Croatia;22.5.2004.;2004-05-22;1f;1;Linyphiidae;Palliduphantes;spelaeorum;Palliduphantes spelaeorum;300;43 401 143;16 894 548;Tf;deep cave;4 340 114 316 894 540;5;;;
2074;Ze?ica;Croatia;17.10.2002.;2002-10-17;1f;1;Linyphiidae;Palliduphantes;spelaeorum;Palliduphantes spelaeorum;1002;43 260 392;17 146 168;Tf;deep cave;4 326 039 217 146 160;3;;;
2075;Pozjata špilja;Croatia;26.10.2003.;2003-10-26;2f;2;Linyphiidae;Palliduphantes;spelaeorum;Palliduphantes spelaeorum;1435;43 387 837;16 963 748;Tf;deep cave;4 338 783 716 963 740;3;;;7,85
2084;Kukor;Croatia;29.12.1997.;1997-12-29;1f, 1 juv;2;Nesticidae;Kryptonesticus;deelemanae;Kryptonesticus deelemanae;425;43 355 609;16 991 707;tb;deep cave;4 335 560 916 991 700;10;;;15,4
2085;Kukor;Croatia;7.8.2000.;2000-08-07;1f, 7 juv;8;Nesticidae;Kryptonesticus;deelemanae;Kryptonesticus deelemanae;425;43 355 609;16 991 707;tb;deep cave;4 335 560 916 991 700;10;;;15,4
2088;Kukor;Croatia;25.3.2004.;2004-03-25;1 juv;1;Nesticidae;Kryptonesticus;deelemanae;Kryptonesticus deelemanae;425;43 355 609;16 991 707;tb;deep cave;4 335 560 916 991 700;10;;;15,4
2092;Svetica;Croatia;16.11.2005.;2005-11-16;1m, 2f, 3 juv;6;Linyphiidae;Palliduphantes;spelaeorum;Palliduphantes spelaeorum;300;43 401 143;16 894 548;Tf;deep cave;4 340 114 316 894 540;5;;;
2093;Kukor;Croatia;26.3.2004.;2004-03-26;1f, 1 juv;2;Nesticidae;Kryptonesticus;deelemanae;Kryptonesticus deelemanae;425;43 355 609;16 991 707;tb;deep cave;4 335 560 916 991 700;10;;;15,4
2094;Spila 2;Croatia;26.3.2003.;2003-03-26;1 juv m;1;Linyphiidae;Typhlonyphia;sp. 1;Typhlonyphia sp. 1;516;4 326 239;17 204 021;Tb;deep cave;432 623 917 204 021;6;;12;12
2097;Baba;Croatia;27.4.2002.;2002-04-27;1 juv;1;Linyphiidae;Typhlonyphia;sp. 1;Typhlonyphia sp. 1;;43 256 469;17 162 283;Tb;deep cave;4 325 646 917 162 280;4;;;
2098;Jama na Saran?u;Croatia;25.3.2005.;2005-03-25;1 juv;1;Linyphiidae;Typhlonyphia;sp. 1;Typhlonyphia sp. 1;;43 247 108;17 176 093;Tb;deep cave;4 324 710 817 176 090;4;;;
2100;Bošak jama;Croatia;17.11.2005.;2005-11-17;1f;1;Linyphiidae;Typhlonyphia;sp. 1;Typhlonyphia sp. 1;739;43 347 996;17 100 045;Tb;deep cave;4 334 799 617 100 040;2;;;7,4
2102;Tu?epska vilenja?a;Croatia;23.5.2004.;2004-05-23;1 juv m;1;Linyphiidae;Typhlonyphia;sp. 1;Typhlonyphia sp. 1;1181;43 286 465;17 083 638;Tb;deep cave;4 328 646 517 083 630;8;;;9,967
2102;Tu?epska vilenja?a;Croatia;23.5.2004.;2004-05-23;1 juv m;1;Linyphiidae;Typhlonyphia;sp. 1;Typhlonyphia sp. 1;1181;43 286 465;17 083 638;Tb;deep cave;4 328 646 517 083 630;8;;;11,2
2102;Tu?epska vilenja?a;Croatia;23.5.2004.;2004-05-23;1 juv m;1;Linyphiidae;Typhlonyphia;sp. 1;Typhlonyphia sp. 1;1181;43 286 465;17 083 638;Tb;deep cave;4 328 646 517 083 630;8;;10,6;11,025
2103;Spila 2;Croatia;26.3.2003.;2003-03-26;1 juv;1;Linyphiidae;Typhlonyphia;sp. 1;Typhlonyphia sp. 1;516;4 326 239;17 204 021;Tb;deep cave;432 623 917 204 021;6;;12;12
2104;?avlenova?a;Croatia;18.6.2002.;2002-06-18;1 juv;1;Nesticidae;Kryptonesticus;deelemanae;Kryptonesticus deelemanae;1460;43 334 228;17 040 746;tb;deep cave;4 333 422 817 040 740;1;;;
2105;Spila 2;Croatia;23.3.2004.;2004-03-23;2 juv;2;Linyphiidae;Typhlonyphia;sp. 1;Typhlonyphia sp. 1;516;4 326 239;17 204 021;Tb;deep cave;432 623 917 204 021;6;;12;12
2107;Jama za Supinom;Croatia;18.11.2005.;2005-11-18;2m, 1f;3;Linyphiidae;Palliduphantes;spelaeorum;Palliduphantes spelaeorum;;43 250 417;17 113 278;Tf;deep cave;4 325 041 717 113 270;7;;;10,1
2107;Jama za Supinom;Croatia;18.11.2005.;2005-11-18;2m, 1f;3;Linyphiidae;Palliduphantes;spelaeorum;Palliduphantes spelaeorum;;43 250 417;17 113 278;Tf;deep cave;4 325 041 717 113 270;7;;;11,4
2108;Vlastelinka jama;Croatia;26.3.2003.;2003-03-26;1f;1;Linyphiidae;Palliduphantes;spelaeorum;Palliduphantes spelaeorum;410;43 269 635;17 211 206;Tf;deep cave;4 326 963 517 211 200;2;;;11,4
2109;Jamina, Biokovo;Croatia;22.11.2005.;2005-11-22;3f, 1 juv m, 1 juv;5;Linyphiidae;Palliduphantes;spelaeorum;Palliduphantes spelaeorum;617;43 386 358;16 925 277;Tf;deep cave;4 338 635 816 925 270;4;;;
2111;Golubnja?a, Bartulovi?i;Croatia;23.3.2003.;2003-03-23;2 juv;2;Nesticidae;Kryptonesticus;deelemanae;Kryptonesticus deelemanae;;43 408 559;16 942 035;tb;deep cave;4 340 855 916 942 030;2;;;
2112;Jama na Saran?u;Croatia;25.3.2003.;2003-03-25;1m, 1 juv;2;Linyphiidae;Palliduphantes;spelaeorum;Palliduphantes spelaeorum;;43 247 108;17 176 093;Tf;deep cave;4 324 710 817 176 090;4;;;
2114;Kukor;Croatia;23.9.1999.;1999-09-23;1 juv;1;Nesticidae;Kryptonesticus;deelemanae;Kryptonesticus deelemanae;425;43 355 609;16 991 707;tb;deep cave;4 335 560 916 991 700;10;;;15,4
2117;Jama u Bratušu;Croatia;27.10.2006.;2006-10-27;2m, 1f, 1 juv;4;Linyphiidae;Palliduphantes;spelaeorum;Palliduphantes spelaeorum;;43 328 376;16 979 405;Tf;deep cave;4 332 837 616 979 400;4;;12,5;13,15
2118;Jujnovi?a špilja;Croatia;27.4.2002.;2002-04-27;1 juv;1;Linyphiidae;Typhlonyphia;sp. 1;Typhlonyphia sp. 1;405;43 266 579;1 719 798;Tb;deep cave;432 665 791 719 798;6;;;10,35
2118;Jujnovi?a špilja;Croatia;27.4.2002.;2002-04-27;1 juv;1;Linyphiidae;Typhlonyphia;sp. 1;Typhlonyphia sp. 1;405;43 266 579;1 719 798;Tb;deep cave;432 665 791 719 798;6;;13,8;11,35
2119;Pružina špilja;Croatia;29.10.2003.;2003-10-29;1 juv;1;Linyphiidae;Typhlonyphia;sp. 1;Typhlonyphia sp. 1;519;43 394 238;17 058 713;Tb;deep cave;4 339 423 817 058 710;4;;;11,9
2120;?uli?a jama;Croatia;26-10.2003.;2003-10-26;1 juv;1;Linyphiidae;Typhlonyphia;sp. 1;Typhlonyphia sp. 1;1029;43 395 082;16 950 762;Tb;deep cave;4 339 508 216 950 760;2;;;
2123;Jama za Supinom;Croatia;26.5.2004.;2004-05-26;1m, 2f, 1 juv;4;Linyphiidae;Palliduphantes;spelaeorum;Palliduphantes spelaeorum;;43 250 417;17 113 278;Tf;deep cave;4 325 041 717 113 270;7;;;10,1
2123;Jama za Supinom;Croatia;26.5.2004.;2004-05-26;1m, 2f, 1 juv;4;Linyphiidae;Palliduphantes;spelaeorum;Palliduphantes spelaeorum;;43 250 417;17 113 278;Tf;deep cave;4 325 041 717 113 270;7;;;11,4
2131;Svetica;Croatia;25.10.2003.;2003-10-25;1m, 2 juv;3;Amaurobidae;Amaurobius;erberi;Amaurobius erberi;300;43 401 143;16 894 548;Tx;deep cave;4 340 114 316 894 540;5;;;
2133;Polušpilja iza ku?e u Bastu;Croatia;18.8.1998.;1998-08-18;1 juv/f;1;Scytodidae;Scytodes;thoracica;Scytodes thoracica;285;43 354 924;16 982 503;Tx;;4 335 492 416 982 500;3;;;
2142;Ga?ina jama;Croatia;15.10.2002.;2002-10-15;1 juv;1;Linyphiidae;Typhlonyphia;sp. 1;Typhlonyphia sp. 1;591;43 401 743;17 058 436;Tb;deep cave;4 340 174 317 058 430;3;;;
2146;Male spile;Croatia;29.10.2003.;2003-10-29;1m;1;Scytodidae;Scytodes;thoracica;Scytodes thoracica;790;43 369 039;16 955 554;Tx;;4 336 903 916 955 550;1;;;11,4
2147;Pasji manastir;Croatia;2.3.2004.;2004-03-02;1 juv/f;1;Scytodidae;Scytodes;thoracica;Scytodes thoracica;712;43 367 864;16 970 923;Tx;;4 336 786 416 970 920;2;;;
2149;Špilja na Mrždolcu;Croatia;5.4.2006.;2006-04-05;1 juv;1;Linyphiidae;Typhlonyphia;sp. 1;Typhlonyphia sp. 1;461;43 405 319;17 014 811;Tb;deep cave;4 340 531 917 014 810;3;;;7,5
2151;Muci?a ledenica;Croatia;24.5.2004.;2004-05-24;1f;1;Linyphiidae;Troglohyphantes;sp. 8;Troglohyphantes sp. 8;1250;4 335 632;17 051 544;Tf;deep cave;433 563 217 051 544;3;;0,8;0,8
2153;Kukor;Croatia;26.4.2002.;2002-04-26;2f juv;2;Leptonetidae;Sulcia;sp.;Sulcia sp.;425;43 355 609;16 991 707;;;4 335 560 916 991 700;10;;;15,4
2154;Jama u Bratušu;Croatia;27.10.2006.;2006-10-27;1m;1;Linyphiidae;Centromerus;raridentatus sp.n.;Centromerus raridentatus sp.n.;25;43 328 376;16 979 405;;;4 332 837 616 979 400;4;;12,5;13,15
2155;Krjava 2;Croatia;27.10.2006.;2006-10-27;3f;3;Linyphiidae;Centromerus;cavernarum;Centromerus cavernarum;903;43 329 431;17 027 011;Tf;deep cave;4 332 943 117 027 010;3;;;7,425
2156;Stonjska pe? gornja;Croatia;27.10.2003.;2003-10-27;1f, 1 juv;2;Linyphiidae;Centromerus;cavernarum;Centromerus cavernarum;625;43 315 167;171 304;Tf;deep cave;43 315 167 171 304;4;;;
2157;Jama iznad Prozor?i?a;Croatia;28.10.2003.;2003-10-28;1m, 1 juv m;2;Linyphiidae;Centromerus;silvicola;Centromerus silvicola;617;4 338 381;16 932 036;tx;deep cave;433 838 116 932 036;5;;12,5;8,9
2158;Jama iznad Prozor?i?a;Croatia;24.3.2004.;2004-03-24;1 m;1;Linyphiidae;Centromerus;silvicola;Centromerus silvicola;617;4 338 381;16 932 036;tx;deep cave;433 838 116 932 036;5;;12,5;8,9
2159;Mala jama u stijenama;Croatia;20.3.2003.;2003-03-20;1m, 1 juv;2;Linyphiidae;Centromerus;cavernarum;Centromerus cavernarum;1115;43 365 579;17 027 668;Tf;deep cave;4 336 557 917 027 660;3;;9,3;9,3
2161;Jama iznad Prozor?i?a;Croatia;28.10.2003.;2003-10-28;2m, 1f, 1 juv m;4;Linyphiidae;Centromerus;silvicola;Centromerus silvicola;617;4 338 381;16 932 036;tx;deep cave;433 838 116 932 036;5;;12,5;8,9
2162;Jama iznad Prozor?i?a;Croatia;1.4.2006.;2006-04-01;1f;1;Linyphiidae;Centromerus;silvicola;Centromerus silvicola;617;4 338 381;16 932 036;tx;deep cave;433 838 116 932 036;5;;12,5;8,9
2163;Jama iznad Prozor?i?a;Croatia;1.4.2006.;2006-04-01;1f;1;Linyphiidae;Centromerus;silvicola;Centromerus silvicola;617;4 338 381;16 932 036;tx;deep cave;433 838 116 932 036;5;;12,5;8,9
2164;Jama iznad Prozor?i?a;Croatia;28.10.2003.;2003-10-28;1f;1;Linyphiidae;Centromerus;silvicola;Centromerus silvicola;617;4 338 381;16 932 036;tx;deep cave;433 838 116 932 036;5;;12,5;8,9
2165;Jama iznad Prozor?i?a;Croatia;26.10.2006.;2006-10-26;2f;2;Linyphiidae;Centromerus;silvicola;Centromerus silvicola;617;4 338 381;16 932 036;tx;deep cave;433 838 116 932 036;5;;12,5;8,9
2169;Samogorska špilja;Croatia;25.5.2005.;2005-05-25;1 f;1;Linyphiidae;Gen. 8;sp. 1;Gen. 8 sp. 1;717;43 318 227;17 121 122;;;4 331 822 717 121 120;6;;;13,1
2169;Samogorska špilja;Croatia;25.5.2005.;2005-05-25;1 f;1;Linyphiidae;Gen. 8;sp. 1;Gen. 8 sp. 1;717;43 318 227;17 121 122;;;4 331 822 717 121 120;6;;7,1;4,967
2170;Samogorska špilja;Croatia;19.11.2005.;2005-11-19;1 f;1;Linyphiidae;Gen. 8;sp. 1;Gen. 8 sp. 1;717;43 318 227;17 121 122;;;4 331 822 717 121 120;6;;;13,1
2170;Samogorska špilja;Croatia;19.11.2005.;2005-11-19;1 f;1;Linyphiidae;Gen. 8;sp. 1;Gen. 8 sp. 1;717;43 318 227;17 121 122;;;4 331 822 717 121 120;6;;7,1;4,967
2180;Brikinjava špilja;Croatia;17.11.2005.;2005-11-17;3f, 1 juv m, 1 juv;5;Leptonetidae;Barusia;maheni;Barusia maheni;740;43 345 181;17 096 904;tf;deep cave;4 334 518 117 096 900;3;;;5,533
2181;Brikinjava špilja;Croatia;21.3.2003.;2003-03-21;1f;1;Leptonetidae;Sulcia;sp.;Sulcia sp.;740;43 345 181;17 096 904;;;4 334 518 117 096 900;3;;;5,533
2182;Kukor;Croatia;19.6.2002.;2002-06-19;1f, 1 juv;2;Leptonetidae;Sulcia;sp.;Sulcia sp.;425;43 355 609;16 991 707;;;4 335 560 916 991 700;10;;;15,4
2183;Gradska spila;Croatia;19.11.2005.;2005-11-19;1f;1;Leptonetidae;Sulcia;sp.;Sulcia sp.;755;43 318 029;17 117 623;;;4 331 802 917 117 620;4;;;6,6
2185;Gradska spila;Croatia;25.5.2004.;2004-05-25;2f, 1juv m, 3 juv;6;Leptonetidae;Sulcia;sp.;Sulcia sp.;755;43 318 029;17 117 623;;;4 331 802 917 117 620;4;;;6,6
2186;Stonjska pe? donja;Croatia;27.10.2003.;2003-10-27;1 juv m, 1f;2;Leptonetidae;Sulcia;sp.;Sulcia sp.;608;43 315 167;17 130 659;;;4 331 516 717 130 650;6;;;
2188;Samogorska špilja;Croatia;19.11.2005.;2005-11-19;2f, 6 juv;8;Leptonetidae;Sulcia;sp.;Sulcia sp.;717;43 318 227;17 121 122;;;4 331 822 717 121 120;6;;;13,1
2188;Samogorska špilja;Croatia;19.11.2005.;2005-11-19;2f, 6 juv;8;Leptonetidae;Sulcia;sp.;Sulcia sp.;717;43 318 227;17 121 122;;;4 331 822 717 121 120;6;;7,1;4,967
2190;Kukor;Croatia;28.7.2006.;2006-07-28;1f;1;Leptonetidae;Barusia;maheni;Barusia maheni;425;43 355 609;16 991 707;tf;deep cave;4 335 560 916 991 700;10;;;15,4
2192;Špilja na Mrždolcu;Croatia;21.11.2005.;2005-11-21;1f, 1 juv m, 1 juv;3;Leptonetidae;Barusia;maheni;Barusia maheni;461;43 405 319;17 014 811;tf;deep cave;4 340 531 917 014 810;3;;;7,5
2194;Gradska spila;Croatia;4.4.2006.;2006-04-04;1f, 1 juv m, 3 juv;5;Leptonetidae;Sulcia;sp.;Sulcia sp.;755;43 318 029;17 117 623;;;4 331 802 917 117 620;4;;;6,6
2196;Kukor;Croatia;24.9.2001.;2001-09-24;1f, 1 juv;2;Leptonetidae;Barusia;maheni;Barusia maheni;425;43 355 609;16 991 707;tf;deep cave;4 335 560 916 991 700;10;;;15,4
2197;Pasji manastir;Croatia;20.3.2004.;2004-03-20;1f;1;Leptonetidae;Sulcia;sp.;Sulcia sp.;712;43 367 864;16 970 923;;;4 336 786 416 970 920;2;;;
2203;Samogorska špilja;Croatia;25.5.2005.;2005-05-25;3f, 3 juvm, 1 juv;7;Leptonetidae;Sulcia;sp.;Sulcia sp.;717;43 318 227;17 121 122;;;4 331 822 717 121 120;6;;;13,1
2203;Samogorska špilja;Croatia;25.5.2005.;2005-05-25;3f, 3 juvm, 1 juv;7;Leptonetidae;Sulcia;sp.;Sulcia sp.;717;43 318 227;17 121 122;;;4 331 822 717 121 120;6;;7,1;4,967
2205;Samogorska špilja;Croatia;4.4.2006.;2006-04-04;6f, 1 juv;7;Leptonetidae;Sulcia;sp.;Sulcia sp.;717;43 318 227;17 121 122;;;4 331 822 717 121 120;6;;;13,1
2205;Samogorska špilja;Croatia;4.4.2006.;2006-04-04;6f, 1 juv;7;Leptonetidae;Sulcia;sp.;Sulcia sp.;717;43 318 227;17 121 122;;;4 331 822 717 121 120;6;;7,1;4,967
2207;Stonjska pe? donja;Croatia;27.10.2003.;2003-10-27;2f, 1 juvm;3;Leptonetidae;Barusia;maheni;Barusia maheni;608;43 315 167;17 130 659;tf;deep cave;4 331 516 717 130 650;6;;;
2209;Samogorska špilja;Croatia;25.5.2005.;2005-05-25;1f;1;Leptonetidae;Sulcia;sp.;Sulcia sp.;717;43 318 227;17 121 122;;;4 331 822 717 121 120;6;;;13,1
2209;Samogorska špilja;Croatia;25.5.2005.;2005-05-25;1f;1;Leptonetidae;Sulcia;sp.;Sulcia sp.;717;43 318 227;17 121 122;;;4 331 822 717 121 120;6;;7,1;4,967
2212;Jama na Brezdanu;Croatia;20.3.2004.;2004-03-20;1f, 2 juv;3;Leptonetidae;Sulcia;sp.;Sulcia sp.;915;43 369 901;16 973 172;;;4 336 990 116 973 170;3;;8,5;8,5
2218;Samogorska špilja;Croatia;4.4.2006.;2006-04-04;2f, 2 juv;4;Leptonetidae;Sulcia;sp.;Sulcia sp.;717;43 318 227;17 121 122;;;4 331 822 717 121 120;6;;;13,1
2218;Samogorska špilja;Croatia;4.4.2006.;2006-04-04;2f, 2 juv;4;Leptonetidae;Sulcia;sp.;Sulcia sp.;717;43 318 227;17 121 122;;;4 331 822 717 121 120;6;;7,1;4,967
2219;Matijaševa pe?;Croatia;4.4.2006.;2006-04-04;2f;2;Leptonetidae;Sulcia;sp.;Sulcia sp.;584;43 320 551;17 122 321;;;4 332 055 117 122 320;6;;8,3;6,933
2222;Matijaševa pe?;Croatia;4.4.2006.;2006-04-04;1f;1;Leptonetidae;Sulcia;sp.;Sulcia sp.;584;43 320 551;17 122 321;;;4 332 055 117 122 320;6;;8,3;6,933
2223;Kukor;Croatia;6.4.2006.;2006-04-06;1 juv f;1;Leptonetidae;Sulcia;sp.;Sulcia sp.;425;43 355 609;16 991 707;;;4 335 560 916 991 700;10;;;15,4
2225;Sniježnica pod Ljubljanom;Croatia;23.6.2011.;2011-06-23;1f, 1 juv;2;Linyphiidae;Troglohyphantes;dalmaticus;Troglohyphantes dalmaticus;;43 537 964;16 616 241;tf;deep cave;4 353 796 416 616 240;1;;;
2226;Sniježnica pod Ljubljanom;Croatia;23.6.2011.;2011-06-23;1f, 4 juv;5;Linyphiidae;Troglohyphantes;dalmaticus;Troglohyphantes dalmaticus;;43 537 964;16 616 241;tf;deep cave;4 353 796 416 616 240;1;;;
2227;Židovske jame;Croatia;23.4.2005.;2005-04-23;3f, 3 juv;6;Linyphiidae;Troglohyphantes;sp. 12;Troglohyphantes sp. 12;;45 997 503;16 038 982;tf;deep cave;4 599 750 316 038 980;2;;;
2228;Židovske jame;Croatia;23.4.2005.;2005-04-23;3f, 3 juv;6;Linyphiidae;Troglohyphantes;sp. 12;Troglohyphantes sp. 12;;45 997 503;16 038 982;tf;deep cave;4 599 750 316 038 980;2;;;
2229;Glogova jama;Croatia;24.8.2005.;2005-08-24;1f;1;Linyphiidae;Troglohyphantes;lesserti;Troglohyphantes lesserti;;42 573 189;18 361 688;tb;deep cave;4 257 318 918 361 680;1;;;
2230;Bedara;Croatia;24.8.2002.;2002-08-24;1f;1;Linyphiidae;Troglohyphantes;sketi;Troglohyphantes sketi;620;45 751 922;15 536 692;;deep cave;4 575 192 215 536 690;4;;;
2231;Velika pe? (Rog);Croatia;20.3.2005.;2005-03-20;3f, 1 juvm, 1juvf, 1 juv;6;Linyphiidae;Troglohyphantes;sp. 12;Troglohyphantes sp. 12;;4 593 776;1 606 234;tf;deep cave;45 937 761 606 234;4;;;
2232;Jezero;Croatia;28.5.2004.;2004-05-28;1m;1;Linyphiidae;Troglohyphantes;lesserti;Troglohyphantes lesserti;903;42 580 381;18 356 073;tb;deep cave;4 258 038 118 356 070;8;;;7,567
2233;Drinova 2;Croatia;23.3.2003.;2003-03-23;1m, 1f, 1 juvm;3;Leptonetidae;Sulcia;sp. 3;Sulcia sp. 3;725;43 407 702;16 942 899;Tb;deep cave;4 340 770 216 942 890;3;;;
2234;Podrum;Croatia;22.5.2004.;2004-05-22;1m, 1 juvm;2;Leptonetidae;Sulcia;sp. 4;Sulcia sp. 4;;43 234 263;17 091 929;Tb;deep cave;4 323 426 317 091 920;2;;;
2235;Stonjska pe? donja;Croatia;27.10.2003.;2003-10-27;2m, 1f, 1 juv;4;Leptonetidae;Sulcia;sp. 4;Sulcia sp. 4;608;43 315 167;17 130 659;Tb;deep cave;4 331 516 717 130 650;6;;;
2236;Jama na Brezdanu;Croatia;20.3.2004.;2004-03-20;1m, 1f, 1 juvm;3;Leptonetidae;Sulcia;sp. 3;Sulcia sp. 3;915;43 369 901;16 973 172;Tb;deep cave;4 336 990 116 973 170;3;;8,5;8,5
2237;Kukor;Croatia;7.8.2000.;2000-08-07;5m, 3f, 4juv;12;Leptonetidae;Sulcia;sp. 4;Sulcia sp. 4;425;43 355 609;16 991 707;Tb;deep cave;4 335 560 916 991 700;10;;;15,4
2238;Bužnja?a;Croatia;29.10.2003.;2003-10-29;1m;1;Leptonetidae;Sulcia;sp. 3;Sulcia sp. 3;;43 370 414;16 958 245;Tb;deep cave;4 337 041 416 958 240;2;;;
2239;Kukor;Croatia;27.3.2003.;2003-03-27;1m, 1 juv;2;Leptonetidae;Sulcia;sp. 3;Sulcia sp. 3;425;43 355 609;16 991 707;Tb;deep cave;4 335 560 916 991 700;10;;;15,4
2240;Gradska spila;Croatia;19.11.2005.;2005-11-19;1m, 1 f, 1 juv;3;Leptonetidae;Sulcia;sp. 4;Sulcia sp. 4;755;43 318 029;17 117 623;Tb;deep cave;4 331 802 917 117 620;4;;;6,6
2241;Samogorska špilja;Croatia;25.5.2004.;2004-05-25;1m, 2 juv;3;Leptonetidae;Sulcia;sp. 4;Sulcia sp. 4;717;43 318 227;17 121 122;Tb;deep cave;4 331 822 717 121 120;6;;;13,1
2241;Samogorska špilja;Croatia;25.5.2004.;2004-05-25;1m, 2 juv;3;Leptonetidae;Sulcia;sp. 4;Sulcia sp. 4;717;43 318 227;17 121 122;Tb;deep cave;4 331 822 717 121 120;6;;7,1;4,967
2242;Kukor;Croatia;2.1.1999.;1999-01-02;1m;1;Leptonetidae;Sulcia;sp. 3;Sulcia sp. 3;425;43 355 609;16 991 707;Tb;deep cave;4 335 560 916 991 700;10;;;15,4
2243;Kukor;Croatia;26.8.1998.;1998-08-26;1m;1;Leptonetidae;Sulcia;sp. 3;Sulcia sp. 3;425;43 355 609;16 991 707;Tb;deep cave;4 335 560 916 991 700;10;;;15,4
2244;Samogorska špilja;Croatia;19.11.2005.;2005-11-19;1m, 5 juv;6;Leptonetidae;Sulcia;sp. 4;Sulcia sp. 4;717;43 318 227;17 121 122;Tb;deep cave;4 331 822 717 121 120;6;;;13,1
2244;Samogorska špilja;Croatia;19.11.2005.;2005-11-19;1m, 5 juv;6;Leptonetidae;Sulcia;sp. 4;Sulcia sp. 4;717;43 318 227;17 121 122;Tb;deep cave;4 331 822 717 121 120;6;;7,1;4,967
2245;Samogorska špilja;Croatia;19.11.2005.;2005-11-19;1m, 2 juv;3;Leptonetidae;Sulcia;sp. 4;Sulcia sp. 4;717;43 318 227;17 121 122;Tb;deep cave;4 331 822 717 121 120;6;;;13,1
2245;Samogorska špilja;Croatia;19.11.2005.;2005-11-19;1m, 2 juv;3;Leptonetidae;Sulcia;sp. 4;Sulcia sp. 4;717;43 318 227;17 121 122;Tb;deep cave;4 331 822 717 121 120;6;;7,1;4,967
2247;Kukor;Croatia;29.10.2006.;2006-10-29;1m, 1f, 1 juvm;3;Leptonetidae;Sulcia;sp. 3;Sulcia sp. 3;425;43 355 609;16 991 707;Tb;deep cave;4 335 560 916 991 700;10;;;15,4
2249;Gradska spila;Croatia;19.11.2005.;2005-11-19;1m, 3f, 2 juv;6;Leptonetidae;Sulcia;sp. 4;Sulcia sp. 4;755;43 318 029;17 117 623;Tb;deep cave;4 331 802 917 117 620;4;;;6,6
2250;Kukor;Croatia;27.7.2004.;2004-07-27;1m, 1f;2;Leptonetidae;Sulcia;sp. 3;Sulcia sp. 3;425;43 355 609;16 991 707;Tb;deep cave;4 335 560 916 991 700;10;;;15,4
2251;Kukor;Croatia;20.10.2005.;2005-10-20;1m;1;Leptonetidae;Sulcia;sp. 3;Sulcia sp. 3;425;43 355 609;16 991 707;Tb;deep cave;4 335 560 916 991 700;10;;;15,4
2252;Podrum;Croatia;22.5.2004.;2004-05-22;3m, 1f, 3juv;7;Leptonetidae;Sulcia;sp. 4;Sulcia sp. 4;;43 234 263;17 091 929;Tb;deep cave;4 323 426 317 091 920;2;;;
2253;Matijaševa pe?;Croatia;4.4.2006.;2006-04-04;1m, 1f;2;Leptonetidae;Sulcia;sp. 4;Sulcia sp. 4;584;43 320 551;17 122 321;Tb;deep cave;4 332 055 117 122 320;6;;8,3;6,933
2254;Samogorska špilja;Croatia;4.4.2006.;2006-04-04;3m, 1f;4;Leptonetidae;Sulcia;sp. 4;Sulcia sp. 4;717;43 318 227;17 121 122;Tb;deep cave;4 331 822 717 121 120;6;;;13,1
2254;Samogorska špilja;Croatia;4.4.2006.;2006-04-04;3m, 1f;4;Leptonetidae;Sulcia;sp. 4;Sulcia sp. 4;717;43 318 227;17 121 122;Tb;deep cave;4 331 822 717 121 120;6;;7,1;4,967
2255;Stonjska pe? gornja;Croatia;27.10.2003.;2003-10-27;1m;1;Leptonetidae;Sulcia;sp. 4;Sulcia sp. 4;;43 315 167;171 304;Tb;deep cave;43 315 167 171 304;4;;;
2256;Gradska spila;Croatia;4.4.2006.;2006-04-04;2m, 2 juv;4;Leptonetidae;Sulcia;sp. 4;Sulcia sp. 4;755;43 318 029;17 117 623;Tb;deep cave;4 331 802 917 117 620;4;;;6,6
2257;Tanki Ratac;Croatia;6.1.2009.;2009-01-06;1m, 1 juvm;2;Leptonetidae;Barusia;maheni;Barusia maheni;;43 360 229;16 569 356;tf;deep cave;4 336 022 916 569 350;3;;;16,6
2258;Svetica;Croatia;16.11.2005.;2005-11-16;5m, 1f, 3 juv;9;Leptonetidae;Barusia;maheni;Barusia maheni;300;43 401 143;16 894 548;tf;deep cave;4 340 114 316 894 540;5;;;
2259;Jama u Bratušu;Croatia;27.10.2006.;2006-10-27;2m, 1f;3;Leptonetidae;Barusia;maheni;Barusia maheni;;43 328 376;16 979 405;tf;deep cave;4 332 837 616 979 400;4;;12,5;13,15
2260;Svetica;Croatia;25.10.2003.;2003-10-25;1m,1f;2;Leptonetidae;Barusia;maheni;Barusia maheni;300;43 401 143;16 894 548;tf;deep cave;4 340 114 316 894 540;5;;;
2261;Svetica;Croatia;22.5.2004.;2004-05-22;1m;1;Leptonetidae;Barusia;maheni;Barusia maheni;300;43 401 143;16 894 548;tf;deep cave;4 340 114 316 894 540;5;;;
2262;Jamski sustav Crnopac;Croatia;10.8.2011.;2011-08-10;1f;1;Linyphiidae;Troglohyphantes;sp. 9;Troglohyphantes sp. 9;;44 260 625;1 585 028;tb;deep cave;442 606 251 585 028;1;;;
2263;Špilja kod bare Vojnikuše;Croatia;3.8.2011.;2011-08-03;1m;1;Dysderidae;Parastalita;stygia;Parastalita stygia;590;4 462 389;15 206 584;Tb;deep cave;446 238 915 206 584;1;;;
2264;Špilja kod bare Vojnikuše;Croatia;3.8.2011.;2011-08-03;1f;1;Dysderidae;Parastalita;stygia;Parastalita stygia;590;4 462 389;15 206 584;Tb;deep cave;446 238 915 206 584;1;;;
2267;Klementina 21;Croatia;3.8.2011.;2011-08-03;1 juv m;1;Linyphiidae;Troglohyphantes;sp.;Troglohyphantes sp.;;44 650 725;15 103 309;;;4 465 072 515 103 300;1;;;
2268;Ponor Štirova?a;Croatia;7.8.2011.;2011-08-07;1f, 1 juv;2;Linyphiidae;Troglohyphantes;sp. 3;Troglohyphantes sp. 3;1060;44 693 088;15 051 176;tb;deep cave;4 469 308 815 051 170;2;;;
2269;Jama kod Lugarnice;Croatia;4.8.2011.;2011-08-04;2m, 4f, 1juv;7;Linyphiidae;Troglohyphantes;croaticus;Troglohyphantes croaticus;570;45 327 864;15 092 353;tb;deep cave;4 532 786 415 092 350;3;;;8,9
2270;Jama kod Lugarnice;Croatia;4.8.2011.;2011-08-04;3f, 1m;4;Dysderidae;Parastalita;stygia;Parastalita stygia;570;45 327 864;15 092 353;Tb;deep cave;4 532 786 415 092 350;3;;;8,9
2271;Špilja Šuplja?a;Croatia;1.8.2006.;2006-08-01;1f;1;Linyphiidae;Troglohyphantes;roberti;Troglohyphantes roberti;;44 228 797;15 851 735;tb;deep cave;4 422 879 715 851 730;2;;;7,7
2271;Špilja Šuplja?a;Croatia;1.8.2006.;2006-08-01;1f;1;Linyphiidae;Troglohyphantes;roberti;Troglohyphantes roberti;;44 228 797;15 851 735;tb;deep cave;4 422 879 715 851 730;2;;;10,3
2272;Velika pe?ina, Gornji ?abri?i;Croatia;1.8.2006.;2006-08-01;3f, 2m, 3 juv;8;Linyphiidae;Troglohyphantes;roberti;Troglohyphantes roberti;;44 229 974;15 855 897;tb;deep cave;4 422 997 415 855 890;4;;;
2275;Jama prvi put;Croatia;13.8.2004.;2004-08-13;1m;1;Linyphiidae;Porrhomma;convexum;Porrhomma convexum;;44 258 904;15 828 678;;deep cave;4 425 890 415 828 670;1;;;
2277;Vodarica;Croatia;13.6.1999.;1999-06-13;1 juv m;1;Linyphiidae;Troglohyphantes;sp.;Troglohyphantes sp.;;4 431 302;15 502 487;;;443 130 215 502 487;1;;;
2278;Rastova?a;Croatia;28.9.2006.;2006-09-28;1m, 1f, 1juv;3;Linyphiidae;Troglohyphantes;roberti;Troglohyphantes roberti;380;44 233 742;15 698 969;tb;deep cave;4 423 374 215 698 960;2;;;
2279;Jama Kao-kao;Croatia;25.7.2001.;2001-07-25;1 juv f;1;Linyphiidae;Troglohyphantes;sp.;Troglohyphantes sp.;;4 445 232;152 474;;;4 445 232 152 474;1;;;
2286;Velika pe?ina, Gornji ?abri?i;Croatia;1.8.2006.;2006-08-01;1m;1;Linyphiidae;Bathyphantes;sp. 2;Bathyphantes sp. 2;585;44 229 974;15 855 897;Tx;;4 422 997 415 855 890;4;;;
2287;Vulva;Croatia;14.8.2006.;2006-08-14;1m;1;Linyphiidae;Porrhomma;convexum;Porrhomma convexum;;44 259 766;15 828 941;;deep cave;4 425 976 615 828 940;2;;;
2288;Jama lijepih fosila;Croatia;15.5.2006.;2006-05-15;1f;1;Dysderidae;Gen. 1;sp. 1;Gen. 1 sp. 1;1674;44 374 877;15 490 469;Tb;deep cave;4 437 487 715 490 460;1;;;
2289;Vaganka;Croatia;3.6.2006.;2006-06-03;1m, 1f;2;Dysderidae;Parastalita;stygia;Parastalita stygia;658;4 433 853;1 543 867;Tb;deep cave;44 338 531 543 867;5;;;12,2
2290;Jama Pisnica;Croatia;16.6.2006.;2006-06-16;1m;1;Dysderidae;Parastalita;stygia;Parastalita stygia;615;44 315 196;15 492 471;Tb;deep cave;4 431 519 615 492 470;1;;;
2291;Velika pe?ina, Gornji ?abri?i;Croatia;1.8.2006.;2006-08-01;1m;1;Dysderidae;Parastalita;stygia;Parastalita stygia;585;44 229 974;15 855 897;Tb;deep cave;4 422 997 415 855 890;4;;;
2292;Jatara špilja;Croatia;9.6.2006.;2006-06-09;1f;1;Linyphiidae;Centromerus;cavernarum;Centromerus cavernarum;;44 334 974;15 446 351;Tf;deep cave;4 433 497 415 446 350;3;;;
2293;Kad jaganjci utihnu;Croatia;5.6.2006.;2006-06-05;1m;1;Theridiidae;Episinus;cavernicola;Episinus cavernicola;;44 365 085;15 314 841;Tf;deep cave;4 436 508 515 314 840;3;;;
2294;Vulva;Croatia;14.8.2006.;2006-08-14;1m;1;Theridiidae;Episinus;cavernicola;Episinus cavernicola;;44 259 766;15 828 941;Tf;deep cave;4 425 976 615 828 940;2;;;
2299;Vrta?a kod jame Kajgana;Croatia;1.8.2005.;2005-08-01;1 juv;1;Dysderidae;Dysdera;sp.;Dysdera sp.;;44 487 041;15 231 807;Tx;;4 448 704 115 231 800;2;;;
2301;Rastova?a;Croatia;2.8.2005.;2005-08-02;1m, 1f;2;Dysderidae;Parastalita;stygia;Parastalita stygia;380;44 233 742;15 698 969;Tb;deep cave;4 423 374 215 698 960;2;;;
2302;Munižaba;Croatia;9.7.2011.;2011-07-09;1f, 1 juv;2;Linyphiidae;Troglohyphantes;roberti;Troglohyphantes roberti;;44 265 901;15 864 397;tb;deep cave;4 426 590 115 864 390;1;;;
2309;Vrta?a kod jame Kajgana;Croatia;1.8.2005.;2005-08-01;1f, 1 juv;2;Linyphiidae;Gen.;sp. X;Gen. sp. X;;44 487 041;15 231 807;;;4 448 704 115 231 800;2;;;
2319;Golubinka više Mrši?a strane;Croatia;4.8.2006.;2006-08-04;1m;1;Linyphiidae;Palliduphantes;istrianus;Palliduphantes istrianus;;4 412 501;15 807 683;Tf;deep cave;441 250 115 807 683;3;;7,1;7,45
2321;Jama B-5;Croatia;31.7.2000.;2000-07-31;1m;1;Linyphiidae;Micrargus;sp.;Micrargus sp.;;44 744 468;15 066 058;;;4 474 446 815 066 050;1;;;
2324;Babi?a Snježnja?a;Croatia;9.6.1984.;1984-06-09;1f;1;Linyphiidae;Troglohyphantes;kordunlikanus;Troglohyphantes kordunlikanus;800;44 209 779;16 103 991;tf;deep cave;4 420 977 916 103 990;2;;;
2328;Jama II kod Velikih Brisnica;Croatia;2.6.2006.;2006-06-02;1m;1;Familia x;Gen.;sp.;Gen. sp.;520;44 789 027;14 918 377;;;4 478 902 714 918 370;3;;;
2330;Školjka jama;Croatia;15.8.2007.;2007-08-15;1f;1;Linyphiidae;Porrhomma;egeria;Porrhomma egeria;1600;44 762 398;14 986 639;;deep cave;4 476 239 814 986 630;1;;;
2331;Jama na Kuželjevcu;Croatia;2.6.2006.;2006-06-02;1f;1;Linyphiidae;Palliduphantes;istrianus;Palliduphantes istrianus;;44 828 665;14 910 216;Tf;deep cave;4 482 866 514 910 210;2;;;
2333;Školjka jama;Croatia;7.8.2003.;2003-08-07;1m;1;Linyphiidae;Porrhomma;egeria;Porrhomma egeria;1600;44 762 398;14 986 639;;deep cave;4 476 239 814 986 630;1;;;
2336;Zelena;Croatia;2.8.2004.;2004-08-02;1m;1;Linyphiidae;Micrargus;sp.;Micrargus sp.;;44 756 954;1 498 717;;;447 569 541 498 717;2;;;
2337;Jama na Kuželjevcu;Croatia;2.6.2006.;2006-06-02;3m, 5f, 2 juv;1;Linyphiidae;Palliduphantes;istrianus;Palliduphantes istrianus;;44 828 665;14 910 216;Tf;deep cave;4 482 866 514 910 210;2;;;
2338;Dvorske lude;Croatia;22.7.2003.;2003-07-22;1m;1;Linyphiidae;Porrhomma;egeria;Porrhomma egeria;1150;44 740 886;15 089 898;;deep cave;4 474 088 615 089 890;1;;;
2342;Jama II kod Velikih Brisnica;Croatia;2.6.2006.;2006-06-02;1m;1;Linyphiidae;Palliduphantes;istrianus;Palliduphantes istrianus;520;44 789 027;14 918 377;Tf;deep cave;4 478 902 714 918 370;3;;;
2346;Zelena;Croatia;2.8.2004.;2004-08-02;1m, 1juv;2;Linyphiidae;Gen. 9;sp. 1;Gen. 9 sp. 1;;44 756 954;1 498 717;;;447 569 541 498 717;2;;;
2354;Puhova jama;Croatia;13.8.2006.;2006-08-13;1m;1;Linyphiidae;Micrargus;sp.;Micrargus sp.;;44 629 717;15 131 426;;;4 462 971 715 131 420;1;;;
2358;Zverina;Croatia;3.11.2005.;2005-11-03;1m;1;Linyphiidae;Troglohyphantes;wiehlei;Troglohyphantes wiehlei;;45 681 296;15 445 012;tf;deep cave;4 568 129 615 445 010;2;;;
2359;Gornja Cerova?ka špilja;Croatia;6.6.2006.;2006-06-06;1f;1;Linyphiidae;Troglohyphantes;roberti;Troglohyphantes roberti;700;4 427 338;1 588 422;tb;deep cave;44 273 381 588 422;5;;;
2360;Led 1;Croatia;21.6.2003.;2003-06-21;1f;1;Linyphiidae;Troglohyphantes;sp. 8;Troglohyphantes sp. 8;1475;43 344 045;17 057 588;Tf;deep cave;4 334 404 517 057 580;3;;;
2361;Vaginuša;Croatia;14.8.2006.;2006-08-14;1m;1;Linyphiidae;Bathyphantes;sp. 2;Bathyphantes sp. 2;;44 633 812;1 512 667;Tx;;446 338 121 512 667;1;;;
2362;Japagina 1;Croatia;15.8.2006.;2006-08-15;1m;1;Linyphiidae;Porrhomma;convexum;Porrhomma convexum;;44 645 732;15 119 398;;deep cave;4 464 573 215 119 390;1;;;
2363;Sini?i? špilja;Croatia;29.4.2004.;2004-04-29;1f;1;Linyphiidae;Troglohyphantes;kordunlikanus;Troglohyphantes kordunlikanus;;44 990 698;15 177 848;tf;deep cave;4 499 069 815 177 840;6;;;
2365;Babina jama, Sv. Rok;Croatia;2.9.2008.;2008-09-02;1 juv m, 3 juv;4;Linyphiidae;Troglohyphantes;roberti;Troglohyphantes roberti;;44 321 352;15 678 259;tb;deep cave;4 432 135 215 678 250;1;;;
2367;Pe? u ?ulinovim raljevinama;Croatia;25.6.2011.;2011-06-25;1 juv;1;Dysderidae;Stalagtia;sp. 4;Stalagtia sp. 4;;43 605 854;16 575 066;Tb;deep cave;4 360 585 416 575 060;5;;;11
2368;Drinov?uša;Croatia;21.6.2011.;2011-06-21;1f;1;Dysderidae;Harpactea;damini;Harpactea damini;793;43 548 476;16 638 636;TF;deep cave;4 354 847 616 638 630;4;;;
2370;Tu?epska vilenja?a;Croatia;18.6.2011.;2011-06-18;1 juv;1;Agelenidae;Histopona;sp.;Histopona sp.;1181;43 286 465;17 083 638;;deep cave;4 328 646 517 083 630;8;;;9,967
2370;Tu?epska vilenja?a;Croatia;18.6.2011.;2011-06-18;1 juv;1;Agelenidae;Histopona;sp.;Histopona sp.;1181;43 286 465;17 083 638;;deep cave;4 328 646 517 083 630;8;;;11,2
2370;Tu?epska vilenja?a;Croatia;18.6.2011.;2011-06-18;1 juv;1;Agelenidae;Histopona;sp.;Histopona sp.;1181;43 286 465;17 083 638;;deep cave;4 328 646 517 083 630;8;;10,6;11,025
2371;Tu?epska vilenja?a;Croatia;18.6.2011.;2011-06-18;2f;2;Dysderidae;Stalagtia;sp. 4;Stalagtia sp. 4;1181;43 286 465;17 083 638;Tb;deep cave;4 328 646 517 083 630;8;;;9,967
2371;Tu?epska vilenja?a;Croatia;18.6.2011.;2011-06-18;2f;2;Dysderidae;Stalagtia;sp. 4;Stalagtia sp. 4;1181;43 286 465;17 083 638;Tb;deep cave;4 328 646 517 083 630;8;;;11,2
2371;Tu?epska vilenja?a;Croatia;18.6.2011.;2011-06-18;2f;2;Dysderidae;Stalagtia;sp. 4;Stalagtia sp. 4;1181;43 286 465;17 083 638;Tb;deep cave;4 328 646 517 083 630;8;;10,6;11,025
2372;Špilja Sv. Filipa i Jakoba;Croatia;14.6.2011.;2011-06-14;1f;1;Dysderidae;Stalagtia;sp. 4;Stalagtia sp. 4;;43 521 135;16 091 237;Tb;deep cave;4 352 113 516 091 230;5;;;
2373;Špilja Sv. Filipa i Jakoba;Croatia;14.6.2011.;2011-06-14;1 juv m;1;Dysderidae;Stalagtia;sp. 4;Stalagtia sp. 4;;43 521 135;16 091 237;Tb;deep cave;4 352 113 516 091 230;5;;;
2374;Špilja Sv. Filipa i Jakoba;Croatia;14.6.2011.;2011-06-14;1 juv;1;Nesticidae;Kryptonesticus;eremita;Kryptonesticus eremita;;43 521 135;16 091 237;;deep cave;4 352 113 516 091 230;5;;;
2375;Budina špilja;Croatia;11.6.2011.;2011-06-11;3f;3;Dysderidae;Parastalita;stygia;Parastalita stygia;570;4 471 694;15 360 985;Tb;deep cave;447 169 415 360 985;6;;;
2376;Budina špilja;Croatia;11.6.2011.;2011-06-11;1m;1;Nesticidae;Nesticus;cellulanus;Nesticus cellulanus;;4 471 694;15 360 985;tf;deep cave;447 169 415 360 985;6;;;
2377;Crna ledenica;Croatia;18.6.2011.;2011-06-18;1f;1;Nesticidae;Kryptonesticus;deelemanae;Kryptonesticus deelemanae;;43 348 162;17 055 328;tb;deep cave;4 334 816 217 055 320;2;;;0,3
2378;Rodi?a špilja;Croatia;25.6.2011.;2011-06-25;1 juv m;1;Dysderidae;Stalita;pretneri;Stalita pretneri;;44 916 872;155 777;TB;deep cave;44 916 872 155 777;4;;;
2379;Pe? u ?ulinovim raljevinama;Croatia;25.6.2011.;2011-06-25;1 juv;1;Dysderidae;Stalagtia;sp. 4;Stalagtia sp. 4;;43 605 854;16 575 066;Tb;deep cave;4 360 585 416 575 060;5;;;11
2380;Horvatova jama;Croatia;1.9.1998.;1998-09-01;1f;1;Tetragnathidae;Meta;menardi;Meta menardi;;45 437 217;14 615 996;Tf;deep cave;4 543 721 714 615 990;1;;;
2381;Škabac;Croatia;17.4.2011.;2011-04-17;4f;4;Linyphiidae;Centromerus;densidentatus sp.n.;Centromerus densidentatus sp.n.;;45 259 902;14 606 487;;;4 525 990 214 606 480;10;;;12
2382;Špilja pod Kapelu;Croatia;29.9.2011.;2011-09-29;1 juv m;1;Agelenidae;Hadites;tegenarioides;Hadites tegenarioides;;43 184 949;16 434 233;TB;deep cave;4 318 494 916 434 230;5;;;11,1
2382;Špilja pod Kapelu;Croatia;29.9.2011.;2011-09-29;1 juv m;1;Agelenidae;Hadites;tegenarioides;Hadites tegenarioides;;43 184 949;16 434 233;TB;deep cave;4 318 494 916 434 230;5;;;14,333
2384;Jama u uvali Vela Golubinka;Croatia;30.9.2011.;2011-09-30;2f, 3m, 6juv;11;Nesticidae;Kryptonesticus;eremita;Kryptonesticus eremita;;43 119 256;16 870 199;;deep cave;4 311 925 616 870 190;1;;;
2385;Špilja pod Kapelu;Croatia;29.9.2011.;2011-09-29;3 juv;3;Agelenidae;Hadites;tegenarioides;Hadites tegenarioides;;43 184 949;16 434 233;TB;deep cave;4 318 494 916 434 230;5;;;11,1
2385;Špilja pod Kapelu;Croatia;29.9.2011.;2011-09-29;3 juv;3;Agelenidae;Hadites;tegenarioides;Hadites tegenarioides;;43 184 949;16 434 233;TB;deep cave;4 318 494 916 434 230;5;;;14,333
2386;Grap?eva špilja;Croatia;30.9.2011.;2011-09-30;3 juv;3;Agelenidae;Hadites;tegenarioides;Hadites tegenarioides;200;43 134 189;16 753 732;TB;deep cave;4 313 418 916 753 730;5;;;11,1
2386;Grap?eva špilja;Croatia;30.9.2011.;2011-09-30;3 juv;3;Agelenidae;Hadites;tegenarioides;Hadites tegenarioides;200;43 134 189;16 753 732;TB;deep cave;4 313 418 916 753 730;5;;;15,35
2387;Pišurka;Croatia;1.10.2007.;2007-10-01;1juv;1;Dysderidae;Folkia;haasi;Folkia haasi;;42 959 451;17 129 228;Tb;deep cave;4 295 945 117 129 220;5;;;13,925
2388;Babina jama, Sv. Rok;Croatia;9.4.2011.;2011-04-09;1m, 2f, 1 juv;4;Linyphiidae;Troglohyphantes;roberti;Troglohyphantes roberti;;44 321 352;15 678 259;tb;deep cave;4 432 135 215 678 250;1;;;
2390;Grap?eva špilja;Croatia;4.4.2005.;2005-04-04;1f, 2 juv;3;Leptonetidae;Barusia;insulana;Barusia insulana;200;43 134 189;16 753 732;tb;deep cave;4 313 418 916 753 730;5;;;11,1
2390;Grap?eva špilja;Croatia;4.4.2005.;2005-04-04;1f, 2 juv;3;Leptonetidae;Barusia;insulana;Barusia insulana;200;43 134 189;16 753 732;tb;deep cave;4 313 418 916 753 730;5;;;15,35
2395;Pe? u ?ulinovim raljevinama;Croatia;4.8.2007.;2007-08-04;1f;1;Dysderidae;Stalagtia;sp. 4;Stalagtia sp. 4;;43 605 854;16 575 066;Tb;deep cave;4 360 585 416 575 060;5;;;11
2396;Drinov?uša;Croatia;;;1m;1;Dysderidae;Stalagtia;sp. 4;Stalagtia sp. 4;793;43 548 476;16 638 636;Tb;deep cave;4 354 847 616 638 630;4;;;
2397;Pe? u ?ulinovim raljevinama;Croatia;4.8.2007.;2007-08-04;2 juv;2;Dysderidae;Stalagtia;sp. 4;Stalagtia sp. 4;;43 605 854;16 575 066;Tb;deep cave;4 360 585 416 575 060;5;;;11
2398;Lokvina špilja;Croatia;7.5.2005.;2005-05-07;1f, 1 juv;2;Dysderidae;Stalagtia;sp. 4;Stalagtia sp. 4;;43 680 442;16 406 697;Tb;deep cave;4 368 044 216 406 690;1;;;
2399;Stražbenica;Croatia;29.3.2005.;2005-03-29;2 juv;2;Dysderidae;Stalagtia;sp. 4;Stalagtia sp. 4;;43 697 353;16 029 618;Tb;deep cave;4 369 735 316 029 610;3;;;14,7
2400;Stara jametina;Croatia;7.1.2005.;2005-01-07;1f, 2 juv;3;Dysderidae;Stalagtia;sp. 4;Stalagtia sp. 4;;43 794 009;1 600 259;Tb;deep cave;437 940 091 600 259;6;;;13
2400;Stara jametina;Croatia;7.1.2005.;2005-01-07;1f, 2 juv;3;Dysderidae;Stalagtia;sp. 4;Stalagtia sp. 4;;43 794 009;1 600 259;Tb;deep cave;437 940 091 600 259;6;;13,4;13,4
2401;Jama na Ka?inama;Croatia;15.7.1999.;1999-07-15;1 juv;1;Dysderidae;Stalagtia;sp. 4;Stalagtia sp. 4;;4 358 848;16 914 982;Tb;deep cave;435 884 816 914 982;1;;;
2403;Rastova?a;Croatia;28.9.2006.;2006-09-28;1m;1;Dysderidae;Parastalita;stygia;Parastalita stygia;380;44 233 742;15 698 969;Tb;deep cave;4 423 374 215 698 960;2;;;
2404;Špilja na Kamenitoj glavici;Croatia;23.3.1997.;1997-03-23;1 juv;1;Dysderidae;Stalita;pretneri;Stalita pretneri;;45 336 025;14 681 765;Tb;deep cave;4 533 602 514 681 760;1;;;
2405;Gornja Cerova?ka špilja;Croatia;4.12.2011.;2011-12-04;1m;1;Dysderidae;Stalita;pretneri;Stalita pretneri;700;44 273 382;15 884 227;Tb;deep cave;4 427 338 215 884 220;2;;;
2406;Topla pe?ina;Croatia;7.1.2005.;2005-01-07;4 juv;4;Dysderidae;Stalagtia;sp. 4;Stalagtia sp. 4;;43 839 254;160 536;Tb;deep cave;43 839 254 160 536;4;;;
2407;Grizeljeva jama;Croatia;8.8.2007.;2007-08-08;3f, 1 juv m, 1 juv;5;Linyphiidae;Troglohyphantes;svilajensis;Troglohyphantes svilajensis;;43 867 534;16 399 097;tb;deep cave;4 386 753 416 399 090;5;;;
2408;Grizeljeva jama;Croatia;8.8.2007.;2007-08-08;2m, 2f;4;Linyphiidae;Troglohyphantes;svilajensis;Troglohyphantes svilajensis;;43 867 534;16 399 097;tb;deep cave;4 386 753 416 399 090;5;;;
2409;Bali?a špilja;Croatia;4.8.2007.;2007-08-04;6f, 3m, 1juv;1;Linyphiidae;Troglohyphantes;giromettai;Troglohyphantes giromettai;405;4 357 296;1 657 002;tf;deep cave;43 572 961 657 002;11;;;7,2
2411;Bali?a špilja;Croatia;15.6.2011.;2011-06-15;1m;1;Linyphiidae;Troglohyphantes;giromettai;Troglohyphantes giromettai;405;4 357 296;1 657 002;tf;deep cave;43 572 961 657 002;11;;;7,2
2412;Bali?a špilja;Croatia;4.8.2007.;2007-08-04;1m;1;Linyphiidae;Troglohyphantes;giromettai;Troglohyphantes giromettai;405;4 357 296;1 657 002;tf;deep cave;43 572 961 657 002;11;;;7,2
2413;Bali?a špilja;Croatia;15.6.2011.;2011-06-15;1m, 1 juv m;2;Linyphiidae;Troglohyphantes;giromettai;Troglohyphantes giromettai;405;4 357 296;1 657 002;tf;deep cave;43 572 961 657 002;11;;;7,2
2414;Bali?a špilja;Croatia;1.10.2006.;2006-10-01;1f;1;Linyphiidae;Troglohyphantes;strandi;Troglohyphantes strandi;405;4 357 296;1 657 002;tb;deep cave;43 572 961 657 002;11;;;7,2
2417;Vranja?a špilja kod Dugopolja;Croatia;1.8.2007.;2007-08-01;1 juv m, 1 juv;2;Linyphiidae;Troglohyphantes;strandi;Troglohyphantes strandi;445;43 562 235;16 648 216;tb;deep cave;4 356 223 516 648 210;5;;;8,7
2418;Vranja?a špilja kod Dugopolja;Croatia;25.6.2011.;2011-06-25;2 juv m;2;Linyphiidae;Troglohyphantes;strandi;Troglohyphantes strandi;445;43 562 235;16 648 216;tb;deep cave;4 356 223 516 648 210;5;;;8,7
2419;Vranja?a špilja kod Dugopolja;Croatia;26.10.2007.;2007-10-26;2 juv;2;Linyphiidae;Troglohyphantes;strandi;Troglohyphantes strandi;445;43 562 235;16 648 216;tb;deep cave;4 356 223 516 648 210;5;;;8,7
2422;Vranja?a špilja kod Dugopolja;Croatia;26.10.2007.;2007-10-26;1f;1;Linyphiidae;Troglohyphantes;strandi;Troglohyphantes strandi;445;43 562 235;16 648 216;tb;deep cave;4 356 223 516 648 210;5;;;8,7
2423;Vranja?a špilja kod Dugopolja;Croatia;26.10.2007.;2007-10-26;1 juv;1;Linyphiidae;Troglohyphantes;strandi;Troglohyphantes strandi;445;43 562 235;16 648 216;tb;deep cave;4 356 223 516 648 210;5;;;8,7
2424;Vranja?a špilja kod Dugopolja;Croatia;22.6.2011.;2011-06-22;1juv f, 2 juv;3;Linyphiidae;Troglohyphantes;strandi;Troglohyphantes strandi;445;43 562 235;16 648 216;tb;deep cave;4 356 223 516 648 210;5;;;8,7
2425;Vranja?a špilja kod Dugopolja;Croatia;24.6.2011.;2011-06-24;1f;1;Linyphiidae;Troglohyphantes;strandi;Troglohyphantes strandi;445;43 562 235;16 648 216;tb;deep cave;4 356 223 516 648 210;5;;;8,7
2426;Makluta?a;Croatia;24.6.2011.;2011-06-24;1m, 1f;2;Linyphiidae;Troglohyphantes;strandi;Troglohyphantes strandi;400;43 569 268;16 620 515;tb;deep cave;4 356 926 816 620 510;6;;;4,8
2426;Makluta?a;Croatia;24.6.2011.;2011-06-24;1m, 1f;2;Linyphiidae;Troglohyphantes;strandi;Troglohyphantes strandi;400;43 569 268;16 620 515;tb;deep cave;4 356 926 816 620 510;6;;;7,7
2427;Makluta?a;Croatia;15.6.2011.;2011-06-15;1m;1;Linyphiidae;Troglohyphantes;giromettai;Troglohyphantes giromettai;400;43 569 268;16 620 515;tf;deep cave;4 356 926 816 620 510;6;;;4,8
2427;Makluta?a;Croatia;15.6.2011.;2011-06-15;1m;1;Linyphiidae;Troglohyphantes;giromettai;Troglohyphantes giromettai;400;43 569 268;16 620 515;tf;deep cave;4 356 926 816 620 510;6;;;7,7
2428;Makluta?a;Croatia;24.6.2011.;2011-06-24;2f, 1m;3;Linyphiidae;Troglohyphantes;strandi;Troglohyphantes strandi;400;43 569 268;16 620 515;tb;deep cave;4 356 926 816 620 510;6;;;4,8
2428;Makluta?a;Croatia;24.6.2011.;2011-06-24;2f, 1m;3;Linyphiidae;Troglohyphantes;strandi;Troglohyphantes strandi;400;43 569 268;16 620 515;tb;deep cave;4 356 926 816 620 510;6;;;7,7
2429;Golubinka, Vu?evica;Croatia;6.8.2007.;2007-08-06;1m, 1f;2;Linyphiidae;Troglohyphantes;strandi;Troglohyphantes strandi;;43 583 491;16 413 783;tb;deep cave;4 358 349 116 413 780;1;;;
2430;Pe? u ?ulinovim raljevinama;Croatia;4.8.2007.;2007-08-04;1m, 2f;3;Linyphiidae;Troglohyphantes;strandi;Troglohyphantes strandi;;43 605 854;16 575 066;tb;deep cave;4 360 585 416 575 060;5;;;11
2431;Pe? u ?ulinovim raljevinama;Croatia;25.6.2011.;2011-06-25;1juv;1;Linyphiidae;Troglohyphantes;strandi;Troglohyphantes strandi;;43 605 854;16 575 066;tb;deep cave;4 360 585 416 575 060;5;;;11
2432;Sniježnica pod Ljubljanom;Croatia;3.8.2007.;2007-08-03;1f;1;Linyphiidae;Troglohyphantes;dalmaticus;Troglohyphantes dalmaticus;;43 537 964;16 616 241;tf;deep cave;4 353 796 416 616 240;1;;;
2433;Špilja iznad Velikog Bresta;Croatia;21.12.2008.;2008-12-21;1m, 1f;2;Linyphiidae;Troglohyphantes;brignolii;Troglohyphantes brignolii;743;45 429 588;14 095 256;tb;deep cave;4 542 958 814 095 250;3;;;
2435;Vranja?a špilja kod Dugopolja;Croatia;1.8.2007.;2007-08-01;2f;2;Linyphiidae;Troglohyphantes;strandi;Troglohyphantes strandi;445;43 562 235;16 648 216;tb;deep cave;4 356 223 516 648 210;5;;;8,7
2436;Golubnja?a, Žegar;Croatia;2.8.2006.;2006-08-02;1f;1;Linyphiidae;Troglohyphantes;roberti;Troglohyphantes roberti;243;44 131 933;15 851 054;tb;deep cave;4 413 193 315 851 050;6;;;
2439;Golubnja?a, Žegar;Croatia;2.8.2006.;2006-08-02;1f;1;Linyphiidae;Troglohyphantes;roberti;Troglohyphantes roberti;243;44 131 933;15 851 054;tb;deep cave;4 413 193 315 851 050;6;;;
2445;Gornja Cerova?ka špilja;Croatia;28.7.2007.;2007-07-28;1 juv m;1;Linyphiidae;Troglohyphantes;roberti;Troglohyphantes roberti;700;4 427 338;1 588 422;tb;deep cave;44 273 381 588 422;5;;;
2446;Zveka?a jama;Croatia;19.2.2010.;2010-02-19;2 juv;2;Dysderidae;Stalagtia;sp. 4;Stalagtia sp. 4;;4 367 716;16 095 044;Tb;deep cave;436 771 616 095 044;1;;;
2447;Zveka?a jama;Croatia;27.10.2010.;2010-10-27;1 juv;1;Dysderidae;Stalagtia;sp. 4;Stalagtia sp. 4;;4 367 716;16 095 044;Tb;deep cave;436 771 616 095 044;1;;;
2448;Zveka?a jama;Croatia;27.10.2010.;2010-10-27;1f;1;Dysderidae;Stalagtia;sp. 4;Stalagtia sp. 4;;4 367 716;16 095 044;Tb;deep cave;436 771 616 095 044;1;;;
2449;Stražbenica;Croatia;29.3.2005.;2005-03-29;3 juv;3;Dysderidae;Stalagtia;sp. 4;Stalagtia sp. 4;;43 697 353;16 029 618;Tb;deep cave;4 369 735 316 029 610;3;;;14,7
2450;Špilja Sv. Filipa i Jakoba;Croatia;5.5.2005.;2005-05-05;1m;1;Dysderidae;Stalagtia;sp. 4;Stalagtia sp. 4;;43 521 135;16 091 237;Tb;deep cave;4 352 113 516 091 230;5;;;
2451;Jama na Grabiku;Croatia;25.11.2007.;2007-11-25;1m;1;Dysderidae;Stalita;hadzii;Stalita hadzii;;45 700 607;15 293 363;Tb;deep cave;4 570 060 715 293 360;1;;;
2452;Jama na vrhu Malog Šibenika;Croatia;19.6.2011.;2011-06-19;1m;1;Agelenidae;Histopona;conveniens;Histopona conveniens;;43 281 102;17 233 483;Tf;deep cave;4 328 110 217 233 480;2;;;
2455;Stražbenica;Croatia;3.5.2009.;2009-05-03;1 juv;1;Dysderidae;Stalagtia;sp. 4;Stalagtia sp. 4;;43 697 353;16 029 618;Tb;deep cave;4 369 735 316 029 610;3;;;14,7
2456;Jeremika;Croatia;14.5.2005.;2005-05-14;2juv;2;Dysderidae;Stalagtia;sp. 4;Stalagtia sp. 4;;4 357 057;1 641 436;Tb;deep cave;43 570 571 641 436;1;;;
2458;Topla pe?ina;Croatia;29.7.2006.;2006-07-29;1m;1;Tetragnathidae;Meta;bourneti;Meta bourneti;;43 839 254;160 536;Tf;deep cave;43 839 254 160 536;4;;;
2459;Velika špilja kod Neori?a;Croatia;31.7.2007.;2007-07-31;1 juv m;1;Agelenidae;Tegenaria;sp.;Tegenaria sp.;703;43 686 117;1 655 312;;deep cave;436 861 171 655 312;2;;;9,5
2461;Rupa u uvali Kozja;Croatia;11.4.2007.;2007-04-11;1f;1;Tetragnathidae;Meta;bourneti;Meta bourneti;;43 117 027;16 971 541;Tf;deep cave;4 311 702 716 971 540;1;;;
2462;Žejava jama;Croatia;23.10.2007.;2007-10-23;1juv f;1;Linyphiidae;Palliduphantes;sp.;Palliduphantes sp.;;43 284 633;16 804 046;;;4 328 463 316 804 040;1;;;
2465;Špilja pod Velji vrh;Croatia;25.4.2004.;2004-04-25;1 juv;1;Linyphiidae;Typhlonyphia;reimoseri;Typhlonyphia reimoseri;;42 953 716;17 039 919;tb;deep cave;4 295 371 617 039 910;2;;;
2467;Jama na Odvoru;Croatia;26.4.2004.;2004-04-26;1 juv;1;Linyphiidae;Typhlonyphia;reimoseri;Typhlonyphia reimoseri;;4 296 718;16 999 758;tb;deep cave;429 671 816 999 758;2;;;
2469;Samograd;Croatia;26.4.2004.;2004-04-26;1f;1;Linyphiidae;Gen.;sp. X;Gen. sp. X;;42 970 451;16 995 978;;;4 297 045 116 995 970;4;;;
2470;Požarova jama;Croatia;25.8.1997.;1997-08-25;1juvm;1;Dysderidae;Stalagtia;sp. 4;Stalagtia sp. 4;;43 058 834;17 560 907;Tb;deep cave;4 305 883 417 560 900;1;;;
2471;Špilja na Zalokavlju;Croatia;17.7.1997.;1997-07-17;1 juv;1;Dysderidae;Stalagtia;sp. 4_1;Stalagtia sp. 4_1;;42 968 227;17 527 103;Tb;deep cave;4 296 822 717 527 100;1;;;
2472;Špilja kod sela Kremena;Croatia;7.1.1998.;1998-01-07;1 juv;1;Dysderidae;Stalagtia;sp. 4_1;Stalagtia sp. 4_1;35;42 972 502;17 500 681;Tb;deep cave;4 297 250 217 500 680;1;;;
2473;Tunel Krotuša;Croatia;24.6.2010.;2010-06-24;1 m;1;Filistatidae;Filistata;insidiatrix;Filistata insidiatrix;;43 083;1 743 399;;;430 831 743 399;1;;;
2474;Jasena ponor;Croatia;4.8.2010.;2010-08-04;1f, 1 juv;2;Linyphiidae;Typhlonyphia;sp. 1;Typhlonyphia sp. 1;;43 221 246;172 767;Tb;deep cave;43 221 246 172 767;2;;;
2475;Pišurka;Croatia;26.12.2009.;2009-12-26;1 juv m;1;Dysderidae;Folkia;haasi;Folkia haasi;;42 959 451;17 129 228;Tb;deep cave;4 295 945 117 129 220;5;;;13,925
2476;Pišurka;Croatia;26.12.2009.;2009-12-26;1 juv;1;Dysderidae;Folkia;haasi;Folkia haasi;;42 959 451;17 129 228;Tb;deep cave;4 295 945 117 129 220;5;;;13,925
2477;Špilja u uvali Predpe?;Croatia;9.7.2007.;2007-07-09;1f;1;Dysderidae;Stalita;taenaria;Stalita taenaria;;45 291 576;14 510 419;Tb;deep cave;4 529 157 614 510 410;4;;10,3;10,625
2478;Nakovana spila;Croatia;25.9.2009.;2009-09-25;1f/juv, 2 juv;3;Dysderidae;Stalagtia;hercegovinensis;Stalagtia hercegovinensis;390;43 005 018;17 091 068;Tb;deep cave;4 300 501 817 091 060;4;;;13,3
2479;Miki?a jama;Croatia;24.1.2010.;2010-01-24;1f;1;Dysderidae;Parastalita;stygia;Parastalita stygia;;45 279 338;1 549 413;Tb;deep cave;452 793 381 549 413;2;;;
2480;Vutla pe?;Croatia;18.5.2009.;2009-05-18;1m, 2 juv;3;Dysderidae;Harpactea;hombergi;Harpactea hombergi;;46 211 188;15 954 292;Tx;deep cave;4 621 118 815 954 290;1;;;
2481;Jama pod Kola?;Croatia;25.4.2004.;2004-04-25;2 juv;2;Dysderidae;Folkia;haasi;Folkia haasi;;42 922 084;17 123 592;Tb;deep cave;4 292 208 417 123 590;1;;;12,9
2482;Ostaševica;Croatia;17.6.2001.;2001-06-17;1f;1;Dysderidae;Folkia;inermis;Folkia inermis;;42 748 959;17 544 404;Tb;deep cave;4 274 895 917 544 400;9;;;11,4
2483;Markova špilja, Hvar;Croatia;6.5.2011.;2011-05-06;5 juv;5;Nesticidae;Kryptonesticus;eremita;Kryptonesticus eremita;;43 190 585;16 402 907;tf;deep cave;4 319 058 516 402 900;8;;;
2485;Živa voda;Croatia;5.5.2011.;2011-05-05;2 juv;2;Nesticidae;Kryptonesticus;eremita;Kryptonesticus eremita;;43 116 808;17 050 393;tf;deep cave;4 311 680 817 050 390;1;;;13,5
2486;Podarjuša;Croatia;5.5.2011.;2011-05-05;1 juv;1;Agelenidae;Hadites;tegenarioides;Hadites tegenarioides;;43 143 173;16 842 272;;deep cave;4 314 317 316 842 270;2;;;
2487;Podarjuša;Croatia;5.5.2011.;2011-05-05;1f;1;Nesticidae;Kryptonesticus;eremita;Kryptonesticus eremita;;43 143 173;16 842 272;;deep cave;4 314 317 316 842 270;2;;;
2488;Grap?eva špilja;Croatia;3.5.2011.;2011-05-03;1 juv;1;Nesticidae;Kryptonesticus;eremita;Kryptonesticus eremita;200;43 134 189;16 753 732;tf;deep cave;4 313 418 916 753 730;5;;;11,1
2488;Grap?eva špilja;Croatia;3.5.2011.;2011-05-03;1 juv;1;Nesticidae;Kryptonesticus;eremita;Kryptonesticus eremita;200;43 134 189;16 753 732;tf;deep cave;4 313 418 916 753 730;5;;;15,35
2493;Grap?eva špilja;Croatia;5.5.2011.;2011-05-05;2 juv;2;Agelenidae;Hadites;tegenarioides;Hadites tegenarioides;200;43 134 189;16 753 732;TB;deep cave;4 313 418 916 753 730;5;;;11,1
2493;Grap?eva špilja;Croatia;5.5.2011.;2011-05-05;2 juv;2;Agelenidae;Hadites;tegenarioides;Hadites tegenarioides;200;43 134 189;16 753 732;TB;deep cave;4 313 418 916 753 730;5;;;15,35
2494;Grap?eva špilja;Croatia;5.5.2011.;2011-05-05;1m, 5 juv;6;Nesticidae;Kryptonesticus;eremita;Kryptonesticus eremita;200;43 134 189;16 753 732;tf;deep cave;4 313 418 916 753 730;5;;;11,1
2494;Grap?eva špilja;Croatia;5.5.2011.;2011-05-05;1m, 5 juv;6;Nesticidae;Kryptonesticus;eremita;Kryptonesticus eremita;200;43 134 189;16 753 732;tf;deep cave;4 313 418 916 753 730;5;;;15,35
2495;Kraljevska jama na Gulišini;Croatia;5.5.2011.;2011-05-05;1f, 1 juv;2;Nesticidae;Kryptonesticus;eremita;Kryptonesticus eremita;;43 133 120;16 744 319;tf;deep cave;4 313 312 016 744 310;3;;;
2497;Markova špilja, Hvar;Croatia;6.5.2011.;2011-05-06;3 juv;3;Nesticidae;Kryptonesticus;eremita;Kryptonesticus eremita;;43 190 585;16 402 907;tf;deep cave;4 319 058 516 402 900;8;;;
2498;Kraljevska jama na Gulišini;Croatia;5.5.2011.;2011-05-05;1f;1;Nesticidae;Kryptonesticus;eremita;Kryptonesticus eremita;;43 133 120;16 744 319;tf;deep cave;4 313 312 016 744 310;3;;;
2500;Grap?eva špilja;Croatia;3.5.2011.;2011-05-03;1f, 1 juv;2;Leptonetidae;Barusia;insulana;Barusia insulana;200;43 134 189;16 753 732;tb;deep cave;4 313 418 916 753 730;5;;;11,1
2500;Grap?eva špilja;Croatia;3.5.2011.;2011-05-03;1f, 1 juv;2;Leptonetidae;Barusia;insulana;Barusia insulana;200;43 134 189;16 753 732;tb;deep cave;4 313 418 916 753 730;5;;;15,35
2502;Grap?eva špilja;Croatia;3.5.2011.;2011-05-03;4 juv;4;Nesticidae;Kryptonesticus;eremita;Kryptonesticus eremita;200;43 134 189;16 753 732;tf;deep cave;4 313 418 916 753 730;5;;;11,1
2502;Grap?eva špilja;Croatia;3.5.2011.;2011-05-03;4 juv;4;Nesticidae;Kryptonesticus;eremita;Kryptonesticus eremita;200;43 134 189;16 753 732;tf;deep cave;4 313 418 916 753 730;5;;;15,35
2503;Podarjuša;Croatia;5.5.2011.;2011-05-05;1 juv;1;Nesticidae;Kryptonesticus;eremita;Kryptonesticus eremita;;43 143 173;16 842 272;;deep cave;4 314 317 316 842 270;2;;;
2504;Podarjuša;Croatia;5.5.2011.;2011-05-05;1 juv;1;Agelenidae;Hadites;tegenarioides;Hadites tegenarioides;;43 143 173;16 842 272;;deep cave;4 314 317 316 842 270;2;;;
2510;Špilja pod Kapelu;Croatia;2.5.2011.;2011-05-02;1 juv;1;Agelenidae;Hadites;tegenarioides;Hadites tegenarioides;;43 184 949;16 434 233;TB;deep cave;4 318 494 916 434 230;5;;;11,1
2510;Špilja pod Kapelu;Croatia;2.5.2011.;2011-05-02;1 juv;1;Agelenidae;Hadites;tegenarioides;Hadites tegenarioides;;43 184 949;16 434 233;TB;deep cave;4 318 494 916 434 230;5;;;14,333
2511;Grap?eva špilja;Croatia;3.5.2011.;2011-05-03;1 juv;1;Nesticidae;Kryptonesticus;eremita;Kryptonesticus eremita;200;43 134 189;16 753 732;tf;deep cave;4 313 418 916 753 730;5;;;11,1
2511;Grap?eva špilja;Croatia;3.5.2011.;2011-05-03;1 juv;1;Nesticidae;Kryptonesticus;eremita;Kryptonesticus eremita;200;43 134 189;16 753 732;tf;deep cave;4 313 418 916 753 730;5;;;15,35
2512;Grap?eva špilja;Croatia;3.5.2011.;2011-05-03;1f;1;Pholcidae;Stygopholcus;absoloni;Stygopholcus absoloni;200;43 134 189;16 753 732;;deep cave;4 313 418 916 753 730;5;;;11,1
2512;Grap?eva špilja;Croatia;3.5.2011.;2011-05-03;1f;1;Pholcidae;Stygopholcus;absoloni;Stygopholcus absoloni;200;43 134 189;16 753 732;;deep cave;4 313 418 916 753 730;5;;;15,35
2513;Špilja u Grli?u;Croatia;3.5.2011.;2011-05-03;1f;1;Pholcidae;Stygopholcus;absoloni;Stygopholcus absoloni;;43 158 023;16 813 636;;deep cave;4 315 802 316 813 630;4;;;17,3
2514;Ružova?a;Croatia;1.3.1998.;1998-03-01;1f;1;Dysderidae;Stalagtia;sp. 4;Stalagtia sp. 4;390;43 229 968;17 417 439;Tb;deep cave;4 322 996 817 417 430;1;;;
2515;Špilja za Groma?kom vlakom;Croatia;25-26.6 2003.;2003-06-25/2003-06-26;1f;1;Dysderidae;Stalagtia;hercegovinensis;Stalagtia hercegovinensis;605;42 743 509;18 027 359;Tb;deep cave;4 274 350 918 027 350;15;;;13,378
2516;Šolkina jama;Croatia;1.12.2009.;2009-12-01;1 juv;1;Dysderidae;Stalagtia;sp. 4_1;Stalagtia sp. 4_1;230;42 966 544;17 662 484;Tb;deep cave;4 296 654 417 662 480;4;;;
2517;Vilina špilja-Izvor Omble;Croatia;22.6.2009.;2009-06-22;1 juv;1;Dysderidae;Stalagtia;sp. 2;Stalagtia sp. 2;;4 267 716;18 136 236;Tb;deep cave;426 771 618 136 236;5;;;
2518;Višti?ina jama;Croatia;16.7.2009.;2009-07-16;1 juv m, 2 juv;3;Dysderidae;Stalagtia;sp. 4_1;Stalagtia sp. 4_1;200;42 985 281;17 557 541;Tb;deep cave;4 298 528 117 557 540;3;;;11
2519;Jama Velika;Croatia;2.12.2009.;2009-12-02;1f;1;Dysderidae;Stalagtia;sp. 4_1;Stalagtia sp. 4_1;;42 971 034;17 655 644;Tb;deep cave;4 297 103 417 655 640;1;;;
2520;Vilina špilja-Izvor Omble;Croatia;11.8.2000.;2000-08-11;5 juv;5;Dysderidae;Stalagtia;sp. 2;Stalagtia sp. 2;137;4 267 716;18 136 236;Tb;deep cave;426 771 618 136 236;5;;;
2523;Ra?a špilja;Croatia;31.10.1999.;1999-10-31;1f, 2 juv;3;Dysderidae;Folkia;sp. 2;Folkia sp. 2;;42 734 493;16 910 785;Tb;deep cave;4 273 449 316 910 780;4;;14,8;14,42
2524;Mala špilja, Blato;Croatia;19.6.2001.;2001-06-19;1m, 1f, 6 juv;8;Dysderidae;Folkia;inermis;Folkia inermis;;42 764 498;17 471 054;Tb;deep cave;4 276 449 817 471 050;5;;;
2525;Mala špilja, Blato;Croatia;19.6.2001.;2001-06-19;1m, 1f, 3 juv;5;Leptonetidae;Sulcia;nocturna;Sulcia nocturna;;42 764 498;17 471 054;;deep cave;4 276 449 817 471 050;5;;;
2526;Jama Jekavica;Croatia;1.3.1998.;1998-03-01;1f;1;Dysderidae;Stalagtia;sp. 4;Stalagtia sp. 4;;43 235 773;17 368 007;Tb;deep cave;4 323 577 317 368 000;2;;;
2527;Jama Jekavica;Croatia;1.3.1998.;1998-03-01;1f;1;Linyphiidae;Palliduphantes;spelaeorum;Palliduphantes spelaeorum;;43 235 773;17 368 007;Tf;deep cave;4 323 577 317 368 000;2;;;
2528;Jama pod Velji vrh;Croatia;14.6.2001.;2001-06-14;1m, 2f, 1juvm, 2juv;6;Dysderidae;Folkia;sp. 2;Folkia sp. 2;;42 766 635;16 907 278;Tb;deep cave;4 276 663 516 907 270;2;;;16,567
2530;Špilja za Groma?kom vlakom;Croatia;29.5.2004.;2004-05-29;1m, 2f, 2juv;5;Dysderidae;Stalagtia;hercegovinensis;Stalagtia hercegovinensis;605;42 743 509;18 027 359;Tb;deep cave;4 274 350 918 027 350;15;;;13,378
2532;Male ponte;Croatia;21.6.2001.;2001-06-21;4 juv;4;Dysderidae;Folkia;sp. 5;Folkia sp. 5;;42 761 389;17 430 786;Tb;deep cave;4 276 138 917 430 780;7;;;14,45
2534;Višti?ina jama;Croatia;8.2.1998.;1998-02-08;2 juv;2;Dysderidae;Stalagtia;sp. 4_1;Stalagtia sp. 4_1;200;42 985 281;17 557 541;Tb;deep cave;4 298 528 117 557 540;3;;;11
2535;Jama u šumi uvale Bjejajka;Croatia;18.6.2011.;2011-06-18;1f, 3 juv m, 1 juv f;5;Linyphiidae;Palliduphantes;sp. 1;Palliduphantes sp. 1;;42 765 231;17 385 606;tf;deep cave;4 276 523 117 385 600;6;;;15,4
2535;Jama u šumi uvale Bjejajka;Croatia;18.6.2011.;2011-06-18;1f, 3 juv m, 1 juv f;5;Linyphiidae;Palliduphantes;sp. 1;Palliduphantes sp. 1;;42 765 231;17 385 606;tf;deep cave;4 276 523 117 385 600;6;;;12,867
2537;Jama u šumi uvale Bjejajka;Croatia;18.6.2011.;2011-06-18;1f;1;Dysderidae;Harpactea;sp. 26;Harpactea sp. 26;;42 765 231;17 385 606;;;4 276 523 117 385 600;6;;;15,4
2537;Jama u šumi uvale Bjejajka;Croatia;18.6.2011.;2011-06-18;1f;1;Dysderidae;Harpactea;sp. 26;Harpactea sp. 26;;42 765 231;17 385 606;;;4 276 523 117 385 600;6;;;12,867
2538;Jama u šumi uvale Bjejajka;Croatia;18.6.2011.;2011-06-18;1m;1;Segestriidae;Segestria;sp. 1;Segestria sp. 1;;42 765 231;17 385 606;;;4 276 523 117 385 600;6;;;15,4
2538;Jama u šumi uvale Bjejajka;Croatia;18.6.2011.;2011-06-18;1m;1;Segestriidae;Segestria;sp. 1;Segestria sp. 1;;42 765 231;17 385 606;;;4 276 523 117 385 600;6;;;12,867
2540;Jama pod Sv. Spasom;Croatia;20.6.2001.;2001-06-20;1f, 1 juv m, 1 juv;3;Linyphiidae;Palliduphantes;sp. 1;Palliduphantes sp. 1;;42 731 779;17 542 409;tf;deep cave;4 273 177 917 542 400;6;;;14,6
2541;Jama pod Sv. Spasom;Croatia;20.6.2001.;2001-06-20;5 juv;5;Dysderidae;Folkia;inermis;Folkia inermis;;42 731 779;17 542 409;Tb;deep cave;4 273 177 917 542 400;6;;;14,6
2542;Velika špilja, Blato;Croatia;19.6.2001.;2001-06-19;1m, 1 juvf, 2juv;4;Leptonetidae;Barusia;maheni;Barusia maheni;;4 276 443;17 471 825;tf;deep cave;427 644 317 471 825;8;;;
2543;Velika špilja, Blato;Croatia;19.6.2001.;2001-06-19;3 juv;3;Dysderidae;Folkia;inermis;Folkia inermis;;4 276 443;17 471 825;Tb;deep cave;427 644 317 471 825;8;;;
2544;Tabaina špilja;Croatia;19.4.2011.;2011-04-19;1 juv;1;Nesticidae;Kryptonesticus;eremita;Kryptonesticus eremita;;42 969 749;1 671 696;;deep cave;429 697 491 671 696;1;;;
2545;Spilja od Bilosoja;Croatia;8.5.2005.;2005-05-08;1 juv;1;Dysderidae;Stalagtia;sp. 4;Stalagtia sp. 4;;43 512 286;16 260 705;Tb;deep cave;4 351 228 616 260 700;1;;;
2546;Špilja u Solinama;Croatia;7.8.1996.;1996-08-07;1 juv;1;Dysderidae;Folkia;sp. 5;Folkia sp. 5;;42 768 021;17 377 062;Tb;deep cave;4 276 802 117 377 060;5;;;10,3
2546;Špilja u Solinama;Croatia;7.8.1996.;1996-08-07;1 juv;1;Dysderidae;Folkia;sp. 5;Folkia sp. 5;;42 768 021;17 377 062;Tb;deep cave;4 276 802 117 377 060;5;;;6,25
2546;Špilja u Solinama;Croatia;7.8.1996.;1996-08-07;1 juv;1;Dysderidae;Folkia;sp. 5;Folkia sp. 5;;42 768 021;17 377 062;Tb;deep cave;4 276 802 117 377 060;5;;;10,3
2547;?a?ina golubinka;Croatia;24.8.1997.;1997-08-24;3 juv;3;Dysderidae;Stalagtia;sp. 4;Stalagtia sp. 4;;4 310 374;17 493 279;Tb;deep cave;431 037 417 493 279;1;;;
2548;Špijaturica;Croatia;5.11.2008.;2008-11-05;1f;1;Leptonetidae;Barusia;maheni;Barusia maheni;;42 835 204;17 806 752;tf;deep cave;4 283 520 417 806 750;3;;;
2552;Jama Tre?a sre?a;Croatia;17.7.2003.;2003-07-17;1 juv;1;Dysderidae;Harpactea;sp.;Harpactea sp.;;4 474 819;15 005 114;;;447 481 915 005 114;1;;;
2556;Velika špilja kod Neori?a;Croatia;31.7.2007.;2007-07-31;1 juvm;1;Dysderidae;Harpactea;sp.;Harpactea sp.;703;43 686 117;1 655 312;;;436 861 171 655 312;2;;;9,5
2557;Pe? u ?ulinovim raljevinama;Croatia;6.1.2009.;2009-01-06;1f;1;Linyphiidae;Centromerus;cavernarum;Centromerus cavernarum;;43 605 854;16 575 066;Tf;deep cave;4 360 585 416 575 060;5;;;11
2558;Židovske jame;Croatia;7.7.2009.;2009-07-07;2f, 1 juv;3;Linyphiidae;Troglohyphantes;excavatus;Troglohyphantes excavatus;;45 997 503;16 038 982;tf;deep cave;4 599 750 316 038 980;2;;;
2563;Balan?ica;Croatia;7.10.2008.;2008-10-07;2f, 1m, 1juv;4;Leptonetidae;Barusia;maheni;Barusia maheni;;42 783 131;17 357 659;tf;deep cave;4 278 313 117 357 650;1;;;
2565;Jama u šumi uvale Bjejajka;Croatia;10.1.2008.;2008-01-10;2m, 1f, 2 juv f;5;Linyphiidae;Palliduphantes;sp. 1;Palliduphantes sp. 1;;42 765 231;17 385 606;tf;deep cave;4 276 523 117 385 600;6;;;15,4
2565;Jama u šumi uvale Bjejajka;Croatia;10.1.2008.;2008-01-10;2m, 1f, 2 juv f;5;Linyphiidae;Palliduphantes;sp. 1;Palliduphantes sp. 1;;42 765 231;17 385 606;tf;deep cave;4 276 523 117 385 600;6;;;12,867
2566;Jama u šumi uvale Bjejajka;Croatia;10.1.2008.;2008-01-10;1f;1;Leptonetidae;Barusia;maheni;Barusia maheni;;42 765 231;17 385 606;tf;deep cave;4 276 523 117 385 600;6;;;15,4
2566;Jama u šumi uvale Bjejajka;Croatia;10.1.2008.;2008-01-10;1f;1;Leptonetidae;Barusia;maheni;Barusia maheni;;42 765 231;17 385 606;tf;deep cave;4 276 523 117 385 600;6;;;12,867
2568;Jama u šumi uvale Bjejajka;Croatia;10.1.2008.;2008-01-10;1f;1;Familia x;Gen.;sp.;Gen. sp.;;42 765 231;17 385 606;;;4 276 523 117 385 600;6;;;15,4
2568;Jama u šumi uvale Bjejajka;Croatia;10.1.2008.;2008-01-10;1f;1;Familia x;Gen.;sp.;Gen. sp.;;42 765 231;17 385 606;;;4 276 523 117 385 600;6;;;12,867
2570;Golubnja?a, Žegar;Croatia;2.8.2006.;2006-08-02;1f;1;Linyphiidae;Centromerus;cavernarum;Centromerus cavernarum;243;44 131 933;15 851 054;Tf;deep cave;4 413 193 315 851 050;6;;;
2571;Jama na Visokoj;Croatia;18.10.2005.;2005-10-18;2 juv;2;Dysderidae;Harpactea;sp.;Harpactea sp.;;4 368 201;16 607 257;;;436 820 116 607 257;3;;;
2573;Špilja za Groma?kom vlakom;Croatia;5.10.2011.;2011-10-05;1 juv;1;Agelenidae;Histopona;sp.;Histopona sp.;605;42 743 509;18 027 359;;deep cave;4 274 350 918 027 350;15;;;13,378
2574;Špilja iznad Velikog Bresta;Croatia;21.12.2008.;2008-12-21;1f;1;Linyphiidae;Centromerus;cavernarum;Centromerus cavernarum;743;45 429 588;14 095 256;Tf;deep cave;4 542 958 814 095 250;3;;;
2575;Bobaj II;Croatia;3.10.2011.;2011-10-03;1f, 2 juv;3;Nesticidae;Kryptonesticus;eremita;Kryptonesticus eremita;;43 035 229;17 600 087;tf;deep cave;4 303 522 917 600 080;3;;;
2576;Bobaj II;Croatia;3.10.2011.;2011-10-03;1f;1;Linyphiidae;Palliduphantes;spelaeorum;Palliduphantes spelaeorum;;43 035 229;17 600 087;Tf;deep cave;4 303 522 917 600 080;3;;;
2577;Vranja?a špilja kod Dugopolja;Croatia;24.6.2011.;2011-06-24;1f;1;Linyphiidae;Palliduphantes;spelaeorum;Palliduphantes spelaeorum;445;43 562 235;16 648 216;Tf;deep cave;4 356 223 516 648 210;5;;;8,7
2578;Špilja u uvali Predpe?;Croatia;9.7.2007.;2007-07-09;1f;1;Nesticidae;Kryptonesticus;eremita;Kryptonesticus eremita;;45 291 576;14 510 419;tf;deep cave;4 529 157 614 510 410;4;;10,3;10,625
2579;Grizeljeva jama;Croatia;30.4.2005.;2005-04-30;2 juv;2;Nesticidae;Kryptonesticus;eremita;Kryptonesticus eremita;;43 867 534;16 399 097;;deep cave;4 386 753 416 399 090;5;;;
2580;Špilja u Solinama;Croatia;8.1.2008.;2008-01-08;2m, 1 f;3;Leptonetidae;Barusia;maheni;Barusia maheni;;42 768 021;17 377 062;tf;deep cave;4 276 802 117 377 060;5;;;10,3
2580;Špilja u Solinama;Croatia;8.1.2008.;2008-01-08;2m, 1 f;3;Leptonetidae;Barusia;maheni;Barusia maheni;;42 768 021;17 377 062;tf;deep cave;4 276 802 117 377 060;5;;;6,25
2580;Špilja u Solinama;Croatia;8.1.2008.;2008-01-08;2m, 1 f;3;Leptonetidae;Barusia;maheni;Barusia maheni;;42 768 021;17 377 062;tf;deep cave;4 276 802 117 377 060;5;;;10,3
2583;Špilja za Groma?kom vlakom;Croatia;5.10.2011.;2011-10-05;1f;1;Agelenidae;Tegenaria;sp. X;Tegenaria sp. X;605;42 743 509;18 027 359;;deep cave;4 274 350 918 027 350;15;;;13,378
2584;Špilja za Groma?kom vlakom;Croatia;5.10.2011.;2011-10-05;1f, 1juv;2;Agelenidae;Histopona;dubia;Histopona dubia;605;42 743 509;18 027 359;tb;deep cave;4 274 350 918 027 350;15;;;13,378
2586;Jama Tu Fifti;Croatia;28.7.2001.;2001-07-28;2f;2;Dysderidae;Gen. 1;sp. 1;Gen. 1 sp. 1;1150;44 445 011;15 246 022;Tb;deep cave;4 444 501 115 246 020;1;;;
2587;Ledenica u Šugarskoj dulibi;Croatia;30.7. 2001.;2001-07-30;1f;1;Dysderidae;Parastalita;stygia;Parastalita stygia;1195;44 451 173;15 248 876;Tb;deep cave;4 445 117 315 248 870;1;;;
2588;Jama pod Bojinim kukom;Croatia;31.8.2001.;2001-08-31;2f;2;Dysderidae;Parastalita;stygia;Parastalita stygia;1100;44 349 579;15 412 948;Tb;deep cave;4 434 957 915 412 940;2;;;
2589;Ljiljanin sistem;Croatia;29.7.2005.;2005-07-29;1m;1;Dysderidae;Parastalita;stygia;Parastalita stygia;1215;44 487 306;15 237 074;Tb;deep cave;4 448 730 615 237 070;2;;;
2590;Ljiljanin sistem;Croatia;29.7.2005.;2005-07-29;1f;1;Dysderidae;Harpactea;sp. 23;Harpactea sp. 23;1215;44 487 306;15 237 074;;;4 448 730 615 237 070;2;;;
2592;Kapljarka;Croatia;8.6.2006.;2006-06-08;1f;1;Leptonetidae;Cataleptoneta;lingulata;Cataleptoneta lingulata;;44 294 555;15 519 648;tb;deep cave;4 429 455 515 519 640;2;;;
2595;Kad jaganjci utihnu;Croatia;5.6.2006.;2006-06-05;1f;1;Leptonetidae;Cataleptoneta;lingulata;Cataleptoneta lingulata;;44 365 085;15 314 841;tb;deep cave;4 436 508 515 314 840;3;;;
2596;Vaganka;Croatia;3.6.2006.;2006-06-03;1f, 1 juv m, 3 juv;5;Leptonetidae;Cataleptoneta;lingulata;Cataleptoneta lingulata;658;4 433 853;1 543 867;tb;deep cave;44 338 531 543 867;5;;;12,2
2597;Hircova jama;Croatia;2.5.2004.;2004-05-02;1 juv;1;Dysderidae;Stalita;pretneri;Stalita pretneri;;45 426 113;14 664 785;Tb;deep cave;4 542 611 314 664 780;3;;;
2598;Lokvarka;Croatia;1.2.2003.;2003-02-01;2 juv;2;Dysderidae;Parastalita;stygia;Parastalita stygia;775;45 361 466;14 762 671;Tb;deep cave;4 536 146 614 762 670;2;;;
2599;Gordanova jama;Croatia;23.4.1995.;1995-04-23;1m;1;Dysderidae;Parastalita;stygia;Parastalita stygia;875;45 455 731;14 792 266;Tb;deep cave;4 545 573 114 792 260;2;;;
2600;Lokvarka;Croatia;17.3.2007.;2007-03-17;1f;1;Dysderidae;Parastalita;stygia;Parastalita stygia;775;45 361 466;14 762 671;Tb;deep cave;4 536 146 614 762 670;2;;;
2601;Jama II kod Velikih Brisnica;Croatia;6.8.2005.;2005-08-06;1f;1;Dysderidae;Parastalita;stygia;Parastalita stygia;520;44 789 027;14 918 377;Tb;deep cave;4 478 902 714 918 370;3;;;
2603;Jama na vrtlu u Biljevini;Croatia;23.9.2005.;2005-09-23;1f;1;Dysderidae;Parastalita;stygia;Parastalita stygia;;44 921 647;15 581 161;Tb;deep cave;4 492 164 715 581 160;2;;;
2604;Velika pe?ina, Plaški;Croatia;29.7.2003.;2003-07-29;1 juv;1;Dysderidae;Parastalita;stygia;Parastalita stygia;;45 013 517;15 407 073;Tb;deep cave;4 501 351 715 407 070;1;;;
2605;Crna?ka špilja;Croatia;7.9.2002.;2002-09-07;1m;1;Dysderidae;Parastalita;stygia;Parastalita stygia;;45 058 563;15 192 941;Tb;deep cave;4 505 856 315 192 940;2;;;
2606;Gordanova jama;Croatia;23.4.2005.;2005-04-23;1 juv;1;Dysderidae;Parastalita;stygia;Parastalita stygia;875;45 455 731;14 792 266;Tb;deep cave;4 545 573 114 792 260;2;;;
2607;Mramornica, Lika;Croatia;30.5.1999.;1999-05-30;1m;1;Dysderidae;Parastalita;stygia;Parastalita stygia;;44 772 186;15 181 912;Tb;deep cave;4 477 218 615 181 910;2;;;
2609;Luška špilja;Croatia;3.7.2004.;2004-07-03;1f;1;Dysderidae;Parastalita;stygia;Parastalita stygia;620;45 224 689;15 093 741;Tb;deep cave;4 522 468 915 093 740;2;;;
2610;Pe?inik;Croatia;2.7.2004.;2004-07-02;1juv;1;Dysderidae;Parastalita;stygia;Parastalita stygia;;4 525 813;15 198 439;Tb;deep cave;452 581 315 198 439;1;;;
2611;Zagorska pe? kod Ogulina;Croatia;1.7.2004.;2004-07-01;1f, 1 juv;2;Dysderidae;Parastalita;stygia;Parastalita stygia;335;45 196 851;15 219 904;Tb;deep cave;4 519 685 115 219 900;3;;;
2612;Gornja Bara?eva;Croatia;15.5.2004.;2004-05-15;2 juv;2;Dysderidae;Stalita;pretneri;Stalita pretneri;;44 983 895;15 721 656;Tb;deep cave;4 498 389 515 721 650;8;;;
2613;Per?evi?a špilja;Croatia;27.8.2004.;2004-08-27;1m;1;Dysderidae;Parastalita;stygia;Parastalita stygia;;45 242 617;15 336 296;Tb;deep cave;4 524 261 715 336 290;3;;;
2614;Zagorska pe? kod Ogulina;Croatia;9.7.2004.;2004-07-09;1m;1;Dysderidae;Parastalita;stygia;Parastalita stygia;335;45 196 851;15 219 904;Tb;deep cave;4 519 685 115 219 900;3;;;
2615;Sopa? špilja;Croatia;25.8.2004.;2004-08-25;1 juv;1;Dysderidae;Parastalita;stygia;Parastalita stygia;;45 048 113;15 408 131;Tb;deep cave;4 504 811 315 408 130;1;;;
2616;Vidovi?a špilja;Croatia;10.7.2004.;2004-07-10;1 juv;1;Dysderidae;Parastalita;stygia;Parastalita stygia;;4 514 975;150 993;Tb;deep cave;4 514 975 150 993;2;;;
2617;Jankovi?a špilja;Croatia;22.7.2004.;2004-07-22;1f, 1 juv;2;Dysderidae;Parastalita;stygia;Parastalita stygia;;44 931 328;15 708 023;Tb;deep cave;4 493 132 815 708 020;1;;;
2618;Obilježena jama;Croatia;20.6.2003.;2003-06-20;1f;1;Theridiidae;Paidiscura;pallens;Paidiscura pallens;;4 336 813;17 026 024;;;433 681 317 026 024;2;;2,5;2,5
2619;Krjava 2;Croatia;27.10.2006.;2006-10-27;1f;1;Anapidae;Comaroma;sp. 1;Comaroma sp. 1;903;43 329 431;17 027 011;tb;deep cave;4 332 943 117 027 010;3;;;7,425
2620;Vodena trepetljika;Croatia;20.6.2003.;2003-06-20;1f;1;Theridiidae;Paidiscura;pallens;Paidiscura pallens;;43 364 147;17 029 715;;;4 336 414 717 029 710;1;;7,7;9,5
2621;Spila 2;Croatia;23.3.2004.;2004-03-23;1m, 1f;2;Mysmenidae;Trogloneta;granulum;Trogloneta granulum;;4 326 239;17 204 021;Tf;deep cave;432 623 917 204 021;6;;12;12
2622;Crna ledenica;Croatia;24.5.2004.;2004-05-24;1m;1;Linyphiidae;Gen. 5;sp. 1;Gen. 5 sp. 1;;43 348 162;17 055 328;;;4 334 816 217 055 320;2;;;0,3
2623;Jama iznad Sarana?a;Croatia;2.4.2006.;2006-04-02;1f;1;Mysmenidae;Trogloneta;granulum;Trogloneta granulum;770;43 249 007;17 174 663;Tf;deep cave;4 324 900 717 174 660;7;;10,8;10,025
2623;Jama iznad Sarana?a;Croatia;2.4.2006.;2006-04-02;1f;1;Mysmenidae;Trogloneta;granulum;Trogloneta granulum;770;43 249 007;17 174 663;Tf;deep cave;4 324 900 717 174 660;7;;;12,2
2625;Svetica;Croatia;22.5.2004.;2004-05-22;1m, 1f;2;Leptonetidae;Barusia;maheni;Barusia maheni;300;43 401 143;16 894 548;tf;deep cave;4 340 114 316 894 540;5;;;
2626;Bazgova?a;Croatia;26.10.2006.;2006-10-26;1f;1;Linyphiidae;Palliduphantes;spelaeorum;Palliduphantes spelaeorum;;4 330 647;16 622 143;Tf;deep cave;433 064 716 622 143;3;;;7,2
2627;Bazgova?a;Croatia;4.8.2004.;2004-08-04;4f, 1 juvm, 1 juv f;6;Linyphiidae;Palliduphantes;spelaeorum;Palliduphantes spelaeorum;;4 330 647;16 622 143;Tf;deep cave;433 064 716 622 143;3;;;7,2
2628;Bazgova?a;Croatia;26.10.2006.;2006-10-26;1f;1;Linyphiidae;Palliduphantes;spelaeorum;Palliduphantes spelaeorum;;4 330 647;16 622 143;Tf;deep cave;433 064 716 622 143;3;;;7,2
2629;Bazgova?a;Croatia;5.1.2009.;2009-01-05;1m, 1 juv f;2;Tetragnathidae;Metellina;merianae;Metellina merianae;;4 330 647;16 622 143;Tf;deep cave;433 064 716 622 143;3;;;7,2
2631;Šipun;Croatia;31.10.2003.;2003-10-31;1 juv;1;Dysderidae;Stalagtia;sp. 1;Stalagtia sp. 1;;42 583 646;18 217 986;Tb;deep cave;4 258 364 618 217 980;11;;;15,4
2632;Pišurka;Croatia;23.4.2004.;2004-04-23;2 juv;2;Dysderidae;Folkia;haasi;Folkia haasi;;42 959 451;17 129 228;Tb;deep cave;4 295 945 117 129 220;5;;;13,925
2633;Pišurka;Croatia;2.6.2000.;2000-06-02;2 juv;2;Dysderidae;Folkia;haasi;Folkia haasi;;42 959 451;17 129 228;Tb;deep cave;4 295 945 117 129 220;5;;;13,925
2634;Pišurka;Croatia;2.6.2000.;2000-06-02;1f, 1 juv f, 1 juv;3;Tetragnathidae;Metellina;merianae;Metellina merianae;;42 959 451;17 129 228;Tf;deep cave;4 295 945 117 129 220;5;;;13,925
2635;?ampari;Croatia;29.11.2008.;2008-11-29;1m;1;Linyphiidae;Troglohyphantes;liburnicus;Troglohyphantes liburnicus;312;45 123 809;14 333 655;Tb;deep cave;4 512 380 914 333 650;4;;;
2636;?ulin ponor-Medvedica;Croatia;1.2.2008.;2008-02-01;1f, 2m;3;Linyphiidae;Porrhomma;convexum;Porrhomma convexum;320;45 267 036;15 223 745;Tf;deep cave;4 526 703 615 223 740;3;;;
2640;Bukovac;Croatia;7.7.2007.;2007-07-07;2f;2;Linyphiidae;Diplocephalus;cristatus;Diplocephalus cristatus;881;4 534 318;14 757 647;Tx;deep cave;453 431 814 757 647;5;;;7,8
2642;Gornja Bara?eva;Croatia;21.7.2002.;2002-07-21;2m, 2f, 2 juv m;6;Linyphiidae;Centromerus;cavernarum;Centromerus cavernarum;;44 983 895;15 721 656;Tf;deep cave;4 498 389 515 721 650;8;;;
2649;Špilja na Gradini kod Premanture;Croatia;13.7.2005.;2005-07-13;? juv;1;Nesticidae;Kryptonesticus;eremita;Kryptonesticus eremita;;44 810 188;139 075;tf;deep cave;44 810 188 139 075;1;;;13,875
2650;Golubnja?a, Bartulovi?i;Croatia;23.3.2003.;2003-03-23;2m;2;Leptonetidae;Sulcia;sp. 3;Sulcia sp. 3;;43 408 559;16 942 035;Tb;deep cave;4 340 855 916 942 030;2;;;
2651;Tu?epska vilenja?a;Croatia;23.5.2004.;2004-05-23;1juv m, 1juv f;2;Linyphiidae;Typhlonyphia;sp. 1;Typhlonyphia sp. 1;1181;43 286 465;17 083 638;Tb;deep cave;4 328 646 517 083 630;8;;;9,967
2651;Tu?epska vilenja?a;Croatia;23.5.2004.;2004-05-23;1juv m, 1juv f;2;Linyphiidae;Typhlonyphia;sp. 1;Typhlonyphia sp. 1;1181;43 286 465;17 083 638;Tb;deep cave;4 328 646 517 083 630;8;;;11,2
2651;Tu?epska vilenja?a;Croatia;23.5.2004.;2004-05-23;1juv m, 1juv f;2;Linyphiidae;Typhlonyphia;sp. 1;Typhlonyphia sp. 1;1181;43 286 465;17 083 638;Tb;deep cave;4 328 646 517 083 630;8;;10,6;11,025
2652;Škrabuljica;Croatia;23.6.2006.;2006-06-23;1f;1;Linyphiidae;Centromerus;subcaecus;Centromerus subcaecus;685;42 567 045;18 385 063;Tf;deep cave;4 256 704 518 385 060;5;;;10,867
2653;Glogova jama;Croatia;24.8.2005.;2005-08-24;1juv m, 1 juv;2;Linyphiidae;Troglohyphantes;lesserti;Troglohyphantes lesserti;;42 573 189;18 361 688;tb;deep cave;4 257 318 918 361 680;1;;;
2656;Jama pod Perova?om;Croatia;5.4.2007.;2007-04-05;1 juv m;1;Dysderidae;Stalagtia;hercegovinensis;Stalagtia hercegovinensis;;42 757 595;17 945 265;Tb;deep cave;4 275 759 517 945 260;1;;;
2657;Jama u Mikulin Dolcu;Croatia;23.4.2004.;2004-04-23;3 juv;3;Dysderidae;Folkia;haasi;Folkia haasi;;42 936 719;17 087 449;Tb;deep cave;4 293 671 917 087 440;1;;;
2658;Rudina;Croatia;9.9.2006.;2006-09-09;2 juv;2;Dysderidae;Stalagtia;hercegovinensis;Stalagtia hercegovinensis;;42 721 999;18 015 321;Tb;deep cave;4 272 199 918 015 320;3;;;
2659;Kaverna u Konavoskom polju;Croatia;26.8.2005.;2005-08-26;3juv;3;Dysderidae;Stalagtia;sp. 1;Stalagtia sp. 1;;4 252 633;183 382;Tb;deep cave;4 252 633 183 382;4;;;
2660;Špilja za Groma?kom vlakom;Croatia;29.3.2003.;2003-03-29;1m, 3 juv;4;Dysderidae;Stalagtia;sp. 5;Stalagtia sp. 5;605;42 743 509;18 027 359;Tb;deep cave;4 274 350 918 027 350;15;;;13,378
2661;Špilja na vrh Toraca;Croatia;8.10.2004.;2004-10-08;1f;1;Dysderidae;Stalagtia;sp. 5;Stalagtia sp. 5;;42 705 575;1 803 049;Tb;deep cave;427 055 751 803 049;3;;15,5;15,275
2662;Škrabuljica;Croatia;1.11.2003.;2003-11-01;1f;1;Dysderidae;Stalagtia;sp. 2;Stalagtia sp. 2;685;42 567 045;18 385 063;Tb;deep cave;4 256 704 518 385 060;5;;;10,867
2663;Špilja za Groma?kom vlakom;Croatia;25.-26.3.2003.;2003-03-25/2003-03-26;1m;1;Dysderidae;Stalagtia;hercegovinensis;Stalagtia hercegovinensis;605;42 743 509;18 027 359;Tb;deep cave;4 274 350 918 027 350;15;;;13,378
2664;Špilja za Groma?kom vlakom;Croatia;25.-26.3.2003.;2003-03-25/2003-03-26;1juv;1;Dysderidae;Stalagtia;hercegovinensis;Stalagtia hercegovinensis;605;42 743 509;18 027 359;Tb;deep cave;4 274 350 918 027 350;15;;;13,378
2665;Jama na Mehovnju;Croatia;24.4.2004.;2004-04-24;1juv;1;Dysderidae;Folkia;haasi;Folkia haasi;;42 935 749;1 706 541;Tb;deep cave;429 357 491 706 541;1;;;
2666;Jama u Dubokom dolu;Croatia;27.4.2004.;2004-04-27;1f, 1juv;2;Dysderidae;Folkia;haasi;Folkia haasi;;42 946 895;17 022 321;Tb;deep cave;4 294 689 517 022 320;3;;;
2667;Jama u Vrisju;Croatia;25.4.2004.;2004-04-25;1juv;1;Dysderidae;Folkia;haasi;Folkia haasi;;42 944 287;17 118 511;Tb;deep cave;4 294 428 717 118 510;2;;;
2668;Jama pod Bilušinim vrhom;Croatia;24.4.2004.;2004-04-24;1juv;1;Dysderidae;Folkia;haasi;Folkia haasi;;4 293 959;1 711 266;Tb;deep cave;42 939 591 711 266;3;;;
2669;Bežurova jama;Croatia;23.8.1997.;1997-08-23;1f, 1 juv;2;Dysderidae;Stalagtia;sp. 4;Stalagtia sp. 4;429;43 064 004;17 559 348;Tb;deep cave;4 306 400 417 559 340;1;;;
2670;Škrabuljica;Croatia;11.3.2003.;2003-03-11;1m;1;Dysderidae;Stalagtia;sp. 2;Stalagtia sp. 2;685;42 567 045;18 385 063;Tb;deep cave;4 256 704 518 385 060;5;;;10,867
2672;Špilja za Groma?kom vlakom;Croatia;29.5.2004.;2004-05-29;1f, 2 juv;3;Dysderidae;Stalagtia;hercegovinensis;Stalagtia hercegovinensis;605;42 743 509;18 027 359;Tb;deep cave;4 274 350 918 027 350;15;;;13,378
2677;Špilja za Groma?kom vlakom;Croatia;29.5.2004.;2004-05-29;1 juv m;1;Dysderidae;Stalagtia;sp. 5;Stalagtia sp. 5;605;42 743 509;18 027 359;Tb;deep cave;4 274 350 918 027 350;15;;;13,378
2678;Vilina špilja, Gruda;Croatia;27.6.2003.;2003-06-27;1f, 2 juv;3;Dysderidae;Stalagtia;sp. 1;Stalagtia sp. 1;205;42 506 621;18 391 346;Tb;deep cave;4 250 662 118 391 340;7;;;
2680;Aragonka;Croatia;9.6.1985.;1985-06-09;1f/juv;1;Dysderidae;Stalagtia;sp. 5;Stalagtia sp. 5;;42 713 284;18 019 397;Tb;deep cave;4 271 328 418 019 390;3;;;
2681;Špilja pod Velji vrh;Croatia;25.4.2004.;2004-04-25;1juv;1;Dysderidae;Folkia;haasi;Folkia haasi;;42 953 716;17 039 919;Tb;deep cave;4 295 371 617 039 910;2;;;
2682;Mo?iljska špilja;Croatia;1.4.2007.;2007-04-01;1 juv;1;Dysderidae;Stalagtia;sp. 5;Stalagtia sp. 5;;42 689 061;18 071 906;Tb;deep cave;4 268 906 118 071 900;6;;15,4;14,7
2683;Vilina špilja, Gruda;Croatia;27.6.2004.;2004-06-27;4juv;4;Dysderidae;Stalagtia;sp. 1;Stalagtia sp. 1;205;42 506 621;18 391 346;Tb;deep cave;4 250 662 118 391 340;7;;;
2684;Debela ljut;Croatia;7.4.2006.;2006-04-07;2 juv;2;Dysderidae;Stalagtia;sp. 5;Stalagtia sp. 5;;42 717 699;18 022 036;Tb;deep cave;4 271 769 918 022 030;8;;15,6;15,6
2685;Debela ljut;Croatia;7.4.2006.;2006-04-07;2 juv;2;Nesticidae;Kryptonesticus;eremita;Kryptonesticus eremita;;42 717 699;18 022 036;tf;deep cave;4 271 769 918 022 030;8;;15,6;15,6
2687;Špilja za Groma?kom vlakom;Croatia;2.11.2003.;2003-11-02;2 juv;2;Dysderidae;Stalagtia;sp. 5;Stalagtia sp. 5;605;42 743 509;18 027 359;Tb;deep cave;4 274 350 918 027 350;15;;;13,378
2688;Ostaševica;Croatia;17.6.2001.;2001-06-17;1 juv;1;Dysderidae;Folkia;inermis;Folkia inermis;;42 748 959;17 544 404;Tb;deep cave;4 274 895 917 544 400;9;;;11,4
2690;Vilina špilja-Izvor Omble;Croatia;7.10.2004.;2004-10-07;1 juv;1;Dysderidae;Stalagtia;sp. 2;Stalagtia sp. 2;137;4 267 716;18 136 236;Tb;deep cave;426 771 618 136 236;5;;;
2691;Vilina špilja-Izvor Omble;Croatia;7.10.2004.;2004-10-07;1f, 1 juv;2;Dysderidae;Stalagtia;sp. 2;Stalagtia sp. 2;137;4 267 716;18 136 236;Tb;deep cave;426 771 618 136 236;5;;;
2692;Jama pod Perova?om;Croatia;5.4.2007.;2007-04-05;1 juv m;1;Dysderidae;Stalagtia;hercegovinensis;Stalagtia hercegovinensis;;42 757 595;17 945 265;Tb;deep cave;4 275 759 517 945 260;1;;;
2693;Gorska jama;Croatia;3.11.2003.;2003-11-03;5 juv;5;Dysderidae;Stalagtia;hercegovinensis;Stalagtia hercegovinensis;200;4 292 697;17 424 809;Tb;deep cave;429 269 717 424 809;2;;10,6;13,3
2696;Špilja za Groma?kom vlakom;Croatia;29.5.2004.;2004-05-29;1f, 2 juv;3;Dysderidae;Stalagtia;hercegovinensis;Stalagtia hercegovinensis;605;42 743 509;18 027 359;Tb;deep cave;4 274 350 918 027 350;15;;;13,378
2698;Mo?iljska špilja;Croatia;8.10.2004.;2004-10-08;3 juv;3;Dysderidae;Stalagtia;sp. 5;Stalagtia sp. 5;;42 689 061;18 071 906;Tb;deep cave;4 268 906 118 071 900;6;;15,4;14,7
2699;Špilja za Groma?kom vlakom;Croatia;25.-26.3.2003.;2003-03-25/2003-03-26;1f;1;Dysderidae;Kaemis;vernalis;Kaemis vernalis;605;42 743 509;18 027 359;Tx;deep cave;4 274 350 918 027 350;15;;;13,378
2700;Špilja za Groma?kom vlakom;Croatia;25.-26.3.2003.;2003-03-25/2003-03-26;4 juv;4;Dysderidae;Stalagtia;hercegovinensis;Stalagtia hercegovinensis;605;42 743 509;18 027 359;Tb;deep cave;4 274 350 918 027 350;15;;;13,378
2701;?urovi?a jama;Croatia;26.3.2004.;2004-03-26;1f/juv raspadnuto;1;Dysderidae;Stalagtia;sp. 1;Stalagtia sp. 1;;42 559 979;18 263 559;Tb;deep cave;4 255 997 918 263 550;4;;;17,267
2702;Špilja za Groma?kom vlakom;Croatia;29.3.2003.;2003-03-29;1 juv;1;Dysderidae;Stalagtia;sp. 5;Stalagtia sp. 5;605;42 743 509;18 027 359;Tb;deep cave;4 274 350 918 027 350;15;;;13,378
2703;Jama u Vrisju;Croatia;25.4.2004.;2004-04-25;1juv;1;Dysderidae;Folkia;haasi;Folkia haasi;;42 944 287;17 118 511;Tb;deep cave;4 294 428 717 118 510;2;;;
2704;Špilja u Solinama;Croatia;18.6.2001.;2001-06-18;1 juv;1;Dysderidae;Folkia;sp. 5;Folkia sp. 5;;42 768 021;17 377 062;Tb;deep cave;4 276 802 117 377 060;5;;;10,3
2704;Špilja u Solinama;Croatia;18.6.2001.;2001-06-18;1 juv;1;Dysderidae;Folkia;sp. 5;Folkia sp. 5;;42 768 021;17 377 062;Tb;deep cave;4 276 802 117 377 060;5;;;6,25
2704;Špilja u Solinama;Croatia;18.6.2001.;2001-06-18;1 juv;1;Dysderidae;Folkia;sp. 5;Folkia sp. 5;;42 768 021;17 377 062;Tb;deep cave;4 276 802 117 377 060;5;;;10,3
2705;Špilja za Groma?kom vlakom;Croatia;29.3.2003.;2003-03-29;1 juv;1;Dysderidae;Stalagtia;sp. 5;Stalagtia sp. 5;605;42 743 509;18 027 359;Tb;deep cave;4 274 350 918 027 350;15;;;13,378
2706;Banova ljut;Croatia;7.9.2006.;2006-09-07;1 juv;1;Nesticidae;Kryptonesticus;eremita;Kryptonesticus eremita;;42 724 023;18 023 649;tf;deep cave;4 272 402 318 023 640;4;;;15,2
2707;Banova ljut;Croatia;7.9.2006.;2006-09-07;2 juv;2;Dysderidae;Stalagtia;sp. 5;Stalagtia sp. 5;;42 724 023;18 023 649;Tb;deep cave;4 272 402 318 023 640;4;;;15,2
2708;Mo?iljska špilja;Croatia;1.4.2007.;2007-04-01;1 juv;1;Dysderidae;Harpactea;sp.;Harpactea sp.;;42 689 061;18 071 906;;;4 268 906 118 071 900;6;;15,4;14,7
2709;Mo?iljska špilja;Croatia;1.4.2007.;2007-04-01;1 juv;1;Dysderidae;Harpactea;sp.;Harpactea sp.;;42 689 061;18 071 906;;;4 268 906 118 071 900;6;;15,4;14,7
2710;Vilinska jama;Croatia;9.6.2000.;2000-06-09;1 juv;1;Dysderidae;Stalagtia;sp. 2;Stalagtia sp. 2;121;42 728 553;17 881 121;Tb;deep cave;4 272 855 317 881 120;10;;;13,6
2711;Rudina;Croatia;9.9.2006.;2006-09-09;1 juv;1;Dysderidae;Stalagtia;hercegovinensis;Stalagtia hercegovinensis;;42 721 999;18 015 321;Tb;deep cave;4 272 199 918 015 320;3;;;
2712;Špilja kod Nerezinog dola;Croatia;21.6.2001.;2001-06-21;1 juv;1;Dysderidae;Folkia;inermis;Folkia inermis;;42 758 378;17 436 094;Tb;deep cave;4 275 837 817 436 090;6;;;15,5
2712;Špilja kod Nerezinog dola;Croatia;21.6.2001.;2001-06-21;1 juv;1;Dysderidae;Folkia;inermis;Folkia inermis;;42 758 378;17 436 094;Tb;deep cave;4 275 837 817 436 090;6;;;12,267
2718;Špilja za Groma?kom vlakom;Croatia;2.11.2003.;2003-11-02;5 juv;5;Dysderidae;Stalagtia;sp. 5;Stalagtia sp. 5;605;42 743 509;18 027 359;Tb;deep cave;4 274 350 918 027 350;15;;;13,378
2719;Špilja u Mikuli?ima;Croatia;18.12.2006.;2006-12-18;1 juv;1;Dysderidae;Stalagtia;sp. 1;Stalagtia sp. 1;;42 477 655;18 414 148;Tb;deep cave;4 247 765 518 414 140;1;;;
2721;Špilja za Groma?kom vlakom;Croatia;29.5.2004.;2004-05-29;1f;1;Dysderidae;Stalagtia;sp. 5;Stalagtia sp. 5;605;42 743 509;18 027 359;Tb;deep cave;4 274 350 918 027 350;15;;;13,378
2723;Špilja za Groma?kom vlakom;Croatia;2.11.2003.;2003-11-02;2 juv;2;Dysderidae;Stalagtia;sp.;Stalagtia sp.;605;42 743 509;18 027 359;;;4 274 350 918 027 350;15;;;13,378
2724;Jama na Odvoru;Croatia;26.4.2004.;2004-04-26;1juv;1;Dysderidae;Folkia;haasi;Folkia haasi;;4 296 718;16 999 758;Tb;deep cave;429 671 816 999 758;2;;;
2727;?urovi?a jama;Croatia;31.10.2003.;2003-10-31;1juv/f;1;Dysderidae;Rhode;sp. 2;Rhode sp. 2;;42 559 979;18 263 559;Tb;deep cave;4 255 997 918 263 550;4;;;17,267
2729;Špilja za Groma?kom vlakom;Croatia;2.11.2003.;2003-11-02;2 juv;2;Dysderidae;Stalagtia;sp. 5;Stalagtia sp. 5;605;42 743 509;18 027 359;;;4 274 350 918 027 350;15;;;13,378
2730;Špilja za Groma?kom vlakom;Croatia;8.9.2006.;2006-09-08;1 juv;1;Dysderidae;Stalagtia;sp.;Stalagtia sp.;605;42 743 509;18 027 359;;;4 274 350 918 027 350;15;;;13,378
2733;Jama pod križem 2;Croatia;3.4.2007.;2007-04-03;1 juv;1;Nesticidae;Kryptonesticus;eremita;Kryptonesticus eremita;;42 712 365;18 019 469;;deep cave;4 271 236 518 019 460;1;;;
2737;Vilinska jama;Croatia;2.4.2007.;2007-04-02;1m;1;Leptonetidae;Barusia;maheni;Barusia maheni;121;42 728 553;17 881 121;tf;deep cave;4 272 855 317 881 120;10;;;13,6
2739;Vilina špilja-Izvor Omble;Croatia;19.3.2012.;2012-03-19;1f;1;Nesticidae;Kryptonesticus;eremita;Kryptonesticus eremita;;4 267 716;18 136 236;tf;deep cave;426 771 618 136 236;5;;;
2744;Špilja za Groma?kom vlakom;Croatia;22.8.2005.;2005-08-22;1 juv;1;Dysderidae;Stalagtia;sp.;Stalagtia sp.;605;42 743 509;18 027 359;;;4 274 350 918 027 350;15;;;13,378
2745;Špilja za Groma?kom vlakom;Croatia;29.5.2004.;2004-05-29;1juv;1;Dysderidae;Stalagtia;sp. 5;Stalagtia sp. 5;605;42 743 509;18 027 359;Tb;deep cave;4 274 350 918 027 350;15;;;13,378
2747;Debela ljut;Croatia;7.4.2006.;2006-04-07;1juv;1;Dysderidae;Stalagtia;sp.;Stalagtia sp.;;42 717 699;18 022 036;;;4 271 769 918 022 030;8;;15,6;15,6
2748;Škrabuljica;Croatia;11.3.2003.;2003-03-11;3f, 2 juv;5;Linyphiidae;Centromerus;subcaecus;Centromerus subcaecus;685;42 567 045;18 385 063;Tf;deep cave;4 256 704 518 385 060;5;;;10,867
2749;Špilja za Groma?kom vlakom;Croatia;2.11.2003.;2003-11-02;1m;1;Linyphiidae;Palliduphantes;sp. 3;Palliduphantes sp. 3;605;42 743 509;18 027 359;;;4 274 350 918 027 350;15;;;13,378
2750;Vilina špilja, Gruda;Croatia;27.6.2004.;2004-06-27;4f, 1 juv;5;Mysmenidae;Trogloneta;granulum;Trogloneta granulum;205;42 506 621;18 391 346;Tf;deep cave;4 250 662 118 391 340;7;;;
2752;Škrabuljica;Croatia;1.11.2003.;2003-11-01;1f, 1juvm, 3 juv;5;Linyphiidae;Centromerus;subcaecus;Centromerus subcaecus;685;42 567 045;18 385 063;Tf;deep cave;4 256 704 518 385 060;5;;;10,867
2753;Jama za Rasohama;Croatia;23.6.2009.;2009-06-23;1m;1;Linyphiidae;Palliduphantes;spelaeorum;Palliduphantes spelaeorum;;42 800 629;17 929 995;Tf;deep cave;4 280 062 917 929 990;2;;;
2754;Jama za Rasohama;Croatia;23.6.2009.;2009-06-23;2f, 1juv m;3;Linyphiidae;Troglohyphantes;hadzii;Troglohyphantes hadzii;;42 800 629;17 929 995;tf;deep cave;4 280 062 917 929 990;2;;;
2756;Vranja?a špilja kod Dugopolja;Croatia;29.4.2012.;2012-04-29;1 juv;1;Dysderidae;Stalagtia;sp. 4;Stalagtia sp. 4;445;43 562 235;16 648 216;Tb;deep cave;4 356 223 516 648 210;5;;;8,7
2757;Balešina jama;Croatia;28.4.2012.;2012-04-28;1f;1;Nesticidae;Kryptonesticus;eremita;Kryptonesticus eremita;310;43 578 743;16 580 621;tf;deep cave;4 357 874 316 580 620;5;;;
2758;Balešina jama;Croatia;28.4.2012.;2012-04-28;2f, 1m;3;Linyphiidae;Palliduphantes;spelaeorum;Palliduphantes spelaeorum;310;43 578 743;16 580 621;Tf;deep cave;4 357 874 316 580 620;5;;;
2759;Balešina jama;Croatia;28.4.2012.;2012-04-28;1f;1;Pholcidae;Stygopholcus;absoloni;Stygopholcus absoloni;310;43 578 743;16 580 621;;deep cave;4 357 874 316 580 620;5;;;
2760;Balešina jama;Croatia;28.4.2012.;2012-04-28;1 juv;1;Dysderidae;Stalagtia;sp. 4;Stalagtia sp. 4;310;43 578 743;16 580 621;Tb;deep cave;4 357 874 316 580 620;5;;;
2761;Bali?a špilja;Croatia;28.4.2012.;2012-04-28;1juv;1;Dysderidae;Rhode;sp. 1;Rhode sp. 1;405;4 357 296;1 657 002;Tb;deep cave;43 572 961 657 002;11;;;7,2
2762;Bali?a špilja;Croatia;28.4.2012.;2012-04-28;1f, 1 juv;2;Linyphiidae;Troglohyphantes;giromettai;Troglohyphantes giromettai;405;4 357 296;1 657 002;tf;deep cave;43 572 961 657 002;11;;;7,2
2763;Žmirina jama;Croatia;29.4.2012.;2012-04-29;1 juv;1;Dysderidae;Stalagtia;sp. 4;Stalagtia sp. 4;;43 570 976;1 659 734;Tb;deep cave;435 709 761 659 734;5;;;
2764;Višti?ina jama;Croatia;16.7.1997.;1997-07-16;2f;2;Linyphiidae;Palliduphantes;spelaeorum;Palliduphantes spelaeorum;;42 985 281;17 557 541;Tf;deep cave;4 298 528 117 557 540;3;;;11
2765;Žmirina jama;Croatia;29.4.2012.;2012-04-29;1f, 1m, 1juv;3;Nesticidae;Kryptonesticus;eremita;Kryptonesticus eremita;;43 570 976;1 659 734;Tf;deep cave;435 709 761 659 734;5;;;
2766;Žmirina jama;Croatia;29.4.2012.;2012-04-29;1m, 1 juv;2;Leptonetidae;Barusia;maheni;Barusia maheni;;43 570 976;1 659 734;tf;deep cave;435 709 761 659 734;5;;;
2767;Žmirina jama;Croatia;29.4.2012.;2012-04-29;1m;1;Tetragnathidae;Metellina;merianae;Metellina merianae;;43 570 976;1 659 734;Tf;deep cave;435 709 761 659 734;5;;;
2770;Žmirina jama;Croatia;29.4.2012.;2012-04-29;1f;1;Linyphiidae;Centromerus;cavernarum;Centromerus cavernarum;;43 570 976;1 659 734;Tf;deep cave;435 709 761 659 734;5;;;
2771;Jujnovi?a špilja;Croatia;1.5.2012.;2012-05-01;1f;1;Linyphiidae;Typhlonyphia;sp. 1;Typhlonyphia sp. 1;405;43 266 579;1 719 798;Tb;deep cave;432 665 791 719 798;6;;;10,35
2771;Jujnovi?a špilja;Croatia;1.5.2012.;2012-05-01;1f;1;Linyphiidae;Typhlonyphia;sp. 1;Typhlonyphia sp. 1;405;43 266 579;1 719 798;Tb;deep cave;432 665 791 719 798;6;;13,8;11,35
2772;Jujnovi?a špilja;Croatia;1.5.2012.;2012-05-01;1f;1;Agelenidae;Histopona;conveniens;Histopona conveniens;405;43 266 579;1 719 798;Tf;deep cave;432 665 791 719 798;6;;;10,35
2772;Jujnovi?a špilja;Croatia;1.5.2012.;2012-05-01;1f;1;Agelenidae;Histopona;conveniens;Histopona conveniens;405;43 266 579;1 719 798;Tf;deep cave;432 665 791 719 798;6;;13,8;11,35
2773;Jujnovi?a špilja;Croatia;1.5.2012.;2012-05-01;1f;1;Pholcidae;Stygopholcus;absoloni;Stygopholcus absoloni;405;43 266 579;1 719 798;;deep cave;432 665 791 719 798;6;;;10,35
2773;Jujnovi?a špilja;Croatia;1.5.2012.;2012-05-01;1f;1;Pholcidae;Stygopholcus;absoloni;Stygopholcus absoloni;405;43 266 579;1 719 798;;deep cave;432 665 791 719 798;6;;13,8;11,35
2774;Jujnovi?a špilja;Croatia;1.5.2012.;2012-05-01;1f, 1m, 1 juv;3;Agelenidae;Histopona;conveniens;Histopona conveniens;405;43 266 579;1 719 798;Tf;deep cave;432 665 791 719 798;6;;;10,35
2774;Jujnovi?a špilja;Croatia;1.5.2012.;2012-05-01;1f, 1m, 1 juv;3;Agelenidae;Histopona;conveniens;Histopona conveniens;405;43 266 579;1 719 798;Tf;deep cave;432 665 791 719 798;6;;13,8;11,35
2775;Jujnovi?a špilja;Croatia;1.5.2012.;2012-05-01;1m;1;Linyphiidae;Typhlonyphia;sp. 1;Typhlonyphia sp. 1;405;43 266 579;1 719 798;Tb;deep cave;432 665 791 719 798;6;;;10,35
2775;Jujnovi?a špilja;Croatia;1.5.2012.;2012-05-01;1m;1;Linyphiidae;Typhlonyphia;sp. 1;Typhlonyphia sp. 1;405;43 266 579;1 719 798;Tb;deep cave;432 665 791 719 798;6;;13,8;11,35
2776;Jama V=13;Croatia;20.11.2011.;2011-11-20;1m;1;Pholcidae;Stygopholcus;skotophilus;Stygopholcus skotophilus;;42 574;18 352;;deep cave;4 257 418 352;1;;;
2777;Jezero;Croatia;16.3.2002.;2002-03-16;1f, 5 juv;6;Nesticidae;Kryptonesticus;arenstorffi;Kryptonesticus arenstorffi;903;42 580 381;18 356 073;tb;deep cave;4 258 038 118 356 070;8;;;7,567
2779;Škrabuljica;Croatia;7.11.2003.;2003-11-07;1f, 2 juv;3;Linyphiidae;Centromerus;subcaecus;Centromerus subcaecus;685;42 567 045;18 385 063;Tf;deep cave;4 256 704 518 385 060;5;;;10,867
2783;Šimunkovi?a špilja;Croatia;6.4.2007.;2007-04-06;1f;1;Leptonetidae;Barusia;korculana;Barusia korculana;50;42 978 588;17 129 081;tb;deep cave;4 297 858 817 129 080;7;;;15
2786;Vilina špilja-Izvor Omble;Croatia;5.5.2012.;2012-05-05;1f;1;Nesticidae;Kryptonesticus;eremita;Kryptonesticus eremita;;4 267 716;18 136 236;tf;deep cave;426 771 618 136 236;5;;;
2787;Vilina špilja-Izvor Omble;Croatia;5.5.2012.;2012-05-05;1 juv;1;Agelenidae;Histopona;sp.;Histopona sp.;;4 267 716;18 136 236;;deep cave;426 771 618 136 236;5;;;
2788;Vilina špilja-Izvor Omble;Croatia;5.5.2012.;2012-05-05;1f;1;Nesticidae;Kryptonesticus;eremita;Kryptonesticus eremita;;4 267 716;18 136 236;tf;deep cave;426 771 618 136 236;5;;;
2789;Vilina špilja-Izvor Omble;Croatia;5.5.2012.;2012-05-05;1juv , 1 juv;2;Nesticidae;Kryptonesticus;eremita;Kryptonesticus eremita;;4 267 716;18 136 236;tf;deep cave;426 771 618 136 236;5;;;
2790;Vilina špilja-Izvor Omble;Croatia;5.5.2012.;2012-05-05;1 juvm;1;Dysderidae;Stalagtia;sp. 2;Stalagtia sp. 2;;4 267 716;18 136 236;Tb;deep cave;426 771 618 136 236;5;;;
2791;Vilina špilja-Izvor Omble;Croatia;6.5.2012.;2012-05-06;2f, 1 juv;3;Agelenidae;Histopona;dubia;Histopona dubia;;4 267 716;18 136 236;tb;deep cave;426 771 618 136 236;5;;;
2792;Vilina špilja-Izvor Omble;Croatia;6.5.2012.;2012-05-06;2 juv m, 3f, 1 juv;6;Dysderidae;Stalagtia;sp. 2;Stalagtia sp. 2;;4 267 716;18 136 236;Tb;deep cave;426 771 618 136 236;5;;;
2793;Vilina špilja-Izvor Omble;Croatia;6.5.2012.;2012-05-06;1m, 1f, 3 juv m, 4 juv;9;Leptonetidae;Sulcia;sp. 2;Sulcia sp. 2;;4 267 716;18 136 236;Tb;deep cave;426 771 618 136 236;5;;;
2794;Vilina špilja-Izvor Omble;Croatia;6.5.2012.;2012-05-06;1 juv;1;Dysderidae;Stalagtia;sp. 2;Stalagtia sp. 2;;4 267 716;18 136 236;Tb;deep cave;426 771 618 136 236;5;;;
2795;Vilina špilja-Izvor Omble;Croatia;17.6.2012.;2012-06-17;1f, 1 juv;2;Dysderidae;Stalagtia;sp. 2;Stalagtia sp. 2;;4 267 716;18 136 236;Tb;deep cave;426 771 618 136 236;5;;;
2796;Vilina špilja-Izvor Omble;Croatia;16.6.2012.;2012-06-16;1 juv;1;Dysderidae;Stalagtia;sp. 2;Stalagtia sp. 2;;4 267 716;18 136 236;Tb;deep cave;426 771 618 136 236;5;;;
2797;Vilina špilja-Izvor Omble;Croatia;17.6.2012.;2012-06-17;2 juv;2;Dysderidae;Stalagtia;sp. 2;Stalagtia sp. 2;;4 267 716;18 136 236;Tb;deep cave;426 771 618 136 236;5;;;
2798;Vilina špilja-Izvor Omble;Croatia;16.6.2012.;2012-06-16;1 juv;1;Dysderidae;Stalagtia;sp. 2;Stalagtia sp. 2;;4 267 716;18 136 236;Tb;deep cave;426 771 618 136 236;5;;;
2799;Vilina špilja-Izvor Omble;Croatia;17.6.2012.;2012-06-17;2 juv;2;Dysderidae;Stalagtia;sp. 2;Stalagtia sp. 2;;4 267 716;18 136 236;Tb;deep cave;426 771 618 136 236;5;;;
2800;Vilina špilja-Izvor Omble;Croatia;17.6.2012.;2012-06-17;6 juv;6;Dysderidae;Stalagtia;sp. 2;Stalagtia sp. 2;;4 267 716;18 136 236;Tb;deep cave;426 771 618 136 236;5;;;
2801;Vilina špilja-Izvor Omble;Croatia;17.6.2012.;2012-06-17;1f;1;Agelenidae;Histopona;dubia;Histopona dubia;;4 267 716;18 136 236;tb;deep cave;426 771 618 136 236;5;;;
2802;Vilina špilja-Izvor Omble;Croatia;17.6.2012.;2012-06-17;1f;1;Agelenidae;Histopona;dubia;Histopona dubia;;4 267 716;18 136 236;tb;deep cave;426 771 618 136 236;5;;;
2803;Vilina špilja-Izvor Omble;Croatia;17.6.2012.;2012-06-17;1 juv;1;Agelenidae;Histopona;dubia;Histopona dubia;;4 267 716;18 136 236;tb;deep cave;426 771 618 136 236;5;;;
2804;Vilina špilja-Izvor Omble;Croatia;17.6.2012.;2012-06-17;1f, 8 juv;9;Agelenidae;Histopona;dubia;Histopona dubia;;4 267 716;18 136 236;tb;deep cave;426 771 618 136 236;5;;;
2805;Vilina špilja-Izvor Omble;Croatia;17.6.2012.;2012-06-17;2f, 2 m;4;Leptonetidae;Sulcia;sp. 2;Sulcia sp. 2;;4 267 716;18 136 236;Tb;deep cave;426 771 618 136 236;5;;;
2806;Vilina špilja-Izvor Omble;Croatia;17.6.2012.;2012-06-17;1m;1;Leptonetidae;Sulcia;sp. 2;Sulcia sp. 2;;4 267 716;18 136 236;Tb;deep cave;426 771 618 136 236;5;;;
2807;Vilina špilja-Izvor Omble;Croatia;16.6.2012.;2012-06-16;1f, 1 juv m, 2 juv;4;Nesticidae;Kryptonesticus;eremita;Kryptonesticus eremita;;4 267 716;18 136 236;tf;deep cave;426 771 618 136 236;5;;;
2808;Vilina špilja-Izvor Omble;Croatia;17.6.2012.;2012-06-17;1f, 2 juv;3;Nesticidae;Kryptonesticus;eremita;Kryptonesticus eremita;;4 267 716;18 136 236;tf;deep cave;426 771 618 136 236;5;;;
2810;Zidane pe?ine;Croatia;28.2.2010.;2010-02-28;2f, 2m;4;Linyphiidae;Porrhomma;convexum;Porrhomma convexum;400;45 738 992;15 497 143;;deep cave;4 573 899 215 497 140;7;;;
2811;Vugrinova špilja;Croatia;7.7.2009.;2009-07-07;2f;2;Linyphiidae;Porrhomma;egeria;Porrhomma egeria;310;4 577 395;1 570 102;;deep cave;45 773 951 570 102;7;;;
2841;Veternica;Croatia;13.1.2010.;2010-01-13;1 m;1;Linyphiidae;Porrhomma;convexum;Porrhomma convexum;330;45 841 058;15 873 642;;deep cave;4 584 105 815 873 640;6;;;
2866;Gajina pe?;Croatia;13.6.2009.;2009-06-13;1 juv;1;Dysderidae;Stalita;pretneri;Stalita pretneri;535;44 956 397;15 064 298;Tb;deep cave;4 495 639 715 064 290;1;;;
2869;Sini?i? špilja;Croatia;7.10.2006.;2006-10-07;2m, 2f, 2 juv m;6;Linyphiidae;Porrhomma;convexum;Porrhomma convexum;;44 990 698;15 177 848;;deep cave;4 499 069 815 177 840;6;;;
2876;Vrta?a kod špilje Kame Hame;Croatia;24.6.2006.;2006-06-24;1f;1;Linyphiidae;Micrargus;apertus;Micrargus apertus;;45 551 639;14 518 065;;;4 555 163 914 518 060;2;;;
2881;Biserujka;Croatia;8.4.2012.;2012-04-08;1f;1;Nesticidae;Kryptonesticus;eremita;Kryptonesticus eremita;;45 187 464;1 460 981;tf;deep cave;451 874 641 460 981;1;;;14,8
2885;?ampari;Croatia;7.4.2012.;2012-04-07;2f;2;Nesticidae;Kryptonesticus;eremita;Kryptonesticus eremita;312;45 123 809;14 333 655;tf;deep cave;4 512 380 914 333 650;4;;;
2886;Medova buža;Croatia;23.5.2010.;2010-05-23;1m, 2 juv;3;Nesticidae;Kryptonesticus;eremita;Kryptonesticus eremita;;44 813 345;14 745 867;;deep cave;4 481 334 514 745 860;1;;;14,9
2888;Pliškovi?eva jama;Croatia;19.2.2007.;2007-02-19;3f, 2m, 3 juv;8;Linyphiidae;Porrhomma;convexum;Porrhomma convexum;;45 071 604;13 872 151;;deep cave;4 507 160 413 872 150;4;;;
2890;Markova jama kod Tara;Croatia;3.1999.;1999-03;1f, 3 juv;4;Nesticidae;Kryptonesticus;eremita;Kryptonesticus eremita;95;45 319 298;13 631 373;tf;deep cave;4 531 929 813 631 370;7;;;
2898;Kraljicina špilja;Croatia;19.10.2007.;2007-10-19;1 juv;1;Nesticidae;Kryptonesticus;eremita;Kryptonesticus eremita;;43 073 661;16 100 773;tf;deep cave;4 307 366 116 100 770;2;;;15,1
2901;Špilja pod Kapelu;Croatia;13.4.2003.;2003-04-13;1 juv f, 3 juv;4;Linyphiidae;Palliduphantes;sp.;Palliduphantes sp.;;43 184 949;16 434 233;;;4 318 494 916 434 230;5;;;11,1
2901;Špilja pod Kapelu;Croatia;13.4.2003.;2003-04-13;1 juv f, 3 juv;4;Linyphiidae;Palliduphantes;sp.;Palliduphantes sp.;;43 184 949;16 434 233;;;4 318 494 916 434 230;5;;;14,333
2906;Tanki Ratac;Croatia;21.10.2007.;2007-10-21;1 juv;1;Nesticidae;Kryptonesticus;eremita;Kryptonesticus eremita;;43 360 229;16 569 356;tf;deep cave;4 336 022 916 569 350;3;;;16,6
2916;Pišurka;Croatia;18.4.2011.;2011-04-18;1 juv m, 3 juv;4;Nesticidae;Kryptonesticus;eremita;Kryptonesticus eremita;;42 959 451;17 129 228;;deep cave;4 295 945 117 129 220;5;;;13,925
2922;Golubnja?a, Žegar;Croatia;2.8.2006.;2006-08-02;3f;3;Linyphiidae;Micrargus;herbigradus;Micrargus herbigradus;243;44 131 933;15 851 054;Tf;deep cave;4 413 193 315 851 050;6;;;
2923;Uviraljka;Croatia;6.11.2004.;2004-11-06;1f;1;Linyphiidae;Porrhomma;egeria;Porrhomma egeria;810;45 522 243;1 762 067;;deep cave;455 222 431 762 067;3;;;
2924;Rogovac;Croatia;11.12.2004.;2004-12-11;1f;1;Linyphiidae;Gen. 4;sp.;Gen. 4 sp.;;45 674 185;15 444 223;;;4 567 418 515 444 220;3;;;
2925;Rogovac;Croatia;11.12.2004.;2004-12-11;1f;1;Linyphiidae;Gen.;sp. X;Gen. sp. X;;45 674 185;15 444 223;;;4 567 418 515 444 220;3;;;
2926;Rogovac;Croatia;11.12.2004.;2004-12-11;2f, 1 prosoma (f?);2;Linyphiidae;Porrhomma;convexum;Porrhomma convexum;;45 674 185;15 444 223;;deep cave;4 567 418 515 444 220;3;;;
2927;Bedara;Croatia;18.10.2003.;2003-10-18;1f;1;Linyphiidae;Porrhomma;egeria;Porrhomma egeria;620;45 751 922;15 536 692;;deep cave;4 575 192 215 536 690;4;;;
2928;Batinova jama;Croatia;23.1.2004.;2004-01-23;3f, 1m, 2 juv;6;Linyphiidae;Porrhomma;egeria;Porrhomma egeria;450;45 845 957;15 868 496;;deep cave;4 584 595 715 868 490;2;;;
2929;Jama na Ostrisnjaku;Croatia;27.10.2002.;2002-10-27;1m;1;Linyphiidae;Porrhomma;egeria;Porrhomma egeria;;45.77;15.45;;deep cave;45.7715.45;1;;;
2931;Kus;Croatia;21.12.2003.;2003-12-21;3m, 1f, 2 juv;6;Linyphiidae;Micrargus;herbigradus;Micrargus herbigradus;;44 814 755;14 426 275;Tf;deep cave;4 481 475 514 426 270;2;;;
2932;Jelovec jama;Croatia;16.10.2006.;2006-10-16;1f;1;Linyphiidae;Porrhomma;egeria;Porrhomma egeria;525;46 276 775;15 992 573;;deep cave;4 627 677 515 992 570;1;;;
2933;Jama Staja;Croatia;14.8.2001.;2001-08-14;2f, 2 juv;4;Linyphiidae;Porrhomma;convexum;Porrhomma convexum;;44 919 862;13 938 147;;deep cave;4 491 986 213 938 140;4;;;
2934;Ponor Bele vode;Croatia;12.7.2005.;2005-07-12;2f;2;Linyphiidae;Porrhomma;sp. x;Porrhomma sp. x;;45 418 527;14 693 695;;;4 541 852 714 693 690;3;;;
2935;Francuski rudnik 3;Croatia;24.11.2004.;2004-11-24;1f;1;Linyphiidae;Porrhomma;convexum;Porrhomma convexum;;45 905 584;15 940 186;;deep cave;4 590 558 415 940 180;2;;;
2936;Velebita- Dva javora;Croatia;15.8.2007.;2007-08-15;1f;1;Linyphiidae;Porrhomma;egeria;Porrhomma egeria;1560;44 757 596;1 498 636;;deep cave;447 575 961 498 636;2;;;
2937;Dola?a;Croatia;7.3.2010.;2010-03-07;1m;1;Linyphiidae;Porrhomma;convexum;Porrhomma convexum;;45 739 571;15 482 755;;deep cave;4 573 957 115 482 750;5;;;
2938;Francuski rudnik 3;Croatia;16.4.2005.;2005-04-16;1f;1;Linyphiidae;Porrhomma;convexum;Porrhomma convexum;;45 905 584;15 940 186;;deep cave;4 590 558 415 940 180;2;;;
2939;Vari?akova špilja;Croatia;8.2002.;2002-08;1f;1;Linyphiidae;Porrhomma;convexum;Porrhomma convexum;;45 008 251;15 736 981;;deep cave;4 500 825 115 736 980;5;;;
2940;Bedara;Croatia;28.4.2002.;2002-04-28;3f;3;Linyphiidae;Porrhomma;egeria;Porrhomma egeria;620;45 751 922;15 536 692;;deep cave;4 575 192 215 536 690;4;;;
2941;Sini?i? špilja;Croatia;3.1.2010.;2010-01-03;2f, 1m, 2 juv;5;Linyphiidae;Porrhomma;convexum;Porrhomma convexum;;44 990 698;15 177 848;;deep cave;4 499 069 815 177 840;6;;;
2942;Zagorska pe? kod Ogulina;Croatia;17.6.2006.;2006-06-17;1m;1;Linyphiidae;Porrhomma;egeria;Porrhomma egeria;335;45 196 851;15 219 904;;deep cave;4 519 685 115 219 900;3;;;
2943;Velika špilja kod Goranca;Croatia;15.10.2006.;2006-10-15;1f;1;Linyphiidae;Porrhomma;convexum;Porrhomma convexum;;46 284 655;16 032 361;;deep cave;4 628 465 516 032 360;5;;;
2944;Jama iznad lova?og doma;Croatia;17.6.2006.;2006-06-17;3m, 2f, 1 prosoma (f?);5;Linyphiidae;Porrhomma;egeria;Porrhomma egeria;400;45.19;15.22;;deep cave;45.1915.22;1;;;
2945;Pušina;Croatia;20.4.2008.;2008-04-20;3f;3;Linyphiidae;Porrhomma;egeria;Porrhomma egeria;724;45 740 585;1 535 653;;deep cave;457 405 851 535 653;4;;;8,3
2946;Špilja iznad Crnog vrela;Croatia;30.6.2004.;2004-06-30;1m;1;Linyphiidae;Porrhomma;microps;Porrhomma microps;;45.16;15.08;Tf;deep cave;45.1615.08;1;;;
2947;Sini?i? špilja;Croatia;11.8.2007.;2007-08-11;4m, 3f;7;Linyphiidae;Porrhomma;convexum;Porrhomma convexum;;44 990 698;15 177 848;;deep cave;4 499 069 815 177 840;6;;;
2948;Jama iznad lova?og doma;Croatia;17.6.2006.;2006-06-17;2m, 1f;3;Linyphiidae;Porrhomma;egeria;Porrhomma egeria;400;45.19;15.22;;deep cave;45.1915.22;1;;;
2949;Bibi?ka špilja;Croatia;10.9.2000.;2000-09-10;1m;1;Linyphiidae;Porrhomma;egeria;Porrhomma egeria;200;45 335 921;15 254 079;;deep cave;4 533 592 115 254 070;3;;;
2950;Vukovi?a špilja;Croatia;10.5.2003.;2003-05-10;1f;1;Linyphiidae;Porrhomma;convexum;Porrhomma convexum;;45 121 909;15 659 938;;deep cave;4 512 190 915 659 930;2;;;
2951;Bedara;Croatia;20.12.2003.;2003-12-20;1f, 1m, 2 juv;4;Linyphiidae;Porrhomma;egeria;Porrhomma egeria;620;45 751 922;15 536 692;;deep cave;4 575 192 215 536 690;4;;;
2952;Ambarac;Croatia;11.6.2005.;2005-06-11;1f;1;Linyphiidae;Porrhomma;convexum;Porrhomma convexum;;45 231 783;15 306 426;;deep cave;4 523 178 315 306 420;1;;;
2953;Velika špilja kod Goranca;Croatia;15.10.2006.;2006-10-15;1f;1;Linyphiidae;Porrhomma;convexum;Porrhomma convexum;;46 284 655;16 032 361;;deep cave;4 628 465 516 032 360;5;;;
2954;?ulin ponor-Medvedica;Croatia;1.2.2004.;2004-02-01;1f, 1m;2;Linyphiidae;Porrhomma;convexum;Porrhomma convexum;320;45 267 036;15 223 745;Tf;deep cave;4 526 703 615 223 740;3;;;
2955;Sini?i? špilja;Croatia;29.6.2004.;2004-06-29;2f, 1m;3;Linyphiidae;Porrhomma;convexum;Porrhomma convexum;;44 990 698;15 177 848;;deep cave;4 499 069 815 177 840;6;;;
2956;Kapaljka 1;Croatia;1.6.1997.;1997-06-01;1m;1;Linyphiidae;Gen.;sp. X;Gen. sp. X;;45 459 187;14 675 404;;;4 545 918 714 675 400;2;;;
2957;Vukovi?a špilja;Croatia;5.5.2002.;2002-05-05;1m, 1 juv;2;Linyphiidae;Porrhomma;convexum;Porrhomma convexum;;45 121 909;15 659 938;;deep cave;4 512 190 915 659 930;2;;;
2958;Velika špilja kod Goranca;Croatia;14.5.2006.;2006-05-14;1f;1;Linyphiidae;Porrhomma;convexum;Porrhomma convexum;;46 284 655;16 032 361;;deep cave;4 628 465 516 032 360;5;;;
2959;Rudnik Zrinski;Croatia;16.4.2004.;2004-04-16;1f, 2 juv;3;Linyphiidae;Porrhomma;microps;Porrhomma microps;804;45 887 195;15 927 871;Tf;deep cave;4 588 719 515 927 870;9;;;
2960;Gojkova draga;Croatia;15.9.1998.;1998-09-15;1m;1;Linyphiidae;Porrhomma;egeria;Porrhomma egeria;600;45 779 634;15 516 718;;deep cave;4 577 963 415 516 710;1;;;
2962;Rudnik Zrinski;Croatia;16.6.2004.;2004-06-16;1f;1;Linyphiidae;Porrhomma;sp. 1;Porrhomma sp. 1;804;45 887 195;15 927 871;;;4 588 719 515 927 870;9;;;
2963;Hircova jama;Croatia;2.5.2004.;2004-05-02;1f;1;Linyphiidae;Porrhomma;convexum;Porrhomma convexum;;45 426 113;14 664 785;;deep cave;4 542 611 314 664 780;3;;;
2964;Ponor Bele vode;Croatia;12.7.2004.;2004-07-12;1m, 1f, 3 juv;5;Linyphiidae;Porrhomma;convexum;Porrhomma convexum;;45 418 527;14 693 695;;deep cave;4 541 852 714 693 690;3;;;
2965;Mrgi?a ponor;Croatia;9.1.1999.;1999-01-09;2f, 2m;4;Linyphiidae;Porrhomma;convexum;Porrhomma convexum;;45 268 189;15 469 236;;deep cave;4 526 818 915 469 230;10;;;
2966;izvor kod Crvenog križa;Croatia;21.5.2005.;2005-05-21;1m;1;Linyphiidae;Porrhomma;convexum;Porrhomma convexum;;45 856 759;15 879 739;;deep cave;4 585 675 915 879 730;1;;;
2967;Vrelo Jambrišak;Croatia;21.5.2005.;2005-05-21;1m;1;Linyphiidae;Porrhomma;convexum;Porrhomma convexum;;45 857 115;15 880 144;;deep cave;4 585 711 515 880 140;1;;;
2968;Jama Jamura;Croatia;15.9.2002.;2002-09-15;6f, 2 juv;8;Linyphiidae;Porrhomma;convexum;Porrhomma convexum;;45 754 062;15 489 269;;deep cave;4 575 406 215 489 260;2;;;
2970;Cinkalica 3;Croatia;14.5.2006.;2006-05-14;1f;1;Linyphiidae;Porrhomma;egeria;Porrhomma egeria;405;4 627 707;16 041 044;;deep cave;462 770 716 041 044;2;;;
2971;Ponor Vele vode;Croatia;12.7.2005.;2005-07-12;1f, 4 juv;5;Linyphiidae;Porrhomma;convexum;Porrhomma convexum;;45 418 527;14 693 695;;deep cave;4 541 852 714 693 690;3;;;
2972;Dvoga?a;Croatia;16.5.2006.;2006-05-16;1m;1;Linyphiidae;Porrhomma;microps;Porrhomma microps;450;45 850 768;15 873 148;Tf;deep cave;4 585 076 815 873 140;2;;;
2974;Špilja kod Dobre vode;Croatia;16.5.2006.;2006-05-16;1f, 1 juv;2;Linyphiidae;Porrhomma;convexum;Porrhomma convexum;;46 269 643;16 002 576;;deep cave;4 626 964 316 002 570;4;;;
2975;Baji?eva špilja 1;Croatia;5.6.2002.;2002-06-05;1f, 1 juv;2;Linyphiidae;Porrhomma;egeria;Porrhomma egeria;;45 251 716;15 849 502;;deep cave;4 525 171 615 849 500;1;;;
2976;Ponor Bele vode;Croatia;12.7.2005.;2005-07-12;1f;1;Linyphiidae;Porrhomma;convexum;Porrhomma convexum;;45 418 527;14 693 695;;deep cave;4 541 852 714 693 690;3;;;
2977;Izvor Križevš?ak;Croatia;28.5.2005.;2005-05-28;1f;1;Linyphiidae;Porrhomma;convexum;Porrhomma convexum;;45 837 713;15 858 133;;deep cave;4 583 771 315 858 130;2;;;
2978;Bedara;Croatia;18.12.2005.;2005-12-18;2f, 2 juv;4;Linyphiidae;Porrhomma;egeria;Porrhomma egeria;620;45 751 922;15 536 692;;deep cave;4 575 192 215 536 690;4;;;
2979;Dola?a;Croatia;8.12.2002.;2002-12-08;2f;2;Linyphiidae;Porrhomma;convexum;Porrhomma convexum;;45 739 571;15 482 755;;deep cave;4 573 957 115 482 750;5;;;
2980;Bedara;Croatia;24.8.2002.;2002-08-24;1f, 4 juv;5;Linyphiidae;Porrhomma;egeria;Porrhomma egeria;620;45 751 922;15 536 692;;deep cave;4 575 192 215 536 690;4;;;
2981;Cinkalica 3;Croatia;14.5.2006.;2006-05-14;2f, 1 juv;3;Linyphiidae;Porrhomma;egeria;Porrhomma egeria;405;4 627 707;16 041 044;;deep cave;462 770 716 041 044;2;;;
2982;Bedara;Croatia;12.10.2003.;2003-10-12;2m, 5f, 1 juv;8;Linyphiidae;Porrhomma;egeria;Porrhomma egeria;620;45 751 922;15 536 692;;deep cave;4 575 192 215 536 690;4;;;
2983;Mateši?eva-Popova?a sustav;Croatia;23.4.1998.;1998-04-23;2f;2;Linyphiidae;Porrhomma;convexum;Porrhomma convexum;;45 108 023;15 613 894;;deep cave;4 510 802 315 613 890;3;;;
2984;Špilja kod Dobre vode;Croatia;16.5.2006.;2006-05-16;1f;1;Linyphiidae;Porrhomma;convexum;Porrhomma convexum;;46 269 643;16 002 576;;deep cave;4 626 964 316 002 570;4;;;
2986;Dola?a;Croatia;17.10.2009.;2009-10-17;2f, 3 juv;5;Linyphiidae;Porrhomma;convexum;Porrhomma convexum;;45 739 571;15 482 755;;deep cave;4 573 957 115 482 750;5;;;
2987;Žlota;Croatia;2.2.2002.;2002-02-02;1f;1;Linyphiidae;Porrhomma;convexum;Porrhomma convexum;;45 659 111;15 466 604;;deep cave;4 565 911 115 466 600;1;;;
2989;Ambarac;Croatia;11.6.2004.;2004-06-11;2m;2;Linyphiidae;Porrhomma;convexum;Porrhomma convexum;;45 231 783;15 306 426;;deep cave;4 523 178 315 306 420;1;;;
2990;Mikuli?ka;Croatia;7.2.1999.;1999-02-07;1f, 1 juv;2;Linyphiidae;Porrhomma;egeria;Porrhomma egeria;585;45 759 733;15 527 833;;deep cave;4 575 973 315 527 830;1;;;
2991;Dola?a;Croatia;12.12.2004.;2004-12-12;6f, 3 juv;9;Linyphiidae;Porrhomma;convexum;Porrhomma convexum;;45 739 571;15 482 755;;deep cave;4 573 957 115 482 750;5;;;
2992;Sini?i? špilja;Croatia;7.10.2006.;2006-10-07;1m, 1f;2;Linyphiidae;Porrhomma;convexum;Porrhomma convexum;;44 990 698;15 177 848;;deep cave;4 499 069 815 177 840;6;;;
2993;Dola?a;Croatia;8.12.2002.;2002-12-08;1m, 1 juv;2;Linyphiidae;Porrhomma;convexum;Porrhomma convexum;;45 739 571;15 482 755;;deep cave;4 573 957 115 482 750;5;;;
2994;Vindija;Croatia;17.5.2006.;2006-05-17;2f;2;Linyphiidae;Gen. 11;sp. 1;Gen. 11 sp. 1;270;46 302 462;16 079 177;;;4 630 246 216 079 170;6;;;
2995;Cinkalica 3;Croatia;14.5.2006.;2006-05-14;2f, 2 juv;4;Linyphiidae;Porrhomma;egeria;Porrhomma egeria;405;4 627 707;16 041 044;;deep cave;462 770 716 041 044;2;;;
2996;Mikašinovi?a špilja;Croatia;31.1.2004.;2004-01-31;1f;1;Linyphiidae;Porrhomma;egeria;Porrhomma egeria;230;45 283 788;1 528 561;;deep cave;452 837 881 528 561;3;;;
2997;Jama u 6. odjelu;Croatia;8.6.2003.;2003-06-08;1f;1;Linyphiidae;Porrhomma;egeria;Porrhomma egeria;;45 733;15 307;;deep cave;4 573 315 307;1;;;
2998;Francuski rudnik 3;Croatia;24.11.2004.;2004-11-24;1f;1;Linyphiidae;Porrhomma;convexum;Porrhomma convexum;;45 905 584;15 940 186;;deep cave;4 590 558 415 940 180;2;;;
2999;Dola?a;Croatia;8.12.2003.;2003-12-08;3f, 1 juv;4;Linyphiidae;Porrhomma;convexum;Porrhomma convexum;;45 739 571;15 482 755;;deep cave;4 573 957 115 482 750;5;;;
3000;Pušina;Croatia;30.11.2002.;2002-11-30;2m;2;Linyphiidae;Porrhomma;egeria;Porrhomma egeria;724;45 740 585;1 535 653;;deep cave;457 405 851 535 653;4;;;8,3
3001;Bedara;Croatia;20.12.2003.;2003-12-20;1m;1;Linyphiidae;Porrhomma;egeria;Porrhomma egeria;620;45 751 922;15 536 692;;deep cave;4 575 192 215 536 690;4;;;
3002;Batinova jama;Croatia;23.1.2004.;2004-01-23;3f, 1 juv;4;Linyphiidae;Porrhomma;egeria;Porrhomma egeria;450;45 845 957;15 868 496;;deep cave;4 584 595 715 868 490;2;;;
3003;Vindija;Croatia;17.5.2006.;2006-05-17;2f;2;Linyphiidae;Micrargus;sp.;Micrargus sp.;;46 302 462;16 079 177;;;4 630 246 216 079 170;6;;;
3004;Miljacka 2;Croatia;6.1.2005.;2005-01-06;1 juv m;1;Pholcidae;Holocnemus;sp.;Holocnemus sp.;;440 002;16 016 234;;;44 000 216 016 234;4;;;12,6
3005;Ješkalovica;Croatia;4.1.2009.;2009-01-04;1f;1;Linyphiidae;Asthenargus;bracianus;Asthenargus bracianus;;43 299 857;16 839 313;tf;deep cave;4 329 985 716 839 310;2;;;15,4
3006;Jama na vrh Vrguda;Croatia;2.11.2008.;2008-11-02;1f;1;Linyphiidae;Asthenargus;bracianus;Asthenargus bracianus;;42 726 207;18 039 158;tf;deep cave;4 272 620 718 039 150;9;;;
3007;Atila;Croatia;28.7.2012.;2012-07-28;1f;1;Dysderidae;Stalita;pretneri;Stalita pretneri;950;44 677 748;15 110 767;Tb;deep cave;4 467 774 815 110 760;2;;;5,5
3008;Kozjakuša jama;Croatia;2.8.2012.;2012-08-02;1f;1;Dysderidae;Parastalita;stygia;Parastalita stygia;1020;4 467 531;15 109 028;Tb;deep cave;446 753 115 109 028;1;;;
3010;Los Antonio;Croatia;3.8.2012.;2012-08-03;1m, 1 juv m;2;Linyphiidae;Troglohyphantes;sp. 4;Troglohyphantes sp. 4;;44 632 703;15 136 461;tb;deep cave;4 463 270 315 136 460;1;;;
3011;Bukvakuša špilja;Croatia;3.8.2012.;2012-08-03;1 juv;1;Dysderidae;Stalita;pretneri;Stalita pretneri;;44 672 873;1 511 359;Tb;deep cave;446 728 731 511 359;1;;;
3012;Manita pe?;Croatia;23.9.2012.;2012-09-23;1 juv;1;Dysderidae;Stalita;pretneri;Stalita pretneri;520;44 314 302;15 475 264;Tb;deep cave;4 431 430 215 475 260;7;;;9,8
3012;Manita pe?;Croatia;23.9.2012.;2012-09-23;1 juv;1;Dysderidae;Stalita;pretneri;Stalita pretneri;520;44 314 302;15 475 264;Tb;deep cave;4 431 430 215 475 260;7;;8,8;9,25
3013;Manita pe?;Croatia;25.7.2012.;2012-07-25;1f;1;Dysderidae;Parastalita;stygia;Parastalita stygia;520;44 314 302;15 475 264;Tb;deep cave;4 431 430 215 475 260;7;;;9,8
3013;Manita pe?;Croatia;25.7.2012.;2012-07-25;1f;1;Dysderidae;Parastalita;stygia;Parastalita stygia;520;44 314 302;15 475 264;Tb;deep cave;4 431 430 215 475 260;7;;8,8;9,25
3014;Manita pe?;Croatia;23.9.2012.;2012-09-23;1f;1;Dysderidae;Stalita;pretneri;Stalita pretneri;520;44 314 302;15 475 264;Tb;deep cave;4 431 430 215 475 260;7;;;9,8
3014;Manita pe?;Croatia;23.9.2012.;2012-09-23;1f;1;Dysderidae;Stalita;pretneri;Stalita pretneri;520;44 314 302;15 475 264;Tb;deep cave;4 431 430 215 475 260;7;;8,8;9,25
3015;Manita pe?;Croatia;25.7.2012.;2012-07-25;1f;1;Dysderidae;Parastalita;stygia;Parastalita stygia;520;44 314 302;15 475 264;Tb;deep cave;4 431 430 215 475 260;7;;;9,8
3015;Manita pe?;Croatia;25.7.2012.;2012-07-25;1f;1;Dysderidae;Parastalita;stygia;Parastalita stygia;520;44 314 302;15 475 264;Tb;deep cave;4 431 430 215 475 260;7;;8,8;9,25
3016;Manita pe?;Croatia;25.7.2012.;2012-07-25;1m;1;Dysderidae;Parastalita;stygia;Parastalita stygia;520;44 314 302;15 475 264;Tb;deep cave;4 431 430 215 475 260;7;;;9,8
3016;Manita pe?;Croatia;25.7.2012.;2012-07-25;1m;1;Dysderidae;Parastalita;stygia;Parastalita stygia;520;44 314 302;15 475 264;Tb;deep cave;4 431 430 215 475 260;7;;8,8;9,25
3017;Atila;Croatia;20.5.2012.;2012-05-20;1f;1;Linyphiidae;Troglohyphantes;sp. 4;Troglohyphantes sp. 4;;44 677 748;15 110 767;tb;deep cave;4 467 774 815 110 760;2;;;5,5
3018;Kad jaganjci utihnu;Croatia;5.6.2006.;2006-06-05;2m;2;Leptonetidae;Cataleptoneta;lingulata;Cataleptoneta lingulata;;44 365 085;15 314 841;tb;deep cave;4 436 508 515 314 840;3;;;
3019;Špilja u Vukoti?a dragi;Croatia;1.6.2006.;2006-06-01;4m, 3f, 3 juv;1;Leptonetidae;Cataleptoneta;lingulata;Cataleptoneta lingulata;;44 808 197;14 883 737;tb;deep cave;4 480 819 714 883 730;2;;;
3020;Grunfova jama;Croatia;31.7.2012.;2012-07-31;1m;1;Linyphiidae;Gen.;sp. X;Gen. sp. X;;44 675 604;15 109 244;;;4 467 560 415 109 240;1;;;
3022;Jazinka;Croatia;20.10.2012.;2012-10-20;1m;1;Dysderidae;Stalagtia;sp. 4;Stalagtia sp. 4;235;43 975 892;16 029 694;Tb;deep cave;4 397 589 216 029 690;2;;;13
3023;Stara jametina;Croatia;17.10.2012.;2012-10-17;1m;1;Dysderidae;Stalagtia;sp. 4;Stalagtia sp. 4;;43 794 009;1 600 259;Tb;deep cave;437 940 091 600 259;6;;;13
3023;Stara jametina;Croatia;17.10.2012.;2012-10-17;1m;1;Dysderidae;Stalagtia;sp. 4;Stalagtia sp. 4;;43 794 009;1 600 259;Tb;deep cave;437 940 091 600 259;6;;13,4;13,4
3025;Stara jametina;Croatia;17.10.2012.;2012-10-17;1 juv;1;Dysderidae;Stalagtia;sp. 4;Stalagtia sp. 4;;43 794 009;1 600 259;Tb;deep cave;437 940 091 600 259;6;;;13
3025;Stara jametina;Croatia;17.10.2012.;2012-10-17;1 juv;1;Dysderidae;Stalagtia;sp. 4;Stalagtia sp. 4;;43 794 009;1 600 259;Tb;deep cave;437 940 091 600 259;6;;13,4;13,4
3026;Miljacka 2;Croatia;18.10.2012.;2012-10-18;1m, 2 juvm, 2 juv;5;Nesticidae;Kryptonesticus;eremita;Kryptonesticus eremita;;440 002;16 016 234;tf;deep cave;44 000 216 016 234;4;;;12,6
3028;Miljacka 2;Croatia;21.10.2012.;2012-10-21;1m;1;Nesticidae;Kryptonesticus;eremita;Kryptonesticus eremita;;440 002;16 016 234;tf;deep cave;44 000 216 016 234;4;;;12,6
3030;Špilja u izvoru Krke;Croatia;19.10.2012.;2012-10-19;1f, 2juv;3;Nesticidae;Kryptonesticus;eremita;Kryptonesticus eremita;;440 422 953;162 352 157 514;tf;deep cave;440 422 953 162 352 000 000;2;;;
3031;Sedrena špilja iza mlina;Croatia;19.10.2012.;2012-10-19;1f, 1 juv;2;Nesticidae;Kryptonesticus;eremita;Kryptonesticus eremita;198;44 013 402;16 067 798;tf;deep cave;4 401 340 216 067 790;6;;;7,9
3032;Jazinka;Croatia;20.10.2012.;2012-10-20;1f, 2 juv;3;Nesticidae;Kryptonesticus;eremita;Kryptonesticus eremita;235;43 975 892;16 029 694;tf;deep cave;4 397 589 216 029 690;2;;;13
3033;Miljacka 2;Croatia;18.10.2012.;2012-10-18;1m;1;Nesticidae;Kryptonesticus;eremita;Kryptonesticus eremita;;440 002;16 016 234;tf;deep cave;44 000 216 016 234;4;;;12,6
3034;Špilja u izvoru Krke;Croatia;19.10.2012.;2012-10-19;2f, 3 juv;5;Nesticidae;Kryptonesticus;eremita;Kryptonesticus eremita;;440 422 953;162 352 157 514;tf;deep cave;440 422 953 162 352 000 000;2;;;
3035;Jama na Selinama;Croatia;22.10.2012.;2012-10-22;3f, 3 juv;6;Nesticidae;Kryptonesticus;eremita;Kryptonesticus eremita;;43 914 655;15 962 407;tf;deep cave;4 391 465 515 962 400;4;;;
3036;Jama na Bibinovcu;Croatia;22.10.2012.;2012-10-22;1f;1;Nesticidae;Kryptonesticus;eremita;Kryptonesticus eremita;;43 908 757;15 957 245;tf;deep cave;4 390 875 715 957 240;3;;;11,7
3038;Stara jametina;Croatia;17.10.2012.;2012-10-17;1m, 3f;4;Linyphiidae;Micrargus;herbigradus;Micrargus herbigradus;;43 794 009;1 600 259;Tf;deep cave;437 940 091 600 259;6;;;13
3038;Stara jametina;Croatia;17.10.2012.;2012-10-17;1m, 3f;4;Linyphiidae;Micrargus;herbigradus;Micrargus herbigradus;;43 794 009;1 600 259;Tf;deep cave;437 940 091 600 259;6;;13,4;13,4
3040;Stara jametina;Croatia;17.10.2012.;2012-10-17;3f, 1 juv;4;Linyphiidae;Micrargus;herbigradus;Micrargus herbigradus;;43 794 009;1 600 259;Tf;deep cave;437 940 091 600 259;6;;;13
3040;Stara jametina;Croatia;17.10.2012.;2012-10-17;3f, 1 juv;4;Linyphiidae;Micrargus;herbigradus;Micrargus herbigradus;;43 794 009;1 600 259;Tf;deep cave;437 940 091 600 259;6;;13,4;13,4
3041;Stara jametina;Croatia;17.10.2012.;2012-10-17;1f;1;Theridiidae;Episinus;cavernicola;Episinus cavernicola;;43 794 009;1 600 259;Tf;deep cave;437 940 091 600 259;6;;;13
3041;Stara jametina;Croatia;17.10.2012.;2012-10-17;1f;1;Theridiidae;Episinus;cavernicola;Episinus cavernicola;;43 794 009;1 600 259;Tf;deep cave;437 940 091 600 259;6;;13,4;13,4
3042;Stara jametina;Croatia;17.10.2012.;2012-10-17;1f, 1 juv;2;Theridiidae;Episinus;cavernicola;Episinus cavernicola;;43 794 009;1 600 259;Tf;deep cave;437 940 091 600 259;6;;;13
3042;Stara jametina;Croatia;17.10.2012.;2012-10-17;1f, 1 juv;2;Theridiidae;Episinus;cavernicola;Episinus cavernicola;;43 794 009;1 600 259;Tf;deep cave;437 940 091 600 259;6;;13,4;13,4
3043;Stara jametina;Croatia;17.10.2012.;2012-10-17;1f, 1m;2;Linyphiidae;Micrargus;herbigradus;Micrargus herbigradus;;43 794 009;1 600 259;Tf;deep cave;437 940 091 600 259;6;;;13
3043;Stara jametina;Croatia;17.10.2012.;2012-10-17;1f, 1m;2;Linyphiidae;Micrargus;herbigradus;Micrargus herbigradus;;43 794 009;1 600 259;Tf;deep cave;437 940 091 600 259;6;;13,4;13,4
3044;Stara jametina;Croatia;17.10.2012.;2012-10-17;2m, 1f;3;Linyphiidae;Micrargus;herbigradus;Micrargus herbigradus;;43 794 009;1 600 259;Tf;deep cave;437 940 091 600 259;6;;;13
3044;Stara jametina;Croatia;17.10.2012.;2012-10-17;2m, 1f;3;Linyphiidae;Micrargus;herbigradus;Micrargus herbigradus;;43 794 009;1 600 259;Tf;deep cave;437 940 091 600 259;6;;13,4;13,4
3045;Stara jametina;Croatia;17.10.2012.;2012-10-17;1m, 1f;2;Linyphiidae;Micrargus;herbigradus;Micrargus herbigradus;;43 794 009;1 600 259;Tf;deep cave;437 940 091 600 259;6;;;13
3045;Stara jametina;Croatia;17.10.2012.;2012-10-17;1m, 1f;2;Linyphiidae;Micrargus;herbigradus;Micrargus herbigradus;;43 794 009;1 600 259;Tf;deep cave;437 940 091 600 259;6;;13,4;13,4
3047;Stara jametina;Croatia;17.10.2012.;2012-10-17;1f;1;Linyphiidae;Micrargus;herbigradus;Micrargus herbigradus;;43 794 009;1 600 259;Tf;deep cave;437 940 091 600 259;6;;;13
3047;Stara jametina;Croatia;17.10.2012.;2012-10-17;1f;1;Linyphiidae;Micrargus;herbigradus;Micrargus herbigradus;;43 794 009;1 600 259;Tf;deep cave;437 940 091 600 259;6;;13,4;13,4
3048;Stara jametina;Croatia;17.10.2012.;2012-10-17;1f, 1m;2;Linyphiidae;Micrargus;herbigradus;Micrargus herbigradus;;43 794 009;1 600 259;Tf;deep cave;437 940 091 600 259;6;;;13
3048;Stara jametina;Croatia;17.10.2012.;2012-10-17;1f, 1m;2;Linyphiidae;Micrargus;herbigradus;Micrargus herbigradus;;43 794 009;1 600 259;Tf;deep cave;437 940 091 600 259;6;;13,4;13,4
3049;Stara jametina;Croatia;17.10.2012.;2012-10-17;2f, 1 juv;3;Theridiidae;Episinus;cavernicola;Episinus cavernicola;;43 794 009;1 600 259;Tf;deep cave;437 940 091 600 259;6;;;13
3049;Stara jametina;Croatia;17.10.2012.;2012-10-17;2f, 1 juv;3;Theridiidae;Episinus;cavernicola;Episinus cavernicola;;43 794 009;1 600 259;Tf;deep cave;437 940 091 600 259;6;;13,4;13,4
3050;Jama na Bibinovcu;Croatia;22.10.2012.;2012-10-22;1m;1;Agelenidae;Tegenaria;annulata;Tegenaria annulata;;43 908 757;15 957 245;Tf;deep cave;4 390 875 715 957 240;3;;;11,7
3051;Miljacka 2;Croatia;18.10.2012.;2012-10-18;2m, 1f;3;Agelenidae;Tegenaria;domestica;Tegenaria domestica;;440 002;16 016 234;Tf;deep cave;44 000 216 016 234;4;;;12,6
3052;Miljacka 2;Croatia;18.10.2012.;2012-10-18;1m, 2 juv;3;Agelenidae;Tegenaria;domestica;Tegenaria domestica;;440 002;16 016 234;Tf;deep cave;44 000 216 016 234;4;;;12,6
3056;Keranova golubinka;Croatia;20.10.2012.;2012-10-20;3f, 1 juv;4;Linyphiidae;Palliduphantes;byzantinus;Palliduphantes byzantinus;;43 934 367;16 058 782;Tf;deep cave;4 393 436 716 058 780;4;;;7,95
3057;Sedrena špilja kod stola;Croatia;19.10.2012.;2012-10-19;1f, 3juv;4;Nesticidae;Kryptonesticus;eremita;Kryptonesticus eremita;;4 401 385;16 068 978;tf;deep cave;440 138 516 068 978;2;;6,1;6,1
3058;Sedrena špilja kod stola;Croatia;19.10.2012.;2012-10-19;1f;1;Nesticidae;Kryptonesticus;eremita;Kryptonesticus eremita;;4 401 385;16 068 978;tf;deep cave;440 138 516 068 978;2;;6,1;6,1
3060;Miljacka 2;Croatia;18.10.2012.;2012-10-18;1f;1;Nesticidae;Kryptonesticus;eremita;Kryptonesticus eremita;;440 002;16 016 234;tf;deep cave;44 000 216 016 234;4;;;12,6
3061;Sedrena špilja s jamskim ulazom;Croatia;19.10.2012.;2012-10-19;1f;1;Nesticidae;Kryptonesticus;eremita;Kryptonesticus eremita;;44 013 829;16 069 202;tf;deep cave;4 401 382 916 069 200;2;;;9,3
3062;Jama na Bibinovcu;Croatia;22.10.2012.;2012-10-22;1f, 1 juv;2;Nesticidae;Kryptonesticus;eremita;Kryptonesticus eremita;;43 908 757;15 957 245;tf;deep cave;4 390 875 715 957 240;3;;;11,7
3063;Tradanj;Croatia;8.1.2005.;2005-01-08;1f, 1 juv;2;Pholcidae;Holocnemus;pluchei;Holocnemus pluchei;;43 793 104;15 845 439;tf;deep cave;4 379 310 415 845 430;3;;;
3064;Sedrena špilja iza mlina;Croatia;19.10.2012.;2012-10-19;1f;1;Leptonetidae;Barusia;maheni;Barusia maheni;198;44 013 402;16 067 798;tf;deep cave;4 401 340 216 067 790;6;;;7,9
3065;Sedrena špilja iza mlina;Croatia;19.10.2012.;2012-10-19;1m;1;Leptonetidae;Barusia;maheni;Barusia maheni;198;44 013 402;16 067 798;tf;deep cave;4 401 340 216 067 790;6;;;7,9
3066;Sedrena špilja iza mlina;Croatia;19.10.2012.;2012-10-19;1f, 3 juv;4;Leptonetidae;Barusia;maheni;Barusia maheni;198;44 013 402;16 067 798;tf;deep cave;4 401 340 216 067 790;6;;;7,9
3067;Sedrena špilja iza mlina;Croatia;19.10.2012.;2012-10-19;1 juv f;1;Leptonetidae;Barusia;maheni;Barusia maheni;198;44 013 402;16 067 798;tf;deep cave;4 401 340 216 067 790;6;;;7,9
3069;Stara jametina;Croatia;17.10.2012.;2012-10-17;1f;1;Linyphiidae;Palliduphantes;istrianus;Palliduphantes istrianus;;43 794 009;1 600 259;Tf;deep cave;437 940 091 600 259;6;;;13
3069;Stara jametina;Croatia;17.10.2012.;2012-10-17;1f;1;Linyphiidae;Palliduphantes;istrianus;Palliduphantes istrianus;;43 794 009;1 600 259;Tf;deep cave;437 940 091 600 259;6;;13,4;13,4
3070;Keranova golubinka;Croatia;20.10.2012.;2012-10-20;1m;1;Linyphiidae;Centromerus;cavernarum;Centromerus cavernarum;;43 934 367;16 058 782;Tf;deep cave;4 393 436 716 058 780;4;;;7,95
3072;Keranova golubinka;Croatia;20.10.2012.;2012-10-20;1f;1;Linyphiidae;Gen. 4;sp. 1;Gen. 4 sp. 1;;43 934 367;16 058 782;;;4 393 436 716 058 780;4;;;7,95
3073;Keranova golubinka;Croatia;20.10.2012.;2012-10-20;1m, 1 juv;2;Linyphiidae;Gen.;sp. X;Gen. sp. X;;43 934 367;16 058 782;;;4 393 436 716 058 780;4;;;7,95
3074;Jama na Selinama;Croatia;22.10.2012.;2012-10-22;1m;1;Linyphiidae;Gen.;sp. X;Gen. sp. X;;43 914 655;15 962 407;;;4 391 465 515 962 400;4;;;
3075;Jama na Bibinovcu;Croatia;22.10.2012.;2012-10-22;1m;1;Linyphiidae;Gen.;sp. X;Gen. sp. X;;43 908 757;15 957 245;;;4 390 875 715 957 240;3;;;11,7
3077;Jazinka;Croatia;16.12.2012.;2012-12-16;1f, 1juv;2;Nesticidae;Kryptonesticus;eremita;Kryptonesticus eremita;235;43 975 892;16 029 694;tf;deep cave;4 397 589 216 029 690;2;;;13
3078;Jama u koritu Lemeš;Croatia;17.12.2012.;2012-12-17;1juvm, 2 juv;3;Nesticidae;Kryptonesticus;eremita;Kryptonesticus eremita;;43 884 571;16 326 893;;deep cave;4 388 457 116 326 890;4;;;
3079;Jama u koritu Lemeš;Croatia;17.12.2012.;2012-12-17;1juvm, 1 juv;2;Nesticidae;Kryptonesticus;eremita;Kryptonesticus eremita;;43 884 571;16 326 893;;deep cave;4 388 457 116 326 890;4;;;
3080;Škarin Samograd;Croatia;17.10.2009.;2009-10-17;1m;1;Nesticidae;Kryptonesticus;eremita;Kryptonesticus eremita;;43 781 501;1 609 613;tf;deep cave;437 815 011 609 613;3;;;
3081;Jagodnjak;Croatia;17.12.2012.;2012-12-17;1f, 1 juvm, 1 juv;3;Nesticidae;Kryptonesticus;eremita;Kryptonesticus eremita;;44 002 869;16 074 441;tf;deep cave;4 400 286 916 074 440;2;;;12,3
3082;Golubnja?a u Grulovi?ima;Croatia;18.12.2012.;2012-12-18;2f;2;Nesticidae;Kryptonesticus;eremita;Kryptonesticus eremita;;44 006 712;15 931 138;tf;deep cave;4 400 671 215 931 130;1;;;
3083;Špilja ispod Vukovi?a poda;Croatia;19.12.2012.;2012-12-19;1f, 1 juv;2;Nesticidae;Kryptonesticus;eremita;Kryptonesticus eremita;;4 385 296;1 597 176;tf;deep cave;43 852 961 597 176;3;;;
3084;Špilja ispod Vukovi?a poda;Croatia;19.12.2012.;2012-12-19;1f;1;Dysderidae;Harpactea;sp. 11;Harpactea sp. 11;;4 385 296;1 597 176;Tf;deep cave;43 852 961 597 176;3;;;
3085;Špilja ispod Vukovi?a poda;Croatia;19.12.2012.;2012-12-19;1f;1;Nesticidae;Kryptonesticus;eremita;Kryptonesticus eremita;;4 385 296;1 597 176;tf;deep cave;43 852 961 597 176;3;;;
3086;Jama u koritu Lemeš;Croatia;17.12.2012.;2012-12-17;1 juv;1;Nesticidae;Kryptonesticus;eremita;Kryptonesticus eremita;;43 884 571;16 326 893;;deep cave;4 388 457 116 326 890;4;;;
3087;Jama u koritu Lemeš;Croatia;17.12.2012.;2012-12-17;1m;1;Dysderidae;Harpactea;sp. 18;Harpactea sp. 18;;43 884 571;16 326 893;Tf;deep cave;4 388 457 116 326 890;4;;;
3092;Makeljina špilja;Croatia;17.12.2012.;2012-12-17;1f;1;Tetragnathidae;Meta;bourneti;Meta bourneti;;43 995 296;1 607 216;Tf;deep cave;439 952 961 607 216;5;;;
3093;Makeljina špilja;Croatia;17.12.2012.;2012-12-17;1m;1;Agelenidae;Tegenaria;annulata;Tegenaria annulata;;43 995 296;1 607 216;Tf;deep cave;439 952 961 607 216;5;;;
3097;Dvostruka jama Lemeš I;Croatia;17.12.2012.;2012-12-17;1f;1;Tetragnathidae;Meta;menardi;Meta menardi;;43 882 863;16 330 514;Tf;deep cave;4 388 286 316 330 510;1;;;
3099;Jama na Selinama;Croatia;15.12.2012.;2012-12-15;1f;1;Agelenidae;Tegenaria;sp. 7;Tegenaria sp. 7;;43 914 655;15 962 407;;;4 391 465 515 962 400;4;;;
3103;Makeljina špilja;Croatia;17.12.2012.;2012-12-17;1 juv;1;Dysderidae;Stalagtia;sp. 4;Stalagtia sp. 4;;43 995 296;1 607 216;Tb;deep cave;439 952 961 607 216;5;;;
3104;Špilja kod Gornjih Krni?a;Croatia;15.12.2012.;2012-12-15;1f;1;Theridiidae;Episinus;cavernicola;Episinus cavernicola;;43 791 103;16 015 638;Tf;deep cave;4 379 110 316 015 630;1;;;
3105;Jama u koritu Lemeš;Croatia;17.12.2012.;2012-12-17;1f;1;Linyphiidae;Centromerus;cavernarum;Centromerus cavernarum;;43 884 571;16 326 893;Tf;deep cave;4 388 457 116 326 890;4;;;
3106;Jama u koritu Lemeš;Croatia;17.12.2012.;2012-12-17;2f;2;Linyphiidae;Palliduphantes;istrianus;Palliduphantes istrianus;;43 884 571;16 326 893;Tf;deep cave;4 388 457 116 326 890;4;;;
3108;Triši?a jama;Croatia;16.12.2102.;2012-12-16;1f, 1 m, 1 prosoma (f?);2;Linyphiidae;Palliduphantes;istrianus;Palliduphantes istrianus;;43 949 231;15 947 793;Tf;deep cave;4 394 923 115 947 790;2;;;10,38
3109;Triši?a jama;Croatia;16.12.2102.;2012-12-16;1m;1;Linyphiidae;Micrargus;herbigradus;Micrargus herbigradus;;43 949 231;15 947 793;Tf;deep cave;4 394 923 115 947 790;2;;;10,38
3112;Sedrena špilja iza mlina;Croatia;14.12.2012.;2012-12-14;1m;1;Leptonetidae;Barusia;maheni;Barusia maheni;198;44 013 402;16 067 798;tf;deep cave;4 401 340 216 067 790;6;;;7,9
3113;Keranova golubinka;Croatia;18.12.2012.;2012-12-18;1f;1;Linyphiidae;Centromerus;cavernarum;Centromerus cavernarum;;43 934 367;16 058 782;Tf;deep cave;4 393 436 716 058 780;4;;;7,95
3114;Keranova golubinka;Croatia;18.12.2012.;2012-12-18;1m, 7f, 2 juv;1;Linyphiidae;Palliduphantes;byzantinus;Palliduphantes byzantinus;;43 934 367;16 058 782;Tf;deep cave;4 393 436 716 058 780;4;;;7,95
3115;Keranova golubinka;Croatia;18.12.2012.;2012-12-18;1f;1;Linyphiidae;Palliduphantes;byzantinus;Palliduphantes byzantinus;;43 934 367;16 058 782;Tf;deep cave;4 393 436 716 058 780;4;;;7,95
3117;Keranova golubinka;Croatia;18.12.2012.;2012-12-18;2f, 2 juv;4;Linyphiidae;Palliduphantes;byzantinus;Palliduphantes byzantinus;;43 934 367;16 058 782;Tf;deep cave;4 393 436 716 058 780;4;;;7,95
3118;Triši?a jama;Croatia;16.12.2102.;2012-12-16;2f;2;Linyphiidae;Palliduphantes;istrianus;Palliduphantes istrianus;;43 949 231;15 947 793;Tf;deep cave;4 394 923 115 947 790;2;;;10,38
3119;Triši?a jama;Croatia;16.12.2102.;2012-12-16;2f;2;Linyphiidae;Micrargus;herbigradus;Micrargus herbigradus;;43 949 231;15 947 793;Tf;deep cave;4 394 923 115 947 790;2;;;10,38
3120;Stara jametina;Croatia;15.12.2012.;2012-12-15;1m;1;Theridiidae;Episinus;cavernicola;Episinus cavernicola;;43 794 009;1 600 259;Tf;deep cave;437 940 091 600 259;6;;;13
3120;Stara jametina;Croatia;15.12.2012.;2012-12-15;1m;1;Theridiidae;Episinus;cavernicola;Episinus cavernicola;;43 794 009;1 600 259;Tf;deep cave;437 940 091 600 259;6;;13,4;13,4
3122;Jagodnjak;Croatia;17.12.2012.;2012-12-17;1m;1;Linyphiidae;Palliduphantes;istrianus;Palliduphantes istrianus;;44 002 869;16 074 441;Tf;deep cave;4 400 286 916 074 440;2;;;12,3
3123;Sedrena špilja kod stola;Croatia;14.12.2012.;2012-12-14;1 juv;1;Pholcidae;Holocnemus;sp.;Holocnemus sp.;;4 401 385;16 068 978;Tf?;;440 138 516 068 978;2;;6,1;6,1
3129;Jama na Selinama;Croatia;15.12.2012.;2012-12-15;1m;1;Linyphiidae;Gen. 9;sp. 1;Gen. 9 sp. 1;;43 914 655;15 962 407;;;4 391 465 515 962 400;4;;;
3130;Jama na Selinama;Croatia;15.12.2012.;2012-12-15;1f;1;Linyphiidae;Gen.;sp. X;Gen. sp. X;;43 914 655;15 962 407;;;4 391 465 515 962 400;4;;;
3131;Sedrena špilja iza mlina;Croatia;14.12.2012.;2012-12-14;1m, 3f, 1 juv;5;Leptonetidae;Barusia;maheni;Barusia maheni;198;44 013 402;16 067 798;tf;deep cave;4 401 340 216 067 790;6;;;7,9
3133;Sedrena špilja iza mlina;Croatia;17.12.2012.;2012-12-17;2juv/f;2;Leptonetidae;Barusia;maheni;Barusia maheni;198;44 013 402;16 067 798;tf;deep cave;4 401 340 216 067 790;6;;;7,9
3135;Sedrena špilja iza mlina;Croatia;17.12.2012.;2012-12-17;2f , 1 m;3;Leptonetidae;Barusia;maheni;Barusia maheni;198;44 013 402;16 067 798;tf;deep cave;4 401 340 216 067 790;6;;;7,9
3136;Sedrena špilja iza mlina;Croatia;17.12.2012.;2012-12-17;1m;1;Leptonetidae;Barusia;maheni;Barusia maheni;198;44 013 402;16 067 798;tf;deep cave;4 401 340 216 067 790;6;;;7,9
3137;Špilja u kamenolomu Tounj;Croatia;7.10.2007.;2007-10-07;1f, 2 juv;3;Linyphiidae;Troglohyphantes;croaticus;Troglohyphantes croaticus;263;45 245 525;15 318 946;tb;deep cave;4 524 552 515 318 940;3;;;9,54
3138;Špilja u kamenolomu Tounj;Croatia;23.1.1999.;1999-01-23;1f, 1 juv m, 1 juv;3;Linyphiidae;Troglohyphantes;croaticus;Troglohyphantes croaticus;263;45 245 525;15 318 946;tb;deep cave;4 524 552 515 318 940;3;;;9,54
3139;Špilja u kamenolomu Tounj;Croatia;23.1.1999.;1999-01-23;7f, 1 juv;8;Linyphiidae;Porrhomma;egeria;Porrhomma egeria;263;45 245 525;15 318 946;;deep cave;4 524 552 515 318 940;3;;;9,54
3140;Špilja u kamenolomu Tounj;Croatia;23.1.1999.;1999-01-23;1 juv;1;Dysderidae;Stalita;pretneri;Stalita pretneri;263;45 245 525;15 318 946;Tb;deep cave;4 524 552 515 318 940;3;;;9,54
3141;Tounj?ica;Croatia;18.6.2006.;2006-06-18;1f;1;Linyphiidae;Centromerus;cavernarum;Centromerus cavernarum;;45 248 722;15 322 408;Tf;deep cave;4 524 872 215 322 400;5;;;14
3142;Tounj?ica;Croatia;30.3.2004.;2004-03-30;2f;2;Linyphiidae;Centromerus;cavernarum;Centromerus cavernarum;;45 248 722;15 322 408;Tf;deep cave;4 524 872 215 322 400;5;;;14
3144;Tounj?ica;Croatia;18.6.2006.;2006-06-18;2 f;2;Linyphiidae;Centromerus;cavernarum;Centromerus cavernarum;;45 248 722;15 322 408;Tf;deep cave;4 524 872 215 322 400;5;;;14
3145;?ulin ponor-Medvedica;Croatia;25.2.2012.;2012-02-25;2f;2;Linyphiidae;Porrhomma;convexum;Porrhomma convexum;320;45 267 036;15 223 745;Tf;deep cave;4 526 703 615 223 740;3;;;
3146;?ulin ponor-Medvedica;Croatia;11.2.2006.;2006-02-11;1f;1;Linyphiidae;Porrhomma;convexum;Porrhomma convexum;320;45 267 036;15 223 745;Tf;deep cave;4 526 703 615 223 740;3;;;
3147;Brezdanja?a na Stražbenici;Croatia;11.11.1995.;1995-11-11;1m , 1f;2;Dysderidae;Parastalita;stygia;Parastalita stygia;;4 526 712;14 691 436;Tb;deep cave;452 671 214 691 436;4;;;
3148;Markova jama kod Tara;Croatia;12.5.2001.;2001-05-12;1f;1;Dysderidae;Stalita;taenaria;Stalita taenaria;95;45 319 298;13 631 373;Tb;deep cave;4 531 929 813 631 370;7;;;
3149;Jama Leopoldina;Croatia;30.10.2011.;2011-10-30;1f;1;Dysderidae;Stalita;taenaria;Stalita taenaria;;45 387 514;13 777 034;Tb;deep cave;4 538 751 413 777 030;1;;;
3150;Jama kod Buri?i;Croatia;12.5.2001.;2001-05-12;2 juv;2;Dysderidae;Stalita;taenaria;Stalita taenaria;;45 110 672;1 383 399;Tb;deep cave;451 106 721 383 399;1;;;
3151;Markova jama kod Tara;Croatia;28.8.1997.;1997-08-28;2 juv;2;Dysderidae;Stalita;taenaria;Stalita taenaria;95;45 319 298;13 631 373;Tb;deep cave;4 531 929 813 631 370;7;;;
3152;Jama Staja;Croatia;14.8.2001.;2001-08-14;2 juv;2;Dysderidae;Stalita;taenaria;Stalita taenaria;;44 919 862;13 938 147;Tb;deep cave;4 491 986 213 938 140;4;;;
3153;Pliškovi?eva jama;Croatia;19.2.2007.;2007-02-19;1 juv;1;Dysderidae;Stalita;taenaria;Stalita taenaria;;45 071 604;13 872 151;Tb;deep cave;4 507 160 413 872 150;4;;;
3154;Tamnica;Croatia;11.11.1998.;1998-11-11;1f;1;Dysderidae;Parastalita;stygia;Parastalita stygia;;4 527 298;1 536 197;Tb;deep cave;45 272 981 536 197;3;;;
3155;Tamnica;Croatia;11.11.1998.;1998-11-11;1 juv;1;Dysderidae;Dysdera;sp.;Dysdera sp.;;4 527 298;1 536 197;Tx;;45 272 981 536 197;3;;;
3156;Mateši?eva-Popova?a sustav;Croatia;23.4.1998.;1998-04-23;1f;1;Dysderidae;Parastalita;stygia;Parastalita stygia;;45 108 023;15 613 894;Tb;deep cave;4 510 802 315 613 890;3;;;
3157;?utno;Croatia;11.5.1998.;1998-05-11;2m, 1f;3;Dysderidae;Parastalita;stygia;Parastalita stygia;210;45 415 607;15 233 039;Tb;deep cave;4 541 560 715 233 030;4;;;7,75
3158;?utno;Croatia;11.5.1998.;1998-05-11;1f;1;Dysderidae;Stalita;pretneri;Stalita pretneri;210;45 415 607;15 233 039;Tb;deep cave;4 541 560 715 233 030;4;;;7,75
3159;Jama Jankonka;Croatia;16.1.1999.;1999-01-16;1m, 2 f;3;Dysderidae;Parastalita;stygia;Parastalita stygia;;45 397 377;15 248 276;Tb;deep cave;4 539 737 715 248 270;1;;;
3160;Panjkov ponor;Croatia;23.7.2003.;2003-07-23;1m;1;Dysderidae;Parastalita;stygia;Parastalita stygia;;45 015 797;15 723 489;Tb;deep cave;4 501 579 715 723 480;1;;;
3161;Gornja Bara?eva;Croatia;16.2.2002.;2002-02-16;1 juv;1;Dysderidae;Parastalita;stygia;Parastalita stygia;;44 983 895;15 721 656;Tb;deep cave;4 498 389 515 721 650;8;;;
3162;Tamnica;Croatia;26.5.2012.;2012-05-26;1m;1;Dysderidae;Parastalita;stygia;Parastalita stygia;;4 527 298;1 536 197;Tb;deep cave;45 272 981 536 197;3;;;
3163;Tamnica;Croatia;22.2.1998.;1998-02-22;1m, 1f;2;Dysderidae;Parastalita;stygia;Parastalita stygia;;4 527 298;1 536 197;Tb;deep cave;45 272 981 536 197;3;;;
3164;Eko špilja;Croatia;10.8.1998.;1998-08-10;1f;1;Dysderidae;Parastalita;stygia;Parastalita stygia;;45 350 927;15 478 623;Tb;deep cave;4 535 092 715 478 620;1;;;
3165;Jama na Škrilama;Croatia;16.10.1998.;1998-10-16;1f, 1 juv;2;Dysderidae;Parastalita;stygia;Parastalita stygia;;45 532 375;15 344 297;Tb;deep cave;4 553 237 515 344 290;1;;;
3166;Plantaža;Croatia;22.6.2007.;2007-06-22;1 juv;1;Dysderidae;Stalita;pretneri;Stalita pretneri;;45 227 501;15 325 084;Tb;deep cave;4 522 750 115 325 080;2;;;
3167;Kunina jama;Croatia;1.5.1999.;1999-05-01;1m;1;Dysderidae;Parastalita;stygia;Parastalita stygia;;4 504 668;156 877;Tb;deep cave;4 504 668 156 877;2;;;
3168;?utno;Croatia;3.10.1999.;1999-10-03;1f, 2 juv;3;Dysderidae;Stalita;pretneri;Stalita pretneri;210;45 415 607;15 233 039;Tb;deep cave;4 541 560 715 233 030;4;;;7,75
3169;Zagorska pe? kod Ogulina;Croatia;17.6.2006.;2006-06-17;1f;1;Dysderidae;Parastalita;stygia;Parastalita stygia;335;45 196 851;15 219 904;Tb;deep cave;4 519 685 115 219 900;3;;;
3170;Zagorska pe? kod Ogulina;Croatia;17.6.2006.;2006-06-17;1juv;1;Dysderidae;Stalita;pretneri;Stalita pretneri;335;45 196 851;15 219 904;Tb;deep cave;4 519 685 115 219 900;3;;;
3171;?utno;Croatia;2.5.2000.;2000-05-02;1f;1;Dysderidae;Parastalita;stygia;Parastalita stygia;210;45 415 607;15 233 039;Tb;deep cave;4 541 560 715 233 030;4;;;7,75
3173;Zvone?ka II;Croatia;1998.;1905-06-20;1m, 1f;2;Dysderidae;Parastalita;stygia;Parastalita stygia;;45 531 095;15 367 671;Tb;deep cave;4 553 109 515 367 670;3;;;
3174;Vodena špilja;Croatia;4.7.1998.;1998-07-04;1 juv;1;Dysderidae;Parastalita;stygia;Parastalita stygia;;45 354 577;15 472 853;Tb;deep cave;4 535 457 715 472 850;2;;;
3176;Mikašinovi?a špilja;Croatia;10.2000.;2000-10;;;Dysderidae;Parastalita;stygia;Parastalita stygia;230;45 283 788;1 528 561;Tb;deep cave;452 837 881 528 561;3;;;
3177;Vari?akova špilja;Croatia;30.7.2002.;2002-07-30;2f, 1m;3;Dysderidae;Parastalita;stygia;Parastalita stygia;;45 008 251;15 736 981;Tb;deep cave;4 500 825 115 736 980;5;;;
3178;Gornja Bara?eva;Croatia;17.5.2003.;2003-05-17;1m;1;Dysderidae;Parastalita;stygia;Parastalita stygia;;44 983 895;15 721 656;Tb;deep cave;4 498 389 515 721 650;8;;;
3179;Zagorska pe? kod Ogulina;Croatia;9.1.1999.;1999-01-09;1m;1;Dysderidae;Parastalita;stygia;Parastalita stygia;335;45 196 851;15 219 904;Tb;deep cave;4 519 685 115 219 900;3;;;
3180;Eko špilja;Croatia;4.7.1998.;1998-07-04;1 juv, 1 juv neki drugi;1;Dysderidae;Parastalita;stygia;Parastalita stygia;;45 350 927;15 478 623;Tb;deep cave;4 535 092 715 478 620;1;;;
3181;Mateši?eva-Popova?a sustav;Croatia;15.5.1999.;1999-05-15;1f;1;Dysderidae;Parastalita;stygia;Parastalita stygia;;45 108 023;15 613 894;Tb;deep cave;4 510 802 315 613 890;3;;;
3182;Bubijeva jama;Croatia;5.3.1999.;1999-03-05;1m;1;Dysderidae;Parastalita;stygia;Parastalita stygia;;45 339 219;15 470 103;Tb;deep cave;4 533 921 915 470 100;1;;;
3183;Vodena špilja;Croatia;31.5.1998.;1998-05-31;1f;1;Dysderidae;Parastalita;stygia;Parastalita stygia;;45 354 577;15 472 853;Tb;deep cave;4 535 457 715 472 850;2;;;
3184;Markova špilja, Kordun;Croatia;16.1.2000.;2000-01-16;1f;1;Dysderidae;Parastalita;stygia;Parastalita stygia;;45 329 484;15 416 581;Tb;deep cave;4 532 948 415 416 580;1;;;
3185;Jama Jankonka;Croatia;2.4.2000.;2000-04-02;1m;1;Dysderidae;Parastalita;stygia;Parastalita stygia;;45 397 377;15 248 276;Tb;deep cave;4 539 737 715 248 270;1;;;
3187;Makluta?a;Croatia;2.12.2012.;2012-12-02;2f, 2m, 3 juv;7;Linyphiidae;Troglohyphantes;giromettai;Troglohyphantes giromettai;400;43 569 268;16 620 515;tf;deep cave;4 356 926 816 620 510;6;;;4,8
3187;Makluta?a;Croatia;2.12.2012.;2012-12-02;2f, 2m, 3 juv;7;Linyphiidae;Troglohyphantes;giromettai;Troglohyphantes giromettai;400;43 569 268;16 620 515;tf;deep cave;4 356 926 816 620 510;6;;;7,7
3188;Bali?a špilja;Croatia;12.5.2012.;2012-05-12;1f;1;Linyphiidae;Troglohyphantes;giromettai;Troglohyphantes giromettai;405;4 357 296;1 657 002;tf;deep cave;43 572 961 657 002;11;;;7,2
3189;Bali?a špilja;Croatia;12.5.2012.;2012-05-12;1f;1;Pholcidae;Stygopholcus;absoloni;Stygopholcus absoloni;405;4 357 296;1 657 002;;deep cave;43 572 961 657 002;11;;;7,2
3190;Bali?a špilja;Croatia;12.5.2012.;2012-05-12;2m, 1f;3;Leptonetidae;Barusia;maheni;Barusia maheni;405;4 357 296;1 657 002;tf;deep cave;43 572 961 657 002;11;;;7,2
3191;Bali?a špilja;Croatia;12.5.2012.;2012-05-12;4f;4;Zodariidae;Zodarion;sp. 1;Zodarion sp. 1;405;4 357 296;1 657 002;;;43 572 961 657 002;11;;;7,2
3192;Kravska jama 1;Croatia;11.5.2013.;2013-05-11;3f;3;Linyphiidae;Troglohyphantes;dalmaticus;Troglohyphantes dalmaticus;;43 549 165;16 637 531;tf;deep cave;4 354 916 516 637 530;4;;;
3193;Kravska jama 1;Croatia;11.5.2013.;2013-05-11;1m, 2f;3;Linyphiidae;Troglohyphantes;strandi;Troglohyphantes strandi;;43 549 165;16 637 531;tb;deep cave;4 354 916 516 637 530;4;;;
3194;Kravska jama 1;Croatia;11.5.2013.;2013-05-11;5f;5;Linyphiidae;Troglohyphantes;dalmaticus;Troglohyphantes dalmaticus;;43 549 165;16 637 531;tf;deep cave;4 354 916 516 637 530;4;;;
3196;Kravska jama 1;Croatia;11.5.2013.;2013-05-11;1f;1;Linyphiidae;Gen.;sp. X;Gen. sp. X;;43 549 165;16 637 531;;;4 354 916 516 637 530;4;;;
3197;Bali?a špilja;Croatia;12.5.2012.;2012-05-12;2f, 2juv;4;Linyphiidae;Troglohyphantes;strandi;Troglohyphantes strandi;405;4 357 296;1 657 002;tb;deep cave;43 572 961 657 002;11;;;7,2
3199;Bali?a špilja;Croatia;12.5.2012.;2012-05-12;1m, 1 juv;2;Linyphiidae;Troglohyphantes;giromettai;Troglohyphantes giromettai;405;4 357 296;1 657 002;tf;deep cave;43 572 961 657 002;11;;;7,2
3205;Špilja uz put za Vrdovo;Croatia;28.7.2012.;2012-07-28;1 juv;1;Dysderidae;Harpactea;sp.;Harpactea sp.;;43 963 557;16 649 787;;;4 396 355 716 649 780;1;;5,7;5,7
3207;Meandar 1;Croatia;25.7.2012.;2012-07-25;1m, 1 juv;2;Linyphiidae;Troglohyphantes;dekkingae;Troglohyphantes dekkingae;1556;43 932 384;16 612 019;tf;deep cave;4 393 238 416 612 010;1;;;
3215;Kornjatuša;Croatia;19.7.1997.;1997-07-19;1f? R;1;Dysderidae;Stalagtia;sp. 4_1;Stalagtia sp. 4_1;610;4 297 909;17 673 966;Tb;deep cave;429 790 917 673 966;5;;;10,5
3218;Svetica;Croatia;22.5.2004.;2004-05-22;1f R;1;Amaurobidae;Amaurobius;erberi;Amaurobius erberi;300;43 401 143;16 894 548;Tx;deep cave;4 340 114 316 894 540;5;;;
3220;Golubinka, Desne;Croatia;23.7.1997.;1997-07-23;3 juv R;3;Dysderidae;Stalagtia;sp. 4;Stalagtia sp. 4;40;43 065 371;17 527 293;Tb;deep cave;4 306 537 117 527 290;3;;;
3221;Nevakuša špilja;Croatia;11.9.1997.;1997-09-11;1 juv R;1;Dysderidae;Stalagtia;sp. 4_1;Stalagtia sp. 4_1;;4 297 412;17 686 578;Tb;deep cave;429 741 217 686 578;3;;;
3222;Marasovi?a špilja;Croatia;26.9.1999.;1999-09-26;1 juv R;1;Agelenidae;Histopona;sp.;Histopona sp.;;44 309 906;15 481 716;;;4 430 990 615 481 710;2;;;
3223;Jama u Vrisju;Croatia;27.4.2007.;2007-04-27;1m, 1 juv R;2;Dysderidae;Folkia;haasi;Folkia haasi;;42 944 287;17 118 511;Tb;deep cave;4 294 428 717 118 510;2;;;
3225;Staje 8;Croatia;29.7.2001.;2001-07-29;1 juv R;1;Dysderidae;Stalita;taenaria;Stalita taenaria;;45 447 413;14 143 861;Tb;deep cave;4 544 741 314 143 860;3;;;
3226;?ukina jama;Croatia;19.3.2000.;2000-03-19;1 juv R;1;Dysderidae;Stalagtia;sp. 4;Stalagtia sp. 4;;43 556 313;16 540 533;Tb;deep cave;4 355 631 316 540 530;1;;;
3227;Eko špilja;Croatia;2002.;1905-06-24;1 m R;1;Dysderidae;Parastalita;stygia;Parastalita stygia;;45 350 927;15 478 623;Tb;deep cave;4 535 092 715 478 620;1;;;
3228;Velika špilja, Blato;Croatia;2.12.2001.;2001-12-02;1m R;1;Dysderidae;Folkia;inermis;Folkia inermis;;4 276 443;17 471 825;Tb;deep cave;427 644 317 471 825;8;;;
3229;Movrica;Croatia;17.6.2001.;2001-06-17;3 juv R;3;Agelenidae;Histopona;bidens;Histopona bidens;;42 752 604;17 551 145;tb;deep cave;4 275 260 417 551 140;6;;;11,9
3230;Jama Ikinica;Croatia;13.8.2001.;2001-08-13;13 juv R;13;Dysderidae;Stalita;taenaria;Stalita taenaria;;44 924 393;13 947 791;Tb;deep cave;4 492 439 313 947 790;3;;;
3232;Špilja za Groma?kom vlakom;Croatia;8.9.2006.;2006-09-08;1 juv R;1;Dysderidae;Stalagtia;sp. 5;Stalagtia sp. 5;605;42 743 509;18 027 359;Tb;deep cave;4 274 350 918 027 350;15;;;13,378
3234;Pišurka;Croatia;23.4.2004.;2004-04-23;1m, 1f, 4 juv R;6;Dysderidae;Folkia;haasi;Folkia haasi;;42 959 451;17 129 228;Tb;deep cave;4 295 945 117 129 220;5;;;13,925
3235;Kaverna 781;Croatia;26.8.2005.;2005-08-26;1 juv R;1;Dysderidae;Stalagtia;sp. 1;Stalagtia sp. 1;;4 252 633;183 382;Tb;deep cave;4 252 633 183 382;4;;;12,3
3236;Martina jama;Croatia;9.1.2005.;2005-01-09;1 juv R;1;Dysderidae;Stalagtia;sp. 4;Stalagtia sp. 4;;4 381 399;15 912 668;Tb;deep cave;438 139 915 912 668;1;;;
3237;Piskovica;Croatia;1.11.1998.;1998-11-01;1f R;1;Nesticidae;Kryptonesticus;eremita;Kryptonesticus eremita;315;4 526 207;1 403 692;tf;deep cave;45 262 071 403 692;1;;;
3239;Špilja u Zuniškom dolcu;Croatia;17.9.2006.;2006-09-17;2 juv R;2;Agelenidae;Hadites;tegenarioides;Hadites tegenarioides;;43 132 799;16 737 843;TB;deep cave;4 313 279 916 737 840;1;;;
3242;Ze?ica (ispred);Croatia;26.5.2004.;2004-05-26;1 juv R;1;Agelenidae;Tegenaria;sp.;Tegenaria sp.;;43 260 392;17 146 168;;;4 326 039 217 146 160;3;;;
3245;Kraljevska jama na Gulišini;Croatia;5.8.1997.;1997-08-05;3 juv R;3;Agelenidae;Hadites;tegenarioides;Hadites tegenarioides;;43 133 120;16 744 319;TB;deep cave;4 313 312 016 744 310;3;;;
3248;Oštirova jama;Croatia;18.9.2007.;2007-09-18;1f, 4 juv R;5;Linyphiidae;Troglohyphantes;brignolii;Troglohyphantes brignolii;;45 355 854;14 123 988;tb;deep cave;4 535 585 414 123 980;3;;;
3250;Topolska pe?;Croatia;14.9.2007.;2007-09-14;1f, 1 juv R;2;Linyphiidae;Troglohyphantes;brignolii;Troglohyphantes brignolii;;4 530 489;14 212 681;tb;deep cave;453 048 914 212 681;3;;;6,4
3253;Romanova jama;Croatia;30.9.1995.;1995-09-30;1 juv R;1;Nesticidae;Kryptonesticus;deelemanae;Kryptonesticus deelemanae;;43 307 939;17 067 563;tb;deep cave;4 330 793 917 067 560;2;;;
3258;Markova jama kod Tara;Croatia;31.10.1998.;1998-10-31;4f, 1 juv m R;5;Nesticidae;Kryptonesticus;eremita;Kryptonesticus eremita;95;45 319 298;13 631 373;tf;deep cave;4 531 929 813 631 370;7;;;
3259;Špilja kod mlina Miljacki (Miljacka 4);Croatia;6.1.2005.;2005-01-06;1f R;1;Agelenidae;Tegenaria;sp. 7;Tegenaria sp. 7;175;44 003 485;16 019 087;;;4 400 348 516 019 080;2;;;16
3261;Lukina jama - Trojama;Croatia;9.8.2013.;2013-08-09;1 svlak juv;1;Dysderidae;Gen. 1;sp. 1;Gen. 1 sp. 1;1438;44 766 939;15 026 571;Tb;deep cave;4 476 693 915 026 570;1;;;
3263;Manita pe?;Croatia;23.9.2012.;2012-09-23;1f, 1 juv;2;Agelenidae;Histopona;egonpretneri;Histopona egonpretneri;520;44 314 302;15 475 264;Tb;deep cave;4 431 430 215 475 260;7;;;9,8
3263;Manita pe?;Croatia;23.9.2012.;2012-09-23;1f, 1 juv;2;Agelenidae;Histopona;egonpretneri;Histopona egonpretneri;520;44 314 302;15 475 264;Tb;deep cave;4 431 430 215 475 260;7;;8,8;9,25
3264;Manita pe?;Croatia;23.9.2012.;2012-09-23;1 juv;1;Agelenidae;Histopona;sp.;Histopona sp.;520;44 314 302;15 475 264;;;4 431 430 215 475 260;7;;;9,8
3264;Manita pe?;Croatia;23.9.2012.;2012-09-23;1 juv;1;Agelenidae;Histopona;sp.;Histopona sp.;520;44 314 302;15 475 264;;;4 431 430 215 475 260;7;;8,8;9,25
3265;Manita pe?;Croatia;23.9.2012.;2012-09-23;1m, 1 juv;2;Leptonetidae;Cataleptoneta;lingulata;Cataleptoneta lingulata;520;44 314 302;15 475 264;tb;deep cave;4 431 430 215 475 260;7;;;9,8
3265;Manita pe?;Croatia;23.9.2012.;2012-09-23;1m, 1 juv;2;Leptonetidae;Cataleptoneta;lingulata;Cataleptoneta lingulata;520;44 314 302;15 475 264;tb;deep cave;4 431 430 215 475 260;7;;8,8;9,25
3266;Manita pe?;Croatia;20.4.2013.;2013-04-20;1m;1;Agelenidae;Histopona;egonpretneri;Histopona egonpretneri;520;44 314 302;15 475 264;Tb;deep cave;4 431 430 215 475 260;7;;;9,8
3266;Manita pe?;Croatia;20.4.2013.;2013-04-20;1m;1;Agelenidae;Histopona;egonpretneri;Histopona egonpretneri;520;44 314 302;15 475 264;Tb;deep cave;4 431 430 215 475 260;7;;8,8;9,25
3268;Manita pe?;Croatia;20.4.2013.;2013-04-20;1m;1;Dysderidae;Parastalita;stygia;Parastalita stygia;520;44 314 302;15 475 264;Tb;deep cave;4 431 430 215 475 260;7;;;9,8
3268;Manita pe?;Croatia;20.4.2013.;2013-04-20;1m;1;Dysderidae;Parastalita;stygia;Parastalita stygia;520;44 314 302;15 475 264;Tb;deep cave;4 431 430 215 475 260;7;;8,8;9,25
3269;Manita pe?;Croatia;3.12.2011.;2011-12-03;1 juv;1;Agelenidae;Histopona;sp.;Histopona sp.;520;44 314 302;15 475 264;;;4 431 430 215 475 260;7;;;9,8
3269;Manita pe?;Croatia;3.12.2011.;2011-12-03;1 juv;1;Agelenidae;Histopona;sp.;Histopona sp.;520;44 314 302;15 475 264;;;4 431 430 215 475 260;7;;8,8;9,25
3272;Manita pe?;Croatia;23.9.2012.;2012-09-23;2 juv;2;Agelenidae;Histopona;sp.;Histopona sp.;520;44 314 302;15 475 264;;;4 431 430 215 475 260;7;;;9,8
3272;Manita pe?;Croatia;23.9.2012.;2012-09-23;2 juv;2;Agelenidae;Histopona;sp.;Histopona sp.;520;44 314 302;15 475 264;;;4 431 430 215 475 260;7;;8,8;9,25
3274;Manita pe?;Croatia;20.12.2012.;2012-12-20;1m, 3f, 2 juv;6;Leptonetidae;Cataleptoneta;lingulata;Cataleptoneta lingulata;520;44 314 302;15 475 264;tb;deep cave;4 431 430 215 475 260;7;;;9,8
3274;Manita pe?;Croatia;20.12.2012.;2012-12-20;1m, 3f, 2 juv;6;Leptonetidae;Cataleptoneta;lingulata;Cataleptoneta lingulata;520;44 314 302;15 475 264;tb;deep cave;4 431 430 215 475 260;7;;8,8;9,25
3275;Manita pe?;Croatia;3.12.2011.;2011-12-03;2m, 1f;3;Leptonetidae;Cataleptoneta;lingulata;Cataleptoneta lingulata;520;44 314 302;15 475 264;tb;deep cave;4 431 430 215 475 260;7;;;9,8
3275;Manita pe?;Croatia;3.12.2011.;2011-12-03;2m, 1f;3;Leptonetidae;Cataleptoneta;lingulata;Cataleptoneta lingulata;520;44 314 302;15 475 264;tb;deep cave;4 431 430 215 475 260;7;;8,8;9,25
3276;Manita pe?;Croatia;3.12.2011.;2011-12-03;4m, 1f;5;Leptonetidae;Cataleptoneta;lingulata;Cataleptoneta lingulata;520;44 314 302;15 475 264;tb;deep cave;4 431 430 215 475 260;7;;;9,8
3276;Manita pe?;Croatia;3.12.2011.;2011-12-03;4m, 1f;5;Leptonetidae;Cataleptoneta;lingulata;Cataleptoneta lingulata;520;44 314 302;15 475 264;tb;deep cave;4 431 430 215 475 260;7;;8,8;9,25
3277;Manita pe?;Croatia;20.12.2012.;2012-12-20;1 juv;1;Dysderidae;Parastalita;stygia;Parastalita stygia;520;44 314 302;15 475 264;Tb;deep cave;4 431 430 215 475 260;7;;;9,8
3277;Manita pe?;Croatia;20.12.2012.;2012-12-20;1 juv;1;Dysderidae;Parastalita;stygia;Parastalita stygia;520;44 314 302;15 475 264;Tb;deep cave;4 431 430 215 475 260;7;;8,8;9,25
3278;Manita pe?;Croatia;1.9.2012.;2012-09-01;1 juv;1;Agelenidae;Histopona;sp.;Histopona sp.;520;44 314 302;15 475 264;;;4 431 430 215 475 260;7;;;9,8
3278;Manita pe?;Croatia;1.9.2012.;2012-09-01;1 juv;1;Agelenidae;Histopona;sp.;Histopona sp.;520;44 314 302;15 475 264;;;4 431 430 215 475 260;7;;8,8;9,25
3280;Manita pe?;Croatia;20.4.2013.;2013-04-20;1 juv;1;Dysderidae;Stalita;pretneri;Stalita pretneri;520;44 314 302;15 475 264;Tb;deep cave;4 431 430 215 475 260;7;;;9,8
3280;Manita pe?;Croatia;20.4.2013.;2013-04-20;1 juv;1;Dysderidae;Stalita;pretneri;Stalita pretneri;520;44 314 302;15 475 264;Tb;deep cave;4 431 430 215 475 260;7;;8,8;9,25
3281;Manita pe?;Croatia;3.12.2013.;2013-12-03;1 juv;1;Dysderidae;Parastalita;stygia;Parastalita stygia;520;44 314 302;15 475 264;Tb;deep cave;4 431 430 215 475 260;7;;;9,8
3281;Manita pe?;Croatia;3.12.2013.;2013-12-03;1 juv;1;Dysderidae;Parastalita;stygia;Parastalita stygia;520;44 314 302;15 475 264;Tb;deep cave;4 431 430 215 475 260;7;;8,8;9,25
3284;Manita pe?;Croatia;20.4.2013.;2013-04-20;1 juv;1;Dysderidae;Parastalita;stygia;Parastalita stygia;520;44 314 302;15 475 264;Tb;deep cave;4 431 430 215 475 260;7;;;9,8
3284;Manita pe?;Croatia;20.4.2013.;2013-04-20;1 juv;1;Dysderidae;Parastalita;stygia;Parastalita stygia;520;44 314 302;15 475 264;Tb;deep cave;4 431 430 215 475 260;7;;8,8;9,25
3287;Manita pe?;Croatia;10.2.2013.;2013-02-10;1m;1;Familia x;Gen.;sp.;Gen. sp.;520;44 314 302;15 475 264;;;4 431 430 215 475 260;7;;;9,8
3287;Manita pe?;Croatia;10.2.2013.;2013-02-10;1m;1;Familia x;Gen.;sp.;Gen. sp.;520;44 314 302;15 475 264;;;4 431 430 215 475 260;7;;8,8;9,25
3297;Špilja od Vore;Croatia;30.3.2013.;2013-03-30;5 juv;5;Nesticidae;Kryptonesticus;eremita;Kryptonesticus eremita;;43 057 273;16 135 641;tf;deep cave;4 305 727 316 135 640;1;;;
3298;Mramorcina;Croatia;1.4.2013.;2013-04-01;2 juv;2;Nesticidae;Kryptonesticus;eremita;Kryptonesticus eremita;131;43 012 358;16 113 011;tf;deep cave;4 301 235 816 113 010;2;;;
3300;Gorska jama;Croatia;3.11.2003.;2003-11-03;1m, 1 juv;2;Leptonetidae;Barusia;maheni;Barusia maheni;;4 292 697;17 424 809;tf;deep cave;429 269 717 424 809;2;;10,6;13,3
3301;Špilja na Pozalicu;Croatia;14.6.2001.;2001-06-14;1f, 2 juv;3;Leptonetidae;Barusia;sp. 1;Barusia sp. 1;60;4 276 131;169 129;tb;deep cave;4 276 131 169 129;4;;12,65;14
3302;Gorska jama;Croatia;3.11.2003.;2003-11-03;1f, 1m, 2 juv;4;Leptonetidae;Barusia;maheni;Barusia maheni;;4 292 697;17 424 809;tf;deep cave;429 269 717 424 809;2;;10,6;13,3
3305;Jama pod Bilušinim vrhom;Croatia;24.4.2004.;2004-04-24;1f, 1 juvm, 1 juv;3;Leptonetidae;Barusia;korculana;Barusia korculana;;4 293 959;1 711 266;tb;deep cave;42 939 591 711 266;3;;;
3308;Mala špilja, Blato;Croatia;19.6.2001.;2001-06-19;2f, 2 juv m;4;Leptonetidae;Barusia;maheni;Barusia maheni;;42 764 498;17 471 054;tf;deep cave;4 276 449 817 471 050;5;;;
3310;Špilja pod Kaštel;Croatia;14.6.2001.;2001-06-14;1f;1;Leptonetidae;Barusia;sp. 1;Barusia sp. 1;;42 768 041;16 899 005;tb;deep cave;4 276 804 116 899 000;2;;15,3;16,95
3311;Stonjska pe? donja;Croatia;1.5.2012.;2012-05-01;1 juv f;1;Leptonetidae;Barusia;maheni;Barusia maheni;608;43 315 167;17 130 659;tf;deep cave;4 331 516 717 130 650;6;;;
3313;Stonjska pe? donja;Croatia;1.5.2012.;2012-05-01;1m;1;Leptonetidae;Barusia;maheni;Barusia maheni;608;43 315 167;17 130 659;tf;deep cave;4 331 516 717 130 650;6;;;
3314;Jezero na Gatuli;Croatia;2.10.2005.;2005-10-02;1f;1;Leptonetidae;Barusia;sp. 1;Barusia sp. 1;;42 960 756;16 003 363;tb;deep cave;4 296 075 616 003 360;1;;15,6;16,1
3316;Svetica;Croatia;22.5.2004.;2004-05-22;1f, 4 juv;5;Leptonetidae;Barusia;maheni;Barusia maheni;300;43 401 143;16 894 548;tf;deep cave;4 340 114 316 894 540;5;;;
3317;Jezero na Gatuli;Croatia;18.10.2007.;2007-10-18;1m, 1f;2;Leptonetidae;Barusia;sp. 1;Barusia sp. 1;;42 960 756;16 003 363;tb;deep cave;4 296 075 616 003 360;1;;15,6;16,1
3318;Vilina špilja-Izvor Omble;Croatia;29.4.2010.;2010-04-29;1m;1;Leptonetidae;Sulcia;sp. 2;Sulcia sp. 2;;4 267 716;18 136 236;Tb;deep cave;426 771 618 136 236;5;;;
3320;Mrgi?a ponor (suha pe?ina);Croatia;9.1.1999.;1999-01-09;1 juv f;1;Leptonetidae;Gen. 2;sp. 1;Gen. 2 sp. 1;;45 267 996;15 469 321;;deep cave;4 526 799 615 469 320;1;;;9,05
3321;Špilja kod izvora Rude;Croatia;17.8.2005.;2005-08-17;2f;2;Leptonetidae;Barusia;maheni;Barusia maheni;;43 779 865;16 657 316;tf;deep cave;4 377 986 516 657 310;1;;;
3323;Jama na Visokoj;Croatia;7.8.2007.;2007-08-07;1f;1;Leptonetidae;Barusia;maheni;Barusia maheni;;4 368 201;16 607 257;tf;deep cave;436 820 116 607 257;3;;;
3324;Jezero na Gatuli;Croatia;18.10.2007.;2007-10-18;4f, 2m, 1 juv;7;Leptonetidae;Barusia;sp. 1;Barusia sp. 1;;42 960 756;16 003 363;tb;deep cave;4 296 075 616 003 360;1;;15,6;16,1
3325;Stonjska pe? donja;Croatia;1.5.2012.;2012-05-01;1m;1;Leptonetidae;Sulcia;sp. 4;Sulcia sp. 4;608;43 315 167;17 130 659;Tb;deep cave;4 331 516 717 130 650;6;;;
3327;Poskokova jama;Croatia;2.8.2002.;2002-08-02;1f;1;Leptonetidae;Barusia;korculana;Barusia korculana;;43 001 888;17 134 002;tb;deep cave;4 300 188 817 134 000;4;;;12,3
3328;Šolkina jama;Croatia;1.12.2009.;2009-12-01;1m, 2f, 1 juv;4;Leptonetidae;Sulcia;sp. 5;Sulcia sp. 5;230;42 966 544;17 662 484;;;4 296 654 417 662 480;4;;;
3353;Pe? u ?ulinovim raljevinama;Croatia;6.1.2009.;2009-01-06;3m, 1f;4;Leptonetidae;Barusia;maheni;Barusia maheni;;43 605 854;16 575 066;tf;deep cave;4 360 585 416 575 060;5;;;11
3355;?agjina jama;Croatia;6.4.2007.;2007-04-06;2m;2;Leptonetidae;Barusia;korculana;Barusia korculana;113;42 977 147;17 155 166;tb;deep cave;4 297 714 717 155 160;5;;;17,5
3356;Jezero;Croatia;16.3.2002.;2002-03-16;1m, 2f, 3 juv;6;Pholcidae;Stygopholcus;skotophilus;Stygopholcus skotophilus;903;42 580 381;18 356 073;;deep cave;4 258 038 118 356 070;8;;;7,567
3357;Getaldi?eva špilja;Croatia;11.8.2000.;2000-08-11;1m, 1 juv;2;Pholcidae;Pholcus;phalangioides;Pholcus phalangioides;;42 638 504;18 126 604;;deep cave;4 263 850 418 126 600;1;;;
3360;Jezero;Croatia;28.5.2004.;2004-05-28;2 juv;2;Pholcidae;Stygopholcus;skotophilus;Stygopholcus skotophilus;903;42 580 381;18 356 073;;deep cave;4 258 038 118 356 070;8;;;7,567
3361;Karle;Croatia;12.2.2005.;2005-02-12;1m;1;Pholcidae;Pholcus;phalangioides;Pholcus phalangioides;;42 657 575;18 088 819;;deep cave;4 265 757 518 088 810;1;;;
3363;Franetova jama;Croatia;28.2.1999.;1999-02-28;1f, 1 juv;2;Pholcidae;Stygopholcus;absoloni;Stygopholcus absoloni;;431 361;169 384;;deep cave;431 361 169 384;2;;;
3367;Kukor;Croatia;2.1.1999.;1999-01-02;1m, 1f, 1 juv;3;Pholcidae;Stygopholcus;absoloni;Stygopholcus absoloni;425;43 355 609;16 991 707;;deep cave;4 335 560 916 991 700;10;;;15,4
3369;Tu?epska vilenja?a;Croatia;30.4.2012.;2012-04-30;1 juv;1;Linyphiidae;Typhlonyphia;sp. 1;Typhlonyphia sp. 1;1181;43 286 465;17 083 638;Tb;deep cave;4 328 646 517 083 630;8;;;9,967
3369;Tu?epska vilenja?a;Croatia;30.4.2012.;2012-04-30;1 juv;1;Linyphiidae;Typhlonyphia;sp. 1;Typhlonyphia sp. 1;1181;43 286 465;17 083 638;Tb;deep cave;4 328 646 517 083 630;8;;;11,2
3369;Tu?epska vilenja?a;Croatia;30.4.2012.;2012-04-30;1 juv;1;Linyphiidae;Typhlonyphia;sp. 1;Typhlonyphia sp. 1;1181;43 286 465;17 083 638;Tb;deep cave;4 328 646 517 083 630;8;;10,6;11,025
3370;Tu?epska vilenja?a;Croatia;30.4.2012.;2012-04-30;1f;1;Pholcidae;Stygopholcus;absoloni;Stygopholcus absoloni;1181;43 286 465;17 083 638;;deep cave;4 328 646 517 083 630;8;;;9,967
3370;Tu?epska vilenja?a;Croatia;30.4.2012.;2012-04-30;1f;1;Pholcidae;Stygopholcus;absoloni;Stygopholcus absoloni;1181;43 286 465;17 083 638;;deep cave;4 328 646 517 083 630;8;;;11,2
3370;Tu?epska vilenja?a;Croatia;30.4.2012.;2012-04-30;1f;1;Pholcidae;Stygopholcus;absoloni;Stygopholcus absoloni;1181;43 286 465;17 083 638;;deep cave;4 328 646 517 083 630;8;;10,6;11,025
3373;Kapljarka;Croatia;8.6.2006.;2006-06-08;1m ,2f, 1 juvm, 2 juv;6;Leptonetidae;Cataleptoneta;lingulata;Cataleptoneta lingulata;;44 294 555;15 519 648;tb;deep cave;4 429 455 515 519 640;2;;;
3374;Velika špilja kod Neori?a;Croatia;31.7.2007.;2007-07-31;1m;1;Pholcidae;Stygopholcus;absoloni;Stygopholcus absoloni;703;43 686 117;1 655 312;;deep cave;436 861 171 655 312;2;;;9,5
3384;Kornjatuša;Croatia;2.11.2013.;2013-11-02;2f;2;Pholcidae;Stygopholcus;absoloni;Stygopholcus absoloni;610;4 297 909;17 673 966;;deep cave;429 790 917 673 966;5;;;10,5
3385;Gavranova jama;Croatia;13.8.2013.;2013-08-13;1 juv;1;Linyphiidae;Troglohyphantes;sp. 3;Troglohyphantes sp. 3;;44 745 184;15 072 389;tb;deep cave;4 474 518 415 072 380;1;;;
3388;Kornjatuša;Croatia;2.11.2013.;2013-11-02;1f;1;Leptonetidae;Sulcia;sp.;Sulcia sp.;610;4 297 909;17 673 966;;;429 790 917 673 966;5;;;10,5
3391;Zmajeva špilja;Croatia;26.6.1937.;1937-06-26;1f;1;Amaurobidae;Amaurobius;kratochvili;Amaurobius kratochvili;;43 269 174;16 598 972;Tx;epigean habitat;4 326 917 416 598 970;4;;;
3392;Grgosova špilja stara;Croatia;4.11.2014.;2014-11-04;6juv;6;Nesticidae;Nesticus;cellulanus;Nesticus cellulanus;;45 818 969;1 567 855;tf;deep cave;458 189 691 567 855;6;;;
3393;Grgosova špilja stara;Croatia;4.11.2014.;2014-11-04;3f, 1juv m;4;Linyphiidae;Gen.;sp. X;Gen. sp. X;;45 818 969;1 567 855;;;458 189 691 567 855;6;;;
3394;Grgosova špilja nova;Croatia;4.11.2014.;2014-11-04;1 juv;1;Nesticidae;Nesticus;cellulanus;Nesticus cellulanus;;45 818 715;1 567 827;tf;deep cave;458 187 151 567 827;3;;;
3395;Grgosova špilja nova;Croatia;4.11.2014.;2014-11-04;1 juv;1;Nesticidae;Nesticus;cellulanus;Nesticus cellulanus;;45 818 715;1 567 827;tf;deep cave;458 187 151 567 827;3;;;
3396;Bali?a špilja;Croatia;5.2013.;2013-05;1 juv m;1;Dysderidae;Rhode;sp. 1;Rhode sp. 1;405;4 357 296;1 657 002;Tb;deep cave;43 572 961 657 002;11;;;7,2
3397;Sirena;Croatia;21.4.2014.;2014-04-21;1m, 1f;2;Dysderidae;Gen. 1;sp. 1;Gen. 1 sp. 1;1543;44 768 103;1 498 756;Tb;deep cave;447 681 031 498 756;1;;;
3399;Grgosova špilja nova;Croatia;26.11.2014.;2014-11-26;1f, 1juv;2;Nesticidae;Nesticus;cellulanus;Nesticus cellulanus;;45 818 715;1 567 827;tf;deep cave;458 187 151 567 827;3;;;
3401;Grgosova špilja nova;Croatia;26.11.2014.;2014-11-26;1f;1;Nesticidae;Nesticus;cellulanus;Nesticus cellulanus;;45 818 715;1 567 827;tf;deep cave;458 187 151 567 827;3;;;
3402;Grgosova špilja nova;Croatia;26.11.2014.;2014-11-26;1m;1;Linyphiidae;Porrhomma;microphthalmum;Porrhomma microphthalmum;;45 818 715;1 567 827;Tx;deep cave;458 187 151 567 827;3;;;
3403;Grgosova špilja stara;Croatia;26.11.2014.;2014-11-26;2juvm, 2 juv;4;Nesticidae;Nesticus;cellulanus;Nesticus cellulanus;;45 818 969;1 567 855;tf;deep cave;458 189 691 567 855;6;;;
3405;Grgosova špilja nova;Croatia;26.11.2014.;2014-11-26;1m;1;Amaurobidae;Amaurobius;ferox;Amaurobius ferox;;45 818 715;1 567 827;Tf;deep cave;458 187 151 567 827;3;;;
3406;Grgosova špilja stara;Croatia;26.11.2014.;2014-11-26;2f, 5 juv;7;Nesticidae;Nesticus;cellulanus;Nesticus cellulanus;;45 818 969;1 567 855;tf;deep cave;458 189 691 567 855;6;;;
3408;Grgosova špilja stara;Croatia;26.11.2014.;2014-11-26;1f;1;Linyphiidae;Centromerus;cavernarum;Centromerus cavernarum;;45 818 969;1 567 855;Tf;deep cave;458 189 691 567 855;6;;;
3409;Grgosova špilja stara;Croatia;26.11.2014.;2014-11-26;1m;1;Tetragnathidae;Meta;menardi;Meta menardi;;45 818 969;1 567 855;Tf;deep cave;458 189 691 567 855;6;;;
3410;Židovske jame;Croatia;26.11.2014.;2014-11-26;1f;1;Linyphiidae;Troglohyphantes;sp. 12;Troglohyphantes sp. 12;;45 997 503;16 038 982;tf;deep cave;4 599 750 316 038 980;2;;;
3412;Kukova pe?;Croatia;30.11.2014.;2014-11-30;3f, 2m, 3 juv;8;Tetragnathidae;Meta;bourneti;Meta bourneti;;42 726 992;1 796 566;Tf;deep cave;427 269 921 796 566;5;;17;16,6
3413;Židovske jame;Croatia;21.12.2014.;2014-12-21;1f, 1 juvm, 2 juv;4;Linyphiidae;Troglohyphantes;excavatus;Troglohyphantes excavatus;;45 997 503;16 038 982;tf;deep cave;4 599 750 316 038 980;2;;;
3414;Židovske jame;Croatia;21.12.2014.;2014-12-21;1f;1;Linyphiidae;Troglohyphantes;excavatus;Troglohyphantes excavatus;;45 997 503;16 038 982;tf;deep cave;4 599 750 316 038 980;2;;;
3415;Židovske jame;Croatia;21.12.2014.;2014-12-21;1f, 1 juv;2;Linyphiidae;Troglohyphantes;excavatus;Troglohyphantes excavatus;;45 997 503;16 038 982;tf;deep cave;4 599 750 316 038 980;2;;;
3417;Židovske jame;Croatia;21.12.2014.;2014-12-21;1f, 1juv;2;Linyphiidae;Troglohyphantes;sp. 12;Troglohyphantes sp. 12;;45 997 503;16 038 982;tf;deep cave;4 599 750 316 038 980;2;;;
3418;Židovske jame;Croatia;21.12.2014.;2014-12-21;1f;1;Linyphiidae;Troglohyphantes;excavatus;Troglohyphantes excavatus;;45 997 503;16 038 982;tf;deep cave;4 599 750 316 038 980;2;;;
3419;Židovske jame;Croatia;21.12.2014.;2014-12-21;1f, 1juv;2;Linyphiidae;Troglohyphantes;sp. 12;Troglohyphantes sp. 12;;45 997 503;16 038 982;tf;deep cave;4 599 750 316 038 980;2;;;
3420;Brušane (CLD, materijal od doma);Croatia;16.10.1980.;1980-10-16;1f, 1m;2;Dysderidae;Harpactea;lepida;Harpactea lepida;;44 500 768;15 270 244;Tx;deep cave;4 450 076 815 270 240;1;;;
3422;Vrelo;Croatia;20.4.1974.;1974-04-20;1f;1;Linyphiidae;Troglohyphantes;croaticus;Troglohyphantes croaticus;730;45 326 489;14 704 217;tb;deep cave;4 532 648 914 704 210;8;;;
3423;Njivice, Krk (CLD, materijal od doma);Croatia;27.10.1980.;1980-10-27;1m, 1f, 1juvm;3;Dysderidae;Dysdera;ninnii;Dysdera ninnii;;45 158 049;14 538 878;Tx;;4 515 804 914 538 870;1;;;
3424;Ozaljska špilja;Croatia;22.4.1973.;1973-04-22;1f;1;Agelenidae;Tegenaria;sp. X;Tegenaria sp. X;;45 615 811;15 465 045;;;4 561 581 115 465 040;5;;;
3425;NP Paklenica (CLD, materijal od doma);Croatia;19.10.1980.;1980-10-19;1m, 1f, 1 juvm;3;Amaurobidae;Amaurobius;sp. x;Amaurobius sp. x;;44 343 694;15 483 995;Tx;;4 434 369 415 483 990;1;;;
3429;Hvar (CLD, materijal od doma);Croatia;12.4.1977.;1977-04-12;1f, Rm bulbus;1;Dysderidae;Dysdera;bottazziae;Dysdera bottazziae;;43 133 332;16 733 332;Tx;;4 313 333 216 733 330;1;;;
3434;Ami?ina pe?ina;Croatia;11.5.2014.;2014-05-11;1f;1;Dysderidae;Parastalita;stygia;Parastalita stygia;;44 636 775;15 361 277;Tb;deep cave;4 463 677 515 361 270;1;;;
3436;Sitvukova špilja;Croatia;8.8.2014.;2014-08-08;1f;1;Dysderidae;Parastalita;stygia;Parastalita stygia;;4 467 871;15 344 906;Tb;deep cave;446 787 115 344 906;2;;;
3437;Sitvukova špilja;Croatia;8.8.2014.;2014-08-08;1juvm;1;Dysderidae;Stalita;pretneri;Stalita pretneri;;4 467 871;15 344 906;Tb;deep cave;446 787 115 344 906;2;;;
3438;Milinkovi?eva špilja;Croatia;;;1m, 1f;2;Linyphiidae;Tenuiphantes;tenuis;Tenuiphantes tenuis;;44 658 953;15 194 442;;;4 465 895 315 194 440;1;;;
3439;Pe?ina kod Garište;Croatia;15.4.1974.;1974-04-15;1f, 3 juv, dio bulbusa m;4;Linyphiidae;Centromerus;sylvaticus;Centromerus sylvaticus;;43 756 233;16 730 879;tx;deep cave;4 375 623 316 730 870;1;;;
3444;Ozaljska špilja;Croatia;22.4.1973.;1973-04-22;1f;1;Linyphiidae;Formiphantes;lepthyphantiformis;Formiphantes lepthyphantiformis;;45 615 811;15 465 045;Tf;deep cave;4 561 581 115 465 040;5;;;
3452;Šipun;Croatia;5.8.1969.;1969-08-05;1f;1;Linyphiidae;Palliduphantes;brignolii;Palliduphantes brignolii;;42 583 646;18 217 986;Tb;deep cave;4 258 364 618 217 980;11;;;15,4
3466;Mjese?evi?a špilja;Croatia;3.12.2014.;2014-12-03;1f, 1juv;2;Leptonetidae;Sulcia;sp. 2;Sulcia sp. 2;;42 480 511;18 411 965;Tb;deep cave;4 248 051 118 411 960;3;;;
3529;Regrutova spila ol Vore;Croatia;26.4.2015.;2015-04-26;2juvm, 1 juv;3;Nesticidae;Kryptonesticus;eremita;Kryptonesticus eremita;110;430 688;16 120 592;tf;deep cave;43 068 816 120 592;1;;;
3530;Mo?iljska špilja;Croatia;26.8.2014.;2014-08-26;3f;3;Leptonetidae;Sulcia;sp.;Sulcia sp.;;42 689 061;18 071 906;;;4 268 906 118 071 900;6;;15,4;14,7
3531;Jama na vrh Prodoli;Croatia;23.8.2014.;2014-08-23;1m;1;Leptonetidae;Barusia;maheni;Barusia maheni;;42 720 837;18 021 231;tf;deep cave;4 272 083 718 021 230;1;;;21,6
3533;Vilinska jama;Croatia;5.6.2014.;2014-06-05;2m, 2f;4;Leptonetidae;Barusia;maheni;Barusia maheni;121;42 728 553;17 881 121;tf;deep cave;4 272 855 317 881 120;10;;;13,6
3534;Tihinja;Croatia;8.6.2014.;2014-06-08;2f;2;Linyphiidae;Centromerus;raridentatus sp.n.;Centromerus raridentatus sp.n.;50;42 866 729;1 767 021;;;428 667 291 767 021;5;;;9,8
3535;Tihinja;Croatia;8.6.2014.;2014-06-08;3f, 2m, 3 juv;8;Linyphiidae;Palliduphantes;sp. 6;Palliduphantes sp. 6;50;42 866 729;1 767 021;;;428 667 291 767 021;5;;;9,8
3536;Tihinja;Croatia;8.6.2014.;2014-06-08;1m, 1f, 2juvm;4;Leptonetidae;Sulcia;sp. 13;Sulcia sp. 13;50;42 866 729;1 767 021;;deep cave;428 667 291 767 021;5;;;9,8
3537;Meduza;Croatia;1.8.2015.;2015-08-01;2 svlaka, 1 bulbus;;Dysderidae;Gen. 1;sp. 1;Gen. 1 sp. 1;1600;4 476 237;14 987 194;Tb;deep cave;447 623 714 987 194;1;;;
3538;Meduza;Croatia;4.8.2015.;2015-08-04;1f;1;Dysderidae;Gen. 1;sp. 1;Gen. 1 sp. 1;1600;4 476 237;14 987 194;Tb;deep cave;447 623 714 987 194;1;;;
3541;Gornja Cerova?ka špilja;Croatia;2.5.2015.;2015-05-02;1f;1;Dysderidae;Stalita;pretneri;Stalita pretneri;700;44 273 382;15 884 227;Tb;deep cave;4 427 338 215 884 220;2;;;
3542;Gornja Cerova?ka špilja;Croatia;2.5.2015.;2015-05-02;1 juv;1;Dysderidae;Parastalita;stygia;Parastalita stygia;700;44 273 382;15 884 227;Tb;deep cave;4 427 338 215 884 220;2;;;
3544;Jama na Strmici;Croatia;11.4.2015.;2015-04-11;1m;1;Dysderidae;Dasumia;amoena;Dasumia amoena;;42 767 364;17 452 506;tx;deep cave;4 276 736 417 452 500;6;;;12,1
3547;Do?ina špilja;Croatia;11.4.2015.;2015-04-11;5 juv;5;Agelenidae;Histopona;sp.;Histopona sp.;;42 758 091;17 489 642;tx;;4 275 809 117 489 640;1;;;14,6
3549;Špilja kod Nerezinog dola;Croatia;5.4.2015.;2015-04-05;2 juv;2;Dysderidae;Folkia;inermis;Folkia inermis;;42 758 378;17 436 094;tb;deep cave;4 275 837 817 436 090;6;;;15,5
3549;Špilja kod Nerezinog dola;Croatia;5.4.2015.;2015-04-05;2 juv;2;Dysderidae;Folkia;inermis;Folkia inermis;;42 758 378;17 436 094;tb;deep cave;4 275 837 817 436 090;6;;;12,267
3550;Jama na Brekalcima;Croatia;6.5.2015.;2015-05-06;1juv;1;Agelenidae;Histopona;bidens;Histopona bidens;;42 781 895;17 407 747;tb;deep cave;4 278 189 517 407 740;1;;;12,867
3551;Jama na Žutim kokom;Croatia;9.4.2015.;2015-04-09;5 juv;5;Agelenidae;Histopona;bidens;Histopona bidens;;42 712 746;17 682 621;tb;deep cave;4 271 274 617 682 620;3;;;
3552;Jama iznad Dugog polja;Croatia;11.4.2015.;2015-04-11;1f;1;Leptonetidae;Barusia;maheni;Barusia maheni;;4 275 873;17 448 697;tf;deep cave;427 587 317 448 697;5;;16,3;16,4
3552;Jama iznad Dugog polja;Croatia;11.4.2015.;2015-04-11;1f;1;Leptonetidae;Barusia;maheni;Barusia maheni;;4 275 873;17 448 697;tf;deep cave;427 587 317 448 697;5;;;15,4
3553;Jama iznad Dugog polja;Croatia;11.4.2015.;2015-04-11;1 juv;1;Agelenidae;Histopona;bidens;Histopona bidens;;4 275 873;17 448 697;tb;deep cave;427 587 317 448 697;5;;16,3;16,4
3553;Jama iznad Dugog polja;Croatia;11.4.2015.;2015-04-11;1 juv;1;Agelenidae;Histopona;bidens;Histopona bidens;;4 275 873;17 448 697;tb;deep cave;427 587 317 448 697;5;;;15,4
3554;Jama Veja Gora;Croatia;11.4.2015.;2015-04-11;2 juv;2;Agelenidae;Histopona;bidens;Histopona bidens;;42 780 094;17 417 734;tb;deep cave;4 278 009 417 417 730;1;;;12,4
3555;Movrica;Croatia;8.4.2015.;2015-04-08;1 juv f, 1 juv;2;Agelenidae;Histopona;bidens;Histopona bidens;;42 752 604;17 551 145;tb;deep cave;4 275 260 417 551 140;6;;;11,9
3556;Jama za Sv. Ilijom;Croatia;10.4.2015.;2015-04-10;1 juv;1;Agelenidae;Histopona;bidens;Histopona bidens;;42 744 428;17 515 269;tb;deep cave;4 274 442 817 515 260;3;;;12,533
3557;Špilja u Solinama;Croatia;4.4.2015.;2015-04-04;2 juv m;2;Leptonetidae;Sulcia;sp.;Sulcia sp.;;42 768 021;17 377 062;tx;;4 276 802 117 377 060;5;;;10,3
3557;Špilja u Solinama;Croatia;4.4.2015.;2015-04-04;2 juv m;2;Leptonetidae;Sulcia;sp.;Sulcia sp.;;42 768 021;17 377 062;tx;;4 276 802 117 377 060;5;;;6,25
3557;Špilja u Solinama;Croatia;4.4.2015.;2015-04-04;2 juv m;2;Leptonetidae;Sulcia;sp.;Sulcia sp.;;42 768 021;17 377 062;tx;;4 276 802 117 377 060;5;;;10,3
3559;Ostaševica;Croatia;8.4.2015.;2015-04-08;1 juv;1;Agelenidae;Histopona;bidens;Histopona bidens;;42 748 959;17 544 404;tb;deep cave;4 274 895 917 544 400;9;;;11,4
3560;Špilja na Bugarima;Croatia;7.4.2015.;2015-04-07;1 juv;1;Agelenidae;Histopona;bidens;Histopona bidens;;42 752 459;17 474 369;tb;deep cave;4 275 245 917 474 360;3;;;11,9
3561;Špilja na Bugarima;Croatia;7.4.2015.;2015-04-07;1f;1;Leptonetidae;Sulcia;sp.;Sulcia sp.;;42 752 459;17 474 369;tx;;4 275 245 917 474 360;3;;;11,9
3562;Jara? na ponti od Graca;Croatia;6.4.2015.;2015-04-06;1f;1;Agelenidae;Histopona;bidens;Histopona bidens;;42 785 308;17 392 067;tb;deep cave;4 278 530 817 392 060;2;;;10,833
3566;Špilja na Bugarima;Croatia;7.4.2015.;2015-04-07;1 juv;1;Agelenidae;Histopona;bidens;Histopona bidens;;42 752 459;17 474 369;tb;deep cave;4 275 245 917 474 360;3;;;11,9
3567;Špilja na Bugarima;Croatia;7.4.2015.;2015-04-07;1m, 1 juv m;2;Leptonetidae;Barusia;maheni;Barusia maheni;;42 752 459;17 474 369;tf;deep cave;4 275 245 917 474 360;3;;;11,9
3575;Velika špilja, Blato;Croatia;5.4.2015.;2015-04-05;2f?, 2 juv;4;Leptonetidae;Barusia;maheni;Barusia maheni;;4 276 443;17 471 825;tf;deep cave;427 644 317 471 825;8;;;
3577;Špilja kod Vrha spile;Croatia;6.4.2015.;2015-04-06;1 juv;1;Agelenidae;Tegenaria;sp.;Tegenaria sp.;;42 776 757;17 420 591;tx;;4 277 675 717 420 590;3;;;9,4
3578;Špilja kod Vrha spile;Croatia;6.4.2015.;2015-04-06;1m, 1f/juv;2;Leptonetidae;Barusia;maheni;Barusia maheni;;42 776 757;17 420 591;tf;deep cave;4 277 675 717 420 590;3;;;9,4
3581;Špilja kod Nerezinog dola;Croatia;6.4.2015.;2015-04-06;1f/juv;1;Leptonetidae;Barusia;maheni;Barusia maheni;;42 758 378;17 436 094;tf;deep cave;4 275 837 817 436 090;6;;;15,5
3581;Špilja kod Nerezinog dola;Croatia;6.4.2015.;2015-04-06;1f/juv;1;Leptonetidae;Barusia;maheni;Barusia maheni;;42 758 378;17 436 094;tf;deep cave;4 275 837 817 436 090;6;;;12,267
3583;Jara? na ponti od Graca;Croatia;6.4.2015.;2015-04-06;1 juv m;1;Leptonetidae;Barusia;maheni;Barusia maheni;;42 785 308;17 392 067;tf;deep cave;4 278 530 817 392 060;2;;;10,833
3586;Špilja u Brdskoj gori;Croatia;7.4.2015.;2015-04-07;1m, 3 juv;4;Leptonetidae;Sulcia;nocturna;Sulcia nocturna;;42 756 339;1 749 651;tb;deep cave;427 563 391 749 651;1;;;
3587;Gali?njak;Croatia;9.4.2015.;2015-04-09;1f;1;Leptonetidae;Barusia;maheni;Barusia maheni;;42 720 118;1 767 071;tf;deep cave;427 201 181 767 071;11;;;13,6
3588;Gali?njak;Croatia;9.4.2015.;2015-04-09;2m, 3f, 2juv m, 4 juv;11;Leptonetidae;Sulcia;sp. 6;Sulcia sp. 6;;42 720 118;1 767 071;tf;cave entrance;427 201 181 767 071;11;;;13,6
3592;Velika špilja, Blato;Croatia;5.4.2015.;2015-04-05;1 juv;1;Dysderidae;Folkia;inermis;Folkia inermis;;4 276 443;17 471 825;Tb;deep cave;427 644 317 471 825;8;;;
3593;Velika špilja, Blato;Croatia;5.4.2015.;2015-04-05;1f;1;Pholcidae;Spermophora;senoculata;Spermophora senoculata;;4 276 443;17 471 825;Tf;deep cave;427 644 317 471 825;8;;;
3594;Velika špilja, Blato;Croatia;5.4.2015.;2015-04-05;2m,2 juv;4;Leptonetidae;Barusia;maheni;Barusia maheni;;4 276 443;17 471 825;tf;deep cave;427 644 317 471 825;8;;;
3595;Velika špilja, Blato;Croatia;5.4.2015.;2015-04-05;1m;1;Theridiidae;Pholcomma;gibbum;Pholcomma gibbum;;4 276 443;17 471 825;Tx;;427 644 317 471 825;8;;;
3597;Špilja kod Nerezinog dola;Croatia;5.4.2015.;2015-04-05;1 juv;1;Dysderidae;Folkia;inermis;Folkia inermis;;42 758 378;17 436 094;Tb;deep cave;4 275 837 817 436 090;6;;;15,5
3597;Špilja kod Nerezinog dola;Croatia;5.4.2015.;2015-04-05;1 juv;1;Dysderidae;Folkia;inermis;Folkia inermis;;42 758 378;17 436 094;Tb;deep cave;4 275 837 817 436 090;6;;;12,267
3598;Špilja kod Nerezinog dola;Croatia;5.4.2015.;2015-04-05;1f, 3 juv;4;Agelenidae;Histopona;bidens;Histopona bidens;;42 758 378;17 436 094;tb;deep cave;4 275 837 817 436 090;6;;;15,5
3598;Špilja kod Nerezinog dola;Croatia;5.4.2015.;2015-04-05;1f, 3 juv;4;Agelenidae;Histopona;bidens;Histopona bidens;;42 758 378;17 436 094;tb;deep cave;4 275 837 817 436 090;6;;;12,267
3601;Jama iznad Dugog polja;Croatia;11.4.2015.;2015-04-11;1f, 3 juv;4;Agelenidae;Histopona;bidens;Histopona bidens;;4 275 873;17 448 697;tb;deep cave;427 587 317 448 697;5;;16,3;16,4
3601;Jama iznad Dugog polja;Croatia;11.4.2015.;2015-04-11;1f, 3 juv;4;Agelenidae;Histopona;bidens;Histopona bidens;;4 275 873;17 448 697;tb;deep cave;427 587 317 448 697;5;;;15,4
3602;Jama iznad Dugog polja;Croatia;11.4.2015.;2015-04-11;1 juv m, 2 juv;3;Agelenidae;Histopona;sp.;Histopona sp.;;4 275 873;17 448 697;;;427 587 317 448 697;5;;16,3;16,4
3602;Jama iznad Dugog polja;Croatia;11.4.2015.;2015-04-11;1 juv m, 2 juv;3;Agelenidae;Histopona;sp.;Histopona sp.;;4 275 873;17 448 697;;;427 587 317 448 697;5;;;15,4
3603;Jama iznad Dugog polja;Croatia;11.4.2015.;2015-04-11;1 juv;1;Dysderidae;Folkia;inermis;Folkia inermis;;4 275 873;17 448 697;Tb;deep cave;427 587 317 448 697;5;;16,3;16,4
3603;Jama iznad Dugog polja;Croatia;11.4.2015.;2015-04-11;1 juv;1;Dysderidae;Folkia;inermis;Folkia inermis;;4 275 873;17 448 697;Tb;deep cave;427 587 317 448 697;5;;;15,4
3604;Stražbenica;Croatia;6.3.2015.;2015-03-06;1m;1;Nesticidae;Kryptonesticus;eremita;Kryptonesticus eremita;;43 697 353;16 029 618;tf;deep cave;4 369 735 316 029 610;3;;;14,7
3605;Stražbenica;Croatia;14.12.2014.;2014-12-14;1m, 1f;2;Nesticidae;Kryptonesticus;eremita;Kryptonesticus eremita;;43 697 353;16 029 618;tf;deep cave;4 369 735 316 029 610;3;;;14,7
3606;Stražbenica;Croatia;14.12.2014.;2014-12-14;1 juv;1;Dysderidae;Stalagtia;sp. 4;Stalagtia sp. 4;;43 697 353;16 029 618;Tb;deep cave;4 369 735 316 029 610;3;;;14,7
3607;Stražbenica;Croatia;14.12.2014.;2014-12-14;3f;3;Linyphiidae;Palliduphantes;istrianus;Palliduphantes istrianus;;43 697 353;16 029 618;Tf;deep cave;4 369 735 316 029 610;3;;;14,7
3608;Mandalina;Croatia;14.12.2014.;2014-12-14;1f;1;Dysderidae;Stalagtia;sp. 4;Stalagtia sp. 4;;43 711 127;15 902 143;Tb;deep cave;4 371 112 715 902 140;2;;;
3609;Mandalina;Croatia;14.12.2014.;2014-12-14;1m, 2f, 2 juv;5;Nesticidae;Kryptonesticus;eremita;Kryptonesticus eremita;;43 711 127;15 902 143;tf;deep cave;4 371 112 715 902 140;2;;;
3610;Topla pe?ina;Croatia;6.3.2015.;2015-03-06;1f;1;Nesticidae;Kryptonesticus;eremita;Kryptonesticus eremita;;43 839 254;160 536;tf;deep cave;43 839 254 160 536;4;;;
3611;Topla pe?ina;Croatia;6.3.2015.;2015-03-06;1m;1;Dysderidae;Stalagtia;sp. 4;Stalagtia sp. 4;;43 839 254;160 536;Tb;deep cave;43 839 254 160 536;4;;;
3612;Triši?a jama;Croatia;13.12.2014.;2014-12-13;1f;1;Linyphiidae;Palliduphantes;istrianus;Palliduphantes istrianus;;43 949 231;15 947 793;Tf;deep cave;4 394 923 115 947 790;2;;;10,38
3613;Triši?a jama;Croatia;13.12.2014.;2014-12-13;1m;1;Linyphiidae;Micrargus;herbigradus;Micrargus herbigradus;;43 949 231;15 947 793;Tf;deep cave;4 394 923 115 947 790;2;;;10,38
3614;Triši?a jama;Croatia;13.12.2014.;2014-12-13;1m, 1f;2;Linyphiidae;Micrargus;herbigradus;Micrargus herbigradus;;43 949 231;15 947 793;Tf;deep cave;4 394 923 115 947 790;2;;;10,38
3615;Triši?a jama;Croatia;13.12.2014.;2014-12-13;1m;1;Linyphiidae;Palliduphantes;istrianus;Palliduphantes istrianus;;43 949 231;15 947 793;Tf;deep cave;4 394 923 115 947 790;2;;;10,38
3616;Jazinka;Croatia;7.3.2015.;2015-03-07;1m;1;Nesticidae;Kryptonesticus;eremita;Kryptonesticus eremita;235;43 975 892;16 029 694;tf;deep cave;4 397 589 216 029 690;2;;;13
3617;Jazinka;Croatia;16.12.2014.;2014-12-16;1m;1;Dysderidae;Stalagtia;sp. 4;Stalagtia sp. 4;235;43 975 892;16 029 694;Tb;deep cave;4 397 589 216 029 690;2;;;13
3620;Ozi?ana pe?ina;Croatia;17.12.2014.;2014-12-17;1f;1;Dysderidae;Stalagtia;sp. 4;Stalagtia sp. 4;;4 390 774;15 980 634;Tb;deep cave;439 077 415 980 634;4;;;
3621;Ozi?ana pe?ina;Croatia;17.12.2014.;2014-12-17;1f;1;Theridiidae;Gen.;sp.;Gen. sp.;;4 390 774;15 980 634;;;439 077 415 980 634;4;;;
3622;Ozi?ana pe?ina;Croatia;17.12.2014.;2014-12-17;1m, 1f;2;Pholcidae;Holocnemus;pluchei;Holocnemus pluchei;;4 390 774;15 980 634;tf;deep cave;439 077 415 980 634;4;;;
3623;Ozi?ana pe?ina;Croatia;17.12.2014.;2014-12-17;2f, 1 juvm, 4 juv;7;Nesticidae;Kryptonesticus;eremita;Kryptonesticus eremita;;4 390 774;15 980 634;tf;deep cave;439 077 415 980 634;4;;;
3624;Stara jametina;Croatia;13.12.2014.;2014-12-13;1m, 1f;2;Linyphiidae;Micrargus;herbigradus;Micrargus herbigradus;;44 013 402;16 067 798;Tf;deep cave;4 401 340 216 067 790;6;;;13
3624;Stara jametina;Croatia;13.12.2014.;2014-12-13;1m, 1f;2;Linyphiidae;Micrargus;herbigradus;Micrargus herbigradus;;44 013 402;16 067 798;Tf;deep cave;4 401 340 216 067 790;6;;13,4;13,4
3625;Stara jametina;Croatia;13.12.2014.;2014-12-13;1m;1;Linyphiidae;Palliduphantes;istrianus;Palliduphantes istrianus;;43 794 009;1 600 259;Tf;deep cave;437 940 091 600 259;6;;;13
3625;Stara jametina;Croatia;13.12.2014.;2014-12-13;1m;1;Linyphiidae;Palliduphantes;istrianus;Palliduphantes istrianus;;43 794 009;1 600 259;Tf;deep cave;437 940 091 600 259;6;;13,4;13,4
3626;Stara jametina;Croatia;13.12.2014.;2014-12-13;1m;1;Linyphiidae;Micrargus;herbigradus;Micrargus herbigradus;;43 794 009;1 600 259;Tf;deep cave;437 940 091 600 259;6;;;13
3626;Stara jametina;Croatia;13.12.2014.;2014-12-13;1m;1;Linyphiidae;Micrargus;herbigradus;Micrargus herbigradus;;43 794 009;1 600 259;Tf;deep cave;437 940 091 600 259;6;;13,4;13,4
3628;Stara jametina;Croatia;6.3.2015.;2015-03-06;1f, 1 juv;2;Theridiidae;Episinus;cavernicola;Episinus cavernicola;;43 794 009;1 600 259;Tf;deep cave;437 940 091 600 259;6;;;13
3628;Stara jametina;Croatia;6.3.2015.;2015-03-06;1f, 1 juv;2;Theridiidae;Episinus;cavernicola;Episinus cavernicola;;43 794 009;1 600 259;Tf;deep cave;437 940 091 600 259;6;;13,4;13,4
3630;Stara jametina;Croatia;13.12.2014.;2014-12-13;1m;1;Linyphiidae;Micrargus;herbigradus;Micrargus herbigradus;;43 794 009;1 600 259;Tf;deep cave;437 940 091 600 259;6;;;13
3630;Stara jametina;Croatia;13.12.2014.;2014-12-13;1m;1;Linyphiidae;Micrargus;herbigradus;Micrargus herbigradus;;43 794 009;1 600 259;Tf;deep cave;437 940 091 600 259;6;;13,4;13,4
3631;Stara jametina;Croatia;13.12.2014.;2014-12-13;1m;1;Dysderidae;Harpactea;sp. 18;Harpactea sp. 18;;43 794 009;1 600 259;Tf;deep cave;437 940 091 600 259;6;;;13
3631;Stara jametina;Croatia;13.12.2014.;2014-12-13;1m;1;Dysderidae;Harpactea;sp. 18;Harpactea sp. 18;;43 794 009;1 600 259;Tf;deep cave;437 940 091 600 259;6;;13,4;13,4
3705;Jama pod Sinji kuk;Croatia;24.10.2015.;2015-10-24;2 juv;2;Nesticidae;Kryptonesticus;eremita;Kryptonesticus eremita;;42 709 828;17 988 632;tf;deep cave;4 270 982 817 988 630;5;;;16,2
3706;Jama pod Sinji kuk;Croatia;24.10.2015.;2015-10-24;1f, 1 juv;2;Nesticidae;Kryptonesticus;eremita;Kryptonesticus eremita;;42 709 828;17 988 632;tf;deep cave;4 270 982 817 988 630;5;;;16,2
3707;Jama pod Sinji kuk;Croatia;24.10.2015.;2015-10-24;1 juv;1;Leptonetidae;Gen. 1;sp. 1;Gen. 1 sp. 1;;42 709 828;17 988 632;Tb;deep cave;4 270 982 817 988 630;5;;;16,2
3708;Jama pod Sinji kuk;Croatia;24.10.2015.;2015-10-24;2f;2;Pholcidae;Holocnemus;pluchei;Holocnemus pluchei;;42 709 828;17 988 632;tf;deep cave;4 270 982 817 988 630;5;;;16,2
3709;Jama pod Sinji kuk;Croatia;24.10.2015.;2015-10-24;2f;2;Linyphiidae;Asthenargus;bracianus;Asthenargus bracianus;;42 709 828;17 988 632;tf;deep cave;4 270 982 817 988 630;5;;;16,2
3817;Jama pod Sinji kuk;Croatia;24.10.2015.;2015-10-24;1m, 1f, 2 juv;4;Leptonetidae;Gen. 1;sp. 1;Gen. 1 sp. 1;;42 709 828;17 988 632;Tb;deep cave;4 270 982 817 988 630;5;;;16,2
3819;Jama pod Sinji kuk;Croatia;24.10.2015.;2015-10-24;1 juvm, 1 juv, 1f;3;Leptonetidae;Gen. 1;sp. 1;Gen. 1 sp. 1;;42 709 828;17 988 632;Tb;deep cave;4 270 982 817 988 630;5;;;16,2
3820;Jama pod Sinji kuk;Croatia;24.10.2015.;2015-10-24;2 juv;2;Nesticidae;Kryptonesticus;eremita;Kryptonesticus eremita;;42 709 828;17 988 632;tf;deep cave;4 270 982 817 988 630;5;;;16,2
3825;Punar u Luci;Croatia;4.8.2015.;2015-08-04;1 juv;1;Dysderidae;Parastalita;stygia;Parastalita stygia;;44 345 815;15 988 437;Tb;deep cave;4 434 581 515 988 430;1;;;7,35
3826;Spila 2;Croatia;7.7.2015.;2015-07-07;1 juv;1;Dysderidae;Stalagtia;sp. 4;Stalagtia sp. 4;;4 326 239;17 204 021;Tb;deep cave;432 623 917 204 021;6;;12;12
3827;Male ponte;Croatia;19.10.2015.;2015-10-19;2f, 2 juv;4;Leptonetidae;Sulcia;sp.;Sulcia sp.;;42 761 389;17 430 786;;;4 276 138 917 430 780;7;;;14,45
3830;Male ponte;Croatia;19.10.2015.;2015-10-19;1 juv;1;Dysderidae;Folkia;sp. 5;Folkia sp. 5;;42 761 389;17 430 786;Tb;deep cave;4 276 138 917 430 780;7;;;14,45
3831;Male ponte;Croatia;19.10.2015.;2015-10-19;1f, 1m;2;Leptonetidae;Sulcia;nocturna;Sulcia nocturna;;42 761 389;17 430 786;;deep cave;4 276 138 917 430 780;7;;;14,45
3833;Gali?njak;Croatia;22.10.2015.;2015-10-22;1f, 1m, 1juvm, 3 juv/f, 4 juv;1;Leptonetidae;Sulcia;sp. 6;Sulcia sp. 6;;42 720 118;1 767 071;Tf;cave entrance;427 201 181 767 071;11;;;13,6
3834;Gali?njak;Croatia;22.10.2015.;2015-10-22;3f, 7 juv, 2m;12;Leptonetidae;Sulcia;sp. 6;Sulcia sp. 6;;42 720 118;1 767 071;Tf;cave entrance;427 201 181 767 071;11;;;13,6
3836;Špilja kod Nerezinog dola;Croatia;19.10.2015.;2015-10-19;1f;1;Dysderidae;Folkia;inermis;Folkia inermis;;42 758 378;17 436 094;Tb;deep cave;4 275 837 817 436 090;6;;;15,5
3836;Špilja kod Nerezinog dola;Croatia;19.10.2015.;2015-10-19;1f;1;Dysderidae;Folkia;inermis;Folkia inermis;;42 758 378;17 436 094;Tb;deep cave;4 275 837 817 436 090;6;;;12,267
3841;Špilja kod Nerezinog dola;Croatia;19.10.2015.;2015-10-19;1 juv;1;Dysderidae;Folkia;inermis;Folkia inermis;;42 758 378;17 436 094;Tb;deep cave;4 275 837 817 436 090;6;;;15,5
3841;Špilja kod Nerezinog dola;Croatia;19.10.2015.;2015-10-19;1 juv;1;Dysderidae;Folkia;inermis;Folkia inermis;;42 758 378;17 436 094;Tb;deep cave;4 275 837 817 436 090;6;;;12,267
3844;Kneži? jama;Croatia;20.10.2015.;2015-10-20;1juvm, 3 juv;4;Agelenidae;Histopona;bidens;Histopona bidens;;427 783;17 459 681;tb;deep cave;42 778 317 459 681;1;;;16,5
3847;Špilja u Solinama;Croatia;19.10.2015.;2015-10-19;2m,  2juv;4;Leptonetidae;Sulcia;nocturna;Sulcia nocturna;;42 768 021;17 377 062;;deep cave;4 276 802 117 377 060;5;;;10,3
3847;Špilja u Solinama;Croatia;19.10.2015.;2015-10-19;2m,  2juv;4;Leptonetidae;Sulcia;nocturna;Sulcia nocturna;;42 768 021;17 377 062;;deep cave;4 276 802 117 377 060;5;;;6,25
3847;Špilja u Solinama;Croatia;19.10.2015.;2015-10-19;2m,  2juv;4;Leptonetidae;Sulcia;nocturna;Sulcia nocturna;;42 768 021;17 377 062;;deep cave;4 276 802 117 377 060;5;;;10,3
3849;Jama za Sv. Ilijom;Croatia;22.10.2015.;2015-10-22;1m, 1f;2;Leptonetidae;Sulcia;nocturna;Sulcia nocturna;;42 744 428;17 515 269;;deep cave;4 274 442 817 515 260;3;;;12,533
3850;Jama na Strmici;Croatia;20.10.2015.;2015-10-20;1m, 1 juv;2;Leptonetidae;Barusia;maheni;Barusia maheni;;42 767 364;17 452 506;tf;deep cave;4 276 736 417 452 500;6;;;12,1
3851;Jama na Strmici;Croatia;20.10.2015.;2015-10-20;1m;1;Linyphiidae;Palliduphantes;sp. 1;Palliduphantes sp. 1;;42 767 364;17 452 506;tf;deep cave;4 276 736 417 452 500;6;;;12,1
3853;Jama na Strmici;Croatia;20.10.2015.;2015-10-20;7m, 1 f/juv, 4 juv;12;Leptonetidae;Barusia;maheni;Barusia maheni;;42 767 364;17 452 506;tf;deep cave;4 276 736 417 452 500;6;;;12,1
3855;Gali?njak;Croatia;22.10.2015.;2015-10-22;1f;1;Leptonetidae;Gen.;sp.;Gen. sp.;;42 720 118;1 767 071;;;427 201 181 767 071;11;;;13,6
3856;Gali?njak;Croatia;22.10.2015.;2015-10-22;1f;1;Theridiidae;Gen.;sp.;Gen. sp.;;42 720 118;1 767 071;;;427 201 181 767 071;11;;;13,6
3858;Jama iznad Dugog polja;Croatia;18.10.2015.;2015-10-18;1 juv;1;Dysderidae;Folkia;inermis;Folkia inermis;;4 275 873;17 448 697;Tb;deep cave;427 587 317 448 697;5;;16,3;16,4
3858;Jama iznad Dugog polja;Croatia;18.10.2015.;2015-10-18;1 juv;1;Dysderidae;Folkia;inermis;Folkia inermis;;4 275 873;17 448 697;Tb;deep cave;427 587 317 448 697;5;;;15,4
3859;Jama iznad Dugog polja;Croatia;18.10.2015.;2015-10-18;1 juv;1;Dysderidae;Folkia;inermis;Folkia inermis;;4 275 873;17 448 697;Tb;deep cave;427 587 317 448 697;5;;16,3;16,4
3859;Jama iznad Dugog polja;Croatia;18.10.2015.;2015-10-18;1 juv;1;Dysderidae;Folkia;inermis;Folkia inermis;;4 275 873;17 448 697;Tb;deep cave;427 587 317 448 697;5;;;15,4
3860;Jama iznad Dugog polja;Croatia;18.10.2015.;2015-10-18;1 juv;1;Dysderidae;Folkia;inermis;Folkia inermis;;4 275 873;17 448 697;Tb;deep cave;427 587 317 448 697;5;;16,3;16,4
3860;Jama iznad Dugog polja;Croatia;18.10.2015.;2015-10-18;1 juv;1;Dysderidae;Folkia;inermis;Folkia inermis;;4 275 873;17 448 697;Tb;deep cave;427 587 317 448 697;5;;;15,4
3862;Jama na Žutim kokom;Croatia;22.10.2015.;2015-10-22;1f;1;Agelenidae;Histopona;bidens;Histopona bidens;;42 712 746;17 682 621;tb;deep cave;4 271 274 617 682 620;3;;;
3863;Špilja kod Špilje kod Jaruge;Croatia;23.10.2015.;2015-10-23;1f;1;Agelenidae;Tegenaria;sp. X;Tegenaria sp. X;;42 782 558;17 422 514;;;4 278 255 817 422 510;4;;;
3864;Špilja kod Špilje kod Jaruge;Croatia;23.10.2015.;2015-10-23;1f;1;Linyphiidae;Palliduphantes;sp. 1;Palliduphantes sp. 1;;42 782 558;17 422 514;tf;deep cave;4 278 255 817 422 510;4;;;
3866;pod kamenjem oko jame Jaruga;Croatia;23.10.2015.;2015-10-23;1 juv;1;Dysderidae;Harpactea;sp.;Harpactea sp.;;42 782 558;17 422 514;;;4 278 255 817 422 510;4;;;
3867;pod kamenjem oko jame Jaruga;Croatia;23.10.2015.;2015-10-23;1f;1;Dysderidae;Dysdera;sp.;Dysdera sp.;;42 782 558;17 422 514;Tx;;4 278 255 817 422 510;4;;;
3868;Špilja kod Jaruge;Croatia;23.10.2015.;2015-10-23;3m, 1f, 1 juv;5;Leptonetidae;Barusia;maheni;Barusia maheni;;42 782 558;17 422 514;tf;deep cave;4 278 255 817 422 510;4;;;
3869;Polušpilja na Rožancu;Croatia;21.10.2015.;2015-10-21;1m, 1f;2;Agelenidae;Tegenaria;bosnica;Tegenaria bosnica;;42 769 951;17 436 488;;;4 276 995 117 436 480;3;;;
3870;Polušpilja na Rožancu;Croatia;21.10.2015.;2015-10-21;1 juv/f;1;Dysderidae;Harpactea;rucnerorum;Harpactea rucnerorum;;42 769 951;17 436 488;Tf;shallow subterranean habitat;4 276 995 117 436 480;3;;;
3871;Jama za Sv. Ilijom;Croatia;22.10.2015.;2015-10-22;1f/juv, 1 juv;2;Leptonetidae;Barusia;maheni;Barusia maheni;;42 744 428;17 515 269;tf;deep cave;4 274 442 817 515 260;3;;;12,533
3872;Jama za Sv. Ilijom;Croatia;22.10.2015.;2015-10-22;1m, 1f;2;Leptonetidae;Sulcia;nocturna;Sulcia nocturna;;42 744 428;17 515 269;;deep cave;4 274 442 817 515 260;3;;;12,533
3873;Male ponte;Croatia;19.10.2015.;2015-10-19;1f;1;Dysderidae;Folkia;sp. 5;Folkia sp. 5;;42 761 389;17 430 786;Tb;deep cave;4 276 138 917 430 780;7;;;14,45
3874;Jama na Strmici;Croatia;20.10.2015.;2015-10-20;1f;1;Leptonetidae;Sulcia;sp.;Sulcia sp.;;42 767 364;17 452 506;;;4 276 736 417 452 500;6;;;12,1
3876;Špilja na Strmici;Croatia;20.10.2015.;2015-10-20;1 juv;1;Dysderidae;Folkia;inermis;Folkia inermis;;42 767 242;17 453 338;Tb;deep cave;4 276 724 217 453 330;4;;;
3877;Gali?njak;Croatia;22.10.2015.;2015-10-22;5f, 1m;6;Leptonetidae;Sulcia;sp. 6;Sulcia sp. 6;;42 720 118;1 767 071;Tf;cave entrance;427 201 181 767 071;11;;;13,6
3878;Gali?njak;Croatia;22.10.2015.;2015-10-22;1m;1;Linyphiidae;Gen.;sp. X;Gen. sp. X;;42 720 118;1 767 071;;;427 201 181 767 071;11;;;13,6
3879;Gali?njak;Croatia;22.10.2015.;2015-10-22;1f;1;Theridiidae;Gen.;sp.;Gen. sp.;;42 720 118;1 767 071;;;427 201 181 767 071;11;;;13,6
3880;Jama na Strmici;Croatia;20.10.2015.;2015-10-20;2m, 3f;5;Linyphiidae;Palliduphantes;sp. 1;Palliduphantes sp. 1;;42 767 364;17 452 506;tf;deep cave;4 276 736 417 452 500;6;;;12,1
3881;Jama na Strmici;Croatia;20.10.2015.;2015-10-20;1f, 2m;3;Linyphiidae;Gen.;sp. X;Gen. sp. X;;42 767 364;17 452 506;;;4 276 736 417 452 500;6;;;12,1
3882;Jama na Strmici;Croatia;20.10.2015.;2015-10-20;1 juv;1;Dysderidae;Folkia;inermis;Folkia inermis;;42 767 364;17 452 506;Tb;deep cave;4 276 736 417 452 500;6;;;12,1
3883;Jama na Strmici;Croatia;20.10.2015.;2015-10-20;2m, 1 juvf, 1 juv m;4;Leptonetidae;Barusia;maheni;Barusia maheni;;42 767 364;17 452 506;tf;deep cave;4 276 736 417 452 500;6;;;12,1
3884;Velika špilja, Blato;Croatia;19.10.2015.;2015-10-19;9m, 2f, 3 juv;14;Leptonetidae;Barusia;maheni;Barusia maheni;;4 276 443;17 471 825;tf;deep cave;427 644 317 471 825;8;;;
3885;Špilja u Solinama;Croatia;19.10.2015.;2015-10-19;2m, 3f, 3 juv;8;Leptonetidae;Barusia;maheni;Barusia maheni;;42 768 021;17 377 062;tf;deep cave;4 276 802 117 377 060;5;;;10,3
3885;Špilja u Solinama;Croatia;19.10.2015.;2015-10-19;2m, 3f, 3 juv;8;Leptonetidae;Barusia;maheni;Barusia maheni;;42 768 021;17 377 062;tf;deep cave;4 276 802 117 377 060;5;;;6,25
3885;Špilja u Solinama;Croatia;19.10.2015.;2015-10-19;2m, 3f, 3 juv;8;Leptonetidae;Barusia;maheni;Barusia maheni;;42 768 021;17 377 062;tf;deep cave;4 276 802 117 377 060;5;;;10,3
3886;Polušpilja na Rožancu;Croatia;21.10.2015.;2015-10-21;5m, 1f, 4 juv;1;Leptonetidae;Barusia;maheni;Barusia maheni;;42 769 951;17 436 488;tf;cave entrance;4 276 995 117 436 480;3;;;
3887;Jama na Žutim kokom;Croatia;22.10.2015.;2015-10-22;2m, 3f, 3 juv;8;Leptonetidae;Barusia;maheni;Barusia maheni;;42 712 746;17 682 621;tf;deep cave;4 271 274 617 682 620;3;;;
3888;Jama u šumi uvale Bjejajka;Croatia;19.10.2015.;2015-10-19;1m, 1f, 1 juv;3;Leptonetidae;Barusia;maheni;Barusia maheni;;42 765 231;17 385 606;tf;deep cave;4 276 523 117 385 600;6;;;15,4
3888;Jama u šumi uvale Bjejajka;Croatia;19.10.2015.;2015-10-19;1m, 1f, 1 juv;3;Leptonetidae;Barusia;maheni;Barusia maheni;;42 765 231;17 385 606;tf;deep cave;4 276 523 117 385 600;6;;;12,867
3889;Tunel kod Kulijera;Croatia;23.10.2015.;2015-10-23;4m, 2f, 8 juv;14;Leptonetidae;Barusia;maheni;Barusia maheni;;42 787 249;17 328 395;tf;deep cave;4 278 724 917 328 390;3;;;
3890;Špilja kod Nerezinog dola;Croatia;19.10.2015.;2015-10-19;3m, 4f, 1 juv;8;Leptonetidae;Barusia;maheni;Barusia maheni;;42 758 378;17 436 094;tf;deep cave;4 275 837 817 436 090;6;;;15,5
3890;Špilja kod Nerezinog dola;Croatia;19.10.2015.;2015-10-19;3m, 4f, 1 juv;8;Leptonetidae;Barusia;maheni;Barusia maheni;;42 758 378;17 436 094;tf;deep cave;4 275 837 817 436 090;6;;;12,267
3891;Male ponte;Croatia;19.10.2015.;2015-10-19;2f, 1m;3;Linyphiidae;Palliduphantes;sp. 1;Palliduphantes sp. 1;;42 761 389;17 430 786;tf;deep cave;4 276 138 917 430 780;7;;;14,45
3892;Male ponte;Croatia;19.10.2015.;2015-10-19;3f, 1m, 4 juv;8;Leptonetidae;Sulcia;nocturna;Sulcia nocturna;;42 761 389;17 430 786;;deep cave;4 276 138 917 430 780;7;;;14,45
3893;Jama iznad Dugog polja;Croatia;18.10.2015.;2015-10-18;1m, 2f, 3 juv;6;Leptonetidae;Barusia;maheni;Barusia maheni;;4 275 873;17 448 697;tf;deep cave;427 587 317 448 697;5;;16,3;16,4
3893;Jama iznad Dugog polja;Croatia;18.10.2015.;2015-10-18;1m, 2f, 3 juv;6;Leptonetidae;Barusia;maheni;Barusia maheni;;4 275 873;17 448 697;tf;deep cave;427 587 317 448 697;5;;;15,4
3894;Jama iznad Dugog polja;Croatia;18.10.2015.;2015-10-18;1m, 2f, 1 juv;4;Leptonetidae;Barusia;maheni;Barusia maheni;;4 275 873;17 448 697;tf;deep cave;427 587 317 448 697;5;;16,3;16,4
3894;Jama iznad Dugog polja;Croatia;18.10.2015.;2015-10-18;1m, 2f, 1 juv;4;Leptonetidae;Barusia;maheni;Barusia maheni;;4 275 873;17 448 697;tf;deep cave;427 587 317 448 697;5;;;15,4
3895;Jama iznad Dugog polja;Croatia;18.10.2015.;2015-10-18;1f;1;Leptonetidae;Sulcia;nocturna;Sulcia nocturna;;4 275 873;17 448 697;;deep cave;427 587 317 448 697;5;;16,3;16,4
3895;Jama iznad Dugog polja;Croatia;18.10.2015.;2015-10-18;1f;1;Leptonetidae;Sulcia;nocturna;Sulcia nocturna;;4 275 873;17 448 697;;deep cave;427 587 317 448 697;5;;;15,4
3896;Pe?ina u Dunjaku;Croatia;28.11.2015.;2015-11-28;1m, 1f, 1juv;3;Linyphiidae;Porrhomma;egeria;Porrhomma egeria;205;4 523 655;15 668 962;;deep cave;452 365 515 668 962;1;;;
3899;Jama Blitvica;Croatia;25.6.2015.;2015-06-25;2f, 1 juv m;3;Linyphiidae;Centromerus;densidentatus sp.n.;Centromerus densidentatus sp.n.;;43 765 234;15 352 649;;;4 376 523 415 352 640;2;;;15,7
3901;Jama u šumi uvale Bjejajka;Croatia;19.10.2015.;2015-10-19;1m, 2f;3;Leptonetidae;Barusia;maheni;Barusia maheni;;42 765 231;17 385 606;tf;deep cave;4 276 523 117 385 600;6;;;15,4
3901;Jama u šumi uvale Bjejajka;Croatia;19.10.2015.;2015-10-19;1m, 2f;3;Leptonetidae;Barusia;maheni;Barusia maheni;;42 765 231;17 385 606;tf;deep cave;4 276 523 117 385 600;6;;;12,867
3902;Jama u šumi uvale Bjejajka;Croatia;19.10.2015.;2015-10-19;2f;2;Linyphiidae;Palliduphantes;sp. 1;Palliduphantes sp. 1;;42 765 231;17 385 606;tf;deep cave;4 276 523 117 385 600;6;;;15,4
3902;Jama u šumi uvale Bjejajka;Croatia;19.10.2015.;2015-10-19;2f;2;Linyphiidae;Palliduphantes;sp. 1;Palliduphantes sp. 1;;42 765 231;17 385 606;tf;deep cave;4 276 523 117 385 600;6;;;12,867
3904;oko Jame u šumi uvale Bjejajka;Croatia;19.10.2015.;2015-10-19;1m, 1 juv;2;Scytodidae;Scytodes;thoracica;Scytodes thoracica;;42 765 288;17 385 591;Tx;;4 276 528 817 385 590;1;;;
3906;Špilja u Radinovcima;Croatia;1.5.2014.;2014-05-01;2 juv m;2;Nesticidae;Kryptonesticus;deelemanae;Kryptonesticus deelemanae;400;43 387 285;170 103;tb;deep cave;43 387 285 170 103;4;;;8,3
3906;Špilja u Radinovcima;Croatia;1.5.2014.;2014-05-01;2 juv m;2;Nesticidae;Kryptonesticus;deelemanae;Kryptonesticus deelemanae;400;43 387 285;170 103;tb;deep cave;43 387 285 170 103;4;;;8,75
3907;Kašogijeva jama;Croatia;11.10.2014.;2014-10-11;1f;1;Agelenidae;Histopona;conveniens;Histopona conveniens;;43 338 971;1 705 039;Tf;deep cave;433 389 711 705 039;2;;5,7;5,7
3908;Tu?epska vilenja?a;Croatia;14.10.2014.;2014-10-14;1m, 4f;5;Linyphiidae;Typhlonyphia;sp. 1;Typhlonyphia sp. 1;1181;43 286 465;17 083 638;Tb;deep cave;4 328 646 517 083 630;8;;;9,967
3908;Tu?epska vilenja?a;Croatia;14.10.2014.;2014-10-14;1m, 4f;5;Linyphiidae;Typhlonyphia;sp. 1;Typhlonyphia sp. 1;1181;43 286 465;17 083 638;Tb;deep cave;4 328 646 517 083 630;8;;;11,2
3908;Tu?epska vilenja?a;Croatia;14.10.2014.;2014-10-14;1m, 4f;5;Linyphiidae;Typhlonyphia;sp. 1;Typhlonyphia sp. 1;1181;43 286 465;17 083 638;Tb;deep cave;4 328 646 517 083 630;8;;10,6;11,025
3909;Jama pod Svetim Jurom;Croatia;11.10.2014.;2014-10-11;1juv;1;Nesticidae;Kryptonesticus;deelemanae;Kryptonesticus deelemanae;;43 339 049;17 054 385;tb;deep cave;4 333 904 917 054 380;1;;;
3910;Jama iznad Sarana?a;Croatia;2.5.2014.;2014-05-02;1f;1;Linyphiidae;Palliduphantes;spelaeorum;Palliduphantes spelaeorum;770;43 249 007;17 174 663;Tf;deep cave;4 324 900 717 174 660;7;;10,8;10,025
3910;Jama iznad Sarana?a;Croatia;2.5.2014.;2014-05-02;1f;1;Linyphiidae;Palliduphantes;spelaeorum;Palliduphantes spelaeorum;770;43 249 007;17 174 663;Tf;deep cave;4 324 900 717 174 660;7;;;12,2
3911;Spila 1;Croatia;15.10.2014.;2014-10-15;1 juv;1;Dysderidae;Harpactea;damini;Harpactea damini;340;43 262 438;17 203 945;TF;deep cave;4 326 243 817 203 940;3;;10,4;10,4
3912;Špilja u Radinovcima;Croatia;15.10.2014.;2014-10-15;1 juv;1;Nesticidae;Kryptonesticus;deelemanae;Kryptonesticus deelemanae;400;43 387 285;170 103;tb;deep cave;43 387 285 170 103;4;;;8,3
3912;Špilja u Radinovcima;Croatia;15.10.2014.;2014-10-15;1 juv;1;Nesticidae;Kryptonesticus;deelemanae;Kryptonesticus deelemanae;400;43 387 285;170 103;tb;deep cave;43 387 285 170 103;4;;;8,75
3913;Tu?epska vilenja?a;Croatia;14.10.2014.;2014-10-14;1 juv;1;Dysderidae;Stalagtia;sp. 4;Stalagtia sp. 4;1181;43 286 465;17 083 638;Tb;deep cave;4 328 646 517 083 630;8;;;9,967
3913;Tu?epska vilenja?a;Croatia;14.10.2014.;2014-10-14;1 juv;1;Dysderidae;Stalagtia;sp. 4;Stalagtia sp. 4;1181;43 286 465;17 083 638;Tb;deep cave;4 328 646 517 083 630;8;;;11,2
3913;Tu?epska vilenja?a;Croatia;14.10.2014.;2014-10-14;1 juv;1;Dysderidae;Stalagtia;sp. 4;Stalagtia sp. 4;1181;43 286 465;17 083 638;Tb;deep cave;4 328 646 517 083 630;8;;10,6;11,025
3914;Jama za Supinom;Croatia;14.10.2014.;2014-10-14;1f;1;Linyphiidae;Typhlonyphia;sp. 1;Typhlonyphia sp. 1;;43 250 417;17 113 278;Tb;deep cave;4 325 041 717 113 270;7;;;10,1
3914;Jama za Supinom;Croatia;14.10.2014.;2014-10-14;1f;1;Linyphiidae;Typhlonyphia;sp. 1;Typhlonyphia sp. 1;;43 250 417;17 113 278;Tb;deep cave;4 325 041 717 113 270;7;;;11,4
3915;Kašogijeva jama;Croatia;11.10.2014.;2014-10-11;1f;1;Nesticidae;Kryptonesticus;deelemanae;Kryptonesticus deelemanae;;43 338 971;1 705 039;tb;deep cave;433 389 711 705 039;2;;5,7;5,7
3916;Jujnovi?a špilja;Croatia;29.4.2014.;2014-04-29;1f;1;Dysderidae;Harpactea;damini;Harpactea damini;405;43 266 579;1 719 798;TF;deep cave;432 665 791 719 798;6;;;10,35
3916;Jujnovi?a špilja;Croatia;29.4.2014.;2014-04-29;1f;1;Dysderidae;Harpactea;damini;Harpactea damini;405;43 266 579;1 719 798;TF;deep cave;432 665 791 719 798;6;;13,8;11,35
3917;Spila 2;Croatia;29.4.2014.;2014-04-29;2 juv;2;Dysderidae;Harpactea;damini;Harpactea damini;338;4 326 239;17 204 021;TF;deep cave;432 623 917 204 021;6;;12;12
3918;Spila 1;Croatia;1.5.2014.;2014-05-01;1 juv;1;Dysderidae;Harpactea;damini;Harpactea damini;340;43 262 438;17 203 945;TF;deep cave;4 326 243 817 203 940;3;;10,4;10,4
3919;Jujnovi?a špilja;Croatia;29.4.2014.;2014-04-29;1m, 3 juv;4;Dysderidae;Harpactea;damini;Harpactea damini;405;43 266 579;1 719 798;TF;deep cave;432 665 791 719 798;6;;;10,35
3919;Jujnovi?a špilja;Croatia;29.4.2014.;2014-04-29;1m, 3 juv;4;Dysderidae;Harpactea;damini;Harpactea damini;405;43 266 579;1 719 798;TF;deep cave;432 665 791 719 798;6;;13,8;11,35
3920;Karabitkin let;Croatia;4.6.2015.;2015-06-04;1f;1;Linyphiidae;Troglohyphantes;sp. 3;Troglohyphantes sp. 3;;44 742 824;15 060 869;tb;deep cave;4 474 282 415 060 860;1;;;
3921;Jubilarna jama;Croatia;5.8.2015.;2015-08-05;1f, 1m;2;Linyphiidae;Troglohyphantes;sp. 4;Troglohyphantes sp. 4;;44 658 654;15 129 563;tb;deep cave;4 465 865 415 129 560;1;;;
3922;Špilja na Dani?a kosi;Croatia;2.8.2015.;2015-08-02;1juvf, 1juvm;2;Linyphiidae;Troglohyphantes;sp.;Troglohyphantes sp.;;44 661 778;15 128 574;;deep cave;4 466 177 815 128 570;2;;;
3923;Špilja na Dani?a kosi;Croatia;2.8.2015.;2015-08-02;1f;1;Dysderidae;Parastalita;stygia;Parastalita stygia;800;44 661 778;15 128 574;Tb;deep cave;4 466 177 815 128 570;2;;;
3924;Fau 1 - V1;Croatia;x.8.1998.;1998-08;1m;1;Agelenidae;Histopona;luxurians;Histopona luxurians;;44 741 925;15 000 015;tf;deep cave;4 474 192 515 000 010;1;;;
3925;Anti?a špilja;Croatia;23.7.2015.;2015-07-23;1f, 1 juv;2;Dysderidae;Parastalita;stygia;Parastalita stygia;;44 956 848;153 167;Tb;deep cave;44 956 848 153 167;1;;;
3927;Skusa?a jama;Croatia;3.8.2015.;2015-08-03;2f, 1 juvf, 2 juvm, 1 juv;6;Linyphiidae;Troglohyphantes;sp. 4;Troglohyphantes sp. 4;;4 465 566;1 513 489;tb;deep cave;44 655 661 513 489;1;;;
3930;Pe?ina na ?akovcu;Croatia;2.8.2015.;2015-08-02;1 juv;1;Dysderidae;Stalita;pretneri;Stalita pretneri;;44 697 677;15 280 168;Tb;deep cave;4 469 767 715 280 160;1;;;
3931;Atila;Croatia;27.7.2014.;2014-07-27;1f;1;Dysderidae;Stalita;pretneri;Stalita pretneri;;44 677 748;15 110 767;Tb;deep cave;4 467 774 815 110 760;2;;;5,5
3932;Samogorska špilja;Croatia;23.1.2016.;2016-01-23;1m, 7f, 3 juvm, 3 juv;14;Nesticidae;Kryptonesticus;deelemanae;Kryptonesticus deelemanae;717;43 318 227;17 121 122;tb;deep cave;4 331 822 717 121 120;6;;;13,1
3932;Samogorska špilja;Croatia;23.1.2016.;2016-01-23;1m, 7f, 3 juvm, 3 juv;14;Nesticidae;Kryptonesticus;deelemanae;Kryptonesticus deelemanae;717;43 318 227;17 121 122;tb;deep cave;4 331 822 717 121 120;6;;7,1;4,967
3933;Samogorska špilja;Croatia;23.1.2016.;2016-01-23;9f;9;Nesticidae;Kryptonesticus;deelemanae;Kryptonesticus deelemanae;717;43 318 227;17 121 122;tb;deep cave;4 331 822 717 121 120;6;;;13,1
3933;Samogorska špilja;Croatia;23.1.2016.;2016-01-23;9f;9;Nesticidae;Kryptonesticus;deelemanae;Kryptonesticus deelemanae;717;43 318 227;17 121 122;tb;deep cave;4 331 822 717 121 120;6;;7,1;4,967
3934;Samogorska špilja;Croatia;23.1.2016.;2016-01-23;9f, 3m, 2juv;14;Nesticidae;Kryptonesticus;deelemanae;Kryptonesticus deelemanae;717;43 318 227;17 121 122;tb;deep cave;4 331 822 717 121 120;6;;;13,1
3934;Samogorska špilja;Croatia;23.1.2016.;2016-01-23;9f, 3m, 2juv;14;Nesticidae;Kryptonesticus;deelemanae;Kryptonesticus deelemanae;717;43 318 227;17 121 122;tb;deep cave;4 331 822 717 121 120;6;;7,1;4,967
3935;Samogorska špilja;Croatia;23.1.2016.;2016-01-23;1m;1;Pholcidae;Stygopholcus;absoloni;Stygopholcus absoloni;717;43 318 227;17 121 122;;deep cave;4 331 822 717 121 120;6;;;13,1
3935;Samogorska špilja;Croatia;23.1.2016.;2016-01-23;1m;1;Pholcidae;Stygopholcus;absoloni;Stygopholcus absoloni;717;43 318 227;17 121 122;;deep cave;4 331 822 717 121 120;6;;7,1;4,967
3936;Samogorska špilja;Croatia;23.1.2016.;2016-01-23;3 juv, 1juvm;4;Nesticidae;Kryptonesticus;deelemanae;Kryptonesticus deelemanae;717;43 318 227;17 121 122;tb;deep cave;4 331 822 717 121 120;6;;;13,1
3936;Samogorska špilja;Croatia;23.1.2016.;2016-01-23;3 juv, 1juvm;4;Nesticidae;Kryptonesticus;deelemanae;Kryptonesticus deelemanae;717;43 318 227;17 121 122;tb;deep cave;4 331 822 717 121 120;6;;7,1;4,967
3937;Samogorska špilja;Croatia;23.1.2016.;2016-01-23;1m, 3f, 1juv;5;Leptonetidae;Sulcia;sp. 4;Sulcia sp. 4;717;43 318 227;17 121 122;Tb;deep cave;4 331 822 717 121 120;6;;;13,1
3937;Samogorska špilja;Croatia;23.1.2016.;2016-01-23;1m, 3f, 1juv;5;Leptonetidae;Sulcia;sp. 4;Sulcia sp. 4;717;43 318 227;17 121 122;Tb;deep cave;4 331 822 717 121 120;6;;7,1;4,967
3938;Stonjska pe? gornja;Croatia;22.1.2016.;2016-01-22;2f, 1juv;3;Nesticidae;Kryptonesticus;deelemanae;Kryptonesticus deelemanae;;43 315 167;171 304;tb;deep cave;43 315 167 171 304;4;;;
3939;Stonjska pe? gornja;Croatia;22.1.2016.;2016-01-22;1f;1;Leptonetidae;Sulcia;sp.;Sulcia sp.;;43 315 167;171 304;;;43 315 167 171 304;4;;;
3940;Stonjska pe? gornja;Croatia;22.1.2016.;2016-01-22;1f;1;Linyphiidae;Centromerus;cavernarum;Centromerus cavernarum;;43 315 167;171 304;Tf;deep cave;43 315 167 171 304;4;;;
3941;Stonjska pe? gornja;Croatia;22.1.2016.;2016-01-22;2f, 1m;3;Nesticidae;Kryptonesticus;deelemanae;Kryptonesticus deelemanae;;43 315 167;171 304;tb;deep cave;43 315 167 171 304;4;;;
3944;Stonjska pe? donja;Croatia;22.1.2016.;2016-01-22;3juv;3;Nesticidae;Kryptonesticus;deelemanae;Kryptonesticus deelemanae;608;43 315 167;17 130 659;tb;deep cave;4 331 516 717 130 650;6;;;
3945;Stonjska pe? donja;Croatia;22.1.2016.;2016-01-22;1f;1;Nesticidae;Kryptonesticus;deelemanae;Kryptonesticus deelemanae;608;43 315 167;17 130 659;tb;deep cave;4 331 516 717 130 650;6;;;
3947;Stonjska pe? donja;Croatia;22.1.2016.;2016-01-22;5f;5;Nesticidae;Kryptonesticus;deelemanae;Kryptonesticus deelemanae;608;43 315 167;17 130 659;tb;deep cave;4 331 516 717 130 650;6;;;
3949;Kukor;Croatia;21.1.2016.;2016-01-21;2f;2;Nesticidae;Kryptonesticus;deelemanae;Kryptonesticus deelemanae;425;43 355 609;16 991 707;tb;deep cave;4 335 560 916 991 700;10;;;15,4
3950;Kukor;Croatia;21.1.2016.;2016-01-21;1f, 4juv;5;Nesticidae;Kryptonesticus;deelemanae;Kryptonesticus deelemanae;425;43 355 609;16 991 707;tb;deep cave;4 335 560 916 991 700;10;;;15,4
3951;Kukor;Croatia;21.1.2016.;2016-01-21;1f;1;Scytodidae;Scytodes;thoracica;Scytodes thoracica;425;43 355 609;16 991 707;Tx;;4 335 560 916 991 700;10;;;15,4
3952;Kukor;Croatia;21.1.2016.;2016-01-21;2m;2;Pholcidae;Stygopholcus;absoloni;Stygopholcus absoloni;425;43 355 609;16 991 707;;deep cave;4 335 560 916 991 700;10;;;15,4
3953;Matijaševa pe?;Croatia;23.1.2016.;2016-01-23;1f, 1juv;2;Nesticidae;Kryptonesticus;deelemanae;Kryptonesticus deelemanae;584;43 320 551;17 122 321;tb;deep cave;4 332 055 117 122 320;6;;8,3;6,933
3954;Matijaševa pe?;Croatia;23.1.2016.;2016-01-23;1m;1;Pholcidae;Stygopholcus;absoloni;Stygopholcus absoloni;584;43 320 551;17 122 321;;deep cave;4 332 055 117 122 320;6;;8,3;6,933
3955;Matijaševa pe?;Croatia;23.1.2016.;2016-01-23;3juv;3;Nesticidae;Kryptonesticus;deelemanae;Kryptonesticus deelemanae;584;43 320 551;17 122 321;tb;deep cave;4 332 055 117 122 320;6;;8,3;6,933
3957;Matijaševa pe?;Croatia;23.1.2016.;2016-01-23;2juv;2;Nesticidae;Kryptonesticus;deelemanae;Kryptonesticus deelemanae;584;43 320 551;17 122 321;tb;deep cave;4 332 055 117 122 320;6;;8,3;6,933
3958;Matijaševa pe?;Croatia;23.1.2016.;2016-01-23;1f;1;Leptonetidae;Barusia;maheni;Barusia maheni;584;43 320 551;17 122 321;tf;deep cave;4 332 055 117 122 320;6;;8,3;6,933
3960;Matijaševa pe?;Croatia;23.1.2016.;2016-01-23;1f;1;Pholcidae;Stygopholcus;absoloni;Stygopholcus absoloni;584;43 320 551;17 122 321;;deep cave;4 332 055 117 122 320;6;;8,3;6,933
3961;Samogorska špilja;Croatia;23.1.2016.;2016-01-23;1m, 1juv;2;Leptonetidae;Sulcia;sp. 4;Sulcia sp. 4;717;43 318 227;17 121 122;Tb;deep cave;4 331 822 717 121 120;6;;;13,1
3961;Samogorska špilja;Croatia;23.1.2016.;2016-01-23;1m, 1juv;2;Leptonetidae;Sulcia;sp. 4;Sulcia sp. 4;717;43 318 227;17 121 122;Tb;deep cave;4 331 822 717 121 120;6;;7,1;4,967
3962;Samogorska špilja;Croatia;23.1.2016.;2016-01-23;1m;1;Pholcidae;Stygopholcus;absoloni;Stygopholcus absoloni;717;43 318 227;17 121 122;;deep cave;4 331 822 717 121 120;6;;;13,1
3962;Samogorska špilja;Croatia;23.1.2016.;2016-01-23;1m;1;Pholcidae;Stygopholcus;absoloni;Stygopholcus absoloni;717;43 318 227;17 121 122;;deep cave;4 331 822 717 121 120;6;;7,1;4,967
3964;Kukor;Croatia;21.1.2016.;2016-01-21;5f, 1m, 2juv;8;Leptonetidae;Sulcia;sp. 3;Sulcia sp. 3;425;43 355 609;16 991 707;Tb;deep cave;4 335 560 916 991 700;10;;;15,4
3965;Kukor;Croatia;21.1.2016.;2016-01-21;6m, 13f/juv;19;Leptonetidae;Sulcia;sp. 3;Sulcia sp. 3;425;43 355 609;16 991 707;Tb;deep cave;4 335 560 916 991 700;10;;;15,4
3967;Kukor;Croatia;21.1.2016.;2016-01-21;4m, 9f/juv;13;Leptonetidae;Sulcia;sp. 3;Sulcia sp. 3;425;43 355 609;16 991 707;Tb;deep cave;4 335 560 916 991 700;10;;;15,4
3968;Kukor;Croatia;21.1.2016.;2016-01-21;1m;1;Pholcidae;Stygopholcus;absoloni;Stygopholcus absoloni;425;43 355 609;16 991 707;;deep cave;4 335 560 916 991 700;10;;;15,4
3969;Kukor;Croatia;21.1.2016.;2016-01-21;1m;1;Agelenidae;Histopona;conveniens;Histopona conveniens;425;43 355 609;16 991 707;Tf;deep cave;4 335 560 916 991 700;10;;;15,4
3971;Kukor;Croatia;21.1.2016.;2016-01-21;3f, 1juv;4;Pholcidae;Stygopholcus;absoloni;Stygopholcus absoloni;425;43 355 609;16 991 707;;deep cave;4 335 560 916 991 700;10;;;15,4
3973;Stonjska pe? donja;Croatia;22.1.2016.;2016-01-22;1juvm, 1juv;2;Nesticidae;Kryptonesticus;deelemanae;Kryptonesticus deelemanae;608;43 315 167;17 130 659;tb;deep cave;4 331 516 717 130 650;6;;;
3975;Stonjska pe? donja;Croatia;22.1.2016.;2016-01-22;1m, 1f;2;Pholcidae;Stygopholcus;absoloni;Stygopholcus absoloni;608;43 315 167;17 130 659;;deep cave;4 331 516 717 130 650;6;;;
3976;Stonjska pe? gornja;Croatia;22.1.2016.;2016-01-22;3m, 6f;9;Leptonetidae;Sulcia;sp. 4;Sulcia sp. 4;;43 315 167;171 304;Tb;deep cave;43 315 167 171 304;4;;;
3977;Stonjska pe? gornja;Croatia;22.1.2016.;2016-01-22;1juvm;1;Nesticidae;Kryptonesticus;deelemanae;Kryptonesticus deelemanae;;43 315 167;171 304;tb;deep cave;43 315 167 171 304;4;;;
3979;Gradska spila;Croatia;23.1.2016.;2016-01-23;1m, 2f, 3juv;6;Leptonetidae;Sulcia;sp. 4;Sulcia sp. 4;755;43 318 029;17 117 623;Tb;deep cave;4 331 802 917 117 620;4;;;6,6
3980;Gradska spila;Croatia;23.1.2016.;2016-01-23;1m;1;Pholcidae;Stygopholcus;absoloni;Stygopholcus absoloni;755;43 318 029;17 117 623;;deep cave;4 331 802 917 117 620;4;;;6,6
3981;Gradska spila;Croatia;23.1.2016.;2016-01-23;1m, 3f, 1juv;5;Leptonetidae;Sulcia;sp. 4;Sulcia sp. 4;755;43 318 029;17 117 623;Tb;deep cave;4 331 802 917 117 620;4;;;6,6
3982;Gradska spila;Croatia;23.1.2016.;2016-01-23;3m, 2f;5;Leptonetidae;Sulcia;sp. 4;Sulcia sp. 4;755;43 318 029;17 117 623;Tb;deep cave;4 331 802 917 117 620;4;;;6,6
3983;Mala špilja kod Antunovi?a;Croatia;22.1.2016.;2016-01-22;1f;1;Dysderidae;Stalagtia;sp. 4;Stalagtia sp. 4;708;4 327 698;17 226 992;Tb;deep cave;432 769 817 226 992;1;;;
3984;Mala špilja kod Antunovi?a;Croatia;22.1.2016.;2016-01-22;1f;1;Dysderidae;Stalagtia;sp. 4;Stalagtia sp. 4;708;4 327 698;17 226 992;Tb;deep cave;432 769 817 226 992;1;;;
3985;?utno;Croatia;20.3.2016.;2016-03-20;3 juv;3;Dysderidae;Stalita;pretneri;Stalita pretneri;210;45 415 607;15 233 039;Tb;deep cave;4 541 560 715 233 030;4;;;7,75
3986;Šolkina jama;Croatia;27.2.2016.;2016-02-27;4m, 2f;6;Leptonetidae;Sulcia;sp.;Sulcia sp.;230;42 966 544;17 662 484;;;4 296 654 417 662 480;4;;;
3987;Šolkina jama;Croatia;27.2.2016.;2016-02-27;1juv;1;Agelenidae;Tegenaria;sp.;Tegenaria sp.;230;42 966 544;17 662 484;;;4 296 654 417 662 480;4;;;
3989;Šolkina jama;Croatia;27.2.2016.;2016-02-27;1f;1;Pholcidae;Stygopholcus;absoloni;Stygopholcus absoloni;230;42 966 544;17 662 484;;deep cave;4 296 654 417 662 480;4;;;
3991;Batista jama;Croatia;13.-15.7.2016.;2016-07-13/2016-07-15;2m;2;Linyphiidae;Palliduphantes;spelaeorum;Palliduphantes spelaeorum;;4 333 236;1 643 605;Tf;deep cave;43 332 361 643 605;2;;;
3992;Batista jama;Croatia;13.-15.7.2016.;2016-07-13/2016-07-15;2f, 1juvm, 1 juv;4;Nesticidae;Kryptonesticus;eremita;Kryptonesticus eremita;;4 333 236;1 643 605;tf;deep cave;43 332 361 643 605;2;;;
3994;Batista jama;Croatia;13.-15.7.2016.;2016-07-13/2016-07-15;1f, 1m, 1 juv f;3;Linyphiidae;Palliduphantes;spelaeorum;Palliduphantes spelaeorum;;4 333 236;1 643 605;Tf;deep cave;43 332 361 643 605;2;;;
3995;Tu?epska vilenja?a;Croatia;21.8.2016.;2016-08-21;1f;1;Dysderidae;Mesostalita;comottii;Mesostalita comottii;1181;43 286 465;17 083 638;Tb;deep cave;4 328 646 517 083 630;8;;;9,967
3995;Tu?epska vilenja?a;Croatia;21.8.2016.;2016-08-21;1f;1;Dysderidae;Mesostalita;comottii;Mesostalita comottii;1181;43 286 465;17 083 638;Tb;deep cave;4 328 646 517 083 630;8;;;11,2
3995;Tu?epska vilenja?a;Croatia;21.8.2016.;2016-08-21;1f;1;Dysderidae;Mesostalita;comottii;Mesostalita comottii;1181;43 286 465;17 083 638;Tb;deep cave;4 328 646 517 083 630;8;;10,6;11,025
3996;Špilja u Grli?u;Croatia;19.8.2016.;2016-08-19;2m;2;Pholcidae;Stygopholcus;absoloni;Stygopholcus absoloni;;43 158 023;16 813 636;;deep cave;4 315 802 316 813 630;4;;;17,3
3997;Vojni tunel na Kamenicama;Croatia;17.8.2016.;2016-08-17;1f;1;Pholcidae;Pholcus;phalangioides;Pholcus phalangioides;;4 272 749;16 840 169;;deep cave;427 274 916 840 169;2;;;
3999;Špilja na Pozalicu;Croatia;16.8.2016.;2016-08-16;1m, 1f, 1juvm, 1juv;4;Leptonetidae;Barusia;sp. 1;Barusia sp. 1;;4 276 131;169 129;tb;deep cave;4 276 131 169 129;4;;12,65;14
4000;Vojni tunel na Kamenicama;Croatia;17.8.2016.;2016-08-17;4f, 2 juvm, 3 juv;9;Leptonetidae;Barusia;sp. 1;Barusia sp. 1;;4 272 749;16 840 169;tb;deep cave;427 274 916 840 169;2;;;
4001;Špilja na Pozalicu;Croatia;16.8.2016.;2016-08-16;1m, 1f;2;Leptonetidae;Barusia;sp. 1;Barusia sp. 1;;4 276 131;169 129;tb;deep cave;4 276 131 169 129;4;;12,65;14
4002;Vojni tunel na Kamenicama;Croatia;17.8.2016.;2016-08-17;1f, 1 juv m;2;Leptonetidae;Barusia;sp. 1;Barusia sp. 1;;4 272 749;16 840 169;tb;deep cave;427 274 916 840 169;2;;;
4003;Ra?a špilja;Croatia;16.8.2016.;2016-08-16;1 juv;1;Dysderidae;Folkia;sp. 2;Folkia sp. 2;;42 734 493;16 910 785;Tb;deep cave;4 273 449 316 910 780;4;;14,8;14,42
4004;Ra?a špilja;Croatia;16.8.2016.;2016-08-16;2m;2;Leptonetidae;Barusia;sp. 1;Barusia sp. 1;;42 734 493;16 910 785;tb;deep cave;4 273 449 316 910 780;4;;14,8;14,42
4005;Ra?a špilja;Croatia;16.8.2016.;2016-08-16;11f/juv;11;Leptonetidae;Barusia;sp. 1;Barusia sp. 1;;42 734 493;16 910 785;tb;deep cave;4 273 449 316 910 780;4;;14,8;14,42
4007;Ra?a špilja;Croatia;16.8.2016.;2016-08-16;1m, 3f, 1 juvm;5;Leptonetidae;Barusia;sp. 1;Barusia sp. 1;;42 734 493;16 910 785;tb;deep cave;4 273 449 316 910 780;4;;14,8;14,42
4008;Ra?a špilja;Croatia;16.8.2016.;2016-08-16;1m;1;Leptonetidae;Barusia;sp. 1;Barusia sp. 1;;42 734 493;16 910 785;tb;deep cave;4 273 449 316 910 780;4;;14,8;14,42
4009;Špilja u Grli?u;Croatia;19.8.2016.;2016-08-19;2f, 4juv m, 2 juv;8;Leptonetidae;Barusia;maheni;Barusia maheni;;43 158 023;16 813 636;tf;deep cave;4 315 802 316 813 630;4;;;17,3
4010;Špilja u Grli?u;Croatia;19.8.2016.;2016-08-19;1f, 2 juvm, 1 juv;4;Leptonetidae;Barusia;maheni;Barusia maheni;;43 158 023;16 813 636;tf;deep cave;4 315 802 316 813 630;4;;;17,3
4011;Špilja u Grli?u;Croatia;19.8.2016.;2016-08-19;1juv m, 2juv/f, 3 juv;6;Leptonetidae;Barusia;maheni;Barusia maheni;;43 158 023;16 813 636;tf;deep cave;4 315 802 316 813 630;4;;;17,3
4012;Špilja u Grli?u;Croatia;19.8.2016.;2016-08-19;1f, 1juvm, 1juvf/juv, 1 juv;4;Leptonetidae;Barusia;maheni;Barusia maheni;;43 158 023;16 813 636;tf;deep cave;4 315 802 316 813 630;4;;;17,3
4013;Grap?eva špilja;Croatia;20.8.2016.;2016-08-20;4juv;4;Agelenidae;Hadites;tegenarioides;Hadites tegenarioides;200;43 134 189;16 753 732;TB;deep cave;4 313 418 916 753 730;5;;;11,1
4013;Grap?eva špilja;Croatia;20.8.2016.;2016-08-20;4juv;4;Agelenidae;Hadites;tegenarioides;Hadites tegenarioides;200;43 134 189;16 753 732;TB;deep cave;4 313 418 916 753 730;5;;;15,35
4014;Grap?eva špilja;Croatia;20.8.2016.;2016-08-20;1f, 7juv;8;Agelenidae;Hadites;tegenarioides;Hadites tegenarioides;200;43 134 189;16 753 732;TB;deep cave;4 313 418 916 753 730;5;;;11,1
4014;Grap?eva špilja;Croatia;20.8.2016.;2016-08-20;1f, 7juv;8;Agelenidae;Hadites;tegenarioides;Hadites tegenarioides;200;43 134 189;16 753 732;TB;deep cave;4 313 418 916 753 730;5;;;15,35
4015;Grap?eva špilja;Croatia;20.8.2016.;2016-08-20;1f;1;Nesticidae;Kryptonesticus;eremita;Kryptonesticus eremita;200;43 134 189;16 753 732;tf;deep cave;4 313 418 916 753 730;5;;;11,1
4015;Grap?eva špilja;Croatia;20.8.2016.;2016-08-20;1f;1;Nesticidae;Kryptonesticus;eremita;Kryptonesticus eremita;200;43 134 189;16 753 732;tf;deep cave;4 313 418 916 753 730;5;;;15,35
4017;Grap?eva špilja;Croatia;20.8.2016.;2016-08-20;1m, 1 juv m;2;Leptonetidae;Barusia;insulana;Barusia insulana;200;43 134 189;16 753 732;tb;deep cave;4 313 418 916 753 730;5;;;11,1
4017;Grap?eva špilja;Croatia;20.8.2016.;2016-08-20;1m, 1 juv m;2;Leptonetidae;Barusia;insulana;Barusia insulana;200;43 134 189;16 753 732;tb;deep cave;4 313 418 916 753 730;5;;;15,35
4018;Špilja pod Kapelu;Croatia;18.8.2016.;2016-08-18;1 juv;1;Agelenidae;Hadites;tegenarioides;Hadites tegenarioides;;43 184 949;16 434 233;TB;deep cave;4 318 494 916 434 230;5;;;11,1
4018;Špilja pod Kapelu;Croatia;18.8.2016.;2016-08-18;1 juv;1;Agelenidae;Hadites;tegenarioides;Hadites tegenarioides;;43 184 949;16 434 233;TB;deep cave;4 318 494 916 434 230;5;;;14,333
4024;Fosilka;Croatia;5.8.2016.;2016-08-05;2f, 1m, 1 juv m;4;Linyphiidae;Troglohyphantes;sp. 4;Troglohyphantes sp. 4;;44 623 188;15 130 654;tb;deep cave;4 462 318 815 130 650;1;;;
4025;Fosilka;Croatia;3.8.2016.;2016-08-03;4f;4;Linyphiidae;Troglohyphantes;sp. 4;Troglohyphantes sp. 4;;44 623 188;15 130 654;tb;deep cave;4 462 318 815 130 650;1;;;
4026;Markov ponor;Croatia;3.8.2016.;2016-08-03;1juv;1;Linyphiidae;Troglohyphantes;sp. 3;Troglohyphantes sp. 3;;44 765 318;15 176 875;tb;deep cave;4 476 531 815 176 870;1;;;6,6
4029;Ponor Štirova?a;Croatia;5.8.2016.;2016-08-05;2f, 3juv;5;Linyphiidae;Troglohyphantes;sp. 3;Troglohyphantes sp. 3;1060;44 693 088;15 051 176;tb;deep cave;4 469 308 815 051 170;2;;;
4030;Ra?a špilja;Croatia;16.8.2016.;2016-08-16;1m;1;Tetragnathidae;Meta;bourneti;Meta bourneti;;42 734 493;16 910 785;Tf;deep cave;4 273 449 316 910 780;4;;14,8;14,42
4031;Špilja na Pozalicu;Croatia;16.8.2016.;2016-08-16;1f;1;Nesticidae;Kryptonesticus;eremita;Kryptonesticus eremita;;4 276 131;169 129;tf;deep cave;4 276 131 169 129;4;;12,65;14
4032;Špilja pod Kapelu;Croatia;18.8.2016.;2016-08-18;1juv;1;Agelenidae;Tegenaria;sp.;Tegenaria sp.;;43 184 949;16 434 233;;;4 318 494 916 434 230;5;;;11,1
4032;Špilja pod Kapelu;Croatia;18.8.2016.;2016-08-18;1juv;1;Agelenidae;Tegenaria;sp.;Tegenaria sp.;;43 184 949;16 434 233;;;4 318 494 916 434 230;5;;;14,333
4033;Špilja pod Kapelu;Croatia;18.8.2016.;2016-08-18;2f;2;Linyphiidae;Palliduphantes;sp. X;Palliduphantes sp. X;;43 184 949;16 434 233;;;4 318 494 916 434 230;5;;;11,1
4033;Špilja pod Kapelu;Croatia;18.8.2016.;2016-08-18;2f;2;Linyphiidae;Palliduphantes;sp. X;Palliduphantes sp. X;;43 184 949;16 434 233;;;4 318 494 916 434 230;5;;;14,333
4034;Spilja pod Kuk;Croatia;19.8.2016.;2016-08-19;1m;1;Sicariidae;Loxosceles;rufescens;Loxosceles rufescens;;43 156 687;16 814 810;Tf;deep cave;4 315 668 716 814 810;2;;;
4035;Spilja pod Kuk;Croatia;19.8.2016.;2016-08-19;1m, 1f, 1juv;3;Sicariidae;Loxosceles;rufescens;Loxosceles rufescens;;43 156 687;16 814 810;Tf;deep cave;4 315 668 716 814 810;2;;;
4037;Grap?eva špilja;Croatia;20.8.2016.;2016-08-20;1juv/f;1;Dysderidae;Dysdera;sp.;Dysdera sp.;200;43 134 189;16 753 732;Tx;;4 313 418 916 753 730;5;;;11,1
4037;Grap?eva špilja;Croatia;20.8.2016.;2016-08-20;1juv/f;1;Dysderidae;Dysdera;sp.;Dysdera sp.;200;43 134 189;16 753 732;Tx;;4 313 418 916 753 730;5;;;15,35
4038;Tu?epska vilenja?a;Croatia;21.8.2016.;2016-08-21;1f;1;Linyphiidae;Typhlonyphia;sp. 1;Typhlonyphia sp. 1;1181;43 286 465;17 083 638;Tb;deep cave;4 328 646 517 083 630;8;;;9,967
4038;Tu?epska vilenja?a;Croatia;21.8.2016.;2016-08-21;1f;1;Linyphiidae;Typhlonyphia;sp. 1;Typhlonyphia sp. 1;1181;43 286 465;17 083 638;Tb;deep cave;4 328 646 517 083 630;8;;;11,2
4038;Tu?epska vilenja?a;Croatia;21.8.2016.;2016-08-21;1f;1;Linyphiidae;Typhlonyphia;sp. 1;Typhlonyphia sp. 1;1181;43 286 465;17 083 638;Tb;deep cave;4 328 646 517 083 630;8;;10,6;11,025
4039;Bali?a špilja;Croatia;22.8.2016.;2016-08-22;1m;1;Linyphiidae;Troglohyphantes;giromettai;Troglohyphantes giromettai;405;4 357 296;1 657 002;tf;deep cave;43 572 961 657 002;11;;;7,2
4040;Ponor Dražice;Croatia;24.8.2016.;2016-08-24;4f, 1juvf;5;Linyphiidae;Troglohyphantes;sp. 3;Troglohyphantes sp. 3;;44 768 838;15 171 299;tb;deep cave;4 476 883 815 171 290;1;;;
4041;Crkviš?e;Croatia;9.9.2016.;2016-09-09;1m;1;Linyphiidae;Troglohyphantes;kordunlikanus;Troglohyphantes kordunlikanus;;45 398 087;15 437 771;tf;shallow subterranean habitat;4 539 808 715 437 770;1;;;
4042;Grap?eva špilja;Croatia;20.8.2016.;2016-08-20;1juvm;1;Agelenidae;Hadites;tegenarioides;Hadites tegenarioides;200;43 134 189;16 753 732;TB;deep cave;4 313 418 916 753 730;5;;;11,1
4042;Grap?eva špilja;Croatia;20.8.2016.;2016-08-20;1juvm;1;Agelenidae;Hadites;tegenarioides;Hadites tegenarioides;200;43 134 189;16 753 732;TB;deep cave;4 313 418 916 753 730;5;;;15,35
4043;Mandelaja;Croatia;17.4.2016.;2016-04-17;1f;1;Linyphiidae;Troglohyphantes;excavatus;Troglohyphantes excavatus;;45 233 397;1 530 015;tf;deep cave;452 333 971 530 015;7;;;
4044;Ponor Dražice;Croatia;24.8.2016.;2016-08-24;1m, 1f;2;Linyphiidae;Troglohyphantes;sp. 3;Troglohyphantes sp. 3;;44 768 838;15 171 299;tb;deep cave;4 476 883 815 171 290;1;;;
4046;Ponor Dražice;Croatia;25.8.2016.;2016-08-25;1f, 4 juv;5;Linyphiidae;Troglohyphantes;sp. 3;Troglohyphantes sp. 3;;44 768 838;15 171 299;tb;deep cave;4 476 883 815 171 290;1;;;
4048;Ponor Dražice;Croatia;26.8.2016.;2016-08-26;1m;1;Linyphiidae;Troglohyphantes;sp. 3;Troglohyphantes sp. 3;;44 768 838;15 171 299;tb;deep cave;4 476 883 815 171 290;1;;;
4049;Kuštrovka;Croatia;24.9.2016.;2016-09-24;1f, 2 juv;3;Dysderidae;Stalita;pretneri;Stalita pretneri;450;45 346 234;15 219 338;Tb;deep cave;4 534 623 415 219 330;3;;;
4050;Šipun;Croatia;4.5.2012.;2012-05-04;1f/juv;1;Dysderidae;Stalagtia;sp. 1;Stalagtia sp. 1;;42 583 646;18 217 986;Tb;deep cave;4 258 364 618 217 980;11;;;15,4
4051;Šipun;Croatia;4.5.2012.;2012-05-04;1f;1;Tetragnathidae;Meta;bourneti;Meta bourneti;;42 583 646;18 217 986;Tf;deep cave;4 258 364 618 217 980;11;;;15,4
4052;Špilja u izvoru Krke;Croatia;10.9.2015.;2015-09-10;1f;1;Nesticidae;Kryptonesticus;eremita;Kryptonesticus eremita;;440 422 953;162 352 157 514;tf;deep cave;440 422 953 162 352 000 000;2;;;
4053;Sedrena špilja iza mlina;Croatia;7.3.2015.;2015-03-07;3juv;3;Tetragnathidae;Meta;sp.;Meta sp.;198;44 013 402;16 067 798;;;4 401 340 216 067 790;6;;;7,9
4055;Mandelaja;Croatia;28.1.1995.;1995-01-28;1f,1 juv;2;Tetragnathidae;Meta;menardi;Meta menardi;;45 233 397;1 530 015;Tf;deep cave;452 333 971 530 015;7;;;
4056;Gornja Bara?eva;Croatia;29.7.2002.;2002-07-29;1f, 1juvm, 1 juv;3;Tetragnathidae;Meta;menardi;Meta menardi;;44 983 895;15 721 656;Tf;deep cave;4 498 389 515 721 650;8;;;
4057;Mrgi?a ponor;Croatia;9.1.1999.;1999-01-09;2m, 1f;3;Tetragnathidae;Meta;menardi;Meta menardi;;45 268 189;15 469 236;Tf;deep cave;4 526 818 915 469 230;10;;;
4058;Mrgi?a ponor;Croatia;9.1.1999.;1999-01-09;1m;1;Tetragnathidae;Metellina;merianae;Metellina merianae;;45 268 189;15 469 236;Tf;deep cave;4 526 818 915 469 230;10;;;
4059;Mrgi?a ponor;Croatia;9.1.1999.;1999-01-09;1m;1;Agelenidae;Tegenaria;silvestris;Tegenaria silvestris;;45 268 189;15 469 236;Tf;deep cave;4 526 818 915 469 230;10;;;
4060;Gornja Bara?eva;Croatia;17.5.2003.;2003-05-17;1f;1;Tetragnathidae;Meta;menardi;Meta menardi;;44 983 895;15 721 656;Tf;deep cave;4 498 389 515 721 650;8;;;
4061;Mrgi?a ponor;Croatia;13.9.1998.;1998-09-13;1f;1;Tetragnathidae;Meta;menardi;Meta menardi;;45 268 189;15 469 236;Tf;deep cave;4 526 818 915 469 230;10;;;
4063;Crna?ka špilja;Croatia;14.11.1995.;1995-11-14;1m;1;Tetragnathidae;Meta;menardi;Meta menardi;;45 058 563;15 192 941;Tf;deep cave;4 505 856 315 192 940;2;;;
4067;Gvozdenica;Croatia;9.12.1997.;1997-12-09;1m;1;Tetragnathidae;Meta;menardi;Meta menardi;;45 299 765;15 589 405;Tf;deep cave;4 529 976 515 589 400;4;;;8,7
4070;Špilja pod Ma?kovom dragom;Croatia;11.7.2010.;2010-07-11;1m;1;Dysderidae;Parastalita;stygia;Parastalita stygia;;45 261 001;15 023 822;Tb;deep cave;4 526 100 115 023 820;1;;;7,4
4073;Makeljina špilja;Croatia;19.2.2016.;2016-02-19;1f;1;Nesticidae;Kryptonesticus;eremita;Kryptonesticus eremita;;43 995 296;1 607 216;tf;deep cave;439 952 961 607 216;5;;;
4074;Špilja u izvoru Krke;Croatia;30.4.2015.;2015-04-30;1f;1;Nesticidae;Kryptonesticus;eremita;Kryptonesticus eremita;;440 422 953;162 352 157 514;tf;deep cave;440 422 953 162 352 000 000;2;;;
4075;Stara jametina;Croatia;2.5.2015.;2015-05-02;1f;1;Linyphiidae;Micrargus;herbigradus;Micrargus herbigradus;;43 794 009;1 600 259;Tf;deep cave;437 940 091 600 259;6;;;13
4075;Stara jametina;Croatia;2.5.2015.;2015-05-02;1f;1;Linyphiidae;Micrargus;herbigradus;Micrargus herbigradus;;43 794 009;1 600 259;Tf;deep cave;437 940 091 600 259;6;;13,4;13,4
4076;Stara jametina;Croatia;2.5.2015.;2015-05-02;2f;2;Theridiidae;Episinus;cavernicola;Episinus cavernicola;;43 794 009;1 600 259;Tf;deep cave;437 940 091 600 259;6;;;13
4076;Stara jametina;Croatia;2.5.2015.;2015-05-02;2f;2;Theridiidae;Episinus;cavernicola;Episinus cavernicola;;43 794 009;1 600 259;Tf;deep cave;437 940 091 600 259;6;;13,4;13,4
4077;Stara jametina;Croatia;2.5.2015.;2015-05-02;1f, 1 juvm;2;Linyphiidae;Micrargus;herbigradus;Micrargus herbigradus;;43 794 009;1 600 259;Tf;deep cave;437 940 091 600 259;6;;;13
4077;Stara jametina;Croatia;2.5.2015.;2015-05-02;1f, 1 juvm;2;Linyphiidae;Micrargus;herbigradus;Micrargus herbigradus;;43 794 009;1 600 259;Tf;deep cave;437 940 091 600 259;6;;13,4;13,4
4078;Stara jametina;Croatia;2.5.2015.;2015-05-02;1 juv;1;Dysderidae;Stalagtia;sp. 4;Stalagtia sp. 4;;43 794 009;1 600 259;Tb;deep cave;437 940 091 600 259;6;;;13
4078;Stara jametina;Croatia;2.5.2015.;2015-05-02;1 juv;1;Dysderidae;Stalagtia;sp. 4;Stalagtia sp. 4;;43 794 009;1 600 259;Tb;deep cave;437 940 091 600 259;6;;13,4;13,4
4080;Stara jametina;Croatia;2.5.2015.;2015-05-02;1f, 2 juv;3;Linyphiidae;Micrargus;herbigradus;Micrargus herbigradus;;43 794 009;1 600 259;Tf;deep cave;437 940 091 600 259;6;;;13
4080;Stara jametina;Croatia;2.5.2015.;2015-05-02;1f, 2 juv;3;Linyphiidae;Micrargus;herbigradus;Micrargus herbigradus;;43 794 009;1 600 259;Tf;deep cave;437 940 091 600 259;6;;13,4;13,4
4082;Sedrena špilja iza mlina;Croatia;9.10.2016.;2016-10-09;1m, 1f;2;Tetragnathidae;Metellina;merianae;Metellina merianae;198;44 013 402;16 067 798;Tf;deep cave;4 401 340 216 067 790;6;;;7,9
4083;Sedrena špilja iza mlina;Croatia;9.10.2016.;2016-10-09;1juv, 1f;2;Tetragnathidae;Meta;bourneti;Meta bourneti;198;44 013 402;16 067 798;Tf;deep cave;4 401 340 216 067 790;6;;;7,9
4084;Stara jametina;Croatia;10.10.2016.;2016-10-10;5juv;5;Dysderidae;Stalagtia;sp. 4;Stalagtia sp. 4;;43 794 009;1 600 259;Tb;deep cave;437 940 091 600 259;6;;;13
4084;Stara jametina;Croatia;10.10.2016.;2016-10-10;5juv;5;Dysderidae;Stalagtia;sp. 4;Stalagtia sp. 4;;43 794 009;1 600 259;Tb;deep cave;437 940 091 600 259;6;;13,4;13,4
4085;Jazinka;Croatia;10.10.2016.;2016-10-10;1 juv;1;Dysderidae;Stalagtia;sp. 4;Stalagtia sp. 4;235;43 975 892;16 029 694;Tb;deep cave;4 397 589 216 029 690;2;;;13
4086;Sedrena špilja iza mlina;Croatia;9.10.2016.;2016-10-09;1 juvm;1;Tetragnathidae;Meta;sp.;Meta sp.;198;44 013 402;16 067 798;;;4 401 340 216 067 790;6;;;7,9
4087;Stara jametina;Croatia;10.10.2016.;2016-10-10;1f, 4 juv;5;Dysderidae;Stalagtia;sp. 4;Stalagtia sp. 4;;43 794 009;1 600 259;Tb;deep cave;437 940 091 600 259;6;;;13
4087;Stara jametina;Croatia;10.10.2016.;2016-10-10;1f, 4 juv;5;Dysderidae;Stalagtia;sp. 4;Stalagtia sp. 4;;43 794 009;1 600 259;Tb;deep cave;437 940 091 600 259;6;;13,4;13,4
4088;Stara jametina;Croatia;10.10.2016.;2016-10-10;1m;1;Theridiidae;Episinus;cavernicola;Episinus cavernicola;;43 794 009;1 600 259;Tf;deep cave;437 940 091 600 259;6;;;13
4088;Stara jametina;Croatia;10.10.2016.;2016-10-10;1m;1;Theridiidae;Episinus;cavernicola;Episinus cavernicola;;43 794 009;1 600 259;Tf;deep cave;437 940 091 600 259;6;;13,4;13,4
4089;Stara jametina;Croatia;10.10.2016.;2016-10-10;3juv;3;Dysderidae;Stalagtia;sp. 4;Stalagtia sp. 4;;43 794 009;1 600 259;Tb;deep cave;437 940 091 600 259;6;;;13
4089;Stara jametina;Croatia;10.10.2016.;2016-10-10;3juv;3;Dysderidae;Stalagtia;sp. 4;Stalagtia sp. 4;;43 794 009;1 600 259;Tb;deep cave;437 940 091 600 259;6;;13,4;13,4
4090;Ozi?ana pe?ina;Croatia;9.10.2016.;2016-10-09;3 juv m;3;Pholcidae;Holocnemus;sp.;Holocnemus sp.;;4 390 774;15 980 634;;;439 077 415 980 634;4;;;
4091;Potkapina ispod Jame nasuprot Torka;Croatia;8.10.2016.;2016-10-08;1f, 1 juvm;2;Theridiidae;Episinus;cavernicola;Episinus cavernicola;;4 382 018;16 012 303;Tf;shallow subterranean habitat;438 201 816 012 303;8;;;
4092;Potkapina ispod Jame nasuprot Torka, pod kamenjem;Croatia;8.10.2016.;2016-10-08;1f;1;Amaurobidae;Amaurobius;erberi;Amaurobius erberi;;4 382 018;16 012 303;Tx;epigean habitat;438 201 816 012 303;8;;;
4095;Potkapina ispod Jame nasuprot Torka;Croatia;8.10.2016.;2016-10-08;1m;1;Dysderidae;Harpactea;rucnerorum;Harpactea rucnerorum;;4 382 018;16 012 303;Tf;shallow subterranean habitat;438 201 816 012 303;8;;;
4096;Sedrena špilja s jamskim ulazom;Croatia;9.10.2016.;2016-10-09;1m;1;Agelenidae;Tegenaria;bosnica;Tegenaria bosnica;;44 013 829;16 069 202;;deep cave;4 401 382 916 069 200;2;;;9,3
4097;Špilja u izvoru Krke;Croatia;10.10.2016.;2016-10-10;1f, 1 juvm, 1 juv;3;Nesticidae;Kryptonesticus;eremita;Kryptonesticus eremita;;440 422 953;162 352 157 514;tf;deep cave;440 422 953 162 352 000 000;2;;;
4098;Špilja u izvoru Krke;Croatia;10.10.2016.;2016-10-10;1juvm;1;Pholcidae;Pholcus;sp.;Pholcus sp.;;440 422 953;162 352 157 514;;;440 422 953 162 352 000 000;2;;;
4100;Potkapina ispod Jame nasuprot Torka;Croatia;8.10.2016.;2016-10-08;1m, 1f, 3 juv;5;Dysderidae;Harpactea;rucnerorum;Harpactea rucnerorum;;4 382 018;16 012 303;Tf;shallow subterranean habitat;438 201 816 012 303;8;;;
4101;Potkapina ispod Jame nasuprot Torka, pod kamenjem;Croatia;8.10.2016.;2016-10-08;1m;1;Amaurobidae;Amaurobius;erberi;Amaurobius erberi;;4 382 018;16 012 303;Tx;epigean habitat;438 201 816 012 303;8;;;
4102;Potkapina ispod Jame nasuprot Torka, pod kamenjem;Croatia;8.10.2016.;2016-10-08;2f;2;Linyphiidae;Gen.;sp. X;Gen. sp. X;;4 382 018;16 012 303;;;438 201 816 012 303;8;;;
4103;Potkapina ispod Jame nasuprot Torka, pod kamenjem;Croatia;8.10.2016.;2016-10-08;1m;1;Theridiidae;Steatoda;triangulosa;Steatoda triangulosa;;4 382 018;16 012 303;Tf;cave entrance;438 201 816 012 303;8;;;
4104;Potkapina ispod Jame nasuprot Torka, pod kamenjem;Croatia;8.10.2016.;2016-10-08;1m, 3f;4;Amaurobidae;Amaurobius;erberi;Amaurobius erberi;;4 382 018;16 012 303;Tx;epigean habitat;438 201 816 012 303;8;;;
4105;Potkapina ispod Jame nasuprot Torka, under stones;Croatia;8.10.2016.;2016-10-08;1f;1;Agelenidae;Inermocoelotes;gasperinii;Inermocoelotes gasperinii;;4 382 018;16 012 303;;;438 201 816 012 303;8;;;
4107;Potkapina ispod Jame nasuprot Torka, pod kamenjem;Croatia;8.10.2016.;2016-10-08;1f;1;Clubionidae;Gen.;sp.;Gen. sp.;;4 382 018;16 012 303;;;438 201 816 012 303;8;;;
4108;Miljacka 2;Croatia;1.6.2016.;2016-06-01;1m;1;Agelenidae;Tegenaria;domestica;Tegenaria domestica;;440 002;16 016 234;Tf;deep cave;44 000 216 016 234;4;;;12,6
4109;Špilja na Gradini kod Premanture;Croatia;16.7.2016.;2016-07-16;5 juv;5;Nesticidae;Kryptonesticus;eremita;Kryptonesticus eremita;;44 786 909;13 907 968;tf;deep cave;4 478 690 913 907 960;3;;;13,875
4111;Špilja na Gradini kod Premanture;Croatia;30.4.2016.;2016-04-30;3f, 1juv m, 7 juv;11;Nesticidae;Kryptonesticus;eremita;Kryptonesticus eremita;;44 786 909;13 907 968;tf;deep cave;4 478 690 913 907 960;3;;;13,875
