sample ID,locality,country,Collection date,eventDate,Number and gender,individualCount,Family,Genus,species,scientific name,elevation,decimalLatitude,decimalLongitude,Troglomorphy,habitat,joint coordinates,unique species count,deepest air temperature,média temperature,Temp anual,Temp anual.1,TempRange,Prec,land_use_code,LGM_dist_km,media humidity,deepest air humidity,Main entrance width (Dimenzije glavnog ulaza (širina)),Main entrance hught (Dimenzije glavnog ulaza (visina)),Number of entrances (Broj ulaza),Cave length (Duljina (m)),Horizontal cave length (Horizontalna duljina (m)),Cave depth (Dubina (m))
1,Špilja na Pozalicu,Croatia,29.9.2007.,2007-09-29,"1 m, 1 f",2,Nesticidae,Kryptonesticus,eremita,,61,4.276.131,169.129,tf,deep cave,,4,"12,65",14,"16,4216671","16,4216671","22,7733345",668,29,"143,02697",94,,nan,nan,1,nan,nan,nan
2,Špilja na Pozalicu,Croatia,4.3.2008.,2008-03-04,"1 m, 1 f",2,Nesticidae,Kryptonesticus,eremita,Kryptonesticus eremita,61,4.276.131,169.129,tf,deep cave,,4,"12,65",14,"16,4216671","16,4216671","22,7733345",668,29,"143,02697",94,,nan,nan,1,nan,nan,nan
4,Jama pod Velji vrh,Croatia,30.9.2007.,2007-09-30,3 juv,3,Dysderidae,Folkia,sp. 2,Folkia sp. 2,55,42.766.635,16.907.278,Tb,deep cave,,2,,"16,567","16,4216671","16,4216671","22,7733345",668,29,"142,6292455","95,667",,1,2,1,nan,90,41
7,Špilja na Pozalicu,Croatia,29.9.2007.,2007-09-29,1 juv,1,Cheiracanthiidae,Gen.,sp.,Gen. sp.,61,4.276.131,169.129,,,,4,"12,65",14,"16,4216671","16,4216671","22,7733345",668,29,"143,02697",94,,nan,nan,1,nan,nan,nan
8,Špilja na Pozalicu,Croatia,3.3.2008.,2008-03-03,6 juv,6,Nesticidae,Kryptonesticus,eremita,Kryptonesticus eremita,61,4.276.131,169.129,tf,deep cave,,4,"12,65",14,"16,4216671","16,4216671","22,7733345",668,29,"143,02697",94,,nan,nan,1,nan,nan,nan
9,Rača špilja,Croatia,28.9.2007.,2007-09-28,1 juv,1,Dysderidae,Folkia,sp. 2,Folkia sp. 2,90,42.734.493,16.910.785,Tb,deep cave,,4,"14,8","14,42","16,37628174","16,37628174","22,81538391",662,28,"146,7036244",,,,,,,,
10,Jama pod Velji vrh,Croatia,30.9.2007.,2007-09-30,1 juv,1,Dysderidae,Folkia,sp. 2,Folkia sp. 2,55,42.766.635,16.907.278,Tb,deep cave,,2,,"16,567","16,4216671","16,4216671","22,7733345",668,29,"142,6292455","95,667",,1,2,1,nan,90,41
11,Hrastovska špilja,Croatia,2.10.2007.,2007-10-02,5 juv,5,Nesticidae,Kryptonesticus,eremita,Kryptonesticus eremita,103,42.756.282,16.875.635,tf,deep cave,,4,,"12,6","16,4216671","16,4216671","22,7733345",668,29,"145,7479543",94,,nan,nan,1,nan,nan,nan
12,Rača špilja,Croatia,28.9.2007.,2007-09-28,1 f,1,Dysderidae,Folkia,sp. 2,Folkia sp. 2,90,42.734.493,16.910.785,Tb,deep cave,,4,"14,8","14,42","16,37628174","16,37628174","22,81538391",662,28,"146,7036244",,,,,,,,
13,Jama pod Velji vrh,Croatia,30.9.2007.,2007-09-30,1 juv,1,Dysderidae,Folkia,sp. 2,Folkia sp. 2,55,42.766.635,16.907.278,Tb,deep cave,,2,,"16,567","16,4216671","16,4216671","22,7733345",668,29,"142,6292455","95,667",,1,2,1,nan,90,41
14,Špilja na Pozalicu,Croatia,4.3.2008.,2008-03-04,1 f,1,Leptonetidae,Barusia,sp. 1,Barusia sp. 1,61,4.276.131,169.129,tb,deep cave,,4,"12,65",14,"16,4216671","16,4216671","22,7733345",668,29,"143,02697",94,,nan,nan,1,nan,nan,nan
16,Polušpilja na Mrčari,Croatia,1.10.2007.,2007-10-01,"1f, 2 juv",3,Agelenidae,Tegenaria,domestica,Tegenaria domestica,48,42.768.583,16.788.965,Tf,cave entrance,,2,,"19,4","16,70208359","16,70208359","20,84999847",630,24,"149,308983",,,,,,,,
18,Špilja na Pozalicu,Croatia,29.9.2007.,2007-09-29,"1 f, 1 juv",2,Nesticidae,Kryptonesticus,eremita,Kryptonesticus eremita,61,4.276.131,169.129,tf,deep cave,,4,"12,65",14,"16,4216671","16,4216671","22,7733345",668,29,"143,02697",94,,nan,nan,1,nan,nan,nan
19,Špilja na Pozalicu,Croatia,3.3.2008.,2008-03-03,1 juv,1,Nesticidae,Kryptonesticus,eremita,Kryptonesticus eremita,61,4.276.131,169.129,tf,deep cave,,4,"12,65",14,"16,4216671","16,4216671","22,7733345",668,29,"143,02697",94,,nan,nan,1,nan,nan,nan
20,Jama pod Velji vrh,Croatia,30.9.2007.,2007-09-30,"1 f, 1 juv",2,Nesticidae,Kryptonesticus,eremita,Kryptonesticus eremita,55,42.766.635,16.907.278,tf,deep cave,,2,,"16,567","16,4216671","16,4216671","22,7733345",668,29,"142,6292455","95,667",,1,2,1,nan,90,41
21,Špilja na Pozalicu,Croatia,29.9.2007.,2007-09-29,2 juv,2,Nesticidae,Kryptonesticus,eremita,Kryptonesticus eremita,61,4.276.131,169.129,tf,deep cave,,4,"12,65",14,"16,4216671","16,4216671","22,7733345",668,29,"143,02697",94,,nan,nan,1,nan,nan,nan
23,Hrastovska špilja,Croatia,3.3.2008.,2008-03-03,2 juv,2,Nesticidae,Kryptonesticus,eremita,Kryptonesticus eremita,103,42.756.282,16.875.635,tf,deep cave,,4,,"12,6","16,4216671","16,4216671","22,7733345",668,29,"145,7479543",94,,nan,nan,1,nan,nan,nan
25,Rača špilja,Croatia,28.9.2007.,2007-09-28,1f,1,Dysderidae,Folkia,sp. 2,Folkia sp. 2,90,42.734.493,16.910.785,Tb,deep cave,,4,"14,8","14,42","16,37628174","16,37628174","22,81538391",662,28,"146,7036244",,,,,,,,
26,Špilja pod Kaštel,Croatia,4.3.2008.,2008-03-04,1 m,1,Leptonetidae,Barusia,sp. 1,Barusia sp. 1,44,42.768.041,16.899.005,tb,deep cave,,2,"15,3","16,95","16,4216671","16,4216671","22,7733345",668,29,"142,9000056","97,25",,nan,nan,1,nan,nan,nan
29,Hrastovska špilja,Croatia,4.3.2008.,2008-03-04,6 juv,6,Nesticidae,Kryptonesticus,eremita,Kryptonesticus eremita,103,42.756.282,16.875.635,tf,deep cave,,4,,"12,6","16,4216671","16,4216671","22,7733345",668,29,"145,7479543",94,,nan,nan,1,nan,nan,nan
30,Rača špilja,Croatia,28.9.2007.,2007-09-28,1 juv,1,Dysderidae,Folkia,sp. 2,Folkia sp. 2,90,42.734.493,16.910.785,Tb,deep cave,,4,"14,8","14,42","16,37628174","16,37628174","22,81538391",662,28,"146,7036244",,,,,,,,
31,Hrastovska špilja,Croatia,2.10.2007.,2007-10-02,5 juv,5,Nesticidae,Kryptonesticus,eremita,Kryptonesticus eremita,103,42.756.282,16.875.635,tf,deep cave,,4,,"12,6","16,4216671","16,4216671","22,7733345",668,29,"145,7479543",94,,nan,nan,1,nan,nan,nan
32,Hrastovska špilja,Croatia,3.3.2008.,2008-03-03,"1 f, 1 juv m",2,Nesticidae,Kryptonesticus,eremita,Kryptonesticus eremita,103,42.756.282,16.875.635,tf,deep cave,,4,,"12,6","16,4216671","16,4216671","22,7733345",668,29,"145,7479543",94,,nan,nan,1,nan,nan,nan
33,Jama pod Velji vrh,Croatia,30.9.2007.,2007-09-30,3 juv,3,Dysderidae,Folkia,sp. 2,Folkia sp. 2,55,42.766.635,16.907.278,Tb,deep cave,,2,,"16,567","16,4216671","16,4216671","22,7733345",668,29,"142,6292455","95,667",,1,2,1,nan,90,41
34,Rača špilja,Croatia,28.9.2007.,2007-09-28,1 juv,1,Dysderidae,Folkia,sp. 2,Folkia sp. 2,90,42.734.493,16.910.785,Tb,deep cave,,4,"14,8","14,42","16,37628174","16,37628174","22,81538391",662,28,"146,7036244",,,,,,,,
35,Špilja na Pozalicu,Croatia,3.3.2008.,2008-03-03,1 f,1,Pholcidae,Pholcus,phalangioides,Pholcus phalangioides,61,4.276.131,169.129,,deep cave,,4,"12,65",14,"16,4216671","16,4216671","22,7733345",668,29,"143,02697",94,,nan,nan,1,nan,nan,nan
36,Hrastovska špilja,Croatia,3.3.2008.,2008-03-03,1 juv,1,Dysderidae,Folkia,sp. 2,Folkia sp. 2,103,42.756.282,16.875.635,Tb,deep cave,,4,,"12,6","16,4216671","16,4216671","22,7733345",668,29,"145,7479543",94,,nan,nan,1,nan,nan,nan
39,Špilja pod Kaštel,Croatia,27.9.2007.,2007-09-27,2 juv,2,Nesticidae,Kryptonesticus,eremita,Kryptonesticus eremita,44,42.768.041,16.899.005,tf,deep cave,,2,"15,3","16,95","16,4216671","16,4216671","22,7733345",668,29,"142,9000056","97,25",,nan,nan,1,nan,nan,nan
41,Rača špilja,Croatia,2.10.2007.,2007-10-02,1 juv,1,Agelenidae,Tegenaria,sp.,Tegenaria sp.,90,42.734.493,16.910.785,,deep cave,,4,"14,8","14,42","16,37628174","16,37628174","22,81538391",662,28,"146,7036244",,,,,,,,
42,Jama Cvjetana Barbića,Croatia,1.10.2007.,2007-10-01,2 juv,2,Nesticidae,Kryptonesticus,eremita,Kryptonesticus eremita,38,42.740.282,16.879.112,tf,deep cave,,1,,"17,2","16,37628174","16,37628174","22,81538391",662,28,"147,6523728",,,1,0.5,1,nan,5.5,6.5
44,Jama pod Velji vrh,Croatia,30.9.2007.,2007-09-30,1 juv,1,Nesticidae,Kryptonesticus,eremita,Kryptonesticus eremita,55,42.766.635,16.907.278,tf,deep cave,,2,,"16,567","16,4216671","16,4216671","22,7733345",668,29,"142,6292455","95,667",,1,2,1,nan,90,41
45,Hrastovska špilja,Croatia,2.10.2007.,2007-10-02,2 juv,2,Dysderidae,Folkia,sp. 2,Folkia sp. 2,103,42.756.282,16.875.635,Tb,deep cave,,4,,"12,6","16,4216671","16,4216671","22,7733345",668,29,"145,7479543",94,,nan,nan,1,nan,nan,nan
46,Špilja na Pozalicu,Croatia,3.3.2008.,2008-03-03,1 m,1,Nesticidae,Kryptonesticus,eremita,Kryptonesticus eremita,61,4.276.131,169.129,tf,deep cave,,4,"12,65",14,"16,4216671","16,4216671","22,7733345",668,29,"143,02697",94,,nan,nan,1,nan,nan,nan
47,Jama pod Velji vrh,Croatia,2.3.2008.,2008-03-02,1 juv,1,Dysderidae,Folkia,sp. 2,Folkia sp. 2,55,42.766.635,16.907.278,Tb,deep cave,,2,,"16,567","16,4216671","16,4216671","22,7733345",668,29,"142,6292455","95,667",,1,2,1,nan,90,41
48,Hrastovska špilja,Croatia,3.3.2008.,2008-03-03,"1 f, 1 juv",2,Leptonetidae,Barusia,sp. 1,Barusia sp. 1,103,42.756.282,16.875.635,tb,deep cave,,4,,"12,6","16,4216671","16,4216671","22,7733345",668,29,"145,7479543",94,,nan,nan,1,nan,nan,nan
50,Hrastovska špilja,Croatia,3.3.2008.,2008-03-03,2 juv,2,Nesticidae,Kryptonesticus,eremita,Kryptonesticus eremita,103,42.756.282,16.875.635,tf,deep cave,,4,,"12,6","16,4216671","16,4216671","22,7733345",668,29,"145,7479543",94,,nan,nan,1,nan,nan,nan
51,Hrastovska špilja,Croatia,2.10.2007.,2007-10-02,1 f,1,Linyphiidae,Bathyphantes,sp. 1,Bathyphantes sp. 1,103,42.756.282,16.875.635,Tx,,,4,,"12,6","16,4216671","16,4216671","22,7733345",668,29,"145,7479543",94,,nan,nan,1,nan,nan,nan
53,Špilja pod Kaštel,Croatia,4.3.2008.,2008-03-04,1 m,1,Nesticidae,Kryptonesticus,eremita,Kryptonesticus eremita,44,42.768.041,16.899.005,tf,deep cave,,2,"15,3","16,95","16,4216671","16,4216671","22,7733345",668,29,"142,9000056","97,25",,nan,nan,1,nan,nan,nan
54,Špilja na Pozalicu,Croatia,29.9.2007.,2007-09-29,1 juv,1,Nesticidae,Kryptonesticus,eremita,Kryptonesticus eremita,61,4.276.131,169.129,tf,deep cave,,4,"12,65",14,"16,4216671","16,4216671","22,7733345",668,29,"143,02697",94,,nan,nan,1,nan,nan,nan
56,Breg jama,Croatia,30.4.2008.,2008-04-30,1 juv,1,Dysderidae,Harpactea,sp.,Harpactea sp.,35,42.723.459,17.591.234,,,,1,,"14,9","16,37552071","16,37552071","24,14374924",938,25,"102,4734285","97,1",,0.8,1.2,1,nan,5,7.5
57,Jama Međugrađen,Croatia,30.4.2008.,2008-04-30,"1m, 2 juv?",3,Dysderidae,Harpactea,sp. 9,Harpactea sp. 9,309,42.737.934,1.755.671,Tb,deep cave,,3,,"15,8","15,79444408","15,79444408","24,11999893",925,28,"102,2121648",,,0.5,0.5,1,nan,30,102.6
58,Jama Međugrađen,Croatia,30.4.2008.,2008-04-30,"1f, 2juv",3,Agelenidae,Histopona,bidens,Histopona bidens,309,42.737.934,1.755.671,tb,deep cave,,3,,"15,8","15,79444408","15,79444408","24,11999893",925,28,"102,2121648",,,0.5,0.5,1,nan,30,102.6
59,Jarač na ponti od Graca,Croatia,3.5.2008.,2008-05-03,2 juv,2,Agelenidae,Histopona,bidens,Histopona bidens,,42.785.308,17.392.067,tb,deep cave,,2,,"10,833","16,31185913","16,31185913","23,7307682",855,28,"105,4881868",,,14,6,1,nan,72,28
61,Ostaševica,Croatia,28.4.2008.,2008-04-28,"1f, 1juv m",2,Agelenidae,Histopona,bidens,Histopona bidens,302,42.748.959,17.544.404,tb,deep cave,,9,,"11,4","15,79444408","15,79444408","24,11999893",925,25,"101,3842944",100,,6,5,1,nan,70,20
62,Jama na Brekalcima,Croatia,29.4.2008.,2008-04-29,"1m, 1f",2,Agelenidae,Histopona,bidens,Histopona bidens,109,42.781.895,17.407.747,tb,deep cave,,1,,"12,867","16,31185913","16,31185913","23,7307682",855,25,"104,9005462","99,833",,12,3,1,nan,20,77.5
63,Jama pod Sv. Spasom,Croatia,3.5.2008.,2008-05-03,1f,1,Agelenidae,Histopona,bidens,Histopona bidens,50,42.731.779,17.542.409,tb,deep cave,,6,,"14,6","15,79444408","15,79444408","24,11999893",925,17,"103,7805159",,,6,7,1,nan,42,78
64,Jama pod Sv. Spasom,Croatia,3.5.2008.,2008-05-03,1f,1,Dysderidae,Folkia,inermis,Folkia inermis,50,42.731.779,17.542.409,Tb,deep cave,,6,,"14,6","15,79444408","15,79444408","24,11999893",925,17,"103,7805159",,,6,7,1,nan,42,78
65,Movrica,Croatia,28.4.2008.,2008-04-28,1 juv m,1,Agelenidae,Histopona,bidens,Histopona bidens,147,42.752.604,17.551.145,tb,deep cave,,6,,"11,9","16,45000076","16,45000076","24,5",925,25,"100,5400609",,,4,11,1,nan,82,6
66,Male ponte,Croatia,27.4.2008.,2008-04-27,1 juv m,1,Agelenidae,Histopona,bidens,Histopona bidens,258,42.761.389,17.430.786,tb,deep cave,,7,,"14,45","16,10370445","16,10370445","23,88333321",874,29,"106,0560518",100,,1,1.5,1,nan,106,28.8
67,Movrica,Croatia,28.4.2008.,2008-04-28,"1m, 1f, 3 juv",5,Agelenidae,Histopona,bidens,Histopona bidens,147,42.752.604,17.551.145,tb,deep cave,,6,,"11,9","16,45000076","16,45000076","24,5",925,25,"100,5400609",,,4,11,1,nan,82,6
68,Špilja u Solinama,Croatia,26.4.2008.,2008-04-26,"1f, 2juv",3,Agelenidae,Histopona,bidens,Histopona bidens,83,42.768.021,17.377.062,tb,deep cave,,5,,"8,95","16,31185913","16,31185913","23,7307682",855,24,"108,5917672","83,7",,22,6,1,nan,47,18
70,Špilja u Solinama,Croatia,26.4.2008.,2008-04-26,1 juv,1,Dysderidae,Gen.,sp.,Gen.  sp.,83,42.768.021,17.377.062,Tb,deep cave,,5,,"8,95","16,31185913","16,31185913","23,7307682",855,24,"108,5917672","83,7",,22,6,1,nan,47,18
71,Špilja u Solinama,Croatia,26.4.2008.,2008-04-26,1 juv,1,Dysderidae,Folkia,sp. 5,Folkia sp. 5,83,42.768.021,17.377.062,Tb,deep cave,,5,,"8,95","16,31185913","16,31185913","23,7307682",855,24,"108,5917672","83,7",,22,6,1,nan,47,18
72,Jama na Brekalcima,Croatia,29.4.2008.,2008-04-29,1f,1,Agelenidae,Histopona,bidens,Histopona bidens,109,42.781.895,17.407.747,tb,deep cave,,1,,"12,867","16,31185913","16,31185913","23,7307682",855,25,"104,9005462","99,833",,12,3,1,nan,20,77.5
73,Špilja kod Nerezinog dola,Croatia,27.4.2008.,2008-04-27,1 juv,1,Agelenidae,Tegenaria,sp.,Tegenaria sp.,177,42.758.378,17.436.094,,deep cave,,6,,"13,883","16,10370445","16,10370445","23,88333321",874,24,"106,1225494","95,342",,6,2.5,1,nan,35,5.5
74,Male ponte,Croatia,27.4.2008.,2008-04-27,2 juv,2,Agelenidae,Histopona,bidens,Histopona bidens,258,42.761.389,17.430.786,tb,deep cave,,7,,"14,45","16,10370445","16,10370445","23,88333321",874,29,"106,0560518",100,,1,1.5,1,nan,106,28.8
75,Jama za Sv. Ilijom,Croatia,2.5.2008.,2008-05-02,2 juv,2,Agelenidae,Histopona,bidens,Histopona bidens,257,42.744.428,17.515.269,tb,deep cave,,3,,"12,533","15,98333359","15,98333359","24,29999924",909,29,"103,5442348",100,,3,2,1,nan,80,65
77,Galičnjak,Croatia,2.5.2008.,2008-05-02,1 juv,1,Agelenidae,Histopona,bidens,Histopona bidens,160,42.720.118,1.767.071,tb,deep cave,,11,,"13,6","16,1147728","16,1147728","23,72727203",971,25,"99,37896954",,,50,40,1,nan,130,60
78,Galičnjak,Croatia,2.5.2008.,2008-05-02,1 f,1,Leptonetidae,Sulcia,sp. 6,Sulcia sp. 6,160,42.720.118,1.767.071,Tf,cave entrance,,11,,"13,6","16,1147728","16,1147728","23,72727203",971,25,"99,37896954",,,50,40,1,nan,130,60
79,Galičnjak,Croatia,2.5.2008.,2008-05-02,"2 m, 2 f, 1 juv",5,Leptonetidae,Sulcia,sp. 6,Sulcia sp. 6,160,42.720.118,1.767.071,Tf,cave entrance,,11,,"13,6","16,1147728","16,1147728","23,72727203",971,25,"99,37896954",,,50,40,1,nan,130,60
80,Galičnjak,Croatia,2.5.2008.,2008-05-02,"1m, 1f, 1 juv",3,Leptonetidae,Sulcia,sp. 6,Sulcia sp. 6,160,42.720.118,1.767.071,Tf,cave entrance,,11,,"13,6","16,1147728","16,1147728","23,72727203",971,25,"99,37896954",,,50,40,1,nan,130,60
86,Galičnjak,Croatia,2.5.2008.,2008-05-02,"2 m, 1 juv",3,Leptonetidae,Barusia,maheni,Barusia maheni,160,42.720.118,1.767.071,tf,deep cave,,11,,"13,6","16,1147728","16,1147728","23,72727203",971,25,"99,37896954",,,50,40,1,nan,130,60
87,Špilja kod Nerezinog dola,Croatia,27.4.2008.,2008-04-27,1 juv f,1,Leptonetidae,Barusia,maheni,Barusia maheni,177,42.758.378,17.436.094,tf,deep cave,,6,,"13,883","16,10370445","16,10370445","23,88333321",874,24,"106,1225494","95,342",,6,2.5,1,nan,35,5.5
89,Movrica,Croatia,28.4.2008.,2008-04-28,"1 f, 2 juv m",3,Leptonetidae,Sulcia,nocturna,Sulcia nocturna,147,42.752.604,17.551.145,,deep cave,,6,,"11,9","16,45000076","16,45000076","24,5",925,25,"100,5400609",,,4,11,1,nan,82,6
90,Male ponte,Croatia,27.4.2008.,2008-04-27,1 f,1,Linyphiidae,Palliduphantes,sp. 1,Palliduphantes sp. 1,258,42.761.389,17.430.786,tf,deep cave,,7,,"14,45","16,10370445","16,10370445","23,88333321",874,29,"106,0560518",100,,1,1.5,1,nan,106,28.8
96,Male ponte,Croatia,14.4.2007.,2007-04-14,"1f, 1 juv",2,Leptonetidae,Sulcia,nocturna,Sulcia nocturna,258,42.761.389,17.430.786,,deep cave,,7,,"14,45","16,10370445","16,10370445","23,88333321",874,29,"106,0560518",100,,1,1.5,1,nan,106,28.8
98,Galičnjak,Croatia,10.4.2007.,2007-04-10,1 m,1,Leptonetidae,Barusia,maheni,Barusia maheni,160,42.720.118,1.767.071,tf,deep cave,,11,,"13,6","16,1147728","16,1147728","23,72727203",971,25,"99,37896954",,,50,40,1,nan,130,60
99,Ostaševica,Croatia,8.4.2007.,2007-04-08,"1f, 1 juv",2,Leptonetidae,Sulcia,nocturna,Sulcia nocturna,302,42.748.959,17.544.404,,deep cave,,9,,"11,4","15,79444408","15,79444408","24,11999893",925,25,"101,3842944",100,,6,5,1,nan,70,20
100,Galičnjak,Croatia,14.4.2007.,2007-04-14,1 m,1,Leptonetidae,Barusia,maheni,Barusia maheni,160,42.720.118,1.767.071,tf,deep cave,,11,,"13,6","16,1147728","16,1147728","23,72727203",971,25,"99,37896954",,,50,40,1,nan,130,60
102,Male ponte,Croatia,9.4.2007.,2007-04-09,1 f,1,Leptonetidae,Barusia,maheni,Barusia maheni,258,42.761.389,17.430.786,tf,deep cave,,7,,"14,45","16,10370445","16,10370445","23,88333321",874,29,"106,0560518",100,,1,1.5,1,nan,106,28.8
103,Male ponte,Croatia,9.4.2007.,2007-04-09,"1 m, 1 f, 1 juv",3,Leptonetidae,Sulcia,nocturna,Sulcia nocturna,258,42.761.389,17.430.786,,deep cave,,7,,"14,45","16,10370445","16,10370445","23,88333321",874,29,"106,0560518",100,,1,1.5,1,nan,106,28.8
104,Špilja kod Nerezinog dola,Croatia,7.4.2007.,2007-04-07,"1 m, 3 juv",4,Leptonetidae,Barusia,maheni,Barusia maheni,177,42.758.378,17.436.094,tf,deep cave,,6,,"13,883","16,10370445","16,10370445","23,88333321",874,24,"106,1225494","95,342",,6,2.5,1,nan,35,5.5
105,Špilja u Solinama,Croatia,11.4.2007.,2007-04-11,"1 m, 1 f",2,Leptonetidae,Barusia,maheni,Barusia maheni,83,42.768.021,17.377.062,tf,deep cave,,5,,"8,95","16,31185913","16,31185913","23,7307682",855,24,"108,5917672","83,7",,22,6,1,nan,47,18
109,Špilja kod Nerezinog dola,Croatia,7.4.2007.,2007-04-07,"1 m, 2 f",3,Leptonetidae,Barusia,maheni,Barusia maheni,177,42.758.378,17.436.094,tf,deep cave,,6,,"13,883","16,10370445","16,10370445","23,88333321",874,24,"106,1225494","95,342",,6,2.5,1,nan,35,5.5
111,Male ponte,Croatia,9.4.2007.,2007-04-09,1 f,1,Linyphiidae,Palliduphantes,sp. 1,Palliduphantes sp. 1,258,42.761.389,17.430.786,tf,deep cave,,7,,"14,45","16,10370445","16,10370445","23,88333321",874,29,"106,0560518",100,,1,1.5,1,nan,106,28.8
112,Ostaševica,Croatia,8.4.2007.,2007-04-08,2 juv,2,Agelenidae,Histopona,bidens,Histopona bidens,302,42.748.959,17.544.404,tb,deep cave,,9,,"11,4","15,79444408","15,79444408","24,11999893",925,25,"101,3842944",100,,6,5,1,nan,70,20
113,Špilja kod Nerezinog dola,Croatia,7.4.2007.,2007-04-07,1 juv,1,Agelenidae,Histopona,bidens,Histopona bidens,177,42.758.378,17.436.094,tb,deep cave,,6,,"13,883","16,10370445","16,10370445","23,88333321",874,24,"106,1225494","95,342",,6,2.5,1,nan,35,5.5
114,Male ponte,Croatia,9.4.2007.,2007-04-09,1 juv,1,Agelenidae,Histopona,bidens,Histopona bidens,258,42.761.389,17.430.786,tb,deep cave,,7,,"14,45","16,10370445","16,10370445","23,88333321",874,29,"106,0560518",100,,1,1.5,1,nan,106,28.8
118,Galičnjak,Croatia,10.4.2007.,2007-04-10,1m,1,Nemesiidae,Nemesia,sp. 1,Nemesia sp. 1,160,42.720.118,1.767.071,,,,11,,"13,6","16,1147728","16,1147728","23,72727203",971,25,"99,37896954",,,50,40,1,nan,130,60
119,Galičnjak,Croatia,14.4.2007.,2007-04-14,2 juv,2,Agelenidae,Histopona,bidens,Histopona bidens,160,42.720.118,1.767.071,tb,deep cave,,11,,"13,6","16,1147728","16,1147728","23,72727203",971,25,"99,37896954",,,50,40,1,nan,130,60
120,Male ponte,Croatia,9.4.2007.,2007-04-09,2 juv,2,Agelenidae,Histopona,bidens,Histopona bidens,258,42.761.389,17.430.786,tb,deep cave,,7,,"14,45","16,10370445","16,10370445","23,88333321",874,29,"106,0560518",100,,1,1.5,1,nan,106,28.8
122,Movrica,Croatia,8.4.2007.,2007-04-08,2 juv,2,Agelenidae,Histopona,bidens,Histopona bidens,147,42.752.604,17.551.145,tb,deep cave,,6,,"11,9","16,45000076","16,45000076","24,5",925,25,"100,5400609",,,4,11,1,nan,82,6
123,Špilja kod Vrha spile,Croatia,9.4.2007.,2007-04-09,1 juv,1,Agelenidae,Histopona,bidens,Histopona bidens,183,42.776.757,17.420.591,tb,deep cave,,3,,"9,4","16,10370445","16,10370445","23,88333321",874,29,"104,7346977","74,3",,12.5,5,1,nan,30,10.6
125,Galičnjak,Croatia,10.4.2007.,2007-04-10,1 juv,1,Dysderidae,Harpactea,sp.,Harpactea sp.,160,42.720.118,1.767.071,,,,11,,"13,6","16,1147728","16,1147728","23,72727203",971,25,"99,37896954",,,50,40,1,nan,130,60
126,Špilja u Solinama,Croatia,11.4.2007.,2007-04-11,1 juv,1,Dysderidae,Folkia,sp. 5,Folkia sp. 5,83,42.768.021,17.377.062,Tb,deep cave,,5,,"8,95","16,31185913","16,31185913","23,7307682",855,24,"108,5917672","83,7",,22,6,1,nan,47,18
128,Male ponte,Croatia,9.4.2007.,2007-04-09,1 juv,1,Dysderidae,Folkia,sp. 5,Folkia sp. 5,258,42.761.389,17.430.786,Tb,deep cave,,7,,"14,45","16,10370445","16,10370445","23,88333321",874,29,"106,0560518",100,,1,1.5,1,nan,106,28.8
129,Špilja kod Nerezinog dola,Croatia,7.4.2007.,2007-04-07,1 juv,1,Dysderidae,Folkia,inermis,Folkia inermis,177,42.758.378,17.436.094,Tb,deep cave,,6,,"13,883","16,10370445","16,10370445","23,88333321",874,24,"106,1225494","95,342",,6,2.5,1,nan,35,5.5
131,Male ponte,Croatia,13.4.2007.,2007-04-13,1f,1,Dysderidae,Folkia,sp. 5,Folkia sp. 5,258,42.761.389,17.430.786,Tb,deep cave,,7,,"14,45","16,10370445","16,10370445","23,88333321",874,29,"106,0560518",100,,1,1.5,1,nan,106,28.8
133,Movrica,Croatia,8.4.2007.,2007-04-08,1 f,1,Linyphiidae,Bathyphantes,sp. 1,Bathyphantes sp. 1,147,42.752.604,17.551.145,Tx,,,6,,"11,9","16,45000076","16,45000076","24,5",925,25,"100,5400609",,,4,11,1,nan,82,6
134,Špilja u Solinama,Croatia,11.4.2007.,2007-04-11,1 f,1,Familia x,Gen.,sp.,Gen. sp.,83,42.768.021,17.377.062,,,,5,,"8,95","16,31185913","16,31185913","23,7307682",855,24,"108,5917672","83,7",,22,6,1,nan,47,18
135,Male ponte,Croatia,9.4.2007.,2007-04-09,1 f,1,Linyphiidae,Bathyphantes,sp. 1,Bathyphantes sp. 1,258,42.761.389,17.430.786,Tx,,,7,,"14,45","16,10370445","16,10370445","23,88333321",874,29,"106,0560518",100,,1,1.5,1,nan,106,28.8
139,Ostaševica,Croatia,28.4.2008.,2008-04-28,1m,1,Dysderidae,Folkia,inermis,Folkia inermis,302,42.748.959,17.544.404,Tb,deep cave,,9,,"11,4","15,79444408","15,79444408","24,11999893",925,25,"101,3842944",100,,6,5,1,nan,70,20
140,Ostaševica,Croatia,28.4.2008.,2008-04-28,1m,1,Agelenidae,Histopona,bidens,Histopona bidens,302,42.748.959,17.544.404,tb,deep cave,,9,,"11,4","15,79444408","15,79444408","24,11999893",925,25,"101,3842944",100,,6,5,1,nan,70,20
141,Jama Međugrađen,Croatia,30.4.2008.,2008-04-30,3 juv,3,Agelenidae,Histopona,bidens,Histopona bidens,309,42.737.934,1.755.671,tb,deep cave,,3,,"15,8","15,79444408","15,79444408","24,11999893",925,28,"102,2121648",,,0.5,0.5,1,nan,30,102.6
142,Jama Međugrađen,Croatia,30.4.2008.,2008-04-30,1f,1,Dysderidae,Folkia,inermis,Folkia inermis,309,42.737.934,1.755.671,Tb,deep cave,,3,,"15,8","15,79444408","15,79444408","24,11999893",925,28,"102,2121648",,,0.5,0.5,1,nan,30,102.6
144,Močiljska špilja,Croatia,1.11.2008.,2008-11-01,1f,1,Nesticidae,Kryptonesticus,eremita,Kryptonesticus eremita,333,42.689.061,18.071.906,tf,deep cave,,6,"15,4","14,7","15,5370369","15,5370369","24,25",1154,26,"95,48772633",,,5,2.5,1,1038,938,138
146,Debela ljut,Croatia,31.10.2008.,2008-10-31,"1f, 2 juv",3,Nesticidae,Kryptonesticus,eremita,Kryptonesticus eremita,278,42.717.699,18.022.036,tf,deep cave,,8,"15,6","15,6","14,54366684","14,54366684","24,62399864",1130,32,"91,11277219",,,,,,,,
147,Debela ljut,Croatia,31.10.2008.,2008-10-31,1 f,1,Linyphiidae,Gen.,sp. X,Gen. sp. X,278,42.717.699,18.022.036,,,,8,"15,6","15,6","14,54366684","14,54366684","24,62399864",1130,32,"91,11277219",,,,,,,,
148,Banova ljut,Croatia,31.10.2008.,2008-10-31,1 juv m,1,Nesticidae,Kryptonesticus,eremita,Kryptonesticus eremita,278,42.724.023,18.023.649,tf,deep cave,,4,,"15,2","14,54366684","14,54366684","24,62399864",1130,32,"90,15075072",93,,2,1.8,1,nan,306,25
152,Jama Zadubravica,Croatia,3.11.2008.,2008-11-03,"1 juv m, 1f",2,Leptonetidae,Sulcia,sp. X,Sulcia sp. X,670,42.771.666,17.936.425,,,,3,,"11,45","13,26933289","13,26933289","24,79599953",1074,26,"83,72254241","95,2",,5,2,1,164,111,108
154,Jama na vrh Prodoli,Croatia,4.11.2008.,2008-11-04,1 m,1,Leptonetidae,Barusia,maheni,Barusia maheni,278,42.720.837,18.021.231,tf,deep cave,,1,,"21,6","14,54366684","14,54366684","24,62399864",1130,32,"90,63957603",,,4,0.5,1,nan,7,6.5
156,Debela ljut,Croatia,31.10.2008.,2008-10-31,"1m, 1 juv",2,Leptonetidae,Barusia,maheni,Barusia maheni,278,42.717.699,18.022.036,tf,deep cave,,8,"15,6","15,6","14,54366684","14,54366684","24,62399864",1130,32,"91,11277219",,,,,,,,
180,Jama Zadubravica,Croatia,3.11.2008.,2008-11-03,1f,1,Agelenidae,Histopona,conveniens,Histopona conveniens,670,42.771.666,17.936.425,Tf,deep cave,,3,,"11,45","13,26933289","13,26933289","24,79599953",1074,26,"83,72254241","95,2",,5,2,1,164,111,108
183,Jama u Zabirađu,Croatia,30.3.2008.,2008-03-30,"1m, 2 juv",3,Dysderidae,Dysdera,sp. 1,Dysdera sp. 1,447,42.732.667,18.049.328,,,,3,,"11,9","14,05533314","14,05533314","24,89999962",1139,21,"88,82459541",,,1,1,1,90,25,87
184,Krivača špilja,Croatia,31.3.2008.,2008-03-31,1f,1,Dysderidae,Stalagtia,hercegovinensis,Stalagtia hercegovinensis,525,42.730.217,18.067.602,Tb,deep cave,,1,,"8,9","14,05533314","14,05533314","24,89999962",1139,29,"89,23993567",,,6,3,1,nan,43,9
185,Jama u Zabirađu,Croatia,30.3.2008.,2008-03-30,1m,1,Dysderidae,Stalagtia,sp. 5,Stalagtia sp. 5,447,42.732.667,18.049.328,Tb,deep cave,,3,,"11,9","14,05533314","14,05533314","24,89999962",1139,21,"88,82459541",,,1,1,1,90,25,87
189,Krivača špilja,Croatia,31.3.2008.,2008-03-31,1f,1,Dysderidae,Stalagtia,hercegovinensis,Stalagtia hercegovinensis,525,42.730.217,18.067.602,Tb,deep cave,,1,,"8,9","14,05533314","14,05533314","24,89999962",1139,29,"89,23993567",,,6,3,1,nan,43,9
190,Jama u Zabirađu,Croatia,2.11.2008.,2008-11-02,2f,2,Dysderidae,Stalagtia,sp. 5,Stalagtia sp. 5,447,42.732.667,18.049.328,Tb,deep cave,,3,,"11,9","14,05533314","14,05533314","24,89999962",1139,21,"88,82459541",,,1,1,1,90,25,87
191,Jama Zadubravica,Croatia,3.11.2008.,2008-11-03,1f,1,Dysderidae,Stalagtia,hercegovinensis,Stalagtia hercegovinensis,670,42.771.666,17.936.425,Tb,deep cave,,3,,"11,45","13,26933289","13,26933289","24,79599953",1074,26,"83,72254241","95,2",,5,2,1,164,111,108
194,Špilja na vrh Toraca,Croatia,26.3.2008.,2008-03-26,1f,1,Dysderidae,Stalagtia,sp. 5,Stalagtia sp. 5,193,42.705.575,1.803.049,Tb,deep cave,,3,"15,5","15,275","16,42202377","16,42202377","23,8571434",1128,29,"92,9323532","96,75",100,1,2,1,nan,65.5,17
201,Jama Zadubravica,Croatia,31.3.2008.,2008-03-31,3 juv,3,Dysderidae,Stalagtia,hercegovinensis,Stalagtia hercegovinensis,670,42.771.666,17.936.425,Tb,deep cave,,3,,"11,45","13,26933289","13,26933289","24,79599953",1074,26,"83,72254241","95,2",,5,2,1,164,111,108
202,Močiljska špilja,Croatia,1.11.2008.,2008-11-01,1 juv,1,Dysderidae,Stalagtia,sp. 5,Stalagtia sp. 5,333,42.689.061,18.071.906,Tb,deep cave,,6,"15,4","14,7","15,5370369","15,5370369","24,25",1154,26,"95,48772633",,,5,2.5,1,1038,938,138
205,Debela ljut,Croatia,31.10.2008.,2008-10-31,"1f, 1m",2,Linyphiidae,Asthenargus,bracianus,Asthenargus bracianus,278,42.717.699,18.022.036,tf,deep cave,,8,"15,6","15,6","14,54366684","14,54366684","24,62399864",1130,32,"91,11277219",,,,,,,,
207,Debela ljut,Croatia,31.10.2008.,2008-10-31,1 f,1,Linyphiidae,Asthenargus,bracianus,Asthenargus bracianus,278,42.717.699,18.022.036,tf,deep cave,,8,"15,6","15,6","14,54366684","14,54366684","24,62399864",1130,32,"91,11277219",,,,,,,,
208,Jama u Zabirađu,Croatia,30.3.2008.,2008-03-30,1f,1,Linyphiidae,Centromerus,raridentatus sp.n.,Centromerus raridentatus sp.n.,447,42.732.667,18.049.328,,,,3,,"11,9","14,05533314","14,05533314","24,89999962",1139,21,"88,82459541",,,1,1,1,90,25,87
214,Činjadra,Croatia,5.1.2009.,2009-01-05,"1 f, 1 juv",2,Nesticidae,Kryptonesticus,eremita,Kryptonesticus eremita,364,43.339.771,16.599.423,tf,deep cave,,2,,"15,1","15,05266666","15,05266666","25,05999947",793,28,"109,3832783",,,4,1,1,nan,83,0
215,Činjadra,Croatia,22.10.2007.,2007-10-22,"1 f, 5 juv",6,Nesticidae,Kryptonesticus,eremita,Kryptonesticus eremita,364,43.339.771,16.599.423,tf,deep cave,,2,,"15,1","15,05266666","15,05266666","25,05999947",793,28,"109,3832783",,,4,1,1,nan,83,0
219,Špilja pod Zimzelom,Croatia,25.6.2008.,2008-06-25,1 m,1,Dysderidae,Parastalita,stygia,Parastalita stygia,791,45.281.948,15.115.239,Tb,deep cave,,1,,8,"7,624666691","7,624666691","27,04400063",1505,24,"373,7136599",,,5,2.7,1,nan,194,21
220,Špilja pod Zimzelom,Croatia,25.6.2008.,2008-06-25,"1 m, 1f",2,Dysderidae,Parastalita,stygia,Parastalita stygia,791,45.281.948,15.115.239,Tb,deep cave,,1,,8,"7,624666691","7,624666691","27,04400063",1505,24,"373,7136599",,,5,2.7,1,nan,194,21
221,Špilja pod Zimzelom,Croatia,14.12.2008.,2008-12-14,1 m,1,Dysderidae,Parastalita,stygia,Parastalita stygia,791,45.281.948,15.115.239,Tb,deep cave,,1,,8,"7,624666691","7,624666691","27,04400063",1505,24,"373,7136599",,,5,2.7,1,nan,194,21
222,Špilja pod Zimzelom,Croatia,14.12.2008.,2008-12-14,2 f,2,Dysderidae,Parastalita,stygia,Parastalita stygia,791,45.281.948,15.115.239,Tb,deep cave,,1,,8,"7,624666691","7,624666691","27,04400063",1505,24,"373,7136599",,,5,2.7,1,nan,194,21
227,Kovačica jama,Croatia,25.10.2008.,2008-10-25,"1f, 1m, 1juv",3,Linyphiidae,Porrhomma,convexum,Porrhomma convexum,676,45.519.178,1.765.444,,deep cave,,4,,"9,3","8,596333504","8,596333504","27,29999924",916,23,"289,2533106",,,,,,,,
228,Lijepa jama,Croatia,27.10.2008.,2008-10-27,"2m, 1 juv",3,Linyphiidae,Porrhomma,egeria,Porrhomma egeria,696,45.501.686,17.708.297,,deep cave,,1,,"10,8","9,106999397","9,106999397","27,62399864",882,23,"286,5244136",100,,3.5,1.5,1,nan,15,7
230,Jama iznad Jezerca,Croatia,27.10.2008.,2008-10-27,2 m,2,Linyphiidae,Porrhomma,microps,Porrhomma microps,626,45.504.726,17.684.095,Tf,deep cave,,1,"9,6","9,85","9,106999397","9,106999397","27,62399864",882,23,"286,9693747",,,0.6,0.6,1,nan,23,12
231,Jama na Bilu,Croatia,25.10.2008.,2008-10-25,"1m, 2f, 1juv",4,Linyphiidae,Porrhomma,egeria,Porrhomma egeria,659,45.512.599,17.693.701,,deep cave,,1,,"8,9","9,106999397","9,106999397","27,62399864",882,23,"288,2318392",,,1,0.5,1,nan,14.7,11.5
267,Bazgovača,Croatia,5.1.2009.,2009-01-05,"1f, 2m, 1juv",4,Linyphiidae,Palliduphantes,spelaeorum,Palliduphantes spelaeorum,652,4.330.647,16.622.143,Tf,deep cave,,3,,"7,2","12,8081665","12,8081665","24,57600021",796,24,"108,9858223",,,5,7,1,nan,47,32
270,Grapčeva špilja,Croatia,16.10.2007.,2007-10-16,"1m, 2 f, 1 juv",4,Nesticidae,Kryptonesticus,eremita,Kryptonesticus eremita,279,43.134.189,16.753.732,tf,deep cave,,5,,"13,225","15,48979187","15,48979187","23,94499969",751,28,"110,2583259",,,nan,nan,1,nan,nan,nan
271,Grapčeva špilja,Croatia,16.10.2007.,2007-10-16,1 juv,1,Agelenidae,Hadites,tegenarioides,Hadites tegenarioides,279,43.134.189,16.753.732,TB,deep cave,,5,,"13,225","15,48979187","15,48979187","23,94499969",751,28,"110,2583259",,,nan,nan,1,nan,nan,nan
274,Grapčeva špilja,Croatia,16.10.2007.,2007-10-16,"1 m, 1 juv",2,Nesticidae,Kryptonesticus,eremita,Kryptonesticus eremita,279,43.134.189,16.753.732,tf,deep cave,,5,,"13,225","15,48979187","15,48979187","23,94499969",751,28,"110,2583259",,,nan,nan,1,nan,nan,nan
281,Božićeva špilja,Croatia,12.8.2007.,2007-08-12,"2f, 1m",3,Linyphiidae,Troglohyphantes,kordunlikanus,Troglohyphantes kordunlikanus,260,45.000.041,15.776.525,tf,deep cave,,7,,"10,84","10,56083298","10,56083298","29,33199883",1248,26,"290,5189089",,,,,,,,
282,Božićeva špilja,Croatia,12.8.2007.,2007-08-12,2f,2,Linyphiidae,Troglohyphantes,kordunlikanus,Troglohyphantes kordunlikanus,260,45.000.041,15.776.525,tf,deep cave,,7,,"10,84","10,56083298","10,56083298","29,33199883",1248,26,"290,5189089",,,,,,,,
283,Božićeva špilja,Croatia,12.8.2007.,2007-08-12,"2f, 2 juv",4,Linyphiidae,Troglohyphantes,kordunlikanus,Troglohyphantes kordunlikanus,260,45.000.041,15.776.525,tf,deep cave,,7,,"10,84","10,56083298","10,56083298","29,33199883",1248,26,"290,5189089",,,,,,,,
284,Božićeva špilja,Croatia,12.8.2007.,2007-08-12,1f,1,Linyphiidae,Centromerus,cavernarum,Centromerus cavernarum,260,45.000.041,15.776.525,Tf,deep cave,,7,,"10,84","10,56083298","10,56083298","29,33199883",1248,26,"290,5189089",,,,,,,,
285,Božićeva špilja,Croatia,12.8.2007.,2007-08-12,1f,1,Linyphiidae,Troglohyphantes,kordunlikanus,Troglohyphantes kordunlikanus,260,45.000.041,15.776.525,tf,deep cave,,7,,"10,84","10,56083298","10,56083298","29,33199883",1248,26,"290,5189089",,,,,,,,
286,Božićeva špilja,Croatia,12.8.2007.,2007-08-12,1m,1,Linyphiidae,Centromerus,cavernarum,Centromerus cavernarum,260,45.000.041,15.776.525,Tf,deep cave,,7,,"10,84","10,56083298","10,56083298","29,33199883",1248,26,"290,5189089",,,,,,,,
287,Božićeva špilja,Croatia,12.8.2007.,2007-08-12,1m,1,Nesticidae,Nesticus,cellulanus,Nesticus cellulanus,260,45.000.041,15.776.525,tf,deep cave,,7,,"10,84","10,56083298","10,56083298","29,33199883",1248,26,"290,5189089",,,,,,,,
299,Jezero,Croatia,16.3.2002.,2002-03-16,2 m,2,Linyphiidae,Troglohyphantes,troglodytes,Troglohyphantes troglodytes,964,42.580.381,18.356.073,tf,deep cave,,8,,"7,567","12,93216705","12,93216705","24,86800003",1208,29,"104,2091301","96,5",,1,0.5,1,20.5,nan,12
300,Škrabuljica,Croatia,1.11.2003.,2003-11-01,"1m, 1 juv",2,Linyphiidae,Troglohyphantes,troglodytes,Troglohyphantes troglodytes,701,42.567.045,18.385.063,tf,deep cave,,5,,"10,867","12,1378336","12,1378336","24,90799904",1201,29,"102,7796012","97,4",,6,8,1,nan,98,11
360,Vaganka,Croatia,27.9.2008.,2008-09-27,1 juv,1,Dysderidae,Parastalita,stygia,Parastalita stygia,656,4.433.853,1.543.867,Tb,deep cave,,5,,"12,2","7,622666836","7,622666836","26,19600105",1265,29,"257,5927467",95,,,,,,,
362,Jama Nangilija,Croatia,29.9.2008.,2008-09-29,1 juv,1,Agelenidae,Histopona,sp.,Histopona sp.,432,44.346.542,15.385.818,,deep cave,,1,,"12,2","9,265666962","9,265666962","27,22400093",1146,26,"263,4245618",,,,,,,,
364,Manita peć,Croatia,1.10.2008.,2008-10-01,1 f,1,Dysderidae,Parastalita,stygia,Parastalita stygia,374,44.314.302,15.475.264,Tb,deep cave,,7,"8,8","9,525","10,42683315","10,42683315","27,29200172",1068,28,"252,2759525",,,nan,nan,1,nan,nan,nan
368,Vaganka,Croatia,27.9.2008.,2008-09-27,1 juv,1,Agelenidae,Histopona,sp.,Histopona sp.,656,4.433.853,1.543.867,,deep cave,,5,,"12,2","7,622666836","7,622666836","26,19600105",1265,29,"257,5927467",95,,,,,,,
370,Vaganka,Croatia,27.9.2008.,2008-09-27,1f,1,Dysderidae,Mesostalita,sp. 3,Mesostalita sp. 3,656,4.433.853,1.543.867,Tb,deep cave,,5,,"12,2","7,622666836","7,622666836","26,19600105",1265,29,"257,5927467",95,,,,,,,
371,Vaganka,Croatia,27.9.2008.,2008-09-27,1 juv,1,Agelenidae,Histopona,sp.,Histopona sp.,656,4.433.853,1.543.867,,deep cave,,5,,"12,2","7,622666836","7,622666836","26,19600105",1265,29,"257,5927467",95,,,,,,,
372,Vaganka,Croatia,27.9.2008.,2008-09-27,1 f,1,Leptonetidae,Cataleptoneta,lingulata,Cataleptoneta lingulata,656,4.433.853,1.543.867,tb,deep cave,,5,,"12,2","7,622666836","7,622666836","26,19600105",1265,29,"257,5927467",95,,,,,,,
388,Izvor špilja Bijeli bunar,Croatia,18.7.2004.,2004-07-18,1 f,1,Linyphiidae,Porrhomma,convexum,Porrhomma convexum,249,45.609.794,17.536.299,,deep cave,,2,,"11,6","10,06550026","10,06550026","28,22800064",867,23,"303,9731266","90,8",,0.5,0.5,1,nan,24,0
389,Izvor špilja Bijeli bunar,Croatia,18.7.2004.,2004-07-18,1 juv,1,Nesticidae,Nesticus,cellulanus,Nesticus cellulanus,249,45.609.794,17.536.299,,deep cave,,2,,"11,6","10,06550026","10,06550026","28,22800064",867,23,"303,9731266","90,8",,0.5,0.5,1,nan,24,0
391,Kotluša,Croatia,13.8.2005.,2005-08-13,1 f,1,Nesticidae,Kryptonesticus,eremita,Kryptonesticus eremita,433,43.949.126,16.399.081,tf,deep cave,,1,,"11,7","11,81166649","11,81166649","27,38800049",953,21,"135,1579933","95,2",,2,3,1,4727,4538,9
392,Gospodska špilja,Croatia,21.8.2004.,2004-08-21,1 juv,1,Nesticidae,Kryptonesticus,eremita,Kryptonesticus eremita,414,43.982.279,16.432.905,tf,deep cave,,1,,"10,45","11,62766647","11,62766647","28,06799889",971,26,"133,8798791",96,,1,1,1,3111,2493,55
428,Gvozdenica,Croatia,13.2.2009.,2009-02-13,"1f, 1 juv",2,Nesticidae,Nesticus,cellulanus,Nesticus cellulanus,213,45.299.765,15.589.405,tf,deep cave,,4,,"8,7","10,85416698","10,85416698","29,48399925",1123,24,"339,8560445",,,24,14,1,nan,250,85
429,Gvozdenica,Croatia,13.2.2009.,2009-02-13,1 m,1,Linyphiidae,Troglohyphantes,kordunlikanus,Troglohyphantes kordunlikanus,213,45.299.765,15.589.405,tf,deep cave,,4,,"8,7","10,85416698","10,85416698","29,48399925",1123,24,"339,8560445",,,24,14,1,nan,250,85
433,Gvozdenica,Croatia,13.2.2009.,2009-02-13,1 f,1,Linyphiidae,Centromerus,cavernarum,Centromerus cavernarum,213,45.299.765,15.589.405,Tf,deep cave,,4,,"8,7","10,85416698","10,85416698","29,48399925",1123,24,"339,8560445",,,24,14,1,nan,250,85
440,Ponor Sušik,Croatia,8.9.2009.,2009-09-08,2f,2,Linyphiidae,Porrhomma,convexum,Porrhomma convexum,224,45.145.514,15.538.934,Tf,deep cave,,4,,"9,6","10,33966637","10,33966637","29,04400063",1248,21,"325,2942174",,,,,,,,
441,Ponor Sušik,Croatia,8.9.2009.,2009-09-08,2f,2,Linyphiidae,Porrhomma,egeria,Porrhomma egeria,224,45.145.514,15.538.934,Tf,deep cave,,4,,"9,6","10,33966637","10,33966637","29,04400063",1248,21,"325,2942174",,,,,,,,
443,Tounjčica,Croatia,15.2.2009.,2009-02-15,1f,1,Nesticidae,Nesticus,cellulanus,Nesticus cellulanus,306,45.248.722,15.322.408,tf,deep cave,,5,,14,"10,14599991","10,14599991","28,85200119",1306,23,"353,7031634",,,nan,nan,1,nan,nan,nan
444,Tounjčica,Croatia,15.2.2009.,2009-02-15,1f,1,Linyphiidae,Troglohyphantes,croaticus,Troglohyphantes croaticus,306,45.248.722,15.322.408,Tb,deep cave,,5,,14,"10,14599991","10,14599991","28,85200119",1306,23,"353,7031634",,,nan,nan,1,nan,nan,nan
445,Tounjčica,Croatia,15.2.2009.,2009-02-15,1 m,1,Tetragnathidae,Meta,menardi,Meta menardi,306,45.248.722,15.322.408,tf,deep cave,,5,,14,"10,14599991","10,14599991","28,85200119",1306,23,"353,7031634",,,nan,nan,1,nan,nan,nan
452,Špilja pod Mačkovom dragom,Croatia,9.9.2009.,2009-09-09,1 juv m,1,Dysderidae,Parastalita,stygia,Parastalita stygia,685,45.261.001,15.023.822,Tb,deep cave,,1,,"7,4","6,968666553","6,968666553","26,46800041",1564,25,"378,8376232",,,2,1,1,376,362,26
453,Špilja pod Mačkovom dragom,Croatia,17.5.2009.,2009-05-17,2m,2,Dysderidae,Parastalita,stygia,Parastalita stygia,685,45.261.001,15.023.822,Tb,deep cave,,1,,"7,4","6,968666553","6,968666553","26,46800041",1564,25,"378,8376232",,,2,1,1,376,362,26
463,Špilja pod Mačkovom dragom,Croatia,14.6.2009.,2009-06-14,"1m, 2f",3,Dysderidae,Parastalita,stygia,Parastalita stygia,685,45.261.001,15.023.822,Tb,deep cave,,1,,"7,4","6,968666553","6,968666553","26,46800041",1564,25,"378,8376232",,,2,1,1,376,362,26
464,Špilja pod Mačkovom dragom,Croatia,14.6.2009.,2009-06-14,1m,1,Dysderidae,Parastalita,stygia,Parastalita stygia,685,45.261.001,15.023.822,Tb,deep cave,,1,,"7,4","6,968666553","6,968666553","26,46800041",1564,25,"378,8376232",,,2,1,1,376,362,26
519,Kukova peć,Croatia,8.10.2009.,2009-10-08,2 juv,2,Agelenidae,Histopona,sp.,Histopona sp.,185,42.726.992,1.796.566,,deep cave,,5,17,"16,6","15,07569408","15,07569408","24,35416603",1115,26,"90,07229603",,,1,1.2,1,nan,81.5,22
520,Kukova peć,Croatia,8.10.2009.,2009-10-08,"1f, 1m",2,Linyphiidae,Agyneta,sp.,Agyneta sp.,185,42.726.992,1.796.566,,,,5,17,"16,6","15,07569408","15,07569408","24,35416603",1115,26,"90,07229603",,,1,1.2,1,nan,81.5,22
521,Kukova peć,Croatia,8.10.2009.,2009-10-08,"1m, 4 juv/f",5,Dysderidae,Stalagtia,hercegovinensis,Stalagtia hercegovinensis,185,42.726.992,1.796.566,Tb,deep cave,,5,17,"16,6","15,07569408","15,07569408","24,35416603",1115,26,"90,07229603",,,1,1.2,1,nan,81.5,22
522,Špilja za Gromačkom vlakom,Croatia,6.9.2006.,2006-09-06,"1juv m, 2 juv",3,Dysderidae,Stalagtia,hercegovinensis,Stalagtia hercegovinensis,630,42.743.509,18.027.359,Tb,deep cave,,15,,"13,378","14,54366684","14,54366684","24,62399864",1130,29,"87,19003096",,,2,3,1,2439,2204,220
523,Špilja za Gromačkom vlakom,Croatia,6.9.2006.,2006-09-06,1 juv,1,Agelenidae,Histopona,sp.,Histopona sp.,630,42.743.509,18.027.359,,deep cave,,15,,"13,378","14,54366684","14,54366684","24,62399864",1130,29,"87,19003096",,,2,3,1,2439,2204,220
524,Jama pod Sinji kuk,Croatia,10.10.2009.,2009-10-10,"3m, 1f, 1 juv",5,Leptonetidae,Gen. 1,sp. 1,Gen. 1 sp. 1,254,42.709.828,17.988.632,Tb,deep cave,,5,,"16,2","15,07569408","15,07569408","24,35416603",1115,26,"92,46523385",,,2,1.8,1,18,8,15
525,Jama pod Sinji kuk,Croatia,10.10.2009.,2009-10-10,1f,1,Dysderidae,Stalagtia,hercegovinensis,Stalagtia hercegovinensis,254,42.709.828,17.988.632,Tb,deep cave,,5,,"16,2","15,07569408","15,07569408","24,35416603",1115,26,"92,46523385",,,2,1.8,1,18,8,15
526,Špilja na vrh Krčevina,Croatia,9.10.2009.,2009-10-09,1 juv,1,Dysderidae,Stalagtia,hercegovinensis,Stalagtia hercegovinensis,263,42.717.692,18.006.249,Tb,deep cave,,2,"16,5","17,75","14,54366684","14,54366684","24,62399864",1130,28,"91,1717054",,,,,,,,
529,Špilja na vrh Krčevina,Croatia,9.10.2009.,2009-10-09,1 juv,1,Nesticidae,Kryptonesticus,eremita,Kryptonesticus eremita,263,42.717.692,18.006.249,,deep cave,,2,"16,5","17,75","14,54366684","14,54366684","24,62399864",1130,28,"91,1717054",,,,,,,,
530,Špilja na vrh Krčevina,Croatia,9.10.2009.,2009-10-09,"1f, 2juv",3,Dysderidae,Stalagtia,hercegovinensis,Stalagtia hercegovinensis,263,42.717.692,18.006.249,Tb,deep cave,,2,"16,5","17,75","14,54366684","14,54366684","24,62399864",1130,28,"91,1717054",,,,,,,,
533,Kukova peć,Croatia,7.10.2009.,2009-10-07,1 juv,1,Agelenidae,Histopona,sp.,Histopona sp.,185,42.726.992,1.796.566,,deep cave,,5,17,"16,6","15,07569408","15,07569408","24,35416603",1115,26,"90,07229603",,,1,1.2,1,nan,81.5,22
534,Kukova peć,Croatia,7.10.2009.,2009-10-07,"1f, 1juv m",2,Linyphiidae,Agyneta,sp.,Agyneta sp.,185,42.726.992,1.796.566,,,,5,17,"16,6","15,07569408","15,07569408","24,35416603",1115,26,"90,07229603",,,1,1.2,1,nan,81.5,22
564,Jama pod Velikim Knezgradom,Croatia,28.6.2009.,2009-06-28,1 juv,1,Dysderidae,Stalita,taenaria,Stalita taenaria,402,4.528.092,14.249.305,Tb,deep cave,,2,,"9,7","9,835666656","9,835666656","24,73600006",1474,25,"386,9528386",,,5,2.5,1,nan,7,36
565,Jama pod Križ,Croatia,27.6.2009.,2009-06-27,2f,2,Linyphiidae,Troglohyphantes,brignolii,Troglohyphantes brignolii,587,45.374.314,14.113.041,Tb,deep cave,,1,,"8,5","11,26066685","11,26066685","25,83600044",1337,25,"397,0763597",,,1,1.4,1,nan,30,9
568,Pećina kod planinarske kuće Pavlovac,Croatia,20.9.2008.,2008-09-20,2m,2,Linyphiidae,Troglohyphantes,brignolii,Troglohyphantes brignolii,985,45.371.352,14.191.845,Tb,deep cave,,1,,"4,1","7,255167007","7,255167007","24,9280014",1698,23,"398,8929094",,,nan,nan,1,nan,nan,nan
569,ZV-1,Croatia,24.4.2009.,2009-04-24,"4f, 2m",6,Linyphiidae,Troglohyphantes,brignolii,Troglohyphantes brignolii,903,45.352.478,14.253.225,Tb,deep cave,,2,,5,"9,69299984","9,69299984","25,36000061",1515,23,"397,9206615",100,,4,2,1,nan,10,46
570,ZV-1,Croatia,24.4.2009.,2009-04-24,1m,1,Linyphiidae,Tenuiphantes,cristatus,Tenuiphantes cristatus,903,45.352.478,14.253.225,SubTf?,,,2,,5,"9,69299984","9,69299984","25,36000061",1515,23,"397,9206615",100,,4,2,1,nan,10,46
572,Jama u Debelom bregu,Croatia,25.4.2009.,2009-04-25,"1f, 1m",2,Linyphiidae,Troglohyphantes,brignolii,Troglohyphantes brignolii,903,45.358.239,1.425.243,Tb,deep cave,,1,,"3,9","9,69299984","9,69299984","25,36000061",1515,23,"398,769652",,,4,4,1,nan,18,26
574,Jama pod Velikim Knezgradom,Croatia,28.6.2009.,2009-06-28,3f,3,Linyphiidae,Troglohyphantes,brignolii,Troglohyphantes brignolii,402,4.528.092,14.249.305,Tb,deep cave,,2,,"9,7","9,835666656","9,835666656","24,73600006",1474,25,"386,9528386",,,5,2.5,1,nan,7,36
578,Jama u Debelom bregu,Croatia,25.4.2009.,2009-04-25,"1f, 1juv m",2,Linyphiidae,Troglohyphantes,brignolii,Troglohyphantes brignolii,903,45.358.239,1.425.243,Tb,deep cave,,1,,"3,9","9,69299984","9,69299984","25,36000061",1515,23,"398,769652",,,4,4,1,nan,18,26
579,Jama na Mahencu 1,Croatia,22.4.2009.,2009-04-22,"1f, 1m, 7juv",9,Linyphiidae,Troglohyphantes,brignolii,Troglohyphantes brignolii,914,45.348.186,14.239.877,Tb,deep cave,,1,,4,"7,663000107","7,663000107","24,94799995",1661,23,"396,8448673","94,1",,0.5,1.5,1,nan,11,9
581,Jama na Mahencu 2,Croatia,22.4.2009.,2009-04-22,1f,1,Cheiracanthiidae,Gen.,sp.,Gen. sp.,914,45.348.335,1.423.389,SubTf?,,,4,,4,"7,663000107","7,663000107","24,94799995",1661,23,"396,6787282",,,3,2,1,nan,8,13
585,Pećina kod planinarske kuće Pavlovac,Croatia,20.6.2009.,2009-06-20,1f,1,Linyphiidae,Troglohyphantes,brignolii,Troglohyphantes brignolii,985,45.371.352,14.191.845,Tb,deep cave,,1,,"4,1","7,255167007","7,255167007","24,9280014",1698,23,"398,8929094",,,nan,nan,1,nan,nan,nan
586,Druška peć,Croatia,24.4.2009.,2009-04-24,"1m, 1juv m",2,Nesticidae,Kryptonesticus,eremita,Kryptonesticus eremita,453,45.249.486,14.231.421,Tf,deep cave,,2,,"12,5","11,48616695","11,48616695","24,60000038",1337,23,"381,6162264",,,nan,nan,1,nan,nan,nan
589,Jama na Mahencu 2,Croatia,22.4.2009.,2009-04-22,"2f, 1juv",3,Linyphiidae,Troglohyphantes,brignolii,Troglohyphantes brignolii,914,45.348.335,1.423.389,Tb,deep cave,,4,,4,"7,663000107","7,663000107","24,94799995",1661,23,"396,6787282",,,3,2,1,nan,8,13
593,ZV-1,Croatia,24.4.2009.,2009-04-24,"1m, 1f, 1juv",3,Linyphiidae,Troglohyphantes,brignolii,Troglohyphantes brignolii,903,45.352.478,14.253.225,Tb,deep cave,,2,,5,"9,69299984","9,69299984","25,36000061",1515,23,"397,9206615",100,,4,2,1,nan,10,46
594,Druška peć,Croatia,24.4.2009.,2009-04-24,1 juv,1,Pholcidae,Pholcus,sp.,Pholcus sp.,453,45.249.486,14.231.421,Tf,,,2,,"12,5","11,48616695","11,48616695","24,60000038",1337,23,"381,6162264",,,nan,nan,1,nan,nan,nan
595,Jama u Vetvi,Croatia,26.4.2009.,2009-04-26,1m,1,Dysderidae,Dysdera,adriatica,Dysdera adriatica,902,45.332.148,14.240.733,Tx,,,3,,"9,6","8,69833374","8,69833374","24,88399887",1569,23,"394,4373935",,,2,1,1,nan,5,47
598,Pećina pod Brložnikom,Croatia,13.9.2008.,2008-09-13,"1f, 1juv",2,Linyphiidae,Troglohyphantes,brignolii,Troglohyphantes brignolii,1033,45.336.603,14.227.302,Tb,deep cave,,1,,"8,3","7,663000107","7,663000107","24,94799995",1661,23,"394,6891806",,,15,4,1,nan,21,6
599,Proljetna jama,Croatia,28.6.2009.,2009-06-28,"1f, 1juv m",2,Linyphiidae,Troglohyphantes,liburnicus,Troglohyphantes liburnicus,548,45.284.901,1.424.706,Tb,deep cave,,1,,"9,5","9,835666656","9,835666656","24,73600006",1474,25,"387,4820026",100,,0.3,0.3,1,nan,8,25
600,Jama SD 2,Croatia,24.4.2009.,2009-04-24,1f,1,Linyphiidae,Troglohyphantes,brignolii,Troglohyphantes brignolii,867,45.356.722,14.228.408,Tb,deep cave,,1,,"5,6","7,663000107","7,663000107","24,94799995",1661,23,"397,7819737",100,,1.5,0.3,1,nan,2,21
601,Jama na Lipovice,Croatia,25.4.2009.,2009-04-25,1f,1,Linyphiidae,Troglohyphantes,excavatus,Troglohyphantes excavatus,965,45.368.907,14.245.975,Tf,deep cave,,4,,"2,9","7,663000107","7,663000107","24,94799995",1661,23,"400,1852823",,,2.5,2.5,1,nan,10,31
602,Jama na Lipovice,Croatia,25.4.2009.,2009-04-25,"1m, 2f, 1juv",4,Linyphiidae,Troglohyphantes,brignolii,Troglohyphantes brignolii,965,45.368.907,14.245.975,Tb,deep cave,,4,,"2,9","7,663000107","7,663000107","24,94799995",1661,23,"400,1852823",,,2.5,2.5,1,nan,10,31
603,Jama na Lipovice,Croatia,25.4.2009.,2009-04-25,1m,1,Linyphiidae,Tenuiphantes,cristatus,Tenuiphantes cristatus,965,45.368.907,14.245.975,SubTf?,,,4,,"2,9","7,663000107","7,663000107","24,94799995",1661,23,"400,1852823",,,2.5,2.5,1,nan,10,31
604,Jama pod Velikim Knezgradom,Croatia,28.6.2009.,2009-06-28,1f,1,Linyphiidae,Troglohyphantes,brignolii,Troglohyphantes brignolii,402,4.528.092,14.249.305,Tb,deep cave,,2,,"9,7","9,835666656","9,835666656","24,73600006",1474,25,"386,9528386",,,5,2.5,1,nan,7,36
607,Barinova jama,Croatia,11.9.2008.,2008-09-11,"1m, 1juv m",2,Linyphiidae,Troglohyphantes,brignolii,Troglohyphantes brignolii,706,45.354.889,14.126.033,Tb,deep cave,,1,,"5,9","9,280166626","9,280166626","25,73200035",1519,23,"394,4600784",,,12,5,1,nan,61,55
608,Rudnik u Medveji,Croatia,24.4.2009.,2009-04-24,"1f, 1juv",2,Nesticidae,Kryptonesticus,eremita,Kryptonesticus eremita,29,45.271.377,14.268.107,Tf,deep cave,,1,,"13,8","13,13749981","13,13749981","24,08461571",1288,2,"386,1307014",,,nan,nan,1,nan,nan,nan
609,Jama u Vetvi,Croatia,26.4.2009.,2009-04-26,1f,1,Linyphiidae,Troglohyphantes,liburnicus,Troglohyphantes liburnicus,902,45.332.148,14.240.733,Tb,deep cave,,3,,"9,6","8,69833374","8,69833374","24,88399887",1569,23,"394,4373935",,,2,1,1,nan,5,47
610,ZV-1,Croatia,24.4.2009.,2009-04-24,"1f, 1m",2,Linyphiidae,Troglohyphantes,brignolii,Troglohyphantes brignolii,903,45.352.478,14.253.225,Tb,deep cave,,2,,5,"9,69299984","9,69299984","25,36000061",1515,23,"397,9206615",100,,4,2,1,nan,10,46
613,Jama na Lipovice,Croatia,25.4.2009.,2009-04-25,1f,1,Linyphiidae,Troglohyphantes,brignolii,Troglohyphantes brignolii,965,45.368.907,14.245.975,Tb,deep cave,,4,,"2,9","7,663000107","7,663000107","24,94799995",1661,23,"400,1852823",,,2.5,2.5,1,nan,10,31
615,ZV-1,Croatia,24.4.2009.,2009-04-24,"6f, 1m",7,Linyphiidae,Troglohyphantes,brignolii,Troglohyphantes brignolii,903,45.352.478,14.253.225,Tb,deep cave,,2,,5,"9,69299984","9,69299984","25,36000061",1515,23,"397,9206615",100,,4,2,1,nan,10,46
616,Jama na Mahencu 2,Croatia,22.4.2009.,2009-04-22,"1m, 5f",6,Linyphiidae,Troglohyphantes,brignolii,Troglohyphantes brignolii,914,45.348.335,1.423.389,Tb,deep cave,,4,,4,"7,663000107","7,663000107","24,94799995",1661,23,"396,6787282",,,3,2,1,nan,8,13
617,Jama u Velim Sapcima 3,Croatia,26.4.2009.,2009-04-26,"1f, 2juv",3,Linyphiidae,Troglohyphantes,liburnicus,Troglohyphantes liburnicus,925,45.359.003,14.242.656,Tb,deep cave,,5,,"7,6","7,663000107","7,663000107","24,94799995",1661,23,"398,5757323","97,4",,1,0.8,1,nan,6,14
618,Jama u Velim Sapcima 3,Croatia,26.4.2009.,2009-04-26,"1f, 1m",2,Linyphiidae,Troglohyphantes,excavatus,Troglohyphantes excavatus,925,45.359.003,14.242.656,Tf,deep cave,,5,,"7,6","7,663000107","7,663000107","24,94799995",1661,23,"398,5757323","97,4",,1,0.8,1,nan,6,14
619,Jama u Velim Sapcima 3,Croatia,26.4.2009.,2009-04-26,1m,1,Tetragnathidae,Metellina,mengei,Metellina mengei,925,45.359.003,14.242.656,SubTf?,,,5,,"7,6","7,663000107","7,663000107","24,94799995",1661,23,"398,5757323","97,4",,1,0.8,1,nan,6,14
622,Jama na Lipovice,Croatia,25.4.2009.,2009-04-25,2f,2,Tetragnathidae,Metellina,merianae,Metellina merianae,965,45.368.907,14.245.975,tf,deep cave,,4,,"2,9","7,663000107","7,663000107","24,94799995",1661,23,"400,1852823",,,2.5,2.5,1,nan,10,31
623,Jama na Mahencu 2,Croatia,22.4.2009.,2009-04-22,1m,1,Tetragnathidae,Metellina,merianae,Metellina merianae,914,45.348.335,1.423.389,tf,deep cave,,4,,4,"7,663000107","7,663000107","24,94799995",1661,23,"396,6787282",,,3,2,1,nan,8,13
624,Jama na Mahencu 2,Croatia,22.4.2009.,2009-04-22,1f,1,Agelenidae,Tegenaria,silvestris,Tegenaria silvestris,914,45.348.335,1.423.389,Tf,deep cave,,4,,4,"7,663000107","7,663000107","24,94799995",1661,23,"396,6787282",,,3,2,1,nan,8,13
625,Jama u Velim Sapcima 3,Croatia,26.4.2009.,2009-04-26,1f,1,Agelenidae,Tegenaria,sp. 1,Tegenaria sp. 1,925,45.359.003,14.242.656,SubTf?,deep cave,,5,,"7,6","7,663000107","7,663000107","24,94799995",1661,23,"398,5757323","97,4",,1,0.8,1,nan,6,14
627,Jama u Vetvi,Croatia,26.4.2009.,2009-04-26,1m,1,cf. Tetragnathidae,Gen. 1,sp. 1,Gen. 1 sp. 1,902,45.332.148,14.240.733,Tx,,,3,,"9,6","8,69833374","8,69833374","24,88399887",1569,23,"394,4373935",,,2,1,1,nan,5,47
633,Tounjčica,Croatia,5.12.2009.,2009-12-05,2f,2,Linyphiidae,Porrhomma,convexum,Porrhomma convexum,306,45.248.722,15.322.408,Tf,deep cave,,5,,14,"10,14599991","10,14599991","28,85200119",1306,23,"353,7031634",,,nan,nan,1,nan,nan,nan
635,Urinjska špilja,Croatia,17.10.2009.,2009-10-17,1f,1,Nesticidae,Kryptonesticus,eremita,Kryptonesticus eremita,37,45.285.721,14.524.173,tf,deep cave,,5,,"10,3","13,89999962","13,89999962","25,40000153",1376,3,"397,7084991","98,15",,0.7,0.7,1,nan,115,24
636,Urinjska špilja,Croatia,17.10.2009.,2009-10-17,1 juv,1,Dysderidae,Stalita,taenaria,Stalita taenaria,37,45.285.721,14.524.173,Tb,deep cave,,5,,"10,3","13,89999962","13,89999962","25,40000153",1376,3,"397,7084991","98,15",,0.7,0.7,1,nan,115,24
637,Mali štumbur,Croatia,18.10.2009.,2009-10-18,1m,1,Dysderidae,Stalita,taenaria,Stalita taenaria,38,45.297.181,14.503.575,Tb,deep cave,,2,,"9,8","12,8671875","12,8671875","25,84583282",1435,23,"398,5783076","97,7",,2,2,1,29,22,10
639,Špilja kod kompresorske stanice,Croatia,17.10.2009.,2009-10-17,"1m, 2juv",3,Nesticidae,Kryptonesticus,eremita,Kryptonesticus eremita,65,45.315.027,14.483.783,tf,deep cave,,2,,"13,8","13,62371826","13,62371826","25,51538467",1452,2,"400,4466542","53,1",,,,,,,
640,Špilja kod kompresorske stanice,Croatia,17.10.2009.,2009-10-17,1 juv,1,Pholcidae,Pholcus,sp.,Pholcus sp.,65,45.315.027,14.483.783,,,,2,,"13,8","13,62371826","13,62371826","25,51538467",1452,2,"400,4466542","53,1",,,,,,,
641,Urinjska špilja,Croatia,15.10.2009.,2009-10-15,1 m,1,Nesticidae,Kryptonesticus,eremita,Kryptonesticus eremita,37,45.285.721,14.524.173,tf,deep cave,,5,,"10,3","13,89999962","13,89999962","25,40000153",1376,3,"397,7084991","98,15",,0.7,0.7,1,nan,115,24
642,Urinjska špilja,Croatia,17.10.2009.,2009-10-17,1f,1,Nesticidae,Kryptonesticus,eremita,Kryptonesticus eremita,37,45.285.721,14.524.173,tf,deep cave,,5,,"10,3","13,89999962","13,89999962","25,40000153",1376,3,"397,7084991","98,15",,0.7,0.7,1,nan,115,24
643,Rudnik iznad uvale Martinščica,Croatia,29.4.2009.,2009-04-29,"1m, 1f",2,Nesticidae,Kryptonesticus,eremita,Kryptonesticus eremita,98,4.531.777,14.487.393,tf,deep cave,,1,,"12,6","13,62371826","13,62371826","25,51538467",1452,29,"400,9937559",,,,,,,,
647,Rudnik iznad uvale Martinščica,Croatia,29.4.2009.,2009-04-29,"1f, 2juv m, 2juv",5,Nesticidae,Kryptonesticus,eremita,Kryptonesticus eremita,98,4.531.777,14.487.393,tf,deep cave,,1,,"12,6","13,62371826","13,62371826","25,51538467",1452,29,"400,9937559",,,,,,,,
649,Bunetova jama,Croatia,28.4.2009.,2009-04-28,"2f, 2juv",4,Nesticidae,Kryptonesticus,eremita,Kryptonesticus eremita,137,45.300.434,14.526.307,tf,deep cave,,1,,"9,3","12,8671875","12,8671875","25,84583282",1435,23,"399,9651999","99,75",,1,0.75,1,24,17,6
652,Mali štumbur,Croatia,18.10.2009.,2009-10-18,1f,1,Nesticidae,Kryptonesticus,eremita,Kryptonesticus eremita,38,45.297.181,14.503.575,tf,deep cave,,2,,"9,8","12,8671875","12,8671875","25,84583282",1435,23,"398,5783076","97,7",,2,2,1,29,22,10
653,Špilja iznad ceste,Croatia,17.10.2009.,2009-10-17,1f,1,Nesticidae,Kryptonesticus,eremita,Kryptonesticus eremita,,4.531.381,14.483.246,tf,deep cave,,3,,"17,9","13,62371826","13,62371826","25,51538467",1452,2,"400,2452462","91,6",,,,,,,
655,Špilja iznad ceste,Croatia,17.10.2009.,2009-10-17,2f,2,Nesticidae,Kryptonesticus,eremita,Kryptonesticus eremita,,4.531.381,14.483.246,tf,deep cave,,3,,"17,9","13,62371826","13,62371826","25,51538467",1452,2,"400,2452462","91,6",,,,,,,
660,Špilja kod kompresorske stanice,Croatia,17.10.2009.,2009-10-17,1 juv,1,Pholcidae,Pholcus,sp.,Pholcus sp.,65,45.315.027,14.483.783,,,,2,,"13,8","13,62371826","13,62371826","25,51538467",1452,2,"400,4466542","53,1",,,,,,,
661,Špilja iznad ceste,Croatia,17.10.2009.,2009-10-17,1 juv,1,Pholcidae,Pholcus,sp.,Pholcus sp.,,4.531.381,14.483.246,,,,3,,"17,9","13,62371826","13,62371826","25,51538467",1452,2,"400,2452462","91,6",,,,,,,
663,Špilja u uvali Predpeć,Croatia,27.4.2009.,2009-04-27,1f,1,Dysderidae,Rhode,aspinifera,Rhode aspinifera,,45.291.576,14.510.419,Tb,deep cave,,4,"10,3","10,625","13,89999962","13,89999962","25,40000153",1376,44,"398,0215329",,,4,3,1,25,21,4
664,Urinjska špilja,Croatia,29.4.2009.,2009-04-29,1f,1,Linyphiidae,Centromerus,sellarius,Centromerus sellarius,37,45.285.721,14.524.173,tf,deep cave,,5,,"10,3","13,89999962","13,89999962","25,40000153",1376,3,"397,7084991","98,15",,0.7,0.7,1,nan,115,24
665,Urinjska špilja,Croatia,17.10.2009.,2009-10-17,"2f, 2juv",4,Linyphiidae,Centromerus,sellarius,Centromerus sellarius,37,45.285.721,14.524.173,tf,deep cave,,5,,"10,3","13,89999962","13,89999962","25,40000153",1376,3,"397,7084991","98,15",,0.7,0.7,1,nan,115,24
666,Špilja iznad ceste,Croatia,17.10.2009.,2009-10-17,1f,1,Theridiidae,Episinus,cavernicola,Episinus cavernicola,,4.531.381,14.483.246,Tf,deep cave,,3,,"17,9","13,62371826","13,62371826","25,51538467",1452,2,"400,2452462","91,6",,,,,,,
671,Urinjska špilja,Croatia,29.4.2009.,2009-04-29,1 juv,1,Dysderidae,Rhode,aspinifera,Rhode aspinifera,37,45.285.721,14.524.173,Tb,deep cave,,5,,"10,3","13,89999962","13,89999962","25,40000153",1376,3,"397,7084991","98,15",,0.7,0.7,1,nan,115,24
672,Urinjska špilja,Croatia,29.4.2009.,2009-04-29,1m,1,Dictynidae,Nigma,flavescens,Nigma flavescens,37,45.285.721,14.524.173,Tx,,,5,,"10,3","13,89999962","13,89999962","25,40000153",1376,3,"397,7084991","98,15",,0.7,0.7,1,nan,115,24
674,Biserujka,Croatia,26.5.2009.,2009-05-26,1 f,1,Nesticidae,Kryptonesticus,eremita,Kryptonesticus eremita,27,45.187.464,1.460.981,tf,deep cave,,1,,"14,8","14,12559509","14,12559509","25,39523888",1232,32,"386,9540194",,,nan,nan,1,nan,nan,nan
689,Jama iznad Vrulja,Croatia,26.9.2009.,2009-09-26,1 juv,1,Agelenidae,Tegenaria,sp.,Tegenaria sp.,25,4.381.234,15.301.095,,deep cave,,5,"16,4","16,642","14,70833302","14,70833302","24,91250038",753,32,"248,4265548",91,"89,6",nan,nan,1,nan,nan,nan
692,Vjetruša,Croatia,28.9.2009.,2009-09-28,1 juv,1,Agelenidae,Tegenaria,sp.,Tegenaria sp.,,4.377.419,15.349.733,,deep cave,,1,,"15,5","14,99659061","14,99659061","23,85454559",727,26,"242,3432246",87,,5,4,1,61,36,34
697,Manita peć,Croatia,12.8.1998.,1998-08-12,"1m, 2 juv",3,Dysderidae,Parastalita,stygia,Parastalita stygia,374,44.314.302,15.475.264,Tb,deep cave,,7,"8,8","9,525","10,42683315","10,42683315","27,29200172",1068,28,"252,2759525",,,nan,nan,1,nan,nan,nan
698,Manita peć,Croatia,12.8.1998.,1998-08-12,"1f, 1 juv",2,Dysderidae,Stalita,pretneri,Stalita pretneri,374,44.314.302,15.475.264,Tb,deep cave,,7,"8,8","9,525","10,42683315","10,42683315","27,29200172",1068,28,"252,2759525",,,nan,nan,1,nan,nan,nan
699,Manita peć,Croatia,13.6.1999.,1999-06-13,"1m, 1 juv",2,Dysderidae,Parastalita,stygia,Parastalita stygia,374,44.314.302,15.475.264,Tb,deep cave,,7,"8,8","9,525","10,42683315","10,42683315","27,29200172",1068,28,"252,2759525",,,nan,nan,1,nan,nan,nan
700,Manita peć,Croatia,13.6.1999.,1999-06-13,1 juv,1,Dysderidae,Stalita,pretneri,Stalita pretneri,374,44.314.302,15.475.264,Tb,deep cave,,7,"8,8","9,525","10,42683315","10,42683315","27,29200172",1068,28,"252,2759525",,,nan,nan,1,nan,nan,nan
701,Jama u Velim Sapcima 3,Croatia,26.4.2009.,2009-04-26,1m,1,Agelenidae,Histopona,torpida,Histopona torpida,925,45.359.003,14.242.656,Tx,deep cave,,5,,"7,6","7,663000107","7,663000107","24,94799995",1661,23,"398,5757323","97,4",,1,0.8,1,nan,6,14
702,Tučepska vilenjača,Croatia,31.5.2007.,2007-05-31,1m,1,Dysderidae,Stalagtia,sp. 4,Stalagtia sp. 4,1242,43.286.465,17.083.638,Tb,deep cave,,8,"10,6","10,731","9,67800045","9,67800045","24,96000099",926,26,"67,32747088",,,6,0.8,1,nan,28,35
703,Vranjača špilja kod Dugopolja,Croatia,1.8.2007.,2007-08-01,1m,1,Dysderidae,Rhode,sp. 1,Rhode sp. 1,445,43.562.235,16.648.216,Tb,deep cave,,5,,"8,7","12,21549988","12,21549988","26,12800026",886,21,"96,51736486",,,,,,,,
704,Tučepska vilenjača,Croatia,9.4.1990.,1990-04-09,1m,1,Dysderidae,Harpactea,mateparlovi,Harpactea mateparlovi,1242,43.286.465,17.083.638,Tf,deep cave,,8,"10,6","10,731","9,67800045","9,67800045","24,96000099",926,26,"67,32747088",,,6,0.8,1,nan,28,35
705,Kuna špilja,Croatia,27.8.1998.,1998-08-27,1m,1,Dysderidae,Harpactea,mateparlovi,Harpactea mateparlovi,1396,43.324.523,17.055.953,Tf,deep cave,,2,,"4,5","7,993500233","7,993500233","24,5",945,23,"65,81333493","98,6",,1.7,0.9,1,44,28,3
715,Stara jametina,Croatia,7.5.2010.,2010-05-07,"1m, 1 juv",2,Theridiidae,Episinus,cavernicola,Episinus cavernicola,161,43.794.009,1.600.259,Tf,deep cave,,6,"13,4","13,2","14,21000004","14,21000004","27,66799927",790,20,"170,7986956","90,95","91,7",12,8,1,nan,188,85
716,Stara jametina,Croatia,7.5.2010.,2010-05-07,1f,1,Dysderidae,Stalagtia,sp. 4,Stalagtia sp. 4,161,43.794.009,1.600.259,Tb,deep cave,,6,"13,4","13,2","14,21000004","14,21000004","27,66799927",790,20,"170,7986956","90,95","91,7",12,8,1,nan,188,85
717,Jazinka,Croatia,6.5.2010.,2010-05-06,1m,1,Dysderidae,Stalagtia,sp. 4,Stalagtia sp. 4,162,43.975.892,16.029.694,Tb,deep cave,,2,,13,"13,5286665","13,5286665","28,34799957",864,23,"174,9933462",,,2,1,1,42,42,4
720,Stara jametina,Croatia,7.5.2010.,2010-05-07,1m,1,Dysderidae,Stalagtia,sp. 4,Stalagtia sp. 4,161,43.794.009,1.600.259,Tb,deep cave,,6,"13,4","13,2","14,21000004","14,21000004","27,66799927",790,20,"170,7986956","90,95","91,7",12,8,1,nan,188,85
721,Stara jametina,Croatia,7.5.2010.,2010-05-07,1f,1,Linyphiidae,Micrargus,herbigradus,Micrargus herbigradus,161,43.794.009,1.600.259,Tf,deep cave,,6,"13,4","13,2","14,21000004","14,21000004","27,66799927",790,20,"170,7986956","90,95","91,7",12,8,1,nan,188,85
722,Stara jametina,Croatia,7.5.2010.,2010-05-07,3 juv,3,Dysderidae,Stalagtia,sp. 4,Stalagtia sp. 4,161,43.794.009,1.600.259,Tb,deep cave,,6,"13,4","13,2","14,21000004","14,21000004","27,66799927",790,20,"170,7986956","90,95","91,7",12,8,1,nan,188,85
723,Jazinka,Croatia,6.5.2010.,2010-05-06,1 juv,1,Dysderidae,Stalagtia,sp. 4,Stalagtia sp. 4,162,43.975.892,16.029.694,Tb,deep cave,,2,,13,"13,5286665","13,5286665","28,34799957",864,23,"174,9933462",,,2,1,1,42,42,4
724,Stara jametina,Croatia,7.5.2010.,2010-05-07,1 juv,1,Dysderidae,Stalagtia,sp. 4,Stalagtia sp. 4,161,43.794.009,1.600.259,Tb,deep cave,,6,"13,4","13,2","14,21000004","14,21000004","27,66799927",790,20,"170,7986956","90,95","91,7",12,8,1,nan,188,85
725,Stara jametina,Croatia,7.5.2010.,2010-05-07,1 juv,1,Dysderidae,Stalagtia,sp. 4,Stalagtia sp. 4,161,43.794.009,1.600.259,Tb,deep cave,,6,"13,4","13,2","14,21000004","14,21000004","27,66799927",790,20,"170,7986956","90,95","91,7",12,8,1,nan,188,85
726,Jazinka,Croatia,6.5.2010.,2010-05-06,1 juv,1,Dysderidae,Stalagtia,sp. 4,Stalagtia sp. 4,162,43.975.892,16.029.694,Tb,deep cave,,2,,13,"13,5286665","13,5286665","28,34799957",864,23,"174,9933462",,,2,1,1,42,42,4
729,Sedrena špilja kod stola,Croatia,3.5.2010.,2010-05-03,1 juv,1,Agelenidae,Histopona,sp.,Histopona sp.,247,4.401.385,16.068.978,,deep cave,,2,"6,1","6,1","13,18266678","13,18266678","28,31999969",900,29,"172,9455136","85,7","85,7",1,1,1,nan,21,2
731,Miljacka 2,Croatia,6.1.2005.,2005-01-06,2 juv,2,Agelenidae,Tegenaria,sp.,Tegenaria sp.,224,440.002,16.016.234,,deep cave,,4,,"12,6","13,29333305","13,29333305","28,4279995",894,32,"177,675492",,,,,,,,
735,Trišića jama,Croatia,8.1.2005.,2005-01-08,"3f, 4 juv",7,Linyphiidae,Palliduphantes,istrianus,Palliduphantes istrianus,224,43.949.231,15.947.793,Tf,deep cave,,2,,"10,38","13,53916645","13,53916645","27,88800049",838,33,"182,369015",,,11,2.5,1,119,55,65
736,Trišića jama,Croatia,8.1.2005.,2005-01-08,2f,2,Linyphiidae,Palliduphantes,istrianus,Palliduphantes istrianus,224,43.949.231,15.947.793,Tf,deep cave,,2,,"10,38","13,53916645","13,53916645","27,88800049",838,33,"182,369015",,,11,2.5,1,119,55,65
737,Trišića jama,Croatia,8.1.2005.,2005-01-08,"1m, 1 juv",2,Linyphiidae,Micrargus,herbigradus,Micrargus herbigradus,224,43.949.231,15.947.793,Tf,deep cave,,2,,"10,38","13,53916645","13,53916645","27,88800049",838,33,"182,369015",,,11,2.5,1,119,55,65
739,Jama u šumi uvale Bjejajka,Croatia,18.6.2010.,2010-06-18,1f,1,Linyphiidae,Gen. 4,sp.,Gen. 4 sp.,,42.765.231,17.385.606,,,,6,,"14,133","16,31185913","16,31185913","23,7307682",855,24,"108,3846938","97,2",,3,2.2,1,nan,42,21
740,Jama u šumi uvale Bjejajka,Croatia,18.6.2010.,2010-06-18,"1 f, 1 juv m",2,Linyphiidae,Palliduphantes,sp. 1,Palliduphantes sp. 1,,42.765.231,17.385.606,tf,deep cave,,6,,"14,133","16,31185913","16,31185913","23,7307682",855,24,"108,3846938","97,2",,3,2.2,1,nan,42,21
746,Mravinjuša jama,Croatia,21.3.2004.,2004-03-21,"2 f, 2juv",4,Linyphiidae,Typhlonyphia,sp. 1,Typhlonyphia sp. 1,742,43.346.139,17.099.776,Tb,deep cave,,1,"8,1","8,1","11,25733376","11,25733376","26,1079998",928,23,"59,93693006",,,,,,,,
752,Vranjača špilja kod Dugopolja,Croatia,20.7.2004.,2004-07-20,"1f,1juv",2,Linyphiidae,Troglohyphantes,strandi,Troglohyphantes strandi,445,43.562.235,16.648.216,tb,deep cave,,5,,"8,7","12,21549988","12,21549988","26,12800026",886,21,"96,51736486",,,,,,,,
761,Mravinjuša jama,Croatia,21.3.2004.,2004-03-21,"2 f, 1 juv",3,Linyphiidae,Typhlonyphia,sp. 1,Typhlonyphia sp. 1,742,43.346.139,17.099.776,Tb,deep cave,,1,"8,1","8,1","11,25733376","11,25733376","26,1079998",928,23,"59,93693006",,,,,,,,
763,Bošak jama,Croatia,21.3.2004.,2004-03-21,2 f,2,Linyphiidae,Typhlonyphia,sp. 1,Typhlonyphia sp. 1,721,43.347.996,17.100.045,Tb,deep cave,,2,,"7,4","11,25733376","11,25733376","26,1079998",928,23,"59,73571895",100,,1.1,1.7,1,nan,11,17
785,Jama u Vrloj strani,Croatia,7.6.2003.,2003-06-07,1f,1,Linyphiidae,Troglohyphantes,wiehlei,Troglohyphantes wiehlei,732,4.572.603,1.527.504,tf,deep cave,,1,,"7,9","7,769499779","7,769499779","28,47200012",1329,29,"414,3973351","98,9",,1.6,1,1,nan,12,35
790,Jamina,Croatia,2.11.2002.,2002-11-02,1 f,1,Linyphiidae,Troglohyphantes,excavatus,Troglohyphantes excavatus,483,45.699.157,15.424.684,tf,deep cave,,3,"10,8","10,1","9,762499809","9,762499809","29,01600075",1149,23,"400,8582115",100,100,4.5,7,1,65,15,59
794,Špilja u zubu Buljme,Croatia,13.9.2006.,2006-09-13,1 f,1,Linyphiidae,Troglohyphantes,sp. 14,Troglohyphantes sp. 14,1445,44.366.906,15.470.541,tb,deep cave,,1,,"5,4","7,383500099","7,383500099","25,82799911",1297,23,"256,4267796",,,5,5,1,nan,250,0
799,Bezdanka,Croatia,13.4.1984.,1984-04-13,3 f,3,Linyphiidae,Troglohyphantes,roberti,Troglohyphantes roberti,586,44.227.473,15.852.219,tb,deep cave,,2,,"14,367","9,772166252","9,772166252","27,11600113",1105,28,"208,7260183","94,633",,nan,nan,1,nan,nan,nan
808,Kukuruzovićeva špilja,Croatia,18.6.2005.,2005-06-18,"1 m, 2 juv",3,Nesticidae,Nesticus,cellulanus,Nesticus cellulanus,329,44.914.821,15.702.486,tf,deep cave,,3,,"10,8","9,661832809","9,661832809","28,4640007",1309,18,"286,5022004",,,5,2.5,1,nan,486,45
815,Gvozdenica,Croatia,9.12.1997.,1997-12-09,1 f,1,Nesticidae,Nesticus,cellulanus,Nesticus cellulanus,213,45.299.765,15.589.405,tf,deep cave,,4,,"8,7","10,85416698","10,85416698","29,48399925",1123,24,"339,8560445",,,24,14,1,nan,250,85
821,Đurovića jama,Croatia,31.10.2003.,2003-10-31,1 f,1,Nesticidae,Kryptonesticus,eremita,Kryptonesticus eremita,156,42.559.979,18.263.559,tf,deep cave,,4,,"17,267","15,93194485","15,93194485","24,30000114",1247,6,"111,7390404",,,1,2,1,156,132,17
823,Jezero,Croatia,28.5.2004.,2004-05-28,1f,1,Nesticidae,Kryptonesticus,arenstorffi,Kryptonesticus arenstorffi,964,42.580.381,18.356.073,tb,deep cave,,8,,"7,567","12,93216705","12,93216705","24,86800003",1208,29,"104,2091301","96,5",,1,0.5,1,20.5,nan,12
824,Jezero,Croatia,28.5.2004.,2004-05-28,"1f, 2 juv",3,Nesticidae,Kryptonesticus,arenstorffi,Kryptonesticus arenstorffi,964,42.580.381,18.356.073,tb,deep cave,,8,,"7,567","12,93216705","12,93216705","24,86800003",1208,29,"104,2091301","96,5",,1,0.5,1,20.5,nan,12
890,Špilja pod Kaštel,Croatia,14.6.2001.,2001-06-14,"1 juv f,1 juv m,4 juv",6,Nesticidae,Kryptonesticus,eremita,Kryptonesticus eremita,44,42.768.041,16.899.005,tf,deep cave,,2,"15,3","16,95","16,4216671","16,4216671","22,7733345",668,29,"142,9000056","97,25",,nan,nan,1,nan,nan,nan
946,Špilja u Solinama,Croatia,18.6.2001.,2001-06-18,1 f,1,Agelenidae,Histopona,bidens,Histopona bidens,83,42.768.021,17.377.062,tb,deep cave,,5,,"8,95","16,31185913","16,31185913","23,7307682",855,24,"108,5917672","83,7",,22,6,1,nan,47,18
960,Jama pod Sv. Spasom,Croatia,17.6.2001.,2001-06-17,"1f, 1m,5 juv",7,Agelenidae,Histopona,bidens,Histopona bidens,50,42.731.779,17.542.409,tb,deep cave,,6,,"14,6","15,79444408","15,79444408","24,11999893",925,17,"103,7805159",,,6,7,1,nan,42,78
962,Kukor,Croatia,27.7.2004.,2004-07-27,1 juv,1,Agelenidae,Histopona,sp.,Histopona sp.,587,43.355.609,16.991.707,,deep cave,,10,,"15,4","12,63749981","12,63749981","25,40833473",906,29,"68,94753675",,,1,1,1,264,213,40
964,Špilja pod Kapelu,Croatia,13.4.2003.,2003-04-13,"1 juv m, 1 juv",2,Agelenidae,Hadites,tegenarioides,Hadites tegenarioides,102,43.184.949,16.434.233,TB,deep cave,,5,,"12,717","16,20546913","16,20546913","23,36250114",714,21,"135,8656791","97,5",,nan,nan,1,nan,nan,nan
965,Vlastelinka jama,Croatia,26.3.2003.,2003-03-26,2 juv,2,Agelenidae,Histopona,sp.,Histopona sp.,390,43.269.635,17.211.206,,deep cave,,2,,"11,4","11,41149998","11,41149998","26,41199875",935,29,"59,88488508",90,,,,,,,
968,Modrić špilja,Croatia,20.9.2003.,2003-09-20,1 juv m,1,Agelenidae,Histopona,sp.,Histopona sp.,17,4.425.684,15.537.248,,deep cave,,1,,"16,3","12,14111137","12,14111137","27,68000031",993,18,"242,2164451",,,,,,,,
972,Ješkalovica,Croatia,4.1.2009.,2009-01-04,"1 f,1 juv",2,Nesticidae,Kryptonesticus,eremita,Kryptonesticus eremita,194,43.299.857,16.839.313,tf,deep cave,,2,,"15,4","15,64131927","15,64131927","25,73750114",817,20,"87,88201212","95,1",,1,1,1,nan,21,29
974,Spilja od Tankega rota,Croatia,9.1.2000.,2000-01-09,4 f,4,Nesticidae,Kryptonesticus,eremita,Kryptonesticus eremita,114,43.012.832,16.111.537,tf,deep cave,,1,,17,"15,42175961","15,42175961","22,66110992",580,28,"179,9480494",80,,1,2,1,164,148,19
976,Špilja na Vršinoj glavici,Croatia,30.7.2007.,2007-07-30,"1f, 1juv",2,Nesticidae,Kryptonesticus,eremita,Kryptonesticus eremita,647,4.370.718,167.843,tf,deep cave,,2,,"8,1","12,10249996","12,10249996","28,01199913",941,26,"82,80050632",,,2.6,5,1,nan,20,8.4
978,Živa voda,Croatia,9.-10.4.2004.,2004-04-09/2004-04-10,4 juv,4,Nesticidae,Kryptonesticus,eremita,Kryptonesticus eremita,115,43.116.808,17.050.393,tf,deep cave,,1,,"13,5","15,95083332","15,95083332","25,5",819,29,"89,2958768",85,,,,,,,
981,Kraljicina špilja,Croatia,3.4.1995.,1995-04-03,"1f, 1 juv",2,Nesticidae,Kryptonesticus,eremita,Kryptonesticus eremita,189,43.073.661,16.100.773,tf,deep cave,,2,,"15,1","15,32770824","15,32770824","22,59999847",585,44,"176,649054",91,,4,2,1,nan,126,6
985,Živa voda,Croatia,9.8.1997.,1997-08-09,1f,1,Nesticidae,Kryptonesticus,eremita,Kryptonesticus eremita,115,43.116.808,17.050.393,tf,deep cave,,1,,"13,5","15,95083332","15,95083332","25,5",819,29,"89,2958768",85,,,,,,,
986,Živa voda,Croatia,27.-28.9.2000.,2000-09-27/2000-09-28,4 juv,4,Nesticidae,Kryptonesticus,eremita,Kryptonesticus eremita,115,43.116.808,17.050.393,tf,deep cave,,1,,"13,5","15,95083332","15,95083332","25,5",819,29,"89,2958768",85,,,,,,,
988,Živa voda,Croatia,9.-10.4.2004.,2004-04-09/2004-04-10,"1juv m, 1 juv",2,Nesticidae,Kryptonesticus,eremita,Kryptonesticus eremita,115,43.116.808,17.050.393,tf,deep cave,,1,,"13,5","15,95083332","15,95083332","25,5",819,29,"89,2958768",85,,,,,,,
990,Kraljicina špilja,Croatia,10.1.2000.,2000-01-10,"5 f,1 juv m,6 juv",12,Nesticidae,Kryptonesticus,eremita,Kryptonesticus eremita,189,43.073.661,16.100.773,tf,deep cave,,2,,"15,1","15,32770824","15,32770824","22,59999847",585,44,"176,649054",91,,4,2,1,nan,126,6
1001,Škrabuljica,Croatia,11.3.2003.,2003-03-11,1 juv,1,Dysderidae,Stalagtia,sp. 2,Stalagtia sp. 2,701,42.567.045,18.385.063,Tb,deep cave,,5,,"10,867","12,1378336","12,1378336","24,90799904",1201,29,"102,7796012","97,4",,6,8,1,nan,98,11
1003,Špilja kod mlina Miljacki (Miljacka 4),Croatia,6.1.2005.,2005-01-06,2 juv,2,Agelenidae,Tegenaria,sp.,Tegenaria sp.,185,44.003.485,16.019.087,,deep cave,,2,,16,"13,29333305","13,29333305","28,4279995",894,32,"177,5545614",,,,,,,,
1005,Miljacka 2,Croatia,6.1.2005.,2005-01-06,1f,1,Agelenidae,Gen.,sp.,Gen. sp.,224,440.002,16.016.234,,deep cave,,4,,"12,6","13,29333305","13,29333305","28,4279995",894,32,"177,675492",,,,,,,,
1009,Miljacka 2,Croatia,6.1.2005.,2005-01-06,"2f, 1m",3,Nesticidae,Kryptonesticus,eremita,Kryptonesticus eremita,224,440.002,16.016.234,tf,deep cave,,4,,"12,6","13,29333305","13,29333305","28,4279995",894,32,"177,675492",,,,,,,,
1011,Špilja kod Vilišnice,Croatia,4.5.2005.,2005-05-04,1f,1,Nesticidae,Kryptonesticus,eremita,Kryptonesticus eremita,48,43.960.355,15.450.916,tf,deep cave,,2,,"12,9","14,33033371","14,33033371","28,02400017",813,20,"236,193425",,,3.5,1.5,1,nan,37,20.3
1014,Milića špilja,Croatia,30.7.2006.,2006-07-30,1 f,1,Nesticidae,Kryptonesticus,eremita,Kryptonesticus eremita,224,44.143.333,15.803.133,tf,deep cave,,1,,"12,6","12,67350006","12,67350006","28,27199936",949,29,"207,9910669",,,nan,nan,1,nan,nan,nan
1018,Špilja kod Vilišnice,Croatia,4.5.2005.,2005-05-04,"1 m,2 juv",3,Nesticidae,Kryptonesticus,eremita,Kryptonesticus eremita,48,43.960.355,15.450.916,tf,deep cave,,2,,"12,9","14,33033371","14,33033371","28,02400017",813,20,"236,193425",,,3.5,1.5,1,nan,37,20.3
1023,Stražbenica,Croatia,29.3.2005.,2005-03-29,"1 f,1 juv m,3 juv",5,Nesticidae,Kryptonesticus,eremita,Kryptonesticus eremita,172,43.697.353,16.029.618,tf,deep cave,,3,,"14,7","14,88466644","14,88466644","26,93600082",739,26,"165,8524113",100,,7,2.5,1,86,86,7
1026,Stražbenica,Croatia,31.1.2001.,2001-01-31,"1 f,1 juv m",2,Nesticidae,Kryptonesticus,eremita,Kryptonesticus eremita,172,43.697.353,16.029.618,tf,deep cave,,3,,"14,7","14,88466644","14,88466644","26,93600082",739,26,"165,8524113",100,,7,2.5,1,86,86,7
1027,Velika Kusača,Croatia,29.7.2003.,2003-07-29,1 juv,1,Nesticidae,Kryptonesticus,eremita,Kryptonesticus eremita,199,44.139.892,15.842.169,tf,deep cave,,1,,"13,3","13,36083317","13,36083317","28,63999939",926,23,"203,8021044",,,1,2,1,65.3,63,1
1030,Milića špilja,Croatia,30.7.2006.,2006-07-30,"1 f, 3 juv",4,Nesticidae,Kryptonesticus,eremita,Kryptonesticus eremita,224,44.143.333,15.803.133,tf,deep cave,,1,,"12,6","12,67350006","12,67350006","28,27199936",949,29,"207,9910669",,,nan,nan,1,nan,nan,nan
1031,Mala Kusača,Croatia,29.7.2006.,2006-07-29,"1 f,1 m,1juv",3,Nesticidae,Kryptonesticus,eremita,Kryptonesticus eremita,199,44.139.831,15.842.079,tf,deep cave,,2,,"13,3","13,36083317","13,36083317","28,63999939",926,23,"203,8073898",,,2,1.6,1,288,280,11
1032,Maksimova špilja,Croatia,22.4.2006.,2006-04-22,1 juv,1,Nesticidae,Nesticus,cellulanus,Nesticus cellulanus,520,45.518.313,1.768.695,tf,deep cave,,3,"10,8","10,45","9,106999397","9,106999397","27,62399864",882,23,"289,1307512",,,1,5,1,nan,18.2,0
1035,Sokolina špilja,Croatia,19.7.2004.,2004-07-19,1 m,1,Nesticidae,Nesticus,cellulanus,Nesticus cellulanus,499,45.461.454,17.566.155,Tf,deep cave,,1,,"10,8","9,419500351","9,419500351","28,50400162",901,23,"280,2812656",100,,2.5,1.5,1,nan,19,4
1050,Biserujka,Croatia,19.10.2000.,2000-10-19,1f,1,Nesticidae,Kryptonesticus,eremita,Kryptonesticus eremita,27,45.187.464,1.460.981,tf,deep cave,,1,,"14,8","14,12559509","14,12559509","25,39523888",1232,32,"386,9540194",,,nan,nan,1,nan,nan,nan
1052,Medova buža,Croatia,29.5.2001.,2001-05-29,1 f,1,Nesticidae,Kryptonesticus,eremita,Kryptonesticus eremita,51,44.813.345,14.745.867,,deep cave,,1,,"14,9","14,50555611","14,50555611","24,99523926",1052,44,"340,9428521","74,5",,,,,,,
1055,Sedrena špilja iza mlina,Croatia,3.5.2010.,2010-05-03,1m,1,Leptonetidae,Barusia,maheni,Barusia maheni,247,44.013.402,16.067.798,tf,deep cave,,6,,"7,9","13,18266678","13,18266678","28,31999969",900,29,"173,0421739",,,6,3,1,124,124,4
1063,Jama u Krogu,Croatia,15.9.2007.,2007-09-15,1f,1,Agelenidae,Tegenaria,sp. 1,Tegenaria sp. 1,1002,45.378.389,1.416.897,SubTf?,deep cave,,2,"2,5","2,45","7,287499905","7,287499905","25,13999939",1707,23,"399,2909922",,,20,15,1,nan,130,93
1071,Jama u Krogu,Croatia,15.9.1997.,1997-09-15,1f,1,Agelenidae,Tegenaria,sp. 1,Tegenaria sp. 1,1002,45.378.389,1.416.897,SubTf?,deep cave,,2,"2,5","2,45","7,287499905","7,287499905","25,13999939",1707,23,"399,2909922",,,20,15,1,nan,130,93
1117,Špilja u zubu Buljme,Croatia,13.9.2006.,2006-09-13,1 f,1,Linyphiidae,Troglohyphantes,sp. 14,Troglohyphantes sp. 14,1445,44.366.906,15.470.541,tb,deep cave,,1,,"5,4","7,383500099","7,383500099","25,82799911",1297,23,"256,4267796",,,5,5,1,nan,250,0
1119,Bošak jama,Croatia,21.3.2004.,2004-03-21,"1 f,5 juv",6,Linyphiidae,Typhlonyphia,sp. 1,Typhlonyphia sp. 1,721,43.347.996,17.100.045,Tb,deep cave,,2,,"7,4","11,25733376","11,25733376","26,1079998",928,23,"59,73571895",100,,1.1,1.7,1,nan,11,17
1122,Jama pod Osojem,Croatia,28.10.2008.,2008-10-28,"1f, 1m",2,Linyphiidae,Typhlonyphia,sp. 1,Typhlonyphia sp. 1,867,43.251.441,17.118.374,Tb,deep cave,,3,7,7,"9,67800045","9,67800045","24,96000099",926,23,"68,56980378","97,1","97,1",nan,nan,1,nan,nan,nan
1141,Tounjčica,Croatia,18.6.2006.,2006-06-18,2 f,2,Linyphiidae,Troglohyphantes,croaticus,Troglohyphantes croaticus,306,45.248.722,15.322.408,Tb,deep cave,,5,,14,"10,14599991","10,14599991","28,85200119",1306,23,"353,7031634",,,nan,nan,1,nan,nan,nan
1142,Golubinka više Mršića strane,Croatia,5.8.2006.,2006-08-05,2 f,2,Linyphiidae,Troglohyphantes,roberti,Troglohyphantes roberti,473,4.412.501,15.807.683,tb,deep cave,,3,"7,1","7,45","12,67350006","12,67350006","28,27199936",949,23,"206,3976041",,,,,,,,
1143,Tounjčica,Croatia,19.8.1999.,1999-08-19,3 f,3,Linyphiidae,Troglohyphantes,croaticus,Troglohyphantes croaticus,306,45.248.722,15.322.408,Tb,deep cave,,5,,14,"10,14599991","10,14599991","28,85200119",1306,23,"353,7031634",,,nan,nan,1,nan,nan,nan
1147,Đutno,Croatia,27.1.2001.,2001-01-27,"1 f,1 juv",2,Linyphiidae,Troglohyphantes,croaticus,Troglohyphantes croaticus,218,45.415.607,15.233.039,tb,deep cave,,4,,"7,75","10,4248333","10,4248333","28,8239994",1290,23,"379,8005434",,,7.5,5,1,nan,328,34
1150,Movrica,Croatia,17.6.2001.,2001-06-17,"3 f,1 juv",4,Agelenidae,Histopona,bidens,Histopona bidens,147,42.752.604,17.551.145,tb,deep cave,,6,,"11,9","16,45000076","16,45000076","24,5",925,25,"100,5400609",,,4,11,1,nan,82,6
1152,Špilja kod Nerezinog dola,Croatia,2.12.2001.,2001-12-02,1 juv,1,Agelenidae,Histopona,bidens,Histopona bidens,177,42.758.378,17.436.094,tb,deep cave,,6,,"13,883","16,10370445","16,10370445","23,88333321",874,24,"106,1225494","95,342",,6,2.5,1,nan,35,5.5
1155,Špilja na Gradini kod Premanture,Croatia,13.7.2005.,2005-07-13,2 juv,2,Nesticidae,Kryptonesticus,eremita,Kryptonesticus eremita,10,44.786.909,13.907.968,tf,deep cave,,3,,"13,875","14,38249969","14,38249969","24,69999886",753,25,"301,7029411","93,725",,nan,nan,1,nan,nan,nan
1157,Tučepska vilenjača,Croatia,17.6.2002.,2002-06-17,"1 juv,1juv m,1f",3,Agelenidae,Histopona,conveniens,Histopona conveniens,1242,43.286.465,17.083.638,Tf,deep cave,,8,"10,6","10,731","9,67800045","9,67800045","24,96000099",926,26,"67,32747088",,,6,0.8,1,nan,28,35
1158,Ostaševica,Croatia,17.6.2001.,2001-06-17,"1f,1 juv",2,Agelenidae,Histopona,bidens,Histopona bidens,302,42.748.959,17.544.404,tb,deep cave,,9,,"11,4","15,79444408","15,79444408","24,11999893",925,25,"101,3842944",100,,6,5,1,nan,70,20
1159,Manita peć,Croatia,12.8.1998.,1998-08-12,1 juv,1,Agelenidae,Histopona,sp.,Histopona sp.,374,44.314.302,15.475.264,,deep cave,,7,"8,8","9,525","10,42683315","10,42683315","27,29200172",1068,28,"252,2759525",,,nan,nan,1,nan,nan,nan
1160,Močiljska špilja,Croatia,21.6.2001.,2001-06-21,"2f,2m,2 juv",6,Nesticidae,Kryptonesticus,eremita,Kryptonesticus eremita,333,42.689.061,18.071.906,tf,deep cave,,6,"15,4","14,7","15,5370369","15,5370369","24,25",1154,26,"95,48772633",,,5,2.5,1,1038,938,138
1161,Tučepska vilenjača,Croatia,17.6.2002.,2002-06-17,"1 m, 2juv",3,Agelenidae,Histopona,conveniens,Histopona conveniens,1242,43.286.465,17.083.638,Tf,deep cave,,8,"10,6","10,731","9,67800045","9,67800045","24,96000099",926,26,"67,32747088",,,6,0.8,1,nan,28,35
1162,Tučepska vilenjača,Croatia,23.5.2004.,2004-05-23,1 juv,1,Agelenidae,Histopona,sp.,Histopona sp.,1242,43.286.465,17.083.638,,deep cave,,8,"10,6","10,731","9,67800045","9,67800045","24,96000099",926,26,"67,32747088",,,6,0.8,1,nan,28,35
1164,Pišurka,Croatia,2.6.2000.,2000-06-02,"1f,1 juv m,1 juv",3,Nesticidae,Kryptonesticus,eremita,Kryptonesticus eremita,17,42.959.451,17.129.228,tf,deep cave,,5,,"13,925","14,0666666","14,0666666","24,28125",833,25,"105,2150766","84,833",,6,1.3,1,86,75,32
1165,Jama za Mahrincem,Croatia,5.1.2009.,2009-01-05,"3f,2m,2 juv",7,Nesticidae,Kryptonesticus,eremita,Kryptonesticus eremita,45,43.344.348,1.674.088,tf,deep cave,,2,,"9,9","15,69453144","15,69453144","25,78749847",804,2,"94,5530675",,,3.5,2.5,1,nan,26,25
1166,Bazgovača,Croatia,4.8.2004.,2004-08-04,1 juv,1,Nesticidae,Kryptonesticus,eremita,Kryptonesticus eremita,652,4.330.647,16.622.143,,deep cave,,3,,"7,2","12,8081665","12,8081665","24,57600021",796,24,"108,9858223",,,5,7,1,nan,47,32
1167,Jama za Mahrincem,Croatia,24.10.2007.,2007-10-24,"1f,1m,4 juv",6,Nesticidae,Kryptonesticus,eremita,Kryptonesticus eremita,45,43.344.348,1.674.088,tf,deep cave,,2,,"9,9","15,69453144","15,69453144","25,78749847",804,2,"94,5530675",,,3.5,2.5,1,nan,26,25
1168,Balića špilja,Croatia,4.8.2007.,2007-08-04,1 m,1,Nesticidae,Kryptonesticus,eremita,Kryptonesticus eremita,438,4.357.296,1.657.002,tf,deep cave,,11,,"7,2","12,25566673","12,25566673","25,68000031",872,23,"105,1255288",,,70,7,1,194,155,50
1172,Manita peć,Croatia,3.9.1999.,1999-09-03,1 juv,1,Agelenidae,Histopona,sp.,Histopona sp.,374,44.314.302,15.475.264,,deep cave,,7,"8,8","9,525","10,42683315","10,42683315","27,29200172",1068,28,"252,2759525",,,nan,nan,1,nan,nan,nan
1173,Manita peć,Croatia,7.6.2006.,2006-06-07,1 f,1,Agelenidae,Histopona,egonpretneri,Histopona egonpretneri,374,44.314.302,15.475.264,Tb,deep cave,,7,"8,8","9,525","10,42683315","10,42683315","27,29200172",1068,28,"252,2759525",,,nan,nan,1,nan,nan,nan
1175,Grapčeva špilja,Croatia,4.4.2005.,2005-04-04,1 juv,1,Agelenidae,Hadites,tegenarioides,Hadites tegenarioides,279,43.134.189,16.753.732,TB,deep cave,,5,,"13,225","15,48979187","15,48979187","23,94499969",751,28,"110,2583259",,,nan,nan,1,nan,nan,nan
1176,Grapčeva špilja,Croatia,4.4.2005.,2005-04-04,"1 f,2 juv",3,Nesticidae,Kryptonesticus,eremita,Kryptonesticus eremita,279,43.134.189,16.753.732,tf,deep cave,,5,,"13,225","15,48979187","15,48979187","23,94499969",751,28,"110,2583259",,,nan,nan,1,nan,nan,nan
1177,Špilja na Gradini kod Premanture,Croatia,13.7.2004.,2004-07-13,"2 f,3 juv",5,Nesticidae,Kryptonesticus,eremita,Kryptonesticus eremita,10,44.786.909,13.907.968,tf,deep cave,,3,,"13,875","14,38249969","14,38249969","24,69999886",753,25,"301,7029411","93,725",,nan,nan,1,nan,nan,nan
1178,Špilja na Gradini kod Premanture,Croatia,20.11.2006.,2006-11-20,2f,2,Nesticidae,Kryptonesticus,eremita,Kryptonesticus eremita,10,44.786.909,13.907.968,tf,deep cave,,3,,"13,875","14,38249969","14,38249969","24,69999886",753,25,"301,7029411","93,725",,nan,nan,1,nan,nan,nan
1180,Špilja u uvali Predpeć,Croatia,6.4.2008.,2008-04-06,"1 f,2 juv",3,Nesticidae,Kryptonesticus,eremita,Kryptonesticus eremita,,45.291.576,14.510.419,tf,deep cave,,4,"10,3","10,625","13,89999962","13,89999962","25,40000153",1376,44,"398,0215329",,,4,3,1,25,21,4
1183,Šipun,Croatia,27.3.2003.,2003-03-27,3 juv,3,Agelenidae,Histopona,sp.,Histopona sp.,,42.583.646,18.217.986,,deep cave,,11,,"15,4","15,02037048","15,02037048","24,28333282",1208,2,"111,3036255","97,8",,1.5,2.5,1,165,150,22.5
1184,Šipun,Croatia,11.2.2005.,2005-02-11,"1 f,2juv",3,Agelenidae,Histopona,dubia,Histopona dubia,,42.583.646,18.217.986,tb,deep cave,,11,,"15,4","15,02037048","15,02037048","24,28333282",1208,2,"111,3036255","97,8",,1.5,2.5,1,165,150,22.5
1189,Šipun,Croatia,11.2.2005.,2005-02-11,1 juv,1,Agelenidae,Histopona,sp.,Histopona sp.,,42.583.646,18.217.986,,deep cave,,11,,"15,4","15,02037048","15,02037048","24,28333282",1208,2,"111,3036255","97,8",,1.5,2.5,1,165,150,22.5
1191,Šipun,Croatia,27.3.2003.,2003-03-27,1 juv,1,Agelenidae,Histopona,sp.,Histopona sp.,,42.583.646,18.217.986,,deep cave,,11,,"15,4","15,02037048","15,02037048","24,28333282",1208,2,"111,3036255","97,8",,1.5,2.5,1,165,150,22.5
1196,Šipun,Croatia,12.2.2005.,2005-02-12,1 juv,1,Agelenidae,Histopona,sp.,Histopona sp.,,42.583.646,18.217.986,,deep cave,,11,,"15,4","15,02037048","15,02037048","24,28333282",1208,2,"111,3036255","97,8",,1.5,2.5,1,165,150,22.5
1198,Šipun,Croatia,19.8.2005.,2005-08-19,"1f, 1 juv",2,Nesticidae,Kryptonesticus,eremita,Kryptonesticus eremita,,42.583.646,18.217.986,tf,deep cave,,11,,"15,4","15,02037048","15,02037048","24,28333282",1208,2,"111,3036255","97,8",,1.5,2.5,1,165,150,22.5
1199,Šipun,Croatia,27.3.2003.,2003-03-27,2 juv,2,Agelenidae,Histopona,sp.,Histopona sp.,,42.583.646,18.217.986,,deep cave,,11,,"15,4","15,02037048","15,02037048","24,28333282",1208,2,"111,3036255","97,8",,1.5,2.5,1,165,150,22.5
1200,Šipun,Croatia,19.8.2005.,2005-08-19,1 juv,1,Agelenidae,Histopona,sp.,Histopona sp.,,42.583.646,18.217.986,,deep cave,,11,,"15,4","15,02037048","15,02037048","24,28333282",1208,2,"111,3036255","97,8",,1.5,2.5,1,165,150,22.5
1201,Pišurka,Croatia,27.4.2004.,2004-04-27,1 juv,1,Nesticidae,Kryptonesticus,eremita,Kryptonesticus eremita,17,42.959.451,17.129.228,,deep cave,,5,,"13,925","14,0666666","14,0666666","24,28125",833,25,"105,2150766","84,833",,6,1.3,1,86,75,32
1203,Đurovića jama,Croatia,27.6.2003.,2003-06-27,"1f,1m,1 juv",3,Nesticidae,Kryptonesticus,eremita,Kryptonesticus eremita,156,42.559.979,18.263.559,tf,deep cave,,4,,"17,267","15,93194485","15,93194485","24,30000114",1247,6,"111,7390404",,,1,2,1,156,132,17
1204,Đurovića jama,Croatia,27.5.2004.,2004-05-27,"1f, 1juv",2,Nesticidae,Kryptonesticus,eremita,Kryptonesticus eremita,156,42.559.979,18.263.559,tf,deep cave,,4,,"17,267","15,93194485","15,93194485","24,30000114",1247,6,"111,7390404",,,1,2,1,156,132,17
1240,Antina špilja,Croatia,17.7.2004.,2004-07-17,"1 f,2 juv",3,Nesticidae,Nesticus,cellulanus,Nesticus cellulanus,570,45.497.475,17.856.553,tf,deep cave,,2,,"13,2","8,909166336","8,909166336","27,79999924",855,23,"285,9960742","96,9",,2,1.5,1,nan,24,1.7
1268,Kukor,Croatia,8.9.2005.,2005-09-08,1 f,1,Nesticidae,Kryptonesticus,deelemanae,Kryptonesticus deelemanae,587,43.355.609,16.991.707,tb,deep cave,,10,,"15,4","12,63749981","12,63749981","25,40833473",906,29,"68,94753675",,,1,1,1,264,213,40
1271,Matijaševa peć,Croatia,4.4.2006.,2006-04-04,1 juv,1,Nesticidae,Kryptonesticus,deelemanae,Kryptonesticus deelemanae,621,43.320.551,17.122.321,tb,deep cave,,6,"8,3","6,933","9,092166901","9,092166901",25,931,23,"60,61369348",,,3,1,1,18,17,6
1272,Kukor,Croatia,27.7.2004.,2004-07-27,1 juv,1,Nesticidae,Kryptonesticus,deelemanae,Kryptonesticus deelemanae,587,43.355.609,16.991.707,tb,deep cave,,10,,"15,4","12,63749981","12,63749981","25,40833473",906,29,"68,94753675",,,1,1,1,264,213,40
1273,Špilja u Radinovcima,Croatia,25.10.2006.,2006-10-25,"2f, 2m, 2 juv",6,Nesticidae,Kryptonesticus,deelemanae,Kryptonesticus deelemanae,416,43.387.285,170.103,tb,deep cave,,4,,"8,525","12,27216721","12,27216721","26,62000084",912,23,"64,7145817",93,,7,4,1,nan,50,14
1275,Kukor,Croatia,19.6.2002.,2002-06-19,"1f, 2 juv",3,Nesticidae,Kryptonesticus,deelemanae,Kryptonesticus deelemanae,587,43.355.609,16.991.707,tb,deep cave,,10,,"15,4","12,63749981","12,63749981","25,40833473",906,29,"68,94753675",,,1,1,1,264,213,40
1276,Kukor,Croatia,29.10.2006.,2006-10-29,1 f,1,Nesticidae,Kryptonesticus,deelemanae,Kryptonesticus deelemanae,587,43.355.609,16.991.707,tb,deep cave,,10,,"15,4","12,63749981","12,63749981","25,40833473",906,29,"68,94753675",,,1,1,1,264,213,40
1277,Crna ledenica,Croatia,24.10.2006.,2006-10-24,1 m,1,Nesticidae,Kryptonesticus,deelemanae,Kryptonesticus deelemanae,1557,43.348.162,17.055.328,tb,deep cave,,2,,"0,3","8,441666603","8,441666603","24,99200058",947,26,"63,68523746",,,15,10,1,200,112,72.5
1281,Ledenica kod Stare škole,Croatia,28.6.2002.,2002-06-28,2 juv,2,Nesticidae,Kryptonesticus,deelemanae,Kryptonesticus deelemanae,1402,43.342.082,17.041.289,tb,deep cave,,1,"1,8",3,"7,902999878","7,902999878","24,58800125",950,23,"65,49733528","95,5",92,nan,nan,1,nan,nan,nan
1285,Mala jama u stijenama,Croatia,20.6.2003.,2003-06-20,1 juv,1,Nesticidae,Kryptonesticus,deelemanae,Kryptonesticus deelemanae,1221,43.365.579,17.027.668,tb,deep cave,,3,"9,3","9,3","7,902999878","7,902999878","24,58800125",950,29,"64,74299334",93,93,nan,nan,1,nan,nan,nan
1286,Kukor,Croatia,6.4.2006.,2006-04-06,1 juv,1,Nesticidae,Kryptonesticus,deelemanae,Kryptonesticus deelemanae,587,43.355.609,16.991.707,tb,deep cave,,10,,"15,4","12,63749981","12,63749981","25,40833473",906,29,"68,94753675",,,1,1,1,264,213,40
1288,Kuna špilja,Croatia,15.6.2002.,2002-06-15,1 juv m,1,Nesticidae,Kryptonesticus,deelemanae,Kryptonesticus deelemanae,1396,43.324.523,17.055.953,tb,deep cave,,2,,"4,5","7,993500233","7,993500233","24,5",945,23,"65,81333493","98,6",,1.7,0.9,1,44,28,3
1289,Kukor,Croatia,6.4.2006.,2006-04-06,1 juv,1,Nesticidae,Kryptonesticus,deelemanae,Kryptonesticus deelemanae,587,43.355.609,16.991.707,tb,deep cave,,10,,"15,4","12,63749981","12,63749981","25,40833473",906,29,"68,94753675",,,1,1,1,264,213,40
1290,Samogorska špilja,Croatia,4.4.2006.,2006-04-04,1 juv m,1,Nesticidae,Kryptonesticus,deelemanae,Kryptonesticus deelemanae,621,43.318.227,17.121.122,tb,deep cave,,6,"7,1","9,033","9,092166901","9,092166901",25,931,23,"60,95464736",99,,2,3,1,nan,19,3.5
1291,Kuna špilja,Croatia,28.4.2002.,2002-04-28,1 juv m,1,Nesticidae,Kryptonesticus,deelemanae,Kryptonesticus deelemanae,1396,43.324.523,17.055.953,tb,deep cave,,2,,"4,5","7,993500233","7,993500233","24,5",945,23,"65,81333493","98,6",,1.7,0.9,1,44,28,3
1293,Pretnerova jama,Croatia,28.10.2006.,2006-10-28,1 f,1,Nesticidae,Kryptonesticus,deelemanae,Kryptonesticus deelemanae,1459,43.339.276,17.038.312,tb,deep cave,,2,,"5,44","7,902999878","7,902999878","24,58800125",950,23,"66,01720708","68,3",,2.5,1.5,1,nan,422,254
1294,Crna ledenica,Croatia,25.4.2004.,2004-04-25,"1f, 1 juv m",2,Nesticidae,Kryptonesticus,deelemanae,Kryptonesticus deelemanae,1557,43.348.162,17.055.328,tb,deep cave,,2,,"0,3","8,441666603","8,441666603","24,99200058",947,26,"63,68523746",,,15,10,1,200,112,72.5
1296,Kukor,Croatia,27.7.2004.,2004-07-27,1 f,1,Nesticidae,Kryptonesticus,deelemanae,Kryptonesticus deelemanae,587,43.355.609,16.991.707,tb,deep cave,,10,,"15,4","12,63749981","12,63749981","25,40833473",906,29,"68,94753675",,,1,1,1,264,213,40
1297,Špilja u Radinovcima,Croatia,25.10.2006.,2006-10-25,"2f, 1m, 7 juv",1,Nesticidae,Kryptonesticus,deelemanae,Kryptonesticus deelemanae,416,43.387.285,170.103,tb,deep cave,,4,,"8,525","12,27216721","12,27216721","26,62000084",912,23,"64,7145817",93,,7,4,1,nan,50,14
1298,Samogorska špilja,Croatia,4.4.2006.,2006-04-04,1 f,1,Nesticidae,Kryptonesticus,deelemanae,Kryptonesticus deelemanae,621,43.318.227,17.121.122,tb,deep cave,,6,"7,1","9,033","9,092166901","9,092166901",25,931,23,"60,95464736",99,,2,3,1,nan,19,3.5
1299,Špilja u Radinovcima,Croatia,26.10.2006.,2006-10-26,"2f, 2juv",4,Nesticidae,Kryptonesticus,deelemanae,Kryptonesticus deelemanae,416,43.387.285,170.103,tb,deep cave,,4,,"8,525","12,27216721","12,27216721","26,62000084",912,23,"64,7145817",93,,7,4,1,nan,50,14
1305,Božinkina jama,Croatia,4.1.2004.,2004-01-04,"1m, 1f",2,Dysderidae,Stalita,taenaria,Stalita taenaria,357,4.540.466,1.430.388,Tb,deep cave,,2,,"10,2","11,41566658","11,41566658","25,84399986",1431,23,"407,4707392",,,0.8,1.5,1,nan,103,114
1306,Jama u Vetvi,Croatia,4.6.2010.,2010-06-04,1m,1,Dysderidae,Dysdera,adriatica,Dysdera adriatica,902,45.332.148,14.240.733,Tx,,,3,,"9,6","8,69833374","8,69833374","24,88399887",1569,23,"394,4373935",,,2,1,1,nan,5,47
1307,Jama u Vetvi,Croatia,4.6.2010.,2010-06-04,1f,1,Linyphiidae,Troglohyphantes,liburnicus,Troglohyphantes liburnicus,902,45.332.148,14.240.733,Tb,deep cave,,3,,"9,6","8,69833374","8,69833374","24,88399887",1569,23,"394,4373935",,,2,1,1,nan,5,47
1309,Jama pod Križ,Croatia,4.6.2010.,2010-06-04,1f,1,Linyphiidae,Troglohyphantes,brignolii,Troglohyphantes brignolii,587,45.374.314,14.113.041,Tb,deep cave,,1,,"8,5","11,26066685","11,26066685","25,83600044",1337,25,"397,0763597",,,1,1.4,1,nan,30,9
1310,Jama pod Križ,Croatia,4.6.2010.,2010-06-04,"1f, 3 juv m",4,Linyphiidae,Troglohyphantes,brignolii,Troglohyphantes brignolii,587,45.374.314,14.113.041,Tb,deep cave,,1,,"8,5","11,26066685","11,26066685","25,83600044",1337,25,"397,0763597",,,1,1.4,1,nan,30,9
1311,Barinova jama,Croatia,18.9.2007.,2007-09-18,3f,3,Linyphiidae,Troglohyphantes,brignolii,Troglohyphantes brignolii,706,45.354.889,14.126.033,Tb,deep cave,,1,,"5,9","9,280166626","9,280166626","25,73200035",1519,23,"394,4600784",,,12,5,1,nan,61,55
1318,Topolska peć,Croatia,14.9.2007.,2007-09-14,1f,1,Linyphiidae,Troglohyphantes,brignolii,Troglohyphantes brignolii,1012,4.530.489,14.212.681,Tb,deep cave,,3,,"6,4","8,69833374","8,69833374","24,88399887",1569,23,"389,4132415",,,nan,nan,1,nan,nan,nan
1336,Topolska peć,Croatia,26.7.2006.,2006-07-26,"1m, 3 juv",4,Linyphiidae,Troglohyphantes,brignolii,Troglohyphantes brignolii,1012,4.530.489,14.212.681,Tb,deep cave,,3,,"6,4","8,69833374","8,69833374","24,88399887",1569,23,"389,4132415",,,nan,nan,1,nan,nan,nan
1337,Topolska peć,Croatia,26.7.2006.,2006-07-26,"1f, 1 juv",2,Linyphiidae,Troglohyphantes,brignolii,Troglohyphantes brignolii,1012,4.530.489,14.212.681,Tb,deep cave,,3,,"6,4","8,69833374","8,69833374","24,88399887",1569,23,"389,4132415",,,nan,nan,1,nan,nan,nan
1349,Vela peć,Croatia,4.6.2010.,2010-06-04,1f,1,Linyphiidae,Troglohyphantes,brignolii,Troglohyphantes brignolii,632,45.333.194,14.158.683,Tb,deep cave,,1,,"6,6","11,98849964","11,98849964","25,54400063",1267,25,"392,0826182",,,nan,nan,1,nan,nan,nan
1396,Špilja kod Stare Sušice,Croatia,12.6.2009.,2009-06-12,1m,1,Anapidae,Comaroma,simoni,Comaroma simoni,723,45.387.689,14.994.379,tf,deep cave,,11,,"7,4","7,502999783","7,502999783","27,42399979",1494,24,"395,0363624","99,65",,2,1,1,nan,414,103
1397,Peć u Čulinovim raljevinama,Croatia,6.1.2009.,2009-01-06,1f,1,Linyphiidae,Troglohyphantes,strandi,Troglohyphantes strandi,369,43.605.854,16.575.066,tb,deep cave,,5,,11,"12,99133301","12,99133301","26,44000053",879,26,"104,4759765",,,1,1,1,nan,42.5,12.5
1400,Jama u Krogu,Croatia,15.9.2007.,2007-09-15,1m,1,Linyphiidae,Labulla,thoracica,Labulla thoracica,1002,45.378.389,1.416.897,,,,2,"2,5","2,45","7,287499905","7,287499905","25,13999939",1707,23,"399,2909922",,,20,15,1,nan,130,93
1401,Kukor,Croatia,28.7.2006.,2006-07-28,1 juv,1,Nesticidae,Kryptonesticus,deelemanae,Kryptonesticus deelemanae,587,43.355.609,16.991.707,tb,deep cave,,10,,"15,4","12,63749981","12,63749981","25,40833473",906,29,"68,94753675",,,1,1,1,264,213,40
1402,Matijaševa peć,Croatia,19.11.2005.,2005-11-19,1 juv,1,Nesticidae,Kryptonesticus,deelemanae,Kryptonesticus deelemanae,621,43.320.551,17.122.321,tb,deep cave,,6,"8,3","6,933","9,092166901","9,092166901",25,931,23,"60,61369348",,,3,1,1,18,17,6
1403,Jama iznad Saranača,Croatia,2.4.2006.,2006-04-02,1 juv m,1,Agelenidae,Histopona,sp.,Histopona sp.,777,43.249.007,17.174.663,,deep cave,,7,"10,8","11,112","11,73516655","11,73516655","25,61599922",905,28,"64,87446036",,,2.5,0.5,1,nan,8.6,20.5
1406,Vaganka,Croatia,3.6.2006.,2006-06-03,3 juv,3,Agelenidae,Histopona,sp.,Histopona sp.,656,4.433.853,1.543.867,,deep cave,,5,,"12,2","7,622666836","7,622666836","26,19600105",1265,29,"257,5927467",95,,,,,,,
1408,Jama pod istočnom stijenom Buljme,Croatia,13.9.2006.,2006-09-13,1 f,1,Agelenidae,Histopona,egonpretneri,Histopona egonpretneri,1445,44.368.375,15.467.868,Tb,deep cave,,3,,"4,8","7,383500099","7,383500099","25,82799911",1297,23,"256,7963643",,,,,,,,
1432,Kukor,Croatia,2.1.1999.,1999-01-02,1 f,1,Agelenidae,Histopona,conveniens,Histopona conveniens,587,43.355.609,16.991.707,Tf,deep cave,,10,,"15,4","12,63749981","12,63749981","25,40833473",906,29,"68,94753675",,,1,1,1,264,213,40
1434,Pozjata špilja,Croatia,26.10.2003.,2003-10-26,1m,1,Agelenidae,Histopona,conveniens,Histopona conveniens,1394,43.387.837,16.963.748,Tf,deep cave,,3,,"7,85","10,82800007","10,82800007","25,23999977",919,28,"69,25839521",99,,,,,,,
1435,Jujnovića špilja,Croatia,27.4.2002.,2002-04-27,1f,1,Agelenidae,Histopona,conveniens,Histopona conveniens,463,43.266.579,1.719.798,Tf,deep cave,,6,"13,8","10,85","12,35200024","12,35200024","26,52000046",917,29,"61,15708825",,,5,2.5,1,108,40,16
1437,Jama za Supinom,Croatia,18.11.2005.,2005-11-18,1 f,1,Agelenidae,Histopona,conveniens,Histopona conveniens,905,43.250.417,17.113.278,Tf,deep cave,,7,,"10,75","9,67800045","9,67800045","24,96000099",926,26,"69,05858686","87,25",,2.5,2.5,1,372,264,82
1438,Jama za Supinom,Croatia,18.11.2005.,2005-11-18,"2m,1 juv",3,Agelenidae,Histopona,conveniens,Histopona conveniens,905,43.250.417,17.113.278,Tf,deep cave,,7,,"10,75","9,67800045","9,67800045","24,96000099",926,26,"69,05858686","87,25",,2.5,2.5,1,372,264,82
1440,Bošak jama,Croatia,4.4.2006.,2006-04-04,1 juv,1,Agelenidae,Histopona,sp.,Histopona sp.,721,43.347.996,17.100.045,,deep cave,,2,,"7,4","11,25733376","11,25733376","26,1079998",928,23,"59,73571895",100,,1.1,1.7,1,nan,11,17
1441,Jama iznad Saranača,Croatia,25.3.2003.,2003-03-25,1f,1,Agelenidae,Histopona,conveniens,Histopona conveniens,777,43.249.007,17.174.663,Tf,deep cave,,7,"10,8","11,112","11,73516655","11,73516655","25,61599922",905,28,"64,87446036",,,2.5,0.5,1,nan,8.6,20.5
1442,Kukor,Croatia,6.4.2006.,2006-04-06,1m,1,Agelenidae,Histopona,conveniens,Histopona conveniens,587,43.355.609,16.991.707,Tf,deep cave,,10,,"15,4","12,63749981","12,63749981","25,40833473",906,29,"68,94753675",,,1,1,1,264,213,40
1443,Kukor,Croatia,23.9.1999.,1999-09-23,"1f,1 juv m",2,Agelenidae,Histopona,conveniens,Histopona conveniens,587,43.355.609,16.991.707,Tf,deep cave,,10,,"15,4","12,63749981","12,63749981","25,40833473",906,29,"68,94753675",,,1,1,1,264,213,40
1444,Špilja u Radinovcima,Croatia,25.10.2006.,2006-10-25,1f,1,Agelenidae,Histopona,conveniens,Histopona conveniens,416,43.387.285,170.103,Tf,deep cave,,4,,"8,525","12,27216721","12,27216721","26,62000084",912,23,"64,7145817",93,,7,4,1,nan,50,14
1445,Spila 1,Croatia,26.3.2003.,2003-03-26,1f,1,Agelenidae,Histopona,conveniens,Histopona conveniens,349,43.262.438,17.203.945,Tf,deep cave,,3,"10,4","10,4","12,35200024","12,35200024","26,52000046",917,21,"61,24985608",100,100,3,1.8,1,30,27,10.5
1447,Špilja u Radinovcima,Croatia,25.10.2006.,2006-10-25,1m,1,Agelenidae,Histopona,conveniens,Histopona conveniens,416,43.387.285,170.103,Tf,deep cave,,4,,"8,525","12,27216721","12,27216721","26,62000084",912,23,"64,7145817",93,,7,4,1,nan,50,14
1448,Jama za Supinom,Croatia,3.4.2006.,2006-04-03,1m,1,Agelenidae,Histopona,conveniens,Histopona conveniens,905,43.250.417,17.113.278,Tf,deep cave,,7,,"10,75","9,67800045","9,67800045","24,96000099",926,26,"69,05858686","87,25",,2.5,2.5,1,372,264,82
1449,Jama na Brezdanu,Croatia,20.3.2004.,2004-03-20,1f,1,Agelenidae,Histopona,conveniens,Histopona conveniens,914,43.369.901,16.973.172,Tf,deep cave,,3,"8,5","8,5","12,63749981","12,63749981","25,40833473",906,32,"69,62048453",,,nan,nan,1,nan,nan,nan
1450,Matijaševa peć,Croatia,4.4.2006.,2006-04-04,1 juv,1,Agelenidae,Histopona,sp.,Histopona sp.,621,43.320.551,17.122.321,,deep cave,,6,"8,3","6,933","9,092166901","9,092166901",25,931,23,"60,61369348",,,3,1,1,18,17,6
1451,Oplemenjena špilja,Croatia,20.6.2003.,2003-06-20,1 juv,1,Agelenidae,Histopona,sp.,Histopona sp.,998,43.369.119,17.025.884,,deep cave,,1,7,7,"7,902999878","7,902999878","24,58800125",950,25,"64,62358923",,,,,,,,
1452,Kukor,Croatia,19.6.2002.,2002-06-19,1 juv,1,Agelenidae,Histopona,sp.,Histopona sp.,587,43.355.609,16.991.707,,deep cave,,10,,"15,4","12,63749981","12,63749981","25,40833473",906,29,"68,94753675",,,1,1,1,264,213,40
1454,Spila 2,Croatia,23.3.2004.,2004-03-23,1 juv,1,Agelenidae,Histopona,sp.,Histopona sp.,349,4.326.239,17.204.021,,deep cave,,6,12,12,"12,35200024","12,35200024","26,52000046",917,21,"61,25054739","96,3","96,3",0.5,0.7,1,28,24,11
1455,Jama iznad Prozorčića,Croatia,22.11.2005.,2005-11-22,1 juv,1,Agelenidae,Histopona,sp.,Histopona sp.,460,4.338.381,16.932.036,,deep cave,,5,"12,5","8,9","12,02766705","12,02766705","24,98400116",895,24,"72,69547752",,,4,1.5,1,28.6,15,23.5
1456,Jama iznad Prozorčića,Croatia,24.3.2004.,2004-03-24,2 juv,2,Agelenidae,Histopona,sp.,Histopona sp.,460,4.338.381,16.932.036,,deep cave,,5,"12,5","8,9","12,02766705","12,02766705","24,98400116",895,24,"72,69547752",,,4,1.5,1,28.6,15,23.5
1462,Jama za Supinom,Croatia,26.5.2004.,2004-05-26,3 juv,3,Agelenidae,Histopona,sp.,Histopona sp.,905,43.250.417,17.113.278,,deep cave,,7,,"10,75","9,67800045","9,67800045","24,96000099",926,26,"69,05858686","87,25",,2.5,2.5,1,372,264,82
1467,Špilja na Mrždolcu,Croatia,21.11.2005.,2005-11-21,1 juv m,1,Agelenidae,Histopona,sp.,Histopona sp.,419,43.405.319,17.014.811,,deep cave,,3,,"7,5","12,27216721","12,27216721","26,62000084",912,23,"62,97721711",,,nan,nan,1,nan,nan,nan
1468,Jama u Bratušu,Croatia,27.10.2006.,2006-10-27,1 juv,1,Agelenidae,Histopona,sp.,Histopona sp.,43,43.328.376,16.979.405,,deep cave,,4,"12,5","13,15","14,92166615","14,92166615","26,53999901",857,2,"72,35367461",91,,7,1.8,1,18,7,11
1469,Ješkalovica,Croatia,4.1.2009.,2009-01-04,1f,1,Nesticidae,Kryptonesticus,eremita,Kryptonesticus eremita,194,43.299.857,16.839.313,tf,deep cave,,2,,"15,4","15,64131927","15,64131927","25,73750114",817,20,"87,88201212","95,1",,1,1,1,nan,21,29
1476,Mucića ledenica,Croatia,24.5.2004.,2004-05-24,1f,1,Agelenidae,Tegenaria,sp. 2,Tegenaria sp. 2,1344,4.335.632,17.051.544,,deep cave,,3,"0,8","0,8","8,441666603","8,441666603","24,99200058",947,23,"63,30845715",,,5,4,1,nan,60,37.5
1478,Špilja u uvali Svežanj,Croatia,6.4.2008.,2008-04-06,"2 juv m,1 juv",3,Nesticidae,Kryptonesticus,eremita,Kryptonesticus eremita,,45.298.144,1.449.561,,deep cave,,1,,"7,8","13,62371826","13,62371826","25,51538467",1452,44,"398,4064564","98,1",,3,1,1,17,17,2
1481,Kukor,Croatia,17.8.2000.,2000-08-17,"1f,1 juv",2,Nesticidae,Kryptonesticus,deelemanae,Kryptonesticus deelemanae,587,43.355.609,16.991.707,tb,deep cave,,10,,"15,4","12,63749981","12,63749981","25,40833473",906,29,"68,94753675",,,1,1,1,264,213,40
1486,Milića špilja,Croatia,30.7.2006.,2006-07-30,1f,1,Nesticidae,Kryptonesticus,eremita,Kryptonesticus eremita,224,44.143.333,15.803.133,tf,deep cave,,1,,"12,6","12,67350006","12,67350006","28,27199936",949,29,"207,9910669",,,nan,nan,1,nan,nan,nan
1489,Jama u Bratušu,Croatia,27.8.2005.,2005-08-27,3 juv,3,Agelenidae,Histopona,sp.,Histopona sp.,43,43.328.376,16.979.405,,deep cave,,4,"12,5","13,15","14,92166615","14,92166615","26,53999901",857,2,"72,35367461",91,,7,1.8,1,18,7,11
1490,Velika špilja na Bukovcima,Croatia,21.11.2005.,2005-11-21,1 juv,1,Agelenidae,Histopona,sp.,Histopona sp.,467,43.403.686,17.022.825,,deep cave,,1,,"7,7","12,27216721","12,27216721","26,62000084",912,23,"62,29824154",,,nan,nan,1,nan,nan,nan
1494,Pišurka,Croatia,2.6.2000.,2000-06-02,2f,2,Agelenidae,Tegenaria,annulata,Tegenaria annulata,17,42.959.451,17.129.228,tf,deep cave,,5,,"13,925","14,0666666","14,0666666","24,28125",833,25,"105,2150766","84,833",,6,1.3,1,86,75,32
1495,Kuna špilja,Croatia,27.8.1998.,1998-08-27,1m,1,Nesticidae,Kryptonesticus,deelemanae,Kryptonesticus deelemanae,1396,43.324.523,17.055.953,tb,deep cave,,2,,"4,5","7,993500233","7,993500233","24,5",945,23,"65,81333493","98,6",,1.7,0.9,1,44,28,3
1500,Kraljicina špilja,Croatia,19.10.2007.,2007-10-19,"4f,1m",5,Nesticidae,Kryptonesticus,eremita,Kryptonesticus eremita,189,43.073.661,16.100.773,tf,deep cave,,2,,"15,1","15,32770824","15,32770824","22,59999847",585,44,"176,649054",91,,4,2,1,nan,126,6
1502,Kraljicina špilja,Croatia,19.10.2007.,2007-10-19,1 juv,1,Agelenidae,Histopona,sp.,Histopona sp.,189,43.073.661,16.100.773,,deep cave,,2,,"15,1","15,32770824","15,32770824","22,59999847",585,44,"176,649054",91,,4,2,1,nan,126,6
1503,Kraljicina špilja,Croatia,19.10.2007.,2007-10-19,1 juv,1,Nesticidae,Kryptonesticus,eremita,Kryptonesticus eremita,189,43.073.661,16.100.773,tf,deep cave,,2,,"15,1","15,32770824","15,32770824","22,59999847",585,44,"176,649054",91,,4,2,1,nan,126,6
1504,Jama za Mahrincem,Croatia,5.1.2005.,2005-01-05,"2f,1 juv",3,Nesticidae,Kryptonesticus,eremita,Kryptonesticus eremita,45,43.344.348,1.674.088,tf,deep cave,,2,,"9,9","15,69453144","15,69453144","25,78749847",804,2,"94,5530675",,,3.5,2.5,1,nan,26,25
1505,Polušpilja na Mrčari,Croatia,1.10.2007.,2007-10-01,2 juv,2,Agelenidae,Tegenaria,sp.,Tegenaria sp.,48,42.768.583,16.788.965,,deep cave,,2,,"19,4","16,70208359","16,70208359","20,84999847",630,24,"149,308983",,,,,,,,
1506,Kraljicina špilja,Croatia,3.10.2005.,2005-10-03,1f,1,Nesticidae,Kryptonesticus,eremita,Kryptonesticus eremita,189,43.073.661,16.100.773,tf,deep cave,,2,,"15,1","15,32770824","15,32770824","22,59999847",585,44,"176,649054",91,,4,2,1,nan,126,6
1516,Špilja Jama,Croatia,17.3.2002.,2002-03-17,1f,1,Agelenidae,Tegenaria,bosnica,Tegenaria bosnica,317,43.110.888,17.354.016,,deep cave,,1,"9,1","13,8","14,25021935","14,25021935","26,047369",918,21,"74,66357593","73,5",97,,,,,,
1518,Špilja na vrh Toraca,Croatia,23.8.2005.,2005-08-23,1 juv,1,Nesticidae,Kryptonesticus,eremita,Kryptonesticus eremita,193,42.705.575,1.803.049,tf,deep cave,,3,"15,5","15,275","16,42202377","16,42202377","23,8571434",1128,29,"92,9323532","96,75",100,1,2,1,nan,65.5,17
1521,Hrastovska špilja,Croatia,2.10.2007.,2007-10-02,2 juv,2,Nesticidae,Kryptonesticus,eremita,Kryptonesticus eremita,103,42.756.282,16.875.635,tf,deep cave,,4,,"12,6","16,4216671","16,4216671","22,7733345",668,29,"145,7479543",94,,nan,nan,1,nan,nan,nan
1523,Stražbenica,Croatia,3.5.2009.,2009-05-03,3f,3,Nesticidae,Kryptonesticus,eremita,Kryptonesticus eremita,172,43.697.353,16.029.618,tf,deep cave,,3,,"14,7","14,88466644","14,88466644","26,93600082",739,26,"165,8524113",100,,7,2.5,1,86,86,7
1524,Male ponte,Croatia,21.6.2001.,2001-06-21,3 juv,3,Agelenidae,Histopona,bidens,Histopona bidens,258,42.761.389,17.430.786,tb,deep cave,,7,,"14,45","16,10370445","16,10370445","23,88333321",874,29,"106,0560518",100,,1,1.5,1,nan,106,28.8
1528,Močiljska špilja,Croatia,1.11.2003.,2003-11-01,"1f,1 juv",2,Agelenidae,Histopona,dubia,Histopona dubia,333,42.689.061,18.071.906,tb,deep cave,,6,"15,4","14,7","15,5370369","15,5370369","24,25",1154,26,"95,48772633",,,5,2.5,1,1038,938,138
1530,Ostaševica,Croatia,17.6.2001.,2001-06-17,"1f,1 juv",2,Agelenidae,Histopona,bidens,Histopona bidens,302,42.748.959,17.544.404,tb,deep cave,,9,,"11,4","15,79444408","15,79444408","24,11999893",925,25,"101,3842944",100,,6,5,1,nan,70,20
1531,Vilinska jama,Croatia,2.4.2007.,2007-04-02,1 juv,1,Agelenidae,Histopona,sp.,Histopona sp.,118,42.728.553,17.881.121,,deep cave,,10,,"13,6","16,61458397","16,61458397","23,72142792",1068,24,"91,19914008","84,6",,1,1,1,14.9,10.3,5.8
1532,Banova ljut,Croatia,4.4.2007.,2007-04-04,"1f,1 juv",2,Nesticidae,Kryptonesticus,eremita,Kryptonesticus eremita,278,42.724.023,18.023.649,tf,deep cave,,4,,"15,2","14,54366684","14,54366684","24,62399864",1130,32,"90,15075072",93,,2,1.8,1,nan,306,25
1533,Banova ljut,Croatia,4.4.2007.,2007-04-04,2 juv,2,Agelenidae,Histopona,sp.,Histopona sp.,278,42.724.023,18.023.649,,deep cave,,4,,"15,2","14,54366684","14,54366684","24,62399864",1130,32,"90,15075072",93,,2,1.8,1,nan,306,25
1534,Špilja za Gromačkom vlakom,Croatia,29.5.2004.,2004-05-29,1 f,1,Agelenidae,Histopona,dubia,Histopona dubia,630,42.743.509,18.027.359,tb,deep cave,,15,,"13,378","14,54366684","14,54366684","24,62399864",1130,29,"87,19003096",,,2,3,1,2439,2204,220
1535,Jama pod Velji vrh,Croatia,14.6.2001.,2001-06-14,"2m,1f, 2 juv",5,Nesticidae,Kryptonesticus,eremita,Kryptonesticus eremita,55,42.766.635,16.907.278,tf,deep cave,,2,,"16,567","16,4216671","16,4216671","22,7733345",668,29,"142,6292455","95,667",,1,2,1,nan,90,41
1536,Špilja na vrh Toraca,Croatia,8.10.2004.,2004-10-08,2 juv,2,Agelenidae,Histopona,sp.,Histopona sp.,193,42.705.575,1.803.049,,deep cave,,3,"15,5","15,275","16,42202377","16,42202377","23,8571434",1128,29,"92,9323532","96,75",100,1,2,1,nan,65.5,17
1537,Špilja za Gromačkom vlakom,Croatia,29.5.2004.,2004-05-29,2f,2,Agelenidae,Histopona,dubia,Histopona dubia,630,42.743.509,18.027.359,tb,deep cave,,15,,"13,378","14,54366684","14,54366684","24,62399864",1130,29,"87,19003096",,,2,3,1,2439,2204,220
1542,Špilja na vrh Toraca,Croatia,8.10.2004.,2004-10-08,3 juv,3,Agelenidae,Histopona,sp.,Histopona sp.,193,42.705.575,1.803.049,,deep cave,,3,"15,5","15,275","16,42202377","16,42202377","23,8571434",1128,29,"92,9323532","96,75",100,1,2,1,nan,65.5,17
1543,Banova ljut,Croatia,7.9.2006.,2006-09-07,1f,1,Agelenidae,Histopona,dubia,Histopona dubia,278,42.724.023,18.023.649,tb,deep cave,,4,,"15,2","14,54366684","14,54366684","24,62399864",1130,32,"90,15075072",93,,2,1.8,1,nan,306,25
1544,Debela ljut,Croatia,7.4.2006.,2006-04-07,2 juv,2,Nesticidae,Kryptonesticus,eremita,Kryptonesticus eremita,278,42.717.699,18.022.036,tf,deep cave,,8,"15,6","15,6","14,54366684","14,54366684","24,62399864",1130,32,"91,11277219",,,,,,,,
1545,Špilja za Gromačkom vlakom,Croatia,25.-26.3.2003.,2003-03-25/2003-03-26,2 f,2,Tetragnathidae,Metellina,merianae,Metellina merianae,630,42.743.509,18.027.359,Tf,deep cave,,15,,"13,378","14,54366684","14,54366684","24,62399864",1130,29,"87,19003096",,,2,3,1,2439,2204,220
1546,Špilja za Gromačkom vlakom,Croatia,25.-26.3.2003.,2003-03-25/2003-03-26,"1f,2 juv",3,Agelenidae,Histopona,dubia,Histopona dubia,630,42.743.509,18.027.359,tb,deep cave,,15,,"13,378","14,54366684","14,54366684","24,62399864",1130,29,"87,19003096",,,2,3,1,2439,2204,220
1547,Špilja za Gromačkom vlakom,Croatia,8.5.2006.,2006-05-08,1f,1,Agelenidae,Histopona,dubia,Histopona dubia,630,42.743.509,18.027.359,tb,deep cave,,15,,"13,378","14,54366684","14,54366684","24,62399864",1130,29,"87,19003096",,,2,3,1,2439,2204,220
1548,Špilja za Gromačkom vlakom,Croatia,29.3.2003.,2003-03-29,1 juv,1,Agelenidae,Histopona,sp.,Histopona sp.,630,42.743.509,18.027.359,,deep cave,,15,,"13,378","14,54366684","14,54366684","24,62399864",1130,29,"87,19003096",,,2,3,1,2439,2204,220
1549,Špilja na vrh Toraca,Croatia,23.8.2005.,2005-08-23,1 juv,1,Agelenidae,Histopona,sp.,Histopona sp.,193,42.705.575,1.803.049,,deep cave,,3,"15,5","15,275","16,42202377","16,42202377","23,8571434",1128,29,"92,9323532","96,75",100,1,2,1,nan,65.5,17
1550,Banova ljut,Croatia,4.4.2007.,2007-04-04,2 juv,2,Agelenidae,Histopona,sp.,Histopona sp.,278,42.724.023,18.023.649,,deep cave,,4,,"15,2","14,54366684","14,54366684","24,62399864",1130,32,"90,15075072",93,,2,1.8,1,nan,306,25
1551,Banova ljut,Croatia,4.4.2007.,2007-04-04,"1f, 1 juv",2,Agelenidae,Histopona,dubia,Histopona dubia,278,42.724.023,18.023.649,tb,deep cave,,4,,"15,2","14,54366684","14,54366684","24,62399864",1130,32,"90,15075072",93,,2,1.8,1,nan,306,25
1552,Banova ljut,Croatia,7.9.2006.,2006-09-07,1 f,1,Nesticidae,Kryptonesticus,eremita,Kryptonesticus eremita,278,42.724.023,18.023.649,tf,deep cave,,4,,"15,2","14,54366684","14,54366684","24,62399864",1130,32,"90,15075072",93,,2,1.8,1,nan,306,25
1553,Špilja za Gromačkom vlakom,Croatia,29.3.2003.,2003-03-29,1 juv,1,Agelenidae,Histopona,sp.,Histopona sp.,630,42.743.509,18.027.359,,deep cave,,15,,"13,378","14,54366684","14,54366684","24,62399864",1130,29,"87,19003096",,,2,3,1,2439,2204,220
1554,Špilja za Gromačkom vlakom,Croatia,25.-26.3.2003.,2003-03-25/2003-03-26,"2 f,1juv",3,Agelenidae,Histopona,dubia,Histopona dubia,630,42.743.509,18.027.359,tb,deep cave,,15,,"13,378","14,54366684","14,54366684","24,62399864",1130,29,"87,19003096",,,2,3,1,2439,2204,220
1555,Špilja na vrh Toraca,Croatia,23.8.2005.,2005-08-23,1f,1,Nesticidae,Kryptonesticus,eremita,Kryptonesticus eremita,193,42.705.575,1.803.049,tf,deep cave,,3,"15,5","15,275","16,42202377","16,42202377","23,8571434",1128,29,"92,9323532","96,75",100,1,2,1,nan,65.5,17
1556,Močiljska špilja,Croatia,28.3.2003.,2003-03-28,1 m,1,Agelenidae,Histopona,dubia,Histopona dubia,333,42.689.061,18.071.906,tb,deep cave,,6,"15,4","14,7","15,5370369","15,5370369","24,25",1154,26,"95,48772633",,,5,2.5,1,1038,938,138
1557,Močiljska špilja,Croatia,,,1 juv,1,Agelenidae,Histopona,sp.,Histopona sp.,333,42.689.061,18.071.906,,deep cave,,6,"15,4","14,7","15,5370369","15,5370369","24,25",1154,26,"95,48772633",,,5,2.5,1,1038,938,138
1558,Močiljska špilja,Croatia,28.3.2003.,2003-03-28,5 juv,5,Agelenidae,Histopona,sp.,Histopona sp.,333,42.689.061,18.071.906,,deep cave,,6,"15,4","14,7","15,5370369","15,5370369","24,25",1154,26,"95,48772633",,,5,2.5,1,1038,938,138
1559,Močiljska špilja,Croatia,8.10.2004.,2004-10-08,2 juv,2,Agelenidae,Histopona,sp.,Histopona sp.,333,42.689.061,18.071.906,,deep cave,,6,"15,4","14,7","15,5370369","15,5370369","24,25",1154,26,"95,48772633",,,5,2.5,1,1038,938,138
1561,Močiljska špilja,Croatia,1.4.2007.,2007-04-01,"1 m, 1f",2,Agelenidae,Histopona,dubia,Histopona dubia,333,42.689.061,18.071.906,tb,deep cave,,6,"15,4","14,7","15,5370369","15,5370369","24,25",1154,26,"95,48772633",,,5,2.5,1,1038,938,138
1563,Vilinska jama,Croatia,2.4.2007.,2007-04-02,1f,1,Agelenidae,Histopona,dubia,Histopona dubia,118,42.728.553,17.881.121,tb,deep cave,,10,,"13,6","16,61458397","16,61458397","23,72142792",1068,24,"91,19914008","84,6",,1,1,1,14.9,10.3,5.8
1564,Jama pod Sv. Spasom,Croatia,20.6.2001.,2001-06-20,"1juv m, 3 juv",4,Agelenidae,Histopona,bidens,Histopona bidens,50,42.731.779,17.542.409,tb,deep cave,,6,,"14,6","15,79444408","15,79444408","24,11999893",925,17,"103,7805159",,,6,7,1,nan,42,78
1565,Jama pod Sv. Spasom,Croatia,2.12.2001.,2001-12-02,1 m,1,Tetragnathidae,Metellina,merianae,Metellina merianae,50,42.731.779,17.542.409,Tf,deep cave,,6,,"14,6","15,79444408","15,79444408","24,11999893",925,17,"103,7805159",,,6,7,1,nan,42,78
1570,Močiljska špilja,Croatia,28.4.2010.,2010-04-28,"1m, 1juv",2,Nesticidae,Kryptonesticus,eremita,Kryptonesticus eremita,333,42.689.061,18.071.906,tf,deep cave,,6,"15,4","14,7","15,5370369","15,5370369","24,25",1154,26,"95,48772633",,,5,2.5,1,1038,938,138
1571,Močiljska špilja,Croatia,28.4.2010.,2010-04-28,2 juv,2,Agelenidae,Histopona,sp.,Histopona sp.,333,42.689.061,18.071.906,,deep cave,,6,"15,4","14,7","15,5370369","15,5370369","24,25",1154,26,"95,48772633",,,5,2.5,1,1038,938,138
1572,Močiljska špilja,Croatia,28.4.2010.,2010-04-28,"1 juv m,1juv",2,Nesticidae,Kryptonesticus,eremita,Kryptonesticus eremita,333,42.689.061,18.071.906,tf,deep cave,,6,"15,4","14,7","15,5370369","15,5370369","24,25",1154,26,"95,48772633",,,5,2.5,1,1038,938,138
1573,Močiljska špilja,Croatia,28.4.2010.,2010-04-28,1 juv,1,Agelenidae,Histopona,sp.,Histopona sp.,333,42.689.061,18.071.906,,deep cave,,6,"15,4","14,7","15,5370369","15,5370369","24,25",1154,26,"95,48772633",,,5,2.5,1,1038,938,138
1575,Špilja za Gromačkom vlakom,Croatia,27.4.2010.,2010-04-27,1f,1,Agelenidae,Histopona,dubia,Histopona dubia,630,42.743.509,18.027.359,tb,deep cave,,15,,"13,378","14,54366684","14,54366684","24,62399864",1130,29,"87,19003096",,,2,3,1,2439,2204,220
1576,Špilja za Gromačkom vlakom,Croatia,27.4.2010.,2010-04-27,5 juv,5,Agelenidae,Histopona,sp.,Histopona sp.,630,42.743.509,18.027.359,,deep cave,,15,,"13,378","14,54366684","14,54366684","24,62399864",1130,29,"87,19003096",,,2,3,1,2439,2204,220
1581,Banova ljut,Croatia,4.4.2007.,2007-04-04,1 juv,1,Nesticidae,Kryptonesticus,eremita,Kryptonesticus eremita,278,42.724.023,18.023.649,tf,deep cave,,4,,"15,2","14,54366684","14,54366684","24,62399864",1130,32,"90,15075072",93,,2,1.8,1,nan,306,25
1583,Jama pod Sv. Spasom,Croatia,20.6.2001.,2001-06-20,1juv,1,Agelenidae,Tegenaria,sp.,Tegenaria sp.,50,42.731.779,17.542.409,,deep cave,,6,,"14,6","15,79444408","15,79444408","24,11999893",925,17,"103,7805159",,,6,7,1,nan,42,78
1591,Kukor,Croatia,19.6.2002.,2002-06-19,1f,1,Theridiidae,Gen.,sp.,Gen. sp.,587,43.355.609,16.991.707,,,,10,,"15,4","12,63749981","12,63749981","25,40833473",906,29,"68,94753675",,,1,1,1,264,213,40
1593,Markov ponor,Croatia,15.8.2009.,2009-08-15,1f,1,Linyphiidae,Troglohyphantes,sp. 3,Troglohyphantes sp. 3,562,44.765.318,15.176.875,tb,deep cave,,1,,"6,6","8,673000336","8,673000336","27,76000023",1341,23,"316,7274136","96,7",,5,7,1,2240,1725,69
1610,Medvjeđa špilja,Croatia,20.10.1996.,1996-10-20,"2m, 2f",4,Dysderidae,Parastalita,stygia,Parastalita stygia,758,45.363.572,14.757.905,Tb,deep cave,,3,,"10,95","7,299499989","7,299499989","26,94799995",1530,25,"411,6907421",,,nan,nan,1,nan,nan,nan
1611,Medvjeđa špilja,Croatia,20.10.1996.,1996-10-20,1 juv m?,1,Dysderidae,Stalita,pretneri,Stalita pretneri,758,45.363.572,14.757.905,Tb,deep cave,,3,,"10,95","7,299499989","7,299499989","26,94799995",1530,25,"411,6907421",,,nan,nan,1,nan,nan,nan
1624,Špilja kod Nerezinog dola,Croatia,8.8.1996.,1996-08-08,"1m, 1juv",2,Dysderidae,Folkia,inermis,Folkia inermis,177,42.758.378,17.436.094,Tb,deep cave,,6,,"13,883","16,10370445","16,10370445","23,88333321",874,24,"106,1225494","95,342",,6,2.5,1,nan,35,5.5
1626,Pišurka,Croatia,28.8.1995.,1995-08-28,1juv,1,Dysderidae,Folkia,haasi,Folkia haasi,17,42.959.451,17.129.228,Tb,deep cave,,5,,"13,925","14,0666666","14,0666666","24,28125",833,25,"105,2150766","84,833",,6,1.3,1,86,75,32
1628,Pišurka,Croatia,12.2.1998.,1998-02-12,2 juv,2,Dysderidae,Folkia,haasi,Folkia haasi,17,42.959.451,17.129.228,Tb,deep cave,,5,,"13,925","14,0666666","14,0666666","24,28125",833,25,"105,2150766","84,833",,6,1.3,1,86,75,32
1634,Pišurka,Croatia,2.6.2000.,2000-06-02,2 juv,2,Dysderidae,Folkia,haasi,Folkia haasi,17,42.959.451,17.129.228,Tb,deep cave,,5,,"13,925","14,0666666","14,0666666","24,28125",833,25,"105,2150766","84,833",,6,1.3,1,86,75,32
1639,Močiljska špilja,Croatia,1.11.2003.,2003-11-01,1m,1,Dysderidae,Stalagtia,sp. 5,Stalagtia sp. 5,333,42.689.061,18.071.906,Tb,deep cave,,6,"15,4","14,7","15,5370369","15,5370369","24,25",1154,26,"95,48772633",,,5,2.5,1,1038,938,138
1640,Šipun,Croatia,26.3.2004.,2004-03-26,1f,1,Dysderidae,Stalagtia,sp. 1,Stalagtia sp. 1,,42.583.646,18.217.986,Tb,deep cave,,11,,"15,4","15,02037048","15,02037048","24,28333282",1208,2,"111,3036255","97,8",,1.5,2.5,1,165,150,22.5
1641,Močiljska špilja,Croatia,9.2.1998.,1998-02-09,1f,1,Dysderidae,Stalagtia,sp. 5,Stalagtia sp. 5,333,42.689.061,18.071.906,Tb,deep cave,,6,"15,4","14,7","15,5370369","15,5370369","24,25",1154,26,"95,48772633",,,5,2.5,1,1038,938,138
1642,Močiljska špilja,Croatia,25.3.2004.,2004-03-25,1m,1,Dysderidae,Stalagtia,sp. 5,Stalagtia sp. 5,333,42.689.061,18.071.906,Tb,deep cave,,6,"15,4","14,7","15,5370369","15,5370369","24,25",1154,26,"95,48772633",,,5,2.5,1,1038,938,138
1643,Močiljska špilja,Croatia,21.6.2001.,2001-06-21,"1f, 1 juv",2,Dysderidae,Stalagtia,sp. 5,Stalagtia sp. 5,333,42.689.061,18.071.906,Tb,deep cave,,6,"15,4","14,7","15,5370369","15,5370369","24,25",1154,26,"95,48772633",,,5,2.5,1,1038,938,138
1644,Šipun,Croatia,12.2.2005.,2005-02-12,1f,1,Dysderidae,Stalagtia,sp. 1,Stalagtia sp. 1,,42.583.646,18.217.986,Tb,deep cave,,11,,"15,4","15,02037048","15,02037048","24,28333282",1208,2,"111,3036255","97,8",,1.5,2.5,1,165,150,22.5
1645,Šipun,Croatia,19.8.2005.,2005-08-19,2 juv,2,Dysderidae,Stalagtia,sp. 1,Stalagtia sp. 1,,42.583.646,18.217.986,Tb,deep cave,,11,,"15,4","15,02037048","15,02037048","24,28333282",1208,2,"111,3036255","97,8",,1.5,2.5,1,165,150,22.5
1646,Močiljska špilja,Croatia,27.6.2003.,2003-06-27,1juvm,1,Dysderidae,Stalagtia,sp. 5,Stalagtia sp. 5,333,42.689.061,18.071.906,Tb,deep cave,,6,"15,4","14,7","15,5370369","15,5370369","24,25",1154,26,"95,48772633",,,5,2.5,1,1038,938,138
1647,Močiljska špilja,Croatia,28.3.2003.,2003-03-28,2 juv,2,Dysderidae,Stalagtia,sp. 5,Stalagtia sp. 5,333,42.689.061,18.071.906,Tb,deep cave,,6,"15,4","14,7","15,5370369","15,5370369","24,25",1154,26,"95,48772633",,,5,2.5,1,1038,938,138
1649,Močiljska špilja,Croatia,1.11.2003.,2003-11-01,1 juv,1,Dysderidae,Stalagtia,sp. 5,Stalagtia sp. 5,333,42.689.061,18.071.906,Tb,deep cave,,6,"15,4","14,7","15,5370369","15,5370369","24,25",1154,26,"95,48772633",,,5,2.5,1,1038,938,138
1656,Stara jametina,Croatia,10.10.2010.,2010-10-10,1 juv,1,Dysderidae,Stalagtia,sp. 4,Stalagtia sp. 4,161,43.794.009,1.600.259,Tb,deep cave,,6,"13,4","13,2","14,21000004","14,21000004","27,66799927",790,20,"170,7986956","90,95","91,7",12,8,1,nan,188,85
1657,Miljacka 2,Croatia,8.10.2010.,2010-10-08,"1m, 1f, 4 juv",6,Nesticidae,Kryptonesticus,eremita,Kryptonesticus eremita,224,440.002,16.016.234,tf,deep cave,,4,,"12,6","13,29333305","13,29333305","28,4279995",894,32,"177,675492",,,,,,,,
1658,Stara jametina,Croatia,10.10.2010.,2010-10-10,1juv,1,Dysderidae,Stalagtia,sp. 4,Stalagtia sp. 4,161,43.794.009,1.600.259,Tb,deep cave,,6,"13,4","13,2","14,21000004","14,21000004","27,66799927",790,20,"170,7986956","90,95","91,7",12,8,1,nan,188,85
1659,Stara jametina,Croatia,10.10.2010.,2010-10-10,1 juv,1,Agelenidae,Histopona,sp.,Histopona sp.,161,43.794.009,1.600.259,,deep cave,,6,"13,4","13,2","14,21000004","14,21000004","27,66799927",790,20,"170,7986956","90,95","91,7",12,8,1,nan,188,85
1663,Sedrena špilja kod stola,Croatia,5.10.2010.,2010-10-05,1 m,1,Nesticidae,Kryptonesticus,eremita,Kryptonesticus eremita,247,4.401.385,16.068.978,tf,deep cave,,2,"6,1","6,1","13,18266678","13,18266678","28,31999969",900,29,"172,9455136","85,7","85,7",1,1,1,nan,21,2
1664,Miljacka 2,Croatia,8.10.2010.,2010-10-08,"1m, 1f",2,Nesticidae,Kryptonesticus,eremita,Kryptonesticus eremita,224,440.002,16.016.234,tf,deep cave,,4,,"12,6","13,29333305","13,29333305","28,4279995",894,32,"177,675492",,,,,,,,
1665,Jazinka,Croatia,10.10.2010.,2010-10-10,1 juv,1,Dysderidae,Stalagtia,sp. 4,Stalagtia sp. 4,162,43.975.892,16.029.694,Tb,deep cave,,2,,13,"13,5286665","13,5286665","28,34799957",864,23,"174,9933462",,,2,1,1,42,42,4
1667,Stara jametina,Croatia,10.10.2010.,2010-10-10,1m,1,Linyphiidae,Palliduphantes,istrianus,Palliduphantes istrianus,161,43.794.009,1.600.259,Tf,deep cave,,6,"13,4","13,2","14,21000004","14,21000004","27,66799927",790,20,"170,7986956","90,95","91,7",12,8,1,nan,188,85
1668,Stara jametina,Croatia,10.10.2010.,2010-10-10,1f,1,Linyphiidae,Palliduphantes,istrianus,Palliduphantes istrianus,161,43.794.009,1.600.259,Tf,deep cave,,6,"13,4","13,2","14,21000004","14,21000004","27,66799927",790,20,"170,7986956","90,95","91,7",12,8,1,nan,188,85
1669,Stara jametina,Croatia,10.10.2010.,2010-10-10,1f,1,Linyphiidae,Palliduphantes,istrianus,Palliduphantes istrianus,161,43.794.009,1.600.259,Tf,deep cave,,6,"13,4","13,2","14,21000004","14,21000004","27,66799927",790,20,"170,7986956","90,95","91,7",12,8,1,nan,188,85
1677,Miljacka 2,Croatia,8.10.2010.,2010-10-08,"1f, 1m",2,Nesticidae,Kryptonesticus,eremita,Kryptonesticus eremita,224,440.002,16.016.234,tf,deep cave,,4,,"12,6","13,29333305","13,29333305","28,4279995",894,32,"177,675492",,,,,,,,
1678,Miljacka 2,Croatia,8.10.2010.,2010-10-08,1f,1,Agelenidae,Tegenaria,domestica,Tegenaria domestica,224,440.002,16.016.234,Tf,deep cave,,4,,"12,6","13,29333305","13,29333305","28,4279995",894,32,"177,675492",,,,,,,,
1679,Miljacka 2,Croatia,8.10.2010.,2010-10-08,"1f, 2 juv",3,Nesticidae,Kryptonesticus,eremita,Kryptonesticus eremita,224,440.002,16.016.234,tf,deep cave,,4,,"12,6","13,29333305","13,29333305","28,4279995",894,32,"177,675492",,,,,,,,
1680,Miljacka 2,Croatia,8.10.2010.,2010-10-08,"1f, 1m",2,Agelenidae,Tegenaria,domestica,Tegenaria domestica,224,440.002,16.016.234,Tf,deep cave,,4,,"12,6","13,29333305","13,29333305","28,4279995",894,32,"177,675492",,,,,,,,
1681,Stara jametina,Croatia,10.10.2010.,2010-10-10,4 juv,4,Dysderidae,Stalagtia,sp. 4,Stalagtia sp. 4,161,43.794.009,1.600.259,Tb,deep cave,,6,"13,4","13,2","14,21000004","14,21000004","27,66799927",790,20,"170,7986956","90,95","91,7",12,8,1,nan,188,85
1684,Stara jametina,Croatia,10.10.2010.,2010-10-10,"2m, 6f, 1 juv",9,Linyphiidae,Micrargus,herbigradus,Micrargus herbigradus,161,43.794.009,1.600.259,Tf,deep cave,,6,"13,4","13,2","14,21000004","14,21000004","27,66799927",790,20,"170,7986956","90,95","91,7",12,8,1,nan,188,85
1685,Stara jametina,Croatia,10.10.2010.,2010-10-10,"2m, 2f",4,Linyphiidae,Micrargus,herbigradus,Micrargus herbigradus,161,43.794.009,1.600.259,Tf,deep cave,,6,"13,4","13,2","14,21000004","14,21000004","27,66799927",790,20,"170,7986956","90,95","91,7",12,8,1,nan,188,85
1686,Stara jametina,Croatia,10.10.2010.,2010-10-10,1f,1,Linyphiidae,Micrargus,herbigradus,Micrargus herbigradus,161,43.794.009,1.600.259,Tf,deep cave,,6,"13,4","13,2","14,21000004","14,21000004","27,66799927",790,20,"170,7986956","90,95","91,7",12,8,1,nan,188,85
1687,Stara jametina,Croatia,10.10.2010.,2010-10-10,1f,1,Linyphiidae,Micrargus,herbigradus,Micrargus herbigradus,161,43.794.009,1.600.259,Tf,deep cave,,6,"13,4","13,2","14,21000004","14,21000004","27,66799927",790,20,"170,7986956","90,95","91,7",12,8,1,nan,188,85
1688,Stara jametina,Croatia,10.10.2010.,2010-10-10,1f,1,Linyphiidae,Micrargus,herbigradus,Micrargus herbigradus,161,43.794.009,1.600.259,Tf,deep cave,,6,"13,4","13,2","14,21000004","14,21000004","27,66799927",790,20,"170,7986956","90,95","91,7",12,8,1,nan,188,85
1689,Stara jametina,Croatia,10.10.2010.,2010-10-10,1f,1,Theridiidae,Episinus,cavernicola,Episinus cavernicola,161,43.794.009,1.600.259,Tf,deep cave,,6,"13,4","13,2","14,21000004","14,21000004","27,66799927",790,20,"170,7986956","90,95","91,7",12,8,1,nan,188,85
1697,Bundalova pećina,Croatia,11.7.2009.,2009-07-11,1 juv,1,Agelenidae,Histopona,sp.,Histopona sp.,204,44.195.721,15.855.588,,deep cave,,4,,"10,4","12,68216705","12,68216705","28,51600075",964,26,"206,1502601",,,,,,,,
1699,Frkina jama,Croatia,20.11.2010.,2010-11-20,"1f, 1 juv ",2,Tetragnathidae,Metellina,merianae,Metellina merianae,892,4.421.424,15.998.543,Tf,deep cave,,1,,"6,8","8,311166763","8,311166763","26,90400124",1147,23,"193,4254554",,,10,5,1,249,39,215
1701,Šipun,Croatia,27.3.2003.,2003-03-27,1 juv,1,Dysderidae,Stalagtia,sp. 1,Stalagtia sp. 1,,42.583.646,18.217.986,Tb,deep cave,,11,,"15,4","15,02037048","15,02037048","24,28333282",1208,2,"111,3036255","97,8",,1.5,2.5,1,165,150,22.5
1703,Šipun,Croatia,27.3.2003.,2003-03-27,2 juv,2,Dysderidae,Stalagtia,sp. 1,Stalagtia sp. 1,,42.583.646,18.217.986,Tb,deep cave,,11,,"15,4","15,02037048","15,02037048","24,28333282",1208,2,"111,3036255","97,8",,1.5,2.5,1,165,150,22.5
1704,Šipun,Croatia,19.8.2005.,2005-08-19,1 juv,1,Dysderidae,Stalagtia,sp. 1,Stalagtia sp. 1,,42.583.646,18.217.986,Tb,deep cave,,11,,"15,4","15,02037048","15,02037048","24,28333282",1208,2,"111,3036255","97,8",,1.5,2.5,1,165,150,22.5
1705,Šipun,Croatia,27.3.2003.,2003-03-27,1 juv,1,Dysderidae,Stalagtia,sp. 1,Stalagtia sp. 1,,42.583.646,18.217.986,Tb,deep cave,,11,,"15,4","15,02037048","15,02037048","24,28333282",1208,2,"111,3036255","97,8",,1.5,2.5,1,165,150,22.5
1706,Šipun,Croatia,27.6.2003.,2003-06-27,1 juv,1,Dysderidae,Stalagtia,sp. 1,Stalagtia sp. 1,,42.583.646,18.217.986,Tb,deep cave,,11,,"15,4","15,02037048","15,02037048","24,28333282",1208,2,"111,3036255","97,8",,1.5,2.5,1,165,150,22.5
1707,Šipun,Croatia,19.8.2005.,2005-08-19,"1m, 1f",2,Dysderidae,Stalagtia,sp. 1,Stalagtia sp. 1,,42.583.646,18.217.986,Tb,deep cave,,11,,"15,4","15,02037048","15,02037048","24,28333282",1208,2,"111,3036255","97,8",,1.5,2.5,1,165,150,22.5
1709,Šipun,Croatia,29.6.2000.,2000-06-29,6 juv,6,Dysderidae,Stalagtia,sp. 1,Stalagtia sp. 1,,42.583.646,18.217.986,Tb,deep cave,,11,,"15,4","15,02037048","15,02037048","24,28333282",1208,2,"111,3036255","97,8",,1.5,2.5,1,165,150,22.5
1710,Tučepska vilenjača,Croatia,17.6.2002.,2002-06-17,1 juv,1,Dysderidae,Stalagtia,sp. 4,Stalagtia sp. 4,1242,43.286.465,17.083.638,Tb,deep cave,,8,"10,6","10,731","9,67800045","9,67800045","24,96000099",926,26,"67,32747088",,,6,0.8,1,nan,28,35
1711,Močiljska špilja,Croatia,1.11.2003.,2003-11-01,1 juv,1,Dysderidae,Stalagtia,sp. 5,Stalagtia sp. 5,333,42.689.061,18.071.906,Tb,deep cave,,6,"15,4","14,7","15,5370369","15,5370369","24,25",1154,26,"95,48772633",,,5,2.5,1,1038,938,138
1712,Tučepska vilenjača,Croatia,9.4.1999.,1999-04-09,1m,1,Dysderidae,Stalagtia,sp. 4,Stalagtia sp. 4,1242,43.286.465,17.083.638,Tb,deep cave,,8,"10,6","10,731","9,67800045","9,67800045","24,96000099",926,26,"67,32747088",,,6,0.8,1,nan,28,35
1713,Šipun,Croatia,11.2.2005.,2005-02-11,2 juv,2,Dysderidae,Stalagtia,sp. 1,Stalagtia sp. 1,,42.583.646,18.217.986,Tb,deep cave,,11,,"15,4","15,02037048","15,02037048","24,28333282",1208,2,"111,3036255","97,8",,1.5,2.5,1,165,150,22.5
1719,Đurovića jama,Croatia,27.5.2004.,2004-05-27,1 juv,1,Leptonetidae,Gen.,sp.,Gen. sp.,156,42.559.979,18.263.559,,,,4,,"17,267","15,93194485","15,93194485","24,30000114",1247,6,"111,7390404",,,1,2,1,156,132,17
1720,Miljacka 2,Croatia,6.1.2005.,2005-01-06,1m,1,Tetragnathidae,Metellina,merianae,Metellina merianae,224,440.002,16.016.234,Tf,deep cave,,4,,"12,6","13,29333305","13,29333305","28,4279995",894,32,"177,675492",,,,,,,,
1726,Močiljska špilja,Croatia,28.4.2010.,2010-04-28,1 juv,1,Dysderidae,Stalagtia,sp. 5,Stalagtia sp. 5,333,42.689.061,18.071.906,Tb,deep cave,,6,"15,4","14,7","15,5370369","15,5370369","24,25",1154,26,"95,48772633",,,5,2.5,1,1038,938,138
1730,Špilja u uvali Predpeć,Croatia,23.1.2011.,2011-01-23,1m,1,Nesticidae,Kryptonesticus,eremita,Kryptonesticus eremita,,45.291.576,14.510.419,tf,deep cave,,4,"10,3","10,625","13,89999962","13,89999962","25,40000153",1376,44,"398,0215329",,,4,3,1,25,21,4
1733,Pišurka,Croatia,1.10.2007.,2007-10-01,"3f, 3 juv",6,Nesticidae,Kryptonesticus,eremita,Kryptonesticus eremita,17,42.959.451,17.129.228,tf,deep cave,,5,,"13,925","14,0666666","14,0666666","24,28125",833,25,"105,2150766","84,833",,6,1.3,1,86,75,32
1734,Pišurka,Croatia,1.10.2007.,2007-10-01,"1f, 2 juv",3,Dysderidae,Folkia,haasi,Folkia haasi,17,42.959.451,17.129.228,Tb,deep cave,,5,,"13,925","14,0666666","14,0666666","24,28125",833,25,"105,2150766","84,833",,6,1.3,1,86,75,32
1736,Slovačka jama,Croatia,3.8.2002.,2002-08-03,1f,1,Dysderidae,Stalita,pretneri,Stalita pretneri,1455,44.748.943,15.003.173,Tb,deep cave,,1,,"4,4","4,542500019","4,542500019","23,87199974",1804,27,"331,4039026",,,,,,,,
1741,Manita peć,Croatia,7.6.2006.,2006-06-07,"1m, 1f, 1 juv",3,Dysderidae,Parastalita,stygia,Parastalita stygia,374,44.314.302,15.475.264,Tb,deep cave,,7,"8,8","9,525","10,42683315","10,42683315","27,29200172",1068,28,"252,2759525",,,nan,nan,1,nan,nan,nan
1742,Manita peć,Croatia,7.6.2006.,2006-06-07,2 juv,2,Dysderidae,Parastalita,stygia,Parastalita stygia,374,44.314.302,15.475.264,Tb,deep cave,,7,"8,8","9,525","10,42683315","10,42683315","27,29200172",1068,28,"252,2759525",,,nan,nan,1,nan,nan,nan
1743,Čude špilja,Croatia,4.8.2006.,2006-08-04,1m,1,Dysderidae,Parastalita,stygia,Parastalita stygia,70,44.212.351,15.741.592,Tb,deep cave,,2,,"13,4","11,30550003","11,30550003","28,15200043",1034,18,"218,6874679",,,,,,,,
1748,Bukovac,Croatia,20.2.1999.,1999-02-20,2 juv,2,Dysderidae,Stalita,pretneri,Stalita pretneri,817,4.534.318,14.757.647,Tb,deep cave,,5,,"7,8","7,299499989","7,299499989","26,94799995",1530,24,"409,5782937","96,5",,8,5,1,nan,136,2
1749,Špilja kod Stare Sušice,Croatia,25.7.2009.,2009-07-25,"1m, 1f",2,Dysderidae,Parastalita,stygia,Parastalita stygia,723,45.387.689,14.994.379,Tb,deep cave,,11,,"7,4","7,502999783","7,502999783","27,42399979",1494,24,"395,0363624","99,65",,2,1,1,nan,414,103
1750,Špilja pod Mačkovom dragom,Croatia,10.7.2010.,2010-07-10,1m,1,Dysderidae,Parastalita,stygia,Parastalita stygia,685,45.261.001,15.023.822,Tb,deep cave,,1,,"7,4","6,968666553","6,968666553","26,46800041",1564,25,"378,8376232",,,2,1,1,376,362,26
1752,Špilja za Gromačkom vlakom,Croatia,27.4.2010.,2010-04-27,"1m, 2f, 1 juv",4,Dysderidae,Stalagtia,hercegovinensis,Stalagtia hercegovinensis,630,42.743.509,18.027.359,Tb,deep cave,,15,,"13,378","14,54366684","14,54366684","24,62399864",1130,29,"87,19003096",,,2,3,1,2439,2204,220
1776,Močiljska špilja,Croatia,28.4.2010.,2010-04-28,1m,1,Dysderidae,Stalagtia,sp. 5,Stalagtia sp. 5,333,42.689.061,18.071.906,Tb,deep cave,,6,"15,4","14,7","15,5370369","15,5370369","24,25",1154,26,"95,48772633",,,5,2.5,1,1038,938,138
1779,Špilja za Gromačkom vlakom,Croatia,27.4.2010.,2010-04-27,1 juv,1,Dysderidae,Stalagtia,hercegovinensis,Stalagtia hercegovinensis,630,42.743.509,18.027.359,Tb,deep cave,,15,,"13,378","14,54366684","14,54366684","24,62399864",1130,29,"87,19003096",,,2,3,1,2439,2204,220
1780,Maica Golubinka,Croatia,21.6.2010.,2010-06-21,1m,1,Dysderidae,Stalagtia,sp. 4,Stalagtia sp. 4,157,43.108.853,17.566.424,Tb,deep cave,,6,,"13,9","15,70966625","15,70966625","28,84799957",995,23,"55,78019094",,,nan,nan,1,nan,nan,nan
1781,Špilja za Gromačkom vlakom,Croatia,27.4.2010.,2010-04-27,1m,1,Dysderidae,Stalagtia,hercegovinensis,Stalagtia hercegovinensis,630,42.743.509,18.027.359,Tb,deep cave,,15,,"13,378","14,54366684","14,54366684","24,62399864",1130,29,"87,19003096",,,2,3,1,2439,2204,220
1788,Jama pod Vošcem,Croatia,15.7.2008.,2008-07-15,1 juv,1,Dysderidae,Harpactea,sp.,Harpactea sp.,1280,43.309.566,17.046.435,,,,1,,"7,15","7,993500233","7,993500233","24,5",945,28,"68,07477846","97,4",,2,2,1,35,22,7
1789,Medvjeđa špilja,Croatia,25.5.2008.,2008-05-25,"1m, 1f",2,Dysderidae,Parastalita,stygia,Parastalita stygia,758,45.363.572,14.757.905,Tb,deep cave,,3,,"10,95","7,299499989","7,299499989","26,94799995",1530,25,"411,6907421",,,nan,nan,1,nan,nan,nan
1790,Pustinja,Croatia,7.6.2008.,2008-06-07,1 juv,1,Dysderidae,Parastalita,stygia,Parastalita stygia,882,45.372.172,14.808.873,Tb,deep cave,,3,,"5,75","6,758500099","6,758500099","26,70800018",1573,24,"408,3737808",,,2,1,1,172,154,23
1797,Špilja pod Kapelu,Croatia,15.3.2011.,2011-03-15,"2juv m, 2 juv",4,Agelenidae,Hadites,tegenarioides,Hadites tegenarioides,102,43.184.949,16.434.233,TB,deep cave,,5,,"12,717","16,20546913","16,20546913","23,36250114",714,21,"135,8656791","97,5",,nan,nan,1,nan,nan,nan
1798,Špilja pod Kapelu,Croatia,15.3.2011.,2011-03-15,2 juv,2,Agelenidae,Tegenaria,sp.,Tegenaria sp.,102,43.184.949,16.434.233,,deep cave,,5,,"12,717","16,20546913","16,20546913","23,36250114",714,21,"135,8656791","97,5",,nan,nan,1,nan,nan,nan
1803,Bundalova pećina,Croatia,3.5.2010.,2010-05-03,"1f, 1 juv",2,Agelenidae,Histopona,egonpretneri,Histopona egonpretneri,204,44.195.721,15.855.588,Tb,deep cave,,4,,"10,4","12,68216705","12,68216705","28,51600075",964,26,"206,1502601",,,,,,,,
1804,Špilja uz cestu,Croatia,1.5.2010.,2010-05-01,"1m, 1f",2,Nesticidae,Kryptonesticus,eremita,Kryptonesticus eremita,289,44.093.064,16.082.069,tf,deep cave,,1,,"12,6","12,08616638","12,08616638","27,79999924",968,21,"176,5099989",,,3.5,5,1,14.9,13.8,3.5
1805,Bundalova pećina,Croatia,3.5.2010.,2010-05-03,5 juv,5,Agelenidae,Histopona,sp.,Histopona sp.,204,44.195.721,15.855.588,,deep cave,,4,,"10,4","12,68216705","12,68216705","28,51600075",964,26,"206,1502601",,,,,,,,
1806,Bundalova pećina,Croatia,3.5.2010.,2010-05-03,1 juv,1,Leptonetidae,Cataleptoneta,lingulata,Cataleptoneta lingulata,204,44.195.721,15.855.588,tb,deep cave,,4,,"10,4","12,68216705","12,68216705","28,51600075",964,26,"206,1502601",,,,,,,,
1807,Bundalova pećina,Croatia,3.5.2010.,2010-05-03,1 juv,1,Agelenidae,Histopona,sp.,Histopona sp.,204,44.195.721,15.855.588,,deep cave,,4,,"10,4","12,68216705","12,68216705","28,51600075",964,26,"206,1502601",,,,,,,,
1808,Špilja uz cestu,Croatia,1.5.2010.,2010-05-01,1f,1,Nesticidae,Kryptonesticus,eremita,Kryptonesticus eremita,289,44.093.064,16.082.069,tf,deep cave,,1,,"12,6","12,08616638","12,08616638","27,79999924",968,21,"176,5099989",,,3.5,5,1,14.9,13.8,3.5
1813,Milića špilja,Croatia,5.5.2010.,2010-05-05,1 juv,1,Nesticidae,Kryptonesticus,eremita,Kryptonesticus eremita,224,44.143.333,15.803.133,tf,deep cave,,1,,"12,6","12,67350006","12,67350006","28,27199936",949,29,"207,9910669",,,nan,nan,1,nan,nan,nan
1818,Jama pod Osojem,Croatia,22.6.2003.,2003-06-22,1 juv f,1,Linyphiidae,Palliduphantes,sp.,Palliduphantes sp.,867,43.251.441,17.118.374,,,,3,7,7,"9,67800045","9,67800045","24,96000099",926,23,"68,56980378","97,1","97,1",nan,nan,1,nan,nan,nan
1823,Maksimova špilja,Croatia,22.4.2006.,2006-04-22,"3f, 3 juv",6,Linyphiidae,Diplocephalus,cristatus,Diplocephalus cristatus,520,45.518.313,1.768.695,Tx,deep cave,,3,"10,8","10,45","9,106999397","9,106999397","27,62399864",882,23,"289,1307512",,,1,5,1,nan,18.2,0
1825,Jelenova špilja,Croatia,21.4.2006.,2006-04-21,1f,1,Linyphiidae,Centromerus,sellarius,Centromerus sellarius,603,45.517.695,17.668.982,tf,deep cave,,2,,"9,75","9,106999397","9,106999397","27,62399864",882,23,"289,0187524",,,0.5,0.5,1,nan,5.5,5
1831,Antina špilja,Croatia,17.7.2004.,2004-07-17,1m,1,Agelenidae,Histopona,luxurians,Histopona luxurians,570,45.497.475,17.856.553,tf,deep cave,,2,,"13,2","8,909166336","8,909166336","27,79999924",855,23,"285,9960742","96,9",,2,1.5,1,nan,24,1.7
1836,Maksimova špilja,Croatia,8.6.2007.,2007-06-08,1f,1,Linyphiidae,Porrhomma,egeria,Porrhomma egeria,520,45.518.313,1.768.695,Tf,deep cave,,3,"10,8","10,45","9,106999397","9,106999397","27,62399864",882,23,"289,1307512",,,1,5,1,nan,18.2,0
1839,Jelenova špilja,Croatia,21.4.2006.,2006-04-21,1f,1,Linyphiidae,Porrhomma,microps,Porrhomma microps,603,45.517.695,17.668.982,Tf,deep cave,,2,,"9,75","9,106999397","9,106999397","27,62399864",882,23,"289,0187524",,,0.5,0.5,1,nan,5.5,5
1846,Kovačica jama,Croatia,2.10.2006.,2006-10-02,1m,1,Linyphiidae,Porrhomma,convexum,Porrhomma convexum,676,45.519.178,1.765.444,Tf,deep cave,,4,,"9,3","8,596333504","8,596333504","27,29999924",916,23,"289,2533106",,,,,,,,
1852,Špilja u kamenolomu Tounj,Croatia,2.4.2011.,2011-04-02,"2f, 1 juv",3,Linyphiidae,Troglohyphantes,croaticus,Troglohyphantes croaticus,306,45.245.525,15.318.946,Tb,deep cave,,3,,"9,54","10,14599991","10,14599991","28,85200119",1306,7,"353,6071019","94,233",,1,0.6,1,8639,8487,47
1853,Špilja u kamenolomu Tounj,Croatia,2.4.2011.,2011-04-02,"1f, 1 juv m",2,Linyphiidae,Porrhomma,egeria,Porrhomma egeria,306,45.245.525,15.318.946,Tf,deep cave,,3,,"9,54","10,14599991","10,14599991","28,85200119",1306,7,"353,6071019","94,233",,1,0.6,1,8639,8487,47
1857,Jama za Mahrincem,Croatia,12.3.2011.,2011-03-12,1m,1,Nesticidae,Kryptonesticus,eremita,Kryptonesticus eremita,45,43.344.348,1.674.088,tf,deep cave,,2,,"9,9","15,69453144","15,69453144","25,78749847",804,2,"94,5530675",,,3.5,2.5,1,nan,26,25
1858,Jama kod Matešića stana,Croatia,14.3.2011.,2011-03-14,1f,1,Nesticidae,Kryptonesticus,eremita,Kryptonesticus eremita,383,43.305.943,1.675.112,tf,deep cave,,2,,"13,35","14,60616684","14,60616684","25,51200104",813,29,"96,0390213",,,nan,nan,1,nan,nan,nan
1859,Bazgovača,Croatia,13.3.2011.,2011-03-13,1m,1,Tetragnathidae,Metellina,merianae,Metellina merianae,652,4.330.647,16.622.143,Tf,deep cave,,3,,"7,2","12,8081665","12,8081665","24,57600021",796,24,"108,9858223",,,5,7,1,nan,47,32
1860,Jama za Mahrincem,Croatia,12.3.2011.,2011-03-12,1f,1,Agelenidae,Tegenaria,bosnica,Tegenaria bosnica,45,43.344.348,1.674.088,,deep cave,,2,,"9,9","15,69453144","15,69453144","25,78749847",804,2,"94,5530675",,,3.5,2.5,1,nan,26,25
1861,Rudnik Minjera,Croatia,13.3.2011.,2011-03-13,1f,1,Nesticidae,Kryptonesticus,eremita,Kryptonesticus eremita,197,43.361.342,1.660.633,tf,deep cave,,2,,"12,65","15,05266666","15,05266666","25,05999947",793,17,"107,4931529","95,85",,,,,,,
1863,Rudnik Minjera,Croatia,13.3.2011.,2011-03-13,1f,1,Nesticidae,Kryptonesticus,eremita,Kryptonesticus eremita,197,43.361.342,1.660.633,tf,deep cave,,2,,"12,65","15,05266666","15,05266666","25,05999947",793,17,"107,4931529","95,85",,,,,,,
1866,Ješkalovica,Croatia,12.3.2011.,2011-03-12,1m,1,Nesticidae,Kryptonesticus,eremita,Kryptonesticus eremita,194,43.299.857,16.839.313,tf,deep cave,,2,,"15,4","15,64131927","15,64131927","25,73750114",817,20,"87,88201212","95,1",,1,1,1,nan,21,29
1867,Bazgovača,Croatia,13.3.2011.,2011-03-13,1m,1,Linyphiidae,Palliduphantes,spelaeorum,Palliduphantes spelaeorum,652,4.330.647,16.622.143,Tf,deep cave,,3,,"7,2","12,8081665","12,8081665","24,57600021",796,24,"108,9858223",,,5,7,1,nan,47,32
1868,Bazgovača,Croatia,13.3.2011.,2011-03-13,1m,1,Linyphiidae,Palliduphantes,spelaeorum,Palliduphantes spelaeorum,652,4.330.647,16.622.143,Tf,deep cave,,3,,"7,2","12,8081665","12,8081665","24,57600021",796,24,"108,9858223",,,5,7,1,nan,47,32
1869,Jama kod Matešića stana,Croatia,14.3.2011.,2011-03-14,"1m, 5 f",6,Linyphiidae,Palliduphantes,spelaeorum,Palliduphantes spelaeorum,383,43.305.943,1.675.112,Tf,deep cave,,2,,"13,35","14,60616684","14,60616684","25,51200104",813,29,"96,0390213",,,nan,nan,1,nan,nan,nan
1870,Bazgovača,Croatia,13.3.2011.,2011-03-13,1m,1,Linyphiidae,Palliduphantes,spelaeorum,Palliduphantes spelaeorum,652,4.330.647,16.622.143,Tf,deep cave,,3,,"7,2","12,8081665","12,8081665","24,57600021",796,24,"108,9858223",,,5,7,1,nan,47,32
1871,Jama kod Matešića stana,Croatia,13.3.2011.,2011-03-13,1f,1,Linyphiidae,Palliduphantes,spelaeorum,Palliduphantes spelaeorum,383,43.305.943,1.675.112,Tf,deep cave,,2,,"13,35","14,60616684","14,60616684","25,51200104",813,29,"96,0390213",,,nan,nan,1,nan,nan,nan
1876,Škabac,Croatia,17.4.2011.,2011-04-17,"1m, 1 juv",2,Theridiidae,Episinus,cavernicola,Episinus cavernicola,241,45.259.902,14.606.487,Tf,deep cave,,10,,12,"12,13366699","12,13366699","25,75999832",1398,28,"397,3459592",82,,nan,nan,1,nan,nan,nan
1877,Škabac,Croatia,17.4.2011.,2011-04-17,"1f, 96%",1,Tetragnathidae,Metellina,merianae,Metellina merianae,241,45.259.902,14.606.487,Tf,deep cave,,10,,12,"12,13366699","12,13366699","25,75999832",1398,28,"397,3459592",82,,nan,nan,1,nan,nan,nan
1879,Čepić tunel,Croatia,16.4.2011.,2011-04-16,1f,1,Agelenidae,Tegenaria,silvestris,Tegenaria silvestris,88,451.639,14.161.311,Tf,deep cave,,1,,13,"13,5284996","13,5284996","25,1439991",1071,29,"366,4183858",,,nan,nan,1,nan,nan,nan
1881,Vela špilja u Krugu,Croatia,17.4.2011.,2011-04-17,2f,2,Agelenidae,Tegenaria,silvestris,Tegenaria silvestris,591,45.447.191,14.423.879,Tf,deep cave,,2,,"10,4","9,178833008","9,178833008","26,49600029",1506,23,"417,9768284",,,1,0.8,1,nan,77,36
1882,Vela špilja u Krugu,Croatia,17.4.2011.,2011-04-17,1m,1,Dysderidae,Parastalita,stygia,Parastalita stygia,591,45.447.191,14.423.879,Tb,deep cave,,2,,"10,4","9,178833008","9,178833008","26,49600029",1506,23,"417,9768284",,,1,0.8,1,nan,77,36
1883,Škabac,Croatia,17.4.2011.,2011-04-17,"1m, 1f",2,Nesticidae,Kryptonesticus,eremita,Kryptonesticus eremita,241,45.259.902,14.606.487,tf,deep cave,,10,,12,"12,13366699","12,13366699","25,75999832",1398,28,"397,3459592",82,,nan,nan,1,nan,nan,nan
1885,Škabac,Croatia,17.4.2011.,2011-04-17,2 juv,2,Agelenidae,Histopona,egonpretneri,Histopona egonpretneri,241,45.259.902,14.606.487,Tb,deep cave,,10,,12,"12,13366699","12,13366699","25,75999832",1398,28,"397,3459592",82,,nan,nan,1,nan,nan,nan
1886,Škabac,Croatia,17.4.2011.,2011-04-17,1f,1,Linyphiidae,Centromerus,sellarius,Centromerus sellarius,241,45.259.902,14.606.487,tf,cave entrance,,10,,12,"12,13366699","12,13366699","25,75999832",1398,28,"397,3459592",82,,nan,nan,1,nan,nan,nan
1887,Škabac,Croatia,17.4.2011.,2011-04-17,3 f,3,Leptonetidae,Cataleptoneta,lingulata,Cataleptoneta lingulata,241,45.259.902,14.606.487,tb,deep cave,,10,,12,"12,13366699","12,13366699","25,75999832",1398,28,"397,3459592",82,,nan,nan,1,nan,nan,nan
1890,Bezdanka,Croatia,7.7.2009.,2009-07-07,2 f,2,Dysderidae,Parastalita,stygia,Parastalita stygia,586,44.227.473,15.852.219,Tb,deep cave,,2,,"14,367","9,772166252","9,772166252","27,11600113",1105,28,"208,7260183","94,633",,nan,nan,1,nan,nan,nan
1894,Bezdanka,Croatia,28.9.2010.,2010-09-28,"2f, 1juv",3,Linyphiidae,Troglohyphantes,roberti,Troglohyphantes roberti,586,44.227.473,15.852.219,tb,deep cave,,2,,"14,367","9,772166252","9,772166252","27,11600113",1105,28,"208,7260183","94,633",,nan,nan,1,nan,nan,nan
1906,Čude špilja,Croatia,2.5.2010.,2010-05-02,1f,1,Theridiidae,Episinus,cavernicola,Episinus cavernicola,70,44.212.351,15.741.592,Tf,deep cave,,2,,"13,4","11,30550003","11,30550003","28,15200043",1034,18,"218,6874679",,,,,,,,
1908,Bundalova pećina,Croatia,3.5.2010.,2010-05-03,"1f, 1 juv",2,Linyphiidae,Asthenargus,bracianus,Asthenargus bracianus,204,44.195.721,15.855.588,tf,deep cave,,4,,"10,4","12,68216705","12,68216705","28,51600075",964,26,"206,1502601",,,,,,,,
1912,Jama iznad Saranača,Croatia,25.5.2004.,2004-05-25,1m,1,Nemesiidae,Nemesia,sp. 1,Nemesia sp. 1,777,43.249.007,17.174.663,,,,7,"10,8","11,112","11,73516655","11,73516655","25,61599922",905,28,"64,87446036",,,2.5,0.5,1,nan,8.6,20.5
1914,Pružina špilja,Croatia,15.10.2002.,2002-10-15,"1f, 1 juv",2,Dysderidae,Stalagtia,sp. 4,Stalagtia sp. 4,501,43.394.238,17.058.713,Tb,deep cave,,4,,"11,9","11,93233299","11,93233299","26,88800049",923,21,"59,50526807","99,9",,nan,nan,1,nan,nan,nan
1917,Velika peć,Croatia,18.10.2002.,2002-10-18,"2 juv m, 1 juv",3,Agelenidae,Histopona,sp.,Histopona sp.,403,43.417.013,17.007.608,,deep cave,,3,,"8,4","12,26799965","12,26799965","27,10400009",920,23,"62,91132056",,,8,15,1,nan,69,12
1918,Velika peć,Croatia,18.10.2002.,2002-10-18,"2f, 1 juv",3,Leptonetidae,Barusia,maheni,Barusia maheni,403,43.417.013,17.007.608,tf,deep cave,,3,,"8,4","12,26799965","12,26799965","27,10400009",920,23,"62,91132056",,,8,15,1,nan,69,12
1919,Pružina špilja,Croatia,15.10.2002.,2002-10-15,1f,1,Agelenidae,Histopona,conveniens,Histopona conveniens,501,43.394.238,17.058.713,Tf,deep cave,,4,,"11,9","11,93233299","11,93233299","26,88800049",923,21,"59,50526807","99,9",,nan,nan,1,nan,nan,nan
1920,Špilja u Gaju,Croatia,18.10.2002.,2002-10-18,1f,1,Agelenidae,Histopona,conveniens,Histopona conveniens,706,43.382.476,17.040.666,Tf,deep cave,,7,"10,6","10,825","12,27216721","12,27216721","26,62000084",912,23,"62,15311347",99,99,nan,nan,1,nan,nan,nan
1921,Špilja u Gaju,Croatia,18.10.2002.,2002-10-18,1f,1,Tetragnathidae,Metellina,merianae,Metellina merianae,706,43.382.476,17.040.666,Tf,deep cave,,7,"10,6","10,825","12,27216721","12,27216721","26,62000084",912,23,"62,15311347",99,99,nan,nan,1,nan,nan,nan
1922,Špilja u Gaju,Croatia,18.10.2002.,2002-10-18,1f,1,Agelenidae,Tegenaria,annulata,Tegenaria annulata,706,43.382.476,17.040.666,tf,deep cave,,7,"10,6","10,825","12,27216721","12,27216721","26,62000084",912,23,"62,15311347",99,99,nan,nan,1,nan,nan,nan
1923,Jujnovića špilja,Croatia,14.10.2002.,2002-10-14,4f,4,Agelenidae,Histopona,conveniens,Histopona conveniens,463,43.266.579,1.719.798,Tf,deep cave,,6,"13,8","10,85","12,35200024","12,35200024","26,52000046",917,29,"61,15708825",,,5,2.5,1,108,40,16
1924,Jujnovića špilja,Croatia,14.10.2002.,2002-10-14,1f,1,Agelenidae,Tegenaria,sp. 2,Tegenaria sp. 2,463,43.266.579,1.719.798,,deep cave,,6,"13,8","10,85","12,35200024","12,35200024","26,52000046",917,29,"61,15708825",,,5,2.5,1,108,40,16
1925,Jujnovića špilja,Croatia,14.10.2002.,2002-10-14,"1f, 1 juv m",2,Dysderidae,Harpactea,damini,Harpactea damini,463,43.266.579,1.719.798,TF,deep cave,,6,"13,8","10,85","12,35200024","12,35200024","26,52000046",917,29,"61,15708825",,,5,2.5,1,108,40,16
1926,Pružina špilja,Croatia,15.10.2002.,2002-10-15,2m,2,Pholcidae,Stygopholcus,absoloni,Stygopholcus absoloni,501,43.394.238,17.058.713,,deep cave,,4,,"11,9","11,93233299","11,93233299","26,88800049",923,21,"59,50526807","99,9",,nan,nan,1,nan,nan,nan
1927,Jujnovića špilja,Croatia,14.10.2002.,2002-10-14,3f,3,Pholcidae,Stygopholcus,absoloni,Stygopholcus absoloni,463,43.266.579,1.719.798,,deep cave,,6,"13,8","10,85","12,35200024","12,35200024","26,52000046",917,29,"61,15708825",,,5,2.5,1,108,40,16
1928,Velika peć,Croatia,18.10.2002.,2002-10-18,"1m, 1 juv",2,Pholcidae,Stygopholcus,absoloni,Stygopholcus absoloni,403,43.417.013,17.007.608,,deep cave,,3,,"8,4","12,26799965","12,26799965","27,10400009",920,23,"62,91132056",,,8,15,1,nan,69,12
1935,Oplemenjena špilja,Croatia,20.6.2003.,2003-06-20,1 juv,1,Dysderidae,Harpactea,sp.,Harpactea sp.,998,43.369.119,17.025.884,,,,1,7,7,"7,902999878","7,902999878","24,58800125",950,25,"64,62358923",,,,,,,,
1936,Jama iznad Saranača,Croatia,25.3.2003.,2003-03-25,1 f,1,Dysderidae,Stalagtia,sp. 4,Stalagtia sp. 4,777,43.249.007,17.174.663,Tb,deep cave,,7,"10,8","11,112","11,73516655","11,73516655","25,61599922",905,28,"64,87446036",,,2.5,0.5,1,nan,8.6,20.5
1937,Spila 2,Croatia,23.3.2004.,2004-03-23,"1f?, 1 juv",2,Dysderidae,Stalagtia,sp. 4,Stalagtia sp. 4,349,4.326.239,17.204.021,Tb,deep cave,,6,12,12,"12,35200024","12,35200024","26,52000046",917,21,"61,25054739","96,3","96,3",0.5,0.7,1,28,24,11
1938,Mala jama u stijenama,Croatia,20.3.2003.,2003-03-20,1 juv,1,Dysderidae,Harpactea,sp.,Harpactea sp.,1221,43.365.579,17.027.668,,,,3,"9,3","9,3","7,902999878","7,902999878","24,58800125",950,29,"64,74299334",93,93,nan,nan,1,nan,nan,nan
1940,Velika špilja kod Antunovića,Croatia,23.3.2004.,2004-03-23,1 juv,1,Dysderidae,Stalagtia,sp. 4,Stalagtia sp. 4,944,43.276.843,17.227.143,Tb,deep cave,,1,"11,9","12,1","11,41149998","11,41149998","26,41199875",935,28,"57,93624128",,,30,6,1,265,253,14
1942,Tučepska vilenjača,Croatia,23.5.2004.,2004-05-23,1 juvm,1,Dysderidae,Stalagtia,sp. 4,Stalagtia sp. 4,1242,43.286.465,17.083.638,Tb,deep cave,,8,"10,6","10,731","9,67800045","9,67800045","24,96000099",926,26,"67,32747088",,,6,0.8,1,nan,28,35
1946,Mala špilja pod Spilom,Croatia,5.12.2009.,2009-12-05,2 juv,2,Dysderidae,Stalagtia,sp. 4,Stalagtia sp. 4,349,43.262.462,17.200.927,Tb,deep cave,,2,,11,"12,35200024","12,35200024","26,52000046",917,21,"61,45159013",,,,,,,,
1950,Jama na Kačkoj glavici 3,Croatia,18.6.2003.,2003-06-18,1 juv,1,Dysderidae,Harpactea,sp.,Harpactea sp.,998,43.368.677,17.032.184,,,,1,5,"4,75","7,902999878","7,902999878","24,58800125",950,25,"64,06469174",,,nan,nan,1,nan,nan,nan
1954,Kukor,Croatia,26.4.2002.,2002-04-26,1m,1,Dysderidae,Harpactea,damini,Harpactea damini,587,43.355.609,16.991.707,TF,deep cave,,10,,"15,4","12,63749981","12,63749981","25,40833473",906,29,"68,94753675",,,1,1,1,264,213,40
1955,Spila 2,Croatia,26.3.2003.,2003-03-26,1 juv,1,Dysderidae,Stalagtia,sp. 4,Stalagtia sp. 4,349,4.326.239,17.204.021,Tb,deep cave,,6,12,12,"12,35200024","12,35200024","26,52000046",917,21,"61,25054739","96,3","96,3",0.5,0.7,1,28,24,11
1956,Gradska spila,Croatia,19.11.2005.,2005-11-19,1f,1,Dysderidae,Harpactea,damini,Harpactea damini,621,43.318.029,17.117.623,TF,deep cave,,4,,"6,6","9,092166901","9,092166901",25,931,23,"61,25913011","93,333",,5,2.5,1,nan,26.5,1.8
1957,Kukor,Croatia,17.8.2000.,2000-08-17,"2/3f, 1/2juv",3,Dysderidae,Harpactea,sp. 34,Harpactea sp. 34,587,43.355.609,16.991.707,,,,10,,"15,4","12,63749981","12,63749981","25,40833473",906,29,"68,94753675",,,1,1,1,264,213,40
1958,Kukor,Croatia,28.7.2006.,2006-07-28,1 juv,1,Dysderidae,Harpactea,sp.,Harpactea sp.,587,43.355.609,16.991.707,,,,10,,"15,4","12,63749981","12,63749981","25,40833473",906,29,"68,94753675",,,1,1,1,264,213,40
1959,Kukor,Croatia,26.8.1998.,1998-08-26,"1juvm, 2 juv",3,Dysderidae,Harpactea,sp.,Harpactea sp.,587,43.355.609,16.991.707,,,,10,,"15,4","12,63749981","12,63749981","25,40833473",906,29,"68,94753675",,,1,1,1,264,213,40
1961,Velika špilja kod Antunovića,Croatia,29.11.2009.,2009-11-29,2 juv,2,Dysderidae,Stalagtia,sp. 4,Stalagtia sp. 4,944,43.276.843,17.227.143,Tb,deep cave,,1,"11,9","12,1","11,41149998","11,41149998","26,41199875",935,28,"57,93624128",,,30,6,1,265,253,14
1963,Jama iznad Prozorčića,Croatia,24.3.2004.,2004-03-24,1 f,1,Dysderidae,Stalagtia,sp. 4,Stalagtia sp. 4,460,4.338.381,16.932.036,Tb,deep cave,,5,"12,5","8,9","12,02766705","12,02766705","24,98400116",895,24,"72,69547752",,,4,1.5,1,28.6,15,23.5
1964,Obilježena jama,Croatia,20.6.2003.,2003-06-20,1 juv,1,Dysderidae,Harpactea,sp.,Harpactea sp.,998,4.336.813,17.026.024,,,,2,"2,5","2,5","7,902999878","7,902999878","24,58800125",950,23,"64,69031173",,,,,,,,
1965,Bubnjavača špilja,Croatia,27.10.2006.,2006-10-27,1f,1,Dysderidae,Harpactea,damini,Harpactea damini,256,4.332.252,17.009.954,TF,deep cave,,2,"16,8","16,5","12,74867439","12,74867439","25,54545403",898,29,"70,07800845",,,,,,,,
1966,Kukor,Croatia,23.9.1999.,1999-09-23,2 juv,2,Dysderidae,Harpactea,sp.,Harpactea sp.,587,43.355.609,16.991.707,,,,10,,"15,4","12,63749981","12,63749981","25,40833473",906,29,"68,94753675",,,1,1,1,264,213,40
1968,Kukor,Croatia,27.7.2004.,2004-07-27,2 juv,2,Dysderidae,Harpactea,sp.,Harpactea sp.,587,43.355.609,16.991.707,,,,10,,"15,4","12,63749981","12,63749981","25,40833473",906,29,"68,94753675",,,1,1,1,264,213,40
1973,Samogorska špilja,Croatia,25.5.2004.,2004-05-25,1f,1,Dysderidae,Harpactea,damini,Harpactea damini,621,43.318.227,17.121.122,TF,deep cave,,6,"7,1","9,033","9,092166901","9,092166901",25,931,23,"60,95464736",99,,2,3,1,nan,19,3.5
1974,Jama na putu za Staru školu,Croatia,27.6.2002.,2002-06-27,1 juv,1,Agelenidae,Histopona,sp.,Histopona sp.,1519,43.337.777,17.043.231,,deep cave,,1,8,8,"8,441666603","8,441666603","24,99200058",947,29,"65,70935768",90,90,2,2,1,26,4,22
1976,Krjava 2,Croatia,24.3.2004.,2004-03-24,1 f,1,Dysderidae,Mesostalita,comottii,Mesostalita comottii,1061,43.329.431,17.027.011,Tb,deep cave,,3,,"7,425","12,74867439","12,74867439","25,54545403",898,26,"67,92076497","97,5",,nan,nan,1,nan,nan,nan
1980,Velika špilja kod Antunovića,Croatia,29.11.2009.,2009-11-29,1 juv,1,Dysderidae,Stalagtia,sp. 4,Stalagtia sp. 4,944,43.276.843,17.227.143,Tb,deep cave,,1,"11,9","12,1","11,41149998","11,41149998","26,41199875",935,28,"57,93624128",,,30,6,1,265,253,14
1981,Samogorska špilja,Croatia,25.5.2005.,2005-05-25,2 juv,2,Dysderidae,Harpactea,sp.,Harpactea sp.,621,43.318.227,17.121.122,,,,6,"7,1","9,033","9,092166901","9,092166901",25,931,23,"60,95464736",99,,2,3,1,nan,19,3.5
1982,Pozjata špilja,Croatia,26.10.2003.,2003-10-26,1 f,1,Dysderidae,Harpactea,sp. 34,Harpactea sp. 34,1394,43.387.837,16.963.748,,,,3,,"7,85","10,82800007","10,82800007","25,23999977",919,28,"69,25839521",99,,,,,,,
1983,Mucića ledenica,Croatia,24.5.2004.,2004-05-24,1 juv,1,Dysderidae,Harpactea,sp.,Harpactea sp.,1344,4.335.632,17.051.544,,,,3,"0,8","0,8","8,441666603","8,441666603","24,99200058",947,23,"63,30845715",,,5,4,1,nan,60,37.5
1985,Jama iznad Prozorčića,Croatia,26.10.2006.,2006-10-26,1 juv,1,Dysderidae,Stalagtia,sp. 4,Stalagtia sp. 4,460,4.338.381,16.932.036,Tb,deep cave,,5,"12,5","8,9","12,02766705","12,02766705","24,98400116",895,24,"72,69547752",,,4,1.5,1,28.6,15,23.5
1986,Kukor,Croatia,25.3.2004.,2004-03-25,1 juv,1,Dysderidae,Harpactea,sp.,Harpactea sp.,587,43.355.609,16.991.707,,,,10,,"15,4","12,63749981","12,63749981","25,40833473",906,29,"68,94753675",,,1,1,1,264,213,40
1987,Kukor,Croatia,29.12.1997.,1997-12-29,1 juv,1,Dysderidae,Harpactea,sp.,Harpactea sp.,587,43.355.609,16.991.707,,,,10,,"15,4","12,63749981","12,63749981","25,40833473",906,29,"68,94753675",,,1,1,1,264,213,40
1993,Špilja u Gaju,Croatia,18.10.2002.,2002-10-18,"5f, 1m",6,Pholcidae,Stygopholcus,absoloni,Stygopholcus absoloni,706,43.382.476,17.040.666,,deep cave,,7,"10,6","10,825","12,27216721","12,27216721","26,62000084",912,23,"62,15311347",99,99,nan,nan,1,nan,nan,nan
1995,Jama iznad Prozorčića,Croatia,24.3.2004.,2004-03-24,1 m,1,Pholcidae,Stygopholcus,absoloni,Stygopholcus absoloni,460,4.338.381,16.932.036,,deep cave,,5,"12,5","8,9","12,02766705","12,02766705","24,98400116",895,24,"72,69547752",,,4,1.5,1,28.6,15,23.5
1996,Jama u Čikešima,Croatia,23.11.2005.,2005-11-23,1 m,1,Pholcidae,Stygopholcus,absoloni,Stygopholcus absoloni,250,43.416.092,16.967.015,,deep cave,,1,,"12,4","10,82800007","10,82800007","25,23999977",919,21,"67,08605568",,,,,,,,
1998,Jama iznad Saranača,Croatia,25.3.2003.,2003-03-25,1 f,1,Pholcidae,Stygopholcus,absoloni,Stygopholcus absoloni,777,43.249.007,17.174.663,,deep cave,,7,"10,8","11,112","11,73516655","11,73516655","25,61599922",905,28,"64,87446036",,,2.5,0.5,1,nan,8.6,20.5
1999,Jujnovića špilja,Croatia,27.4.2002.,2002-04-27,"1m, 1 juv",2,Pholcidae,Stygopholcus,absoloni,Stygopholcus absoloni,463,43.266.579,1.719.798,,deep cave,,6,"13,8","10,85","12,35200024","12,35200024","26,52000046",917,29,"61,15708825",,,5,2.5,1,108,40,16
2000,Brikinjava špilja,Croatia,17.11.2005.,2005-11-17,"1f, 1 juv",2,Pholcidae,Stygopholcus,absoloni,Stygopholcus absoloni,742,43.345.181,17.096.904,,deep cave,,3,,"5,533","11,25733376","11,25733376","26,1079998",928,23,"60,27800105",94,,6,2,1,nan,16,2.4
2005,Raputinova špilja,Croatia,24.11.2005.,2005-11-24,1 m,1,Pholcidae,Stygopholcus,absoloni,Stygopholcus absoloni,369,4.338.645,17.019.868,,deep cave,,1,,"4,15","12,27216721","12,27216721","26,62000084",912,4,"63,84704162",98,,nan,nan,1,nan,nan,nan
2006,Jujnovića špilja,Croatia,14.10.2002.,2002-10-14,1 f,1,Pholcidae,Stygopholcus,absoloni,Stygopholcus absoloni,463,43.266.579,1.719.798,,deep cave,,6,"13,8","10,85","12,35200024","12,35200024","26,52000046",917,29,"61,15708825",,,5,2.5,1,108,40,16
2007,Mala špilja na Bukovcima,Croatia,21.11.2005.,2005-11-21,"2m, 1 f",3,Pholcidae,Stygopholcus,absoloni,Stygopholcus absoloni,467,43.403.677,17.021.702,,deep cave,,1,,"7,95","12,27216721","12,27216721","26,62000084",912,23,"62,40979119",,,nan,nan,1,nan,nan,nan
2009,Špilja u Radinovcima,Croatia,25.10.2006.,2006-10-25,1 f,1,Pholcidae,Stygopholcus,absoloni,Stygopholcus absoloni,416,43.387.285,170.103,,deep cave,,4,,"8,525","12,27216721","12,27216721","26,62000084",912,23,"64,7145817",93,,7,4,1,nan,50,14
2027,Špilja u Gaju,Croatia,18.10.2002.,2002-10-18,1m,1,Linyphiidae,Typhlonyphia,sp. 1,Typhlonyphia sp. 1,706,43.382.476,17.040.666,Tb,deep cave,,7,"10,6","10,825","12,27216721","12,27216721","26,62000084",912,23,"62,15311347",99,99,nan,nan,1,nan,nan,nan
2029,Jujnovića špilja,Croatia,14.10.2002.,2002-10-14,"1m, 1f",2,Linyphiidae,Typhlonyphia,sp. 1,Typhlonyphia sp. 1,463,43.266.579,1.719.798,Tb,deep cave,,6,"13,8","10,85","12,35200024","12,35200024","26,52000046",917,29,"61,15708825",,,5,2.5,1,108,40,16
2030,Špilja u Gaju,Croatia,18.10.2002.,2002-10-18,"1f, 1 juv",2,Linyphiidae,Typhlonyphia,sp. 1,Typhlonyphia sp. 1,706,43.382.476,17.040.666,Tb,deep cave,,7,"10,6","10,825","12,27216721","12,27216721","26,62000084",912,23,"62,15311347",99,99,nan,nan,1,nan,nan,nan
2032,Pružina špilja,Croatia,15.10.2002.,2002-10-15,1f,1,Linyphiidae,Typhlonyphia,sp. 1,Typhlonyphia sp. 1,501,43.394.238,17.058.713,Tb,deep cave,,4,,"11,9","11,93233299","11,93233299","26,88800049",923,21,"59,50526807","99,9",,nan,nan,1,nan,nan,nan
2033,Špilja u Gaju,Croatia,18.10.2002.,2002-10-18,"2f, 2 juv",4,Linyphiidae,Typhlonyphia,sp. 1,Typhlonyphia sp. 1,706,43.382.476,17.040.666,Tb,deep cave,,7,"10,6","10,825","12,27216721","12,27216721","26,62000084",912,23,"62,15311347",99,99,nan,nan,1,nan,nan,nan
2034,Jama na grebenu,Croatia,17.10.2002.,2002-10-17,"  2f, 1 juv m, 1 juv",4,Linyphiidae,Typhlonyphia,sp. 1,Typhlonyphia sp. 1,1108,4.325.927,17.147.834,Tb,deep cave,,3,"10,8","10,8","9,285666466","9,285666466","25,12000084",925,23,"65,54939122","98,6","98,6",nan,nan,1,nan,nan,nan
2036,Špilja na Mrždolcu,Croatia,5.4.2006.,2006-04-05,"1f, 1 juv",2,Linyphiidae,Typhlonyphia,sp. 1,Typhlonyphia sp. 1,419,43.405.319,17.014.811,Tb,deep cave,,3,,"7,5","12,27216721","12,27216721","26,62000084",912,23,"62,97721711",,,nan,nan,1,nan,nan,nan
2037,Bošak jama,Croatia,4.4.2006.,2006-04-04,1f,1,Linyphiidae,Typhlonyphia,sp. 1,Typhlonyphia sp. 1,721,43.347.996,17.100.045,Tb,deep cave,,2,,"7,4","11,25733376","11,25733376","26,1079998",928,23,"59,73571895",100,,1.1,1.7,1,nan,11,17
2038,Bošak jama,Croatia,4.4.2006.,2006-04-04,1 f,1,Linyphiidae,Typhlonyphia,sp. 1,Typhlonyphia sp. 1,721,43.347.996,17.100.045,Tb,deep cave,,2,,"7,4","11,25733376","11,25733376","26,1079998",928,23,"59,73571895",100,,1.1,1.7,1,nan,11,17
2039,Bošak jama,Croatia,17.11.2005.,2005-11-17,1f,1,Linyphiidae,Typhlonyphia,sp. 1,Typhlonyphia sp. 1,721,43.347.996,17.100.045,Tb,deep cave,,2,,"7,4","11,25733376","11,25733376","26,1079998",928,23,"59,73571895",100,,1.1,1.7,1,nan,11,17
2040,Jama za Supinom,Croatia,18.11.2005.,2005-11-18,1m,1,Linyphiidae,Typhlonyphia,sp. 1,Typhlonyphia sp. 1,905,43.250.417,17.113.278,Tb,deep cave,,7,,"10,75","9,67800045","9,67800045","24,96000099",926,26,"69,05858686","87,25",,2.5,2.5,1,372,264,82
2042,Jama na grebenu,Croatia,15.10.2002.,2002-10-15,1f,1,Linyphiidae,Palliduphantes,spelaeorum,Palliduphantes spelaeorum,1108,4.325.927,17.147.834,Tf,deep cave,,3,"10,8","10,8","9,285666466","9,285666466","25,12000084",925,23,"65,54939122","98,6","98,6",nan,nan,1,nan,nan,nan
2043,Jama na grebenu,Croatia,15.10.2002.,2002-10-15,1 juv,1,Dysderidae,Stalagtia,sp. 4,Stalagtia sp. 4,1108,4.325.927,17.147.834,Tb,deep cave,,3,"10,8","10,8","9,285666466","9,285666466","25,12000084",925,23,"65,54939122","98,6","98,6",nan,nan,1,nan,nan,nan
2049,Jama za Supinom,Croatia,18.11.2005.,2005-11-18,1m,1,Linyphiidae,Palliduphantes,spelaeorum,Palliduphantes spelaeorum,905,43.250.417,17.113.278,Tf,deep cave,,7,,"10,75","9,67800045","9,67800045","24,96000099",926,26,"69,05858686","87,25",,2.5,2.5,1,372,264,82
2050,Kukor,Croatia,2.1.1999.,1999-01-02,"1f, 1 juv",2,Nesticidae,Kryptonesticus,deelemanae,Kryptonesticus deelemanae,587,43.355.609,16.991.707,tb,deep cave,,10,,"15,4","12,63749981","12,63749981","25,40833473",906,29,"68,94753675",,,1,1,1,264,213,40
2054,Jama iznad Prozorčića,Croatia,26.10.2006.,2006-10-26,2f,2,Linyphiidae,Palliduphantes,spelaeorum,Palliduphantes spelaeorum,460,4.338.381,16.932.036,Tf,deep cave,,5,"12,5","8,9","12,02766705","12,02766705","24,98400116",895,24,"72,69547752",,,4,1.5,1,28.6,15,23.5
2055,Jama iznad Prozorčića,Croatia,28.10.2003.,2003-10-28,"1f, 3 juv",4,Linyphiidae,Palliduphantes,spelaeorum,Palliduphantes spelaeorum,460,4.338.381,16.932.036,Tf,deep cave,,5,"12,5","8,9","12,02766705","12,02766705","24,98400116",895,24,"72,69547752",,,4,1.5,1,28.6,15,23.5
2057,Potkameničina jama,Croatia,25.10.2006.,2006-10-25,2 f,2,Linyphiidae,Typhlonyphia,sp. 1,Typhlonyphia sp. 1,378,43.393.898,17.018.204,Tb,deep cave,,1,,13,"12,27216721","12,27216721","26,62000084",912,29,"63,4563638",,,0.8,0.5,1,nan,4,17.3
2060,Jama za Supinom,Croatia,18.11.2005.,2005-11-18,"2m, 2 f",4,Linyphiidae,Palliduphantes,spelaeorum,Palliduphantes spelaeorum,905,43.250.417,17.113.278,Tf,deep cave,,7,,"10,75","9,67800045","9,67800045","24,96000099",926,26,"69,05858686","87,25",,2.5,2.5,1,372,264,82
2061,Pozjata špilja,Croatia,26.10.2003.,2003-10-26,"1f, 2 juv",3,Linyphiidae,Palliduphantes,spelaeorum,Palliduphantes spelaeorum,1394,43.387.837,16.963.748,Tf,deep cave,,3,,"7,85","10,82800007","10,82800007","25,23999977",919,28,"69,25839521",99,,,,,,,
2067,Crna ledenica,Croatia,24.5.2004.,2004-05-24,1 juv m,1,Nesticidae,Kryptonesticus,deelemanae,Kryptonesticus deelemanae,1557,43.348.162,17.055.328,tb,deep cave,,2,,"0,3","8,441666603","8,441666603","24,99200058",947,26,"63,68523746",,,15,10,1,200,112,72.5
2068,Jama pod Osojem,Croatia,28.10.2003.,2003-10-28,"1f, 3 juv",4,Linyphiidae,Palliduphantes,spelaeorum,Palliduphantes spelaeorum,867,43.251.441,17.118.374,Tf,deep cave,,3,7,7,"9,67800045","9,67800045","24,96000099",926,23,"68,56980378","97,1","97,1",nan,nan,1,nan,nan,nan
2071,Pozjata špilja,Croatia,26.10.2003.,2003-10-26,1f,1,Linyphiidae,Palliduphantes,spelaeorum,Palliduphantes spelaeorum,1394,43.387.837,16.963.748,Tf,deep cave,,3,,"7,85","10,82800007","10,82800007","25,23999977",919,28,"69,25839521",99,,,,,,,
2075,Pozjata špilja,Croatia,26.10.2003.,2003-10-26,2f,2,Linyphiidae,Palliduphantes,spelaeorum,Palliduphantes spelaeorum,1394,43.387.837,16.963.748,Tf,deep cave,,3,,"7,85","10,82800007","10,82800007","25,23999977",919,28,"69,25839521",99,,,,,,,
2084,Kukor,Croatia,29.12.1997.,1997-12-29,"1f, 1 juv",2,Nesticidae,Kryptonesticus,deelemanae,Kryptonesticus deelemanae,587,43.355.609,16.991.707,tb,deep cave,,10,,"15,4","12,63749981","12,63749981","25,40833473",906,29,"68,94753675",,,1,1,1,264,213,40
2085,Kukor,Croatia,7.8.2000.,2000-08-07,"1f, 7 juv",8,Nesticidae,Kryptonesticus,deelemanae,Kryptonesticus deelemanae,587,43.355.609,16.991.707,tb,deep cave,,10,,"15,4","12,63749981","12,63749981","25,40833473",906,29,"68,94753675",,,1,1,1,264,213,40
2088,Kukor,Croatia,25.3.2004.,2004-03-25,1 juv,1,Nesticidae,Kryptonesticus,deelemanae,Kryptonesticus deelemanae,587,43.355.609,16.991.707,tb,deep cave,,10,,"15,4","12,63749981","12,63749981","25,40833473",906,29,"68,94753675",,,1,1,1,264,213,40
2093,Kukor,Croatia,26.3.2004.,2004-03-26,"1f, 1 juv",2,Nesticidae,Kryptonesticus,deelemanae,Kryptonesticus deelemanae,587,43.355.609,16.991.707,tb,deep cave,,10,,"15,4","12,63749981","12,63749981","25,40833473",906,29,"68,94753675",,,1,1,1,264,213,40
2094,Spila 2,Croatia,26.3.2003.,2003-03-26,1 juv m,1,Linyphiidae,Typhlonyphia,sp. 1,Typhlonyphia sp. 1,349,4.326.239,17.204.021,Tb,deep cave,,6,12,12,"12,35200024","12,35200024","26,52000046",917,21,"61,25054739","96,3","96,3",0.5,0.7,1,28,24,11
2100,Bošak jama,Croatia,17.11.2005.,2005-11-17,1f,1,Linyphiidae,Typhlonyphia,sp. 1,Typhlonyphia sp. 1,721,43.347.996,17.100.045,Tb,deep cave,,2,,"7,4","11,25733376","11,25733376","26,1079998",928,23,"59,73571895",100,,1.1,1.7,1,nan,11,17
2102,Tučepska vilenjača,Croatia,23.5.2004.,2004-05-23,1 juv m,1,Linyphiidae,Typhlonyphia,sp. 1,Typhlonyphia sp. 1,1242,43.286.465,17.083.638,Tb,deep cave,,8,"10,6","10,731","9,67800045","9,67800045","24,96000099",926,26,"67,32747088",,,6,0.8,1,nan,28,35
2103,Spila 2,Croatia,26.3.2003.,2003-03-26,1 juv,1,Linyphiidae,Typhlonyphia,sp. 1,Typhlonyphia sp. 1,349,4.326.239,17.204.021,Tb,deep cave,,6,12,12,"12,35200024","12,35200024","26,52000046",917,21,"61,25054739","96,3","96,3",0.5,0.7,1,28,24,11
2105,Spila 2,Croatia,23.3.2004.,2004-03-23,2 juv,2,Linyphiidae,Typhlonyphia,sp. 1,Typhlonyphia sp. 1,349,4.326.239,17.204.021,Tb,deep cave,,6,12,12,"12,35200024","12,35200024","26,52000046",917,21,"61,25054739","96,3","96,3",0.5,0.7,1,28,24,11
2107,Jama za Supinom,Croatia,18.11.2005.,2005-11-18,"2m, 1f",3,Linyphiidae,Palliduphantes,spelaeorum,Palliduphantes spelaeorum,905,43.250.417,17.113.278,Tf,deep cave,,7,,"10,75","9,67800045","9,67800045","24,96000099",926,26,"69,05858686","87,25",,2.5,2.5,1,372,264,82
2108,Vlastelinka jama,Croatia,26.3.2003.,2003-03-26,1f,1,Linyphiidae,Palliduphantes,spelaeorum,Palliduphantes spelaeorum,390,43.269.635,17.211.206,Tf,deep cave,,2,,"11,4","11,41149998","11,41149998","26,41199875",935,29,"59,88488508",90,,,,,,,
2114,Kukor,Croatia,23.9.1999.,1999-09-23,1 juv,1,Nesticidae,Kryptonesticus,deelemanae,Kryptonesticus deelemanae,587,43.355.609,16.991.707,tb,deep cave,,10,,"15,4","12,63749981","12,63749981","25,40833473",906,29,"68,94753675",,,1,1,1,264,213,40
2117,Jama u Bratušu,Croatia,27.10.2006.,2006-10-27,"2m, 1f, 1 juv",4,Linyphiidae,Palliduphantes,spelaeorum,Palliduphantes spelaeorum,43,43.328.376,16.979.405,Tf,deep cave,,4,"12,5","13,15","14,92166615","14,92166615","26,53999901",857,2,"72,35367461",91,,7,1.8,1,18,7,11
2118,Jujnovića špilja,Croatia,27.4.2002.,2002-04-27,1 juv,1,Linyphiidae,Typhlonyphia,sp. 1,Typhlonyphia sp. 1,463,43.266.579,1.719.798,Tb,deep cave,,6,"13,8","10,85","12,35200024","12,35200024","26,52000046",917,29,"61,15708825",,,5,2.5,1,108,40,16
2119,Pružina špilja,Croatia,29.10.2003.,2003-10-29,1 juv,1,Linyphiidae,Typhlonyphia,sp. 1,Typhlonyphia sp. 1,501,43.394.238,17.058.713,Tb,deep cave,,4,,"11,9","11,93233299","11,93233299","26,88800049",923,21,"59,50526807","99,9",,nan,nan,1,nan,nan,nan
2123,Jama za Supinom,Croatia,26.5.2004.,2004-05-26,"1m, 2f, 1 juv",4,Linyphiidae,Palliduphantes,spelaeorum,Palliduphantes spelaeorum,905,43.250.417,17.113.278,Tf,deep cave,,7,,"10,75","9,67800045","9,67800045","24,96000099",926,26,"69,05858686","87,25",,2.5,2.5,1,372,264,82
2146,Male spile,Croatia,29.10.2003.,2003-10-29,1m,1,Scytodidae,Scytodes,thoracica,Scytodes thoracica,676,43.369.039,16.955.554,Tx,,,1,,"11,4","14,44047642","14,44047642","25,87142944",870,32,"71,40216851",94,,nan,nan,1,nan,nan,nan
2149,Špilja na Mrždolcu,Croatia,5.4.2006.,2006-04-05,1 juv,1,Linyphiidae,Typhlonyphia,sp. 1,Typhlonyphia sp. 1,419,43.405.319,17.014.811,Tb,deep cave,,3,,"7,5","12,27216721","12,27216721","26,62000084",912,23,"62,97721711",,,nan,nan,1,nan,nan,nan
2151,Mucića ledenica,Croatia,24.5.2004.,2004-05-24,1f,1,Linyphiidae,Troglohyphantes,sp. 8,Troglohyphantes sp. 8,1344,4.335.632,17.051.544,Tf,deep cave,,3,"0,8","0,8","8,441666603","8,441666603","24,99200058",947,23,"63,30845715",,,5,4,1,nan,60,37.5
2153,Kukor,Croatia,26.4.2002.,2002-04-26,2f juv,2,Leptonetidae,Sulcia,sp.,Sulcia sp.,587,43.355.609,16.991.707,,,,10,,"15,4","12,63749981","12,63749981","25,40833473",906,29,"68,94753675",,,1,1,1,264,213,40
2154,Jama u Bratušu,Croatia,27.10.2006.,2006-10-27,1m,1,Linyphiidae,Centromerus,raridentatus sp.n.,Centromerus raridentatus sp.n.,43,43.328.376,16.979.405,,,,4,"12,5","13,15","14,92166615","14,92166615","26,53999901",857,2,"72,35367461",91,,7,1.8,1,18,7,11
2155,Krjava 2,Croatia,27.10.2006.,2006-10-27,3f,3,Linyphiidae,Centromerus,cavernarum,Centromerus cavernarum,1061,43.329.431,17.027.011,Tf,deep cave,,3,,"7,425","12,74867439","12,74867439","25,54545403",898,26,"67,92076497","97,5",,nan,nan,1,nan,nan,nan
2157,Jama iznad Prozorčića,Croatia,28.10.2003.,2003-10-28,"1m, 1 juv m",2,Linyphiidae,Centromerus,silvicola,Centromerus silvicola,460,4.338.381,16.932.036,tx,deep cave,,5,"12,5","8,9","12,02766705","12,02766705","24,98400116",895,24,"72,69547752",,,4,1.5,1,28.6,15,23.5
2158,Jama iznad Prozorčića,Croatia,24.3.2004.,2004-03-24,1 m,1,Linyphiidae,Centromerus,silvicola,Centromerus silvicola,460,4.338.381,16.932.036,tx,deep cave,,5,"12,5","8,9","12,02766705","12,02766705","24,98400116",895,24,"72,69547752",,,4,1.5,1,28.6,15,23.5
2159,Mala jama u stijenama,Croatia,20.3.2003.,2003-03-20,"1m, 1 juv",2,Linyphiidae,Centromerus,cavernarum,Centromerus cavernarum,1221,43.365.579,17.027.668,Tf,deep cave,,3,"9,3","9,3","7,902999878","7,902999878","24,58800125",950,29,"64,74299334",93,93,nan,nan,1,nan,nan,nan
2161,Jama iznad Prozorčića,Croatia,28.10.2003.,2003-10-28,"2m, 1f, 1 juv m",4,Linyphiidae,Centromerus,silvicola,Centromerus silvicola,460,4.338.381,16.932.036,tx,deep cave,,5,"12,5","8,9","12,02766705","12,02766705","24,98400116",895,24,"72,69547752",,,4,1.5,1,28.6,15,23.5
2162,Jama iznad Prozorčića,Croatia,1.4.2006.,2006-04-01,1f,1,Linyphiidae,Centromerus,silvicola,Centromerus silvicola,460,4.338.381,16.932.036,tx,deep cave,,5,"12,5","8,9","12,02766705","12,02766705","24,98400116",895,24,"72,69547752",,,4,1.5,1,28.6,15,23.5
2163,Jama iznad Prozorčića,Croatia,1.4.2006.,2006-04-01,1f,1,Linyphiidae,Centromerus,silvicola,Centromerus silvicola,460,4.338.381,16.932.036,tx,deep cave,,5,"12,5","8,9","12,02766705","12,02766705","24,98400116",895,24,"72,69547752",,,4,1.5,1,28.6,15,23.5
2164,Jama iznad Prozorčića,Croatia,28.10.2003.,2003-10-28,1f,1,Linyphiidae,Centromerus,silvicola,Centromerus silvicola,460,4.338.381,16.932.036,tx,deep cave,,5,"12,5","8,9","12,02766705","12,02766705","24,98400116",895,24,"72,69547752",,,4,1.5,1,28.6,15,23.5
2165,Jama iznad Prozorčića,Croatia,26.10.2006.,2006-10-26,2f,2,Linyphiidae,Centromerus,silvicola,Centromerus silvicola,460,4.338.381,16.932.036,tx,deep cave,,5,"12,5","8,9","12,02766705","12,02766705","24,98400116",895,24,"72,69547752",,,4,1.5,1,28.6,15,23.5
2169,Samogorska špilja,Croatia,25.5.2005.,2005-05-25,1 f,1,Linyphiidae,Gen. 8,sp. 1,Gen. 8 sp. 1,621,43.318.227,17.121.122,,,,6,"7,1","9,033","9,092166901","9,092166901",25,931,23,"60,95464736",99,,2,3,1,nan,19,3.5
2170,Samogorska špilja,Croatia,19.11.2005.,2005-11-19,1 f,1,Linyphiidae,Gen. 8,sp. 1,Gen. 8 sp. 1,621,43.318.227,17.121.122,,,,6,"7,1","9,033","9,092166901","9,092166901",25,931,23,"60,95464736",99,,2,3,1,nan,19,3.5
2180,Brikinjava špilja,Croatia,17.11.2005.,2005-11-17,"3f, 1 juv m, 1 juv",5,Leptonetidae,Barusia,maheni,Barusia maheni,742,43.345.181,17.096.904,tf,deep cave,,3,,"5,533","11,25733376","11,25733376","26,1079998",928,23,"60,27800105",94,,6,2,1,nan,16,2.4
2181,Brikinjava špilja,Croatia,21.3.2003.,2003-03-21,1f,1,Leptonetidae,Sulcia,sp.,Sulcia sp.,742,43.345.181,17.096.904,,,,3,,"5,533","11,25733376","11,25733376","26,1079998",928,23,"60,27800105",94,,6,2,1,nan,16,2.4
2182,Kukor,Croatia,19.6.2002.,2002-06-19,"1f, 1 juv",2,Leptonetidae,Sulcia,sp.,Sulcia sp.,587,43.355.609,16.991.707,,,,10,,"15,4","12,63749981","12,63749981","25,40833473",906,29,"68,94753675",,,1,1,1,264,213,40
2183,Gradska spila,Croatia,19.11.2005.,2005-11-19,1f,1,Leptonetidae,Sulcia,sp.,Sulcia sp.,621,43.318.029,17.117.623,,,,4,,"6,6","9,092166901","9,092166901",25,931,23,"61,25913011","93,333",,5,2.5,1,nan,26.5,1.8
2185,Gradska spila,Croatia,25.5.2004.,2004-05-25,"2f, 1juv m, 3 juv",6,Leptonetidae,Sulcia,sp.,Sulcia sp.,621,43.318.029,17.117.623,,,,4,,"6,6","9,092166901","9,092166901",25,931,23,"61,25913011","93,333",,5,2.5,1,nan,26.5,1.8
2188,Samogorska špilja,Croatia,19.11.2005.,2005-11-19,"2f, 6 juv",8,Leptonetidae,Sulcia,sp.,Sulcia sp.,621,43.318.227,17.121.122,,,,6,"7,1","9,033","9,092166901","9,092166901",25,931,23,"60,95464736",99,,2,3,1,nan,19,3.5
2190,Kukor,Croatia,28.7.2006.,2006-07-28,1f,1,Leptonetidae,Barusia,maheni,Barusia maheni,587,43.355.609,16.991.707,tf,deep cave,,10,,"15,4","12,63749981","12,63749981","25,40833473",906,29,"68,94753675",,,1,1,1,264,213,40
2192,Špilja na Mrždolcu,Croatia,21.11.2005.,2005-11-21,"1f, 1 juv m, 1 juv",3,Leptonetidae,Barusia,maheni,Barusia maheni,419,43.405.319,17.014.811,tf,deep cave,,3,,"7,5","12,27216721","12,27216721","26,62000084",912,23,"62,97721711",,,nan,nan,1,nan,nan,nan
2194,Gradska spila,Croatia,4.4.2006.,2006-04-04,"1f, 1 juv m, 3 juv",5,Leptonetidae,Sulcia,sp.,Sulcia sp.,621,43.318.029,17.117.623,,,,4,,"6,6","9,092166901","9,092166901",25,931,23,"61,25913011","93,333",,5,2.5,1,nan,26.5,1.8
2196,Kukor,Croatia,24.9.2001.,2001-09-24,"1f, 1 juv",2,Leptonetidae,Barusia,maheni,Barusia maheni,587,43.355.609,16.991.707,tf,deep cave,,10,,"15,4","12,63749981","12,63749981","25,40833473",906,29,"68,94753675",,,1,1,1,264,213,40
2203,Samogorska špilja,Croatia,25.5.2005.,2005-05-25,"3f, 3 juvm, 1 juv",7,Leptonetidae,Sulcia,sp.,Sulcia sp.,621,43.318.227,17.121.122,,,,6,"7,1","9,033","9,092166901","9,092166901",25,931,23,"60,95464736",99,,2,3,1,nan,19,3.5
2205,Samogorska špilja,Croatia,4.4.2006.,2006-04-04,"6f, 1 juv",7,Leptonetidae,Sulcia,sp.,Sulcia sp.,621,43.318.227,17.121.122,,,,6,"7,1","9,033","9,092166901","9,092166901",25,931,23,"60,95464736",99,,2,3,1,nan,19,3.5
2209,Samogorska špilja,Croatia,25.5.2005.,2005-05-25,1f,1,Leptonetidae,Sulcia,sp.,Sulcia sp.,621,43.318.227,17.121.122,,,,6,"7,1","9,033","9,092166901","9,092166901",25,931,23,"60,95464736",99,,2,3,1,nan,19,3.5
2212,Jama na Brezdanu,Croatia,20.3.2004.,2004-03-20,"1f, 2 juv",3,Leptonetidae,Sulcia,sp.,Sulcia sp.,914,43.369.901,16.973.172,,,,3,"8,5","8,5","12,63749981","12,63749981","25,40833473",906,32,"69,62048453",,,nan,nan,1,nan,nan,nan
2218,Samogorska špilja,Croatia,4.4.2006.,2006-04-04,"2f, 2 juv",4,Leptonetidae,Sulcia,sp.,Sulcia sp.,621,43.318.227,17.121.122,,,,6,"7,1","9,033","9,092166901","9,092166901",25,931,23,"60,95464736",99,,2,3,1,nan,19,3.5
2219,Matijaševa peć,Croatia,4.4.2006.,2006-04-04,2f,2,Leptonetidae,Sulcia,sp.,Sulcia sp.,621,43.320.551,17.122.321,,,,6,"8,3","6,933","9,092166901","9,092166901",25,931,23,"60,61369348",,,3,1,1,18,17,6
2222,Matijaševa peć,Croatia,4.4.2006.,2006-04-04,1f,1,Leptonetidae,Sulcia,sp.,Sulcia sp.,621,43.320.551,17.122.321,,,,6,"8,3","6,933","9,092166901","9,092166901",25,931,23,"60,61369348",,,3,1,1,18,17,6
2223,Kukor,Croatia,6.4.2006.,2006-04-06,1 juv f,1,Leptonetidae,Sulcia,sp.,Sulcia sp.,587,43.355.609,16.991.707,,,,10,,"15,4","12,63749981","12,63749981","25,40833473",906,29,"68,94753675",,,1,1,1,264,213,40
2232,Jezero,Croatia,28.5.2004.,2004-05-28,1m,1,Linyphiidae,Troglohyphantes,lesserti,Troglohyphantes lesserti,964,42.580.381,18.356.073,tb,deep cave,,8,,"7,567","12,93216705","12,93216705","24,86800003",1208,29,"104,2091301","96,5",,1,0.5,1,20.5,nan,12
2236,Jama na Brezdanu,Croatia,20.3.2004.,2004-03-20,"1m, 1f, 1 juvm",3,Leptonetidae,Sulcia,sp. 3,Sulcia sp. 3,914,43.369.901,16.973.172,Tb,deep cave,,3,"8,5","8,5","12,63749981","12,63749981","25,40833473",906,32,"69,62048453",,,nan,nan,1,nan,nan,nan
2237,Kukor,Croatia,7.8.2000.,2000-08-07,"5m, 3f, 4juv",12,Leptonetidae,Sulcia,sp. 4,Sulcia sp. 4,587,43.355.609,16.991.707,Tb,deep cave,,10,,"15,4","12,63749981","12,63749981","25,40833473",906,29,"68,94753675",,,1,1,1,264,213,40
2239,Kukor,Croatia,27.3.2003.,2003-03-27,"1m, 1 juv",2,Leptonetidae,Sulcia,sp. 3,Sulcia sp. 3,587,43.355.609,16.991.707,Tb,deep cave,,10,,"15,4","12,63749981","12,63749981","25,40833473",906,29,"68,94753675",,,1,1,1,264,213,40
2240,Gradska spila,Croatia,19.11.2005.,2005-11-19,"1m, 1 f, 1 juv",3,Leptonetidae,Sulcia,sp. 4,Sulcia sp. 4,621,43.318.029,17.117.623,Tb,deep cave,,4,,"6,6","9,092166901","9,092166901",25,931,23,"61,25913011","93,333",,5,2.5,1,nan,26.5,1.8
2241,Samogorska špilja,Croatia,25.5.2004.,2004-05-25,"1m, 2 juv",3,Leptonetidae,Sulcia,sp. 4,Sulcia sp. 4,621,43.318.227,17.121.122,Tb,deep cave,,6,"7,1","9,033","9,092166901","9,092166901",25,931,23,"60,95464736",99,,2,3,1,nan,19,3.5
2242,Kukor,Croatia,2.1.1999.,1999-01-02,1m,1,Leptonetidae,Sulcia,sp. 3,Sulcia sp. 3,587,43.355.609,16.991.707,Tb,deep cave,,10,,"15,4","12,63749981","12,63749981","25,40833473",906,29,"68,94753675",,,1,1,1,264,213,40
2243,Kukor,Croatia,26.8.1998.,1998-08-26,1m,1,Leptonetidae,Sulcia,sp. 3,Sulcia sp. 3,587,43.355.609,16.991.707,Tb,deep cave,,10,,"15,4","12,63749981","12,63749981","25,40833473",906,29,"68,94753675",,,1,1,1,264,213,40
2244,Samogorska špilja,Croatia,19.11.2005.,2005-11-19,"1m, 5 juv",6,Leptonetidae,Sulcia,sp. 4,Sulcia sp. 4,621,43.318.227,17.121.122,Tb,deep cave,,6,"7,1","9,033","9,092166901","9,092166901",25,931,23,"60,95464736",99,,2,3,1,nan,19,3.5
2245,Samogorska špilja,Croatia,19.11.2005.,2005-11-19,"1m, 2 juv",3,Leptonetidae,Sulcia,sp. 4,Sulcia sp. 4,621,43.318.227,17.121.122,Tb,deep cave,,6,"7,1","9,033","9,092166901","9,092166901",25,931,23,"60,95464736",99,,2,3,1,nan,19,3.5
2247,Kukor,Croatia,29.10.2006.,2006-10-29,"1m, 1f, 1 juvm",3,Leptonetidae,Sulcia,sp. 3,Sulcia sp. 3,587,43.355.609,16.991.707,Tb,deep cave,,10,,"15,4","12,63749981","12,63749981","25,40833473",906,29,"68,94753675",,,1,1,1,264,213,40
2249,Gradska spila,Croatia,19.11.2005.,2005-11-19,"1m, 3f, 2 juv",6,Leptonetidae,Sulcia,sp. 4,Sulcia sp. 4,621,43.318.029,17.117.623,Tb,deep cave,,4,,"6,6","9,092166901","9,092166901",25,931,23,"61,25913011","93,333",,5,2.5,1,nan,26.5,1.8
2250,Kukor,Croatia,27.7.2004.,2004-07-27,"1m, 1f",2,Leptonetidae,Sulcia,sp. 3,Sulcia sp. 3,587,43.355.609,16.991.707,Tb,deep cave,,10,,"15,4","12,63749981","12,63749981","25,40833473",906,29,"68,94753675",,,1,1,1,264,213,40
2251,Kukor,Croatia,20.10.2005.,2005-10-20,1m,1,Leptonetidae,Sulcia,sp. 3,Sulcia sp. 3,587,43.355.609,16.991.707,Tb,deep cave,,10,,"15,4","12,63749981","12,63749981","25,40833473",906,29,"68,94753675",,,1,1,1,264,213,40
2253,Matijaševa peć,Croatia,4.4.2006.,2006-04-04,"1m, 1f",2,Leptonetidae,Sulcia,sp. 4,Sulcia sp. 4,621,43.320.551,17.122.321,Tb,deep cave,,6,"8,3","6,933","9,092166901","9,092166901",25,931,23,"60,61369348",,,3,1,1,18,17,6
2254,Samogorska špilja,Croatia,4.4.2006.,2006-04-04,"3m, 1f",4,Leptonetidae,Sulcia,sp. 4,Sulcia sp. 4,621,43.318.227,17.121.122,Tb,deep cave,,6,"7,1","9,033","9,092166901","9,092166901",25,931,23,"60,95464736",99,,2,3,1,nan,19,3.5
2256,Gradska spila,Croatia,4.4.2006.,2006-04-04,"2m, 2 juv",4,Leptonetidae,Sulcia,sp. 4,Sulcia sp. 4,621,43.318.029,17.117.623,Tb,deep cave,,4,,"6,6","9,092166901","9,092166901",25,931,23,"61,25913011","93,333",,5,2.5,1,nan,26.5,1.8
2257,Tanki Ratac,Croatia,6.1.2009.,2009-01-06,"1m, 1 juvm",2,Leptonetidae,Barusia,maheni,Barusia maheni,215,43.360.229,16.569.356,tf,deep cave,,3,,"16,6","14,83833313","14,83833313","25,04799843",787,17,"111,4255656",91,,nan,nan,1,nan,nan,nan
2259,Jama u Bratušu,Croatia,27.10.2006.,2006-10-27,"2m, 1f",3,Leptonetidae,Barusia,maheni,Barusia maheni,43,43.328.376,16.979.405,tf,deep cave,,4,"12,5","13,15","14,92166615","14,92166615","26,53999901",857,2,"72,35367461",91,,7,1.8,1,18,7,11
2269,Jama kod Lugarnice,Croatia,4.8.2011.,2011-08-04,"2m, 4f, 1juv",7,Linyphiidae,Troglohyphantes,croaticus,Troglohyphantes croaticus,528,45.327.864,15.092.353,tb,deep cave,,3,,"8,9","8,389166832","8,389166832","27,80400085",1465,24,"380,6148962","94,3",,,,,,,
2270,Jama kod Lugarnice,Croatia,4.8.2011.,2011-08-04,"3f, 1m",4,Dysderidae,Parastalita,stygia,Parastalita stygia,528,45.327.864,15.092.353,Tb,deep cave,,3,,"8,9","8,389166832","8,389166832","27,80400085",1465,24,"380,6148962","94,3",,,,,,,
2271,Špilja Šupljača,Croatia,1.8.2006.,2006-08-01,1f,1,Linyphiidae,Troglohyphantes,roberti,Troglohyphantes roberti,586,44.228.797,15.851.735,tb,deep cave,,2,,9,"9,772166252","9,772166252","27,11600113",1105,28,"208,8691717",,,,,,,,
2289,Vaganka,Croatia,3.6.2006.,2006-06-03,"1m, 1f",2,Dysderidae,Parastalita,stygia,Parastalita stygia,656,4.433.853,1.543.867,Tb,deep cave,,5,,"12,2","7,622666836","7,622666836","26,19600105",1265,29,"257,5927467",95,,,,,,,
2319,Golubinka više Mršića strane,Croatia,4.8.2006.,2006-08-04,1m,1,Linyphiidae,Palliduphantes,istrianus,Palliduphantes istrianus,473,4.412.501,15.807.683,Tf,deep cave,,3,"7,1","7,45","12,67350006","12,67350006","28,27199936",949,23,"206,3976041",,,,,,,,
2367,Peć u Čulinovim raljevinama,Croatia,25.6.2011.,2011-06-25,1 juv,1,Dysderidae,Stalagtia,sp. 4,Stalagtia sp. 4,369,43.605.854,16.575.066,Tb,deep cave,,5,,11,"12,99133301","12,99133301","26,44000053",879,26,"104,4759765",,,1,1,1,nan,42.5,12.5
2370,Tučepska vilenjača,Croatia,18.6.2011.,2011-06-18,1 juv,1,Agelenidae,Histopona,sp.,Histopona sp.,1242,43.286.465,17.083.638,,deep cave,,8,"10,6","10,731","9,67800045","9,67800045","24,96000099",926,26,"67,32747088",,,6,0.8,1,nan,28,35
2371,Tučepska vilenjača,Croatia,18.6.2011.,2011-06-18,2f,2,Dysderidae,Stalagtia,sp. 4,Stalagtia sp. 4,1242,43.286.465,17.083.638,Tb,deep cave,,8,"10,6","10,731","9,67800045","9,67800045","24,96000099",926,26,"67,32747088",,,6,0.8,1,nan,28,35
2377,Crna ledenica,Croatia,18.6.2011.,2011-06-18,1f,1,Nesticidae,Kryptonesticus,deelemanae,Kryptonesticus deelemanae,1557,43.348.162,17.055.328,tb,deep cave,,2,,"0,3","8,441666603","8,441666603","24,99200058",947,26,"63,68523746",,,15,10,1,200,112,72.5
2379,Peć u Čulinovim raljevinama,Croatia,25.6.2011.,2011-06-25,1 juv,1,Dysderidae,Stalagtia,sp. 4,Stalagtia sp. 4,369,43.605.854,16.575.066,Tb,deep cave,,5,,11,"12,99133301","12,99133301","26,44000053",879,26,"104,4759765",,,1,1,1,nan,42.5,12.5
2381,Škabac,Croatia,17.4.2011.,2011-04-17,4f,4,Linyphiidae,Centromerus,densidentatus sp.n.,Centromerus densidentatus sp.n.,241,45.259.902,14.606.487,,,,10,,12,"12,13366699","12,13366699","25,75999832",1398,28,"397,3459592",82,,nan,nan,1,nan,nan,nan
2382,Špilja pod Kapelu,Croatia,29.9.2011.,2011-09-29,1 juv m,1,Agelenidae,Hadites,tegenarioides,Hadites tegenarioides,102,43.184.949,16.434.233,TB,deep cave,,5,,"12,717","16,20546913","16,20546913","23,36250114",714,21,"135,8656791","97,5",,nan,nan,1,nan,nan,nan
2385,Špilja pod Kapelu,Croatia,29.9.2011.,2011-09-29,3 juv,3,Agelenidae,Hadites,tegenarioides,Hadites tegenarioides,102,43.184.949,16.434.233,TB,deep cave,,5,,"12,717","16,20546913","16,20546913","23,36250114",714,21,"135,8656791","97,5",,nan,nan,1,nan,nan,nan
2386,Grapčeva špilja,Croatia,30.9.2011.,2011-09-30,3 juv,3,Agelenidae,Hadites,tegenarioides,Hadites tegenarioides,279,43.134.189,16.753.732,TB,deep cave,,5,,"13,225","15,48979187","15,48979187","23,94499969",751,28,"110,2583259",,,nan,nan,1,nan,nan,nan
2387,Pišurka,Croatia,1.10.2007.,2007-10-01,1juv,1,Dysderidae,Folkia,haasi,Folkia haasi,17,42.959.451,17.129.228,Tb,deep cave,,5,,"13,925","14,0666666","14,0666666","24,28125",833,25,"105,2150766","84,833",,6,1.3,1,86,75,32
2390,Grapčeva špilja,Croatia,4.4.2005.,2005-04-04,"1f, 2 juv",3,Leptonetidae,Barusia,insulana,Barusia insulana,279,43.134.189,16.753.732,tb,deep cave,,5,,"13,225","15,48979187","15,48979187","23,94499969",751,28,"110,2583259",,,nan,nan,1,nan,nan,nan
2395,Peć u Čulinovim raljevinama,Croatia,4.8.2007.,2007-08-04,1f,1,Dysderidae,Stalagtia,sp. 4,Stalagtia sp. 4,369,43.605.854,16.575.066,Tb,deep cave,,5,,11,"12,99133301","12,99133301","26,44000053",879,26,"104,4759765",,,1,1,1,nan,42.5,12.5
2397,Peć u Čulinovim raljevinama,Croatia,4.8.2007.,2007-08-04,2 juv,2,Dysderidae,Stalagtia,sp. 4,Stalagtia sp. 4,369,43.605.854,16.575.066,Tb,deep cave,,5,,11,"12,99133301","12,99133301","26,44000053",879,26,"104,4759765",,,1,1,1,nan,42.5,12.5
2399,Stražbenica,Croatia,29.3.2005.,2005-03-29,2 juv,2,Dysderidae,Stalagtia,sp. 4,Stalagtia sp. 4,172,43.697.353,16.029.618,Tb,deep cave,,3,,"14,7","14,88466644","14,88466644","26,93600082",739,26,"165,8524113",100,,7,2.5,1,86,86,7
2400,Stara jametina,Croatia,7.1.2005.,2005-01-07,"1f, 2 juv",3,Dysderidae,Stalagtia,sp. 4,Stalagtia sp. 4,161,43.794.009,1.600.259,Tb,deep cave,,6,"13,4","13,2","14,21000004","14,21000004","27,66799927",790,20,"170,7986956","90,95","91,7",12,8,1,nan,188,85
2409,Balića špilja,Croatia,4.8.2007.,2007-08-04,"6f, 3m, 1juv",1,Linyphiidae,Troglohyphantes,giromettai,Troglohyphantes giromettai,438,4.357.296,1.657.002,tf,deep cave,,11,,"7,2","12,25566673","12,25566673","25,68000031",872,23,"105,1255288",,,70,7,1,194,155,50
2411,Balića špilja,Croatia,15.6.2011.,2011-06-15,1m,1,Linyphiidae,Troglohyphantes,giromettai,Troglohyphantes giromettai,438,4.357.296,1.657.002,tf,deep cave,,11,,"7,2","12,25566673","12,25566673","25,68000031",872,23,"105,1255288",,,70,7,1,194,155,50
2412,Balića špilja,Croatia,4.8.2007.,2007-08-04,1m,1,Linyphiidae,Troglohyphantes,giromettai,Troglohyphantes giromettai,438,4.357.296,1.657.002,tf,deep cave,,11,,"7,2","12,25566673","12,25566673","25,68000031",872,23,"105,1255288",,,70,7,1,194,155,50
2413,Balića špilja,Croatia,15.6.2011.,2011-06-15,"1m, 1 juv m",2,Linyphiidae,Troglohyphantes,giromettai,Troglohyphantes giromettai,438,4.357.296,1.657.002,tf,deep cave,,11,,"7,2","12,25566673","12,25566673","25,68000031",872,23,"105,1255288",,,70,7,1,194,155,50
2414,Balića špilja,Croatia,1.10.2006.,2006-10-01,1f,1,Linyphiidae,Troglohyphantes,strandi,Troglohyphantes strandi,438,4.357.296,1.657.002,tb,deep cave,,11,,"7,2","12,25566673","12,25566673","25,68000031",872,23,"105,1255288",,,70,7,1,194,155,50
2417,Vranjača špilja kod Dugopolja,Croatia,1.8.2007.,2007-08-01,"1 juv m, 1 juv",2,Linyphiidae,Troglohyphantes,strandi,Troglohyphantes strandi,445,43.562.235,16.648.216,tb,deep cave,,5,,"8,7","12,21549988","12,21549988","26,12800026",886,21,"96,51736486",,,,,,,,
2418,Vranjača špilja kod Dugopolja,Croatia,25.6.2011.,2011-06-25,2 juv m,2,Linyphiidae,Troglohyphantes,strandi,Troglohyphantes strandi,445,43.562.235,16.648.216,tb,deep cave,,5,,"8,7","12,21549988","12,21549988","26,12800026",886,21,"96,51736486",,,,,,,,
2419,Vranjača špilja kod Dugopolja,Croatia,26.10.2007.,2007-10-26,2 juv,2,Linyphiidae,Troglohyphantes,strandi,Troglohyphantes strandi,445,43.562.235,16.648.216,tb,deep cave,,5,,"8,7","12,21549988","12,21549988","26,12800026",886,21,"96,51736486",,,,,,,,
2422,Vranjača špilja kod Dugopolja,Croatia,26.10.2007.,2007-10-26,1f,1,Linyphiidae,Troglohyphantes,strandi,Troglohyphantes strandi,445,43.562.235,16.648.216,tb,deep cave,,5,,"8,7","12,21549988","12,21549988","26,12800026",886,21,"96,51736486",,,,,,,,
2423,Vranjača špilja kod Dugopolja,Croatia,26.10.2007.,2007-10-26,1 juv,1,Linyphiidae,Troglohyphantes,strandi,Troglohyphantes strandi,445,43.562.235,16.648.216,tb,deep cave,,5,,"8,7","12,21549988","12,21549988","26,12800026",886,21,"96,51736486",,,,,,,,
2424,Vranjača špilja kod Dugopolja,Croatia,22.6.2011.,2011-06-22,"1juv f, 2 juv",3,Linyphiidae,Troglohyphantes,strandi,Troglohyphantes strandi,445,43.562.235,16.648.216,tb,deep cave,,5,,"8,7","12,21549988","12,21549988","26,12800026",886,21,"96,51736486",,,,,,,,
2425,Vranjača špilja kod Dugopolja,Croatia,24.6.2011.,2011-06-24,1f,1,Linyphiidae,Troglohyphantes,strandi,Troglohyphantes strandi,445,43.562.235,16.648.216,tb,deep cave,,5,,"8,7","12,21549988","12,21549988","26,12800026",886,21,"96,51736486",,,,,,,,
2426,Maklutača,Croatia,24.6.2011.,2011-06-24,"1m, 1f",2,Linyphiidae,Troglohyphantes,strandi,Troglohyphantes strandi,415,43.569.268,16.620.515,tb,deep cave,,6,,"6,25","11,86699963","11,86699963","25,86800003",883,29,"99,53597793",,,11,6.5,1,152,140,39
2427,Maklutača,Croatia,15.6.2011.,2011-06-15,1m,1,Linyphiidae,Troglohyphantes,giromettai,Troglohyphantes giromettai,415,43.569.268,16.620.515,tf,deep cave,,6,,"6,25","11,86699963","11,86699963","25,86800003",883,29,"99,53597793",,,11,6.5,1,152,140,39
2428,Maklutača,Croatia,24.6.2011.,2011-06-24,"2f, 1m",3,Linyphiidae,Troglohyphantes,strandi,Troglohyphantes strandi,415,43.569.268,16.620.515,tb,deep cave,,6,,"6,25","11,86699963","11,86699963","25,86800003",883,29,"99,53597793",,,11,6.5,1,152,140,39
2430,Peć u Čulinovim raljevinama,Croatia,4.8.2007.,2007-08-04,"1m, 2f",3,Linyphiidae,Troglohyphantes,strandi,Troglohyphantes strandi,369,43.605.854,16.575.066,tb,deep cave,,5,,11,"12,99133301","12,99133301","26,44000053",879,26,"104,4759765",,,1,1,1,nan,42.5,12.5
2431,Peć u Čulinovim raljevinama,Croatia,25.6.2011.,2011-06-25,1juv,1,Linyphiidae,Troglohyphantes,strandi,Troglohyphantes strandi,369,43.605.854,16.575.066,tb,deep cave,,5,,11,"12,99133301","12,99133301","26,44000053",879,26,"104,4759765",,,1,1,1,nan,42.5,12.5
2435,Vranjača špilja kod Dugopolja,Croatia,1.8.2007.,2007-08-01,2f,2,Linyphiidae,Troglohyphantes,strandi,Troglohyphantes strandi,445,43.562.235,16.648.216,tb,deep cave,,5,,"8,7","12,21549988","12,21549988","26,12800026",886,21,"96,51736486",,,,,,,,
2449,Stražbenica,Croatia,29.3.2005.,2005-03-29,3 juv,3,Dysderidae,Stalagtia,sp. 4,Stalagtia sp. 4,172,43.697.353,16.029.618,Tb,deep cave,,3,,"14,7","14,88466644","14,88466644","26,93600082",739,26,"165,8524113",100,,7,2.5,1,86,86,7
2455,Stražbenica,Croatia,3.5.2009.,2009-05-03,1 juv,1,Dysderidae,Stalagtia,sp. 4,Stalagtia sp. 4,172,43.697.353,16.029.618,Tb,deep cave,,3,,"14,7","14,88466644","14,88466644","26,93600082",739,26,"165,8524113",100,,7,2.5,1,86,86,7
2459,Velika špilja kod Neorića,Croatia,31.7.2007.,2007-07-31,1 juv m,1,Agelenidae,Tegenaria,sp.,Tegenaria sp.,721,43.686.117,1.655.312,,deep cave,,2,,"9,5","11,06483364","11,06483364","25,84800148",934,23,"107,710035",,,2,2.1,1,19,19,0
2475,Pišurka,Croatia,26.12.2009.,2009-12-26,1 juv m,1,Dysderidae,Folkia,haasi,Folkia haasi,17,42.959.451,17.129.228,Tb,deep cave,,5,,"13,925","14,0666666","14,0666666","24,28125",833,25,"105,2150766","84,833",,6,1.3,1,86,75,32
2476,Pišurka,Croatia,26.12.2009.,2009-12-26,1 juv,1,Dysderidae,Folkia,haasi,Folkia haasi,17,42.959.451,17.129.228,Tb,deep cave,,5,,"13,925","14,0666666","14,0666666","24,28125",833,25,"105,2150766","84,833",,6,1.3,1,86,75,32
2477,Špilja u uvali Predpeć,Croatia,9.7.2007.,2007-07-09,1f,1,Dysderidae,Stalita,taenaria,Stalita taenaria,,45.291.576,14.510.419,Tb,deep cave,,4,"10,3","10,625","13,89999962","13,89999962","25,40000153",1376,44,"398,0215329",,,4,3,1,25,21,4
2478,Nakovana spila,Croatia,25.9.2009.,2009-09-25,"1f/juv, 2 juv",3,Dysderidae,Stalagtia,hercegovinensis,Stalagtia hercegovinensis,324,43.005.018,17.091.068,Tb,deep cave,,4,,"13,3","14,54694462","14,54694462","24,21999931",807,29,"101,0327345",92,,,,,,,
2481,Jama pod Kolač,Croatia,25.4.2004.,2004-04-25,2 juv,2,Dysderidae,Folkia,haasi,Folkia haasi,163,42.922.084,17.123.592,Tb,deep cave,,1,,"12,9","15,59433365","15,59433365","24,44799995",793,15,"110,6255634",,,,,,,,
2482,Ostaševica,Croatia,17.6.2001.,2001-06-17,1f,1,Dysderidae,Folkia,inermis,Folkia inermis,302,42.748.959,17.544.404,Tb,deep cave,,9,,"11,4","15,79444408","15,79444408","24,11999893",925,25,"101,3842944",100,,6,5,1,nan,70,20
2485,Živa voda,Croatia,5.5.2011.,2011-05-05,2 juv,2,Nesticidae,Kryptonesticus,eremita,Kryptonesticus eremita,115,43.116.808,17.050.393,tf,deep cave,,1,,"13,5","15,95083332","15,95083332","25,5",819,29,"89,2958768",85,,,,,,,
2488,Grapčeva špilja,Croatia,3.5.2011.,2011-05-03,1 juv,1,Nesticidae,Kryptonesticus,eremita,Kryptonesticus eremita,279,43.134.189,16.753.732,tf,deep cave,,5,,"13,225","15,48979187","15,48979187","23,94499969",751,28,"110,2583259",,,nan,nan,1,nan,nan,nan
2493,Grapčeva špilja,Croatia,5.5.2011.,2011-05-05,2 juv,2,Agelenidae,Hadites,tegenarioides,Hadites tegenarioides,279,43.134.189,16.753.732,TB,deep cave,,5,,"13,225","15,48979187","15,48979187","23,94499969",751,28,"110,2583259",,,nan,nan,1,nan,nan,nan
2494,Grapčeva špilja,Croatia,5.5.2011.,2011-05-05,"1m, 5 juv",6,Nesticidae,Kryptonesticus,eremita,Kryptonesticus eremita,279,43.134.189,16.753.732,tf,deep cave,,5,,"13,225","15,48979187","15,48979187","23,94499969",751,28,"110,2583259",,,nan,nan,1,nan,nan,nan
2500,Grapčeva špilja,Croatia,3.5.2011.,2011-05-03,"1f, 1 juv",2,Leptonetidae,Barusia,insulana,Barusia insulana,279,43.134.189,16.753.732,tb,deep cave,,5,,"13,225","15,48979187","15,48979187","23,94499969",751,28,"110,2583259",,,nan,nan,1,nan,nan,nan
2502,Grapčeva špilja,Croatia,3.5.2011.,2011-05-03,4 juv,4,Nesticidae,Kryptonesticus,eremita,Kryptonesticus eremita,279,43.134.189,16.753.732,tf,deep cave,,5,,"13,225","15,48979187","15,48979187","23,94499969",751,28,"110,2583259",,,nan,nan,1,nan,nan,nan
2510,Špilja pod Kapelu,Croatia,2.5.2011.,2011-05-02,1 juv,1,Agelenidae,Hadites,tegenarioides,Hadites tegenarioides,102,43.184.949,16.434.233,TB,deep cave,,5,,"12,717","16,20546913","16,20546913","23,36250114",714,21,"135,8656791","97,5",,nan,nan,1,nan,nan,nan
2511,Grapčeva špilja,Croatia,3.5.2011.,2011-05-03,1 juv,1,Nesticidae,Kryptonesticus,eremita,Kryptonesticus eremita,279,43.134.189,16.753.732,tf,deep cave,,5,,"13,225","15,48979187","15,48979187","23,94499969",751,28,"110,2583259",,,nan,nan,1,nan,nan,nan
2512,Grapčeva špilja,Croatia,3.5.2011.,2011-05-03,1f,1,Pholcidae,Stygopholcus,absoloni,Stygopholcus absoloni,279,43.134.189,16.753.732,,deep cave,,5,,"13,225","15,48979187","15,48979187","23,94499969",751,28,"110,2583259",,,nan,nan,1,nan,nan,nan
2513,Špilja u Grliću,Croatia,3.5.2011.,2011-05-03,1f,1,Pholcidae,Stygopholcus,absoloni,Stygopholcus absoloni,75,43.158.023,16.813.636,,deep cave,,4,,"17,3","15,55208302","15,55208302","24,34000015",763,44,"102,806737",,,,,,,,
2515,Špilja za Gromačkom vlakom,Croatia,25-26.6 2003.,2003-06-25/2003-06-26,1f,1,Dysderidae,Stalagtia,hercegovinensis,Stalagtia hercegovinensis,630,42.743.509,18.027.359,Tb,deep cave,,15,,"13,378","14,54366684","14,54366684","24,62399864",1130,29,"87,19003096",,,2,3,1,2439,2204,220
2518,Vištičina jama,Croatia,16.7.2009.,2009-07-16,"1 juv m, 2 juv",3,Dysderidae,Stalagtia,sp. 4_1,Stalagtia sp. 4_1,165,42.985.281,17.557.541,Tb,deep cave,,3,,11,"15,60000038","15,60000038","27,23600006",966,25,"70,13034031",,,,,,,,
2523,Rača špilja,Croatia,31.10.1999.,1999-10-31,"1f, 2 juv",3,Dysderidae,Folkia,sp. 2,Folkia sp. 2,90,42.734.493,16.910.785,Tb,deep cave,,4,"14,8","14,42","16,37628174","16,37628174","22,81538391",662,28,"146,7036244",,,,,,,,
2528,Jama pod Velji vrh,Croatia,14.6.2001.,2001-06-14,"1m, 2f, 1juvm, 2juv",6,Dysderidae,Folkia,sp. 2,Folkia sp. 2,55,42.766.635,16.907.278,Tb,deep cave,,2,,"16,567","16,4216671","16,4216671","22,7733345",668,29,"142,6292455","95,667",,1,2,1,nan,90,41
2530,Špilja za Gromačkom vlakom,Croatia,29.5.2004.,2004-05-29,"1m, 2f, 2juv",5,Dysderidae,Stalagtia,hercegovinensis,Stalagtia hercegovinensis,630,42.743.509,18.027.359,Tb,deep cave,,15,,"13,378","14,54366684","14,54366684","24,62399864",1130,29,"87,19003096",,,2,3,1,2439,2204,220
2532,Male ponte,Croatia,21.6.2001.,2001-06-21,4 juv,4,Dysderidae,Folkia,sp. 5,Folkia sp. 5,258,42.761.389,17.430.786,Tb,deep cave,,7,,"14,45","16,10370445","16,10370445","23,88333321",874,29,"106,0560518",100,,1,1.5,1,nan,106,28.8
2534,Vištičina jama,Croatia,8.2.1998.,1998-02-08,2 juv,2,Dysderidae,Stalagtia,sp. 4_1,Stalagtia sp. 4_1,165,42.985.281,17.557.541,Tb,deep cave,,3,,11,"15,60000038","15,60000038","27,23600006",966,25,"70,13034031",,,,,,,,
2535,Jama u šumi uvale Bjejajka,Croatia,18.6.2011.,2011-06-18,"1f, 3 juv m, 1 juv f",5,Linyphiidae,Palliduphantes,sp. 1,Palliduphantes sp. 1,,42.765.231,17.385.606,tf,deep cave,,6,,"14,133","16,31185913","16,31185913","23,7307682",855,24,"108,3846938","97,2",,3,2.2,1,nan,42,21
2537,Jama u šumi uvale Bjejajka,Croatia,18.6.2011.,2011-06-18,1f,1,Dysderidae,Harpactea,sp. 26,Harpactea sp. 26,,42.765.231,17.385.606,,,,6,,"14,133","16,31185913","16,31185913","23,7307682",855,24,"108,3846938","97,2",,3,2.2,1,nan,42,21
2538,Jama u šumi uvale Bjejajka,Croatia,18.6.2011.,2011-06-18,1m,1,Segestriidae,Segestria,sp. 1,Segestria sp. 1,,42.765.231,17.385.606,,,,6,,"14,133","16,31185913","16,31185913","23,7307682",855,24,"108,3846938","97,2",,3,2.2,1,nan,42,21
2540,Jama pod Sv. Spasom,Croatia,20.6.2001.,2001-06-20,"1f, 1 juv m, 1 juv",3,Linyphiidae,Palliduphantes,sp. 1,Palliduphantes sp. 1,50,42.731.779,17.542.409,tf,deep cave,,6,,"14,6","15,79444408","15,79444408","24,11999893",925,17,"103,7805159",,,6,7,1,nan,42,78
2541,Jama pod Sv. Spasom,Croatia,20.6.2001.,2001-06-20,5 juv,5,Dysderidae,Folkia,inermis,Folkia inermis,50,42.731.779,17.542.409,Tb,deep cave,,6,,"14,6","15,79444408","15,79444408","24,11999893",925,17,"103,7805159",,,6,7,1,nan,42,78
2546,Špilja u Solinama,Croatia,7.8.1996.,1996-08-07,1 juv,1,Dysderidae,Folkia,sp. 5,Folkia sp. 5,83,42.768.021,17.377.062,Tb,deep cave,,5,,"8,95","16,31185913","16,31185913","23,7307682",855,24,"108,5917672","83,7",,22,6,1,nan,47,18
2556,Velika špilja kod Neorića,Croatia,31.7.2007.,2007-07-31,1 juvm,1,Dysderidae,Harpactea,sp.,Harpactea sp.,721,43.686.117,1.655.312,,,,2,,"9,5","11,06483364","11,06483364","25,84800148",934,23,"107,710035",,,2,2.1,1,19,19,0
2557,Peć u Čulinovim raljevinama,Croatia,6.1.2009.,2009-01-06,1f,1,Linyphiidae,Centromerus,cavernarum,Centromerus cavernarum,369,43.605.854,16.575.066,Tf,deep cave,,5,,11,"12,99133301","12,99133301","26,44000053",879,26,"104,4759765",,,1,1,1,nan,42.5,12.5
2565,Jama u šumi uvale Bjejajka,Croatia,10.1.2008.,2008-01-10,"2m, 1f, 2 juv f",5,Linyphiidae,Palliduphantes,sp. 1,Palliduphantes sp. 1,,42.765.231,17.385.606,tf,deep cave,,6,,"14,133","16,31185913","16,31185913","23,7307682",855,24,"108,3846938","97,2",,3,2.2,1,nan,42,21
2566,Jama u šumi uvale Bjejajka,Croatia,10.1.2008.,2008-01-10,1f,1,Leptonetidae,Barusia,maheni,Barusia maheni,,42.765.231,17.385.606,tf,deep cave,,6,,"14,133","16,31185913","16,31185913","23,7307682",855,24,"108,3846938","97,2",,3,2.2,1,nan,42,21
2568,Jama u šumi uvale Bjejajka,Croatia,10.1.2008.,2008-01-10,1f,1,Familia x,Gen.,sp.,Gen. sp.,,42.765.231,17.385.606,,,,6,,"14,133","16,31185913","16,31185913","23,7307682",855,24,"108,3846938","97,2",,3,2.2,1,nan,42,21
2573,Špilja za Gromačkom vlakom,Croatia,5.10.2011.,2011-10-05,1 juv,1,Agelenidae,Histopona,sp.,Histopona sp.,630,42.743.509,18.027.359,,deep cave,,15,,"13,378","14,54366684","14,54366684","24,62399864",1130,29,"87,19003096",,,2,3,1,2439,2204,220
2577,Vranjača špilja kod Dugopolja,Croatia,24.6.2011.,2011-06-24,1f,1,Linyphiidae,Palliduphantes,spelaeorum,Palliduphantes spelaeorum,445,43.562.235,16.648.216,Tf,deep cave,,5,,"8,7","12,21549988","12,21549988","26,12800026",886,21,"96,51736486",,,,,,,,
2578,Špilja u uvali Predpeć,Croatia,9.7.2007.,2007-07-09,1f,1,Nesticidae,Kryptonesticus,eremita,Kryptonesticus eremita,,45.291.576,14.510.419,tf,deep cave,,4,"10,3","10,625","13,89999962","13,89999962","25,40000153",1376,44,"398,0215329",,,4,3,1,25,21,4
2580,Špilja u Solinama,Croatia,8.1.2008.,2008-01-08,"2m, 1 f",3,Leptonetidae,Barusia,maheni,Barusia maheni,83,42.768.021,17.377.062,tf,deep cave,,5,,"8,95","16,31185913","16,31185913","23,7307682",855,24,"108,5917672","83,7",,22,6,1,nan,47,18
2583,Špilja za Gromačkom vlakom,Croatia,5.10.2011.,2011-10-05,1f,1,Agelenidae,Tegenaria,sp. X,Tegenaria sp. X,630,42.743.509,18.027.359,,deep cave,,15,,"13,378","14,54366684","14,54366684","24,62399864",1130,29,"87,19003096",,,2,3,1,2439,2204,220
2584,Špilja za Gromačkom vlakom,Croatia,5.10.2011.,2011-10-05,"1f, 1juv",2,Agelenidae,Histopona,dubia,Histopona dubia,630,42.743.509,18.027.359,tb,deep cave,,15,,"13,378","14,54366684","14,54366684","24,62399864",1130,29,"87,19003096",,,2,3,1,2439,2204,220
2596,Vaganka,Croatia,3.6.2006.,2006-06-03,"1f, 1 juv m, 3 juv",5,Leptonetidae,Cataleptoneta,lingulata,Cataleptoneta lingulata,656,4.433.853,1.543.867,tb,deep cave,,5,,"12,2","7,622666836","7,622666836","26,19600105",1265,29,"257,5927467",95,,,,,,,
2618,Obilježena jama,Croatia,20.6.2003.,2003-06-20,1f,1,Theridiidae,Paidiscura,pallens,Paidiscura pallens,998,4.336.813,17.026.024,,,,2,"2,5","2,5","7,902999878","7,902999878","24,58800125",950,23,"64,69031173",,,,,,,,
2619,Krjava 2,Croatia,27.10.2006.,2006-10-27,1f,1,Anapidae,Comaroma,sp. 1,Comaroma sp. 1,1061,43.329.431,17.027.011,tb,deep cave,,3,,"7,425","12,74867439","12,74867439","25,54545403",898,26,"67,92076497","97,5",,nan,nan,1,nan,nan,nan
2620,Vodena trepetljika,Croatia,20.6.2003.,2003-06-20,1f,1,Theridiidae,Paidiscura,pallens,Paidiscura pallens,1221,43.364.147,17.029.715,,,,1,"7,7","9,5","7,902999878","7,902999878","24,58800125",950,29,"64,66831948","77,7","69,3",nan,nan,1,nan,nan,nan
2621,Spila 2,Croatia,23.3.2004.,2004-03-23,"1m, 1f",2,Mysmenidae,Trogloneta,granulum,Trogloneta granulum,349,4.326.239,17.204.021,Tf,deep cave,,6,12,12,"12,35200024","12,35200024","26,52000046",917,21,"61,25054739","96,3","96,3",0.5,0.7,1,28,24,11
2622,Crna ledenica,Croatia,24.5.2004.,2004-05-24,1m,1,Linyphiidae,Gen. 5,sp. 1,Gen. 5 sp. 1,1557,43.348.162,17.055.328,,,,2,,"0,3","8,441666603","8,441666603","24,99200058",947,26,"63,68523746",,,15,10,1,200,112,72.5
2623,Jama iznad Saranača,Croatia,2.4.2006.,2006-04-02,1f,1,Mysmenidae,Trogloneta,granulum,Trogloneta granulum,777,43.249.007,17.174.663,Tf,deep cave,,7,"10,8","11,112","11,73516655","11,73516655","25,61599922",905,28,"64,87446036",,,2.5,0.5,1,nan,8.6,20.5
2626,Bazgovača,Croatia,26.10.2006.,2006-10-26,1f,1,Linyphiidae,Palliduphantes,spelaeorum,Palliduphantes spelaeorum,652,4.330.647,16.622.143,Tf,deep cave,,3,,"7,2","12,8081665","12,8081665","24,57600021",796,24,"108,9858223",,,5,7,1,nan,47,32
2627,Bazgovača,Croatia,4.8.2004.,2004-08-04,"4f, 1 juvm, 1 juv f",6,Linyphiidae,Palliduphantes,spelaeorum,Palliduphantes spelaeorum,652,4.330.647,16.622.143,Tf,deep cave,,3,,"7,2","12,8081665","12,8081665","24,57600021",796,24,"108,9858223",,,5,7,1,nan,47,32
2628,Bazgovača,Croatia,26.10.2006.,2006-10-26,1f,1,Linyphiidae,Palliduphantes,spelaeorum,Palliduphantes spelaeorum,652,4.330.647,16.622.143,Tf,deep cave,,3,,"7,2","12,8081665","12,8081665","24,57600021",796,24,"108,9858223",,,5,7,1,nan,47,32
2629,Bazgovača,Croatia,5.1.2009.,2009-01-05,"1m, 1 juv f",2,Tetragnathidae,Metellina,merianae,Metellina merianae,652,4.330.647,16.622.143,Tf,deep cave,,3,,"7,2","12,8081665","12,8081665","24,57600021",796,24,"108,9858223",,,5,7,1,nan,47,32
2631,Šipun,Croatia,31.10.2003.,2003-10-31,1 juv,1,Dysderidae,Stalagtia,sp. 1,Stalagtia sp. 1,,42.583.646,18.217.986,Tb,deep cave,,11,,"15,4","15,02037048","15,02037048","24,28333282",1208,2,"111,3036255","97,8",,1.5,2.5,1,165,150,22.5
2632,Pišurka,Croatia,23.4.2004.,2004-04-23,2 juv,2,Dysderidae,Folkia,haasi,Folkia haasi,17,42.959.451,17.129.228,Tb,deep cave,,5,,"13,925","14,0666666","14,0666666","24,28125",833,25,"105,2150766","84,833",,6,1.3,1,86,75,32
2633,Pišurka,Croatia,2.6.2000.,2000-06-02,2 juv,2,Dysderidae,Folkia,haasi,Folkia haasi,17,42.959.451,17.129.228,Tb,deep cave,,5,,"13,925","14,0666666","14,0666666","24,28125",833,25,"105,2150766","84,833",,6,1.3,1,86,75,32
2634,Pišurka,Croatia,2.6.2000.,2000-06-02,"1f, 1 juv f, 1 juv",3,Tetragnathidae,Metellina,merianae,Metellina merianae,17,42.959.451,17.129.228,Tf,deep cave,,5,,"13,925","14,0666666","14,0666666","24,28125",833,25,"105,2150766","84,833",,6,1.3,1,86,75,32
2640,Bukovac,Croatia,7.7.2007.,2007-07-07,2f,2,Linyphiidae,Diplocephalus,cristatus,Diplocephalus cristatus,817,4.534.318,14.757.647,Tx,deep cave,,5,,"7,8","7,299499989","7,299499989","26,94799995",1530,24,"409,5782937","96,5",,8,5,1,nan,136,2
2649,Špilja na Gradini kod Premanture,Croatia,13.7.2005.,2005-07-13,∞ juv,1,Nesticidae,Kryptonesticus,eremita,Kryptonesticus eremita,36,44.810.188,139.075,tf,deep cave,,1,,"13,875","14,23515606","14,23515606","25,72500038",759,24,"305,2263454","93,725",,nan,nan,1,nan,nan,nan
2651,Tučepska vilenjača,Croatia,23.5.2004.,2004-05-23,"1juv m, 1juv f",2,Linyphiidae,Typhlonyphia,sp. 1,Typhlonyphia sp. 1,1242,43.286.465,17.083.638,Tb,deep cave,,8,"10,6","10,731","9,67800045","9,67800045","24,96000099",926,26,"67,32747088",,,6,0.8,1,nan,28,35
2652,Škrabuljica,Croatia,23.6.2006.,2006-06-23,1f,1,Linyphiidae,Centromerus,subcaecus,Centromerus subcaecus,701,42.567.045,18.385.063,Tf,deep cave,,5,,"10,867","12,1378336","12,1378336","24,90799904",1201,29,"102,7796012","97,4",,6,8,1,nan,98,11
2660,Špilja za Gromačkom vlakom,Croatia,29.3.2003.,2003-03-29,"1m, 3 juv",4,Dysderidae,Stalagtia,sp. 5,Stalagtia sp. 5,630,42.743.509,18.027.359,Tb,deep cave,,15,,"13,378","14,54366684","14,54366684","24,62399864",1130,29,"87,19003096",,,2,3,1,2439,2204,220
2661,Špilja na vrh Toraca,Croatia,8.10.2004.,2004-10-08,1f,1,Dysderidae,Stalagtia,sp. 5,Stalagtia sp. 5,193,42.705.575,1.803.049,Tb,deep cave,,3,"15,5","15,275","16,42202377","16,42202377","23,8571434",1128,29,"92,9323532","96,75",100,1,2,1,nan,65.5,17
2662,Škrabuljica,Croatia,1.11.2003.,2003-11-01,1f,1,Dysderidae,Stalagtia,sp. 2,Stalagtia sp. 2,701,42.567.045,18.385.063,Tb,deep cave,,5,,"10,867","12,1378336","12,1378336","24,90799904",1201,29,"102,7796012","97,4",,6,8,1,nan,98,11
2663,Špilja za Gromačkom vlakom,Croatia,25.-26.3.2003.,2003-03-25/2003-03-26,1m,1,Dysderidae,Stalagtia,hercegovinensis,Stalagtia hercegovinensis,630,42.743.509,18.027.359,Tb,deep cave,,15,,"13,378","14,54366684","14,54366684","24,62399864",1130,29,"87,19003096",,,2,3,1,2439,2204,220
2664,Špilja za Gromačkom vlakom,Croatia,25.-26.3.2003.,2003-03-25/2003-03-26,1juv,1,Dysderidae,Stalagtia,hercegovinensis,Stalagtia hercegovinensis,630,42.743.509,18.027.359,Tb,deep cave,,15,,"13,378","14,54366684","14,54366684","24,62399864",1130,29,"87,19003096",,,2,3,1,2439,2204,220
2670,Škrabuljica,Croatia,11.3.2003.,2003-03-11,1m,1,Dysderidae,Stalagtia,sp. 2,Stalagtia sp. 2,701,42.567.045,18.385.063,Tb,deep cave,,5,,"10,867","12,1378336","12,1378336","24,90799904",1201,29,"102,7796012","97,4",,6,8,1,nan,98,11
2672,Špilja za Gromačkom vlakom,Croatia,29.5.2004.,2004-05-29,"1f, 2 juv",3,Dysderidae,Stalagtia,hercegovinensis,Stalagtia hercegovinensis,630,42.743.509,18.027.359,Tb,deep cave,,15,,"13,378","14,54366684","14,54366684","24,62399864",1130,29,"87,19003096",,,2,3,1,2439,2204,220
2677,Špilja za Gromačkom vlakom,Croatia,29.5.2004.,2004-05-29,1 juv m,1,Dysderidae,Stalagtia,sp. 5,Stalagtia sp. 5,630,42.743.509,18.027.359,Tb,deep cave,,15,,"13,378","14,54366684","14,54366684","24,62399864",1130,29,"87,19003096",,,2,3,1,2439,2204,220
2682,Močiljska špilja,Croatia,1.4.2007.,2007-04-01,1 juv,1,Dysderidae,Stalagtia,sp. 5,Stalagtia sp. 5,333,42.689.061,18.071.906,Tb,deep cave,,6,"15,4","14,7","15,5370369","15,5370369","24,25",1154,26,"95,48772633",,,5,2.5,1,1038,938,138
2684,Debela ljut,Croatia,7.4.2006.,2006-04-07,2 juv,2,Dysderidae,Stalagtia,sp. 5,Stalagtia sp. 5,278,42.717.699,18.022.036,Tb,deep cave,,8,"15,6","15,6","14,54366684","14,54366684","24,62399864",1130,32,"91,11277219",,,,,,,,
2685,Debela ljut,Croatia,7.4.2006.,2006-04-07,2 juv,2,Nesticidae,Kryptonesticus,eremita,Kryptonesticus eremita,278,42.717.699,18.022.036,tf,deep cave,,8,"15,6","15,6","14,54366684","14,54366684","24,62399864",1130,32,"91,11277219",,,,,,,,
2687,Špilja za Gromačkom vlakom,Croatia,2.11.2003.,2003-11-02,2 juv,2,Dysderidae,Stalagtia,sp. 5,Stalagtia sp. 5,630,42.743.509,18.027.359,Tb,deep cave,,15,,"13,378","14,54366684","14,54366684","24,62399864",1130,29,"87,19003096",,,2,3,1,2439,2204,220
2688,Ostaševica,Croatia,17.6.2001.,2001-06-17,1 juv,1,Dysderidae,Folkia,inermis,Folkia inermis,302,42.748.959,17.544.404,Tb,deep cave,,9,,"11,4","15,79444408","15,79444408","24,11999893",925,25,"101,3842944",100,,6,5,1,nan,70,20
2693,Gorska jama,Croatia,3.11.2003.,2003-11-03,5 juv,5,Dysderidae,Stalagtia,hercegovinensis,Stalagtia hercegovinensis,179,4.292.697,17.424.809,Tb,deep cave,,2,"10,6","13,3","16,30899048","16,30899048","26,72631454",906,29,"86,44992112","99,9",,nan,nan,1,nan,nan,nan
2696,Špilja za Gromačkom vlakom,Croatia,29.5.2004.,2004-05-29,"1f, 2 juv",3,Dysderidae,Stalagtia,hercegovinensis,Stalagtia hercegovinensis,630,42.743.509,18.027.359,Tb,deep cave,,15,,"13,378","14,54366684","14,54366684","24,62399864",1130,29,"87,19003096",,,2,3,1,2439,2204,220
2698,Močiljska špilja,Croatia,8.10.2004.,2004-10-08,3 juv,3,Dysderidae,Stalagtia,sp. 5,Stalagtia sp. 5,333,42.689.061,18.071.906,Tb,deep cave,,6,"15,4","14,7","15,5370369","15,5370369","24,25",1154,26,"95,48772633",,,5,2.5,1,1038,938,138
2699,Špilja za Gromačkom vlakom,Croatia,25.-26.3.2003.,2003-03-25/2003-03-26,1f,1,Dysderidae,Kaemis,vernalis,Kaemis vernalis,630,42.743.509,18.027.359,Tx,deep cave,,15,,"13,378","14,54366684","14,54366684","24,62399864",1130,29,"87,19003096",,,2,3,1,2439,2204,220
2700,Špilja za Gromačkom vlakom,Croatia,25.-26.3.2003.,2003-03-25/2003-03-26,4 juv,4,Dysderidae,Stalagtia,hercegovinensis,Stalagtia hercegovinensis,630,42.743.509,18.027.359,Tb,deep cave,,15,,"13,378","14,54366684","14,54366684","24,62399864",1130,29,"87,19003096",,,2,3,1,2439,2204,220
2701,Đurovića jama,Croatia,26.3.2004.,2004-03-26,1f/juv raspadnuto,1,Dysderidae,Stalagtia,sp. 1,Stalagtia sp. 1,156,42.559.979,18.263.559,Tb,deep cave,,4,,"17,267","15,93194485","15,93194485","24,30000114",1247,6,"111,7390404",,,1,2,1,156,132,17
2702,Špilja za Gromačkom vlakom,Croatia,29.3.2003.,2003-03-29,1 juv,1,Dysderidae,Stalagtia,sp. 5,Stalagtia sp. 5,630,42.743.509,18.027.359,Tb,deep cave,,15,,"13,378","14,54366684","14,54366684","24,62399864",1130,29,"87,19003096",,,2,3,1,2439,2204,220
2704,Špilja u Solinama,Croatia,18.6.2001.,2001-06-18,1 juv,1,Dysderidae,Folkia,sp. 5,Folkia sp. 5,83,42.768.021,17.377.062,Tb,deep cave,,5,,"8,95","16,31185913","16,31185913","23,7307682",855,24,"108,5917672","83,7",,22,6,1,nan,47,18
2705,Špilja za Gromačkom vlakom,Croatia,29.3.2003.,2003-03-29,1 juv,1,Dysderidae,Stalagtia,sp. 5,Stalagtia sp. 5,630,42.743.509,18.027.359,Tb,deep cave,,15,,"13,378","14,54366684","14,54366684","24,62399864",1130,29,"87,19003096",,,2,3,1,2439,2204,220
2706,Banova ljut,Croatia,7.9.2006.,2006-09-07,1 juv,1,Nesticidae,Kryptonesticus,eremita,Kryptonesticus eremita,278,42.724.023,18.023.649,tf,deep cave,,4,,"15,2","14,54366684","14,54366684","24,62399864",1130,32,"90,15075072",93,,2,1.8,1,nan,306,25
2707,Banova ljut,Croatia,7.9.2006.,2006-09-07,2 juv,2,Dysderidae,Stalagtia,sp. 5,Stalagtia sp. 5,278,42.724.023,18.023.649,Tb,deep cave,,4,,"15,2","14,54366684","14,54366684","24,62399864",1130,32,"90,15075072",93,,2,1.8,1,nan,306,25
2708,Močiljska špilja,Croatia,1.4.2007.,2007-04-01,1 juv,1,Dysderidae,Harpactea,sp.,Harpactea sp.,333,42.689.061,18.071.906,,,,6,"15,4","14,7","15,5370369","15,5370369","24,25",1154,26,"95,48772633",,,5,2.5,1,1038,938,138
2709,Močiljska špilja,Croatia,1.4.2007.,2007-04-01,1 juv,1,Dysderidae,Harpactea,sp.,Harpactea sp.,333,42.689.061,18.071.906,,,,6,"15,4","14,7","15,5370369","15,5370369","24,25",1154,26,"95,48772633",,,5,2.5,1,1038,938,138
2710,Vilinska jama,Croatia,9.6.2000.,2000-06-09,1 juv,1,Dysderidae,Stalagtia,sp. 2,Stalagtia sp. 2,118,42.728.553,17.881.121,Tb,deep cave,,10,,"13,6","16,61458397","16,61458397","23,72142792",1068,24,"91,19914008","84,6",,1,1,1,14.9,10.3,5.8
2712,Špilja kod Nerezinog dola,Croatia,21.6.2001.,2001-06-21,1 juv,1,Dysderidae,Folkia,inermis,Folkia inermis,177,42.758.378,17.436.094,Tb,deep cave,,6,,"13,883","16,10370445","16,10370445","23,88333321",874,24,"106,1225494","95,342",,6,2.5,1,nan,35,5.5
2718,Špilja za Gromačkom vlakom,Croatia,2.11.2003.,2003-11-02,5 juv,5,Dysderidae,Stalagtia,sp. 5,Stalagtia sp. 5,630,42.743.509,18.027.359,Tb,deep cave,,15,,"13,378","14,54366684","14,54366684","24,62399864",1130,29,"87,19003096",,,2,3,1,2439,2204,220
2721,Špilja za Gromačkom vlakom,Croatia,29.5.2004.,2004-05-29,1f,1,Dysderidae,Stalagtia,sp. 5,Stalagtia sp. 5,630,42.743.509,18.027.359,Tb,deep cave,,15,,"13,378","14,54366684","14,54366684","24,62399864",1130,29,"87,19003096",,,2,3,1,2439,2204,220
2723,Špilja za Gromačkom vlakom,Croatia,2.11.2003.,2003-11-02,2 juv,2,Dysderidae,Stalagtia,sp.,Stalagtia sp.,630,42.743.509,18.027.359,,,,15,,"13,378","14,54366684","14,54366684","24,62399864",1130,29,"87,19003096",,,2,3,1,2439,2204,220
2727,Đurovića jama,Croatia,31.10.2003.,2003-10-31,1juv/f,1,Dysderidae,Rhode,sp. 2,Rhode sp. 2,156,42.559.979,18.263.559,Tb,deep cave,,4,,"17,267","15,93194485","15,93194485","24,30000114",1247,6,"111,7390404",,,1,2,1,156,132,17
2729,Špilja za Gromačkom vlakom,Croatia,2.11.2003.,2003-11-02,2 juv,2,Dysderidae,Stalagtia,sp. 5,Stalagtia sp. 5,630,42.743.509,18.027.359,,,,15,,"13,378","14,54366684","14,54366684","24,62399864",1130,29,"87,19003096",,,2,3,1,2439,2204,220
2730,Špilja za Gromačkom vlakom,Croatia,8.9.2006.,2006-09-08,1 juv,1,Dysderidae,Stalagtia,sp.,Stalagtia sp.,630,42.743.509,18.027.359,,,,15,,"13,378","14,54366684","14,54366684","24,62399864",1130,29,"87,19003096",,,2,3,1,2439,2204,220
2737,Vilinska jama,Croatia,2.4.2007.,2007-04-02,1m,1,Leptonetidae,Barusia,maheni,Barusia maheni,118,42.728.553,17.881.121,tf,deep cave,,10,,"13,6","16,61458397","16,61458397","23,72142792",1068,24,"91,19914008","84,6",,1,1,1,14.9,10.3,5.8
2744,Špilja za Gromačkom vlakom,Croatia,22.8.2005.,2005-08-22,1 juv,1,Dysderidae,Stalagtia,sp.,Stalagtia sp.,630,42.743.509,18.027.359,,,,15,,"13,378","14,54366684","14,54366684","24,62399864",1130,29,"87,19003096",,,2,3,1,2439,2204,220
2745,Špilja za Gromačkom vlakom,Croatia,29.5.2004.,2004-05-29,1juv,1,Dysderidae,Stalagtia,sp. 5,Stalagtia sp. 5,630,42.743.509,18.027.359,Tb,deep cave,,15,,"13,378","14,54366684","14,54366684","24,62399864",1130,29,"87,19003096",,,2,3,1,2439,2204,220
2747,Debela ljut,Croatia,7.4.2006.,2006-04-07,1juv,1,Dysderidae,Stalagtia,sp.,Stalagtia sp.,278,42.717.699,18.022.036,,,,8,"15,6","15,6","14,54366684","14,54366684","24,62399864",1130,32,"91,11277219",,,,,,,,
2748,Škrabuljica,Croatia,11.3.2003.,2003-03-11,"3f, 2 juv",5,Linyphiidae,Centromerus,subcaecus,Centromerus subcaecus,701,42.567.045,18.385.063,Tf,deep cave,,5,,"10,867","12,1378336","12,1378336","24,90799904",1201,29,"102,7796012","97,4",,6,8,1,nan,98,11
2749,Špilja za Gromačkom vlakom,Croatia,2.11.2003.,2003-11-02,1m,1,Linyphiidae,Palliduphantes,sp. 3,Palliduphantes sp. 3,630,42.743.509,18.027.359,,,,15,,"13,378","14,54366684","14,54366684","24,62399864",1130,29,"87,19003096",,,2,3,1,2439,2204,220
2752,Škrabuljica,Croatia,1.11.2003.,2003-11-01,"1f, 1juvm, 3 juv",5,Linyphiidae,Centromerus,subcaecus,Centromerus subcaecus,701,42.567.045,18.385.063,Tf,deep cave,,5,,"10,867","12,1378336","12,1378336","24,90799904",1201,29,"102,7796012","97,4",,6,8,1,nan,98,11
2756,Vranjača špilja kod Dugopolja,Croatia,29.4.2012.,2012-04-29,1 juv,1,Dysderidae,Stalagtia,sp. 4,Stalagtia sp. 4,445,43.562.235,16.648.216,Tb,deep cave,,5,,"8,7","12,21549988","12,21549988","26,12800026",886,21,"96,51736486",,,,,,,,
2761,Balića špilja,Croatia,28.4.2012.,2012-04-28,1juv,1,Dysderidae,Rhode,sp. 1,Rhode sp. 1,438,4.357.296,1.657.002,Tb,deep cave,,11,,"7,2","12,25566673","12,25566673","25,68000031",872,23,"105,1255288",,,70,7,1,194,155,50
2762,Balića špilja,Croatia,28.4.2012.,2012-04-28,"1f, 1 juv",2,Linyphiidae,Troglohyphantes,giromettai,Troglohyphantes giromettai,438,4.357.296,1.657.002,tf,deep cave,,11,,"7,2","12,25566673","12,25566673","25,68000031",872,23,"105,1255288",,,70,7,1,194,155,50
2764,Vištičina jama,Croatia,16.7.1997.,1997-07-16,2f,2,Linyphiidae,Palliduphantes,spelaeorum,Palliduphantes spelaeorum,165,42.985.281,17.557.541,Tf,deep cave,,3,,11,"15,60000038","15,60000038","27,23600006",966,25,"70,13034031",,,,,,,,
2771,Jujnovića špilja,Croatia,1.5.2012.,2012-05-01,1f,1,Linyphiidae,Typhlonyphia,sp. 1,Typhlonyphia sp. 1,463,43.266.579,1.719.798,Tb,deep cave,,6,"13,8","10,85","12,35200024","12,35200024","26,52000046",917,29,"61,15708825",,,5,2.5,1,108,40,16
2772,Jujnovića špilja,Croatia,1.5.2012.,2012-05-01,1f,1,Agelenidae,Histopona,conveniens,Histopona conveniens,463,43.266.579,1.719.798,Tf,deep cave,,6,"13,8","10,85","12,35200024","12,35200024","26,52000046",917,29,"61,15708825",,,5,2.5,1,108,40,16
2773,Jujnovića špilja,Croatia,1.5.2012.,2012-05-01,1f,1,Pholcidae,Stygopholcus,absoloni,Stygopholcus absoloni,463,43.266.579,1.719.798,,deep cave,,6,"13,8","10,85","12,35200024","12,35200024","26,52000046",917,29,"61,15708825",,,5,2.5,1,108,40,16
2774,Jujnovića špilja,Croatia,1.5.2012.,2012-05-01,"1f, 1m, 1 juv",3,Agelenidae,Histopona,conveniens,Histopona conveniens,463,43.266.579,1.719.798,Tf,deep cave,,6,"13,8","10,85","12,35200024","12,35200024","26,52000046",917,29,"61,15708825",,,5,2.5,1,108,40,16
2775,Jujnovića špilja,Croatia,1.5.2012.,2012-05-01,1m,1,Linyphiidae,Typhlonyphia,sp. 1,Typhlonyphia sp. 1,463,43.266.579,1.719.798,Tb,deep cave,,6,"13,8","10,85","12,35200024","12,35200024","26,52000046",917,29,"61,15708825",,,5,2.5,1,108,40,16
2777,Jezero,Croatia,16.3.2002.,2002-03-16,"1f, 5 juv",6,Nesticidae,Kryptonesticus,arenstorffi,Kryptonesticus arenstorffi,964,42.580.381,18.356.073,tb,deep cave,,8,,"7,567","12,93216705","12,93216705","24,86800003",1208,29,"104,2091301","96,5",,1,0.5,1,20.5,nan,12
2779,Škrabuljica,Croatia,7.11.2003.,2003-11-07,"1f, 2 juv",3,Linyphiidae,Centromerus,subcaecus,Centromerus subcaecus,701,42.567.045,18.385.063,Tf,deep cave,,5,,"10,867","12,1378336","12,1378336","24,90799904",1201,29,"102,7796012","97,4",,6,8,1,nan,98,11
2783,Šimunkovića špilja,Croatia,6.4.2007.,2007-04-06,1f,1,Leptonetidae,Barusia,korculana,Barusia korculana,78,42.978.588,17.129.081,tb,deep cave,,7,,15,"14,0666666","14,0666666","24,28125",833,29,"102,605262",,,7,1,1,22.7,19.9,1
2881,Biserujka,Croatia,8.4.2012.,2012-04-08,1f,1,Nesticidae,Kryptonesticus,eremita,Kryptonesticus eremita,27,45.187.464,1.460.981,tf,deep cave,,1,,"14,8","14,12559509","14,12559509","25,39523888",1232,32,"386,9540194",,,nan,nan,1,nan,nan,nan
2886,Medova buža,Croatia,23.5.2010.,2010-05-23,"1m, 2 juv",3,Nesticidae,Kryptonesticus,eremita,Kryptonesticus eremita,51,44.813.345,14.745.867,,deep cave,,1,,"14,9","14,50555611","14,50555611","24,99523926",1052,44,"340,9428521","74,5",,,,,,,
2898,Kraljicina špilja,Croatia,19.10.2007.,2007-10-19,1 juv,1,Nesticidae,Kryptonesticus,eremita,Kryptonesticus eremita,189,43.073.661,16.100.773,tf,deep cave,,2,,"15,1","15,32770824","15,32770824","22,59999847",585,44,"176,649054",91,,4,2,1,nan,126,6
2901,Špilja pod Kapelu,Croatia,13.4.2003.,2003-04-13,"1 juv f, 3 juv",4,Linyphiidae,Palliduphantes,sp.,Palliduphantes sp.,102,43.184.949,16.434.233,,,,5,,"12,717","16,20546913","16,20546913","23,36250114",714,21,"135,8656791","97,5",,nan,nan,1,nan,nan,nan
2906,Tanki Ratac,Croatia,21.10.2007.,2007-10-21,1 juv,1,Nesticidae,Kryptonesticus,eremita,Kryptonesticus eremita,215,43.360.229,16.569.356,tf,deep cave,,3,,"16,6","14,83833313","14,83833313","25,04799843",787,17,"111,4255656",91,,nan,nan,1,nan,nan,nan
2916,Pišurka,Croatia,18.4.2011.,2011-04-18,"1 juv m, 3 juv",4,Nesticidae,Kryptonesticus,eremita,Kryptonesticus eremita,17,42.959.451,17.129.228,,deep cave,,5,,"13,925","14,0666666","14,0666666","24,28125",833,25,"105,2150766","84,833",,6,1.3,1,86,75,32
2945,Pušina,Croatia,20.4.2008.,2008-04-20,3f,3,Linyphiidae,Porrhomma,egeria,Porrhomma egeria,729,45.740.585,1.535.653,,deep cave,,4,,"8,3","8,075166702","8,075166702","28,34399986",1294,23,"410,6956067",,,0.75,0.5,1,nan,328,56
3000,Pušina,Croatia,30.11.2002.,2002-11-30,2m,2,Linyphiidae,Porrhomma,egeria,Porrhomma egeria,729,45.740.585,1.535.653,,deep cave,,4,,"8,3","8,075166702","8,075166702","28,34399986",1294,23,"410,6956067",,,0.75,0.5,1,nan,328,56
3004,Miljacka 2,Croatia,6.1.2005.,2005-01-06,1 juv m,1,Pholcidae,Holocnemus,sp.,Holocnemus sp.,224,440.002,16.016.234,,,,4,,"12,6","13,29333305","13,29333305","28,4279995",894,32,"177,675492",,,,,,,,
3005,Ješkalovica,Croatia,4.1.2009.,2009-01-04,1f,1,Linyphiidae,Asthenargus,bracianus,Asthenargus bracianus,194,43.299.857,16.839.313,tf,deep cave,,2,,"15,4","15,64131927","15,64131927","25,73750114",817,20,"87,88201212","95,1",,1,1,1,nan,21,29
3007,Atila,Croatia,28.7.2012.,2012-07-28,1f,1,Dysderidae,Stalita,pretneri,Stalita pretneri,927,44.677.748,15.110.767,Tb,deep cave,,2,,"5,5","6,273333549","6,273333549","24,96800041",1565,25,"315,3232512","90,9",,7,11,1,2410,2051,41.5
3012,Manita peć,Croatia,23.9.2012.,2012-09-23,1 juv,1,Dysderidae,Stalita,pretneri,Stalita pretneri,374,44.314.302,15.475.264,Tb,deep cave,,7,"8,8","9,525","10,42683315","10,42683315","27,29200172",1068,28,"252,2759525",,,nan,nan,1,nan,nan,nan
3013,Manita peć,Croatia,25.7.2012.,2012-07-25,1f,1,Dysderidae,Parastalita,stygia,Parastalita stygia,374,44.314.302,15.475.264,Tb,deep cave,,7,"8,8","9,525","10,42683315","10,42683315","27,29200172",1068,28,"252,2759525",,,nan,nan,1,nan,nan,nan
3014,Manita peć,Croatia,23.9.2012.,2012-09-23,1f,1,Dysderidae,Stalita,pretneri,Stalita pretneri,374,44.314.302,15.475.264,Tb,deep cave,,7,"8,8","9,525","10,42683315","10,42683315","27,29200172",1068,28,"252,2759525",,,nan,nan,1,nan,nan,nan
3015,Manita peć,Croatia,25.7.2012.,2012-07-25,1f,1,Dysderidae,Parastalita,stygia,Parastalita stygia,374,44.314.302,15.475.264,Tb,deep cave,,7,"8,8","9,525","10,42683315","10,42683315","27,29200172",1068,28,"252,2759525",,,nan,nan,1,nan,nan,nan
3016,Manita peć,Croatia,25.7.2012.,2012-07-25,1m,1,Dysderidae,Parastalita,stygia,Parastalita stygia,374,44.314.302,15.475.264,Tb,deep cave,,7,"8,8","9,525","10,42683315","10,42683315","27,29200172",1068,28,"252,2759525",,,nan,nan,1,nan,nan,nan
3017,Atila,Croatia,20.5.2012.,2012-05-20,1f,1,Linyphiidae,Troglohyphantes,sp. 4,Troglohyphantes sp. 4,927,44.677.748,15.110.767,tb,deep cave,,2,,"5,5","6,273333549","6,273333549","24,96800041",1565,25,"315,3232512","90,9",,7,11,1,2410,2051,41.5
3022,Jazinka,Croatia,20.10.2012.,2012-10-20,1m,1,Dysderidae,Stalagtia,sp. 4,Stalagtia sp. 4,162,43.975.892,16.029.694,Tb,deep cave,,2,,13,"13,5286665","13,5286665","28,34799957",864,23,"174,9933462",,,2,1,1,42,42,4
3023,Stara jametina,Croatia,17.10.2012.,2012-10-17,1m,1,Dysderidae,Stalagtia,sp. 4,Stalagtia sp. 4,161,43.794.009,1.600.259,Tb,deep cave,,6,"13,4","13,2","14,21000004","14,21000004","27,66799927",790,20,"170,7986956","90,95","91,7",12,8,1,nan,188,85
3025,Stara jametina,Croatia,17.10.2012.,2012-10-17,1 juv,1,Dysderidae,Stalagtia,sp. 4,Stalagtia sp. 4,161,43.794.009,1.600.259,Tb,deep cave,,6,"13,4","13,2","14,21000004","14,21000004","27,66799927",790,20,"170,7986956","90,95","91,7",12,8,1,nan,188,85
3026,Miljacka 2,Croatia,18.10.2012.,2012-10-18,"1m, 2 juvm, 2 juv",5,Nesticidae,Kryptonesticus,eremita,Kryptonesticus eremita,224,440.002,16.016.234,tf,deep cave,,4,,"12,6","13,29333305","13,29333305","28,4279995",894,32,"177,675492",,,,,,,,
3028,Miljacka 2,Croatia,21.10.2012.,2012-10-21,1m,1,Nesticidae,Kryptonesticus,eremita,Kryptonesticus eremita,224,440.002,16.016.234,tf,deep cave,,4,,"12,6","13,29333305","13,29333305","28,4279995",894,32,"177,675492",,,,,,,,
3031,Sedrena špilja iza mlina,Croatia,19.10.2012.,2012-10-19,"1f, 1 juv",2,Nesticidae,Kryptonesticus,eremita,Kryptonesticus eremita,247,44.013.402,16.067.798,tf,deep cave,,6,,"7,9","13,18266678","13,18266678","28,31999969",900,29,"173,0421739",,,6,3,1,124,124,4
3032,Jazinka,Croatia,20.10.2012.,2012-10-20,"1f, 2 juv",3,Nesticidae,Kryptonesticus,eremita,Kryptonesticus eremita,162,43.975.892,16.029.694,tf,deep cave,,2,,13,"13,5286665","13,5286665","28,34799957",864,23,"174,9933462",,,2,1,1,42,42,4
3033,Miljacka 2,Croatia,18.10.2012.,2012-10-18,1m,1,Nesticidae,Kryptonesticus,eremita,Kryptonesticus eremita,224,440.002,16.016.234,tf,deep cave,,4,,"12,6","13,29333305","13,29333305","28,4279995",894,32,"177,675492",,,,,,,,
3036,Jama na Bibinovcu,Croatia,22.10.2012.,2012-10-22,1f,1,Nesticidae,Kryptonesticus,eremita,Kryptonesticus eremita,208,43.908.757,15.957.245,tf,deep cave,,3,,"11,7","13,98799992","13,98799992","27,64400101",812,26,"179,6127377",,,,,,,,
3038,Stara jametina,Croatia,17.10.2012.,2012-10-17,"1m, 3f",4,Linyphiidae,Micrargus,herbigradus,Micrargus herbigradus,161,43.794.009,1.600.259,Tf,deep cave,,6,"13,4","13,2","14,21000004","14,21000004","27,66799927",790,20,"170,7986956","90,95","91,7",12,8,1,nan,188,85
3040,Stara jametina,Croatia,17.10.2012.,2012-10-17,"3f, 1 juv",4,Linyphiidae,Micrargus,herbigradus,Micrargus herbigradus,161,43.794.009,1.600.259,Tf,deep cave,,6,"13,4","13,2","14,21000004","14,21000004","27,66799927",790,20,"170,7986956","90,95","91,7",12,8,1,nan,188,85
3041,Stara jametina,Croatia,17.10.2012.,2012-10-17,1f,1,Theridiidae,Episinus,cavernicola,Episinus cavernicola,161,43.794.009,1.600.259,Tf,deep cave,,6,"13,4","13,2","14,21000004","14,21000004","27,66799927",790,20,"170,7986956","90,95","91,7",12,8,1,nan,188,85
3042,Stara jametina,Croatia,17.10.2012.,2012-10-17,"1f, 1 juv",2,Theridiidae,Episinus,cavernicola,Episinus cavernicola,161,43.794.009,1.600.259,Tf,deep cave,,6,"13,4","13,2","14,21000004","14,21000004","27,66799927",790,20,"170,7986956","90,95","91,7",12,8,1,nan,188,85
3043,Stara jametina,Croatia,17.10.2012.,2012-10-17,"1f, 1m",2,Linyphiidae,Micrargus,herbigradus,Micrargus herbigradus,161,43.794.009,1.600.259,Tf,deep cave,,6,"13,4","13,2","14,21000004","14,21000004","27,66799927",790,20,"170,7986956","90,95","91,7",12,8,1,nan,188,85
3044,Stara jametina,Croatia,17.10.2012.,2012-10-17,"2m, 1f",3,Linyphiidae,Micrargus,herbigradus,Micrargus herbigradus,161,43.794.009,1.600.259,Tf,deep cave,,6,"13,4","13,2","14,21000004","14,21000004","27,66799927",790,20,"170,7986956","90,95","91,7",12,8,1,nan,188,85
3045,Stara jametina,Croatia,17.10.2012.,2012-10-17,"1m, 1f",2,Linyphiidae,Micrargus,herbigradus,Micrargus herbigradus,161,43.794.009,1.600.259,Tf,deep cave,,6,"13,4","13,2","14,21000004","14,21000004","27,66799927",790,20,"170,7986956","90,95","91,7",12,8,1,nan,188,85
3047,Stara jametina,Croatia,17.10.2012.,2012-10-17,1f,1,Linyphiidae,Micrargus,herbigradus,Micrargus herbigradus,161,43.794.009,1.600.259,Tf,deep cave,,6,"13,4","13,2","14,21000004","14,21000004","27,66799927",790,20,"170,7986956","90,95","91,7",12,8,1,nan,188,85
3048,Stara jametina,Croatia,17.10.2012.,2012-10-17,"1f, 1m",2,Linyphiidae,Micrargus,herbigradus,Micrargus herbigradus,161,43.794.009,1.600.259,Tf,deep cave,,6,"13,4","13,2","14,21000004","14,21000004","27,66799927",790,20,"170,7986956","90,95","91,7",12,8,1,nan,188,85
3049,Stara jametina,Croatia,17.10.2012.,2012-10-17,"2f, 1 juv",3,Theridiidae,Episinus,cavernicola,Episinus cavernicola,161,43.794.009,1.600.259,Tf,deep cave,,6,"13,4","13,2","14,21000004","14,21000004","27,66799927",790,20,"170,7986956","90,95","91,7",12,8,1,nan,188,85
3050,Jama na Bibinovcu,Croatia,22.10.2012.,2012-10-22,1m,1,Agelenidae,Tegenaria,annulata,Tegenaria annulata,208,43.908.757,15.957.245,Tf,deep cave,,3,,"11,7","13,98799992","13,98799992","27,64400101",812,26,"179,6127377",,,,,,,,
3051,Miljacka 2,Croatia,18.10.2012.,2012-10-18,"2m, 1f",3,Agelenidae,Tegenaria,domestica,Tegenaria domestica,224,440.002,16.016.234,Tf,deep cave,,4,,"12,6","13,29333305","13,29333305","28,4279995",894,32,"177,675492",,,,,,,,
3052,Miljacka 2,Croatia,18.10.2012.,2012-10-18,"1m, 2 juv",3,Agelenidae,Tegenaria,domestica,Tegenaria domestica,224,440.002,16.016.234,Tf,deep cave,,4,,"12,6","13,29333305","13,29333305","28,4279995",894,32,"177,675492",,,,,,,,
3056,Keranova golubinka,Croatia,20.10.2012.,2012-10-20,"3f, 1 juv",4,Linyphiidae,Palliduphantes,byzantinus,Palliduphantes byzantinus,257,43.934.367,16.058.782,Tf,deep cave,,4,,"7,95","13,46049976","13,46049976","28,50800133",863,28,"169,8905011",,,nan,nan,1,nan,nan,nan
3057,Sedrena špilja kod stola,Croatia,19.10.2012.,2012-10-19,"1f, 3juv",4,Nesticidae,Kryptonesticus,eremita,Kryptonesticus eremita,247,4.401.385,16.068.978,tf,deep cave,,2,"6,1","6,1","13,18266678","13,18266678","28,31999969",900,29,"172,9455136","85,7","85,7",1,1,1,nan,21,2
3058,Sedrena špilja kod stola,Croatia,19.10.2012.,2012-10-19,1f,1,Nesticidae,Kryptonesticus,eremita,Kryptonesticus eremita,247,4.401.385,16.068.978,tf,deep cave,,2,"6,1","6,1","13,18266678","13,18266678","28,31999969",900,29,"172,9455136","85,7","85,7",1,1,1,nan,21,2
3060,Miljacka 2,Croatia,18.10.2012.,2012-10-18,1f,1,Nesticidae,Kryptonesticus,eremita,Kryptonesticus eremita,224,440.002,16.016.234,tf,deep cave,,4,,"12,6","13,29333305","13,29333305","28,4279995",894,32,"177,675492",,,,,,,,
3061,Sedrena špilja s jamskim ulazom,Croatia,19.10.2012.,2012-10-19,1f,1,Nesticidae,Kryptonesticus,eremita,Kryptonesticus eremita,247,44.013.829,16.069.202,tf,deep cave,,2,,"9,3","13,18266678","13,18266678","28,31999969",900,29,"172,9211316","95,6",,1,0.5,1,23,18,6
3062,Jama na Bibinovcu,Croatia,22.10.2012.,2012-10-22,"1f, 1 juv",2,Nesticidae,Kryptonesticus,eremita,Kryptonesticus eremita,208,43.908.757,15.957.245,tf,deep cave,,3,,"11,7","13,98799992","13,98799992","27,64400101",812,26,"179,6127377",,,,,,,,
3064,Sedrena špilja iza mlina,Croatia,19.10.2012.,2012-10-19,1f,1,Leptonetidae,Barusia,maheni,Barusia maheni,247,44.013.402,16.067.798,tf,deep cave,,6,,"7,9","13,18266678","13,18266678","28,31999969",900,29,"173,0421739",,,6,3,1,124,124,4
3065,Sedrena špilja iza mlina,Croatia,19.10.2012.,2012-10-19,1m,1,Leptonetidae,Barusia,maheni,Barusia maheni,247,44.013.402,16.067.798,tf,deep cave,,6,,"7,9","13,18266678","13,18266678","28,31999969",900,29,"173,0421739",,,6,3,1,124,124,4
3066,Sedrena špilja iza mlina,Croatia,19.10.2012.,2012-10-19,"1f, 3 juv",4,Leptonetidae,Barusia,maheni,Barusia maheni,247,44.013.402,16.067.798,tf,deep cave,,6,,"7,9","13,18266678","13,18266678","28,31999969",900,29,"173,0421739",,,6,3,1,124,124,4
3067,Sedrena špilja iza mlina,Croatia,19.10.2012.,2012-10-19,1 juv f,1,Leptonetidae,Barusia,maheni,Barusia maheni,247,44.013.402,16.067.798,tf,deep cave,,6,,"7,9","13,18266678","13,18266678","28,31999969",900,29,"173,0421739",,,6,3,1,124,124,4
3069,Stara jametina,Croatia,17.10.2012.,2012-10-17,1f,1,Linyphiidae,Palliduphantes,istrianus,Palliduphantes istrianus,161,43.794.009,1.600.259,Tf,deep cave,,6,"13,4","13,2","14,21000004","14,21000004","27,66799927",790,20,"170,7986956","90,95","91,7",12,8,1,nan,188,85
3070,Keranova golubinka,Croatia,20.10.2012.,2012-10-20,1m,1,Linyphiidae,Centromerus,cavernarum,Centromerus cavernarum,257,43.934.367,16.058.782,Tf,deep cave,,4,,"7,95","13,46049976","13,46049976","28,50800133",863,28,"169,8905011",,,nan,nan,1,nan,nan,nan
3072,Keranova golubinka,Croatia,20.10.2012.,2012-10-20,1f,1,Linyphiidae,Gen. 4,sp. 1,Gen. 4 sp. 1,257,43.934.367,16.058.782,,,,4,,"7,95","13,46049976","13,46049976","28,50800133",863,28,"169,8905011",,,nan,nan,1,nan,nan,nan
3073,Keranova golubinka,Croatia,20.10.2012.,2012-10-20,"1m, 1 juv",2,Linyphiidae,Gen.,sp. X,Gen. sp. X,257,43.934.367,16.058.782,,,,4,,"7,95","13,46049976","13,46049976","28,50800133",863,28,"169,8905011",,,nan,nan,1,nan,nan,nan
3075,Jama na Bibinovcu,Croatia,22.10.2012.,2012-10-22,1m,1,Linyphiidae,Gen.,sp. X,Gen. sp. X,208,43.908.757,15.957.245,,,,3,,"11,7","13,98799992","13,98799992","27,64400101",812,26,"179,6127377",,,,,,,,
3077,Jazinka,Croatia,16.12.2012.,2012-12-16,"1f, 1juv",2,Nesticidae,Kryptonesticus,eremita,Kryptonesticus eremita,162,43.975.892,16.029.694,tf,deep cave,,2,,13,"13,5286665","13,5286665","28,34799957",864,23,"174,9933462",,,2,1,1,42,42,4
3081,Jagodnjak,Croatia,17.12.2012.,2012-12-17,"1f, 1 juvm, 1 juv",3,Nesticidae,Kryptonesticus,eremita,Kryptonesticus eremita,263,44.002.869,16.074.441,tf,deep cave,,2,,"12,3","13,18266678","13,18266678","28,31999969",900,23,"171,7600045",,,2,5,1,46,35,32
3108,Trišića jama,Croatia,16.12.2102.,2012-12-16,"1f, 1 m, 1 prosoma (f?)",2,Linyphiidae,Palliduphantes,istrianus,Palliduphantes istrianus,224,43.949.231,15.947.793,Tf,deep cave,,2,,"10,38","13,53916645","13,53916645","27,88800049",838,33,"182,369015",,,11,2.5,1,119,55,65
3109,Trišića jama,Croatia,16.12.2102.,2012-12-16,1m,1,Linyphiidae,Micrargus,herbigradus,Micrargus herbigradus,224,43.949.231,15.947.793,Tf,deep cave,,2,,"10,38","13,53916645","13,53916645","27,88800049",838,33,"182,369015",,,11,2.5,1,119,55,65
3112,Sedrena špilja iza mlina,Croatia,14.12.2012.,2012-12-14,1m,1,Leptonetidae,Barusia,maheni,Barusia maheni,247,44.013.402,16.067.798,tf,deep cave,,6,,"7,9","13,18266678","13,18266678","28,31999969",900,29,"173,0421739",,,6,3,1,124,124,4
3113,Keranova golubinka,Croatia,18.12.2012.,2012-12-18,1f,1,Linyphiidae,Centromerus,cavernarum,Centromerus cavernarum,257,43.934.367,16.058.782,Tf,deep cave,,4,,"7,95","13,46049976","13,46049976","28,50800133",863,28,"169,8905011",,,nan,nan,1,nan,nan,nan
3114,Keranova golubinka,Croatia,18.12.2012.,2012-12-18,"1m, 7f, 2 juv",1,Linyphiidae,Palliduphantes,byzantinus,Palliduphantes byzantinus,257,43.934.367,16.058.782,Tf,deep cave,,4,,"7,95","13,46049976","13,46049976","28,50800133",863,28,"169,8905011",,,nan,nan,1,nan,nan,nan
3115,Keranova golubinka,Croatia,18.12.2012.,2012-12-18,1f,1,Linyphiidae,Palliduphantes,byzantinus,Palliduphantes byzantinus,257,43.934.367,16.058.782,Tf,deep cave,,4,,"7,95","13,46049976","13,46049976","28,50800133",863,28,"169,8905011",,,nan,nan,1,nan,nan,nan
3117,Keranova golubinka,Croatia,18.12.2012.,2012-12-18,"2f, 2 juv",4,Linyphiidae,Palliduphantes,byzantinus,Palliduphantes byzantinus,257,43.934.367,16.058.782,Tf,deep cave,,4,,"7,95","13,46049976","13,46049976","28,50800133",863,28,"169,8905011",,,nan,nan,1,nan,nan,nan
3118,Trišića jama,Croatia,16.12.2102.,2012-12-16,2f,2,Linyphiidae,Palliduphantes,istrianus,Palliduphantes istrianus,224,43.949.231,15.947.793,Tf,deep cave,,2,,"10,38","13,53916645","13,53916645","27,88800049",838,33,"182,369015",,,11,2.5,1,119,55,65
3119,Trišića jama,Croatia,16.12.2102.,2012-12-16,2f,2,Linyphiidae,Micrargus,herbigradus,Micrargus herbigradus,224,43.949.231,15.947.793,Tf,deep cave,,2,,"10,38","13,53916645","13,53916645","27,88800049",838,33,"182,369015",,,11,2.5,1,119,55,65
3120,Stara jametina,Croatia,15.12.2012.,2012-12-15,1m,1,Theridiidae,Episinus,cavernicola,Episinus cavernicola,161,43.794.009,1.600.259,Tf,deep cave,,6,"13,4","13,2","14,21000004","14,21000004","27,66799927",790,20,"170,7986956","90,95","91,7",12,8,1,nan,188,85
3122,Jagodnjak,Croatia,17.12.2012.,2012-12-17,1m,1,Linyphiidae,Palliduphantes,istrianus,Palliduphantes istrianus,263,44.002.869,16.074.441,Tf,deep cave,,2,,"12,3","13,18266678","13,18266678","28,31999969",900,23,"171,7600045",,,2,5,1,46,35,32
3123,Sedrena špilja kod stola,Croatia,14.12.2012.,2012-12-14,1 juv,1,Pholcidae,Holocnemus,sp.,Holocnemus sp.,247,4.401.385,16.068.978,Tf?,,,2,"6,1","6,1","13,18266678","13,18266678","28,31999969",900,29,"172,9455136","85,7","85,7",1,1,1,nan,21,2
3131,Sedrena špilja iza mlina,Croatia,14.12.2012.,2012-12-14,"1m, 3f, 1 juv",5,Leptonetidae,Barusia,maheni,Barusia maheni,247,44.013.402,16.067.798,tf,deep cave,,6,,"7,9","13,18266678","13,18266678","28,31999969",900,29,"173,0421739",,,6,3,1,124,124,4
3133,Sedrena špilja iza mlina,Croatia,17.12.2012.,2012-12-17,2juv/f,2,Leptonetidae,Barusia,maheni,Barusia maheni,247,44.013.402,16.067.798,tf,deep cave,,6,,"7,9","13,18266678","13,18266678","28,31999969",900,29,"173,0421739",,,6,3,1,124,124,4
3135,Sedrena špilja iza mlina,Croatia,17.12.2012.,2012-12-17,"2f , 1 m",3,Leptonetidae,Barusia,maheni,Barusia maheni,247,44.013.402,16.067.798,tf,deep cave,,6,,"7,9","13,18266678","13,18266678","28,31999969",900,29,"173,0421739",,,6,3,1,124,124,4
3136,Sedrena špilja iza mlina,Croatia,17.12.2012.,2012-12-17,1m,1,Leptonetidae,Barusia,maheni,Barusia maheni,247,44.013.402,16.067.798,tf,deep cave,,6,,"7,9","13,18266678","13,18266678","28,31999969",900,29,"173,0421739",,,6,3,1,124,124,4
3137,Špilja u kamenolomu Tounj,Croatia,7.10.2007.,2007-10-07,"1f, 2 juv",3,Linyphiidae,Troglohyphantes,croaticus,Troglohyphantes croaticus,306,45.245.525,15.318.946,tb,deep cave,,3,,"9,54","10,14599991","10,14599991","28,85200119",1306,7,"353,6071019","94,233",,1,0.6,1,8639,8487,47
3138,Špilja u kamenolomu Tounj,Croatia,23.1.1999.,1999-01-23,"1f, 1 juv m, 1 juv",3,Linyphiidae,Troglohyphantes,croaticus,Troglohyphantes croaticus,306,45.245.525,15.318.946,tb,deep cave,,3,,"9,54","10,14599991","10,14599991","28,85200119",1306,7,"353,6071019","94,233",,1,0.6,1,8639,8487,47
3139,Špilja u kamenolomu Tounj,Croatia,23.1.1999.,1999-01-23,"7f, 1 juv",8,Linyphiidae,Porrhomma,egeria,Porrhomma egeria,306,45.245.525,15.318.946,,deep cave,,3,,"9,54","10,14599991","10,14599991","28,85200119",1306,7,"353,6071019","94,233",,1,0.6,1,8639,8487,47
3140,Špilja u kamenolomu Tounj,Croatia,23.1.1999.,1999-01-23,1 juv,1,Dysderidae,Stalita,pretneri,Stalita pretneri,306,45.245.525,15.318.946,Tb,deep cave,,3,,"9,54","10,14599991","10,14599991","28,85200119",1306,7,"353,6071019","94,233",,1,0.6,1,8639,8487,47
3141,Tounjčica,Croatia,18.6.2006.,2006-06-18,1f,1,Linyphiidae,Centromerus,cavernarum,Centromerus cavernarum,306,45.248.722,15.322.408,Tf,deep cave,,5,,14,"10,14599991","10,14599991","28,85200119",1306,23,"353,7031634",,,nan,nan,1,nan,nan,nan
3142,Tounjčica,Croatia,30.3.2004.,2004-03-30,2f,2,Linyphiidae,Centromerus,cavernarum,Centromerus cavernarum,306,45.248.722,15.322.408,Tf,deep cave,,5,,14,"10,14599991","10,14599991","28,85200119",1306,23,"353,7031634",,,nan,nan,1,nan,nan,nan
3144,Tounjčica,Croatia,18.6.2006.,2006-06-18,2 f,2,Linyphiidae,Centromerus,cavernarum,Centromerus cavernarum,306,45.248.722,15.322.408,Tf,deep cave,,5,,14,"10,14599991","10,14599991","28,85200119",1306,23,"353,7031634",,,nan,nan,1,nan,nan,nan
3157,Đutno,Croatia,11.5.1998.,1998-05-11,"2m, 1f",3,Dysderidae,Parastalita,stygia,Parastalita stygia,218,45.415.607,15.233.039,Tb,deep cave,,4,,"7,75","10,4248333","10,4248333","28,8239994",1290,23,"379,8005434",,,7.5,5,1,nan,328,34
3158,Đutno,Croatia,11.5.1998.,1998-05-11,1f,1,Dysderidae,Stalita,pretneri,Stalita pretneri,218,45.415.607,15.233.039,Tb,deep cave,,4,,"7,75","10,4248333","10,4248333","28,8239994",1290,23,"379,8005434",,,7.5,5,1,nan,328,34
3168,Đutno,Croatia,3.10.1999.,1999-10-03,"1f, 2 juv",3,Dysderidae,Stalita,pretneri,Stalita pretneri,218,45.415.607,15.233.039,Tb,deep cave,,4,,"7,75","10,4248333","10,4248333","28,8239994",1290,23,"379,8005434",,,7.5,5,1,nan,328,34
3171,Đutno,Croatia,2.5.2000.,2000-05-02,1f,1,Dysderidae,Parastalita,stygia,Parastalita stygia,218,45.415.607,15.233.039,Tb,deep cave,,4,,"7,75","10,4248333","10,4248333","28,8239994",1290,23,"379,8005434",,,7.5,5,1,nan,328,34
3187,Maklutača,Croatia,2.12.2012.,2012-12-02,"2f, 2m, 3 juv",7,Linyphiidae,Troglohyphantes,giromettai,Troglohyphantes giromettai,415,43.569.268,16.620.515,tf,deep cave,,6,,"6,25","11,86699963","11,86699963","25,86800003",883,29,"99,53597793",,,11,6.5,1,152,140,39
3188,Balića špilja,Croatia,12.5.2012.,2012-05-12,1f,1,Linyphiidae,Troglohyphantes,giromettai,Troglohyphantes giromettai,438,4.357.296,1.657.002,tf,deep cave,,11,,"7,2","12,25566673","12,25566673","25,68000031",872,23,"105,1255288",,,70,7,1,194,155,50
3189,Balića špilja,Croatia,12.5.2012.,2012-05-12,1f,1,Pholcidae,Stygopholcus,absoloni,Stygopholcus absoloni,438,4.357.296,1.657.002,,deep cave,,11,,"7,2","12,25566673","12,25566673","25,68000031",872,23,"105,1255288",,,70,7,1,194,155,50
3190,Balića špilja,Croatia,12.5.2012.,2012-05-12,"2m, 1f",3,Leptonetidae,Barusia,maheni,Barusia maheni,438,4.357.296,1.657.002,tf,deep cave,,11,,"7,2","12,25566673","12,25566673","25,68000031",872,23,"105,1255288",,,70,7,1,194,155,50
3191,Balića špilja,Croatia,12.5.2012.,2012-05-12,4f,4,Zodariidae,Zodarion,sp. 1,Zodarion sp. 1,438,4.357.296,1.657.002,,,,11,,"7,2","12,25566673","12,25566673","25,68000031",872,23,"105,1255288",,,70,7,1,194,155,50
3197,Balića špilja,Croatia,12.5.2012.,2012-05-12,"2f, 2juv",4,Linyphiidae,Troglohyphantes,strandi,Troglohyphantes strandi,438,4.357.296,1.657.002,tb,deep cave,,11,,"7,2","12,25566673","12,25566673","25,68000031",872,23,"105,1255288",,,70,7,1,194,155,50
3199,Balića špilja,Croatia,12.5.2012.,2012-05-12,"1m, 1 juv",2,Linyphiidae,Troglohyphantes,giromettai,Troglohyphantes giromettai,438,4.357.296,1.657.002,tf,deep cave,,11,,"7,2","12,25566673","12,25566673","25,68000031",872,23,"105,1255288",,,70,7,1,194,155,50
3205,Špilja uz put za Vrdovo,Croatia,28.7.2012.,2012-07-28,1 juv,1,Dysderidae,Harpactea,sp.,Harpactea sp.,722,43.963.557,16.649.787,,,,1,"5,7","5,7","9,187832832","9,187832832","28,01199913",1054,21,"111,2025497",,,,,,,,
3215,Kornjatuša,Croatia,19.7.1997.,1997-07-19,1f? R,1,Dysderidae,Stalagtia,sp. 4_1,Stalagtia sp. 4_1,542,4.297.909,17.673.966,Tb,deep cave,,5,,"10,5","14,43300056","14,43300056","27,01200104",1017,26,"63,78359658",,,,,,,,
3229,Movrica,Croatia,17.6.2001.,2001-06-17,3 juv R,3,Agelenidae,Histopona,bidens,Histopona bidens,147,42.752.604,17.551.145,tb,deep cave,,6,,"11,9","16,45000076","16,45000076","24,5",925,25,"100,5400609",,,4,11,1,nan,82,6
3232,Špilja za Gromačkom vlakom,Croatia,8.9.2006.,2006-09-08,1 juv R,1,Dysderidae,Stalagtia,sp. 5,Stalagtia sp. 5,630,42.743.509,18.027.359,Tb,deep cave,,15,,"13,378","14,54366684","14,54366684","24,62399864",1130,29,"87,19003096",,,2,3,1,2439,2204,220
3234,Pišurka,Croatia,23.4.2004.,2004-04-23,"1m, 1f, 4 juv R",6,Dysderidae,Folkia,haasi,Folkia haasi,17,42.959.451,17.129.228,Tb,deep cave,,5,,"13,925","14,0666666","14,0666666","24,28125",833,25,"105,2150766","84,833",,6,1.3,1,86,75,32
3235,Kaverna 781,Croatia,26.8.2005.,2005-08-26,1 juv R,1,Dysderidae,Stalagtia,sp. 1,Stalagtia sp. 1,55,4.252.633,183.382,Tb,deep cave,,4,,"12,3","16,00799942","16,00799942","24,41199875",1258,21,"110,0890104",99,,1,1.3,1,nan,142,0
3250,Topolska peć,Croatia,14.9.2007.,2007-09-14,"1f, 1 juv R",2,Linyphiidae,Troglohyphantes,brignolii,Troglohyphantes brignolii,1012,4.530.489,14.212.681,tb,deep cave,,3,,"6,4","8,69833374","8,69833374","24,88399887",1569,23,"389,4132415",,,nan,nan,1,nan,nan,nan
3259,Špilja kod mlina Miljacki (Miljacka 4),Croatia,6.1.2005.,2005-01-06,1f R,1,Agelenidae,Tegenaria,sp. 7,Tegenaria sp. 7,185,44.003.485,16.019.087,,,,2,,16,"13,29333305","13,29333305","28,4279995",894,32,"177,5545614",,,,,,,,
3263,Manita peć,Croatia,23.9.2012.,2012-09-23,"1f, 1 juv",2,Agelenidae,Histopona,egonpretneri,Histopona egonpretneri,374,44.314.302,15.475.264,Tb,deep cave,,7,"8,8","9,525","10,42683315","10,42683315","27,29200172",1068,28,"252,2759525",,,nan,nan,1,nan,nan,nan
3264,Manita peć,Croatia,23.9.2012.,2012-09-23,1 juv,1,Agelenidae,Histopona,sp.,Histopona sp.,374,44.314.302,15.475.264,,,,7,"8,8","9,525","10,42683315","10,42683315","27,29200172",1068,28,"252,2759525",,,nan,nan,1,nan,nan,nan
3265,Manita peć,Croatia,23.9.2012.,2012-09-23,"1m, 1 juv",2,Leptonetidae,Cataleptoneta,lingulata,Cataleptoneta lingulata,374,44.314.302,15.475.264,tb,deep cave,,7,"8,8","9,525","10,42683315","10,42683315","27,29200172",1068,28,"252,2759525",,,nan,nan,1,nan,nan,nan
3266,Manita peć,Croatia,20.4.2013.,2013-04-20,1m,1,Agelenidae,Histopona,egonpretneri,Histopona egonpretneri,374,44.314.302,15.475.264,Tb,deep cave,,7,"8,8","9,525","10,42683315","10,42683315","27,29200172",1068,28,"252,2759525",,,nan,nan,1,nan,nan,nan
3268,Manita peć,Croatia,20.4.2013.,2013-04-20,1m,1,Dysderidae,Parastalita,stygia,Parastalita stygia,374,44.314.302,15.475.264,Tb,deep cave,,7,"8,8","9,525","10,42683315","10,42683315","27,29200172",1068,28,"252,2759525",,,nan,nan,1,nan,nan,nan
3269,Manita peć,Croatia,3.12.2011.,2011-12-03,1 juv,1,Agelenidae,Histopona,sp.,Histopona sp.,374,44.314.302,15.475.264,,,,7,"8,8","9,525","10,42683315","10,42683315","27,29200172",1068,28,"252,2759525",,,nan,nan,1,nan,nan,nan
3272,Manita peć,Croatia,23.9.2012.,2012-09-23,2 juv,2,Agelenidae,Histopona,sp.,Histopona sp.,374,44.314.302,15.475.264,,,,7,"8,8","9,525","10,42683315","10,42683315","27,29200172",1068,28,"252,2759525",,,nan,nan,1,nan,nan,nan
3274,Manita peć,Croatia,20.12.2012.,2012-12-20,"1m, 3f, 2 juv",6,Leptonetidae,Cataleptoneta,lingulata,Cataleptoneta lingulata,374,44.314.302,15.475.264,tb,deep cave,,7,"8,8","9,525","10,42683315","10,42683315","27,29200172",1068,28,"252,2759525",,,nan,nan,1,nan,nan,nan
3275,Manita peć,Croatia,3.12.2011.,2011-12-03,"2m, 1f",3,Leptonetidae,Cataleptoneta,lingulata,Cataleptoneta lingulata,374,44.314.302,15.475.264,tb,deep cave,,7,"8,8","9,525","10,42683315","10,42683315","27,29200172",1068,28,"252,2759525",,,nan,nan,1,nan,nan,nan
3276,Manita peć,Croatia,3.12.2011.,2011-12-03,"4m, 1f",5,Leptonetidae,Cataleptoneta,lingulata,Cataleptoneta lingulata,374,44.314.302,15.475.264,tb,deep cave,,7,"8,8","9,525","10,42683315","10,42683315","27,29200172",1068,28,"252,2759525",,,nan,nan,1,nan,nan,nan
3277,Manita peć,Croatia,20.12.2012.,2012-12-20,1 juv,1,Dysderidae,Parastalita,stygia,Parastalita stygia,374,44.314.302,15.475.264,Tb,deep cave,,7,"8,8","9,525","10,42683315","10,42683315","27,29200172",1068,28,"252,2759525",,,nan,nan,1,nan,nan,nan
3278,Manita peć,Croatia,1.9.2012.,2012-09-01,1 juv,1,Agelenidae,Histopona,sp.,Histopona sp.,374,44.314.302,15.475.264,,,,7,"8,8","9,525","10,42683315","10,42683315","27,29200172",1068,28,"252,2759525",,,nan,nan,1,nan,nan,nan
3280,Manita peć,Croatia,20.4.2013.,2013-04-20,1 juv,1,Dysderidae,Stalita,pretneri,Stalita pretneri,374,44.314.302,15.475.264,Tb,deep cave,,7,"8,8","9,525","10,42683315","10,42683315","27,29200172",1068,28,"252,2759525",,,nan,nan,1,nan,nan,nan
3281,Manita peć,Croatia,3.12.2013.,2013-12-03,1 juv,1,Dysderidae,Parastalita,stygia,Parastalita stygia,374,44.314.302,15.475.264,Tb,deep cave,,7,"8,8","9,525","10,42683315","10,42683315","27,29200172",1068,28,"252,2759525",,,nan,nan,1,nan,nan,nan
3284,Manita peć,Croatia,20.4.2013.,2013-04-20,1 juv,1,Dysderidae,Parastalita,stygia,Parastalita stygia,374,44.314.302,15.475.264,Tb,deep cave,,7,"8,8","9,525","10,42683315","10,42683315","27,29200172",1068,28,"252,2759525",,,nan,nan,1,nan,nan,nan
3287,Manita peć,Croatia,10.2.2013.,2013-02-10,1m,1,Familia x,Gen.,sp.,Gen. sp.,374,44.314.302,15.475.264,,,,7,"8,8","9,525","10,42683315","10,42683315","27,29200172",1068,28,"252,2759525",,,nan,nan,1,nan,nan,nan
3300,Gorska jama,Croatia,3.11.2003.,2003-11-03,"1m, 1 juv",2,Leptonetidae,Barusia,maheni,Barusia maheni,179,4.292.697,17.424.809,tf,deep cave,,2,"10,6","13,3","16,30899048","16,30899048","26,72631454",906,29,"86,44992112","99,9",,nan,nan,1,nan,nan,nan
3301,Špilja na Pozalicu,Croatia,14.6.2001.,2001-06-14,"1f, 2 juv",3,Leptonetidae,Barusia,sp. 1,Barusia sp. 1,61,4.276.131,169.129,tb,deep cave,,4,"12,65",14,"16,4216671","16,4216671","22,7733345",668,29,"143,02697",94,,nan,nan,1,nan,nan,nan
3302,Gorska jama,Croatia,3.11.2003.,2003-11-03,"1f, 1m, 2 juv",4,Leptonetidae,Barusia,maheni,Barusia maheni,179,4.292.697,17.424.809,tf,deep cave,,2,"10,6","13,3","16,30899048","16,30899048","26,72631454",906,29,"86,44992112","99,9",,nan,nan,1,nan,nan,nan
3310,Špilja pod Kaštel,Croatia,14.6.2001.,2001-06-14,1f,1,Leptonetidae,Barusia,sp. 1,Barusia sp. 1,44,42.768.041,16.899.005,tb,deep cave,,2,"15,3","16,95","16,4216671","16,4216671","22,7733345",668,29,"142,9000056","97,25",,nan,nan,1,nan,nan,nan
3314,Jezero na Gatuli,Croatia,2.10.2005.,2005-10-02,1f,1,Leptonetidae,Barusia,sp. 1,Barusia sp. 1,54,42.960.756,16.003.363,tb,deep cave,,1,"15,6","16,1","16,36354256","16,36354256","22,04166794",542,26,"194,3326648",92,93,7,3,1,nan,29,27
3317,Jezero na Gatuli,Croatia,18.10.2007.,2007-10-18,"1m, 1f",2,Leptonetidae,Barusia,sp. 1,Barusia sp. 1,54,42.960.756,16.003.363,tb,deep cave,,1,"15,6","16,1","16,36354256","16,36354256","22,04166794",542,26,"194,3326648",92,93,7,3,1,nan,29,27
3320,Mrgića ponor (suha pećina),Croatia,9.1.1999.,1999-01-09,1 juv f,1,Leptonetidae,Gen. 2,sp. 1,Gen. 2 sp. 1,233,45.267.996,15.469.321,,deep cave,,1,,"9,05","10,56266689","10,56266689","29,30400085",1197,29,"344,8308889",,,,,,,,
3324,Jezero na Gatuli,Croatia,18.10.2007.,2007-10-18,"4f, 2m, 1 juv",7,Leptonetidae,Barusia,sp. 1,Barusia sp. 1,54,42.960.756,16.003.363,tb,deep cave,,1,"15,6","16,1","16,36354256","16,36354256","22,04166794",542,26,"194,3326648",92,93,7,3,1,nan,29,27
3327,Poskokova jama,Croatia,2.8.2002.,2002-08-02,1f,1,Leptonetidae,Barusia,korculana,Barusia korculana,655,43.001.888,17.134.002,tb,deep cave,,4,,"12,3","14,34500027","14,34500027","24,36666679",826,28,"99,19045362",94,,1,0.5,1,nan,20,19
3353,Peć u Čulinovim raljevinama,Croatia,6.1.2009.,2009-01-06,"3m, 1f",4,Leptonetidae,Barusia,maheni,Barusia maheni,369,43.605.854,16.575.066,tf,deep cave,,5,,11,"12,99133301","12,99133301","26,44000053",879,26,"104,4759765",,,1,1,1,nan,42.5,12.5
3355,Čagjina jama,Croatia,6.4.2007.,2007-04-06,2m,2,Leptonetidae,Barusia,korculana,Barusia korculana,197,42.977.147,17.155.166,tb,deep cave,,5,,"17,5","14,0666666","14,0666666","24,28125",833,20,"101,5489359",,,0.7,0.7,1,26.8,8.2,18.6
3356,Jezero,Croatia,16.3.2002.,2002-03-16,"1m, 2f, 3 juv",6,Pholcidae,Stygopholcus,skotophilus,Stygopholcus skotophilus,964,42.580.381,18.356.073,,deep cave,,8,,"7,567","12,93216705","12,93216705","24,86800003",1208,29,"104,2091301","96,5",,1,0.5,1,20.5,nan,12
3360,Jezero,Croatia,28.5.2004.,2004-05-28,2 juv,2,Pholcidae,Stygopholcus,skotophilus,Stygopholcus skotophilus,964,42.580.381,18.356.073,,deep cave,,8,,"7,567","12,93216705","12,93216705","24,86800003",1208,29,"104,2091301","96,5",,1,0.5,1,20.5,nan,12
3367,Kukor,Croatia,2.1.1999.,1999-01-02,"1m, 1f, 1 juv",3,Pholcidae,Stygopholcus,absoloni,Stygopholcus absoloni,587,43.355.609,16.991.707,,deep cave,,10,,"15,4","12,63749981","12,63749981","25,40833473",906,29,"68,94753675",,,1,1,1,264,213,40
3369,Tučepska vilenjača,Croatia,30.4.2012.,2012-04-30,1 juv,1,Linyphiidae,Typhlonyphia,sp. 1,Typhlonyphia sp. 1,1242,43.286.465,17.083.638,Tb,deep cave,,8,"10,6","10,731","9,67800045","9,67800045","24,96000099",926,26,"67,32747088",,,6,0.8,1,nan,28,35
3370,Tučepska vilenjača,Croatia,30.4.2012.,2012-04-30,1f,1,Pholcidae,Stygopholcus,absoloni,Stygopholcus absoloni,1242,43.286.465,17.083.638,,deep cave,,8,"10,6","10,731","9,67800045","9,67800045","24,96000099",926,26,"67,32747088",,,6,0.8,1,nan,28,35
3374,Velika špilja kod Neorića,Croatia,31.7.2007.,2007-07-31,1m,1,Pholcidae,Stygopholcus,absoloni,Stygopholcus absoloni,721,43.686.117,1.655.312,,deep cave,,2,,"9,5","11,06483364","11,06483364","25,84800148",934,23,"107,710035",,,2,2.1,1,19,19,0
3384,Kornjatuša,Croatia,2.11.2013.,2013-11-02,2f,2,Pholcidae,Stygopholcus,absoloni,Stygopholcus absoloni,542,4.297.909,17.673.966,,deep cave,,5,,"10,5","14,43300056","14,43300056","27,01200104",1017,26,"63,78359658",,,,,,,,
3388,Kornjatuša,Croatia,2.11.2013.,2013-11-02,1f,1,Leptonetidae,Sulcia,sp.,Sulcia sp.,542,4.297.909,17.673.966,,,,5,,"10,5","14,43300056","14,43300056","27,01200104",1017,26,"63,78359658",,,,,,,,
3396,Balića špilja,Croatia,5.2013.,2013-05,1 juv m,1,Dysderidae,Rhode,sp. 1,Rhode sp. 1,438,4.357.296,1.657.002,Tb,deep cave,,11,,"7,2","12,25566673","12,25566673","25,68000031",872,23,"105,1255288",,,70,7,1,194,155,50
3412,Kukova peć,Croatia,30.11.2014.,2014-11-30,"3f, 2m, 3 juv",8,Tetragnathidae,Meta,bourneti,Meta bourneti,185,42.726.992,1.796.566,Tf,deep cave,,5,17,"16,6","15,07569408","15,07569408","24,35416603",1115,26,"90,07229603",,,1,1.2,1,nan,81.5,22
3452,Šipun,Croatia,5.8.1969.,1969-08-05,1f,1,Linyphiidae,Palliduphantes,brignolii,Palliduphantes brignolii,,42.583.646,18.217.986,Tb,deep cave,,11,,"15,4","15,02037048","15,02037048","24,28333282",1208,2,"111,3036255","97,8",,1.5,2.5,1,165,150,22.5
3530,Močiljska špilja,Croatia,26.8.2014.,2014-08-26,3f,3,Leptonetidae,Sulcia,sp.,Sulcia sp.,333,42.689.061,18.071.906,,,,6,"15,4","14,7","15,5370369","15,5370369","24,25",1154,26,"95,48772633",,,5,2.5,1,1038,938,138
3531,Jama na vrh Prodoli,Croatia,23.8.2014.,2014-08-23,1m,1,Leptonetidae,Barusia,maheni,Barusia maheni,278,42.720.837,18.021.231,tf,deep cave,,1,,"21,6","14,54366684","14,54366684","24,62399864",1130,32,"90,63957603",,,4,0.5,1,nan,7,6.5
3533,Vilinska jama,Croatia,5.6.2014.,2014-06-05,"2m, 2f",4,Leptonetidae,Barusia,maheni,Barusia maheni,118,42.728.553,17.881.121,tf,deep cave,,10,,"13,6","16,61458397","16,61458397","23,72142792",1068,24,"91,19914008","84,6",,1,1,1,14.9,10.3,5.8
3534,Tihinja,Croatia,8.6.2014.,2014-06-08,2f,2,Linyphiidae,Centromerus,raridentatus sp.n.,Centromerus raridentatus sp.n.,51,42.866.729,1.767.021,,,,5,,"9,8","16,36354256","16,36354256","26,23500061",1001,25,"79,07159234","83,1",,,,,,,
3535,Tihinja,Croatia,8.6.2014.,2014-06-08,"3f, 2m, 3 juv",8,Linyphiidae,Palliduphantes,sp. 6,Palliduphantes sp. 6,51,42.866.729,1.767.021,,,,5,,"9,8","16,36354256","16,36354256","26,23500061",1001,25,"79,07159234","83,1",,,,,,,
3536,Tihinja,Croatia,8.6.2014.,2014-06-08,"1m, 1f, 2juvm",4,Leptonetidae,Sulcia,sp. 13,Sulcia sp. 13,51,42.866.729,1.767.021,,deep cave,,5,,"9,8","16,36354256","16,36354256","26,23500061",1001,25,"79,07159234","83,1",,,,,,,
3544,Jama na Strmici,Croatia,11.4.2015.,2015-04-11,1m,1,Dysderidae,Dasumia,amoena,Dasumia amoena,144,42.767.364,17.452.506,tx,deep cave,,6,,"12,1","16,10370445","16,10370445","23,88333321",874,29,"103,9966606",,,3,2,1,39,25,27.5
3547,Dočina špilja,Croatia,11.4.2015.,2015-04-11,5 juv,5,Agelenidae,Histopona,sp.,Histopona sp.,174,42.758.091,17.489.642,tx,,,1,,"14,6","16,23472214","16,23472214","24,23999786",891,29,"103,0911444",,,3.8,2,1,nan,31,9
3549,Špilja kod Nerezinog dola,Croatia,5.4.2015.,2015-04-05,2 juv,2,Dysderidae,Folkia,inermis,Folkia inermis,177,42.758.378,17.436.094,tb,deep cave,,6,,"13,883","16,10370445","16,10370445","23,88333321",874,24,"106,1225494","95,342",,6,2.5,1,nan,35,5.5
3550,Jama na Brekalcima,Croatia,6.5.2015.,2015-05-06,1juv,1,Agelenidae,Histopona,bidens,Histopona bidens,109,42.781.895,17.407.747,tb,deep cave,,1,,"12,867","16,31185913","16,31185913","23,7307682",855,25,"104,9005462","99,833",,12,3,1,nan,20,77.5
3552,Jama iznad Dugog polja,Croatia,11.4.2015.,2015-04-11,1f,1,Leptonetidae,Barusia,maheni,Barusia maheni,221,4.275.873,17.448.697,tf,deep cave,,5,"16,3","15,9","16,10370445","16,10370445","23,88333321",874,29,"105,3324935","98,75","97,2",1,1.5,1,nan,41,54
3553,Jama iznad Dugog polja,Croatia,11.4.2015.,2015-04-11,1 juv,1,Agelenidae,Histopona,bidens,Histopona bidens,221,4.275.873,17.448.697,tb,deep cave,,5,"16,3","15,9","16,10370445","16,10370445","23,88333321",874,29,"105,3324935","98,75","97,2",1,1.5,1,nan,41,54
3554,Jama Veja Gora,Croatia,11.4.2015.,2015-04-11,2 juv,2,Agelenidae,Histopona,bidens,Histopona bidens,183,42.780.094,17.417.734,tb,deep cave,,1,,"12,4","16,10370445","16,10370445","23,88333321",874,25,"104,4943375",,,1.4,3,1,nan,5,11
3555,Movrica,Croatia,8.4.2015.,2015-04-08,"1 juv f, 1 juv",2,Agelenidae,Histopona,bidens,Histopona bidens,147,42.752.604,17.551.145,tb,deep cave,,6,,"11,9","16,45000076","16,45000076","24,5",925,25,"100,5400609",,,4,11,1,nan,82,6
3556,Jama za Sv. Ilijom,Croatia,10.4.2015.,2015-04-10,1 juv,1,Agelenidae,Histopona,bidens,Histopona bidens,257,42.744.428,17.515.269,tb,deep cave,,3,,"12,533","15,98333359","15,98333359","24,29999924",909,29,"103,5442348",100,,3,2,1,nan,80,65
3557,Špilja u Solinama,Croatia,4.4.2015.,2015-04-04,2 juv m,2,Leptonetidae,Sulcia,sp.,Sulcia sp.,83,42.768.021,17.377.062,tx,,,5,,"8,95","16,31185913","16,31185913","23,7307682",855,24,"108,5917672","83,7",,22,6,1,nan,47,18
3559,Ostaševica,Croatia,8.4.2015.,2015-04-08,1 juv,1,Agelenidae,Histopona,bidens,Histopona bidens,302,42.748.959,17.544.404,tb,deep cave,,9,,"11,4","15,79444408","15,79444408","24,11999893",925,25,"101,3842944",100,,6,5,1,nan,70,20
3560,Špilja na Bugarima,Croatia,7.4.2015.,2015-04-07,1 juv,1,Agelenidae,Histopona,bidens,Histopona bidens,165,42.752.459,17.474.369,tb,deep cave,,3,,"11,9","16,23472214","16,23472214","24,23999786",891,25,"104,6781117",,,5,2,1,nan,24,1.3
3561,Špilja na Bugarima,Croatia,7.4.2015.,2015-04-07,1f,1,Leptonetidae,Sulcia,sp.,Sulcia sp.,165,42.752.459,17.474.369,tx,,,3,,"11,9","16,23472214","16,23472214","24,23999786",891,25,"104,6781117",,,5,2,1,nan,24,1.3
3562,Jarač na ponti od Graca,Croatia,6.4.2015.,2015-04-06,1f,1,Agelenidae,Histopona,bidens,Histopona bidens,,42.785.308,17.392.067,tb,deep cave,,2,,"10,833","16,31185913","16,31185913","23,7307682",855,28,"105,4881868",,,14,6,1,nan,72,28
3566,Špilja na Bugarima,Croatia,7.4.2015.,2015-04-07,1 juv,1,Agelenidae,Histopona,bidens,Histopona bidens,165,42.752.459,17.474.369,tb,deep cave,,3,,"11,9","16,23472214","16,23472214","24,23999786",891,25,"104,6781117",,,5,2,1,nan,24,1.3
3567,Špilja na Bugarima,Croatia,7.4.2015.,2015-04-07,"1m, 1 juv m",2,Leptonetidae,Barusia,maheni,Barusia maheni,165,42.752.459,17.474.369,tf,deep cave,,3,,"11,9","16,23472214","16,23472214","24,23999786",891,25,"104,6781117",,,5,2,1,nan,24,1.3
3577,Špilja kod Vrha spile,Croatia,6.4.2015.,2015-04-06,1 juv,1,Agelenidae,Tegenaria,sp.,Tegenaria sp.,183,42.776.757,17.420.591,tx,,,3,,"9,4","16,10370445","16,10370445","23,88333321",874,29,"104,7346977","74,3",,12.5,5,1,nan,30,10.6
3578,Špilja kod Vrha spile,Croatia,6.4.2015.,2015-04-06,"1m, 1f/juv",2,Leptonetidae,Barusia,maheni,Barusia maheni,183,42.776.757,17.420.591,tf,deep cave,,3,,"9,4","16,10370445","16,10370445","23,88333321",874,29,"104,7346977","74,3",,12.5,5,1,nan,30,10.6
3581,Špilja kod Nerezinog dola,Croatia,6.4.2015.,2015-04-06,1f/juv,1,Leptonetidae,Barusia,maheni,Barusia maheni,177,42.758.378,17.436.094,tf,deep cave,,6,,"13,883","16,10370445","16,10370445","23,88333321",874,24,"106,1225494","95,342",,6,2.5,1,nan,35,5.5
3583,Jarač na ponti od Graca,Croatia,6.4.2015.,2015-04-06,1 juv m,1,Leptonetidae,Barusia,maheni,Barusia maheni,,42.785.308,17.392.067,tf,deep cave,,2,,"10,833","16,31185913","16,31185913","23,7307682",855,28,"105,4881868",,,14,6,1,nan,72,28
3587,Galičnjak,Croatia,9.4.2015.,2015-04-09,1f,1,Leptonetidae,Barusia,maheni,Barusia maheni,160,42.720.118,1.767.071,tf,deep cave,,11,,"13,6","16,1147728","16,1147728","23,72727203",971,25,"99,37896954",,,50,40,1,nan,130,60
3588,Galičnjak,Croatia,9.4.2015.,2015-04-09,"2m, 3f, 2juv m, 4 juv",11,Leptonetidae,Sulcia,sp. 6,Sulcia sp. 6,160,42.720.118,1.767.071,tf,cave entrance,,11,,"13,6","16,1147728","16,1147728","23,72727203",971,25,"99,37896954",,,50,40,1,nan,130,60
3597,Špilja kod Nerezinog dola,Croatia,5.4.2015.,2015-04-05,1 juv,1,Dysderidae,Folkia,inermis,Folkia inermis,177,42.758.378,17.436.094,Tb,deep cave,,6,,"13,883","16,10370445","16,10370445","23,88333321",874,24,"106,1225494","95,342",,6,2.5,1,nan,35,5.5
3598,Špilja kod Nerezinog dola,Croatia,5.4.2015.,2015-04-05,"1f, 3 juv",4,Agelenidae,Histopona,bidens,Histopona bidens,177,42.758.378,17.436.094,tb,deep cave,,6,,"13,883","16,10370445","16,10370445","23,88333321",874,24,"106,1225494","95,342",,6,2.5,1,nan,35,5.5
3601,Jama iznad Dugog polja,Croatia,11.4.2015.,2015-04-11,"1f, 3 juv",4,Agelenidae,Histopona,bidens,Histopona bidens,221,4.275.873,17.448.697,tb,deep cave,,5,"16,3","15,9","16,10370445","16,10370445","23,88333321",874,29,"105,3324935","98,75","97,2",1,1.5,1,nan,41,54
3602,Jama iznad Dugog polja,Croatia,11.4.2015.,2015-04-11,"1 juv m, 2 juv",3,Agelenidae,Histopona,sp.,Histopona sp.,221,4.275.873,17.448.697,,,,5,"16,3","15,9","16,10370445","16,10370445","23,88333321",874,29,"105,3324935","98,75","97,2",1,1.5,1,nan,41,54
3603,Jama iznad Dugog polja,Croatia,11.4.2015.,2015-04-11,1 juv,1,Dysderidae,Folkia,inermis,Folkia inermis,221,4.275.873,17.448.697,Tb,deep cave,,5,"16,3","15,9","16,10370445","16,10370445","23,88333321",874,29,"105,3324935","98,75","97,2",1,1.5,1,nan,41,54
3604,Stražbenica,Croatia,6.3.2015.,2015-03-06,1m,1,Nesticidae,Kryptonesticus,eremita,Kryptonesticus eremita,172,43.697.353,16.029.618,tf,deep cave,,3,,"14,7","14,88466644","14,88466644","26,93600082",739,26,"165,8524113",100,,7,2.5,1,86,86,7
3605,Stražbenica,Croatia,14.12.2014.,2014-12-14,"1m, 1f",2,Nesticidae,Kryptonesticus,eremita,Kryptonesticus eremita,172,43.697.353,16.029.618,tf,deep cave,,3,,"14,7","14,88466644","14,88466644","26,93600082",739,26,"165,8524113",100,,7,2.5,1,86,86,7
3606,Stražbenica,Croatia,14.12.2014.,2014-12-14,1 juv,1,Dysderidae,Stalagtia,sp. 4,Stalagtia sp. 4,172,43.697.353,16.029.618,Tb,deep cave,,3,,"14,7","14,88466644","14,88466644","26,93600082",739,26,"165,8524113",100,,7,2.5,1,86,86,7
3607,Stražbenica,Croatia,14.12.2014.,2014-12-14,3f,3,Linyphiidae,Palliduphantes,istrianus,Palliduphantes istrianus,172,43.697.353,16.029.618,Tf,deep cave,,3,,"14,7","14,88466644","14,88466644","26,93600082",739,26,"165,8524113",100,,7,2.5,1,86,86,7
3612,Trišića jama,Croatia,13.12.2014.,2014-12-13,1f,1,Linyphiidae,Palliduphantes,istrianus,Palliduphantes istrianus,224,43.949.231,15.947.793,Tf,deep cave,,2,,"10,38","13,53916645","13,53916645","27,88800049",838,33,"182,369015",,,11,2.5,1,119,55,65
3613,Trišića jama,Croatia,13.12.2014.,2014-12-13,1m,1,Linyphiidae,Micrargus,herbigradus,Micrargus herbigradus,224,43.949.231,15.947.793,Tf,deep cave,,2,,"10,38","13,53916645","13,53916645","27,88800049",838,33,"182,369015",,,11,2.5,1,119,55,65
3614,Trišića jama,Croatia,13.12.2014.,2014-12-13,"1m, 1f",2,Linyphiidae,Micrargus,herbigradus,Micrargus herbigradus,224,43.949.231,15.947.793,Tf,deep cave,,2,,"10,38","13,53916645","13,53916645","27,88800049",838,33,"182,369015",,,11,2.5,1,119,55,65
3615,Trišića jama,Croatia,13.12.2014.,2014-12-13,1m,1,Linyphiidae,Palliduphantes,istrianus,Palliduphantes istrianus,224,43.949.231,15.947.793,Tf,deep cave,,2,,"10,38","13,53916645","13,53916645","27,88800049",838,33,"182,369015",,,11,2.5,1,119,55,65
3616,Jazinka,Croatia,7.3.2015.,2015-03-07,1m,1,Nesticidae,Kryptonesticus,eremita,Kryptonesticus eremita,162,43.975.892,16.029.694,tf,deep cave,,2,,13,"13,5286665","13,5286665","28,34799957",864,23,"174,9933462",,,2,1,1,42,42,4
3617,Jazinka,Croatia,16.12.2014.,2014-12-16,1m,1,Dysderidae,Stalagtia,sp. 4,Stalagtia sp. 4,162,43.975.892,16.029.694,Tb,deep cave,,2,,13,"13,5286665","13,5286665","28,34799957",864,23,"174,9933462",,,2,1,1,42,42,4
3624,Stara jametina,Croatia,13.12.2014.,2014-12-13,"1m, 1f",2,Linyphiidae,Micrargus,herbigradus,Micrargus herbigradus,247,44.013.402,16.067.798,Tf,deep cave,,6,"13,4","13,2","13,18266678","13,18266678","28,31999969",900,29,"173,0421739","90,95","91,7",12,8,1,nan,188,85
3625,Stara jametina,Croatia,13.12.2014.,2014-12-13,1m,1,Linyphiidae,Palliduphantes,istrianus,Palliduphantes istrianus,161,43.794.009,1.600.259,Tf,deep cave,,6,"13,4","13,2","14,21000004","14,21000004","27,66799927",790,20,"170,7986956","90,95","91,7",12,8,1,nan,188,85
3626,Stara jametina,Croatia,13.12.2014.,2014-12-13,1m,1,Linyphiidae,Micrargus,herbigradus,Micrargus herbigradus,161,43.794.009,1.600.259,Tf,deep cave,,6,"13,4","13,2","14,21000004","14,21000004","27,66799927",790,20,"170,7986956","90,95","91,7",12,8,1,nan,188,85
3628,Stara jametina,Croatia,6.3.2015.,2015-03-06,"1f, 1 juv",2,Theridiidae,Episinus,cavernicola,Episinus cavernicola,161,43.794.009,1.600.259,Tf,deep cave,,6,"13,4","13,2","14,21000004","14,21000004","27,66799927",790,20,"170,7986956","90,95","91,7",12,8,1,nan,188,85
3630,Stara jametina,Croatia,13.12.2014.,2014-12-13,1m,1,Linyphiidae,Micrargus,herbigradus,Micrargus herbigradus,161,43.794.009,1.600.259,Tf,deep cave,,6,"13,4","13,2","14,21000004","14,21000004","27,66799927",790,20,"170,7986956","90,95","91,7",12,8,1,nan,188,85
3631,Stara jametina,Croatia,13.12.2014.,2014-12-13,1m,1,Dysderidae,Harpactea,sp. 18,Harpactea sp. 18,161,43.794.009,1.600.259,Tf,deep cave,,6,"13,4","13,2","14,21000004","14,21000004","27,66799927",790,20,"170,7986956","90,95","91,7",12,8,1,nan,188,85
3705,Jama pod Sinji kuk,Croatia,24.10.2015.,2015-10-24,2 juv,2,Nesticidae,Kryptonesticus,eremita,Kryptonesticus eremita,254,42.709.828,17.988.632,tf,deep cave,,5,,"16,2","15,07569408","15,07569408","24,35416603",1115,26,"92,46523385",,,2,1.8,1,18,8,15
3706,Jama pod Sinji kuk,Croatia,24.10.2015.,2015-10-24,"1f, 1 juv",2,Nesticidae,Kryptonesticus,eremita,Kryptonesticus eremita,254,42.709.828,17.988.632,tf,deep cave,,5,,"16,2","15,07569408","15,07569408","24,35416603",1115,26,"92,46523385",,,2,1.8,1,18,8,15
3707,Jama pod Sinji kuk,Croatia,24.10.2015.,2015-10-24,1 juv,1,Leptonetidae,Gen. 1,sp. 1,Gen. 1 sp. 1,254,42.709.828,17.988.632,Tb,deep cave,,5,,"16,2","15,07569408","15,07569408","24,35416603",1115,26,"92,46523385",,,2,1.8,1,18,8,15
3708,Jama pod Sinji kuk,Croatia,24.10.2015.,2015-10-24,2f,2,Pholcidae,Holocnemus,pluchei,Holocnemus pluchei,254,42.709.828,17.988.632,tf,deep cave,,5,,"16,2","15,07569408","15,07569408","24,35416603",1115,26,"92,46523385",,,2,1.8,1,18,8,15
3709,Jama pod Sinji kuk,Croatia,24.10.2015.,2015-10-24,2f,2,Linyphiidae,Asthenargus,bracianus,Asthenargus bracianus,254,42.709.828,17.988.632,tf,deep cave,,5,,"16,2","15,07569408","15,07569408","24,35416603",1115,26,"92,46523385",,,2,1.8,1,18,8,15
3817,Jama pod Sinji kuk,Croatia,24.10.2015.,2015-10-24,"1m, 1f, 2 juv",4,Leptonetidae,Gen. 1,sp. 1,Gen. 1 sp. 1,254,42.709.828,17.988.632,Tb,deep cave,,5,,"16,2","15,07569408","15,07569408","24,35416603",1115,26,"92,46523385",,,2,1.8,1,18,8,15
3819,Jama pod Sinji kuk,Croatia,24.10.2015.,2015-10-24,"1 juvm, 1 juv, 1f",3,Leptonetidae,Gen. 1,sp. 1,Gen. 1 sp. 1,254,42.709.828,17.988.632,Tb,deep cave,,5,,"16,2","15,07569408","15,07569408","24,35416603",1115,26,"92,46523385",,,2,1.8,1,18,8,15
3820,Jama pod Sinji kuk,Croatia,24.10.2015.,2015-10-24,2 juv,2,Nesticidae,Kryptonesticus,eremita,Kryptonesticus eremita,254,42.709.828,17.988.632,tf,deep cave,,5,,"16,2","15,07569408","15,07569408","24,35416603",1115,26,"92,46523385",,,2,1.8,1,18,8,15
3825,Punar u Luci,Croatia,4.8.2015.,2015-08-04,1 juv,1,Dysderidae,Parastalita,stygia,Parastalita stygia,1109,44.345.815,15.988.437,Tb,deep cave,,1,,"7,35","7,308833122","7,308833122","27,08399963",1241,26,"205,1533462",,,5,6,1,1695,1485,350
3826,Spila 2,Croatia,7.7.2015.,2015-07-07,1 juv,1,Dysderidae,Stalagtia,sp. 4,Stalagtia sp. 4,349,4.326.239,17.204.021,Tb,deep cave,,6,12,12,"12,35200024","12,35200024","26,52000046",917,21,"61,25054739","96,3","96,3",0.5,0.7,1,28,24,11
3827,Male ponte,Croatia,19.10.2015.,2015-10-19,"2f, 2 juv",4,Leptonetidae,Sulcia,sp.,Sulcia sp.,258,42.761.389,17.430.786,,,,7,,"14,45","16,10370445","16,10370445","23,88333321",874,29,"106,0560518",100,,1,1.5,1,nan,106,28.8
3830,Male ponte,Croatia,19.10.2015.,2015-10-19,1 juv,1,Dysderidae,Folkia,sp. 5,Folkia sp. 5,258,42.761.389,17.430.786,Tb,deep cave,,7,,"14,45","16,10370445","16,10370445","23,88333321",874,29,"106,0560518",100,,1,1.5,1,nan,106,28.8
3831,Male ponte,Croatia,19.10.2015.,2015-10-19,"1f, 1m",2,Leptonetidae,Sulcia,nocturna,Sulcia nocturna,258,42.761.389,17.430.786,,deep cave,,7,,"14,45","16,10370445","16,10370445","23,88333321",874,29,"106,0560518",100,,1,1.5,1,nan,106,28.8
3833,Galičnjak,Croatia,22.10.2015.,2015-10-22,"1f, 1m, 1juvm, 3 juv/f, 4 juv",1,Leptonetidae,Sulcia,sp. 6,Sulcia sp. 6,160,42.720.118,1.767.071,Tf,cave entrance,,11,,"13,6","16,1147728","16,1147728","23,72727203",971,25,"99,37896954",,,50,40,1,nan,130,60
3834,Galičnjak,Croatia,22.10.2015.,2015-10-22,"3f, 7 juv, 2m",12,Leptonetidae,Sulcia,sp. 6,Sulcia sp. 6,160,42.720.118,1.767.071,Tf,cave entrance,,11,,"13,6","16,1147728","16,1147728","23,72727203",971,25,"99,37896954",,,50,40,1,nan,130,60
3836,Špilja kod Nerezinog dola,Croatia,19.10.2015.,2015-10-19,1f,1,Dysderidae,Folkia,inermis,Folkia inermis,177,42.758.378,17.436.094,Tb,deep cave,,6,,"13,883","16,10370445","16,10370445","23,88333321",874,24,"106,1225494","95,342",,6,2.5,1,nan,35,5.5
3841,Špilja kod Nerezinog dola,Croatia,19.10.2015.,2015-10-19,1 juv,1,Dysderidae,Folkia,inermis,Folkia inermis,177,42.758.378,17.436.094,Tb,deep cave,,6,,"13,883","16,10370445","16,10370445","23,88333321",874,24,"106,1225494","95,342",,6,2.5,1,nan,35,5.5
3844,Knežić jama,Croatia,20.10.2015.,2015-10-20,"1juvm, 3 juv",4,Agelenidae,Histopona,bidens,Histopona bidens,,427.783,17.459.681,tb,deep cave,,1,,"16,5","16,23472214","16,23472214","24,23999786",891,25,"102,1669145",,,1,1.5,1,nan,16.5,27.5
3847,Špilja u Solinama,Croatia,19.10.2015.,2015-10-19,"2m,  2juv",4,Leptonetidae,Sulcia,nocturna,Sulcia nocturna,83,42.768.021,17.377.062,,deep cave,,5,,"8,95","16,31185913","16,31185913","23,7307682",855,24,"108,5917672","83,7",,22,6,1,nan,47,18
3849,Jama za Sv. Ilijom,Croatia,22.10.2015.,2015-10-22,"1m, 1f",2,Leptonetidae,Sulcia,nocturna,Sulcia nocturna,257,42.744.428,17.515.269,,deep cave,,3,,"12,533","15,98333359","15,98333359","24,29999924",909,29,"103,5442348",100,,3,2,1,nan,80,65
3850,Jama na Strmici,Croatia,20.10.2015.,2015-10-20,"1m, 1 juv",2,Leptonetidae,Barusia,maheni,Barusia maheni,144,42.767.364,17.452.506,tf,deep cave,,6,,"12,1","16,10370445","16,10370445","23,88333321",874,29,"103,9966606",,,3,2,1,39,25,27.5
3851,Jama na Strmici,Croatia,20.10.2015.,2015-10-20,1m,1,Linyphiidae,Palliduphantes,sp. 1,Palliduphantes sp. 1,144,42.767.364,17.452.506,tf,deep cave,,6,,"12,1","16,10370445","16,10370445","23,88333321",874,29,"103,9966606",,,3,2,1,39,25,27.5
3853,Jama na Strmici,Croatia,20.10.2015.,2015-10-20,"7m, 1 f/juv, 4 juv",12,Leptonetidae,Barusia,maheni,Barusia maheni,144,42.767.364,17.452.506,tf,deep cave,,6,,"12,1","16,10370445","16,10370445","23,88333321",874,29,"103,9966606",,,3,2,1,39,25,27.5
3855,Galičnjak,Croatia,22.10.2015.,2015-10-22,1f,1,Leptonetidae,Gen.,sp.,Gen. sp.,160,42.720.118,1.767.071,,,,11,,"13,6","16,1147728","16,1147728","23,72727203",971,25,"99,37896954",,,50,40,1,nan,130,60
3856,Galičnjak,Croatia,22.10.2015.,2015-10-22,1f,1,Theridiidae,Gen.,sp.,Gen. sp.,160,42.720.118,1.767.071,,,,11,,"13,6","16,1147728","16,1147728","23,72727203",971,25,"99,37896954",,,50,40,1,nan,130,60
3858,Jama iznad Dugog polja,Croatia,18.10.2015.,2015-10-18,1 juv,1,Dysderidae,Folkia,inermis,Folkia inermis,221,4.275.873,17.448.697,Tb,deep cave,,5,"16,3","15,9","16,10370445","16,10370445","23,88333321",874,29,"105,3324935","98,75","97,2",1,1.5,1,nan,41,54
3859,Jama iznad Dugog polja,Croatia,18.10.2015.,2015-10-18,1 juv,1,Dysderidae,Folkia,inermis,Folkia inermis,221,4.275.873,17.448.697,Tb,deep cave,,5,"16,3","15,9","16,10370445","16,10370445","23,88333321",874,29,"105,3324935","98,75","97,2",1,1.5,1,nan,41,54
3860,Jama iznad Dugog polja,Croatia,18.10.2015.,2015-10-18,1 juv,1,Dysderidae,Folkia,inermis,Folkia inermis,221,4.275.873,17.448.697,Tb,deep cave,,5,"16,3","15,9","16,10370445","16,10370445","23,88333321",874,29,"105,3324935","98,75","97,2",1,1.5,1,nan,41,54
3871,Jama za Sv. Ilijom,Croatia,22.10.2015.,2015-10-22,"1f/juv, 1 juv",2,Leptonetidae,Barusia,maheni,Barusia maheni,257,42.744.428,17.515.269,tf,deep cave,,3,,"12,533","15,98333359","15,98333359","24,29999924",909,29,"103,5442348",100,,3,2,1,nan,80,65
3872,Jama za Sv. Ilijom,Croatia,22.10.2015.,2015-10-22,"1m, 1f",2,Leptonetidae,Sulcia,nocturna,Sulcia nocturna,257,42.744.428,17.515.269,,deep cave,,3,,"12,533","15,98333359","15,98333359","24,29999924",909,29,"103,5442348",100,,3,2,1,nan,80,65
3873,Male ponte,Croatia,19.10.2015.,2015-10-19,1f,1,Dysderidae,Folkia,sp. 5,Folkia sp. 5,258,42.761.389,17.430.786,Tb,deep cave,,7,,"14,45","16,10370445","16,10370445","23,88333321",874,29,"106,0560518",100,,1,1.5,1,nan,106,28.8
3874,Jama na Strmici,Croatia,20.10.2015.,2015-10-20,1f,1,Leptonetidae,Sulcia,sp.,Sulcia sp.,144,42.767.364,17.452.506,,,,6,,"12,1","16,10370445","16,10370445","23,88333321",874,29,"103,9966606",,,3,2,1,39,25,27.5
3877,Galičnjak,Croatia,22.10.2015.,2015-10-22,"5f, 1m",6,Leptonetidae,Sulcia,sp. 6,Sulcia sp. 6,160,42.720.118,1.767.071,Tf,cave entrance,,11,,"13,6","16,1147728","16,1147728","23,72727203",971,25,"99,37896954",,,50,40,1,nan,130,60
3878,Galičnjak,Croatia,22.10.2015.,2015-10-22,1m,1,Linyphiidae,Gen.,sp. X,Gen. sp. X,160,42.720.118,1.767.071,,,,11,,"13,6","16,1147728","16,1147728","23,72727203",971,25,"99,37896954",,,50,40,1,nan,130,60
3879,Galičnjak,Croatia,22.10.2015.,2015-10-22,1f,1,Theridiidae,Gen.,sp.,Gen. sp.,160,42.720.118,1.767.071,,,,11,,"13,6","16,1147728","16,1147728","23,72727203",971,25,"99,37896954",,,50,40,1,nan,130,60
3880,Jama na Strmici,Croatia,20.10.2015.,2015-10-20,"2m, 3f",5,Linyphiidae,Palliduphantes,sp. 1,Palliduphantes sp. 1,144,42.767.364,17.452.506,tf,deep cave,,6,,"12,1","16,10370445","16,10370445","23,88333321",874,29,"103,9966606",,,3,2,1,39,25,27.5
3881,Jama na Strmici,Croatia,20.10.2015.,2015-10-20,"1f, 2m",3,Linyphiidae,Gen.,sp. X,Gen. sp. X,144,42.767.364,17.452.506,,,,6,,"12,1","16,10370445","16,10370445","23,88333321",874,29,"103,9966606",,,3,2,1,39,25,27.5
3882,Jama na Strmici,Croatia,20.10.2015.,2015-10-20,1 juv,1,Dysderidae,Folkia,inermis,Folkia inermis,144,42.767.364,17.452.506,Tb,deep cave,,6,,"12,1","16,10370445","16,10370445","23,88333321",874,29,"103,9966606",,,3,2,1,39,25,27.5
3883,Jama na Strmici,Croatia,20.10.2015.,2015-10-20,"2m, 1 juvf, 1 juv m",4,Leptonetidae,Barusia,maheni,Barusia maheni,144,42.767.364,17.452.506,tf,deep cave,,6,,"12,1","16,10370445","16,10370445","23,88333321",874,29,"103,9966606",,,3,2,1,39,25,27.5
3885,Špilja u Solinama,Croatia,19.10.2015.,2015-10-19,"2m, 3f, 3 juv",8,Leptonetidae,Barusia,maheni,Barusia maheni,83,42.768.021,17.377.062,tf,deep cave,,5,,"8,95","16,31185913","16,31185913","23,7307682",855,24,"108,5917672","83,7",,22,6,1,nan,47,18
3888,Jama u šumi uvale Bjejajka,Croatia,19.10.2015.,2015-10-19,"1m, 1f, 1 juv",3,Leptonetidae,Barusia,maheni,Barusia maheni,,42.765.231,17.385.606,tf,deep cave,,6,,"14,133","16,31185913","16,31185913","23,7307682",855,24,"108,3846938","97,2",,3,2.2,1,nan,42,21
3890,Špilja kod Nerezinog dola,Croatia,19.10.2015.,2015-10-19,"3m, 4f, 1 juv",8,Leptonetidae,Barusia,maheni,Barusia maheni,177,42.758.378,17.436.094,tf,deep cave,,6,,"13,883","16,10370445","16,10370445","23,88333321",874,24,"106,1225494","95,342",,6,2.5,1,nan,35,5.5
3891,Male ponte,Croatia,19.10.2015.,2015-10-19,"2f, 1m",3,Linyphiidae,Palliduphantes,sp. 1,Palliduphantes sp. 1,258,42.761.389,17.430.786,tf,deep cave,,7,,"14,45","16,10370445","16,10370445","23,88333321",874,29,"106,0560518",100,,1,1.5,1,nan,106,28.8
3892,Male ponte,Croatia,19.10.2015.,2015-10-19,"3f, 1m, 4 juv",8,Leptonetidae,Sulcia,nocturna,Sulcia nocturna,258,42.761.389,17.430.786,,deep cave,,7,,"14,45","16,10370445","16,10370445","23,88333321",874,29,"106,0560518",100,,1,1.5,1,nan,106,28.8
3893,Jama iznad Dugog polja,Croatia,18.10.2015.,2015-10-18,"1m, 2f, 3 juv",6,Leptonetidae,Barusia,maheni,Barusia maheni,221,4.275.873,17.448.697,tf,deep cave,,5,"16,3","15,9","16,10370445","16,10370445","23,88333321",874,29,"105,3324935","98,75","97,2",1,1.5,1,nan,41,54
3894,Jama iznad Dugog polja,Croatia,18.10.2015.,2015-10-18,"1m, 2f, 1 juv",4,Leptonetidae,Barusia,maheni,Barusia maheni,221,4.275.873,17.448.697,tf,deep cave,,5,"16,3","15,9","16,10370445","16,10370445","23,88333321",874,29,"105,3324935","98,75","97,2",1,1.5,1,nan,41,54
3895,Jama iznad Dugog polja,Croatia,18.10.2015.,2015-10-18,1f,1,Leptonetidae,Sulcia,nocturna,Sulcia nocturna,221,4.275.873,17.448.697,,deep cave,,5,"16,3","15,9","16,10370445","16,10370445","23,88333321",874,29,"105,3324935","98,75","97,2",1,1.5,1,nan,41,54
3899,Jama Blitvica,Croatia,25.6.2015.,2015-06-25,"2f, 1 juv m",3,Linyphiidae,Centromerus,densidentatus sp.n.,Centromerus densidentatus sp.n.,52,43.765.234,15.352.649,,,,2,,"15,7","14,99659061","14,99659061","23,85454559",727,26,"241,8726371",72,,,,,,,
3901,Jama u šumi uvale Bjejajka,Croatia,19.10.2015.,2015-10-19,"1m, 2f",3,Leptonetidae,Barusia,maheni,Barusia maheni,,42.765.231,17.385.606,tf,deep cave,,6,,"14,133","16,31185913","16,31185913","23,7307682",855,24,"108,3846938","97,2",,3,2.2,1,nan,42,21
3902,Jama u šumi uvale Bjejajka,Croatia,19.10.2015.,2015-10-19,2f,2,Linyphiidae,Palliduphantes,sp. 1,Palliduphantes sp. 1,,42.765.231,17.385.606,tf,deep cave,,6,,"14,133","16,31185913","16,31185913","23,7307682",855,24,"108,3846938","97,2",,3,2.2,1,nan,42,21
3906,Špilja u Radinovcima,Croatia,1.5.2014.,2014-05-01,2 juv m,2,Nesticidae,Kryptonesticus,deelemanae,Kryptonesticus deelemanae,416,43.387.285,170.103,tb,deep cave,,4,,"8,525","12,27216721","12,27216721","26,62000084",912,23,"64,7145817",93,,7,4,1,nan,50,14
3907,Kašogijeva jama,Croatia,11.10.2014.,2014-10-11,1f,1,Agelenidae,Histopona,conveniens,Histopona conveniens,1588,43.338.971,1.705.039,Tf,deep cave,,2,"5,7","5,7","8,441666603","8,441666603","24,99200058",947,23,"64,95944491",91,91,nan,nan,1,nan,nan,nan
3908,Tučepska vilenjača,Croatia,14.10.2014.,2014-10-14,"1m, 4f",5,Linyphiidae,Typhlonyphia,sp. 1,Typhlonyphia sp. 1,1242,43.286.465,17.083.638,Tb,deep cave,,8,"10,6","10,731","9,67800045","9,67800045","24,96000099",926,26,"67,32747088",,,6,0.8,1,nan,28,35
3910,Jama iznad Saranača,Croatia,2.5.2014.,2014-05-02,1f,1,Linyphiidae,Palliduphantes,spelaeorum,Palliduphantes spelaeorum,777,43.249.007,17.174.663,Tf,deep cave,,7,"10,8","11,112","11,73516655","11,73516655","25,61599922",905,28,"64,87446036",,,2.5,0.5,1,nan,8.6,20.5
3911,Spila 1,Croatia,15.10.2014.,2014-10-15,1 juv,1,Dysderidae,Harpactea,damini,Harpactea damini,349,43.262.438,17.203.945,TF,deep cave,,3,"10,4","10,4","12,35200024","12,35200024","26,52000046",917,21,"61,24985608",100,100,3,1.8,1,30,27,10.5
3912,Špilja u Radinovcima,Croatia,15.10.2014.,2014-10-15,1 juv,1,Nesticidae,Kryptonesticus,deelemanae,Kryptonesticus deelemanae,416,43.387.285,170.103,tb,deep cave,,4,,"8,525","12,27216721","12,27216721","26,62000084",912,23,"64,7145817",93,,7,4,1,nan,50,14
3913,Tučepska vilenjača,Croatia,14.10.2014.,2014-10-14,1 juv,1,Dysderidae,Stalagtia,sp. 4,Stalagtia sp. 4,1242,43.286.465,17.083.638,Tb,deep cave,,8,"10,6","10,731","9,67800045","9,67800045","24,96000099",926,26,"67,32747088",,,6,0.8,1,nan,28,35
3914,Jama za Supinom,Croatia,14.10.2014.,2014-10-14,1f,1,Linyphiidae,Typhlonyphia,sp. 1,Typhlonyphia sp. 1,905,43.250.417,17.113.278,Tb,deep cave,,7,,"10,75","9,67800045","9,67800045","24,96000099",926,26,"69,05858686","87,25",,2.5,2.5,1,372,264,82
3915,Kašogijeva jama,Croatia,11.10.2014.,2014-10-11,1f,1,Nesticidae,Kryptonesticus,deelemanae,Kryptonesticus deelemanae,1588,43.338.971,1.705.039,tb,deep cave,,2,"5,7","5,7","8,441666603","8,441666603","24,99200058",947,23,"64,95944491",91,91,nan,nan,1,nan,nan,nan
3916,Jujnovića špilja,Croatia,29.4.2014.,2014-04-29,1f,1,Dysderidae,Harpactea,damini,Harpactea damini,463,43.266.579,1.719.798,TF,deep cave,,6,"13,8","10,85","12,35200024","12,35200024","26,52000046",917,29,"61,15708825",,,5,2.5,1,108,40,16
3917,Spila 2,Croatia,29.4.2014.,2014-04-29,2 juv,2,Dysderidae,Harpactea,damini,Harpactea damini,349,4.326.239,17.204.021,TF,deep cave,,6,12,12,"12,35200024","12,35200024","26,52000046",917,21,"61,25054739","96,3","96,3",0.5,0.7,1,28,24,11
3918,Spila 1,Croatia,1.5.2014.,2014-05-01,1 juv,1,Dysderidae,Harpactea,damini,Harpactea damini,349,43.262.438,17.203.945,TF,deep cave,,3,"10,4","10,4","12,35200024","12,35200024","26,52000046",917,21,"61,24985608",100,100,3,1.8,1,30,27,10.5
3919,Jujnovića špilja,Croatia,29.4.2014.,2014-04-29,"1m, 3 juv",4,Dysderidae,Harpactea,damini,Harpactea damini,463,43.266.579,1.719.798,TF,deep cave,,6,"13,8","10,85","12,35200024","12,35200024","26,52000046",917,29,"61,15708825",,,5,2.5,1,108,40,16
3931,Atila,Croatia,27.7.2014.,2014-07-27,1f,1,Dysderidae,Stalita,pretneri,Stalita pretneri,927,44.677.748,15.110.767,Tb,deep cave,,2,,"5,5","6,273333549","6,273333549","24,96800041",1565,25,"315,3232512","90,9",,7,11,1,2410,2051,41.5
3932,Samogorska špilja,Croatia,23.1.2016.,2016-01-23,"1m, 7f, 3 juvm, 3 juv",14,Nesticidae,Kryptonesticus,deelemanae,Kryptonesticus deelemanae,621,43.318.227,17.121.122,tb,deep cave,,6,"7,1","9,033","9,092166901","9,092166901",25,931,23,"60,95464736",99,,2,3,1,nan,19,3.5
3933,Samogorska špilja,Croatia,23.1.2016.,2016-01-23,9f,9,Nesticidae,Kryptonesticus,deelemanae,Kryptonesticus deelemanae,621,43.318.227,17.121.122,tb,deep cave,,6,"7,1","9,033","9,092166901","9,092166901",25,931,23,"60,95464736",99,,2,3,1,nan,19,3.5
3934,Samogorska špilja,Croatia,23.1.2016.,2016-01-23,"9f, 3m, 2juv",14,Nesticidae,Kryptonesticus,deelemanae,Kryptonesticus deelemanae,621,43.318.227,17.121.122,tb,deep cave,,6,"7,1","9,033","9,092166901","9,092166901",25,931,23,"60,95464736",99,,2,3,1,nan,19,3.5
3935,Samogorska špilja,Croatia,23.1.2016.,2016-01-23,1m,1,Pholcidae,Stygopholcus,absoloni,Stygopholcus absoloni,621,43.318.227,17.121.122,,deep cave,,6,"7,1","9,033","9,092166901","9,092166901",25,931,23,"60,95464736",99,,2,3,1,nan,19,3.5
3936,Samogorska špilja,Croatia,23.1.2016.,2016-01-23,"3 juv, 1juvm",4,Nesticidae,Kryptonesticus,deelemanae,Kryptonesticus deelemanae,621,43.318.227,17.121.122,tb,deep cave,,6,"7,1","9,033","9,092166901","9,092166901",25,931,23,"60,95464736",99,,2,3,1,nan,19,3.5
3937,Samogorska špilja,Croatia,23.1.2016.,2016-01-23,"1m, 3f, 1juv",5,Leptonetidae,Sulcia,sp. 4,Sulcia sp. 4,621,43.318.227,17.121.122,Tb,deep cave,,6,"7,1","9,033","9,092166901","9,092166901",25,931,23,"60,95464736",99,,2,3,1,nan,19,3.5
3949,Kukor,Croatia,21.1.2016.,2016-01-21,2f,2,Nesticidae,Kryptonesticus,deelemanae,Kryptonesticus deelemanae,587,43.355.609,16.991.707,tb,deep cave,,10,,"15,4","12,63749981","12,63749981","25,40833473",906,29,"68,94753675",,,1,1,1,264,213,40
3950,Kukor,Croatia,21.1.2016.,2016-01-21,"1f, 4juv",5,Nesticidae,Kryptonesticus,deelemanae,Kryptonesticus deelemanae,587,43.355.609,16.991.707,tb,deep cave,,10,,"15,4","12,63749981","12,63749981","25,40833473",906,29,"68,94753675",,,1,1,1,264,213,40
3951,Kukor,Croatia,21.1.2016.,2016-01-21,1f,1,Scytodidae,Scytodes,thoracica,Scytodes thoracica,587,43.355.609,16.991.707,Tx,,,10,,"15,4","12,63749981","12,63749981","25,40833473",906,29,"68,94753675",,,1,1,1,264,213,40
3952,Kukor,Croatia,21.1.2016.,2016-01-21,2m,2,Pholcidae,Stygopholcus,absoloni,Stygopholcus absoloni,587,43.355.609,16.991.707,,deep cave,,10,,"15,4","12,63749981","12,63749981","25,40833473",906,29,"68,94753675",,,1,1,1,264,213,40
3953,Matijaševa peć,Croatia,23.1.2016.,2016-01-23,"1f, 1juv",2,Nesticidae,Kryptonesticus,deelemanae,Kryptonesticus deelemanae,621,43.320.551,17.122.321,tb,deep cave,,6,"8,3","6,933","9,092166901","9,092166901",25,931,23,"60,61369348",,,3,1,1,18,17,6
3954,Matijaševa peć,Croatia,23.1.2016.,2016-01-23,1m,1,Pholcidae,Stygopholcus,absoloni,Stygopholcus absoloni,621,43.320.551,17.122.321,,deep cave,,6,"8,3","6,933","9,092166901","9,092166901",25,931,23,"60,61369348",,,3,1,1,18,17,6
3955,Matijaševa peć,Croatia,23.1.2016.,2016-01-23,3juv,3,Nesticidae,Kryptonesticus,deelemanae,Kryptonesticus deelemanae,621,43.320.551,17.122.321,tb,deep cave,,6,"8,3","6,933","9,092166901","9,092166901",25,931,23,"60,61369348",,,3,1,1,18,17,6
3957,Matijaševa peć,Croatia,23.1.2016.,2016-01-23,2juv,2,Nesticidae,Kryptonesticus,deelemanae,Kryptonesticus deelemanae,621,43.320.551,17.122.321,tb,deep cave,,6,"8,3","6,933","9,092166901","9,092166901",25,931,23,"60,61369348",,,3,1,1,18,17,6
3958,Matijaševa peć,Croatia,23.1.2016.,2016-01-23,1f,1,Leptonetidae,Barusia,maheni,Barusia maheni,621,43.320.551,17.122.321,tf,deep cave,,6,"8,3","6,933","9,092166901","9,092166901",25,931,23,"60,61369348",,,3,1,1,18,17,6
3960,Matijaševa peć,Croatia,23.1.2016.,2016-01-23,1f,1,Pholcidae,Stygopholcus,absoloni,Stygopholcus absoloni,621,43.320.551,17.122.321,,deep cave,,6,"8,3","6,933","9,092166901","9,092166901",25,931,23,"60,61369348",,,3,1,1,18,17,6
3961,Samogorska špilja,Croatia,23.1.2016.,2016-01-23,"1m, 1juv",2,Leptonetidae,Sulcia,sp. 4,Sulcia sp. 4,621,43.318.227,17.121.122,Tb,deep cave,,6,"7,1","9,033","9,092166901","9,092166901",25,931,23,"60,95464736",99,,2,3,1,nan,19,3.5
3962,Samogorska špilja,Croatia,23.1.2016.,2016-01-23,1m,1,Pholcidae,Stygopholcus,absoloni,Stygopholcus absoloni,621,43.318.227,17.121.122,,deep cave,,6,"7,1","9,033","9,092166901","9,092166901",25,931,23,"60,95464736",99,,2,3,1,nan,19,3.5
3964,Kukor,Croatia,21.1.2016.,2016-01-21,"5f, 1m, 2juv",8,Leptonetidae,Sulcia,sp. 3,Sulcia sp. 3,587,43.355.609,16.991.707,Tb,deep cave,,10,,"15,4","12,63749981","12,63749981","25,40833473",906,29,"68,94753675",,,1,1,1,264,213,40
3965,Kukor,Croatia,21.1.2016.,2016-01-21,"6m, 13f/juv",19,Leptonetidae,Sulcia,sp. 3,Sulcia sp. 3,587,43.355.609,16.991.707,Tb,deep cave,,10,,"15,4","12,63749981","12,63749981","25,40833473",906,29,"68,94753675",,,1,1,1,264,213,40
3967,Kukor,Croatia,21.1.2016.,2016-01-21,"4m, 9f/juv",13,Leptonetidae,Sulcia,sp. 3,Sulcia sp. 3,587,43.355.609,16.991.707,Tb,deep cave,,10,,"15,4","12,63749981","12,63749981","25,40833473",906,29,"68,94753675",,,1,1,1,264,213,40
3968,Kukor,Croatia,21.1.2016.,2016-01-21,1m,1,Pholcidae,Stygopholcus,absoloni,Stygopholcus absoloni,587,43.355.609,16.991.707,,deep cave,,10,,"15,4","12,63749981","12,63749981","25,40833473",906,29,"68,94753675",,,1,1,1,264,213,40
3969,Kukor,Croatia,21.1.2016.,2016-01-21,1m,1,Agelenidae,Histopona,conveniens,Histopona conveniens,587,43.355.609,16.991.707,Tf,deep cave,,10,,"15,4","12,63749981","12,63749981","25,40833473",906,29,"68,94753675",,,1,1,1,264,213,40
3971,Kukor,Croatia,21.1.2016.,2016-01-21,"3f, 1juv",4,Pholcidae,Stygopholcus,absoloni,Stygopholcus absoloni,587,43.355.609,16.991.707,,deep cave,,10,,"15,4","12,63749981","12,63749981","25,40833473",906,29,"68,94753675",,,1,1,1,264,213,40
3979,Gradska spila,Croatia,23.1.2016.,2016-01-23,"1m, 2f, 3juv",6,Leptonetidae,Sulcia,sp. 4,Sulcia sp. 4,621,43.318.029,17.117.623,Tb,deep cave,,4,,"6,6","9,092166901","9,092166901",25,931,23,"61,25913011","93,333",,5,2.5,1,nan,26.5,1.8
3980,Gradska spila,Croatia,23.1.2016.,2016-01-23,1m,1,Pholcidae,Stygopholcus,absoloni,Stygopholcus absoloni,621,43.318.029,17.117.623,,deep cave,,4,,"6,6","9,092166901","9,092166901",25,931,23,"61,25913011","93,333",,5,2.5,1,nan,26.5,1.8
3981,Gradska spila,Croatia,23.1.2016.,2016-01-23,"1m, 3f, 1juv",5,Leptonetidae,Sulcia,sp. 4,Sulcia sp. 4,621,43.318.029,17.117.623,Tb,deep cave,,4,,"6,6","9,092166901","9,092166901",25,931,23,"61,25913011","93,333",,5,2.5,1,nan,26.5,1.8
3982,Gradska spila,Croatia,23.1.2016.,2016-01-23,"3m, 2f",5,Leptonetidae,Sulcia,sp. 4,Sulcia sp. 4,621,43.318.029,17.117.623,Tb,deep cave,,4,,"6,6","9,092166901","9,092166901",25,931,23,"61,25913011","93,333",,5,2.5,1,nan,26.5,1.8
3985,Đutno,Croatia,20.3.2016.,2016-03-20,3 juv,3,Dysderidae,Stalita,pretneri,Stalita pretneri,218,45.415.607,15.233.039,Tb,deep cave,,4,,"7,75","10,4248333","10,4248333","28,8239994",1290,23,"379,8005434",,,7.5,5,1,nan,328,34
3995,Tučepska vilenjača,Croatia,21.8.2016.,2016-08-21,1f,1,Dysderidae,Mesostalita,comottii,Mesostalita comottii,1242,43.286.465,17.083.638,Tb,deep cave,,8,"10,6","10,731","9,67800045","9,67800045","24,96000099",926,26,"67,32747088",,,6,0.8,1,nan,28,35
3996,Špilja u Grliću,Croatia,19.8.2016.,2016-08-19,2m,2,Pholcidae,Stygopholcus,absoloni,Stygopholcus absoloni,75,43.158.023,16.813.636,,deep cave,,4,,"17,3","15,55208302","15,55208302","24,34000015",763,44,"102,806737",,,,,,,,
3999,Špilja na Pozalicu,Croatia,16.8.2016.,2016-08-16,"1m, 1f, 1juvm, 1juv",4,Leptonetidae,Barusia,sp. 1,Barusia sp. 1,61,4.276.131,169.129,tb,deep cave,,4,"12,65",14,"16,4216671","16,4216671","22,7733345",668,29,"143,02697",94,,nan,nan,1,nan,nan,nan
4001,Špilja na Pozalicu,Croatia,16.8.2016.,2016-08-16,"1m, 1f",2,Leptonetidae,Barusia,sp. 1,Barusia sp. 1,61,4.276.131,169.129,tb,deep cave,,4,"12,65",14,"16,4216671","16,4216671","22,7733345",668,29,"143,02697",94,,nan,nan,1,nan,nan,nan
4003,Rača špilja,Croatia,16.8.2016.,2016-08-16,1 juv,1,Dysderidae,Folkia,sp. 2,Folkia sp. 2,90,42.734.493,16.910.785,Tb,deep cave,,4,"14,8","14,42","16,37628174","16,37628174","22,81538391",662,28,"146,7036244",,,,,,,,
4004,Rača špilja,Croatia,16.8.2016.,2016-08-16,2m,2,Leptonetidae,Barusia,sp. 1,Barusia sp. 1,90,42.734.493,16.910.785,tb,deep cave,,4,"14,8","14,42","16,37628174","16,37628174","22,81538391",662,28,"146,7036244",,,,,,,,
4005,Rača špilja,Croatia,16.8.2016.,2016-08-16,11f/juv,11,Leptonetidae,Barusia,sp. 1,Barusia sp. 1,90,42.734.493,16.910.785,tb,deep cave,,4,"14,8","14,42","16,37628174","16,37628174","22,81538391",662,28,"146,7036244",,,,,,,,
4007,Rača špilja,Croatia,16.8.2016.,2016-08-16,"1m, 3f, 1 juvm",5,Leptonetidae,Barusia,sp. 1,Barusia sp. 1,90,42.734.493,16.910.785,tb,deep cave,,4,"14,8","14,42","16,37628174","16,37628174","22,81538391",662,28,"146,7036244",,,,,,,,
4008,Rača špilja,Croatia,16.8.2016.,2016-08-16,1m,1,Leptonetidae,Barusia,sp. 1,Barusia sp. 1,90,42.734.493,16.910.785,tb,deep cave,,4,"14,8","14,42","16,37628174","16,37628174","22,81538391",662,28,"146,7036244",,,,,,,,
4009,Špilja u Grliću,Croatia,19.8.2016.,2016-08-19,"2f, 4juv m, 2 juv",8,Leptonetidae,Barusia,maheni,Barusia maheni,75,43.158.023,16.813.636,tf,deep cave,,4,,"17,3","15,55208302","15,55208302","24,34000015",763,44,"102,806737",,,,,,,,
4010,Špilja u Grliću,Croatia,19.8.2016.,2016-08-19,"1f, 2 juvm, 1 juv",4,Leptonetidae,Barusia,maheni,Barusia maheni,75,43.158.023,16.813.636,tf,deep cave,,4,,"17,3","15,55208302","15,55208302","24,34000015",763,44,"102,806737",,,,,,,,
4011,Špilja u Grliću,Croatia,19.8.2016.,2016-08-19,"1juv m, 2juv/f, 3 juv",6,Leptonetidae,Barusia,maheni,Barusia maheni,75,43.158.023,16.813.636,tf,deep cave,,4,,"17,3","15,55208302","15,55208302","24,34000015",763,44,"102,806737",,,,,,,,
4012,Špilja u Grliću,Croatia,19.8.2016.,2016-08-19,"1f, 1juvm, 1juvf/juv, 1 juv",4,Leptonetidae,Barusia,maheni,Barusia maheni,75,43.158.023,16.813.636,tf,deep cave,,4,,"17,3","15,55208302","15,55208302","24,34000015",763,44,"102,806737",,,,,,,,
4013,Grapčeva špilja,Croatia,20.8.2016.,2016-08-20,4juv,4,Agelenidae,Hadites,tegenarioides,Hadites tegenarioides,279,43.134.189,16.753.732,TB,deep cave,,5,,"13,225","15,48979187","15,48979187","23,94499969",751,28,"110,2583259",,,nan,nan,1,nan,nan,nan
4014,Grapčeva špilja,Croatia,20.8.2016.,2016-08-20,"1f, 7juv",8,Agelenidae,Hadites,tegenarioides,Hadites tegenarioides,279,43.134.189,16.753.732,TB,deep cave,,5,,"13,225","15,48979187","15,48979187","23,94499969",751,28,"110,2583259",,,nan,nan,1,nan,nan,nan
4015,Grapčeva špilja,Croatia,20.8.2016.,2016-08-20,1f,1,Nesticidae,Kryptonesticus,eremita,Kryptonesticus eremita,279,43.134.189,16.753.732,tf,deep cave,,5,,"13,225","15,48979187","15,48979187","23,94499969",751,28,"110,2583259",,,nan,nan,1,nan,nan,nan
4017,Grapčeva špilja,Croatia,20.8.2016.,2016-08-20,"1m, 1 juv m",2,Leptonetidae,Barusia,insulana,Barusia insulana,279,43.134.189,16.753.732,tb,deep cave,,5,,"13,225","15,48979187","15,48979187","23,94499969",751,28,"110,2583259",,,nan,nan,1,nan,nan,nan
4018,Špilja pod Kapelu,Croatia,18.8.2016.,2016-08-18,1 juv,1,Agelenidae,Hadites,tegenarioides,Hadites tegenarioides,102,43.184.949,16.434.233,TB,deep cave,,5,,"12,717","16,20546913","16,20546913","23,36250114",714,21,"135,8656791","97,5",,nan,nan,1,nan,nan,nan
4026,Markov ponor,Croatia,3.8.2016.,2016-08-03,1juv,1,Linyphiidae,Troglohyphantes,sp. 3,Troglohyphantes sp. 3,562,44.765.318,15.176.875,tb,deep cave,,1,,"6,6","8,673000336","8,673000336","27,76000023",1341,23,"316,7274136","96,7",,5,7,1,2240,1725,69
4030,Rača špilja,Croatia,16.8.2016.,2016-08-16,1m,1,Tetragnathidae,Meta,bourneti,Meta bourneti,90,42.734.493,16.910.785,Tf,deep cave,,4,"14,8","14,42","16,37628174","16,37628174","22,81538391",662,28,"146,7036244",,,,,,,,
4031,Špilja na Pozalicu,Croatia,16.8.2016.,2016-08-16,1f,1,Nesticidae,Kryptonesticus,eremita,Kryptonesticus eremita,61,4.276.131,169.129,tf,deep cave,,4,"12,65",14,"16,4216671","16,4216671","22,7733345",668,29,"143,02697",94,,nan,nan,1,nan,nan,nan
4032,Špilja pod Kapelu,Croatia,18.8.2016.,2016-08-18,1juv,1,Agelenidae,Tegenaria,sp.,Tegenaria sp.,102,43.184.949,16.434.233,,,,5,,"12,717","16,20546913","16,20546913","23,36250114",714,21,"135,8656791","97,5",,nan,nan,1,nan,nan,nan
4033,Špilja pod Kapelu,Croatia,18.8.2016.,2016-08-18,2f,2,Linyphiidae,Palliduphantes,sp. X,Palliduphantes sp. X,102,43.184.949,16.434.233,,,,5,,"12,717","16,20546913","16,20546913","23,36250114",714,21,"135,8656791","97,5",,nan,nan,1,nan,nan,nan
4037,Grapčeva špilja,Croatia,20.8.2016.,2016-08-20,1juv/f,1,Dysderidae,Dysdera,sp.,Dysdera sp.,279,43.134.189,16.753.732,Tx,,,5,,"13,225","15,48979187","15,48979187","23,94499969",751,28,"110,2583259",,,nan,nan,1,nan,nan,nan
4038,Tučepska vilenjača,Croatia,21.8.2016.,2016-08-21,1f,1,Linyphiidae,Typhlonyphia,sp. 1,Typhlonyphia sp. 1,1242,43.286.465,17.083.638,Tb,deep cave,,8,"10,6","10,731","9,67800045","9,67800045","24,96000099",926,26,"67,32747088",,,6,0.8,1,nan,28,35
4039,Balića špilja,Croatia,22.8.2016.,2016-08-22,1m,1,Linyphiidae,Troglohyphantes,giromettai,Troglohyphantes giromettai,438,4.357.296,1.657.002,tf,deep cave,,11,,"7,2","12,25566673","12,25566673","25,68000031",872,23,"105,1255288",,,70,7,1,194,155,50
4042,Grapčeva špilja,Croatia,20.8.2016.,2016-08-20,1juvm,1,Agelenidae,Hadites,tegenarioides,Hadites tegenarioides,279,43.134.189,16.753.732,TB,deep cave,,5,,"13,225","15,48979187","15,48979187","23,94499969",751,28,"110,2583259",,,nan,nan,1,nan,nan,nan
4050,Šipun,Croatia,4.5.2012.,2012-05-04,1f/juv,1,Dysderidae,Stalagtia,sp. 1,Stalagtia sp. 1,,42.583.646,18.217.986,Tb,deep cave,,11,,"15,4","15,02037048","15,02037048","24,28333282",1208,2,"111,3036255","97,8",,1.5,2.5,1,165,150,22.5
4051,Šipun,Croatia,4.5.2012.,2012-05-04,1f,1,Tetragnathidae,Meta,bourneti,Meta bourneti,,42.583.646,18.217.986,Tf,deep cave,,11,,"15,4","15,02037048","15,02037048","24,28333282",1208,2,"111,3036255","97,8",,1.5,2.5,1,165,150,22.5
4053,Sedrena špilja iza mlina,Croatia,7.3.2015.,2015-03-07,3juv,3,Tetragnathidae,Meta,sp.,Meta sp.,247,44.013.402,16.067.798,,,,6,,"7,9","13,18266678","13,18266678","28,31999969",900,29,"173,0421739",,,6,3,1,124,124,4
4067,Gvozdenica,Croatia,9.12.1997.,1997-12-09,1m,1,Tetragnathidae,Meta,menardi,Meta menardi,213,45.299.765,15.589.405,Tf,deep cave,,4,,"8,7","10,85416698","10,85416698","29,48399925",1123,24,"339,8560445",,,24,14,1,nan,250,85
4070,Špilja pod Mačkovom dragom,Croatia,11.7.2010.,2010-07-11,1m,1,Dysderidae,Parastalita,stygia,Parastalita stygia,685,45.261.001,15.023.822,Tb,deep cave,,1,,"7,4","6,968666553","6,968666553","26,46800041",1564,25,"378,8376232",,,2,1,1,376,362,26
4075,Stara jametina,Croatia,2.5.2015.,2015-05-02,1f,1,Linyphiidae,Micrargus,herbigradus,Micrargus herbigradus,161,43.794.009,1.600.259,Tf,deep cave,,6,"13,4","13,2","14,21000004","14,21000004","27,66799927",790,20,"170,7986956","90,95","91,7",12,8,1,nan,188,85
4076,Stara jametina,Croatia,2.5.2015.,2015-05-02,2f,2,Theridiidae,Episinus,cavernicola,Episinus cavernicola,161,43.794.009,1.600.259,Tf,deep cave,,6,"13,4","13,2","14,21000004","14,21000004","27,66799927",790,20,"170,7986956","90,95","91,7",12,8,1,nan,188,85
4077,Stara jametina,Croatia,2.5.2015.,2015-05-02,"1f, 1 juvm",2,Linyphiidae,Micrargus,herbigradus,Micrargus herbigradus,161,43.794.009,1.600.259,Tf,deep cave,,6,"13,4","13,2","14,21000004","14,21000004","27,66799927",790,20,"170,7986956","90,95","91,7",12,8,1,nan,188,85
4078,Stara jametina,Croatia,2.5.2015.,2015-05-02,1 juv,1,Dysderidae,Stalagtia,sp. 4,Stalagtia sp. 4,161,43.794.009,1.600.259,Tb,deep cave,,6,"13,4","13,2","14,21000004","14,21000004","27,66799927",790,20,"170,7986956","90,95","91,7",12,8,1,nan,188,85
4080,Stara jametina,Croatia,2.5.2015.,2015-05-02,"1f, 2 juv",3,Linyphiidae,Micrargus,herbigradus,Micrargus herbigradus,161,43.794.009,1.600.259,Tf,deep cave,,6,"13,4","13,2","14,21000004","14,21000004","27,66799927",790,20,"170,7986956","90,95","91,7",12,8,1,nan,188,85
4082,Sedrena špilja iza mlina,Croatia,9.10.2016.,2016-10-09,"1m, 1f",2,Tetragnathidae,Metellina,merianae,Metellina merianae,247,44.013.402,16.067.798,Tf,deep cave,,6,,"7,9","13,18266678","13,18266678","28,31999969",900,29,"173,0421739",,,6,3,1,124,124,4
4083,Sedrena špilja iza mlina,Croatia,9.10.2016.,2016-10-09,"1juv, 1f",2,Tetragnathidae,Meta,bourneti,Meta bourneti,247,44.013.402,16.067.798,Tf,deep cave,,6,,"7,9","13,18266678","13,18266678","28,31999969",900,29,"173,0421739",,,6,3,1,124,124,4
4084,Stara jametina,Croatia,10.10.2016.,2016-10-10,5juv,5,Dysderidae,Stalagtia,sp. 4,Stalagtia sp. 4,161,43.794.009,1.600.259,Tb,deep cave,,6,"13,4","13,2","14,21000004","14,21000004","27,66799927",790,20,"170,7986956","90,95","91,7",12,8,1,nan,188,85
4085,Jazinka,Croatia,10.10.2016.,2016-10-10,1 juv,1,Dysderidae,Stalagtia,sp. 4,Stalagtia sp. 4,162,43.975.892,16.029.694,Tb,deep cave,,2,,13,"13,5286665","13,5286665","28,34799957",864,23,"174,9933462",,,2,1,1,42,42,4
4086,Sedrena špilja iza mlina,Croatia,9.10.2016.,2016-10-09,1 juvm,1,Tetragnathidae,Meta,sp.,Meta sp.,247,44.013.402,16.067.798,,,,6,,"7,9","13,18266678","13,18266678","28,31999969",900,29,"173,0421739",,,6,3,1,124,124,4
4087,Stara jametina,Croatia,10.10.2016.,2016-10-10,"1f, 4 juv",5,Dysderidae,Stalagtia,sp. 4,Stalagtia sp. 4,161,43.794.009,1.600.259,Tb,deep cave,,6,"13,4","13,2","14,21000004","14,21000004","27,66799927",790,20,"170,7986956","90,95","91,7",12,8,1,nan,188,85
4088,Stara jametina,Croatia,10.10.2016.,2016-10-10,1m,1,Theridiidae,Episinus,cavernicola,Episinus cavernicola,161,43.794.009,1.600.259,Tf,deep cave,,6,"13,4","13,2","14,21000004","14,21000004","27,66799927",790,20,"170,7986956","90,95","91,7",12,8,1,nan,188,85
4089,Stara jametina,Croatia,10.10.2016.,2016-10-10,3juv,3,Dysderidae,Stalagtia,sp. 4,Stalagtia sp. 4,161,43.794.009,1.600.259,Tb,deep cave,,6,"13,4","13,2","14,21000004","14,21000004","27,66799927",790,20,"170,7986956","90,95","91,7",12,8,1,nan,188,85
4096,Sedrena špilja s jamskim ulazom,Croatia,9.10.2016.,2016-10-09,1m,1,Agelenidae,Tegenaria,bosnica,Tegenaria bosnica,247,44.013.829,16.069.202,,deep cave,,2,,"9,3","13,18266678","13,18266678","28,31999969",900,29,"172,9211316","95,6",,1,0.5,1,23,18,6
4108,Miljacka 2,Croatia,1.6.2016.,2016-06-01,1m,1,Agelenidae,Tegenaria,domestica,Tegenaria domestica,224,440.002,16.016.234,Tf,deep cave,,4,,"12,6","13,29333305","13,29333305","28,4279995",894,32,"177,675492",,,,,,,,
4109,Špilja na Gradini kod Premanture,Croatia,16.7.2016.,2016-07-16,5 juv,5,Nesticidae,Kryptonesticus,eremita,Kryptonesticus eremita,10,44.786.909,13.907.968,tf,deep cave,,3,,"13,875","14,38249969","14,38249969","24,69999886",753,25,"301,7029411","93,725",,nan,nan,1,nan,nan,nan
4111,Špilja na Gradini kod Premanture,Croatia,30.4.2016.,2016-04-30,"3f, 1juv m, 7 juv",11,Nesticidae,Kryptonesticus,eremita,Kryptonesticus eremita,10,44.786.909,13.907.968,tf,deep cave,,3,,"13,875","14,38249969","14,38249969","24,69999886",753,25,"301,7029411","93,725",,nan,nan,1,nan,nan,nan
4112,Špilja na Gradini kod Premanture,Croatia,30.4.2016.,2016-04-30,"1m, 1juvm, 2 juv",4,Nesticidae,Kryptonesticus,eremita,Kryptonesticus eremita,10,44.786.909,13.907.968,tf,deep cave,,3,,"13,875","14,38249969","14,38249969","24,69999886",753,25,"301,7029411","93,725",,nan,nan,1,nan,nan,nan
4113,Špilja na Gradini kod Premanture,Croatia,16.7.2016.,2016-07-16,2juv,2,Nesticidae,Kryptonesticus,eremita,Kryptonesticus eremita,10,44.786.909,13.907.968,tf,deep cave,,3,,"13,875","14,38249969","14,38249969","24,69999886",753,25,"301,7029411","93,725",,nan,nan,1,nan,nan,nan
4114,Špilja na Gradini kod Premanture,Croatia,30.4.2016.,2016-04-30,"1f, 1juvm, 1juv",3,Nesticidae,Kryptonesticus,eremita,Kryptonesticus eremita,10,44.786.909,13.907.968,tf,deep cave,,3,,"13,875","14,38249969","14,38249969","24,69999886",753,25,"301,7029411","93,725",,nan,nan,1,nan,nan,nan
4115,Špilja na Gradini kod Premanture,Croatia,16.7.2016.,2016-07-16,"1m, 1f, 3juv",5,Nesticidae,Kryptonesticus,eremita,Kryptonesticus eremita,10,44.786.909,13.907.968,tf,deep cave,,3,,"13,875","14,38249969","14,38249969","24,69999886",753,25,"301,7029411","93,725",,nan,nan,1,nan,nan,nan
4116,Špilja na Gradini kod Premanture,Croatia,30.4.2016.,2016-04-30,2juv,2,Nesticidae,Kryptonesticus,eremita,Kryptonesticus eremita,10,44.786.909,13.907.968,tf,deep cave,,3,,"13,875","14,38249969","14,38249969","24,69999886",753,25,"301,7029411","93,725",,nan,nan,1,nan,nan,nan
4117,Špilja na Gradini kod Premanture,Croatia,16.7.2016.,2016-07-16,1m,1,Nesticidae,Kryptonesticus,eremita,Kryptonesticus eremita,10,44.786.909,13.907.968,tf,deep cave,,3,,"13,875","14,38249969","14,38249969","24,69999886",753,25,"301,7029411","93,725",,nan,nan,1,nan,nan,nan
4118,Špilja na Gradini kod Premanture,Croatia,16.7.2016.,2016-07-16,"1f, 1juvm, 4juv",6,Nesticidae,Kryptonesticus,eremita,Kryptonesticus eremita,10,44.786.909,13.907.968,tf,deep cave,,3,,"13,875","14,38249969","14,38249969","24,69999886",753,25,"301,7029411","93,725",,nan,nan,1,nan,nan,nan
4119,Špilja na Gradini kod Premanture,Croatia,16.7.2016.,2016-07-16,1juv,1,Nesticidae,Kryptonesticus,eremita,Kryptonesticus eremita,10,44.786.909,13.907.968,tf,deep cave,,3,,"13,875","14,38249969","14,38249969","24,69999886",753,25,"301,7029411","93,725",,nan,nan,1,nan,nan,nan
4120,Špilja na Gradini kod Premanture,Croatia,16.7.2016.,2016-07-16,"1f, 2juv",3,Nesticidae,Kryptonesticus,eremita,Kryptonesticus eremita,10,44.786.909,13.907.968,tf,deep cave,,3,,"13,875","14,38249969","14,38249969","24,69999886",753,25,"301,7029411","93,725",,nan,nan,1,nan,nan,nan
4121,Špilja na Gradini kod Premanture,Croatia,16.7.2016.,2016-07-16,2juv,2,Nesticidae,Kryptonesticus,eremita,Kryptonesticus eremita,10,44.786.909,13.907.968,tf,deep cave,,3,,"13,875","14,38249969","14,38249969","24,69999886",753,25,"301,7029411","93,725",,nan,nan,1,nan,nan,nan
4122,Šipun,Croatia,4.6.2014.,2014-06-04,1m,1,Dysderidae,Stalagtia,sp. 1,Stalagtia sp. 1,,42.583.646,18.217.986,Tb,deep cave,,11,,"15,4","15,02037048","15,02037048","24,28333282",1208,2,"111,3036255","97,8",,1.5,2.5,1,165,150,22.5
4123,Tihinja,Croatia,8.6.2014.,2014-06-08,"1m, 1 juv",2,Tetragnathidae,Metellina,merianae,Metellina merianae,51,42.866.729,1.767.021,Tf,deep cave,,5,,"9,8","16,36354256","16,36354256","26,23500061",1001,25,"79,07159234","83,1",,,,,,,
4124,Špilja u Žarmi,Croatia,2.6.2014.,2014-06-02,"1f, 1juv/f, 3 juv",5,Dysderidae,Stalagtia,hercegovinensis,Stalagtia hercegovinensis,40,42.935.427,1.743.822,Tb,deep cave,,7,"13,05","13,05","16,30899048","16,30899048","26,72631454",906,21,"84,49485396","87,3","87,3",3,3,1,28,22,9.5
4126,Bezdan,Croatia,3.6.2014.,2014-06-03,1juv,1,Dysderidae,Stalagtia,sp. 1,Stalagtia sp. 1,133,42.530.343,18.316.239,Tb,deep cave,,2,,"14,7","16,13833237","16,13833237","24,16666794",1249,23,"112,0435418",,,0.5,0.3,1,nan,12,22
4130,Vilinska jama,Croatia,5.6.2014.,2014-06-05,1m,1,Nesticidae,Kryptonesticus,eremita,Kryptonesticus eremita,118,42.728.553,17.881.121,tf,deep cave,,10,,"13,6","16,61458397","16,61458397","23,72142792",1068,24,"91,19914008","84,6",,1,1,1,14.9,10.3,5.8
4132,Vilinska jama,Croatia,5.6.2014.,2014-06-05,1f,1,Leptonetidae,Sulcia,sp. 15,Sulcia sp. 15,118,42.728.553,17.881.121,,,,10,,"13,6","16,61458397","16,61458397","23,72142792",1068,24,"91,19914008","84,6",,1,1,1,14.9,10.3,5.8
4133,Vilinska jama,Croatia,5.6.2014.,2014-06-05,"1f, 1m, 3f?, 3juv",8,Leptonetidae,Barusia,maheni,Barusia maheni,118,42.728.553,17.881.121,tf,deep cave,,10,,"13,6","16,61458397","16,61458397","23,72142792",1068,24,"91,19914008","84,6",,1,1,1,14.9,10.3,5.8
4136,Vilinska jama,Croatia,5.6.2014.,2014-06-05,2juv,2,Dysderidae,Stalagtia,sp. 2,Stalagtia sp. 2,118,42.728.553,17.881.121,Tb,deep cave,,10,,"13,6","16,61458397","16,61458397","23,72142792",1068,24,"91,19914008","84,6",,1,1,1,14.9,10.3,5.8
4137,Jezero,Croatia,7.6.2014.,2014-06-07,1f,1,Nesticidae,Kryptonesticus,arenstorffi,Kryptonesticus arenstorffi,964,42.580.381,18.356.073,tb,deep cave,,8,,"7,567","12,93216705","12,93216705","24,86800003",1208,29,"104,2091301","96,5",,1,0.5,1,20.5,nan,12
4139,Šipun,Croatia,4.6.2014.,2014-06-04,2f,2,Agelenidae,Histopona,dubia,Histopona dubia,,42.583.646,18.217.986,tb,deep cave,,11,,"15,4","15,02037048","15,02037048","24,28333282",1208,2,"111,3036255","97,8",,1.5,2.5,1,165,150,22.5
4141,Jezero,Croatia,7.6.2014.,2014-06-07,1juv,1,Linyphiidae,Troglohyphantes,troglodytes,Troglohyphantes troglodytes,964,42.580.381,18.356.073,tf,deep cave,,8,,"7,567","12,93216705","12,93216705","24,86800003",1208,29,"104,2091301","96,5",,1,0.5,1,20.5,nan,12
4142,Đurovića jama,Croatia,3.6.2014.,2014-06-03,1f,1,Nesticidae,Kryptonesticus,eremita,Kryptonesticus eremita,156,42.559.979,18.263.559,tf,deep cave,,4,,"17,267","15,93194485","15,93194485","24,30000114",1247,6,"111,7390404",,,1,2,1,156,132,17
4143,Vilinska jama,Croatia,5.6.2014.,2014-06-05,1f,1,Nesticidae,Kryptonesticus,eremita,Kryptonesticus eremita,118,42.728.553,17.881.121,tf,deep cave,,10,,"13,6","16,61458397","16,61458397","23,72142792",1068,24,"91,19914008","84,6",,1,1,1,14.9,10.3,5.8
4144,Vilinska jama,Croatia,5.6.2014.,2014-06-05,1juv m,1,Leptonetidae,Barusia,maheni,Barusia maheni,118,42.728.553,17.881.121,tf,deep cave,,10,,"13,6","16,61458397","16,61458397","23,72142792",1068,24,"91,19914008","84,6",,1,1,1,14.9,10.3,5.8
4148,Bezdan,Croatia,3.6.2014.,2014-06-03,1f,1,Dysderidae,Stalagtia,sp. 1,Stalagtia sp. 1,133,42.530.343,18.316.239,Tb,deep cave,,2,,"14,7","16,13833237","16,13833237","24,16666794",1249,23,"112,0435418",,,0.5,0.3,1,nan,12,22
4197,Kukova peć,Croatia,30.11.2014.,2014-11-30,1m,1,Dysderidae,Stalagtia,hercegovinensis,Stalagtia hercegovinensis,185,42.726.992,1.796.566,Tb,deep cave,,5,17,"16,6","15,07569408","15,07569408","24,35416603",1115,26,"90,07229603",,,1,1.2,1,nan,81.5,22
4215,Kukova peć,Croatia,30.11.2014.,2014-11-30,"2m, 1f, 1juv",4,Agelenidae,Histopona,dubia,Histopona dubia,185,42.726.992,1.796.566,tb,deep cave,,5,17,"16,6","15,07569408","15,07569408","24,35416603",1115,26,"90,07229603",,,1,1.2,1,nan,81.5,22
4216,Kukova peć,Croatia,30.11.2014.,2014-11-30,1m,1,Agelenidae,Histopona,dubia,Histopona dubia,185,42.726.992,1.796.566,tb,deep cave,,5,17,"16,6","15,07569408","15,07569408","24,35416603",1115,26,"90,07229603",,,1,1.2,1,nan,81.5,22
4224,Močiljska špilja,Croatia,2.12.2014.,2014-12-02,1juv,1,Dysderidae,Stalagtia,sp. 5,Stalagtia sp. 5,333,42.689.061,18.071.906,Tb,deep cave,,6,"15,4","14,7","15,5370369","15,5370369","24,25",1154,26,"95,48772633",,,5,2.5,1,1038,938,138
4226,Močiljska špilja,Croatia,1.12.2014.,2014-12-01,"1f/juv, 1 juv",2,Leptonetidae,Sulcia,sp.,Sulcia sp.,333,42.689.061,18.071.906,,,,6,"15,4","14,7","15,5370369","15,5370369","24,25",1154,26,"95,48772633",,,5,2.5,1,1038,938,138
4232,Vištičina jama,Croatia,1.11.2013.,2013-11-01,1f,1,Dysderidae,Stalagtia,sp. 4_1,Stalagtia sp. 4_1,165,42.985.281,17.557.541,Tb,deep cave,,3,,11,"15,60000038","15,60000038","27,23600006",966,25,"70,13034031",,,,,,,,
4236,Kornjatuša,Croatia,2.11.2013.,2013-11-02,"1m, 1f",2,Dysderidae,Stalagtia,sp. 4_1,Stalagtia sp. 4_1,542,4.297.909,17.673.966,Tb,deep cave,,5,,"10,5","14,43300056","14,43300056","27,01200104",1017,26,"63,78359658",,,,,,,,
4238,Vištičina jama,Croatia,1.11.2013.,2013-11-01,2juv,2,Dysderidae,Stalagtia,sp. 4_1,Stalagtia sp. 4_1,165,42.985.281,17.557.541,Tb,deep cave,,3,,11,"15,60000038","15,60000038","27,23600006",966,25,"70,13034031",,,,,,,,
4239,Tihinja,Croatia,7.12.2013.,2013-12-07,1f,1,Dysderidae,Harpactea,sp. 3,Harpactea sp. 3,51,42.866.729,1.767.021,tb,deep cave,,5,,"9,8","16,36354256","16,36354256","26,23500061",1001,25,"79,07159234","83,1",,,,,,,
4243,Kornjatuša,Croatia,5.11.2013.,2013-11-05,1juv,1,Dysderidae,Stalagtia,sp. 4_1,Stalagtia sp. 4_1,542,4.297.909,17.673.966,Tb,deep cave,,5,,"10,5","14,43300056","14,43300056","27,01200104",1017,26,"63,78359658",,,,,,,,
4244,Kornjatuša,Croatia,5.11.2013.,2013-11-05,1juvm,1,Dysderidae,Stalagtia,sp. 4_1,Stalagtia sp. 4_1,542,4.297.909,17.673.966,Tb,deep cave,,5,,"10,5","14,43300056","14,43300056","27,01200104",1017,26,"63,78359658",,,,,,,,
4245,Kornjatuša,Croatia,5.11.2013.,2013-11-05,1m,1,Agelenidae,Histopona,luxurians,Histopona luxurians,542,4.297.909,17.673.966,tf,deep cave,,5,,"10,5","14,43300056","14,43300056","27,01200104",1017,26,"63,78359658",,,,,,,,
4246,Vištičina jama,Croatia,1.11.2013.,2013-11-01,1f,1,Dysderidae,Stalagtia,sp. 4_1,Stalagtia sp. 4_1,165,42.985.281,17.557.541,Tb,deep cave,,3,,11,"15,60000038","15,60000038","27,23600006",966,25,"70,13034031",,,,,,,,
4247,Jama na Benkotovu,Croatia,3.8.2014.,2014-08-03,1m,1,Linyphiidae,Palliduphantes,spelaeorum,Palliduphantes spelaeorum,120,4.337.569,16.272.059,Tf,deep cave,,3,,"15,2","15,939394","15,939394","23,43181801",720,29,"142,4731318","93,667",,1.8,2.5,1,41.1,17.6,30.2
4248,Stara jametina,Croatia,19.2.2016.,2016-02-19,1m,1,Dysderidae,Stalagtia,sp. 4,Stalagtia sp. 4,161,43.794.009,1.600.259,Tb,deep cave,,6,"13,4","13,2","14,21000004","14,21000004","27,66799927",790,20,"170,7986956","90,95","91,7",12,8,1,nan,188,85
4249,Špilja iznad Kopren dola,Croatia,3.11.2013.,2013-11-03,"1f, 4juv",5,Dysderidae,Stalagtia,sp. 4_1,Stalagtia sp. 4_1,139,42.983.916,1.762.401,Tb,deep cave,,1,,"14,7","16,22516632","16,22516632","27,9640007",984,32,"65,99245219",80,,,,,,,
4254,Vištičina jama,Croatia,1.11.2013.,2013-11-01,1juv,1,Dysderidae,Stalagtia,sp. 4_1,Stalagtia sp. 4_1,165,42.985.281,17.557.541,Tb,deep cave,,3,,11,"15,60000038","15,60000038","27,23600006",966,25,"70,13034031",,,,,,,,
4255,Vištičina jama,Croatia,1.11.2013.,2013-11-01,"1f, 2m",3,Linyphiidae,Palliduphantes,spelaeorum,Palliduphantes spelaeorum,165,42.985.281,17.557.541,Tf,deep cave,,3,,11,"15,60000038","15,60000038","27,23600006",966,25,"70,13034031",,,,,,,,
4256,Tihinja,Croatia,3.11.2013.,2013-11-03,1f,1,Linyphiidae,Palliduphantes,sp. 6,Palliduphantes sp. 6,51,42.866.729,1.767.021,,,,5,,"9,8","16,36354256","16,36354256","26,23500061",1001,25,"79,07159234","83,1",,,,,,,
4257,Tihinja,Croatia,3.11.2013.,2013-11-03,1juv,1,Dysderidae,Harpactea,sp. 3,Harpactea sp. 3,51,42.866.729,1.767.021,tb,deep cave,,5,,"9,8","16,36354256","16,36354256","26,23500061",1001,25,"79,07159234","83,1",,,,,,,
4260,Kornjatuša,Croatia,2.11.2013.,2013-11-02,1juv,1,Dysderidae,Stalagtia,sp. 4_1,Stalagtia sp. 4_1,542,4.297.909,17.673.966,Tb,deep cave,,5,,"10,5","14,43300056","14,43300056","27,01200104",1017,26,"63,78359658",,,,,,,,
4261,Kornjatuša,Croatia,2.11.2013.,2013-11-02,"1m, 1juv",2,Linyphiidae,Palliduphantes,spelaeorum,Palliduphantes spelaeorum,542,4.297.909,17.673.966,Tf,deep cave,,5,,"10,5","14,43300056","14,43300056","27,01200104",1017,26,"63,78359658",,,,,,,,
4264,Đutno,Croatia,20.3.2016.,2016-03-20,1juvf,1,Linyphiidae,Troglohyphantes,croaticus,Troglohyphantes croaticus,218,45.415.607,15.233.039,tb,deep cave,,4,,"7,75","10,4248333","10,4248333","28,8239994",1290,23,"379,8005434",,,7.5,5,1,nan,328,34
4265,Kornjatuša,Croatia,5.11.2013.,2013-11-05,1juvm,1,Dysderidae,Stalagtia,sp. 4_1,Stalagtia sp. 4_1,542,4.297.909,17.673.966,Tb,deep cave,,5,,"10,5","14,43300056","14,43300056","27,01200104",1017,26,"63,78359658",,,,,,,,
4266,Kornjatuša,Croatia,5.11.2013.,2013-11-05,1m,1,Linyphiidae,Palliduphantes,spelaeorum,Palliduphantes spelaeorum,542,4.297.909,17.673.966,Tf,deep cave,,5,,"10,5","14,43300056","14,43300056","27,01200104",1017,26,"63,78359658",,,,,,,,
4273,Đutno,Croatia,20.3.2016.,2016-03-20,"1m, 1juv",2,Linyphiidae,Troglohyphantes,croaticus,Troglohyphantes croaticus,218,45.415.607,15.233.039,tb,deep cave,,4,,"7,75","10,4248333","10,4248333","28,8239994",1290,23,"379,8005434",,,7.5,5,1,nan,328,34
4274,Đutno,Croatia,20.3.2016.,2016-03-20,"1f, 2m, 1juvm, 1juvf",5,Linyphiidae,Troglohyphantes,croaticus,Troglohyphantes croaticus,218,45.415.607,15.233.039,tb,deep cave,,4,,"7,75","10,4248333","10,4248333","28,8239994",1290,23,"379,8005434",,,7.5,5,1,nan,328,34
4278,Tučepska vilenjača,Croatia,9.8.1998.,1998-08-09,1f,1,Dysderidae,Mesostalita,comottii,Mesostalita comottii,1242,43.286.465,17.083.638,Tb,deep cave,,8,"10,6","10,731","9,67800045","9,67800045","24,96000099",926,26,"67,32747088",,,6,0.8,1,nan,28,35
4279,Tučepska vilenjača,Croatia,9.8.1998.,1998-08-09,2f,2,Dysderidae,Mesostalita,comottii,Mesostalita comottii,1242,43.286.465,17.083.638,Tb,deep cave,,8,"10,6","10,731","9,67800045","9,67800045","24,96000099",926,26,"67,32747088",,,6,0.8,1,nan,28,35
4280,Jama pod Gažnovcem,Croatia,4.11.2016.,2016-11-04,1f,1,Dysderidae,Harpactea,sp. 2,Harpactea sp. 2,590,43.229.672,17.314.159,Tb,deep cave,,8,,"11,6","12,67833328","12,67833328","26,74400139",940,23,"59,1740747","99,2",,0.6,1,1,45,41,3.5
4281,Jama pod Gažnovcem,Croatia,4.11.2016.,2016-11-04,4juv,4,Dysderidae,Stalagtia,sp. 4,Stalagtia sp. 4,590,43.229.672,17.314.159,Tb,deep cave,,8,,"11,6","12,67833328","12,67833328","26,74400139",940,23,"59,1740747","99,2",,0.6,1,1,45,41,3.5
4282,Jama pod Gažnovcem,Croatia,4.11.2016.,2016-11-04,"2f, 1m, 7juv",1,Linyphiidae,Typhlonyphia,sp. 1,Typhlonyphia sp. 1,590,43.229.672,17.314.159,Tb,deep cave,,8,,"11,6","12,67833328","12,67833328","26,74400139",940,23,"59,1740747","99,2",,0.6,1,1,45,41,3.5
4283,Jama pod Gažnovcem,Croatia,4.11.2016.,2016-11-04,"2f, 1m",3,Pholcidae,Stygopholcus,absoloni,Stygopholcus absoloni,590,43.229.672,17.314.159,,deep cave,,8,,"11,6","12,67833328","12,67833328","26,74400139",940,23,"59,1740747","99,2",,0.6,1,1,45,41,3.5
4284,Jama pod Gažnovcem,Croatia,4.11.2016.,2016-11-04,"1m, 4f",5,Linyphiidae,Palliduphantes,spelaeorum,Palliduphantes spelaeorum,590,43.229.672,17.314.159,Tf,deep cave,,8,,"11,6","12,67833328","12,67833328","26,74400139",940,23,"59,1740747","99,2",,0.6,1,1,45,41,3.5
4285,Jama pod Gažnovcem,Croatia,4.11.2016.,2016-11-04,2m,2,Linyphiidae,Centromerus,cavernarum,Centromerus cavernarum,590,43.229.672,17.314.159,Tf,deep cave,,8,,"11,6","12,67833328","12,67833328","26,74400139",940,23,"59,1740747","99,2",,0.6,1,1,45,41,3.5
4286,Peć u Čulinovim raljevinama,Croatia,5.11.2016.,2016-11-05,5juv,5,Dysderidae,Stalagtia,sp. 4,Stalagtia sp. 4,369,43.605.854,16.575.066,Tb,deep cave,,5,,11,"12,99133301","12,99133301","26,44000053",879,26,"104,4759765",,,1,1,1,nan,42.5,12.5
4287,Peć u Čulinovim raljevinama,Croatia,5.11.2016.,2016-11-05,1m,1,Nesticidae,Kryptonesticus,eremita,Kryptonesticus eremita,369,43.605.854,16.575.066,tf,deep cave,,5,,11,"12,99133301","12,99133301","26,44000053",879,26,"104,4759765",,,1,1,1,nan,42.5,12.5
4288,Tučepska vilenjača,Croatia,28.4.2014.,2014-04-28,"1f, 1juv",2,Dysderidae,Stalagtia,sp. 4,Stalagtia sp. 4,1242,43.286.465,17.083.638,Tb,deep cave,,8,"10,6","10,731","9,67800045","9,67800045","24,96000099",926,26,"67,32747088",,,6,0.8,1,nan,28,35
4289,Tučepska vilenjača,Croatia,28.4.2014.,2014-04-28,1juv,1,Agelenidae,Histopona,sp.,Histopona sp.,1242,43.286.465,17.083.638,,,,8,"10,6","10,731","9,67800045","9,67800045","24,96000099",926,26,"67,32747088",,,6,0.8,1,nan,28,35
4290,Jujnovića špilja,Croatia,29.4.2014.,2014-04-29,1juv,1,Agelenidae,Histopona,sp.,Histopona sp.,463,43.266.579,1.719.798,,,,6,"13,8","10,85","12,35200024","12,35200024","26,52000046",917,29,"61,15708825",,,5,2.5,1,108,40,16
4293,Jujnovića špilja,Croatia,14.5.2016.,2016-05-14,"1f, 1juv",2,Dysderidae,Harpactea,damini,Harpactea damini,463,43.266.579,1.719.798,TF,deep cave,,6,"13,8","10,85","12,35200024","12,35200024","26,52000046",917,29,"61,15708825",,,5,2.5,1,108,40,16
4294,Peć u Čulinovim raljevinama,Croatia,20.5.2016.,2016-05-20,2juv,2,Dysderidae,Stalagtia,sp. 4,Stalagtia sp. 4,369,43.605.854,16.575.066,Tb,deep cave,,5,,11,"12,99133301","12,99133301","26,44000053",879,26,"104,4759765",,,1,1,1,nan,42.5,12.5
4296,Peć u Čulinovim raljevinama,Croatia,20.5.2016.,2016-05-20,2f,2,Linyphiidae,Centromerus,cavernarum,Centromerus cavernarum,369,43.605.854,16.575.066,Tf,deep cave,,5,,11,"12,99133301","12,99133301","26,44000053",879,26,"104,4759765",,,1,1,1,nan,42.5,12.5
4297,Jama za Supinom,Croatia,18.5.2016.,2016-05-18,1juv,1,Dysderidae,Stalagtia,sp. 4,Stalagtia sp. 4,905,43.250.417,17.113.278,Tb,deep cave,,7,,"10,75","9,67800045","9,67800045","24,96000099",926,26,"69,05858686","87,25",,2.5,2.5,1,372,264,82
4300,Jama za Supinom,Croatia,18.5.2016.,2016-05-18,1f,1,Dysderidae,Stalagtia,sp. 4,Stalagtia sp. 4,905,43.250.417,17.113.278,Tb,deep cave,,7,,"10,75","9,67800045","9,67800045","24,96000099",926,26,"69,05858686","87,25",,2.5,2.5,1,372,264,82
4301,Pretnerova jama,Croatia,19.5.2016.,2016-05-19,1f,1,Nesticidae,Kryptonesticus,deelemanae,Kryptonesticus deelemanae,1459,43.339.276,17.038.312,tb,deep cave,,2,,"5,44","7,902999878","7,902999878","24,58800125",950,23,"66,01720708","68,3",,2.5,1.5,1,nan,422,254
4302,Gradska spila,Croatia,15.5.2016.,2016-05-15,1m,1,Dysderidae,Harpactea,damini,Harpactea damini,621,43.318.029,17.117.623,TF,deep cave,,4,,"6,6","9,092166901","9,092166901",25,931,23,"61,25913011","93,333",,5,2.5,1,nan,26.5,1.8
4303,Gradska spila,Croatia,15.5.2016.,2016-05-15,"8m, plur f i juv",8,Leptonetidae,Sulcia,sp.,Sulcia sp.,621,43.318.029,17.117.623,,,,4,,"6,6","9,092166901","9,092166901",25,931,23,"61,25913011","93,333",,5,2.5,1,nan,26.5,1.8
4304,Tučepska vilenjača,Croatia,18.9.2016.,2016-09-18,1juvm,1,Dysderidae,Stalagtia,sp. 4,Stalagtia sp. 4,1242,43.286.465,17.083.638,Tb,deep cave,,8,"10,6","10,731","9,67800045","9,67800045","24,96000099",926,26,"67,32747088",,,6,0.8,1,nan,28,35
4305,Tučepska vilenjača,Croatia,18.9.2016.,2016-09-18,"1m, 1f, 1juv",3,Linyphiidae,Typhlonyphia,sp. 1,Typhlonyphia sp. 1,1242,43.286.465,17.083.638,Tb,deep cave,,8,"10,6","10,731","9,67800045","9,67800045","24,96000099",926,26,"67,32747088",,,6,0.8,1,nan,28,35
4306,Peć u Čulinovim raljevinama,Croatia,20.5.2016.,2016-05-20,1juv,1,Dysderidae,Stalagtia,sp. 4,Stalagtia sp. 4,369,43.605.854,16.575.066,Tb,deep cave,,5,,11,"12,99133301","12,99133301","26,44000053",879,26,"104,4759765",,,1,1,1,nan,42.5,12.5
4307,Gradska spila,Croatia,15.5.2016.,2016-05-15,1f,1,Dysderidae,Harpactea,damini,Harpactea damini,621,43.318.029,17.117.623,TF,deep cave,,4,,"6,6","9,092166901","9,092166901",25,931,23,"61,25913011","93,333",,5,2.5,1,nan,26.5,1.8
4308,Gradska spila,Croatia,15.5.2016.,2016-05-15,"1m, 1juv",2,Leptonetidae,Sulcia,sp.,Sulcia sp.,621,43.318.029,17.117.623,,,,4,,"6,6","9,092166901","9,092166901",25,931,23,"61,25913011","93,333",,5,2.5,1,nan,26.5,1.8
4309,Peć u Čulinovim raljevinama,Croatia,20.5.2016.,2016-05-20,1juv,1,Dysderidae,Stalagtia,sp. 4,Stalagtia sp. 4,369,43.605.854,16.575.066,Tb,deep cave,,5,,11,"12,99133301","12,99133301","26,44000053",879,26,"104,4759765",,,1,1,1,nan,42.5,12.5
4311,Spila 2,Croatia,14.5.2016.,2016-05-14,"1f, 1juv",2,Dysderidae,Stalagtia,sp. 4,Stalagtia sp. 4,349,4.326.239,17.204.021,Tb,deep cave,,6,12,12,"12,35200024","12,35200024","26,52000046",917,21,"61,25054739","96,3","96,3",0.5,0.7,1,28,24,11
4312,Spila 2,Croatia,14.5.2016.,2016-05-14,1f,1,Agelenidae,Histopona,conveniens,Histopona conveniens,349,4.326.239,17.204.021,Tf,deep cave,,6,12,12,"12,35200024","12,35200024","26,52000046",917,21,"61,25054739","96,3","96,3",0.5,0.7,1,28,24,11
4313,Spila 2,Croatia,14.5.2016.,2016-05-14,"1m, 1f, 2juv",4,Leptonetidae,Sulcia,sp.,Sulcia sp.,349,4.326.239,17.204.021,,,,6,12,12,"12,35200024","12,35200024","26,52000046",917,21,"61,25054739","96,3","96,3",0.5,0.7,1,28,24,11
4316,Velika špilja kod Antunovića,Croatia,17.5.2016.,2016-05-17,2juv,2,Dysderidae,Stalagtia,sp. 4,Stalagtia sp. 4,944,43.276.843,17.227.143,Tb,deep cave,,1,"11,9","12,1","11,41149998","11,41149998","26,41199875",935,28,"57,93624128",,,30,6,1,265,253,14
4317,Jama za Supinom,Croatia,18.5.2016.,2016-05-18,1juv,1,Dysderidae,Stalagtia,sp. 4,Stalagtia sp. 4,905,43.250.417,17.113.278,Tb,deep cave,,7,,"10,75","9,67800045","9,67800045","24,96000099",926,26,"69,05858686","87,25",,2.5,2.5,1,372,264,82
4318,Jama za Supinom,Croatia,18.5.2016.,2016-05-18,1juv,1,Nesticidae,Kryptonesticus,deelemanae,Kryptonesticus deelemanae,905,43.250.417,17.113.278,TB,deep cave,,7,,"10,75","9,67800045","9,67800045","24,96000099",926,26,"69,05858686","87,25",,2.5,2.5,1,372,264,82
4319,Peć u Čulinovim raljevinama,Croatia,20.5.2016.,2016-05-20,2juv,2,Dysderidae,Stalagtia,sp. 4,Stalagtia sp. 4,369,43.605.854,16.575.066,Tb,deep cave,,5,,11,"12,99133301","12,99133301","26,44000053",879,26,"104,4759765",,,1,1,1,nan,42.5,12.5
4320,Peć u Čulinovim raljevinama,Croatia,20.5.2016.,2016-05-20,"1m, 1f, 2juv",4,Leptonetidae,Barusia,maheni,Barusia maheni,369,43.605.854,16.575.066,tf,deep cave,,5,,11,"12,99133301","12,99133301","26,44000053",879,26,"104,4759765",,,1,1,1,nan,42.5,12.5
4321,Peć u Čulinovim raljevinama,Croatia,20.5.2016.,2016-05-20,1juv m,1,Linyphiidae,Troglohyphantes,strandi,Troglohyphantes strandi,369,43.605.854,16.575.066,tb,deep cave,,5,,11,"12,99133301","12,99133301","26,44000053",879,26,"104,4759765",,,1,1,1,nan,42.5,12.5
4328,Špilja pod Zimzelom,Croatia,3.10.2015.,2015-10-03,"1m, 1f",2,Dysderidae,Parastalita,stygia,Parastalita stygia,791,45.281.948,15.115.239,Tb,deep cave,,1,,8,"7,624666691","7,624666691","27,04400063",1505,24,"373,7136599",,,5,2.7,1,nan,194,21
4329,Jama kod šumarske kuće,Croatia,9.11.2016.,2016-11-09,1m,1,Dysderidae,Parastalita,stygia,Parastalita stygia,923,45.336.159,14.926.119,Tb,deep cave,,1,,"7,2","6,87349987","6,87349987","26,93999863",1545,24,"394,8980675",,,1,0.7,1,nan,83,77
4331,Ostaševica,Croatia,4.12.2001.,2001-12-04,"1f, 3juv",4,Agelenidae,Histopona,bidens,Histopona bidens,302,42.748.959,17.544.404,tb,deep cave,,9,,"11,4","15,79444408","15,79444408","24,11999893",925,25,"101,3842944",100,,6,5,1,nan,70,20
4333,Jama kod Lugarnice,Croatia,4.10.2015.,2015-10-04,1m,1,Dysderidae,Parastalita,stygia,Parastalita stygia,528,45.327.864,15.092.353,Tb,deep cave,,3,,"8,9","8,389166832","8,389166832","27,80400085",1465,24,"380,6148962","94,3",,,,,,,
4334,Jama kod Lugarnice,Croatia,4.10.2015.,2015-10-04,"1f, 1juvm, 2juv",4,Linyphiidae,Troglohyphantes,croaticus,Troglohyphantes croaticus,528,45.327.864,15.092.353,tb,deep cave,,3,,"8,9","8,389166832","8,389166832","27,80400085",1465,24,"380,6148962","94,3",,,,,,,
4340,Špilja pod Mačkovom dragom,Croatia,9.10.2015.,2015-10-09,1f,1,Dysderidae,Parastalita,stygia,Parastalita stygia,685,45.261.001,15.023.822,Tb,deep cave,,1,,"7,4","6,968666553","6,968666553","26,46800041",1564,25,"378,8376232",,,2,1,1,376,362,26
4342,Jama kod šumarske kuće,Croatia,4.10.2015.,2015-10-04,1f,1,Dysderidae,Parastalita,stygia,Parastalita stygia,923,45.336.159,14.926.119,Tb,deep cave,,1,,"7,2","6,87349987","6,87349987","26,93999863",1545,24,"394,8980675",,,1,0.7,1,nan,83,77
4343,Đutno,Croatia,20.3.2016.,2016-03-20,1juv,1,Dysderidae,Stalita,pretneri,Stalita pretneri,218,45.415.607,15.233.039,Tb,deep cave,,4,,"7,75","10,4248333","10,4248333","28,8239994",1290,23,"379,8005434",,,7.5,5,1,nan,328,34
4344,Tučepska vilenjača,Croatia,30.4.2012.,2012-04-30,1f,1,Dysderidae,Stalagtia,sp. 4,Stalagtia sp. 4,1242,43.286.465,17.083.638,Tb,deep cave,,8,"10,6","10,731","9,67800045","9,67800045","24,96000099",926,26,"67,32747088",,,6,0.8,1,nan,28,35
4345,Đutno,Croatia,20.3.2016.,2016-03-20,2juv,2,Dysderidae,Stalita,pretneri,Stalita pretneri,218,45.415.607,15.233.039,Tb,deep cave,,4,,"7,75","10,4248333","10,4248333","28,8239994",1290,23,"379,8005434",,,7.5,5,1,nan,328,34
4353,Jama pod Sinji kuk,Croatia,31.10.2016.,2016-10-31,3 juv,3,Dysderidae,Stalagtia,hercegovinensis,Stalagtia hercegovinensis,254,42.709.828,17.988.632,Tb,deep cave,,5,,"16,2","15,07569408","15,07569408","24,35416603",1115,26,"92,46523385",,,2,1.8,1,18,8,15
4354,Jama pod Sinji kuk,Croatia,31.10.2016.,2016-10-31,"3juvm, 2 juv",5,Leptonetidae,Gen. 1,sp. 1,Gen. 1 sp. 1,254,42.709.828,17.988.632,Tb,deep cave,,5,,"16,2","15,07569408","15,07569408","24,35416603",1115,26,"92,46523385",,,2,1.8,1,18,8,15
4374,Maklutača,Croatia,12.5.2013.,2013-05-12,"1m, 2f",3,Linyphiidae,Troglohyphantes,strandi,Troglohyphantes strandi,415,43.569.268,16.620.515,tb,deep cave,,6,,"6,25","11,86699963","11,86699963","25,86800003",883,29,"99,53597793",,,11,6.5,1,152,140,39
4383,Gorska jama,Croatia,19.5.2013.,2013-05-19,1f,1,Leptonetidae,Barusia,maheni,Barusia maheni,179,4.292.697,17.424.809,tf,deep cave,,2,"10,6","13,3","16,30899048","16,30899048","26,72631454",906,29,"86,44992112","99,9",,nan,nan,1,nan,nan,nan
4385,Pušina,Croatia,21.6.2014.,2014-06-21,"1m, 2f, 1juvm",4,Linyphiidae,Porrhomma,egeria,Porrhomma egeria,729,45.740.585,1.535.653,,deep cave,,4,,"8,3","8,075166702","8,075166702","28,34399986",1294,23,"410,6956067",,,0.75,0.5,1,nan,328,56
4387,Spilja od Tankega rota,Croatia,17.6.2013.,2013-06-17,"1m, 2f, 2juv",5,Nesticidae,Kryptonesticus,eremita,Kryptonesticus eremita,114,43.012.832,16.111.537,tf,deep cave,,1,,17,"15,42175961","15,42175961","22,66110992",580,28,"179,9480494",80,,1,2,1,164,148,19
4392,Špilja u Gaju,Croatia,16.5.2016.,2016-05-16,1f,1,Agelenidae,Histopona,conveniens,Histopona conveniens,706,43.382.476,17.040.666,Tf,deep cave,,7,"10,6","10,825","12,27216721","12,27216721","26,62000084",912,23,"62,15311347",99,99,nan,nan,1,nan,nan,nan
4393,Špilja u Gaju,Croatia,16.5.2016.,2016-05-16,1juv,1,Agelenidae,Tegenaria,sp.,Tegenaria sp.,706,43.382.476,17.040.666,,,,7,"10,6","10,825","12,27216721","12,27216721","26,62000084",912,23,"62,15311347",99,99,nan,nan,1,nan,nan,nan
4394,Špilja u Gaju,Croatia,16.5.2016.,2016-05-16,1f?,1,Dysderidae,Stalagtia,sp. 4,Stalagtia sp. 4,706,43.382.476,17.040.666,Tb,deep cave,,7,"10,6","10,825","12,27216721","12,27216721","26,62000084",912,23,"62,15311347",99,99,nan,nan,1,nan,nan,nan
4395,Špilja u Gaju,Croatia,16.5.2016.,2016-05-16,1f,1,Linyphiidae,Typhlonyphia,sp. 1,Typhlonyphia sp. 1,706,43.382.476,17.040.666,Tb,deep cave,,7,"10,6","10,825","12,27216721","12,27216721","26,62000084",912,23,"62,15311347",99,99,nan,nan,1,nan,nan,nan
4396,Špilja u Gaju,Croatia,16.5.2016.,2016-05-16,1m,1,Agelenidae,Histopona,conveniens,Histopona conveniens,706,43.382.476,17.040.666,Tf,deep cave,,7,"10,6","10,825","12,27216721","12,27216721","26,62000084",912,23,"62,15311347",99,99,nan,nan,1,nan,nan,nan
4397,Gradska spila,Croatia,15.5.2016.,2016-05-15,"1f, 1m, 4 juv",6,Leptonetidae,Sulcia,sp.,Sulcia sp.,621,43.318.029,17.117.623,,,,4,,"6,6","9,092166901","9,092166901",25,931,23,"61,25913011","93,333",,5,2.5,1,nan,26.5,1.8
4398,Gradska spila,Croatia,15.5.2016.,2016-05-15,"1m, 1juv",2,Dysderidae,Harpactea,damini,Harpactea damini,621,43.318.029,17.117.623,TF,deep cave,,4,,"6,6","9,092166901","9,092166901",25,931,23,"61,25913011","93,333",,5,2.5,1,nan,26.5,1.8
4399,Špilja u Radinovcima,Croatia,15.5.2016.,2016-05-15,"1f, 3 juv",4,Nesticidae,Kryptonesticus,deelemanae,Kryptonesticus deelemanae,416,43.387.285,170.103,tb,deep cave,,4,,"8,525","12,27216721","12,27216721","26,62000084",912,23,"64,7145817",93,,7,4,1,nan,50,14
4401,Jama pod Barišinovcem,Croatia,21.5.2016.,2016-05-21,1m,1,Nesticidae,Kryptonesticus,eremita,Kryptonesticus eremita,431,43.695.911,16.308.069,tf,deep cave,,5,,"10,3","13,1133337","13,1133337","26,19199944",855,26,"134,9828358","99,55",,5,5,1,288,144,186
4402,Jama iznad Saranača,Croatia,17.5.2016.,2016-05-17,1juvm,1,Agelenidae,Histopona,sp.,Histopona sp.,777,43.249.007,17.174.663,,,,7,"10,8","11,112","11,73516655","11,73516655","25,61599922",905,28,"64,87446036",,,2.5,0.5,1,nan,8.6,20.5
4403,Jama za Supinom,Croatia,18.5.2016.,2016-05-18,1f,1,Linyphiidae,Palliduphantes,sp. X,Palliduphantes sp. X,905,43.250.417,17.113.278,,,,7,,"10,75","9,67800045","9,67800045","24,96000099",926,26,"69,05858686","87,25",,2.5,2.5,1,372,264,82
4404,Spila 2,Croatia,14.5.2016.,2016-05-14,1f,1,Linyphiidae,Typhlonyphia,sp. 1,Typhlonyphia sp. 1,349,4.326.239,17.204.021,Tb,deep cave,,6,12,12,"12,35200024","12,35200024","26,52000046",917,21,"61,25054739","96,3","96,3",0.5,0.7,1,28,24,11
4405,Spila 2,Croatia,14.5.2016.,2016-05-14,1f,1,Leptonetidae,Gen.,sp.,Gen. sp.,349,4.326.239,17.204.021,,,,6,12,12,"12,35200024","12,35200024","26,52000046",917,21,"61,25054739","96,3","96,3",0.5,0.7,1,28,24,11
4406,Spila 2,Croatia,14.5.2016.,2016-05-14,1juv,1,Dysderidae,Harpactea,damini,Harpactea damini,349,4.326.239,17.204.021,TF,deep cave,,6,12,12,"12,35200024","12,35200024","26,52000046",917,21,"61,25054739","96,3","96,3",0.5,0.7,1,28,24,11
4407,Spila 2,Croatia,14.5.2016.,2016-05-14,1juv,1,Dysderidae,Stalagtia,sp. 4,Stalagtia sp. 4,349,4.326.239,17.204.021,Tb,deep cave,,6,12,12,"12,35200024","12,35200024","26,52000046",917,21,"61,25054739","96,3","96,3",0.5,0.7,1,28,24,11
4408,Ješkalovica,Croatia,18.6.2013.,2013-06-18,"4f, 1juvf",5,Nesticidae,Kryptonesticus,eremita,Kryptonesticus eremita,194,43.299.857,16.839.313,tf,deep cave,,2,,"15,4","15,64131927","15,64131927","25,73750114",817,20,"87,88201212","95,1",,1,1,1,nan,21,29
4411,Mićoletova jama,Croatia,17.5.2016.,2016-05-17,"1m, 2f",3,Nesticidae,Kryptonesticus,eremita,Kryptonesticus eremita,137,43.565.689,16.300.318,tf,deep cave,,1,,"14,9","15,22274303","15,22274303","25,78333473",792,29,"135,169185",,,1.2,1.6,1,23,3,20
4413,Matijaševa peć,Croatia,15.5.2016.,2016-05-15,"1f, 1juv",2,Agelenidae,Histopona,conveniens,Histopona conveniens,621,43.320.551,17.122.321,Tf,deep cave,,6,"8,3","6,933","9,092166901","9,092166901",25,931,23,"60,61369348",,,3,1,1,18,17,6
4414,Velika špilja kod Antunovića,Croatia,17.5.2016.,2016-05-17,1juv,1,Dysderidae,Stalagtia,sp. 4,Stalagtia sp. 4,944,43.276.843,17.227.143,Tb,deep cave,,1,"11,9","12,1","11,41149998","11,41149998","26,41199875",935,28,"57,93624128",,,30,6,1,265,253,14
4415,Tučepska vilenjača,Croatia,20.5.2016.,2016-05-20,1f,1,Agelenidae,Histopona,conveniens,Histopona conveniens,1242,43.286.465,17.083.638,Tf,deep cave,,8,"10,6","10,731","9,67800045","9,67800045","24,96000099",926,26,"67,32747088",,,6,0.8,1,nan,28,35
4416,Tučepska vilenjača,Croatia,20.5.2016.,2016-05-20,"1m, 1juv/f",2,Leptonetidae,Barusia,maheni,Barusia maheni,1242,43.286.465,17.083.638,tf,deep cave,,8,"10,6","10,731","9,67800045","9,67800045","24,96000099",926,26,"67,32747088",,,6,0.8,1,nan,28,35
4417,Kukor,Croatia,16.5.2016.,2016-05-16,"2f, 4juv",6,Nesticidae,Kryptonesticus,deelemanae,Kryptonesticus deelemanae,587,43.355.609,16.991.707,tb,deep cave,,10,,"15,4","12,63749981","12,63749981","25,40833473",906,29,"68,94753675",,,1,1,1,264,213,40
4418,Kukor,Croatia,16.5.2016.,2016-05-16,1juv,1,Scytodidae,Scytodes,thoracica,Scytodes thoracica,587,43.355.609,16.991.707,Tx,,,10,,"15,4","12,63749981","12,63749981","25,40833473",906,29,"68,94753675",,,1,1,1,264,213,40
4420,Špilja u Radinovcima,Croatia,1.5.2014.,2014-05-01,1juv,1,Nesticidae,Kryptonesticus,deelemanae,Kryptonesticus deelemanae,416,43.387.285,170.103,TB,deep cave,,4,,"8,525","12,27216721","12,27216721","26,62000084",912,23,"64,7145817",93,,7,4,1,nan,50,14
4421,Špilja u Radinovcima,Croatia,15.5.2016.,2016-05-15,"1f, 3juvm",4,Nesticidae,Kryptonesticus,deelemanae,Kryptonesticus deelemanae,416,43.387.285,170.103,tb,deep cave,,4,,"8,525","12,27216721","12,27216721","26,62000084",912,23,"64,7145817",93,,7,4,1,nan,50,14
4422,Špilja u Radinovcima,Croatia,15.5.2016.,2016-05-15,1f,1,Linyphiidae,Typhlonyphia,sp. 1,Typhlonyphia sp. 1,416,43.387.285,170.103,Tb,deep cave,,4,,"8,525","12,27216721","12,27216721","26,62000084",912,23,"64,7145817",93,,7,4,1,nan,50,14
4423,Špilja u Gaju,Croatia,16.5.2016.,2016-05-16,1juv,1,Linyphiidae,Typhlonyphia,sp. 1,Typhlonyphia sp. 1,706,43.382.476,17.040.666,Tb,deep cave,,7,"10,6","10,825","12,27216721","12,27216721","26,62000084",912,23,"62,15311347",99,99,nan,nan,1,nan,nan,nan
4426,Matijaševa peć,Croatia,15.5.2016.,2016-05-15,"1m, 1f, 2juv",4,Leptonetidae,Sulcia,sp.,Sulcia sp.,621,43.320.551,17.122.321,,,,6,"8,3","6,933","9,092166901","9,092166901",25,931,23,"60,61369348",,,3,1,1,18,17,6
4427,Spila 1,Croatia,14.5.2016.,2016-05-14,1juvm,1,Agelenidae,Histopona,sp.,Histopona sp.,349,43.262.438,17.203.945,,,,3,"10,4","10,4","12,35200024","12,35200024","26,52000046",917,21,"61,24985608",100,100,3,1.8,1,30,27,10.5
4428,Spila 1,Croatia,14.5.2016.,2016-05-14,"2m, 2f, 2juv",6,Leptonetidae,Sulcia,sp.,Sulcia sp.,349,43.262.438,17.203.945,,,,3,"10,4","10,4","12,35200024","12,35200024","26,52000046",917,21,"61,24985608",100,100,3,1.8,1,30,27,10.5
4430,Tučepska vilenjača,Croatia,18.5.2016.,2016-05-18,"1m, 5f",6,Linyphiidae,Typhlonyphia,sp. 1,Typhlonyphia sp. 1,1242,43.286.465,17.083.638,Tb,deep cave,,8,"10,6","10,731","9,67800045","9,67800045","24,96000099",926,26,"67,32747088",,,6,0.8,1,nan,28,35
4432,Jama za Supinom,Croatia,18.5.2016.,2016-05-18,"1f, 1juv",2,Linyphiidae,Typhlonyphia,sp. 1,Typhlonyphia sp. 1,905,43.250.417,17.113.278,Tb,deep cave,,7,,"10,75","9,67800045","9,67800045","24,96000099",926,26,"69,05858686","87,25",,2.5,2.5,1,372,264,82
4433,Tučepska vilenjača,Croatia,18.5.2016.,2016-05-18,1juvm,1,Agelenidae,Histopona,sp.,Histopona sp.,1242,43.286.465,17.083.638,,,,8,"10,6","10,731","9,67800045","9,67800045","24,96000099",926,26,"67,32747088",,,6,0.8,1,nan,28,35
4434,Tučepska vilenjača,Croatia,18.5.2016.,2016-05-18,"1m, 1f, 1juv",3,Linyphiidae,Typhlonyphia,sp. 1,Typhlonyphia sp. 1,1242,43.286.465,17.083.638,Tb,deep cave,,8,"10,6","10,731","9,67800045","9,67800045","24,96000099",926,26,"67,32747088",,,6,0.8,1,nan,28,35
4435,Matijaševa peć,Croatia,15.5.2016.,2016-05-15,1f,1,Nesticidae,Kryptonesticus,deelemanae,Kryptonesticus deelemanae,621,43.320.551,17.122.321,tb,deep cave,,6,"8,3","6,933","9,092166901","9,092166901",25,931,23,"60,61369348",,,3,1,1,18,17,6
4437,Špilja u Gaju,Croatia,16.5.2016.,2016-05-16,"2f, 1juvm",3,Agelenidae,Histopona,conveniens,Histopona conveniens,706,43.382.476,17.040.666,Tf,deep cave,,7,"10,6","10,825","12,27216721","12,27216721","26,62000084",912,23,"62,15311347",99,99,nan,nan,1,nan,nan,nan
4438,Špilja u Gaju,Croatia,16.5.2016.,2016-05-16,2juv,2,Linyphiidae,Typhlonyphia,sp. 1,Typhlonyphia sp. 1,706,43.382.476,17.040.666,Tb,deep cave,,7,"10,6","10,825","12,27216721","12,27216721","26,62000084",912,23,"62,15311347",99,99,nan,nan,1,nan,nan,nan
4439,Jama pod Barišinovcem,Croatia,21.5.2016.,2016-05-21,1m,1,Nesticidae,Kryptonesticus,eremita,Kryptonesticus eremita,431,43.695.911,16.308.069,tf,deep cave,,5,,"10,3","13,1133337","13,1133337","26,19199944",855,26,"134,9828358","99,55",,5,5,1,288,144,186
4492,Rudnik Minjera,Croatia,22.6.2011.,2011-06-22,1f,1,Nesticidae,Kryptonesticus,eremita,Kryptonesticus eremita,197,43.361.342,1.660.633,tf,deep cave,,2,,"12,65","15,05266666","15,05266666","25,05999947",793,17,"107,4931529","95,85",,,,,,,
4495,Pišurka,Croatia,18.4.2011.,2011-04-18,1juv,1,Nesticidae,Kryptonesticus,eremita,Kryptonesticus eremita,17,42.959.451,17.129.228,,deep cave,,5,,"13,925","14,0666666","14,0666666","24,28125",833,25,"105,2150766","84,833",,6,1.3,1,86,75,32
4500,Jama pod Vošcem,Croatia,30.4.2012.,2012-04-30,1juvm,1,Agelenidae,Histopona,sp.,Histopona sp.,1280,43.309.566,17.046.435,,,,1,,"7,15","7,993500233","7,993500233","24,5",945,28,"68,07477846","97,4",,2,2,1,35,22,7
4501,Jujnovića špilja,Croatia,1.5.2012.,2012-05-01,2f,2,Linyphiidae,Typhlonyphia,sp. 1,Typhlonyphia sp. 1,463,43.266.579,1.719.798,Tb,deep cave,,6,"13,8","10,85","12,35200024","12,35200024","26,52000046",917,29,"61,15708825",,,5,2.5,1,108,40,16
4502,Velika špilja kod Neorića,Croatia,28.4.2012.,2012-04-28,1juv,1,Agelenidae,Histopona,sp.,Histopona sp.,721,43.686.117,1.655.312,,,,2,,"9,5","11,06483364","11,06483364","25,84800148",934,23,"107,710035",,,2,2.1,1,19,19,0
4503,Velika špilja kod Neorića,Croatia,28.4.2012.,2012-04-28,1juv,1,Dysderidae,Harpactea,sp.,Harpactea sp.,721,43.686.117,1.655.312,,,,2,,"9,5","11,06483364","11,06483364","25,84800148",934,23,"107,710035",,,2,2.1,1,19,19,0
4504,Mala špilja pod Spilom,Croatia,30.4.2012.,2012-04-30,1f,1,Agelenidae,Histopona,conveniens,Histopona conveniens,349,43.262.462,17.200.927,Tf,deep cave,,2,,11,"12,35200024","12,35200024","26,52000046",917,21,"61,45159013",,,,,,,,
4505,Mala špilja pod Spilom,Croatia,30.4.2012.,2012-04-30,1juv,1,Dysderidae,Stalagtia,sp. 4,Stalagtia sp. 4,349,43.262.462,17.200.927,Tb,deep cave,,2,,11,"12,35200024","12,35200024","26,52000046",917,21,"61,45159013",,,,,,,,
4506,Jama pod Vošcem,Croatia,30.4.2012.,2012-04-30,1juvm,1,Agelenidae,Histopona,sp.,Histopona sp.,1280,43.309.566,17.046.435,,,,1,,"7,15","7,993500233","7,993500233","24,5",945,28,"68,07477846","97,4",,2,2,1,35,22,7
4508,Maklutača,Croatia,29.4.2012.,2012-04-29,"1f, 2juvm",3,Linyphiidae,Troglohyphantes,giromettai,Troglohyphantes giromettai,415,43.569.268,16.620.515,tf,deep cave,,6,,"6,25","11,86699963","11,86699963","25,86800003",883,29,"99,53597793",,,11,6.5,1,152,140,39
4525,Pušina,Croatia,21.6.2014.,2014-06-21,1f,1,Linyphiidae,Porrhomma,egeria,Porrhomma egeria,729,45.740.585,1.535.653,,deep cave,,4,,"8,3","8,075166702","8,075166702","28,34399986",1294,23,"410,6956067",,,0.75,0.5,1,nan,328,56
4526,Židovske kuće,Croatia,19.6.2014.,2014-06-19,1f,1,Linyphiidae,Centromerus,cavernarum,Centromerus cavernarum,656,45.809.504,15.476.375,Tf,deep cave,,7,,"9,3","8,356666565","8,356666565","28,45599937",1213,23,"411,7964956",,,2,1,1,nan,46,4
4527,Jama u Vrloj strani,Croatia,19.6.2014.,2014-06-19,"2f, 2juv",4,Linyphiidae,Troglohyphantes,excavatus,Troglohyphantes excavatus,732,4.572.605,15.275.065,tf,deep cave,,1,,"7,9","7,769499779","7,769499779","28,47200012",1329,29,"414,3981178","98,9",,1.6,1,1,nan,12,35
4528,Špilja kod Juraševe livade,Croatia,20.6.2014.,2014-06-20,1m,1,Linyphiidae,Troglohyphantes,excavatus,Troglohyphantes excavatus,682,45.732.825,15.307.207,tf,deep cave,,1,,"8,7","7,945333481","7,945333481","28,35200119",1312,29,"413,0470129","86,7",,1,1,1,40,39,0
4530,Židovske kuće,Croatia,19.6.2014.,2014-06-19,1f,1,Linyphiidae,Centromerus,cavernarum,Centromerus cavernarum,656,45.809.504,15.476.375,Tf,deep cave,,7,,"9,3","8,356666565","8,356666565","28,45599937",1213,23,"411,7964956",,,2,1,1,nan,46,4
4541,Dimnjačareva špilja,Croatia,10.10.2015.,2015-10-10,1m,1,Linyphiidae,Gen.,sp. X,Gen. sp. X,887,4.537.178,14.750.133,,,,1,,"11,5","7,299499989","7,299499989","26,94799995",1530,25,"413,2008119",,,0.8,0.8,1,nan,27,14
4543,Bukovac,Croatia,3.7.2011.,2011-07-03,1f,1,Linyphiidae,Porrhomma,sp. x,Porrhomma sp. x,817,4.534.318,14.757.647,,,,5,,"7,8","7,299499989","7,299499989","26,94799995",1530,24,"409,5782937","96,5",,8,5,1,nan,136,2
4549,Jama kod Lugarnice,Croatia,4.10.2015.,2015-10-04,1f,1,Linyphiidae,Troglohyphantes,excavatus,Troglohyphantes excavatus,528,45.327.864,15.092.353,tf,deep cave,,3,,"8,9","8,389166832","8,389166832","27,80400085",1465,24,"380,6148962","94,3",,,,,,,
4551,Pušina,Croatia,3.11.2002.,2002-11-03,1f,1,Dysderidae,Harpactea,lepida,Harpactea lepida,729,45.740.585,1.535.653,Tx,deep cave,,4,,"8,3","8,075166702","8,075166702","28,34399986",1294,23,"410,6956067",,,0.75,0.5,1,nan,328,56
4552,Provala,Croatia,2.11.2002.,2002-11-02,ostaci prosome,,Dysderidae,Mesostalita,sp. 1,Mesostalita sp. 1,310,45.696.538,15.438.161,Tb,deep cave,,3,,"9,7","9,762499809","9,762499809","29,01600075",1149,23,"399,6273411","91,333",,2,2,1,2161,1862,55
4558,Jamina,Croatia,2.11.2002.,2002-11-02,2f,2,Linyphiidae,Centromerus,cavernarum,Centromerus cavernarum,483,45.699.157,15.424.684,Tf,deep cave,,3,"10,8","10,1","9,762499809","9,762499809","29,01600075",1149,23,"400,8582115",100,100,4.5,7,1,65,15,59
4561,Provala,Croatia,16.11.2003.,2003-11-16,2m,2,Dysderidae,Mesostalita,sp. 1,Mesostalita sp. 1,310,45.696.538,15.438.161,Tb,deep cave,,3,,"9,7","9,762499809","9,762499809","29,01600075",1149,23,"399,6273411","91,333",,2,2,1,2161,1862,55
4562,Jamina,Croatia,2.11.2002.,2002-11-02,1m,1,Linyphiidae,Centromerus,cavernarum,Centromerus cavernarum,483,45.699.157,15.424.684,Tf,deep cave,,3,"10,8","10,1","9,762499809","9,762499809","29,01600075",1149,23,"400,8582115",100,100,4.5,7,1,65,15,59
4566,Židovske kuće,Croatia,21.12.2003.,2003-12-21,1f,1,Linyphiidae,Centromerus,cavernarum,Centromerus cavernarum,656,45.809.504,15.476.375,Tf,deep cave,,7,,"9,3","8,356666565","8,356666565","28,45599937",1213,23,"411,7964956",,,2,1,1,nan,46,4
4567,Židovske kuće,Croatia,21.12.2003.,2003-12-21,"2f, 1juv",3,Linyphiidae,Gen.,sp. X,Gen. sp. X,656,45.809.504,15.476.375,,,,7,,"9,3","8,356666565","8,356666565","28,45599937",1213,23,"411,7964956",,,2,1,1,nan,46,4
4568,Židovske kuće,Croatia,28.6.1998.,1998-06-28,"3f, 1m, 1juv",5,Linyphiidae,Centromerus,cavernarum,Centromerus cavernarum,656,45.809.504,15.476.375,Tf,deep cave,,7,,"9,3","8,356666565","8,356666565","28,45599937",1213,23,"411,7964956",,,2,1,1,nan,46,4
4575,Židovske kuće,Croatia,28.6.1998.,1998-06-28,"1m, 1juv",2,Linyphiidae,Centromerus,cavernarum,Centromerus cavernarum,656,45.809.504,15.476.375,Tf,deep cave,,7,,"9,3","8,356666565","8,356666565","28,45599937",1213,23,"411,7964956",,,2,1,1,nan,46,4
4586,Medvjeđa špilja,Croatia,25.5.2008.,2008-05-25,1f,1,Linyphiidae,Troglohyphantes,croaticus,Troglohyphantes croaticus,758,45.363.572,14.757.905,tb,deep cave,,3,,"10,95","7,299499989","7,299499989","26,94799995",1530,25,"411,6907421",,,nan,nan,1,nan,nan,nan
4590,Špilja pod Mačkovom dragom,Croatia,13.10.2012.,2012-10-13,1jumv,1,Dysderidae,Parastalita,stygia,Parastalita stygia,685,45.261.001,15.023.822,Tb,deep cave,,1,,"7,4","6,968666553","6,968666553","26,46800041",1564,25,"378,8376232",,,2,1,1,376,362,26
4592,Mala špilja u Krugu,Croatia,17.4.2011.,2011-04-17,1f,1,Linyphiidae,Troglohyphantes,croaticus,Troglohyphantes croaticus,591,45.447.112,14.423.785,tb,deep cave,,1,,"8,5","9,178833008","9,178833008","26,49600029",1506,23,"417,9616175",,,3,1.4,1,nan,50,14
4606,Bezdanka,Croatia,28.4.2013.,2013-04-28,2juv,2,Linyphiidae,Troglohyphantes,roberti,Troglohyphantes roberti,586,44.227.473,15.852.219,tb,deep cave,,2,,"14,367","9,772166252","9,772166252","27,11600113",1105,28,"208,7260183","94,633",,nan,nan,1,nan,nan,nan
4609,Bezdanka,Croatia,28.4.2013.,2013-04-28,"2f, 2juvm",4,Linyphiidae,Troglohyphantes,roberti,Troglohyphantes roberti,586,44.227.473,15.852.219,tb,deep cave,,2,,"14,367","9,772166252","9,772166252","27,11600113",1105,28,"208,7260183","94,633",,nan,nan,1,nan,nan,nan
4631,Kukuruzovićeva špilja,Croatia,18.6.2005.,2005-06-18,1f,1,Linyphiidae,Centromerus,cavernarum,Centromerus cavernarum,329,44.914.821,15.702.486,Tf,deep cave,,3,,"10,8","9,661832809","9,661832809","28,4640007",1309,18,"286,5022004",,,5,2.5,1,nan,486,45
4684,Šimunkovića špilja,Croatia,6.4.2007.,2007-04-06,1f,1,Linyphiidae,Centromerus,densidentatus sp.n.,Centromerus densidentatus sp.n.,78,42.978.588,17.129.081,,,,7,,15,"14,0666666","14,0666666","24,28125",833,29,"102,605262",,,7,1,1,22.7,19.9,1
4685,Šimunkovića špilja,Croatia,6.4.2007.,2007-04-06,2juv,2,Leptonetidae,Barusia,korculana,Barusia korculana,78,42.978.588,17.129.081,tb,deep cave,,7,,15,"14,0666666","14,0666666","24,28125",833,29,"102,605262",,,7,1,1,22.7,19.9,1
4686,Šimunkovića špilja,Croatia,3.11.2016.,2016-11-03,"1f, 2juv",3,Nesticidae,Kryptonesticus,eremita,Kryptonesticus eremita,78,42.978.588,17.129.081,tf,deep cave,,7,,15,"14,0666666","14,0666666","24,28125",833,29,"102,605262",,,7,1,1,22.7,19.9,1
4687,Šimunkovića špilja,Croatia,3.11.2016.,2016-11-03,"1m, 2f, 2juv",5,Leptonetidae,Barusia,korculana,Barusia korculana,78,42.978.588,17.129.081,tb,deep cave,,7,,15,"14,0666666","14,0666666","24,28125",833,29,"102,605262",,,7,1,1,22.7,19.9,1
4688,Šimunkovića špilja,Croatia,3.11.2016.,2016-11-03,"3m, 7f, 2juv",12,Leptonetidae,Barusia,korculana,Barusia korculana,78,42.978.588,17.129.081,tb,deep cave,,7,,15,"14,0666666","14,0666666","24,28125",833,29,"102,605262",,,7,1,1,22.7,19.9,1
4689,Šimunkovića špilja,Croatia,3.11.2016.,2016-11-03,1juv,1,Dysderidae,Folkia,sp. 4,Folkia sp. 4,78,42.978.588,17.129.081,Tb,deep cave,,7,,15,"14,0666666","14,0666666","24,28125",833,29,"102,605262",,,7,1,1,22.7,19.9,1
4690,Šimunkovića špilja,Croatia,3.11.2016.,2016-11-03,"3f, 4juv",7,Leptonetidae,Barusia,korculana,Barusia korculana,78,42.978.588,17.129.081,tb,deep cave,,7,,15,"14,0666666","14,0666666","24,28125",833,29,"102,605262",,,7,1,1,22.7,19.9,1
4691,Šimunkovića špilja,Croatia,3.11.2016.,2016-11-03,1juv,1,Dysderidae,Folkia,sp. 4,Folkia sp. 4,78,42.978.588,17.129.081,Tb,deep cave,,7,,15,"14,0666666","14,0666666","24,28125",833,29,"102,605262",,,7,1,1,22.7,19.9,1
4692,Šimunkovića špilja,Croatia,3.11.2016.,2016-11-03,1f,1,Pholcidae,Stygopholcus,absoloni,Stygopholcus absoloni,78,42.978.588,17.129.081,,deep cave,,7,,15,"14,0666666","14,0666666","24,28125",833,29,"102,605262",,,7,1,1,22.7,19.9,1
4693,Šimunkovića špilja,Croatia,3.11.2016.,2016-11-03,1m,1,Pholcidae,Holocnemus,pluchei,Holocnemus pluchei,78,42.978.588,17.129.081,tf,deep cave,,7,,15,"14,0666666","14,0666666","24,28125",833,29,"102,605262",,,7,1,1,22.7,19.9,1
4699,Hrastovska špilja,Croatia,2.10.2007.,2007-10-02,1f,1,Linyphiidae,Centromerus,lastovensis sp. n.,Centromerus lastovensis sp. n.,103,42.756.282,16.875.635,,deep cave,,4,,"12,6","16,4216671","16,4216671","22,7733345",668,29,"145,7479543",94,,nan,nan,1,nan,nan,nan
4700,Polušpilja na Mrčari,Croatia,1.10.2007.,2007-10-01,1juv,1,Dysderidae,Harpactea,sp.,Harpactea sp.,48,42.768.583,16.788.965,,,,2,,"19,4","16,70208359","16,70208359","20,84999847",630,24,"149,308983",,,,,,,,
4709,Jama pod Kolač,Croatia,30.8.1995.,1995-08-30,1juv,1,Dysderidae,Folkia,haasi,Folkia haasi,163,42.922.084,17.123.592,Tb,deep cave,,1,,"12,9","15,59433365","15,59433365","24,44799995",793,15,"110,6255634",,,,,,,,
4710,Špilja pod Kapelu,Croatia,15.10.2007.,2007-10-15,2f,2,Linyphiidae,Palliduphantes,spelaeorum,Palliduphantes spelaeorum,102,43.184.949,16.434.233,Tf,deep cave,,5,,"12,717","16,20546913","16,20546913","23,36250114",714,21,"135,8656791","97,5",,nan,nan,1,nan,nan,nan
4712,Špilja pod Kapelu,Croatia,15.10.2007.,2007-10-15,"4m, 4f, 1juv",9,Linyphiidae,Palliduphantes,spelaeorum,Palliduphantes spelaeorum,102,43.184.949,16.434.233,Tf,deep cave,,5,,"12,717","16,20546913","16,20546913","23,36250114",714,21,"135,8656791","97,5",,nan,nan,1,nan,nan,nan
4714,Špilja pod Kapelu,Croatia,13.4.2003.,2003-04-13,1f,1,Linyphiidae,Palliduphantes,spelaeorum,Palliduphantes spelaeorum,102,43.184.949,16.434.233,Tf,deep cave,,5,,"12,717","16,20546913","16,20546913","23,36250114",714,21,"135,8656791","97,5",,nan,nan,1,nan,nan,nan
4723,Špilja na Gradini kod Premanture,Croatia,5.3.2011.,2011-03-05,1juvm,1,Nesticidae,Kryptonesticus,eremita,Kryptonesticus eremita,10,44.786.909,13.907.968,tf,deep cave,,3,,"13,875","14,38249969","14,38249969","24,69999886",753,25,"301,7029411","93,725",,nan,nan,1,nan,nan,nan
4724,Špilja na Gradini kod Premanture,Croatia,5.3.2011.,2011-03-05,"1f, 1juvm, 7juv",9,Nesticidae,Kryptonesticus,eremita,Kryptonesticus eremita,10,44.786.909,13.907.968,tf,deep cave,,3,,"13,875","14,38249969","14,38249969","24,69999886",753,25,"301,7029411","93,725",,nan,nan,1,nan,nan,nan
4729,Špilja na Gradini kod Premanture,Croatia,3.12.2016.,2016-12-03,1juv,1,Nesticidae,Kryptonesticus,eremita,Kryptonesticus eremita,10,44.786.909,13.907.968,tf,deep cave,,3,,"13,875","14,38249969","14,38249969","24,69999886",753,25,"301,7029411","93,725",,nan,nan,1,nan,nan,nan
4730,Špilja na Gradini kod Premanture,Croatia,19.12.2016.,2016-12-19,1m,1,Nesticidae,Kryptonesticus,eremita,Kryptonesticus eremita,10,44.786.909,13.907.968,tf,deep cave,,3,,"13,875","14,38249969","14,38249969","24,69999886",753,25,"301,7029411","93,725",,nan,nan,1,nan,nan,nan
4731,Špilja na Gradini kod Premanture,Croatia,1.10.2016.,2016-10-01,1m,1,Nesticidae,Kryptonesticus,eremita,Kryptonesticus eremita,10,44.786.909,13.907.968,tf,deep cave,,3,,"13,875","14,38249969","14,38249969","24,69999886",753,25,"301,7029411","93,725",,nan,nan,1,nan,nan,nan
4732,Špilja na Gradini kod Premanture,Croatia,1.10.2016.,2016-10-01,"1f, 1m",2,Nesticidae,Kryptonesticus,eremita,Kryptonesticus eremita,10,44.786.909,13.907.968,tf,deep cave,,3,,"13,875","14,38249969","14,38249969","24,69999886",753,25,"301,7029411","93,725",,nan,nan,1,nan,nan,nan
4733,Špilja na Gradini kod Premanture,Croatia,19.12.2016.,2016-12-19,1m,1,Nesticidae,Kryptonesticus,eremita,Kryptonesticus eremita,10,44.786.909,13.907.968,tf,deep cave,,3,,"13,875","14,38249969","14,38249969","24,69999886",753,25,"301,7029411","93,725",,nan,nan,1,nan,nan,nan
4734,Špilja na Gradini kod Premanture,Croatia,18.12.2016.,2016-12-18,3juv,3,Nesticidae,Kryptonesticus,eremita,Kryptonesticus eremita,10,44.786.909,13.907.968,tf,deep cave,,3,,"13,875","14,38249969","14,38249969","24,69999886",753,25,"301,7029411","93,725",,nan,nan,1,nan,nan,nan
4737,Gvozdenica,Croatia,15.12.2013.,2013-12-15,1m,1,Nesticidae,Nesticus,cellulanus,Nesticus cellulanus,213,45.299.765,15.589.405,tf,deep cave,,4,,"8,7","10,85416698","10,85416698","29,48399925",1123,24,"339,8560445",,,24,14,1,nan,250,85
4738,Gvozdenica,Croatia,15.12.2013.,2013-12-15,"1f, 1juv",2,Linyphiidae,Centromerus,cavernarum,Centromerus cavernarum,213,45.299.765,15.589.405,Tf,deep cave,,4,,"8,7","10,85416698","10,85416698","29,48399925",1123,24,"339,8560445",,,24,14,1,nan,250,85
4739,Đutno,Croatia,24.6.2007.,2007-06-24,"3f, 5juv",8,Linyphiidae,Troglohyphantes,croaticus,Troglohyphantes croaticus,218,45.415.607,15.233.039,tb,deep cave,,4,,"7,75","10,4248333","10,4248333","28,8239994",1290,23,"379,8005434",,,7.5,5,1,nan,328,34
4743,Špilja u uvali Predpeć,Croatia,23.1.2011.,2011-01-23,1f,1,Tetragnathidae,Metellina,merianae,Metellina merianae,,45.291.576,14.510.419,Tf,deep cave,,4,"10,3","10,625","13,89999962","13,89999962","25,40000153",1376,44,"398,0215329",,,4,3,1,25,21,4
4767,Jama na Benkotovu,Croatia,10.6.2016.,2016-06-10,"1m, 1f",2,Leptonetidae,Barusia,maheni,Barusia maheni,120,4.337.569,16.272.059,tf,deep cave,,3,,"15,2","15,939394","15,939394","23,43181801",720,29,"142,4731318","93,667",,1.8,2.5,1,41.1,17.6,30.2
4768,Jama na Benkotovu,Croatia,10.6.2016.,2016-06-10,1m,1,Leptonetidae,Barusia,maheni,Barusia maheni,120,4.337.569,16.272.059,tf,deep cave,,3,,"15,2","15,939394","15,939394","23,43181801",720,29,"142,4731318","93,667",,1.8,2.5,1,41.1,17.6,30.2
4771,Škrabuljica,Croatia,1.11.2016.,2016-11-01,1juv,1,Dysderidae,Stalagtia,sp. 2,Stalagtia sp. 2,701,42.567.045,18.385.063,Tb,deep cave,,5,,"10,867","12,1378336","12,1378336","24,90799904",1201,29,"102,7796012","97,4",,6,8,1,nan,98,11
4772,Škrabuljica,Croatia,1.11.2016.,2016-11-01,1m,1,Pholcidae,Stygopholcus,skotophilus,Stygopholcus skotophilus,701,42.567.045,18.385.063,,deep cave,,5,,"10,867","12,1378336","12,1378336","24,90799904",1201,29,"102,7796012","97,4",,6,8,1,nan,98,11
4773,Škrabuljica,Croatia,1.11.2016.,2016-11-01,"1m, 2f, 6juv",9,Linyphiidae,Troglohyphantes,troglodytes,Troglohyphantes troglodytes,701,42.567.045,18.385.063,tf,deep cave,,5,,"10,867","12,1378336","12,1378336","24,90799904",1201,29,"102,7796012","97,4",,6,8,1,nan,98,11
4774,Škrabuljica,Croatia,1.11.2016.,2016-11-01,5f,5,Linyphiidae,Centromerus,subcaecus,Centromerus subcaecus,701,42.567.045,18.385.063,Tf,deep cave,,5,,"10,867","12,1378336","12,1378336","24,90799904",1201,29,"102,7796012","97,4",,6,8,1,nan,98,11
4775,Škrabuljica,Croatia,1.11.2003.,2003-11-01,1juv,1,Scytodidae,Scytodes,thoracica,Scytodes thoracica,701,42.567.045,18.385.063,Tx,,,5,,"10,867","12,1378336","12,1378336","24,90799904",1201,29,"102,7796012","97,4",,6,8,1,nan,98,11
4776,Jezero,Croatia,1.11.2016.,2016-11-01,"1f, 5juv",6,Pholcidae,Stygopholcus,skotophilus,Stygopholcus skotophilus,964,42.580.381,18.356.073,,deep cave,,8,,"7,567","12,93216705","12,93216705","24,86800003",1208,29,"104,2091301","96,5",,1,0.5,1,20.5,nan,12
4777,Jezero,Croatia,11.11.2016.,2016-11-11,1m,1,Tetragnathidae,Metellina,merianae,Metellina merianae,964,42.580.381,18.356.073,Tf,deep cave,,8,,"7,567","12,93216705","12,93216705","24,86800003",1208,29,"104,2091301","96,5",,1,0.5,1,20.5,nan,12
4778,Jezero,Croatia,11.11.2016.,2016-11-11,"1m, 1juv",2,Nesticidae,Kryptonesticus,arenstorffi,Kryptonesticus arenstorffi,964,42.580.381,18.356.073,tb,deep cave,,8,,"7,567","12,93216705","12,93216705","24,86800003",1208,29,"104,2091301","96,5",,1,0.5,1,20.5,nan,12
4779,Jezero,Croatia,11.11.2016.,2016-11-11,"1f, 2m, 7juv",1,Linyphiidae,Troglohyphantes,troglodytes,Troglohyphantes troglodytes,964,42.580.381,18.356.073,tf,deep cave,,8,,"7,567","12,93216705","12,93216705","24,86800003",1208,29,"104,2091301","96,5",,1,0.5,1,20.5,nan,12
4781,Jezero,Croatia,1.11.2016.,2016-11-01,2juv m,2,Agelenidae,Tegenaria,sp.,Tegenaria sp.,964,42.580.381,18.356.073,,deep cave,,8,,"7,567","12,93216705","12,93216705","24,86800003",1208,29,"104,2091301","96,5",,1,0.5,1,20.5,nan,12
4782,Šipun,Croatia,31.10.2016.,2016-10-31,7juv,7,Dysderidae,Stalagtia,sp. 1,Stalagtia sp. 1,,42.583.646,18.217.986,Tb,deep cave,,11,,"15,4","15,02037048","15,02037048","24,28333282",1208,2,"111,3036255","97,8",,1.5,2.5,1,165,150,22.5
4783,Šipun,Croatia,27.3.2003.,2003-03-27,"1m, 3juv",4,Tetragnathidae,Metellina,merianae,Metellina merianae,,42.583.646,18.217.986,Tf,deep cave,,11,,"15,4","15,02037048","15,02037048","24,28333282",1208,2,"111,3036255","97,8",,1.5,2.5,1,165,150,22.5
4784,Špilja za Gromačkom vlakom,Croatia,3.12.2009.,2009-12-03,1f,1,Dysderidae,Stalagtia,sp. 5,Stalagtia sp. 5,630,42.743.509,18.027.359,Tb,deep cave,,15,,"13,378","14,54366684","14,54366684","24,62399864",1130,29,"87,19003096",,,2,3,1,2439,2204,220
4785,Špilja za Gromačkom vlakom,Croatia,29.5.2004.,2004-05-29,"2f, 1m",3,Anapidae,Comaroma,sp. 1,Comaroma sp. 1,630,42.743.509,18.027.359,tb,deep cave,,15,,"13,378","14,54366684","14,54366684","24,62399864",1130,29,"87,19003096",,,2,3,1,2439,2204,220
4786,Vilinska jama,Croatia,6.9.2000.,2000-09-06,1m,1,Linyphiidae,Gen.,sp. X,Gen. sp. X,118,42.728.553,17.881.121,,,,10,,"13,6","16,61458397","16,61458397","23,72142792",1068,24,"91,19914008","84,6",,1,1,1,14.9,10.3,5.8
4792,Jezero,Croatia,7.6.2014.,2014-06-07,"1f, 1juvm",2,Linyphiidae,Troglohyphantes,troglodytes,Troglohyphantes troglodytes,964,42.580.381,18.356.073,tf,deep cave,,8,,"7,567","12,93216705","12,93216705","24,86800003",1208,29,"104,2091301","96,5",,1,0.5,1,20.5,nan,12
4794,Balića špilja,Croatia,20.5.2016.,2016-05-20,"1f, 3juv",4,Linyphiidae,Troglohyphantes,giromettai,Troglohyphantes giromettai,438,4.357.296,1.657.002,tf,deep cave,,11,,"7,2","12,25566673","12,25566673","25,68000031",872,23,"105,1255288",,,70,7,1,194,155,50
4795,Balića špilja,Croatia,20.5.2016.,2016-05-20,"2f, 1m, 5juv",8,Linyphiidae,Troglohyphantes,giromettai,Troglohyphantes giromettai,438,4.357.296,1.657.002,tf,deep cave,,11,,"7,2","12,25566673","12,25566673","25,68000031",872,23,"105,1255288",,,70,7,1,194,155,50
4796,Balića špilja,Croatia,5.11.2016.,2016-11-05,"3f, 8juv",11,Linyphiidae,Troglohyphantes,giromettai,Troglohyphantes giromettai,438,4.357.296,1.657.002,tf,deep cave,,11,,"7,2","12,25566673","12,25566673","25,68000031",872,23,"105,1255288",,,70,7,1,194,155,50
4797,Balića špilja,Croatia,5.11.2016.,2016-11-05,"1m, 2juv",3,Leptonetidae,Barusia,maheni,Barusia maheni,438,4.357.296,1.657.002,tf,deep cave,,11,,"7,2","12,25566673","12,25566673","25,68000031",872,23,"105,1255288",,,70,7,1,194,155,50
4798,Balića špilja,Croatia,5.11.2016.,2016-11-05,1m,1,Linyphiidae,Centromerus,sylvaticus,Centromerus sylvaticus,438,4.357.296,1.657.002,tx,deep cave,,11,,"7,2","12,25566673","12,25566673","25,68000031",872,23,"105,1255288",,,70,7,1,194,155,50
4799,Balića špilja,Croatia,5.11.2016.,2016-11-05,1f,1,Linyphiidae,Troglohyphantes,strandi,Troglohyphantes strandi,438,4.357.296,1.657.002,tb,deep cave,,11,,"7,2","12,25566673","12,25566673","25,68000031",872,23,"105,1255288",,,70,7,1,194,155,50
4800,Balića špilja,Croatia,5.11.2016.,2016-11-05,"1m, 4f, 2juv",7,Linyphiidae,Troglohyphantes,giromettai,Troglohyphantes giromettai,438,4.357.296,1.657.002,tf,deep cave,,11,,"7,2","12,25566673","12,25566673","25,68000031",872,23,"105,1255288",,,70,7,1,194,155,50
4801,Balića špilja,Croatia,5.11.2016.,2016-11-05,1f,1,Linyphiidae,Centromerus,sylvaticus,Centromerus sylvaticus,438,4.357.296,1.657.002,tx,deep cave,,11,,"7,2","12,25566673","12,25566673","25,68000031",872,23,"105,1255288",,,70,7,1,194,155,50
4802,Balića špilja,Croatia,5.11.2016.,2016-11-05,1f,1,Pholcidae,Stygopholcus,absoloni,Stygopholcus absoloni,438,4.357.296,1.657.002,,deep cave,,11,,"7,2","12,25566673","12,25566673","25,68000031",872,23,"105,1255288",,,70,7,1,194,155,50
4804,Balića špilja,Croatia,5.11.2016.,2016-11-05,"1m, 3f",4,Leptonetidae,Barusia,maheni,Barusia maheni,438,4.357.296,1.657.002,tf,deep cave,,11,,"7,2","12,25566673","12,25566673","25,68000031",872,23,"105,1255288",,,70,7,1,194,155,50
4805,Balića špilja,Croatia,5.11.2016.,2016-11-05,1m,1,Zoropsidae,Zoropsis,oertzeni,Zoropsis oertzeni,438,4.357.296,1.657.002,,,,11,,"7,2","12,25566673","12,25566673","25,68000031",872,23,"105,1255288",,,70,7,1,194,155,50
4806,Balića špilja,Croatia,5.11.2016.,2016-11-05,1m,1,Tetragnathidae,Metellina,merianae,Metellina merianae,438,4.357.296,1.657.002,Tf,deep cave,,11,,"7,2","12,25566673","12,25566673","25,68000031",872,23,"105,1255288",,,70,7,1,194,155,50
4810,Peć u Čulinovim raljevinama,Croatia,20.5.2016.,2016-05-20,"1m, 1f, 5juv",7,Leptonetidae,Barusia,maheni,Barusia maheni,369,43.605.854,16.575.066,tf,deep cave,,5,,11,"12,99133301","12,99133301","26,44000053",879,26,"104,4759765",,,1,1,1,nan,42.5,12.5
4812,Tučepska vilenjača,Croatia,18.5.2016.,2016-05-18,2 juv,2,Linyphiidae,Typhlonyphia,sp. 1,Typhlonyphia sp. 1,1242,43.286.465,17.083.638,Tb,deep cave,,8,"10,6","10,731","9,67800045","9,67800045","24,96000099",926,26,"67,32747088",,,6,0.8,1,nan,28,35
4813,Matijaševa peć,Croatia,15.5.2016.,2016-05-15,"1m, 4juv",5,Nesticidae,Kryptonesticus,deelemanae,Kryptonesticus deelemanae,621,43.320.551,17.122.321,tb,deep cave,,6,"8,3","6,933","9,092166901","9,092166901",25,931,23,"60,61369348",,,3,1,1,18,17,6
4815,Matijaševa peć,Croatia,15.5.2016.,2016-05-15,"1m, 3f, 1juv",5,Leptonetidae,Sulcia,sp.,Sulcia sp.,621,43.320.551,17.122.321,,,,6,"8,3","6,933","9,092166901","9,092166901",25,931,23,"60,61369348",,,3,1,1,18,17,6
4816,Špilja u Gaju,Croatia,16.5.2016.,2016-05-16,"1m, 1f",2,Agelenidae,Histopona,conveniens,Histopona conveniens,706,43.382.476,17.040.666,Tf,deep cave,,7,"10,6","10,825","12,27216721","12,27216721","26,62000084",912,23,"62,15311347",99,99,nan,nan,1,nan,nan,nan
4817,Jama iznad Saranača,Croatia,17.5.2016.,2016-05-17,1f,1,Linyphiidae,Typhlonyphia,sp. 1,Typhlonyphia sp. 1,777,43.249.007,17.174.663,Tb,deep cave,,7,"10,8","11,112","11,73516655","11,73516655","25,61599922",905,28,"64,87446036",,,2.5,0.5,1,nan,8.6,20.5
4818,Jama iznad Saranača,Croatia,17.5.2016.,2016-05-17,"1f, 1juvm",2,Agelenidae,Histopona,conveniens,Histopona conveniens,777,43.249.007,17.174.663,Tf,deep cave,,7,"10,8","11,112","11,73516655","11,73516655","25,61599922",905,28,"64,87446036",,,2.5,0.5,1,nan,8.6,20.5
4819,Jama iznad Saranača,Croatia,17.5.2016.,2016-05-17,3juv,3,Linyphiidae,Typhlonyphia,sp. 1,Typhlonyphia sp. 1,777,43.249.007,17.174.663,Tb,deep cave,,7,"10,8","11,112","11,73516655","11,73516655","25,61599922",905,28,"64,87446036",,,2.5,0.5,1,nan,8.6,20.5
4820,Jama iznad Saranača,Croatia,17.5.2016.,2016-05-17,1juv,1,Dysderidae,Stalagtia,sp. 4,Stalagtia sp. 4,777,43.249.007,17.174.663,Tb,deep cave,,7,"10,8","11,112","11,73516655","11,73516655","25,61599922",905,28,"64,87446036",,,2.5,0.5,1,nan,8.6,20.5
4823,Bratska jama,Croatia,11.6.2016.,2016-06-11,1juv m,1,Agelenidae,Histopona,sp.,Histopona sp.,101,43.344.737,16.340.901,,,,2,,15,"16,1016674","16,1016674","23,59000015",732,29,"136,3438122",74,,4.2,4.8,1,35,26.7,15.5
4826,Bratska jama,Croatia,11.6.2016.,2016-06-11,1f,1,Linyphiidae,Palliduphantes,spelaeorum,Palliduphantes spelaeorum,101,43.344.737,16.340.901,Tf,deep cave,,2,,15,"16,1016674","16,1016674","23,59000015",732,29,"136,3438122",74,,4.2,4.8,1,35,26.7,15.5
4866,Kaverna 781,Croatia,30.10.2016.,2016-10-30,"1m, 5juv",6,Dysderidae,Stalagtia,sp. 1,Stalagtia sp. 1,55,4.252.633,183.382,Tb,deep cave,,4,,"12,3","16,00799942","16,00799942","24,41199875",1258,21,"110,0890104",99,,1,1.3,1,nan,142,0
4872,Đurovića jama,Croatia,31.10.2003.,2003-10-31,2f,2,Leptonetidae,Sulcia,sp.,Sulcia sp.,156,42.559.979,18.263.559,,,,4,,"17,267","15,93194485","15,93194485","24,30000114",1247,6,"111,7390404",,,1,2,1,156,132,17
4877,Vranja peć,Croatia,2.11.2006.,2006-11-02,1f,1,Pholcidae,Stygopholcus,absoloni,Stygopholcus absoloni,261,42.868.266,17.812.427,,deep cave,,2,"15,65","16,683","15,15533352","15,15533352","26,40799904",1060,21,"72,71378675",,,1,1,1,188,149,49.5
4879,Jama u Predolcu,Croatia,14.9.2010.,2010-09-14,1juv,1,Dysderidae,Stalagtia,sp. 4_1,Stalagtia sp. 4_1,82,43.046.428,17.658.771,Tb,deep cave,,2,,"14,1","16,44449997","16,44449997","29,03199768",1015,24,"55,93544548",100,,nan,nan,1,nan,nan,nan
4890,Jama Gradina,Croatia,23.3.2017.,2017-03-23,1f,1,Leptonetidae,Barusia,maheni,Barusia maheni,25,43.641.102,15.678.293,tf,deep cave,,3,"15,3","15,3","15,27291679","15,27291679","24,07500076",674,28,"204,393645",,,,,,,,
4892,Jama Gradina,Croatia,23.3.2017.,2017-03-23,1m,1,Linyphiidae,Centromerus,cavernarum,Centromerus cavernarum,25,43.641.102,15.678.293,Tf,deep cave,,3,"15,3","15,3","15,27291679","15,27291679","24,07500076",674,28,"204,393645",,,,,,,,
4893,Jama Gradina,Croatia,23.3.2017.,2017-03-23,1m,1,Amaurobidae,Amaurobius,erberi,Amaurobius erberi,25,43.641.102,15.678.293,Tx,deep cave,,3,"15,3","15,3","15,27291679","15,27291679","24,07500076",674,28,"204,393645",,,,,,,,
4894,Špilja kod Vilišnice,Croatia,22.5.2016.,2016-05-22,1m,1,Nesticidae,Kryptonesticus,eremita,Kryptonesticus eremita,48,43.960.355,15.450.916,tf,deep cave,,2,,"12,9","14,33033371","14,33033371","28,02400017",813,20,"236,193425",,,3.5,1.5,1,nan,37,20.3
4897,Špilja u Radinovcima,Croatia,15.5.2016.,2016-05-15,1f,1,Nesticidae,Kryptonesticus,deelemanae,Kryptonesticus deelemanae,416,43.387.285,170.103,tb,deep cave,,4,,"8,525","12,27216721","12,27216721","26,62000084",912,23,"64,7145817",93,,7,4,1,nan,50,14
4903,Rudnik Kmegla,Croatia,13.2.2017.,2017-02-13,"3f, 1juv",4,Nesticidae,Kryptonesticus,eremita,Kryptonesticus eremita,156,43.057.856,16.146.615,tf,deep cave,,2,,16,"15,73949337","15,73949337","22,95217514",602,21,"173,2241191",74,,,,,,,
4904,Špilja u Radinovcima,Croatia,15.5.2016.,2016-05-15,1m,1,Nesticidae,Kryptonesticus,deelemanae,Kryptonesticus deelemanae,416,43.387.285,170.103,tb,deep cave,,4,,"8,525","12,27216721","12,27216721","26,62000084",912,23,"64,7145817",93,,7,4,1,nan,50,14
4908,Pretnerova jama,Croatia,19.5.2016.,2016-05-19,1f,1,Agelenidae,Histopona,conveniens,Histopona conveniens,1459,43.339.276,17.038.312,Tf,deep cave,,2,,"5,44","7,902999878","7,902999878","24,58800125",950,23,"66,01720708","68,3",,2.5,1.5,1,nan,422,254
4909,Jama na Vlačine,Croatia,16.5.2016.,2016-05-16,2f,2,Linyphiidae,Troglohyphantes,svilajensis,Troglohyphantes svilajensis,1146,43.813.799,16.425.298,tb,deep cave,,1,,"10,1","7,872000217","7,872000217","25,69199944",1039,26,"125,4880634",,,0.8,1.2,1,29,5,25
4917,Golubinka više Mršića strane,Croatia,5.8.2006.,2006-08-05,2f,2,Linyphiidae,Palliduphantes,istrianus,Palliduphantes istrianus,473,4.412.501,15.807.683,Tf,deep cave,,3,"7,1","7,45","12,67350006","12,67350006","28,27199936",949,23,"206,3976041",,,,,,,,
4920,Gradska spila,Croatia,15.5.2016.,2016-05-15,1juv,1,Dysderidae,Stalagtia,sp. 4,Stalagtia sp. 4,621,43.318.029,17.117.623,Tb,deep cave,,4,,"6,6","9,092166901","9,092166901",25,931,23,"61,25913011","93,333",,5,2.5,1,nan,26.5,1.8
4922,Gradska spila,Croatia,15.5.2016.,2016-05-15,"1m, 2f?, 8 juv",11,Leptonetidae,Sulcia,sp.,Sulcia sp.,621,43.318.029,17.117.623,,,,4,,"6,6","9,092166901","9,092166901",25,931,23,"61,25913011","93,333",,5,2.5,1,nan,26.5,1.8
4923,Tučepska vilenjača,Croatia,1.9.1998.,1998-09-01,"1m, 1f, 1juvm, 2juvf",5,Linyphiidae,Typhlonyphia,sp. 1,Typhlonyphia sp. 1,1242,43.286.465,17.083.638,Tb,deep cave,,8,"10,6","10,731","9,67800045","9,67800045","24,96000099",926,26,"67,32747088",,,6,0.8,1,nan,28,35
4931,Medina pećina,Croatia,16.5.2014.,2014-05-16,1m,1,Dysderidae,Parastalita,stygia,Parastalita stygia,628,4.463.744,15.364.535,Tb,deep cave,,1,,"8,2","8,664500237","8,664500237","29,65600014",1241,23,"288,179941",,,1.5,2,1,nan,9.2,2.4
4934,Jopićeva špilja,Croatia,20.11.2015.,2015-11-20,1f,1,Linyphiidae,Troglohyphantes,kordunlikanus,Troglohyphantes kordunlikanus,184,45.301.113,15.592.877,tf,deep cave,,5,,"9,2","10,85416698","10,85416698","29,48399925",1123,23,"339,7663612",,,10,5,2,nan,6710,57
4940,Jopićeva špilja,Croatia,27.2.2000.,2000-02-27,2f,2,Linyphiidae,Centromerus,cavernarum,Centromerus cavernarum,184,45.301.113,15.592.877,Tf,deep cave,,5,,"9,2","10,85416698","10,85416698","29,48399925",1123,23,"339,7663612",,,10,5,2,nan,6710,57
4941,Biserujka,Croatia,9.7.2007.,2007-07-09,1m,1,Nesticidae,Kryptonesticus,eremita,Kryptonesticus eremita,27,45.187.464,1.460.981,tf,deep cave,,1,,"14,8","14,12559509","14,12559509","25,39523888",1232,32,"386,9540194",,,nan,nan,1,nan,nan,nan
4952,Kukuruzovićeva špilja,Croatia,10.1.2010.,2010-01-10,2f,2,Linyphiidae,Troglohyphantes,excavatus,Troglohyphantes excavatus,329,44.914.821,15.702.486,tf,deep cave,,3,,"10,8","9,661832809","9,661832809","28,4640007",1309,18,"286,5022004",,,5,2.5,1,nan,486,45
4954,Ponor Sušik,Croatia,9.6.2007.,2007-06-09,"1f, 1juvm, 1juv",3,Linyphiidae,Porrhomma,sp. 1,Porrhomma sp. 1,224,45.145.514,15.538.934,,,,4,,"9,6","10,33966637","10,33966637","29,04400063",1248,21,"325,2942174",,,,,,,,
4964,Jopićeva špilja,Croatia,9.4.2012.,2012-04-09,"1m, 2juvm, 1juv",4,Linyphiidae,Troglohyphantes,kordunlikanus,Troglohyphantes kordunlikanus,184,45.301.113,15.592.877,tf,deep cave,,5,,"9,2","10,85416698","10,85416698","29,48399925",1123,23,"339,7663612",,,10,5,2,nan,6710,57
4973,Jopićeva špilja,Croatia,12.11.2015.,2015-11-12,1f,1,Linyphiidae,Centromerus,cavernarum,Centromerus cavernarum,184,45.301.113,15.592.877,Tf,deep cave,,5,,"9,2","10,85416698","10,85416698","29,48399925",1123,23,"339,7663612",,,10,5,2,nan,6710,57
4974,Jopićeva špilja,Croatia,12.11.2015.,2015-11-12,1f,1,Linyphiidae,Gen.,sp. X,Gen. sp. X,184,45.301.113,15.592.877,,,,5,,"9,2","10,85416698","10,85416698","29,48399925",1123,23,"339,7663612",,,10,5,2,nan,6710,57
4977,Maklutača,Croatia,5.11.2016.,2016-11-05,"5f, 1m, 2juv",8,Linyphiidae,Troglohyphantes,strandi,Troglohyphantes strandi,415,43.569.268,16.620.515,tb,deep cave,,6,,"6,25","11,86699963","11,86699963","25,86800003",883,29,"99,53597793",,,11,6.5,1,152,140,39
4978,Maklutača,Croatia,5.11.2016.,2016-11-05,1m,1,Pholcidae,Stygopholcus,absoloni,Stygopholcus absoloni,415,43.569.268,16.620.515,,deep cave,,6,,"6,25","11,86699963","11,86699963","25,86800003",883,29,"99,53597793",,,11,6.5,1,152,140,39
4979,Maklutača,Croatia,5.11.2016.,2016-11-05,1f,1,Tetragnathidae,Metellina,merianae,Metellina merianae,415,43.569.268,16.620.515,Tf,deep cave,,6,,"6,25","11,86699963","11,86699963","25,86800003",883,29,"99,53597793",,,11,6.5,1,152,140,39
4980,Maklutača,Croatia,5.11.2016.,2016-11-05,1f,1,Linyphiidae,Troglohyphantes,giromettai,Troglohyphantes giromettai,415,43.569.268,16.620.515,tf,deep cave,,6,,"6,25","11,86699963","11,86699963","25,86800003",883,29,"99,53597793",,,11,6.5,1,152,140,39
4981,Maklutača,Croatia,5.11.2016.,2016-11-05,"1m, 1f",2,Linyphiidae,Troglohyphantes,strandi,Troglohyphantes strandi,415,43.569.268,16.620.515,tb,deep cave,,6,,"6,25","11,86699963","11,86699963","25,86800003",883,29,"99,53597793",,,11,6.5,1,152,140,39
4984,Gospodska špilja,Croatia,8.8.2012.,2012-08-08,"2f, 1juvm",3,Nesticidae,Kryptonesticus,eremita,Kryptonesticus eremita,414,43.982.279,16.432.905,tf,deep cave,,1,,"10,45","11,62766647","11,62766647","28,06799889",971,26,"133,8798791",96,,1,1,1,3111,2493,55
4987,Gospodska špilja,Croatia,7.8.2010.,2010-08-07,1f,1,Nesticidae,Kryptonesticus,eremita,Kryptonesticus eremita,414,43.982.279,16.432.905,tf,deep cave,,1,,"10,45","11,62766647","11,62766647","28,06799889",971,26,"133,8798791",96,,1,1,1,3111,2493,55
4991,Jujnovića špilja,Croatia,14.5.2016.,2016-05-14,2juv,2,Pholcidae,Pholcus,sp.,Pholcus sp.,463,43.266.579,1.719.798,,,,6,"13,8","10,85","12,35200024","12,35200024","26,52000046",917,29,"61,15708825",,,5,2.5,1,108,40,16
4992,Jujnovića špilja,Croatia,14.5.2016.,2016-05-14,1juv,1,Pholcidae,Pholcus,sp.,Pholcus sp.,463,43.266.579,1.719.798,,,,6,"13,8","10,85","12,35200024","12,35200024","26,52000046",917,29,"61,15708825",,,5,2.5,1,108,40,16
4993,Maklutača,Croatia,4.1.2016.,2016-01-04,7f,7,Linyphiidae,Troglohyphantes,giromettai,Troglohyphantes giromettai,415,43.569.268,16.620.515,tf,deep cave,,6,,"6,25","11,86699963","11,86699963","25,86800003",883,29,"99,53597793",,,11,6.5,1,152,140,39
4994,Maklutača,Croatia,4.1.2016.,2016-01-04,2f,2,Linyphiidae,Troglohyphantes,strandi,Troglohyphantes strandi,415,43.569.268,16.620.515,tb,deep cave,,6,,"6,25","11,86699963","11,86699963","25,86800003",883,29,"99,53597793",,,11,6.5,1,152,140,39
4996,Maklutača,Croatia,4.1.2016.,2016-01-04,2f,2,Linyphiidae,Palliduphantes,spelaeorum,Palliduphantes spelaeorum,415,43.569.268,16.620.515,Tf,deep cave,,6,,"6,25","11,86699963","11,86699963","25,86800003",883,29,"99,53597793",,,11,6.5,1,152,140,39
4998,Bezdan,Croatia,30.10.2016.,2016-10-30,1 juv,1,Dysderidae,Stalagtia,sp. 1,Stalagtia sp. 1,133,42.530.343,18.316.239,Tb,deep cave,,2,,"14,7","16,13833237","16,13833237","24,16666794",1249,23,"112,0435418",,,0.5,0.3,1,nan,12,22
4999,Bezdan,Croatia,30.10.2016.,2016-10-30,1f,1,Dysderidae,Stalagtia,sp. 1,Stalagtia sp. 1,133,42.530.343,18.316.239,Tb,deep cave,,2,,"14,7","16,13833237","16,13833237","24,16666794",1249,23,"112,0435418",,,0.5,0.3,1,nan,12,22
5000,Bezdan,Croatia,30.10.2016.,2016-10-30,3juv,3,Dysderidae,Stalagtia,sp. 1,Stalagtia sp. 1,133,42.530.343,18.316.239,Tb,deep cave,,2,,"14,7","16,13833237","16,13833237","24,16666794",1249,23,"112,0435418",,,0.5,0.3,1,nan,12,22
5002,Bezdan,Croatia,30.10.2016.,2016-10-30,3juv,3,Dysderidae,Stalagtia,sp. 1,Stalagtia sp. 1,133,42.530.343,18.316.239,Tb,deep cave,,2,,"14,7","16,13833237","16,13833237","24,16666794",1249,23,"112,0435418",,,0.5,0.3,1,nan,12,22
5004,Bezdan,Croatia,30.10.2016.,2016-10-30,5juv,5,Dysderidae,Stalagtia,sp. 1,Stalagtia sp. 1,133,42.530.343,18.316.239,Tb,deep cave,,2,,"14,7","16,13833237","16,13833237","24,16666794",1249,23,"112,0435418",,,0.5,0.3,1,nan,12,22
5006,Škrabuljica,Croatia,1.11.2016.,2016-11-01,1juv,1,Dysderidae,Stalagtia,sp. 2,Stalagtia sp. 2,701,42.567.045,18.385.063,Tb,deep cave,,5,,"10,867","12,1378336","12,1378336","24,90799904",1201,29,"102,7796012","97,4",,6,8,1,nan,98,11
5008,Škrabuljica,Croatia,1.11.2016.,2016-11-01,1f,1,Linyphiidae,Troglohyphantes,troglodytes,Troglohyphantes troglodytes,701,42.567.045,18.385.063,tf,deep cave,,5,,"10,867","12,1378336","12,1378336","24,90799904",1201,29,"102,7796012","97,4",,6,8,1,nan,98,11
5009,Jezero,Croatia,1.11.2016.,2016-11-01,1f,1,Linyphiidae,Troglohyphantes,troglodytes,Troglohyphantes troglodytes,964,42.580.381,18.356.073,tf,deep cave,,8,,"7,567","12,93216705","12,93216705","24,86800003",1208,29,"104,2091301","96,5",,1,0.5,1,20.5,nan,12
5010,Bezdan,Croatia,31.10.2016.,2016-10-31,1m,1,Dysderidae,Stalagtia,sp. 1,Stalagtia sp. 1,133,42.530.343,18.316.239,Tb,deep cave,,2,,"14,7","16,13833237","16,13833237","24,16666794",1249,23,"112,0435418",,,0.5,0.3,1,nan,12,22
5011,Jezero,Croatia,1.11.2016.,2016-11-01,"1f, 2juv",3,Linyphiidae,Troglohyphantes,troglodytes,Troglohyphantes troglodytes,964,42.580.381,18.356.073,tf,deep cave,,8,,"7,567","12,93216705","12,93216705","24,86800003",1208,29,"104,2091301","96,5",,1,0.5,1,20.5,nan,12
5014,Jezero,Croatia,1.11.2016.,2016-11-01,1f,1,Linyphiidae,Troglohyphantes,troglodytes,Troglohyphantes troglodytes,964,42.580.381,18.356.073,tf,deep cave,,8,,"7,567","12,93216705","12,93216705","24,86800003",1208,29,"104,2091301","96,5",,1,0.5,1,20.5,nan,12
5015,Jezero,Croatia,1.11.2016.,2016-11-01,"1m, 2f",3,Linyphiidae,Palliduphantes,sp. X,Palliduphantes sp. X,964,42.580.381,18.356.073,,,,8,,"7,567","12,93216705","12,93216705","24,86800003",1208,29,"104,2091301","96,5",,1,0.5,1,20.5,nan,12
5019,Jezero,Croatia,1.11.2016.,2016-11-01,1f,1,Linyphiidae,Palliduphantes,sp. X,Palliduphantes sp. X,964,42.580.381,18.356.073,,,,8,,"7,567","12,93216705","12,93216705","24,86800003",1208,29,"104,2091301","96,5",,1,0.5,1,20.5,nan,12
5020,Bezdan,Croatia,31.10.2016.,2016-10-31,1f/juv,1,Dysderidae,Stalagtia,sp. 1,Stalagtia sp. 1,133,42.530.343,18.316.239,Tb,deep cave,,2,,"14,7","16,13833237","16,13833237","24,16666794",1249,23,"112,0435418",,,0.5,0.3,1,nan,12,22
5025,Jezero,Croatia,1.11.2016.,2016-11-01,1?,,Linyphiidae,Troglohyphantes,troglodytes,Troglohyphantes troglodytes,964,42.580.381,18.356.073,tf,deep cave,,8,,"7,567","12,93216705","12,93216705","24,86800003",1208,29,"104,2091301","96,5",,1,0.5,1,20.5,nan,12
5027,Jezero,Croatia,1.11.2016.,2016-11-01,1m,1,Linyphiidae,Micrargus,sp.,Micrargus sp.,964,42.580.381,18.356.073,,,,8,,"7,567","12,93216705","12,93216705","24,86800003",1208,29,"104,2091301","96,5",,1,0.5,1,20.5,nan,12
5032,Tučepska vilenjača,Croatia,24.6.2017.,2017-06-24,"2m, 1f, 1juvm",4,Leptonetidae,Sulcia,sp. 4,Sulcia sp. 4,1242,43.286.465,17.083.638,Tb,deep cave,,8,"10,6","10,731","9,67800045","9,67800045","24,96000099",926,26,"67,32747088",,,6,0.8,1,nan,28,35
5033,Tučepska vilenjača,Croatia,24.6.2017.,2017-06-24,"2f, 1juv",3,Leptonetidae,Sulcia,sp. 4,Sulcia sp. 4,1242,43.286.465,17.083.638,Tb,deep cave,,8,"10,6","10,731","9,67800045","9,67800045","24,96000099",926,26,"67,32747088",,,6,0.8,1,nan,28,35
5034,Tučepska vilenjača,Croatia,24.6.2017.,2017-06-24,1juv,1,Agelenidae,Histopona,sp.,Histopona sp.,1242,43.286.465,17.083.638,,,,8,"10,6","10,731","9,67800045","9,67800045","24,96000099",926,26,"67,32747088",,,6,0.8,1,nan,28,35
5035,Tučepska vilenjača,Croatia,24.6.2017.,2017-06-24,1f,1,Pholcidae,Stygopholcus,absoloni,Stygopholcus absoloni,1242,43.286.465,17.083.638,,deep cave,,8,"10,6","10,731","9,67800045","9,67800045","24,96000099",926,26,"67,32747088",,,6,0.8,1,nan,28,35
5036,Miličevića pećina,Croatia,5.11.2016.,2016-11-05,1juv,1,Dysderidae,Stalagtia,sp. 4,Stalagtia sp. 4,527,43.534.495,16.564.289,Tb,deep cave,,2,,"12,2","14,35266685","14,35266685","25,30800056",833,33,"106,1704139",,,,,,,,
5037,Miličevića pećina,Croatia,5.11.2016.,2016-11-05,"1f, 1juvf, 2juv",4,Leptonetidae,Sulcia,sp. 1,Sulcia sp. 1,527,43.534.495,16.564.289,Tf,deep cave,,2,,"12,2","14,35266685","14,35266685","25,30800056",833,33,"106,1704139",,,,,,,,
5038,Miličevića pećina,Croatia,5.11.2016.,2016-11-05,"1f, 1juvf, 3 juv",5,Leptonetidae,Sulcia,sp. 1,Sulcia sp. 1,527,43.534.495,16.564.289,Tf,deep cave,,2,,"12,2","14,35266685","14,35266685","25,30800056",833,33,"106,1704139",,,,,,,,
5040,Miličevića pećina,Croatia,5.11.2016.,2016-11-05,"2f, 3juvm, 2juv",7,Leptonetidae,Sulcia,sp. 1,Sulcia sp. 1,527,43.534.495,16.564.289,Tf,deep cave,,2,,"12,2","14,35266685","14,35266685","25,30800056",833,33,"106,1704139",,,,,,,,
5041,Miličevića pećina,Croatia,5.11.2016.,2016-11-05,1juv,1,Dysderidae,Stalagtia,sp. 4,Stalagtia sp. 4,527,43.534.495,16.564.289,Tb,deep cave,,2,,"12,2","14,35266685","14,35266685","25,30800056",833,33,"106,1704139",,,,,,,,
5042,Miličevića pećina,Croatia,5.11.2016.,2016-11-05,"2f, 1juv",3,Leptonetidae,Sulcia,sp. 1,Sulcia sp. 1,527,43.534.495,16.564.289,Tf,deep cave,,2,,"12,2","14,35266685","14,35266685","25,30800056",833,33,"106,1704139",,,,,,,,
5043,Miličevića pećina,Croatia,5.11.2016.,2016-11-05,1f,1,Leptonetidae,Sulcia,sp. 1,Sulcia sp. 1,527,43.534.495,16.564.289,Tf,deep cave,,2,,"12,2","14,35266685","14,35266685","25,30800056",833,33,"106,1704139",,,,,,,,
5045,Tanki Ratac,Croatia,29.6.2017.,2017-06-29,"3m, 4f",7,Leptonetidae,Barusia,maheni,Barusia maheni,215,43.360.229,16.569.356,tf,deep cave,,3,,"16,6","14,83833313","14,83833313","25,04799843",787,17,"111,4255656",91,,nan,nan,1,nan,nan,nan
5046,Činjadra,Croatia,1.7.2017.,2017-07-01,"5f, 1juvf, 3juv",9,Leptonetidae,Barusia,maheni,Barusia maheni,364,43.339.771,16.599.423,tf,deep cave,,2,,"15,1","15,05266666","15,05266666","25,05999947",793,28,"109,3832783",,,4,1,1,nan,83,0
5050,Jezero na Gatuli,Croatia,4.7.2017.,2017-07-04,2m,2,Leptonetidae,Barusia,sp. 1,Barusia sp. 1,54,42.960.756,16.003.363,tb,deep cave,,1,"15,6","16,1","16,36354256","16,36354256","22,04166794",542,26,"194,3326648",92,93,7,3,1,nan,29,27
5051,Jezero na Gatuli,Croatia,4.7.2017.,2017-07-04,"2juvm, 5 juv",7,Leptonetidae,Barusia,sp. 1,Barusia sp. 1,54,42.960.756,16.003.363,tb,deep cave,,1,"15,6","16,1","16,36354256","16,36354256","22,04166794",542,26,"194,3326648",92,93,7,3,1,nan,29,27
5052,Jezero na Gatuli,Croatia,4.7.2017.,2017-07-04,"5m, 8 females, 7 juv",2,Leptonetidae,Barusia,sp. 1,Barusia sp. 1,54,42.960.756,16.003.363,tb,deep cave,,1,"15,6","16,1","16,36354256","16,36354256","22,04166794",542,26,"194,3326648",92,93,7,3,1,nan,29,27
5053,Tanki Ratac,Croatia,29.6.2017.,2017-06-29,"2juvm, 3f, 3juv",8,Leptonetidae,Barusia,maheni,Barusia maheni,215,43.360.229,16.569.356,tf,deep cave,,3,,"16,6","14,83833313","14,83833313","25,04799843",787,17,"111,4255656",91,,nan,nan,1,nan,nan,nan
5054,Tanki Ratac,Croatia,29.6.2017.,2017-06-29,1m,1,Leptonetidae,Barusia,maheni,Barusia maheni,215,43.360.229,16.569.356,tf,deep cave,,3,,"16,6","14,83833313","14,83833313","25,04799843",787,17,"111,4255656",91,,nan,nan,1,nan,nan,nan
5055,Tanki Ratac,Croatia,29.6.2017.,2017-06-29,"3f, 1m",4,Leptonetidae,Barusia,maheni,Barusia maheni,215,43.360.229,16.569.356,tf,deep cave,,3,,"16,6","14,83833313","14,83833313","25,04799843",787,17,"111,4255656",91,,nan,nan,1,nan,nan,nan
5056,Tanki Ratac,Croatia,29.6.2017.,2017-06-29,"1f, 1juvm, 2juv+1juv Liny",5,Nesticidae,Kryptonesticus,eremita,Kryptonesticus eremita,215,43.360.229,16.569.356,tf,deep cave,,3,,"16,6","14,83833313","14,83833313","25,04799843",787,17,"111,4255656",91,,nan,nan,1,nan,nan,nan
5057,Tanki Ratac,Croatia,29.6.2017.,2017-06-29,3juv,3,Agelenidae,Tegenaria,sp.,Tegenaria sp.,215,43.360.229,16.569.356,,,,3,,"16,6","14,83833313","14,83833313","25,04799843",787,17,"111,4255656",91,,nan,nan,1,nan,nan,nan
5058,Činjadra,Croatia,1.7.2017.,2017-07-01,3 f/juv,3,Leptonetidae,Barusia,maheni,Barusia maheni,364,43.339.771,16.599.423,tf,deep cave,,2,,"15,1","15,05266666","15,05266666","25,05999947",793,28,"109,3832783",,,4,1,1,nan,83,0
5061,Jezero na Gatuli,Croatia,4.7.2017.,2017-07-04,1f,1,Dysderidae,Folkia,sp. 1,Folkia sp. 1,54,42.960.756,16.003.363,TB,deep cave,,1,"15,6","16,1","16,36354256","16,36354256","22,04166794",542,26,"194,3326648",92,93,7,3,1,nan,29,27
5066,Sistem Velika-Velika,Croatia,22.6.2017.,2017-06-22,1juv,1,Nesticidae,Kryptonesticus,deelemanae,Kryptonesticus deelemanae,1410,43.330.129,17.048.357,tb,deep cave,,3,,"2,2","7,993500233","7,993500233","24,5",945,23,"65,95384936",99,,5,4,1,135,71,48
5067,Sistem Velika-Velika,Croatia,22.6.2017.,2017-06-22,"3f, 5juv",8,Linyphiidae,Troglohyphantes,sp. 8,Troglohyphantes sp. 8,1410,43.330.129,17.048.357,Tf,deep cave,,3,,"2,2","7,993500233","7,993500233","24,5",945,23,"65,95384936",99,,5,4,1,135,71,48
5068,Jama pod Stipkovcem,Croatia,22.6.2017.,2017-06-22,"1f, 1juvm",2,Nesticidae,Kryptonesticus,deelemanae,Kryptonesticus deelemanae,1345,43.309.002,17.065.079,tb,deep cave,,5,,"9,4","7,993500233","7,993500233","24,5",945,28,"66,53927382",95,,,,,,,
5069,Jama pod Stipkovcem,Croatia,22.6.2017.,2017-06-22,"2f, 2juv",4,Linyphiidae,Troglohyphantes,sp. 8,Troglohyphantes sp. 8,1345,43.309.002,17.065.079,Tf,deep cave,,5,,"9,4","7,993500233","7,993500233","24,5",945,28,"66,53927382",95,,,,,,,
5070,Sistem Velika-Velika,Croatia,22.6.2017.,2017-06-22,1f,1,Linyphiidae,Troglohyphantes,sp. 8,Troglohyphantes sp. 8,1410,43.330.129,17.048.357,Tf,deep cave,,3,,"2,2","7,993500233","7,993500233","24,5",945,23,"65,95384936",99,,5,4,1,135,71,48
5071,Sistem Velika-Velika,Croatia,22.6.2017.,2017-06-22,1juv,1,Nesticidae,Kryptonesticus,deelemanae,Kryptonesticus deelemanae,1410,43.330.129,17.048.357,tb,deep cave,,3,,"2,2","7,993500233","7,993500233","24,5",945,23,"65,95384936",99,,5,4,1,135,71,48
5074,SOB 188,Croatia,23.6.2017.,2017-06-23,1f,1,Linyphiidae,Troglohyphantes,sp. 8,Troglohyphantes sp. 8,1557,43.344.045,17.057.588,Tf,deep cave,,3,"2,9","3,15","8,441666603","8,441666603","24,99200058",947,32,"63,85343176",80,82,,,,,,
5075,Tučepska vilenjača,Croatia,24.6.2017.,2017-06-24,1f-samo opistosoma,1,Dysderidae,Stalagtia,sp. 4,Stalagtia sp. 4,1242,43.286.465,17.083.638,Tb,deep cave,,8,"10,6","10,731","9,67800045","9,67800045","24,96000099",926,26,"67,32747088",,,6,0.8,1,nan,28,35
5076,Tučepska vilenjača,Croatia,24.6.2017.,2017-06-24,"1f, 1m, 1juv",3,Linyphiidae,Typhlonyphia,sp. 1,Typhlonyphia sp. 1,1242,43.286.465,17.083.638,Tb,deep cave,,8,"10,6","10,731","9,67800045","9,67800045","24,96000099",926,26,"67,32747088",,,6,0.8,1,nan,28,35
5078,Tučepska vilenjača,Croatia,24.6.2017.,2017-06-24,"1m, 5juv",6,Agelenidae,Histopona,conveniens,Histopona conveniens,1242,43.286.465,17.083.638,Tf,deep cave,,8,"10,6","10,731","9,67800045","9,67800045","24,96000099",926,26,"67,32747088",,,6,0.8,1,nan,28,35
5079,Tučepska vilenjača,Croatia,24.6.2017.,2017-06-24,"1f, 1juvf, 2juv",4,Leptonetidae,Sulcia,sp.,Sulcia sp.,1242,43.286.465,17.083.638,,,,8,"10,6","10,731","9,67800045","9,67800045","24,96000099",926,26,"67,32747088",,,6,0.8,1,nan,28,35
5081,Tučepska vilenjača,Croatia,24.6.2017.,2017-06-24,"1m ostaci, 1 juv ostaci",2,Dysderidae,Stalagtia,sp. 4,Stalagtia sp. 4,1242,43.286.465,17.083.638,Tb,deep cave,,8,"10,6","10,731","9,67800045","9,67800045","24,96000099",926,26,"67,32747088",,,6,0.8,1,nan,28,35
5083,Amfora,Croatia,3.6.2017.,2017-06-03,2juv,2,Nesticidae,Kryptonesticus,deelemanae,Kryptonesticus deelemanae,1530,43.346.701,17.046.656,tb,deep cave,,2,,"4,717","8,441666603","8,441666603","24,99200058",947,26,"64,60005286","85,733",,8,6,1,nan,468,778
5084,Požega,Croatia,1.6.2017.,2017-06-01,1m,1,Eutichuridae,Cheiracanthium,effossum,Cheiracanthium effossum,1410,43.330.293,1.704.711,,,,1,,"4,35","7,993500233","7,993500233","24,5",945,23,"66,04902349","95,5",,,,,,,
5086,Amfora,Croatia,3.6.2017.,2017-06-03,1f,1,Linyphiidae,Troglohyphantes,sp. 8,Troglohyphantes sp. 8,1530,43.346.701,17.046.656,Tf,deep cave,,2,,"4,717","8,441666603","8,441666603","24,99200058",947,26,"64,60005286","85,733",,8,6,1,nan,468,778
5089,Jama pod Kamenitim vratima,Croatia,31.5.2017.,2017-05-31,1f,1,Dysderidae,Harpactea,mateparlovi,Harpactea mateparlovi,1254,4.330.085,17.119.314,Tf,deep cave,,1,"6,5",5,"9,092166901","9,092166901",25,931,23,"62,95176923",93,,3,15,1,nan,312,499
5090,Mokre noge,Croatia,30.5.2017.,2017-05-30,"1f, 2juv",3,Linyphiidae,Troglohyphantes,sp. 8,Troglohyphantes sp. 8,1367,4.329.671,17.090.621,Tf,deep cave,,1,,"4,45","9,092166901","9,092166901",25,931,29,"65,6832495","97,75",,4,7,1,1563,720,831
5091,Mokre noge,Croatia,30.5.2017.,2017-05-30,"4f, 1juv",5,Linyphiidae,Troglohyphantes,sp. 8,Troglohyphantes sp. 8,1367,4.329.671,17.090.621,Tf,deep cave,,1,,"4,45","9,092166901","9,092166901",25,931,29,"65,6832495","97,75",,4,7,1,1563,720,831
5092,Mokre noge,Croatia,30.5.2017.,2017-05-30,1f,1,Linyphiidae,Troglohyphantes,sp. 8,Troglohyphantes sp. 8,1367,4.329.671,17.090.621,Tf,deep cave,,1,,"4,45","9,092166901","9,092166901",25,931,29,"65,6832495","97,75",,4,7,1,1563,720,831
5117,Bukovac,Croatia,27.7.2017.,2017-07-27,"1m, 2juv",3,Dysderidae,Parastalita,stygia,Parastalita stygia,817,4.534.318,14.757.647,Tb,deep cave,,5,,"7,8","7,299499989","7,299499989","26,94799995",1530,24,"409,5782937","96,5",,8,5,1,nan,136,2
5118,Medvjeđa špilja,Croatia,27.7.2017.,2017-07-27,1juv m,1,Dysderidae,Stalita,pretneri,Stalita pretneri,758,45.363.572,14.757.905,Tb,deep cave,,3,,"10,95","7,299499989","7,299499989","26,94799995",1530,25,"411,6907421",,,nan,nan,1,nan,nan,nan
5119,Medvjeđa špilja,Croatia,27.7.2017.,2017-07-27,1f,1,Dysderidae,Parastalita,stygia,Parastalita stygia,758,45.363.572,14.757.905,Tb,deep cave,,3,,"10,95","7,299499989","7,299499989","26,94799995",1530,25,"411,6907421",,,nan,nan,1,nan,nan,nan
5120,Medvjeđa špilja,Croatia,27.7.2017.,2017-07-27,"3f, 1juv",4,Linyphiidae,Troglohyphantes,croaticus,Troglohyphantes croaticus,758,45.363.572,14.757.905,tb,deep cave,,3,,"10,95","7,299499989","7,299499989","26,94799995",1530,25,"411,6907421",,,nan,nan,1,nan,nan,nan
5121,Medvjeđa špilja,Croatia,27.7.2017.,2017-07-27,svlakovi 2m i 2 juv,4,Dysderidae,Stalita,pretneri,Stalita pretneri,758,45.363.572,14.757.905,Tb,deep cave,,3,,"10,95","7,299499989","7,299499989","26,94799995",1530,25,"411,6907421",,,nan,nan,1,nan,nan,nan
5147,Vranja peć,Croatia,2.11.2016.,2016-11-02,1m,1,Dysderidae,Stalagtia,hercegovinensis,Stalagtia hercegovinensis,261,42.868.266,17.812.427,Tb,deep cave,,2,"15,65","16,683","15,15533352","15,15533352","26,40799904",1060,21,"72,71378675",,,1,1,1,188,149,49.5
5148,Vranja peć,Croatia,2.11.2016.,2016-11-02,1f,1,Pholcidae,Stygopholcus,absoloni,Stygopholcus absoloni,261,42.868.266,17.812.427,,deep cave,,2,"15,65","16,683","15,15533352","15,15533352","26,40799904",1060,21,"72,71378675",,,1,1,1,188,149,49.5
5151,Šipun,Croatia,31.10.2016.,2016-10-31,3juv,3,Dysderidae,Stalagtia,sp. 1,Stalagtia sp. 1,,42.583.646,18.217.986,Tb,deep cave,,11,,"15,4","15,02037048","15,02037048","24,28333282",1208,2,"111,3036255","97,8",,1.5,2.5,1,165,150,22.5
5152,Šipun,Croatia,31.10.2016.,2016-10-31,1juv,1,Agelenidae,Histopona,dubia,Histopona dubia,,42.583.646,18.217.986,tb,deep cave,,11,,"15,4","15,02037048","15,02037048","24,28333282",1208,2,"111,3036255","97,8",,1.5,2.5,1,165,150,22.5
5153,Kaverna 781,Croatia,31.10.2016.,2016-10-31,4juv,4,Dysderidae,Stalagtia,sp. 1,Stalagtia sp. 1,55,4.252.633,183.382,Tb,deep cave,,4,,"12,3","16,00799942","16,00799942","24,41199875",1258,21,"110,0890104",99,,1,1.3,1,nan,142,0
5155,Kukor,Croatia,4.11.2016.,2016-11-04,"2f, 1juv",3,Nesticidae,Kryptonesticus,deelemanae,Kryptonesticus deelemanae,587,43.355.609,16.991.707,tb,deep cave,,10,,"15,4","12,63749981","12,63749981","25,40833473",906,29,"68,94753675",,,1,1,1,264,213,40
5156,Kukor,Croatia,4.11.2016.,2016-11-04,"1m, 2f, 4juv",7,Leptonetidae,Sulcia,sp. 3,Sulcia sp. 3,587,43.355.609,16.991.707,Tb,deep cave,,10,,"15,4","12,63749981","12,63749981","25,40833473",906,29,"68,94753675",,,1,1,1,264,213,40
5157,Maklutača,Croatia,5.11.2016.,2016-11-05,"6f, 1juvm",7,Linyphiidae,Troglohyphantes,strandi,Troglohyphantes strandi,415,43.569.268,16.620.515,tb,deep cave,,6,,"6,25","11,86699963","11,86699963","25,86800003",883,29,"99,53597793",,,11,6.5,1,152,140,39
5158,Maklutača,Croatia,5.11.2016.,2016-11-05,1m,1,Linyphiidae,Troglohyphantes,giromettai,Troglohyphantes giromettai,415,43.569.268,16.620.515,tf,deep cave,,6,,"6,25","11,86699963","11,86699963","25,86800003",883,29,"99,53597793",,,11,6.5,1,152,140,39
5159,Šipun,Croatia,31.10.2016.,2016-10-31,1juv,1,Pholcidae,Pholcus,sp.,Pholcus sp.,,42.583.646,18.217.986,,,,11,,"15,4","15,02037048","15,02037048","24,28333282",1208,2,"111,3036255","97,8",,1.5,2.5,1,165,150,22.5
5160,Šipun,Croatia,31.10.2016.,2016-10-31,1juv,1,Agelenidae,Histopona,dubia,Histopona dubia,,42.583.646,18.217.986,tb,deep cave,,11,,"15,4","15,02037048","15,02037048","24,28333282",1208,2,"111,3036255","97,8",,1.5,2.5,1,165,150,22.5
5161,Šipun,Croatia,31.10.2016.,2016-10-31,1juv,1,Dysderidae,Stalagtia,sp. 1,Stalagtia sp. 1,,42.583.646,18.217.986,Tb,deep cave,,11,,"15,4","15,02037048","15,02037048","24,28333282",1208,2,"111,3036255","97,8",,1.5,2.5,1,165,150,22.5
5162,Špilja u Žarmi,Croatia,3.11.2016.,2016-11-03,1f,1,Dysderidae,Dysdera,ninnii,Dysdera ninnii,40,42.935.427,1.743.822,Tx,,,7,"13,05","13,05","16,30899048","16,30899048","26,72631454",906,21,"84,49485396","87,3","87,3",3,3,1,28,22,9.5
5163,Špilja u Žarmi,Croatia,3.11.2016.,2016-11-03,1juv,1,Dysderidae,Stalagtia,hercegovinensis,Stalagtia hercegovinensis,40,42.935.427,1.743.822,Tb,deep cave,,7,"13,05","13,05","16,30899048","16,30899048","26,72631454",906,21,"84,49485396","87,3","87,3",3,3,1,28,22,9.5
5164,Špilja u Žarmi,Croatia,3.11.2016.,2016-11-03,1juv,1,Linyphiidae,Gen. 12,sp. 1,Gen. 12 sp. 1,40,42.935.427,1.743.822,tb,deep cave,,7,"13,05","13,05","16,30899048","16,30899048","26,72631454",906,21,"84,49485396","87,3","87,3",3,3,1,28,22,9.5
5165,Špilja u Žarmi,Croatia,3.11.2016.,2016-11-03,1m,1,Leptonetidae,Barusia,maheni,Barusia maheni,40,42.935.427,1.743.822,tf,deep cave,,7,"13,05","13,05","16,30899048","16,30899048","26,72631454",906,21,"84,49485396","87,3","87,3",3,3,1,28,22,9.5
5166,Špilja u Žarmi,Croatia,3.11.2016.,2016-11-03,1juv,1,Pholcidae,Pholcus,sp.,Pholcus sp.,40,42.935.427,1.743.822,,,,7,"13,05","13,05","16,30899048","16,30899048","26,72631454",906,21,"84,49485396","87,3","87,3",3,3,1,28,22,9.5
5171,Jama pod Gažnovcem,Croatia,4.11.2016.,2016-11-04,1f,1,Linyphiidae,Centromerus,cavernarum,Centromerus cavernarum,590,43.229.672,17.314.159,Tf,deep cave,,8,,"11,6","12,67833328","12,67833328","26,74400139",940,23,"59,1740747","99,2",,0.6,1,1,45,41,3.5
5172,Jama pod Gažnovcem,Croatia,4.11.2016.,2016-11-04,1juv,1,Dysderidae,Harpactea,sp. 2,Harpactea sp. 2,590,43.229.672,17.314.159,Tb,deep cave,,8,,"11,6","12,67833328","12,67833328","26,74400139",940,23,"59,1740747","99,2",,0.6,1,1,45,41,3.5
5173,Jama pod Gažnovcem,Croatia,4.11.2016.,2016-11-04,"1f, 1juvf",2,Linyphiidae,Palliduphantes,spelaeorum,Palliduphantes spelaeorum,590,43.229.672,17.314.159,Tf,deep cave,,8,,"11,6","12,67833328","12,67833328","26,74400139",940,23,"59,1740747","99,2",,0.6,1,1,45,41,3.5
5174,Jama pod Gažnovcem,Croatia,4.11.2016.,2016-11-04,1juvm,1,Linyphiidae,Typhlonyphia,sp. 1,Typhlonyphia sp. 1,590,43.229.672,17.314.159,Tb,deep cave,,8,,"11,6","12,67833328","12,67833328","26,74400139",940,23,"59,1740747","99,2",,0.6,1,1,45,41,3.5
5175,Kukor,Croatia,4.11.2016.,2016-11-04,1f,1,Agelenidae,Histopona,conveniens,Histopona conveniens,587,43.355.609,16.991.707,Tf,deep cave,,10,,"15,4","12,63749981","12,63749981","25,40833473",906,29,"68,94753675",,,1,1,1,264,213,40
5178,Kukor,Croatia,4.11.2016.,2016-11-04,1juv,1,Agelenidae,Histopona,conveniens,Histopona conveniens,587,43.355.609,16.991.707,Tf,deep cave,,10,,"15,4","12,63749981","12,63749981","25,40833473",906,29,"68,94753675",,,1,1,1,264,213,40
5179,Kukor,Croatia,4.11.2016.,2016-11-04,1juv,1,Nesticidae,Kryptonesticus,deelemanae,Kryptonesticus deelemanae,587,43.355.609,16.991.707,TB,deep cave,,10,,"15,4","12,63749981","12,63749981","25,40833473",906,29,"68,94753675",,,1,1,1,264,213,40
5180,Kukor,Croatia,4.11.2016.,2016-11-04,1juv m,1,Leptonetidae,Sulcia,sp.,Sulcia sp.,587,43.355.609,16.991.707,,,,10,,"15,4","12,63749981","12,63749981","25,40833473",906,29,"68,94753675",,,1,1,1,264,213,40
5244,Činjadra,Croatia,1.7.2017.,2017-07-01,"1m, 1f",2,Nesticidae,Kryptonesticus,eremita,Kryptonesticus eremita,364,43.339.771,16.599.423,tf,deep cave,,2,,"15,1","15,05266666","15,05266666","25,05999947",793,28,"109,3832783",,,4,1,1,nan,83,0
5250,Bezdan,Croatia,30.10.2016.,2016-10-30,1m,1,Nesticidae,Kryptonesticus,eremita,Kryptonesticus eremita,133,42.530.343,18.316.239,tf,deep cave,,2,,"14,7","16,13833237","16,13833237","24,16666794",1249,23,"112,0435418",,,0.5,0.3,1,nan,12,22
5251,Bezdan,Croatia,30.10.2016.,2016-10-30,"1f, 2juv",3,Dysderidae,Stalagtia,sp. 1,Stalagtia sp. 1,133,42.530.343,18.316.239,Tb,deep cave,,2,,"14,7","16,13833237","16,13833237","24,16666794",1249,23,"112,0435418",,,0.5,0.3,1,nan,12,22
5254,Bezdan,Croatia,30.10.2016.,2016-10-30,"1m, 1juv",2,Dysderidae,Stalagtia,sp. 1,Stalagtia sp. 1,133,42.530.343,18.316.239,Tb,deep cave,,2,,"14,7","16,13833237","16,13833237","24,16666794",1249,23,"112,0435418",,,0.5,0.3,1,nan,12,22
5255,Jezero,Croatia,1.11.2016.,2016-11-01,1m,1,Pholcidae,Stygopholcus,skotophilus,Stygopholcus skotophilus,964,42.580.381,18.356.073,,deep cave,,8,,"7,567","12,93216705","12,93216705","24,86800003",1208,29,"104,2091301","96,5",,1,0.5,1,20.5,nan,12
5256,Jama pod Gažnovcem,Croatia,4.11.2016.,2016-11-04,1f,1,Linyphiidae,Centromerus,cavernarum,Centromerus cavernarum,590,43.229.672,17.314.159,Tf,deep cave,,8,,"11,6","12,67833328","12,67833328","26,74400139",940,23,"59,1740747","99,2",,0.6,1,1,45,41,3.5
5257,Špilja u Žarmi,Croatia,3.11.2016.,2016-11-03,1m,1,Dysderidae,Harpactea,rucnerorum,Harpactea rucnerorum,40,42.935.427,1.743.822,Tf,deep cave,,7,"13,05","13,05","16,30899048","16,30899048","26,72631454",906,21,"84,49485396","87,3","87,3",3,3,1,28,22,9.5
5258,Maklutača,Croatia,5.11.2016.,2016-11-05,1f,1,Linyphiidae,Gen.,sp. X,Gen. sp. X,415,43.569.268,16.620.515,,,,6,,"6,25","11,86699963","11,86699963","25,86800003",883,29,"99,53597793",,,11,6.5,1,152,140,39
5259,Močiljska špilja,Croatia,2.11.2016.,2016-11-02,1f,1,Agelenidae,Histopona,dubia,Histopona dubia,333,42.689.061,18.071.906,tb,deep cave,,6,"15,4","14,7","15,5370369","15,5370369","24,25",1154,26,"95,48772633",,,5,2.5,1,1038,938,138
5260,Močiljska špilja,Croatia,2.11.2016.,2016-11-02,1juv,1,Agelenidae,Histopona,sp.,Histopona sp.,333,42.689.061,18.071.906,,,,6,"15,4","14,7","15,5370369","15,5370369","24,25",1154,26,"95,48772633",,,5,2.5,1,1038,938,138
5262,Đurovića jama,Croatia,2.11.2016.,2016-11-02,1f,1,Nesticidae,Kryptonesticus,eremita,Kryptonesticus eremita,156,42.559.979,18.263.559,tf,deep cave,,4,,"17,267","15,93194485","15,93194485","24,30000114",1247,6,"111,7390404",,,1,2,1,156,132,17
5263,Močiljska špilja,Croatia,2.11.2016.,2016-11-02,"1f, 1juv",2,Agelenidae,Histopona,dubia,Histopona dubia,333,42.689.061,18.071.906,tb,deep cave,,6,"15,4","14,7","15,5370369","15,5370369","24,25",1154,26,"95,48772633",,,5,2.5,1,1038,938,138
5264,Šipun,Croatia,2.11.2016.,2016-11-02,1juv,1,Agelenidae,Histopona,sp.,Histopona sp.,,42.583.646,18.217.986,,,,11,,"15,4","15,02037048","15,02037048","24,28333282",1208,2,"111,3036255","97,8",,1.5,2.5,1,165,150,22.5
5265,Kaverna 781,Croatia,30.10.2016.,2016-10-30,1f,1,Nesticidae,Kryptonesticus,eremita,Kryptonesticus eremita,55,4.252.633,183.382,tf,deep cave,,4,,"12,3","16,00799942","16,00799942","24,41199875",1258,21,"110,0890104",99,,1,1.3,1,nan,142,0
5271,Jama na Benkotovu,Croatia,27.6.2017.,2017-06-27,"1juvm, 1juvf, 2juv",4,Leptonetidae,Barusia,maheni,Barusia maheni,120,4.337.569,16.272.059,tf,deep cave,,3,,"15,2","15,939394","15,939394","23,43181801",720,29,"142,4731318","93,667",,1.8,2.5,1,41.1,17.6,30.2
5272,Jama na Benkotovu,Croatia,27.6.2017.,2017-06-27,3juv,3,Agelenidae,Tegenaria,sp.,Tegenaria sp.,120,4.337.569,16.272.059,,,,3,,"15,2","15,939394","15,939394","23,43181801",720,29,"142,4731318","93,667",,1.8,2.5,1,41.1,17.6,30.2
5274,Jama na Benkotovu,Croatia,27.6.2017.,2017-06-27,"6f, 1m, 2juvm",9,Linyphiidae,Palliduphantes,spelaeorum,Palliduphantes spelaeorum,120,4.337.569,16.272.059,Tf,deep cave,,3,,"15,2","15,939394","15,939394","23,43181801",720,29,"142,4731318","93,667",,1.8,2.5,1,41.1,17.6,30.2
5275,Jama na Benkotovu,Croatia,27.6.2017.,2017-06-27,"2m, 3f, 3juv",8,Leptonetidae,Barusia,maheni,Barusia maheni,120,4.337.569,16.272.059,tf,deep cave,,3,,"15,2","15,939394","15,939394","23,43181801",720,29,"142,4731318","93,667",,1.8,2.5,1,41.1,17.6,30.2
5277,Jama na Benkotovu,Croatia,27.6.2017.,2017-06-27,1m,1,Familia x,Gen.,sp.,Gen. sp.,120,4.337.569,16.272.059,,,,3,,"15,2","15,939394","15,939394","23,43181801",720,29,"142,4731318","93,667",,1.8,2.5,1,41.1,17.6,30.2
5413,Bezdan,Croatia,16.4.2017.,2017-04-16,1m,1,Dysderidae,Stalagtia,sp. 1,Stalagtia sp. 1,133,42.530.343,18.316.239,Tb,deep cave,,2,,"14,7","16,13833237","16,13833237","24,16666794",1249,23,"112,0435418",,,0.5,0.3,1,nan,12,22
5421,Jama pod Gažnovcem,Croatia,18.9.2016.,2016-09-18,4juv,4,Linyphiidae,Typhlonyphia,sp. 1,Typhlonyphia sp. 1,590,43.229.672,17.314.159,Tb,deep cave,,8,,"11,6","12,67833328","12,67833328","26,74400139",940,23,"59,1740747","99,2",,0.6,1,1,45,41,3.5
5422,Jama pod Gažnovcem,Croatia,18.9.2016.,2016-09-18,1f,1,Agelenidae,Histopona,conveniens,Histopona conveniens,590,43.229.672,17.314.159,Tf,deep cave,,8,,"11,6","12,67833328","12,67833328","26,74400139",940,23,"59,1740747","99,2",,0.6,1,1,45,41,3.5
5423,Jama pod Gažnovcem,Croatia,18.9.2016.,2016-09-18,2juv,2,Dysderidae,Stalagtia,sp. 4,Stalagtia sp. 4,590,43.229.672,17.314.159,Tb,deep cave,,8,,"11,6","12,67833328","12,67833328","26,74400139",940,23,"59,1740747","99,2",,0.6,1,1,45,41,3.5
5431,Vranja peć,Croatia,20.10.2016.,2016-10-20,1juv/f,1,Dysderidae,Stalagtia,hercegovinensis,Stalagtia hercegovinensis,261,42.868.266,17.812.427,Tb,deep cave,,2,"15,65","16,683","15,15533352","15,15533352","26,40799904",1060,21,"72,71378675",,,1,1,1,188,149,49.5
5435,Kaverna 781,Croatia,20.10.2016.,2016-10-20,2juv,2,Dysderidae,Stalagtia,sp. 1,Stalagtia sp. 1,55,4.252.633,183.382,Tb,deep cave,,4,,"12,3","16,00799942","16,00799942","24,41199875",1258,21,"110,0890104",99,,1,1.3,1,nan,142,0
5437,Mandina jama,Croatia,22.10.2016.,2016-10-22,1juv,1,Dysderidae,Stalagtia,sp. 4,Stalagtia sp. 4,66,43.083.116,17.606.299,Tb,deep cave,,5,,"12,3","16,30433273","16,30433273","28,61999893",999,23,"55,28020586",100,,3.2,1.6,1,45,13,35
5439,Mandina jama,Croatia,22.10.2016.,2016-10-22,1juv,1,Nesticidae,Kryptonesticus,eremita,Kryptonesticus eremita,66,43.083.116,17.606.299,,deep cave,,5,,"12,3","16,30433273","16,30433273","28,61999893",999,23,"55,28020586",100,,3.2,1.6,1,45,13,35
5440,Mandina jama,Croatia,22.10.2016.,2016-10-22,1f,1,Linyphiidae,Gen.,sp. X,Gen. sp. X,66,43.083.116,17.606.299,,,,5,,"12,3","16,30433273","16,30433273","28,61999893",999,23,"55,28020586",100,,3.2,1.6,1,45,13,35
5441,Mandina jama,Croatia,22.10.2016.,2016-10-22,1juv,1,Liocranidae,Liocranum,sp.,Liocranum sp.,66,43.083.116,17.606.299,,,,5,,"12,3","16,30433273","16,30433273","28,61999893",999,23,"55,28020586",100,,3.2,1.6,1,45,13,35
5442,Mandina jama,Croatia,22.10.2016.,2016-10-22,"6m, 2f, 2juv",1,Leptonetidae,Sulcia,sp. 13,Sulcia sp. 13,66,43.083.116,17.606.299,,deep cave,,5,,"12,3","16,30433273","16,30433273","28,61999893",999,23,"55,28020586",100,,3.2,1.6,1,45,13,35
5445,Kaverna 781,Croatia,20.10.2016.,2016-10-20,"1m, 1juvm, 4juv",6,Dysderidae,Stalagtia,sp. 1,Stalagtia sp. 1,55,4.252.633,183.382,Tb,deep cave,,4,,"12,3","16,00799942","16,00799942","24,41199875",1258,21,"110,0890104",99,,1,1.3,1,nan,142,0
5446,Kaverna 781,Croatia,20.10.2016.,2016-10-20,"1m, 1juvm",2,Linyphiidae,Porrhomma,sp.,Porrhomma sp.,55,4.252.633,183.382,,,,4,,"12,3","16,00799942","16,00799942","24,41199875",1258,21,"110,0890104",99,,1,1.3,1,nan,142,0
5447,Kaverna 781,Croatia,20.10.2016.,2016-10-20,"1m, 1f, 1juv",3,Dysderidae,Stalagtia,sp. 1,Stalagtia sp. 1,55,4.252.633,183.382,Tb,deep cave,,4,,"12,3","16,00799942","16,00799942","24,41199875",1258,21,"110,0890104",99,,1,1.3,1,nan,142,0
5449,Mandina jama,Croatia,22.10.2016.,2016-10-22,"1f, 2juv",3,Leptonetidae,Sulcia,sp. 13,Sulcia sp. 13,66,43.083.116,17.606.299,,deep cave,,5,,"12,3","16,30433273","16,30433273","28,61999893",999,23,"55,28020586",100,,3.2,1.6,1,45,13,35
5450,Jama pod Stipkovcem,Croatia,22.6.2017.,2017-06-22,"1f, 1juv",2,Linyphiidae,Troglohyphantes,sp. 8,Troglohyphantes sp. 8,1345,43.309.002,17.065.079,Tf,deep cave,,5,,"9,4","7,993500233","7,993500233","24,5",945,28,"66,53927382",95,,,,,,,
5451,Jama pod Stipkovcem,Croatia,22.6.2017.,2017-06-22,1juv,1,Dysderidae,Stalagtia,sp. 4,Stalagtia sp. 4,1345,43.309.002,17.065.079,Tb,deep cave,,5,,"9,4","7,993500233","7,993500233","24,5",945,28,"66,53927382",95,,,,,,,
5452,Tučepska vilenjača,Croatia,24.6.2017.,2017-06-24,1juvm,1,Leptonetidae,Sulcia,sp.,Sulcia sp.,1242,43.286.465,17.083.638,,,,8,"10,6","10,731","9,67800045","9,67800045","24,96000099",926,26,"67,32747088",,,6,0.8,1,nan,28,35
5457,Matijaševa peć,Croatia,23.6.2017.,2017-06-23,1juv,1,Nesticidae,Kryptonesticus,deelemanae,Kryptonesticus deelemanae,621,43.320.551,17.122.321,TB,deep cave,,6,"8,3","6,933","9,092166901","9,092166901",25,931,23,"60,61369348",,,3,1,1,18,17,6
5459,Matijaševa peć,Croatia,23.6.2017.,2017-06-23,1f,1,Leptonetidae,Sulcia,sp.,Sulcia sp.,621,43.320.551,17.122.321,,,,6,"8,3","6,933","9,092166901","9,092166901",25,931,23,"60,61369348",,,3,1,1,18,17,6
5461,SOB 188,Croatia,23.6.2017.,2017-06-23,1juv m,1,Nesticidae,Kryptonesticus,deelemanae,Kryptonesticus deelemanae,1557,43.344.045,17.057.588,TB,deep cave,,3,"2,9","3,15","8,441666603","8,441666603","24,99200058",947,32,"63,85343176",80,82,,,,,,
5464,Gradska spila,Croatia,23.6.2017.,2017-06-23,"1m, 1f, 1juv",3,Leptonetidae,Sulcia,sp. 4,Sulcia sp. 4,621,43.318.029,17.117.623,Tb,deep cave,,4,,"6,6","9,092166901","9,092166901",25,931,23,"61,25913011","93,333",,5,2.5,1,nan,26.5,1.8
5465,Jama pod Stipkovcem,Croatia,21.6.2017.,2017-06-21,1juv,1,Dysderidae,Stalagtia,sp. 4,Stalagtia sp. 4,1345,43.309.002,17.065.079,Tb,deep cave,,5,,"9,4","7,993500233","7,993500233","24,5",945,28,"66,53927382",95,,,,,,,
5466,Jama pod Stipkovcem,Croatia,21.6.2017.,2017-06-21,1juvm,1,Nesticidae,Kryptonesticus,deelemanae,Kryptonesticus deelemanae,1345,43.309.002,17.065.079,TB,deep cave,,5,,"9,4","7,993500233","7,993500233","24,5",945,28,"66,53927382",95,,,,,,,
5467,Jama pod Stipkovcem,Croatia,21.6.2017.,2017-06-21,"2juvm, 2juv",4,Pholcidae,Stygopholcus,absoloni,Stygopholcus absoloni,1345,43.309.002,17.065.079,,deep cave,,5,,"9,4","7,993500233","7,993500233","24,5",945,28,"66,53927382",95,,,,,,,
5468,Gradska spila,Croatia,23.6.2017.,2017-06-23,1juvm,1,Agelenidae,Histopona,sp.,Histopona sp.,621,43.318.029,17.117.623,,,,4,,"6,6","9,092166901","9,092166901",25,931,23,"61,25913011","93,333",,5,2.5,1,nan,26.5,1.8
5470,Gradska spila,Croatia,23.6.2017.,2017-06-23,"3f, 3m",6,Leptonetidae,Sulcia,sp. 4,Sulcia sp. 4,621,43.318.029,17.117.623,Tb,deep cave,,4,,"6,6","9,092166901","9,092166901",25,931,23,"61,25913011","93,333",,5,2.5,1,nan,26.5,1.8
5472,SOB 188,Croatia,23.6.2017.,2017-06-23,"1f, 1 juv",2,Nesticidae,Kryptonesticus,deelemanae,Kryptonesticus deelemanae,1557,43.344.045,17.057.588,tb,deep cave,,3,"2,9","3,15","8,441666603","8,441666603","24,99200058",947,32,"63,85343176",80,82,,,,,,
5473,Samogorska špilja,Croatia,23.6.2017.,2017-06-23,1f,1,Dysderidae,Harpactea,damini,Harpactea damini,621,43.318.227,17.121.122,TF,deep cave,,6,"7,1","9,033","9,092166901","9,092166901",25,931,23,"60,95464736",99,,2,3,1,nan,19,3.5
5474,Samogorska špilja,Croatia,23.6.2017.,2017-06-23,1juvm,1,Agelenidae,Histopona,sp.,Histopona sp.,621,43.318.227,17.121.122,,,,6,"7,1","9,033","9,092166901","9,092166901",25,931,23,"60,95464736",99,,2,3,1,nan,19,3.5
5475,Samogorska špilja,Croatia,23.6.2017.,2017-06-23,"2f, 1juvm",3,Nesticidae,Kryptonesticus,deelemanae,Kryptonesticus deelemanae,621,43.318.227,17.121.122,tb,deep cave,,6,"7,1","9,033","9,092166901","9,092166901",25,931,23,"60,95464736",99,,2,3,1,nan,19,3.5
5477,Samogorska špilja,Croatia,23.6.2017.,2017-06-23,1juv,1,Pholcidae,Stygopholcus,absoloni,Stygopholcus absoloni,621,43.318.227,17.121.122,,deep cave,,6,"7,1","9,033","9,092166901","9,092166901",25,931,23,"60,95464736",99,,2,3,1,nan,19,3.5
5478,Samogorska špilja,Croatia,23.6.2017.,2017-06-23,"1m, 8 females, 3juv",12,Leptonetidae,Sulcia,sp. 4,Sulcia sp. 4,621,43.318.227,17.121.122,Tb,deep cave,,6,"7,1","9,033","9,092166901","9,092166901",25,931,23,"60,95464736",99,,2,3,1,nan,19,3.5
5512,Provala,Croatia,2.9.2017.,2017-09-02,"1f, 1juv",2,Nesticidae,Nesticus,cellulanus,Nesticus cellulanus,310,45.696.538,15.438.161,tf,deep cave,,3,,"9,7","9,762499809","9,762499809","29,01600075",1149,23,"399,6273411","91,333",,2,2,1,2161,1862,55
5557,Bukovac,Croatia,10.9.2017.,2017-09-10,1m,1,Nesticidae,Nesticus,cellulanus,Nesticus cellulanus,817,4.534.318,14.757.647,tf,deep cave,,5,,"7,8","7,299499989","7,299499989","26,94799995",1530,24,"409,5782937","96,5",,8,5,1,nan,136,2
5560,Bazgovača,Croatia,22.10.2007.,2007-10-22,1m,1,Linyphiidae,Palliduphantes,spelaeorum,Palliduphantes spelaeorum,652,4.330.647,16.622.143,Tf,deep cave,,3,,"7,2","12,8081665","12,8081665","24,57600021",796,24,"108,9858223",,,5,7,1,nan,47,32
5561,Bazgovača,Croatia,22.10.2007.,2007-10-22,1f,1,Linyphiidae,Palliduphantes,spelaeorum,Palliduphantes spelaeorum,652,4.330.647,16.622.143,Tf,deep cave,,3,,"7,2","12,8081665","12,8081665","24,57600021",796,24,"108,9858223",,,5,7,1,nan,47,32
5563,Jama iznad Vrulja,Croatia,5.4.2017.,2017-04-05,1juv,1,Dysderidae,Mesostalita,sp. 2,Mesostalita sp. 2,25,4.381.234,15.301.095,Tb,deep cave,,5,"16,4","16,642","14,70833302","14,70833302","24,91250038",753,32,"248,4265548",91,"89,6",nan,nan,1,nan,nan,nan
5568,Biokovka,Croatia,22.6.2017.,2017-06-22,1m,1,Dysderidae,Harpactea,mateparlovi,Harpactea mateparlovi,1396,43.322.203,17.050.602,Tf,deep cave,,2,5,"4,667","7,993500233","7,993500233","24,5",945,23,"66,50071702",88,88,10,5,1,545,190,389
5569,Golubinka u gaju,Croatia,29.4.2018.,2018-04-29,1juvm,1,Dysderidae,Harpactea,sp.,Harpactea sp.,699,4.325.525,17.265.833,,,,6,,"7,8","10,36450005","10,36450005","26,19599915",947,29,"58,2626568",77,,4.6,10,1,29,28.8,5.7
5570,Golubinka u gaju,Croatia,29.4.2018.,2018-04-29,"1f, 3juvm, 1juv",5,Leptonetidae,Gen.,sp.,Gen. sp.,699,4.325.525,17.265.833,,,,6,,"7,8","10,36450005","10,36450005","26,19599915",947,29,"58,2626568",77,,4.6,10,1,29,28.8,5.7
5571,Jama malog ulaza,Croatia,28.4.2018.,2018-04-28,1juv/f,1,Dysderidae,Stalagtia,sp. 4,Stalagtia sp. 4,722,43.251.472,17.270.889,Tb,deep cave,,2,,12,"10,36450005","10,36450005","26,19599915",947,29,"58,46817059",89,,0.5,0.6,1,40.4,3.8,36.6
5574,Jama malog ulaza,Croatia,28.4.2018.,2018-04-28,3juv,3,Linyphiidae,Typhlonyphia,sp. 1,Typhlonyphia sp. 1,722,43.251.472,17.270.889,Tb,deep cave,,2,,12,"10,36450005","10,36450005","26,19599915",947,29,"58,46817059",89,,0.5,0.6,1,40.4,3.8,36.6
5575,Antipatična,Croatia,30.4.2018.,2018-04-30,1juvm,1,Dysderidae,Harpactea,sp.,Harpactea sp.,722,43.256.111,1.726.775,,,,2,,7,"10,36450005","10,36450005","26,19599915",947,29,"58,03935299",,,3,4,1,22,12,12
5576,Antipatična,Croatia,30.4.2018.,2018-04-30,1f,1,Leptonetidae,Gen.,sp.,Gen. sp.,722,43.256.111,1.726.775,,,,2,,7,"10,36450005","10,36450005","26,19599915",947,29,"58,03935299",,,3,4,1,22,12,12
5578,Biokovka,Croatia,22.6.2017.,2017-06-22,1juvm,1,Dysderidae,Harpactea,mateparlovi,Harpactea mateparlovi,1396,43.322.203,17.050.602,Tf,deep cave,,2,5,"4,667","7,993500233","7,993500233","24,5",945,23,"66,50071702",88,88,10,5,1,545,190,389
5593,Vjetruša,Croatia,1.10.2017.,2017-10-01,1m,1,Linyphiidae,Palliduphantes,sp. 10,Palliduphantes sp. 10,,43.774.298,15.349.734,,,,5,,"15,5","14,99659061","14,99659061","23,85454559",727,26,"242,3449432",87,,5,4,1,61,36,34
5595,Vjetruša,Croatia,1.10.2017.,2017-10-01,"5juv, 1m",6,Agelenidae,Tegenaria,domestica,Tegenaria domestica,,43.774.298,15.349.734,Tf,deep cave,,5,,"15,5","14,99659061","14,99659061","23,85454559",727,26,"242,3449432",87,,5,4,1,61,36,34
5596,Vjetruša,Croatia,1.10.2017.,2017-10-01,1juv,1,Scytodidae,Scytodes,thoracica,Scytodes thoracica,,43.774.298,15.349.734,Tx,,,5,,"15,5","14,99659061","14,99659061","23,85454559",727,26,"242,3449432",87,,5,4,1,61,36,34
5597,Vjetruša,Croatia,1.10.2017.,2017-10-01,3juv,3,Agelenidae,Tegenaria,sp.,Tegenaria sp.,,43.774.298,15.349.734,,,,5,,"15,5","14,99659061","14,99659061","23,85454559",727,26,"242,3449432",87,,5,4,1,61,36,34
5601,Vjetruša,Croatia,1.10.2017.,2017-10-01,1f,1,Agelenidae,Tegenaria,domestica,Tegenaria domestica,,43.774.298,15.349.734,Tf,deep cave,,5,,"15,5","14,99659061","14,99659061","23,85454559",727,26,"242,3449432",87,,5,4,1,61,36,34
5602,Vjetruša,Croatia,1.10.2017.,2017-10-01,1juv,1,Agelenidae,Tegenaria,sp.,Tegenaria sp.,,43.774.298,15.349.734,,,,5,,"15,5","14,99659061","14,99659061","23,85454559",727,26,"242,3449432",87,,5,4,1,61,36,34
5604,Vjetruša,Croatia,1.10.2017.,2017-10-01,2juv,2,Agelenidae,Tegenaria,sp.,Tegenaria sp.,,43.774.298,15.349.734,,,,5,,"15,5","14,99659061","14,99659061","23,85454559",727,26,"242,3449432",87,,5,4,1,61,36,34
5607,Vjetruša,Croatia,7.10.2017.,2017-10-07,1m,1,Agelenidae,Tegenaria,domestica,Tegenaria domestica,,43.774.298,15.349.734,Tf,deep cave,,5,,"15,5","14,99659061","14,99659061","23,85454559",727,26,"242,3449432",87,,5,4,1,61,36,34
5614,Jama Borovnik,Croatia,3.10.2017.,2017-10-03,"2 juv, 1 svlak",2,Agelenidae,Tegenaria,sp.,Tegenaria sp.,5,4.381.202,15.255.662,,,,3,,"19,9","14,89114571","14,89114571","24,51250076",750,26,"253,4352033",,,,,,,,
5616,Jama Borovnik,Croatia,3.10.2017.,2017-10-03,1f,1,Pholcidae,Spermophora,senoculata,Spermophora senoculata,5,4.381.202,15.255.662,Tf,deep cave,,3,,"19,9","14,89114571","14,89114571","24,51250076",750,26,"253,4352033",,,,,,,,
5617,Jama Borovnik,Croatia,3.10.2017.,2017-10-03,1juv,1,Agelenidae,Tegenaria,sp.,Tegenaria sp.,5,4.381.202,15.255.662,,,,3,,"19,9","14,89114571","14,89114571","24,51250076",750,26,"253,4352033",,,,,,,,
5618,Jama Borovnik,Croatia,3.10.2017.,2017-10-03,1juv,1,Agelenidae,Tegenaria,sp.,Tegenaria sp.,5,4.381.202,15.255.662,,,,3,,"19,9","14,89114571","14,89114571","24,51250076",750,26,"253,4352033",,,,,,,,
5620,Jama Borovnik,Croatia,3.10.2017.,2017-10-03,1f,1,Linyphiidae,Palliduphantes,sp. 10,Palliduphantes sp. 10,5,4.381.202,15.255.662,,,,3,,"19,9","14,89114571","14,89114571","24,51250076",750,26,"253,4352033",,,,,,,,
5622,Jama Borovnik,Croatia,3.10.2017.,2017-10-03,1juv,1,Agelenidae,Tegenaria,sp.,Tegenaria sp.,5,4.381.202,15.255.662,,,,3,,"19,9","14,89114571","14,89114571","24,51250076",750,26,"253,4352033",,,,,,,,
5623,Jama Petra Stijene,Croatia,2.10.2017.,2017-10-02,1f,1,Linyphiidae,Palliduphantes,sp. 10,Palliduphantes sp. 10,35,4.376.621,15.348.457,,,,3,"16,4","15,95","14,99659061","14,99659061","23,85454559",727,26,"242,3524596",89,,,,,,,
5630,Jama Blitvica,Croatia,2.10.2017.,2017-10-02,1f,1,Agelenidae,Inermocoelotes,sp.,Inermocoelotes sp.,52,43.765.234,15.352.649,,,,2,,"15,7","14,99659061","14,99659061","23,85454559",727,26,"241,8726371",72,,,,,,,
5631,Jama pod Velim vrhom,Croatia,7.10.2017.,2017-10-07,1juv,1,Scytodidae,Scytodes,thoracica,Scytodes thoracica,,43.824.798,15.240.798,Tx,,,3,,"16,767","15,02083302","15,02083302","23,89999771",745,28,"255,3346159",94,,0.5,0.7,1,7,4.7,3.5
5634,Jama pod Velim vrhom,Croatia,7.10.2017.,2017-10-07,1juv,1,Nemesiidae,Brachythele,sp.,Brachythele sp.,,43.824.798,15.240.798,,,,3,,"16,767","15,02083302","15,02083302","23,89999771",745,28,"255,3346159",94,,0.5,0.7,1,7,4.7,3.5
5635,Jama pod Velim vrhom,Croatia,7.10.2017.,2017-10-07,1juv,1,Nemesiidae,Brachythele,sp.,Brachythele sp.,,43.824.798,15.240.798,,,,3,,"16,767","15,02083302","15,02083302","23,89999771",745,28,"255,3346159",94,,0.5,0.7,1,7,4.7,3.5
5636,Jama pod Velim vrhom,Croatia,7.10.2017.,2017-10-07,1juv,1,Dysderidae,Harpactea,sp.,Harpactea sp.,,43.824.798,15.240.798,,,,3,,"16,767","15,02083302","15,02083302","23,89999771",745,28,"255,3346159",94,,0.5,0.7,1,7,4.7,3.5
5646,Zelena jama,Croatia,6.10.2017.,2017-10-06,1f,1,Dysderidae,Dysdera,sp.,Dysdera sp.,132,43.832.628,15.290.877,Tx,,,8,"14,5",15,"14,89114571","14,89114571","24,51250076",750,32,"249,9812212",94,94,2,5,1,nan,23,19.5
5647,Zelena jama,Croatia,6.10.2017.,2017-10-06,1f,1,Dysderidae,Dysdera,dubrovninnii,Dysdera dubrovninnii,132,43.832.628,15.290.877,Tx,,,8,"14,5",15,"14,89114571","14,89114571","24,51250076",750,32,"249,9812212",94,94,2,5,1,nan,23,19.5
5648,Zelena jama,Croatia,6.10.2017.,2017-10-06,2juv,2,Pholcidae,Holocnemus,sp.,Holocnemus sp.,132,43.832.628,15.290.877,,,,8,"14,5",15,"14,89114571","14,89114571","24,51250076",750,32,"249,9812212",94,94,2,5,1,nan,23,19.5
5649,Zelena jama,Croatia,6.10.2017.,2017-10-06,"1f, 1juv",2,Nesticidae,Kryptonesticus,eremita,Kryptonesticus eremita,132,43.832.628,15.290.877,tf,deep cave,,8,"14,5",15,"14,89114571","14,89114571","24,51250076",750,32,"249,9812212",94,94,2,5,1,nan,23,19.5
5650,Zelena jama,Croatia,6.10.2017.,2017-10-06,3m,3,Theridiidae,Pholcomma,gibbum,Pholcomma gibbum,132,43.832.628,15.290.877,Tx,,,8,"14,5",15,"14,89114571","14,89114571","24,51250076",750,32,"249,9812212",94,94,2,5,1,nan,23,19.5
5651,Zelena jama,Croatia,6.10.2017.,2017-10-06,"1m, 3f",4,Linyphiidae,Palliduphantes,sp. 10,Palliduphantes sp. 10,132,43.832.628,15.290.877,,,,8,"14,5",15,"14,89114571","14,89114571","24,51250076",750,32,"249,9812212",94,94,2,5,1,nan,23,19.5
5655,Rupa,Croatia,4.10.2017.,2017-10-04,1juv,1,Scytodidae,Scytodes,thoracica,Scytodes thoracica,83,43.807.072,15.340.281,Tx,,,1,,18,"14,90952396","14,90952396","24,5",743,32,"243,9956802",92,,2,1,1,35,34,0
5657,Stražbenica,Croatia,20.11.2017.,2017-11-20,"1f, 2juv, jaja",3,Nesticidae,Kryptonesticus,eremita,Kryptonesticus eremita,172,43.697.353,16.029.618,tf,deep cave,,3,,"14,7","14,88466644","14,88466644","26,93600082",739,26,"165,8524113",100,,7,2.5,1,86,86,7
5662,Veli Badanj,Croatia,10.5.2017.,2017-05-10,1f,1,Tetragnathidae,Metellina,merianae,Metellina merianae,131,43.986.193,15.054.548,Tf,deep cave,,3,"12,3","11,9","14,24374962","14,24374962","25,10625076",821,29,"262,8976974",,,6.4,6,1,169,148,63
5663,Veli Badanj,Croatia,10.5.2017.,2017-05-10,"1f, 5juv",6,Nesticidae,Kryptonesticus,eremita,Kryptonesticus eremita,131,43.986.193,15.054.548,tf,deep cave,,3,"12,3","11,9","14,24374962","14,24374962","25,10625076",821,29,"262,8976974",,,6.4,6,1,169,148,63
5664,Veli Badanj,Croatia,30.9.2017.,2017-09-30,1f,1,Tetragnathidae,Metellina,merianae,Metellina merianae,131,43.986.193,15.054.548,Tf,deep cave,,3,"12,3","11,9","14,24374962","14,24374962","25,10625076",821,29,"262,8976974",,,6.4,6,1,169,148,63
5665,Veli Badanj,Croatia,30.9.2017.,2017-09-30,"2f, 2juv",4,Nesticidae,Kryptonesticus,eremita,Kryptonesticus eremita,131,43.986.193,15.054.548,tf,deep cave,,3,"12,3","11,9","14,24374962","14,24374962","25,10625076",821,29,"262,8976974",,,6.4,6,1,169,148,63
5666,Veli Badanj,Croatia,30.9.2017.,2017-09-30,1juv,1,Nesticidae,Kryptonesticus,eremita,Kryptonesticus eremita,131,43.986.193,15.054.548,tf,deep cave,,3,"12,3","11,9","14,24374962","14,24374962","25,10625076",821,29,"262,8976974",,,6.4,6,1,169,148,63
5667,Veli Badanj,Croatia,10.5.2017.,2017-05-10,"1m, 1juvm",2,Tetragnathidae,Metellina,merianae,Metellina merianae,131,43.986.193,15.054.548,Tf,deep cave,,3,"12,3","11,9","14,24374962","14,24374962","25,10625076",821,29,"262,8976974",,,6.4,6,1,169,148,63
5668,Veli Badanj,Croatia,10.5.2017.,2017-05-10,2juv,2,Nesticidae,Kryptonesticus,eremita,Kryptonesticus eremita,131,43.986.193,15.054.548,tf,deep cave,,3,"12,3","11,9","14,24374962","14,24374962","25,10625076",821,29,"262,8976974",,,6.4,6,1,169,148,63
5669,Veli Badanj,Croatia,10.5.2017.,2017-05-10,"1f, 1juvm, 4juv",6,Nesticidae,Kryptonesticus,eremita,Kryptonesticus eremita,131,43.986.193,15.054.548,tf,deep cave,,3,"12,3","11,9","14,24374962","14,24374962","25,10625076",821,29,"262,8976974",,,6.4,6,1,169,148,63
5670,Veli Badanj,Croatia,10.5.2017.,2017-05-10,"1m, 1juvf",2,Linyphiidae,Palliduphantes,istrianus,Palliduphantes istrianus,131,43.986.193,15.054.548,Tf,deep cave,,3,"12,3","11,9","14,24374962","14,24374962","25,10625076",821,29,"262,8976974",,,6.4,6,1,169,148,63
5672,Veli Badanj,Croatia,30.9.2017.,2017-09-30,"4juv, 1juvm",5,Nesticidae,Kryptonesticus,eremita,Kryptonesticus eremita,131,43.986.193,15.054.548,tf,deep cave,,3,"12,3","11,9","14,24374962","14,24374962","25,10625076",821,29,"262,8976974",,,6.4,6,1,169,148,63
5673,Veli Badanj,Croatia,30.9.2017.,2017-09-30,"3f, 2juv",5,Linyphiidae,Palliduphantes,istrianus,Palliduphantes istrianus,131,43.986.193,15.054.548,Tf,deep cave,,3,"12,3","11,9","14,24374962","14,24374962","25,10625076",821,29,"262,8976974",,,6.4,6,1,169,148,63
5675,Veli Badanj,Croatia,10.5.2017.,2017-05-10,1juv,1,Nesticidae,Kryptonesticus,eremita,Kryptonesticus eremita,131,43.986.193,15.054.548,tf,deep cave,,3,"12,3","11,9","14,24374962","14,24374962","25,10625076",821,29,"262,8976974",,,6.4,6,1,169,148,63
5676,Veli Badanj,Croatia,10.5.2017.,2017-05-10,1juvm,1,Nesticidae,Kryptonesticus,eremita,Kryptonesticus eremita,131,43.986.193,15.054.548,tf,deep cave,,3,"12,3","11,9","14,24374962","14,24374962","25,10625076",821,29,"262,8976974",,,6.4,6,1,169,148,63
5677,Veli Badanj,Croatia,10.5.2017.,2017-05-10,"1f, 1juvf",2,Linyphiidae,Palliduphantes,istrianus,Palliduphantes istrianus,131,43.986.193,15.054.548,Tf,deep cave,,3,"12,3","11,9","14,24374962","14,24374962","25,10625076",821,29,"262,8976974",,,6.4,6,1,169,148,63
5678,Veli Badanj,Croatia,10.5.2017.,2017-05-10,1juv,1,Nesticidae,Kryptonesticus,eremita,Kryptonesticus eremita,131,43.986.193,15.054.548,tf,deep cave,,3,"12,3","11,9","14,24374962","14,24374962","25,10625076",821,29,"262,8976974",,,6.4,6,1,169,148,63
5679,Podslotinjak,Croatia,11.5.2017.,2017-05-11,1juv,1,Nesticidae,Kryptonesticus,eremita,Kryptonesticus eremita,79,43.957.667,15.117.515,tf,deep cave,,1,,15,"14,45087719","14,45087719","25,6210537",803,17,"265,5835446",,,0.8,1.4,1,44.8,30.2,13.9
5680,Podslotinjak,Croatia,11.5.2017.,2017-05-11,1f,1,Nesticidae,Kryptonesticus,eremita,Kryptonesticus eremita,79,43.957.667,15.117.515,tf,deep cave,,1,,15,"14,45087719","14,45087719","25,6210537",803,17,"265,5835446",,,0.8,1.4,1,44.8,30.2,13.9
5681,Podslotinjak,Croatia,29.9.2017.,2017-09-29,"1f, 2juv",3,Nesticidae,Kryptonesticus,eremita,Kryptonesticus eremita,79,43.957.667,15.117.515,tf,deep cave,,1,,15,"14,45087719","14,45087719","25,6210537",803,17,"265,5835446",,,0.8,1.4,1,44.8,30.2,13.9
5684,Jama s vodom kraj sela Luka,Croatia,11.5.2017.,2017-05-11,3juv,3,Nesticidae,Kryptonesticus,eremita,Kryptonesticus eremita,35,43.975.701,15.101.951,tf,deep cave,,2,,"12,5","14,40544891","14,40544891","25,53076935",813,17,"265,9578515",,,4,4,1,42.9,11,34.2
5685,Jama s vodom kraj sela Luka,Croatia,11.5.2017.,2017-05-11,"1f, 2juv",3,Linyphiidae,Asthenargus,sp.,Asthenargus sp.,35,43.975.701,15.101.951,tf,deep cave,,2,,"12,5","14,40544891","14,40544891","25,53076935",813,17,"265,9578515",,,4,4,1,42.9,11,34.2
5686,Jama u Čuščici,Croatia,9.5.2017.,2017-05-09,2f,2,Linyphiidae,Centromerus,sp.,Centromerus sp.,37,43.898.978,15.212.082,,,,2,,"14,8","14,90535736","14,90535736","24,89999962",772,26,"260,2751622",,,0.7,1.5,1,40,19,21
5687,Jama u Čuščici,Croatia,9.5.2017.,2017-05-09,1m,1,Scytodidae,Scytodes,thoracica,Scytodes thoracica,37,43.898.978,15.212.082,Tx,,,2,,"14,8","14,90535736","14,90535736","24,89999962",772,26,"260,2751622",,,0.7,1.5,1,40,19,21
5691,Špilja pod Kapelu,Croatia,18.8.2016.,2016-08-18,1 svlak_juvm,1,Agelenidae,Hadites,tegenarioides,Hadites tegenarioides,102,43.184.949,16.434.233,TB,deep cave,,5,,"12,717","16,20546913","16,20546913","23,36250114",714,21,"135,8656791","97,5",,nan,nan,1,nan,nan,nan
5695,Kukova peć,Croatia,17.10.2017.,2017-10-17,"1f, 5 juv",6,Dysderidae,Stalagtia,hercegovinensis,Stalagtia hercegovinensis,185,42.726.992,1.796.566,Tb,deep cave,,5,17,"16,6","15,07569408","15,07569408","24,35416603",1115,26,"90,07229603",,,1,1.2,1,nan,81.5,22
5699,Hrastovska špilja,Croatia,2.10.2007.,2007-10-02,1 juv,1,Dysderidae,Folkia,sp. 2,Folkia sp. 2,103,42.756.282,16.875.635,Tb,deep cave,,4,,"12,6","16,4216671","16,4216671","22,7733345",668,29,"145,7479543",94,,nan,nan,1,nan,nan,nan
5700,Vaganka,Croatia,17.6.2018.,2018-06-17,"1f, 1 juv",2,Dysderidae,Mesostalita,sp. 3,Mesostalita sp. 3,656,4.433.853,1.543.867,Tb,deep cave,,5,,"12,2","7,622666836","7,622666836","26,19600105",1265,29,"257,5927467",95,,,,,,,
5701,Vaganka,Croatia,17.6.2018.,2018-06-17,"2m, 2juv, 2juv/f",6,Leptonetidae,Cataleptoneta,lingulata,Cataleptoneta lingulata,656,4.433.853,1.543.867,tb,deep cave,,5,,"12,2","7,622666836","7,622666836","26,19600105",1265,29,"257,5927467",95,,,,,,,
5702,Vaganka,Croatia,17.6.2018.,2018-06-17,"1f, 2juv",3,Agelenidae,Histopona,egonpretneri,Histopona egonpretneri,656,4.433.853,1.543.867,Tb,deep cave,,5,,"12,2","7,622666836","7,622666836","26,19600105",1265,29,"257,5927467",95,,,,,,,
5703,Jama pod istočnom stijenom Buljme,Croatia,16.6.2018.,2018-06-16,1 juv,1,Linyphiidae,Troglohyphantes,sp. 14,Troglohyphantes sp. 14,1445,44.368.375,15.467.868,tb,deep cave,,3,,"4,8","7,383500099","7,383500099","25,82799911",1297,23,"256,7963643",,,,,,,,
5706,Jama pod istočnom stijenom Buljme,Croatia,16.6.2018.,2018-06-16,1juv,1,Dysderidae,Gen. 1,sp. 1,Gen. 1 sp. 1,1445,44.368.375,15.467.868,Tb,deep cave,,3,,"4,8","7,383500099","7,383500099","25,82799911",1297,23,"256,7963643",,,,,,,,
5707,Vaganka,Croatia,17.6.2018.,2018-06-17,"1f, 2juv",3,Leptonetidae,Cataleptoneta,lingulata,Cataleptoneta lingulata,656,4.433.853,1.543.867,tb,deep cave,,5,,"12,2","7,622666836","7,622666836","26,19600105",1265,29,"257,5927467",95,,,,,,,
5709,Jama pod istočnom stijenom Buljme,Croatia,6.6.2018.,2018-06-06,1f,1,Linyphiidae,Troglohyphantes,sp. 14,Troglohyphantes sp. 14,1445,44.368.375,15.467.868,tb,deep cave,,3,,"4,8","7,383500099","7,383500099","25,82799911",1297,23,"256,7963643",,,,,,,,
5716,Manita peć,Croatia,19.5.2018.,2018-05-19,1m,1,Dysderidae,Stalita,pretneri,Stalita pretneri,374,44.314.302,15.475.264,Tb,deep cave,,7,"8,8","9,525","10,42683315","10,42683315","27,29200172",1068,28,"252,2759525",,,nan,nan,1,nan,nan,nan
5717,Manita peć,Croatia,19.5.2018.,2018-05-19,1m,1,Dysderidae,Parastalita,stygia,Parastalita stygia,374,44.314.302,15.475.264,Tb,deep cave,,7,"8,8","9,525","10,42683315","10,42683315","27,29200172",1068,28,"252,2759525",,,nan,nan,1,nan,nan,nan
5718,Manita peć,Croatia,19.5.2018.,2018-05-19,2 juv,2,Dysderidae,Stalita,pretneri,Stalita pretneri,374,44.314.302,15.475.264,Tb,deep cave,,7,"8,8","9,525","10,42683315","10,42683315","27,29200172",1068,28,"252,2759525",,,nan,nan,1,nan,nan,nan
5719,Manita peć,Croatia,19.5.2018.,2018-05-19,1m,1,Dysderidae,Parastalita,stygia,Parastalita stygia,374,44.314.302,15.475.264,Tb,deep cave,,7,"8,8","9,525","10,42683315","10,42683315","27,29200172",1068,28,"252,2759525",,,nan,nan,1,nan,nan,nan
5728,Vaganka,Croatia,8.7.2018.,2018-07-08,1m,1,Dysderidae,Mesostalita,sp. 3,Mesostalita sp. 3,656,4.433.853,1.543.867,Tb,deep cave,,5,,"12,2","7,622666836","7,622666836","26,19600105",1265,29,"257,5927467",95,,,,,,,
5755,Vjetruša,Croatia,18.4.2018.,2018-04-18,1juvm,1,Agelenidae,Tegenaria,sp.,Tegenaria sp.,,43.774.298,15.349.734,,,,5,,"15,5","14,99659061","14,99659061","23,85454559",727,26,"242,3449432",87,,5,4,1,61,36,34
5758,Vjetruša,Croatia,18.4.2018.,2018-04-18,"1f,1juv",2,Agelenidae,Tegenaria,domestica,Tegenaria domestica,,43.774.298,15.349.734,Tf,deep cave,,5,,"15,5","14,99659061","14,99659061","23,85454559",727,26,"242,3449432",87,,5,4,1,61,36,34
5759,Vjetruša,Croatia,18.4.2018.,2018-04-18,2juv,2,Agelenidae,Tegenaria,sp.,Tegenaria sp.,,43.774.298,15.349.734,,,,5,,"15,5","14,99659061","14,99659061","23,85454559",727,26,"242,3449432",87,,5,4,1,61,36,34
5766,Vjetruša,Croatia,18.4.2018.,2018-04-18,1f,1,Linyphiidae,Centromerus,densidentatus sp.n.,Centromerus densidentatus sp.n.,,43.774.298,15.349.734,,,,5,,"15,5","14,99659061","14,99659061","23,85454559",727,26,"242,3449432",87,,5,4,1,61,36,34
5771,Mala jama pod križem,Croatia,17.4.2018.,2018-04-17,1juvm,1,Pholcidae,Holocnemus,sp.,Holocnemus sp.,15,43.818.664,15.254.882,,,,2,,"14,25","14,89114571","14,89114571","24,51250076",750,26,"253,6545557",96,,0.5,0.8,1,8.5,5,5
5772,Zelena jama,Croatia,20.4.2018.,2018-04-20,2f,2,Nesticidae,Kryptonesticus,eremita,Kryptonesticus eremita,132,43.832.628,15.290.877,tf,deep cave,,8,"14,5",15,"14,89114571","14,89114571","24,51250076",750,32,"249,9812212",94,94,2,5,1,nan,23,19.5
5773,Zelena jama,Croatia,20.4.2018.,2018-04-20,"2f, 2m",4,Theridiidae,Pholcomma,gibbum,Pholcomma gibbum,132,43.832.628,15.290.877,Tx,,,8,"14,5",15,"14,89114571","14,89114571","24,51250076",750,32,"249,9812212",94,94,2,5,1,nan,23,19.5
5774,Zelena jama,Croatia,20.4.2018.,2018-04-20,1juv,1,Pholcidae,Holocnemus,sp.,Holocnemus sp.,132,43.832.628,15.290.877,,,,8,"14,5",15,"14,89114571","14,89114571","24,51250076",750,32,"249,9812212",94,94,2,5,1,nan,23,19.5
5775,Zelena jama,Croatia,20.4.2018.,2018-04-20,2juv,2,Nesticidae,Kryptonesticus,eremita,Kryptonesticus eremita,132,43.832.628,15.290.877,tf,deep cave,,8,"14,5",15,"14,89114571","14,89114571","24,51250076",750,32,"249,9812212",94,94,2,5,1,nan,23,19.5
5776,Zelena jama,Croatia,20.4.2018.,2018-04-20,1f,1,Linyphiidae,Centromerus,sp. 13,Centromerus sp. 13,132,43.832.628,15.290.877,,,,8,"14,5",15,"14,89114571","14,89114571","24,51250076",750,32,"249,9812212",94,94,2,5,1,nan,23,19.5
5777,Zelena jama,Croatia,20.4.2018.,2018-04-20,1juv,1,Nesticidae,Kryptonesticus,eremita,Kryptonesticus eremita,132,43.832.628,15.290.877,tf,deep cave,,8,"14,5",15,"14,89114571","14,89114571","24,51250076",750,32,"249,9812212",94,94,2,5,1,nan,23,19.5
5778,Slavuja,Croatia,21.4.2018.,2018-04-21,1juv,1,Agelenidae,Tegenaria,sp.,Tegenaria sp.,,438.244,15.269.639,,,,1,,"17,6","14,89114571","14,89114571","24,51250076",750,32,"252,1453553",91,,1,0.5,1,29,6,21
5779,Slavuja,Croatia,21.4.2018.,2018-04-21,1juv,1,Pholcidae,Holocnemus,sp.,Holocnemus sp.,,438.244,15.269.639,,,,1,,"17,6","14,89114571","14,89114571","24,51250076",750,32,"252,1453553",91,,1,0.5,1,29,6,21
5780,Slavuja,Croatia,21.4.2018.,2018-04-21,1m,1,Nemesiidae,Nemesia,sp.,Nemesia sp.,,438.244,15.269.639,,,,1,,"17,6","14,89114571","14,89114571","24,51250076",750,32,"252,1453553",91,,1,0.5,1,29,6,21
5781,Jama pod Velim vrhom,Croatia,17.4.2018.,2018-04-17,1juvm,1,Agelenidae,Tegenaria,sp.,Tegenaria sp.,,43.824.798,15.240.798,,,,3,,"16,767","15,02083302","15,02083302","23,89999771",745,28,"255,3346159",94,,0.5,0.7,1,7,4.7,3.5
5782,Jama pod Velim vrhom,Croatia,17.4.2018.,2018-04-17,1juv,1,Agelenidae,Tegenaria,sp.,Tegenaria sp.,,43.824.798,15.240.798,,,,3,,"16,767","15,02083302","15,02083302","23,89999771",745,28,"255,3346159",94,,0.5,0.7,1,7,4.7,3.5
5783,Jama iznad Vrulja,Croatia,15.4.2018.,2018-04-15,3m,3,Pholcidae,Holocnemus,pluchei,Holocnemus pluchei,25,4.381.234,15.301.095,tf,deep cave,,5,"16,4","16,642","14,70833302","14,70833302","24,91250038",753,32,"248,4265548",91,"89,6",nan,nan,1,nan,nan,nan
5784,Jama iznad Vrulja,Croatia,18.4.2018.,2018-04-18,3juv,3,Pholcidae,Holocnemus,sp.,Holocnemus sp.,25,4.381.234,15.301.095,,,,5,"16,4","16,642","14,70833302","14,70833302","24,91250038",753,32,"248,4265548",91,"89,6",nan,nan,1,nan,nan,nan
5785,Bunar u Vruljama,Croatia,18.4.2018.,2018-04-18,1juvm,1,Pholcidae,Holocnemus,sp.,Holocnemus sp.,25,43.812.006,15.305.033,,,,1,,16,"14,70833302","14,70833302","24,91250038",753,32,"247,9852057",,,nan,nan,1,nan,nan,nan
5787,Jama Petra Stijene,Croatia,19.4.2018.,2018-04-19,1m,1,Amaurobidae,Amaurobius,erberi,Amaurobius erberi,35,4.376.621,15.348.457,Tx,deep cave,,3,"16,4","15,95","14,99659061","14,99659061","23,85454559",727,26,"242,3524596",89,,,,,,,
5788,Špilja na Tovarnjaku,Croatia,20.4.2018.,2018-04-20,1juv,1,Pholcidae,Pholcus,sp.,Pholcus sp.,,43.838.274,15.239.733,,,,2,,"14,1","14,86666679","14,86666679","24,60000038",764,44,"255,7406135",,,nan,nan,1,nan,nan,nan
5789,Špilja na Tovarnjaku,Croatia,20.4.2018.,2018-04-20,2juv,2,Pholcidae,Pholcus,sp.,Pholcus sp.,,43.838.274,15.239.733,,,,2,,"14,1","14,86666679","14,86666679","24,60000038",764,44,"255,7406135",,,nan,nan,1,nan,nan,nan
5792,Jama iznad Špraljin stana,Croatia,20.4.2018.,2018-04-20,1f,1,Theridiidae,Gen.,sp.,Gen. sp.,45,43.872.642,15.230.054,,,,1,,"15,667","14,86666679","14,86666679","24,60000038",764,32,"257,6147588",88,,1,0.6,1,15,4,14
5794,Jama kod Špraljin stana,Croatia,20.4.2018.,2018-04-20,1juv,1,Pholcidae,Holocnemus,sp.,Holocnemus sp.,45,43.872.642,15.230.054,,,,1,,"15,667","14,86666679","14,86666679","24,60000038",764,32,"257,6147588","78,5",,1.2,1.8,1,14,8,9.5
5795,Jama kod Špraljin stana,Croatia,20.4.2018.,2018-04-20,1juv,1,Pholcidae,Spermophora,sp.,Spermophora sp.,45,43.872.642,15.230.054,,,,1,,"15,667","14,86666679","14,86666679","24,60000038",764,32,"257,6147588","78,5",,1.2,1.8,1,14,8,9.5
5799,Špilja u uvali Strižnja,Croatia,16.4.2018.,2018-04-16,"1f, 1juv",2,Linyphiidae,Centromerus,densidentatus sp.n.,Centromerus densidentatus sp.n.,19,43.818.743,15.285.861,,,,1,,"14,7","14,89114571","14,89114571","24,51250076",750,32,"250,2381986",77,,1,1.2,1,7.5,4,6
5801,Bratska jama,Croatia,28.6.2017.,2017-06-28,"1juvf, 3juv",4,Agelenidae,Tegenaria,sp.,Tegenaria sp.,101,43.344.737,16.340.901,,,,2,,15,"16,1016674","16,1016674","23,59000015",732,29,"136,3438122",74,,4.2,4.8,1,35,26.7,15.5
5802,Koludrova špilja,Croatia,28.6.2017.,2017-06-28,"2f, 1juvm",3,Linyphiidae,Palliduphantes,spelaeorum,Palliduphantes spelaeorum,132,43.363.177,16.332.844,Tf,deep cave,,4,,12,"16,08511925","16,08511925","23,50714111",724,29,"136,419846",89,,3,1.5,1,49,43.6,13.7
5803,Koludrova špilja,Croatia,28.6.2017.,2017-06-28,2f,2,Linyphiidae,Palliduphantes,spelaeorum,Palliduphantes spelaeorum,132,43.363.177,16.332.844,Tf,deep cave,,4,,12,"16,08511925","16,08511925","23,50714111",724,29,"136,419846",89,,3,1.5,1,49,43.6,13.7
5804,Koludrova špilja,Croatia,28.6.2017.,2017-06-28,1 juv,1,Agelenidae,Tegenaria,sp.,Tegenaria sp.,132,43.363.177,16.332.844,,,,4,,12,"16,08511925","16,08511925","23,50714111",724,29,"136,419846",89,,3,1.5,1,49,43.6,13.7
5805,Koludrova špilja,Croatia,28.6.2017.,2017-06-28,1m,1,Nesticidae,Kryptonesticus,eremita,Kryptonesticus eremita,132,43.363.177,16.332.844,tf,deep cave,,4,,12,"16,08511925","16,08511925","23,50714111",724,29,"136,419846",89,,3,1.5,1,49,43.6,13.7
5806,Koludrova špilja,Croatia,28.6.2017.,2017-06-28,"1m, 1f, 2juv",4,Tetragnathidae,Metellina,merianae,Metellina merianae,132,43.363.177,16.332.844,Tf,deep cave,,4,,12,"16,08511925","16,08511925","23,50714111",724,29,"136,419846",89,,3,1.5,1,49,43.6,13.7
5807,Čagjina jama,Croatia,14.11.2018.,2018-11-14,1juv,1,Dysderidae,Folkia,haasi,Folkia haasi,197,42.977.147,17.155.166,Tb,deep cave,,5,,"17,5","14,0666666","14,0666666","24,28125",833,20,"101,5489359",,,0.7,0.7,1,26.8,8.2,18.6
5808,Čagjina jama,Croatia,14.11.2018.,2018-11-14,1 juv,1,Sicariidae,Loxosceles,rufescens,Loxosceles rufescens,197,42.977.147,17.155.166,Tf,deep cave,,5,,"17,5","14,0666666","14,0666666","24,28125",833,20,"101,5489359",,,0.7,0.7,1,26.8,8.2,18.6
5811,Čagjina jama,Croatia,14.11.2018.,2018-11-14,2 juv,2,Sicariidae,Loxosceles,rufescens,Loxosceles rufescens,197,42.977.147,17.155.166,Tf,deep cave,,5,,"17,5","14,0666666","14,0666666","24,28125",833,20,"101,5489359",,,0.7,0.7,1,26.8,8.2,18.6
5812,Jama u Pisanom dolcu,Croatia,15.11.2018.,2018-11-15,1juv,1,Dysderidae,Harpactea,sp. 3,Harpactea sp. 3,426,42.860.163,17.614.272,tb,deep cave,,4,,"12,5","15,21433353","15,21433353","25,82799911",967,29,"82,85906223","93,667",,1,0.5,1,52,19,25
5814,Sedrena špilja iza mlina,Croatia,???,,1f,1,Leptonetidae,Barusia,maheni,Barusia maheni,247,44.013.402,16.067.798,tf,deep cave,,6,,"7,9","13,18266678","13,18266678","28,31999969",900,29,"173,0421739",,,6,3,1,124,124,4
5815,Jama pod Stipkovcem,Croatia,22.6.2017.,2017-06-22,1juvm,1,Dysderidae,Harpactea,sp.,Harpactea sp.,1345,43.309.002,17.065.079,,,,5,,"9,4","7,993500233","7,993500233","24,5",945,28,"66,53927382",95,,,,,,,
5821,Jama u Pisanom dolcu,Croatia,29.3.2019.,2019-03-29,1m,1,Linyphiidae,Gen. 12,sp. 1,Gen. 12 sp. 1,426,42.860.163,17.614.272,tb,deep cave,,4,,"12,5","15,21433353","15,21433353","25,82799911",967,29,"82,85906223","93,667",,1,0.5,1,52,19,25
5822,Spilja Rupine,Croatia,6.4.2019.,2019-04-06,"1m, 1f, 1juv",3,Linyphiidae,Typhlonyphia,reimoseri,Typhlonyphia reimoseri,482,4.300.528,17.157.984,tb,deep cave,,6,,"9,1","14,34500027","14,34500027","24,36666679",826,29,"97,54303627",90,,5,3,1,99,93,20
5823,Jama u Kučinama,Croatia,29.3.2019.,2019-03-29,1f,1,Linyphiidae,Gen. 12,sp. 1,Gen. 12 sp. 1,340,42.862.079,17.627.355,tb,deep cave,,4,"6,6","8,6","15,42681122","15,42681122","25,8217392",988,29,"81,89482682",,,3,1.8,1,nan,22,11.5
5824,Jama u Pisanom dolcu,Croatia,29.3.2019.,2019-03-29,1juv,1,Linyphiidae,Gen. 12,sp. 1,Gen. 12 sp. 1,426,42.860.163,17.614.272,tb,deep cave,,4,,"12,5","15,21433353","15,21433353","25,82799911",967,29,"82,85906223","93,667",,1,0.5,1,52,19,25
5826,Nakovana spila,Croatia,30.4.2019.,2019-04-30,2juv,2,Dysderidae,Stalagtia,hercegovinensis,Stalagtia hercegovinensis,324,43.005.018,17.091.068,tb,deep cave,,4,,"13,3","14,54694462","14,54694462","24,21999931",807,29,"101,0327345",92,,,,,,,
5830,Rača špilja,Croatia,17.7.2018.,2018-07-17,"2m, 1juvm, 1juv",4,Leptonetidae,Barusia,sp. 1,Barusia sp. 1,90,42.734.493,16.910.785,tb,deep cave,,4,"14,8","14,42","16,37628174","16,37628174","22,81538391",662,28,"146,7036244",,,,,,,,
5832,Špilja u Bilopolju 2,Croatia,29.4.2019.,2019-04-29,1m,1,Dysderidae,Harpactea,sp. 16,Harpactea sp. 16,127,42.977.917,1.714.156,Tb,shallow subterranean habitat,,3,,"15,4","14,0666666","14,0666666","24,28125",833,24,"102,088399",69,,4,2.7,1,24,20,10
5834,Pišurka,Croatia,26.4.2019.,2019-04-26,2f,2,Leptonetidae,Barusia,korculana,Barusia korculana,17,42.959.451,17.129.228,tb,deep cave,,5,,"13,925","14,0666666","14,0666666","24,28125",833,25,"105,2150766","84,833",,6,1.3,1,86,75,32
5836,Tomasova spilja,Croatia,21.4.2019.,2019-04-21,1juv,1,Dysderidae,Folkia,sp. 4,Folkia sp. 4,132,43.014.202,1.716.548,Tb,deep cave,,3,,"12,25","14,34500027","14,34500027","24,36666679",826,17,"95,95739872","84,667",,8,2,1,nan,41,3
5837,Tomasova spilja,Croatia,21.4.2019.,2019-04-21,"1m, 1juv",2,Leptonetidae,Barusia,korculana,Barusia korculana,132,43.014.202,1.716.548,tb,deep cave,,3,,"12,25","14,34500027","14,34500027","24,36666679",826,17,"95,95739872","84,667",,8,2,1,nan,41,3
5839,Jama kod aviona,Croatia,25.4.2019.,2019-04-25,"5f, 1juvm",6,Linyphiidae,Typhlonyphia,reimoseri,Typhlonyphia reimoseri,638,43.006.192,1.712.592,tb,deep cave,,5,,"9,8","14,34500027","14,34500027","24,36666679",826,28,"99,0207162",91,,4,2,1,nan,18,48
5840,Jama kod aviona,Croatia,25.4.2019.,2019-04-25,1f,1,Nesticidae,Kryptonesticus,sp. 1,Kryptonesticus sp. 1,638,43.006.192,1.712.592,Tb,deep cave,,5,,"9,8","14,34500027","14,34500027","24,36666679",826,28,"99,0207162",91,,4,2,1,nan,18,48
5841,Šimunkovića špilja,Croatia,26.4.2019.,2019-04-26,2jvu,2,Dysderidae,Folkia,sp. 4,Folkia sp. 4,78,42.978.588,17.129.081,Tb,deep cave,,7,,15,"14,0666666","14,0666666","24,28125",833,29,"102,605262",,,7,1,1,22.7,19.9,1
5842,Špilja kod Zagruda u vinogradu,Croatia,20.4.2019.,2019-04-20,1juv,1,Dysderidae,Folkia,sp. 7,Folkia sp. 7,318,42.966.644,17.322.697,Tb,deep cave,,6,,"10,1","14,96718788","14,96718788","25,8125",871,21,"90,48303976",86,,2.1,0.7,1,18.5,17.6,2.7
5847,Šimunkovića špilja,Croatia,26.4.2019.,2019-04-26,1m,1,Leptonetidae,Barusia,korculana,Barusia korculana,78,42.978.588,17.129.081,tb,deep cave,,7,,15,"14,0666666","14,0666666","24,28125",833,29,"102,605262",,,7,1,1,22.7,19.9,1
5848,Šimunkovića špilja,Croatia,26.4.2019.,2019-04-26,1juv,1,Dysderidae,Folkia,sp. 4,Folkia sp. 4,78,42.978.588,17.129.081,Tb,deep cave,,7,,15,"14,0666666","14,0666666","24,28125",833,29,"102,605262",,,7,1,1,22.7,19.9,1
5851,Pišurka,Croatia,26.4.2019.,2019-04-26,1juv,1,Dysderidae,Folkia,haasi,Folkia haasi,17,42.959.451,17.129.228,Tb,deep cave,,5,,"13,925","14,0666666","14,0666666","24,28125",833,25,"105,2150766","84,833",,6,1.3,1,86,75,32
5852,Pišurka,Croatia,26.4.2019.,2019-04-26,"1m, 3f",4,Leptonetidae,Barusia,korculana,Barusia korculana,17,42.959.451,17.129.228,tb,deep cave,,5,,"13,925","14,0666666","14,0666666","24,28125",833,25,"105,2150766","84,833",,6,1.3,1,86,75,32
5853,Pišurka,Croatia,26.4.2019.,2019-04-26,"1m, 2f, 1juv",4,Leptonetidae,Barusia,korculana,Barusia korculana,17,42.959.451,17.129.228,tb,deep cave,,5,,"13,925","14,0666666","14,0666666","24,28125",833,25,"105,2150766","84,833",,6,1.3,1,86,75,32
5856,Jama iznad Vrulja,Croatia,8.5.2019.,2019-05-08,1juv,1,Agelenidae,Tegenaria,sp.,Tegenaria sp.,25,4.381.234,15.301.095,,,,5,"16,4","16,642","14,70833302","14,70833302","24,91250038",753,32,"248,4265548",91,"89,6",nan,nan,1,nan,nan,nan
5858,Jama iznad Vrulja,Croatia,8.5.2019.,2019-05-08,1f,1,Pholcidae,Holocnemus,pluchei,Holocnemus pluchei,25,4.381.234,15.301.095,tf,deep cave,,5,"16,4","16,642","14,70833302","14,70833302","24,91250038",753,32,"248,4265548",91,"89,6",nan,nan,1,nan,nan,nan
5860,Jama Petra Stijene,Croatia,10.5.2019.,2019-05-10,1f,1,Linyphiidae,Palliduphantes,sp. 11,Palliduphantes sp. 11,35,4.376.621,15.348.457,,,,3,"16,4","15,95","14,99659061","14,99659061","23,85454559",727,26,"242,3524596",89,,,,,,,
5863,Slavuja,Croatia,11.5.2019.,2019-05-11,1f/juv,1,Nemesiidae,Brachythele,sp.,Brachythele sp.,,438.244,15.269.639,,,,1,,"17,6","14,89114571","14,89114571","24,51250076",750,32,"252,1453553",91,,1,0.5,1,29,6,21
5864,Jama pod Velim vrhom,Croatia,10.5.2019.,2019-05-10,1juv,1,Agelenidae,Tegenaria,sp.,Tegenaria sp.,,43.824.798,15.240.798,,,,3,,"16,767","15,02083302","15,02083302","23,89999771",745,28,"255,3346159",94,,0.5,0.7,1,7,4.7,3.5
5865,Zelena jama,Croatia,9.5.2019.,2019-05-09,1f,1,Theridiidae,Pholcomma,gibbum,Pholcomma gibbum,132,43.832.628,15.290.877,Tx,,,8,"14,5",15,"14,89114571","14,89114571","24,51250076",750,32,"249,9812212",94,94,2,5,1,nan,23,19.5
5868,Jama Blitvica,Croatia,10.5.2019.,2019-05-10,7f,7,Linyphiidae,Centromerus,densidentatus sp.n.,Centromerus densidentatus sp.n.,52,43.765.234,15.352.649,,,,2,,"15,7","14,99659061","14,99659061","23,85454559",727,26,"241,8726371",72,,,,,,,
5870,Mala jama pod križem,Croatia,10.5.2019.,2019-05-10,1juv,1,Nemesiidae,Brachythele,sp.,Brachythele sp.,15,43.818.664,15.254.882,,,,2,,"14,25","14,89114571","14,89114571","24,51250076",750,26,"253,6545557",96,,0.5,0.8,1,8.5,5,5
5871,Mala jama pod križem,Croatia,10.5.2019.,2019-05-10,"1m, 1juv",2,Pholcidae,Holocnemus,pluchei,Holocnemus pluchei,15,43.818.664,15.254.882,tf,deep cave,,2,,"14,25","14,89114571","14,89114571","24,51250076",750,26,"253,6545557",96,,0.5,0.8,1,8.5,5,5
5874,Špilja na Tovarnjaku,Croatia,10.5.2019.,2019-05-10,3juv,3,Pholcidae,Pholcus,sp.,Pholcus sp.,,43.838.274,15.239.733,,,,2,,"14,1","14,86666679","14,86666679","24,60000038",764,44,"255,7406135",,,nan,nan,1,nan,nan,nan
5875,Špilja na Tovarnjaku,Croatia,10.5.2019.,2019-05-10,"1f, 1juv",2,Pholcidae,Pholcus,phalangioides,Pholcus phalangioides,,43.838.274,15.239.733,,deep cave,,2,,"14,1","14,86666679","14,86666679","24,60000038",764,44,"255,7406135",,,nan,nan,1,nan,nan,nan
5876,Zelena jama,Croatia,9.5.2019.,2019-05-09,"1f, 1juv",2,Nesticidae,Kryptonesticus,eremita,Kryptonesticus eremita,132,43.832.628,15.290.877,tf,deep cave,,8,"14,5",15,"14,89114571","14,89114571","24,51250076",750,32,"249,9812212",94,94,2,5,1,nan,23,19.5
5925,Špilja kod Stare Sušice,Croatia,22.11.2019.,2019-11-22,"1m, 2f",3,Linyphiidae,Troglohyphantes,croaticus,Troglohyphantes croaticus,723,45.387.689,14.994.379,tb,deep cave,,11,,"7,4","7,502999783","7,502999783","27,42399979",1494,24,"395,0363624","99,65",,2,1,1,nan,414,103
5927,Špilja kod Stare Sušice,Croatia,22.11.2019.,2019-11-22,1f,1,Linyphiidae,Gen.,sp. X,Gen. sp. X,723,45.387.689,14.994.379,,,,11,,"7,4","7,502999783","7,502999783","27,42399979",1494,24,"395,0363624","99,65",,2,1,1,nan,414,103
5928,Špilja kod Stare Sušice,Croatia,22.11.2019.,2019-11-22,1m,1,Linyphiidae,Micrargus,apertus,Micrargus apertus,723,45.387.689,14.994.379,,,,11,,"7,4","7,502999783","7,502999783","27,42399979",1494,24,"395,0363624","99,65",,2,1,1,nan,414,103
5929,Špilja kod Stare Sušice,Croatia,22.11.2019.,2019-11-22,1m,1,Dysderidae,Parastalita,stygia,Parastalita stygia,723,45.387.689,14.994.379,tb,deep cave,,11,,"7,4","7,502999783","7,502999783","27,42399979",1494,24,"395,0363624","99,65",,2,1,1,nan,414,103
5930,Špilja kod Stare Sušice,Croatia,22.11.2019.,2019-11-22,"1m, 1juv",2,Tetragnathidae,Meta,menardi,Meta menardi,723,45.387.689,14.994.379,Tf,deep cave,,11,,"7,4","7,502999783","7,502999783","27,42399979",1494,24,"395,0363624","99,65",,2,1,1,nan,414,103
5931,Špilja kod Stare Sušice,Croatia,22.11.2019.,2019-11-22,"1m, 4f",5,Linyphiidae,Micrargus,apertus,Micrargus apertus,723,45.387.689,14.994.379,,,,11,,"7,4","7,502999783","7,502999783","27,42399979",1494,24,"395,0363624","99,65",,2,1,1,nan,414,103
5932,Špilja kod Stare Sušice,Croatia,22.11.2019.,2019-11-22,1f,1,Linyphiidae,Porrhomma,egeria,Porrhomma egeria,723,45.387.689,14.994.379,,deep cave,,11,,"7,4","7,502999783","7,502999783","27,42399979",1494,24,"395,0363624","99,65",,2,1,1,nan,414,103
5933,Špilja kod Stare Sušice,Croatia,22.11.2019.,2019-11-22,1m,1,Agelenidae,Tegenaria,silvestris,Tegenaria silvestris,723,45.387.689,14.994.379,Tf,deep cave,,11,,"7,4","7,502999783","7,502999783","27,42399979",1494,24,"395,0363624","99,65",,2,1,1,nan,414,103
5934,Špilja kod Stare Sušice,Croatia,22.11.2019.,2019-11-22,"1m, 1f",2,Tetragnathidae,Metellina,merianae,Metellina merianae,723,45.387.689,14.994.379,Tf,deep cave,,11,,"7,4","7,502999783","7,502999783","27,42399979",1494,24,"395,0363624","99,65",,2,1,1,nan,414,103
5935,Špilja kod Stare Sušice,Croatia,22.11.2019.,2019-11-22,1juvm,1,Nesticidae,Nesticus,cellulanus,Nesticus cellulanus,723,45.387.689,14.994.379,tf,deep cave,,11,,"7,4","7,502999783","7,502999783","27,42399979",1494,24,"395,0363624","99,65",,2,1,1,nan,414,103
5936,Špilja kod Stare Sušice,Croatia,22.11.2019.,2019-11-22,"1m, 2f",3,Linyphiidae,Troglohyphantes,croaticus,Troglohyphantes croaticus,723,45.387.689,14.994.379,tb,deep cave,,11,,"7,4","7,502999783","7,502999783","27,42399979",1494,24,"395,0363624","99,65",,2,1,1,nan,414,103
5937,Špilja kod Stare Sušice,Croatia,22.11.2019.,2019-11-22,"2f, 3m",5,Linyphiidae,Micrargus,apertus,Micrargus apertus,723,45.387.689,14.994.379,,,,11,,"7,4","7,502999783","7,502999783","27,42399979",1494,24,"395,0363624","99,65",,2,1,1,nan,414,103
5938,Špilja kod Stare Sušice,Croatia,22.11.2019.,2019-11-22,1f,1,Linyphiidae,Gen.,sp. X,Gen. sp. X,723,45.387.689,14.994.379,,,,11,,"7,4","7,502999783","7,502999783","27,42399979",1494,24,"395,0363624","99,65",,2,1,1,nan,414,103
5940,Špilja kod Stare Sušice,Croatia,22.11.2019.,2019-11-22,1m,1,Agelenidae,Histopona,luxurians,Histopona luxurians,723,45.387.689,14.994.379,tf,deep cave,,11,,"7,4","7,502999783","7,502999783","27,42399979",1494,24,"395,0363624","99,65",,2,1,1,nan,414,103
5945,Podslotinjak,Croatia,8.9.2018.,2018-09-08,"2m, 2juv",4,Nesticidae,Kryptonesticus,eremita,Kryptonesticus eremita,79,43.957.667,15.117.515,tf,deep cave,,1,,15,"14,45087719","14,45087719","25,6210537",803,17,"265,5835446",,,0.8,1.4,1,44.8,30.2,13.9
5946,Podslotinjak,Croatia,8.9.2018.,2018-09-08,1juv,1,Nesticidae,Kryptonesticus,eremita,Kryptonesticus eremita,79,43.957.667,15.117.515,tf,deep cave,,1,,15,"14,45087719","14,45087719","25,6210537",803,17,"265,5835446",,,0.8,1.4,1,44.8,30.2,13.9
5947,Podslotinjak,Croatia,8.9.2018.,2018-09-08,"4f, 4juv",8,Nesticidae,Kryptonesticus,eremita,Kryptonesticus eremita,79,43.957.667,15.117.515,tf,deep cave,,1,,15,"14,45087719","14,45087719","25,6210537",803,17,"265,5835446",,,0.8,1.4,1,44.8,30.2,13.9
5948,Podslotinjak,Croatia,8.9.2018.,2018-09-08,"3f, 3juv, 1 kokon pun jaja",6,Nesticidae,Kryptonesticus,eremita,Kryptonesticus eremita,79,43.957.667,15.117.515,tf,deep cave,,1,,15,"14,45087719","14,45087719","25,6210537",803,17,"265,5835446",,,0.8,1.4,1,44.8,30.2,13.9
5957,Jama kod aviona,Croatia,25.4.2019.,2019-04-25,1m,1,Dysderidae,Harpactea,rucnerorum,Harpactea rucnerorum,638,43.006.192,1.712.592,Tf,deep cave,,5,,"9,8","14,34500027","14,34500027","24,36666679",826,28,"99,0207162",91,,4,2,1,nan,18,48
5958,Jama kod aviona,Croatia,25.4.2019.,2019-04-25,1juv,1,Dysderidae,Stalagtia,hercegovinensis,Stalagtia hercegovinensis,638,43.006.192,1.712.592,tb,deep cave,,5,,"9,8","14,34500027","14,34500027","24,36666679",826,28,"99,0207162",91,,4,2,1,nan,18,48
5959,Jama kod aviona,Croatia,25.4.2019.,2019-04-25,1juv,1,Dysderidae,Stalagtia,hercegovinensis,Stalagtia hercegovinensis,638,43.006.192,1.712.592,tb,deep cave,,5,,"9,8","14,34500027","14,34500027","24,36666679",826,28,"99,0207162",91,,4,2,1,nan,18,48
5960,Jama kod aviona,Croatia,25.4.2019.,2019-04-25,1f,1,Tetragnathidae,Metellina,merianae,Metellina merianae,638,43.006.192,1.712.592,Tf,deep cave,,5,,"9,8","14,34500027","14,34500027","24,36666679",826,28,"99,0207162",91,,4,2,1,nan,18,48
5961,Špilja kod Zagruda u vinogradu,Croatia,20.4.2019.,2019-04-20,1juvm,1,Dysderidae,Stalagtia,hercegovinensis,Stalagtia hercegovinensis,318,42.966.644,17.322.697,tb,deep cave,,6,,"10,1","14,96718788","14,96718788","25,8125",871,21,"90,48303976",86,,2.1,0.7,1,18.5,17.6,2.7
5964,Špilja kod Zagruda u vinogradu,Croatia,20.4.2019.,2019-04-20,"1f, 2f/juv, 4juv",7,Leptonetidae,Barusia,maheni,Barusia maheni,318,42.966.644,17.322.697,tf,deep cave,,6,,"10,1","14,96718788","14,96718788","25,8125",871,21,"90,48303976",86,,2.1,0.7,1,18.5,17.6,2.7
5974,Jama u Priroju,Croatia,24.4.2019.,2019-04-24,"1f, 1juv",2,Dysderidae,Stalagtia,hercegovinensis,Stalagtia hercegovinensis,536,42.989.087,1.723.812,tb,deep cave,,1,,"12,8","15,09411716","15,09411716","25,1764698",853,29,"95,9128395","91,5",,2.5,5,1,145,46.5,124
5976,Jama u Priroju,Croatia,24.4.2019.,2019-04-24,"1f, 1juv",2,Dysderidae,Stalagtia,hercegovinensis,Stalagtia hercegovinensis,536,42.989.087,1.723.812,tb,deep cave,,1,,"12,8","15,09411716","15,09411716","25,1764698",853,29,"95,9128395","91,5",,2.5,5,1,145,46.5,124
5977,Spilja Rupine,Croatia,24.4.2019.,2019-04-24,"2m, 4f",6,Linyphiidae,Typhlonyphia,reimoseri,Typhlonyphia reimoseri,482,4.300.528,17.157.984,tb,deep cave,,6,,"9,1","14,34500027","14,34500027","24,36666679",826,29,"97,54303627",90,,5,3,1,99,93,20
5978,Spilja Rupine,Croatia,24.4.2019.,2019-04-24,"1juv, ostaci",1,Dysderidae,Stalagtia,hercegovinensis,Stalagtia hercegovinensis,482,4.300.528,17.157.984,tb,deep cave,,6,,"9,1","14,34500027","14,34500027","24,36666679",826,29,"97,54303627",90,,5,3,1,99,93,20
5979,Spilja Rupine,Croatia,6.4.2019.,2019-04-06,1f,1,Dysderidae,Stalagtia,hercegovinensis,Stalagtia hercegovinensis,482,4.300.528,17.157.984,tb,deep cave,,6,,"9,1","14,34500027","14,34500027","24,36666679",826,29,"97,54303627",90,,5,3,1,99,93,20
5980,Spilja Rupine,Croatia,6.4.2019.,2019-04-06,1m,1,Pholcidae,Stygopholcus,absoloni,Stygopholcus absoloni,482,4.300.528,17.157.984,,deep cave,,6,,"9,1","14,34500027","14,34500027","24,36666679",826,29,"97,54303627",90,,5,3,1,99,93,20
5981,Spilja Rupine,Croatia,6.4.2019.,2019-04-06,1juv,1,Linyphiidae,Typhlonyphia,reimoseri,Typhlonyphia reimoseri,482,4.300.528,17.157.984,tb,deep cave,,6,,"9,1","14,34500027","14,34500027","24,36666679",826,29,"97,54303627",90,,5,3,1,99,93,20
5982,Spilja Rupine,Croatia,24.4.2019.,2019-04-24,1f,1,Linyphiidae,Centromerus,cavernarum,Centromerus cavernarum,482,4.300.528,17.157.984,Tf,deep cave,,6,,"9,1","14,34500027","14,34500027","24,36666679",826,29,"97,54303627",90,,5,3,1,99,93,20
5983,Spilja Rupine,Croatia,24.4.2019.,2019-04-24,3juv,3,Dysderidae,Stalagtia,hercegovinensis,Stalagtia hercegovinensis,482,4.300.528,17.157.984,tb,deep cave,,6,,"9,1","14,34500027","14,34500027","24,36666679",826,29,"97,54303627",90,,5,3,1,99,93,20
5984,Spilja Rupine,Croatia,24.4.2019.,2019-04-24,"1juvf, 2 juvm",3,Leptonetidae,Barusia,korculana,Barusia korculana,482,4.300.528,17.157.984,tb,deep cave,,6,,"9,1","14,34500027","14,34500027","24,36666679",826,29,"97,54303627",90,,5,3,1,99,93,20
5985,Spilja Rupine,Croatia,24.4.2019.,2019-04-24,"1f, 2juv",3,Linyphiidae,Typhlonyphia,reimoseri,Typhlonyphia reimoseri,482,4.300.528,17.157.984,tb,deep cave,,6,,"9,1","14,34500027","14,34500027","24,36666679",826,29,"97,54303627",90,,5,3,1,99,93,20
5986,Spilja Rupine,Croatia,24.4.2019.,2019-04-24,1f,1,Pholcidae,Stygopholcus,absoloni,Stygopholcus absoloni,482,4.300.528,17.157.984,,deep cave,,6,,"9,1","14,34500027","14,34500027","24,36666679",826,29,"97,54303627",90,,5,3,1,99,93,20
5987,Spilja Rupine,Croatia,24.4.2019.,2019-04-24,1f,1,Linyphiidae,Centromerus,cavernarum,Centromerus cavernarum,482,4.300.528,17.157.984,Tf,deep cave,,6,,"9,1","14,34500027","14,34500027","24,36666679",826,29,"97,54303627",90,,5,3,1,99,93,20
5991,Jama u Grudama,Croatia,6.4.2019.,2019-04-06,1juv,1,Dysderidae,Stalagtia,hercegovinensis,Stalagtia hercegovinensis,310,42.975.192,17.311.348,tb,deep cave,,1,,"9,5","14,96718788","14,96718788","25,8125",871,29,"90,63733934",,,3.6,1.2,1,36,31,10
5993,Jama u Grudama,Croatia,30.4.2019.,2019-04-30,3juv,3,Dysderidae,Stalagtia,hercegovinensis,Stalagtia hercegovinensis,310,42.975.192,17.311.348,tb,deep cave,,1,,"9,5","14,96718788","14,96718788","25,8125",871,29,"90,63733934",,,3.6,1.2,1,36,31,10
5994,Jama u Grudama,Croatia,6.4.2019.,2019-04-06,1juv,1,Dysderidae,Stalagtia,hercegovinensis,Stalagtia hercegovinensis,310,42.975.192,17.311.348,tb,deep cave,,1,,"9,5","14,96718788","14,96718788","25,8125",871,29,"90,63733934",,,3.6,1.2,1,36,31,10
5995,Jama u Grudama,Croatia,23.4.2019.,2019-04-23,2f,2,Dysderidae,Stalagtia,hercegovinensis,Stalagtia hercegovinensis,310,42.975.192,17.311.348,tb,deep cave,,1,,"9,5","14,96718788","14,96718788","25,8125",871,29,"90,63733934",,,3.6,1.2,1,36,31,10
5996,Jama u Grudama,Croatia,24.4.2019.,2019-04-24,2juv,2,Dysderidae,Stalagtia,hercegovinensis,Stalagtia hercegovinensis,310,42.975.192,17.311.348,tb,deep cave,,1,,"9,5","14,96718788","14,96718788","25,8125",871,29,"90,63733934",,,3.6,1.2,1,36,31,10
5998,Jama u Grudama,Croatia,23.4.2019.,2019-04-23,"1f, 5juv",6,Dysderidae,Stalagtia,hercegovinensis,Stalagtia hercegovinensis,310,42.975.192,17.311.348,tb,deep cave,,1,,"9,5","14,96718788","14,96718788","25,8125",871,29,"90,63733934",,,3.6,1.2,1,36,31,10
6003,Bijelo jezero,Croatia,27.4.2019.,2019-04-27,"1m, 5f, 7juv",13,Leptonetidae,Sulcia,sp. 13,Sulcia sp. 13,339,42.846.912,17.636.744,,deep cave,,2,,"12,75","15,42681122","15,42681122","25,8217392",988,29,"83,43442669",93,,2,1.5,1,21,21,1
6006,Bijelo jezero,Croatia,29.3.2019.,2019-03-29,1f,1,Dysderidae,Harpactea,rucnerorum,Harpactea rucnerorum,339,42.846.912,17.636.744,Tf,deep cave,,2,,"12,75","15,42681122","15,42681122","25,8217392",988,29,"83,43442669",93,,2,1.5,1,21,21,1
6007,Bijelo jezero,Croatia,29.3.2019.,2019-03-29,"2m, 2f, 2juvm, 8 juv",14,Leptonetidae,Sulcia,sp. 13,Sulcia sp. 13,339,42.846.912,17.636.744,,deep cave,,2,,"12,75","15,42681122","15,42681122","25,8217392",988,29,"83,43442669",93,,2,1.5,1,21,21,1
6021,Zanka,Croatia,25.11.2019.,2019-11-25,1f,1,Dysderidae,Mesostalita,sp. 2,Mesostalita sp. 2,38,43.843.734,15.257.838,Tb,deep cave,,1,,"16,225","14,68125057","14,68125057","24,75",763,32,"253,868566","92,5",,0.5,0.7,1,34,10,30
6022,Jama u Potkalaču,Croatia,22.4.2019.,2019-04-22,"2f, 1m",3,Leptonetidae,Barusia,maheni,Barusia maheni,145,43.010.954,17.207.539,tf,deep cave,,1,"12,8","12,8","15,00798607","15,00798607","24,76666641",840,21,"94,4833398",,,0.7,0.6,1,7.3,5,4.6
6024,Spilja Rupine,Croatia,24.4.2019.,2019-04-24,1juv,1,Dysderidae,Stalagtia,hercegovinensis,Stalagtia hercegovinensis,482,4.300.528,17.157.984,tb,deep cave,,6,,"9,1","14,34500027","14,34500027","24,36666679",826,29,"97,54303627",90,,5,3,1,99,93,20
6025,Spilja Rupine,Croatia,24.4.2019.,2019-04-24,1f,1,Linyphiidae,Typhlonyphia,reimoseri,Typhlonyphia reimoseri,482,4.300.528,17.157.984,tb,deep cave,,6,,"9,1","14,34500027","14,34500027","24,36666679",826,29,"97,54303627",90,,5,3,1,99,93,20
6029,Spilja poviše Lemiša,Croatia,27.4.2019.,2019-04-27,"2m, 3f",5,Leptonetidae,Barusia,korculana,Barusia korculana,414,43.007.271,17.159.428,tb,deep cave,,1,,13,"14,34500027","14,34500027","24,36666679",826,29,"97,20022597",,,7,1,1,12,12,0
6031,Tomasova spilja,Croatia,5.4.2019.,2019-04-05,"1m, 3f, 2juvm, 2juv",8,Leptonetidae,Barusia,korculana,Barusia korculana,132,43.014.202,1.716.548,tb,deep cave,,3,,"12,25","14,34500027","14,34500027","24,36666679",826,17,"95,95739872","84,667",,8,2,1,nan,41,3
6032,Tomasova spilja,Croatia,5.4.2019.,2019-04-05,"1f, 1juv",2,Tetragnathidae,Gen.,sp.,Gen. sp.,132,43.014.202,1.716.548,,,,3,,"12,25","14,34500027","14,34500027","24,36666679",826,17,"95,95739872","84,667",,8,2,1,nan,41,3
6033,Nakovana spila,Croatia,30.4.2019.,2019-04-30,3juv,3,Dysderidae,Stalagtia,hercegovinensis,Stalagtia hercegovinensis,324,43.005.018,17.091.068,tb,deep cave,,4,,"13,3","14,54694462","14,54694462","24,21999931",807,29,"101,0327345",92,,,,,,,
6038,Špilja u Privoru,Croatia,26.3.2019.,2019-03-26,1m,1,Pholcidae,Stygopholcus,absoloni,Stygopholcus absoloni,199,43.009.238,17.213.289,,deep cave,,2,12,"12,2","15,45625019","15,45625019","25,47999954",849,21,"94,47715157","79,5",72,0.5,0.5,1,13.2,10,6.7
6040,Kameni kolačić,Croatia,28.3.2019.,2019-03-28,"1f, 2uv",3,Agelenidae,Gen.,sp.,Gen. sp.,260,42.873.066,17.466.385,,,,5,"8,7","8,7","15,3509264","15,3509264","24,91110992",913,24,"89,85179444",,,,,,,,
6041,Kameni kolačić,Croatia,28.3.2019.,2019-03-28,2juv,2,Dysderidae,Stalagtia,hercegovinensis,Stalagtia hercegovinensis,260,42.873.066,17.466.385,tb,deep cave,,5,"8,7","8,7","15,3509264","15,3509264","24,91110992",913,24,"89,85179444",,,,,,,,
6043,Špilja Lysvulpen,Croatia,27.3.2019.,2019-03-27,6f,6,Linyphiidae,Centromerus,cavernarum,Centromerus cavernarum,482,43.006.205,17.157.652,Tf,deep cave,,2,,"11,7","14,34500027","14,34500027","24,36666679",826,29,"97,43225038",100,,4,2,1,23.5,20.9,4.2
6045,Špilja Lysvulpen,Croatia,27.3.2019.,2019-03-27,"3m, 6f, 3juv",12,Leptonetidae,Barusia,korculana,Barusia korculana,482,43.006.205,17.157.652,tb,deep cave,,2,,"11,7","14,34500027","14,34500027","24,36666679",826,29,"97,43225038",100,,4,2,1,23.5,20.9,4.2
6047,Na-kovana jama,Croatia,27.4.2019.,2019-04-27,3juv,3,Dysderidae,Stalagtia,hercegovinensis,Stalagtia hercegovinensis,285,42.998.503,17.087.653,tb,deep cave,,3,,"14,2","15,52812481","15,52812481","24,47499847",803,29,"102,0831363","99,8",,0.5,1,1,39,15,32.5
6048,Na-kovana jama,Croatia,27.4.2019.,2019-04-27,2f,2,Linyphiidae,Centromerus,raridentatus sp.n.,Centromerus raridentatus sp.n.,285,42.998.503,17.087.653,,,,3,,"14,2","15,52812481","15,52812481","24,47499847",803,29,"102,0831363","99,8",,0.5,1,1,39,15,32.5
6051,Špilja u Bilopolju 2,Croatia,29.4.2019.,2019-04-29,"1f, 3juv",4,Pholcidae,Spermophora,senoculata,Spermophora senoculata,127,42.977.917,1.714.156,Tf,deep cave,,3,,"15,4","14,0666666","14,0666666","24,28125",833,24,"102,088399",69,,4,2.7,1,24,20,10
6053,Špilja Lysvulpen,Croatia,27.3.2019.,2019-03-27,"1f, 1juv",2,Linyphiidae,Centromerus,cavernarum,Centromerus cavernarum,482,43.006.205,17.157.652,Tf,deep cave,,2,,"11,7","14,34500027","14,34500027","24,36666679",826,29,"97,43225038",100,,4,2,1,23.5,20.9,4.2
6056,Špilja u Bilopolju 2,Croatia,,,"1m, 1f, 6 juv",8,Pholcidae,Pholcus,phalangioides,Pholcus phalangioides,127,42.977.917,1.714.156,,deep cave,,3,,"15,4","14,0666666","14,0666666","24,28125",833,24,"102,088399",69,,4,2.7,1,24,20,10
6059,Tomasova spilja,Croatia,21.4.2019.,2019-04-21,"2f, 2juv",4,Leptonetidae,Barusia,korculana,Barusia korculana,132,43.014.202,1.716.548,tb,deep cave,,3,,"12,25","14,34500027","14,34500027","24,36666679",826,17,"95,95739872","84,667",,8,2,1,nan,41,3
6061,Tomasova spilja,Croatia,21.4.2019.,2019-04-21,1juv,1,Dysderidae,Folkia,sp. 4,Folkia sp. 4,132,43.014.202,1.716.548,Tb,deep cave,,3,,"12,25","14,34500027","14,34500027","24,36666679",826,17,"95,95739872","84,667",,8,2,1,nan,41,3
6064,Tomasova spilja,Croatia,5.4.2019.,2019-04-05,"1f, 1m, 3juv",5,Leptonetidae,Barusia,korculana,Barusia korculana,132,43.014.202,1.716.548,tb,deep cave,,3,,"12,25","14,34500027","14,34500027","24,36666679",826,17,"95,95739872","84,667",,8,2,1,nan,41,3
6065,Show jama,Croatia,25.4.2019.,2019-04-25,1juv,1,Nesticidae,Kryptonesticus,sp. 1,Kryptonesticus sp. 1,655,43.006.894,17.134.141,Tb,deep cave,,3,,10,"14,34500027","14,34500027","24,36666679",826,29,"98,50486218",,,1,2,1,nan,19,17
6069,Na-kovana jama,Croatia,27.4.2019.,2019-04-27,1juv,1,Dysderidae,Stalagtia,hercegovinensis,Stalagtia hercegovinensis,285,42.998.503,17.087.653,tb,deep cave,,3,,"14,2","15,52812481","15,52812481","24,47499847",803,29,"102,0831363","99,8",,0.5,1,1,39,15,32.5
6070,Jama u Pisanom dolcu,Croatia,29.3.2019.,2019-03-29,1juv,1,Dysderidae,Stalagtia,hercegovinensis,Stalagtia hercegovinensis,426,42.860.163,17.614.272,tb,deep cave,,4,,"12,5","15,21433353","15,21433353","25,82799911",967,29,"82,85906223","93,667",,1,0.5,1,52,19,25
6071,Jasenova glavica,Croatia,31.3.2019.,2019-03-31,1f,1,Agelenidae,Tegenaria,sp. X,Tegenaria sp. X,337,4.287.998,1.754.427,,,,4,,12,"15,32770824","15,32770824","25,97500038",952,21,"84,08870877",,,2.5,1.5,1,16.7,8,13.7
6072,Jasenova glavica,Croatia,31.3.2019.,2019-03-31,1m,1,Amaurobidae,Amaurobius,erberi,Amaurobius erberi,337,4.287.998,1.754.427,Tx,deep cave,,4,,12,"15,32770824","15,32770824","25,97500038",952,21,"84,08870877",,,2.5,1.5,1,16.7,8,13.7
6073,Jama u Kučinama,Croatia,29.3.2019.,2019-03-29,1f,1,Agelenidae,Inermocoelotes,gasperinii,Inermocoelotes gasperinii,340,42.862.079,17.627.355,,,,4,"6,6","8,6","15,42681122","15,42681122","25,8217392",988,29,"81,89482682",,,3,1.8,1,nan,22,11.5
6076,Špilja u Žarmi,Croatia,28.4.2019.,2019-04-28,1f,1,Dysderidae,Stalagtia,hercegovinensis,Stalagtia hercegovinensis,40,42.935.427,1.743.822,tb,deep cave,,7,"13,05","13,05","16,30899048","16,30899048","26,72631454",906,21,"84,49485396","87,3","87,3",3,3,1,28,22,9.5
6078,Kameni kolačić,Croatia,28.3.2019.,2019-03-28,2juv,2,Dysderidae,Stalagtia,hercegovinensis,Stalagtia hercegovinensis,260,42.873.066,17.466.385,tb,deep cave,,5,"8,7","8,7","15,3509264","15,3509264","24,91110992",913,24,"89,85179444",,,,,,,,
6080,Šimunkovića špilja,Croatia,29.4.2019.,2019-04-29,"1f, 2juvm",3,Nesticidae,Kryptonesticus,eremita,Kryptonesticus eremita,78,42.978.588,17.129.081,tf,deep cave,,7,,15,"14,0666666","14,0666666","24,28125",833,29,"102,605262",,,7,1,1,22.7,19.9,1
6083,Nakovana spila,Croatia,30.4.2019.,2019-04-30,1juv,1,Dysderidae,Stalagtia,hercegovinensis,Stalagtia hercegovinensis,324,43.005.018,17.091.068,tb,deep cave,,4,,"13,3","14,54694462","14,54694462","24,21999931",807,29,"101,0327345",92,,,,,,,
6084,Nakovana spila,Croatia,30.4.2019.,2019-04-30,1juv,1,Agelenidae,Tegenaria,sp.,Tegenaria sp.,324,43.005.018,17.091.068,,,,4,,"13,3","14,54694462","14,54694462","24,21999931",807,29,"101,0327345",92,,,,,,,
6085,Nakovana spila,Croatia,30.4.2019.,2019-04-30,"3m, 8 females/juv",11,Leptonetidae,Barusia,korculana,Barusia korculana,324,43.005.018,17.091.068,tb,deep cave,,4,,"13,3","14,54694462","14,54694462","24,21999931",807,29,"101,0327345",92,,,,,,,
6086,Nakovana spila,Croatia,30.4.2019.,2019-04-30,1juv,1,Linyphiidae,Typhlonyphia,reimoseri,Typhlonyphia reimoseri,324,43.005.018,17.091.068,tb,deep cave,,4,,"13,3","14,54694462","14,54694462","24,21999931",807,29,"101,0327345",92,,,,,,,
6089,Male ponte,Croatia,27.9.2019.,2019-09-27,"1juvm, 3juv",4,Agelenidae,Histopona,bidens,Histopona bidens,258,42.761.389,17.430.786,tb,deep cave,,7,,"14,45","16,10370445","16,10370445","23,88333321",874,29,"106,0560518",100,,1,1.5,1,nan,106,28.8
6090,Male ponte,Croatia,27.9.2019.,2019-09-27,2juv,2,Dysderidae,Folkia,sp. 5,Folkia sp. 5,258,42.761.389,17.430.786,Tb,deep cave,,7,,"14,45","16,10370445","16,10370445","23,88333321",874,29,"106,0560518",100,,1,1.5,1,nan,106,28.8
6092,Špilja kod Nerezinog dola,Croatia,27.9.2019.,2019-09-27,4juv,4,Dysderidae,Folkia,inermis,Folkia inermis,177,42.758.378,17.436.094,tb,deep cave,,6,,"13,883","16,10370445","16,10370445","23,88333321",874,24,"106,1225494","95,342",,6,2.5,1,nan,35,5.5
6093,Špilja za Gromačkom vlakom,Croatia,13.2.2019.,2019-02-13,1f,1,Dysderidae,Dysdera,sp.,Dysdera sp.,630,42.743.509,18.027.359,Tx,,,15,,"13,378","14,54366684","14,54366684","24,62399864",1130,29,"87,19003096",,,2,3,1,2439,2204,220
6094,Jama pod Gažnovcem,Croatia,31.3.2018.,2018-03-31,"1f, 1 juv",2,Dysderidae,Harpactea,sp. 2,Harpactea sp. 2,590,43.229.672,17.314.159,Tb,deep cave,,8,,"11,6","12,67833328","12,67833328","26,74400139",940,23,"59,1740747","99,2",,0.6,1,1,45,41,3.5
6095,Jama pod Gažnovcem,Croatia,31.3.2018.,2018-03-31,"1f/juv, 4 juv",5,Dysderidae,Stalagtia,sp. 4,Stalagtia sp. 4,590,43.229.672,17.314.159,Tb,deep cave,,8,,"11,6","12,67833328","12,67833328","26,74400139",940,23,"59,1740747","99,2",,0.6,1,1,45,41,3.5
6096,Jama pod Gažnovcem,Croatia,31.3.2018.,2018-03-31,1juv,1,Agelenidae,Histopona,sp.,Histopona sp.,590,43.229.672,17.314.159,,,,8,,"11,6","12,67833328","12,67833328","26,74400139",940,23,"59,1740747","99,2",,0.6,1,1,45,41,3.5
6098,Jama pod Gažnovcem,Croatia,31.3.2018.,2018-03-31,2f,2,Linyphiidae,Centromerus,cavernarum,Centromerus cavernarum,590,43.229.672,17.314.159,Tf,deep cave,,8,,"11,6","12,67833328","12,67833328","26,74400139",940,23,"59,1740747","99,2",,0.6,1,1,45,41,3.5
6099,Jama pod Gažnovcem,Croatia,31.3.2018.,2018-03-31,1f,1,Linyphiidae,Palliduphantes,spelaeorum,Palliduphantes spelaeorum,590,43.229.672,17.314.159,Tf,deep cave,,8,,"11,6","12,67833328","12,67833328","26,74400139",940,23,"59,1740747","99,2",,0.6,1,1,45,41,3.5
6100,Jama pod Gažnovcem,Croatia,31.3.2018.,2018-03-31,2juv,2,Dysderidae,Stalagtia,sp. 4,Stalagtia sp. 4,590,43.229.672,17.314.159,Tb,deep cave,,8,,"11,6","12,67833328","12,67833328","26,74400139",940,23,"59,1740747","99,2",,0.6,1,1,45,41,3.5
6101,Jama pod Gažnovcem,Croatia,31.3.2018.,2018-03-31,3juv,3,Dysderidae,Stalagtia,sp. 4,Stalagtia sp. 4,590,43.229.672,17.314.159,Tb,deep cave,,8,,"11,6","12,67833328","12,67833328","26,74400139",940,23,"59,1740747","99,2",,0.6,1,1,45,41,3.5
6115,Golubinka,Croatia,29.10.2019.,2019-10-29,1juv,1,Dysderidae,Stalagtia,sp. 4_1,Stalagtia sp. 4_1,320,4.296.651,17.619.912,Tb,deep cave,,3,,"10,1","16,22516632","16,22516632","27,9640007",984,32,"68,47069306",,,8,3.7,1,96,18,85
6116,Golubinka,Croatia,29.10.2019.,2019-10-29,2m,2,Linyphiidae,Palliduphantes,spelaeorum,Palliduphantes spelaeorum,320,4.296.651,17.619.912,Tf,deep cave,,3,,"10,1","16,22516632","16,22516632","27,9640007",984,32,"68,47069306",,,8,3.7,1,96,18,85
6117,Golubinka,Croatia,29.10.2019.,2019-10-29,1m,1,Linyphiidae,Centromerus,cavernarum,Centromerus cavernarum,320,4.296.651,17.619.912,Tf,deep cave,,3,,"10,1","16,22516632","16,22516632","27,9640007",984,32,"68,47069306",,,8,3.7,1,96,18,85
6118,Mandina jama,Croatia,2.5.2019.,2019-05-02,2juv,2,Dysderidae,Stalagtia,sp. 4,Stalagtia sp. 4,66,43.083.116,17.606.299,Tb,deep cave,,5,,"12,3","16,30433273","16,30433273","28,61999893",999,23,"55,28020586",100,,3.2,1.6,1,45,13,35
6131,Poskokova jama,Croatia,25.4.2019.,2019-04-25,"1m, 2juv/f",3,Leptonetidae,Barusia,korculana,Barusia korculana,655,43.001.888,17.134.002,tb,deep cave,,4,,"12,3","14,34500027","14,34500027","24,36666679",826,28,"99,19045362",94,,1,0.5,1,nan,20,19
6132,Poskokova jama,Croatia,25.4.2019.,2019-04-25,1m,1,Linyphiidae,Typhlonyphia,reimoseri,Typhlonyphia reimoseri,655,43.001.888,17.134.002,tb,deep cave,,4,,"12,3","14,34500027","14,34500027","24,36666679",826,28,"99,19045362",94,,1,0.5,1,nan,20,19
6133,Poskokova jama,Croatia,25.4.2019.,2019-04-25,"1f, 1juvm",2,Nesticidae,Kryptonesticus,sp. 1,Kryptonesticus sp. 1,655,43.001.888,17.134.002,Tb,deep cave,,4,,"12,3","14,34500027","14,34500027","24,36666679",826,28,"99,19045362",94,,1,0.5,1,nan,20,19
6134,Poskokova jama,Croatia,25.4.2019.,2019-04-25,"2m, 1 juv",3,Linyphiidae,Typhlonyphia,reimoseri,Typhlonyphia reimoseri,655,43.001.888,17.134.002,tb,deep cave,,4,,"12,3","14,34500027","14,34500027","24,36666679",826,28,"99,19045362",94,,1,0.5,1,nan,20,19
6140,Show jama,Croatia,25.4.2019.,2019-04-25,5juv,5,Nesticidae,Kryptonesticus,sp. 1,Kryptonesticus sp. 1,655,43.006.894,17.134.141,Tb,deep cave,,3,,10,"14,34500027","14,34500027","24,36666679",826,29,"98,50486218",,,1,2,1,nan,19,17
6142,Show jama,Croatia,25.4.2019.,2019-04-25,1juv,1,Dysderidae,Stalagtia,hercegovinensis,Stalagtia hercegovinensis,655,43.006.894,17.134.141,tb,deep cave,,3,,10,"14,34500027","14,34500027","24,36666679",826,29,"98,50486218",,,1,2,1,nan,19,17
6143,Show jama,Croatia,25.4.2019.,2019-04-25,1f,1,Linyphiidae,Centromerus,cavernarum,Centromerus cavernarum,655,43.006.894,17.134.141,Tf,deep cave,,3,,10,"14,34500027","14,34500027","24,36666679",826,29,"98,50486218",,,1,2,1,nan,19,17
6145,Nakovana spila,Croatia,24.4.2019.,2019-04-24,2juv,2,Dysderidae,Stalagtia,hercegovinensis,Stalagtia hercegovinensis,324,43.005.018,17.091.068,tb,deep cave,,4,,"13,3","14,54694462","14,54694462","24,21999931",807,29,"101,0327345",92,,,,,,,
6146,Nakovana spila,Croatia,30.4.2019.,2019-04-30,2juv,2,Dysderidae,Stalagtia,hercegovinensis,Stalagtia hercegovinensis,324,43.005.018,17.091.068,tb,deep cave,,4,,"13,3","14,54694462","14,54694462","24,21999931",807,29,"101,0327345",92,,,,,,,
6148,Jama u Grudama,Croatia,30.4.2019.,2019-04-30,1juv,1,Dysderidae,Stalagtia,hercegovinensis,Stalagtia hercegovinensis,310,42.975.192,17.311.348,tb,deep cave,,1,,"9,5","14,96718788","14,96718788","25,8125",871,29,"90,63733934",,,3.6,1.2,1,36,31,10
6149,Kameni kolačić,Croatia,5.4.2019.,2019-04-05,1f/juv,1,Dysderidae,Stalagtia,hercegovinensis,Stalagtia hercegovinensis,260,42.873.066,17.466.385,tb,deep cave,,5,"8,7","8,7","15,3509264","15,3509264","24,91110992",913,24,"89,85179444",,,,,,,,
6150,Kameni kolačić,Croatia,5.4.2019.,2019-04-05,2f,2,Linyphiidae,Palliduphantes,spelaeorum,Palliduphantes spelaeorum,260,42.873.066,17.466.385,Tf,deep cave,,5,"8,7","8,7","15,3509264","15,3509264","24,91110992",913,24,"89,85179444",,,,,,,,
6153,Špilja Marije Ferenčine,Croatia,20.4.2019.,2019-04-20,1f,1,Linyphiidae,Centromerus,densidentatus sp.n.,Centromerus densidentatus sp.n.,49,4.300.374,17.275.104,,,,1,,"12,2","15,92416668","15,92416668","26,05999947",861,25,"91,25969486",,,2.5,1,1,6,6,0.8
6156,Jama u Grudama,Croatia,23.4.2019.,2019-04-23,1juvm,1,Dysderidae,Stalagtia,hercegovinensis,Stalagtia hercegovinensis,310,42.975.192,17.311.348,tb,deep cave,,1,,"9,5","14,96718788","14,96718788","25,8125",871,29,"90,63733934",,,3.6,1.2,1,36,31,10
6158,Špilja Lysvulpen,Croatia,27.3.2019.,2019-03-27,1f,1,Linyphiidae,Centromerus,cavernarum,Centromerus cavernarum,482,43.006.205,17.157.652,Tf,deep cave,,2,,"11,7","14,34500027","14,34500027","24,36666679",826,29,"97,43225038",100,,4,2,1,23.5,20.9,4.2
6160,Kameni kolačić,Croatia,28.3.2019.,2019-03-28,1f,1,Agelenidae,Tegenaria,sp. X,Tegenaria sp. X,260,42.873.066,17.466.385,,,,5,"8,7","8,7","15,3509264","15,3509264","24,91110992",913,24,"89,85179444",,,,,,,,
6161,Kameni kolačić,Croatia,28.3.2019.,2019-03-28,1f,1,Pholcidae,Stygopholcus,absoloni,Stygopholcus absoloni,260,42.873.066,17.466.385,,deep cave,,5,"8,7","8,7","15,3509264","15,3509264","24,91110992",913,24,"89,85179444",,,,,,,,
6162,Vučja jama,Croatia,23.4.2019.,2019-04-23,1juv,1,Dysderidae,Stalagtia,hercegovinensis,Stalagtia hercegovinensis,343,42.995.994,17.239.826,tb,deep cave,,3,,"10,7","15,09411716","15,09411716","25,1764698",853,28,"95,1615175",,,5,10,1,26,21,15
6163,Vučja jama,Croatia,23.4.2019.,2019-04-23,2juv,2,Agelenidae,Tegenaria,sp.,Tegenaria sp.,343,42.995.994,17.239.826,,,,3,,"10,7","15,09411716","15,09411716","25,1764698",853,28,"95,1615175",,,5,10,1,26,21,15
6165,Vučja jama,Croatia,23.4.2019.,2019-04-23,2juv,2,Scytodidae,Scytodes,thoracica,Scytodes thoracica,343,42.995.994,17.239.826,Tx,,,3,,"10,7","15,09411716","15,09411716","25,1764698",853,28,"95,1615175",,,5,10,1,26,21,15
6166,Na-kovana jama,Croatia,27.4.2019.,2019-04-27,2juv,2,Dysderidae,Stalagtia,hercegovinensis,Stalagtia hercegovinensis,285,42.998.503,17.087.653,tb,deep cave,,3,,"14,2","15,52812481","15,52812481","24,47499847",803,29,"102,0831363","99,8",,0.5,1,1,39,15,32.5
6167,Na-kovana jama,Croatia,27.4.2019.,2019-04-27,1f,1,Agelenidae,Tegenaria,sp. X,Tegenaria sp. X,285,42.998.503,17.087.653,,,,3,,"14,2","15,52812481","15,52812481","24,47499847",803,29,"102,0831363","99,8",,0.5,1,1,39,15,32.5
6168,Bijelo jezero,Croatia,27.4.2019.,2019-04-27,3f/juv,3,Leptonetidae,Sulcia,sp. 13,Sulcia sp. 13,339,42.846.912,17.636.744,,deep cave,,2,,"12,75","15,42681122","15,42681122","25,8217392",988,29,"83,43442669",93,,2,1.5,1,21,21,1
6169,Bijelo jezero,Croatia,29.3.2019.,2019-03-29,1juv,1,Leptonetidae,Sulcia,sp. 13,Sulcia sp. 13,339,42.846.912,17.636.744,,deep cave,,2,,"12,75","15,42681122","15,42681122","25,8217392",988,29,"83,43442669",93,,2,1.5,1,21,21,1
6178,Jasenova glavica,Croatia,31.3.2019.,2019-03-31,"1f, 1juv",2,Tetragnathidae,Meta,bourneti,Meta bourneti,337,4.287.998,1.754.427,Tf,deep cave,,4,,12,"15,32770824","15,32770824","25,97500038",952,21,"84,08870877",,,2.5,1.5,1,16.7,8,13.7
6179,Jasenova glavica,Croatia,31.3.2019.,2019-03-31,1f,1,Tetragnathidae,Metellina,merianae,Metellina merianae,337,4.287.998,1.754.427,Tf,deep cave,,4,,12,"15,32770824","15,32770824","25,97500038",952,21,"84,08870877",,,2.5,1.5,1,16.7,8,13.7
6180,Jama više vodospreme,Croatia,23.4.2019.,2019-04-23,1m,1,Leptonetidae,Barusia,maheni,Barusia maheni,288,42.979.411,17.296.037,tf,deep cave,,2,,13,"14,96718788","14,96718788","25,8125",871,29,"91,5790755",87,,0.5,1.2,1,19.6,11.3,13.3
6185,Jama u Pisanom dolcu,Croatia,29.3.2019.,2019-03-29,1juv,1,Dysderidae,Stalagtia,hercegovinensis,Stalagtia hercegovinensis,426,42.860.163,17.614.272,tb,deep cave,,4,,"12,5","15,21433353","15,21433353","25,82799911",967,29,"82,85906223","93,667",,1,0.5,1,52,19,25
6187,Jama u Pisanom dolcu,Croatia,27.4.2019.,2019-04-27,"2f, 1juv",3,Dysderidae,Stalagtia,hercegovinensis,Stalagtia hercegovinensis,426,42.860.163,17.614.272,tb,deep cave,,4,,"12,5","15,21433353","15,21433353","25,82799911",967,29,"82,85906223","93,667",,1,0.5,1,52,19,25
6188,Spilja Rupine,Croatia,6.4.2019.,2019-04-06,1juv,1,Linyphiidae,Typhlonyphia,reimoseri,Typhlonyphia reimoseri,482,4.300.528,17.157.984,tb,deep cave,,6,,"9,1","14,34500027","14,34500027","24,36666679",826,29,"97,54303627",90,,5,3,1,99,93,20
6189,Spilja Rupine,Croatia,6.4.2019.,2019-04-06,1f,1,Tetragnathidae,Metellina,merianae,Metellina merianae,482,4.300.528,17.157.984,Tf,deep cave,,6,,"9,1","14,34500027","14,34500027","24,36666679",826,29,"97,54303627",90,,5,3,1,99,93,20
6190,Spilja Rupine,Croatia,27.3.2019.,2019-03-27,2juv,2,Dysderidae,Stalagtia,hercegovinensis,Stalagtia hercegovinensis,482,4.300.528,17.157.984,tb,deep cave,,6,,"9,1","14,34500027","14,34500027","24,36666679",826,29,"97,54303627",90,,5,3,1,99,93,20
6191,Spilja Rupine,Croatia,24.4.2019.,2019-04-24,1f,1,Linyphiidae,Typhlonyphia,reimoseri,Typhlonyphia reimoseri,482,4.300.528,17.157.984,tb,deep cave,,6,,"9,1","14,34500027","14,34500027","24,36666679",826,29,"97,54303627",90,,5,3,1,99,93,20
6192,Spilja Rupine,Croatia,27.3.2019.,2019-03-27,"2f, 2juv",4,Linyphiidae,Centromerus,cavernarum,Centromerus cavernarum,482,4.300.528,17.157.984,Tf,deep cave,,6,,"9,1","14,34500027","14,34500027","24,36666679",826,29,"97,54303627",90,,5,3,1,99,93,20
6193,Spilja Rupine,Croatia,27.3.2019.,2019-03-27,"4f, 1m, 1juv",6,Linyphiidae,Typhlonyphia,reimoseri,Typhlonyphia reimoseri,482,4.300.528,17.157.984,tb,deep cave,,6,,"9,1","14,34500027","14,34500027","24,36666679",826,29,"97,54303627",90,,5,3,1,99,93,20
6194,Spilja Rupine,Croatia,24.4.2019.,2019-04-24,4juv,4,Linyphiidae,Typhlonyphia,reimoseri,Typhlonyphia reimoseri,482,4.300.528,17.157.984,tb,deep cave,,6,,"9,1","14,34500027","14,34500027","24,36666679",826,29,"97,54303627",90,,5,3,1,99,93,20
6195,Spilja Rupine,Croatia,24.4.2019.,2019-04-24,"1m, 1f",2,Leptonetidae,Barusia,korculana,Barusia korculana,482,4.300.528,17.157.984,tb,deep cave,,6,,"9,1","14,34500027","14,34500027","24,36666679",826,29,"97,54303627",90,,5,3,1,99,93,20
6196,Spilja Rupine,Croatia,24.4.2019.,2019-04-24,2juv,2,Dysderidae,Stalagtia,hercegovinensis,Stalagtia hercegovinensis,482,4.300.528,17.157.984,tb,deep cave,,6,,"9,1","14,34500027","14,34500027","24,36666679",826,29,"97,54303627",90,,5,3,1,99,93,20
6197,Spilja Rupine,Croatia,24.4.2019.,2019-04-24,1m,1,Pholcidae,Stygopholcus,absoloni,Stygopholcus absoloni,482,4.300.528,17.157.984,,deep cave,,6,,"9,1","14,34500027","14,34500027","24,36666679",826,29,"97,54303627",90,,5,3,1,99,93,20
6203,Jama u Kučinama,Croatia,29.3.2019.,2019-03-29,1f,1,Dysderidae,Stalagtia,hercegovinensis,Stalagtia hercegovinensis,340,42.862.079,17.627.355,tb,deep cave,,4,"6,6","8,6","15,42681122","15,42681122","25,8217392",988,29,"81,89482682",,,3,1.8,1,nan,22,11.5
6204,Jama u Kučinama,Croatia,29.3.2019.,2019-03-29,"1juvm, 1juv",2,Dysderidae,Stalagtia,hercegovinensis,Stalagtia hercegovinensis,340,42.862.079,17.627.355,tb,deep cave,,4,"6,6","8,6","15,42681122","15,42681122","25,8217392",988,29,"81,89482682",,,3,1.8,1,nan,22,11.5
6207,Šimunkovića špilja,Croatia,26.4.2019.,2019-04-26,"2m, 2f, 1juv",5,Leptonetidae,Barusia,korculana,Barusia korculana,78,42.978.588,17.129.081,tb,deep cave,,7,,15,"14,0666666","14,0666666","24,28125",833,29,"102,605262",,,7,1,1,22.7,19.9,1
6208,Šimunkovića špilja,Croatia,26.4.2019.,2019-04-26,"1m, 2f, 1juvm, 4 juv",8,Leptonetidae,Barusia,korculana,Barusia korculana,78,42.978.588,17.129.081,tb,deep cave,,7,,15,"14,0666666","14,0666666","24,28125",833,29,"102,605262",,,7,1,1,22.7,19.9,1
6210,Šimunkovića špilja,Croatia,26.4.2019.,2019-04-26,"2m, 4juv",6,Leptonetidae,Barusia,korculana,Barusia korculana,78,42.978.588,17.129.081,tb,deep cave,,7,,15,"14,0666666","14,0666666","24,28125",833,29,"102,605262",,,7,1,1,22.7,19.9,1
6212,Špilja u Privoru,Croatia,26.3.2019.,2019-03-26,1f,1,Scytodidae,Scytodes,thoracica,Scytodes thoracica,199,43.009.238,17.213.289,Tx,,,2,12,"12,2","15,45625019","15,45625019","25,47999954",849,21,"94,47715157","79,5",72,0.5,0.5,1,13.2,10,6.7
6213,Jama u Priroju,Croatia,24.4.2019.,2019-04-24,2juv,2,Dysderidae,Stalagtia,hercegovinensis,Stalagtia hercegovinensis,536,42.989.087,1.723.812,tb,deep cave,,1,,"12,8","15,09411716","15,09411716","25,1764698",853,29,"95,9128395","91,5",,2.5,5,1,145,46.5,124
6216,Jama u Priroju,Croatia,25.4.2019.,2019-04-25,1f,1,Dysderidae,Stalagtia,hercegovinensis,Stalagtia hercegovinensis,536,42.989.087,1.723.812,tb,deep cave,,1,,"12,8","15,09411716","15,09411716","25,1764698",853,29,"95,9128395","91,5",,2.5,5,1,145,46.5,124
6217,Jama u Priroju,Croatia,24.4.2019.,2019-04-24,1f,1,Dysderidae,Stalagtia,hercegovinensis,Stalagtia hercegovinensis,536,42.989.087,1.723.812,tb,deep cave,,1,,"12,8","15,09411716","15,09411716","25,1764698",853,29,"95,9128395","91,5",,2.5,5,1,145,46.5,124
6218,Jama u Priroju,Croatia,25.4.2019.,2019-04-25,1juv,1,Dysderidae,Stalagtia,hercegovinensis,Stalagtia hercegovinensis,536,42.989.087,1.723.812,tb,deep cave,,1,,"12,8","15,09411716","15,09411716","25,1764698",853,29,"95,9128395","91,5",,2.5,5,1,145,46.5,124
6220,Izvor špilja kod Jurjevića,Croatia,14.11.2018.,2018-11-14,1juvf,1,Tetragnathidae,Meta,sp.,Meta sp.,,4.298.245,17.209.817,,,,1,,"14,15","15,09411716","15,09411716","25,1764698",853,29,"98,39909554",,,1.5,1,1,12.3,11.7,2.1
6227,Jama u Pisanom dolcu,Croatia,15.11.2018.,2018-11-15,5juv,5,Dysderidae,Stalagtia,hercegovinensis,Stalagtia hercegovinensis,426,42.860.163,17.614.272,tb,deep cave,,4,,"12,5","15,21433353","15,21433353","25,82799911",967,29,"82,85906223","93,667",,1,0.5,1,52,19,25
6228,Jama u Pisanom dolcu,Croatia,15.11.2018.,2018-11-15,1f,1,Linyphiidae,Gen. 12,sp. 1,Gen. 12 sp. 1,426,42.860.163,17.614.272,tb,deep cave,,4,,"12,5","15,21433353","15,21433353","25,82799911",967,29,"82,85906223","93,667",,1,0.5,1,52,19,25
6230,Jama u Pisanom dolcu,Croatia,15.11.2018.,2018-11-15,4juv,4,Dysderidae,Stalagtia,hercegovinensis,Stalagtia hercegovinensis,426,42.860.163,17.614.272,tb,deep cave,,4,,"12,5","15,21433353","15,21433353","25,82799911",967,29,"82,85906223","93,667",,1,0.5,1,52,19,25
6231,Jama u Pisanom dolcu,Croatia,15.11.2018.,2018-11-15,1juv,1,Linyphiidae,Gen. 12,sp. 1,Gen. 12 sp. 1,426,42.860.163,17.614.272,tb,deep cave,,4,,"12,5","15,21433353","15,21433353","25,82799911",967,29,"82,85906223","93,667",,1,0.5,1,52,19,25
6234,Vranja jama,Croatia,16.11.2018.,2018-11-16,1juv,1,Dysderidae,Stalagtia,hercegovinensis,Stalagtia hercegovinensis,413,42.874.718,17.616.483,tb,deep cave,,3,"9,4","9,95","15,21433353","15,21433353","25,82799911",967,25,"80,80739377","78,5",73,20,15,1,114,80,63
6237,Vranja jama,Croatia,16.11.2018.,2018-11-16,"7m, 5f, 10juv",22,Leptonetidae,Sulcia,sp. 13,Sulcia sp. 13,413,42.874.718,17.616.483,,deep cave,,3,"9,4","9,95","15,21433353","15,21433353","25,82799911",967,25,"80,80739377","78,5",73,20,15,1,114,80,63
6243,Čagjina jama,Croatia,14.11.2018.,2018-11-14,1juv,1,Scytodidae,Scytodes,thoracica,Scytodes thoracica,197,42.977.147,17.155.166,Tx,,,5,,"17,5","14,0666666","14,0666666","24,28125",833,20,"101,5489359",,,0.7,0.7,1,26.8,8.2,18.6
6247,Čagjina jama,Croatia,14.11.2018.,2018-11-14,1f,1,Pholcidae,Stygopholcus,absoloni,Stygopholcus absoloni,197,42.977.147,17.155.166,,deep cave,,5,,"17,5","14,0666666","14,0666666","24,28125",833,20,"101,5489359",,,0.7,0.7,1,26.8,8.2,18.6
6248,Jama u Kučinama,Croatia,15.11.2018.,2018-11-15,1f,1,Linyphiidae,Gen. 12,sp. 1,Gen. 12 sp. 1,340,42.862.079,17.627.355,tb,deep cave,,4,"6,6","8,6","15,42681122","15,42681122","25,8217392",988,29,"81,89482682",,,3,1.8,1,nan,22,11.5
6253,Jama u Kučinama,Croatia,15.11.2018.,2018-11-15,1f,1,Linyphiidae,Asthenargus,bracianus,Asthenargus bracianus,340,42.862.079,17.627.355,tf,deep cave,,4,"6,6","8,6","15,42681122","15,42681122","25,8217392",988,29,"81,89482682",,,3,1.8,1,nan,22,11.5
6254,Jama u Kučinama,Croatia,15.11.2018.,2018-11-15,"1f, 1juvm",2,Linyphiidae,Gen. 12,sp. 1,Gen. 12 sp. 1,340,42.862.079,17.627.355,tb,deep cave,,4,"6,6","8,6","15,42681122","15,42681122","25,8217392",988,29,"81,89482682",,,3,1.8,1,nan,22,11.5
6258,Špilja u Žarmi,Croatia,28.4.2019.,2019-04-28,1f,1,Pholcidae,Stygopholcus,absoloni,Stygopholcus absoloni,40,42.935.427,1.743.822,,deep cave,,7,"13,05","13,05","16,30899048","16,30899048","26,72631454",906,21,"84,49485396","87,3","87,3",3,3,1,28,22,9.5
6261,Špilja u Žarmi,Croatia,28.4.2019.,2019-04-28,"1m, 1juv",2,Pholcidae,Stygopholcus,absoloni,Stygopholcus absoloni,40,42.935.427,1.743.822,,deep cave,,7,"13,05","13,05","16,30899048","16,30899048","26,72631454",906,21,"84,49485396","87,3","87,3",3,3,1,28,22,9.5
6287,Jama iznad Vrulja,Croatia,25.11.2019.,2019-11-25,1f,1,Agelenidae,Tegenaria,dalmatica,Tegenaria dalmatica,25,4.381.234,15.301.095,,,,5,"16,4","16,642","14,70833302","14,70833302","24,91250038",753,32,"248,4265548",91,"89,6",nan,nan,1,nan,nan,nan
6288,Jama iznad Vrulja,Croatia,25.11.2019.,2019-11-25,1juvm,1,Pholcidae,Holocnemus,sp.,Holocnemus sp.,25,4.381.234,15.301.095,,,,5,"16,4","16,642","14,70833302","14,70833302","24,91250038",753,32,"248,4265548",91,"89,6",nan,nan,1,nan,nan,nan
6290,Jama iznad Vrulja,Croatia,9.5.2019. - 25.11.2019.,2019-05-09/2019-11-25,1m,1,Pholcidae,Spermophora,senoculata,Spermophora senoculata,25,4.381.234,15.301.095,Tf,deep cave,,5,"16,4","16,642","14,70833302","14,70833302","24,91250038",753,32,"248,4265548",91,"89,6",nan,nan,1,nan,nan,nan
6295,Zelena jama,Croatia,25.11.2019.,2019-11-25,1m,1,Theridiidae,Pholcomma,gibbum,Pholcomma gibbum,132,43.832.628,15.290.877,Tx,,,8,"14,5",15,"14,89114571","14,89114571","24,51250076",750,32,"249,9812212",94,94,2,5,1,nan,23,19.5
6296,Zelena jama,Croatia,25.11.2019.,2019-11-25,2f,2,Linyphiidae,Centromerus,densidentatus sp.n.,Centromerus densidentatus sp.n.,132,43.832.628,15.290.877,,,,8,"14,5",15,"14,89114571","14,89114571","24,51250076",750,32,"249,9812212",94,94,2,5,1,nan,23,19.5
6297,Zelena jama,Croatia,25.11.2019.,2019-11-25,1f,1,Linyphiidae,Asthenargus,bracianus,Asthenargus bracianus,132,43.832.628,15.290.877,tf,deep cave,,8,"14,5",15,"14,89114571","14,89114571","24,51250076",750,32,"249,9812212",94,94,2,5,1,nan,23,19.5
6299,Zelena jama,Croatia,25.11.2019.,2019-11-25,2f,2,Theridiidae,Pholcomma,gibbum,Pholcomma gibbum,132,43.832.628,15.290.877,Tx,,,8,"14,5",15,"14,89114571","14,89114571","24,51250076",750,32,"249,9812212",94,94,2,5,1,nan,23,19.5
6301,Zelena jama,Croatia,25.11.2019.,2019-11-25,2f,2,Linyphiidae,Asthenargus,bracianus,Asthenargus bracianus,132,43.832.628,15.290.877,tf,deep cave,,8,"14,5",15,"14,89114571","14,89114571","24,51250076",750,32,"249,9812212",94,94,2,5,1,nan,23,19.5
6303,Zelena jama,Croatia,25.11.2019.,2019-11-25,1f,1,Linyphiidae,Centromerus,densidentatus sp.n.,Centromerus densidentatus sp.n.,132,43.832.628,15.290.877,,,,8,"14,5",15,"14,89114571","14,89114571","24,51250076",750,32,"249,9812212",94,94,2,5,1,nan,23,19.5
6304,Zelena jama,Croatia,25.11.2019.,2019-11-25,2f,2,Linyphiidae,Palliduphantes,sp. 10,Palliduphantes sp. 10,132,43.832.628,15.290.877,,,,8,"14,5",15,"14,89114571","14,89114571","24,51250076",750,32,"249,9812212",94,94,2,5,1,nan,23,19.5
6305,Zelena jama,Croatia,25.11.2019.,2019-11-25,4m,4,Linyphiidae,Centromerus,densidentatus sp.n.,Centromerus densidentatus sp.n.,132,43.832.628,15.290.877,,,,8,"14,5",15,"14,89114571","14,89114571","24,51250076",750,32,"249,9812212",94,94,2,5,1,nan,23,19.5
6306,Zelena jama,Croatia,25.11.2019.,2019-11-25,1juv,1,Agelenidae,Tegenaria,sp.,Tegenaria sp.,132,43.832.628,15.290.877,,,,8,"14,5",15,"14,89114571","14,89114571","24,51250076",750,32,"249,9812212",94,94,2,5,1,nan,23,19.5
6307,Zelena jama,Croatia,25.11.2019.,2019-11-25,1f,1,Linyphiidae,Asthenargus,bracianus,Asthenargus bracianus,132,43.832.628,15.290.877,tf,deep cave,,8,"14,5",15,"14,89114571","14,89114571","24,51250076",750,32,"249,9812212",94,94,2,5,1,nan,23,19.5
6310,Jama pod Velim vrhom,Croatia,26.11.2019.,2019-11-26,2juv,2,Agelenidae,Tegenaria,sp.,Tegenaria sp.,,43.824.798,15.240.798,,,,3,,"16,767","15,02083302","15,02083302","23,89999771",745,28,"255,3346159",94,,0.5,0.7,1,7,4.7,3.5
6311,Jama pod Velim vrhom,Croatia,26.11.2019.,2019-11-26,1juv,1,Scytodidae,Scytodes,sp.,Scytodes sp.,,43.824.798,15.240.798,,,,3,,"16,767","15,02083302","15,02083302","23,89999771",745,28,"255,3346159",94,,0.5,0.7,1,7,4.7,3.5
6312,Jama pod Velim vrhom,Croatia,26.11.2019.,2019-11-26,"1f, 1m",2,Scytodidae,Scytodes,thoracica,Scytodes thoracica,,43.824.798,15.240.798,Tx,,,3,,"16,767","15,02083302","15,02083302","23,89999771",745,28,"255,3346159",94,,0.5,0.7,1,7,4.7,3.5
6315,Jama pod Velim vrhom,Croatia,26.11.2019.,2019-11-26,3f,3,Agelenidae,Tegenaria,domestica,Tegenaria domestica,,43.824.798,15.240.798,Tf,deep cave,,3,,"16,767","15,02083302","15,02083302","23,89999771",745,28,"255,3346159",94,,0.5,0.7,1,7,4.7,3.5
6321,Mala jama pod križem,Croatia,26.11.2019.,2019-11-26,1juv,1,Pholcidae,Holocnemus,sp.,Holocnemus sp.,15,43.818.664,15.254.882,,,,2,,"14,25","14,89114571","14,89114571","24,51250076",750,26,"253,6545557",96,,0.5,0.8,1,8.5,5,5
6325,Mala jama pod križem,Croatia,26.11.2019.,2019-11-26,"1m, 4juv",5,Pholcidae,Holocnemus,pluchei,Holocnemus pluchei,15,43.818.664,15.254.882,tf,deep cave,,2,,"14,25","14,89114571","14,89114571","24,51250076",750,26,"253,6545557",96,,0.5,0.8,1,8.5,5,5
6329,Ančića velika Golubinka,Croatia,8.10.2018.,2018-10-08,"1m, 2juvm, 4juv",7,Agelenidae,Histopona,conveniens,Histopona conveniens,919,43.258.385,17.284.191,Tf,deep cave,,5,,10,"10,36450005","10,36450005","26,19599915",947,26,"56,8098813",,,6,5,1,53,18,46
6331,Ančića velika Golubinka,Croatia,8.10.2018.,2018-10-08,1f,1,Linyphiidae,Palliduphantes,spelaeorum,Palliduphantes spelaeorum,919,43.258.385,17.284.191,Tf,deep cave,,5,,10,"10,36450005","10,36450005","26,19599915",947,26,"56,8098813",,,6,5,1,53,18,46
6332,Ančića velika Golubinka,Croatia,8.10.2018.,2018-10-08,"2m, 1f",3,Leptonetidae,Barusia,maheni,Barusia maheni,919,43.258.385,17.284.191,tf,deep cave,,5,,10,"10,36450005","10,36450005","26,19599915",947,26,"56,8098813",,,6,5,1,53,18,46
6333,Jama malog ulaza,Croatia,7.10.2018.,2018-10-07,4juv,4,Linyphiidae,Typhlonyphia,sp. 1,Typhlonyphia sp. 1,722,43.251.472,17.270.889,Tb,deep cave,,2,,12,"10,36450005","10,36450005","26,19599915",947,29,"58,46817059",89,,0.5,0.6,1,40.4,3.8,36.6
6334,Jama pola fiksa,Croatia,8.10.2018.,2018-10-08,"3m, 1f",4,Leptonetidae,Barusia,maheni,Barusia maheni,790,432.581.389,172.835.556,tf,deep cave,,3,,"11,5","10,36450005","10,36450005","26,19599915",947,26,"56,87772407",88,,1.5,3,1,11,4.4,7.2
6336,Jama pola fiksa,Croatia,8.10.2018.,2018-10-08,"1m, 1juv",2,Linyphiidae,Palliduphantes,spelaeorum,Palliduphantes spelaeorum,790,432.581.389,172.835.556,Tf,deep cave,,3,,"11,5","10,36450005","10,36450005","26,19599915",947,26,"56,87772407",88,,1.5,3,1,11,4.4,7.2
6337,Jama pola fiksa,Croatia,8.10.2018.,2018-10-08,"1m, 3f, 1juvm, 1juv",6,Leptonetidae,Barusia,maheni,Barusia maheni,790,432.581.389,172.835.556,tf,deep cave,,3,,"11,5","10,36450005","10,36450005","26,19599915",947,26,"56,87772407",88,,1.5,3,1,11,4.4,7.2
6348,Vaganka,Croatia,8.7.2018.,2018-07-08,1m,1,Agelenidae,Histopona,egonpretneri,Histopona egonpretneri,656,4.433.853,1.543.867,Tb,deep cave,,5,,"12,2","7,622666836","7,622666836","26,19600105",1265,29,"257,5927467",95,,,,,,,
6349,Vaganka,Croatia,8.7.2018.,2018-07-08,1m,1,Leptonetidae,Cataleptoneta,lingulata,Cataleptoneta lingulata,656,4.433.853,1.543.867,tb,deep cave,,5,,"12,2","7,622666836","7,622666836","26,19600105",1265,29,"257,5927467",95,,,,,,,
6350,Vaganka,Croatia,8.7.2018.,2018-07-08,"1f, 1juv",2,Leptonetidae,Cataleptoneta,lingulata,Cataleptoneta lingulata,656,4.433.853,1.543.867,tb,deep cave,,5,,"12,2","7,622666836","7,622666836","26,19600105",1265,29,"257,5927467",95,,,,,,,
6352,Jama pod Gažnovcem,Croatia,18.9.2016.,2016-09-18,1f,1,Linyphiidae,Typhlonyphia,sp. 1,Typhlonyphia sp. 1,590,43.229.672,17.314.159,Tb,deep cave,,8,,"11,6","12,67833328","12,67833328","26,74400139",940,23,"59,1740747","99,2",,0.6,1,1,45,41,3.5
6357,Špilja kod Vilišnice,Croatia,2.4.2018.,2018-04-02,"3f, 1juv f",4,Linyphiidae,Palliduphantes,istrianus,Palliduphantes istrianus,48,43.960.355,15.450.916,Tf,deep cave,,2,,"12,9","14,33033371","14,33033371","28,02400017",813,20,"236,193425",,,3.5,1.5,1,nan,37,20.3
6359,Špilja kod Vilišnice,Croatia,2.4.2018.,2018-04-02,1f,1,Linyphiidae,Palliduphantes,istrianus,Palliduphantes istrianus,48,43.960.355,15.450.916,Tf,deep cave,,2,,"12,9","14,33033371","14,33033371","28,02400017",813,20,"236,193425",,,3.5,1.5,1,nan,37,20.3
6360,Vranjača špilja kod Dugopolja,Croatia,1.4.2018.,2018-04-01,"2juvm, 2juv",4,Linyphiidae,Troglohyphantes,strandi,Troglohyphantes strandi,445,43.562.235,16.648.216,tb,deep cave,,5,,"8,7","12,21549988","12,21549988","26,12800026",886,21,"96,51736486",,,,,,,,
6361,Vranjača špilja kod Dugopolja,Croatia,1.4.2018.,2018-04-01,"4f, 1m, 4juv",9,Linyphiidae,Troglohyphantes,strandi,Troglohyphantes strandi,445,43.562.235,16.648.216,tb,deep cave,,5,,"8,7","12,21549988","12,21549988","26,12800026",886,21,"96,51736486",,,,,,,,
6362,Vranjača špilja kod Dugopolja,Croatia,1.4.2018.,2018-04-01,1juv,1,Dysderidae,Stalagtia,sp. 4,Stalagtia sp. 4,445,43.562.235,16.648.216,Tb,deep cave,,5,,"8,7","12,21549988","12,21549988","26,12800026",886,21,"96,51736486",,,,,,,,
6363,Vranjača špilja kod Dugopolja,Croatia,1.4.2018.,2018-04-01,1f,1,Linyphiidae,Centromerus,cavernarum,Centromerus cavernarum,445,43.562.235,16.648.216,Tf,deep cave,,5,,"8,7","12,21549988","12,21549988","26,12800026",886,21,"96,51736486",,,,,,,,
6364,Balića špilja,Croatia,1.4.2018.,2018-04-01,2f,2,Linyphiidae,Troglohyphantes,giromettai,Troglohyphantes giromettai,438,4.357.296,1.657.002,tf,deep cave,,11,,"7,2","12,25566673","12,25566673","25,68000031",872,23,"105,1255288",,,70,7,1,194,155,50
6365,Balića špilja,Croatia,1.4.2018.,2018-04-01,"1m, 1juv",2,Linyphiidae,Centromerus,silvicola,Centromerus silvicola,438,4.357.296,1.657.002,tx,deep cave,,11,,"7,2","12,25566673","12,25566673","25,68000031",872,23,"105,1255288",,,70,7,1,194,155,50
6366,Balića špilja,Croatia,1.4.2018.,2018-04-01,"2m, 1f, 1juvm, 2juv",6,Linyphiidae,Troglohyphantes,giromettai,Troglohyphantes giromettai,438,4.357.296,1.657.002,tf,deep cave,,11,,"7,2","12,25566673","12,25566673","25,68000031",872,23,"105,1255288",,,70,7,1,194,155,50
6367,Balića špilja,Croatia,1.4.2018.,2018-04-01,"1f, 2juv",3,Linyphiidae,Troglohyphantes,giromettai,Troglohyphantes giromettai,438,4.357.296,1.657.002,tf,deep cave,,11,,"7,2","12,25566673","12,25566673","25,68000031",872,23,"105,1255288",,,70,7,1,194,155,50
6368,Balića špilja,Croatia,1.4.2018.,2018-04-01,"1m, 7f, 4juvm, 6juv",18,Linyphiidae,Troglohyphantes,giromettai,Troglohyphantes giromettai,438,4.357.296,1.657.002,tf,deep cave,,11,,"7,2","12,25566673","12,25566673","25,68000031",872,23,"105,1255288",,,70,7,1,194,155,50
6369,Šipun,Croatia,30.5.2018.,2018-05-30,2juv,2,Dysderidae,Stalagtia,sp. 1,Stalagtia sp. 1,,42.583.646,18.217.986,Tb,deep cave,,11,,"15,4","15,02037048","15,02037048","24,28333282",1208,2,"111,3036255","97,8",,1.5,2.5,1,165,150,22.5
6370,Šipun,Croatia,28.5.2018.,2018-05-28,1juv,1,Dysderidae,Stalagtia,sp. 1,Stalagtia sp. 1,,42.583.646,18.217.986,Tb,deep cave,,11,,"15,4","15,02037048","15,02037048","24,28333282",1208,2,"111,3036255","97,8",,1.5,2.5,1,165,150,22.5
6371,Šipun,Croatia,28.5.2018.,2018-05-28,1m,1,Nesticidae,Kryptonesticus,eremita,Kryptonesticus eremita,,42.583.646,18.217.986,tf,deep cave,,11,,"15,4","15,02037048","15,02037048","24,28333282",1208,2,"111,3036255","97,8",,1.5,2.5,1,165,150,22.5
6372,Šipun,Croatia,28.5.2018.,2018-05-28,11 juv,11,Dysderidae,Stalagtia,sp. 1,Stalagtia sp. 1,,42.583.646,18.217.986,Tb,deep cave,,11,,"15,4","15,02037048","15,02037048","24,28333282",1208,2,"111,3036255","97,8",,1.5,2.5,1,165,150,22.5
6375,Šipun,Croatia,28.5.2018.,2018-05-28,1f,1,Linyphiidae,Palliduphantes,brignolii,Palliduphantes brignolii,,42.583.646,18.217.986,Tb,deep cave,,11,,"15,4","15,02037048","15,02037048","24,28333282",1208,2,"111,3036255","97,8",,1.5,2.5,1,165,150,22.5
6398,Velika jama poviše Tornja,Croatia,6.11.2019.,2019-11-06,1juv,1,Dysderidae,Stalagtia,sp. 4_1,Stalagtia sp. 4_1,308,42.971.097,17.658.659,Tb,deep cave,,4,,"12,65","14,84200001","14,84200001","27,15999985",1006,32,"65,67050145",94,,7,4,1,328,245,71
6400,Velika jama poviše Tornja,Croatia,6.11.2019.,2019-11-06,1m,1,Pholcidae,Holocnemus,pluchei,Holocnemus pluchei,308,42.971.097,17.658.659,tf,deep cave,,4,,"12,65","14,84200001","14,84200001","27,15999985",1006,32,"65,67050145",94,,7,4,1,328,245,71
6404,Poskokova jama,Croatia,14.12.2019.,2019-12-14,1f,1,Linyphiidae,Typhlonyphia,reimoseri,Typhlonyphia reimoseri,655,43.001.888,17.134.002,tb,deep cave,,4,,"12,3","14,34500027","14,34500027","24,36666679",826,28,"99,19045362",94,,1,0.5,1,nan,20,19
6407,Spilja od Tankega rota,Croatia,5.7.2017.,2017-07-05,1f,1,Nesticidae,Kryptonesticus,eremita,Kryptonesticus eremita,114,43.012.832,16.111.537,tf,deep cave,,1,,17,"15,42175961","15,42175961","22,66110992",580,28,"179,9480494",80,,1,2,1,164,148,19
6408,Špilja na Pozalicu,Croatia,10.9.2018.,2018-09-10,1f,1,Leptonetidae,Barusia,sp. 1,Barusia sp. 1,61,4.276.131,169.129,tb,deep cave,,4,"12,65",14,"16,4216671","16,4216671","22,7733345",668,29,"143,02697",94,,nan,nan,1,nan,nan,nan
6409,Špilja na Pozalicu,Croatia,10.9.2018.,2018-09-10,1juv,1,Nesticidae,Kryptonesticus,eremita,Kryptonesticus eremita,61,4.276.131,169.129,tf,deep cave,,4,"12,65",14,"16,4216671","16,4216671","22,7733345",668,29,"143,02697",94,,nan,nan,1,nan,nan,nan
6412,Spilja od Tankega rota,Croatia,5.7.2017.,2017-07-05,2m,2,Nesticidae,Kryptonesticus,eremita,Kryptonesticus eremita,114,43.012.832,16.111.537,tf,deep cave,,1,,17,"15,42175961","15,42175961","22,66110992",580,28,"179,9480494",80,,1,2,1,164,148,19
6413,Bazgovača,Croatia,30.6.2017.,2017-06-30,2f,2,Linyphiidae,Palliduphantes,spelaeorum,Palliduphantes spelaeorum,652,4.330.647,16.622.143,Tf,deep cave,,3,,"7,2","12,8081665","12,8081665","24,57600021",796,24,"108,9858223",,,5,7,1,nan,47,32
6416,Tunel u Crvenim stijenama,Croatia,3.7.2017.,2017-07-03,1m,1,Nesticidae,Kryptonesticus,eremita,Kryptonesticus eremita,199,43.047.348,16.107.693,tf,deep cave,,2,,"17,8","15,32770824","15,32770824","22,59999847",585,20,"177,8012317",66,,,,,,,
6417,Tunel u Crvenim stijenama,Croatia,3.7.2017.,2017-07-03,"1juvm, 1juv",2,Agelenidae,Tegenaria,sp.,Tegenaria sp.,199,43.047.348,16.107.693,,,,2,,"17,8","15,32770824","15,32770824","22,59999847",585,20,"177,8012317",66,,,,,,,
6418,Vištičina jama,Croatia,7.11.2019.,2019-11-07,1m,1,Leptonetidae,Sulcia,sp.,Sulcia sp.,165,42.985.281,17.557.541,,,,3,,11,"15,60000038","15,60000038","27,23600006",966,25,"70,13034031",,,,,,,,
6419,Rođendanska jama,Croatia,29.4.2018.,2018-04-29,1f,1,Tetragnathidae,Metellina,merianae,Metellina merianae,991,43.268.607,17.238.862,Tf,deep cave,,2,,"3,4","11,41149998","11,41149998","26,41199875",935,23,"58,19416671",,,5,6,1,55.4,10.4,35.8
6420,Rođendanska jama,Croatia,29.4.2018.,2018-04-29,"1m, 3juv",4,Pholcidae,Stygopholcus,absoloni,Stygopholcus absoloni,991,43.268.607,17.238.862,,deep cave,,2,,"3,4","11,41149998","11,41149998","26,41199875",935,23,"58,19416671",,,5,6,1,55.4,10.4,35.8
6425,Jama na Benkotovu,Croatia,10.6.2016.,2016-06-10,1m,1,Linyphiidae,Palliduphantes,spelaeorum,Palliduphantes spelaeorum,120,4.337.569,16.272.059,Tf,deep cave,,3,,"15,2","15,939394","15,939394","23,43181801",720,29,"142,4731318","93,667",,1.8,2.5,1,41.1,17.6,30.2
6428,Titova špilja,Croatia,5.7.2017.,2017-07-05,"1f, 1juv",2,Pholcidae,Spermophora,senoculata,Spermophora senoculata,459,43.037.244,16.120.554,Tf,deep cave,,1,,"17,4","15,42175961","15,42175961","22,66110992",580,23,"177,2678026",,,nan,nan,1,nan,nan,nan
6430,Ričevica,Croatia,5.11.2019.,2019-11-05,"1f, 1juv",2,Pholcidae,Stygopholcus,absoloni,Stygopholcus absoloni,416,43.099.891,17.390.863,,deep cave,,5,,12,"14,44266701","14,44266701","26,6439991",931,28,"72,44884986",,,,,,,,
6431,Ričevica,Croatia,5.11.2019.,2019-11-05,"1m, 1juv",2,Agelenidae,Histopona,conveniens,Histopona conveniens,416,43.099.891,17.390.863,Tf,deep cave,,5,,12,"14,44266701","14,44266701","26,6439991",931,28,"72,44884986",,,,,,,,
6432,Balića špilja,Croatia,5.10.2018.,2018-10-05,3juv,3,Dysderidae,Harpactea,sp.,Harpactea sp.,438,4.357.296,1.657.002,,,,11,,"7,2","12,25566673","12,25566673","25,68000031",872,23,"105,1255288",,,70,7,1,194,155,50
6433,Jama u Predolcu,Croatia,2.11.2019.,2019-11-02,"1f, 2juv",3,Nesticidae,Kryptonesticus,eremita,Kryptonesticus eremita,82,43.046.428,17.658.771,tf,deep cave,,2,,"14,1","16,44449997","16,44449997","29,03199768",1015,24,"55,93544548",100,,nan,nan,1,nan,nan,nan
6446,Manita peć,Croatia,26.1.2019.,2019-01-26,1juv,1,Agelenidae,Histopona,sp.,Histopona sp.,374,44.314.302,15.475.264,,,,7,"8,8","9,525","10,42683315","10,42683315","27,29200172",1068,28,"252,2759525",,,nan,nan,1,nan,nan,nan
6447,Manita peć,Croatia,12.5.2019.,2019-05-12,1juv,1,Dysderidae,Stalita,pretneri,Stalita pretneri,374,44.314.302,15.475.264,tb,deep cave,,7,"8,8","9,525","10,42683315","10,42683315","27,29200172",1068,28,"252,2759525",,,nan,nan,1,nan,nan,nan
6448,Manita peć,Croatia,30.3.2019.,2019-03-30,1juv,1,Agelenidae,Tegenaria,sp.,Tegenaria sp.,374,44.314.302,15.475.264,,,,7,"8,8","9,525","10,42683315","10,42683315","27,29200172",1068,28,"252,2759525",,,nan,nan,1,nan,nan,nan
6449,Manita peć,Croatia,22.10.2018.,2018-10-22,1f,1,Leptonetidae,Cataleptoneta,lingulata,Cataleptoneta lingulata,374,44.314.302,15.475.264,tb,deep cave,,7,"8,8","9,525","10,42683315","10,42683315","27,29200172",1068,28,"252,2759525",,,nan,nan,1,nan,nan,nan
6450,Manita peć,Croatia,22.10.2018.,2018-10-22,1juv,1,Dysderidae,Stalita,pretneri,Stalita pretneri,374,44.314.302,15.475.264,tb,deep cave,,7,"8,8","9,525","10,42683315","10,42683315","27,29200172",1068,28,"252,2759525",,,nan,nan,1,nan,nan,nan
6451,Manita peć,Croatia,22.10.2018.,2018-10-22,1f/juv,1,Leptonetidae,Cataleptoneta,lingulata,Cataleptoneta lingulata,374,44.314.302,15.475.264,tb,deep cave,,7,"8,8","9,525","10,42683315","10,42683315","27,29200172",1068,28,"252,2759525",,,nan,nan,1,nan,nan,nan
6455,Šimunkovića špilja,Croatia,13.12.2019.,2019-12-13,1juv,1,Nesticidae,Kryptonesticus,sp.,Kryptonesticus sp.,78,42.978.588,17.129.081,,deep cave,,7,,15,"14,0666666","14,0666666","24,28125",833,29,"102,605262",,,7,1,1,22.7,19.9,1
6456,Poskokova jama,Croatia,14.12.2019.,2019-12-14,1juv,1,Dysderidae,Stalagtia,hercegovinensis,Stalagtia hercegovinensis,655,43.001.888,17.134.002,tb,deep cave,,4,,"12,3","14,34500027","14,34500027","24,36666679",826,28,"99,19045362",94,,1,0.5,1,nan,20,19
6457,Poskokova jama,Croatia,14.12.2019.,2019-12-14,4 juv,4,Nesticidae,Kryptonesticus,sp. 1,Kryptonesticus sp. 1,655,43.001.888,17.134.002,Tb,deep cave,,4,,"12,3","14,34500027","14,34500027","24,36666679",826,28,"99,19045362",94,,1,0.5,1,nan,20,19
6459,Špilja kod Zagruda u vinogradu,Croatia,13.12.2019.,2019-12-13,"2m, 2f",4,Leptonetidae,Barusia,maheni,Barusia maheni,318,42.966.644,17.322.697,tf,deep cave,,6,,"10,1","14,96718788","14,96718788","25,8125",871,21,"90,48303976",86,,2.1,0.7,1,18.5,17.6,2.7
6460,Špilja kod Zagruda u vinogradu,Croatia,13.12.2019.,2019-12-13,1m,1,Linyphiidae,Centromerus,raridentatus sp.n.,Centromerus raridentatus sp.n.,318,42.966.644,17.322.697,,,,6,,"10,1","14,96718788","14,96718788","25,8125",871,21,"90,48303976",86,,2.1,0.7,1,18.5,17.6,2.7
6461,Špilja kod Zagruda u vinogradu,Croatia,13.12.2019.,2019-12-13,"1m, 3f/juv",4,Leptonetidae,Barusia,maheni,Barusia maheni,318,42.966.644,17.322.697,tf,deep cave,,6,,"10,1","14,96718788","14,96718788","25,8125",871,21,"90,48303976",86,,2.1,0.7,1,18.5,17.6,2.7
6462,Špilja kod Zagruda u vinogradu,Croatia,13.12.2019.,2019-12-13,1f,1,Linyphiidae,Centromerus,sp. 3,Centromerus sp. 3,318,42.966.644,17.322.697,,,,6,,"10,1","14,96718788","14,96718788","25,8125",871,21,"90,48303976",86,,2.1,0.7,1,18.5,17.6,2.7
6464,Špilja kod Zagruda u vinogradu,Croatia,13.12.2019.,2019-12-13,1m,1,Pholcidae,Stygopholcus,absoloni,Stygopholcus absoloni,318,42.966.644,17.322.697,,deep cave,,6,,"10,1","14,96718788","14,96718788","25,8125",871,21,"90,48303976",86,,2.1,0.7,1,18.5,17.6,2.7
6465,Maica Golubinka,Croatia,19.12.2018.,2018-12-19,1f,1,Agelenidae,Histopona,conveniens,Histopona conveniens,157,43.108.853,17.566.424,Tf,deep cave,,6,,"13,9","15,70966625","15,70966625","28,84799957",995,23,"55,78019094",,,nan,nan,1,nan,nan,nan
6466,Maica Golubinka,Croatia,19.12.2018.,2018-12-19,1m,1,Leptonetidae,Barusia,maheni,Barusia maheni,157,43.108.853,17.566.424,tf,deep cave,,6,,"13,9","15,70966625","15,70966625","28,84799957",995,23,"55,78019094",,,nan,nan,1,nan,nan,nan
6467,Maica Golubinka,Croatia,19.12.2018.,2018-12-19,2juv,2,Dysderidae,Stalagtia,sp. 4,Stalagtia sp. 4,157,43.108.853,17.566.424,Tb,deep cave,,6,,"13,9","15,70966625","15,70966625","28,84799957",995,23,"55,78019094",,,nan,nan,1,nan,nan,nan
6468,Maica Golubinka,Croatia,19.12.2018.,2018-12-19,1m,1,Linyphiidae,Centromerus,sp. 3,Centromerus sp. 3,157,43.108.853,17.566.424,,,,6,,"13,9","15,70966625","15,70966625","28,84799957",995,23,"55,78019094",,,nan,nan,1,nan,nan,nan
6469,Maica Golubinka,Croatia,19.12.2018.,2018-12-19,1m,1,Linyphiidae,Gen.,sp. X,Gen. sp. X,157,43.108.853,17.566.424,,,,6,,"13,9","15,70966625","15,70966625","28,84799957",995,23,"55,78019094",,,nan,nan,1,nan,nan,nan
6470,Maica Golubinka,Croatia,19.12.2018.,2018-12-19,4f,4,Linyphiidae,Palliduphantes,spelaeorum,Palliduphantes spelaeorum,157,43.108.853,17.566.424,Tf,deep cave,,6,,"13,9","15,70966625","15,70966625","28,84799957",995,23,"55,78019094",,,nan,nan,1,nan,nan,nan
6523,Golubinka u gaju,Croatia,30.4.2018.,2018-04-30,"4m, 2f, 7juv",13,Leptonetidae,Sulcia,sp.,Sulcia sp.,699,4.325.525,17.265.833,,,,6,,"7,8","10,36450005","10,36450005","26,19599915",947,29,"58,2626568",77,,4.6,10,1,29,28.8,5.7
6524,Golubinka u gaju,Croatia,30.4.2018.,2018-04-30,"2m, 1f, 1juv",4,Leptonetidae,Sulcia,sp.,Sulcia sp.,699,4.325.525,17.265.833,,,,6,,"7,8","10,36450005","10,36450005","26,19599915",947,29,"58,2626568",77,,4.6,10,1,29,28.8,5.7
6526,Golubinka u gaju,Croatia,30.4.2018.,2018-04-30,"1m, 1juv",2,Agelenidae,Histopona,conveniens,Histopona conveniens,699,4.325.525,17.265.833,Tf,deep cave,,6,,"7,8","10,36450005","10,36450005","26,19599915",947,29,"58,2626568",77,,4.6,10,1,29,28.8,5.7
6527,Golubinka u gaju,Croatia,29.4.2018.,2018-04-29,"4m, 9f, 4juv",17,Leptonetidae,Sulcia,sp.,Sulcia sp.,699,4.325.525,17.265.833,,,,6,,"7,8","10,36450005","10,36450005","26,19599915",947,29,"58,2626568",77,,4.6,10,1,29,28.8,5.7
6529,Golubinka u gaju,Croatia,29.4.2018.,2018-04-29,"2f, 2juv",4,Leptonetidae,Sulcia,sp.,Sulcia sp.,699,4.325.525,17.265.833,,,,6,,"7,8","10,36450005","10,36450005","26,19599915",947,29,"58,2626568",77,,4.6,10,1,29,28.8,5.7
6531,Golubinka u gaju,Croatia,29.4.2018.,2018-04-29,"1m, 1juv",2,Linyphiidae,Micrargus,apertus,Micrargus apertus,699,4.325.525,17.265.833,,,,6,,"7,8","10,36450005","10,36450005","26,19599915",947,29,"58,2626568",77,,4.6,10,1,29,28.8,5.7
6532,Golubinka u gaju,Croatia,29.4.2018.,2018-04-29,1juv,1,Agelenidae,Histopona,sp.,Histopona sp.,699,4.325.525,17.265.833,,,,6,,"7,8","10,36450005","10,36450005","26,19599915",947,29,"58,2626568",77,,4.6,10,1,29,28.8,5.7
6533,Golubinka u gaju,Croatia,30.4.2018.,2018-04-30,"1m, 3f, 6juv",1,Leptonetidae,Sulcia,sp.,Sulcia sp.,699,4.325.525,17.265.833,,,,6,,"7,8","10,36450005","10,36450005","26,19599915",947,29,"58,2626568",77,,4.6,10,1,29,28.8,5.7
6534,Golubinka u gaju,Croatia,29.4.2018.,2018-04-29,"2m, 1f, 3juv",6,Leptonetidae,Sulcia,sp.,Sulcia sp.,699,4.325.525,17.265.833,,,,6,,"7,8","10,36450005","10,36450005","26,19599915",947,29,"58,2626568",77,,4.6,10,1,29,28.8,5.7
6535,Golubinka u gaju,Croatia,29.4.2018.,2018-04-29,1f,1,Anapidae,Comaroma,sp. 1,Comaroma sp. 1,699,4.325.525,17.265.833,tb,deep cave,,6,,"7,8","10,36450005","10,36450005","26,19599915",947,29,"58,2626568",77,,4.6,10,1,29,28.8,5.7
6539,Jama pola fiksa,Croatia,30.4.2018.,2018-04-30,"3m, 1f?, 2juv",6,Leptonetidae,Barusia,maheni,Barusia maheni,790,432.581.389,172.835.556,tf,deep cave,,3,,"11,5","10,36450005","10,36450005","26,19599915",947,26,"56,87772407",88,,1.5,3,1,11,4.4,7.2
6540,Jama pola fiksa,Croatia,30.4.2018.,2018-04-30,"1m, 6f?, 5juv",12,Leptonetidae,Barusia,maheni,Barusia maheni,790,432.581.389,172.835.556,tf,deep cave,,3,,"11,5","10,36450005","10,36450005","26,19599915",947,26,"56,87772407",88,,1.5,3,1,11,4.4,7.2
6542,Jama pola fiksa,Croatia,30.4.2018.,2018-04-30,1f,1,Theridiidae,Pholcomma,gibbum,Pholcomma gibbum,790,432.581.389,172.835.556,Tx,,,3,,"11,5","10,36450005","10,36450005","26,19599915",947,26,"56,87772407",88,,1.5,3,1,11,4.4,7.2
6547,Ančića velika Golubinka,Croatia,30.4.2018.,2018-04-30,"1juvm, 2juv",3,Agelenidae,Histopona,sp.,Histopona sp.,919,43.258.385,17.284.191,,,,5,,10,"10,36450005","10,36450005","26,19599915",947,26,"56,8098813",,,6,5,1,53,18,46
6548,Ančića velika Golubinka,Croatia,30.4.2018.,2018-04-30,4f,4,Linyphiidae,Palliduphantes,spelaeorum,Palliduphantes spelaeorum,919,43.258.385,17.284.191,Tf,deep cave,,5,,10,"10,36450005","10,36450005","26,19599915",947,26,"56,8098813",,,6,5,1,53,18,46
6549,Ančića velika Golubinka,Croatia,30.4.2018.,2018-04-30,"5f, 1m, 1juvf, 1juv",8,Linyphiidae,Palliduphantes,spelaeorum,Palliduphantes spelaeorum,919,43.258.385,17.284.191,Tf,deep cave,,5,,10,"10,36450005","10,36450005","26,19599915",947,26,"56,8098813",,,6,5,1,53,18,46
6551,Ančića velika Golubinka,Croatia,30.4.2018.,2018-04-30,"1f, 2juv",3,Agelenidae,Histopona,conveniens,Histopona conveniens,919,43.258.385,17.284.191,Tf,deep cave,,5,,10,"10,36450005","10,36450005","26,19599915",947,26,"56,8098813",,,6,5,1,53,18,46
6552,Ančića velika Golubinka,Croatia,30.4.2018.,2018-04-30,"1m, 1f, 1juvm, 1juv",4,Linyphiidae,Palliduphantes,spelaeorum,Palliduphantes spelaeorum,919,43.258.385,17.284.191,Tf,deep cave,,5,,10,"10,36450005","10,36450005","26,19599915",947,26,"56,8098813",,,6,5,1,53,18,46
6553,Ančića velika Golubinka,Croatia,8.10.2018.,2018-10-08,2f,2,Pholcidae,Stygopholcus,absoloni,Stygopholcus absoloni,919,43.258.385,17.284.191,,deep cave,,5,,10,"10,36450005","10,36450005","26,19599915",947,26,"56,8098813",,,6,5,1,53,18,46
6556,Antipatična,Croatia,30.4.2018.,2018-04-30,1juv,1,Agelenidae,Histopona,sp.,Histopona sp.,722,43.256.111,1.726.775,,,,2,,7,"10,36450005","10,36450005","26,19599915",947,29,"58,03935299",,,3,4,1,22,12,12
6558,Antipatična,Croatia,30.4.2018.,2018-04-30,1f,1,Agelenidae,Histopona,conveniens,Histopona conveniens,722,43.256.111,1.726.775,Tf,deep cave,,2,,7,"10,36450005","10,36450005","26,19599915",947,29,"58,03935299",,,3,4,1,22,12,12
6561,Jama malog ulaza,Croatia,23.7.2018.,2018-07-23,1f,1,Linyphiidae,Typhlonyphia,sp. 1,Typhlonyphia sp. 1,722,43.251.472,17.270.889,Tb,deep cave,,2,,12,"10,36450005","10,36450005","26,19599915",947,29,"58,46817059",89,,0.5,0.6,1,40.4,3.8,36.6
6562,Bokšića golubinka,Croatia,28.4.2018.,2018-04-28,2f,2,Linyphiidae,Palliduphantes,spelaeorum,Palliduphantes spelaeorum,845,432.596.111,172.671.389,Tf,deep cave,,1,,"6,4","10,36450005","10,36450005","26,19599915",947,23,"57,618177",,,8,18,1,60.7,19.9,50.6
6563,Bokšića golubinka,Croatia,28.4.2018.,2018-04-28,1f,1,Linyphiidae,Palliduphantes,spelaeorum,Palliduphantes spelaeorum,845,432.596.111,172.671.389,Tf,deep cave,,1,,"6,4","10,36450005","10,36450005","26,19599915",947,23,"57,618177",,,8,18,1,60.7,19.9,50.6
6567,Jama malog ulaza,Croatia,28.4.2018.,2018-04-28,2juv,2,Linyphiidae,Typhlonyphia,sp. 1,Typhlonyphia sp. 1,722,43.251.472,17.270.889,Tb,deep cave,,2,,12,"10,36450005","10,36450005","26,19599915",947,29,"58,46817059",89,,0.5,0.6,1,40.4,3.8,36.6
